query	target	qheader	theader	fident	alnlen	mismatch	qstart	qend	tstart	tend	evalue	bits
DESULFOASV1_1572_hypothetical_protein	AF-Q87FQ5-F1-model_v4	DESULFOASV1_1572_hypothetical_protein	AF-Q87FQ5-F1-model_v4 HTH-type transcriptional regulator MalT	0.200	126	94	83	201	594	719	2.689E-01	75
DESULFOASV1_1572_hypothetical_protein	AF-O74501-F1-model_v4	DESULFOASV1_1572_hypothetical_protein	AF-O74501-F1-model_v4 Uncharacterized protein CC285.14	0.157	103	85	83	184	457	559	6.442E-01	75
DESULFOASV1_1572_hypothetical_protein	AF-Q6Q4D0-F1-model_v4	DESULFOASV1_1572_hypothetical_protein	AF-Q6Q4D0-F1-model_v4 Protein TONSOKU	0.128	218	178	18	222	275	492	4.462E-02	75
DESULFOASV1_1572_hypothetical_protein	AF-O94332-F1-model_v4	DESULFOASV1_1572_hypothetical_protein	AF-O94332-F1-model_v4 RNA polymerase I-specific transcription initiation factor rrn11	0.109	159	137	60	218	36	190	3.110E-01	74
DESULFOASV1_1572_hypothetical_protein	AF-P94415-F1-model_v4	DESULFOASV1_1572_hypothetical_protein	AF-P94415-F1-model_v4 Response regulator aspartate phosphatase C	0.080	167	143	69	224	112	278	7.452E-01	74
DESULFOASV1_1572_hypothetical_protein	AF-Q9VTL1-F1-model_v4	DESULFOASV1_1572_hypothetical_protein	AF-Q9VTL1-F1-model_v4 PCI domain-containing protein 2 homolog	0.130	200	136	64	220	59	258	3.265E-01	74
DESULFOASV1_1572_hypothetical_protein	AF-Q8TDW4-F1-model_v4	DESULFOASV1_1572_hypothetical_protein	AF-Q8TDW4-F1-model_v4 Suppressor of tumorigenicity 7 protein-like	0.128	129	111	95	223	216	343	8.803E-02	74
DESULFOASV1_1572_hypothetical_protein	AF-P59969-F1-model_v4	DESULFOASV1_1572_hypothetical_protein	AF-P59969-F1-model_v4 Putative HTH-type transcriptional regulator Mb0914c	0.156	169	130	64	218	413	581	5.846E-01	74
DESULFOASV1_1572_hypothetical_protein	AF-Q9VU70-F1-model_v4	DESULFOASV1_1572_hypothetical_protein	AF-Q9VU70-F1-model_v4 Tetratricopeptide repeat protein 36 homolog	0.184	141	104	95	222	44	184	4.814E-01	73
DESULFOASV1_1572_hypothetical_protein	AF-Q52926-F1-model_v4	DESULFOASV1_1572_hypothetical_protein	AF-Q52926-F1-model_v4 Exopolysaccharide production negative regulator	0.175	169	130	62	220	76	244	3.777E-01	73
DESULFOASV1_1572_hypothetical_protein	AF-Q6ES52-F1-model_v4	DESULFOASV1_1572_hypothetical_protein	AF-Q6ES52-F1-model_v4 TPR repeat-containing thioredoxin TDX	0.134	148	119	77	224	39	176	4.814E-01	73
DESULFOASV1_1572_hypothetical_protein	AF-A7SPX9-F1-model_v4	DESULFOASV1_1572_hypothetical_protein	AF-A7SPX9-F1-model_v4 Eukaryotic translation initiation factor 3 subunit M	0.094	147	128	72	218	68	209	2.822E-01	73
DESULFOASV1_1572_hypothetical_protein	AF-Q54QX3-F1-model_v4	DESULFOASV1_1572_hypothetical_protein	AF-Q54QX3-F1-model_v4 COP9 signalosome complex subunit 1	0.126	150	129	66	215	102	250	3.964E-01	73
DESULFOASV1_1572_hypothetical_protein	AF-D0ZBY2-F1-model_v4	DESULFOASV1_1572_hypothetical_protein	AF-D0ZBY2-F1-model_v4 Penicillin-binding protein activator LpoA	0.183	143	110	76	218	43	178	4.369E-01	73
DESULFOASV1_1572_hypothetical_protein	AF-Q20683-F1-model_v4	DESULFOASV1_1572_hypothetical_protein	AF-Q20683-F1-model_v4 Tetratricopeptide repeat protein 36	0.218	134	103	60	192	41	174	3.427E-01	72
DESULFOASV1_1572_hypothetical_protein	AF-Q9P7S2-F1-model_v4	DESULFOASV1_1572_hypothetical_protein	AF-Q9P7S2-F1-model_v4 Probable 26S proteasome regulatory subunit rpn6	0.114	168	144	60	222	14	181	3.110E-01	72
DESULFOASV1_1572_hypothetical_protein	AF-Q6IQT4-F1-model_v4	DESULFOASV1_1572_hypothetical_protein	AF-Q6IQT4-F1-model_v4 COP9 signalosome complex subunit 2	0.146	176	132	61	215	105	280	2.963E-01	72
DESULFOASV1_1572_hypothetical_protein	AF-Q8LPF1-F1-model_v4	DESULFOASV1_1572_hypothetical_protein	AF-Q8LPF1-F1-model_v4 Pentatricopeptide repeat-containing protein At5g15980, mitochondrial	0.150	150	123	68	213	436	585	3.427E-01	72
DESULFOASV1_1572_hypothetical_protein	AF-Q9VN19-F1-model_v4	DESULFOASV1_1572_hypothetical_protein	AF-Q9VN19-F1-model_v4 Golgi to ER traffic protein 4 homolog	0.175	151	111	62	196	19	169	3.265E-01	71
DESULFOASV1_1572_hypothetical_protein	AF-P23610-F1-model_v4	DESULFOASV1_1572_hypothetical_protein	AF-P23610-F1-model_v4 40-kDa huntingtin-associated protein	0.139	199	122	62	204	20	218	8.386E-02	71
DESULFOASV1_1572_hypothetical_protein	AF-P34481-F1-model_v4	DESULFOASV1_1572_hypothetical_protein	AF-P34481-F1-model_v4 Probable 26S proteasome regulatory subunit rpn-6.2	0.134	165	133	69	223	9	173	3.110E-01	71
DESULFOASV1_1572_hypothetical_protein	AF-P61201-F1-model_v4	DESULFOASV1_1572_hypothetical_protein	AF-P61201-F1-model_v4 COP9 signalosome complex subunit 2	0.141	176	132	61	215	105	280	3.427E-01	71
DESULFOASV1_1572_hypothetical_protein	AF-Q52999-F1-model_v4	DESULFOASV1_1572_hypothetical_protein	AF-Q52999-F1-model_v4 Uncharacterized protein R02095	0.138	202	168	29	224	821	1022	2.963E-01	71
DESULFOASV1_1572_hypothetical_protein	AF-P45299-F1-model_v4	DESULFOASV1_1572_hypothetical_protein	AF-P45299-F1-model_v4 Penicillin-binding protein activator LpoA	0.134	137	117	72	208	35	170	4.814E-01	70
DESULFOASV1_1572_hypothetical_protein	AF-A7E727-F1-model_v4	DESULFOASV1_1572_hypothetical_protein	AF-A7E727-F1-model_v4 Inclusion body clearance protein iml2	0.135	106	88	117	222	341	443	2.633E+00	70
DESULFOASV1_1572_hypothetical_protein	AF-A9R1Q6-F1-model_v4	DESULFOASV1_1572_hypothetical_protein	AF-A9R1Q6-F1-model_v4 Penicillin-binding protein activator LpoA	0.122	143	124	76	218	39	180	8.620E-01	70
DESULFOASV1_1572_hypothetical_protein	AF-P0DJD0-F1-model_v4	DESULFOASV1_1572_hypothetical_protein	AF-P0DJD0-F1-model_v4 RANBP2-like and GRIP domain-containing protein 1	0.135	176	145	49	224	3	171	6.442E-01	70
DESULFOASV1_1572_hypothetical_protein	AF-A3KN28-F1-model_v4	DESULFOASV1_1572_hypothetical_protein	AF-A3KN28-F1-model_v4 Suppressor of tumorigenicity 7 protein-like	0.125	139	121	85	223	205	343	1.363E-01	69
DESULFOASV1_1572_hypothetical_protein	AF-Q19294-F1-model_v4	DESULFOASV1_1572_hypothetical_protein	AF-Q19294-F1-model_v4 Cell division cycle protein 23 homolog	0.165	200	140	56	224	188	387	6.579E-02	69
DESULFOASV1_1572_hypothetical_protein	AF-Q8GUP1-F1-model_v4	DESULFOASV1_1572_hypothetical_protein	AF-Q8GUP1-F1-model_v4 Cleavage stimulation factor subunit 77	0.100	166	140	66	222	8	173	7.099E-01	69
DESULFOASV1_1572_hypothetical_protein	AF-Q2QNU0-F1-model_v4	DESULFOASV1_1572_hypothetical_protein	AF-Q2QNU0-F1-model_v4 Trafficking protein particle complex II-specific subunit 130 homolog	0.119	138	118	84	218	538	675	8.620E-01	69
DESULFOASV1_1572_hypothetical_protein	AF-Q4HXF6-F1-model_v4	DESULFOASV1_1572_hypothetical_protein	AF-Q4HXF6-F1-model_v4 Peptidyl-prolyl cis-trans isomerase D	0.108	150	129	77	222	207	356	3.265E-01	68
DESULFOASV1_1572_hypothetical_protein	AF-Q54UB5-F1-model_v4	DESULFOASV1_1572_hypothetical_protein	AF-Q54UB5-F1-model_v4 26S proteasome non-ATPase regulatory subunit 11	0.142	250	178	16	224	4	253	5.569E-01	68
DESULFOASV1_1572_hypothetical_protein	AF-Q68FW3-F1-model_v4	DESULFOASV1_1572_hypothetical_protein	AF-Q68FW3-F1-model_v4 Suppressor of tumorigenicity 7 protein-like	0.126	161	139	64	223	187	347	7.989E-02	68
DESULFOASV1_1572_hypothetical_protein	AF-P46825-F1-model_v4	DESULFOASV1_1572_hypothetical_protein	AF-P46825-F1-model_v4 Kinesin light chain	0.151	225	169	1	200	191	415	4.814E-01	68
DESULFOASV1_1572_hypothetical_protein	AF-Q9LYT2-F1-model_v4	DESULFOASV1_1572_hypothetical_protein	AF-Q9LYT2-F1-model_v4 Pentatricopeptide repeat-containing protein At3g59040	0.121	245	194	1	222	16	260	2.822E-01	68
DESULFOASV1_1572_hypothetical_protein	AF-A5HK05-F1-model_v4	DESULFOASV1_1572_hypothetical_protein	AF-A5HK05-F1-model_v4 Amyloid protein-binding protein 2	0.129	153	118	85	221	102	254	3.598E-01	68
DESULFOASV1_1572_hypothetical_protein	AF-Q9SJK9-F1-model_v4	DESULFOASV1_1572_hypothetical_protein	AF-Q9SJK9-F1-model_v4 Pentatricopeptide repeat-containing protein At2g36980, mitochondrial	0.121	142	121	83	224	421	559	1.153E+00	68
DESULFOASV1_1572_hypothetical_protein	AF-P27123-F1-model_v4	DESULFOASV1_1572_hypothetical_protein	AF-P27123-F1-model_v4 Nuclear autoantigenic sperm protein	0.107	161	116	64	224	424	554	1.914E-01	68
DESULFOASV1_1572_hypothetical_protein	AF-Q9V3C5-F1-model_v4	DESULFOASV1_1572_hypothetical_protein	AF-Q9V3C5-F1-model_v4 Guanine nucleotide exchange factor subunit Rich	0.170	140	107	65	204	841	970	1.069E-01	68
DESULFOASV1_1572_hypothetical_protein	AF-Q9LXZ5-F1-model_v4	DESULFOASV1_1572_hypothetical_protein	AF-Q9LXZ5-F1-model_v4 Alpha-soluble NSF attachment protein 1	0.117	209	162	16	224	38	221	3.857E-02	67
DESULFOASV1_1572_hypothetical_protein	AF-Q8K4P7-F1-model_v4	DESULFOASV1_1572_hypothetical_protein	AF-Q8K4P7-F1-model_v4 Suppressor of tumorigenicity 7 protein-like	0.125	139	121	85	223	209	347	1.502E-01	67
DESULFOASV1_1572_hypothetical_protein	AF-Q9CA58-F1-model_v4	DESULFOASV1_1572_hypothetical_protein	AF-Q9CA58-F1-model_v4 Putative pentatricopeptide repeat-containing protein At1g74580	0.168	145	119	68	211	7	151	1.620E+00	67
DESULFOASV1_1572_hypothetical_protein	AF-Q99MD9-F1-model_v4	DESULFOASV1_1572_hypothetical_protein	AF-Q99MD9-F1-model_v4 Nuclear autoantigenic sperm protein	0.116	141	115	84	224	504	634	5.054E-01	67
DESULFOASV1_1572_hypothetical_protein	AF-A4WFK6-F1-model_v4	DESULFOASV1_1572_hypothetical_protein	AF-A4WFK6-F1-model_v4 HTH-type transcriptional regulator MalT	0.151	158	131	64	218	573	730	2.440E-01	67
DESULFOASV1_1572_hypothetical_protein	AF-P49951-F1-model_v4	DESULFOASV1_1572_hypothetical_protein	AF-P49951-F1-model_v4 Clathrin heavy chain 1	0.140	200	164	8	199	1048	1247	1.430E-01	67
DESULFOASV1_1572_hypothetical_protein	AF-Q00610-F1-model_v4	DESULFOASV1_1572_hypothetical_protein	AF-Q00610-F1-model_v4 Clathrin heavy chain 1	0.132	152	126	54	199	1096	1247	1.576E-01	67
DESULFOASV1_1572_hypothetical_protein	AF-Q5XET4-F1-model_v4	DESULFOASV1_1572_hypothetical_protein	AF-Q5XET4-F1-model_v4 Pentatricopeptide repeat-containing protein At2g01860	0.129	164	135	61	224	328	483	7.822E-01	66
DESULFOASV1_1572_hypothetical_protein	AF-A7ME76-F1-model_v4	DESULFOASV1_1572_hypothetical_protein	AF-A7ME76-F1-model_v4 HTH-type transcriptional regulator MalT	0.180	158	126	64	218	573	730	2.963E-01	66
DESULFOASV1_1572_hypothetical_protein	AF-A7N5N6-F1-model_v4	DESULFOASV1_1572_hypothetical_protein	AF-A7N5N6-F1-model_v4 HTH-type transcriptional regulator MalT	0.162	144	115	64	201	576	719	4.369E-01	66
DESULFOASV1_1572_hypothetical_protein	AF-Q8H1U4-F1-model_v4	DESULFOASV1_1572_hypothetical_protein	AF-Q8H1U4-F1-model_v4 Anaphase-promoting complex subunit 5	0.117	203	140	65	223	704	906	4.162E-01	66
DESULFOASV1_1572_hypothetical_protein	AF-O08901-F1-model_v4	DESULFOASV1_1572_hypothetical_protein	AF-O08901-F1-model_v4 Mitotic checkpoint serine/threonine-protein kinase BUB1	0.137	146	123	79	221	1	146	8.620E-01	66
DESULFOASV1_1572_hypothetical_protein	AF-Q32PH0-F1-model_v4	DESULFOASV1_1572_hypothetical_protein	AF-Q32PH0-F1-model_v4 Trafficking protein particle complex subunit 9	0.143	154	117	84	221	351	504	2.109E-01	66
DESULFOASV1_1572_hypothetical_protein	AF-Q96Q05-F1-model_v4	DESULFOASV1_1572_hypothetical_protein	AF-Q96Q05-F1-model_v4 Trafficking protein particle complex subunit 9	0.146	151	118	83	221	363	513	2.324E-01	66
DESULFOASV1_1572_hypothetical_protein	AF-Q6PA97-F1-model_v4	DESULFOASV1_1572_hypothetical_protein	AF-Q6PA97-F1-model_v4 Trafficking protein particle complex subunit 9	0.143	154	117	84	221	360	513	2.109E-01	66
DESULFOASV1_1572_hypothetical_protein	AF-A8XHX1-F1-model_v4	DESULFOASV1_1572_hypothetical_protein	AF-A8XHX1-F1-model_v4 Tetratricopeptide repeat protein 36	0.144	141	111	95	225	37	177	1.153E+00	65
DESULFOASV1_1572_hypothetical_protein	AF-A8X379-F1-model_v4	DESULFOASV1_1572_hypothetical_protein	AF-A8X379-F1-model_v4 Probable 26S proteasome regulatory subunit rpn-6.2	0.115	160	136	69	223	9	168	7.099E-01	65
DESULFOASV1_1572_hypothetical_protein	AF-O31986-F1-model_v4	DESULFOASV1_1572_hypothetical_protein	AF-O31986-F1-model_v4 SPbeta prophage-derived glycosyltransferase SunS	0.080	194	135	77	224	222	415	2.009E-01	65
DESULFOASV1_1572_hypothetical_protein	AF-P61203-F1-model_v4	DESULFOASV1_1572_hypothetical_protein	AF-P61203-F1-model_v4 COP9 signalosome complex subunit 2	0.141	176	132	61	215	105	280	5.569E-01	65
DESULFOASV1_1572_hypothetical_protein	AF-Q54K78-F1-model_v4	DESULFOASV1_1572_hypothetical_protein	AF-Q54K78-F1-model_v4 Putative uncharacterized protein DDB_G0287573	0.103	151	131	77	223	106	256	1.211E+00	65
DESULFOASV1_1572_hypothetical_protein	AF-Q9DAX9-F1-model_v4	DESULFOASV1_1572_hypothetical_protein	AF-Q9DAX9-F1-model_v4 Amyloid protein-binding protein 2	0.129	153	118	85	221	102	254	4.814E-01	65
DESULFOASV1_1572_hypothetical_protein	AF-A8GJZ0-F1-model_v4	DESULFOASV1_1572_hypothetical_protein	AF-A8GJZ0-F1-model_v4 Penicillin-binding protein activator LpoA	0.136	150	125	76	225	44	189	9.049E-01	65
DESULFOASV1_1572_hypothetical_protein	AF-A6TF41-F1-model_v4	DESULFOASV1_1572_hypothetical_protein	AF-A6TF41-F1-model_v4 HTH-type transcriptional regulator MalT	0.153	158	130	64	218	573	730	3.598E-01	65
DESULFOASV1_1572_hypothetical_protein	AF-A0A2R8QPS5-F1-model_v4	DESULFOASV1_1572_hypothetical_protein	AF-A0A2R8QPS5-F1-model_v4 Guanine nucleotide exchange factor subunit RIC1	0.130	143	111	64	206	819	947	1.502E-01	65
DESULFOASV1_1572_hypothetical_protein	AF-Q94261-F1-model_v4	DESULFOASV1_1572_hypothetical_protein	AF-Q94261-F1-model_v4 COP9/Signalosome and eIF3 complex-shared subunit 1	0.137	159	118	84	221	110	268	1.401E+00	64
DESULFOASV1_1572_hypothetical_protein	AF-O33089-F1-model_v4	DESULFOASV1_1572_hypothetical_protein	AF-O33089-F1-model_v4 ESX-1 secretion system protein EccA1	0.160	149	117	68	216	107	246	6.762E-01	64
DESULFOASV1_1572_hypothetical_protein	AF-Q2NWH5-F1-model_v4	DESULFOASV1_1572_hypothetical_protein	AF-Q2NWH5-F1-model_v4 Penicillin-binding protein activator LpoA	0.128	178	125	77	220	40	217	4.369E-01	64
DESULFOASV1_1572_hypothetical_protein	AF-Q9BQ70-F1-model_v4	DESULFOASV1_1572_hypothetical_protein	AF-Q9BQ70-F1-model_v4 Transcription factor 25	0.127	177	140	65	225	256	432	2.065E+00	64
DESULFOASV1_1572_hypothetical_protein	AF-Q8LP10-F1-model_v4	DESULFOASV1_1572_hypothetical_protein	AF-Q8LP10-F1-model_v4 Probable UDP-N-acetylglucosamine--peptide N-acetylglucosaminyltransferase SPINDLY	0.127	183	138	64	222	37	219	1.178E-01	64
DESULFOASV1_1572_hypothetical_protein	AF-Q09417-F1-model_v4	DESULFOASV1_1572_hypothetical_protein	AF-Q09417-F1-model_v4 Guanine nucleotide exchange factor subunit R06F6.8	0.125	139	112	82	210	837	975	1.737E-01	64
DESULFOASV1_1572_hypothetical_protein	AF-P0DJD1-F1-model_v4	DESULFOASV1_1572_hypothetical_protein	AF-P0DJD1-F1-model_v4 RANBP2-like and GRIP domain-containing protein 2	0.139	174	136	66	224	6	179	7.099E-01	64
DESULFOASV1_1572_hypothetical_protein	AF-O83733-F1-model_v4	DESULFOASV1_1572_hypothetical_protein	AF-O83733-F1-model_v4 Uncharacterized protein TP_0752	0.108	235	153	48	219	10	244	3.265E-01	63
DESULFOASV1_1572_hypothetical_protein	AF-P60330-F1-model_v4	DESULFOASV1_1572_hypothetical_protein	AF-P60330-F1-model_v4 Separin	0.162	156	123	72	219	432	587	6.137E-01	63
DESULFOASV1_1572_hypothetical_protein	AF-Q9MAX6-F1-model_v4	DESULFOASV1_1572_hypothetical_protein	AF-Q9MAX6-F1-model_v4 Coatomer subunit epsilon-1	0.125	155	125	60	203	77	231	9.049E-01	62
DESULFOASV1_1572_hypothetical_protein	AF-Q0U0X1-F1-model_v4	DESULFOASV1_1572_hypothetical_protein	AF-Q0U0X1-F1-model_v4 Eukaryotic translation initiation factor 3 subunit E	0.129	205	144	59	224	90	294	2.561E-01	62
DESULFOASV1_1572_hypothetical_protein	AF-P93005-F1-model_v4	DESULFOASV1_1572_hypothetical_protein	AF-P93005-F1-model_v4 Pentatricopeptide repeat-containing protein At2g33680	0.208	143	107	80	222	504	639	1.874E+00	62
DESULFOASV1_1572_hypothetical_protein	AF-B4SVL9-F1-model_v4	DESULFOASV1_1572_hypothetical_protein	AF-B4SVL9-F1-model_v4 HTH-type transcriptional regulator MalT	0.151	158	131	64	218	573	730	4.162E-01	62
DESULFOASV1_1572_hypothetical_protein	AF-Q3U0M1-F1-model_v4	DESULFOASV1_1572_hypothetical_protein	AF-Q3U0M1-F1-model_v4 Trafficking protein particle complex subunit 9	0.139	162	132	68	221	352	513	2.214E-01	62
DESULFOASV1_1572_hypothetical_protein	AF-Q4ADV7-F1-model_v4	DESULFOASV1_1572_hypothetical_protein	AF-Q4ADV7-F1-model_v4 Guanine nucleotide exchange factor subunit RIC1	0.124	130	104	82	201	855	984	2.963E-01	62
DESULFOASV1_1572_hypothetical_protein	AF-Q2QYW2-F1-model_v4	DESULFOASV1_1572_hypothetical_protein	AF-Q2QYW2-F1-model_v4 Clathrin heavy chain 2	0.127	160	135	69	224	1037	1196	4.814E-01	62
DESULFOASV1_1572_hypothetical_protein	AF-Q2RBN7-F1-model_v4	DESULFOASV1_1572_hypothetical_protein	AF-Q2RBN7-F1-model_v4 Clathrin heavy chain 1	0.116	174	150	29	199	1088	1261	3.265E-01	62
DESULFOASV1_1572_hypothetical_protein	AF-Q08168-F1-model_v4	DESULFOASV1_1572_hypothetical_protein	AF-Q08168-F1-model_v4 58 kDa phosphoprotein	0.136	127	109	97	223	109	235	2.901E+00	61
DESULFOASV1_1572_hypothetical_protein	AF-Q54PX7-F1-model_v4	DESULFOASV1_1572_hypothetical_protein	AF-Q54PX7-F1-model_v4 PCI domain-containing protein 2 homolog	0.104	207	141	65	222	144	350	2.689E-01	61
DESULFOASV1_1572_hypothetical_protein	AF-A7F3L0-F1-model_v4	DESULFOASV1_1572_hypothetical_protein	AF-A7F3L0-F1-model_v4 Eukaryotic translation initiation factor 3 subunit E	0.133	199	140	62	224	112	310	3.427E-01	61
DESULFOASV1_1572_hypothetical_protein	AF-A6SM77-F1-model_v4	DESULFOASV1_1572_hypothetical_protein	AF-A6SM77-F1-model_v4 Eukaryotic translation initiation factor 3 subunit E	0.136	209	140	62	224	103	311	2.689E-01	61
DESULFOASV1_1572_hypothetical_protein	AF-P31778-F1-model_v4	DESULFOASV1_1572_hypothetical_protein	AF-P31778-F1-model_v4 Regulatory protein HrpB	0.136	123	101	84	201	34	156	2.508E+00	61
DESULFOASV1_1572_hypothetical_protein	AF-A8A5M7-F1-model_v4	DESULFOASV1_1572_hypothetical_protein	AF-A8A5M7-F1-model_v4 HTH-type transcriptional regulator MalT	0.139	158	133	64	218	573	730	4.369E-01	61
DESULFOASV1_1572_hypothetical_protein	AF-B1IP47-F1-model_v4	DESULFOASV1_1572_hypothetical_protein	AF-B1IP47-F1-model_v4 HTH-type transcriptional regulator MalT	0.153	158	130	64	218	573	730	5.054E-01	61
DESULFOASV1_1572_hypothetical_protein	AF-O42656-F1-model_v4	DESULFOASV1_1572_hypothetical_protein	AF-O42656-F1-model_v4 Guanine nucleotide exchange factor subunit ric1	0.080	167	130	84	225	886	1052	1.298E-01	61
DESULFOASV1_1572_hypothetical_protein	AF-Q9LXF4-F1-model_v4	DESULFOASV1_1572_hypothetical_protein	AF-Q9LXF4-F1-model_v4 Pentatricopeptide repeat-containing protein At5g15280, mitochondrial	0.120	161	136	64	218	105	265	2.168E+00	61
DESULFOASV1_1572_hypothetical_protein	AF-Q65T15-F1-model_v4	DESULFOASV1_1572_hypothetical_protein	AF-Q65T15-F1-model_v4 Penicillin-binding protein activator LpoA	0.135	149	128	72	220	35	183	1.543E+00	60
DESULFOASV1_1572_hypothetical_protein	AF-Q680H3-F1-model_v4	DESULFOASV1_1572_hypothetical_protein	AF-Q680H3-F1-model_v4 Pentatricopeptide repeat-containing protein At2g25580	0.154	157	123	62	218	255	400	1.967E+00	60
DESULFOASV1_1572_hypothetical_protein	AF-O88512-F1-model_v4	DESULFOASV1_1572_hypothetical_protein	AF-O88512-F1-model_v4 AP-1 complex subunit gamma-like 2	0.143	158	127	72	220	294	451	2.276E+00	60
DESULFOASV1_1572_hypothetical_protein	AF-C4ZVX0-F1-model_v4	DESULFOASV1_1572_hypothetical_protein	AF-C4ZVX0-F1-model_v4 HTH-type transcriptional regulator MalT	0.139	158	133	64	218	573	730	4.814E-01	60
DESULFOASV1_1572_hypothetical_protein	AF-Q8Z227-F1-model_v4	DESULFOASV1_1572_hypothetical_protein	AF-Q8Z227-F1-model_v4 HTH-type transcriptional regulator MalT	0.151	158	131	64	218	573	730	5.054E-01	60
DESULFOASV1_1572_hypothetical_protein	AF-O01422-F1-model_v4	DESULFOASV1_1572_hypothetical_protein	AF-O01422-F1-model_v4 COP9 signalosome complex subunit 2	0.100	161	129	62	222	29	172	3.110E-01	59
DESULFOASV1_1572_hypothetical_protein	AF-D0KEP3-F1-model_v4	DESULFOASV1_1572_hypothetical_protein	AF-D0KEP3-F1-model_v4 Penicillin-binding protein activator LpoA	0.102	143	127	76	218	39	180	2.276E+00	59
DESULFOASV1_1572_hypothetical_protein	AF-A4WEW2-F1-model_v4	DESULFOASV1_1572_hypothetical_protein	AF-A4WEW2-F1-model_v4 Penicillin-binding protein activator LpoA	0.105	148	130	71	218	35	180	1.874E+00	59
DESULFOASV1_1572_hypothetical_protein	AF-Q84K16-F1-model_v4	DESULFOASV1_1572_hypothetical_protein	AF-Q84K16-F1-model_v4 AP-1 complex subunit gamma-1	0.145	134	106	72	196	297	430	1.701E+00	59
DESULFOASV1_1572_hypothetical_protein	AF-B7L4U8-F1-model_v4	DESULFOASV1_1572_hypothetical_protein	AF-B7L4U8-F1-model_v4 HTH-type transcriptional regulator MalT	0.139	158	133	64	218	573	730	5.846E-01	59
DESULFOASV1_1572_hypothetical_protein	AF-A9UQS1-F1-model_v4	DESULFOASV1_1572_hypothetical_protein	AF-A9UQS1-F1-model_v4 Eukaryotic translation initiation factor 3 subunit E	0.142	216	160	35	221	61	276	2.689E-01	58
DESULFOASV1_1572_hypothetical_protein	AF-Q9SY69-F1-model_v4	DESULFOASV1_1572_hypothetical_protein	AF-Q9SY69-F1-model_v4 Pentatricopeptide repeat-containing protein At1g10270	0.111	145	120	83	218	454	598	8.211E-01	58
DESULFOASV1_1572_hypothetical_protein	AF-Q9SY75-F1-model_v4	DESULFOASV1_1572_hypothetical_protein	AF-Q9SY75-F1-model_v4 Putative pentatricopeptide repeat-containing protein At1g10330	0.135	165	134	65	220	13	177	1.967E+00	57
DESULFOASV1_1572_hypothetical_protein	AF-Q3E911-F1-model_v4	DESULFOASV1_1572_hypothetical_protein	AF-Q3E911-F1-model_v4 Pentatricopeptide repeat-containing protein At5g27460	0.138	161	131	64	224	252	404	2.633E+00	57
DESULFOASV1_1572_hypothetical_protein	AF-C5B768-F1-model_v4	DESULFOASV1_1572_hypothetical_protein	AF-C5B768-F1-model_v4 Penicillin-binding protein activator LpoA	0.157	143	114	76	218	43	178	1.401E+00	57
DESULFOASV1_1572_hypothetical_protein	AF-O94368-F1-model_v4	DESULFOASV1_1572_hypothetical_protein	AF-O94368-F1-model_v4 Pentatricopeptide repeat-containing protein 1, mitochondrial	0.122	138	106	81	218	532	653	2.276E+00	57
DESULFOASV1_1572_hypothetical_protein	AF-O23337-F1-model_v4	DESULFOASV1_1572_hypothetical_protein	AF-O23337-F1-model_v4 Pentatricopeptide repeat-containing protein At4g14820	0.150	149	121	82	224	427	575	1.701E+00	57
DESULFOASV1_1572_hypothetical_protein	AF-Q9LIE7-F1-model_v4	DESULFOASV1_1572_hypothetical_protein	AF-Q9LIE7-F1-model_v4 Pentatricopeptide repeat-containing protein At3g22150, chloroplastic	0.137	161	128	64	224	594	742	2.168E+00	57
DESULFOASV1_1572_hypothetical_protein	AF-Q0WPZ6-F1-model_v4	DESULFOASV1_1572_hypothetical_protein	AF-Q0WPZ6-F1-model_v4 Pentatricopeptide repeat-containing protein At2g17140	0.163	142	114	83	224	647	783	2.633E+00	57
DESULFOASV1_1572_hypothetical_protein	AF-Q57IV9-F1-model_v4	DESULFOASV1_1572_hypothetical_protein	AF-Q57IV9-F1-model_v4 HTH-type transcriptional regulator MalT	0.151	158	131	64	218	573	730	7.452E-01	57
DESULFOASV1_1572_hypothetical_protein	AF-B2RXC1-F1-model_v4	DESULFOASV1_1572_hypothetical_protein	AF-B2RXC1-F1-model_v4 Trafficking protein particle complex subunit 11	0.095	161	128	83	224	202	362	8.620E-01	57
DESULFOASV1_1572_hypothetical_protein	AF-Q9LNU4-F1-model_v4	DESULFOASV1_1572_hypothetical_protein	AF-Q9LNU4-F1-model_v4 26S proteasome non-ATPase regulatory subunit 3 homolog A	0.136	142	111	83	211	137	278	1.543E+00	56
DESULFOASV1_1572_hypothetical_protein	AF-Q90YH8-F1-model_v4	DESULFOASV1_1572_hypothetical_protein	AF-Q90YH8-F1-model_v4 Suppressor of tumorigenicity 7 protein-like	0.150	161	135	64	223	178	338	3.110E-01	56
DESULFOASV1_1572_hypothetical_protein	AF-O49287-F1-model_v4	DESULFOASV1_1572_hypothetical_protein	AF-O49287-F1-model_v4 Putative pentatricopeptide repeat-containing protein At1g77010, mitochondrial	0.165	151	119	72	222	523	666	3.523E+00	56
DESULFOASV1_1572_hypothetical_protein	AF-Q54K14-F1-model_v4	DESULFOASV1_1572_hypothetical_protein	AF-Q54K14-F1-model_v4 TSET complex member tstF	0.101	149	108	104	224	947	1095	3.598E-01	56
DESULFOASV1_1572_hypothetical_protein	AF-Q8I8U2-F1-model_v4	DESULFOASV1_1572_hypothetical_protein	AF-Q8I8U2-F1-model_v4 AP-1 complex subunit gamma	0.138	152	126	72	218	291	442	2.764E+00	55
DESULFOASV1_1572_hypothetical_protein	AF-Q9VRX2-F1-model_v4	DESULFOASV1_1572_hypothetical_protein	AF-Q9VRX2-F1-model_v4 Vacuolar protein sorting-associated protein 8 homolog	0.100	241	187	16	224	870	1110	6.762E-01	55
DESULFOASV1_1572_hypothetical_protein	AF-Q19337-F1-model_v4	DESULFOASV1_1572_hypothetical_protein	AF-Q19337-F1-model_v4 Protein ST7 homolog	0.120	263	181	16	222	31	293	2.324E-01	54
DESULFOASV1_1572_hypothetical_protein	AF-P38688-F1-model_v4	DESULFOASV1_1572_hypothetical_protein	AF-P38688-F1-model_v4 Signal recognition particle subunit SRP72	0.090	224	163	39	218	52	275	5.569E-01	54
DESULFOASV1_1572_hypothetical_protein	AF-A6TEG6-F1-model_v4	DESULFOASV1_1572_hypothetical_protein	AF-A6TEG6-F1-model_v4 Penicillin-binding protein activator LpoA	0.120	148	129	71	218	34	181	4.278E+00	54
DESULFOASV1_1572_hypothetical_protein	AF-Q8K2A7-F1-model_v4	DESULFOASV1_1572_hypothetical_protein	AF-Q8K2A7-F1-model_v4 Integrator complex subunit 10	0.170	117	87	100	205	409	525	2.389E+00	54
DESULFOASV1_1572_hypothetical_protein	AF-P49754-F1-model_v4	DESULFOASV1_1572_hypothetical_protein	AF-P49754-F1-model_v4 Vacuolar protein sorting-associated protein 41 homolog	0.209	81	60	140	220	362	438	1.620E+00	54
DESULFOASV1_1572_hypothetical_protein	AF-Q9FY61-F1-model_v4	DESULFOASV1_1572_hypothetical_protein	AF-Q9FY61-F1-model_v4 Trafficking protein particle complex II-specific subunit 120 homolog	0.167	162	113	64	200	315	476	3.964E-01	54
DESULFOASV1_1572_hypothetical_protein	AF-Q6GKV1-F1-model_v4	DESULFOASV1_1572_hypothetical_protein	AF-Q6GKV1-F1-model_v4 Protein GET4	0.117	265	188	3	216	1	265	1.737E-01	53
DESULFOASV1_1572_hypothetical_protein	AF-O83461-F1-model_v4	DESULFOASV1_1572_hypothetical_protein	AF-O83461-F1-model_v4 Uncharacterized protein TP_0447	0.131	205	118	60	196	73	277	1.271E+00	53
DESULFOASV1_1572_hypothetical_protein	AF-Q9US13-F1-model_v4	DESULFOASV1_1572_hypothetical_protein	AF-Q9US13-F1-model_v4 Probable 26S proteasome regulatory subunit rpn9	0.108	243	189	13	225	21	263	1.620E+00	53
