query	target	qheader	theader	fident	alnlen	mismatch	qstart	qend	tstart	tend	evalue	bits
DESULFOASV1_3448_hypothetical_protein	AF-F8W0I5-F1-model_v4	DESULFOASV1_3448_hypothetical_protein	AF-F8W0I5-F1-model_v4 Nuclear pore complex-interacting protein family member B12	0.114	217	189	11	227	121	334	3.622E-01	37
DESULFOASV1_3448_hypothetical_protein	AF-Q5R9T2-F1-model_v4	DESULFOASV1_3448_hypothetical_protein	AF-Q5R9T2-F1-model_v4 Vacuolar protein sorting-associated protein 37C	0.164	221	168	26	227	29	249	2.549E-01	36
DESULFOASV1_3448_hypothetical_protein	AF-Q8BKT2-F1-model_v4	DESULFOASV1_3448_hypothetical_protein	AF-Q8BKT2-F1-model_v4 Transcription factor HES-7	0.154	212	174	16	227	1	207	2.734E-01	35
DESULFOASV1_3448_hypothetical_protein	AF-Q2LCV6-F1-model_v4	DESULFOASV1_3448_hypothetical_protein	AF-Q2LCV6-F1-model_v4 Equatorin	0.188	183	143	1	183	104	280	7.312E-01	35
DESULFOASV1_3448_hypothetical_protein	AF-A1V3N4-F1-model_v4	DESULFOASV1_3448_hypothetical_protein	AF-A1V3N4-F1-model_v4 Translation initiation factor IF-2	0.231	204	152	28	226	171	374	4.797E-01	34
DESULFOASV1_3448_hypothetical_protein	AF-A5D8V6-F1-model_v4	DESULFOASV1_3448_hypothetical_protein	AF-A5D8V6-F1-model_v4 Vacuolar protein sorting-associated protein 37C	0.173	221	166	26	227	29	249	3.622E-01	33
DESULFOASV1_3448_hypothetical_protein	AF-E9PJ23-F1-model_v4	DESULFOASV1_3448_hypothetical_protein	AF-E9PJ23-F1-model_v4 Nuclear pore complex-interacting protein family member B6	0.125	218	188	10	227	138	353	7.844E-01	33
DESULFOASV1_3448_hypothetical_protein	AF-B0T1Q6-F1-model_v4	DESULFOASV1_3448_hypothetical_protein	AF-B0T1Q6-F1-model_v4 Sec-independent protein translocase protein TatB	0.250	190	138	24	213	6	190	7.844E-01	32
DESULFOASV1_3448_hypothetical_protein	AF-O13166-F1-model_v4	DESULFOASV1_3448_hypothetical_protein	AF-O13166-F1-model_v4 Transducin-like enhancer protein 3-A	0.174	218	178	10	227	2	218	5.520E-01	31
DESULFOASV1_3448_hypothetical_protein	AF-Q96HZ4-F1-model_v4	DESULFOASV1_3448_hypothetical_protein	AF-Q96HZ4-F1-model_v4 Transcription cofactor HES-6	0.153	201	166	1	197	1	201	1.584E+00	30
DESULFOASV1_3448_hypothetical_protein	AF-Q3SRQ2-F1-model_v4	DESULFOASV1_3448_hypothetical_protein	AF-Q3SRQ2-F1-model_v4 Sec-independent protein translocase protein TatB	0.211	182	136	44	225	7	180	5.520E-01	29
DESULFOASV1_3448_hypothetical_protein	AF-Q8UEQ0-F1-model_v4	DESULFOASV1_3448_hypothetical_protein	AF-Q8UEQ0-F1-model_v4 Sec-independent protein translocase protein TatB	0.237	198	135	46	223	6	203	4.797E-01	29
DESULFOASV1_3448_hypothetical_protein	AF-Q86XG9-F1-model_v4	DESULFOASV1_3448_hypothetical_protein	AF-Q86XG9-F1-model_v4 Putative neuroblastoma breakpoint family member 5	0.189	226	163	26	227	30	255	3.622E-01	29
DESULFOASV1_3448_hypothetical_protein	AF-Q3JSY9-F1-model_v4	DESULFOASV1_3448_hypothetical_protein	AF-Q3JSY9-F1-model_v4 Translation initiation factor IF-2	0.231	204	152	28	226	171	374	5.146E-01	29
DESULFOASV1_3448_hypothetical_protein	AF-Q1QME4-F1-model_v4	DESULFOASV1_3448_hypothetical_protein	AF-Q1QME4-F1-model_v4 Sec-independent protein translocase protein TatB	0.218	193	134	30	222	7	178	6.353E-01	28
DESULFOASV1_3448_hypothetical_protein	AF-Q11HC6-F1-model_v4	DESULFOASV1_3448_hypothetical_protein	AF-Q11HC6-F1-model_v4 Sec-independent protein translocase protein TatB	0.212	203	149	25	227	5	194	7.312E-01	28
DESULFOASV1_3448_hypothetical_protein	AF-Q9H9H4-F1-model_v4	DESULFOASV1_3448_hypothetical_protein	AF-Q9H9H4-F1-model_v4 Vacuolar protein sorting-associated protein 37B	0.181	205	162	28	226	40	244	9.027E-01	28
DESULFOASV1_3448_hypothetical_protein	AF-O42469-F1-model_v4	DESULFOASV1_3448_hypothetical_protein	AF-O42469-F1-model_v4 Transducin-like enhancer protein 1	0.132	238	196	1	227	4	241	1.114E+00	28
DESULFOASV1_3448_hypothetical_protein	AF-Q8BW86-F1-model_v4	DESULFOASV1_3448_hypothetical_protein	AF-Q8BW86-F1-model_v4 Rho guanine nucleotide exchange factor 33	0.141	217	181	11	227	1	212	8.414E-01	28
DESULFOASV1_3448_hypothetical_protein	AF-Q92617-F1-model_v4	DESULFOASV1_3448_hypothetical_protein	AF-Q92617-F1-model_v4 Nuclear pore complex-interacting protein family member B3	0.127	214	184	14	227	123	334	9.027E-01	28
DESULFOASV1_3448_hypothetical_protein	AF-P9WI43-F1-model_v4	DESULFOASV1_3448_hypothetical_protein	AF-P9WI43-F1-model_v4 PPE family protein PPE4	0.196	213	166	13	219	181	393	1.584E+00	27
DESULFOASV1_3448_hypothetical_protein	AF-Q967R6-F1-model_v4	DESULFOASV1_3448_hypothetical_protein	AF-Q967R6-F1-model_v4 Cytoplasmic polyadenylation element-binding protein	0.150	226	185	1	226	2	220	4.471E-01	27
DESULFOASV1_3448_hypothetical_protein	AF-P51827-F1-model_v4	DESULFOASV1_3448_hypothetical_protein	AF-P51827-F1-model_v4 AF4/FMR2 family member 3	0.114	187	160	46	227	6	192	1.196E+00	27
DESULFOASV1_3448_hypothetical_protein	AF-B4RDI3-F1-model_v4	DESULFOASV1_3448_hypothetical_protein	AF-B4RDI3-F1-model_v4 Sec-independent protein translocase protein TatB	0.190	192	139	25	216	6	178	2.589E+00	26
DESULFOASV1_3448_hypothetical_protein	AF-Q642A3-F1-model_v4	DESULFOASV1_3448_hypothetical_protein	AF-Q642A3-F1-model_v4 Protein FAM205C	0.108	221	183	21	226	1	221	1.584E+00	26
DESULFOASV1_3448_hypothetical_protein	AF-Q5ZK13-F1-model_v4	DESULFOASV1_3448_hypothetical_protein	AF-Q5ZK13-F1-model_v4 Centrosomal protein kizuna	0.113	218	184	10	227	1	209	2.097E+00	26
DESULFOASV1_3448_hypothetical_protein	AF-A5FV21-F1-model_v4	DESULFOASV1_3448_hypothetical_protein	AF-A5FV21-F1-model_v4 Translation initiation factor IF-2	0.214	226	153	1	226	56	251	4.168E-01	26
DESULFOASV1_3448_hypothetical_protein	AF-A6NJU9-F1-model_v4	DESULFOASV1_3448_hypothetical_protein	AF-A6NJU9-F1-model_v4 Nuclear pore complex-interacting protein family member B13	0.132	213	176	14	226	123	326	1.955E+00	26
DESULFOASV1_3448_hypothetical_protein	AF-E9Q743-F1-model_v4	DESULFOASV1_3448_hypothetical_protein	AF-E9Q743-F1-model_v4 Cilia- and flagella-associated protein 251	0.157	249	183	10	227	1	249	1.584E+00	26
DESULFOASV1_3448_hypothetical_protein	AF-Q2NXS1-F1-model_v4	DESULFOASV1_3448_hypothetical_protein	AF-Q2NXS1-F1-model_v4 Sec-independent protein translocase protein TatB	0.231	187	141	43	226	6	192	1.584E+00	25
DESULFOASV1_3448_hypothetical_protein	AF-Q8W2F2-F1-model_v4	DESULFOASV1_3448_hypothetical_protein	AF-Q8W2F2-F1-model_v4 Transcription factor bHLH11	0.129	254	197	1	227	12	265	1.376E+00	25
DESULFOASV1_3448_hypothetical_protein	AF-Q9C0E8-F1-model_v4	DESULFOASV1_3448_hypothetical_protein	AF-Q9C0E8-F1-model_v4 Endoplasmic reticulum junction formation protein lunapark	0.153	198	165	29	226	41	236	1.476E+00	25
DESULFOASV1_3448_hypothetical_protein	AF-Q5PQK4-F1-model_v4	DESULFOASV1_3448_hypothetical_protein	AF-Q5PQK4-F1-model_v4 BRCA1-A complex subunit RAP80	0.118	224	176	1	224	13	213	1.584E+00	25
DESULFOASV1_3448_hypothetical_protein	AF-Q2RMS0-F1-model_v4	DESULFOASV1_3448_hypothetical_protein	AF-Q2RMS0-F1-model_v4 Translation initiation factor IF-2	0.217	215	146	11	225	44	230	9.684E-01	25
DESULFOASV1_3448_hypothetical_protein	AF-Q5NB83-F1-model_v4	DESULFOASV1_3448_hypothetical_protein	AF-Q5NB83-F1-model_v4 Probable protein ABIL3	0.113	248	193	8	226	1	248	7.312E-01	24
DESULFOASV1_3448_hypothetical_protein	AF-Q9I9L0-F1-model_v4	DESULFOASV1_3448_hypothetical_protein	AF-Q9I9L0-F1-model_v4 Hairy/enhancer-of-split related with YRPW motif protein 2	0.155	294	191	1	227	14	307	1.955E+00	24
DESULFOASV1_3448_hypothetical_protein	AF-P49584-F1-model_v4	DESULFOASV1_3448_hypothetical_protein	AF-P49584-F1-model_v4 Choline-phosphate cytidylyltransferase A	0.147	175	146	17	191	192	363	1.822E+00	24
DESULFOASV1_3448_hypothetical_protein	AF-Q96M43-F1-model_v4	DESULFOASV1_3448_hypothetical_protein	AF-Q96M43-F1-model_v4 Neuroblastoma breakpoint family member 4	0.185	226	164	26	227	30	255	1.039E+00	24
DESULFOASV1_3448_hypothetical_protein	AF-Q9VG76-F1-model_v4	DESULFOASV1_3448_hypothetical_protein	AF-Q9VG76-F1-model_v4 c-Myc-binding protein homolog	0.205	208	138	20	227	1	175	2.250E+00	23
DESULFOASV1_3448_hypothetical_protein	AF-Q4UP02-F1-model_v4	DESULFOASV1_3448_hypothetical_protein	AF-Q4UP02-F1-model_v4 Sec-independent protein translocase protein TatB	0.214	199	149	25	223	5	195	1.114E+00	23
DESULFOASV1_3448_hypothetical_protein	AF-Q2K969-F1-model_v4	DESULFOASV1_3448_hypothetical_protein	AF-Q2K969-F1-model_v4 Sec-independent protein translocase protein TatB	0.257	195	134	46	227	6	200	1.955E+00	23
DESULFOASV1_3448_hypothetical_protein	AF-P19836-F1-model_v4	DESULFOASV1_3448_hypothetical_protein	AF-P19836-F1-model_v4 Choline-phosphate cytidylyltransferase A	0.147	175	146	17	191	192	363	2.414E+00	23
DESULFOASV1_3448_hypothetical_protein	AF-P49586-F1-model_v4	DESULFOASV1_3448_hypothetical_protein	AF-P49586-F1-model_v4 Choline-phosphate cytidylyltransferase A	0.137	175	148	17	191	192	363	2.250E+00	23
DESULFOASV1_3448_hypothetical_protein	AF-Q9R0A0-F1-model_v4	DESULFOASV1_3448_hypothetical_protein	AF-Q9R0A0-F1-model_v4 Peroxisomal membrane protein PEX14	0.129	243	197	1	227	79	321	1.476E+00	23
DESULFOASV1_3448_hypothetical_protein	AF-Q9Z2Z3-F1-model_v4	DESULFOASV1_3448_hypothetical_protein	AF-Q9Z2Z3-F1-model_v4 Peroxisomal membrane protein PEX14	0.134	236	190	8	227	86	321	1.584E+00	23
DESULFOASV1_3448_hypothetical_protein	AF-O35779-F1-model_v4	DESULFOASV1_3448_hypothetical_protein	AF-O35779-F1-model_v4 Class E basic helix-loop-helix protein 41	0.140	240	181	15	226	29	268	3.197E+00	23
DESULFOASV1_3448_hypothetical_protein	AF-Q5R891-F1-model_v4	DESULFOASV1_3448_hypothetical_protein	AF-Q5R891-F1-model_v4 Endoplasmic reticulum junction formation protein lunapark	0.162	198	163	29	226	41	236	2.250E+00	23
DESULFOASV1_3448_hypothetical_protein	AF-G0S7F3-F1-model_v4	DESULFOASV1_3448_hypothetical_protein	AF-G0S7F3-F1-model_v4 Nucleoporin GLE1	0.229	176	129	51	226	19	186	1.476E+00	23
DESULFOASV1_3448_hypothetical_protein	AF-Q80X53-F1-model_v4	DESULFOASV1_3448_hypothetical_protein	AF-Q80X53-F1-model_v4 Coiled-coil domain-containing protein 116	0.128	228	197	1	227	215	442	1.376E+00	23
DESULFOASV1_3448_hypothetical_protein	AF-Q08DR9-F1-model_v4	DESULFOASV1_3448_hypothetical_protein	AF-Q08DR9-F1-model_v4 Protein Spindly	0.140	207	170	28	226	323	529	3.679E+00	23
DESULFOASV1_3448_hypothetical_protein	AF-P18302-F1-model_v4	DESULFOASV1_3448_hypothetical_protein	AF-P18302-F1-model_v4 Drebrin	0.156	263	181	12	226	155	417	1.699E+00	23
DESULFOASV1_3448_hypothetical_protein	AF-P16649-F1-model_v4	DESULFOASV1_3448_hypothetical_protein	AF-P16649-F1-model_v4 General transcriptional corepressor TUP1	0.188	200	158	28	227	9	204	2.097E+00	23
DESULFOASV1_3448_hypothetical_protein	AF-P0CN42-F1-model_v4	DESULFOASV1_3448_hypothetical_protein	AF-P0CN42-F1-model_v4 Eukaryotic translation initiation factor 3 subunit A	0.167	215	167	26	227	723	937	2.589E+00	23
DESULFOASV1_3448_hypothetical_protein	AF-Q92974-F1-model_v4	DESULFOASV1_3448_hypothetical_protein	AF-Q92974-F1-model_v4 Rho guanine nucleotide exchange factor 2	0.150	271	192	1	227	686	956	2.589E+00	23
DESULFOASV1_3448_hypothetical_protein	AF-B3P211-F1-model_v4	DESULFOASV1_3448_hypothetical_protein	AF-B3P211-F1-model_v4 Eukaryotic translation initiation factor 3 subunit A	0.161	211	164	30	226	758	968	3.947E+00	23
DESULFOASV1_3448_hypothetical_protein	AF-Q52MB2-F1-model_v4	DESULFOASV1_3448_hypothetical_protein	AF-Q52MB2-F1-model_v4 Coiled-coil domain-containing protein 184	0.129	222	157	1	222	1	181	2.250E+00	22
DESULFOASV1_3448_hypothetical_protein	AF-Q4KMI4-F1-model_v4	DESULFOASV1_3448_hypothetical_protein	AF-Q4KMI4-F1-model_v4 Receptor expression-enhancing protein 2	0.132	215	173	27	226	32	246	3.197E+00	22
DESULFOASV1_3448_hypothetical_protein	AF-Q6AXW0-F1-model_v4	DESULFOASV1_3448_hypothetical_protein	AF-Q6AXW0-F1-model_v4 Borealin	0.131	190	145	56	223	3	192	2.980E+00	22
DESULFOASV1_3448_hypothetical_protein	AF-D3Z423-F1-model_v4	DESULFOASV1_3448_hypothetical_protein	AF-D3Z423-F1-model_v4 RING finger protein 212B	0.153	178	148	50	227	55	230	3.429E+00	22
DESULFOASV1_3448_hypothetical_protein	AF-Q8R105-F1-model_v4	DESULFOASV1_3448_hypothetical_protein	AF-Q8R105-F1-model_v4 Vacuolar protein sorting-associated protein 37C	0.178	219	164	26	226	29	247	2.980E+00	22
DESULFOASV1_3448_hypothetical_protein	AF-O94714-F1-model_v4	DESULFOASV1_3448_hypothetical_protein	AF-O94714-F1-model_v4 Protein spt2	0.164	219	171	22	227	1	219	1.699E+00	22
DESULFOASV1_3448_hypothetical_protein	AF-F1MS15-F1-model_v4	DESULFOASV1_3448_hypothetical_protein	AF-F1MS15-F1-model_v4 Pleckstrin homology domain-containing family A member 8	0.125	181	143	64	227	96	276	8.548E+00	22
DESULFOASV1_3448_hypothetical_protein	AF-Q6AXP4-F1-model_v4	DESULFOASV1_3448_hypothetical_protein	AF-Q6AXP4-F1-model_v4 Uncharacterized protein C2orf81 homolog	0.160	231	186	2	224	1	231	1.476E+00	22
DESULFOASV1_3448_hypothetical_protein	AF-Q9DAQ4-F1-model_v4	DESULFOASV1_3448_hypothetical_protein	AF-Q9DAQ4-F1-model_v4 Uncharacterized protein C2orf81 homolog	0.164	234	188	2	227	1	234	1.283E+00	22
DESULFOASV1_3448_hypothetical_protein	AF-Q923A2-F1-model_v4	DESULFOASV1_3448_hypothetical_protein	AF-Q923A2-F1-model_v4 Protein Spindly	0.162	211	167	28	227	324	534	2.589E+00	22
DESULFOASV1_3448_hypothetical_protein	AF-A4VPP0-F1-model_v4	DESULFOASV1_3448_hypothetical_protein	AF-A4VPP0-F1-model_v4 Translation initiation factor IF-2	0.217	159	108	69	227	98	236	1.955E+00	22
DESULFOASV1_3448_hypothetical_protein	AF-A0A2R6X6S3-F1-model_v4	DESULFOASV1_3448_hypothetical_protein	AF-A0A2R6X6S3-F1-model_v4 Protein SOSEKI	0.144	185	151	50	226	112	296	6.924E+00	22
DESULFOASV1_3448_hypothetical_protein	AF-A6ZU34-F1-model_v4	DESULFOASV1_3448_hypothetical_protein	AF-A6ZU34-F1-model_v4 Chromatin-remodeling ATPase INO80	0.131	227	194	4	227	22	248	3.197E+00	22
DESULFOASV1_3448_hypothetical_protein	AF-Q9BRK0-F1-model_v4	DESULFOASV1_3448_hypothetical_protein	AF-Q9BRK0-F1-model_v4 Receptor expression-enhancing protein 2	0.142	166	132	61	226	90	244	4.234E+00	21
DESULFOASV1_3448_hypothetical_protein	AF-Q3URK1-F1-model_v4	DESULFOASV1_3448_hypothetical_protein	AF-Q3URK1-F1-model_v4 Coiled-coil domain-containing protein 190	0.124	169	134	59	227	2	155	4.542E+00	21
DESULFOASV1_3448_hypothetical_protein	AF-Q9VLD6-F1-model_v4	DESULFOASV1_3448_hypothetical_protein	AF-Q9VLD6-F1-model_v4 Borealin	0.112	186	151	57	227	1	186	2.778E+00	21
DESULFOASV1_3448_hypothetical_protein	AF-Q8NEL0-F1-model_v4	DESULFOASV1_3448_hypothetical_protein	AF-Q8NEL0-F1-model_v4 Coiled-coil domain-containing protein 54	0.136	186	159	8	193	45	229	4.873E+00	21
DESULFOASV1_3448_hypothetical_protein	AF-P15276-F1-model_v4	DESULFOASV1_3448_hypothetical_protein	AF-P15276-F1-model_v4 Transcriptional regulatory protein AlgP	0.210	220	161	18	222	1	220	2.589E+00	21
DESULFOASV1_3448_hypothetical_protein	AF-A2VDA9-F1-model_v4	DESULFOASV1_3448_hypothetical_protein	AF-A2VDA9-F1-model_v4 Caveolae-associated protein 4	0.147	221	168	7	227	149	346	3.679E+00	21
DESULFOASV1_3448_hypothetical_protein	AF-Q6FRZ8-F1-model_v4	DESULFOASV1_3448_hypothetical_protein	AF-Q6FRZ8-F1-model_v4 bZip transcription factor GAP1	0.131	220	165	7	226	3	193	3.679E+00	21
DESULFOASV1_3448_hypothetical_protein	AF-A7MD70-F1-model_v4	DESULFOASV1_3448_hypothetical_protein	AF-A7MD70-F1-model_v4 Protein Spindly	0.176	221	167	23	226	312	532	2.414E+00	21
DESULFOASV1_3448_hypothetical_protein	AF-Q9M3B8-F1-model_v4	DESULFOASV1_3448_hypothetical_protein	AF-Q9M3B8-F1-model_v4 Phragmoplastin interacting protein 1	0.134	139	119	90	227	6	144	2.980E+00	21
DESULFOASV1_3448_hypothetical_protein	AF-Q6FJQ6-F1-model_v4	DESULFOASV1_3448_hypothetical_protein	AF-Q6FJQ6-F1-model_v4 Structure-specific endonuclease subunit SLX4	0.083	300	206	1	226	88	387	3.947E+00	21
DESULFOASV1_3448_hypothetical_protein	AF-Q9JIT3-F1-model_v4	DESULFOASV1_3448_hypothetical_protein	AF-Q9JIT3-F1-model_v4 Transducin-like enhancer protein 3	0.160	218	177	10	227	2	213	3.679E+00	21
DESULFOASV1_3448_hypothetical_protein	AF-A1TSK3-F1-model_v4	DESULFOASV1_3448_hypothetical_protein	AF-A1TSK3-F1-model_v4 Translation initiation factor IF-2	0.193	239	178	6	226	98	336	3.947E+00	21
DESULFOASV1_3448_hypothetical_protein	AF-B0XP13-F1-model_v4	DESULFOASV1_3448_hypothetical_protein	AF-B0XP13-F1-model_v4 Eukaryotic translation initiation factor 3 subunit A	0.193	224	157	28	223	781	1004	1.699E+00	21
DESULFOASV1_3448_hypothetical_protein	AF-Q89KZ8-F1-model_v4	DESULFOASV1_3448_hypothetical_protein	AF-Q89KZ8-F1-model_v4 Sec-independent protein translocase protein TatB	0.226	193	130	30	222	7	175	3.197E+00	20
DESULFOASV1_3448_hypothetical_protein	AF-Q9SN74-F1-model_v4	DESULFOASV1_3448_hypothetical_protein	AF-Q9SN74-F1-model_v4 Transcription factor bHLH47	0.146	219	184	1	219	1	217	3.197E+00	20
DESULFOASV1_3448_hypothetical_protein	AF-P50541-F1-model_v4	DESULFOASV1_3448_hypothetical_protein	AF-P50541-F1-model_v4 Max-interacting protein 1	0.109	191	168	1	190	46	236	5.608E+00	20
DESULFOASV1_3448_hypothetical_protein	AF-P86347-F1-model_v4	DESULFOASV1_3448_hypothetical_protein	AF-P86347-F1-model_v4 Borealin-2	0.141	217	151	11	227	1	177	1.584E+00	20
DESULFOASV1_3448_hypothetical_protein	AF-Q9Z1H9-F1-model_v4	DESULFOASV1_3448_hypothetical_protein	AF-Q9Z1H9-F1-model_v4 Caveolae-associated protein 3	0.182	252	179	8	227	2	253	2.778E+00	20
DESULFOASV1_3448_hypothetical_protein	AF-P75330-F1-model_v4	DESULFOASV1_3448_hypothetical_protein	AF-P75330-F1-model_v4 P30 adhesin	0.168	244	171	21	226	1	244	2.980E+00	20
DESULFOASV1_3448_hypothetical_protein	AF-Q4V7H8-F1-model_v4	DESULFOASV1_3448_hypothetical_protein	AF-Q4V7H8-F1-model_v4 Borealin-2	0.118	225	185	2	226	1	211	6.454E+00	20
DESULFOASV1_3448_hypothetical_protein	AF-Q8L999-F1-model_v4	DESULFOASV1_3448_hypothetical_protein	AF-Q8L999-F1-model_v4 Protein BASIC PENTACYSTEINE6	0.171	222	152	5	226	2	185	1.699E+00	20
DESULFOASV1_3448_hypothetical_protein	AF-A7TP22-F1-model_v4	DESULFOASV1_3448_hypothetical_protein	AF-A7TP22-F1-model_v4 Biogenesis of lysosome-related organelles complex 1 subunit VAB2	0.131	197	168	28	224	70	263	7.427E+00	20
DESULFOASV1_3448_hypothetical_protein	AF-O54724-F1-model_v4	DESULFOASV1_3448_hypothetical_protein	AF-O54724-F1-model_v4 Caveolae-associated protein 1	0.169	200	160	1	194	17	216	6.454E+00	20
DESULFOASV1_3448_hypothetical_protein	AF-Q9FIT1-F1-model_v4	DESULFOASV1_3448_hypothetical_protein	AF-Q9FIT1-F1-model_v4 AT5g62070/mtg10_90	0.141	252	194	1	227	29	280	4.542E+00	20
DESULFOASV1_3448_hypothetical_protein	AF-Q9UJU6-F1-model_v4	DESULFOASV1_3448_hypothetical_protein	AF-Q9UJU6-F1-model_v4 Drebrin-like protein	0.140	207	177	13	219	153	359	6.454E+00	20
DESULFOASV1_3448_hypothetical_protein	AF-Q4R7B9-F1-model_v4	DESULFOASV1_3448_hypothetical_protein	AF-Q4R7B9-F1-model_v4 RUN domain-containing protein 3B	0.122	229	176	15	216	228	456	3.947E+00	20
DESULFOASV1_3448_hypothetical_protein	AF-Q9CXH7-F1-model_v4	DESULFOASV1_3448_hypothetical_protein	AF-Q9CXH7-F1-model_v4 Shugoshin 1	0.128	211	181	17	227	1	209	6.924E+00	20
DESULFOASV1_3448_hypothetical_protein	AF-A2CI98-F1-model_v4	DESULFOASV1_3448_hypothetical_protein	AF-A2CI98-F1-model_v4 Dystrotelin	0.108	227	181	1	227	343	546	4.873E+00	20
DESULFOASV1_3448_hypothetical_protein	AF-B4HMH2-F1-model_v4	DESULFOASV1_3448_hypothetical_protein	AF-B4HMH2-F1-model_v4 Protein teflon	0.109	227	176	1	227	105	302	2.980E+00	20
DESULFOASV1_3448_hypothetical_protein	AF-P56094-F1-model_v4	DESULFOASV1_3448_hypothetical_protein	AF-P56094-F1-model_v4 General transcriptional corepressor TUP1	0.152	202	153	26	227	6	186	6.016E+00	20
DESULFOASV1_3448_hypothetical_protein	AF-Q9QX75-F1-model_v4	DESULFOASV1_3448_hypothetical_protein	AF-Q9QX75-F1-model_v4 Triadin	0.147	217	163	1	217	13	204	3.947E+00	20
DESULFOASV1_3448_hypothetical_protein	AF-A0JNH1-F1-model_v4	DESULFOASV1_3448_hypothetical_protein	AF-A0JNH1-F1-model_v4 Centrosomal protein kizuna	0.130	226	191	8	227	1	226	8.548E+00	20
DESULFOASV1_3448_hypothetical_protein	AF-Q03173-F1-model_v4	DESULFOASV1_3448_hypothetical_protein	AF-Q03173-F1-model_v4 Protein enabled homolog	0.125	215	176	8	222	138	339	3.679E+00	20
DESULFOASV1_3448_hypothetical_protein	AF-Q6FKB1-F1-model_v4	DESULFOASV1_3448_hypothetical_protein	AF-Q6FKB1-F1-model_v4 Histone-lysine N-methyltransferase, H3 lysine-4 specific	0.115	224	163	4	227	540	724	4.873E+00	20
DESULFOASV1_3448_hypothetical_protein	AF-Q07DY4-F1-model_v4	DESULFOASV1_3448_hypothetical_protein	AF-Q07DY4-F1-model_v4 Cortactin-binding protein 2	0.142	200	162	28	227	168	357	3.947E+00	20
DESULFOASV1_3448_hypothetical_protein	AF-Q80XH1-F1-model_v4	DESULFOASV1_3448_hypothetical_protein	AF-Q80XH1-F1-model_v4 KxDL motif-containing protein 1	0.146	176	145	21	191	1	176	7.427E+00	19
DESULFOASV1_3448_hypothetical_protein	AF-Q2NWT7-F1-model_v4	DESULFOASV1_3448_hypothetical_protein	AF-Q2NWT7-F1-model_v4 Sec-independent protein translocase protein TatB	0.193	202	160	25	226	5	203	3.679E+00	19
DESULFOASV1_3448_hypothetical_protein	AF-Q9JMG6-F1-model_v4	DESULFOASV1_3448_hypothetical_protein	AF-Q9JMG6-F1-model_v4 TCF3 fusion partner homolog	0.156	200	154	25	224	53	236	6.016E+00	19
DESULFOASV1_3448_hypothetical_protein	AF-Q8R0J7-F1-model_v4	DESULFOASV1_3448_hypothetical_protein	AF-Q8R0J7-F1-model_v4 Vacuolar protein sorting-associated protein 37B	0.184	205	162	28	226	40	244	4.873E+00	19
DESULFOASV1_3448_hypothetical_protein	AF-F6TQD1-F1-model_v4	DESULFOASV1_3448_hypothetical_protein	AF-F6TQD1-F1-model_v4 Probable E3 SUMO-protein ligase RNF212	0.159	184	143	56	226	56	239	5.227E+00	19
DESULFOASV1_3448_hypothetical_protein	AF-Q5R8Y4-F1-model_v4	DESULFOASV1_3448_hypothetical_protein	AF-Q5R8Y4-F1-model_v4 Leucine zipper protein 2	0.147	201	169	26	226	104	302	6.454E+00	19
DESULFOASV1_3448_hypothetical_protein	AF-Q2YDJ5-F1-model_v4	DESULFOASV1_3448_hypothetical_protein	AF-Q2YDJ5-F1-model_v4 Uncharacterized protein CXorf66 homolog	0.139	200	152	28	227	2	178	3.197E+00	19
DESULFOASV1_3448_hypothetical_protein	AF-Q8BW22-F1-model_v4	DESULFOASV1_3448_hypothetical_protein	AF-Q8BW22-F1-model_v4 Calcium-responsive transactivator	0.127	172	142	56	227	10	173	5.608E+00	19
DESULFOASV1_3448_hypothetical_protein	AF-A6QLR3-F1-model_v4	DESULFOASV1_3448_hypothetical_protein	AF-A6QLR3-F1-model_v4 BRISC complex subunit Abraxas 2	0.119	213	161	14	226	172	355	3.197E+00	19
DESULFOASV1_3448_hypothetical_protein	AF-Q9D489-F1-model_v4	DESULFOASV1_3448_hypothetical_protein	AF-Q9D489-F1-model_v4 Spermatogenesis- and oogenesis-specific basic helix-loop-helix-containing protein 2	0.136	215	159	13	227	181	365	4.873E+00	19
DESULFOASV1_3448_hypothetical_protein	AF-Q86XZ4-F1-model_v4	DESULFOASV1_3448_hypothetical_protein	AF-Q86XZ4-F1-model_v4 Spermatogenesis-associated serine-rich protein 2	0.170	261	188	1	227	199	459	4.234E+00	19
DESULFOASV1_3448_hypothetical_protein	AF-Q4X1V0-F1-model_v4	DESULFOASV1_3448_hypothetical_protein	AF-Q4X1V0-F1-model_v4 Nuclear distribution protein nudE homolog 1	0.131	227	182	18	227	89	315	4.542E+00	19
DESULFOASV1_3448_hypothetical_protein	AF-Q62871-F1-model_v4	DESULFOASV1_3448_hypothetical_protein	AF-Q62871-F1-model_v4 Cytoplasmic dynein 1 intermediate chain 2	0.178	168	134	64	227	5	172	5.608E+00	19
DESULFOASV1_3448_hypothetical_protein	AF-Q9NYZ3-F1-model_v4	DESULFOASV1_3448_hypothetical_protein	AF-Q9NYZ3-F1-model_v4 G2 and S phase-expressed protein 1	0.147	225	165	3	227	54	248	4.234E+00	19
DESULFOASV1_3448_hypothetical_protein	AF-Q9WVS8-F1-model_v4	DESULFOASV1_3448_hypothetical_protein	AF-Q9WVS8-F1-model_v4 Mitogen-activated protein kinase 7	0.182	232	182	1	224	441	672	3.197E+00	19
DESULFOASV1_3448_hypothetical_protein	AF-B7V1F6-F1-model_v4	DESULFOASV1_3448_hypothetical_protein	AF-B7V1F6-F1-model_v4 Translation initiation factor IF-2	0.218	159	110	69	227	98	239	4.542E+00	19
DESULFOASV1_3448_hypothetical_protein	AF-A8MVX0-F1-model_v4	DESULFOASV1_3448_hypothetical_protein	AF-A8MVX0-F1-model_v4 Rho guanine nucleotide exchange factor 33	0.156	221	182	6	226	2	218	3.947E+00	19
DESULFOASV1_3448_hypothetical_protein	AF-O94880-F1-model_v4	DESULFOASV1_3448_hypothetical_protein	AF-O94880-F1-model_v4 PHD finger protein 14	0.133	227	171	1	227	33	230	4.234E+00	19
DESULFOASV1_3448_hypothetical_protein	AF-O74522-F1-model_v4	DESULFOASV1_3448_hypothetical_protein	AF-O74522-F1-model_v4 Adhesion defective protein 3	0.115	231	199	1	226	517	747	7.427E+00	19
DESULFOASV1_3448_hypothetical_protein	AF-Q9BQD3-F1-model_v4	DESULFOASV1_3448_hypothetical_protein	AF-Q9BQD3-F1-model_v4 KxDL motif-containing protein 1	0.152	176	144	21	191	1	176	6.924E+00	18
DESULFOASV1_3448_hypothetical_protein	AF-Q3SZV2-F1-model_v4	DESULFOASV1_3448_hypothetical_protein	AF-Q3SZV2-F1-model_v4 KxDL motif-containing protein 1	0.152	176	144	21	191	1	176	6.454E+00	18
DESULFOASV1_3448_hypothetical_protein	AF-Q9D6J3-F1-model_v4	DESULFOASV1_3448_hypothetical_protein	AF-Q9D6J3-F1-model_v4 Splicing factor YJU2	0.188	214	161	14	227	101	299	9.170E+00	18
DESULFOASV1_3448_hypothetical_protein	AF-Q1KKR9-F1-model_v4	DESULFOASV1_3448_hypothetical_protein	AF-Q1KKR9-F1-model_v4 Endoplasmic reticulum junction formation protein lunapark-B	0.143	195	162	29	223	41	230	9.837E+00	18
DESULFOASV1_3448_hypothetical_protein	AF-Q08E31-F1-model_v4	DESULFOASV1_3448_hypothetical_protein	AF-Q08E31-F1-model_v4 Calcium-responsive transactivator	0.139	172	140	56	227	10	173	7.427E+00	18
DESULFOASV1_3448_hypothetical_protein	AF-P24813-F1-model_v4	DESULFOASV1_3448_hypothetical_protein	AF-P24813-F1-model_v4 AP-1-like transcription factor YAP2	0.153	222	179	16	227	28	249	9.170E+00	18
DESULFOASV1_3448_hypothetical_protein	AF-P63016-F1-model_v4	DESULFOASV1_3448_hypothetical_protein	AF-P63016-F1-model_v4 Paired box protein Pax-6	0.123	226	175	1	226	170	370	1.955E+00	18
DESULFOASV1_3448_hypothetical_protein	AF-P55864-F1-model_v4	DESULFOASV1_3448_hypothetical_protein	AF-P55864-F1-model_v4 Paired box protein Pax-6	0.122	226	176	1	226	170	370	4.234E+00	18
DESULFOASV1_3448_hypothetical_protein	AF-Q62418-F1-model_v4	DESULFOASV1_3448_hypothetical_protein	AF-Q62418-F1-model_v4 Drebrin-like protein	0.163	205	150	42	221	167	371	8.548E+00	18
