query	target	qheader	theader	fident	alnlen	mismatch	qstart	qend	tstart	tend	evalue	bits
DESULFOASV1_1894_YraN_family_protein	AF-A1VFE8-F1-model_v4	DESULFOASV1_1894_YraN_family_protein	AF-A1VFE8-F1-model_v4 UPF0102 protein Dvul_2148	0.459	135	70	3	137	4	134	8.823E-17	550
DESULFOASV1_1894_YraN_family_protein	AF-Q72DU6-F1-model_v4	DESULFOASV1_1894_YraN_family_protein	AF-Q72DU6-F1-model_v4 UPF0102 protein DVU_0833	0.443	133	72	5	137	5	134	3.465E-16	540
DESULFOASV1_1894_YraN_family_protein	AF-Q39RP2-F1-model_v4	DESULFOASV1_1894_YraN_family_protein	AF-Q39RP2-F1-model_v4 UPF0102 protein Gmet_2864	0.389	118	70	5	122	5	119	1.802E-13	476
DESULFOASV1_1894_YraN_family_protein	AF-Q74FF9-F1-model_v4	DESULFOASV1_1894_YraN_family_protein	AF-Q74FF9-F1-model_v4 UPF0102 protein GSU0650	0.381	118	71	5	122	10	125	2.843E-13	467
DESULFOASV1_1894_YraN_family_protein	AF-B9M598-F1-model_v4	DESULFOASV1_1894_YraN_family_protein	AF-B9M598-F1-model_v4 UPF0102 protein Geob_1494	0.414	111	63	12	122	16	124	2.495E-13	464
DESULFOASV1_1894_YraN_family_protein	AF-Q6AJE4-F1-model_v4	DESULFOASV1_1894_YraN_family_protein	AF-Q6AJE4-F1-model_v4 UPF0102 protein DP2807	0.419	124	70	5	128	5	126	1.219E-13	460
DESULFOASV1_1894_YraN_family_protein	AF-Q3AP35-F1-model_v4	DESULFOASV1_1894_YraN_family_protein	AF-Q3AP35-F1-model_v4 UPF0102 protein Cag_1992	0.403	118	69	6	121	8	125	1.388E-13	460
DESULFOASV1_1894_YraN_family_protein	AF-B0RVB9-F1-model_v4	DESULFOASV1_1894_YraN_family_protein	AF-B0RVB9-F1-model_v4 UPF0102 protein xcc-b100_3645	0.404	125	72	1	125	1	121	6.630E-13	453
DESULFOASV1_1894_YraN_family_protein	AF-Q1MRU7-F1-model_v4	DESULFOASV1_1894_YraN_family_protein	AF-Q1MRU7-F1-model_v4 UPF0102 protein LI0223	0.371	132	81	6	137	4	132	8.245E-14	451
DESULFOASV1_1894_YraN_family_protein	AF-Q0S2B2-F1-model_v4	DESULFOASV1_1894_YraN_family_protein	AF-Q0S2B2-F1-model_v4 UPF0102 protein RHA1_ro06551	0.420	119	67	3	121	2	118	4.202E-13	449
DESULFOASV1_1894_YraN_family_protein	AF-A5G7Z1-F1-model_v4	DESULFOASV1_1894_YraN_family_protein	AF-A5G7Z1-F1-model_v4 UPF0102 protein Gura_3756	0.383	120	72	3	122	7	124	6.630E-13	448
DESULFOASV1_1894_YraN_family_protein	AF-C0QKT7-F1-model_v4	DESULFOASV1_1894_YraN_family_protein	AF-C0QKT7-F1-model_v4 UPF0102 protein HRM2_30940	0.367	117	72	5	121	5	118	9.182E-13	446
DESULFOASV1_1894_YraN_family_protein	AF-A5N821-F1-model_v4	DESULFOASV1_1894_YraN_family_protein	AF-A5N821-F1-model_v4 UPF0102 protein CKL_1410	0.322	121	81	1	121	1	120	1.046E-12	445
DESULFOASV1_1894_YraN_family_protein	AF-Q4UQV6-F1-model_v4	DESULFOASV1_1894_YraN_family_protein	AF-Q4UQV6-F1-model_v4 UPF0102 protein XC_3524	0.404	125	72	1	125	1	121	1.357E-12	442
DESULFOASV1_1894_YraN_family_protein	AF-C1B2T3-F1-model_v4	DESULFOASV1_1894_YraN_family_protein	AF-C1B2T3-F1-model_v4 UPF0102 protein ROP_66030	0.428	119	66	3	121	2	118	7.076E-13	441
DESULFOASV1_1894_YraN_family_protein	AF-A5D1I2-F1-model_v4	DESULFOASV1_1894_YraN_family_protein	AF-A5D1I2-F1-model_v4 UPF0102 protein PTH_1707	0.446	121	66	1	121	1	120	2.142E-12	440
DESULFOASV1_1894_YraN_family_protein	AF-Q8PCL4-F1-model_v4	DESULFOASV1_1894_YraN_family_protein	AF-Q8PCL4-F1-model_v4 UPF0102 protein XCC0710	0.404	125	72	1	125	1	121	1.546E-12	439
DESULFOASV1_1894_YraN_family_protein	AF-Q8KAA4-F1-model_v4	DESULFOASV1_1894_YraN_family_protein	AF-Q8KAA4-F1-model_v4 UPF0102 protein CT2262	0.409	124	72	8	131	7	129	4.787E-13	432
DESULFOASV1_1894_YraN_family_protein	AF-Q8PPC2-F1-model_v4	DESULFOASV1_1894_YraN_family_protein	AF-Q8PPC2-F1-model_v4 UPF0102 protein XAC0764	0.396	125	72	1	125	1	121	3.166E-12	428
DESULFOASV1_1894_YraN_family_protein	AF-Q64YH3-F1-model_v4	DESULFOASV1_1894_YraN_family_protein	AF-Q64YH3-F1-model_v4 UPF0102 protein BF0706	0.393	117	68	5	121	4	116	3.379E-12	427
DESULFOASV1_1894_YraN_family_protein	AF-Q5LHJ8-F1-model_v4	DESULFOASV1_1894_YraN_family_protein	AF-Q5LHJ8-F1-model_v4 UPF0102 protein BF0634	0.393	117	68	5	121	4	116	3.166E-12	427
DESULFOASV1_1894_YraN_family_protein	AF-Q5GW28-F1-model_v4	DESULFOASV1_1894_YraN_family_protein	AF-Q5GW28-F1-model_v4 UPF0102 protein XOO3839	0.396	125	72	1	125	1	121	3.379E-12	427
DESULFOASV1_1894_YraN_family_protein	AF-Q2NZA5-F1-model_v4	DESULFOASV1_1894_YraN_family_protein	AF-Q2NZA5-F1-model_v4 UPF0102 protein XOO3617	0.396	125	72	1	125	1	121	3.849E-12	427
DESULFOASV1_1894_YraN_family_protein	AF-B2SNY1-F1-model_v4	DESULFOASV1_1894_YraN_family_protein	AF-B2SNY1-F1-model_v4 UPF0102 protein PXO_04380	0.396	125	72	1	125	1	121	3.379E-12	427
DESULFOASV1_1894_YraN_family_protein	AF-A1AN88-F1-model_v4	DESULFOASV1_1894_YraN_family_protein	AF-A1AN88-F1-model_v4 UPF0102 protein Ppro_1186	0.400	118	70	5	122	20	137	2.286E-12	427
DESULFOASV1_1894_YraN_family_protein	AF-Q8A5K3-F1-model_v4	DESULFOASV1_1894_YraN_family_protein	AF-Q8A5K3-F1-model_v4 UPF0102 protein BT_2236	0.410	117	66	5	121	4	116	2.966E-12	426
DESULFOASV1_1894_YraN_family_protein	AF-Q3Z8D6-F1-model_v4	DESULFOASV1_1894_YraN_family_protein	AF-Q3Z8D6-F1-model_v4 UPF0102 protein DET0781	0.333	120	77	1	120	1	117	1.880E-12	425
DESULFOASV1_1894_YraN_family_protein	AF-A6LSN5-F1-model_v4	DESULFOASV1_1894_YraN_family_protein	AF-A6LSN5-F1-model_v4 UPF0102 protein Cbei_1183	0.324	117	78	5	121	5	120	5.331E-12	425
DESULFOASV1_1894_YraN_family_protein	AF-Q3A2F1-F1-model_v4	DESULFOASV1_1894_YraN_family_protein	AF-Q3A2F1-F1-model_v4 UPF0102 protein Pcar_2217	0.415	118	67	5	122	5	119	4.995E-12	424
DESULFOASV1_1894_YraN_family_protein	AF-B3EDP4-F1-model_v4	DESULFOASV1_1894_YraN_family_protein	AF-B3EDP4-F1-model_v4 UPF0102 protein Clim_0016	0.367	117	72	8	121	8	124	1.761E-12	424
DESULFOASV1_1894_YraN_family_protein	AF-Q3BXG6-F1-model_v4	DESULFOASV1_1894_YraN_family_protein	AF-Q3BXG6-F1-model_v4 UPF0102 protein XCV0816	0.396	125	72	1	125	1	121	4.108E-12	423
DESULFOASV1_1894_YraN_family_protein	AF-A7NKS5-F1-model_v4	DESULFOASV1_1894_YraN_family_protein	AF-A7NKS5-F1-model_v4 UPF0102 protein Rcas_2007	0.398	122	73	1	122	1	122	1.192E-12	423
DESULFOASV1_1894_YraN_family_protein	AF-B3QQX9-F1-model_v4	DESULFOASV1_1894_YraN_family_protein	AF-B3QQX9-F1-model_v4 UPF0102 protein Cpar_0015	0.370	124	77	8	131	7	129	1.116E-12	423
DESULFOASV1_1894_YraN_family_protein	AF-A0Q0X6-F1-model_v4	DESULFOASV1_1894_YraN_family_protein	AF-A0Q0X6-F1-model_v4 UPF0102 protein NT01CX_2205	0.290	117	82	5	121	5	120	6.918E-12	422
DESULFOASV1_1894_YraN_family_protein	AF-Q1D6H9-F1-model_v4	DESULFOASV1_1894_YraN_family_protein	AF-Q1D6H9-F1-model_v4 UPF0102 protein MXAN_3551	0.375	120	73	3	122	7	123	2.779E-12	422
DESULFOASV1_1894_YraN_family_protein	AF-Q2LVT7-F1-model_v4	DESULFOASV1_1894_YraN_family_protein	AF-Q2LVT7-F1-model_v4 UPF0102 protein SYNAS_23220	0.368	125	75	5	129	8	127	2.440E-12	419
DESULFOASV1_1894_YraN_family_protein	AF-A0LCU4-F1-model_v4	DESULFOASV1_1894_YraN_family_protein	AF-A0LCU4-F1-model_v4 UPF0102 protein Mmc1_3298	0.365	114	70	8	121	9	120	5.690E-12	416
DESULFOASV1_1894_YraN_family_protein	AF-Q4ZNX8-F1-model_v4	DESULFOASV1_1894_YraN_family_protein	AF-Q4ZNX8-F1-model_v4 UPF0102 protein Psyr_4114	0.319	118	79	5	122	6	122	4.995E-12	413
DESULFOASV1_1894_YraN_family_protein	AF-A4XQR2-F1-model_v4	DESULFOASV1_1894_YraN_family_protein	AF-A4XQR2-F1-model_v4 UPF0102 protein Pmen_0910	0.352	118	74	5	122	4	118	3.606E-12	412
DESULFOASV1_1894_YraN_family_protein	AF-A6GVQ6-F1-model_v4	DESULFOASV1_1894_YraN_family_protein	AF-A6GVQ6-F1-model_v4 UPF0102 protein FP2501	0.352	119	74	3	121	2	116	6.918E-12	410
DESULFOASV1_1894_YraN_family_protein	AF-Q2RJT6-F1-model_v4	DESULFOASV1_1894_YraN_family_protein	AF-Q2RJT6-F1-model_v4 UPF0102 protein Moth_0988	0.448	115	62	7	121	7	120	1.327E-11	410
DESULFOASV1_1894_YraN_family_protein	AF-Q3ZXD5-F1-model_v4	DESULFOASV1_1894_YraN_family_protein	AF-Q3ZXD5-F1-model_v4 UPF0102 protein cbdbA757	0.377	114	69	7	120	7	117	7.383E-12	410
DESULFOASV1_1894_YraN_family_protein	AF-A1U3H0-F1-model_v4	DESULFOASV1_1894_YraN_family_protein	AF-A1U3H0-F1-model_v4 UPF0102 protein Maqu_2464	0.330	120	79	1	120	1	119	1.650E-12	410
DESULFOASV1_1894_YraN_family_protein	AF-Q2JWH1-F1-model_v4	DESULFOASV1_1894_YraN_family_protein	AF-Q2JWH1-F1-model_v4 UPF0102 protein CYA_0680	0.384	124	73	3	122	8	131	1.761E-12	410
DESULFOASV1_1894_YraN_family_protein	AF-Q313K2-F1-model_v4	DESULFOASV1_1894_YraN_family_protein	AF-Q313K2-F1-model_v4 UPF0102 protein Dde_1093	0.331	190	88	5	137	13	202	4.385E-12	410
DESULFOASV1_1894_YraN_family_protein	AF-A5FR87-F1-model_v4	DESULFOASV1_1894_YraN_family_protein	AF-A5FR87-F1-model_v4 UPF0102 protein DehaBAV1_0707	0.377	114	69	7	120	7	117	6.918E-12	409
DESULFOASV1_1894_YraN_family_protein	AF-Q2S1J6-F1-model_v4	DESULFOASV1_1894_YraN_family_protein	AF-Q2S1J6-F1-model_v4 UPF0102 protein SRU_1822	0.431	114	64	8	121	7	119	4.995E-12	408
DESULFOASV1_1894_YraN_family_protein	AF-Q87WX3-F1-model_v4	DESULFOASV1_1894_YraN_family_protein	AF-Q87WX3-F1-model_v4 UPF0102 protein PSPTO_4420	0.311	122	81	4	122	6	127	5.331E-12	407
DESULFOASV1_1894_YraN_family_protein	AF-B0U468-F1-model_v4	DESULFOASV1_1894_YraN_family_protein	AF-B0U468-F1-model_v4 UPF0102 protein Xfasm12_1748	0.372	117	70	9	125	8	120	9.581E-12	406
DESULFOASV1_1894_YraN_family_protein	AF-Q895L7-F1-model_v4	DESULFOASV1_1894_YraN_family_protein	AF-Q895L7-F1-model_v4 UPF0102 protein CTC_01256	0.305	121	83	1	121	1	120	6.918E-12	406
DESULFOASV1_1894_YraN_family_protein	AF-Q2IJ48-F1-model_v4	DESULFOASV1_1894_YraN_family_protein	AF-Q2IJ48-F1-model_v4 UPF0102 protein Adeh_1910	0.385	122	72	5	126	12	129	1.243E-11	406
DESULFOASV1_1894_YraN_family_protein	AF-Q7MTS0-F1-model_v4	DESULFOASV1_1894_YraN_family_protein	AF-Q7MTS0-F1-model_v4 UPF0102 protein PG_1874	0.404	121	70	1	121	1	118	8.977E-12	404
DESULFOASV1_1894_YraN_family_protein	AF-A8MHC8-F1-model_v4	DESULFOASV1_1894_YraN_family_protein	AF-A8MHC8-F1-model_v4 UPF0102 protein Clos_1471	0.367	115	72	7	121	4	117	9.581E-12	403
DESULFOASV1_1894_YraN_family_protein	AF-Q67PD3-F1-model_v4	DESULFOASV1_1894_YraN_family_protein	AF-Q67PD3-F1-model_v4 UPF0102 protein STH1475	0.442	113	61	9	121	6	116	5.331E-12	403
DESULFOASV1_1894_YraN_family_protein	AF-A8ZV12-F1-model_v4	DESULFOASV1_1894_YraN_family_protein	AF-A8ZV12-F1-model_v4 UPF0102 protein Dole_2298	0.403	124	70	5	128	5	123	2.966E-12	403
DESULFOASV1_1894_YraN_family_protein	AF-A9B5H2-F1-model_v4	DESULFOASV1_1894_YraN_family_protein	AF-A9B5H2-F1-model_v4 UPF0102 protein Haur_0145	0.300	120	83	1	119	1	120	2.440E-12	403
DESULFOASV1_1894_YraN_family_protein	AF-Q87B72-F1-model_v4	DESULFOASV1_1894_YraN_family_protein	AF-Q87B72-F1-model_v4 UPF0102 protein PD_1586	0.372	117	70	9	125	8	120	1.327E-11	402
DESULFOASV1_1894_YraN_family_protein	AF-A3Q9F0-F1-model_v4	DESULFOASV1_1894_YraN_family_protein	AF-A3Q9F0-F1-model_v4 UPF0102 protein Shew_0226	0.314	121	77	1	121	2	114	1.613E-11	401
DESULFOASV1_1894_YraN_family_protein	AF-Q18BD4-F1-model_v4	DESULFOASV1_1894_YraN_family_protein	AF-Q18BD4-F1-model_v4 UPF0102 protein CD630_12710	0.365	115	69	7	121	5	114	1.962E-11	400
DESULFOASV1_1894_YraN_family_protein	AF-A4VIG6-F1-model_v4	DESULFOASV1_1894_YraN_family_protein	AF-A4VIG6-F1-model_v4 UPF0102 protein PST_1070	0.344	118	75	5	122	4	119	1.243E-11	400
DESULFOASV1_1894_YraN_family_protein	AF-A6L1J0-F1-model_v4	DESULFOASV1_1894_YraN_family_protein	AF-A6L1J0-F1-model_v4 UPF0102 protein BVU_1879	0.358	117	72	5	121	4	116	1.838E-11	400
DESULFOASV1_1894_YraN_family_protein	AF-Q48EE6-F1-model_v4	DESULFOASV1_1894_YraN_family_protein	AF-Q48EE6-F1-model_v4 UPF0102 protein PSPPH_4120	0.319	118	79	5	122	6	122	1.512E-11	400
DESULFOASV1_1894_YraN_family_protein	AF-Q1QVF6-F1-model_v4	DESULFOASV1_1894_YraN_family_protein	AF-Q1QVF6-F1-model_v4 UPF0102 protein Csal_2201	0.361	118	72	5	122	8	121	7.880E-12	399
DESULFOASV1_1894_YraN_family_protein	AF-B4S950-F1-model_v4	DESULFOASV1_1894_YraN_family_protein	AF-B4S950-F1-model_v4 UPF0102 protein Paes_0016	0.381	118	71	7	121	7	124	1.722E-11	399
DESULFOASV1_1894_YraN_family_protein	AF-Q8XJQ1-F1-model_v4	DESULFOASV1_1894_YraN_family_protein	AF-Q8XJQ1-F1-model_v4 UPF0102 protein CPE1705	0.338	121	79	1	121	1	120	9.581E-12	396
DESULFOASV1_1894_YraN_family_protein	AF-A6VB97-F1-model_v4	DESULFOASV1_1894_YraN_family_protein	AF-A6VB97-F1-model_v4 UPF0102 protein PSPA7_4996	0.333	120	79	3	122	5	124	1.613E-11	394
DESULFOASV1_1894_YraN_family_protein	AF-Q2J704-F1-model_v4	DESULFOASV1_1894_YraN_family_protein	AF-Q2J704-F1-model_v4 UPF0102 protein Francci3_3586	0.434	115	63	7	121	6	118	8.411E-12	393
DESULFOASV1_1894_YraN_family_protein	AF-Q3K732-F1-model_v4	DESULFOASV1_1894_YraN_family_protein	AF-Q3K732-F1-model_v4 UPF0102 protein Pfl01_4685	0.352	118	73	5	122	6	119	1.838E-11	393
DESULFOASV1_1894_YraN_family_protein	AF-A4X4J0-F1-model_v4	DESULFOASV1_1894_YraN_family_protein	AF-A4X4J0-F1-model_v4 UPF0102 protein Strop_1320	0.353	116	72	6	121	9	121	4.883E-11	393
DESULFOASV1_1894_YraN_family_protein	AF-Q5YS49-F1-model_v4	DESULFOASV1_1894_YraN_family_protein	AF-Q5YS49-F1-model_v4 UPF0102 protein NFA_41430	0.406	117	68	5	121	13	127	2.235E-11	393
DESULFOASV1_1894_YraN_family_protein	AF-A4SC34-F1-model_v4	DESULFOASV1_1894_YraN_family_protein	AF-A4SC34-F1-model_v4 UPF0102 protein Cvib_0014	0.373	123	76	8	130	9	131	6.481E-12	393
DESULFOASV1_1894_YraN_family_protein	AF-B7I8W9-F1-model_v4	DESULFOASV1_1894_YraN_family_protein	AF-B7I8W9-F1-model_v4 UPF0102 protein AB57_1130	0.294	129	83	5	123	4	132	4.108E-12	393
DESULFOASV1_1894_YraN_family_protein	AF-A6LF20-F1-model_v4	DESULFOASV1_1894_YraN_family_protein	AF-A6LF20-F1-model_v4 UPF0102 protein BDI_2565	0.369	119	72	3	121	2	116	4.287E-11	392
DESULFOASV1_1894_YraN_family_protein	AF-Q97I89-F1-model_v4	DESULFOASV1_1894_YraN_family_protein	AF-Q97I89-F1-model_v4 UPF0102 protein CA_C1763	0.367	117	73	5	121	5	120	2.094E-11	392
DESULFOASV1_1894_YraN_family_protein	AF-Q88N88-F1-model_v4	DESULFOASV1_1894_YraN_family_protein	AF-Q88N88-F1-model_v4 UPF0102 protein PP_1324	0.330	114	75	9	122	11	123	2.235E-11	392
DESULFOASV1_1894_YraN_family_protein	AF-A8M6A9-F1-model_v4	DESULFOASV1_1894_YraN_family_protein	AF-A8M6A9-F1-model_v4 UPF0102 protein Sare_1228	0.365	121	75	1	121	1	119	2.094E-11	391
DESULFOASV1_1894_YraN_family_protein	AF-B3EJJ5-F1-model_v4	DESULFOASV1_1894_YraN_family_protein	AF-B3EJJ5-F1-model_v4 UPF0102 protein Cphamn1_0017	0.401	117	68	8	121	8	124	1.243E-11	391
DESULFOASV1_1894_YraN_family_protein	AF-B2HWE2-F1-model_v4	DESULFOASV1_1894_YraN_family_protein	AF-B2HWE2-F1-model_v4 UPF0102 protein ACICU_01089	0.294	129	83	5	123	4	132	4.680E-12	391
DESULFOASV1_1894_YraN_family_protein	AF-Q4K6I1-F1-model_v4	DESULFOASV1_1894_YraN_family_protein	AF-Q4K6I1-F1-model_v4 UPF0102 protein PFL_5073	0.336	118	77	5	122	6	122	2.094E-11	390
DESULFOASV1_1894_YraN_family_protein	AF-B0VKV0-F1-model_v4	DESULFOASV1_1894_YraN_family_protein	AF-B0VKV0-F1-model_v4 UPF0102 protein ABSDF1354	0.294	129	83	5	123	4	132	5.331E-12	390
DESULFOASV1_1894_YraN_family_protein	AF-A3M3I7-F1-model_v4	DESULFOASV1_1894_YraN_family_protein	AF-A3M3I7-F1-model_v4 UPF0102 protein A1S_1049	0.294	129	83	5	123	4	132	4.995E-12	390
DESULFOASV1_1894_YraN_family_protein	AF-A5W8R2-F1-model_v4	DESULFOASV1_1894_YraN_family_protein	AF-A5W8R2-F1-model_v4 UPF0102 protein Pput_4400	0.322	117	78	6	122	7	122	2.235E-11	389
DESULFOASV1_1894_YraN_family_protein	AF-Q9HVZ1-F1-model_v4	DESULFOASV1_1894_YraN_family_protein	AF-Q9HVZ1-F1-model_v4 UPF0102 protein PA4424	0.330	118	78	5	122	7	124	2.094E-11	389
DESULFOASV1_1894_YraN_family_protein	AF-A1BCI0-F1-model_v4	DESULFOASV1_1894_YraN_family_protein	AF-A1BCI0-F1-model_v4 UPF0102 protein Cpha266_0037	0.333	117	75	8	121	8	124	1.512E-11	389
DESULFOASV1_1894_YraN_family_protein	AF-Q9PFV3-F1-model_v4	DESULFOASV1_1894_YraN_family_protein	AF-Q9PFV3-F1-model_v4 UPF0102 protein XF_0554	0.372	117	70	9	125	8	120	3.526E-11	388
DESULFOASV1_1894_YraN_family_protein	AF-B2I7R6-F1-model_v4	DESULFOASV1_1894_YraN_family_protein	AF-B2I7R6-F1-model_v4 UPF0102 protein XfasM23_1674	0.372	117	70	9	125	8	120	3.303E-11	387
DESULFOASV1_1894_YraN_family_protein	AF-Q0SSB5-F1-model_v4	DESULFOASV1_1894_YraN_family_protein	AF-Q0SSB5-F1-model_v4 UPF0102 protein CPR_1677	0.330	121	80	1	121	1	120	2.094E-11	386
DESULFOASV1_1894_YraN_family_protein	AF-Q0TPP8-F1-model_v4	DESULFOASV1_1894_YraN_family_protein	AF-Q0TPP8-F1-model_v4 UPF0102 protein CPF_1959	0.347	121	78	1	121	1	120	2.235E-11	386
DESULFOASV1_1894_YraN_family_protein	AF-Q2JJU2-F1-model_v4	DESULFOASV1_1894_YraN_family_protein	AF-Q2JJU2-F1-model_v4 UPF0102 protein CYB_2119	0.390	121	71	6	122	11	131	6.073E-12	386
DESULFOASV1_1894_YraN_family_protein	AF-A4YBR8-F1-model_v4	DESULFOASV1_1894_YraN_family_protein	AF-A4YBR8-F1-model_v4 UPF0102 protein Sputcn32_3693	0.309	113	72	9	121	4	108	8.776E-11	383
DESULFOASV1_1894_YraN_family_protein	AF-Q0RDP9-F1-model_v4	DESULFOASV1_1894_YraN_family_protein	AF-Q0RDP9-F1-model_v4 UPF0102 protein FRAAL5785	0.448	115	62	7	121	8	120	1.962E-11	383
DESULFOASV1_1894_YraN_family_protein	AF-B1KWN0-F1-model_v4	DESULFOASV1_1894_YraN_family_protein	AF-B1KWN0-F1-model_v4 UPF0102 protein CLK_1817	0.330	117	78	5	121	5	121	4.575E-11	383
DESULFOASV1_1894_YraN_family_protein	AF-Q1IJG5-F1-model_v4	DESULFOASV1_1894_YraN_family_protein	AF-Q1IJG5-F1-model_v4 UPF0102 protein Acid345_3985	0.378	117	71	5	121	24	138	3.303E-11	383
DESULFOASV1_1894_YraN_family_protein	AF-Q1I5A6-F1-model_v4	DESULFOASV1_1894_YraN_family_protein	AF-Q1I5A6-F1-model_v4 UPF0102 protein PSEEN4497	0.339	114	74	9	122	10	122	2.546E-11	382
DESULFOASV1_1894_YraN_family_protein	AF-C3L0D8-F1-model_v4	DESULFOASV1_1894_YraN_family_protein	AF-C3L0D8-F1-model_v4 UPF0102 protein CLJ_B2665	0.327	115	77	7	121	7	121	4.575E-11	382
DESULFOASV1_1894_YraN_family_protein	AF-A7FW04-F1-model_v4	DESULFOASV1_1894_YraN_family_protein	AF-A7FW04-F1-model_v4 UPF0102 protein CLB_2304	0.336	115	76	7	121	7	121	4.575E-11	382
DESULFOASV1_1894_YraN_family_protein	AF-B3QZF2-F1-model_v4	DESULFOASV1_1894_YraN_family_protein	AF-B3QZF2-F1-model_v4 UPF0102 protein Ctha_1382	0.360	122	74	5	121	4	125	1.327E-11	382
DESULFOASV1_1894_YraN_family_protein	AF-B2TJ35-F1-model_v4	DESULFOASV1_1894_YraN_family_protein	AF-B2TJ35-F1-model_v4 UPF0102 protein CLL_A1253	0.256	121	89	1	121	1	120	9.367E-11	381
DESULFOASV1_1894_YraN_family_protein	AF-Q7UM23-F1-model_v4	DESULFOASV1_1894_YraN_family_protein	AF-Q7UM23-F1-model_v4 UPF0102 protein RB9115	0.388	123	74	8	130	42	163	2.717E-11	381
DESULFOASV1_1894_YraN_family_protein	AF-A0LV62-F1-model_v4	DESULFOASV1_1894_YraN_family_protein	AF-A0LV62-F1-model_v4 UPF0102 protein Acel_1550	0.351	129	78	1	121	4	132	7.383E-12	380
DESULFOASV1_1894_YraN_family_protein	AF-A9NAA4-F1-model_v4	DESULFOASV1_1894_YraN_family_protein	AF-A9NAA4-F1-model_v4 UPF0102 protein COXBURSA331_A1934	0.319	118	76	5	122	5	117	6.337E-11	379
DESULFOASV1_1894_YraN_family_protein	AF-B7GX68-F1-model_v4	DESULFOASV1_1894_YraN_family_protein	AF-B7GX68-F1-model_v4 UPF0102 protein ABBFA_002499	0.294	129	83	5	123	4	132	1.165E-11	379
DESULFOASV1_1894_YraN_family_protein	AF-Q8R5S3-F1-model_v4	DESULFOASV1_1894_YraN_family_protein	AF-Q8R5S3-F1-model_v4 UPF0102 protein TTE1452	0.356	115	73	7	121	8	122	6.337E-11	378
DESULFOASV1_1894_YraN_family_protein	AF-B3E4L0-F1-model_v4	DESULFOASV1_1894_YraN_family_protein	AF-B3E4L0-F1-model_v4 UPF0102 protein Glov_2230	0.371	118	73	5	122	8	124	1.838E-11	378
DESULFOASV1_1894_YraN_family_protein	AF-C4ZSN9-F1-model_v4	DESULFOASV1_1894_YraN_family_protein	AF-C4ZSN9-F1-model_v4 UPF0102 protein YraN	0.347	116	72	9	124	20	130	2.717E-11	378
DESULFOASV1_1894_YraN_family_protein	AF-B1IQX3-F1-model_v4	DESULFOASV1_1894_YraN_family_protein	AF-B1IQX3-F1-model_v4 UPF0102 protein YraN	0.347	116	72	9	124	20	130	2.717E-11	378
DESULFOASV1_1894_YraN_family_protein	AF-B1XGW0-F1-model_v4	DESULFOASV1_1894_YraN_family_protein	AF-B1XGW0-F1-model_v4 UPF0102 protein YraN	0.347	116	72	9	124	20	130	2.717E-11	378
DESULFOASV1_1894_YraN_family_protein	AF-P45465-F1-model_v4	DESULFOASV1_1894_YraN_family_protein	AF-P45465-F1-model_v4 UPF0102 protein YraN	0.347	116	72	9	124	20	130	2.717E-11	378
DESULFOASV1_1894_YraN_family_protein	AF-B8E2G0-F1-model_v4	DESULFOASV1_1894_YraN_family_protein	AF-B8E2G0-F1-model_v4 UPF0102 protein Dtur_1530	0.330	115	76	7	121	5	118	7.218E-11	377
DESULFOASV1_1894_YraN_family_protein	AF-A5I4L8-F1-model_v4	DESULFOASV1_1894_YraN_family_protein	AF-A5I4L8-F1-model_v4 UPF0102 protein CBO2440/CLC_2288	0.336	115	76	7	121	7	121	6.337E-11	377
DESULFOASV1_1894_YraN_family_protein	AF-A7GG28-F1-model_v4	DESULFOASV1_1894_YraN_family_protein	AF-A7GG28-F1-model_v4 UPF0102 protein CLI_2496	0.330	117	78	5	121	5	121	6.763E-11	377
DESULFOASV1_1894_YraN_family_protein	AF-A7HBQ4-F1-model_v4	DESULFOASV1_1894_YraN_family_protein	AF-A7HBQ4-F1-model_v4 UPF0102 protein Anae109_1947	0.322	127	83	2	128	8	131	9.367E-11	377
DESULFOASV1_1894_YraN_family_protein	AF-A1RPP5-F1-model_v4	DESULFOASV1_1894_YraN_family_protein	AF-A1RPP5-F1-model_v4 UPF0102 protein Sputw3181_3835	0.309	113	72	9	121	4	108	1.478E-10	376
DESULFOASV1_1894_YraN_family_protein	AF-B2A2P1-F1-model_v4	DESULFOASV1_1894_YraN_family_protein	AF-B2A2P1-F1-model_v4 UPF0102 protein Nther_1376	0.338	115	75	7	121	5	119	2.717E-11	376
DESULFOASV1_1894_YraN_family_protein	AF-B0KFT8-F1-model_v4	DESULFOASV1_1894_YraN_family_protein	AF-B0KFT8-F1-model_v4 UPF0102 protein PputGB1_4524	0.322	117	78	6	122	7	122	7.218E-11	376
DESULFOASV1_1894_YraN_family_protein	AF-Q3JE65-F1-model_v4	DESULFOASV1_1894_YraN_family_protein	AF-Q3JE65-F1-model_v4 UPF0102 protein Noc_0355	0.266	119	85	5	123	6	122	8.776E-11	376
DESULFOASV1_1894_YraN_family_protein	AF-A0L230-F1-model_v4	DESULFOASV1_1894_YraN_family_protein	AF-A0L230-F1-model_v4 UPF0102 protein Shewana3_3881	0.309	113	72	9	121	4	108	1.139E-10	375
DESULFOASV1_1894_YraN_family_protein	AF-B8EBD9-F1-model_v4	DESULFOASV1_1894_YraN_family_protein	AF-B8EBD9-F1-model_v4 UPF0102 protein Sbal223_3990	0.292	113	74	9	121	4	108	1.297E-10	375
DESULFOASV1_1894_YraN_family_protein	AF-A8AQ33-F1-model_v4	DESULFOASV1_1894_YraN_family_protein	AF-A8AQ33-F1-model_v4 UPF0102 protein CKO_04542	0.356	113	69	12	124	2	109	5.563E-11	375
DESULFOASV1_1894_YraN_family_protein	AF-B5YIA9-F1-model_v4	DESULFOASV1_1894_YraN_family_protein	AF-B5YIA9-F1-model_v4 UPF0102 protein THEYE_A1950	0.362	116	68	6	121	4	111	8.223E-11	375
DESULFOASV1_1894_YraN_family_protein	AF-B1LFP9-F1-model_v4	DESULFOASV1_1894_YraN_family_protein	AF-B1LFP9-F1-model_v4 UPF0102 protein YraN	0.355	116	71	9	124	20	130	3.763E-11	375
DESULFOASV1_1894_YraN_family_protein	AF-Q0HDW9-F1-model_v4	DESULFOASV1_1894_YraN_family_protein	AF-Q0HDW9-F1-model_v4 UPF0102 protein Shewmr4_3685	0.292	113	74	9	121	4	108	1.216E-10	374
DESULFOASV1_1894_YraN_family_protein	AF-A6WTP9-F1-model_v4	DESULFOASV1_1894_YraN_family_protein	AF-A6WTP9-F1-model_v4 UPF0102 protein Shew185_4070	0.292	113	74	9	121	4	108	1.297E-10	374
DESULFOASV1_1894_YraN_family_protein	AF-Q0I040-F1-model_v4	DESULFOASV1_1894_YraN_family_protein	AF-Q0I040-F1-model_v4 UPF0102 protein Shewmr7_0260	0.292	113	74	9	121	4	108	1.297E-10	374
DESULFOASV1_1894_YraN_family_protein	AF-Q7P0B3-F1-model_v4	DESULFOASV1_1894_YraN_family_protein	AF-Q7P0B3-F1-model_v4 UPF0102 protein CV_0654	0.380	113	65	9	121	5	110	8.223E-11	374
DESULFOASV1_1894_YraN_family_protein	AF-C1FSL0-F1-model_v4	DESULFOASV1_1894_YraN_family_protein	AF-C1FSL0-F1-model_v4 UPF0102 protein CLM_2733	0.336	115	76	7	121	7	121	8.776E-11	374
DESULFOASV1_1894_YraN_family_protein	AF-A1AG53-F1-model_v4	DESULFOASV1_1894_YraN_family_protein	AF-A1AG53-F1-model_v4 UPF0102 protein YraN	0.347	116	72	9	124	20	130	4.575E-11	374
DESULFOASV1_1894_YraN_family_protein	AF-B0VA98-F1-model_v4	DESULFOASV1_1894_YraN_family_protein	AF-B0VA98-F1-model_v4 UPF0102 protein ABAYE2669	0.301	126	80	6	121	5	130	1.512E-11	374
DESULFOASV1_1894_YraN_family_protein	AF-A4J649-F1-model_v4	DESULFOASV1_1894_YraN_family_protein	AF-A4J649-F1-model_v4 UPF0102 protein Dred_2035	0.341	122	79	1	121	1	122	8.776E-11	373
DESULFOASV1_1894_YraN_family_protein	AF-Q60CC4-F1-model_v4	DESULFOASV1_1894_YraN_family_protein	AF-Q60CC4-F1-model_v4 UPF0102 protein MCA0184	0.342	114	72	9	122	12	121	7.218E-11	373
DESULFOASV1_1894_YraN_family_protein	AF-A5FKL6-F1-model_v4	DESULFOASV1_1894_YraN_family_protein	AF-A5FKL6-F1-model_v4 UPF0102 protein Fjoh_1217	0.333	117	77	5	121	4	120	3.763E-11	373
DESULFOASV1_1894_YraN_family_protein	AF-A3DDG4-F1-model_v4	DESULFOASV1_1894_YraN_family_protein	AF-A3DDG4-F1-model_v4 UPF0102 protein Cthe_0758	0.360	120	74	5	121	11	130	5.563E-11	373
DESULFOASV1_1894_YraN_family_protein	AF-Q8FDA0-F1-model_v4	DESULFOASV1_1894_YraN_family_protein	AF-Q8FDA0-F1-model_v4 UPF0102 protein YraN	0.347	116	72	9	124	20	130	4.575E-11	373
DESULFOASV1_1894_YraN_family_protein	AF-B2RLS5-F1-model_v4	DESULFOASV1_1894_YraN_family_protein	AF-B2RLS5-F1-model_v4 UPF0102 protein PGN_1801	0.362	135	85	1	134	1	135	8.411E-12	373
DESULFOASV1_1894_YraN_family_protein	AF-A6TRS2-F1-model_v4	DESULFOASV1_1894_YraN_family_protein	AF-A6TRS2-F1-model_v4 UPF0102 protein Amet_2739	0.357	110	68	12	121	9	114	3.095E-11	372
DESULFOASV1_1894_YraN_family_protein	AF-A4XLE5-F1-model_v4	DESULFOASV1_1894_YraN_family_protein	AF-A4XLE5-F1-model_v4 UPF0102 protein Csac_2148	0.400	115	68	7	121	5	118	5.212E-11	372
DESULFOASV1_1894_YraN_family_protein	AF-B6J4R1-F1-model_v4	DESULFOASV1_1894_YraN_family_protein	AF-B6J4R1-F1-model_v4 UPF0102 protein CbuK_0265	0.310	118	77	5	122	5	117	1.067E-10	372
DESULFOASV1_1894_YraN_family_protein	AF-Q3IG11-F1-model_v4	DESULFOASV1_1894_YraN_family_protein	AF-Q3IG11-F1-model_v4 UPF0102 protein PSHAa2523	0.283	113	77	9	121	15	123	8.776E-11	372
DESULFOASV1_1894_YraN_family_protein	AF-B7UZK2-F1-model_v4	DESULFOASV1_1894_YraN_family_protein	AF-B7UZK2-F1-model_v4 UPF0102 protein PLES_48031	0.341	114	74	9	122	11	124	4.883E-11	372
DESULFOASV1_1894_YraN_family_protein	AF-B7M056-F1-model_v4	DESULFOASV1_1894_YraN_family_protein	AF-B7M056-F1-model_v4 UPF0102 protein YraN	0.347	116	72	9	124	20	130	4.883E-11	372
DESULFOASV1_1894_YraN_family_protein	AF-Q3YX93-F1-model_v4	DESULFOASV1_1894_YraN_family_protein	AF-Q3YX93-F1-model_v4 UPF0102 protein YraN	0.355	116	71	9	124	20	130	5.212E-11	372
