query	target	qheader	theader	fident	alnlen	mismatch	qstart	qend	tstart	tend	evalue	bits
DESULFOASV1_0002_UPF028_family_protein	AF-Q58921-F1-model_v4	DESULFOASV1_0002_UPF028_family_protein	AF-Q58921-F1-model_v4 UPF0280 protein MJ1526	0.278	229	162	24	248	2	230	1.297E-22	812
DESULFOASV1_0002_UPF028_family_protein	AF-Q0W4Z8-F1-model_v4	DESULFOASV1_0002_UPF028_family_protein	AF-Q0W4Z8-F1-model_v4 UPF0280 protein UNCMA_16740	0.314	233	158	19	250	3	235	2.791E-22	792
DESULFOASV1_0002_UPF028_family_protein	AF-A6UPN5-F1-model_v4	DESULFOASV1_0002_UPF028_family_protein	AF-A6UPN5-F1-model_v4 UPF0280 protein Mevan_0550	0.263	233	167	24	250	3	235	1.542E-21	783
DESULFOASV1_0002_UPF028_family_protein	AF-A4FWU2-F1-model_v4	DESULFOASV1_0002_UPF028_family_protein	AF-A4FWU2-F1-model_v4 UPF0280 protein MmarC5_0355	0.270	231	164	24	248	3	233	2.330E-21	770
DESULFOASV1_0002_UPF028_family_protein	AF-A6VGH5-F1-model_v4	DESULFOASV1_0002_UPF028_family_protein	AF-A6VGH5-F1-model_v4 UPF0280 protein MmarC7_0482	0.253	231	167	24	248	3	233	4.202E-21	762
DESULFOASV1_0002_UPF028_family_protein	AF-Q6LXW0-F1-model_v4	DESULFOASV1_0002_UPF028_family_protein	AF-Q6LXW0-F1-model_v4 UPF0280 protein MMP1236	0.261	231	166	24	248	3	233	6.349E-21	756
DESULFOASV1_0002_UPF028_family_protein	AF-A9AA77-F1-model_v4	DESULFOASV1_0002_UPF028_family_protein	AF-A9AA77-F1-model_v4 UPF0280 protein MmarC6_1437	0.257	231	166	24	248	3	233	6.349E-21	754
DESULFOASV1_0002_UPF028_family_protein	AF-A2SQM1-F1-model_v4	DESULFOASV1_0002_UPF028_family_protein	AF-A2SQM1-F1-model_v4 UPF0280 protein Mlab_0453	0.315	224	153	25	248	2	225	3.129E-21	744
DESULFOASV1_0002_UPF028_family_protein	AF-A6UTV8-F1-model_v4	DESULFOASV1_0002_UPF028_family_protein	AF-A6UTV8-F1-model_v4 UPF0280 protein Maeo_0343	0.252	232	168	25	250	2	233	1.631E-20	744
DESULFOASV1_0002_UPF028_family_protein	AF-A5UJB5-F1-model_v4	DESULFOASV1_0002_UPF028_family_protein	AF-A5UJB5-F1-model_v4 UPF0280 protein Msm_0088	0.270	231	164	25	250	2	232	1.292E-21	742
DESULFOASV1_0002_UPF028_family_protein	AF-A0B8Q1-F1-model_v4	DESULFOASV1_0002_UPF028_family_protein	AF-A0B8Q1-F1-model_v4 UPF0280 protein Mthe_1297	0.293	225	158	25	248	2	226	1.079E-20	735
DESULFOASV1_0002_UPF028_family_protein	AF-O29608-F1-model_v4	DESULFOASV1_0002_UPF028_family_protein	AF-O29608-F1-model_v4 UPF0280 protein AF_0649	0.306	226	154	25	250	2	224	8.037E-21	722
DESULFOASV1_0002_UPF028_family_protein	AF-Q8TYT6-F1-model_v4	DESULFOASV1_0002_UPF028_family_protein	AF-Q8TYT6-F1-model_v4 UPF0280 protein MK0206	0.309	225	154	25	248	2	226	2.950E-21	716
DESULFOASV1_0002_UPF028_family_protein	AF-Q8TQ37-F1-model_v4	DESULFOASV1_0002_UPF028_family_protein	AF-Q8TQ37-F1-model_v4 UPF0280 protein MA_1715	0.259	250	180	1	250	1	244	6.349E-21	712
DESULFOASV1_0002_UPF028_family_protein	AF-Q50429-F1-model_v4	DESULFOASV1_0002_UPF028_family_protein	AF-Q50429-F1-model_v4 UPF0280 protein ORFE	0.266	231	165	25	250	1	231	1.449E-20	705
DESULFOASV1_0002_UPF028_family_protein	AF-Q464Y2-F1-model_v4	DESULFOASV1_0002_UPF028_family_protein	AF-Q464Y2-F1-model_v4 UPF0280 protein Mbar_A3697	0.250	248	181	1	248	1	242	1.288E-20	697
DESULFOASV1_0002_UPF028_family_protein	AF-Q12Z15-F1-model_v4	DESULFOASV1_0002_UPF028_family_protein	AF-Q12Z15-F1-model_v4 UPF0280 protein Mbur_0309	0.256	228	167	25	250	1	228	2.930E-19	689
DESULFOASV1_0002_UPF028_family_protein	AF-Q8PTR5-F1-model_v4	DESULFOASV1_0002_UPF028_family_protein	AF-Q8PTR5-F1-model_v4 UPF0280 protein MM_2648	0.277	248	176	1	248	1	245	2.190E-20	687
DESULFOASV1_0002_UPF028_family_protein	AF-Q2NEQ4-F1-model_v4	DESULFOASV1_0002_UPF028_family_protein	AF-Q2NEQ4-F1-model_v4 UPF0280 protein Msp_1322	0.240	233	176	19	250	1	233	5.965E-20	678
DESULFOASV1_0002_UPF028_family_protein	AF-O26823-F1-model_v4	DESULFOASV1_0002_UPF028_family_protein	AF-O26823-F1-model_v4 UPF0280 protein MTH_727	0.259	228	167	25	250	17	244	1.141E-19	677
DESULFOASV1_0002_UPF028_family_protein	AF-Q2FMZ3-F1-model_v4	DESULFOASV1_0002_UPF028_family_protein	AF-Q2FMZ3-F1-model_v4 UPF0280 protein Mhun_0136	0.290	227	158	24	250	2	225	3.297E-19	663
DESULFOASV1_0002_UPF028_family_protein	AF-A3CVP8-F1-model_v4	DESULFOASV1_0002_UPF028_family_protein	AF-A3CVP8-F1-model_v4 UPF0280 protein Memar_1519	0.305	225	154	25	249	2	224	5.605E-19	656
DESULFOASV1_0002_UPF028_family_protein	AF-B8GHM1-F1-model_v4	DESULFOASV1_0002_UPF028_family_protein	AF-B8GHM1-F1-model_v4 UPF0280 protein Mpal_1292	0.257	225	165	25	249	2	224	3.098E-18	640
DESULFOASV1_0002_UPF028_family_protein	AF-A7I7T1-F1-model_v4	DESULFOASV1_0002_UPF028_family_protein	AF-A7I7T1-F1-model_v4 UPF0280 protein Mboo_1274	0.283	224	159	25	248	2	224	1.137E-18	633
DESULFOASV1_0002_UPF028_family_protein	AF-B5XRA9-F1-model_v4	DESULFOASV1_0002_UPF028_family_protein	AF-B5XRA9-F1-model_v4 FAD:protein FMN transferase	0.124	306	202	19	250	1	306	3.777E-07	194
DESULFOASV1_0002_UPF028_family_protein	AF-P41780-F1-model_v4	DESULFOASV1_0002_UPF028_family_protein	AF-P41780-F1-model_v4 FAD:protein FMN transferase	0.114	338	214	1	243	1	338	1.862E-07	179
DESULFOASV1_0002_UPF028_family_protein	AF-Q89AP6-F1-model_v4	DESULFOASV1_0002_UPF028_family_protein	AF-Q89AP6-F1-model_v4 FAD:protein FMN transferase	0.076	323	221	4	243	10	332	2.095E-07	177
DESULFOASV1_0002_UPF028_family_protein	AF-B5XP00-F1-model_v4	DESULFOASV1_0002_UPF028_family_protein	AF-B5XP00-F1-model_v4 FAD:protein FMN transferase	0.122	323	212	1	243	16	338	9.146E-07	175
DESULFOASV1_0002_UPF028_family_protein	AF-P0AB86-F1-model_v4	DESULFOASV1_0002_UPF028_family_protein	AF-P0AB86-F1-model_v4 FAD:protein FMN transferase	0.113	339	215	1	243	1	339	6.811E-07	175
DESULFOASV1_0002_UPF028_family_protein	AF-P0AB85-F1-model_v4	DESULFOASV1_0002_UPF028_family_protein	AF-P0AB85-F1-model_v4 FAD:protein FMN transferase	0.110	324	215	1	243	16	339	1.158E-06	174
DESULFOASV1_0002_UPF028_family_protein	AF-A5F5Y3-F1-model_v4	DESULFOASV1_0002_UPF028_family_protein	AF-A5F5Y3-F1-model_v4 FAD:protein FMN transferase	0.118	323	212	1	241	1	323	2.349E-06	162
DESULFOASV1_0002_UPF028_family_protein	AF-O85292-F1-model_v4	DESULFOASV1_0002_UPF028_family_protein	AF-O85292-F1-model_v4 FAD:protein FMN transferase	0.091	311	206	14	241	18	328	3.154E-06	152
DESULFOASV1_0002_UPF028_family_protein	AF-P44550-F1-model_v4	DESULFOASV1_0002_UPF028_family_protein	AF-P44550-F1-model_v4 FAD:protein FMN transferase	0.109	321	202	14	241	13	333	1.968E-06	149
DESULFOASV1_0002_UPF028_family_protein	AF-O84080-F1-model_v4	DESULFOASV1_0002_UPF028_family_protein	AF-O84080-F1-model_v4 FAD:protein FMN transferase	0.127	313	204	1	235	1	313	8.594E-06	140
DESULFOASV1_0002_UPF028_family_protein	AF-Q9PKW2-F1-model_v4	DESULFOASV1_0002_UPF028_family_protein	AF-Q9PKW2-F1-model_v4 FAD:protein FMN transferase	0.125	307	202	4	235	7	313	6.400E-06	139
DESULFOASV1_0002_UPF028_family_protein	AF-Q9Z8K2-F1-model_v4	DESULFOASV1_0002_UPF028_family_protein	AF-Q9Z8K2-F1-model_v4 FAD:protein FMN transferase	0.101	310	212	1	237	4	313	5.669E-05	132
DESULFOASV1_0002_UPF028_family_protein	AF-Q8K1R3-F1-model_v4	DESULFOASV1_0002_UPF028_family_protein	AF-Q8K1R3-F1-model_v4 Polyribonucleotide nucleotidyltransferase 1, mitochondrial	0.150	40	33	1	40	21	60	5.911E+00	25
DESULFOASV1_0002_UPF028_family_protein	AF-P9WM25-F1-model_v4	DESULFOASV1_0002_UPF028_family_protein	AF-P9WM25-F1-model_v4 Uncharacterized protein Rv1332	0.116	143	100	1	114	1	143	4.953E+00	23
DESULFOASV1_0002_UPF028_family_protein	AF-P9WM24-F1-model_v4	DESULFOASV1_0002_UPF028_family_protein	AF-P9WM24-F1-model_v4 Uncharacterized protein MT1374	0.108	143	101	1	114	1	143	3.477E+00	23
DESULFOASV1_0002_UPF028_family_protein	AF-Q9JLH5-F1-model_v4	DESULFOASV1_0002_UPF028_family_protein	AF-Q9JLH5-F1-model_v4 CDK5 regulatory subunit-associated protein 2	0.112	124	98	4	127	1704	1814	2.590E+00	23
DESULFOASV1_0002_UPF028_family_protein	AF-Q6Z2K1-F1-model_v4	DESULFOASV1_0002_UPF028_family_protein	AF-Q6Z2K1-F1-model_v4 Protein TIFY 8	0.149	87	69	1	87	14	95	7.484E+00	21
DESULFOASV1_0002_UPF028_family_protein	AF-B8FRG9-F1-model_v4	DESULFOASV1_0002_UPF028_family_protein	AF-B8FRG9-F1-model_v4 ATP-dependent protease subunit HslV	0.084	217	125	25	241	38	174	3.689E+00	21
DESULFOASV1_0002_UPF028_family_protein	AF-Q2QWE3-F1-model_v4	DESULFOASV1_0002_UPF028_family_protein	AF-Q2QWE3-F1-model_v4 Probable protein phosphatase 2C 77	0.119	128	108	23	146	153	280	6.270E+00	21
DESULFOASV1_0002_UPF028_family_protein	AF-A1SWY7-F1-model_v4	DESULFOASV1_0002_UPF028_family_protein	AF-A1SWY7-F1-model_v4 UPF0234 protein Ping_2261	0.153	39	30	13	48	22	60	7.484E+00	20
DESULFOASV1_0002_UPF028_family_protein	AF-Q0AYP2-F1-model_v4	DESULFOASV1_0002_UPF028_family_protein	AF-Q0AYP2-F1-model_v4 ATP-dependent protease subunit HslV	0.118	225	123	25	249	38	178	3.689E+00	20
DESULFOASV1_0002_UPF028_family_protein	AF-C6C0P0-F1-model_v4	DESULFOASV1_0002_UPF028_family_protein	AF-C6C0P0-F1-model_v4 ATP-dependent protease subunit HslV	0.103	221	126	25	245	39	179	2.914E+00	20
DESULFOASV1_0002_UPF028_family_protein	AF-Q00619-F1-model_v4	DESULFOASV1_0002_UPF028_family_protein	AF-Q00619-F1-model_v4 Pheromone P-factor receptor	0.109	113	99	9	120	1	113	4.953E+00	20
DESULFOASV1_0002_UPF028_family_protein	AF-B9MM31-F1-model_v4	DESULFOASV1_0002_UPF028_family_protein	AF-B9MM31-F1-model_v4 ATP-dependent protease subunit HslV	0.093	217	123	25	241	38	174	6.651E+00	18
DESULFOASV1_0002_UPF028_family_protein	AF-B9HQ42-F1-model_v4	DESULFOASV1_0002_UPF028_family_protein	AF-B9HQ42-F1-model_v4 Casparian strip membrane protein 4	0.133	75	62	41	115	85	157	9.474E+00	18
DESULFOASV1_0002_UPF028_family_protein	AF-Q06469-F1-model_v4	DESULFOASV1_0002_UPF028_family_protein	AF-Q06469-F1-model_v4 Curing of [URE3] protein 1	0.087	161	146	1	161	24	184	2.590E+00	18
DESULFOASV1_0002_UPF028_family_protein	AF-B7ZQJ9-F1-model_v4	DESULFOASV1_0002_UPF028_family_protein	AF-B7ZQJ9-F1-model_v4 General transcription factor II-I repeat domain-containing protein 1	0.115	139	119	13	151	40	175	3.689E+00	18
DESULFOASV1_0002_UPF028_family_protein	AF-Q6GHI2-F1-model_v4	DESULFOASV1_0002_UPF028_family_protein	AF-Q6GHI2-F1-model_v4 ATP-dependent protease subunit HslV	0.108	217	122	25	241	42	179	6.270E+00	17
DESULFOASV1_0002_UPF028_family_protein	AF-C4XN25-F1-model_v4	DESULFOASV1_0002_UPF028_family_protein	AF-C4XN25-F1-model_v4 ATP-dependent protease subunit HslV	0.094	221	127	25	245	39	179	7.938E+00	17
DESULFOASV1_0002_UPF028_family_protein	AF-Q834K3-F1-model_v4	DESULFOASV1_0002_UPF028_family_protein	AF-Q834K3-F1-model_v4 ATP-dependent protease subunit HslV	0.094	217	125	25	241	42	180	4.402E+00	17
DESULFOASV1_0002_UPF028_family_protein	AF-Q31IL7-F1-model_v4	DESULFOASV1_0002_UPF028_family_protein	AF-Q31IL7-F1-model_v4 ATP-dependent protease subunit HslV	0.088	224	127	25	248	41	180	6.270E+00	17
DESULFOASV1_0002_UPF028_family_protein	AF-P24473-F1-model_v4	DESULFOASV1_0002_UPF028_family_protein	AF-P24473-F1-model_v4 Glutathione S-transferase kappa 1	0.185	54	41	192	242	145	198	7.484E+00	17
DESULFOASV1_0002_UPF028_family_protein	AF-Q3ZCK9-F1-model_v4	DESULFOASV1_0002_UPF028_family_protein	AF-Q3ZCK9-F1-model_v4 Proteasome subunit alpha type-4	0.128	221	145	21	241	60	226	4.953E+00	17
DESULFOASV1_0002_UPF028_family_protein	AF-A8H793-F1-model_v4	DESULFOASV1_0002_UPF028_family_protein	AF-A8H793-F1-model_v4 UPF0234 protein Spea_3114	0.103	89	74	13	96	24	112	6.651E+00	16
DESULFOASV1_0002_UPF028_family_protein	AF-A8FYX4-F1-model_v4	DESULFOASV1_0002_UPF028_family_protein	AF-A8FYX4-F1-model_v4 UPF0234 protein Ssed_3443	0.113	89	74	13	96	24	112	6.270E+00	16
DESULFOASV1_0002_UPF028_family_protein	AF-B0TR14-F1-model_v4	DESULFOASV1_0002_UPF028_family_protein	AF-B0TR14-F1-model_v4 UPF0234 protein Shal_3198	0.103	89	74	13	96	24	112	6.270E+00	16
DESULFOASV1_0002_UPF028_family_protein	AF-A7H4F1-F1-model_v4	DESULFOASV1_0002_UPF028_family_protein	AF-A7H4F1-F1-model_v4 ATP-dependent protease subunit HslV	0.100	226	128	25	250	37	179	8.931E+00	16
DESULFOASV1_0002_UPF028_family_protein	AF-Q5HVB1-F1-model_v4	DESULFOASV1_0002_UPF028_family_protein	AF-Q5HVB1-F1-model_v4 ATP-dependent protease subunit HslV	0.088	226	130	25	250	37	179	8.931E+00	16
DESULFOASV1_0002_UPF028_family_protein	AF-B9KG99-F1-model_v4	DESULFOASV1_0002_UPF028_family_protein	AF-B9KG99-F1-model_v4 ATP-dependent protease subunit HslV	0.078	226	131	25	250	37	179	9.474E+00	16
DESULFOASV1_0002_UPF028_family_protein	AF-B5RLC2-F1-model_v4	DESULFOASV1_0002_UPF028_family_protein	AF-B5RLC2-F1-model_v4 ATP-dependent protease subunit HslV	0.100	224	128	25	248	38	180	8.931E+00	16
DESULFOASV1_0002_UPF028_family_protein	AF-O25253-F1-model_v4	DESULFOASV1_0002_UPF028_family_protein	AF-O25253-F1-model_v4 ATP-dependent protease subunit HslV	0.074	225	129	25	249	41	180	8.420E+00	16
DESULFOASV1_0002_UPF028_family_protein	AF-A5ISD7-F1-model_v4	DESULFOASV1_0002_UPF028_family_protein	AF-A5ISD7-F1-model_v4 ATP-dependent protease subunit HslV	0.108	217	122	25	241	42	179	8.420E+00	16
DESULFOASV1_0002_UPF028_family_protein	AF-P25789-F1-model_v4	DESULFOASV1_0002_UPF028_family_protein	AF-P25789-F1-model_v4 Proteasome subunit alpha type-4	0.102	227	154	19	245	57	228	5.254E+00	16
DESULFOASV1_0002_UPF028_family_protein	AF-Q93LK9-F1-model_v4	DESULFOASV1_0002_UPF028_family_protein	AF-Q93LK9-F1-model_v4 Spore germination protein GerQA	0.100	189	160	1	189	1	179	3.477E+00	16
DESULFOASV1_0002_UPF028_family_protein	AF-A4XIW9-F1-model_v4	DESULFOASV1_0002_UPF028_family_protein	AF-A4XIW9-F1-model_v4 ATP-dependent protease subunit HslV	0.102	217	122	25	241	38	174	8.931E+00	15
DESULFOASV1_0002_UPF028_family_protein	AF-Q2L1C6-F1-model_v4	DESULFOASV1_0002_UPF028_family_protein	AF-Q2L1C6-F1-model_v4 ATP-dependent protease subunit HslV	0.088	224	127	25	248	39	178	9.474E+00	15
DESULFOASV1_0002_UPF028_family_protein	AF-B5Z6N8-F1-model_v4	DESULFOASV1_0002_UPF028_family_protein	AF-B5Z6N8-F1-model_v4 ATP-dependent protease subunit HslV	0.074	225	129	25	249	41	180	9.474E+00	15
DESULFOASV1_0002_UPF028_family_protein	AF-Q17XG1-F1-model_v4	DESULFOASV1_0002_UPF028_family_protein	AF-Q17XG1-F1-model_v4 ATP-dependent protease subunit HslV	0.074	225	129	25	249	41	180	8.931E+00	15
DESULFOASV1_0002_UPF028_family_protein	AF-B6JL97-F1-model_v4	DESULFOASV1_0002_UPF028_family_protein	AF-B6JL97-F1-model_v4 ATP-dependent protease subunit HslV	0.074	225	129	25	249	41	180	8.420E+00	15
DESULFOASV1_0002_UPF028_family_protein	AF-B2S979-F1-model_v4	DESULFOASV1_0002_UPF028_family_protein	AF-B2S979-F1-model_v4 ATP-dependent protease subunit HslV	0.096	226	127	25	250	44	184	9.474E+00	15
DESULFOASV1_0002_UPF028_family_protein	AF-Q8YE31-F1-model_v4	DESULFOASV1_0002_UPF028_family_protein	AF-Q8YE31-F1-model_v4 ATP-dependent protease subunit HslV	0.092	226	127	25	250	44	184	8.931E+00	15
DESULFOASV1_0002_UPF028_family_protein	AF-Q9Y2Q3-F1-model_v4	DESULFOASV1_0002_UPF028_family_protein	AF-Q9Y2Q3-F1-model_v4 Glutathione S-transferase kappa 1	0.152	59	42	192	242	140	198	8.420E+00	15
DESULFOASV1_0002_UPF028_family_protein	AF-Q4R932-F1-model_v4	DESULFOASV1_0002_UPF028_family_protein	AF-Q4R932-F1-model_v4 Proteasome subunit alpha type-4	0.091	227	155	19	245	57	228	7.055E+00	15
DESULFOASV1_0002_UPF028_family_protein	AF-P21670-F1-model_v4	DESULFOASV1_0002_UPF028_family_protein	AF-P21670-F1-model_v4 Proteasome subunit alpha type-4	0.095	227	155	19	245	57	228	6.651E+00	15
DESULFOASV1_0002_UPF028_family_protein	AF-P36982-F1-model_v4	DESULFOASV1_0002_UPF028_family_protein	AF-P36982-F1-model_v4 Protein phosphatase 2C	0.095	135	96	24	158	38	144	5.573E+00	15
DESULFOASV1_0002_UPF028_family_protein	AF-P53286-F1-model_v4	DESULFOASV1_0002_UPF028_family_protein	AF-P53286-F1-model_v4 Protein BTN2	0.078	164	142	1	155	30	193	2.170E+00	14
DESULFOASV1_0002_UPF028_family_protein	AF-Q9USQ5-F1-model_v4	DESULFOASV1_0002_UPF028_family_protein	AF-Q9USQ5-F1-model_v4 Ornithine decarboxylase antizyme	0.088	143	109	1	143	26	146	3.091E+00	13
DESULFOASV1_0002_UPF028_family_protein	AF-Q4IEA7-F1-model_v4	DESULFOASV1_0002_UPF028_family_protein	AF-Q4IEA7-F1-model_v4 Protein OS-9 homolog	0.121	151	98	1	151	71	183	2.046E+00	13
DESULFOASV1_0002_UPF028_family_protein	AF-P44162-F1-model_v4	DESULFOASV1_0002_UPF028_family_protein	AF-P44162-F1-model_v4 Uncharacterized protein HI_1326	0.125	115	88	14	115	11	125	7.055E+00	12
DESULFOASV1_0002_UPF028_family_protein	AF-Q87C81-F1-model_v4	DESULFOASV1_0002_UPF028_family_protein	AF-Q87C81-F1-model_v4 3-deoxy-D-manno-octulosonic acid kinase	0.079	225	117	22	246	6	133	7.938E+00	12
DESULFOASV1_0002_UPF028_family_protein	AF-Q8WTM6-F1-model_v4	DESULFOASV1_0002_UPF028_family_protein	AF-Q8WTM6-F1-model_v4 Probable actin-related protein 2/3 complex subunit 2	0.091	228	185	13	240	21	224	9.474E+00	12
DESULFOASV1_0002_UPF028_family_protein	AF-Q9KQ48-F1-model_v4	DESULFOASV1_0002_UPF028_family_protein	AF-Q9KQ48-F1-model_v4 Outer membrane protein assembly factor BamC	0.059	219	140	22	240	87	236	3.091E+00	12
DESULFOASV1_0002_UPF028_family_protein	AF-B7VIM1-F1-model_v4	DESULFOASV1_0002_UPF028_family_protein	AF-B7VIM1-F1-model_v4 Outer membrane protein assembly factor BamC	0.072	215	136	26	240	89	236	4.150E+00	11
DESULFOASV1_0002_UPF028_family_protein	AF-Q0WCK7-F1-model_v4	DESULFOASV1_0002_UPF028_family_protein	AF-Q0WCK7-F1-model_v4 Outer membrane protein assembly factor BamC	0.120	214	136	19	232	90	245	2.302E+00	11
DESULFOASV1_0002_UPF028_family_protein	AF-Q9XB61-F1-model_v4	DESULFOASV1_0002_UPF028_family_protein	AF-Q9XB61-F1-model_v4 Carbapenam-3-carboxylate synthase	0.108	136	70	22	157	39	118	9.474E+00	11
DESULFOASV1_0002_UPF028_family_protein	AF-Q6CVQ9-F1-model_v4	DESULFOASV1_0002_UPF028_family_protein	AF-Q6CVQ9-F1-model_v4 Inner kinetochore subunit MCM21	0.085	181	141	7	161	92	272	5.254E+00	10
DESULFOASV1_0002_UPF028_family_protein	AF-E8XP36-F1-model_v4	DESULFOASV1_0002_UPF028_family_protein	AF-E8XP36-F1-model_v4 Outer membrane protein assembly factor BamC	0.068	205	118	21	225	102	229	4.953E+00	10
