query	target	qheader	theader	fident	alnlen	mismatch	qstart	qend	tstart	tend	evalue	bits
DESULFOASV1_1894_YraN_family_protein	AF-A0K3G7-F1-model_v4	DESULFOASV1_1894_YraN_family_protein	AF-A0K3G7-F1-model_v4 UPF0102 protein Bcen2424_0290	0.361	118	70	9	126	32	142	6.612E-10	331
DESULFOASV1_1894_YraN_family_protein	AF-A1SB01-F1-model_v4	DESULFOASV1_1894_YraN_family_protein	AF-A1SB01-F1-model_v4 UPF0102 protein Sama_3355	0.336	113	69	9	121	4	108	1.268E-09	330
DESULFOASV1_1894_YraN_family_protein	AF-Q47IS1-F1-model_v4	DESULFOASV1_1894_YraN_family_protein	AF-Q47IS1-F1-model_v4 UPF0102 protein Daro_0503	0.333	117	71	5	121	9	116	4.774E-10	330
DESULFOASV1_1894_YraN_family_protein	AF-A0QJ36-F1-model_v4	DESULFOASV1_1894_YraN_family_protein	AF-A0QJ36-F1-model_v4 UPF0102 protein MAV_3752	0.352	116	75	6	121	13	128	7.057E-10	330
DESULFOASV1_1894_YraN_family_protein	AF-B7L097-F1-model_v4	DESULFOASV1_1894_YraN_family_protein	AF-B7L097-F1-model_v4 UPF0102 protein Mchl_0439	0.386	118	68	5	122	14	124	7.057E-10	330
DESULFOASV1_1894_YraN_family_protein	AF-Q31EY6-F1-model_v4	DESULFOASV1_1894_YraN_family_protein	AF-Q31EY6-F1-model_v4 UPF0102 protein Tcr_1695	0.292	121	83	1	121	1	118	1.542E-09	329
DESULFOASV1_1894_YraN_family_protein	AF-Q72LQ3-F1-model_v4	DESULFOASV1_1894_YraN_family_protein	AF-Q72LQ3-F1-model_v4 UPF0102 protein TT_C0005	0.365	114	68	5	118	2	109	5.804E-10	328
DESULFOASV1_1894_YraN_family_protein	AF-Q8R616-F1-model_v4	DESULFOASV1_1894_YraN_family_protein	AF-Q8R616-F1-model_v4 UPF0102 protein FN1370	0.270	122	83	7	128	5	119	2.489E-10	328
DESULFOASV1_1894_YraN_family_protein	AF-A9VZS2-F1-model_v4	DESULFOASV1_1894_YraN_family_protein	AF-A9VZS2-F1-model_v4 UPF0102 protein Mext_0406	0.386	118	68	5	122	14	124	8.039E-10	328
DESULFOASV1_1894_YraN_family_protein	AF-Q39KM3-F1-model_v4	DESULFOASV1_1894_YraN_family_protein	AF-Q39KM3-F1-model_v4 UPF0102 protein Bcep18194_A3391	0.352	118	71	9	126	32	142	9.774E-10	328
DESULFOASV1_1894_YraN_family_protein	AF-Q5SLC1-F1-model_v4	DESULFOASV1_1894_YraN_family_protein	AF-Q5SLC1-F1-model_v4 UPF0102 protein TTHA0372	0.365	114	68	5	118	2	109	6.195E-10	327
DESULFOASV1_1894_YraN_family_protein	AF-Q0BJB0-F1-model_v4	DESULFOASV1_1894_YraN_family_protein	AF-Q0BJB0-F1-model_v4 UPF0102 protein Bamb_0202	0.355	117	70	9	125	32	141	1.043E-09	327
DESULFOASV1_1894_YraN_family_protein	AF-A7MWM0-F1-model_v4	DESULFOASV1_1894_YraN_family_protein	AF-A7MWM0-F1-model_v4 UPF0102 protein VIBHAR_00890	0.313	113	75	9	121	10	119	5.804E-10	326
DESULFOASV1_1894_YraN_family_protein	AF-A4YJR8-F1-model_v4	DESULFOASV1_1894_YraN_family_protein	AF-A4YJR8-F1-model_v4 UPF0102 protein BRADO0179	0.375	119	69	5	123	28	139	1.268E-09	326
DESULFOASV1_1894_YraN_family_protein	AF-B2V8B3-F1-model_v4	DESULFOASV1_1894_YraN_family_protein	AF-B2V8B3-F1-model_v4 UPF0102 protein SYO3AOP1_0546	0.325	116	73	6	121	4	112	5.438E-10	325
DESULFOASV1_1894_YraN_family_protein	AF-Q9JWJ8-F1-model_v4	DESULFOASV1_1894_YraN_family_protein	AF-Q9JWJ8-F1-model_v4 UPF0102 protein NMA0341	0.315	114	73	7	120	6	113	1.445E-09	325
DESULFOASV1_1894_YraN_family_protein	AF-C3LS70-F1-model_v4	DESULFOASV1_1894_YraN_family_protein	AF-C3LS70-F1-model_v4 UPF0102 protein VCM66_0538	0.293	114	78	7	120	8	118	1.113E-09	325
DESULFOASV1_1894_YraN_family_protein	AF-A9WP53-F1-model_v4	DESULFOASV1_1894_YraN_family_protein	AF-A9WP53-F1-model_v4 UPF0102 protein RSal33209_1090	0.377	114	69	6	119	5	116	2.597E-09	324
DESULFOASV1_1894_YraN_family_protein	AF-A2S703-F1-model_v4	DESULFOASV1_1894_YraN_family_protein	AF-A2S703-F1-model_v4 UPF0102 protein BMA10229_A1742	0.344	118	72	9	126	33	143	5.095E-10	324
DESULFOASV1_1894_YraN_family_protein	AF-Q82WG7-F1-model_v4	DESULFOASV1_1894_YraN_family_protein	AF-Q82WG7-F1-model_v4 UPF0102 protein NE0711	0.318	116	75	7	122	6	116	1.445E-09	323
DESULFOASV1_1894_YraN_family_protein	AF-B5FB46-F1-model_v4	DESULFOASV1_1894_YraN_family_protein	AF-B5FB46-F1-model_v4 UPF0102 protein VFMJ11_2324	0.306	120	82	1	120	1	119	5.438E-10	323
DESULFOASV1_1894_YraN_family_protein	AF-Q8G5R9-F1-model_v4	DESULFOASV1_1894_YraN_family_protein	AF-Q8G5R9-F1-model_v4 UPF0102 protein BL0935	0.370	113	71	9	121	12	124	1.354E-09	323
DESULFOASV1_1894_YraN_family_protein	AF-A0KPY4-F1-model_v4	DESULFOASV1_1894_YraN_family_protein	AF-A0KPY4-F1-model_v4 UPF0102 protein AHA_3896	0.348	110	68	12	121	26	130	3.679E-10	323
DESULFOASV1_1894_YraN_family_protein	AF-Q6FD45-F1-model_v4	DESULFOASV1_1894_YraN_family_protein	AF-Q6FD45-F1-model_v4 UPF0102 protein ACIAD1132	0.283	127	83	5	121	12	138	4.774E-10	323
DESULFOASV1_1894_YraN_family_protein	AF-Q7MSG7-F1-model_v4	DESULFOASV1_1894_YraN_family_protein	AF-Q7MSG7-F1-model_v4 UPF0102 protein WS0451	0.315	111	68	9	119	6	105	1.113E-09	322
DESULFOASV1_1894_YraN_family_protein	AF-B7GSU4-F1-model_v4	DESULFOASV1_1894_YraN_family_protein	AF-B7GSU4-F1-model_v4 UPF0102 protein Blon_1698/BLIJ_1758	0.362	113	71	9	121	12	124	1.445E-09	322
DESULFOASV1_1894_YraN_family_protein	AF-A7HZY2-F1-model_v4	DESULFOASV1_1894_YraN_family_protein	AF-A7HZY2-F1-model_v4 UPF0102 protein CHAB381_0216	0.269	115	76	5	119	5	109	1.875E-09	321
DESULFOASV1_1894_YraN_family_protein	AF-Q04SX0-F1-model_v4	DESULFOASV1_1894_YraN_family_protein	AF-Q04SX0-F1-model_v4 UPF0102 protein LBJ_1427	0.286	121	82	1	121	1	116	2.280E-09	321
DESULFOASV1_1894_YraN_family_protein	AF-A5IKG8-F1-model_v4	DESULFOASV1_1894_YraN_family_protein	AF-A5IKG8-F1-model_v4 UPF0102 protein Tpet_0671	0.372	110	62	12	121	7	106	2.136E-09	320
DESULFOASV1_1894_YraN_family_protein	AF-Q2YCL8-F1-model_v4	DESULFOASV1_1894_YraN_family_protein	AF-Q2YCL8-F1-model_v4 UPF0102 protein Nmul_A0195	0.342	114	71	9	122	7	115	1.542E-09	320
DESULFOASV1_1894_YraN_family_protein	AF-Q9KUE1-F1-model_v4	DESULFOASV1_1894_YraN_family_protein	AF-Q9KUE1-F1-model_v4 UPF0102 protein VC_0580	0.293	114	78	7	120	8	118	1.646E-09	320
DESULFOASV1_1894_YraN_family_protein	AF-A3PXX6-F1-model_v4	DESULFOASV1_1894_YraN_family_protein	AF-A3PXX6-F1-model_v4 UPF0102 protein Mjls_1965	0.336	114	75	8	121	22	135	2.001E-09	320
DESULFOASV1_1894_YraN_family_protein	AF-A1KWG5-F1-model_v4	DESULFOASV1_1894_YraN_family_protein	AF-A1KWG5-F1-model_v4 UPF0102 protein NMC2069	0.315	114	73	7	120	6	113	1.646E-09	319
DESULFOASV1_1894_YraN_family_protein	AF-B0TL64-F1-model_v4	DESULFOASV1_1894_YraN_family_protein	AF-B0TL64-F1-model_v4 UPF0102 protein Shal_4069	0.286	115	76	7	121	7	113	2.001E-09	318
DESULFOASV1_1894_YraN_family_protein	AF-Q9WY95-F1-model_v4	DESULFOASV1_1894_YraN_family_protein	AF-Q9WY95-F1-model_v4 UPF0102 protein TM_0253	0.372	110	62	12	121	7	106	2.772E-09	317
DESULFOASV1_1894_YraN_family_protein	AF-A1SU47-F1-model_v4	DESULFOASV1_1894_YraN_family_protein	AF-A1SU47-F1-model_v4 UPF0102 protein Ping_1176	0.258	115	80	7	121	12	120	2.958E-09	317
DESULFOASV1_1894_YraN_family_protein	AF-A3N211-F1-model_v4	DESULFOASV1_1894_YraN_family_protein	AF-A3N211-F1-model_v4 UPF0102 protein APL_1363	0.302	116	78	5	120	9	121	8.039E-10	317
DESULFOASV1_1894_YraN_family_protein	AF-Q8XUC6-F1-model_v4	DESULFOASV1_1894_YraN_family_protein	AF-Q8XUC6-F1-model_v4 UPF0102 protein RSc3265	0.322	117	77	7	123	15	128	2.001E-09	317
DESULFOASV1_1894_YraN_family_protein	AF-Q82JX1-F1-model_v4	DESULFOASV1_1894_YraN_family_protein	AF-Q82JX1-F1-model_v4 UPF0102 protein SAV_2633/SAV2633	0.338	120	79	2	121	29	148	1.268E-09	317
DESULFOASV1_1894_YraN_family_protein	AF-Q6NCZ4-F1-model_v4	DESULFOASV1_1894_YraN_family_protein	AF-Q6NCZ4-F1-model_v4 UPF0102 protein RPA0323	0.350	119	72	5	123	17	128	2.136E-09	316
DESULFOASV1_1894_YraN_family_protein	AF-A3P0J9-F1-model_v4	DESULFOASV1_1894_YraN_family_protein	AF-A3P0J9-F1-model_v4 UPF0102 protein BURPS1106A_3900	0.336	118	73	9	126	33	143	1.542E-09	316
DESULFOASV1_1894_YraN_family_protein	AF-Q87SH5-F1-model_v4	DESULFOASV1_1894_YraN_family_protein	AF-Q87SH5-F1-model_v4 UPF0102 protein VP0448	0.293	115	78	7	121	8	118	1.354E-09	315
DESULFOASV1_1894_YraN_family_protein	AF-B0BQV2-F1-model_v4	DESULFOASV1_1894_YraN_family_protein	AF-B0BQV2-F1-model_v4 UPF0102 protein APJL_1381	0.302	116	78	5	120	9	121	8.580E-10	315
DESULFOASV1_1894_YraN_family_protein	AF-B3GYE2-F1-model_v4	DESULFOASV1_1894_YraN_family_protein	AF-B3GYE2-F1-model_v4 UPF0102 protein APP7_1414	0.302	116	78	5	120	9	121	9.774E-10	314
DESULFOASV1_1894_YraN_family_protein	AF-B3R808-F1-model_v4	DESULFOASV1_1894_YraN_family_protein	AF-B3R808-F1-model_v4 UPF0102 protein RALTA_A3032	0.388	124	70	8	131	16	131	5.804E-10	314
DESULFOASV1_1894_YraN_family_protein	AF-Q62G58-F1-model_v4	DESULFOASV1_1894_YraN_family_protein	AF-Q62G58-F1-model_v4 UPF0102 protein BMA2801	0.336	118	73	9	126	33	143	1.445E-09	314
DESULFOASV1_1894_YraN_family_protein	AF-Q1CT46-F1-model_v4	DESULFOASV1_1894_YraN_family_protein	AF-Q1CT46-F1-model_v4 UPF0102 protein HPAG1_0809	0.273	117	76	5	121	8	113	2.597E-09	313
DESULFOASV1_1894_YraN_family_protein	AF-Q7MNW2-F1-model_v4	DESULFOASV1_1894_YraN_family_protein	AF-Q7MNW2-F1-model_v4 UPF0102 protein VV0603	0.289	112	77	9	120	10	118	2.136E-09	313
DESULFOASV1_1894_YraN_family_protein	AF-A3NEP2-F1-model_v4	DESULFOASV1_1894_YraN_family_protein	AF-A3NEP2-F1-model_v4 UPF0102 protein BURPS668_3819	0.336	118	73	9	126	33	143	2.772E-09	313
DESULFOASV1_1894_YraN_family_protein	AF-A1W341-F1-model_v4	DESULFOASV1_1894_YraN_family_protein	AF-A1W341-F1-model_v4 UPF0102 protein Ajs_0414	0.291	114	77	9	122	21	130	1.113E-09	312
DESULFOASV1_1894_YraN_family_protein	AF-Q6A7T5-F1-model_v4	DESULFOASV1_1894_YraN_family_protein	AF-Q6A7T5-F1-model_v4 UPF0102 protein PPA1431	0.330	112	73	8	119	29	138	1.354E-09	312
DESULFOASV1_1894_YraN_family_protein	AF-A4JAG1-F1-model_v4	DESULFOASV1_1894_YraN_family_protein	AF-A4JAG1-F1-model_v4 UPF0102 protein Bcep1808_0248	0.333	125	78	2	126	25	142	2.136E-09	311
DESULFOASV1_1894_YraN_family_protein	AF-A5WCR1-F1-model_v4	DESULFOASV1_1894_YraN_family_protein	AF-A5WCR1-F1-model_v4 UPF0102 protein PsycPRwf_0497	0.285	119	78	12	121	19	137	1.188E-09	310
DESULFOASV1_1894_YraN_family_protein	AF-C0QVG4-F1-model_v4	DESULFOASV1_1894_YraN_family_protein	AF-C0QVG4-F1-model_v4 UPF0102 protein BHWA1_02005	0.328	121	80	1	121	1	120	3.839E-09	308
DESULFOASV1_1894_YraN_family_protein	AF-Q6LME3-F1-model_v4	DESULFOASV1_1894_YraN_family_protein	AF-Q6LME3-F1-model_v4 UPF0102 protein PBPRA3228	0.304	113	76	9	121	13	122	1.268E-09	308
DESULFOASV1_1894_YraN_family_protein	AF-A6VXY8-F1-model_v4	DESULFOASV1_1894_YraN_family_protein	AF-A6VXY8-F1-model_v4 UPF0102 protein Mmwyl1_2395	0.271	113	79	9	121	18	127	7.859E-09	308
DESULFOASV1_1894_YraN_family_protein	AF-A1UZH3-F1-model_v4	DESULFOASV1_1894_YraN_family_protein	AF-A1UZH3-F1-model_v4 UPF0102 protein BMASAVP1_A0024	0.336	118	73	9	126	33	143	2.433E-09	308
DESULFOASV1_1894_YraN_family_protein	AF-A6SUE7-F1-model_v4	DESULFOASV1_1894_YraN_family_protein	AF-A6SUE7-F1-model_v4 UPF0102 protein mma_0204	0.333	117	71	6	122	15	122	9.158E-10	307
DESULFOASV1_1894_YraN_family_protein	AF-B8HA88-F1-model_v4	DESULFOASV1_1894_YraN_family_protein	AF-B8HA88-F1-model_v4 UPF0102 protein Achl_2213	0.330	130	83	8	137	7	131	6.195E-10	307
DESULFOASV1_1894_YraN_family_protein	AF-Q65T14-F1-model_v4	DESULFOASV1_1894_YraN_family_protein	AF-Q65T14-F1-model_v4 UPF0102 protein MS1289	0.283	118	82	5	122	5	119	3.157E-09	306
DESULFOASV1_1894_YraN_family_protein	AF-P45300-F1-model_v4	DESULFOASV1_1894_YraN_family_protein	AF-P45300-F1-model_v4 UPF0102 protein HI_1656	0.279	116	81	5	120	5	117	2.433E-09	306
DESULFOASV1_1894_YraN_family_protein	AF-A1WFK6-F1-model_v4	DESULFOASV1_1894_YraN_family_protein	AF-A1WFK6-F1-model_v4 UPF0102 protein Veis_0630	0.330	116	75	7	122	30	142	2.136E-09	306
DESULFOASV1_1894_YraN_family_protein	AF-A1A0Z4-F1-model_v4	DESULFOASV1_1894_YraN_family_protein	AF-A1A0Z4-F1-model_v4 UPF0102 protein BAD_0596	0.391	110	66	12	121	41	150	2.433E-09	306
DESULFOASV1_1894_YraN_family_protein	AF-A9HJH4-F1-model_v4	DESULFOASV1_1894_YraN_family_protein	AF-A9HJH4-F1-model_v4 UPF0102 protein GDI1964/Gdia_0189	0.338	120	74	2	121	12	124	3.597E-09	305
DESULFOASV1_1894_YraN_family_protein	AF-Q07UR7-F1-model_v4	DESULFOASV1_1894_YraN_family_protein	AF-Q07UR7-F1-model_v4 UPF0102 protein RPE_0358	0.355	120	72	5	124	17	129	4.981E-09	305
DESULFOASV1_1894_YraN_family_protein	AF-Q89WK9-F1-model_v4	DESULFOASV1_1894_YraN_family_protein	AF-Q89WK9-F1-model_v4 UPF0102 protein bll0669	0.355	120	72	5	124	20	132	5.675E-09	304
DESULFOASV1_1894_YraN_family_protein	AF-Q3JY95-F1-model_v4	DESULFOASV1_1894_YraN_family_protein	AF-Q3JY95-F1-model_v4 UPF0102 protein BURPS1710b_0041	0.344	118	72	9	126	33	143	2.433E-09	304
DESULFOASV1_1894_YraN_family_protein	AF-C0QTY9-F1-model_v4	DESULFOASV1_1894_YraN_family_protein	AF-C0QTY9-F1-model_v4 UPF0102 protein PERMA_0362	0.312	112	72	11	122	9	113	3.370E-09	303
DESULFOASV1_1894_YraN_family_protein	AF-A1TJU6-F1-model_v4	DESULFOASV1_1894_YraN_family_protein	AF-A1TJU6-F1-model_v4 UPF0102 protein Aave_0630	0.350	114	71	9	122	24	133	2.772E-09	302
DESULFOASV1_1894_YraN_family_protein	AF-A6Q599-F1-model_v4	DESULFOASV1_1894_YraN_family_protein	AF-A6Q599-F1-model_v4 UPF0102 protein NIS_1551	0.324	111	67	9	119	9	108	5.675E-09	301
DESULFOASV1_1894_YraN_family_protein	AF-B8IT13-F1-model_v4	DESULFOASV1_1894_YraN_family_protein	AF-B8IT13-F1-model_v4 UPF0102 protein Mnod_0024	0.369	118	69	5	122	15	125	2.597E-09	301
DESULFOASV1_1894_YraN_family_protein	AF-A7HZ51-F1-model_v4	DESULFOASV1_1894_YraN_family_protein	AF-A7HZ51-F1-model_v4 UPF0102 protein Plav_3586	0.363	120	70	2	121	21	131	2.433E-09	301
DESULFOASV1_1894_YraN_family_protein	AF-A3MR08-F1-model_v4	DESULFOASV1_1894_YraN_family_protein	AF-A3MR08-F1-model_v4 UPF0102 protein BMA10247_3176	0.344	118	72	9	126	33	143	2.597E-09	301
DESULFOASV1_1894_YraN_family_protein	AF-B9K6M6-F1-model_v4	DESULFOASV1_1894_YraN_family_protein	AF-B9K6M6-F1-model_v4 UPF0102 protein CTN_0433	0.348	109	64	10	118	4	102	6.056E-09	300
DESULFOASV1_1894_YraN_family_protein	AF-Q3AXF2-F1-model_v4	DESULFOASV1_1894_YraN_family_protein	AF-Q3AXF2-F1-model_v4 UPF0102 protein Syncc9902_1284	0.284	114	80	5	118	4	116	5.317E-09	300
DESULFOASV1_1894_YraN_family_protein	AF-A1VXN2-F1-model_v4	DESULFOASV1_1894_YraN_family_protein	AF-A1VXN2-F1-model_v4 UPF0102 protein CJJ81176_0184	0.252	119	81	1	119	1	109	1.717E-08	298
DESULFOASV1_1894_YraN_family_protein	AF-Q0I2P6-F1-model_v4	DESULFOASV1_1894_YraN_family_protein	AF-Q0I2P6-F1-model_v4 UPF0102 protein HS_0739	0.284	114	79	7	120	7	117	4.667E-09	298
DESULFOASV1_1894_YraN_family_protein	AF-A9GEX7-F1-model_v4	DESULFOASV1_1894_YraN_family_protein	AF-A9GEX7-F1-model_v4 UPF0102 protein sce2912	0.296	120	83	2	121	26	144	3.157E-09	298
DESULFOASV1_1894_YraN_family_protein	AF-Q12GI7-F1-model_v4	DESULFOASV1_1894_YraN_family_protein	AF-Q12GI7-F1-model_v4 UPF0102 protein Bpro_0391	0.330	121	77	8	123	28	148	4.373E-09	298
DESULFOASV1_1894_YraN_family_protein	AF-A5UF93-F1-model_v4	DESULFOASV1_1894_YraN_family_protein	AF-A5UF93-F1-model_v4 UPF0102 protein CGSHiGG_01960	0.279	116	81	5	120	5	117	4.981E-09	297
DESULFOASV1_1894_YraN_family_protein	AF-Q5LWE2-F1-model_v4	DESULFOASV1_1894_YraN_family_protein	AF-Q5LWE2-F1-model_v4 UPF0102 protein SPO0400	0.338	117	71	5	121	12	120	3.597E-09	297
DESULFOASV1_1894_YraN_family_protein	AF-Q1QRV0-F1-model_v4	DESULFOASV1_1894_YraN_family_protein	AF-Q1QRV0-F1-model_v4 UPF0102 protein Nham_0146	0.363	120	71	5	124	22	134	8.953E-09	297
DESULFOASV1_1894_YraN_family_protein	AF-A5UBM3-F1-model_v4	DESULFOASV1_1894_YraN_family_protein	AF-A5UBM3-F1-model_v4 UPF0102 protein CGSHiEE_03775	0.279	116	81	5	120	5	117	5.675E-09	296
DESULFOASV1_1894_YraN_family_protein	AF-P57862-F1-model_v4	DESULFOASV1_1894_YraN_family_protein	AF-P57862-F1-model_v4 UPF0102 protein PM0647	0.296	116	79	5	120	5	117	4.667E-09	296
DESULFOASV1_1894_YraN_family_protein	AF-B3PZ58-F1-model_v4	DESULFOASV1_1894_YraN_family_protein	AF-B3PZ58-F1-model_v4 UPF0102 protein RHECIAT_CH0000358	0.381	117	67	5	121	13	122	3.157E-09	296
DESULFOASV1_1894_YraN_family_protein	AF-B1ZJ78-F1-model_v4	DESULFOASV1_1894_YraN_family_protein	AF-B1ZJ78-F1-model_v4 UPF0102 protein Mpop_0474	0.386	118	68	5	122	14	124	8.388E-09	296
DESULFOASV1_1894_YraN_family_protein	AF-Q1LHS4-F1-model_v4	DESULFOASV1_1894_YraN_family_protein	AF-Q1LHS4-F1-model_v4 UPF0102 protein Rmet_3430	0.328	131	84	5	135	9	134	1.354E-09	296
DESULFOASV1_1894_YraN_family_protein	AF-B1M445-F1-model_v4	DESULFOASV1_1894_YraN_family_protein	AF-B1M445-F1-model_v4 UPF0102 protein Mrad2831_2938	0.321	113	71	9	121	19	124	4.667E-09	295
DESULFOASV1_1894_YraN_family_protein	AF-A0RMR3-F1-model_v4	DESULFOASV1_1894_YraN_family_protein	AF-A0RMR3-F1-model_v4 UPF0102 protein CFF8240_0294	0.241	115	79	5	119	5	109	7.364E-09	294
DESULFOASV1_1894_YraN_family_protein	AF-A7H1M6-F1-model_v4	DESULFOASV1_1894_YraN_family_protein	AF-A7H1M6-F1-model_v4 UPF0102 protein JJD26997_0163	0.241	116	79	5	120	6	110	1.508E-08	294
DESULFOASV1_1894_YraN_family_protein	AF-Q050Z4-F1-model_v4	DESULFOASV1_1894_YraN_family_protein	AF-Q050Z4-F1-model_v4 UPF0102 protein LBL_1651	0.298	113	75	9	121	9	116	1.413E-08	294
DESULFOASV1_1894_YraN_family_protein	AF-Q4QJT7-F1-model_v4	DESULFOASV1_1894_YraN_family_protein	AF-Q4QJT7-F1-model_v4 UPF0102 protein NTHI1958	0.279	116	81	5	120	5	117	6.899E-09	294
DESULFOASV1_1894_YraN_family_protein	AF-B0UTT1-F1-model_v4	DESULFOASV1_1894_YraN_family_protein	AF-B0UTT1-F1-model_v4 UPF0102 protein HSM_1206	0.284	114	79	7	120	7	117	6.899E-09	294
DESULFOASV1_1894_YraN_family_protein	AF-Q0K5T4-F1-model_v4	DESULFOASV1_1894_YraN_family_protein	AF-Q0K5T4-F1-model_v4 UPF0102 protein H16_A3579	0.356	127	76	5	131	13	131	5.675E-09	294
DESULFOASV1_1894_YraN_family_protein	AF-Q21RN1-F1-model_v4	DESULFOASV1_1894_YraN_family_protein	AF-Q21RN1-F1-model_v4 UPF0102 protein Rfer_3873	0.319	114	74	9	122	17	126	4.373E-09	293
DESULFOASV1_1894_YraN_family_protein	AF-Q21CJ1-F1-model_v4	DESULFOASV1_1894_YraN_family_protein	AF-Q21CJ1-F1-model_v4 UPF0102 protein RPC_0320	0.366	119	70	5	123	22	133	1.413E-08	293
DESULFOASV1_1894_YraN_family_protein	AF-Q17XU9-F1-model_v4	DESULFOASV1_1894_YraN_family_protein	AF-Q17XU9-F1-model_v4 UPF0102 protein Hac_0727	0.290	117	75	5	121	8	113	6.899E-09	292
DESULFOASV1_1894_YraN_family_protein	AF-B6JM54-F1-model_v4	DESULFOASV1_1894_YraN_family_protein	AF-B6JM54-F1-model_v4 UPF0102 protein HPP12_0830	0.286	115	74	5	119	8	111	1.020E-08	292
DESULFOASV1_1894_YraN_family_protein	AF-Q5F5E2-F1-model_v4	DESULFOASV1_1894_YraN_family_protein	AF-Q5F5E2-F1-model_v4 UPF0102 protein NGO1987	0.296	114	75	7	120	6	113	3.370E-09	292
DESULFOASV1_1894_YraN_family_protein	AF-C5CGT1-F1-model_v4	DESULFOASV1_1894_YraN_family_protein	AF-C5CGT1-F1-model_v4 UPF0102 protein Kole_1919	0.369	117	68	5	121	5	113	7.859E-09	292
DESULFOASV1_1894_YraN_family_protein	AF-B2UG56-F1-model_v4	DESULFOASV1_1894_YraN_family_protein	AF-B2UG56-F1-model_v4 UPF0102 protein Rpic_3463	0.322	117	77	7	123	10	123	1.240E-08	292
DESULFOASV1_1894_YraN_family_protein	AF-Q30PA6-F1-model_v4	DESULFOASV1_1894_YraN_family_protein	AF-Q30PA6-F1-model_v4 UPF0102 protein Suden_1901	0.279	111	72	9	119	6	106	1.508E-08	291
DESULFOASV1_1894_YraN_family_protein	AF-Q9PIX9-F1-model_v4	DESULFOASV1_1894_YraN_family_protein	AF-Q9PIX9-F1-model_v4 UPF0102 protein Cj0148c	0.252	119	81	1	119	1	109	2.892E-08	291
DESULFOASV1_1894_YraN_family_protein	AF-B5ZYH2-F1-model_v4	DESULFOASV1_1894_YraN_family_protein	AF-B5ZYH2-F1-model_v4 UPF0102 protein Rleg2_4331	0.372	117	68	5	121	13	122	4.981E-09	291
DESULFOASV1_1894_YraN_family_protein	AF-Q73KB6-F1-model_v4	DESULFOASV1_1894_YraN_family_protein	AF-Q73KB6-F1-model_v4 UPF0102 protein TDE_2303	0.286	122	81	8	121	4	125	4.097E-09	291
DESULFOASV1_1894_YraN_family_protein	AF-Q2STV7-F1-model_v4	DESULFOASV1_1894_YraN_family_protein	AF-Q2STV7-F1-model_v4 UPF0102 protein BTH_I3148	0.342	113	69	9	121	33	138	4.373E-09	291
DESULFOASV1_1894_YraN_family_protein	AF-Q8FP66-F1-model_v4	DESULFOASV1_1894_YraN_family_protein	AF-Q8FP66-F1-model_v4 UPF0102 protein CE1920	0.347	113	71	7	119	7	116	6.899E-09	290
DESULFOASV1_1894_YraN_family_protein	AF-Q0AK98-F1-model_v4	DESULFOASV1_1894_YraN_family_protein	AF-Q0AK98-F1-model_v4 UPF0102 protein Mmar10_3014	0.351	126	77	2	127	4	123	1.240E-08	290
DESULFOASV1_1894_YraN_family_protein	AF-Q2J329-F1-model_v4	DESULFOASV1_1894_YraN_family_protein	AF-Q2J329-F1-model_v4 UPF0102 protein RPB_0420	0.358	119	71	5	123	15	126	1.240E-08	290
DESULFOASV1_1894_YraN_family_protein	AF-B5Z7I8-F1-model_v4	DESULFOASV1_1894_YraN_family_protein	AF-B5Z7I8-F1-model_v4 UPF0102 protein HPG27_782	0.269	115	75	5	119	8	111	1.413E-08	288
DESULFOASV1_1894_YraN_family_protein	AF-Q5HCB3-F1-model_v4	DESULFOASV1_1894_YraN_family_protein	AF-Q5HCB3-F1-model_v4 UPF0102 protein Erum0631/ERWE_CDS_00560	0.279	117	77	5	121	12	119	1.089E-08	288
DESULFOASV1_1894_YraN_family_protein	AF-A6VPC4-F1-model_v4	DESULFOASV1_1894_YraN_family_protein	AF-A6VPC4-F1-model_v4 UPF0102 protein Asuc_1462	0.301	114	77	7	120	7	117	1.162E-08	287
DESULFOASV1_1894_YraN_family_protein	AF-Q5HX17-F1-model_v4	DESULFOASV1_1894_YraN_family_protein	AF-Q5HX17-F1-model_v4 UPF0102 protein CJE0144	0.252	119	81	1	119	1	109	3.516E-08	286
DESULFOASV1_1894_YraN_family_protein	AF-Q9ZL19-F1-model_v4	DESULFOASV1_1894_YraN_family_protein	AF-Q9ZL19-F1-model_v4 UPF0102 protein jhp_0762	0.286	115	74	5	119	8	111	1.833E-08	286
DESULFOASV1_1894_YraN_family_protein	AF-O25499-F1-model_v4	DESULFOASV1_1894_YraN_family_protein	AF-O25499-F1-model_v4 UPF0102 protein HP_0823	0.286	115	74	5	119	8	111	1.833E-08	286
DESULFOASV1_1894_YraN_family_protein	AF-Q8YW20-F1-model_v4	DESULFOASV1_1894_YraN_family_protein	AF-Q8YW20-F1-model_v4 UPF0102 protein alr1796	0.268	134	86	5	122	3	136	2.597E-09	286
DESULFOASV1_1894_YraN_family_protein	AF-Q1MMH6-F1-model_v4	DESULFOASV1_1894_YraN_family_protein	AF-Q1MMH6-F1-model_v4 UPF0102 protein RL0336	0.364	117	69	5	121	13	122	1.508E-08	285
DESULFOASV1_1894_YraN_family_protein	AF-Q31RH5-F1-model_v4	DESULFOASV1_1894_YraN_family_protein	AF-Q31RH5-F1-model_v4 UPF0102 protein Synpcc7942_0312	0.308	130	82	12	130	12	141	2.001E-09	285
DESULFOASV1_1894_YraN_family_protein	AF-B1L9Q0-F1-model_v4	DESULFOASV1_1894_YraN_family_protein	AF-B1L9Q0-F1-model_v4 UPF0102 protein TRQ2_0695	0.385	108	62	12	119	7	107	3.597E-09	284
DESULFOASV1_1894_YraN_family_protein	AF-A8FJV7-F1-model_v4	DESULFOASV1_1894_YraN_family_protein	AF-A8FJV7-F1-model_v4 UPF0102 protein C8J_0145	0.252	119	81	1	119	1	109	3.294E-08	284
DESULFOASV1_1894_YraN_family_protein	AF-Q83G68-F1-model_v4	DESULFOASV1_1894_YraN_family_protein	AF-Q83G68-F1-model_v4 UPF0102 protein TWT_455	0.264	115	82	5	119	7	118	1.323E-08	284
DESULFOASV1_1894_YraN_family_protein	AF-Q1IX45-F1-model_v4	DESULFOASV1_1894_YraN_family_protein	AF-Q1IX45-F1-model_v4 UPF0102 protein Dgeo_1894	0.339	111	71	8	118	2	110	1.956E-08	283
DESULFOASV1_1894_YraN_family_protein	AF-Q83I01-F1-model_v4	DESULFOASV1_1894_YraN_family_protein	AF-Q83I01-F1-model_v4 UPF0102 protein TW312	0.273	115	81	5	119	7	118	1.413E-08	283
DESULFOASV1_1894_YraN_family_protein	AF-A9I0M2-F1-model_v4	DESULFOASV1_1894_YraN_family_protein	AF-A9I0M2-F1-model_v4 UPF0102 protein Bpet0439	0.347	113	72	9	121	50	160	6.899E-09	283
DESULFOASV1_1894_YraN_family_protein	AF-B2UT06-F1-model_v4	DESULFOASV1_1894_YraN_family_protein	AF-B2UT06-F1-model_v4 UPF0102 protein HPSH_02690	0.269	115	75	5	119	8	111	1.609E-08	282
DESULFOASV1_1894_YraN_family_protein	AF-Q6NGK0-F1-model_v4	DESULFOASV1_1894_YraN_family_protein	AF-Q6NGK0-F1-model_v4 UPF0102 protein DIP1513	0.300	119	80	1	119	2	116	2.710E-08	282
DESULFOASV1_1894_YraN_family_protein	AF-Q2RN09-F1-model_v4	DESULFOASV1_1894_YraN_family_protein	AF-Q2RN09-F1-model_v4 UPF0102 protein Rru_A3692	0.300	118	80	5	122	8	122	5.675E-09	282
DESULFOASV1_1894_YraN_family_protein	AF-Q98DM8-F1-model_v4	DESULFOASV1_1894_YraN_family_protein	AF-Q98DM8-F1-model_v4 UPF0102 protein mlr4633	0.398	117	66	5	121	12	121	1.717E-08	282
DESULFOASV1_1894_YraN_family_protein	AF-Q146Q2-F1-model_v4	DESULFOASV1_1894_YraN_family_protein	AF-Q146Q2-F1-model_v4 UPF0102 protein Bxeno_A0149	0.300	116	78	9	124	26	138	1.609E-08	282
DESULFOASV1_1894_YraN_family_protein	AF-B9KDU0-F1-model_v4	DESULFOASV1_1894_YraN_family_protein	AF-B9KDU0-F1-model_v4 UPF0102 protein Cla_1413	0.256	119	80	1	119	1	109	2.892E-08	281
DESULFOASV1_1894_YraN_family_protein	AF-C1CZ90-F1-model_v4	DESULFOASV1_1894_YraN_family_protein	AF-C1CZ90-F1-model_v4 UPF0102 protein Deide_03080	0.345	111	71	8	118	2	111	2.229E-08	280
DESULFOASV1_1894_YraN_family_protein	AF-A1VIW8-F1-model_v4	DESULFOASV1_1894_YraN_family_protein	AF-A1VIW8-F1-model_v4 UPF0102 protein Pnap_0271	0.341	120	75	8	122	32	151	1.020E-08	278
DESULFOASV1_1894_YraN_family_protein	AF-Q0BTH9-F1-model_v4	DESULFOASV1_1894_YraN_family_protein	AF-Q0BTH9-F1-model_v4 UPF0102 protein GbCGDNIH1_0975	0.284	120	80	5	124	41	153	3.294E-08	278
DESULFOASV1_1894_YraN_family_protein	AF-Q5FF38-F1-model_v4	DESULFOASV1_1894_YraN_family_protein	AF-Q5FF38-F1-model_v4 UPF0102 protein ERGA_CDS_00540	0.268	117	78	5	121	12	119	1.833E-08	277
DESULFOASV1_1894_YraN_family_protein	AF-Q7VMZ9-F1-model_v4	DESULFOASV1_1894_YraN_family_protein	AF-Q7VMZ9-F1-model_v4 UPF0102 protein HD_0802	0.319	116	76	5	120	12	124	4.981E-09	276
DESULFOASV1_1894_YraN_family_protein	AF-Q1Q8M8-F1-model_v4	DESULFOASV1_1894_YraN_family_protein	AF-Q1Q8M8-F1-model_v4 UPF0102 protein Pcryo_2198	0.291	137	81	7	121	31	167	3.370E-09	276
DESULFOASV1_1894_YraN_family_protein	AF-A2SMD0-F1-model_v4	DESULFOASV1_1894_YraN_family_protein	AF-A2SMD0-F1-model_v4 UPF0102 protein Mpe_A3766	0.338	114	74	9	122	8	120	2.088E-08	275
DESULFOASV1_1894_YraN_family_protein	AF-Q13E51-F1-model_v4	DESULFOASV1_1894_YraN_family_protein	AF-Q13E51-F1-model_v4 UPF0102 protein RPD_0400	0.341	119	73	5	123	18	129	4.006E-08	275
DESULFOASV1_1894_YraN_family_protein	AF-A8LJ68-F1-model_v4	DESULFOASV1_1894_YraN_family_protein	AF-A8LJ68-F1-model_v4 UPF0102 protein Dshi_2830	0.278	118	79	2	119	21	131	2.088E-08	275
DESULFOASV1_1894_YraN_family_protein	AF-B0T377-F1-model_v4	DESULFOASV1_1894_YraN_family_protein	AF-B0T377-F1-model_v4 UPF0102 protein Caul_0175	0.325	128	80	2	129	20	139	6.464E-09	275
