query	target	qheader	theader	fident	alnlen	mismatch	qstart	qend	tstart	tend	evalue	bits
DESULFOASV1_0444_DUF167_domain-containing_protein	AF-A1KB74-F1-model_v4	DESULFOASV1_0444_DUF167_domain-containing_protein	AF-A1KB74-F1-model_v4 UPF0235 protein azo3464	0.426	89	51	3	91	1	89	5.209E-12	433
DESULFOASV1_0444_DUF167_domain-containing_protein	AF-B0TGP1-F1-model_v4	DESULFOASV1_0444_DUF167_domain-containing_protein	AF-B0TGP1-F1-model_v4 UPF0235 protein Helmi_20270	0.481	81	42	6	86	3	83	1.600E-11	414
DESULFOASV1_0444_DUF167_domain-containing_protein	AF-Q478W6-F1-model_v4	DESULFOASV1_0444_DUF167_domain-containing_protein	AF-Q478W6-F1-model_v4 UPF0235 protein Daro_3887	0.457	83	45	3	85	1	83	1.150E-11	414
DESULFOASV1_0444_DUF167_domain-containing_protein	AF-Q5P6I2-F1-model_v4	DESULFOASV1_0444_DUF167_domain-containing_protein	AF-Q5P6I2-F1-model_v4 UPF0235 protein AZOSEA09540	0.435	85	47	5	89	2	86	4.030E-11	403
DESULFOASV1_0444_DUF167_domain-containing_protein	AF-Q2IPY3-F1-model_v4	DESULFOASV1_0444_DUF167_domain-containing_protein	AF-Q2IPY3-F1-model_v4 UPF0235 protein Adeh_1087	0.402	82	48	5	86	2	82	1.508E-10	392
DESULFOASV1_0444_DUF167_domain-containing_protein	AF-A7H9D8-F1-model_v4	DESULFOASV1_0444_DUF167_domain-containing_protein	AF-A7H9D8-F1-model_v4 UPF0235 protein Anae109_1126	0.397	83	49	5	87	2	83	1.721E-10	387
DESULFOASV1_0444_DUF167_domain-containing_protein	AF-B4UGV4-F1-model_v4	DESULFOASV1_0444_DUF167_domain-containing_protein	AF-B4UGV4-F1-model_v4 UPF0235 protein AnaeK_1146	0.402	82	48	5	86	2	82	2.557E-10	384
DESULFOASV1_0444_DUF167_domain-containing_protein	AF-C6DE33-F1-model_v4	DESULFOASV1_0444_DUF167_domain-containing_protein	AF-C6DE33-F1-model_v4 UPF0235 protein PC1_3453	0.317	82	55	5	86	2	82	1.508E-10	384
DESULFOASV1_0444_DUF167_domain-containing_protein	AF-A0KPB6-F1-model_v4	DESULFOASV1_0444_DUF167_domain-containing_protein	AF-A0KPB6-F1-model_v4 UPF0235 protein AHA_3661	0.348	89	55	6	94	3	88	7.298E-11	384
DESULFOASV1_0444_DUF167_domain-containing_protein	AF-B8JFX1-F1-model_v4	DESULFOASV1_0444_DUF167_domain-containing_protein	AF-B8JFX1-F1-model_v4 UPF0235 protein A2cp1_1215	0.402	82	48	5	86	2	82	2.918E-10	381
DESULFOASV1_0444_DUF167_domain-containing_protein	AF-A5D180-F1-model_v4	DESULFOASV1_0444_DUF167_domain-containing_protein	AF-A5D180-F1-model_v4 UPF0235 protein PTH_1821	0.432	81	45	6	86	3	82	2.732E-10	381
DESULFOASV1_0444_DUF167_domain-containing_protein	AF-A7MZ92-F1-model_v4	DESULFOASV1_0444_DUF167_domain-containing_protein	AF-A7MZ92-F1-model_v4 UPF0235 protein VIBHAR_03581	0.360	86	54	3	88	1	85	1.237E-10	376
DESULFOASV1_0444_DUF167_domain-containing_protein	AF-Q3K595-F1-model_v4	DESULFOASV1_0444_DUF167_domain-containing_protein	AF-Q3K595-F1-model_v4 UPF0235 protein Pfl01_5322	0.355	90	55	5	94	2	88	1.412E-10	375
DESULFOASV1_0444_DUF167_domain-containing_protein	AF-Q07Z62-F1-model_v4	DESULFOASV1_0444_DUF167_domain-containing_protein	AF-Q07Z62-F1-model_v4 UPF0235 protein Sfri_2863	0.364	85	52	5	86	2	86	1.322E-10	374
DESULFOASV1_0444_DUF167_domain-containing_protein	AF-Q6D118-F1-model_v4	DESULFOASV1_0444_DUF167_domain-containing_protein	AF-Q6D118-F1-model_v4 UPF0235 protein ECA3630	0.317	82	55	5	86	2	82	3.557E-10	372
DESULFOASV1_0444_DUF167_domain-containing_protein	AF-C5BCR7-F1-model_v4	DESULFOASV1_0444_DUF167_domain-containing_protein	AF-C5BCR7-F1-model_v4 UPF0235 protein NT01EI_0281	0.329	82	54	5	86	2	82	2.918E-10	372
DESULFOASV1_0444_DUF167_domain-containing_protein	AF-A4XZY4-F1-model_v4	DESULFOASV1_0444_DUF167_domain-containing_protein	AF-A4XZY4-F1-model_v4 UPF0235 protein Pmen_4153	0.422	90	50	5	94	2	88	1.412E-10	372
DESULFOASV1_0444_DUF167_domain-containing_protein	AF-Q87LJ3-F1-model_v4	DESULFOASV1_0444_DUF167_domain-containing_protein	AF-Q87LJ3-F1-model_v4 UPF0235 protein VP2619	0.336	92	58	3	94	1	89	1.015E-10	371
DESULFOASV1_0444_DUF167_domain-containing_protein	AF-B3PFH5-F1-model_v4	DESULFOASV1_0444_DUF167_domain-containing_protein	AF-B3PFH5-F1-model_v4 UPF0235 protein CJA_0091	0.297	84	58	3	86	4	86	2.918E-10	371
DESULFOASV1_0444_DUF167_domain-containing_protein	AF-A1RHL9-F1-model_v4	DESULFOASV1_0444_DUF167_domain-containing_protein	AF-A1RHL9-F1-model_v4 UPF0235 protein Sputw3181_1321	0.302	86	59	5	90	2	86	2.394E-10	369
DESULFOASV1_0444_DUF167_domain-containing_protein	AF-B1KIX3-F1-model_v4	DESULFOASV1_0444_DUF167_domain-containing_protein	AF-B1KIX3-F1-model_v4 UPF0235 protein Swoo_1329	0.292	89	60	6	94	3	88	1.611E-10	368
DESULFOASV1_0444_DUF167_domain-containing_protein	AF-Q1CB83-F1-model_v4	DESULFOASV1_0444_DUF167_domain-containing_protein	AF-Q1CB83-F1-model_v4 UPF0235 protein YPA_0321	0.344	90	56	5	94	2	88	2.098E-10	366
DESULFOASV1_0444_DUF167_domain-containing_protein	AF-A4Y8X6-F1-model_v4	DESULFOASV1_0444_DUF167_domain-containing_protein	AF-A4Y8X6-F1-model_v4 UPF0235 protein Sputcn32_2690	0.311	90	59	5	94	2	88	2.918E-10	366
DESULFOASV1_0444_DUF167_domain-containing_protein	AF-A4J2F3-F1-model_v4	DESULFOASV1_0444_DUF167_domain-containing_protein	AF-A4J2F3-F1-model_v4 UPF0235 protein Dred_0717	0.375	80	49	7	86	4	82	6.882E-10	364
DESULFOASV1_0444_DUF167_domain-containing_protein	AF-A8FSL7-F1-model_v4	DESULFOASV1_0444_DUF167_domain-containing_protein	AF-A8FSL7-F1-model_v4 UPF0235 protein Ssed_1229	0.280	89	61	6	94	3	88	1.964E-10	364
DESULFOASV1_0444_DUF167_domain-containing_protein	AF-Q4K4D4-F1-model_v4	DESULFOASV1_0444_DUF167_domain-containing_protein	AF-Q4K4D4-F1-model_v4 UPF0235 protein PFL_5841	0.411	90	51	5	94	2	88	2.732E-10	364
DESULFOASV1_0444_DUF167_domain-containing_protein	AF-Q8EBY9-F1-model_v4	DESULFOASV1_0444_DUF167_domain-containing_protein	AF-Q8EBY9-F1-model_v4 UPF0235 protein SO_3356	0.311	90	59	5	94	2	88	2.918E-10	363
DESULFOASV1_0444_DUF167_domain-containing_protein	AF-A0KUF7-F1-model_v4	DESULFOASV1_0444_DUF167_domain-containing_protein	AF-A0KUF7-F1-model_v4 UPF0235 protein Shewana3_1191	0.317	82	55	5	86	2	82	5.646E-10	361
DESULFOASV1_0444_DUF167_domain-containing_protein	AF-Q666N2-F1-model_v4	DESULFOASV1_0444_DUF167_domain-containing_protein	AF-Q666N2-F1-model_v4 UPF0235 protein YPTB3216	0.344	90	56	5	94	2	88	2.918E-10	361
DESULFOASV1_0444_DUF167_domain-containing_protein	AF-Q1CEW2-F1-model_v4	DESULFOASV1_0444_DUF167_domain-containing_protein	AF-Q1CEW2-F1-model_v4 UPF0235 protein YPN_3141	0.344	90	56	5	94	2	88	3.330E-10	360
DESULFOASV1_0444_DUF167_domain-containing_protein	AF-B3GYF9-F1-model_v4	DESULFOASV1_0444_DUF167_domain-containing_protein	AF-B3GYF9-F1-model_v4 UPF0235 protein APP7_1431	0.287	87	61	5	90	2	88	3.800E-10	360
DESULFOASV1_0444_DUF167_domain-containing_protein	AF-C1DI68-F1-model_v4	DESULFOASV1_0444_DUF167_domain-containing_protein	AF-C1DI68-F1-model_v4 UPF0235 protein Avin_03050	0.400	90	52	5	94	2	88	2.918E-10	360
DESULFOASV1_0444_DUF167_domain-containing_protein	AF-A1S8H7-F1-model_v4	DESULFOASV1_0444_DUF167_domain-containing_protein	AF-A1S8H7-F1-model_v4 UPF0235 protein Sama_2480	0.333	90	57	5	94	2	88	3.800E-10	359
DESULFOASV1_0444_DUF167_domain-containing_protein	AF-A4TI69-F1-model_v4	DESULFOASV1_0444_DUF167_domain-containing_protein	AF-A4TI69-F1-model_v4 UPF0235 protein YPDSF_0571	0.344	90	56	5	94	2	88	3.800E-10	358
DESULFOASV1_0444_DUF167_domain-containing_protein	AF-B5YQF1-F1-model_v4	DESULFOASV1_0444_DUF167_domain-containing_protein	AF-B5YQF1-F1-model_v4 UPF0235 protein YggU	0.311	90	59	5	94	2	88	3.800E-10	358
DESULFOASV1_0444_DUF167_domain-containing_protein	AF-C1D6C4-F1-model_v4	DESULFOASV1_0444_DUF167_domain-containing_protein	AF-C1D6C4-F1-model_v4 UPF0235 protein LHK_03181	0.390	82	49	5	86	2	82	4.059E-10	358
DESULFOASV1_0444_DUF167_domain-containing_protein	AF-B1JNN7-F1-model_v4	DESULFOASV1_0444_DUF167_domain-containing_protein	AF-B1JNN7-F1-model_v4 UPF0235 protein YPK_0828	0.344	90	56	5	94	2	88	4.059E-10	356
DESULFOASV1_0444_DUF167_domain-containing_protein	AF-Q1IIU5-F1-model_v4	DESULFOASV1_0444_DUF167_domain-containing_protein	AF-Q1IIU5-F1-model_v4 UPF0235 protein Acid345_4205	0.387	80	48	7	86	4	82	1.167E-09	356
DESULFOASV1_0444_DUF167_domain-containing_protein	AF-C3LRX5-F1-model_v4	DESULFOASV1_0444_DUF167_domain-containing_protein	AF-C3LRX5-F1-model_v4 UPF0235 protein VCM66_0443	0.292	88	62	5	92	2	89	4.059E-10	356
DESULFOASV1_0444_DUF167_domain-containing_protein	AF-Q0AE64-F1-model_v4	DESULFOASV1_0444_DUF167_domain-containing_protein	AF-Q0AE64-F1-model_v4 UPF0235 protein Neut_2146	0.294	85	59	6	89	3	87	6.882E-10	356
DESULFOASV1_0444_DUF167_domain-containing_protein	AF-Q9KUQ7-F1-model_v4	DESULFOASV1_0444_DUF167_domain-containing_protein	AF-Q9KUQ7-F1-model_v4 UPF0235 protein VC_0458	0.280	88	63	5	92	2	89	4.336E-10	355
DESULFOASV1_0444_DUF167_domain-containing_protein	AF-A3QC07-F1-model_v4	DESULFOASV1_0444_DUF167_domain-containing_protein	AF-A3QC07-F1-model_v4 UPF0235 protein Shew_1134	0.298	86	60	6	91	3	88	4.632E-10	354
DESULFOASV1_0444_DUF167_domain-containing_protein	AF-Q8KBF5-F1-model_v4	DESULFOASV1_0444_DUF167_domain-containing_protein	AF-Q8KBF5-F1-model_v4 UPF0235 protein CT1832	0.390	82	49	5	86	2	82	1.519E-09	354
DESULFOASV1_0444_DUF167_domain-containing_protein	AF-C4LCM6-F1-model_v4	DESULFOASV1_0444_DUF167_domain-containing_protein	AF-C4LCM6-F1-model_v4 UPF0235 protein Tola_0962	0.361	83	52	6	88	3	84	8.389E-10	353
DESULFOASV1_0444_DUF167_domain-containing_protein	AF-A4SRR7-F1-model_v4	DESULFOASV1_0444_DUF167_domain-containing_protein	AF-A4SRR7-F1-model_v4 UPF0235 protein ASA_3628	0.340	87	57	6	92	3	89	5.285E-10	353
DESULFOASV1_0444_DUF167_domain-containing_protein	AF-Q9CLC6-F1-model_v4	DESULFOASV1_0444_DUF167_domain-containing_protein	AF-Q9CLC6-F1-model_v4 UPF0235 protein PM1313	0.276	94	65	1	94	1	91	1.721E-10	353
DESULFOASV1_0444_DUF167_domain-containing_protein	AF-Q82X93-F1-model_v4	DESULFOASV1_0444_DUF167_domain-containing_protein	AF-Q82X93-F1-model_v4 UPF0235 protein NE0395	0.318	90	60	5	94	2	90	5.285E-10	353
DESULFOASV1_0444_DUF167_domain-containing_protein	AF-B4S4I4-F1-model_v4	DESULFOASV1_0444_DUF167_domain-containing_protein	AF-B4S4I4-F1-model_v4 UPF0235 protein Paes_1868	0.312	80	54	7	86	4	82	1.331E-09	353
DESULFOASV1_0444_DUF167_domain-containing_protein	AF-A1JPU6-F1-model_v4	DESULFOASV1_0444_DUF167_domain-containing_protein	AF-A1JPU6-F1-model_v4 UPF0235 protein YE3436	0.318	87	59	5	91	2	88	6.031E-10	352
DESULFOASV1_0444_DUF167_domain-containing_protein	AF-Q8ZHF5-F1-model_v4	DESULFOASV1_0444_DUF167_domain-containing_protein	AF-Q8ZHF5-F1-model_v4 UPF0235 protein YPO0944/y3330/YP_3498	0.344	90	56	5	94	2	88	5.646E-10	352
DESULFOASV1_0444_DUF167_domain-containing_protein	AF-A7FEY3-F1-model_v4	DESULFOASV1_0444_DUF167_domain-containing_protein	AF-A7FEY3-F1-model_v4 UPF0235 protein YpsIP31758_0827	0.344	90	56	5	94	2	88	6.031E-10	351
DESULFOASV1_0444_DUF167_domain-containing_protein	AF-A5F9H9-F1-model_v4	DESULFOASV1_0444_DUF167_domain-containing_protein	AF-A5F9H9-F1-model_v4 UPF0235 protein VC0395_A0010/VC395_0502	0.300	90	60	5	94	2	88	5.646E-10	351
DESULFOASV1_0444_DUF167_domain-containing_protein	AF-Q0HKZ7-F1-model_v4	DESULFOASV1_0444_DUF167_domain-containing_protein	AF-Q0HKZ7-F1-model_v4 UPF0235 protein Shewmr4_1190	0.300	90	60	5	94	2	88	8.389E-10	350
DESULFOASV1_0444_DUF167_domain-containing_protein	AF-Q65VT1-F1-model_v4	DESULFOASV1_0444_DUF167_domain-containing_protein	AF-Q65VT1-F1-model_v4 UPF0235 protein MS0322	0.250	84	62	5	88	2	84	8.961E-10	348
DESULFOASV1_0444_DUF167_domain-containing_protein	AF-A4WE91-F1-model_v4	DESULFOASV1_0444_DUF167_domain-containing_protein	AF-A4WE91-F1-model_v4 UPF0235 protein Ent638_3359	0.325	88	59	5	92	2	89	6.442E-10	348
DESULFOASV1_0444_DUF167_domain-containing_protein	AF-Q0HX95-F1-model_v4	DESULFOASV1_0444_DUF167_domain-containing_protein	AF-Q0HX95-F1-model_v4 UPF0235 protein Shewmr7_1261	0.300	90	60	5	94	2	88	9.572E-10	348
DESULFOASV1_0444_DUF167_domain-containing_protein	AF-B6I789-F1-model_v4	DESULFOASV1_0444_DUF167_domain-containing_protein	AF-B6I789-F1-model_v4 UPF0235 protein YggU	0.311	90	59	5	94	2	88	6.882E-10	347
DESULFOASV1_0444_DUF167_domain-containing_protein	AF-B5F5M7-F1-model_v4	DESULFOASV1_0444_DUF167_domain-containing_protein	AF-B5F5M7-F1-model_v4 UPF0235 protein YggU	0.277	90	62	5	94	2	88	7.351E-10	345
DESULFOASV1_0444_DUF167_domain-containing_protein	AF-Q5PML0-F1-model_v4	DESULFOASV1_0444_DUF167_domain-containing_protein	AF-Q5PML0-F1-model_v4 UPF0235 protein YggU	0.277	90	62	5	94	2	88	6.442E-10	344
DESULFOASV1_0444_DUF167_domain-containing_protein	AF-Q7MHJ2-F1-model_v4	DESULFOASV1_0444_DUF167_domain-containing_protein	AF-Q7MHJ2-F1-model_v4 UPF0235 protein VV2877	0.304	92	61	3	94	1	89	6.882E-10	344
DESULFOASV1_0444_DUF167_domain-containing_protein	AF-Q8DCB7-F1-model_v4	DESULFOASV1_0444_DUF167_domain-containing_protein	AF-Q8DCB7-F1-model_v4 UPF0235 protein VV1_1522	0.304	92	61	3	94	1	89	5.646E-10	342
DESULFOASV1_0444_DUF167_domain-containing_protein	AF-P52060-F1-model_v4	DESULFOASV1_0444_DUF167_domain-containing_protein	AF-P52060-F1-model_v4 UPF0235 protein YggU	0.311	90	59	5	94	2	88	1.092E-09	342
DESULFOASV1_0444_DUF167_domain-containing_protein	AF-Q0AYD0-F1-model_v4	DESULFOASV1_0444_DUF167_domain-containing_protein	AF-Q0AYD0-F1-model_v4 UPF0235 protein Swol_0959	0.333	86	57	1	86	1	86	7.853E-10	342
DESULFOASV1_0444_DUF167_domain-containing_protein	AF-Q8WUR7-F1-model_v4	DESULFOASV1_0444_DUF167_domain-containing_protein	AF-Q8WUR7-F1-model_v4 UPF0235 protein C15orf40	0.270	85	61	5	89	53	137	2.576E-09	342
DESULFOASV1_0444_DUF167_domain-containing_protein	AF-Q3A6Y1-F1-model_v4	DESULFOASV1_0444_DUF167_domain-containing_protein	AF-Q3A6Y1-F1-model_v4 UPF0235 protein Pcar_0617	0.452	84	45	3	86	1	83	1.852E-09	341
DESULFOASV1_0444_DUF167_domain-containing_protein	AF-B7LFL6-F1-model_v4	DESULFOASV1_0444_DUF167_domain-containing_protein	AF-B7LFL6-F1-model_v4 UPF0235 protein YggU	0.311	90	59	5	94	2	88	1.092E-09	341
DESULFOASV1_0444_DUF167_domain-containing_protein	AF-B7MME1-F1-model_v4	DESULFOASV1_0444_DUF167_domain-containing_protein	AF-B7MME1-F1-model_v4 UPF0235 protein YggU	0.311	90	59	5	94	2	88	1.167E-09	341
DESULFOASV1_0444_DUF167_domain-containing_protein	AF-A7MP89-F1-model_v4	DESULFOASV1_0444_DUF167_domain-containing_protein	AF-A7MP89-F1-model_v4 UPF0235 protein ESA_00387	0.337	88	58	5	92	2	89	1.023E-09	341
DESULFOASV1_0444_DUF167_domain-containing_protein	AF-A0LDU6-F1-model_v4	DESULFOASV1_0444_DUF167_domain-containing_protein	AF-A0LDU6-F1-model_v4 UPF0235 protein Mmc1_3654	0.437	80	44	7	86	4	82	2.257E-09	341
DESULFOASV1_0444_DUF167_domain-containing_protein	AF-B1XFB3-F1-model_v4	DESULFOASV1_0444_DUF167_domain-containing_protein	AF-B1XFB3-F1-model_v4 UPF0235 protein YggU	0.311	90	59	5	94	2	88	1.167E-09	340
DESULFOASV1_0444_DUF167_domain-containing_protein	AF-A3N228-F1-model_v4	DESULFOASV1_0444_DUF167_domain-containing_protein	AF-A3N228-F1-model_v4 UPF0235 protein APL_1380	0.275	87	62	5	90	2	88	1.623E-09	340
DESULFOASV1_0444_DUF167_domain-containing_protein	AF-Q8GWQ6-F1-model_v4	DESULFOASV1_0444_DUF167_domain-containing_protein	AF-Q8GWQ6-F1-model_v4 UPF0235 protein At5g63440	0.273	84	60	4	87	133	216	2.576E-09	340
DESULFOASV1_0444_DUF167_domain-containing_protein	AF-B7UI00-F1-model_v4	DESULFOASV1_0444_DUF167_domain-containing_protein	AF-B7UI00-F1-model_v4 UPF0235 protein YggU	0.298	86	60	5	90	2	87	1.852E-09	339
DESULFOASV1_0444_DUF167_domain-containing_protein	AF-Q0TDP8-F1-model_v4	DESULFOASV1_0444_DUF167_domain-containing_protein	AF-Q0TDP8-F1-model_v4 UPF0235 protein YggU	0.311	90	59	5	94	2	88	1.246E-09	339
DESULFOASV1_0444_DUF167_domain-containing_protein	AF-B7MZQ2-F1-model_v4	DESULFOASV1_0444_DUF167_domain-containing_protein	AF-B7MZQ2-F1-model_v4 UPF0235 protein YggU	0.311	90	59	5	94	2	88	1.331E-09	339
DESULFOASV1_0444_DUF167_domain-containing_protein	AF-Q7NEP3-F1-model_v4	DESULFOASV1_0444_DUF167_domain-containing_protein	AF-Q7NEP3-F1-model_v4 UPF0235 protein glr3835	0.416	84	48	4	87	16	98	1.623E-09	339
DESULFOASV1_0444_DUF167_domain-containing_protein	AF-B7N7K6-F1-model_v4	DESULFOASV1_0444_DUF167_domain-containing_protein	AF-B7N7K6-F1-model_v4 UPF0235 protein YggU	0.311	90	59	5	94	2	88	1.331E-09	338
DESULFOASV1_0444_DUF167_domain-containing_protein	AF-A1AFD9-F1-model_v4	DESULFOASV1_0444_DUF167_domain-containing_protein	AF-A1AFD9-F1-model_v4 UPF0235 protein YggU	0.311	90	59	5	94	2	88	1.422E-09	338
DESULFOASV1_0444_DUF167_domain-containing_protein	AF-B1IT54-F1-model_v4	DESULFOASV1_0444_DUF167_domain-containing_protein	AF-B1IT54-F1-model_v4 UPF0235 protein YggU	0.311	90	59	5	94	2	88	1.331E-09	338
DESULFOASV1_0444_DUF167_domain-containing_protein	AF-B4T5K9-F1-model_v4	DESULFOASV1_0444_DUF167_domain-containing_protein	AF-B4T5K9-F1-model_v4 UPF0235 protein YggU	0.277	90	62	5	94	2	88	1.092E-09	338
DESULFOASV1_0444_DUF167_domain-containing_protein	AF-A8GJ38-F1-model_v4	DESULFOASV1_0444_DUF167_domain-containing_protein	AF-A8GJ38-F1-model_v4 UPF0235 protein Spro_4033	0.333	90	57	5	94	2	88	1.519E-09	338
DESULFOASV1_0444_DUF167_domain-containing_protein	AF-B7NI16-F1-model_v4	DESULFOASV1_0444_DUF167_domain-containing_protein	AF-B7NI16-F1-model_v4 UPF0235 protein YggU	0.311	90	59	5	94	2	88	1.331E-09	338
DESULFOASV1_0444_DUF167_domain-containing_protein	AF-Q8FE28-F1-model_v4	DESULFOASV1_0444_DUF167_domain-containing_protein	AF-Q8FE28-F1-model_v4 UPF0235 protein YggU	0.311	90	59	5	94	2	88	1.331E-09	338
DESULFOASV1_0444_DUF167_domain-containing_protein	AF-B4SES7-F1-model_v4	DESULFOASV1_0444_DUF167_domain-containing_protein	AF-B4SES7-F1-model_v4 UPF0235 protein Ppha_2415	0.325	80	53	7	86	4	82	2.576E-09	338
DESULFOASV1_0444_DUF167_domain-containing_protein	AF-Q3J6V4-F1-model_v4	DESULFOASV1_0444_DUF167_domain-containing_protein	AF-Q3J6V4-F1-model_v4 UPF0235 protein Noc_3000	0.302	95	64	2	94	1	95	3.557E-10	337
DESULFOASV1_0444_DUF167_domain-containing_protein	AF-B7LYY3-F1-model_v4	DESULFOASV1_0444_DUF167_domain-containing_protein	AF-B7LYY3-F1-model_v4 UPF0235 protein YggU	0.311	90	59	5	94	2	88	1.519E-09	336
DESULFOASV1_0444_DUF167_domain-containing_protein	AF-B1LDG2-F1-model_v4	DESULFOASV1_0444_DUF167_domain-containing_protein	AF-B1LDG2-F1-model_v4 UPF0235 protein YggU	0.311	90	59	5	94	2	88	1.623E-09	336
DESULFOASV1_0444_DUF167_domain-containing_protein	AF-B8F6W0-F1-model_v4	DESULFOASV1_0444_DUF167_domain-containing_protein	AF-B8F6W0-F1-model_v4 UPF0235 protein HAPS_1504	0.258	85	62	5	88	2	86	2.113E-09	336
DESULFOASV1_0444_DUF167_domain-containing_protein	AF-Q83JS1-F1-model_v4	DESULFOASV1_0444_DUF167_domain-containing_protein	AF-Q83JS1-F1-model_v4 UPF0235 protein YggU	0.311	90	59	5	94	2	88	1.852E-09	335
DESULFOASV1_0444_DUF167_domain-containing_protein	AF-A9MQS2-F1-model_v4	DESULFOASV1_0444_DUF167_domain-containing_protein	AF-A9MQS2-F1-model_v4 UPF0235 protein YggU	0.300	90	60	5	94	2	88	1.978E-09	335
DESULFOASV1_0444_DUF167_domain-containing_protein	AF-B0UWD6-F1-model_v4	DESULFOASV1_0444_DUF167_domain-containing_protein	AF-B0UWD6-F1-model_v4 UPF0235 protein HSM_1819	0.337	89	56	6	94	3	88	1.092E-09	335
DESULFOASV1_0444_DUF167_domain-containing_protein	AF-Q0I525-F1-model_v4	DESULFOASV1_0444_DUF167_domain-containing_protein	AF-Q0I525-F1-model_v4 UPF0235 protein HS_1657	0.333	86	57	6	91	3	88	8.961E-10	335
DESULFOASV1_0444_DUF167_domain-containing_protein	AF-A8ZS81-F1-model_v4	DESULFOASV1_0444_DUF167_domain-containing_protein	AF-A8ZS81-F1-model_v4 UPF0235 protein Dole_0289	0.321	83	56	7	89	4	86	2.411E-09	335
DESULFOASV1_0444_DUF167_domain-containing_protein	AF-Q8XCU6-F1-model_v4	DESULFOASV1_0444_DUF167_domain-containing_protein	AF-Q8XCU6-F1-model_v4 UPF0235 protein YggU	0.311	90	59	5	94	2	88	1.092E-09	334
DESULFOASV1_0444_DUF167_domain-containing_protein	AF-B7LPS0-F1-model_v4	DESULFOASV1_0444_DUF167_domain-containing_protein	AF-B7LPS0-F1-model_v4 UPF0235 protein YggU	0.311	90	59	5	94	2	88	1.978E-09	334
DESULFOASV1_0444_DUF167_domain-containing_protein	AF-A9N4P8-F1-model_v4	DESULFOASV1_0444_DUF167_domain-containing_protein	AF-A9N4P8-F1-model_v4 UPF0235 protein YggU	0.292	82	57	5	86	2	82	2.576E-09	334
DESULFOASV1_0444_DUF167_domain-containing_protein	AF-B8E927-F1-model_v4	DESULFOASV1_0444_DUF167_domain-containing_protein	AF-B8E927-F1-model_v4 UPF0235 protein Sbal223_1335	0.311	90	59	5	94	2	88	8.389E-10	334
DESULFOASV1_0444_DUF167_domain-containing_protein	AF-Q2NRC0-F1-model_v4	DESULFOASV1_0444_DUF167_domain-containing_protein	AF-Q2NRC0-F1-model_v4 UPF0235 protein SG2030	0.333	86	57	1	86	1	86	7.853E-10	334
DESULFOASV1_0444_DUF167_domain-containing_protein	AF-C5A0M2-F1-model_v4	DESULFOASV1_0444_DUF167_domain-containing_protein	AF-C5A0M2-F1-model_v4 UPF0235 protein YggU	0.311	90	59	5	94	2	88	2.113E-09	333
DESULFOASV1_0444_DUF167_domain-containing_protein	AF-Q8ZM46-F1-model_v4	DESULFOASV1_0444_DUF167_domain-containing_protein	AF-Q8ZM46-F1-model_v4 UPF0235 protein YggU	0.277	90	62	5	94	2	88	1.422E-09	333
DESULFOASV1_0444_DUF167_domain-containing_protein	AF-Q7VN15-F1-model_v4	DESULFOASV1_0444_DUF167_domain-containing_protein	AF-Q7VN15-F1-model_v4 UPF0235 protein HD_0778	0.294	85	59	5	88	2	86	3.140E-09	333
DESULFOASV1_0444_DUF167_domain-containing_protein	AF-B5RE62-F1-model_v4	DESULFOASV1_0444_DUF167_domain-containing_protein	AF-B5RE62-F1-model_v4 UPF0235 protein YggU	0.277	90	62	5	94	2	88	1.734E-09	332
DESULFOASV1_0444_DUF167_domain-containing_protein	AF-A6VQS7-F1-model_v4	DESULFOASV1_0444_DUF167_domain-containing_protein	AF-A6VQS7-F1-model_v4 UPF0235 protein Asuc_1977	0.305	85	58	6	90	3	86	2.752E-09	332
DESULFOASV1_0444_DUF167_domain-containing_protein	AF-Q8Z3U7-F1-model_v4	DESULFOASV1_0444_DUF167_domain-containing_protein	AF-Q8Z3U7-F1-model_v4 UPF0235 protein YggU	0.277	90	62	5	94	2	88	1.978E-09	330
DESULFOASV1_0444_DUF167_domain-containing_protein	AF-A1SZ30-F1-model_v4	DESULFOASV1_0444_DUF167_domain-containing_protein	AF-A1SZ30-F1-model_v4 UPF0235 protein Ping_3043	0.275	87	62	2	88	1	86	3.583E-09	330
DESULFOASV1_0444_DUF167_domain-containing_protein	AF-Q3ATT3-F1-model_v4	DESULFOASV1_0444_DUF167_domain-containing_protein	AF-Q3ATT3-F1-model_v4 UPF0235 protein Cag_0319	0.300	80	55	7	86	4	82	5.324E-09	330
DESULFOASV1_0444_DUF167_domain-containing_protein	AF-B3QL06-F1-model_v4	DESULFOASV1_0444_DUF167_domain-containing_protein	AF-B3QL06-F1-model_v4 UPF0235 protein Cpar_0370	0.370	81	50	6	86	3	82	4.088E-09	330
DESULFOASV1_0444_DUF167_domain-containing_protein	AF-B5XU96-F1-model_v4	DESULFOASV1_0444_DUF167_domain-containing_protein	AF-B5XU96-F1-model_v4 UPF0235 protein KPK_0722	0.311	90	59	5	94	2	88	2.752E-09	329
DESULFOASV1_0444_DUF167_domain-containing_protein	AF-B5QY78-F1-model_v4	DESULFOASV1_0444_DUF167_domain-containing_protein	AF-B5QY78-F1-model_v4 UPF0235 protein YggU	0.292	82	57	5	86	2	82	3.827E-09	329
DESULFOASV1_0444_DUF167_domain-containing_protein	AF-B4THI7-F1-model_v4	DESULFOASV1_0444_DUF167_domain-containing_protein	AF-B4THI7-F1-model_v4 UPF0235 protein YggU	0.277	90	62	5	94	2	88	2.411E-09	328
DESULFOASV1_0444_DUF167_domain-containing_protein	AF-B4TV71-F1-model_v4	DESULFOASV1_0444_DUF167_domain-containing_protein	AF-B4TV71-F1-model_v4 UPF0235 protein YggU	0.277	90	62	5	94	2	88	2.113E-09	328
DESULFOASV1_0444_DUF167_domain-containing_protein	AF-Q505I4-F1-model_v4	DESULFOASV1_0444_DUF167_domain-containing_protein	AF-Q505I4-F1-model_v4 UPF0235 protein C15orf40 homolog	0.270	85	61	5	89	26	110	6.932E-09	327
DESULFOASV1_0444_DUF167_domain-containing_protein	AF-A8APH3-F1-model_v4	DESULFOASV1_0444_DUF167_domain-containing_protein	AF-A8APH3-F1-model_v4 UPF0235 protein CKO_04329	0.306	87	60	5	91	2	88	2.113E-09	326
DESULFOASV1_0444_DUF167_domain-containing_protein	AF-A3D6Z7-F1-model_v4	DESULFOASV1_0444_DUF167_domain-containing_protein	AF-A3D6Z7-F1-model_v4 UPF0235 protein Sbal_3028	0.311	90	59	5	94	2	88	1.422E-09	326
DESULFOASV1_0444_DUF167_domain-containing_protein	AF-B5FUW5-F1-model_v4	DESULFOASV1_0444_DUF167_domain-containing_protein	AF-B5FUW5-F1-model_v4 UPF0235 protein YggU	0.284	87	62	5	91	2	88	3.583E-09	325
DESULFOASV1_0444_DUF167_domain-containing_protein	AF-A6TDW3-F1-model_v4	DESULFOASV1_0444_DUF167_domain-containing_protein	AF-A6TDW3-F1-model_v4 UPF0235 protein KPN78578_33230	0.311	90	59	5	94	2	88	4.367E-09	324
DESULFOASV1_0444_DUF167_domain-containing_protein	AF-A6WQT5-F1-model_v4	DESULFOASV1_0444_DUF167_domain-containing_protein	AF-A6WQT5-F1-model_v4 UPF0235 protein Shew185_3043	0.311	90	59	5	94	2	88	1.734E-09	324
DESULFOASV1_0444_DUF167_domain-containing_protein	AF-B5BFQ9-F1-model_v4	DESULFOASV1_0444_DUF167_domain-containing_protein	AF-B5BFQ9-F1-model_v4 UPF0235 protein YggU	0.277	90	62	5	94	2	88	3.583E-09	323
DESULFOASV1_0444_DUF167_domain-containing_protein	AF-B7KZL8-F1-model_v4	DESULFOASV1_0444_DUF167_domain-containing_protein	AF-B7KZL8-F1-model_v4 UPF0235 protein Mchl_2407	0.369	91	54	2	88	1	91	3.583E-09	321
DESULFOASV1_0444_DUF167_domain-containing_protein	AF-A9KXP6-F1-model_v4	DESULFOASV1_0444_DUF167_domain-containing_protein	AF-A9KXP6-F1-model_v4 UPF0235 protein Sbal195_3186	0.314	88	60	5	92	2	89	2.113E-09	320
DESULFOASV1_0444_DUF167_domain-containing_protein	AF-Q3ZBP8-F1-model_v4	DESULFOASV1_0444_DUF167_domain-containing_protein	AF-Q3ZBP8-F1-model_v4 UPF0235 protein C15orf40 homolog	0.260	96	65	1	89	15	110	1.623E-09	320
DESULFOASV1_0444_DUF167_domain-containing_protein	AF-Q5JHB2-F1-model_v4	DESULFOASV1_0444_DUF167_domain-containing_protein	AF-Q5JHB2-F1-model_v4 UPF0235 protein TK0768	0.404	82	47	5	86	2	81	4.088E-09	319
DESULFOASV1_0444_DUF167_domain-containing_protein	AF-Q9Z854-F1-model_v4	DESULFOASV1_0444_DUF167_domain-containing_protein	AF-Q9Z854-F1-model_v4 UPF0235 protein CPn_0497/CP_0257/CPj0497/CpB0517	0.328	76	50	11	86	1	76	1.100E-08	317
DESULFOASV1_0444_DUF167_domain-containing_protein	AF-B1GYK8-F1-model_v4	DESULFOASV1_0444_DUF167_domain-containing_protein	AF-B1GYK8-F1-model_v4 UPF0235 protein TGRD_618	0.328	70	46	16	85	2	71	1.433E-08	315
DESULFOASV1_0444_DUF167_domain-containing_protein	AF-A1BI66-F1-model_v4	DESULFOASV1_0444_DUF167_domain-containing_protein	AF-A1BI66-F1-model_v4 UPF0235 protein Cpha266_2081	0.287	86	61	1	86	1	86	7.405E-09	315
DESULFOASV1_0444_DUF167_domain-containing_protein	AF-Q9CRC3-F1-model_v4	DESULFOASV1_0444_DUF167_domain-containing_protein	AF-Q9CRC3-F1-model_v4 UPF0235 protein C15orf40 homolog	0.252	91	66	1	89	20	110	5.687E-09	314
