query	target	qheader	theader	fident	alnlen	mismatch	qstart	qend	tstart	tend	evalue	bits
DESULFOASV1_1171_hypothetical_protein	AF-Q55EF8-F1-model_v4	DESULFOASV1_1171_hypothetical_protein	AF-Q55EF8-F1-model_v4 Transmembrane protein DDB_G0269096	0.234	158	119	19	174	117	274	1.463E-03	207
DESULFOASV1_1171_hypothetical_protein	AF-Q556Z9-F1-model_v4	DESULFOASV1_1171_hypothetical_protein	AF-Q556Z9-F1-model_v4 Transmembrane protein DDB_G0273707/DDB_G0273361	0.221	165	126	12	174	136	300	1.026E-03	177
DESULFOASV1_1171_hypothetical_protein	AF-Q9K9K2-F1-model_v4	DESULFOASV1_1171_hypothetical_protein	AF-Q9K9K2-F1-model_v4 UPF0421 protein BH2644	0.130	228	182	13	240	2	211	1.229E-01	76
DESULFOASV1_1171_hypothetical_protein	AF-P71083-F1-model_v4	DESULFOASV1_1171_hypothetical_protein	AF-P71083-F1-model_v4 UPF0421 protein YgaE	0.117	221	175	22	242	1	199	9.420E-02	74
DESULFOASV1_1171_hypothetical_protein	AF-Q8NVT9-F1-model_v4	DESULFOASV1_1171_hypothetical_protein	AF-Q8NVT9-F1-model_v4 UPF0421 protein MW1829	0.154	207	167	31	237	12	209	2.186E-01	73
DESULFOASV1_1171_hypothetical_protein	AF-Q2FX03-F1-model_v4	DESULFOASV1_1171_hypothetical_protein	AF-Q2FX03-F1-model_v4 UPF0421 protein SAOUHSC_02103	0.154	207	167	31	237	12	209	2.186E-01	73
DESULFOASV1_1171_hypothetical_protein	AF-Q6GFG8-F1-model_v4	DESULFOASV1_1171_hypothetical_protein	AF-Q6GFG8-F1-model_v4 UPF0421 protein SAR1980	0.166	215	167	23	237	9	209	1.914E-01	72
DESULFOASV1_1171_hypothetical_protein	AF-Q7A2R3-F1-model_v4	DESULFOASV1_1171_hypothetical_protein	AF-Q7A2R3-F1-model_v4 UPF0421 protein SAV1889	0.154	207	167	31	237	12	209	2.497E-01	72
DESULFOASV1_1171_hypothetical_protein	AF-Q2YU38-F1-model_v4	DESULFOASV1_1171_hypothetical_protein	AF-Q2YU38-F1-model_v4 UPF0421 protein SAB1821	0.154	207	167	31	237	12	209	2.610E-01	71
DESULFOASV1_1171_hypothetical_protein	AF-Q6G845-F1-model_v4	DESULFOASV1_1171_hypothetical_protein	AF-Q6G845-F1-model_v4 UPF0421 protein SAS1811	0.159	207	166	31	237	12	209	2.981E-01	71
DESULFOASV1_1171_hypothetical_protein	AF-Q7A4R6-F1-model_v4	DESULFOASV1_1171_hypothetical_protein	AF-Q7A4R6-F1-model_v4 UPF0421 protein SA1705	0.144	219	181	22	240	1	212	1.914E-01	71
DESULFOASV1_1171_hypothetical_protein	AF-Q2FFK6-F1-model_v4	DESULFOASV1_1171_hypothetical_protein	AF-Q2FFK6-F1-model_v4 UPF0421 protein SAUSA300_1870	0.154	207	167	31	237	12	209	3.257E-01	69
DESULFOASV1_1171_hypothetical_protein	AF-Q9KWL2-F1-model_v4	DESULFOASV1_1171_hypothetical_protein	AF-Q9KWL2-F1-model_v4 UPF0421 protein SAHV_1874	0.170	221	171	17	237	3	209	3.257E-01	67
DESULFOASV1_1171_hypothetical_protein	AF-Q8ENS1-F1-model_v4	DESULFOASV1_1171_hypothetical_protein	AF-Q8ENS1-F1-model_v4 UPF0421 protein OB2406	0.132	219	177	24	242	1	205	6.617E-01	65
DESULFOASV1_1171_hypothetical_protein	AF-Q81CK9-F1-model_v4	DESULFOASV1_1171_hypothetical_protein	AF-Q81CK9-F1-model_v4 UPF0421 protein BC_2748	0.111	212	182	24	235	1	206	5.073E-01	65
DESULFOASV1_1171_hypothetical_protein	AF-Q49YT4-F1-model_v4	DESULFOASV1_1171_hypothetical_protein	AF-Q49YT4-F1-model_v4 UPF0421 protein SSP0904	0.142	211	169	27	237	12	209	4.249E-01	64
DESULFOASV1_1171_hypothetical_protein	AF-Q5HEN5-F1-model_v4	DESULFOASV1_1171_hypothetical_protein	AF-Q5HEN5-F1-model_v4 UPF0421 protein SACOL1947	0.165	221	172	17	237	3	209	5.073E-01	62
DESULFOASV1_1171_hypothetical_protein	AF-Q4L7K3-F1-model_v4	DESULFOASV1_1171_hypothetical_protein	AF-Q4L7K3-F1-model_v4 UPF0421 protein SH1063	0.120	231	201	25	255	3	231	4.642E-01	62
DESULFOASV1_1171_hypothetical_protein	AF-Q81PQ8-F1-model_v4	DESULFOASV1_1171_hypothetical_protein	AF-Q81PQ8-F1-model_v4 UPF0421 protein BA_2743/GBAA_2743/BAS2557	0.140	216	176	20	235	1	206	6.056E-01	62
DESULFOASV1_1171_hypothetical_protein	AF-Q8CRU8-F1-model_v4	DESULFOASV1_1171_hypothetical_protein	AF-Q8CRU8-F1-model_v4 UPF0421 protein SE_1574	0.129	224	192	22	245	1	222	4.065E-01	61
DESULFOASV1_1171_hypothetical_protein	AF-Q6HHY7-F1-model_v4	DESULFOASV1_1171_hypothetical_protein	AF-Q6HHY7-F1-model_v4 UPF0421 protein BT9727_2513	0.145	216	175	20	235	1	206	5.302E-01	61
DESULFOASV1_1171_hypothetical_protein	AF-A0REW2-F1-model_v4	DESULFOASV1_1171_hypothetical_protein	AF-A0REW2-F1-model_v4 UPF0421 protein BALH_2468	0.134	216	178	20	235	1	206	6.617E-01	58
DESULFOASV1_1171_hypothetical_protein	AF-Q5HN45-F1-model_v4	DESULFOASV1_1171_hypothetical_protein	AF-Q5HN45-F1-model_v4 UPF0421 protein SERP1427	0.102	224	198	22	245	1	222	8.258E-01	57
DESULFOASV1_1171_hypothetical_protein	AF-Q63AK0-F1-model_v4	DESULFOASV1_1171_hypothetical_protein	AF-Q63AK0-F1-model_v4 UPF0421 protein BCE33L2478	0.144	223	178	18	240	3	211	8.632E-01	55
DESULFOASV1_1171_hypothetical_protein	AF-P65016-F1-model_v4	DESULFOASV1_1171_hypothetical_protein	AF-P65016-F1-model_v4 Uncharacterized protein Mb2601c	0.137	211	172	26	236	24	223	1.230E+00	53
DESULFOASV1_1171_hypothetical_protein	AF-P9WL89-F1-model_v4	DESULFOASV1_1171_hypothetical_protein	AF-P9WL89-F1-model_v4 Uncharacterized protein Rv2571c	0.141	211	171	26	236	24	223	1.678E+00	51
DESULFOASV1_1171_hypothetical_protein	AF-P9WL88-F1-model_v4	DESULFOASV1_1171_hypothetical_protein	AF-P9WL88-F1-model_v4 Uncharacterized protein MT2647	0.135	211	172	26	236	24	223	1.833E+00	51
DESULFOASV1_1171_hypothetical_protein	AF-C6C4L7-F1-model_v4	DESULFOASV1_1171_hypothetical_protein	AF-C6C4L7-F1-model_v4 p-hydroxybenzoic acid efflux pump subunit AaeB	0.180	246	187	7	235	325	570	3.559E-01	50
DESULFOASV1_1171_hypothetical_protein	AF-D2C1Z6-F1-model_v4	DESULFOASV1_1171_hypothetical_protein	AF-D2C1Z6-F1-model_v4 p-hydroxybenzoic acid efflux pump subunit AaeB	0.150	243	191	10	235	329	571	1.536E+00	48
DESULFOASV1_1171_hypothetical_protein	AF-C0HL12-F1-model_v4	DESULFOASV1_1171_hypothetical_protein	AF-C0HL12-F1-model_v4 Adhesion G protein-coupled receptor B1	0.108	278	230	10	268	932	1209	3.257E-01	44
DESULFOASV1_1171_hypothetical_protein	AF-P54538-F1-model_v4	DESULFOASV1_1171_hypothetical_protein	AF-P54538-F1-model_v4 Uncharacterized protein YqjA	0.106	215	172	18	232	1	193	2.500E+00	41
DESULFOASV1_1171_hypothetical_protein	AF-B6I1V8-F1-model_v4	DESULFOASV1_1171_hypothetical_protein	AF-B6I1V8-F1-model_v4 p-hydroxybenzoic acid efflux pump subunit AaeB	0.151	243	191	10	235	331	573	2.094E+00	39
DESULFOASV1_1171_hypothetical_protein	AF-Q5ATG7-F1-model_v4	DESULFOASV1_1171_hypothetical_protein	AF-Q5ATG7-F1-model_v4 Aspyridones efflux protein apdF	0.111	243	210	19	261	218	454	8.632E-01	37
DESULFOASV1_1171_hypothetical_protein	AF-P9WG63-F1-model_v4	DESULFOASV1_1171_hypothetical_protein	AF-P9WG63-F1-model_v4 Protein DipZ	0.153	276	223	1	264	97	372	1.536E+00	37
DESULFOASV1_1171_hypothetical_protein	AF-Q6DAH4-F1-model_v4	DESULFOASV1_1171_hypothetical_protein	AF-Q6DAH4-F1-model_v4 p-hydroxybenzoic acid efflux pump subunit AaeB	0.143	243	193	10	235	339	581	2.732E+00	36
DESULFOASV1_1171_hypothetical_protein	AF-A6UQK8-F1-model_v4	DESULFOASV1_1171_hypothetical_protein	AF-A6UQK8-F1-model_v4 Tetrahydromethanopterin S-methyltransferase subunit C	0.153	247	193	19	247	8	254	9.859E-01	35
DESULFOASV1_1171_hypothetical_protein	AF-Q99340-F1-model_v4	DESULFOASV1_1171_hypothetical_protein	AF-Q99340-F1-model_v4 Uncharacterized protein Cgl2769/cg3067	0.156	227	183	26	252	30	247	4.649E+00	35
DESULFOASV1_1171_hypothetical_protein	AF-Q16983-F1-model_v4	DESULFOASV1_1171_hypothetical_protein	AF-Q16983-F1-model_v4 Diuretic hormone receptor	0.120	301	231	5	268	122	422	1.230E+00	35
DESULFOASV1_1171_hypothetical_protein	AF-Q4R794-F1-model_v4	DESULFOASV1_1171_hypothetical_protein	AF-Q4R794-F1-model_v4 Solute carrier family 35 member F5	0.134	305	225	8	268	126	430	3.257E-01	32
DESULFOASV1_1171_hypothetical_protein	AF-P50133-F1-model_v4	DESULFOASV1_1171_hypothetical_protein	AF-P50133-F1-model_v4 Parathyroid hormone/parathyroid hormone-related peptide receptor	0.124	242	199	28	255	229	470	1.678E+00	32
DESULFOASV1_1171_hypothetical_protein	AF-Q5R7Y0-F1-model_v4	DESULFOASV1_1171_hypothetical_protein	AF-Q5R7Y0-F1-model_v4 Adhesion G protein-coupled receptor B2	0.136	258	207	28	268	868	1125	1.344E+00	32
DESULFOASV1_1171_hypothetical_protein	AF-E1BLK7-F1-model_v4	DESULFOASV1_1171_hypothetical_protein	AF-E1BLK7-F1-model_v4 Mitochondria-eating protein	0.121	152	132	20	171	281	431	2.732E+00	31
DESULFOASV1_1171_hypothetical_protein	AF-Q56019-F1-model_v4	DESULFOASV1_1171_hypothetical_protein	AF-Q56019-F1-model_v4 Cell invasion protein SipB	0.104	240	198	27	266	92	313	1.286E+00	31
DESULFOASV1_1171_hypothetical_protein	AF-O83184-F1-model_v4	DESULFOASV1_1171_hypothetical_protein	AF-O83184-F1-model_v4 Uncharacterized protein TP_0149	0.135	192	144	77	268	30	196	3.409E+00	30
DESULFOASV1_1171_hypothetical_protein	AF-Q2SYE1-F1-model_v4	DESULFOASV1_1171_hypothetical_protein	AF-Q2SYE1-F1-model_v4 Undecaprenyl-diphosphatase 1	0.151	208	174	27	234	65	270	4.447E+00	30
DESULFOASV1_1171_hypothetical_protein	AF-Q95KC3-F1-model_v4	DESULFOASV1_1171_hypothetical_protein	AF-Q95KC3-F1-model_v4 P2Y purinoceptor 12	0.096	319	234	1	260	1	319	2.613E+00	30
DESULFOASV1_1171_hypothetical_protein	AF-Q6A553-F1-model_v4	DESULFOASV1_1171_hypothetical_protein	AF-Q6A553-F1-model_v4 Probable inner membrane transporter protein TsaS	0.110	221	190	19	239	22	236	1.754E+00	29
DESULFOASV1_1171_hypothetical_protein	AF-Q3JPL1-F1-model_v4	DESULFOASV1_1171_hypothetical_protein	AF-Q3JPL1-F1-model_v4 Undecaprenyl-diphosphatase 2	0.140	208	176	27	234	65	270	5.079E+00	29
DESULFOASV1_1171_hypothetical_protein	AF-Q9ATL3-F1-model_v4	DESULFOASV1_1171_hypothetical_protein	AF-Q9ATL3-F1-model_v4 Aquaporin TIP4-4	0.157	168	139	74	239	22	189	3.261E+00	28
DESULFOASV1_1171_hypothetical_protein	AF-D5CDA0-F1-model_v4	DESULFOASV1_1171_hypothetical_protein	AF-D5CDA0-F1-model_v4 p-hydroxybenzoic acid efflux pump subunit AaeB	0.160	243	189	10	235	331	573	6.064E+00	28
DESULFOASV1_1171_hypothetical_protein	AF-P51973-F1-model_v4	DESULFOASV1_1171_hypothetical_protein	AF-P51973-F1-model_v4 Competence protein ComA	0.159	215	172	22	236	124	328	5.309E+00	28
DESULFOASV1_1171_hypothetical_protein	AF-P79229-F1-model_v4	DESULFOASV1_1171_hypothetical_protein	AF-P79229-F1-model_v4 Aquaporin-2	0.216	106	80	77	182	4	106	7.911E+00	27
DESULFOASV1_1171_hypothetical_protein	AF-A6ND48-F1-model_v4	DESULFOASV1_1171_hypothetical_protein	AF-A6ND48-F1-model_v4 Olfactory receptor 14I1	0.085	279	205	18	242	12	290	5.079E+00	27
DESULFOASV1_1171_hypothetical_protein	AF-Q8TDV2-F1-model_v4	DESULFOASV1_1171_hypothetical_protein	AF-Q8TDV2-F1-model_v4 Probable G-protein coupled receptor 148	0.147	258	206	27	268	90	347	4.859E+00	27
DESULFOASV1_1171_hypothetical_protein	AF-Q99MT7-F1-model_v4	DESULFOASV1_1171_hypothetical_protein	AF-Q99MT7-F1-model_v4 G-protein coupled receptor 87	0.112	275	210	23	259	69	343	2.732E+00	27
DESULFOASV1_1171_hypothetical_protein	AF-P32241-F1-model_v4	DESULFOASV1_1171_hypothetical_protein	AF-P32241-F1-model_v4 Vasoactive intestinal polypeptide receptor 1	0.132	264	198	27	255	141	404	3.725E+00	27
DESULFOASV1_1171_hypothetical_protein	AF-Q1LZF7-F1-model_v4	DESULFOASV1_1171_hypothetical_protein	AF-Q1LZF7-F1-model_v4 Parathyroid hormone/parathyroid hormone-related peptide receptor	0.109	242	202	28	255	233	474	3.563E+00	27
DESULFOASV1_1171_hypothetical_protein	AF-P25961-F1-model_v4	DESULFOASV1_1171_hypothetical_protein	AF-P25961-F1-model_v4 Parathyroid hormone/parathyroid hormone-related peptide receptor	0.127	241	199	27	255	235	475	4.070E+00	27
DESULFOASV1_1171_hypothetical_protein	AF-O77714-F1-model_v4	DESULFOASV1_1171_hypothetical_protein	AF-O77714-F1-model_v4 Aquaporin-2	0.225	106	79	77	182	4	106	9.445E+00	26
DESULFOASV1_1171_hypothetical_protein	AF-P79168-F1-model_v4	DESULFOASV1_1171_hypothetical_protein	AF-P79168-F1-model_v4 Aquaporin-2	0.216	106	80	77	182	4	106	9.445E+00	26
DESULFOASV1_1171_hypothetical_protein	AF-P79164-F1-model_v4	DESULFOASV1_1171_hypothetical_protein	AF-P79164-F1-model_v4 Aquaporin-2	0.233	106	78	77	182	4	106	9.035E+00	26
DESULFOASV1_1171_hypothetical_protein	AF-P75769-F1-model_v4	DESULFOASV1_1171_hypothetical_protein	AF-P75769-F1-model_v4 Uncharacterized protein YbhM	0.115	190	146	12	177	42	231	5.801E+00	26
DESULFOASV1_1171_hypothetical_protein	AF-D2ZZC1-F1-model_v4	DESULFOASV1_1171_hypothetical_protein	AF-D2ZZC1-F1-model_v4 Nicotinamide riboside transporter PnuC	0.098	241	156	1	174	19	259	3.120E+00	26
DESULFOASV1_1171_hypothetical_protein	AF-O32865-F1-model_v4	DESULFOASV1_1171_hypothetical_protein	AF-O32865-F1-model_v4 Tetrahydromethanopterin S-methyltransferase subunit C	0.165	236	186	17	240	19	254	5.309E+00	26
DESULFOASV1_1171_hypothetical_protein	AF-P80186-F1-model_v4	DESULFOASV1_1171_hypothetical_protein	AF-P80186-F1-model_v4 Tetrahydromethanopterin S-methyltransferase subunit E	0.161	293	199	31	268	3	295	5.309E+00	26
DESULFOASV1_1171_hypothetical_protein	AF-Q8WV83-F1-model_v4	DESULFOASV1_1171_hypothetical_protein	AF-Q8WV83-F1-model_v4 Solute carrier family 35 member F5	0.121	311	225	12	268	211	521	3.894E+00	26
DESULFOASV1_1171_hypothetical_protein	AF-Q03431-F1-model_v4	DESULFOASV1_1171_hypothetical_protein	AF-Q03431-F1-model_v4 Parathyroid hormone/parathyroid hormone-related peptide receptor	0.122	243	199	28	255	233	475	4.649E+00	26
DESULFOASV1_1171_hypothetical_protein	AF-A3NYA9-F1-model_v4	DESULFOASV1_1171_hypothetical_protein	AF-A3NYA9-F1-model_v4 Undecaprenyl-diphosphatase 2	0.140	208	176	27	234	65	270	8.644E+00	25
DESULFOASV1_1171_hypothetical_protein	AF-Q5RKJ2-F1-model_v4	DESULFOASV1_1171_hypothetical_protein	AF-Q5RKJ2-F1-model_v4 Plasma membrane ascorbate-dependent reductase CYBRD1	0.130	211	179	26	236	10	216	1.605E+00	25
DESULFOASV1_1171_hypothetical_protein	AF-A7WZF5-F1-model_v4	DESULFOASV1_1171_hypothetical_protein	AF-A7WZF5-F1-model_v4 Undecaprenyl-diphosphatase	0.090	237	183	4	240	82	283	6.339E+00	25
DESULFOASV1_1171_hypothetical_protein	AF-Q8S8K9-F1-model_v4	DESULFOASV1_1171_hypothetical_protein	AF-Q8S8K9-F1-model_v4 Protein FIP1	0.123	268	213	1	268	1	244	3.725E+00	25
DESULFOASV1_1171_hypothetical_protein	AF-Q923Z0-F1-model_v4	DESULFOASV1_1171_hypothetical_protein	AF-Q923Z0-F1-model_v4 G-protein coupled receptor family C group 5 member B	0.110	257	215	26	268	57	313	5.309E+00	25
DESULFOASV1_1171_hypothetical_protein	AF-P25107-F1-model_v4	DESULFOASV1_1171_hypothetical_protein	AF-P25107-F1-model_v4 Parathyroid hormone/parathyroid hormone-related peptide receptor	0.102	252	198	4	255	248	469	6.339E+00	25
DESULFOASV1_1171_hypothetical_protein	AF-P41593-F1-model_v4	DESULFOASV1_1171_hypothetical_protein	AF-P41593-F1-model_v4 Parathyroid hormone/parathyroid hormone-related peptide receptor	0.116	248	202	27	255	228	475	4.070E+00	25
DESULFOASV1_1171_hypothetical_protein	AF-O64503-F1-model_v4	DESULFOASV1_1171_hypothetical_protein	AF-O64503-F1-model_v4 UDP-galactose/UDP-glucose transporter 1	0.132	280	194	30	253	52	331	3.725E+00	24
DESULFOASV1_1171_hypothetical_protein	AF-Q9UHE8-F1-model_v4	DESULFOASV1_1171_hypothetical_protein	AF-Q9UHE8-F1-model_v4 Metalloreductase STEAP1	0.112	290	226	1	255	48	337	4.447E+00	24
DESULFOASV1_1171_hypothetical_protein	AF-Q9UYV6-F1-model_v4	DESULFOASV1_1171_hypothetical_protein	AF-Q9UYV6-F1-model_v4 Putative phosphate permease PYRAB14010	0.117	328	195	17	238	65	392	3.894E+00	24
DESULFOASV1_1171_hypothetical_protein	AF-Q56134-F1-model_v4	DESULFOASV1_1171_hypothetical_protein	AF-Q56134-F1-model_v4 Cell invasion protein SipB	0.109	263	217	6	268	66	310	3.261E+00	24
DESULFOASV1_1171_hypothetical_protein	AF-Q5RAQ1-F1-model_v4	DESULFOASV1_1171_hypothetical_protein	AF-Q5RAQ1-F1-model_v4 Parathyroid hormone/parathyroid hormone-related peptide receptor	0.125	243	199	28	255	234	476	5.309E+00	24
DESULFOASV1_1171_hypothetical_protein	AF-Q58382-F1-model_v4	DESULFOASV1_1171_hypothetical_protein	AF-Q58382-F1-model_v4 UPF0056 membrane protein MJ0972	0.112	218	187	26	243	17	228	6.626E+00	23
DESULFOASV1_1171_hypothetical_protein	AF-Q11106-F1-model_v4	DESULFOASV1_1171_hypothetical_protein	AF-Q11106-F1-model_v4 Uncharacterized protein C03B8.3	0.113	215	182	2	207	29	243	5.801E+00	23
DESULFOASV1_1171_hypothetical_protein	AF-D1AMK8-F1-model_v4	DESULFOASV1_1171_hypothetical_protein	AF-D1AMK8-F1-model_v4 Protein translocase subunit SecF	0.091	176	153	27	195	129	304	4.649E+00	23
DESULFOASV1_1171_hypothetical_protein	AF-B2J0V5-F1-model_v4	DESULFOASV1_1171_hypothetical_protein	AF-B2J0V5-F1-model_v4 Glycine--tRNA ligase alpha subunit	0.076	130	99	64	193	193	300	7.240E+00	23
DESULFOASV1_1171_hypothetical_protein	AF-P55402-F1-model_v4	DESULFOASV1_1171_hypothetical_protein	AF-P55402-F1-model_v4 Probable conjugal transfer protein TrbL	0.128	243	211	22	264	123	365	5.550E+00	23
DESULFOASV1_1171_hypothetical_protein	AF-O67365-F1-model_v4	DESULFOASV1_1171_hypothetical_protein	AF-O67365-F1-model_v4 Polyamine aminopropyltransferase 2	0.119	174	129	28	174	10	183	9.445E+00	23
DESULFOASV1_1171_hypothetical_protein	AF-Q8R314-F1-model_v4	DESULFOASV1_1171_hypothetical_protein	AF-Q8R314-F1-model_v4 Solute carrier family 35 member F5	0.128	316	225	10	268	207	522	2.613E+00	23
DESULFOASV1_1171_hypothetical_protein	AF-P83714-F1-model_v4	DESULFOASV1_1171_hypothetical_protein	AF-P83714-F1-model_v4 Cardiotrophin-2	0.139	184	134	18	174	14	197	7.240E+00	22
DESULFOASV1_1171_hypothetical_protein	AF-P96606-F1-model_v4	DESULFOASV1_1171_hypothetical_protein	AF-P96606-F1-model_v4 Uncharacterized membrane protein YdbK	0.076	233	201	21	238	5	237	7.568E+00	22
DESULFOASV1_1171_hypothetical_protein	AF-Q2YC65-F1-model_v4	DESULFOASV1_1171_hypothetical_protein	AF-Q2YC65-F1-model_v4 Phosphatidylglycerol--prolipoprotein diacylglyceryl transferase	0.118	276	215	18	262	11	286	4.859E+00	22
DESULFOASV1_1171_hypothetical_protein	AF-Q8TTZ9-F1-model_v4	DESULFOASV1_1171_hypothetical_protein	AF-Q8TTZ9-F1-model_v4 Tetrahydromethanopterin S-methyltransferase subunit E	0.116	294	212	28	268	10	303	8.269E+00	22
DESULFOASV1_1171_hypothetical_protein	AF-O84072-F1-model_v4	DESULFOASV1_1171_hypothetical_protein	AF-O84072-F1-model_v4 Probable metal transport system membrane protein CT_069	0.157	203	156	35	237	9	194	6.926E+00	22
DESULFOASV1_1171_hypothetical_protein	AF-Q830V1-F1-model_v4	DESULFOASV1_1171_hypothetical_protein	AF-Q830V1-F1-model_v4 Magnesium transporter MgtE	0.125	160	132	26	177	291	450	9.035E+00	22
DESULFOASV1_1171_hypothetical_protein	AF-P30650-F1-model_v4	DESULFOASV1_1171_hypothetical_protein	AF-P30650-F1-model_v4 G-protein coupled receptor seb-2	0.121	265	224	10	265	215	479	5.309E+00	22
DESULFOASV1_1171_hypothetical_protein	AF-Q79BT1-F1-model_v4	DESULFOASV1_1171_hypothetical_protein	AF-Q79BT1-F1-model_v4 Cell invasion protein SipB	0.120	248	209	27	265	92	339	5.309E+00	22
DESULFOASV1_1171_hypothetical_protein	AF-O21266-F1-model_v4	DESULFOASV1_1171_hypothetical_protein	AF-O21266-F1-model_v4 Uncharacterized tatC-like protein ymf16	0.105	244	216	27	268	16	259	5.801E+00	21
DESULFOASV1_1171_hypothetical_protein	AF-Q925G2-F1-model_v4	DESULFOASV1_1171_hypothetical_protein	AF-Q925G2-F1-model_v4 Plasma membrane ascorbate-dependent reductase CYBRD1	0.138	211	178	26	236	10	216	3.725E+00	21
DESULFOASV1_1171_hypothetical_protein	AF-P72926-F1-model_v4	DESULFOASV1_1171_hypothetical_protein	AF-P72926-F1-model_v4 UPF0187 protein sll1024	0.139	214	156	27	240	81	262	6.926E+00	21
DESULFOASV1_1171_hypothetical_protein	AF-Q8QFN3-F1-model_v4	DESULFOASV1_1171_hypothetical_protein	AF-Q8QFN3-F1-model_v4 Transmembrane protein 121	0.092	301	226	19	268	1	301	7.240E+00	21
DESULFOASV1_1171_hypothetical_protein	AF-Q80XA0-F1-model_v4	DESULFOASV1_1171_hypothetical_protein	AF-Q80XA0-F1-model_v4 Transmembrane protein 121	0.111	297	223	17	268	2	298	6.926E+00	21
DESULFOASV1_1171_hypothetical_protein	AF-A9MZD0-F1-model_v4	DESULFOASV1_1171_hypothetical_protein	AF-A9MZD0-F1-model_v4 L-rhamnose-proton symporter	0.160	275	181	22	238	66	340	5.079E+00	21
DESULFOASV1_1171_hypothetical_protein	AF-B5FPP7-F1-model_v4	DESULFOASV1_1171_hypothetical_protein	AF-B5FPP7-F1-model_v4 L-rhamnose-proton symporter	0.160	275	181	22	238	66	340	5.079E+00	21
DESULFOASV1_1171_hypothetical_protein	AF-Q66FF0-F1-model_v4	DESULFOASV1_1171_hypothetical_protein	AF-Q66FF0-F1-model_v4 L-rhamnose-proton symporter	0.166	275	180	22	238	66	340	4.859E+00	21
DESULFOASV1_1171_hypothetical_protein	AF-P9WIG9-F1-model_v4	DESULFOASV1_1171_hypothetical_protein	AF-P9WIG9-F1-model_v4 Uncharacterized PE family protein PE23	0.167	217	158	27	243	192	382	4.070E+00	21
DESULFOASV1_1171_hypothetical_protein	AF-Q03730-F1-model_v4	DESULFOASV1_1171_hypothetical_protein	AF-Q03730-F1-model_v4 Uncharacterized vacuolar membrane protein YML018C	0.117	285	218	12	259	107	391	5.550E+00	21
DESULFOASV1_1171_hypothetical_protein	AF-Q8AWF4-F1-model_v4	DESULFOASV1_1171_hypothetical_protein	AF-Q8AWF4-F1-model_v4 Kinetochore protein Nuf2-A	0.125	177	151	87	260	42	218	9.035E+00	21
DESULFOASV1_1171_hypothetical_protein	AF-Q63344-F1-model_v4	DESULFOASV1_1171_hypothetical_protein	AF-Q63344-F1-model_v4 Monocarboxylate transporter 2	0.129	260	203	1	260	223	456	6.339E+00	21
DESULFOASV1_1171_hypothetical_protein	AF-Q8NBI5-F1-model_v4	DESULFOASV1_1171_hypothetical_protein	AF-Q8NBI5-F1-model_v4 Solute carrier family 43 member 3	0.129	205	130	31	235	334	483	4.254E+00	21
DESULFOASV1_1171_hypothetical_protein	AF-P35654-F1-model_v4	DESULFOASV1_1171_hypothetical_protein	AF-P35654-F1-model_v4 Harpin secretion protein HrpI	0.103	318	216	27	268	42	359	7.911E+00	21
DESULFOASV1_1171_hypothetical_protein	AF-Q94BP7-F1-model_v4	DESULFOASV1_1171_hypothetical_protein	AF-Q94BP7-F1-model_v4 AUGMIN subunit 6	0.121	229	197	27	255	9	233	7.568E+00	21
DESULFOASV1_1171_hypothetical_protein	AF-A0A0H3AKU6-F1-model_v4	DESULFOASV1_1171_hypothetical_protein	AF-A0A0H3AKU6-F1-model_v4 Ion-translocating oxidoreductase complex subunit A	0.130	216	175	14	229	4	205	9.873E+00	20
DESULFOASV1_1171_hypothetical_protein	AF-Q9P7W0-F1-model_v4	DESULFOASV1_1171_hypothetical_protein	AF-Q9P7W0-F1-model_v4 OPA3-like protein	0.136	187	150	82	268	12	186	8.269E+00	20
DESULFOASV1_1171_hypothetical_protein	AF-Q9SEL6-F1-model_v4	DESULFOASV1_1171_hypothetical_protein	AF-Q9SEL6-F1-model_v4 Vesicle transport v-SNARE 11	0.113	169	141	87	255	15	174	9.445E+00	20
DESULFOASV1_1171_hypothetical_protein	AF-Q2G0B4-F1-model_v4	DESULFOASV1_1171_hypothetical_protein	AF-Q2G0B4-F1-model_v4 Undecaprenyl-diphosphatase	0.100	201	151	15	183	90	290	5.550E+00	20
DESULFOASV1_1171_hypothetical_protein	AF-Q91ZC1-F1-model_v4	DESULFOASV1_1171_hypothetical_protein	AF-Q91ZC1-F1-model_v4 Mas-related G-protein coupled receptor member B3	0.097	308	241	1	268	1	308	9.445E+00	20
DESULFOASV1_1171_hypothetical_protein	AF-Q9GL50-F1-model_v4	DESULFOASV1_1171_hypothetical_protein	AF-Q9GL50-F1-model_v4 Metalloreductase STEAP1	0.119	269	215	4	248	46	314	8.644E+00	20
DESULFOASV1_1171_hypothetical_protein	AF-Q9CWR7-F1-model_v4	DESULFOASV1_1171_hypothetical_protein	AF-Q9CWR7-F1-model_v4 Metalloreductase STEAP1	0.137	269	213	1	248	47	315	9.445E+00	20
DESULFOASV1_1171_hypothetical_protein	AF-B5QWY6-F1-model_v4	DESULFOASV1_1171_hypothetical_protein	AF-B5QWY6-F1-model_v4 L-rhamnose-proton symporter	0.163	275	181	22	238	66	340	5.801E+00	20
DESULFOASV1_1171_hypothetical_protein	AF-Q8ZIZ8-F1-model_v4	DESULFOASV1_1171_hypothetical_protein	AF-Q8ZIZ8-F1-model_v4 L-rhamnose-proton symporter	0.160	275	181	22	238	66	340	5.801E+00	20
DESULFOASV1_1171_hypothetical_protein	AF-P54913-F1-model_v4	DESULFOASV1_1171_hypothetical_protein	AF-P54913-F1-model_v4 Conjugal transfer protein TrbL	0.140	269	197	28	257	114	382	9.035E+00	20
DESULFOASV1_1171_hypothetical_protein	AF-P63341-F1-model_v4	DESULFOASV1_1171_hypothetical_protein	AF-P63341-F1-model_v4 Inner membrane transport protein YqeG	0.110	302	194	20	238	1	302	5.309E+00	20
DESULFOASV1_1171_hypothetical_protein	AF-Q9MUM0-F1-model_v4	DESULFOASV1_1171_hypothetical_protein	AF-Q9MUM0-F1-model_v4 Protein TIC 214	0.152	241	188	28	268	25	247	9.035E+00	20
DESULFOASV1_1171_hypothetical_protein	AF-P35656-F1-model_v4	DESULFOASV1_1171_hypothetical_protein	AF-P35656-F1-model_v4 Hypersensitivity response secretion protein HrcV	0.142	293	182	23	235	28	320	4.447E+00	20
DESULFOASV1_1171_hypothetical_protein	AF-Q54Q40-F1-model_v4	DESULFOASV1_1171_hypothetical_protein	AF-Q54Q40-F1-model_v4 Probable ubiquitin thioesterase DG1039	0.161	179	138	82	260	32	196	8.644E+00	20
DESULFOASV1_1171_hypothetical_protein	AF-P31563-F1-model_v4	DESULFOASV1_1171_hypothetical_protein	AF-P31563-F1-model_v4 Protein TIC 214	0.116	275	230	5	265	2	276	9.035E+00	20
DESULFOASV1_1171_hypothetical_protein	AF-B9U3F2-F1-model_v4	DESULFOASV1_1171_hypothetical_protein	AF-B9U3F2-F1-model_v4 Protein dispatched homolog 3	0.157	189	155	11	195	400	588	7.240E+00	20
DESULFOASV1_1171_hypothetical_protein	AF-Q16617-F1-model_v4	DESULFOASV1_1171_hypothetical_protein	AF-Q16617-F1-model_v4 Protein NKG7	0.135	164	139	24	185	1	164	6.339E+00	19
DESULFOASV1_1171_hypothetical_protein	AF-Q727E5-F1-model_v4	DESULFOASV1_1171_hypothetical_protein	AF-Q727E5-F1-model_v4 Putative manganese efflux pump MntP	0.112	233	178	24	256	1	201	8.644E+00	19
DESULFOASV1_1171_hypothetical_protein	AF-Q9C540-F1-model_v4	DESULFOASV1_1171_hypothetical_protein	AF-Q9C540-F1-model_v4 Probable transmembrane ascorbate ferrireductase 4	0.132	230	196	22	251	2	228	7.911E+00	19
DESULFOASV1_1171_hypothetical_protein	AF-Q45975-F1-model_v4	DESULFOASV1_1171_hypothetical_protein	AF-Q45975-F1-model_v4 Flagellar biosynthetic protein FliR	0.126	244	202	22	253	2	245	7.568E+00	19
DESULFOASV1_1171_hypothetical_protein	AF-A6UQK6-F1-model_v4	DESULFOASV1_1171_hypothetical_protein	AF-A6UQK6-F1-model_v4 Tetrahydromethanopterin S-methyltransferase subunit E	0.112	289	205	26	257	8	296	9.035E+00	19
DESULFOASV1_1171_hypothetical_protein	AF-B7UNM8-F1-model_v4	DESULFOASV1_1171_hypothetical_protein	AF-B7UNM8-F1-model_v4 L-rhamnose-proton symporter	0.144	273	183	24	238	68	340	6.926E+00	19
DESULFOASV1_1171_hypothetical_protein	AF-B7LVD6-F1-model_v4	DESULFOASV1_1171_hypothetical_protein	AF-B7LVD6-F1-model_v4 L-rhamnose-proton symporter	0.149	273	182	24	238	68	340	6.339E+00	19
DESULFOASV1_1171_hypothetical_protein	AF-A8A711-F1-model_v4	DESULFOASV1_1171_hypothetical_protein	AF-A8A711-F1-model_v4 L-rhamnose-proton symporter	0.151	273	182	24	238	68	340	6.926E+00	19
