query	target	qheader	theader	fident	alnlen	mismatch	qstart	qend	tstart	tend	evalue	bits
DESULFOASV1_3493_hypothetical_protein	AF-Q28056-F1-model_v4	DESULFOASV1_3493_hypothetical_protein	AF-Q28056-F1-model_v4 Aspartyl/asparaginyl beta-hydroxylase	0.166	120	93	43	154	416	535	6.270E-02	128
DESULFOASV1_3493_hypothetical_protein	AF-Q8CD92-F1-model_v4	DESULFOASV1_3493_hypothetical_protein	AF-Q8CD92-F1-model_v4 Tetratricopeptide repeat protein 27	0.116	137	116	43	174	565	701	3.015E-02	128
DESULFOASV1_3493_hypothetical_protein	AF-Q9ULT0-F1-model_v4	DESULFOASV1_3493_hypothetical_protein	AF-Q9ULT0-F1-model_v4 Tetratricopeptide repeat protein 7A	0.173	174	141	1	174	664	835	1.030E-02	128
DESULFOASV1_3493_hypothetical_protein	AF-Q80ZX8-F1-model_v4	DESULFOASV1_3493_hypothetical_protein	AF-Q80ZX8-F1-model_v4 Sperm-associated antigen 1	0.161	185	133	1	160	150	334	1.522E-02	128
DESULFOASV1_3493_hypothetical_protein	AF-P14922-F1-model_v4	DESULFOASV1_3493_hypothetical_protein	AF-P14922-F1-model_v4 General transcriptional corepressor CYC8	0.158	179	146	1	174	1	179	9.343E-03	128
DESULFOASV1_3493_hypothetical_protein	AF-O18158-F1-model_v4	DESULFOASV1_3493_hypothetical_protein	AF-O18158-F1-model_v4 UDP-N-acetylglucosamine--peptide N-acetylglucosaminyltransferase	0.185	152	112	43	180	193	344	1.522E-02	128
DESULFOASV1_3493_hypothetical_protein	AF-P0C2N2-F1-model_v4	DESULFOASV1_3493_hypothetical_protein	AF-P0C2N2-F1-model_v4 Chaperone protein YscY	0.190	110	81	43	152	10	110	9.729E-02	127
DESULFOASV1_3493_hypothetical_protein	AF-Q863A5-F1-model_v4	DESULFOASV1_3493_hypothetical_protein	AF-Q863A5-F1-model_v4 Dynein axonemal assembly factor 4	0.116	181	141	1	160	240	420	2.040E-02	127
DESULFOASV1_3493_hypothetical_protein	AF-P54389-F1-model_v4	DESULFOASV1_3493_hypothetical_protein	AF-P54389-F1-model_v4 TPR repeat-containing protein YpiA	0.148	154	116	43	179	204	357	1.381E-02	127
DESULFOASV1_3493_hypothetical_protein	AF-O74711-F1-model_v4	DESULFOASV1_3493_hypothetical_protein	AF-O74711-F1-model_v4 Peroxisomal targeting signal receptor	0.183	130	104	45	174	297	424	3.848E-02	127
DESULFOASV1_3493_hypothetical_protein	AF-Q920N5-F1-model_v4	DESULFOASV1_3493_hypothetical_protein	AF-Q920N5-F1-model_v4 Peroxisomal targeting signal 1 receptor	0.141	239	145	6	175	264	502	8.474E-03	127
DESULFOASV1_3493_hypothetical_protein	AF-Q6DCD5-F1-model_v4	DESULFOASV1_3493_hypothetical_protein	AF-Q6DCD5-F1-model_v4 Protein O-mannosyl-transferase TMTC2	0.191	141	111	39	176	602	742	4.455E-02	127
DESULFOASV1_3493_hypothetical_protein	AF-A8SEA4-F1-model_v4	DESULFOASV1_3493_hypothetical_protein	AF-A8SEA4-F1-model_v4 Photosystem I assembly protein Ycf3	0.166	114	80	41	137	33	146	4.678E-02	126
DESULFOASV1_3493_hypothetical_protein	AF-Q3SZV0-F1-model_v4	DESULFOASV1_3493_hypothetical_protein	AF-Q3SZV0-F1-model_v4 Tetratricopeptide repeat protein 36	0.176	125	96	38	155	45	169	6.913E-02	126
DESULFOASV1_3493_hypothetical_protein	AF-D5D1H3-F1-model_v4	DESULFOASV1_3493_hypothetical_protein	AF-D5D1H3-F1-model_v4 Lipoprotein NlpI	0.169	152	116	43	182	96	247	1.522E-02	126
DESULFOASV1_3493_hypothetical_protein	AF-Q02790-F1-model_v4	DESULFOASV1_3493_hypothetical_protein	AF-Q02790-F1-model_v4 Peptidyl-prolyl cis-trans isomerase FKBP4	0.165	148	119	39	186	266	408	1.598E-02	126
DESULFOASV1_3493_hypothetical_protein	AF-Q54MD1-F1-model_v4	DESULFOASV1_3493_hypothetical_protein	AF-Q54MD1-F1-model_v4 Peroxisomal targeting signal 1 receptor	0.156	128	92	50	159	510	637	2.734E-02	126
DESULFOASV1_3493_hypothetical_protein	AF-F4K487-F1-model_v4	DESULFOASV1_3493_hypothetical_protein	AF-F4K487-F1-model_v4 Protein PHOX3	0.217	146	99	42	187	125	252	1.522E-02	126
DESULFOASV1_3493_hypothetical_protein	AF-Q17QZ7-F1-model_v4	DESULFOASV1_3493_hypothetical_protein	AF-Q17QZ7-F1-model_v4 Tetratricopeptide repeat protein 27	0.175	131	94	43	157	531	661	2.871E-02	126
DESULFOASV1_3493_hypothetical_protein	AF-Q09G45-F1-model_v4	DESULFOASV1_3493_hypothetical_protein	AF-Q09G45-F1-model_v4 Photosystem I assembly protein Ycf3	0.166	114	80	41	137	33	146	4.912E-02	125
DESULFOASV1_3493_hypothetical_protein	AF-Q6P5P3-F1-model_v4	DESULFOASV1_3493_hypothetical_protein	AF-Q6P5P3-F1-model_v4 Tetratricopeptide repeat protein 9C	0.139	169	126	37	183	2	170	2.040E-02	125
DESULFOASV1_3493_hypothetical_protein	AF-C4NYP8-F1-model_v4	DESULFOASV1_3493_hypothetical_protein	AF-C4NYP8-F1-model_v4 Hsc70-interacting protein 1	0.159	144	111	43	186	126	258	4.455E-02	125
DESULFOASV1_3493_hypothetical_protein	AF-Q9VL78-F1-model_v4	DESULFOASV1_3493_hypothetical_protein	AF-Q9VL78-F1-model_v4 FK506-binding protein 59	0.161	144	112	43	186	252	386	2.040E-02	125
DESULFOASV1_3493_hypothetical_protein	AF-Q9MAH1-F1-model_v4	DESULFOASV1_3493_hypothetical_protein	AF-Q9MAH1-F1-model_v4 TPR repeat-containing thioredoxin TTL1	0.206	116	89	43	155	227	342	4.243E-02	125
DESULFOASV1_3493_hypothetical_protein	AF-Q6P3X3-F1-model_v4	DESULFOASV1_3493_hypothetical_protein	AF-Q6P3X3-F1-model_v4 Tetratricopeptide repeat protein 27	0.116	137	116	43	174	561	697	3.848E-02	125
DESULFOASV1_3493_hypothetical_protein	AF-P19450-F1-model_v4	DESULFOASV1_3493_hypothetical_protein	AF-P19450-F1-model_v4 Cellulose synthase operon protein C	0.134	133	113	44	174	372	504	4.243E-02	125
DESULFOASV1_3493_hypothetical_protein	AF-Q61LA1-F1-model_v4	DESULFOASV1_3493_hypothetical_protein	AF-Q61LA1-F1-model_v4 Tetratricopeptide repeat protein 21 homolog	0.148	147	118	43	181	735	881	2.142E-02	125
DESULFOASV1_3493_hypothetical_protein	AF-A2A690-F1-model_v4	DESULFOASV1_3493_hypothetical_protein	AF-A2A690-F1-model_v4 Protein TANC2	0.164	145	115	43	187	1244	1382	1.850E-02	125
DESULFOASV1_3493_hypothetical_protein	AF-Q4VZH4-F1-model_v4	DESULFOASV1_3493_hypothetical_protein	AF-Q4VZH4-F1-model_v4 Photosystem I assembly protein Ycf3	0.175	114	79	41	137	34	147	5.416E-02	124
DESULFOASV1_3493_hypothetical_protein	AF-Q08168-F1-model_v4	DESULFOASV1_3493_hypothetical_protein	AF-Q08168-F1-model_v4 58 kDa phosphoprotein	0.151	148	113	39	186	109	242	3.848E-02	124
DESULFOASV1_3493_hypothetical_protein	AF-Q9M324-F1-model_v4	DESULFOASV1_3493_hypothetical_protein	AF-Q9M324-F1-model_v4 Serine/threonine-protein kinase BSK6	0.131	99	84	39	136	380	478	2.023E-01	124
DESULFOASV1_3493_hypothetical_protein	AF-I1R9A9-F1-model_v4	DESULFOASV1_3493_hypothetical_protein	AF-I1R9A9-F1-model_v4 Methyltransferase FGSG_00040	0.134	126	101	43	160	187	312	8.003E-02	124
DESULFOASV1_3493_hypothetical_protein	AF-Q12797-F1-model_v4	DESULFOASV1_3493_hypothetical_protein	AF-Q12797-F1-model_v4 Aspartyl/asparaginyl beta-hydroxylase	0.166	113	91	43	152	420	532	1.022E-01	124
DESULFOASV1_3493_hypothetical_protein	AF-Q8N5M4-F1-model_v4	DESULFOASV1_3493_hypothetical_protein	AF-Q8N5M4-F1-model_v4 Tetratricopeptide repeat protein 9C	0.120	168	131	37	186	2	169	2.734E-02	123
DESULFOASV1_3493_hypothetical_protein	AF-Q31D49-F1-model_v4	DESULFOASV1_3493_hypothetical_protein	AF-Q31D49-F1-model_v4 Photosystem I assembly protein Ycf3	0.179	163	118	7	151	1	163	1.850E-02	123
DESULFOASV1_3493_hypothetical_protein	AF-A9BCY9-F1-model_v4	DESULFOASV1_3493_hypothetical_protein	AF-A9BCY9-F1-model_v4 Photosystem I assembly protein Ycf3	0.175	163	119	7	151	1	163	3.848E-02	123
DESULFOASV1_3493_hypothetical_protein	AF-Q6AZN0-F1-model_v4	DESULFOASV1_3493_hypothetical_protein	AF-Q6AZN0-F1-model_v4 Dynein axonemal assembly factor 4	0.114	191	152	1	173	230	420	1.598E-02	123
DESULFOASV1_3493_hypothetical_protein	AF-A1Z8E9-F1-model_v4	DESULFOASV1_3493_hypothetical_protein	AF-A1Z8E9-F1-model_v4 Bardet-Biedl syndrome 4 protein homolog	0.162	163	127	2	154	25	187	2.871E-02	123
DESULFOASV1_3493_hypothetical_protein	AF-Q38931-F1-model_v4	DESULFOASV1_3493_hypothetical_protein	AF-Q38931-F1-model_v4 Peptidyl-prolyl cis-trans isomerase FKBP62	0.152	142	118	43	184	400	539	1.598E-02	123
DESULFOASV1_3493_hypothetical_protein	AF-A4III8-F1-model_v4	DESULFOASV1_3493_hypothetical_protein	AF-A4III8-F1-model_v4 Intraflagellar transport protein 56	0.153	115	95	44	156	152	266	7.259E-02	123
DESULFOASV1_3493_hypothetical_protein	AF-Q8NDW8-F1-model_v4	DESULFOASV1_3493_hypothetical_protein	AF-Q8NDW8-F1-model_v4 Tetratricopeptide repeat protein 21A	0.169	137	111	43	176	728	864	3.665E-02	123
DESULFOASV1_3493_hypothetical_protein	AF-D3ZSP7-F1-model_v4	DESULFOASV1_3493_hypothetical_protein	AF-D3ZSP7-F1-model_v4 E3 ubiquitin-protein ligase TTC3	0.140	147	108	39	185	246	371	3.490E-02	123
DESULFOASV1_3493_hypothetical_protein	AF-A1XFV6-F1-model_v4	DESULFOASV1_3493_hypothetical_protein	AF-A1XFV6-F1-model_v4 Photosystem I assembly protein Ycf3	0.166	114	80	41	137	33	146	5.971E-02	122
DESULFOASV1_3493_hypothetical_protein	AF-A5GP07-F1-model_v4	DESULFOASV1_3493_hypothetical_protein	AF-A5GP07-F1-model_v4 Photosystem I assembly protein Ycf3	0.194	134	91	38	151	30	163	5.158E-02	122
DESULFOASV1_3493_hypothetical_protein	AF-Q46HP2-F1-model_v4	DESULFOASV1_3493_hypothetical_protein	AF-Q46HP2-F1-model_v4 Photosystem I assembly protein Ycf3	0.167	163	123	3	151	1	163	1.598E-02	122
DESULFOASV1_3493_hypothetical_protein	AF-Q20683-F1-model_v4	DESULFOASV1_3493_hypothetical_protein	AF-Q20683-F1-model_v4 Tetratricopeptide repeat protein 36	0.159	138	112	43	180	43	176	3.490E-02	122
DESULFOASV1_3493_hypothetical_protein	AF-B9DHG0-F1-model_v4	DESULFOASV1_3493_hypothetical_protein	AF-B9DHG0-F1-model_v4 Tetratricopeptide repeat domain-containing protein PYG7, chloroplastic	0.173	171	133	16	186	137	298	1.381E-02	122
DESULFOASV1_3493_hypothetical_protein	AF-Q9LDC0-F1-model_v4	DESULFOASV1_3493_hypothetical_protein	AF-Q9LDC0-F1-model_v4 Peptidyl-prolyl cis-trans isomerase FKBP42	0.149	144	119	43	186	179	319	1.850E-02	122
DESULFOASV1_3493_hypothetical_protein	AF-Q13042-F1-model_v4	DESULFOASV1_3493_hypothetical_protein	AF-Q13042-F1-model_v4 Cell division cycle protein 16 homolog	0.131	128	99	46	160	405	532	8.404E-02	122
DESULFOASV1_3493_hypothetical_protein	AF-Q9CY00-F1-model_v4	DESULFOASV1_3493_hypothetical_protein	AF-Q9CY00-F1-model_v4 Tetratricopeptide repeat protein 30B	0.179	132	101	46	177	14	137	3.848E-02	122
DESULFOASV1_3493_hypothetical_protein	AF-Q9VF81-F1-model_v4	DESULFOASV1_3493_hypothetical_protein	AF-Q9VF81-F1-model_v4 Protein O-mannosyl-transferase TMTC4	0.169	159	117	43	184	546	704	2.142E-02	122
DESULFOASV1_3493_hypothetical_protein	AF-K7TQE3-F1-model_v4	DESULFOASV1_3493_hypothetical_protein	AF-K7TQE3-F1-model_v4 HSP-interacting protein	0.159	137	106	43	179	26	152	2.871E-02	122
DESULFOASV1_3493_hypothetical_protein	AF-Q9BGT1-F1-model_v4	DESULFOASV1_3493_hypothetical_protein	AF-Q9BGT1-F1-model_v4 Tetratricopeptide repeat protein 9C	0.134	169	126	37	183	2	170	2.734E-02	121
DESULFOASV1_3493_hypothetical_protein	AF-A2BUA8-F1-model_v4	DESULFOASV1_3493_hypothetical_protein	AF-A2BUA8-F1-model_v4 Photosystem I assembly protein Ycf3	0.175	163	119	7	151	1	163	2.734E-02	121
DESULFOASV1_3493_hypothetical_protein	AF-O78458-F1-model_v4	DESULFOASV1_3493_hypothetical_protein	AF-O78458-F1-model_v4 Uncharacterized protein ycf37	0.142	173	136	15	187	20	178	1.030E-02	121
DESULFOASV1_3493_hypothetical_protein	AF-Q863A4-F1-model_v4	DESULFOASV1_3493_hypothetical_protein	AF-Q863A4-F1-model_v4 Dynein axonemal assembly factor 4	0.125	181	139	1	160	240	420	1.850E-02	121
DESULFOASV1_3493_hypothetical_protein	AF-F4I3M3-F1-model_v4	DESULFOASV1_3493_hypothetical_protein	AF-F4I3M3-F1-model_v4 Serine/threonine-protein kinase BSK7	0.110	99	86	39	136	378	476	1.664E-01	121
DESULFOASV1_3493_hypothetical_protein	AF-Q32NU8-F1-model_v4	DESULFOASV1_3493_hypothetical_protein	AF-Q32NU8-F1-model_v4 Outer dynein arm-docking complex subunit 4	0.155	187	139	14	179	245	431	2.362E-02	121
DESULFOASV1_3493_hypothetical_protein	AF-Q4R7Z9-F1-model_v4	DESULFOASV1_3493_hypothetical_protein	AF-Q4R7Z9-F1-model_v4 Intraflagellar transport protein 56	0.139	115	96	44	156	152	266	1.510E-01	121
DESULFOASV1_3493_hypothetical_protein	AF-A2A6Q5-F1-model_v4	DESULFOASV1_3493_hypothetical_protein	AF-A2A6Q5-F1-model_v4 Cell division cycle protein 27 homolog	0.180	133	108	43	175	602	734	8.824E-02	121
DESULFOASV1_3493_hypothetical_protein	AF-Q9V3X5-F1-model_v4	DESULFOASV1_3493_hypothetical_protein	AF-Q9V3X5-F1-model_v4 Protein O-mannosyl-transferase TMTC2	0.173	167	113	43	180	602	768	2.142E-02	121
DESULFOASV1_3493_hypothetical_protein	AF-D3YVL2-F1-model_v4	DESULFOASV1_3493_hypothetical_protein	AF-D3YVL2-F1-model_v4 Cilia- and flagella-associated protein 70	0.196	132	88	46	177	1023	1133	5.158E-02	121
DESULFOASV1_3493_hypothetical_protein	AF-Q8C0S4-F1-model_v4	DESULFOASV1_3493_hypothetical_protein	AF-Q8C0S4-F1-model_v4 Tetratricopeptide repeat protein 21A	0.153	132	111	43	174	883	1014	5.687E-02	121
DESULFOASV1_3493_hypothetical_protein	AF-Q6EW47-F1-model_v4	DESULFOASV1_3493_hypothetical_protein	AF-Q6EW47-F1-model_v4 Photosystem I assembly protein Ycf3	0.160	112	79	43	137	35	146	6.270E-02	120
DESULFOASV1_3493_hypothetical_protein	AF-Q5SD07-F1-model_v4	DESULFOASV1_3493_hypothetical_protein	AF-Q5SD07-F1-model_v4 Photosystem I assembly protein Ycf3	0.166	114	80	41	137	33	146	8.003E-02	120
DESULFOASV1_3493_hypothetical_protein	AF-Q863A7-F1-model_v4	DESULFOASV1_3493_hypothetical_protein	AF-Q863A7-F1-model_v4 Dynein axonemal assembly factor 4	0.128	181	139	1	160	240	420	2.040E-02	120
DESULFOASV1_3493_hypothetical_protein	AF-A7E3N7-F1-model_v4	DESULFOASV1_3493_hypothetical_protein	AF-A7E3N7-F1-model_v4 NADPH oxidase activator 1	0.132	157	114	43	174	38	194	3.015E-02	120
DESULFOASV1_3493_hypothetical_protein	AF-Q8R349-F1-model_v4	DESULFOASV1_3493_hypothetical_protein	AF-Q8R349-F1-model_v4 Cell division cycle protein 16 homolog	0.140	127	97	46	159	405	531	6.270E-02	120
DESULFOASV1_3493_hypothetical_protein	AF-Q7DMA9-F1-model_v4	DESULFOASV1_3493_hypothetical_protein	AF-Q7DMA9-F1-model_v4 Peptidyl-prolyl cis-trans isomerase PASTICCINO1	0.146	149	126	37	185	394	541	4.678E-02	120
DESULFOASV1_3493_hypothetical_protein	AF-P41842-F1-model_v4	DESULFOASV1_3493_hypothetical_protein	AF-P41842-F1-model_v4 Tetratricopeptide repeat-containing protein trd-1	0.134	161	125	43	187	451	611	2.480E-02	120
DESULFOASV1_3493_hypothetical_protein	AF-O83890-F1-model_v4	DESULFOASV1_3493_hypothetical_protein	AF-O83890-F1-model_v4 TPR repeat-containing protein TP_0920	0.105	120	105	43	162	690	807	8.824E-02	120
DESULFOASV1_3493_hypothetical_protein	AF-P31600-F1-model_v4	DESULFOASV1_3493_hypothetical_protein	AF-P31600-F1-model_v4 Bacteriophage adsorption protein A	0.181	116	88	43	158	612	720	9.729E-02	120
DESULFOASV1_3493_hypothetical_protein	AF-Q7V3E4-F1-model_v4	DESULFOASV1_3493_hypothetical_protein	AF-Q7V3E4-F1-model_v4 Photosystem I assembly protein Ycf3	0.165	163	118	10	151	1	163	4.912E-02	119
DESULFOASV1_3493_hypothetical_protein	AF-Q8I4V8-F1-model_v4	DESULFOASV1_3493_hypothetical_protein	AF-Q8I4V8-F1-model_v4 Peptidyl-prolyl cis-trans isomerase FKBP35	0.147	147	121	39	185	140	282	2.871E-02	119
DESULFOASV1_3493_hypothetical_protein	AF-O75344-F1-model_v4	DESULFOASV1_3493_hypothetical_protein	AF-O75344-F1-model_v4 Inactive peptidyl-prolyl cis-trans isomerase FKBP6	0.180	143	116	43	184	171	313	3.324E-02	119
DESULFOASV1_3493_hypothetical_protein	AF-P33313-F1-model_v4	DESULFOASV1_3493_hypothetical_protein	AF-P33313-F1-model_v4 Hsp70/Hsp90 co-chaperone CNS1	0.189	186	131	1	186	53	214	1.315E-02	119
DESULFOASV1_3493_hypothetical_protein	AF-Q863A6-F1-model_v4	DESULFOASV1_3493_hypothetical_protein	AF-Q863A6-F1-model_v4 Dynein axonemal assembly factor 4	0.130	181	138	1	160	240	420	1.943E-02	119
DESULFOASV1_3493_hypothetical_protein	AF-Q8R368-F1-model_v4	DESULFOASV1_3493_hypothetical_protein	AF-Q8R368-F1-model_v4 Dynein assembly factor 4, axonemal	0.127	183	139	1	160	238	420	1.522E-02	119
DESULFOASV1_3493_hypothetical_protein	AF-Q8BS45-F1-model_v4	DESULFOASV1_3493_hypothetical_protein	AF-Q8BS45-F1-model_v4 Intraflagellar transport protein 56	0.153	115	95	44	156	152	266	9.729E-02	119
DESULFOASV1_3493_hypothetical_protein	AF-Q9WVM3-F1-model_v4	DESULFOASV1_3493_hypothetical_protein	AF-Q9WVM3-F1-model_v4 Anaphase-promoting complex subunit 7	0.181	132	105	43	174	305	433	9.265E-02	119
DESULFOASV1_3493_hypothetical_protein	AF-Q752X0-F1-model_v4	DESULFOASV1_3493_hypothetical_protein	AF-Q752X0-F1-model_v4 Peroxisomal targeting signal receptor	0.171	150	109	45	177	283	432	3.015E-02	119
DESULFOASV1_3493_hypothetical_protein	AF-P35056-F1-model_v4	DESULFOASV1_3493_hypothetical_protein	AF-P35056-F1-model_v4 Peroxisomal targeting signal receptor	0.176	130	105	46	174	315	444	6.270E-02	119
DESULFOASV1_3493_hypothetical_protein	AF-Q9BBT4-F1-model_v4	DESULFOASV1_3493_hypothetical_protein	AF-Q9BBT4-F1-model_v4 Photosystem I assembly protein Ycf3	0.144	146	116	1	137	1	146	2.734E-02	118
DESULFOASV1_3493_hypothetical_protein	AF-A2BZV8-F1-model_v4	DESULFOASV1_3493_hypothetical_protein	AF-A2BZV8-F1-model_v4 Photosystem I assembly protein Ycf3	0.181	163	121	3	151	1	163	1.678E-02	118
DESULFOASV1_3493_hypothetical_protein	AF-Q0I6Y9-F1-model_v4	DESULFOASV1_3493_hypothetical_protein	AF-Q0I6Y9-F1-model_v4 Photosystem I assembly protein Ycf3	0.186	134	92	38	151	30	163	5.687E-02	118
DESULFOASV1_3493_hypothetical_protein	AF-Q8IZP2-F1-model_v4	DESULFOASV1_3493_hypothetical_protein	AF-Q8IZP2-F1-model_v4 Putative protein FAM10A4	0.170	143	107	43	185	110	239	5.416E-02	118
DESULFOASV1_3493_hypothetical_protein	AF-P26882-F1-model_v4	DESULFOASV1_3493_hypothetical_protein	AF-P26882-F1-model_v4 Peptidyl-prolyl cis-trans isomerase D	0.150	143	120	43	185	223	364	3.015E-02	118
DESULFOASV1_3493_hypothetical_protein	AF-Q9QVC8-F1-model_v4	DESULFOASV1_3493_hypothetical_protein	AF-Q9QVC8-F1-model_v4 Peptidyl-prolyl cis-trans isomerase FKBP4	0.159	148	119	39	186	266	408	3.015E-02	118
DESULFOASV1_3493_hypothetical_protein	AF-Q7ZU45-F1-model_v4	DESULFOASV1_3493_hypothetical_protein	AF-Q7ZU45-F1-model_v4 Outer dynein arm-docking complex subunit 4	0.199	226	143	3	182	206	431	2.734E-02	118
DESULFOASV1_3493_hypothetical_protein	AF-Q9FHD7-F1-model_v4	DESULFOASV1_3493_hypothetical_protein	AF-Q9FHD7-F1-model_v4 Serine/threonine-protein kinase BSK8	0.141	99	83	39	136	378	476	2.990E-01	118
DESULFOASV1_3493_hypothetical_protein	AF-Q9FIL1-F1-model_v4	DESULFOASV1_3493_hypothetical_protein	AF-Q9FIL1-F1-model_v4 Serine/threonine-protein kinase BSK5	0.160	99	81	39	136	378	476	2.342E-01	118
DESULFOASV1_3493_hypothetical_protein	AF-Q925N3-F1-model_v4	DESULFOASV1_3493_hypothetical_protein	AF-Q925N3-F1-model_v4 PEX5-related protein	0.152	216	147	1	174	221	436	1.450E-02	118
DESULFOASV1_3493_hypothetical_protein	AF-P07213-F1-model_v4	DESULFOASV1_3493_hypothetical_protein	AF-P07213-F1-model_v4 Mitochondrial import receptor subunit TOM70	0.170	122	97	39	156	95	216	6.913E-02	118
DESULFOASV1_3493_hypothetical_protein	AF-O70525-F1-model_v4	DESULFOASV1_3493_hypothetical_protein	AF-O70525-F1-model_v4 Peroxisomal targeting signal 1 receptor	0.166	144	100	51	171	461	604	8.898E-03	118
DESULFOASV1_3493_hypothetical_protein	AF-Q9WX63-F1-model_v4	DESULFOASV1_3493_hypothetical_protein	AF-Q9WX63-F1-model_v4 Cellulose synthase 1 operon protein C	0.138	133	112	44	174	373	505	3.848E-02	118
DESULFOASV1_3493_hypothetical_protein	AF-Q96AY4-F1-model_v4	DESULFOASV1_3493_hypothetical_protein	AF-Q96AY4-F1-model_v4 Tetratricopeptide repeat protein 28	0.114	145	118	42	186	57	190	5.158E-02	118
DESULFOASV1_3493_hypothetical_protein	AF-Q9I7B1-F1-model_v4	DESULFOASV1_3493_hypothetical_protein	AF-Q9I7B1-F1-model_v4 TPR repeat-containing protein PA0015	0.214	84	61	43	120	17	100	1.585E-01	117
DESULFOASV1_3493_hypothetical_protein	AF-Q7YJX1-F1-model_v4	DESULFOASV1_3493_hypothetical_protein	AF-Q7YJX1-F1-model_v4 Photosystem I assembly protein Ycf3	0.157	114	81	41	137	33	146	9.265E-02	117
DESULFOASV1_3493_hypothetical_protein	AF-Q06GZ6-F1-model_v4	DESULFOASV1_3493_hypothetical_protein	AF-Q06GZ6-F1-model_v4 Photosystem I assembly protein Ycf3	0.144	146	116	1	137	1	146	3.015E-02	117
DESULFOASV1_3493_hypothetical_protein	AF-Q3B045-F1-model_v4	DESULFOASV1_3493_hypothetical_protein	AF-Q3B045-F1-model_v4 Photosystem I assembly protein Ycf3	0.201	134	90	38	151	30	163	7.259E-02	117
DESULFOASV1_3493_hypothetical_protein	AF-P74063-F1-model_v4	DESULFOASV1_3493_hypothetical_protein	AF-P74063-F1-model_v4 Photosystem I assembly protein Ycf3	0.146	116	84	39	137	31	146	1.510E-01	117
DESULFOASV1_3493_hypothetical_protein	AF-Q10W18-F1-model_v4	DESULFOASV1_3493_hypothetical_protein	AF-Q10W18-F1-model_v4 Photosystem I assembly protein Ycf3	0.163	116	82	39	137	31	146	1.438E-01	117
DESULFOASV1_3493_hypothetical_protein	AF-Q57105-F1-model_v4	DESULFOASV1_3493_hypothetical_protein	AF-Q57105-F1-model_v4 TPR repeat-containing protein BB_0298	0.157	194	141	7	174	36	229	6.913E-02	117
DESULFOASV1_3493_hypothetical_protein	AF-Q93YR3-F1-model_v4	DESULFOASV1_3493_hypothetical_protein	AF-Q93YR3-F1-model_v4 FAM10 family protein At4g22670	0.154	142	110	43	184	123	253	7.622E-02	117
DESULFOASV1_3493_hypothetical_protein	AF-P30416-F1-model_v4	DESULFOASV1_3493_hypothetical_protein	AF-P30416-F1-model_v4 Peptidyl-prolyl cis-trans isomerase FKBP4	0.147	148	121	39	186	266	408	3.015E-02	117
DESULFOASV1_3493_hypothetical_protein	AF-P33292-F1-model_v4	DESULFOASV1_3493_hypothetical_protein	AF-P33292-F1-model_v4 Peroxisomal targeting signal receptor	0.132	201	150	5	178	210	410	1.450E-02	117
DESULFOASV1_3493_hypothetical_protein	AF-P42810-F1-model_v4	DESULFOASV1_3493_hypothetical_protein	AF-P42810-F1-model_v4 TPR repeat-containing protein PA4667	0.230	112	85	43	153	473	584	1.438E-01	117
DESULFOASV1_3493_hypothetical_protein	AF-Q6B4Z3-F1-model_v4	DESULFOASV1_3493_hypothetical_protein	AF-Q6B4Z3-F1-model_v4 Histone demethylase UTY	0.139	115	98	43	157	281	395	1.927E-01	117
DESULFOASV1_3493_hypothetical_protein	AF-Q6DFB8-F1-model_v4	DESULFOASV1_3493_hypothetical_protein	AF-Q6DFB8-F1-model_v4 Tetratricopeptide repeat protein 37	0.173	120	93	41	154	4	123	1.510E-01	117
DESULFOASV1_3493_hypothetical_protein	AF-O88480-F1-model_v4	DESULFOASV1_3493_hypothetical_protein	AF-O88480-F1-model_v4 Calcineurin-binding protein cabin-1	0.180	161	113	42	180	89	249	2.734E-02	117
DESULFOASV1_3493_hypothetical_protein	AF-A4IFF3-F1-model_v4	DESULFOASV1_3493_hypothetical_protein	AF-A4IFF3-F1-model_v4 Tetratricopeptide repeat protein 9C	0.126	168	130	37	186	2	169	4.455E-02	116
DESULFOASV1_3493_hypothetical_protein	AF-Q7V4G0-F1-model_v4	DESULFOASV1_3493_hypothetical_protein	AF-Q7V4G0-F1-model_v4 Photosystem I assembly protein Ycf3	0.178	163	122	3	151	1	163	3.848E-02	116
DESULFOASV1_3493_hypothetical_protein	AF-Q95L05-F1-model_v4	DESULFOASV1_3493_hypothetical_protein	AF-Q95L05-F1-model_v4 Peptidyl-prolyl cis-trans isomerase FKBP5	0.171	149	122	39	186	264	412	3.665E-02	116
DESULFOASV1_3493_hypothetical_protein	AF-Q9TRY0-F1-model_v4	DESULFOASV1_3493_hypothetical_protein	AF-Q9TRY0-F1-model_v4 Peptidyl-prolyl cis-trans isomerase FKBP4	0.160	148	122	39	184	266	413	4.678E-02	116
DESULFOASV1_3493_hypothetical_protein	AF-Q8BGZ4-F1-model_v4	DESULFOASV1_3493_hypothetical_protein	AF-Q8BGZ4-F1-model_v4 Cell division cycle protein 23 homolog	0.176	125	102	50	174	338	462	8.404E-02	116
DESULFOASV1_3493_hypothetical_protein	AF-O09012-F1-model_v4	DESULFOASV1_3493_hypothetical_protein	AF-O09012-F1-model_v4 Peroxisomal targeting signal 1 receptor	0.138	237	146	5	174	264	500	2.362E-02	116
DESULFOASV1_3493_hypothetical_protein	AF-Q8VZM1-F1-model_v4	DESULFOASV1_3493_hypothetical_protein	AF-Q8VZM1-F1-model_v4 N-terminal acetyltransferase A complex auxiliary subunit NAA15	0.189	116	92	42	157	8	121	8.404E-02	116
DESULFOASV1_3493_hypothetical_protein	AF-Q810A3-F1-model_v4	DESULFOASV1_3493_hypothetical_protein	AF-Q810A3-F1-model_v4 Tetratricopeptide repeat protein 9C	0.134	169	126	37	183	2	170	4.243E-02	115
DESULFOASV1_3493_hypothetical_protein	AF-P39742-F1-model_v4	DESULFOASV1_3493_hypothetical_protein	AF-P39742-F1-model_v4 Translocation protein SEC72	0.147	142	118	38	179	53	191	4.041E-02	115
DESULFOASV1_3493_hypothetical_protein	AF-Q9Y2Z0-F1-model_v4	DESULFOASV1_3493_hypothetical_protein	AF-Q9Y2Z0-F1-model_v4 Protein SGT1 homolog	0.166	141	107	56	184	24	164	1.850E-02	115
DESULFOASV1_3493_hypothetical_protein	AF-Q8WXU2-F1-model_v4	DESULFOASV1_3493_hypothetical_protein	AF-Q8WXU2-F1-model_v4 Dynein assembly factor 4, axonemal	0.125	181	139	1	160	240	420	2.604E-02	115
DESULFOASV1_3493_hypothetical_protein	AF-Q5RF88-F1-model_v4	DESULFOASV1_3493_hypothetical_protein	AF-Q5RF88-F1-model_v4 Peptidyl-prolyl cis-trans isomerase FKBP5	0.171	149	122	39	186	264	412	3.848E-02	115
DESULFOASV1_3493_hypothetical_protein	AF-B3DNN5-F1-model_v4	DESULFOASV1_3493_hypothetical_protein	AF-B3DNN5-F1-model_v4 Anaphase-promoting complex subunit 6	0.125	167	126	43	187	377	543	4.455E-02	115
DESULFOASV1_3493_hypothetical_protein	AF-O48802-F1-model_v4	DESULFOASV1_3493_hypothetical_protein	AF-O48802-F1-model_v4 Protein CLMP1	0.221	139	98	41	167	49	187	9.729E-02	115
DESULFOASV1_3493_hypothetical_protein	AF-Q1ZXE6-F1-model_v4	DESULFOASV1_3493_hypothetical_protein	AF-Q1ZXE6-F1-model_v4 Anaphase-promoting complex subunit 6	0.144	118	95	43	160	607	718	1.073E-01	115
DESULFOASV1_3493_hypothetical_protein	AF-P37650-F1-model_v4	DESULFOASV1_3493_hypothetical_protein	AF-P37650-F1-model_v4 Cellulose synthase operon protein C	0.188	139	107	39	171	457	595	2.362E-02	115
DESULFOASV1_3493_hypothetical_protein	AF-Q57992-F1-model_v4	DESULFOASV1_3493_hypothetical_protein	AF-Q57992-F1-model_v4 Uncharacterized protein MJ0572	0.279	68	48	41	108	6	73	3.816E-01	114
DESULFOASV1_3493_hypothetical_protein	AF-A1XGN9-F1-model_v4	DESULFOASV1_3493_hypothetical_protein	AF-A1XGN9-F1-model_v4 Photosystem I assembly protein Ycf3	0.166	114	80	41	137	33	146	1.126E-01	114
DESULFOASV1_3493_hypothetical_protein	AF-A2BNS6-F1-model_v4	DESULFOASV1_3493_hypothetical_protein	AF-A2BNS6-F1-model_v4 Photosystem I assembly protein Ycf3	0.179	163	118	7	151	1	163	4.041E-02	114
DESULFOASV1_3493_hypothetical_protein	AF-O08915-F1-model_v4	DESULFOASV1_3493_hypothetical_protein	AF-O08915-F1-model_v4 AH receptor-interacting protein	0.138	148	126	39	186	175	321	4.243E-02	114
