query	target	qheader	theader	fident	alnlen	mismatch	qstart	qend	tstart	tend	evalue	bits
DESULFOASV1_0556_N-A	AF-P64604-F1-model_v4	DESULFOASV1_0556_N-A	AF-P64604-F1-model_v4 Intermembrane phospholipid transport system binding protein MlaD	0.205	155	118	4	152	2	156	5.376E-11	346
DESULFOASV1_0556_N-A	AF-P45029-F1-model_v4	DESULFOASV1_0556_N-A	AF-P45029-F1-model_v4 Intermembrane phospholipid transport system binding protein MlaD	0.188	158	124	2	155	1	158	6.839E-11	337
DESULFOASV1_0556_N-A	AF-P64605-F1-model_v4	DESULFOASV1_0556_N-A	AF-P64605-F1-model_v4 Intermembrane phospholipid transport system binding protein MlaD	0.191	156	119	5	152	1	156	2.899E-10	324
DESULFOASV1_0556_N-A	AF-Q1XDB5-F1-model_v4	DESULFOASV1_0556_N-A	AF-Q1XDB5-F1-model_v4 Uncharacterized protein ycf22	0.135	211	159	6	190	5	215	4.226E-11	281
DESULFOASV1_0556_N-A	AF-P76272-F1-model_v4	DESULFOASV1_0556_N-A	AF-P76272-F1-model_v4 Intermembrane transport protein YebT	0.213	122	79	39	140	746	867	3.366E-08	280
DESULFOASV1_0556_N-A	AF-P51372-F1-model_v4	DESULFOASV1_0556_N-A	AF-P51372-F1-model_v4 Uncharacterized protein ycf22	0.127	208	162	5	190	1	208	3.270E-10	277
DESULFOASV1_0556_N-A	AF-P46315-F1-model_v4	DESULFOASV1_0556_N-A	AF-P46315-F1-model_v4 Uncharacterized protein ycf22	0.150	196	158	15	201	2	197	6.733E-10	271
DESULFOASV1_0556_N-A	AF-P29285-F1-model_v4	DESULFOASV1_0556_N-A	AF-P29285-F1-model_v4 Uncharacterized protein bll6063	0.194	192	147	4	186	2	193	3.631E-09	238
DESULFOASV1_0556_N-A	AF-Q9LTR2-F1-model_v4	DESULFOASV1_0556_N-A	AF-Q9LTR2-F1-model_v4 Protein TRIGALACTOSYLDIACYLGLYCEROL 2, chloroplastic	0.181	290	232	5	288	91	380	7.714E-11	222
DESULFOASV1_0556_N-A	AF-I6Y3P1-F1-model_v4	DESULFOASV1_0556_N-A	AF-I6Y3P1-F1-model_v4 Lipoprotein LprN	0.137	323	264	20	326	2	324	9.512E-09	186
DESULFOASV1_0556_N-A	AF-P43671-F1-model_v4	DESULFOASV1_0556_N-A	AF-P43671-F1-model_v4 Intermembrane transport protein PqiB	0.134	249	183	31	242	276	524	3.072E-06	134
DESULFOASV1_0556_N-A	AF-Q88IY8-F1-model_v4	DESULFOASV1_0556_N-A	AF-Q88IY8-F1-model_v4 Methyl-accepting chemotaxis protein McpP	0.146	170	142	139	308	308	474	2.634E+00	51
DESULFOASV1_0556_N-A	AF-P54576-F1-model_v4	DESULFOASV1_0556_N-A	AF-P54576-F1-model_v4 Methyl-accepting chemotaxis protein McpC	0.171	167	135	140	306	406	569	3.155E+00	40
DESULFOASV1_0556_N-A	AF-Q0VTI9-F1-model_v4	DESULFOASV1_0556_N-A	AF-Q0VTI9-F1-model_v4 Putative methyl-accepting chemotaxis AlkN	0.162	178	139	140	306	422	599	2.797E+00	39
DESULFOASV1_0556_N-A	AF-Q88D09-F1-model_v4	DESULFOASV1_0556_N-A	AF-Q88D09-F1-model_v4 Methyl-accepting chemotaxis protein McpQ	0.151	174	143	140	309	396	569	8.265E+00	38
DESULFOASV1_0556_N-A	AF-P42257-F1-model_v4	DESULFOASV1_0556_N-A	AF-P42257-F1-model_v4 Protein PilJ	0.161	180	141	140	308	426	605	4.263E+00	37
DESULFOASV1_0556_N-A	AF-Q9WYR0-F1-model_v4	DESULFOASV1_0556_N-A	AF-Q9WYR0-F1-model_v4 Methyl-accepting chemotaxis protein 1	0.183	191	137	140	308	386	576	2.071E+00	36
DESULFOASV1_0556_N-A	AF-Q88NI1-F1-model_v4	DESULFOASV1_0556_N-A	AF-Q88NI1-F1-model_v4 Methyl-accepting chemotaxis protein McpU	0.145	172	143	139	306	445	616	9.900E+00	35
DESULFOASV1_0556_N-A	AF-O29710-F1-model_v4	DESULFOASV1_0556_N-A	AF-O29710-F1-model_v4 Uncharacterized protein AF_0540	0.138	265	190	44	308	7	227	1.006E+00	34
DESULFOASV1_0556_N-A	AF-Q8RIK8-F1-model_v4	DESULFOASV1_0556_N-A	AF-Q8RIK8-F1-model_v4 Endonuclease MutS2	0.114	175	150	89	263	452	621	3.559E+00	30
DESULFOASV1_0556_N-A	AF-Q9RV58-F1-model_v4	DESULFOASV1_0556_N-A	AF-Q9RV58-F1-model_v4 Protein DR_1172	0.133	221	163	139	327	64	284	3.351E+00	29
DESULFOASV1_0556_N-A	AF-Q09261-F1-model_v4	DESULFOASV1_0556_N-A	AF-Q09261-F1-model_v4 28S ribosomal protein S31, mitochondrial	0.141	215	179	116	324	12	226	2.199E+00	29
DESULFOASV1_0556_N-A	AF-B1GT62-F1-model_v4	DESULFOASV1_0556_N-A	AF-B1GT62-F1-model_v4 S-layer protein B	0.133	266	179	38	303	289	496	1.359E+00	29
DESULFOASV1_0556_N-A	AF-Q55445-F1-model_v4	DESULFOASV1_0556_N-A	AF-Q55445-F1-model_v4 Putative methyl-accepting chemotaxis protein sll0041	0.216	173	132	140	308	750	922	4.808E+00	29
DESULFOASV1_0556_N-A	AF-D3Z5T1-F1-model_v4	DESULFOASV1_0556_N-A	AF-D3Z5T1-F1-model_v4 Coiled-coil domain-containing protein 78	0.172	212	162	116	327	127	323	6.117E+00	28
DESULFOASV1_0556_N-A	AF-A5YVF1-F1-model_v4	DESULFOASV1_0556_N-A	AF-A5YVF1-F1-model_v4 Protein SUPPRESSOR OF GENE SILENCING 3	0.139	189	150	139	327	455	629	7.782E+00	26
DESULFOASV1_0556_N-A	AF-P22415-F1-model_v4	DESULFOASV1_0556_N-A	AF-P22415-F1-model_v4 Upstream stimulatory factor 1	0.153	126	99	200	325	193	310	9.322E+00	25
DESULFOASV1_0556_N-A	AF-Q9H2F9-F1-model_v4	DESULFOASV1_0556_N-A	AF-Q9H2F9-F1-model_v4 Coiled-coil domain-containing protein 68	0.127	258	184	116	327	64	321	6.497E+00	25
DESULFOASV1_0556_N-A	AF-P38443-F1-model_v4	DESULFOASV1_0556_N-A	AF-P38443-F1-model_v4 Uncharacterized protein VC_1460	0.109	310	233	38	299	31	340	2.797E+00	25
DESULFOASV1_0556_N-A	AF-Q06001-F1-model_v4	DESULFOASV1_0556_N-A	AF-Q06001-F1-model_v4 Factor arrest protein 10	0.131	264	216	64	327	183	432	4.263E+00	25
DESULFOASV1_0556_N-A	AF-Q66HR5-F1-model_v4	DESULFOASV1_0556_N-A	AF-Q66HR5-F1-model_v4 Calcium-binding and coiled-coil domain-containing protein 1	0.124	328	250	41	326	14	341	2.797E+00	25
DESULFOASV1_0556_N-A	AF-Q9SAI1-F1-model_v4	DESULFOASV1_0556_N-A	AF-Q9SAI1-F1-model_v4 Factor of DNA methylation 5	0.101	313	253	40	321	124	436	8.265E+00	23
DESULFOASV1_0556_N-A	AF-Q6P864-F1-model_v4	DESULFOASV1_0556_N-A	AF-Q6P864-F1-model_v4 Keratin, type I cytoskeletal 18	0.163	228	177	96	323	31	242	7.328E+00	22
DESULFOASV1_0556_N-A	AF-Q9Z0H8-F1-model_v4	DESULFOASV1_0556_N-A	AF-Q9Z0H8-F1-model_v4 CAP-Gly domain-containing linker protein 2	0.174	325	230	47	325	214	538	6.497E+00	21
DESULFOASV1_0556_N-A	AF-Q8K1N2-F1-model_v4	DESULFOASV1_0556_N-A	AF-Q8K1N2-F1-model_v4 Pleckstrin homology-like domain family B member 2	0.161	221	161	116	308	546	766	8.778E+00	21
DESULFOASV1_0556_N-A	AF-P96650-F1-model_v4	DESULFOASV1_0556_N-A	AF-P96650-F1-model_v4 Uncharacterized protein YddM	0.080	308	259	6	287	4	311	2.335E+00	20
DESULFOASV1_0556_N-A	AF-Q68UI8-F1-model_v4	DESULFOASV1_0556_N-A	AF-Q68UI8-F1-model_v4 Variable flagella 3	0.143	310	232	56	327	7	316	5.423E+00	20
DESULFOASV1_0556_N-A	AF-Q09372-F1-model_v4	DESULFOASV1_0556_N-A	AF-Q09372-F1-model_v4 Protein npp-24	0.133	268	209	67	308	385	652	9.322E+00	20
DESULFOASV1_0556_N-A	AF-P26516-F1-model_v4	DESULFOASV1_0556_N-A	AF-P26516-F1-model_v4 26S proteasome non-ATPase regulatory subunit 7	0.128	201	148	100	270	120	320	5.423E+00	19
DESULFOASV1_0556_N-A	AF-Q58651-F1-model_v4	DESULFOASV1_0556_N-A	AF-Q58651-F1-model_v4 Uncharacterized protein MJ1254	0.139	269	208	40	308	174	415	9.322E+00	18
DESULFOASV1_0556_N-A	AF-A6ZTW2-F1-model_v4	DESULFOASV1_0556_N-A	AF-A6ZTW2-F1-model_v4 Outer spore wall assembly protein SHE10	0.102	232	204	100	327	343	574	6.117E+00	18
DESULFOASV1_0556_N-A	AF-Q9VM65-F1-model_v4	DESULFOASV1_0556_N-A	AF-Q9VM65-F1-model_v4 FGFR1 oncogene partner 2 homolog	0.187	194	154	138	327	5	198	9.322E+00	17
DESULFOASV1_0556_N-A	AF-B3LHS1-F1-model_v4	DESULFOASV1_0556_N-A	AF-B3LHS1-F1-model_v4 Outer spore wall assembly protein SHE10	0.106	233	203	100	327	343	575	7.328E+00	17
DESULFOASV1_0556_N-A	AF-A2ZIW7-F1-model_v4	DESULFOASV1_0556_N-A	AF-A2ZIW7-F1-model_v4 Protein SUPPRESSOR OF GENE SILENCING 3 homolog	0.106	331	258	38	327	277	607	6.497E+00	17
DESULFOASV1_0556_N-A	AF-C7GNX5-F1-model_v4	DESULFOASV1_0556_N-A	AF-C7GNX5-F1-model_v4 Outer spore wall assembly protein SHE10	0.106	233	203	100	327	343	575	9.322E+00	16
