query	target	qheader	theader	fident	alnlen	mismatch	qstart	qend	tstart	tend	evalue	bits
DESULFOASV1_1247_hypothetical_protein	AF-Q749L1-F1-model_v4	DESULFOASV1_1247_hypothetical_protein	AF-Q749L1-F1-model_v4 C-type polyheme cytochrome OmcC	0.197	76	51	54	117	48	123	9.268E-01	53
DESULFOASV1_1247_hypothetical_protein	AF-D7ALP6-F1-model_v4	DESULFOASV1_1247_hypothetical_protein	AF-D7ALP6-F1-model_v4 C-type polyheme cytochrome OmcC	0.181	113	79	21	117	11	123	6.647E-01	44
DESULFOASV1_1247_hypothetical_protein	AF-Q9S1E6-F1-model_v4	DESULFOASV1_1247_hypothetical_protein	AF-Q9S1E6-F1-model_v4 Cytochrome c-type protein NrfH	0.185	137	107	9	145	4	135	3.235E-01	38
DESULFOASV1_1247_hypothetical_protein	AF-Q06536-F1-model_v4	DESULFOASV1_1247_hypothetical_protein	AF-Q06536-F1-model_v4 Putative tetraheme cytochrome-c type	0.156	160	123	6	152	2	161	1.094E+00	34
DESULFOASV1_1247_hypothetical_protein	AF-Q8U1W7-F1-model_v4	DESULFOASV1_1247_hypothetical_protein	AF-Q8U1W7-F1-model_v4 DNA-binding protein PF1087	0.155	121	92	1	121	1	110	7.610E+00	30
DESULFOASV1_1247_hypothetical_protein	AF-A4WLS5-F1-model_v4	DESULFOASV1_1247_hypothetical_protein	AF-A4WLS5-F1-model_v4 DNA-binding protein Pars_1791	0.137	123	92	1	123	3	110	9.498E+00	29
DESULFOASV1_1247_hypothetical_protein	AF-P56813-F1-model_v4	DESULFOASV1_1247_hypothetical_protein	AF-P56813-F1-model_v4 DNA-binding protein PYRAB09250	0.152	121	91	3	123	8	115	8.986E+00	28
DESULFOASV1_1247_hypothetical_protein	AF-Q8TUY2-F1-model_v4	DESULFOASV1_1247_hypothetical_protein	AF-Q8TUY2-F1-model_v4 DNA-binding protein MK1619	0.142	119	90	3	121	9	114	9.498E+00	27
DESULFOASV1_1247_hypothetical_protein	AF-P9WMA0-F1-model_v4	DESULFOASV1_1247_hypothetical_protein	AF-P9WMA0-F1-model_v4 Uncharacterized protein MT0028	0.139	119	99	5	123	2	117	9.498E+00	26
DESULFOASV1_1247_hypothetical_protein	AF-Q50926-F1-model_v4	DESULFOASV1_1247_hypothetical_protein	AF-Q50926-F1-model_v4 Probable tetraheme cytochrome c-type	0.184	153	119	7	153	3	155	4.622E+00	24
DESULFOASV1_1247_hypothetical_protein	AF-Q6GK25-F1-model_v4	DESULFOASV1_1247_hypothetical_protein	AF-Q6GK25-F1-model_v4 Type VII secretion system protein EssB	0.131	178	125	8	152	226	403	8.502E+00	22
DESULFOASV1_1247_hypothetical_protein	AF-O14737-F1-model_v4	DESULFOASV1_1247_hypothetical_protein	AF-O14737-F1-model_v4 Programmed cell death protein 5	0.154	123	90	2	124	8	114	9.498E+00	21
DESULFOASV1_1247_hypothetical_protein	AF-P9WMA1-F1-model_v4	DESULFOASV1_1247_hypothetical_protein	AF-P9WMA1-F1-model_v4 Uncharacterized protein Rv0025	0.196	116	89	12	123	2	117	8.986E+00	20
DESULFOASV1_1247_hypothetical_protein	AF-P52005-F1-model_v4	DESULFOASV1_1247_hypothetical_protein	AF-P52005-F1-model_v4 Cytochrome c-type protein TorY	0.128	158	115	15	147	2	159	8.044E+00	20
DESULFOASV1_1247_hypothetical_protein	AF-P44655-F1-model_v4	DESULFOASV1_1247_hypothetical_protein	AF-P44655-F1-model_v4 Cytochrome c-type protein NapC	0.149	161	121	6	148	10	170	9.498E+00	19
DESULFOASV1_1247_hypothetical_protein	AF-P58361-F1-model_v4	DESULFOASV1_1247_hypothetical_protein	AF-P58361-F1-model_v4 Cytochrome c-type protein TorY	0.141	158	113	15	147	2	159	8.502E+00	19
