query	target	qheader	theader	fident	alnlen	mismatch	qstart	qend	tstart	tend	evalue	bits
DESULFOASV1_2872_HDOD_domain-containing_protein	AF-P77302-F1-model_v4	DESULFOASV1_2872_HDOD_domain-containing_protein	AF-P77302-F1-model_v4 Diguanylate cyclase DgcM	0.230	404	305	434	830	7	410	4.124E-20	687
DESULFOASV1_2872_HDOD_domain-containing_protein	AF-Q8X8Q3-F1-model_v4	DESULFOASV1_2872_HDOD_domain-containing_protein	AF-Q8X8Q3-F1-model_v4 Diguanylate cyclase DgcM	0.240	404	301	434	830	7	410	5.175E-20	678
DESULFOASV1_2872_HDOD_domain-containing_protein	AF-A0A0H3AFM6-F1-model_v4	DESULFOASV1_2872_HDOD_domain-containing_protein	AF-A0A0H3AFM6-F1-model_v4 Diguanylate cyclase	0.239	291	210	555	831	27	317	2.294E-16	664
DESULFOASV1_2872_HDOD_domain-containing_protein	AF-P77334-F1-model_v4	DESULFOASV1_2872_HDOD_domain-containing_protein	AF-P77334-F1-model_v4 Cyclic di-GMP phosphodiesterase PdeR	0.214	406	310	426	831	2	396	1.226E-19	639
DESULFOASV1_2872_HDOD_domain-containing_protein	AF-Q9ABX9-F1-model_v4	DESULFOASV1_2872_HDOD_domain-containing_protein	AF-Q9ABX9-F1-model_v4 Uncharacterized signaling protein CC_0091	0.255	297	212	546	831	239	535	8.659E-15	617
DESULFOASV1_2872_HDOD_domain-containing_protein	AF-P38097-F1-model_v4	DESULFOASV1_2872_HDOD_domain-containing_protein	AF-P38097-F1-model_v4 Probable diguanylate cyclase DgcE	0.153	827	693	13	831	18	844	3.664E-26	588
DESULFOASV1_2872_HDOD_domain-containing_protein	AF-B8GZM2-F1-model_v4	DESULFOASV1_2872_HDOD_domain-containing_protein	AF-B8GZM2-F1-model_v4 Response regulator PleD	0.350	175	109	662	829	277	451	3.059E-11	562
DESULFOASV1_2872_HDOD_domain-containing_protein	AF-Q9A5I5-F1-model_v4	DESULFOASV1_2872_HDOD_domain-containing_protein	AF-Q9A5I5-F1-model_v4 Response regulator PleD	0.350	175	109	662	829	277	451	6.323E-11	548
DESULFOASV1_2872_HDOD_domain-containing_protein	AF-P55552-F1-model_v4	DESULFOASV1_2872_HDOD_domain-containing_protein	AF-P55552-F1-model_v4 Uncharacterized protein y4lL	0.177	520	425	312	831	44	560	3.513E-22	548
DESULFOASV1_2872_HDOD_domain-containing_protein	AF-P0AAP2-F1-model_v4	DESULFOASV1_2872_HDOD_domain-containing_protein	AF-P0AAP2-F1-model_v4 Probable diguanylate cyclase DgcC	0.306	174	117	662	831	198	371	4.398E-11	538
DESULFOASV1_2872_HDOD_domain-containing_protein	AF-P0AAP1-F1-model_v4	DESULFOASV1_2872_HDOD_domain-containing_protein	AF-P0AAP1-F1-model_v4 Probable diguanylate cyclase DgcC	0.306	174	117	662	831	198	371	4.816E-11	529
DESULFOASV1_2872_HDOD_domain-containing_protein	AF-Q9HT84-F1-model_v4	DESULFOASV1_2872_HDOD_domain-containing_protein	AF-Q9HT84-F1-model_v4 Diguanylate cyclase DgcP	0.302	173	117	662	830	499	671	5.845E-10	515
DESULFOASV1_2872_HDOD_domain-containing_protein	AF-Q8EJM6-F1-model_v4	DESULFOASV1_2872_HDOD_domain-containing_protein	AF-Q8EJM6-F1-model_v4 Cyclic di-GMP phosphodiesterase PdeB	0.168	510	336	427	831	77	586	5.130E-17	501
DESULFOASV1_2872_HDOD_domain-containing_protein	AF-P54595-F1-model_v4	DESULFOASV1_2872_HDOD_domain-containing_protein	AF-P54595-F1-model_v4 Uncharacterized protein YhcK	0.273	178	124	661	831	179	356	1.208E-09	497
DESULFOASV1_2872_HDOD_domain-containing_protein	AF-A0A0H2ZJS2-F1-model_v4	DESULFOASV1_2872_HDOD_domain-containing_protein	AF-A0A0H2ZJS2-F1-model_v4 Diguanylate cyclase DgcP	0.302	173	117	662	830	499	671	1.587E-09	496
DESULFOASV1_2872_HDOD_domain-containing_protein	AF-Q9HYT3-F1-model_v4	DESULFOASV1_2872_HDOD_domain-containing_protein	AF-Q9HYT3-F1-model_v4 Uncharacterized signaling protein PA3311	0.286	176	122	660	831	331	506	1.155E-09	495
DESULFOASV1_2872_HDOD_domain-containing_protein	AF-Q9I310-F1-model_v4	DESULFOASV1_2872_HDOD_domain-containing_protein	AF-Q9I310-F1-model_v4 Uncharacterized signaling protein PA1727	0.372	174	106	662	831	251	424	1.104E-09	488
DESULFOASV1_2872_HDOD_domain-containing_protein	AF-P76129-F1-model_v4	DESULFOASV1_2872_HDOD_domain-containing_protein	AF-P76129-F1-model_v4 Oxygen sensor protein DosP	0.131	517	346	433	831	15	531	6.358E-18	470
DESULFOASV1_2872_HDOD_domain-containing_protein	AF-Q49VU5-F1-model_v4	DESULFOASV1_2872_HDOD_domain-containing_protein	AF-Q49VU5-F1-model_v4 Uncharacterized membrane protein SSP1970	0.271	175	122	662	829	176	350	2.498E-09	467
DESULFOASV1_2872_HDOD_domain-containing_protein	AF-Q8CTF5-F1-model_v4	DESULFOASV1_2872_HDOD_domain-containing_protein	AF-Q8CTF5-F1-model_v4 Uncharacterized membrane protein SE_0528	0.265	175	123	662	829	176	350	3.592E-09	463
DESULFOASV1_2872_HDOD_domain-containing_protein	AF-Q6GIP5-F1-model_v4	DESULFOASV1_2872_HDOD_domain-containing_protein	AF-Q6GIP5-F1-model_v4 Uncharacterized membrane protein SAR0800	0.256	177	126	662	831	176	352	4.716E-09	461
DESULFOASV1_2872_HDOD_domain-containing_protein	AF-Q99VM8-F1-model_v4	DESULFOASV1_2872_HDOD_domain-containing_protein	AF-Q99VM8-F1-model_v4 Uncharacterized membrane protein SA0701	0.259	175	124	662	829	176	350	5.917E-09	456
DESULFOASV1_2872_HDOD_domain-containing_protein	AF-Q5HQY3-F1-model_v4	DESULFOASV1_2872_HDOD_domain-containing_protein	AF-Q5HQY3-F1-model_v4 Uncharacterized membrane protein SERP0413	0.265	175	123	662	829	176	350	6.479E-09	455
DESULFOASV1_2872_HDOD_domain-containing_protein	AF-Q2YSF9-F1-model_v4	DESULFOASV1_2872_HDOD_domain-containing_protein	AF-Q2YSF9-F1-model_v4 Uncharacterized membrane protein SAB0698c	0.259	175	124	662	829	176	350	7.769E-09	451
DESULFOASV1_2872_HDOD_domain-containing_protein	AF-Q7A2V2-F1-model_v4	DESULFOASV1_2872_HDOD_domain-containing_protein	AF-Q7A2V2-F1-model_v4 Uncharacterized membrane protein SAV0746	0.259	175	124	662	829	176	350	8.508E-09	449
DESULFOASV1_2872_HDOD_domain-containing_protein	AF-Q7A1G8-F1-model_v4	DESULFOASV1_2872_HDOD_domain-containing_protein	AF-Q7A1G8-F1-model_v4 Uncharacterized membrane protein MW0708	0.256	177	126	662	831	176	352	9.316E-09	448
DESULFOASV1_2872_HDOD_domain-containing_protein	AF-Q2FIP5-F1-model_v4	DESULFOASV1_2872_HDOD_domain-containing_protein	AF-Q2FIP5-F1-model_v4 Uncharacterized membrane protein SAUSA300_0730	0.256	177	126	662	831	176	352	8.903E-09	448
DESULFOASV1_2872_HDOD_domain-containing_protein	AF-Q2G061-F1-model_v4	DESULFOASV1_2872_HDOD_domain-containing_protein	AF-Q2G061-F1-model_v4 Uncharacterized membrane protein SAOUHSC_00760	0.259	175	124	662	829	176	350	8.903E-09	448
DESULFOASV1_2872_HDOD_domain-containing_protein	AF-Q7DLB7-F1-model_v4	DESULFOASV1_2872_HDOD_domain-containing_protein	AF-Q7DLB7-F1-model_v4 Uncharacterized membrane protein in llm 5'region	0.259	175	124	662	829	176	350	1.117E-08	443
DESULFOASV1_2872_HDOD_domain-containing_protein	AF-Q4L4H1-F1-model_v4	DESULFOASV1_2872_HDOD_domain-containing_protein	AF-Q4L4H1-F1-model_v4 Uncharacterized membrane protein SH2145	0.259	175	124	662	829	176	350	1.280E-08	442
DESULFOASV1_2872_HDOD_domain-containing_protein	AF-Q6GB84-F1-model_v4	DESULFOASV1_2872_HDOD_domain-containing_protein	AF-Q6GB84-F1-model_v4 Uncharacterized membrane protein SAS0711	0.259	175	124	662	829	176	350	1.223E-08	441
DESULFOASV1_2872_HDOD_domain-containing_protein	AF-Q5HHS4-F1-model_v4	DESULFOASV1_2872_HDOD_domain-containing_protein	AF-Q5HHS4-F1-model_v4 Uncharacterized membrane protein SACOL0809	0.259	175	124	662	829	176	350	1.339E-08	440
DESULFOASV1_2872_HDOD_domain-containing_protein	AF-P75908-F1-model_v4	DESULFOASV1_2872_HDOD_domain-containing_protein	AF-P75908-F1-model_v4 Probable diguanylate cyclase DgcT	0.294	175	119	662	831	270	444	6.479E-09	437
DESULFOASV1_2872_HDOD_domain-containing_protein	AF-P0AA89-F1-model_v4	DESULFOASV1_2872_HDOD_domain-containing_protein	AF-P0AA89-F1-model_v4 Diguanylate cyclase DosC	0.338	175	111	663	831	283	457	5.655E-09	436
DESULFOASV1_2872_HDOD_domain-containing_protein	AF-Q9KKZ4-F1-model_v4	DESULFOASV1_2872_HDOD_domain-containing_protein	AF-Q9KKZ4-F1-model_v4 Diguanylate cyclase VdcA	0.314	172	113	662	827	165	336	5.655E-09	419
DESULFOASV1_2872_HDOD_domain-containing_protein	AF-P76236-F1-model_v4	DESULFOASV1_2872_HDOD_domain-containing_protein	AF-P76236-F1-model_v4 Probable diguanylate cyclase CdgI	0.275	173	121	662	829	316	488	2.646E-08	416
DESULFOASV1_2872_HDOD_domain-containing_protein	AF-Q320T0-F1-model_v4	DESULFOASV1_2872_HDOD_domain-containing_protein	AF-Q320T0-F1-model_v4 Diguanylate cyclase DosC	0.344	175	110	663	831	283	457	1.759E-08	410
DESULFOASV1_2872_HDOD_domain-containing_protein	AF-P76147-F1-model_v4	DESULFOASV1_2872_HDOD_domain-containing_protein	AF-P76147-F1-model_v4 Probable diguanylate cyclase DgcF	0.258	175	125	660	828	132	306	1.991E-09	408
DESULFOASV1_2872_HDOD_domain-containing_protein	AF-Q8XAZ4-F1-model_v4	DESULFOASV1_2872_HDOD_domain-containing_protein	AF-Q8XAZ4-F1-model_v4 Probable diguanylate cyclase DgcF	0.258	175	125	660	828	132	306	2.735E-09	406
DESULFOASV1_2872_HDOD_domain-containing_protein	AF-P0AA90-F1-model_v4	DESULFOASV1_2872_HDOD_domain-containing_protein	AF-P0AA90-F1-model_v4 Diguanylate cyclase DosC	0.344	175	110	663	831	283	457	3.474E-08	400
DESULFOASV1_2872_HDOD_domain-containing_protein	AF-Q3Z1N3-F1-model_v4	DESULFOASV1_2872_HDOD_domain-containing_protein	AF-Q3Z1N3-F1-model_v4 Diguanylate cyclase DosC	0.338	175	111	663	831	283	457	2.897E-08	399
DESULFOASV1_2872_HDOD_domain-containing_protein	AF-P24222-F1-model_v4	DESULFOASV1_2872_HDOD_domain-containing_protein	AF-P24222-F1-model_v4 Uncharacterized protein in hutH 5'region	0.285	173	122	660	830	41	213	6.559E-08	385
DESULFOASV1_2872_HDOD_domain-containing_protein	AF-P74101-F1-model_v4	DESULFOASV1_2872_HDOD_domain-containing_protein	AF-P74101-F1-model_v4 Uncharacterized protein sll1895	0.156	379	280	499	831	47	425	2.033E-11	373
DESULFOASV1_2872_HDOD_domain-containing_protein	AF-P9WM12-F1-model_v4	DESULFOASV1_2872_HDOD_domain-containing_protein	AF-P9WM12-F1-model_v4 Uncharacterized protein MT1397	0.229	296	202	569	831	49	344	3.059E-11	370
DESULFOASV1_2872_HDOD_domain-containing_protein	AF-P31129-F1-model_v4	DESULFOASV1_2872_HDOD_domain-containing_protein	AF-P31129-F1-model_v4 Diguanylate cyclase DgcZ	0.262	178	126	660	831	111	288	7.182E-08	365
DESULFOASV1_2872_HDOD_domain-containing_protein	AF-P64826-F1-model_v4	DESULFOASV1_2872_HDOD_domain-containing_protein	AF-P64826-F1-model_v4 Uncharacterized protein Mb1389c	0.228	296	202	569	831	49	344	3.059E-11	361
DESULFOASV1_2872_HDOD_domain-containing_protein	AF-P9WM13-F1-model_v4	DESULFOASV1_2872_HDOD_domain-containing_protein	AF-P9WM13-F1-model_v4 Uncharacterized protein Rv1354c	0.231	296	201	569	831	49	344	4.602E-11	353
DESULFOASV1_2872_HDOD_domain-containing_protein	AF-Q04855-F1-model_v4	DESULFOASV1_2872_HDOD_domain-containing_protein	AF-Q04855-F1-model_v4 Uncharacterized protein AZC_3085	0.141	527	391	305	831	7	462	1.812E-13	348
DESULFOASV1_2872_HDOD_domain-containing_protein	AF-Q57N14-F1-model_v4	DESULFOASV1_2872_HDOD_domain-containing_protein	AF-Q57N14-F1-model_v4 Probable diguanylate cyclase DgcQ	0.163	583	443	249	831	33	562	6.023E-15	338
DESULFOASV1_2872_HDOD_domain-containing_protein	AF-O34325-F1-model_v4	DESULFOASV1_2872_HDOD_domain-containing_protein	AF-O34325-F1-model_v4 Uncharacterized protein YtrP	0.169	556	389	274	829	106	574	6.901E-15	338
DESULFOASV1_2872_HDOD_domain-containing_protein	AF-Q5PLI4-F1-model_v4	DESULFOASV1_2872_HDOD_domain-containing_protein	AF-Q5PLI4-F1-model_v4 Probable diguanylate cyclase DgcQ	0.151	583	449	249	831	33	562	5.256E-15	337
DESULFOASV1_2872_HDOD_domain-containing_protein	AF-Q8Z5R0-F1-model_v4	DESULFOASV1_2872_HDOD_domain-containing_protein	AF-Q8Z5R0-F1-model_v4 Probable diguanylate cyclase DgcQ	0.157	602	459	230	831	15	559	1.123E-15	333
DESULFOASV1_2872_HDOD_domain-containing_protein	AF-Q8ZNT5-F1-model_v4	DESULFOASV1_2872_HDOD_domain-containing_protein	AF-Q8ZNT5-F1-model_v4 Probable diguanylate cyclase DgcQ	0.156	583	446	249	831	33	562	1.190E-14	333
DESULFOASV1_2872_HDOD_domain-containing_protein	AF-P76237-F1-model_v4	DESULFOASV1_2872_HDOD_domain-containing_protein	AF-P76237-F1-model_v4 Probable diguanylate cyclase DgcJ	0.168	417	308	407	823	122	492	9.598E-14	328
DESULFOASV1_2872_HDOD_domain-containing_protein	AF-Q1RAI4-F1-model_v4	DESULFOASV1_2872_HDOD_domain-containing_protein	AF-Q1RAI4-F1-model_v4 Probable diguanylate cyclase DgcQ	0.167	584	463	245	828	8	564	5.023E-15	324
DESULFOASV1_2872_HDOD_domain-containing_protein	AF-Q8FGJ7-F1-model_v4	DESULFOASV1_2872_HDOD_domain-containing_protein	AF-Q8FGJ7-F1-model_v4 Probable diguanylate cyclase DgcQ	0.174	580	434	249	828	38	564	4.587E-15	324
DESULFOASV1_2872_HDOD_domain-containing_protein	AF-Q32HJ0-F1-model_v4	DESULFOASV1_2872_HDOD_domain-containing_protein	AF-Q32HJ0-F1-model_v4 Probable diguanylate cyclase DgcQ	0.164	580	440	249	828	33	559	2.146E-14	318
DESULFOASV1_2872_HDOD_domain-containing_protein	AF-P76330-F1-model_v4	DESULFOASV1_2872_HDOD_domain-containing_protein	AF-P76330-F1-model_v4 Probable diguanylate cyclase DgcQ	0.175	584	444	245	828	21	559	1.190E-14	317
DESULFOASV1_2872_HDOD_domain-containing_protein	AF-P96585-F1-model_v4	DESULFOASV1_2872_HDOD_domain-containing_protein	AF-P96585-F1-model_v4 Uncharacterized membrane protein YdaK	0.181	163	129	662	820	120	282	2.261E-06	316
DESULFOASV1_2872_HDOD_domain-containing_protein	AF-Q8XB92-F1-model_v4	DESULFOASV1_2872_HDOD_domain-containing_protein	AF-Q8XB92-F1-model_v4 Probable diguanylate cyclase DgcQ	0.173	584	445	245	828	21	559	8.659E-15	316
DESULFOASV1_2872_HDOD_domain-containing_protein	AF-Q9HWA7-F1-model_v4	DESULFOASV1_2872_HDOD_domain-containing_protein	AF-Q9HWA7-F1-model_v4 Two-component sensor PprA	0.136	506	400	277	782	278	741	6.758E-13	315
DESULFOASV1_2872_HDOD_domain-containing_protein	AF-Q3Z0N3-F1-model_v4	DESULFOASV1_2872_HDOD_domain-containing_protein	AF-Q3Z0N3-F1-model_v4 Probable diguanylate cyclase DgcQ	0.171	580	436	249	828	38	564	1.363E-14	312
DESULFOASV1_2872_HDOD_domain-containing_protein	AF-Q83KM9-F1-model_v4	DESULFOASV1_2872_HDOD_domain-containing_protein	AF-Q83KM9-F1-model_v4 Putative diguanylate cyclase DgcQ	0.172	584	445	245	828	26	564	2.460E-14	309
DESULFOASV1_2872_HDOD_domain-containing_protein	AF-P36892-F1-model_v4	DESULFOASV1_2872_HDOD_domain-containing_protein	AF-P36892-F1-model_v4 Uncharacterized 19.3 kDa protein in repSA 5'region	0.265	162	115	662	823	18	175	1.145E-06	308
DESULFOASV1_2872_HDOD_domain-containing_protein	AF-P23222-F1-model_v4	DESULFOASV1_2872_HDOD_domain-containing_protein	AF-P23222-F1-model_v4 Sensor protein FixL	0.113	356	281	430	785	16	333	5.655E-09	302
DESULFOASV1_2872_HDOD_domain-containing_protein	AF-P16497-F1-model_v4	DESULFOASV1_2872_HDOD_domain-containing_protein	AF-P16497-F1-model_v4 Sporulation kinase A	0.127	418	338	326	743	58	445	7.934E-11	298
DESULFOASV1_2872_HDOD_domain-containing_protein	AF-O34311-F1-model_v4	DESULFOASV1_2872_HDOD_domain-containing_protein	AF-O34311-F1-model_v4 Signaling protein YkoW	0.124	724	462	108	831	8	535	6.302E-15	294
DESULFOASV1_2872_HDOD_domain-containing_protein	AF-O31661-F1-model_v4	DESULFOASV1_2872_HDOD_domain-containing_protein	AF-O31661-F1-model_v4 Sporulation kinase E	0.123	461	374	320	780	85	511	2.637E-12	293
DESULFOASV1_2872_HDOD_domain-containing_protein	AF-P46139-F1-model_v4	DESULFOASV1_2872_HDOD_domain-containing_protein	AF-P46139-F1-model_v4 Diguanylate cyclase DgcN	0.180	528	289	296	823	50	402	2.923E-11	291
DESULFOASV1_2872_HDOD_domain-containing_protein	AF-Q9KU26-F1-model_v4	DESULFOASV1_2872_HDOD_domain-containing_protein	AF-Q9KU26-F1-model_v4 Biofilm architecture maintenance protein MbaA	0.151	419	341	429	831	90	508	1.179E-11	291
DESULFOASV1_2872_HDOD_domain-containing_protein	AF-P56267-F1-model_v4	DESULFOASV1_2872_HDOD_domain-containing_protein	AF-P56267-F1-model_v4 Nitrogen fixation regulatory protein	0.109	329	291	424	751	19	347	5.655E-09	285
DESULFOASV1_2872_HDOD_domain-containing_protein	AF-P54529-F1-model_v4	DESULFOASV1_2872_HDOD_domain-containing_protein	AF-P54529-F1-model_v4 Putative sigma L-dependent transcriptional regulator YqiR	0.167	267	217	409	675	93	354	1.902E-09	274
DESULFOASV1_2872_HDOD_domain-containing_protein	AF-P45365-F1-model_v4	DESULFOASV1_2872_HDOD_domain-containing_protein	AF-P45365-F1-model_v4 Uncharacterized 76.5 kDa protein in phbC 3'region	0.196	175	135	663	831	257	431	1.824E-05	269
DESULFOASV1_2872_HDOD_domain-containing_protein	AF-P30663-F1-model_v4	DESULFOASV1_2872_HDOD_domain-containing_protein	AF-P30663-F1-model_v4 Nitrogen fixation regulatory protein	0.125	400	340	430	819	25	424	1.208E-09	262
DESULFOASV1_2872_HDOD_domain-containing_protein	AF-P06772-F1-model_v4	DESULFOASV1_2872_HDOD_domain-containing_protein	AF-P06772-F1-model_v4 Nitrogen fixation regulatory protein	0.110	365	319	424	788	7	365	5.655E-09	257
DESULFOASV1_2872_HDOD_domain-containing_protein	AF-Q8X6V3-F1-model_v4	DESULFOASV1_2872_HDOD_domain-containing_protein	AF-Q8X6V3-F1-model_v4 Probable diguanylate cyclase DgcI	0.144	388	296	442	829	95	441	3.240E-10	253
DESULFOASV1_2872_HDOD_domain-containing_protein	AF-O83112-F1-model_v4	DESULFOASV1_2872_HDOD_domain-containing_protein	AF-O83112-F1-model_v4 Uncharacterized protein TP_0073	0.170	272	222	10	281	242	510	7.961E-07	252
DESULFOASV1_2872_HDOD_domain-containing_protein	AF-P75801-F1-model_v4	DESULFOASV1_2872_HDOD_domain-containing_protein	AF-P75801-F1-model_v4 Probable diguanylate cyclase DgcI	0.160	385	312	457	829	57	441	7.675E-10	246
DESULFOASV1_2872_HDOD_domain-containing_protein	AF-Q9I3S1-F1-model_v4	DESULFOASV1_2872_HDOD_domain-containing_protein	AF-Q9I3S1-F1-model_v4 Biofilm dispersion protein BdlA	0.129	310	246	434	743	2	284	3.212E-07	244
DESULFOASV1_2872_HDOD_domain-containing_protein	AF-P76245-F1-model_v4	DESULFOASV1_2872_HDOD_domain-containing_protein	AF-P76245-F1-model_v4 Diguanylate cyclase DgcP	0.213	300	207	559	822	28	327	2.803E-07	243
DESULFOASV1_2872_HDOD_domain-containing_protein	AF-Q55434-F1-model_v4	DESULFOASV1_2872_HDOD_domain-containing_protein	AF-Q55434-F1-model_v4 Phytochrome-like protein cph2	0.140	591	453	304	831	7	597	1.077E-11	238
DESULFOASV1_2872_HDOD_domain-containing_protein	AF-O67821-F1-model_v4	DESULFOASV1_2872_HDOD_domain-containing_protein	AF-O67821-F1-model_v4 Uncharacterized protein aq_2027	0.125	156	128	664	810	195	350	4.129E-05	237
DESULFOASV1_2872_HDOD_domain-containing_protein	AF-Q9RQQ9-F1-model_v4	DESULFOASV1_2872_HDOD_domain-containing_protein	AF-Q9RQQ9-F1-model_v4 Sensor protein DivL	0.113	474	355	312	785	191	591	1.323E-09	227
DESULFOASV1_2872_HDOD_domain-containing_protein	AF-P15939-F1-model_v4	DESULFOASV1_2872_HDOD_domain-containing_protein	AF-P15939-F1-model_v4 Nodulation protein V	0.107	637	514	208	784	13	649	4.398E-11	223
DESULFOASV1_2872_HDOD_domain-containing_protein	AF-Q9P7Q7-F1-model_v4	DESULFOASV1_2872_HDOD_domain-containing_protein	AF-Q9P7Q7-F1-model_v4 Peroxide stress-activated histidine kinase mak1	0.158	341	267	431	748	719	1059	1.818E-09	221
DESULFOASV1_2872_HDOD_domain-containing_protein	AF-P42499-F1-model_v4	DESULFOASV1_2872_HDOD_domain-containing_protein	AF-P42499-F1-model_v4 Phytochrome B	0.090	560	430	270	743	412	971	2.735E-09	217
DESULFOASV1_2872_HDOD_domain-containing_protein	AF-P33530-F1-model_v4	DESULFOASV1_2872_HDOD_domain-containing_protein	AF-P33530-F1-model_v4 Phytochrome A1	0.089	561	431	270	743	382	942	1.055E-09	216
DESULFOASV1_2872_HDOD_domain-containing_protein	AF-P0DOA0-F1-model_v4	DESULFOASV1_2872_HDOD_domain-containing_protein	AF-P0DOA0-F1-model_v4 Sensor kinase CckA	0.105	486	374	362	780	79	564	7.095E-09	215
DESULFOASV1_2872_HDOD_domain-containing_protein	AF-P14714-F1-model_v4	DESULFOASV1_2872_HDOD_domain-containing_protein	AF-P14714-F1-model_v4 Phytochrome C	0.094	557	429	270	743	374	930	3.758E-09	215
DESULFOASV1_2872_HDOD_domain-containing_protein	AF-P34094-F1-model_v4	DESULFOASV1_2872_HDOD_domain-containing_protein	AF-P34094-F1-model_v4 Phytochrome B	0.083	558	434	270	743	387	944	8.130E-09	210
DESULFOASV1_2872_HDOD_domain-containing_protein	AF-Q9P896-F1-model_v4	DESULFOASV1_2872_HDOD_domain-containing_protein	AF-Q9P896-F1-model_v4 Two-component system protein A	0.135	311	266	433	740	46	356	1.606E-08	209
DESULFOASV1_2872_HDOD_domain-containing_protein	AF-P42497-F1-model_v4	DESULFOASV1_2872_HDOD_domain-containing_protein	AF-P42497-F1-model_v4 Phytochrome D	0.089	572	434	270	746	418	989	5.655E-09	206
DESULFOASV1_2872_HDOD_domain-containing_protein	AF-Q41046-F1-model_v4	DESULFOASV1_2872_HDOD_domain-containing_protein	AF-Q41046-F1-model_v4 Phytochrome	0.114	561	418	270	742	387	947	1.117E-08	201
DESULFOASV1_2872_HDOD_domain-containing_protein	AF-P93528-F1-model_v4	DESULFOASV1_2872_HDOD_domain-containing_protein	AF-P93528-F1-model_v4 Phytochrome C	0.092	567	429	270	742	380	946	2.207E-08	201
DESULFOASV1_2872_HDOD_domain-containing_protein	AF-A0A0H3GCG4-F1-model_v4	DESULFOASV1_2872_HDOD_domain-containing_protein	AF-A0A0H3GCG4-F1-model_v4 Cyclic-di-AMP phosphodiesterase PdeA	0.153	287	206	543	829	57	300	5.291E-07	200
DESULFOASV1_2872_HDOD_domain-containing_protein	AF-P55141-F1-model_v4	DESULFOASV1_2872_HDOD_domain-containing_protein	AF-P55141-F1-model_v4 Phytochrome A	0.093	571	428	270	742	380	950	7.425E-09	199
DESULFOASV1_2872_HDOD_domain-containing_protein	AF-P93526-F1-model_v4	DESULFOASV1_2872_HDOD_domain-containing_protein	AF-P93526-F1-model_v4 Phytochrome a	0.093	561	429	270	743	385	945	3.981E-08	199
DESULFOASV1_2872_HDOD_domain-containing_protein	AF-P23842-F1-model_v4	DESULFOASV1_2872_HDOD_domain-containing_protein	AF-P23842-F1-model_v4 Probable cyclic di-GMP phosphodiesterase PdeA	0.186	170	131	662	831	314	475	1.611E-04	197
DESULFOASV1_2872_HDOD_domain-containing_protein	AF-Q6YRK2-F1-model_v4	DESULFOASV1_2872_HDOD_domain-containing_protein	AF-Q6YRK2-F1-model_v4 50S ribosomal protein L9	0.144	285	205	545	829	100	339	6.063E-07	196
DESULFOASV1_2872_HDOD_domain-containing_protein	AF-P26167-F1-model_v4	DESULFOASV1_2872_HDOD_domain-containing_protein	AF-P26167-F1-model_v4 Protein CrtJ	0.119	409	328	325	733	74	446	8.130E-09	194
DESULFOASV1_2872_HDOD_domain-containing_protein	AF-A9M715-F1-model_v4	DESULFOASV1_2872_HDOD_domain-containing_protein	AF-A9M715-F1-model_v4 Cell-division control histidine kinase PdhS	0.169	310	256	435	743	542	851	1.033E-07	192
DESULFOASV1_2872_HDOD_domain-containing_protein	AF-P33529-F1-model_v4	DESULFOASV1_2872_HDOD_domain-containing_protein	AF-P33529-F1-model_v4 Phytochrome	0.102	560	427	270	746	380	939	2.207E-08	192
DESULFOASV1_2872_HDOD_domain-containing_protein	AF-A6X554-F1-model_v4	DESULFOASV1_2872_HDOD_domain-containing_protein	AF-A6X554-F1-model_v4 Blue-light-activated histidine kinase	0.124	308	268	434	741	25	331	2.234E-07	191
DESULFOASV1_2872_HDOD_domain-containing_protein	AF-Q2YRB4-F1-model_v4	DESULFOASV1_2872_HDOD_domain-containing_protein	AF-Q2YRB4-F1-model_v4 Cell-division control histidine kinase PdhS	0.142	352	269	433	784	540	854	4.995E-08	191
DESULFOASV1_2872_HDOD_domain-containing_protein	AF-A5VRX4-F1-model_v4	DESULFOASV1_2872_HDOD_domain-containing_protein	AF-A5VRX4-F1-model_v4 Cell-division control histidine kinase PdhS	0.166	311	258	434	743	541	851	9.868E-08	191
DESULFOASV1_2872_HDOD_domain-containing_protein	AF-P37894-F1-model_v4	DESULFOASV1_2872_HDOD_domain-containing_protein	AF-P37894-F1-model_v4 Non-motile and phage-resistance protein	0.116	390	332	354	743	239	615	2.446E-07	190
DESULFOASV1_2872_HDOD_domain-containing_protein	AF-Q8YIM6-F1-model_v4	DESULFOASV1_2872_HDOD_domain-containing_protein	AF-Q8YIM6-F1-model_v4 Cell-division control histidine kinase PdhS	0.162	326	260	435	745	542	867	7.516E-08	189
DESULFOASV1_2872_HDOD_domain-containing_protein	AF-Q57BR6-F1-model_v4	DESULFOASV1_2872_HDOD_domain-containing_protein	AF-Q57BR6-F1-model_v4 Cell-division control histidine kinase PdhS	0.165	312	259	433	743	540	851	1.238E-07	189
DESULFOASV1_2872_HDOD_domain-containing_protein	AF-A2XLG5-F1-model_v4	DESULFOASV1_2872_HDOD_domain-containing_protein	AF-A2XLG5-F1-model_v4 Phytochrome A	0.096	561	428	270	743	385	945	5.470E-08	189
DESULFOASV1_2872_HDOD_domain-containing_protein	AF-Q2NKC0-F1-model_v4	DESULFOASV1_2872_HDOD_domain-containing_protein	AF-Q2NKC0-F1-model_v4 50S ribosomal protein L9	0.146	286	205	545	830	100	340	1.436E-06	187
DESULFOASV1_2872_HDOD_domain-containing_protein	AF-Q8FZ86-F1-model_v4	DESULFOASV1_2872_HDOD_domain-containing_protein	AF-Q8FZ86-F1-model_v4 Cell-division control histidine kinase PdhS	0.145	351	268	434	784	541	854	7.864E-08	187
DESULFOASV1_2872_HDOD_domain-containing_protein	AF-P06594-F1-model_v4	DESULFOASV1_2872_HDOD_domain-containing_protein	AF-P06594-F1-model_v4 Phytochrome A type 4	0.101	568	425	270	743	383	950	1.280E-08	187
DESULFOASV1_2872_HDOD_domain-containing_protein	AF-P14713-F1-model_v4	DESULFOASV1_2872_HDOD_domain-containing_protein	AF-P14713-F1-model_v4 Phytochrome B	0.097	572	429	270	745	413	984	4.359E-08	187
DESULFOASV1_2872_HDOD_domain-containing_protein	AF-Q10CQ8-F1-model_v4	DESULFOASV1_2872_HDOD_domain-containing_protein	AF-Q10CQ8-F1-model_v4 Phytochrome C	0.086	568	431	270	742	381	948	2.529E-08	186
DESULFOASV1_2872_HDOD_domain-containing_protein	AF-B2S758-F1-model_v4	DESULFOASV1_2872_HDOD_domain-containing_protein	AF-B2S758-F1-model_v4 Cell-division control histidine kinase PdhS	0.155	316	263	432	743	539	854	2.040E-07	185
DESULFOASV1_2872_HDOD_domain-containing_protein	AF-P93527-F1-model_v4	DESULFOASV1_2872_HDOD_domain-containing_protein	AF-P93527-F1-model_v4 Phytochrome B	0.099	562	426	270	743	430	991	3.320E-08	182
DESULFOASV1_2872_HDOD_domain-containing_protein	AF-Q54VU4-F1-model_v4	DESULFOASV1_2872_HDOD_domain-containing_protein	AF-Q54VU4-F1-model_v4 Probable serine/threonine-protein kinase DDB_G0280133	0.085	220	191	439	658	13	222	1.886E-06	182
DESULFOASV1_2872_HDOD_domain-containing_protein	AF-A2XM23-F1-model_v4	DESULFOASV1_2872_HDOD_domain-containing_protein	AF-A2XM23-F1-model_v4 Phytochrome C	0.090	568	430	270	742	381	948	3.173E-08	179
DESULFOASV1_2872_HDOD_domain-containing_protein	AF-B2SB67-F1-model_v4	DESULFOASV1_2872_HDOD_domain-containing_protein	AF-B2SB67-F1-model_v4 Blue-light-activated histidine kinase	0.143	308	261	434	741	25	330	3.851E-07	177
DESULFOASV1_2872_HDOD_domain-containing_protein	AF-A5VUS1-F1-model_v4	DESULFOASV1_2872_HDOD_domain-containing_protein	AF-A5VUS1-F1-model_v4 Blue-light-activated histidine kinase	0.143	308	261	434	741	25	330	3.361E-07	177
