query	target	qheader	theader	fident	alnlen	mismatch	qstart	qend	tstart	tend	evalue	bits
DESULFOASV1_1780_hypothetical_protein	AF-B4NKI9-F1-model_v4	DESULFOASV1_1780_hypothetical_protein	AF-B4NKI9-F1-model_v4 Histone-arginine methyltransferase CARMER	0.107	63	54	107	167	448	510	5.533E+00	26
DESULFOASV1_1780_hypothetical_protein	AF-P26844-F1-model_v4	DESULFOASV1_1780_hypothetical_protein	AF-P26844-F1-model_v4 Signal peptidase I	0.111	45	37	93	135	171	215	6.293E+00	25
DESULFOASV1_1780_hypothetical_protein	AF-Q86YD3-F1-model_v4	DESULFOASV1_1780_hypothetical_protein	AF-Q86YD3-F1-model_v4 Transmembrane protein 25	0.190	61	41	107	167	207	257	7.158E+00	25
DESULFOASV1_1780_hypothetical_protein	AF-Q6XJV6-F1-model_v4	DESULFOASV1_1780_hypothetical_protein	AF-Q6XJV6-F1-model_v4 Cell surface glycoprotein CD200 receptor 2	0.149	87	54	106	169	163	249	2.107E+00	24
DESULFOASV1_1780_hypothetical_protein	AF-Q9EP73-F1-model_v4	DESULFOASV1_1780_hypothetical_protein	AF-Q9EP73-F1-model_v4 Programmed cell death 1 ligand 1	0.168	99	63	90	166	159	257	2.247E+00	24
DESULFOASV1_1780_hypothetical_protein	AF-Q7TST0-F1-model_v4	DESULFOASV1_1780_hypothetical_protein	AF-Q7TST0-F1-model_v4 Butyrophilin-like protein 1	0.163	98	74	78	167	171	268	1.852E+00	24
DESULFOASV1_1780_hypothetical_protein	AF-Q13018-F1-model_v4	DESULFOASV1_1780_hypothetical_protein	AF-Q13018-F1-model_v4 Secretory phospholipase A2 receptor	0.179	96	74	71	166	1330	1420	2.556E+00	24
DESULFOASV1_1780_hypothetical_protein	AF-Q8GXV7-F1-model_v4	DESULFOASV1_1780_hypothetical_protein	AF-Q8GXV7-F1-model_v4 Plasmodesmata-located protein 1	0.123	67	55	105	168	229	295	8.141E+00	23
DESULFOASV1_1780_hypothetical_protein	AF-B4KA23-F1-model_v4	DESULFOASV1_1780_hypothetical_protein	AF-B4KA23-F1-model_v4 Histone-arginine methyltransferase CARMER	0.107	63	54	107	167	454	516	9.875E+00	23
DESULFOASV1_1780_hypothetical_protein	AF-B4JXV2-F1-model_v4	DESULFOASV1_1780_hypothetical_protein	AF-B4JXV2-F1-model_v4 Histone-arginine methyltransferase CARMER	0.151	64	51	107	167	455	518	7.634E+00	23
DESULFOASV1_1780_hypothetical_protein	AF-A3DC27-F1-model_v4	DESULFOASV1_1780_hypothetical_protein	AF-A3DC27-F1-model_v4 Anti-sigma-I factor RsgI2	0.084	71	57	104	166	12	82	6.711E+00	23
DESULFOASV1_1780_hypothetical_protein	AF-Q3T191-F1-model_v4	DESULFOASV1_1780_hypothetical_protein	AF-Q3T191-F1-model_v4 Cell death activator CIDE-B	0.160	95	74	73	167	109	197	3.526E+00	22
DESULFOASV1_1780_hypothetical_protein	AF-Q6UXE8-F1-model_v4	DESULFOASV1_1780_hypothetical_protein	AF-Q6UXE8-F1-model_v4 Butyrophilin-like protein 3	0.150	90	61	94	166	165	254	5.188E+00	22
DESULFOASV1_1780_hypothetical_protein	AF-B4HJC0-F1-model_v4	DESULFOASV1_1780_hypothetical_protein	AF-B4HJC0-F1-model_v4 Histone-arginine methyltransferase CARMER	0.109	62	53	107	166	446	507	9.875E+00	22
DESULFOASV1_1780_hypothetical_protein	AF-Q5R880-F1-model_v4	DESULFOASV1_1780_hypothetical_protein	AF-Q5R880-F1-model_v4 Secretory phospholipase A2 receptor	0.140	96	77	71	166	1332	1421	1.628E+00	22
DESULFOASV1_1780_hypothetical_protein	AF-Q6UW56-F1-model_v4	DESULFOASV1_1780_hypothetical_protein	AF-Q6UW56-F1-model_v4 All-trans retinoic acid-induced differentiation factor	0.168	95	67	75	169	149	229	5.901E+00	21
DESULFOASV1_1780_hypothetical_protein	AF-O14103-F1-model_v4	DESULFOASV1_1780_hypothetical_protein	AF-O14103-F1-model_v4 Protein rot1	0.120	74	52	107	166	157	230	5.901E+00	21
DESULFOASV1_1780_hypothetical_protein	AF-P70387-F1-model_v4	DESULFOASV1_1780_hypothetical_protein	AF-P70387-F1-model_v4 Hereditary hemochromatosis protein homolog	0.139	93	64	94	168	249	341	7.158E+00	21
DESULFOASV1_1780_hypothetical_protein	AF-Q6NRB9-F1-model_v4	DESULFOASV1_1780_hypothetical_protein	AF-Q6NRB9-F1-model_v4 ER membrane protein complex subunit 1	0.122	99	83	70	168	886	980	4.561E+00	21
DESULFOASV1_1780_hypothetical_protein	AF-P25942-F1-model_v4	DESULFOASV1_1780_hypothetical_protein	AF-P25942-F1-model_v4 Tumor necrosis factor receptor superfamily member 5	0.136	72	52	109	169	150	221	9.875E+00	20
DESULFOASV1_1780_hypothetical_protein	AF-O60149-F1-model_v4	DESULFOASV1_1780_hypothetical_protein	AF-O60149-F1-model_v4 Vacuolar protein sorting-associated protein 38	0.097	89	69	90	166	126	214	5.533E+00	20
DESULFOASV1_1780_hypothetical_protein	AF-P13675-F1-model_v4	DESULFOASV1_1780_hypothetical_protein	AF-P13675-F1-model_v4 Y-linked testis-specific protein 1	0.071	42	28	100	141	199	229	9.260E+00	19
DESULFOASV1_1780_hypothetical_protein	AF-Q05BQ1-F1-model_v4	DESULFOASV1_1780_hypothetical_protein	AF-Q05BQ1-F1-model_v4 Protein turtle homolog A	0.276	76	45	107	169	693	768	6.711E+00	19
DESULFOASV1_1780_hypothetical_protein	AF-P49260-F1-model_v4	DESULFOASV1_1780_hypothetical_protein	AF-P49260-F1-model_v4 Secretory phospholipase A2 receptor	0.183	96	74	71	166	1326	1416	3.306E+00	19
DESULFOASV1_1780_hypothetical_protein	AF-Q9UBG0-F1-model_v4	DESULFOASV1_1780_hypothetical_protein	AF-Q9UBG0-F1-model_v4 C-type mannose receptor 2	0.176	124	91	54	165	1315	1438	2.107E+00	18
DESULFOASV1_1780_hypothetical_protein	AF-Q9UJQ7-F1-model_v4	DESULFOASV1_1780_hypothetical_protein	AF-Q9UJQ7-F1-model_v4 SCP2 sterol-binding domain-containing protein 1	0.161	31	25	92	122	67	97	7.158E+00	17
DESULFOASV1_1780_hypothetical_protein	AF-Q2TBS3-F1-model_v4	DESULFOASV1_1780_hypothetical_protein	AF-Q2TBS3-F1-model_v4 SCP2 sterol-binding domain-containing protein 1	0.161	31	25	92	122	67	97	6.711E+00	17
DESULFOASV1_1780_hypothetical_protein	AF-Q86XK7-F1-model_v4	DESULFOASV1_1780_hypothetical_protein	AF-Q86XK7-F1-model_v4 V-set and immunoglobulin domain-containing protein 1	0.180	91	66	87	167	162	252	8.141E+00	17
DESULFOASV1_1780_hypothetical_protein	AF-Q54L22-F1-model_v4	DESULFOASV1_1780_hypothetical_protein	AF-Q54L22-F1-model_v4 Putative uncharacterized protein DDB_G0286949	0.145	53	43	73	123	40	92	8.682E+00	16
DESULFOASV1_1780_hypothetical_protein	AF-Q6PGD0-F1-model_v4	DESULFOASV1_1780_hypothetical_protein	AF-Q6PGD0-F1-model_v4 All-trans retinoic acid-induced differentiation factor	0.159	94	66	75	168	143	221	7.634E+00	16
DESULFOASV1_1780_hypothetical_protein	AF-Q9BPZ2-F1-model_v4	DESULFOASV1_1780_hypothetical_protein	AF-Q9BPZ2-F1-model_v4 Spindlin-2B	0.078	64	44	73	121	189	252	8.682E+00	16
DESULFOASV1_1780_hypothetical_protein	AF-Q6NVE3-F1-model_v4	DESULFOASV1_1780_hypothetical_protein	AF-Q6NVE3-F1-model_v4 Spindlin-2C	0.078	64	44	73	121	187	250	9.875E+00	15
DESULFOASV1_1780_hypothetical_protein	AF-Q2IAL6-F1-model_v4	DESULFOASV1_1780_hypothetical_protein	AF-Q2IAL6-F1-model_v4 Cathelicidin-3	0.169	146	118	24	169	9	151	7.158E+00	14
DESULFOASV1_1780_hypothetical_protein	AF-P82137-F1-model_v4	DESULFOASV1_1780_hypothetical_protein	AF-P82137-F1-model_v4 30S ribosomal protein S17, chloroplastic	0.077	101	67	73	146	41	141	6.711E+00	14
DESULFOASV1_1780_hypothetical_protein	AF-Q8LEA8-F1-model_v4	DESULFOASV1_1780_hypothetical_protein	AF-Q8LEA8-F1-model_v4 Phytochrome A-associated F-box protein	0.151	75	59	48	122	260	329	7.158E+00	14
DESULFOASV1_1780_hypothetical_protein	AF-P34510-F1-model_v4	DESULFOASV1_1780_hypothetical_protein	AF-P34510-F1-model_v4 Uncharacterized protein K06H7.2	0.155	43	34	96	136	353	395	8.682E+00	14
DESULFOASV1_1780_hypothetical_protein	AF-P49539-F1-model_v4	DESULFOASV1_1780_hypothetical_protein	AF-P49539-F1-model_v4 Cytochrome c biogenesis protein Ccs1	0.111	63	44	87	137	289	351	8.682E+00	13
