query	target	qheader	theader	fident	alnlen	mismatch	qstart	qend	tstart	tend	evalue	bits
DESULFOASV1_2431_hypothetical_protein	AF-P36677-F1-model_v4	DESULFOASV1_2431_hypothetical_protein	AF-P36677-F1-model_v4 Uncharacterized protein YhdN	0.403	118	70	15	132	4	121	5.426E-06	179
DESULFOASV1_2431_hypothetical_protein	AF-O34887-F1-model_v4	DESULFOASV1_2431_hypothetical_protein	AF-O34887-F1-model_v4 Uncharacterized protein YflB	0.284	130	87	16	145	5	127	3.311E-05	135
DESULFOASV1_2431_hypothetical_protein	AF-Q9NX36-F1-model_v4	DESULFOASV1_2431_hypothetical_protein	AF-Q9NX36-F1-model_v4 DnaJ homolog subfamily C member 28	0.189	193	129	6	165	191	383	2.966E-02	59
DESULFOASV1_2431_hypothetical_protein	AF-Q8VCE1-F1-model_v4	DESULFOASV1_2431_hypothetical_protein	AF-Q8VCE1-F1-model_v4 DnaJ homolog subfamily C member 28	0.216	193	131	6	173	191	383	3.577E-02	57
DESULFOASV1_2431_hypothetical_protein	AF-Q9EXD3-F1-model_v4	DESULFOASV1_2431_hypothetical_protein	AF-Q9EXD3-F1-model_v4 Uncharacterized protein MPN_377	0.222	72	54	40	111	5	74	2.996E+00	50
DESULFOASV1_2431_hypothetical_protein	AF-P93319-F1-model_v4	DESULFOASV1_2431_hypothetical_protein	AF-P93319-F1-model_v4 Uncharacterized mitochondrial protein AtMg00670	0.135	93	74	38	130	188	273	1.606E+00	42
DESULFOASV1_2431_hypothetical_protein	AF-Q08465-F1-model_v4	DESULFOASV1_2431_hypothetical_protein	AF-Q08465-F1-model_v4 Protein YNG1	0.178	112	76	49	160	8	101	1.819E+00	40
DESULFOASV1_2431_hypothetical_protein	AF-Q9UK53-F1-model_v4	DESULFOASV1_2431_hypothetical_protein	AF-Q9UK53-F1-model_v4 Inhibitor of growth protein 1	0.109	110	87	53	162	170	268	2.815E+00	39
DESULFOASV1_2431_hypothetical_protein	AF-Q9ESK4-F1-model_v4	DESULFOASV1_2431_hypothetical_protein	AF-Q9ESK4-F1-model_v4 Inhibitor of growth protein 2	0.164	158	117	5	162	3	143	1.709E+00	37
DESULFOASV1_2431_hypothetical_protein	AF-O07949-F1-model_v4	DESULFOASV1_2431_hypothetical_protein	AF-O07949-F1-model_v4 Spore coat protein F-like protein YraF	0.113	97	78	44	132	1	97	4.636E+00	35
DESULFOASV1_2431_hypothetical_protein	AF-P92511-F1-model_v4	DESULFOASV1_2431_hypothetical_protein	AF-P92511-F1-model_v4 Uncharacterized ribosomal S3-like protein AtMg00690, mitochondrial	0.111	100	87	39	138	140	238	4.092E+00	34
DESULFOASV1_2431_hypothetical_protein	AF-Q9P6P2-F1-model_v4	DESULFOASV1_2431_hypothetical_protein	AF-Q9P6P2-F1-model_v4 rRNA biogenesis protein rrp36	0.166	203	148	1	178	43	245	1.332E+00	34
DESULFOASV1_2431_hypothetical_protein	AF-Q9H160-F1-model_v4	DESULFOASV1_2431_hypothetical_protein	AF-Q9H160-F1-model_v4 Inhibitor of growth protein 2	0.157	159	119	4	162	1	142	2.815E+00	33
DESULFOASV1_2431_hypothetical_protein	AF-P92550-F1-model_v4	DESULFOASV1_2431_hypothetical_protein	AF-P92550-F1-model_v4 Uncharacterized mitochondrial protein AtMg01200	0.120	141	121	39	179	157	294	2.485E+00	33
DESULFOASV1_2431_hypothetical_protein	AF-P0C962-F1-model_v4	DESULFOASV1_2431_hypothetical_protein	AF-P0C962-F1-model_v4 Protein PerC	0.204	85	63	59	143	9	88	5.590E+00	32
DESULFOASV1_2431_hypothetical_protein	AF-A7X624-F1-model_v4	DESULFOASV1_2431_hypothetical_protein	AF-A7X624-F1-model_v4 Oxygen sensor histidine kinase NreB	0.126	134	80	5	138	124	215	4.092E+00	32
DESULFOASV1_2431_hypothetical_protein	AF-B4G7U3-F1-model_v4	DESULFOASV1_2431_hypothetical_protein	AF-B4G7U3-F1-model_v4 Zinc finger CCCH-type with G patch domain-containing protein	0.118	135	111	6	132	372	506	3.613E+00	31
DESULFOASV1_2431_hypothetical_protein	AF-P37285-F1-model_v4	DESULFOASV1_2431_hypothetical_protein	AF-P37285-F1-model_v4 Kinesin light chain 1	0.130	141	121	39	178	8	148	4.356E+00	31
DESULFOASV1_2431_hypothetical_protein	AF-Q5A287-F1-model_v4	DESULFOASV1_2431_hypothetical_protein	AF-Q5A287-F1-model_v4 Transcription factor SFL1	0.120	120	87	1	120	341	440	7.635E+00	31
DESULFOASV1_2431_hypothetical_protein	AF-O67453-F1-model_v4	DESULFOASV1_2431_hypothetical_protein	AF-O67453-F1-model_v4 Uncharacterized protein aq_1476	0.200	133	103	6	138	5	134	5.950E+00	30
DESULFOASV1_2431_hypothetical_protein	AF-A1TAQ3-F1-model_v4	DESULFOASV1_2431_hypothetical_protein	AF-A1TAQ3-F1-model_v4 Proteasome-associated ATPase	0.128	106	85	39	144	4	101	6.740E+00	30
DESULFOASV1_2431_hypothetical_protein	AF-Q9SCJ4-F1-model_v4	DESULFOASV1_2431_hypothetical_protein	AF-Q9SCJ4-F1-model_v4 Kinesin-like protein KIN-8B	0.103	182	159	1	178	356	537	2.193E+00	30
DESULFOASV1_2431_hypothetical_protein	AF-B3NKZ6-F1-model_v4	DESULFOASV1_2431_hypothetical_protein	AF-B3NKZ6-F1-model_v4 Protein Turandot E	0.170	116	91	35	150	7	117	5.590E+00	29
DESULFOASV1_2431_hypothetical_protein	AF-Q54XT8-F1-model_v4	DESULFOASV1_2431_hypothetical_protein	AF-Q54XT8-F1-model_v4 Ribosomal RNA processing protein 36 homolog	0.115	199	157	1	178	81	279	3.613E+00	29
DESULFOASV1_2431_hypothetical_protein	AF-Q931F6-F1-model_v4	DESULFOASV1_2431_hypothetical_protein	AF-Q931F6-F1-model_v4 Oxygen sensor histidine kinase NreB	0.112	133	80	6	138	125	215	5.590E+00	29
DESULFOASV1_2431_hypothetical_protein	AF-F6ZQ54-F1-model_v4	DESULFOASV1_2431_hypothetical_protein	AF-F6ZQ54-F1-model_v4 Tripartite motif containing 13	0.114	232	156	2	178	151	382	2.645E+00	29
DESULFOASV1_2431_hypothetical_protein	AF-B5B3U4-F1-model_v4	DESULFOASV1_2431_hypothetical_protein	AF-B5B3U4-F1-model_v4 Interferon gamma 1	0.157	136	108	43	178	43	171	5.252E+00	28
DESULFOASV1_2431_hypothetical_protein	AF-Q7A028-F1-model_v4	DESULFOASV1_2431_hypothetical_protein	AF-Q7A028-F1-model_v4 Oxygen sensor histidine kinase NreB	0.126	134	80	5	138	124	215	7.174E+00	28
DESULFOASV1_2431_hypothetical_protein	AF-Q2MJV9-F1-model_v4	DESULFOASV1_2431_hypothetical_protein	AF-Q2MJV9-F1-model_v4 Palmdelphin	0.147	110	91	53	162	26	133	9.206E+00	28
DESULFOASV1_2431_hypothetical_protein	AF-Q29NF3-F1-model_v4	DESULFOASV1_2431_hypothetical_protein	AF-Q29NF3-F1-model_v4 Zinc finger CCCH-type with G patch domain-containing protein	0.130	143	114	1	132	364	506	5.590E+00	27
DESULFOASV1_2431_hypothetical_protein	AF-A9ZLL8-F1-model_v4	DESULFOASV1_2431_hypothetical_protein	AF-A9ZLL8-F1-model_v4 Protein lsd90	0.168	148	120	34	178	144	291	2.996E+00	27
DESULFOASV1_2431_hypothetical_protein	AF-O88447-F1-model_v4	DESULFOASV1_2431_hypothetical_protein	AF-O88447-F1-model_v4 Kinesin light chain 1	0.136	141	120	39	178	8	148	8.650E+00	26
DESULFOASV1_2431_hypothetical_protein	AF-Q8NG66-F1-model_v4	DESULFOASV1_2431_hypothetical_protein	AF-Q8NG66-F1-model_v4 Serine/threonine-protein kinase Nek11	0.120	121	94	58	178	279	386	8.127E+00	26
DESULFOASV1_2431_hypothetical_protein	AF-B9F2Y7-F1-model_v4	DESULFOASV1_2431_hypothetical_protein	AF-B9F2Y7-F1-model_v4 Kinesin-like protein KIN-4C	0.193	184	143	1	178	547	730	5.590E+00	26
DESULFOASV1_2431_hypothetical_protein	AF-C0RGW8-F1-model_v4	DESULFOASV1_2431_hypothetical_protein	AF-C0RGW8-F1-model_v4 NAD(+) hydrolase BtpA	0.130	126	91	53	178	10	115	7.635E+00	25
DESULFOASV1_2431_hypothetical_protein	AF-P50542-F1-model_v4	DESULFOASV1_2431_hypothetical_protein	AF-P50542-F1-model_v4 Peroxisomal targeting signal 1 receptor	0.145	192	151	1	178	105	296	2.815E+00	24
DESULFOASV1_2431_hypothetical_protein	AF-P29006-F1-model_v4	DESULFOASV1_2431_hypothetical_protein	AF-P29006-F1-model_v4 Bombinin-like peptides 1	0.157	127	105	14	140	4	129	9.206E+00	23
DESULFOASV1_2431_hypothetical_protein	AF-Q5M7V1-F1-model_v4	DESULFOASV1_2431_hypothetical_protein	AF-Q5M7V1-F1-model_v4 E3 ubiquitin-protein ligase TRIM13	0.109	176	145	5	168	154	329	7.174E+00	23
DESULFOASV1_2431_hypothetical_protein	AF-O09012-F1-model_v4	DESULFOASV1_2431_hypothetical_protein	AF-O09012-F1-model_v4 Peroxisomal targeting signal 1 receptor	0.097	221	160	1	178	80	300	4.092E+00	23
DESULFOASV1_2431_hypothetical_protein	AF-A1U260-F1-model_v4	DESULFOASV1_2431_hypothetical_protein	AF-A1U260-F1-model_v4 Flagellar hook-basal body complex protein FliE	0.127	132	100	1	132	1	116	5.950E+00	22
DESULFOASV1_2431_hypothetical_protein	AF-Q32L60-F1-model_v4	DESULFOASV1_2431_hypothetical_protein	AF-Q32L60-F1-model_v4 E3 ubiquitin-protein ligase TRIM13	0.131	183	149	2	174	151	333	8.650E+00	22
DESULFOASV1_2431_hypothetical_protein	AF-Q1RMV0-F1-model_v4	DESULFOASV1_2431_hypothetical_protein	AF-Q1RMV0-F1-model_v4 Peroxisomal targeting signal 1 receptor	0.148	202	150	1	177	101	302	8.127E+00	22
DESULFOASV1_2431_hypothetical_protein	AF-Q920N5-F1-model_v4	DESULFOASV1_2431_hypothetical_protein	AF-Q920N5-F1-model_v4 Peroxisomal targeting signal 1 receptor	0.115	196	157	1	178	101	296	6.333E+00	22
DESULFOASV1_2431_hypothetical_protein	AF-Q2M2R8-F1-model_v4	DESULFOASV1_2431_hypothetical_protein	AF-Q2M2R8-F1-model_v4 Peroxisomal targeting signal 1 receptor	0.110	197	158	1	178	103	299	5.252E+00	21
DESULFOASV1_2431_hypothetical_protein	AF-Q9SPL5-F1-model_v4	DESULFOASV1_2431_hypothetical_protein	AF-Q9SPL5-F1-model_v4 Vicilin-like antimicrobial peptides 2-1	0.140	181	152	1	178	1	181	8.650E+00	21
DESULFOASV1_2431_hypothetical_protein	AF-Q6AXX4-F1-model_v4	DESULFOASV1_2431_hypothetical_protein	AF-Q6AXX4-F1-model_v4 Something about silencing protein 10	0.135	186	137	3	161	145	330	8.127E+00	18
