query	target	qheader	theader	fident	alnlen	mismatch	qstart	qend	tstart	tend	evalue	bits
DESULFOASV1_3493_hypothetical_protein	AF-Q3U3W5-F1-model_v4	DESULFOASV1_3493_hypothetical_protein	AF-Q3U3W5-F1-model_v4 Protein arginine N-methyltransferase 9	0.171	157	122	1	157	3	150	5.971E-02	92
DESULFOASV1_3493_hypothetical_protein	AF-A8W3C5-F1-model_v4	DESULFOASV1_3493_hypothetical_protein	AF-A8W3C5-F1-model_v4 Photosystem I assembly protein Ycf3	0.137	163	122	10	151	1	163	2.460E-01	91
DESULFOASV1_3493_hypothetical_protein	AF-Q1KVR8-F1-model_v4	DESULFOASV1_3493_hypothetical_protein	AF-Q1KVR8-F1-model_v4 Photosystem I assembly protein Ycf3	0.155	116	83	39	137	31	146	8.334E-01	91
DESULFOASV1_3493_hypothetical_protein	AF-Q5ZIK9-F1-model_v4	DESULFOASV1_3493_hypothetical_protein	AF-Q5ZIK9-F1-model_v4 Coatomer subunit epsilon	0.125	151	125	43	186	146	296	2.583E-01	91
DESULFOASV1_3493_hypothetical_protein	AF-Q9LS48-F1-model_v4	DESULFOASV1_3493_hypothetical_protein	AF-Q9LS48-F1-model_v4 protein SLOW GREEN 1, chloroplastic	0.153	195	147	1	174	95	289	6.913E-02	91
DESULFOASV1_3493_hypothetical_protein	AF-Q86UR1-F1-model_v4	DESULFOASV1_3493_hypothetical_protein	AF-Q86UR1-F1-model_v4 NADPH oxidase activator 1	0.125	141	103	46	164	41	181	2.231E-01	91
DESULFOASV1_3493_hypothetical_protein	AF-P44089-F1-model_v4	DESULFOASV1_3493_hypothetical_protein	AF-P44089-F1-model_v4 Surface lipoprotein assembly modifier 2	0.240	75	54	49	120	114	188	1.013E+00	91
DESULFOASV1_3493_hypothetical_protein	AF-F4HU55-F1-model_v4	DESULFOASV1_3493_hypothetical_protein	AF-F4HU55-F1-model_v4 Serine/threonine-protein kinase BSK4	0.095	147	100	39	185	371	482	3.296E-01	91
DESULFOASV1_3493_hypothetical_protein	AF-Q54IP0-F1-model_v4	DESULFOASV1_3493_hypothetical_protein	AF-Q54IP0-F1-model_v4 DnaJ homolog subfamily C member 7 homolog	0.117	179	117	43	176	235	413	1.304E-01	91
DESULFOASV1_3493_hypothetical_protein	AF-A8JA42-F1-model_v4	DESULFOASV1_3493_hypothetical_protein	AF-A8JA42-F1-model_v4 Intraflagellar transport protein 56	0.135	148	113	43	174	323	470	6.913E-02	91
DESULFOASV1_3493_hypothetical_protein	AF-Q29L58-F1-model_v4	DESULFOASV1_3493_hypothetical_protein	AF-Q29L58-F1-model_v4 Tetratricopeptide repeat protein 30 homolog	0.136	126	104	46	171	418	538	2.231E-01	91
DESULFOASV1_3493_hypothetical_protein	AF-A0QQK3-F1-model_v4	DESULFOASV1_3493_hypothetical_protein	AF-A0QQK3-F1-model_v4 Serine/threonine-protein kinase PknG	0.104	115	101	46	160	549	662	8.751E-01	91
DESULFOASV1_3493_hypothetical_protein	AF-O82861-F1-model_v4	DESULFOASV1_3493_hypothetical_protein	AF-O82861-F1-model_v4 Cellulose synthase operon protein C	0.139	132	111	46	175	374	505	2.712E-01	91
DESULFOASV1_3493_hypothetical_protein	AF-O88196-F1-model_v4	DESULFOASV1_3493_hypothetical_protein	AF-O88196-F1-model_v4 E3 ubiquitin-protein ligase TTC3	0.145	137	100	45	162	226	362	2.231E-01	91
DESULFOASV1_3493_hypothetical_protein	AF-A4QM74-F1-model_v4	DESULFOASV1_3493_hypothetical_protein	AF-A4QM74-F1-model_v4 Photosystem I assembly protein Ycf3	0.163	116	93	43	154	35	150	2.712E-01	90
DESULFOASV1_3493_hypothetical_protein	AF-P0C160-F1-model_v4	DESULFOASV1_3493_hypothetical_protein	AF-P0C160-F1-model_v4 Photosystem I assembly protein Ycf3	0.133	146	116	3	137	1	146	2.583E-01	90
DESULFOASV1_3493_hypothetical_protein	AF-B8HU23-F1-model_v4	DESULFOASV1_3493_hypothetical_protein	AF-B8HU23-F1-model_v4 Photosystem I assembly protein Ycf3	0.158	120	97	39	154	31	150	2.990E-01	90
DESULFOASV1_3493_hypothetical_protein	AF-Q8X5S3-F1-model_v4	DESULFOASV1_3493_hypothetical_protein	AF-Q8X5S3-F1-model_v4 Formate-dependent nitrite reductase complex subunit NrfG	0.130	197	152	5	180	1	197	4.912E-02	90
DESULFOASV1_3493_hypothetical_protein	AF-Q9K0B1-F1-model_v4	DESULFOASV1_3493_hypothetical_protein	AF-Q9K0B1-F1-model_v4 Outer membrane protein assembly factor BamD	0.130	142	114	43	174	35	176	1.369E-01	90
DESULFOASV1_3493_hypothetical_protein	AF-Q6INS3-F1-model_v4	DESULFOASV1_3493_hypothetical_protein	AF-Q6INS3-F1-model_v4 ER membrane protein complex subunit 2-A	0.115	154	127	44	187	122	275	1.927E-01	90
DESULFOASV1_3493_hypothetical_protein	AF-Q95MN7-F1-model_v4	DESULFOASV1_3493_hypothetical_protein	AF-Q95MN7-F1-model_v4 Aryl-hydrocarbon-interacting protein-like 1	0.150	156	125	39	186	174	329	2.712E-01	90
DESULFOASV1_3493_hypothetical_protein	AF-B4F6I5-F1-model_v4	DESULFOASV1_3493_hypothetical_protein	AF-B4F6I5-F1-model_v4 Protein adenylyltransferase FICD	0.169	118	86	43	160	94	198	1.748E-01	90
DESULFOASV1_3493_hypothetical_protein	AF-Q8C0Q3-F1-model_v4	DESULFOASV1_3493_hypothetical_protein	AF-Q8C0Q3-F1-model_v4 Tetratricopeptide repeat protein 34	0.163	176	121	43	187	378	553	1.835E-01	90
DESULFOASV1_3493_hypothetical_protein	AF-P41889-F1-model_v4	DESULFOASV1_3493_hypothetical_protein	AF-P41889-F1-model_v4 Anaphase-promoting complex subunit cut9	0.159	136	103	46	181	478	600	2.342E-01	90
DESULFOASV1_3493_hypothetical_protein	AF-Q6ZXV5-F1-model_v4	DESULFOASV1_3493_hypothetical_protein	AF-Q6ZXV5-F1-model_v4 Protein O-mannosyl-transferase TMTC3	0.165	157	99	56	174	542	698	7.259E-02	90
DESULFOASV1_3493_hypothetical_protein	AF-Q9S0Y6-F1-model_v4	DESULFOASV1_3493_hypothetical_protein	AF-Q9S0Y6-F1-model_v4 Regulatory protein AfsR	0.176	119	85	50	153	850	968	4.871E-01	90
DESULFOASV1_3493_hypothetical_protein	AF-Q9L7A6-F1-model_v4	DESULFOASV1_3493_hypothetical_protein	AF-Q9L7A6-F1-model_v4 Outer membrane protein assembly factor BamD	0.153	141	94	42	153	32	172	2.460E-01	89
DESULFOASV1_3493_hypothetical_protein	AF-O89079-F1-model_v4	DESULFOASV1_3493_hypothetical_protein	AF-O89079-F1-model_v4 Coatomer subunit epsilon	0.125	151	125	43	186	146	296	2.847E-01	89
DESULFOASV1_3493_hypothetical_protein	AF-Q80UM3-F1-model_v4	DESULFOASV1_3493_hypothetical_protein	AF-Q80UM3-F1-model_v4 N-alpha-acetyltransferase 15, NatA auxiliary subunit	0.157	139	115	42	180	9	146	2.460E-01	89
DESULFOASV1_3493_hypothetical_protein	AF-Q6QI44-F1-model_v4	DESULFOASV1_3493_hypothetical_protein	AF-Q6QI44-F1-model_v4 N-alpha-acetyltransferase 25, NatB auxiliary subunit	0.194	132	106	44	175	12	143	1.304E-01	89
DESULFOASV1_3493_hypothetical_protein	AF-P45252-F1-model_v4	DESULFOASV1_3493_hypothetical_protein	AF-P45252-F1-model_v4 UPF0162 protein HI_1558	0.187	80	64	50	129	182	261	7.559E-01	88
DESULFOASV1_3493_hypothetical_protein	AF-Q9JVB7-F1-model_v4	DESULFOASV1_3493_hypothetical_protein	AF-Q9JVB7-F1-model_v4 Outer membrane protein assembly factor BamD	0.112	142	116	43	174	35	176	1.438E-01	88
DESULFOASV1_3493_hypothetical_protein	AF-Q60445-F1-model_v4	DESULFOASV1_3493_hypothetical_protein	AF-Q60445-F1-model_v4 Coatomer subunit epsilon	0.125	151	125	43	186	146	296	3.139E-01	88
DESULFOASV1_3493_hypothetical_protein	AF-Q8ZCC3-F1-model_v4	DESULFOASV1_3493_hypothetical_protein	AF-Q8ZCC3-F1-model_v4 Beta-barrel assembly-enhancing protease	0.124	169	117	46	179	310	478	1.242E-01	88
DESULFOASV1_3493_hypothetical_protein	AF-G5EG38-F1-model_v4	DESULFOASV1_3493_hypothetical_protein	AF-G5EG38-F1-model_v4 Cell division cycle protein 16 homolog	0.161	147	111	42	174	323	469	1.126E-01	88
DESULFOASV1_3493_hypothetical_protein	AF-O76094-F1-model_v4	DESULFOASV1_3493_hypothetical_protein	AF-O76094-F1-model_v4 Signal recognition particle subunit SRP72	0.143	142	111	46	175	14	155	2.023E-01	88
DESULFOASV1_3493_hypothetical_protein	AF-Q527H0-F1-model_v4	DESULFOASV1_3493_hypothetical_protein	AF-Q527H0-F1-model_v4 Pre-mRNA-splicing factor CLF1	0.153	232	155	1	184	7	238	4.678E-02	88
DESULFOASV1_3493_hypothetical_protein	AF-Q5R4J9-F1-model_v4	DESULFOASV1_3493_hypothetical_protein	AF-Q5R4J9-F1-model_v4 N-alpha-acetyltransferase 15, NatA auxiliary subunit	0.156	135	111	42	174	9	143	2.990E-01	88
DESULFOASV1_3493_hypothetical_protein	AF-A6NKT7-F1-model_v4	DESULFOASV1_3493_hypothetical_protein	AF-A6NKT7-F1-model_v4 RanBP2-like and GRIP domain-containing protein 3	0.147	136	112	42	177	25	156	3.296E-01	88
DESULFOASV1_3493_hypothetical_protein	AF-Q99666-F1-model_v4	DESULFOASV1_3493_hypothetical_protein	AF-Q99666-F1-model_v4 RANBP2-like and GRIP domain-containing protein 5/6	0.146	137	113	41	177	24	156	2.990E-01	88
DESULFOASV1_3493_hypothetical_protein	AF-Q9BVA6-F1-model_v4	DESULFOASV1_3493_hypothetical_protein	AF-Q9BVA6-F1-model_v4 Protein adenylyltransferase FICD	0.163	116	85	43	158	106	208	2.023E-01	87
DESULFOASV1_3493_hypothetical_protein	AF-Q5PPS5-F1-model_v4	DESULFOASV1_3493_hypothetical_protein	AF-Q5PPS5-F1-model_v4 Tetratricopeptide repeat protein 34	0.131	174	125	43	187	388	561	1.927E-01	87
DESULFOASV1_3493_hypothetical_protein	AF-A6H739-F1-model_v4	DESULFOASV1_3493_hypothetical_protein	AF-A6H739-F1-model_v4 Tetratricopeptide repeat protein 30B	0.171	132	103	46	177	14	138	4.871E-01	87
DESULFOASV1_3493_hypothetical_protein	AF-A1A5S1-F1-model_v4	DESULFOASV1_3493_hypothetical_protein	AF-A1A5S1-F1-model_v4 Pre-mRNA-processing factor 6	0.127	110	87	43	152	675	775	6.529E-01	87
DESULFOASV1_3493_hypothetical_protein	AF-O14715-F1-model_v4	DESULFOASV1_3493_hypothetical_protein	AF-O14715-F1-model_v4 RANBP2-like and GRIP domain-containing protein 8	0.146	137	113	41	177	24	156	3.296E-01	87
DESULFOASV1_3493_hypothetical_protein	AF-Q20ET3-F1-model_v4	DESULFOASV1_3493_hypothetical_protein	AF-Q20ET3-F1-model_v4 Photosystem I assembly protein Ycf3	0.164	136	99	39	158	31	166	4.418E-01	86
DESULFOASV1_3493_hypothetical_protein	AF-Q08814-F1-model_v4	DESULFOASV1_3493_hypothetical_protein	AF-Q08814-F1-model_v4 Photosystem I assembly protein Ycf3	0.161	162	130	1	156	1	162	2.847E-01	86
DESULFOASV1_3493_hypothetical_protein	AF-Q6ENH3-F1-model_v4	DESULFOASV1_3493_hypothetical_protein	AF-Q6ENH3-F1-model_v4 Photosystem I assembly protein Ycf3	0.130	163	131	1	151	1	163	3.296E-01	86
DESULFOASV1_3493_hypothetical_protein	AF-Q9KQ28-F1-model_v4	DESULFOASV1_3493_hypothetical_protein	AF-Q9KQ28-F1-model_v4 UPF0162 protein VC_2176	0.125	84	72	74	156	178	261	7.937E-01	86
DESULFOASV1_3493_hypothetical_protein	AF-Q4WIF3-F1-model_v4	DESULFOASV1_3493_hypothetical_protein	AF-Q4WIF3-F1-model_v4 Peptidyl-prolyl cis-trans isomerase D	0.134	164	130	37	187	214	377	3.461E-01	86
DESULFOASV1_3493_hypothetical_protein	AF-Q9EQR6-F1-model_v4	DESULFOASV1_3493_hypothetical_protein	AF-Q9EQR6-F1-model_v4 Fanconi anemia group G protein homolog	0.146	163	121	43	185	458	620	8.824E-02	86
DESULFOASV1_3493_hypothetical_protein	AF-Q96N46-F1-model_v4	DESULFOASV1_3493_hypothetical_protein	AF-Q96N46-F1-model_v4 Tetratricopeptide repeat protein 14	0.205	144	105	43	186	307	439	2.712E-01	86
DESULFOASV1_3493_hypothetical_protein	AF-P51258-F1-model_v4	DESULFOASV1_3493_hypothetical_protein	AF-P51258-F1-model_v4 Photosystem I assembly protein Ycf3	0.142	120	99	39	154	31	150	4.208E-01	85
DESULFOASV1_3493_hypothetical_protein	AF-O51880-F1-model_v4	DESULFOASV1_3493_hypothetical_protein	AF-O51880-F1-model_v4 Ancillary SecYEG translocon subunit	0.098	194	141	2	158	1	194	2.847E-01	85
DESULFOASV1_3493_hypothetical_protein	AF-P52223-F1-model_v4	DESULFOASV1_3493_hypothetical_protein	AF-P52223-F1-model_v4 Cytochrome c-type biogenesis protein CycH	0.111	139	111	43	181	150	275	3.461E-01	85
DESULFOASV1_3493_hypothetical_protein	AF-P33731-F1-model_v4	DESULFOASV1_3493_hypothetical_protein	AF-P33731-F1-model_v4 Signal recognition particle subunit SRP72	0.143	142	111	46	175	14	155	2.460E-01	85
DESULFOASV1_3493_hypothetical_protein	AF-Q5BDX1-F1-model_v4	DESULFOASV1_3493_hypothetical_protein	AF-Q5BDX1-F1-model_v4 Pre-mRNA-splicing factor clf1	0.167	194	142	3	174	9	202	1.126E-01	85
DESULFOASV1_3493_hypothetical_protein	AF-Q6P2P2-F1-model_v4	DESULFOASV1_3493_hypothetical_protein	AF-Q6P2P2-F1-model_v4 Protein arginine N-methyltransferase 9	0.165	157	123	1	157	3	150	1.126E-01	85
DESULFOASV1_3493_hypothetical_protein	AF-Q7Z3J3-F1-model_v4	DESULFOASV1_3493_hypothetical_protein	AF-Q7Z3J3-F1-model_v4 RanBP2-like and GRIP domain-containing protein 4	0.139	118	91	42	148	25	142	5.371E-01	85
DESULFOASV1_3493_hypothetical_protein	AF-B7KKZ8-F1-model_v4	DESULFOASV1_3493_hypothetical_protein	AF-B7KKZ8-F1-model_v4 Photosystem I assembly protein Ycf3	0.172	116	81	39	137	31	146	4.871E-01	84
DESULFOASV1_3493_hypothetical_protein	AF-B7K035-F1-model_v4	DESULFOASV1_3493_hypothetical_protein	AF-B7K035-F1-model_v4 Photosystem I assembly protein Ycf3	0.158	120	97	39	154	31	150	2.990E-01	84
DESULFOASV1_3493_hypothetical_protein	AF-Q9CN81-F1-model_v4	DESULFOASV1_3493_hypothetical_protein	AF-Q9CN81-F1-model_v4 UPF0162 protein PM0557	0.180	79	63	80	157	179	257	7.937E-01	84
DESULFOASV1_3493_hypothetical_protein	AF-O60110-F1-model_v4	DESULFOASV1_3493_hypothetical_protein	AF-O60110-F1-model_v4 TPR repeat protein oca3	0.125	175	123	46	187	108	282	1.585E-01	84
DESULFOASV1_3493_hypothetical_protein	AF-Q9ZD72-F1-model_v4	DESULFOASV1_3493_hypothetical_protein	AF-Q9ZD72-F1-model_v4 Uncharacterized protein RP472	0.141	120	101	59	176	134	253	5.371E-01	84
DESULFOASV1_3493_hypothetical_protein	AF-P0C1J7-F1-model_v4	DESULFOASV1_3493_hypothetical_protein	AF-P0C1J7-F1-model_v4 FK506-binding protein 5	0.150	145	119	43	187	128	268	3.296E-01	84
DESULFOASV1_3493_hypothetical_protein	AF-Q54M20-F1-model_v4	DESULFOASV1_3493_hypothetical_protein	AF-Q54M20-F1-model_v4 Tetratricopeptide repeat protein 4 homolog	0.100	225	167	1	186	1	225	2.847E-01	84
DESULFOASV1_3493_hypothetical_protein	AF-Q5U2N8-F1-model_v4	DESULFOASV1_3493_hypothetical_protein	AF-Q5U2N8-F1-model_v4 Intraflagellar transport protein 56	0.100	149	119	42	174	322	470	1.183E-01	84
DESULFOASV1_3493_hypothetical_protein	AF-Q4R3V2-F1-model_v4	DESULFOASV1_3493_hypothetical_protein	AF-Q4R3V2-F1-model_v4 Spermatogenesis-associated protein 16	0.136	147	100	43	159	176	322	4.007E-01	84
DESULFOASV1_3493_hypothetical_protein	AF-Q9VK41-F1-model_v4	DESULFOASV1_3493_hypothetical_protein	AF-Q9VK41-F1-model_v4 Tetratricopeptide repeat protein 30 homolog	0.168	156	128	16	171	385	539	3.635E-01	84
DESULFOASV1_3493_hypothetical_protein	AF-Q54EP7-F1-model_v4	DESULFOASV1_3493_hypothetical_protein	AF-Q54EP7-F1-model_v4 Signal recognition particle subunit SRP72	0.123	239	155	4	181	132	370	7.259E-02	84
DESULFOASV1_3493_hypothetical_protein	AF-P69435-F1-model_v4	DESULFOASV1_3493_hypothetical_protein	AF-P69435-F1-model_v4 Poly-beta-1,6-N-acetyl-D-glucosamine export protein	0.132	150	114	43	174	65	214	3.296E-01	84
DESULFOASV1_3493_hypothetical_protein	AF-Q06J27-F1-model_v4	DESULFOASV1_3493_hypothetical_protein	AF-Q06J27-F1-model_v4 Photosystem I assembly protein Ycf3	0.157	132	97	43	158	35	166	4.418E-01	83
DESULFOASV1_3493_hypothetical_protein	AF-B2J1S7-F1-model_v4	DESULFOASV1_3493_hypothetical_protein	AF-B2J1S7-F1-model_v4 Photosystem I assembly protein Ycf3	0.172	116	81	39	137	31	146	4.418E-01	83
DESULFOASV1_3493_hypothetical_protein	AF-Q95MP1-F1-model_v4	DESULFOASV1_3493_hypothetical_protein	AF-Q95MP1-F1-model_v4 Aryl-hydrocarbon-interacting protein-like 1	0.131	155	129	39	187	174	328	3.635E-01	83
DESULFOASV1_3493_hypothetical_protein	AF-Q96WW2-F1-model_v4	DESULFOASV1_3493_hypothetical_protein	AF-Q96WW2-F1-model_v4 Meiotically up-regulated gene 93 protein	0.136	196	152	10	186	1	196	1.748E-01	83
DESULFOASV1_3493_hypothetical_protein	AF-P44942-F1-model_v4	DESULFOASV1_3493_hypothetical_protein	AF-P44942-F1-model_v4 Formate-dependent nitrite reductase complex bifunctional subunit NrfFG	0.156	204	151	1	180	168	371	1.438E-01	83
DESULFOASV1_3493_hypothetical_protein	AF-P96649-F1-model_v4	DESULFOASV1_3493_hypothetical_protein	AF-P96649-F1-model_v4 Response regulator aspartate phosphatase I	0.174	147	111	46	180	187	333	4.208E-01	83
DESULFOASV1_3493_hypothetical_protein	AF-A1Z6M6-F1-model_v4	DESULFOASV1_3493_hypothetical_protein	AF-A1Z6M6-F1-model_v4 DNA polymerase interacting tetratricopeptide repeat-containing, protein of 47 kDa	0.122	223	162	1	185	1	223	4.208E-01	83
DESULFOASV1_3493_hypothetical_protein	AF-P0ACB7-F1-model_v4	DESULFOASV1_3493_hypothetical_protein	AF-P0ACB7-F1-model_v4 Protein HemY	0.233	103	67	58	160	309	397	6.218E-01	83
DESULFOASV1_3493_hypothetical_protein	AF-Q5T764-F1-model_v4	DESULFOASV1_3493_hypothetical_protein	AF-Q5T764-F1-model_v4 Interferon-induced protein with tetratricopeptide repeats 1B	0.131	182	120	43	181	251	432	3.816E-01	83
DESULFOASV1_3493_hypothetical_protein	AF-P69434-F1-model_v4	DESULFOASV1_3493_hypothetical_protein	AF-P69434-F1-model_v4 Poly-beta-1,6-N-acetyl-D-glucosamine export protein	0.132	150	114	43	174	65	214	3.635E-01	83
DESULFOASV1_3493_hypothetical_protein	AF-Q85FL9-F1-model_v4	DESULFOASV1_3493_hypothetical_protein	AF-Q85FL9-F1-model_v4 Photosystem I assembly protein Ycf3	0.113	152	120	39	174	31	182	4.418E-01	82
DESULFOASV1_3493_hypothetical_protein	AF-P0AC04-F1-model_v4	DESULFOASV1_3493_hypothetical_protein	AF-P0AC04-F1-model_v4 Outer membrane protein assembly factor BamD	0.111	142	116	43	174	32	173	2.342E-01	82
DESULFOASV1_3493_hypothetical_protein	AF-P0AC02-F1-model_v4	DESULFOASV1_3493_hypothetical_protein	AF-P0AC02-F1-model_v4 Outer membrane protein assembly factor BamD	0.111	142	116	43	174	32	173	2.342E-01	82
DESULFOASV1_3493_hypothetical_protein	AF-Q5ACI8-F1-model_v4	DESULFOASV1_3493_hypothetical_protein	AF-Q5ACI8-F1-model_v4 Peptidyl-prolyl cis-trans isomerase D	0.115	148	127	43	186	217	364	4.418E-01	82
DESULFOASV1_3493_hypothetical_protein	AF-Q6N069-F1-model_v4	DESULFOASV1_3493_hypothetical_protein	AF-Q6N069-F1-model_v4 N-alpha-acetyltransferase 16, NatA auxiliary subunit	0.148	135	112	42	174	9	143	5.115E-01	82
DESULFOASV1_3493_hypothetical_protein	AF-Q9ZT71-F1-model_v4	DESULFOASV1_3493_hypothetical_protein	AF-Q9ZT71-F1-model_v4 Protein STABILIZED1	0.167	132	108	43	173	760	891	5.115E-01	82
DESULFOASV1_3493_hypothetical_protein	AF-P0A2M0-F1-model_v4	DESULFOASV1_3493_hypothetical_protein	AF-P0A2M0-F1-model_v4 Protein SirB1	0.168	85	69	77	160	181	265	1.117E+00	81
DESULFOASV1_3493_hypothetical_protein	AF-Q52997-F1-model_v4	DESULFOASV1_3493_hypothetical_protein	AF-Q52997-F1-model_v4 Uncharacterized protein R00370	0.158	103	86	58	160	312	414	1.013E+00	81
DESULFOASV1_3493_hypothetical_protein	AF-Q9CSP9-F1-model_v4	DESULFOASV1_3493_hypothetical_protein	AF-Q9CSP9-F1-model_v4 Tetratricopeptide repeat protein 14	0.151	151	119	36	186	299	439	4.007E-01	81
DESULFOASV1_3493_hypothetical_protein	AF-Q0P3N1-F1-model_v4	DESULFOASV1_3493_hypothetical_protein	AF-Q0P3N1-F1-model_v4 Photosystem I assembly protein Ycf3	0.162	128	93	43	154	35	162	1.426E+00	80
DESULFOASV1_3493_hypothetical_protein	AF-Q2JJK6-F1-model_v4	DESULFOASV1_3493_hypothetical_protein	AF-Q2JJK6-F1-model_v4 Photosystem I assembly protein Ycf3	0.150	137	115	39	174	32	168	3.635E-01	80
DESULFOASV1_3493_hypothetical_protein	AF-Q9MAX6-F1-model_v4	DESULFOASV1_3493_hypothetical_protein	AF-Q9MAX6-F1-model_v4 Coatomer subunit epsilon-1	0.176	101	79	59	155	183	283	8.751E-01	80
DESULFOASV1_3493_hypothetical_protein	AF-Q95MN8-F1-model_v4	DESULFOASV1_3493_hypothetical_protein	AF-Q95MN8-F1-model_v4 Aryl-hydrocarbon-interacting protein-like 1	0.150	156	125	39	186	174	329	6.218E-01	80
DESULFOASV1_3493_hypothetical_protein	AF-Q95MN9-F1-model_v4	DESULFOASV1_3493_hypothetical_protein	AF-Q95MN9-F1-model_v4 Aryl-hydrocarbon-interacting protein-like 1	0.168	156	122	39	186	174	329	5.639E-01	80
DESULFOASV1_3493_hypothetical_protein	AF-Q8BIX9-F1-model_v4	DESULFOASV1_3493_hypothetical_protein	AF-Q8BIX9-F1-model_v4 Protein adenylyltransferase FICD	0.150	120	90	43	162	106	212	3.139E-01	80
DESULFOASV1_3493_hypothetical_protein	AF-Q60462-F1-model_v4	DESULFOASV1_3493_hypothetical_protein	AF-Q60462-F1-model_v4 Interferon-induced protein with tetratricopeptide repeats 2	0.136	141	111	46	174	212	352	6.218E-01	80
DESULFOASV1_3493_hypothetical_protein	AF-A7YE96-F1-model_v4	DESULFOASV1_3493_hypothetical_protein	AF-A7YE96-F1-model_v4 Tetratricopeptide repeat protein 30A	0.151	132	104	46	177	11	134	9.188E-01	80
DESULFOASV1_3493_hypothetical_protein	AF-Q9FNS4-F1-model_v4	DESULFOASV1_3493_hypothetical_protein	AF-Q9FNS4-F1-model_v4 PsbB mRNA maturation factor Mbb1, chloroplastic	0.159	132	108	43	174	123	252	2.847E-01	80
DESULFOASV1_3493_hypothetical_protein	AF-Q8N4P2-F1-model_v4	DESULFOASV1_3493_hypothetical_protein	AF-Q8N4P2-F1-model_v4 Tetratricopeptide repeat protein 30B	0.178	132	102	46	177	14	138	7.937E-01	80
DESULFOASV1_3493_hypothetical_protein	AF-Q5K654-F1-model_v4	DESULFOASV1_3493_hypothetical_protein	AF-Q5K654-F1-model_v4 Pre-mRNA-splicing factor CLF1	0.137	195	135	1	157	9	203	1.022E-01	80
DESULFOASV1_3493_hypothetical_protein	AF-Q7SGD2-F1-model_v4	DESULFOASV1_3493_hypothetical_protein	AF-Q7SGD2-F1-model_v4 Pre-mRNA-splicing factor clf-1	0.152	192	147	1	174	11	202	1.748E-01	80
DESULFOASV1_3493_hypothetical_protein	AF-P0A2L9-F1-model_v4	DESULFOASV1_3493_hypothetical_protein	AF-P0A2L9-F1-model_v4 Protein SirB1	0.168	85	69	77	160	181	265	1.231E+00	79
DESULFOASV1_3493_hypothetical_protein	AF-O05797-F1-model_v4	DESULFOASV1_3493_hypothetical_protein	AF-O05797-F1-model_v4 Transcriptional regulatory protein MoaR1	0.129	143	114	43	174	128	270	4.007E-01	79
DESULFOASV1_3493_hypothetical_protein	AF-Q6FW76-F1-model_v4	DESULFOASV1_3493_hypothetical_protein	AF-Q6FW76-F1-model_v4 Pre-mRNA-splicing factor CLF1	0.102	191	154	2	174	1	191	2.124E-01	79
DESULFOASV1_3493_hypothetical_protein	AF-O67178-F1-model_v4	DESULFOASV1_3493_hypothetical_protein	AF-O67178-F1-model_v4 Uncharacterized protein aq_1088	0.143	173	115	42	176	136	308	5.416E-02	79
DESULFOASV1_3493_hypothetical_protein	AF-A0T0D3-F1-model_v4	DESULFOASV1_3493_hypothetical_protein	AF-A0T0D3-F1-model_v4 Photosystem I assembly protein Ycf3	0.171	136	95	39	174	25	139	1.510E-01	78
DESULFOASV1_3493_hypothetical_protein	AF-Q9TL02-F1-model_v4	DESULFOASV1_3493_hypothetical_protein	AF-Q9TL02-F1-model_v4 Photosystem I assembly protein Ycf3	0.159	166	127	7	158	5	170	2.990E-01	78
DESULFOASV1_3493_hypothetical_protein	AF-P48277-F1-model_v4	DESULFOASV1_3493_hypothetical_protein	AF-P48277-F1-model_v4 Uncharacterized protein ycf37	0.092	161	145	15	175	11	171	1.369E-01	78
DESULFOASV1_3493_hypothetical_protein	AF-O14579-F1-model_v4	DESULFOASV1_3493_hypothetical_protein	AF-O14579-F1-model_v4 Coatomer subunit epsilon	0.112	151	127	43	186	146	296	7.198E-01	78
DESULFOASV1_3493_hypothetical_protein	AF-Q5B4E7-F1-model_v4	DESULFOASV1_3493_hypothetical_protein	AF-Q5B4E7-F1-model_v4 Peptidyl-prolyl cis-trans isomerase D	0.130	152	124	43	185	215	366	3.139E-01	78
DESULFOASV1_3493_hypothetical_protein	AF-Q9KQ40-F1-model_v4	DESULFOASV1_3493_hypothetical_protein	AF-Q9KQ40-F1-model_v4 Putative beta-barrel assembly-enhancing protease	0.151	172	115	43	179	307	478	3.635E-01	78
DESULFOASV1_3493_hypothetical_protein	AF-Q8C636-F1-model_v4	DESULFOASV1_3493_hypothetical_protein	AF-Q8C636-F1-model_v4 Spermatogenesis-associated protein 16	0.136	147	100	43	159	177	323	8.751E-01	78
DESULFOASV1_3493_hypothetical_protein	AF-Q9Y6X3-F1-model_v4	DESULFOASV1_3493_hypothetical_protein	AF-Q9Y6X3-F1-model_v4 MAU2 chromatid cohesion factor homolog	0.119	158	136	19	173	2	159	1.013E+00	78
DESULFOASV1_3493_hypothetical_protein	AF-Q6CJK2-F1-model_v4	DESULFOASV1_3493_hypothetical_protein	AF-Q6CJK2-F1-model_v4 Pre-mRNA-splicing factor CLF1	0.121	192	152	1	174	2	193	2.231E-01	78
DESULFOASV1_3493_hypothetical_protein	AF-P12945-F1-model_v4	DESULFOASV1_3493_hypothetical_protein	AF-P12945-F1-model_v4 N-terminal acetyltransferase A complex subunit NAT1	0.163	153	104	50	174	391	543	2.583E-01	78
DESULFOASV1_3493_hypothetical_protein	AF-A6MMK8-F1-model_v4	DESULFOASV1_3493_hypothetical_protein	AF-A6MMK8-F1-model_v4 Photosystem I assembly protein Ycf3	0.147	142	102	39	159	31	172	1.013E+00	77
DESULFOASV1_3493_hypothetical_protein	AF-P55727-F1-model_v4	DESULFOASV1_3493_hypothetical_protein	AF-P55727-F1-model_v4 Uncharacterized protein y4yS	0.156	128	95	51	178	63	176	3.635E-01	77
DESULFOASV1_3493_hypothetical_protein	AF-Q9KB79-F1-model_v4	DESULFOASV1_3493_hypothetical_protein	AF-Q9KB79-F1-model_v4 TPR repeat-containing protein BH2049	0.180	151	111	46	181	71	221	2.712E-01	77
DESULFOASV1_3493_hypothetical_protein	AF-Q8K9E8-F1-model_v4	DESULFOASV1_3493_hypothetical_protein	AF-Q8K9E8-F1-model_v4 Outer membrane protein assembly factor BamD	0.086	177	154	15	184	7	183	4.871E-01	77
DESULFOASV1_3493_hypothetical_protein	AF-P57270-F1-model_v4	DESULFOASV1_3493_hypothetical_protein	AF-P57270-F1-model_v4 UPF0162 protein BU173	0.195	82	64	77	157	181	262	1.820E+00	77
DESULFOASV1_3493_hypothetical_protein	AF-P09914-F1-model_v4	DESULFOASV1_3493_hypothetical_protein	AF-P09914-F1-model_v4 Interferon-induced protein with tetratricopeptide repeats 1	0.128	179	118	46	181	254	432	4.639E-01	77
DESULFOASV1_3493_hypothetical_protein	AF-O15287-F1-model_v4	DESULFOASV1_3493_hypothetical_protein	AF-O15287-F1-model_v4 Fanconi anemia group G protein	0.123	148	115	43	174	453	600	3.139E-01	77
DESULFOASV1_3493_hypothetical_protein	AF-P87317-F1-model_v4	DESULFOASV1_3493_hypothetical_protein	AF-P87317-F1-model_v4 Uncharacterized protein C31F10.16	0.103	97	83	46	139	244	340	2.212E+00	77
DESULFOASV1_3493_hypothetical_protein	AF-Q750X3-F1-model_v4	DESULFOASV1_3493_hypothetical_protein	AF-Q750X3-F1-model_v4 Pre-mRNA-splicing factor CLF1	0.129	174	145	1	174	24	190	3.296E-01	77
DESULFOASV1_3493_hypothetical_protein	AF-O74985-F1-model_v4	DESULFOASV1_3493_hypothetical_protein	AF-O74985-F1-model_v4 N-terminal acetyltransferase A complex subunit nat1	0.135	144	118	50	186	387	530	5.922E-01	77
DESULFOASV1_3493_hypothetical_protein	AF-Q2KJJ0-F1-model_v4	DESULFOASV1_3493_hypothetical_protein	AF-Q2KJJ0-F1-model_v4 Pre-mRNA-processing factor 6	0.155	129	107	46	174	645	772	7.559E-01	77
DESULFOASV1_3493_hypothetical_protein	AF-Q5RCC2-F1-model_v4	DESULFOASV1_3493_hypothetical_protein	AF-Q5RCC2-F1-model_v4 Pre-mRNA-processing factor 6	0.101	118	99	43	153	675	792	1.293E+00	77
DESULFOASV1_3493_hypothetical_protein	AF-O94906-F1-model_v4	DESULFOASV1_3493_hypothetical_protein	AF-O94906-F1-model_v4 Pre-mRNA-processing factor 6	0.110	118	98	43	153	675	792	1.293E+00	77
DESULFOASV1_3493_hypothetical_protein	AF-Q89AS9-F1-model_v4	DESULFOASV1_3493_hypothetical_protein	AF-Q89AS9-F1-model_v4 UPF0162 protein bbp_163	0.181	77	62	50	126	188	264	2.439E+00	76
