query	target	qheader	theader	fident	alnlen	mismatch	qstart	qend	tstart	tend	evalue	bits
DESULFOASV1_2187_MliC_family_protein	AF-P29455-F1-model_v4	DESULFOASV1_2187_MliC_family_protein	AF-P29455-F1-model_v4 Interleukin-6	0.083	160	113	1	124	3	162	9.257E+00	17
DESULFOASV1_2187_MliC_family_protein	AF-Q7UA77-F1-model_v4	DESULFOASV1_2187_MliC_family_protein	AF-Q7UA77-F1-model_v4 Protein GrpE	0.106	189	165	1	189	4	189	5.010E+00	17
DESULFOASV1_2187_MliC_family_protein	AF-Q2HJ10-F1-model_v4	DESULFOASV1_2187_MliC_family_protein	AF-Q2HJ10-F1-model_v4 Zinc transporter 2	0.108	123	108	1	122	23	145	8.279E+00	17
DESULFOASV1_2187_MliC_family_protein	AF-Q6FF64-F1-model_v4	DESULFOASV1_2187_MliC_family_protein	AF-Q6FF64-F1-model_v4 UvrABC system protein C	0.117	135	114	38	172	164	293	3.790E+00	17
DESULFOASV1_2187_MliC_family_protein	AF-Q3AFE5-F1-model_v4	DESULFOASV1_2187_MliC_family_protein	AF-Q3AFE5-F1-model_v4 UvrABC system protein C	0.104	128	110	37	160	157	284	5.923E+00	17
DESULFOASV1_2187_MliC_family_protein	AF-A5EW70-F1-model_v4	DESULFOASV1_2187_MliC_family_protein	AF-A5EW70-F1-model_v4 UvrABC system protein C	0.098	118	87	46	163	186	282	5.923E+00	17
DESULFOASV1_2187_MliC_family_protein	AF-Q5WTF5-F1-model_v4	DESULFOASV1_2187_MliC_family_protein	AF-Q5WTF5-F1-model_v4 UvrABC system protein C	0.150	126	103	38	163	166	287	4.738E+00	17
DESULFOASV1_2187_MliC_family_protein	AF-Q9FXA2-F1-model_v4	DESULFOASV1_2187_MliC_family_protein	AF-Q9FXA2-F1-model_v4 Polyadenylate-binding protein 8	0.098	122	106	1	122	530	647	8.755E+00	17
DESULFOASV1_2187_MliC_family_protein	AF-Q758R7-F1-model_v4	DESULFOASV1_2187_MliC_family_protein	AF-Q758R7-F1-model_v4 Mitochondrial division protein 1	0.123	117	68	126	203	566	682	7.830E+00	17
DESULFOASV1_2187_MliC_family_protein	AF-A8WL06-F1-model_v4	DESULFOASV1_2187_MliC_family_protein	AF-A8WL06-F1-model_v4 Homeobox protein unc-62	0.091	146	110	1	122	47	192	9.788E+00	17
DESULFOASV1_2187_MliC_family_protein	AF-Q01846-F1-model_v4	DESULFOASV1_2187_MliC_family_protein	AF-Q01846-F1-model_v4 Structural protein MDM1	0.096	168	148	5	169	659	826	3.205E+00	17
DESULFOASV1_2187_MliC_family_protein	AF-Q40296-F1-model_v4	DESULFOASV1_2187_MliC_family_protein	AF-Q40296-F1-model_v4 Fucoxanthin-chlorophyll a-c binding protein B, chloroplastic	0.127	179	106	1	122	10	188	9.788E+00	16
DESULFOASV1_2187_MliC_family_protein	AF-Q55BU8-F1-model_v4	DESULFOASV1_2187_MliC_family_protein	AF-Q55BU8-F1-model_v4 Protein erg2 homolog	0.088	121	101	92	203	58	178	5.297E+00	16
DESULFOASV1_2187_MliC_family_protein	AF-Q3K1P9-F1-model_v4	DESULFOASV1_2187_MliC_family_protein	AF-Q3K1P9-F1-model_v4 Foldase protein PrsA	0.121	161	117	5	138	1	161	8.755E+00	16
DESULFOASV1_2187_MliC_family_protein	AF-P79065-F1-model_v4	DESULFOASV1_2187_MliC_family_protein	AF-P79065-F1-model_v4 Tip elongation protein 1	0.185	144	98	2	122	96	239	8.755E+00	16
DESULFOASV1_2187_MliC_family_protein	AF-Q9M0V4-F1-model_v4	DESULFOASV1_2187_MliC_family_protein	AF-Q9M0V4-F1-model_v4 U3 snoRNP-associated protein-like YAO	0.064	230	187	3	203	31	260	8.755E+00	16
DESULFOASV1_2187_MliC_family_protein	AF-B0VE41-F1-model_v4	DESULFOASV1_2187_MliC_family_protein	AF-B0VE41-F1-model_v4 UvrABC system protein C	0.129	136	111	38	173	165	293	5.601E+00	16
DESULFOASV1_2187_MliC_family_protein	AF-A5IAT1-F1-model_v4	DESULFOASV1_2187_MliC_family_protein	AF-A5IAT1-F1-model_v4 UvrABC system protein C	0.111	123	106	41	163	168	287	7.405E+00	16
DESULFOASV1_2187_MliC_family_protein	AF-Q8PKS0-F1-model_v4	DESULFOASV1_2187_MliC_family_protein	AF-Q8PKS0-F1-model_v4 UvrABC system protein C	0.102	122	106	42	163	168	286	7.830E+00	16
DESULFOASV1_2187_MliC_family_protein	AF-A5E3Q2-F1-model_v4	DESULFOASV1_2187_MliC_family_protein	AF-A5E3Q2-F1-model_v4 Eukaryotic translation initiation factor 3 subunit C	0.146	149	102	2	122	46	194	5.601E+00	16
DESULFOASV1_2187_MliC_family_protein	AF-Q5AML1-F1-model_v4	DESULFOASV1_2187_MliC_family_protein	AF-Q5AML1-F1-model_v4 Eukaryotic translation initiation factor 3 subunit C	0.112	151	107	1	122	53	203	7.830E+00	16
DESULFOASV1_2187_MliC_family_protein	AF-Q6FPH2-F1-model_v4	DESULFOASV1_2187_MliC_family_protein	AF-Q6FPH2-F1-model_v4 GrpE protein homolog, mitochondrial	0.152	195	136	1	161	25	219	5.601E+00	15
DESULFOASV1_2187_MliC_family_protein	AF-Q60652-F1-model_v4	DESULFOASV1_2187_MliC_family_protein	AF-Q60652-F1-model_v4 Killer cell lectin-like receptor 5	0.096	256	185	1	206	5	260	9.788E+00	15
DESULFOASV1_2187_MliC_family_protein	AF-Q42840-F1-model_v4	DESULFOASV1_2187_MliC_family_protein	AF-Q42840-F1-model_v4 Oxygen-dependent coproporphyrinogen-III oxidase, chloroplastic	0.068	201	178	1	192	23	223	4.481E+00	15
DESULFOASV1_2187_MliC_family_protein	AF-Q9LP59-F1-model_v4	DESULFOASV1_2187_MliC_family_protein	AF-Q9LP59-F1-model_v4 F-box/kelch-repeat protein At1g48625	0.096	113	98	89	201	22	130	8.755E+00	15
DESULFOASV1_2187_MliC_family_protein	AF-O16368-F1-model_v4	DESULFOASV1_2187_MliC_family_protein	AF-O16368-F1-model_v4 Probable 26S proteasome regulatory subunit 4	0.087	198	129	2	199	21	162	7.830E+00	15
DESULFOASV1_2187_MliC_family_protein	AF-Q9UTB2-F1-model_v4	DESULFOASV1_2187_MliC_family_protein	AF-Q9UTB2-F1-model_v4 Serine--tRNA ligase, mitochondrial	0.114	134	105	1	120	13	146	9.257E+00	15
DESULFOASV1_2187_MliC_family_protein	AF-Q00312-F1-model_v4	DESULFOASV1_2187_MliC_family_protein	AF-Q00312-F1-model_v4 Transcription factor RBF1	0.099	264	183	1	204	29	292	4.481E+00	15
DESULFOASV1_2187_MliC_family_protein	AF-Q15326-F1-model_v4	DESULFOASV1_2187_MliC_family_protein	AF-Q15326-F1-model_v4 Zinc finger MYND domain-containing protein 11	0.085	187	153	36	203	135	321	7.003E+00	15
DESULFOASV1_2187_MliC_family_protein	AF-Q4UV60-F1-model_v4	DESULFOASV1_2187_MliC_family_protein	AF-Q4UV60-F1-model_v4 UvrABC system protein C	0.131	112	86	52	163	187	286	8.755E+00	15
DESULFOASV1_2187_MliC_family_protein	AF-Q0VPZ5-F1-model_v4	DESULFOASV1_2187_MliC_family_protein	AF-Q0VPZ5-F1-model_v4 UvrABC system protein C	0.102	138	114	26	163	155	282	8.279E+00	14
DESULFOASV1_2187_MliC_family_protein	AF-Q465Y5-F1-model_v4	DESULFOASV1_2187_MliC_family_protein	AF-Q465Y5-F1-model_v4 Protein GrpE	0.111	201	164	1	201	14	198	9.257E+00	13
DESULFOASV1_2187_MliC_family_protein	AF-P47023-F1-model_v4	DESULFOASV1_2187_MliC_family_protein	AF-P47023-F1-model_v4 Transposon Ty4-J Gag polyprotein	0.103	159	126	4	162	1	142	9.257E+00	13
DESULFOASV1_2187_MliC_family_protein	AF-Q9LUK7-F1-model_v4	DESULFOASV1_2187_MliC_family_protein	AF-Q9LUK7-F1-model_v4 Transcription factor bHLH28	0.104	206	166	1	206	308	493	9.257E+00	13
