query	target	qheader	theader	fident	alnlen	mismatch	qstart	qend	tstart	tend	evalue	bits
DESULFOASV1_1572_hypothetical_protein	AF-Q9CB03-F1-model_v4	DESULFOASV1_1572_hypothetical_protein	AF-Q9CB03-F1-model_v4 Protein NPGR1	0.126	141	120	64	201	439	579	8.803E-02	103
DESULFOASV1_1572_hypothetical_protein	AF-Q9Y5Q9-F1-model_v4	DESULFOASV1_1572_hypothetical_protein	AF-Q9Y5Q9-F1-model_v4 General transcription factor 3C polypeptide 3	0.158	188	144	53	224	154	341	3.500E-02	103
DESULFOASV1_1572_hypothetical_protein	AF-O13754-F1-model_v4	DESULFOASV1_1572_hypothetical_protein	AF-O13754-F1-model_v4 Hsp70/Hsp90 co-chaperone cns1	0.108	154	128	81	224	39	192	9.241E-02	102
DESULFOASV1_1572_hypothetical_protein	AF-Q7TNH6-F1-model_v4	DESULFOASV1_1572_hypothetical_protein	AF-Q7TNH6-F1-model_v4 Nephrocystin-3	0.185	230	145	45	223	1048	1277	8.564E-03	102
DESULFOASV1_1572_hypothetical_protein	AF-Q8SYD0-F1-model_v4	DESULFOASV1_1572_hypothetical_protein	AF-Q8SYD0-F1-model_v4 Tetratricopeptide repeat protein 19 homolog, mitochondrial	0.161	176	139	57	223	189	364	4.916E-02	101
DESULFOASV1_1572_hypothetical_protein	AF-Q7MNW1-F1-model_v4	DESULFOASV1_1572_hypothetical_protein	AF-Q7MNW1-F1-model_v4 Penicillin-binding protein activator LpoA	0.170	144	119	75	218	37	180	1.655E-01	101
DESULFOASV1_1572_hypothetical_protein	AF-Q05022-F1-model_v4	DESULFOASV1_1572_hypothetical_protein	AF-Q05022-F1-model_v4 rRNA biogenesis protein RRP5	0.195	140	105	83	222	1535	1665	9.701E-02	101
DESULFOASV1_1572_hypothetical_protein	AF-Q8GZN1-F1-model_v4	DESULFOASV1_1572_hypothetical_protein	AF-Q8GZN1-F1-model_v4 Protein NPG1	0.100	155	122	84	220	449	603	6.267E-02	100
DESULFOASV1_1572_hypothetical_protein	AF-Q6AZT7-F1-model_v4	DESULFOASV1_1572_hypothetical_protein	AF-Q6AZT7-F1-model_v4 Nephrocystin-3	0.176	251	169	18	223	1005	1255	1.040E-02	100
DESULFOASV1_1572_hypothetical_protein	AF-Q54VF4-F1-model_v4	DESULFOASV1_1572_hypothetical_protein	AF-Q54VF4-F1-model_v4 TPR-containing protein DDB_G0280363	0.112	159	133	64	222	981	1131	2.214E-01	100
DESULFOASV1_1572_hypothetical_protein	AF-Q9VSA4-F1-model_v4	DESULFOASV1_1572_hypothetical_protein	AF-Q9VSA4-F1-model_v4 Tonsoku-like protein	0.164	162	135	63	224	290	451	4.916E-02	100
DESULFOASV1_1572_hypothetical_protein	AF-Q9HGM9-F1-model_v4	DESULFOASV1_1572_hypothetical_protein	AF-Q9HGM9-F1-model_v4 DnaJ homolog subfamily C member 7 homolog	0.148	150	120	82	223	194	343	1.914E-01	99
DESULFOASV1_1572_hypothetical_protein	AF-D4GNT6-F1-model_v4	DESULFOASV1_1572_hypothetical_protein	AF-D4GNT6-F1-model_v4 Penicillin-binding protein activator LpoA	0.163	143	118	76	218	39	180	4.462E-02	99
DESULFOASV1_1572_hypothetical_protein	AF-Q5E2P0-F1-model_v4	DESULFOASV1_1572_hypothetical_protein	AF-Q5E2P0-F1-model_v4 Penicillin-binding protein activator LpoA	0.156	144	121	75	218	39	182	2.561E-01	98
DESULFOASV1_1572_hypothetical_protein	AF-Q9CY00-F1-model_v4	DESULFOASV1_1572_hypothetical_protein	AF-Q9CY00-F1-model_v4 Tetratricopeptide repeat protein 30B	0.149	196	133	67	223	13	208	3.026E-02	98
DESULFOASV1_1572_hypothetical_protein	AF-O34930-F1-model_v4	DESULFOASV1_1572_hypothetical_protein	AF-O34930-F1-model_v4 Response regulator aspartate phosphatase K	0.104	173	143	64	224	97	269	9.241E-02	97
DESULFOASV1_1572_hypothetical_protein	AF-Q13702-F1-model_v4	DESULFOASV1_1572_hypothetical_protein	AF-Q13702-F1-model_v4 43 kDa receptor-associated protein of the synapse	0.119	163	138	58	215	3	165	9.701E-02	97
DESULFOASV1_1572_hypothetical_protein	AF-Q54MD1-F1-model_v4	DESULFOASV1_1572_hypothetical_protein	AF-Q54MD1-F1-model_v4 Peroxisomal targeting signal 1 receptor	0.110	140	121	84	223	482	618	2.324E-01	97
DESULFOASV1_1572_hypothetical_protein	AF-D3YVL2-F1-model_v4	DESULFOASV1_1572_hypothetical_protein	AF-D3YVL2-F1-model_v4 Cilia- and flagella-associated protein 70	0.133	141	116	82	222	1000	1134	1.823E-01	97
DESULFOASV1_1572_hypothetical_protein	AF-Q6FX42-F1-model_v4	DESULFOASV1_1572_hypothetical_protein	AF-Q6FX42-F1-model_v4 Serine/threonine-protein kinase MEC1	0.155	148	118	84	224	1677	1824	1.298E-01	97
DESULFOASV1_1572_hypothetical_protein	AF-Q940U6-F1-model_v4	DESULFOASV1_1572_hypothetical_protein	AF-Q940U6-F1-model_v4 Protein FLUORESCENT IN BLUE LIGHT, chloroplastic	0.169	202	162	1	202	117	312	5.418E-02	96
DESULFOASV1_1572_hypothetical_protein	AF-P70962-F1-model_v4	DESULFOASV1_1572_hypothetical_protein	AF-P70962-F1-model_v4 Response regulator aspartate phosphatase B	0.124	151	131	65	215	153	302	1.737E-01	96
DESULFOASV1_1572_hypothetical_protein	AF-Q99LD4-F1-model_v4	DESULFOASV1_1572_hypothetical_protein	AF-Q99LD4-F1-model_v4 COP9 signalosome complex subunit 1	0.159	135	109	66	196	116	250	9.701E-02	96
DESULFOASV1_1572_hypothetical_protein	AF-Q1RLU8-F1-model_v4	DESULFOASV1_1572_hypothetical_protein	AF-Q1RLU8-F1-model_v4 Suppressor of tumorigenicity 7 protein homolog	0.109	150	117	67	198	143	292	1.655E-01	96
DESULFOASV1_1572_hypothetical_protein	AF-P43988-F1-model_v4	DESULFOASV1_1572_hypothetical_protein	AF-P43988-F1-model_v4 Uncharacterized protein HI_0366	0.122	162	137	59	220	21	177	8.803E-02	95
DESULFOASV1_1572_hypothetical_protein	AF-Q03569-F1-model_v4	DESULFOASV1_1572_hypothetical_protein	AF-Q03569-F1-model_v4 G-protein regulator 2	0.134	194	137	66	224	12	205	2.214E-01	95
DESULFOASV1_1572_hypothetical_protein	AF-Q14690-F1-model_v4	DESULFOASV1_1572_hypothetical_protein	AF-Q14690-F1-model_v4 Protein RRP5 homolog	0.180	241	180	1	221	1567	1807	3.026E-02	95
DESULFOASV1_1572_hypothetical_protein	AF-Q9D4B2-F1-model_v4	DESULFOASV1_1572_hypothetical_protein	AF-Q9D4B2-F1-model_v4 Outer dynein arm-docking complex subunit 4	0.131	245	181	16	224	246	490	6.906E-02	94
DESULFOASV1_1572_hypothetical_protein	AF-Q02335-F1-model_v4	DESULFOASV1_1572_hypothetical_protein	AF-Q02335-F1-model_v4 Mitochondrial import receptor subunit tomm-70	0.191	155	114	35	176	10	164	1.069E-01	93
DESULFOASV1_1572_hypothetical_protein	AF-Q09YJ7-F1-model_v4	DESULFOASV1_1572_hypothetical_protein	AF-Q09YJ7-F1-model_v4 Suppressor of tumorigenicity 7 protein	0.123	198	138	65	222	183	380	9.701E-02	93
DESULFOASV1_1572_hypothetical_protein	AF-Q9KQ40-F1-model_v4	DESULFOASV1_1572_hypothetical_protein	AF-Q9KQ40-F1-model_v4 Putative beta-barrel assembly-enhancing protease	0.171	161	126	64	224	272	424	1.576E-01	92
DESULFOASV1_1572_hypothetical_protein	AF-A4III8-F1-model_v4	DESULFOASV1_1572_hypothetical_protein	AF-A4III8-F1-model_v4 Intraflagellar transport protein 56	0.118	140	121	83	222	373	510	2.009E-01	92
DESULFOASV1_1572_hypothetical_protein	AF-C3NVZ3-F1-model_v4	DESULFOASV1_1572_hypothetical_protein	AF-C3NVZ3-F1-model_v4 Penicillin-binding protein activator LpoA	0.164	144	120	75	218	39	182	3.427E-01	92
DESULFOASV1_1572_hypothetical_protein	AF-Q6P5P3-F1-model_v4	DESULFOASV1_1572_hypothetical_protein	AF-Q6P5P3-F1-model_v4 Tetratricopeptide repeat protein 9C	0.098	161	115	97	224	4	164	1.363E-01	91
DESULFOASV1_1572_hypothetical_protein	AF-Q8LG95-F1-model_v4	DESULFOASV1_1572_hypothetical_protein	AF-Q8LG95-F1-model_v4 Pentatricopeptide repeat-containing protein At4g21190	0.145	161	135	64	224	54	212	7.249E-02	91
DESULFOASV1_1572_hypothetical_protein	AF-Q2PG42-F1-model_v4	DESULFOASV1_1572_hypothetical_protein	AF-Q2PG42-F1-model_v4 Suppressor of tumorigenicity 7 protein	0.123	198	138	65	222	140	337	1.363E-01	91
DESULFOASV1_1572_hypothetical_protein	AF-Q02099-F1-model_v4	DESULFOASV1_1572_hypothetical_protein	AF-Q02099-F1-model_v4 Protein kinase rad3	0.135	194	133	68	222	1602	1795	3.857E-02	91
DESULFOASV1_1572_hypothetical_protein	AF-Q59HN8-F1-model_v4	DESULFOASV1_1572_hypothetical_protein	AF-Q59HN8-F1-model_v4 Response regulator aspartate phosphatase H	0.159	173	119	83	225	198	370	5.161E-02	90
DESULFOASV1_1572_hypothetical_protein	AF-Q4WT84-F1-model_v4	DESULFOASV1_1572_hypothetical_protein	AF-Q4WT84-F1-model_v4 Pre-mRNA-splicing factor clf1	0.139	224	162	1	224	3	191	5.970E-02	90
DESULFOASV1_1572_hypothetical_protein	AF-Q6PGP7-F1-model_v4	DESULFOASV1_1572_hypothetical_protein	AF-Q6PGP7-F1-model_v4 Tetratricopeptide repeat protein 37	0.128	185	142	56	219	988	1172	9.701E-02	90
DESULFOASV1_1572_hypothetical_protein	AF-B7YZT2-F1-model_v4	DESULFOASV1_1572_hypothetical_protein	AF-B7YZT2-F1-model_v4 Mitochondrial fission 1 protein	0.141	89	75	136	224	32	119	1.153E+00	89
DESULFOASV1_1572_hypothetical_protein	AF-H9IWW7-F1-model_v4	DESULFOASV1_1572_hypothetical_protein	AF-H9IWW7-F1-model_v4 Inactive peptidyl-prolyl cis-trans isomerase shutdown	0.150	157	116	88	224	187	343	3.964E-01	89
DESULFOASV1_1572_hypothetical_protein	AF-A0A0P0VG31-F1-model_v4	DESULFOASV1_1572_hypothetical_protein	AF-A0A0P0VG31-F1-model_v4 DnaJ protein P58IPK homolog A	0.145	176	137	62	222	175	350	5.161E-02	89
DESULFOASV1_1572_hypothetical_protein	AF-Q9WVM3-F1-model_v4	DESULFOASV1_1572_hypothetical_protein	AF-Q9WVM3-F1-model_v4 Anaphase-promoting complex subunit 7	0.104	166	125	83	222	357	522	4.049E-02	89
DESULFOASV1_1572_hypothetical_protein	AF-A4D7R9-F1-model_v4	DESULFOASV1_1572_hypothetical_protein	AF-A4D7R9-F1-model_v4 Suppressor of tumorigenicity 7 protein	0.123	198	138	65	222	183	380	1.298E-01	89
DESULFOASV1_1572_hypothetical_protein	AF-Q59LR2-F1-model_v4	DESULFOASV1_1572_hypothetical_protein	AF-Q59LR2-F1-model_v4 Serine/threonine-protein kinase MEC1	0.082	175	143	68	224	1590	1764	9.241E-02	89
DESULFOASV1_1572_hypothetical_protein	AF-Q8GXU5-F1-model_v4	DESULFOASV1_1572_hypothetical_protein	AF-Q8GXU5-F1-model_v4 Protein SULFUR DEFICIENCY-INDUCED 1	0.109	175	143	63	224	82	256	2.109E-01	88
DESULFOASV1_1572_hypothetical_protein	AF-Q5DHT6-F1-model_v4	DESULFOASV1_1572_hypothetical_protein	AF-Q5DHT6-F1-model_v4 Eukaryotic translation initiation factor 3 subunit M	0.111	152	122	77	214	59	210	1.122E-01	88
DESULFOASV1_1572_hypothetical_protein	AF-Q9D8W5-F1-model_v4	DESULFOASV1_1572_hypothetical_protein	AF-Q9D8W5-F1-model_v4 26S proteasome non-ATPase regulatory subunit 12	0.117	235	197	1	224	1	235	7.989E-02	88
DESULFOASV1_1572_hypothetical_protein	AF-Q5JNB5-F1-model_v4	DESULFOASV1_1572_hypothetical_protein	AF-Q5JNB5-F1-model_v4 DnaJ protein P58IPK homolog B	0.143	198	136	64	223	150	347	4.049E-02	88
DESULFOASV1_1572_hypothetical_protein	AF-Q2IBE8-F1-model_v4	DESULFOASV1_1572_hypothetical_protein	AF-Q2IBE8-F1-model_v4 Suppressor of tumorigenicity 7 protein	0.120	196	136	67	222	185	380	1.502E-01	88
DESULFOASV1_1572_hypothetical_protein	AF-Q2QLD7-F1-model_v4	DESULFOASV1_1572_hypothetical_protein	AF-Q2QLD7-F1-model_v4 Suppressor of tumorigenicity 7 protein	0.120	196	136	67	222	185	380	1.502E-01	88
DESULFOASV1_1572_hypothetical_protein	AF-P06180-F1-model_v4	DESULFOASV1_1572_hypothetical_protein	AF-P06180-F1-model_v4 Histone-binding protein N1/N2	0.110	141	117	84	224	333	464	7.249E-02	88
DESULFOASV1_1572_hypothetical_protein	AF-C3LS71-F1-model_v4	DESULFOASV1_1572_hypothetical_protein	AF-C3LS71-F1-model_v4 Penicillin-binding protein activator LpoA	0.164	144	120	75	218	39	182	4.586E-01	88
DESULFOASV1_1572_hypothetical_protein	AF-B5DEL3-F1-model_v4	DESULFOASV1_1572_hypothetical_protein	AF-B5DEL3-F1-model_v4 Tetratricopeptide repeat protein 17	0.140	188	132	71	224	159	346	3.674E-02	88
DESULFOASV1_1572_hypothetical_protein	AF-Q95QT8-F1-model_v4	DESULFOASV1_1572_hypothetical_protein	AF-Q95QT8-F1-model_v4 Intraflagellar transport protein 56 homolog	0.159	142	111	83	224	396	528	3.964E-01	87
DESULFOASV1_1572_hypothetical_protein	AF-Q09YH4-F1-model_v4	DESULFOASV1_1572_hypothetical_protein	AF-Q09YH4-F1-model_v4 Suppressor of tumorigenicity 7 protein	0.120	196	136	67	222	185	380	1.576E-01	87
DESULFOASV1_1572_hypothetical_protein	AF-Q09YI5-F1-model_v4	DESULFOASV1_1572_hypothetical_protein	AF-Q09YI5-F1-model_v4 Suppressor of tumorigenicity 7 protein	0.123	198	138	65	222	183	380	1.502E-01	87
DESULFOASV1_1572_hypothetical_protein	AF-P12672-F1-model_v4	DESULFOASV1_1572_hypothetical_protein	AF-P12672-F1-model_v4 43 kDa receptor-associated protein of the synapse	0.119	163	138	58	215	3	165	2.822E-01	86
DESULFOASV1_1572_hypothetical_protein	AF-A9JRA0-F1-model_v4	DESULFOASV1_1572_hypothetical_protein	AF-A9JRA0-F1-model_v4 Suppressor of tumorigenicity 7 protein-like	0.099	151	121	64	198	170	320	1.298E-01	86
DESULFOASV1_1572_hypothetical_protein	AF-Q00PJ0-F1-model_v4	DESULFOASV1_1572_hypothetical_protein	AF-Q00PJ0-F1-model_v4 Suppressor of tumorigenicity 7 protein	0.123	198	138	65	222	183	380	1.737E-01	86
DESULFOASV1_1572_hypothetical_protein	AF-A5F987-F1-model_v4	DESULFOASV1_1572_hypothetical_protein	AF-A5F987-F1-model_v4 Penicillin-binding protein activator LpoA	0.164	144	120	75	218	39	182	5.305E-01	86
DESULFOASV1_1572_hypothetical_protein	AF-Q5SRH9-F1-model_v4	DESULFOASV1_1572_hypothetical_protein	AF-Q5SRH9-F1-model_v4 Tetratricopeptide repeat protein 39A	0.114	152	129	78	224	451	602	5.970E-02	86
DESULFOASV1_1572_hypothetical_protein	AF-Q527H0-F1-model_v4	DESULFOASV1_1572_hypothetical_protein	AF-Q527H0-F1-model_v4 Pre-mRNA-splicing factor CLF1	0.149	231	190	1	224	5	235	8.386E-02	86
DESULFOASV1_1572_hypothetical_protein	AF-O42668-F1-model_v4	DESULFOASV1_1572_hypothetical_protein	AF-O42668-F1-model_v4 Tetratricopeptide repeat protein 1	0.159	223	173	18	224	350	572	1.122E-01	86
DESULFOASV1_1572_hypothetical_protein	AF-P45432-F1-model_v4	DESULFOASV1_1572_hypothetical_protein	AF-P45432-F1-model_v4 COP9 signalosome complex subunit 1	0.157	154	117	62	215	112	251	2.109E-01	85
DESULFOASV1_1572_hypothetical_protein	AF-Q2IBD0-F1-model_v4	DESULFOASV1_1572_hypothetical_protein	AF-Q2IBD0-F1-model_v4 Suppressor of tumorigenicity 7 protein	0.123	198	138	65	222	183	380	1.737E-01	85
DESULFOASV1_1572_hypothetical_protein	AF-Q07E08-F1-model_v4	DESULFOASV1_1572_hypothetical_protein	AF-Q07E08-F1-model_v4 Suppressor of tumorigenicity 7 protein	0.123	198	138	65	222	182	379	1.914E-01	85
DESULFOASV1_1572_hypothetical_protein	AF-Q9UJX3-F1-model_v4	DESULFOASV1_1572_hypothetical_protein	AF-Q9UJX3-F1-model_v4 Anaphase-promoting complex subunit 7	0.129	173	124	82	224	352	524	4.916E-02	85
DESULFOASV1_1572_hypothetical_protein	AF-Q925N3-F1-model_v4	DESULFOASV1_1572_hypothetical_protein	AF-Q925N3-F1-model_v4 PEX5-related protein	0.120	290	195	1	223	216	505	6.906E-02	85
DESULFOASV1_1572_hypothetical_protein	AF-Q8WVT3-F1-model_v4	DESULFOASV1_1572_hypothetical_protein	AF-Q8WVT3-F1-model_v4 Trafficking protein particle complex subunit 12	0.135	178	137	65	223	501	678	7.989E-02	85
DESULFOASV1_1572_hypothetical_protein	AF-Q6PD62-F1-model_v4	DESULFOASV1_1572_hypothetical_protein	AF-Q6PD62-F1-model_v4 RNA polymerase-associated protein CTR9 homolog	0.172	185	132	65	224	375	559	2.616E-02	85
DESULFOASV1_1572_hypothetical_protein	AF-Q6NS46-F1-model_v4	DESULFOASV1_1572_hypothetical_protein	AF-Q6NS46-F1-model_v4 Protein RRP5 homolog	0.173	244	182	1	221	1555	1798	2.746E-02	85
DESULFOASV1_1572_hypothetical_protein	AF-P47133-F1-model_v4	DESULFOASV1_1572_hypothetical_protein	AF-P47133-F1-model_v4 ER membrane protein complex subunit 2	0.138	177	141	60	224	2	178	8.803E-02	84
DESULFOASV1_1572_hypothetical_protein	AF-Q07DW9-F1-model_v4	DESULFOASV1_1572_hypothetical_protein	AF-Q07DW9-F1-model_v4 Suppressor of tumorigenicity 7 protein	0.125	173	115	67	198	185	357	1.737E-01	84
DESULFOASV1_1572_hypothetical_protein	AF-Q2QLG2-F1-model_v4	DESULFOASV1_1572_hypothetical_protein	AF-Q2QLG2-F1-model_v4 Suppressor of tumorigenicity 7 protein	0.120	196	136	67	222	185	380	1.823E-01	84
DESULFOASV1_1572_hypothetical_protein	AF-Q2IBA8-F1-model_v4	DESULFOASV1_1572_hypothetical_protein	AF-Q2IBA8-F1-model_v4 Suppressor of tumorigenicity 7 protein	0.120	196	136	67	222	185	380	2.109E-01	84
DESULFOASV1_1572_hypothetical_protein	AF-Q9KUE0-F1-model_v4	DESULFOASV1_1572_hypothetical_protein	AF-Q9KUE0-F1-model_v4 Penicillin-binding protein activator LpoA	0.164	144	120	75	218	39	182	6.137E-01	84
DESULFOASV1_1572_hypothetical_protein	AF-Q3UGF1-F1-model_v4	DESULFOASV1_1572_hypothetical_protein	AF-Q3UGF1-F1-model_v4 WD repeat-containing protein 19	0.159	138	106	86	223	761	887	3.265E-01	84
DESULFOASV1_1572_hypothetical_protein	AF-Q6B950-F1-model_v4	DESULFOASV1_1572_hypothetical_protein	AF-Q6B950-F1-model_v4 Uncharacterized protein ycf37	0.124	165	126	35	199	3	147	2.963E-01	83
DESULFOASV1_1572_hypothetical_protein	AF-Q3T0B2-F1-model_v4	DESULFOASV1_1572_hypothetical_protein	AF-Q3T0B2-F1-model_v4 26S proteasome non-ATPase regulatory subunit 6	0.161	162	122	57	218	73	219	9.241E-02	83
DESULFOASV1_1572_hypothetical_protein	AF-Q93YR3-F1-model_v4	DESULFOASV1_1572_hypothetical_protein	AF-Q93YR3-F1-model_v4 FAM10 family protein At4g22670	0.162	128	103	97	224	119	242	6.762E-01	83
DESULFOASV1_1572_hypothetical_protein	AF-Q5W5X9-F1-model_v4	DESULFOASV1_1572_hypothetical_protein	AF-Q5W5X9-F1-model_v4 Tetratricopeptide repeat protein 23	0.146	241	189	1	222	1	241	8.386E-02	83
DESULFOASV1_1572_hypothetical_protein	AF-Q9W1I9-F1-model_v4	DESULFOASV1_1572_hypothetical_protein	AF-Q9W1I9-F1-model_v4 Inactive peptidyl-prolyl cis-trans isomerase shutdown	0.146	156	130	72	224	197	352	7.989E-02	83
DESULFOASV1_1572_hypothetical_protein	AF-Q4R7Z9-F1-model_v4	DESULFOASV1_1572_hypothetical_protein	AF-Q4R7Z9-F1-model_v4 Intraflagellar transport protein 56	0.111	140	122	83	222	373	510	3.964E-01	83
DESULFOASV1_1572_hypothetical_protein	AF-A8MYJ7-F1-model_v4	DESULFOASV1_1572_hypothetical_protein	AF-A8MYJ7-F1-model_v4 Tetratricopeptide repeat protein 34	0.134	173	139	65	225	390	562	2.561E-01	83
DESULFOASV1_1572_hypothetical_protein	AF-Q2QLA6-F1-model_v4	DESULFOASV1_1572_hypothetical_protein	AF-Q2QLA6-F1-model_v4 Suppressor of tumorigenicity 7 protein	0.120	196	136	67	222	185	380	2.214E-01	83
DESULFOASV1_1572_hypothetical_protein	AF-Q09YK8-F1-model_v4	DESULFOASV1_1572_hypothetical_protein	AF-Q09YK8-F1-model_v4 Suppressor of tumorigenicity 7 protein	0.129	175	116	65	198	183	357	1.914E-01	83
DESULFOASV1_1572_hypothetical_protein	AF-Q9P3X9-F1-model_v4	DESULFOASV1_1572_hypothetical_protein	AF-Q9P3X9-F1-model_v4 41 kDa peptidyl-prolyl cis-trans isomerase	0.070	145	127	85	222	215	359	4.586E-01	82
DESULFOASV1_1572_hypothetical_protein	AF-Q2HBQ2-F1-model_v4	DESULFOASV1_1572_hypothetical_protein	AF-Q2HBQ2-F1-model_v4 Eukaryotic translation initiation factor 3 subunit E	0.137	176	141	59	222	101	276	9.701E-02	82
DESULFOASV1_1572_hypothetical_protein	AF-Q9NRC1-F1-model_v4	DESULFOASV1_1572_hypothetical_protein	AF-Q9NRC1-F1-model_v4 Suppressor of tumorigenicity 7 protein	0.125	173	115	67	198	185	357	2.009E-01	82
DESULFOASV1_1572_hypothetical_protein	AF-A0M8T1-F1-model_v4	DESULFOASV1_1572_hypothetical_protein	AF-A0M8T1-F1-model_v4 Suppressor of tumorigenicity 7 protein	0.120	196	136	67	222	185	380	2.440E-01	82
DESULFOASV1_1572_hypothetical_protein	AF-Q2QLE8-F1-model_v4	DESULFOASV1_1572_hypothetical_protein	AF-Q2QLE8-F1-model_v4 Suppressor of tumorigenicity 7 protein	0.125	173	115	67	198	185	357	1.914E-01	82
DESULFOASV1_1572_hypothetical_protein	AF-Q07DV5-F1-model_v4	DESULFOASV1_1572_hypothetical_protein	AF-Q07DV5-F1-model_v4 Suppressor of tumorigenicity 7 protein	0.120	196	136	67	222	185	380	2.324E-01	82
DESULFOASV1_1572_hypothetical_protein	AF-D0M814-F1-model_v4	DESULFOASV1_1572_hypothetical_protein	AF-D0M814-F1-model_v4 Penicillin-binding protein activator LpoA	0.156	144	121	75	218	37	180	6.762E-01	82
DESULFOASV1_1572_hypothetical_protein	AF-C6CMD7-F1-model_v4	DESULFOASV1_1572_hypothetical_protein	AF-C6CMD7-F1-model_v4 Penicillin-binding protein activator LpoA	0.156	147	122	72	218	37	182	4.369E-01	82
DESULFOASV1_1572_hypothetical_protein	AF-Q6FUJ7-F1-model_v4	DESULFOASV1_1572_hypothetical_protein	AF-Q6FUJ7-F1-model_v4 Pre-mRNA-splicing factor SYF1	0.130	198	146	53	221	580	777	8.803E-02	82
DESULFOASV1_1572_hypothetical_protein	AF-Q96AE7-F1-model_v4	DESULFOASV1_1572_hypothetical_protein	AF-Q96AE7-F1-model_v4 Tetratricopeptide repeat protein 17	0.145	188	131	71	224	159	346	5.970E-02	82
DESULFOASV1_1572_hypothetical_protein	AF-E9PVB5-F1-model_v4	DESULFOASV1_1572_hypothetical_protein	AF-E9PVB5-F1-model_v4 Tetratricopeptide repeat protein 17	0.145	188	131	71	224	159	346	4.462E-02	82
DESULFOASV1_1572_hypothetical_protein	AF-Q8VBW8-F1-model_v4	DESULFOASV1_1572_hypothetical_protein	AF-Q8VBW8-F1-model_v4 Tetratricopeptide repeat protein 36	0.161	127	103	101	224	48	174	5.305E-01	81
DESULFOASV1_1572_hypothetical_protein	AF-Q99M96-F1-model_v4	DESULFOASV1_1572_hypothetical_protein	AF-Q99M96-F1-model_v4 Suppressor of tumorigenicity 7 protein	0.125	173	115	67	198	185	357	2.214E-01	81
DESULFOASV1_1572_hypothetical_protein	AF-A0M8S0-F1-model_v4	DESULFOASV1_1572_hypothetical_protein	AF-A0M8S0-F1-model_v4 Suppressor of tumorigenicity 7 protein	0.125	173	115	67	198	185	357	2.324E-01	81
DESULFOASV1_1572_hypothetical_protein	AF-Q2QLB7-F1-model_v4	DESULFOASV1_1572_hypothetical_protein	AF-Q2QLB7-F1-model_v4 Suppressor of tumorigenicity 7 protein	0.125	173	115	67	198	185	357	2.214E-01	81
DESULFOASV1_1572_hypothetical_protein	AF-Q9Z6X3-F1-model_v4	DESULFOASV1_1572_hypothetical_protein	AF-Q9Z6X3-F1-model_v4 Thioredoxin-related protein DsbJ	0.132	172	134	66	220	175	346	9.241E-02	80
DESULFOASV1_1572_hypothetical_protein	AF-A8WQY8-F1-model_v4	DESULFOASV1_1572_hypothetical_protein	AF-A8WQY8-F1-model_v4 COP9/Signalosome and eIF3 complex-shared subunit 1	0.150	159	116	84	221	110	268	3.777E-01	80
DESULFOASV1_1572_hypothetical_protein	AF-Q5RBI3-F1-model_v4	DESULFOASV1_1572_hypothetical_protein	AF-Q5RBI3-F1-model_v4 26S proteasome non-ATPase regulatory subunit 12	0.125	177	141	62	223	21	197	1.363E-01	80
DESULFOASV1_1572_hypothetical_protein	AF-Q07DY8-F1-model_v4	DESULFOASV1_1572_hypothetical_protein	AF-Q07DY8-F1-model_v4 Suppressor of tumorigenicity 7 protein	0.125	173	115	67	198	185	357	2.440E-01	80
DESULFOASV1_1572_hypothetical_protein	AF-Q108U3-F1-model_v4	DESULFOASV1_1572_hypothetical_protein	AF-Q108U3-F1-model_v4 Suppressor of tumorigenicity 7 protein	0.125	173	115	67	198	185	357	2.561E-01	80
DESULFOASV1_1572_hypothetical_protein	AF-Q6CE38-F1-model_v4	DESULFOASV1_1572_hypothetical_protein	AF-Q6CE38-F1-model_v4 Clustered mitochondria protein homolog	0.111	221	142	62	222	896	1116	2.214E-01	80
DESULFOASV1_1572_hypothetical_protein	AF-Q0JBY9-F1-model_v4	DESULFOASV1_1572_hypothetical_protein	AF-Q0JBY9-F1-model_v4 Trafficking protein particle complex II-specific subunit 120 homolog	0.148	174	134	64	221	314	487	2.616E-02	80
DESULFOASV1_1572_hypothetical_protein	AF-P71002-F1-model_v4	DESULFOASV1_1572_hypothetical_protein	AF-P71002-F1-model_v4 Response regulator aspartate phosphatase F	0.112	177	142	64	224	153	329	3.598E-01	79
DESULFOASV1_1572_hypothetical_protein	AF-Q7S519-F1-model_v4	DESULFOASV1_1572_hypothetical_protein	AF-Q7S519-F1-model_v4 Eukaryotic translation initiation factor 3 subunit E	0.156	186	143	52	222	87	272	1.237E-01	79
DESULFOASV1_1572_hypothetical_protein	AF-Q8C437-F1-model_v4	DESULFOASV1_1572_hypothetical_protein	AF-Q8C437-F1-model_v4 PEX5-related protein	0.118	275	189	1	215	181	455	6.906E-02	79
DESULFOASV1_1572_hypothetical_protein	AF-Q2QL86-F1-model_v4	DESULFOASV1_1572_hypothetical_protein	AF-Q2QL86-F1-model_v4 Suppressor of tumorigenicity 7 protein	0.125	211	141	61	222	170	380	1.655E-01	79
DESULFOASV1_1572_hypothetical_protein	AF-Q54XP4-F1-model_v4	DESULFOASV1_1572_hypothetical_protein	AF-Q54XP4-F1-model_v4 Crooked neck-like protein 1	0.129	207	178	16	222	133	337	1.237E-01	79
DESULFOASV1_1572_hypothetical_protein	AF-Q9Y2L5-F1-model_v4	DESULFOASV1_1572_hypothetical_protein	AF-Q9Y2L5-F1-model_v4 Trafficking protein particle complex subunit 8	0.117	205	146	59	224	451	655	1.655E-01	79
DESULFOASV1_1572_hypothetical_protein	AF-Q2M021-F1-model_v4	DESULFOASV1_1572_hypothetical_protein	AF-Q2M021-F1-model_v4 Tetratricopeptide repeat protein 36 homolog	0.156	141	107	95	222	44	184	2.561E-01	78
DESULFOASV1_1572_hypothetical_protein	AF-O29414-F1-model_v4	DESULFOASV1_1572_hypothetical_protein	AF-O29414-F1-model_v4 Uncharacterized protein AF_0844	0.167	179	137	60	225	115	293	1.823E-01	78
DESULFOASV1_1572_hypothetical_protein	AF-Q52963-F1-model_v4	DESULFOASV1_1572_hypothetical_protein	AF-Q52963-F1-model_v4 Chemotaxis protein MotC	0.198	120	94	68	185	224	343	3.598E-01	78
DESULFOASV1_1572_hypothetical_protein	AF-Q2KJ25-F1-model_v4	DESULFOASV1_1572_hypothetical_protein	AF-Q2KJ25-F1-model_v4 26S proteasome non-ATPase regulatory subunit 12	0.102	199	142	60	218	75	273	1.576E-01	78
DESULFOASV1_1572_hypothetical_protein	AF-Q07E45-F1-model_v4	DESULFOASV1_1572_hypothetical_protein	AF-Q07E45-F1-model_v4 Suppressor of tumorigenicity 7 protein	0.125	173	115	67	198	185	357	2.963E-01	78
DESULFOASV1_1572_hypothetical_protein	AF-Q07DX8-F1-model_v4	DESULFOASV1_1572_hypothetical_protein	AF-Q07DX8-F1-model_v4 Suppressor of tumorigenicity 7 protein	0.129	175	116	65	198	183	357	2.963E-01	78
DESULFOASV1_1572_hypothetical_protein	AF-A7FDZ0-F1-model_v4	DESULFOASV1_1572_hypothetical_protein	AF-A7FDZ0-F1-model_v4 Penicillin-binding protein activator LpoA	0.122	143	124	76	218	39	180	4.369E-01	78
DESULFOASV1_1572_hypothetical_protein	AF-Q96HA7-F1-model_v4	DESULFOASV1_1572_hypothetical_protein	AF-Q96HA7-F1-model_v4 Tonsoku-like protein	0.163	177	132	61	219	284	460	1.018E-01	78
DESULFOASV1_1572_hypothetical_protein	AF-Q00558-F1-model_v4	DESULFOASV1_1572_hypothetical_protein	AF-Q00558-F1-model_v4 40-kDa huntingtin-associated protein	0.145	201	124	61	206	19	219	6.579E-02	77
DESULFOASV1_1572_hypothetical_protein	AF-Q2IBE0-F1-model_v4	DESULFOASV1_1572_hypothetical_protein	AF-Q2IBE0-F1-model_v4 Suppressor of tumorigenicity 7 protein	0.125	173	115	67	198	185	357	3.265E-01	77
DESULFOASV1_1572_hypothetical_protein	AF-P40509-F1-model_v4	DESULFOASV1_1572_hypothetical_protein	AF-P40509-F1-model_v4 Coatomer subunit epsilon	0.119	161	141	64	224	55	215	3.598E-01	76
DESULFOASV1_1572_hypothetical_protein	AF-Q09YN2-F1-model_v4	DESULFOASV1_1572_hypothetical_protein	AF-Q09YN2-F1-model_v4 Suppressor of tumorigenicity 7 protein	0.131	188	119	61	198	170	357	1.737E-01	76
DESULFOASV1_1572_hypothetical_protein	AF-Q7MG94-F1-model_v4	DESULFOASV1_1572_hypothetical_protein	AF-Q7MG94-F1-model_v4 HTH-type transcriptional regulator MalT	0.162	144	115	64	201	576	719	1.430E-01	75
