query	target	qheader	theader	fident	alnlen	mismatch	qstart	qend	tstart	tend	evalue	bits
DESULFOASV1_3283_hypothetical_protein	AF-P34750-F1-model_v4	DESULFOASV1_3283_hypothetical_protein	AF-P34750-F1-model_v4 Fimbrial assembly protein PilQ	0.214	110	83	192	301	18	123	2.227E-07	297
DESULFOASV1_3283_hypothetical_protein	AF-P35819-F1-model_v4	DESULFOASV1_3283_hypothetical_protein	AF-P35819-F1-model_v4 Type IV pilus biogenesis and competence protein PilQ	0.144	102	86	201	302	25	125	4.693E-06	250
DESULFOASV1_3283_hypothetical_protein	AF-Q9JVW4-F1-model_v4	DESULFOASV1_3283_hypothetical_protein	AF-Q9JVW4-F1-model_v4 Type IV pilus biogenesis and competence protein PilQ	0.156	113	93	190	302	15	125	4.440E-06	240
DESULFOASV1_3283_hypothetical_protein	AF-Q5FAD2-F1-model_v4	DESULFOASV1_3283_hypothetical_protein	AF-Q5FAD2-F1-model_v4 Type IV pilus biogenesis and competence protein PilQ	0.147	113	93	190	302	16	125	3.760E-06	238
DESULFOASV1_3283_hypothetical_protein	AF-Q9ZHF3-F1-model_v4	DESULFOASV1_3283_hypothetical_protein	AF-Q9ZHF3-F1-model_v4 Type IV pilus biogenesis and competence protein PilQ	0.146	114	94	189	302	15	125	8.635E-06	225
DESULFOASV1_3283_hypothetical_protein	AF-Q7A656-F1-model_v4	DESULFOASV1_3283_hypothetical_protein	AF-Q7A656-F1-model_v4 Iron-regulated surface determinant protein B	0.133	240	195	76	301	16	255	1.332E-01	42
DESULFOASV1_3283_hypothetical_protein	AF-Q1XG89-F1-model_v4	DESULFOASV1_3283_hypothetical_protein	AF-Q1XG89-F1-model_v4 Putative ATP-dependent RNA helicase TDRD12	0.114	212	180	74	285	1496	1699	5.190E-02	42
DESULFOASV1_3283_hypothetical_protein	AF-Q9LXG8-F1-model_v4	DESULFOASV1_3283_hypothetical_protein	AF-Q9LXG8-F1-model_v4 Probable WRKY transcription factor 72	0.124	287	243	8	285	1	287	5.486E-02	33
DESULFOASV1_3283_hypothetical_protein	AF-Q8NCU7-F1-model_v4	DESULFOASV1_3283_hypothetical_protein	AF-Q8NCU7-F1-model_v4 C2 calcium-dependent domain-containing protein 4A	0.154	276	217	4	279	70	327	3.416E-01	29
DESULFOASV1_3283_hypothetical_protein	AF-Q5T7P8-F1-model_v4	DESULFOASV1_3283_hypothetical_protein	AF-Q5T7P8-F1-model_v4 Synaptotagmin-6	0.113	304	210	44	281	50	353	4.507E-01	29
DESULFOASV1_3283_hypothetical_protein	AF-Q9SUB1-F1-model_v4	DESULFOASV1_3283_hypothetical_protein	AF-Q9SUB1-F1-model_v4 Dof zinc finger protein DOF4.2	0.096	180	156	1	180	21	194	3.136E+00	28
DESULFOASV1_3283_hypothetical_protein	AF-B0KPX4-F1-model_v4	DESULFOASV1_3283_hypothetical_protein	AF-B0KPX4-F1-model_v4 Cell division protein ZipA	0.144	237	201	44	280	1	236	5.946E-01	28
DESULFOASV1_3283_hypothetical_protein	AF-Q6NTE8-F1-model_v4	DESULFOASV1_3283_hypothetical_protein	AF-Q6NTE8-F1-model_v4 MRN complex-interacting protein	0.138	212	163	1	212	10	199	1.904E+00	28
DESULFOASV1_3283_hypothetical_protein	AF-Q8BV49-F1-model_v4	DESULFOASV1_3283_hypothetical_protein	AF-Q8BV49-F1-model_v4 Pyrin and HIN domain-containing protein 1	0.159	224	174	46	253	72	295	1.704E+00	28
DESULFOASV1_3283_hypothetical_protein	AF-Q09501-F1-model_v4	DESULFOASV1_3283_hypothetical_protein	AF-Q09501-F1-model_v4 Intermediate filament protein ifp-1	0.126	234	196	77	301	528	761	5.626E-01	28
DESULFOASV1_3283_hypothetical_protein	AF-Q8IVE0-F1-model_v4	DESULFOASV1_3283_hypothetical_protein	AF-Q8IVE0-F1-model_v4 Putative ciliary rootlet coiled-coil protein-like 2 protein	0.121	136	116	48	180	152	287	8.045E+00	27
DESULFOASV1_3283_hypothetical_protein	AF-Q9D1F5-F1-model_v4	DESULFOASV1_3283_hypothetical_protein	AF-Q9D1F5-F1-model_v4 MRN complex-interacting protein	0.154	212	179	1	212	10	221	2.967E+00	27
DESULFOASV1_3283_hypothetical_protein	AF-Q925B5-F1-model_v4	DESULFOASV1_3283_hypothetical_protein	AF-Q925B5-F1-model_v4 Synaptotagmin-13	0.115	256	190	44	299	12	227	6.644E-01	27
DESULFOASV1_3283_hypothetical_protein	AF-Q99062-F1-model_v4	DESULFOASV1_3283_hypothetical_protein	AF-Q99062-F1-model_v4 Granulocyte colony-stimulating factor receptor	0.125	166	134	28	181	599	764	6.098E+00	26
DESULFOASV1_3283_hypothetical_protein	AF-B4KYX8-F1-model_v4	DESULFOASV1_3283_hypothetical_protein	AF-B4KYX8-F1-model_v4 Serine/threonine-protein kinase PLK4	0.101	204	182	77	280	286	489	1.366E+00	25
DESULFOASV1_3283_hypothetical_protein	AF-Q07292-F1-model_v4	DESULFOASV1_3283_hypothetical_protein	AF-Q07292-F1-model_v4 Raf homolog serine/threonine-protein kinase	0.091	279	242	1	279	288	554	1.443E+00	25
DESULFOASV1_3283_hypothetical_protein	AF-P26968-F1-model_v4	DESULFOASV1_3283_hypothetical_protein	AF-P26968-F1-model_v4 Adult-specific cuticular protein ACP-22	0.079	207	175	76	282	9	199	2.655E+00	24
DESULFOASV1_3283_hypothetical_protein	AF-B8GX61-F1-model_v4	DESULFOASV1_3283_hypothetical_protein	AF-B8GX61-F1-model_v4 Cell division protein FtsN	0.191	238	178	1	221	1	238	2.127E+00	24
DESULFOASV1_3283_hypothetical_protein	AF-Q9BEG5-F1-model_v4	DESULFOASV1_3283_hypothetical_protein	AF-Q9BEG5-F1-model_v4 Ectodysplasin-A	0.098	363	272	1	302	22	384	8.292E-01	24
DESULFOASV1_3283_hypothetical_protein	AF-P01125-F1-model_v4	DESULFOASV1_3283_hypothetical_protein	AF-P01125-F1-model_v4 Proto-oncogene c-Rel	0.187	173	131	28	189	257	429	6.098E+00	24
DESULFOASV1_3283_hypothetical_protein	AF-Q80WQ8-F1-model_v4	DESULFOASV1_3283_hypothetical_protein	AF-Q80WQ8-F1-model_v4 Mis18-binding protein 1	0.114	251	195	1	251	172	392	7.845E-01	24
DESULFOASV1_3283_hypothetical_protein	AF-Q84ND9-F1-model_v4	DESULFOASV1_3283_hypothetical_protein	AF-Q84ND9-F1-model_v4 DNA polymerase I B, chloroplastic/mitochondrial	0.067	246	202	1	217	51	296	1.443E+00	24
DESULFOASV1_3283_hypothetical_protein	AF-Q6S592-F1-model_v4	DESULFOASV1_3283_hypothetical_protein	AF-Q6S592-F1-model_v4 Zinc finger protein JAGGED-like	0.151	182	143	1	182	31	199	5.769E+00	23
DESULFOASV1_3283_hypothetical_protein	AF-Q9KTD2-F1-model_v4	DESULFOASV1_3283_hypothetical_protein	AF-Q9KTD2-F1-model_v4 Cell division protein ZipA	0.111	229	202	49	277	3	230	2.512E+00	23
DESULFOASV1_3283_hypothetical_protein	AF-Q88F24-F1-model_v4	DESULFOASV1_3283_hypothetical_protein	AF-Q88F24-F1-model_v4 Cell division protein ZipA	0.150	234	198	47	280	4	237	1.526E+00	23
DESULFOASV1_3283_hypothetical_protein	AF-A5W0T9-F1-model_v4	DESULFOASV1_3283_hypothetical_protein	AF-A5W0T9-F1-model_v4 Cell division protein ZipA	0.150	234	198	47	280	4	237	1.366E+00	23
DESULFOASV1_3283_hypothetical_protein	AF-B5RUL6-F1-model_v4	DESULFOASV1_3283_hypothetical_protein	AF-B5RUL6-F1-model_v4 Mitochondrial distribution and morphology protein 12	0.139	233	187	68	300	76	293	7.422E-01	23
DESULFOASV1_3283_hypothetical_protein	AF-Q54L83-F1-model_v4	DESULFOASV1_3283_hypothetical_protein	AF-Q54L83-F1-model_v4 GATA zinc finger domain-containing protein 13	0.160	173	138	48	212	172	344	8.045E+00	23
DESULFOASV1_3283_hypothetical_protein	AF-Q61727-F1-model_v4	DESULFOASV1_3283_hypothetical_protein	AF-Q61727-F1-model_v4 Interleukin-10 receptor subunit alpha	0.121	192	162	28	212	206	397	4.137E+00	23
DESULFOASV1_3283_hypothetical_protein	AF-Q460M5-F1-model_v4	DESULFOASV1_3283_hypothetical_protein	AF-Q460M5-F1-model_v4 Leucine-rich repeat and fibronectin type-III domain-containing protein 2	0.156	174	141	28	195	492	665	4.885E+00	23
DESULFOASV1_3283_hypothetical_protein	AF-Q8IVU1-F1-model_v4	DESULFOASV1_3283_hypothetical_protein	AF-Q8IVU1-F1-model_v4 Immunoglobulin superfamily DCC subclass member 3	0.171	183	128	28	182	593	775	5.458E+00	23
DESULFOASV1_3283_hypothetical_protein	AF-O14232-F1-model_v4	DESULFOASV1_3283_hypothetical_protein	AF-O14232-F1-model_v4 ATP-dependent RNA helicase mtr4	0.109	166	130	77	242	23	169	4.622E+00	23
DESULFOASV1_3283_hypothetical_protein	AF-C3LTL8-F1-model_v4	DESULFOASV1_3283_hypothetical_protein	AF-C3LTL8-F1-model_v4 Cell division protein ZipA	0.117	229	200	49	277	3	230	5.164E+00	22
DESULFOASV1_3283_hypothetical_protein	AF-A5F2W2-F1-model_v4	DESULFOASV1_3283_hypothetical_protein	AF-A5F2W2-F1-model_v4 Cell division protein ZipA	0.112	229	202	49	277	3	230	2.013E+00	22
DESULFOASV1_3283_hypothetical_protein	AF-Q54Q72-F1-model_v4	DESULFOASV1_3283_hypothetical_protein	AF-Q54Q72-F1-model_v4 PH domain-containing rcdII	0.074	252	210	49	276	192	443	3.136E+00	22
DESULFOASV1_3283_hypothetical_protein	AF-F1LNI5-F1-model_v4	DESULFOASV1_3283_hypothetical_protein	AF-F1LNI5-F1-model_v4 Protein phosphatase 1G	0.148	166	138	75	237	191	356	6.098E+00	22
DESULFOASV1_3283_hypothetical_protein	AF-Q9U405-F1-model_v4	DESULFOASV1_3283_hypothetical_protein	AF-Q9U405-F1-model_v4 Transcription factor grauzone	0.127	222	169	2	196	3	224	8.504E+00	21
DESULFOASV1_3283_hypothetical_protein	AF-P38121-F1-model_v4	DESULFOASV1_3283_hypothetical_protein	AF-P38121-F1-model_v4 DNA polymerase alpha subunit B	0.105	169	140	44	212	54	210	8.988E+00	21
DESULFOASV1_3283_hypothetical_protein	AF-Q80TG9-F1-model_v4	DESULFOASV1_3283_hypothetical_protein	AF-Q80TG9-F1-model_v4 Leucine-rich repeat and fibronectin type-III domain-containing protein 2	0.151	201	156	28	212	492	692	3.315E+00	21
DESULFOASV1_3283_hypothetical_protein	AF-Q9ZV33-F1-model_v4	DESULFOASV1_3283_hypothetical_protein	AF-Q9ZV33-F1-model_v4 Dof zinc finger protein DOF2.2	0.107	212	173	1	212	94	288	8.988E+00	20
DESULFOASV1_3283_hypothetical_protein	AF-Q54KJ1-F1-model_v4	DESULFOASV1_3283_hypothetical_protein	AF-Q54KJ1-F1-model_v4 Uncharacterized protein DDB_G0287317	0.095	208	185	78	282	81	288	4.373E+00	20
DESULFOASV1_3283_hypothetical_protein	AF-Q6L3A5-F1-model_v4	DESULFOASV1_3283_hypothetical_protein	AF-Q6L3A5-F1-model_v4 DNA-directed RNA polymerase subunit beta''	0.093	319	247	29	301	615	933	2.655E+00	20
DESULFOASV1_3283_hypothetical_protein	AF-Q22366-F1-model_v4	DESULFOASV1_3283_hypothetical_protein	AF-Q22366-F1-model_v4 Rab-3-interacting molecule unc-10	0.121	280	184	78	287	1272	1551	3.315E+00	20
DESULFOASV1_3283_hypothetical_protein	AF-Q08DK1-F1-model_v4	DESULFOASV1_3283_hypothetical_protein	AF-Q08DK1-F1-model_v4 Immunoglobulin superfamily member 11	0.128	196	145	28	194	214	409	8.045E+00	19
DESULFOASV1_3283_hypothetical_protein	AF-Q9SI37-F1-model_v4	DESULFOASV1_3283_hypothetical_protein	AF-Q9SI37-F1-model_v4 WRKY transcription factor 1	0.101	295	260	1	295	83	372	1.904E+00	19
DESULFOASV1_3283_hypothetical_protein	AF-Q86I32-F1-model_v4	DESULFOASV1_3283_hypothetical_protein	AF-Q86I32-F1-model_v4 Uncharacterized protein DDB_G0275275	0.131	205	155	8	212	1	179	8.045E+00	19
DESULFOASV1_3283_hypothetical_protein	AF-O80942-F1-model_v4	DESULFOASV1_3283_hypothetical_protein	AF-O80942-F1-model_v4 Zinc finger protein 10	0.123	213	183	3	212	10	222	8.504E+00	18
DESULFOASV1_3283_hypothetical_protein	AF-Q54WR5-F1-model_v4	DESULFOASV1_3283_hypothetical_protein	AF-Q54WR5-F1-model_v4 Splicing factor YJU2	0.076	272	165	2	181	42	313	5.458E+00	18
DESULFOASV1_3283_hypothetical_protein	AF-Q8IYJ3-F1-model_v4	DESULFOASV1_3283_hypothetical_protein	AF-Q8IYJ3-F1-model_v4 Synaptotagmin-like protein 1	0.167	285	201	61	302	102	386	2.807E+00	18
DESULFOASV1_3283_hypothetical_protein	AF-Q9C098-F1-model_v4	DESULFOASV1_3283_hypothetical_protein	AF-Q9C098-F1-model_v4 Serine/threonine-protein kinase DCLK3	0.115	226	180	76	279	207	432	4.622E+00	18
DESULFOASV1_3283_hypothetical_protein	AF-Q6GP15-F1-model_v4	DESULFOASV1_3283_hypothetical_protein	AF-Q6GP15-F1-model_v4 Mediator of RNA polymerase II transcription subunit 25	0.118	312	244	1	278	234	545	4.622E+00	18
DESULFOASV1_3283_hypothetical_protein	AF-Q2GGQ8-F1-model_v4	DESULFOASV1_3283_hypothetical_protein	AF-Q2GGQ8-F1-model_v4 Translation initiation factor IF-2	0.117	212	181	1	212	42	247	9.500E+00	18
DESULFOASV1_3283_hypothetical_protein	AF-Q6P4T1-F1-model_v4	DESULFOASV1_3283_hypothetical_protein	AF-Q6P4T1-F1-model_v4 Sorting nexin-19	0.118	241	206	1	241	348	581	2.512E+00	18
DESULFOASV1_3283_hypothetical_protein	AF-O75132-F1-model_v4	DESULFOASV1_3283_hypothetical_protein	AF-O75132-F1-model_v4 Zinc finger BED domain-containing protein 4	0.146	174	143	8	181	273	440	6.813E+00	18
DESULFOASV1_3283_hypothetical_protein	AF-B2TWZ6-F1-model_v4	DESULFOASV1_3283_hypothetical_protein	AF-B2TWZ6-F1-model_v4 Cell division protein ZipA	0.183	269	186	50	278	2	270	4.137E+00	17
DESULFOASV1_3283_hypothetical_protein	AF-O13736-F1-model_v4	DESULFOASV1_3283_hypothetical_protein	AF-O13736-F1-model_v4 Actin cytoskeleton-regulatory complex protein sla1	0.103	208	181	76	283	221	423	8.504E+00	17
DESULFOASV1_3283_hypothetical_protein	AF-Q8X492-F1-model_v4	DESULFOASV1_3283_hypothetical_protein	AF-Q8X492-F1-model_v4 Cell division protein ZipA	0.177	275	193	50	284	2	276	4.137E+00	16
DESULFOASV1_3283_hypothetical_protein	AF-P0A2N6-F1-model_v4	DESULFOASV1_3283_hypothetical_protein	AF-P0A2N6-F1-model_v4 Cell division protein ZipA	0.183	276	192	50	285	2	277	8.988E+00	16
DESULFOASV1_3283_hypothetical_protein	AF-Q1KMD3-F1-model_v4	DESULFOASV1_3283_hypothetical_protein	AF-Q1KMD3-F1-model_v4 Heterogeneous nuclear ribonucleoprotein U-like protein 2	0.085	363	270	6	301	51	413	6.446E+00	16
DESULFOASV1_3283_hypothetical_protein	AF-Q8VHP6-F1-model_v4	DESULFOASV1_3283_hypothetical_protein	AF-Q8VHP6-F1-model_v4 Cadherin-related family member 1	0.176	203	164	12	211	632	834	8.504E+00	16
DESULFOASV1_3283_hypothetical_protein	AF-Q5RJH2-F1-model_v4	DESULFOASV1_3283_hypothetical_protein	AF-Q5RJH2-F1-model_v4 Multiple C2 and transmembrane domain-containing protein 2	0.113	303	212	62	301	8	310	8.045E+00	16
DESULFOASV1_3283_hypothetical_protein	AF-Q96T37-F1-model_v4	DESULFOASV1_3283_hypothetical_protein	AF-Q96T37-F1-model_v4 RNA-binding protein 15	0.125	309	180	78	284	650	958	6.098E+00	16
DESULFOASV1_3283_hypothetical_protein	AF-P08575-F1-model_v4	DESULFOASV1_3283_hypothetical_protein	AF-P08575-F1-model_v4 Receptor-type tyrosine-protein phosphatase C	0.112	287	200	77	302	97	383	9.500E+00	16
DESULFOASV1_3283_hypothetical_protein	AF-Q9JIR4-F1-model_v4	DESULFOASV1_3283_hypothetical_protein	AF-Q9JIR4-F1-model_v4 Regulating synaptic membrane exocytosis protein 1	0.109	383	261	1	294	338	720	6.098E+00	16
DESULFOASV1_3283_hypothetical_protein	AF-Q6CA06-F1-model_v4	DESULFOASV1_3283_hypothetical_protein	AF-Q6CA06-F1-model_v4 Maintenance of mitochondrial morphology protein 1-2	0.098	349	223	44	291	16	364	8.504E+00	15
DESULFOASV1_3283_hypothetical_protein	AF-Q17RD7-F1-model_v4	DESULFOASV1_3283_hypothetical_protein	AF-Q17RD7-F1-model_v4 Synaptotagmin-16	0.107	272	233	8	279	160	421	7.611E+00	15
DESULFOASV1_3283_hypothetical_protein	AF-Q92543-F1-model_v4	DESULFOASV1_3283_hypothetical_protein	AF-Q92543-F1-model_v4 Sorting nexin-19	0.129	241	202	1	241	344	576	2.967E+00	15
DESULFOASV1_3283_hypothetical_protein	AF-Q23256-F1-model_v4	DESULFOASV1_3283_hypothetical_protein	AF-Q23256-F1-model_v4 WD repeat-containing protein wdr-5.3	0.111	281	204	12	241	1	281	8.988E+00	14
DESULFOASV1_3283_hypothetical_protein	AF-F4I8I0-F1-model_v4	DESULFOASV1_3283_hypothetical_protein	AF-F4I8I0-F1-model_v4 SUN domain-containing protein 4	0.111	297	230	42	301	24	320	6.446E+00	14
DESULFOASV1_3283_hypothetical_protein	AF-Q9QXJ1-F1-model_v4	DESULFOASV1_3283_hypothetical_protein	AF-Q9QXJ1-F1-model_v4 Amyloid-beta A4 precursor protein-binding family B member 1	0.097	282	237	1	282	224	486	7.201E+00	14
DESULFOASV1_3283_hypothetical_protein	AF-A4IHD9-F1-model_v4	DESULFOASV1_3283_hypothetical_protein	AF-A4IHD9-F1-model_v4 Mediator of RNA polymerase II transcription subunit 25	0.115	317	248	1	281	235	551	5.164E+00	14
DESULFOASV1_3283_hypothetical_protein	AF-Q89AF5-F1-model_v4	DESULFOASV1_3283_hypothetical_protein	AF-Q89AF5-F1-model_v4 Translation initiation factor IF-2	0.103	102	74	201	302	787	870	6.813E+00	14
