query	target	qheader	theader	fident	alnlen	mismatch	qstart	qend	tstart	tend	evalue	bits
DESULFOASV1_1894_YraN_family_protein	AF-Q1JHM1-F1-model_v4	DESULFOASV1_1894_YraN_family_protein	AF-Q1JHM1-F1-model_v4 ATP-dependent helicase/nuclease subunit A	0.141	93	75	25	117	1135	1222	2.217E-02	52
DESULFOASV1_1894_YraN_family_protein	AF-Q5XCW6-F1-model_v4	DESULFOASV1_1894_YraN_family_protein	AF-Q5XCW6-F1-model_v4 ATP-dependent helicase/nuclease subunit A	0.131	93	76	25	117	1135	1222	2.366E-02	52
DESULFOASV1_1894_YraN_family_protein	AF-A4VUD2-F1-model_v4	DESULFOASV1_1894_YraN_family_protein	AF-A4VUD2-F1-model_v4 ATP-dependent helicase/nuclease subunit A	0.115	102	89	16	117	1124	1225	1.708E-02	52
DESULFOASV1_1894_YraN_family_protein	AF-A0AL18-F1-model_v4	DESULFOASV1_1894_YraN_family_protein	AF-A0AL18-F1-model_v4 ATP-dependent helicase/nuclease subunit A	0.122	87	71	37	123	1154	1235	6.709E-02	52
DESULFOASV1_1894_YraN_family_protein	AF-A7FPG0-F1-model_v4	DESULFOASV1_1894_YraN_family_protein	AF-A7FPG0-F1-model_v4 ATP-dependent helicase/nuclease subunit A	0.129	77	57	38	114	1212	1277	6.286E-02	52
DESULFOASV1_1894_YraN_family_protein	AF-Q9Z7G7-F1-model_v4	DESULFOASV1_1894_YraN_family_protein	AF-Q9Z7G7-F1-model_v4 RecBCD enzyme subunit RecB	0.092	121	97	25	132	930	1050	1.823E-02	51
DESULFOASV1_1894_YraN_family_protein	AF-P15594-F1-model_v4	DESULFOASV1_1894_YraN_family_protein	AF-P15594-F1-model_v4 Retrotransposable element SLACS 132 kDa protein	0.116	113	88	1	101	1010	1122	3.419E-01	51
DESULFOASV1_1894_YraN_family_protein	AF-Q9CJI9-F1-model_v4	DESULFOASV1_1894_YraN_family_protein	AF-Q9CJI9-F1-model_v4 ATP-dependent helicase/nuclease subunit A	0.113	106	88	18	117	1096	1201	3.498E-02	51
DESULFOASV1_1894_YraN_family_protein	AF-Q1JCJ8-F1-model_v4	DESULFOASV1_1894_YraN_family_protein	AF-Q1JCJ8-F1-model_v4 ATP-dependent helicase/nuclease subunit A	0.131	93	76	25	117	1135	1222	2.695E-02	51
DESULFOASV1_1894_YraN_family_protein	AF-Q929A9-F1-model_v4	DESULFOASV1_1894_YraN_family_protein	AF-Q929A9-F1-model_v4 ATP-dependent helicase/nuclease subunit A	0.125	114	87	15	114	1115	1228	3.277E-02	51
DESULFOASV1_1894_YraN_family_protein	AF-A4WJL8-F1-model_v4	DESULFOASV1_1894_YraN_family_protein	AF-A4WJL8-F1-model_v4 Sugar fermentation stimulation protein homolog	0.111	140	94	12	118	83	222	5.890E-02	50
DESULFOASV1_1894_YraN_family_protein	AF-B0BSG6-F1-model_v4	DESULFOASV1_1894_YraN_family_protein	AF-B0BSG6-F1-model_v4 Sugar fermentation stimulation protein homolog	0.085	151	98	10	117	82	232	5.170E-02	50
DESULFOASV1_1894_YraN_family_protein	AF-P19887-F1-model_v4	DESULFOASV1_1894_YraN_family_protein	AF-P19887-F1-model_v4 Type-2 restriction enzyme BanI	0.158	105	87	5	109	213	316	3.733E-02	50
DESULFOASV1_1894_YraN_family_protein	AF-Q897P5-F1-model_v4	DESULFOASV1_1894_YraN_family_protein	AF-Q897P5-F1-model_v4 ATP-dependent helicase/deoxyribonuclease subunit B	0.101	105	73	25	106	897	1001	9.292E-02	50
DESULFOASV1_1894_YraN_family_protein	AF-A2RFA8-F1-model_v4	DESULFOASV1_1894_YraN_family_protein	AF-A2RFA8-F1-model_v4 ATP-dependent helicase/nuclease subunit A	0.131	93	76	25	117	1123	1210	3.070E-02	50
DESULFOASV1_1894_YraN_family_protein	AF-C0MGY6-F1-model_v4	DESULFOASV1_1894_YraN_family_protein	AF-C0MGY6-F1-model_v4 ATP-dependent helicase/nuclease subunit A	0.112	114	97	7	116	1098	1211	4.252E-02	50
DESULFOASV1_1894_YraN_family_protein	AF-Q03IZ8-F1-model_v4	DESULFOASV1_1894_YraN_family_protein	AF-Q03IZ8-F1-model_v4 ATP-dependent helicase/nuclease subunit A	0.129	101	87	18	118	1116	1216	3.733E-02	50
DESULFOASV1_1894_YraN_family_protein	AF-A7X0I2-F1-model_v4	DESULFOASV1_1894_YraN_family_protein	AF-A7X0I2-F1-model_v4 ATP-dependent helicase/nuclease subunit A	0.150	78	59	32	101	1132	1209	1.059E-01	50
DESULFOASV1_1894_YraN_family_protein	AF-Q6NHS6-F1-model_v4	DESULFOASV1_1894_YraN_family_protein	AF-Q6NHS6-F1-model_v4 Endonuclease NucS	0.187	85	65	13	97	110	190	1.903E-01	49
DESULFOASV1_1894_YraN_family_protein	AF-B0KCE9-F1-model_v4	DESULFOASV1_1894_YraN_family_protein	AF-B0KCE9-F1-model_v4 Sugar fermentation stimulation protein homolog	0.190	99	76	5	103	82	176	2.635E-01	49
DESULFOASV1_1894_YraN_family_protein	AF-Q3A286-F1-model_v4	DESULFOASV1_1894_YraN_family_protein	AF-Q3A286-F1-model_v4 Sugar fermentation stimulation protein homolog	0.116	141	95	10	118	82	222	2.695E-02	49
DESULFOASV1_1894_YraN_family_protein	AF-C6E6G4-F1-model_v4	DESULFOASV1_1894_YraN_family_protein	AF-C6E6G4-F1-model_v4 Sugar fermentation stimulation protein homolog	0.131	140	92	12	118	84	223	5.518E-02	49
DESULFOASV1_1894_YraN_family_protein	AF-Q4FLK0-F1-model_v4	DESULFOASV1_1894_YraN_family_protein	AF-Q4FLK0-F1-model_v4 Sugar fermentation stimulation protein homolog	0.125	143	96	7	117	85	227	5.518E-02	49
DESULFOASV1_1894_YraN_family_protein	AF-F6SDF8-F1-model_v4	DESULFOASV1_1894_YraN_family_protein	AF-F6SDF8-F1-model_v4 Mitochondrial genome maintenance exonuclease 1	0.134	82	65	38	119	244	319	1.783E-01	49
DESULFOASV1_1894_YraN_family_protein	AF-B9E0C6-F1-model_v4	DESULFOASV1_1894_YraN_family_protein	AF-B9E0C6-F1-model_v4 ATP-dependent helicase/deoxyribonuclease subunit B	0.138	106	72	21	104	892	997	8.157E-02	49
DESULFOASV1_1894_YraN_family_protein	AF-A8MJ41-F1-model_v4	DESULFOASV1_1894_YraN_family_protein	AF-A8MJ41-F1-model_v4 ATP-dependent helicase/nuclease subunit A	0.141	78	58	38	115	1129	1197	1.130E-01	49
DESULFOASV1_1894_YraN_family_protein	AF-Q5HHB7-F1-model_v4	DESULFOASV1_1894_YraN_family_protein	AF-Q5HHB7-F1-model_v4 ATP-dependent helicase/nuclease subunit A	0.169	67	53	37	101	1143	1209	1.670E-01	49
DESULFOASV1_1894_YraN_family_protein	AF-Q6GAV9-F1-model_v4	DESULFOASV1_1894_YraN_family_protein	AF-Q6GAV9-F1-model_v4 ATP-dependent helicase/nuclease subunit A	0.151	77	58	33	101	1133	1209	1.374E-01	49
DESULFOASV1_1894_YraN_family_protein	AF-Q5M2T7-F1-model_v4	DESULFOASV1_1894_YraN_family_protein	AF-Q5M2T7-F1-model_v4 ATP-dependent helicase/nuclease subunit A	0.137	101	86	18	118	1116	1216	3.277E-02	49
DESULFOASV1_1894_YraN_family_protein	AF-Q7A6H4-F1-model_v4	DESULFOASV1_1894_YraN_family_protein	AF-Q7A6H4-F1-model_v4 ATP-dependent helicase/nuclease subunit A	0.151	77	58	33	101	1133	1209	5.518E-02	49
DESULFOASV1_1894_YraN_family_protein	AF-Q8Y511-F1-model_v4	DESULFOASV1_1894_YraN_family_protein	AF-Q8Y511-F1-model_v4 ATP-dependent helicase/nuclease subunit A	0.116	121	95	15	122	1114	1234	4.539E-02	49
DESULFOASV1_1894_YraN_family_protein	AF-B8DF44-F1-model_v4	DESULFOASV1_1894_YraN_family_protein	AF-B8DF44-F1-model_v4 ATP-dependent helicase/nuclease subunit A	0.124	121	94	15	122	1114	1234	4.539E-02	49
DESULFOASV1_1894_YraN_family_protein	AF-Q8ERW5-F1-model_v4	DESULFOASV1_1894_YraN_family_protein	AF-Q8ERW5-F1-model_v4 ATP-dependent helicase/nuclease subunit A	0.086	97	81	25	114	1142	1238	3.984E-02	49
DESULFOASV1_1894_YraN_family_protein	AF-B2G531-F1-model_v4	DESULFOASV1_1894_YraN_family_protein	AF-B2G531-F1-model_v4 ATP-dependent helicase/deoxyribonuclease subunit B	0.123	70	58	37	103	1031	1100	1.059E-01	49
DESULFOASV1_1894_YraN_family_protein	AF-A1TD35-F1-model_v4	DESULFOASV1_1894_YraN_family_protein	AF-A1TD35-F1-model_v4 Endonuclease NucS	0.177	85	66	13	97	104	184	2.313E-01	48
DESULFOASV1_1894_YraN_family_protein	AF-B0K5C5-F1-model_v4	DESULFOASV1_1894_YraN_family_protein	AF-B0K5C5-F1-model_v4 Sugar fermentation stimulation protein homolog	0.102	138	94	12	117	89	226	7.161E-02	48
DESULFOASV1_1894_YraN_family_protein	AF-Q9YEX9-F1-model_v4	DESULFOASV1_1894_YraN_family_protein	AF-Q9YEX9-F1-model_v4 Sugar fermentation stimulation protein homolog	0.159	135	87	16	119	91	225	1.946E-02	48
DESULFOASV1_1894_YraN_family_protein	AF-B4U2H1-F1-model_v4	DESULFOASV1_1894_YraN_family_protein	AF-B4U2H1-F1-model_v4 ATP-dependent helicase/nuclease subunit A	0.111	114	97	7	116	1098	1211	5.518E-02	48
DESULFOASV1_1894_YraN_family_protein	AF-Q5LY80-F1-model_v4	DESULFOASV1_1894_YraN_family_protein	AF-Q5LY80-F1-model_v4 ATP-dependent helicase/nuclease subunit A	0.137	101	86	18	118	1116	1216	4.252E-02	48
DESULFOASV1_1894_YraN_family_protein	AF-Q9A0H3-F1-model_v4	DESULFOASV1_1894_YraN_family_protein	AF-Q9A0H3-F1-model_v4 ATP-dependent helicase/nuclease subunit A	0.131	93	76	25	117	1135	1222	4.539E-02	48
DESULFOASV1_1894_YraN_family_protein	AF-B5XKR4-F1-model_v4	DESULFOASV1_1894_YraN_family_protein	AF-B5XKR4-F1-model_v4 ATP-dependent helicase/nuclease subunit A	0.123	102	87	18	117	1121	1222	5.890E-02	48
DESULFOASV1_1894_YraN_family_protein	AF-Q1J7E4-F1-model_v4	DESULFOASV1_1894_YraN_family_protein	AF-Q1J7E4-F1-model_v4 ATP-dependent helicase/nuclease subunit A	0.131	93	76	25	117	1135	1222	5.170E-02	48
DESULFOASV1_1894_YraN_family_protein	AF-Q0AXU8-F1-model_v4	DESULFOASV1_1894_YraN_family_protein	AF-Q0AXU8-F1-model_v4 ATP-dependent helicase/nuclease subunit A	0.166	78	57	38	115	1168	1236	1.466E-01	48
DESULFOASV1_1894_YraN_family_protein	AF-B9DZK4-F1-model_v4	DESULFOASV1_1894_YraN_family_protein	AF-B9DZK4-F1-model_v4 ATP-dependent helicase/nuclease subunit A	0.129	77	57	38	114	1171	1236	1.206E-01	48
DESULFOASV1_1894_YraN_family_protein	AF-B7IL84-F1-model_v4	DESULFOASV1_1894_YraN_family_protein	AF-B7IL84-F1-model_v4 ATP-dependent helicase/nuclease subunit A	0.118	102	82	25	118	1139	1240	6.286E-02	48
DESULFOASV1_1894_YraN_family_protein	AF-A7GM37-F1-model_v4	DESULFOASV1_1894_YraN_family_protein	AF-A7GM37-F1-model_v4 ATP-dependent helicase/nuclease subunit A	0.140	101	77	25	115	1140	1240	4.844E-02	48
DESULFOASV1_1894_YraN_family_protein	AF-B5EG09-F1-model_v4	DESULFOASV1_1894_YraN_family_protein	AF-B5EG09-F1-model_v4 Sugar fermentation stimulation protein homolog	0.138	140	91	12	118	84	223	6.709E-02	47
DESULFOASV1_1894_YraN_family_protein	AF-A0PY66-F1-model_v4	DESULFOASV1_1894_YraN_family_protein	AF-A0PY66-F1-model_v4 ATP-dependent helicase/deoxyribonuclease subunit B	0.103	73	62	37	106	911	983	1.565E-01	47
DESULFOASV1_1894_YraN_family_protein	AF-A6QFH8-F1-model_v4	DESULFOASV1_1894_YraN_family_protein	AF-A6QFH8-F1-model_v4 ATP-dependent helicase/nuclease subunit A	0.132	79	64	37	115	1143	1217	1.466E-01	47
DESULFOASV1_1894_YraN_family_protein	AF-A5IRE5-F1-model_v4	DESULFOASV1_1894_YraN_family_protein	AF-A5IRE5-F1-model_v4 ATP-dependent helicase/nuclease subunit A	0.136	67	55	37	101	1143	1209	1.287E-01	47
DESULFOASV1_1894_YraN_family_protein	AF-Q48UB8-F1-model_v4	DESULFOASV1_1894_YraN_family_protein	AF-Q48UB8-F1-model_v4 ATP-dependent helicase/nuclease subunit A	0.131	93	76	25	117	1135	1222	5.170E-02	47
DESULFOASV1_1894_YraN_family_protein	AF-Q4L4Y3-F1-model_v4	DESULFOASV1_1894_YraN_family_protein	AF-Q4L4Y3-F1-model_v4 ATP-dependent helicase/nuclease subunit A	0.166	68	54	37	104	1147	1212	7.161E-02	47
DESULFOASV1_1894_YraN_family_protein	AF-B7HGP9-F1-model_v4	DESULFOASV1_1894_YraN_family_protein	AF-B7HGP9-F1-model_v4 ATP-dependent helicase/nuclease subunit A	0.118	102	82	25	118	1139	1240	6.709E-02	47
DESULFOASV1_1894_YraN_family_protein	AF-P25258-F1-model_v4	DESULFOASV1_1894_YraN_family_protein	AF-P25258-F1-model_v4 Type-2 restriction enzyme HgiCI	0.131	101	83	9	109	210	306	1.059E-01	46
DESULFOASV1_1894_YraN_family_protein	AF-B1IEL7-F1-model_v4	DESULFOASV1_1894_YraN_family_protein	AF-B1IEL7-F1-model_v4 ATP-dependent helicase/deoxyribonuclease subunit B	0.132	110	75	20	106	889	998	1.130E-01	46
DESULFOASV1_1894_YraN_family_protein	AF-B7HZR4-F1-model_v4	DESULFOASV1_1894_YraN_family_protein	AF-B7HZR4-F1-model_v4 ATP-dependent helicase/deoxyribonuclease subunit B	0.136	120	94	24	133	912	1031	3.277E-02	46
DESULFOASV1_1894_YraN_family_protein	AF-Q6GIC1-F1-model_v4	DESULFOASV1_1894_YraN_family_protein	AF-Q6GIC1-F1-model_v4 ATP-dependent helicase/nuclease subunit A	0.136	67	55	37	101	1143	1209	1.466E-01	46
DESULFOASV1_1894_YraN_family_protein	AF-Q2FIA8-F1-model_v4	DESULFOASV1_1894_YraN_family_protein	AF-Q2FIA8-F1-model_v4 ATP-dependent helicase/nuclease subunit A	0.136	67	55	37	101	1143	1209	1.466E-01	46
DESULFOASV1_1894_YraN_family_protein	AF-Q99VC3-F1-model_v4	DESULFOASV1_1894_YraN_family_protein	AF-Q99VC3-F1-model_v4 ATP-dependent helicase/nuclease subunit A	0.169	67	53	37	101	1143	1209	1.903E-01	46
DESULFOASV1_1894_YraN_family_protein	AF-Q8P1J2-F1-model_v4	DESULFOASV1_1894_YraN_family_protein	AF-Q8P1J2-F1-model_v4 ATP-dependent helicase/nuclease subunit A	0.131	93	76	25	117	1135	1222	6.709E-02	46
DESULFOASV1_1894_YraN_family_protein	AF-B0KDB7-F1-model_v4	DESULFOASV1_1894_YraN_family_protein	AF-B0KDB7-F1-model_v4 ATP-dependent helicase/nuclease subunit A	0.126	79	60	37	115	1164	1233	1.670E-01	46
DESULFOASV1_1894_YraN_family_protein	AF-A5N628-F1-model_v4	DESULFOASV1_1894_YraN_family_protein	AF-A5N628-F1-model_v4 ATP-dependent helicase/nuclease subunit A	0.129	77	57	38	114	1168	1233	1.670E-01	46
DESULFOASV1_1894_YraN_family_protein	AF-A0PY67-F1-model_v4	DESULFOASV1_1894_YraN_family_protein	AF-A0PY67-F1-model_v4 ATP-dependent helicase/nuclease subunit A	0.096	83	62	37	119	1166	1235	1.783E-01	46
DESULFOASV1_1894_YraN_family_protein	AF-B8I2Y2-F1-model_v4	DESULFOASV1_1894_YraN_family_protein	AF-B8I2Y2-F1-model_v4 ATP-dependent helicase/nuclease subunit A	0.129	103	78	16	118	1158	1247	7.161E-02	46
DESULFOASV1_1894_YraN_family_protein	AF-Q2YWW4-F1-model_v4	DESULFOASV1_1894_YraN_family_protein	AF-Q2YWW4-F1-model_v4 ATP-dependent helicase/nuclease subunit A	0.136	67	55	37	101	1143	1209	1.670E-01	45
DESULFOASV1_1894_YraN_family_protein	AF-P0CZ52-F1-model_v4	DESULFOASV1_1894_YraN_family_protein	AF-P0CZ52-F1-model_v4 ATP-dependent helicase/nuclease subunit A	0.123	102	87	18	117	1121	1222	1.130E-01	45
DESULFOASV1_1894_YraN_family_protein	AF-Q6HM43-F1-model_v4	DESULFOASV1_1894_YraN_family_protein	AF-Q6HM43-F1-model_v4 ATP-dependent helicase/nuclease subunit A	0.118	102	82	25	118	1139	1240	9.918E-02	45
DESULFOASV1_1894_YraN_family_protein	AF-Q8XPE2-F1-model_v4	DESULFOASV1_1894_YraN_family_protein	AF-Q8XPE2-F1-model_v4 ATP-dependent helicase/nuclease subunit A	0.145	115	84	17	115	1154	1268	1.287E-01	45
DESULFOASV1_1894_YraN_family_protein	AF-A1AUE8-F1-model_v4	DESULFOASV1_1894_YraN_family_protein	AF-A1AUE8-F1-model_v4 Sugar fermentation stimulation protein homolog	0.114	144	93	12	117	83	226	1.565E-01	44
DESULFOASV1_1894_YraN_family_protein	AF-Q21FA3-F1-model_v4	DESULFOASV1_1894_YraN_family_protein	AF-Q21FA3-F1-model_v4 Sugar fermentation stimulation protein homolog	0.121	148	94	10	117	83	230	2.167E-01	44
DESULFOASV1_1894_YraN_family_protein	AF-B7GM51-F1-model_v4	DESULFOASV1_1894_YraN_family_protein	AF-B7GM51-F1-model_v4 ATP-dependent helicase/nuclease subunit A	0.156	89	73	26	114	1118	1205	4.252E-02	44
DESULFOASV1_1894_YraN_family_protein	AF-Q71X99-F1-model_v4	DESULFOASV1_1894_YraN_family_protein	AF-Q71X99-F1-model_v4 ATP-dependent helicase/nuclease subunit A	0.125	121	95	15	123	1115	1235	6.286E-02	44
DESULFOASV1_1894_YraN_family_protein	AF-Q73C23-F1-model_v4	DESULFOASV1_1894_YraN_family_protein	AF-Q73C23-F1-model_v4 ATP-dependent helicase/nuclease subunit A	0.126	101	82	25	119	1139	1239	1.374E-01	44
DESULFOASV1_1894_YraN_family_protein	AF-B9ITE9-F1-model_v4	DESULFOASV1_1894_YraN_family_protein	AF-B9ITE9-F1-model_v4 ATP-dependent helicase/nuclease subunit A	0.132	100	77	25	114	1139	1238	1.059E-01	44
DESULFOASV1_1894_YraN_family_protein	AF-A0RAX7-F1-model_v4	DESULFOASV1_1894_YraN_family_protein	AF-A0RAX7-F1-model_v4 ATP-dependent helicase/nuclease subunit A	0.122	100	78	25	114	1139	1238	9.918E-02	44
DESULFOASV1_1894_YraN_family_protein	AF-O28724-F1-model_v4	DESULFOASV1_1894_YraN_family_protein	AF-O28724-F1-model_v4 Uncharacterized protein AF_1548	0.152	105	79	18	111	3	107	1.206E-01	43
DESULFOASV1_1894_YraN_family_protein	AF-Q7NJU8-F1-model_v4	DESULFOASV1_1894_YraN_family_protein	AF-Q7NJU8-F1-model_v4 Sugar fermentation stimulation protein homolog	0.118	137	93	14	119	94	230	5.170E-02	43
DESULFOASV1_1894_YraN_family_protein	AF-A8MJ51-F1-model_v4	DESULFOASV1_1894_YraN_family_protein	AF-A8MJ51-F1-model_v4 ATP-dependent helicase/deoxyribonuclease subunit B	0.123	69	59	37	104	924	992	1.059E-01	43
DESULFOASV1_1894_YraN_family_protein	AF-B8I2Y3-F1-model_v4	DESULFOASV1_1894_YraN_family_protein	AF-B8I2Y3-F1-model_v4 ATP-dependent helicase/deoxyribonuclease subunit B	0.100	105	73	25	106	896	1000	1.783E-01	43
DESULFOASV1_1894_YraN_family_protein	AF-B0K212-F1-model_v4	DESULFOASV1_1894_YraN_family_protein	AF-B0K212-F1-model_v4 ATP-dependent helicase/deoxyribonuclease subunit B	0.111	67	59	38	104	925	991	1.565E-01	43
DESULFOASV1_1894_YraN_family_protein	AF-A5HYX0-F1-model_v4	DESULFOASV1_1894_YraN_family_protein	AF-A5HYX0-F1-model_v4 ATP-dependent helicase/deoxyribonuclease subunit B	0.138	91	71	24	106	908	998	9.292E-02	43
DESULFOASV1_1894_YraN_family_protein	AF-A7GAI7-F1-model_v4	DESULFOASV1_1894_YraN_family_protein	AF-A7GAI7-F1-model_v4 ATP-dependent helicase/deoxyribonuclease subunit B	0.132	110	75	20	106	889	998	1.903E-01	43
DESULFOASV1_1894_YraN_family_protein	AF-A6TVN2-F1-model_v4	DESULFOASV1_1894_YraN_family_protein	AF-A6TVN2-F1-model_v4 ATP-dependent helicase/nuclease subunit A	0.153	88	69	28	115	1116	1197	1.783E-01	43
DESULFOASV1_1894_YraN_family_protein	AF-Q24PG6-F1-model_v4	DESULFOASV1_1894_YraN_family_protein	AF-Q24PG6-F1-model_v4 Sugar fermentation stimulation protein homolog	0.093	140	95	12	117	82	221	1.374E-01	42
DESULFOASV1_1894_YraN_family_protein	AF-B1YKM8-F1-model_v4	DESULFOASV1_1894_YraN_family_protein	AF-B1YKM8-F1-model_v4 ATP-dependent helicase/nuclease subunit A	0.131	111	88	17	118	1071	1181	5.890E-02	42
DESULFOASV1_1894_YraN_family_protein	AF-Q8RCZ0-F1-model_v4	DESULFOASV1_1894_YraN_family_protein	AF-Q8RCZ0-F1-model_v4 ATP-dependent helicase/nuclease subunit A	0.126	79	60	37	115	1135	1204	3.419E-01	42
DESULFOASV1_1894_YraN_family_protein	AF-B0K213-F1-model_v4	DESULFOASV1_1894_YraN_family_protein	AF-B0K213-F1-model_v4 ATP-dependent helicase/nuclease subunit A	0.126	79	60	37	115	1164	1233	3.419E-01	42
DESULFOASV1_1894_YraN_family_protein	AF-Q81TW1-F1-model_v4	DESULFOASV1_1894_YraN_family_protein	AF-Q81TW1-F1-model_v4 ATP-dependent helicase/nuclease subunit A	0.122	100	78	25	114	1139	1238	1.565E-01	42
DESULFOASV1_1894_YraN_family_protein	AF-A5VHK1-F1-model_v4	DESULFOASV1_1894_YraN_family_protein	AF-A5VHK1-F1-model_v4 ATP-dependent helicase/deoxyribonuclease subunit B	0.125	70	58	37	103	1031	1100	9.918E-02	42
DESULFOASV1_1894_YraN_family_protein	AF-Q0SWW4-F1-model_v4	DESULFOASV1_1894_YraN_family_protein	AF-Q0SWW4-F1-model_v4 ATP-dependent helicase/nuclease subunit A	0.153	115	83	17	115	1153	1267	2.167E-01	42
DESULFOASV1_1894_YraN_family_protein	AF-Q0TV46-F1-model_v4	DESULFOASV1_1894_YraN_family_protein	AF-Q0TV46-F1-model_v4 ATP-dependent helicase/nuclease subunit A	0.153	115	83	17	115	1154	1268	2.313E-01	42
DESULFOASV1_1894_YraN_family_protein	AF-O34820-F1-model_v4	DESULFOASV1_1894_YraN_family_protein	AF-O34820-F1-model_v4 SPbeta prophage-derived uncharacterized protein YotM	0.122	97	83	13	108	11	107	6.146E-01	41
DESULFOASV1_1894_YraN_family_protein	AF-B9M2P7-F1-model_v4	DESULFOASV1_1894_YraN_family_protein	AF-B9M2P7-F1-model_v4 Sugar fermentation stimulation protein homolog	0.132	134	88	16	117	93	226	5.518E-02	41
DESULFOASV1_1894_YraN_family_protein	AF-O84645-F1-model_v4	DESULFOASV1_1894_YraN_family_protein	AF-O84645-F1-model_v4 RecBCD enzyme subunit RecB	0.151	92	65	26	103	919	1010	7.643E-02	41
DESULFOASV1_1894_YraN_family_protein	AF-A8AY34-F1-model_v4	DESULFOASV1_1894_YraN_family_protein	AF-A8AY34-F1-model_v4 ATP-dependent helicase/deoxyribonuclease subunit B	0.127	108	81	10	103	839	946	6.559E-01	41
DESULFOASV1_1894_YraN_family_protein	AF-Q5HQJ4-F1-model_v4	DESULFOASV1_1894_YraN_family_protein	AF-Q5HQJ4-F1-model_v4 ATP-dependent helicase/nuclease subunit A	0.197	81	59	37	117	1142	1216	2.635E-01	41
DESULFOASV1_1894_YraN_family_protein	AF-A4IKW7-F1-model_v4	DESULFOASV1_1894_YraN_family_protein	AF-A4IKW7-F1-model_v4 ATP-dependent helicase/nuclease subunit A	0.142	104	80	25	118	1139	1242	1.287E-01	41
DESULFOASV1_1894_YraN_family_protein	AF-A3DJP1-F1-model_v4	DESULFOASV1_1894_YraN_family_protein	AF-A3DJP1-F1-model_v4 Sugar fermentation stimulation protein homolog	0.098	143	99	7	117	86	228	8.706E-02	40
DESULFOASV1_1894_YraN_family_protein	AF-B1HN89-F1-model_v4	DESULFOASV1_1894_YraN_family_protein	AF-B1HN89-F1-model_v4 ATP-dependent helicase/deoxyribonuclease subunit B	0.118	90	70	27	106	931	1020	1.783E-01	40
DESULFOASV1_1894_YraN_family_protein	AF-P45157-F1-model_v4	DESULFOASV1_1894_YraN_family_protein	AF-P45157-F1-model_v4 RecBCD enzyme subunit RecB	0.109	78	58	37	102	1104	1181	3.002E-01	40
DESULFOASV1_1894_YraN_family_protein	AF-B9DIS2-F1-model_v4	DESULFOASV1_1894_YraN_family_protein	AF-B9DIS2-F1-model_v4 ATP-dependent helicase/nuclease subunit A	0.169	67	53	37	101	1140	1206	2.635E-01	40
DESULFOASV1_1894_YraN_family_protein	AF-Q6AS42-F1-model_v4	DESULFOASV1_1894_YraN_family_protein	AF-Q6AS42-F1-model_v4 Sugar fermentation stimulation protein homolog	0.148	72	58	26	97	105	173	3.204E-01	39
DESULFOASV1_1894_YraN_family_protein	AF-Q88DX7-F1-model_v4	DESULFOASV1_1894_YraN_family_protein	AF-Q88DX7-F1-model_v4 Sugar fermentation stimulation protein homolog	0.114	146	97	10	119	83	228	3.419E-01	39
DESULFOASV1_1894_YraN_family_protein	AF-Q4ZY77-F1-model_v4	DESULFOASV1_1894_YraN_family_protein	AF-Q4ZY77-F1-model_v4 Sugar fermentation stimulation protein homolog	0.110	146	97	10	119	83	228	5.055E-01	39
DESULFOASV1_1894_YraN_family_protein	AF-A5W965-F1-model_v4	DESULFOASV1_1894_YraN_family_protein	AF-A5W965-F1-model_v4 Sugar fermentation stimulation protein homolog	0.114	146	97	10	119	83	228	3.419E-01	39
DESULFOASV1_1894_YraN_family_protein	AF-Q111B4-F1-model_v4	DESULFOASV1_1894_YraN_family_protein	AF-Q111B4-F1-model_v4 Sugar fermentation stimulation protein homolog	0.160	87	70	14	97	108	194	2.313E-01	39
DESULFOASV1_1894_YraN_family_protein	AF-Q28HX0-F1-model_v4	DESULFOASV1_1894_YraN_family_protein	AF-Q28HX0-F1-model_v4 BRCA1-A complex subunit Abraxas 1	0.157	70	46	47	116	99	153	1.783E-01	39
DESULFOASV1_1894_YraN_family_protein	AF-B1KUY8-F1-model_v4	DESULFOASV1_1894_YraN_family_protein	AF-B1KUY8-F1-model_v4 ATP-dependent helicase/deoxyribonuclease subunit B	0.148	91	70	24	106	908	998	1.206E-01	39
DESULFOASV1_1894_YraN_family_protein	AF-B0KDB8-F1-model_v4	DESULFOASV1_1894_YraN_family_protein	AF-B0KDB8-F1-model_v4 ATP-dependent helicase/deoxyribonuclease subunit B	0.125	86	70	24	104	906	991	1.287E-01	39
DESULFOASV1_1894_YraN_family_protein	AF-Q1JMH5-F1-model_v4	DESULFOASV1_1894_YraN_family_protein	AF-Q1JMH5-F1-model_v4 ATP-dependent helicase/nuclease subunit A	0.130	93	76	25	117	1135	1222	1.565E-01	38
DESULFOASV1_1894_YraN_family_protein	AF-Q8CPT9-F1-model_v4	DESULFOASV1_1894_YraN_family_protein	AF-Q8CPT9-F1-model_v4 ATP-dependent helicase/nuclease subunit A	0.191	68	53	37	104	1148	1213	3.895E-01	38
DESULFOASV1_1894_YraN_family_protein	AF-A6LPC4-F1-model_v4	DESULFOASV1_1894_YraN_family_protein	AF-A6LPC4-F1-model_v4 ATP-dependent helicase/nuclease subunit A	0.157	109	80	20	115	1136	1244	2.167E-01	38
DESULFOASV1_1894_YraN_family_protein	AF-Q49WA6-F1-model_v4	DESULFOASV1_1894_YraN_family_protein	AF-Q49WA6-F1-model_v4 ATP-dependent helicase/nuclease subunit A	0.170	79	61	37	115	1143	1217	2.469E-01	37
DESULFOASV1_1894_YraN_family_protein	AF-A0A0H3CC30-F1-model_v4	DESULFOASV1_1894_YraN_family_protein	AF-A0A0H3CC30-F1-model_v4 DNA replication inhibitor toxin SocB	0.137	99	84	19	116	92	190	6.559E-01	36
DESULFOASV1_1894_YraN_family_protein	AF-Q2JPQ5-F1-model_v4	DESULFOASV1_1894_YraN_family_protein	AF-Q2JPQ5-F1-model_v4 Sugar fermentation stimulation protein homolog	0.107	87	76	12	97	93	179	1.179E+00	36
DESULFOASV1_1894_YraN_family_protein	AF-B5X1P9-F1-model_v4	DESULFOASV1_1894_YraN_family_protein	AF-B5X1P9-F1-model_v4 BRCA1-A complex subunit Abraxas 1	0.096	141	94	12	116	12	152	1.059E-01	36
DESULFOASV1_1894_YraN_family_protein	AF-Q1GAB0-F1-model_v4	DESULFOASV1_1894_YraN_family_protein	AF-Q1GAB0-F1-model_v4 ATP-dependent helicase/deoxyribonuclease subunit B	0.088	120	82	13	103	895	1014	3.204E-01	36
DESULFOASV1_1894_YraN_family_protein	AF-A4J4E3-F1-model_v4	DESULFOASV1_1894_YraN_family_protein	AF-A4J4E3-F1-model_v4 ATP-dependent helicase/nuclease subunit A	0.158	93	77	25	117	1152	1244	5.758E-01	36
DESULFOASV1_1894_YraN_family_protein	AF-A3DH19-F1-model_v4	DESULFOASV1_1894_YraN_family_protein	AF-A3DH19-F1-model_v4 ATP-dependent helicase/nuclease subunit A	0.134	81	60	37	117	1182	1251	6.146E-01	36
DESULFOASV1_1894_YraN_family_protein	AF-Q3K6R5-F1-model_v4	DESULFOASV1_1894_YraN_family_protein	AF-Q3K6R5-F1-model_v4 Sugar fermentation stimulation protein homolog	0.112	146	97	10	119	83	228	3.895E-01	35
DESULFOASV1_1894_YraN_family_protein	AF-A9WJ28-F1-model_v4	DESULFOASV1_1894_YraN_family_protein	AF-A9WJ28-F1-model_v4 Sugar fermentation stimulation protein homolog	0.090	122	83	26	117	122	243	1.287E-01	35
DESULFOASV1_1894_YraN_family_protein	AF-B9LD40-F1-model_v4	DESULFOASV1_1894_YraN_family_protein	AF-B9LD40-F1-model_v4 Sugar fermentation stimulation protein homolog	0.090	122	83	26	117	122	243	1.374E-01	35
DESULFOASV1_1894_YraN_family_protein	AF-Q6GR31-F1-model_v4	DESULFOASV1_1894_YraN_family_protein	AF-Q6GR31-F1-model_v4 BRCA1-A complex subunit Abraxas 1	0.132	83	54	34	116	91	153	1.670E-01	35
DESULFOASV1_1894_YraN_family_protein	AF-Q3AA34-F1-model_v4	DESULFOASV1_1894_YraN_family_protein	AF-Q3AA34-F1-model_v4 ATP-dependent helicase/deoxyribonuclease subunit B	0.091	103	74	25	106	826	928	1.035E+00	35
DESULFOASV1_1894_YraN_family_protein	AF-B7JDU4-F1-model_v4	DESULFOASV1_1894_YraN_family_protein	AF-B7JDU4-F1-model_v4 ATP-dependent helicase/nuclease subunit A	0.148	100	76	25	114	1138	1237	7.643E-02	35
DESULFOASV1_1894_YraN_family_protein	AF-Q1WRS0-F1-model_v4	DESULFOASV1_1894_YraN_family_protein	AF-Q1WRS0-F1-model_v4 ATP-dependent helicase/nuclease subunit A	0.101	79	60	37	115	1181	1248	7.001E-01	35
DESULFOASV1_1894_YraN_family_protein	AF-Q3J8V9-F1-model_v4	DESULFOASV1_1894_YraN_family_protein	AF-Q3J8V9-F1-model_v4 Sugar fermentation stimulation protein homolog	0.103	144	96	10	117	88	231	2.469E-01	34
