query	target	qheader	theader	fident	alnlen	mismatch	qstart	qend	tstart	tend	evalue	bits
DESULFOASV1_2187_MliC_family_protein	AF-P9WK41-F1-model_v4	DESULFOASV1_2187_MliC_family_protein	AF-P9WK41-F1-model_v4 Lipoprotein LprI	0.236	205	150	1	205	1	197	2.360E-10	338
DESULFOASV1_2187_MliC_family_protein	AF-P9WK40-F1-model_v4	DESULFOASV1_2187_MliC_family_protein	AF-P9WK40-F1-model_v4 Lipoprotein LprI	0.231	205	151	1	205	1	197	2.790E-10	336
DESULFOASV1_2187_MliC_family_protein	AF-P65319-F1-model_v4	DESULFOASV1_2187_MliC_family_protein	AF-P65319-F1-model_v4 Lipoprotein LprI	0.236	205	145	1	205	7	197	3.119E-10	329
DESULFOASV1_2187_MliC_family_protein	AF-A7MMK4-F1-model_v4	DESULFOASV1_2187_MliC_family_protein	AF-A7MMK4-F1-model_v4 Membrane-bound lysozyme inhibitor of C-type lysozyme	0.141	78	63	129	206	31	104	1.784E-02	124
DESULFOASV1_2187_MliC_family_protein	AF-Q0K8S4-F1-model_v4	DESULFOASV1_2187_MliC_family_protein	AF-Q0K8S4-F1-model_v4 Membrane-bound lysozyme inhibitor of C-type lysozyme	0.112	86	73	124	206	40	125	1.687E-02	123
DESULFOASV1_2187_MliC_family_protein	AF-P28837-F1-model_v4	DESULFOASV1_2187_MliC_family_protein	AF-P28837-F1-model_v4 Membrane-bound lysozyme inhibitor of C-type lysozyme	0.090	77	66	129	205	32	104	2.230E-02	122
DESULFOASV1_2187_MliC_family_protein	AF-Q9I574-F1-model_v4	DESULFOASV1_2187_MliC_family_protein	AF-Q9I574-F1-model_v4 Membrane-bound lysozyme inhibitor of C-type lysozyme	0.089	85	74	124	205	43	127	1.784E-02	113
DESULFOASV1_2187_MliC_family_protein	AF-P28224-F1-model_v4	DESULFOASV1_2187_MliC_family_protein	AF-P28224-F1-model_v4 Membrane-bound lysozyme inhibitor of C-type lysozyme	0.136	93	74	114	206	20	106	2.109E-02	99
DESULFOASV1_2187_MliC_family_protein	AF-P44416-F1-model_v4	DESULFOASV1_2187_MliC_family_protein	AF-P44416-F1-model_v4 Opacity-associated protein OapB	0.104	109	90	97	205	24	124	8.052E-02	79
DESULFOASV1_2187_MliC_family_protein	AF-P53276-F1-model_v4	DESULFOASV1_2187_MliC_family_protein	AF-P53276-F1-model_v4 U3 small nucleolar RNA-associated protein 8	0.065	89	68	131	204	219	307	1.407E-01	45
DESULFOASV1_2187_MliC_family_protein	AF-B5XFA7-F1-model_v4	DESULFOASV1_2187_MliC_family_protein	AF-B5XFA7-F1-model_v4 LYR motif-containing protein 2	0.163	89	69	34	122	2	85	1.388E+00	38
DESULFOASV1_2187_MliC_family_protein	AF-Q4G3A6-F1-model_v4	DESULFOASV1_2187_MliC_family_protein	AF-Q4G3A6-F1-model_v4 DNA-directed RNA polymerase subunit beta'	0.142	42	33	164	205	558	597	4.237E+00	38
DESULFOASV1_2187_MliC_family_protein	AF-Q725P0-F1-model_v4	DESULFOASV1_2187_MliC_family_protein	AF-Q725P0-F1-model_v4 Zinc resistance-associated protein homolog	0.149	111	94	12	122	1	111	1.110E+00	37
DESULFOASV1_2187_MliC_family_protein	AF-B2WMX8-F1-model_v4	DESULFOASV1_2187_MliC_family_protein	AF-B2WMX8-F1-model_v4 Altered inheritance of mitochondria protein 41, mitochondrial	0.135	124	104	4	124	1	124	2.293E+00	30
DESULFOASV1_2187_MliC_family_protein	AF-Q10KT6-F1-model_v4	DESULFOASV1_2187_MliC_family_protein	AF-Q10KT6-F1-model_v4 Copper transporter 4	0.163	120	89	2	121	7	113	1.388E+00	30
DESULFOASV1_2187_MliC_family_protein	AF-Q80ZM8-F1-model_v4	DESULFOASV1_2187_MliC_family_protein	AF-Q80ZM8-F1-model_v4 Cardiolipin synthase (CMP-forming)	0.130	119	97	2	120	72	184	4.481E+00	29
DESULFOASV1_2187_MliC_family_protein	AF-Q2SF17-F1-model_v4	DESULFOASV1_2187_MliC_family_protein	AF-Q2SF17-F1-model_v4 UvrABC system protein C	0.123	138	117	34	171	162	295	3.074E-01	29
DESULFOASV1_2187_MliC_family_protein	AF-Q9VSH4-F1-model_v4	DESULFOASV1_2187_MliC_family_protein	AF-Q9VSH4-F1-model_v4 Cleavage and polyadenylation specificity factor subunit 6	0.140	122	101	1	122	403	520	2.425E+00	29
DESULFOASV1_2187_MliC_family_protein	AF-P19369-F1-model_v4	DESULFOASV1_2187_MliC_family_protein	AF-P19369-F1-model_v4 Flexible pilin	0.109	63	55	57	119	6	68	7.830E+00	28
DESULFOASV1_2187_MliC_family_protein	AF-Q94EE4-F1-model_v4	DESULFOASV1_2187_MliC_family_protein	AF-Q94EE4-F1-model_v4 Copper transporter 1	0.162	121	91	2	122	10	118	1.940E+00	28
DESULFOASV1_2187_MliC_family_protein	AF-P60810-F1-model_v4	DESULFOASV1_2187_MliC_family_protein	AF-P60810-F1-model_v4 Foldase protein PrsA 2	0.131	120	100	4	119	1	120	3.031E+00	28
DESULFOASV1_2187_MliC_family_protein	AF-Q14393-F1-model_v4	DESULFOASV1_2187_MliC_family_protein	AF-Q14393-F1-model_v4 Growth arrest-specific protein 6	0.113	82	72	125	206	325	406	1.735E+00	28
DESULFOASV1_2187_MliC_family_protein	AF-P82352-F1-model_v4	DESULFOASV1_2187_MliC_family_protein	AF-P82352-F1-model_v4 Sarcospan	0.123	170	137	1	157	5	174	1.174E+00	27
DESULFOASV1_2187_MliC_family_protein	AF-A6T533-F1-model_v4	DESULFOASV1_2187_MliC_family_protein	AF-A6T533-F1-model_v4 Esterase FrsA	0.135	89	76	58	146	98	186	3.584E+00	27
DESULFOASV1_2187_MliC_family_protein	AF-Q39QN3-F1-model_v4	DESULFOASV1_2187_MliC_family_protein	AF-Q39QN3-F1-model_v4 UvrABC system protein C	0.119	122	95	44	165	174	282	1.110E+00	27
DESULFOASV1_2187_MliC_family_protein	AF-Q6CJ50-F1-model_v4	DESULFOASV1_2187_MliC_family_protein	AF-Q6CJ50-F1-model_v4 Mitochondrial division protein 1	0.086	72	64	132	203	602	672	4.481E+00	27
DESULFOASV1_2187_MliC_family_protein	AF-P82130-F1-model_v4	DESULFOASV1_2187_MliC_family_protein	AF-P82130-F1-model_v4 30S ribosomal protein S20, chloroplastic	0.098	132	111	1	124	44	175	6.263E+00	26
DESULFOASV1_2187_MliC_family_protein	AF-Q3U6N9-F1-model_v4	DESULFOASV1_2187_MliC_family_protein	AF-Q3U6N9-F1-model_v4 UPF0488 protein C8orf33 homolog	0.179	128	99	1	122	42	169	3.389E+00	26
DESULFOASV1_2187_MliC_family_protein	AF-A7I6E8-F1-model_v4	DESULFOASV1_2187_MliC_family_protein	AF-A7I6E8-F1-model_v4 UPF0316 protein Mboo_0791	0.112	206	158	1	179	1	206	2.425E+00	26
DESULFOASV1_2187_MliC_family_protein	AF-Q9UM00-F1-model_v4	DESULFOASV1_2187_MliC_family_protein	AF-Q9UM00-F1-model_v4 Calcium load-activated calcium channel	0.119	139	104	4	122	1	139	2.051E+00	26
DESULFOASV1_2187_MliC_family_protein	AF-O49647-F1-model_v4	DESULFOASV1_2187_MliC_family_protein	AF-O49647-F1-model_v4 Putative F-box protein At4g22660	0.075	75	66	128	199	169	243	5.601E+00	26
DESULFOASV1_2187_MliC_family_protein	AF-Q6DDF0-F1-model_v4	DESULFOASV1_2187_MliC_family_protein	AF-Q6DDF0-F1-model_v4 WD repeat-containing protein 37	0.129	232	172	1	198	1	232	1.551E+00	26
DESULFOASV1_2187_MliC_family_protein	AF-P22204-F1-model_v4	DESULFOASV1_2187_MliC_family_protein	AF-P22204-F1-model_v4 Cell cycle protein kinase DBF2	0.104	203	181	1	203	53	255	1.551E+00	26
DESULFOASV1_2187_MliC_family_protein	AF-B3E394-F1-model_v4	DESULFOASV1_2187_MliC_family_protein	AF-B3E394-F1-model_v4 UvrABC system protein C	0.124	125	105	38	158	158	282	9.927E-01	26
DESULFOASV1_2187_MliC_family_protein	AF-A0KVM4-F1-model_v4	DESULFOASV1_2187_MliC_family_protein	AF-A0KVM4-F1-model_v4 UvrABC system protein C	0.155	134	109	38	171	161	290	6.351E-01	26
DESULFOASV1_2187_MliC_family_protein	AF-B6IZT9-F1-model_v4	DESULFOASV1_2187_MliC_family_protein	AF-B6IZT9-F1-model_v4 UvrABC system protein C	0.114	109	96	38	146	160	268	1.110E+00	26
DESULFOASV1_2187_MliC_family_protein	AF-Q8XWW2-F1-model_v4	DESULFOASV1_2187_MliC_family_protein	AF-Q8XWW2-F1-model_v4 Phosphoenolpyruvate carboxylase	0.090	120	96	1	120	24	129	7.003E+00	26
DESULFOASV1_2187_MliC_family_protein	AF-P37422-F1-model_v4	DESULFOASV1_2187_MliC_family_protein	AF-P37422-F1-model_v4 SPI-1 type 3 secretion system pilotin	0.149	123	100	1	118	24	146	3.584E+00	25
DESULFOASV1_2187_MliC_family_protein	AF-Q60EN8-F1-model_v4	DESULFOASV1_2187_MliC_family_protein	AF-Q60EN8-F1-model_v4 Copper transporter 2	0.130	125	104	2	122	1	125	3.389E+00	25
DESULFOASV1_2187_MliC_family_protein	AF-Q6AZV0-F1-model_v4	DESULFOASV1_2187_MliC_family_protein	AF-Q6AZV0-F1-model_v4 Succinate dehydrogenase [ubiquinone] cytochrome b small subunit B, mitochondrial	0.117	122	96	1	122	18	127	3.389E+00	25
DESULFOASV1_2187_MliC_family_protein	AF-Q68FN7-F1-model_v4	DESULFOASV1_2187_MliC_family_protein	AF-Q68FN7-F1-model_v4 Succinate dehydrogenase [ubiquinone] cytochrome b small subunit B, mitochondrial	0.145	121	101	2	122	15	133	2.564E+00	25
DESULFOASV1_2187_MliC_family_protein	AF-Q5RC29-F1-model_v4	DESULFOASV1_2187_MliC_family_protein	AF-Q5RC29-F1-model_v4 Succinate dehydrogenase [ubiquinone] cytochrome b small subunit, mitochondrial	0.169	128	101	1	122	7	134	2.867E+00	25
DESULFOASV1_2187_MliC_family_protein	AF-Q2KID8-F1-model_v4	DESULFOASV1_2187_MliC_family_protein	AF-Q2KID8-F1-model_v4 UPF0488 protein C8orf33 homolog	0.176	121	97	2	122	17	135	4.007E+00	25
DESULFOASV1_2187_MliC_family_protein	AF-Q5RBH2-F1-model_v4	DESULFOASV1_2187_MliC_family_protein	AF-Q5RBH2-F1-model_v4 Diablo homolog, mitochondrial	0.105	121	100	1	121	36	148	8.755E+00	25
DESULFOASV1_2187_MliC_family_protein	AF-Q4R8E0-F1-model_v4	DESULFOASV1_2187_MliC_family_protein	AF-Q4R8E0-F1-model_v4 Eukaryotic translation initiation factor 2-alpha kinase 1	0.126	185	134	1	154	11	195	1.551E+00	25
DESULFOASV1_2187_MliC_family_protein	AF-B0BYA6-F1-model_v4	DESULFOASV1_2187_MliC_family_protein	AF-B0BYA6-F1-model_v4 UvrABC system protein C	0.093	114	90	52	165	187	286	2.711E+00	25
DESULFOASV1_2187_MliC_family_protein	AF-Q9USN1-F1-model_v4	DESULFOASV1_2187_MliC_family_protein	AF-Q9USN1-F1-model_v4 Sorting nexin-12	0.106	168	144	2	169	582	743	1.467E+00	25
DESULFOASV1_2187_MliC_family_protein	AF-Q63661-F1-model_v4	DESULFOASV1_2187_MliC_family_protein	AF-Q63661-F1-model_v4 Mucin-4	0.082	83	68	130	204	1670	1752	3.790E+00	25
DESULFOASV1_2187_MliC_family_protein	AF-F4I1L3-F1-model_v4	DESULFOASV1_2187_MliC_family_protein	AF-F4I1L3-F1-model_v4 Acetyl-CoA carboxylase 2	0.060	79	71	129	205	696	774	6.623E+00	25
DESULFOASV1_2187_MliC_family_protein	AF-Q6P355-F1-model_v4	DESULFOASV1_2187_MliC_family_protein	AF-Q6P355-F1-model_v4 Succinate dehydrogenase [ubiquinone] cytochrome b small subunit, mitochondrial	0.109	122	97	1	122	18	127	4.481E+00	24
DESULFOASV1_2187_MliC_family_protein	AF-Q3SYS7-F1-model_v4	DESULFOASV1_2187_MliC_family_protein	AF-Q3SYS7-F1-model_v4 IQ domain-containing protein F1	0.157	168	140	1	168	43	209	8.396E-01	24
DESULFOASV1_2187_MliC_family_protein	AF-Q5RDQ4-F1-model_v4	DESULFOASV1_2187_MliC_family_protein	AF-Q5RDQ4-F1-model_v4 UPF0488 protein C8orf33 homolog	0.154	122	82	1	122	71	168	9.257E+00	24
DESULFOASV1_2187_MliC_family_protein	AF-Q9SSA5-F1-model_v4	DESULFOASV1_2187_MliC_family_protein	AF-Q9SSA5-F1-model_v4 Peptidyl-prolyl cis-trans isomerase CYP38, chloroplastic	0.108	266	178	1	201	68	333	2.711E+00	24
DESULFOASV1_2187_MliC_family_protein	AF-B6J7K3-F1-model_v4	DESULFOASV1_2187_MliC_family_protein	AF-B6J7K3-F1-model_v4 UvrABC system protein C	0.112	120	93	52	171	182	287	9.927E-01	24
DESULFOASV1_2187_MliC_family_protein	AF-C4K1I8-F1-model_v4	DESULFOASV1_2187_MliC_family_protein	AF-C4K1I8-F1-model_v4 UvrABC system protein C	0.078	129	112	37	165	164	286	2.425E+00	24
DESULFOASV1_2187_MliC_family_protein	AF-C4R628-F1-model_v4	DESULFOASV1_2187_MliC_family_protein	AF-C4R628-F1-model_v4 Vacuolar membrane protease	0.145	168	142	1	168	51	217	1.312E+00	24
DESULFOASV1_2187_MliC_family_protein	AF-Q1E554-F1-model_v4	DESULFOASV1_2187_MliC_family_protein	AF-Q1E554-F1-model_v4 rRNA-processing protein CGR1	0.200	121	91	2	122	9	123	3.584E+00	23
DESULFOASV1_2187_MliC_family_protein	AF-Q6AZR3-F1-model_v4	DESULFOASV1_2187_MliC_family_protein	AF-Q6AZR3-F1-model_v4 Succinate dehydrogenase [ubiquinone] cytochrome b small subunit A, mitochondrial	0.120	122	96	1	122	18	127	6.263E+00	23
DESULFOASV1_2187_MliC_family_protein	AF-Q9STG2-F1-model_v4	DESULFOASV1_2187_MliC_family_protein	AF-Q9STG2-F1-model_v4 Copper transporter 2	0.120	119	87	1	119	6	105	3.584E+00	23
DESULFOASV1_2187_MliC_family_protein	AF-Q8IYI0-F1-model_v4	DESULFOASV1_2187_MliC_family_protein	AF-Q8IYI0-F1-model_v4 Shieldin complex subunit 1	0.077	118	92	1	118	55	155	9.257E+00	23
DESULFOASV1_2187_MliC_family_protein	AF-O82251-F1-model_v4	DESULFOASV1_2187_MliC_family_protein	AF-O82251-F1-model_v4 Protein TIC 20-II, chloroplastic	0.111	135	105	1	119	9	143	7.003E+00	23
DESULFOASV1_2187_MliC_family_protein	AF-Q7X7A9-F1-model_v4	DESULFOASV1_2187_MliC_family_protein	AF-Q7X7A9-F1-model_v4 F-box protein At1g11270	0.147	81	67	127	206	225	305	3.790E+00	23
DESULFOASV1_2187_MliC_family_protein	AF-G1T7U7-F1-model_v4	DESULFOASV1_2187_MliC_family_protein	AF-G1T7U7-F1-model_v4 N-acylethanolamine-hydrolyzing acid amidase	0.143	146	123	1	146	2	145	3.389E+00	23
DESULFOASV1_2187_MliC_family_protein	AF-B5EWK1-F1-model_v4	DESULFOASV1_2187_MliC_family_protein	AF-B5EWK1-F1-model_v4 Esterase FrsA	0.071	90	81	58	145	98	187	6.263E+00	23
DESULFOASV1_2187_MliC_family_protein	AF-B5R5R5-F1-model_v4	DESULFOASV1_2187_MliC_family_protein	AF-B5R5R5-F1-model_v4 Esterase FrsA	0.072	90	81	58	145	98	187	6.623E+00	23
DESULFOASV1_2187_MliC_family_protein	AF-Q6NWC6-F1-model_v4	DESULFOASV1_2187_MliC_family_protein	AF-Q6NWC6-F1-model_v4 Cleavage and polyadenylation specificity factor subunit 6	0.103	121	100	1	121	367	478	6.263E+00	23
DESULFOASV1_2187_MliC_family_protein	AF-C1DIK7-F1-model_v4	DESULFOASV1_2187_MliC_family_protein	AF-C1DIK7-F1-model_v4 UvrABC system protein C	0.111	129	108	37	165	160	282	2.051E+00	23
DESULFOASV1_2187_MliC_family_protein	AF-Q0HJZ1-F1-model_v4	DESULFOASV1_2187_MliC_family_protein	AF-Q0HJZ1-F1-model_v4 UvrABC system protein C	0.164	114	94	38	151	161	274	1.551E+00	23
DESULFOASV1_2187_MliC_family_protein	AF-A9NDQ6-F1-model_v4	DESULFOASV1_2187_MliC_family_protein	AF-A9NDQ6-F1-model_v4 UvrABC system protein C	0.107	124	102	38	161	160	274	1.110E+00	23
DESULFOASV1_2187_MliC_family_protein	AF-Q4UL10-F1-model_v4	DESULFOASV1_2187_MliC_family_protein	AF-Q4UL10-F1-model_v4 UvrABC system protein C	0.101	114	89	52	165	187	286	3.790E+00	23
DESULFOASV1_2187_MliC_family_protein	AF-Q8WNR0-F1-model_v4	DESULFOASV1_2187_MliC_family_protein	AF-Q8WNR0-F1-model_v4 High affinity copper uptake protein 1	0.126	97	74	2	98	18	103	7.003E+00	22
DESULFOASV1_2187_MliC_family_protein	AF-O83245-F1-model_v4	DESULFOASV1_2187_MliC_family_protein	AF-O83245-F1-model_v4 Protein GrpE	0.170	210	142	2	173	4	213	3.205E+00	22
DESULFOASV1_2187_MliC_family_protein	AF-Q94FZ9-F1-model_v4	DESULFOASV1_2187_MliC_family_protein	AF-Q94FZ9-F1-model_v4 Plastid lipid-associated protein 1, chloroplastic	0.112	212	175	1	198	32	243	8.878E-01	22
DESULFOASV1_2187_MliC_family_protein	AF-Q4KAR9-F1-model_v4	DESULFOASV1_2187_MliC_family_protein	AF-Q4KAR9-F1-model_v4 UvrABC system protein C	0.137	114	85	52	165	183	282	1.388E+00	22
DESULFOASV1_2187_MliC_family_protein	AF-Q3KBQ0-F1-model_v4	DESULFOASV1_2187_MliC_family_protein	AF-Q3KBQ0-F1-model_v4 UvrABC system protein C	0.119	137	111	27	163	156	282	1.940E+00	22
DESULFOASV1_2187_MliC_family_protein	AF-Q02N77-F1-model_v4	DESULFOASV1_2187_MliC_family_protein	AF-Q02N77-F1-model_v4 UvrABC system protein C	0.101	109	94	52	160	184	289	2.425E+00	22
DESULFOASV1_2187_MliC_family_protein	AF-A9KFP2-F1-model_v4	DESULFOASV1_2187_MliC_family_protein	AF-A9KFP2-F1-model_v4 UvrABC system protein C	0.116	97	78	52	148	182	270	2.051E+00	22
DESULFOASV1_2187_MliC_family_protein	AF-Q83CD5-F1-model_v4	DESULFOASV1_2187_MliC_family_protein	AF-Q83CD5-F1-model_v4 UvrABC system protein C	0.107	124	102	38	161	160	274	1.312E+00	22
DESULFOASV1_2187_MliC_family_protein	AF-C3PP03-F1-model_v4	DESULFOASV1_2187_MliC_family_protein	AF-C3PP03-F1-model_v4 UvrABC system protein C	0.072	137	123	37	173	164	297	3.205E+00	22
DESULFOASV1_2187_MliC_family_protein	AF-Q9P3A9-F1-model_v4	DESULFOASV1_2187_MliC_family_protein	AF-Q9P3A9-F1-model_v4 Uncharacterized protein C1565.05	0.056	86	69	133	206	80	165	4.481E+00	22
DESULFOASV1_2187_MliC_family_protein	AF-Q63312-F1-model_v4	DESULFOASV1_2187_MliC_family_protein	AF-Q63312-F1-model_v4 Pleckstrin homology-like domain family B member 1	0.106	249	181	1	203	557	805	2.169E+00	22
DESULFOASV1_2187_MliC_family_protein	AF-Q0V8T8-F1-model_v4	DESULFOASV1_2187_MliC_family_protein	AF-Q0V8T8-F1-model_v4 Contactin-associated protein like 5-2	0.068	83	70	129	204	403	485	6.623E+00	22
DESULFOASV1_2187_MliC_family_protein	AF-O22914-F1-model_v4	DESULFOASV1_2187_MliC_family_protein	AF-O22914-F1-model_v4 Calvin cycle protein CP12-1, chloroplastic	0.157	122	78	1	122	1	93	6.623E+00	21
DESULFOASV1_2187_MliC_family_protein	AF-P0CU98-F1-model_v4	DESULFOASV1_2187_MliC_family_protein	AF-P0CU98-F1-model_v4 Secreted RxLR effector protein 15	0.152	122	98	1	122	18	133	4.481E+00	21
DESULFOASV1_2187_MliC_family_protein	AF-Q8GWP3-F1-model_v4	DESULFOASV1_2187_MliC_family_protein	AF-Q8GWP3-F1-model_v4 Copper transporter 6	0.143	139	117	1	137	3	141	5.601E+00	21
DESULFOASV1_2187_MliC_family_protein	AF-O94618-F1-model_v4	DESULFOASV1_2187_MliC_family_protein	AF-O94618-F1-model_v4 Mitochondrial import inner membrane translocase subunit tim21	0.099	200	175	1	200	1	195	1.050E+00	21
DESULFOASV1_2187_MliC_family_protein	AF-P48544-F1-model_v4	DESULFOASV1_2187_MliC_family_protein	AF-P48544-F1-model_v4 G protein-activated inward rectifier potassium channel 4	0.080	299	186	2	204	23	321	5.080E-01	21
DESULFOASV1_2187_MliC_family_protein	AF-P26684-F1-model_v4	DESULFOASV1_2187_MliC_family_protein	AF-P26684-F1-model_v4 Endothelin-1 receptor	0.081	123	99	1	123	37	145	7.405E+00	21
DESULFOASV1_2187_MliC_family_protein	AF-P39391-F1-model_v4	DESULFOASV1_2187_MliC_family_protein	AF-P39391-F1-model_v4 Protein YjiT	0.144	184	140	41	204	202	385	2.051E+00	21
DESULFOASV1_2187_MliC_family_protein	AF-Q52377-F1-model_v4	DESULFOASV1_2187_MliC_family_protein	AF-Q52377-F1-model_v4 UvrABC system protein C	0.133	109	91	52	160	183	288	2.169E+00	21
DESULFOASV1_2187_MliC_family_protein	AF-P32966-F1-model_v4	DESULFOASV1_2187_MliC_family_protein	AF-P32966-F1-model_v4 UvrABC system protein C	0.093	125	107	42	160	164	288	1.834E+00	21
DESULFOASV1_2187_MliC_family_protein	AF-A5W1B2-F1-model_v4	DESULFOASV1_2187_MliC_family_protein	AF-A5W1B2-F1-model_v4 UvrABC system protein C	0.137	127	104	39	165	162	282	1.735E+00	21
DESULFOASV1_2187_MliC_family_protein	AF-A1RKL4-F1-model_v4	DESULFOASV1_2187_MliC_family_protein	AF-A1RKL4-F1-model_v4 UvrABC system protein C	0.164	114	94	38	151	161	274	2.425E+00	21
DESULFOASV1_2187_MliC_family_protein	AF-Q8EFV4-F1-model_v4	DESULFOASV1_2187_MliC_family_protein	AF-Q8EFV4-F1-model_v4 UvrABC system protein C	0.155	133	109	39	171	161	290	1.551E+00	21
DESULFOASV1_2187_MliC_family_protein	AF-Q747I7-F1-model_v4	DESULFOASV1_2187_MliC_family_protein	AF-Q747I7-F1-model_v4 UvrABC system protein C	0.166	118	79	46	163	185	280	8.878E-01	21
DESULFOASV1_2187_MliC_family_protein	AF-A8GP33-F1-model_v4	DESULFOASV1_2187_MliC_family_protein	AF-A8GP33-F1-model_v4 UvrABC system protein C	0.115	100	81	52	151	187	278	7.405E+00	21
DESULFOASV1_2187_MliC_family_protein	AF-Q08EC4-F1-model_v4	DESULFOASV1_2187_MliC_family_protein	AF-Q08EC4-F1-model_v4 Cas scaffolding protein family member 4	0.107	138	106	2	121	663	800	8.755E+00	21
DESULFOASV1_2187_MliC_family_protein	AF-P97310-F1-model_v4	DESULFOASV1_2187_MliC_family_protein	AF-P97310-F1-model_v4 DNA replication licensing factor MCM2	0.070	307	189	1	204	133	439	1.388E+00	21
DESULFOASV1_2187_MliC_family_protein	AF-Q91Z38-F1-model_v4	DESULFOASV1_2187_MliC_family_protein	AF-Q91Z38-F1-model_v4 Tetratricopeptide repeat protein 1	0.122	125	106	1	122	42	166	5.010E+00	20
DESULFOASV1_2187_MliC_family_protein	AF-P0C2B5-F1-model_v4	DESULFOASV1_2187_MliC_family_protein	AF-P0C2B5-F1-model_v4 Foldase protein PrsA	0.113	236	182	1	206	1	236	5.601E+00	20
DESULFOASV1_2187_MliC_family_protein	AF-Q9ZP40-F1-model_v4	DESULFOASV1_2187_MliC_family_protein	AF-Q9ZP40-F1-model_v4 Plastoglobulin-1, chloroplastic	0.100	209	180	1	201	78	286	9.927E-01	20
DESULFOASV1_2187_MliC_family_protein	AF-Q95L55-F1-model_v4	DESULFOASV1_2187_MliC_family_protein	AF-Q95L55-F1-model_v4 Endothelin-1 receptor	0.090	122	100	2	123	35	145	7.830E+00	20
DESULFOASV1_2187_MliC_family_protein	AF-C3K7T2-F1-model_v4	DESULFOASV1_2187_MliC_family_protein	AF-C3K7T2-F1-model_v4 UvrABC system protein C	0.094	130	116	29	158	158	286	2.051E+00	20
DESULFOASV1_2187_MliC_family_protein	AF-Q48J96-F1-model_v4	DESULFOASV1_2187_MliC_family_protein	AF-Q48J96-F1-model_v4 UvrABC system protein C	0.116	134	117	27	160	156	288	2.051E+00	20
DESULFOASV1_2187_MliC_family_protein	AF-Q0A8X6-F1-model_v4	DESULFOASV1_2187_MliC_family_protein	AF-Q0A8X6-F1-model_v4 UvrABC system protein C	0.156	130	103	38	160	165	294	2.564E+00	20
DESULFOASV1_2187_MliC_family_protein	AF-B2I637-F1-model_v4	DESULFOASV1_2187_MliC_family_protein	AF-B2I637-F1-model_v4 UvrABC system protein C	0.117	129	108	37	165	164	286	3.389E+00	20
DESULFOASV1_2187_MliC_family_protein	AF-B5EG40-F1-model_v4	DESULFOASV1_2187_MliC_family_protein	AF-B5EG40-F1-model_v4 UvrABC system protein C	0.123	128	108	38	165	159	282	2.867E+00	20
DESULFOASV1_2187_MliC_family_protein	AF-Q6FT96-F1-model_v4	DESULFOASV1_2187_MliC_family_protein	AF-Q6FT96-F1-model_v4 Mitochondrial division protein 1	0.084	115	69	126	201	563	677	5.010E+00	20
DESULFOASV1_2187_MliC_family_protein	AF-Q0VCA3-F1-model_v4	DESULFOASV1_2187_MliC_family_protein	AF-Q0VCA3-F1-model_v4 Mitochondrial proton/calcium exchanger protein	0.117	122	103	1	122	500	617	8.755E+00	20
DESULFOASV1_2187_MliC_family_protein	AF-Q0UVD1-F1-model_v4	DESULFOASV1_2187_MliC_family_protein	AF-Q0UVD1-F1-model_v4 rRNA-processing protein CGR1	0.186	122	91	1	122	1	113	9.257E+00	19
DESULFOASV1_2187_MliC_family_protein	AF-A4II32-F1-model_v4	DESULFOASV1_2187_MliC_family_protein	AF-A4II32-F1-model_v4 N-acetylaspartate synthetase	0.113	189	150	2	171	1	189	1.834E+00	19
DESULFOASV1_2187_MliC_family_protein	AF-Q02473-F1-model_v4	DESULFOASV1_2187_MliC_family_protein	AF-Q02473-F1-model_v4 Foldase protein PrsA	0.107	236	183	1	206	1	236	5.923E+00	19
DESULFOASV1_2187_MliC_family_protein	AF-Q90732-F1-model_v4	DESULFOASV1_2187_MliC_family_protein	AF-Q90732-F1-model_v4 26S proteasome regulatory subunit 4	0.103	199	128	1	199	16	159	4.481E+00	19
DESULFOASV1_2187_MliC_family_protein	AF-Q9ULS5-F1-model_v4	DESULFOASV1_2187_MliC_family_protein	AF-Q9ULS5-F1-model_v4 Transmembrane and coiled-coil domain protein 3	0.147	123	103	1	122	13	135	8.755E+00	19
DESULFOASV1_2187_MliC_family_protein	AF-Q8N135-F1-model_v4	DESULFOASV1_2187_MliC_family_protein	AF-Q8N135-F1-model_v4 Leucine-rich repeat LGI family member 4	0.109	82	66	131	205	367	448	6.623E+00	19
DESULFOASV1_2187_MliC_family_protein	AF-A6V4J2-F1-model_v4	DESULFOASV1_2187_MliC_family_protein	AF-A6V4J2-F1-model_v4 UvrABC system protein C	0.104	124	106	42	165	165	283	3.031E+00	19
DESULFOASV1_2187_MliC_family_protein	AF-Q9I0Q1-F1-model_v4	DESULFOASV1_2187_MliC_family_protein	AF-Q9I0Q1-F1-model_v4 UvrABC system protein C	0.128	112	86	52	163	184	283	3.205E+00	19
DESULFOASV1_2187_MliC_family_protein	AF-B7V4X6-F1-model_v4	DESULFOASV1_2187_MliC_family_protein	AF-B7V4X6-F1-model_v4 UvrABC system protein C	0.112	114	88	52	165	184	283	3.205E+00	19
DESULFOASV1_2187_MliC_family_protein	AF-A6WPJ5-F1-model_v4	DESULFOASV1_2187_MliC_family_protein	AF-A6WPJ5-F1-model_v4 UvrABC system protein C	0.164	114	94	38	151	161	274	3.584E+00	19
DESULFOASV1_2187_MliC_family_protein	AF-Q0U2T3-F1-model_v4	DESULFOASV1_2187_MliC_family_protein	AF-Q0U2T3-F1-model_v4 Mitochondrial division protein 1	0.105	110	63	133	203	532	641	7.003E+00	19
DESULFOASV1_2187_MliC_family_protein	AF-Q754N7-F1-model_v4	DESULFOASV1_2187_MliC_family_protein	AF-Q754N7-F1-model_v4 Serine/threonine-protein kinase CBK1	0.123	165	115	1	165	208	339	2.867E+00	19
DESULFOASV1_2187_MliC_family_protein	AF-O17514-F1-model_v4	DESULFOASV1_2187_MliC_family_protein	AF-O17514-F1-model_v4 Histone-lysine N-methyltransferase mes-2	0.189	205	123	1	205	7	159	3.389E+00	19
DESULFOASV1_2187_MliC_family_protein	AF-A0A0P1AQV8-F1-model_v4	DESULFOASV1_2187_MliC_family_protein	AF-A0A0P1AQV8-F1-model_v4 Secreted RxLR effector protein RXLR-C16	0.139	126	104	1	122	1	126	8.279E+00	18
DESULFOASV1_2187_MliC_family_protein	AF-A6NKF7-F1-model_v4	DESULFOASV1_2187_MliC_family_protein	AF-A6NKF7-F1-model_v4 Transmembrane protein 88B	0.126	142	119	1	137	3	144	7.003E+00	18
DESULFOASV1_2187_MliC_family_protein	AF-P12360-F1-model_v4	DESULFOASV1_2187_MliC_family_protein	AF-P12360-F1-model_v4 Chlorophyll a-b binding protein 6A, chloroplastic	0.137	194	104	1	122	8	201	8.755E+00	18
DESULFOASV1_2187_MliC_family_protein	AF-O13684-F1-model_v4	DESULFOASV1_2187_MliC_family_protein	AF-O13684-F1-model_v4 Monopolin complex subunit pcs1	0.101	195	159	2	196	47	224	3.031E+00	18
DESULFOASV1_2187_MliC_family_protein	AF-Q91YI6-F1-model_v4	DESULFOASV1_2187_MliC_family_protein	AF-Q91YI6-F1-model_v4 Poly(A) RNA polymerase GLD2	0.071	158	135	1	146	114	271	4.738E+00	18
DESULFOASV1_2187_MliC_family_protein	AF-Q5R650-F1-model_v4	DESULFOASV1_2187_MliC_family_protein	AF-Q5R650-F1-model_v4 WD repeat-containing protein 37	0.114	228	171	1	194	1	228	5.923E+00	18
DESULFOASV1_2187_MliC_family_protein	AF-Q6P3Z3-F1-model_v4	DESULFOASV1_2187_MliC_family_protein	AF-Q6P3Z3-F1-model_v4 Peroxynitrite isomerase THAP4	0.099	243	184	1	205	278	520	4.007E+00	18
DESULFOASV1_2187_MliC_family_protein	AF-B0VLX1-F1-model_v4	DESULFOASV1_2187_MliC_family_protein	AF-B0VLX1-F1-model_v4 UvrABC system protein C	0.135	129	106	37	165	164	286	2.867E+00	18
DESULFOASV1_2187_MliC_family_protein	AF-Q5H0H5-F1-model_v4	DESULFOASV1_2187_MliC_family_protein	AF-Q5H0H5-F1-model_v4 UvrABC system protein C	0.131	112	86	52	163	187	286	5.010E+00	18
DESULFOASV1_2187_MliC_family_protein	AF-Q5ZS74-F1-model_v4	DESULFOASV1_2187_MliC_family_protein	AF-Q5ZS74-F1-model_v4 UvrABC system protein C	0.150	125	102	39	163	167	287	3.790E+00	18
DESULFOASV1_2187_MliC_family_protein	AF-B2SKI8-F1-model_v4	DESULFOASV1_2187_MliC_family_protein	AF-B2SKI8-F1-model_v4 UvrABC system protein C	0.118	112	87	52	163	187	286	5.923E+00	18
DESULFOASV1_2187_MliC_family_protein	AF-Q90738-F1-model_v4	DESULFOASV1_2187_MliC_family_protein	AF-Q90738-F1-model_v4 Actin filament-associated protein 1	0.077	90	78	117	206	148	233	8.279E+00	18
DESULFOASV1_2187_MliC_family_protein	AF-Q8N6M8-F1-model_v4	DESULFOASV1_2187_MliC_family_protein	AF-Q8N6M8-F1-model_v4 IQ domain-containing protein F1	0.136	193	140	1	163	8	200	3.790E+00	17
