query	target	qheader	theader	fident	alnlen	mismatch	qstart	qend	tstart	tend	evalue	bits
DESULFOASV1_0444_DUF167_domain-containing_protein	AF-A4SD66-F1-model_v4	DESULFOASV1_0444_DUF167_domain-containing_protein	AF-A4SD66-F1-model_v4 UPF0235 protein Cvib_0403	0.325	83	55	5	86	2	84	6.489E-09	313
DESULFOASV1_0444_DUF167_domain-containing_protein	AF-A9W4L9-F1-model_v4	DESULFOASV1_0444_DUF167_domain-containing_protein	AF-A9W4L9-F1-model_v4 UPF0235 protein Mext_2130	0.369	91	54	2	88	1	91	6.932E-09	313
DESULFOASV1_0444_DUF167_domain-containing_protein	AF-B3EMY7-F1-model_v4	DESULFOASV1_0444_DUF167_domain-containing_protein	AF-B3EMY7-F1-model_v4 UPF0235 protein Cphamn1_2066	0.312	80	54	7	86	4	82	2.429E-08	312
DESULFOASV1_0444_DUF167_domain-containing_protein	AF-Q54UW1-F1-model_v4	DESULFOASV1_0444_DUF167_domain-containing_protein	AF-Q54UW1-F1-model_v4 UPF0235 protein	0.303	79	54	8	86	25	103	6.489E-09	310
DESULFOASV1_0444_DUF167_domain-containing_protein	AF-B6YUU2-F1-model_v4	DESULFOASV1_0444_DUF167_domain-containing_protein	AF-B6YUU2-F1-model_v4 UPF0235 protein TON_0641	0.380	82	49	5	86	2	81	7.405E-09	309
DESULFOASV1_0444_DUF167_domain-containing_protein	AF-Q58035-F1-model_v4	DESULFOASV1_0444_DUF167_domain-containing_protein	AF-Q58035-F1-model_v4 UPF0235 protein MJ0618	0.321	82	54	5	86	4	83	1.100E-08	305
DESULFOASV1_0444_DUF167_domain-containing_protein	AF-Q21D99-F1-model_v4	DESULFOASV1_0444_DUF167_domain-containing_protein	AF-Q21D99-F1-model_v4 UPF0235 protein RPC_0058	0.296	90	60	3	88	1	90	5.687E-09	305
DESULFOASV1_0444_DUF167_domain-containing_protein	AF-Q8TIP5-F1-model_v4	DESULFOASV1_0444_DUF167_domain-containing_protein	AF-Q8TIP5-F1-model_v4 UPF0235 protein MA_4097	0.239	91	65	1	86	2	92	1.530E-08	302
DESULFOASV1_0444_DUF167_domain-containing_protein	AF-Q1MAP9-F1-model_v4	DESULFOASV1_0444_DUF167_domain-containing_protein	AF-Q1MAP9-F1-model_v4 UPF0235 protein RL4503	0.365	90	55	1	88	1	90	5.687E-09	300
DESULFOASV1_0444_DUF167_domain-containing_protein	AF-Q8PYN9-F1-model_v4	DESULFOASV1_0444_DUF167_domain-containing_protein	AF-Q8PYN9-F1-model_v4 UPF0235 protein MM_0822	0.269	88	62	1	86	4	91	2.772E-08	298
DESULFOASV1_0444_DUF167_domain-containing_protein	AF-B0BQW9-F1-model_v4	DESULFOASV1_0444_DUF167_domain-containing_protein	AF-B0BQW9-F1-model_v4 UPF0235 protein APJL_1398	0.290	86	59	5	88	2	87	2.772E-08	295
DESULFOASV1_0444_DUF167_domain-containing_protein	AF-Q3KLW5-F1-model_v4	DESULFOASV1_0444_DUF167_domain-containing_protein	AF-Q3KLW5-F1-model_v4 UPF0235 protein CTA_0423	0.324	77	51	10	86	16	92	1.993E-08	295
DESULFOASV1_0444_DUF167_domain-containing_protein	AF-Q3B605-F1-model_v4	DESULFOASV1_0444_DUF167_domain-containing_protein	AF-Q3B605-F1-model_v4 UPF0235 protein Plut_0338	0.325	80	53	7	86	4	82	7.458E-08	294
DESULFOASV1_0444_DUF167_domain-containing_protein	AF-Q824A6-F1-model_v4	DESULFOASV1_0444_DUF167_domain-containing_protein	AF-Q824A6-F1-model_v4 UPF0235 protein CCA_00247	0.337	74	48	13	86	4	77	7.967E-08	291
DESULFOASV1_0444_DUF167_domain-containing_protein	AF-C3PLX4-F1-model_v4	DESULFOASV1_0444_DUF167_domain-containing_protein	AF-C3PLX4-F1-model_v4 UPF0235 protein RAF_ORF1191	0.213	89	65	6	89	4	92	1.635E-08	291
DESULFOASV1_0444_DUF167_domain-containing_protein	AF-Q2J3Y9-F1-model_v4	DESULFOASV1_0444_DUF167_domain-containing_protein	AF-Q2J3Y9-F1-model_v4 UPF0235 protein RPB_0109	0.318	90	58	3	88	1	90	1.255E-08	291
DESULFOASV1_0444_DUF167_domain-containing_protein	AF-O84393-F1-model_v4	DESULFOASV1_0444_DUF167_domain-containing_protein	AF-O84393-F1-model_v4 UPF0235 protein CT_388	0.324	77	51	10	86	16	92	2.274E-08	291
DESULFOASV1_0444_DUF167_domain-containing_protein	AF-B3PQB3-F1-model_v4	DESULFOASV1_0444_DUF167_domain-containing_protein	AF-B3PQB3-F1-model_v4 UPF0235 protein RHECIAT_CH0004196	0.365	90	55	1	88	1	90	1.100E-08	289
DESULFOASV1_0444_DUF167_domain-containing_protein	AF-A8GTZ4-F1-model_v4	DESULFOASV1_0444_DUF167_domain-containing_protein	AF-A8GTZ4-F1-model_v4 UPF0235 protein A1G_07140	0.211	90	66	5	89	3	92	1.865E-08	289
DESULFOASV1_0444_DUF167_domain-containing_protein	AF-A8GWJ3-F1-model_v4	DESULFOASV1_0444_DUF167_domain-containing_protein	AF-A8GWJ3-F1-model_v4 UPF0235 protein A1I_04385	0.224	89	64	6	89	3	91	2.274E-08	288
DESULFOASV1_0444_DUF167_domain-containing_protein	AF-Q1RIV0-F1-model_v4	DESULFOASV1_0444_DUF167_domain-containing_protein	AF-Q1RIV0-F1-model_v4 UPF0235 protein RBE_0633	0.224	89	64	6	89	3	91	2.274E-08	288
DESULFOASV1_0444_DUF167_domain-containing_protein	AF-B0BVI5-F1-model_v4	DESULFOASV1_0444_DUF167_domain-containing_protein	AF-B0BVI5-F1-model_v4 UPF0235 protein RrIowa_1526	0.211	90	66	5	89	3	92	2.129E-08	287
DESULFOASV1_0444_DUF167_domain-containing_protein	AF-B4U5M3-F1-model_v4	DESULFOASV1_0444_DUF167_domain-containing_protein	AF-B4U5M3-F1-model_v4 UPF0235 protein HY04AAS1_1378	0.305	72	49	16	87	2	73	7.458E-08	286
DESULFOASV1_0444_DUF167_domain-containing_protein	AF-Q4UJV6-F1-model_v4	DESULFOASV1_0444_DUF167_domain-containing_protein	AF-Q4UJV6-F1-model_v4 UPF0235 protein RF_1332	0.195	87	65	5	86	3	89	2.274E-08	286
DESULFOASV1_0444_DUF167_domain-containing_protein	AF-B3QA92-F1-model_v4	DESULFOASV1_0444_DUF167_domain-containing_protein	AF-B3QA92-F1-model_v4 UPF0235 protein Rpal_0418	0.285	90	61	3	88	1	90	1.993E-08	286
DESULFOASV1_0444_DUF167_domain-containing_protein	AF-Q7UFY2-F1-model_v4	DESULFOASV1_0444_DUF167_domain-containing_protein	AF-Q7UFY2-F1-model_v4 UPF0235 protein RB8260	0.391	91	54	1	89	2	92	1.746E-08	286
DESULFOASV1_0444_DUF167_domain-containing_protein	AF-B1ZLG8-F1-model_v4	DESULFOASV1_0444_DUF167_domain-containing_protein	AF-B1ZLG8-F1-model_v4 UPF0235 protein Mpop_2087	0.380	91	53	2	88	1	91	2.961E-08	286
DESULFOASV1_0444_DUF167_domain-containing_protein	AF-B0BC23-F1-model_v4	DESULFOASV1_0444_DUF167_domain-containing_protein	AF-B0BC23-F1-model_v4 UPF0235 protein CTLon_0641	0.317	85	56	2	86	10	92	1.100E-08	286
DESULFOASV1_0444_DUF167_domain-containing_protein	AF-B0B7V8-F1-model_v4	DESULFOASV1_0444_DUF167_domain-containing_protein	AF-B0B7V8-F1-model_v4 UPF0235 protein CTL0644	0.313	86	57	1	86	9	92	1.255E-08	286
DESULFOASV1_0444_DUF167_domain-containing_protein	AF-B5ZTD4-F1-model_v4	DESULFOASV1_0444_DUF167_domain-containing_protein	AF-B5ZTD4-F1-model_v4 UPF0235 protein Rleg2_3707	0.322	90	59	1	88	1	90	2.129E-08	285
DESULFOASV1_0444_DUF167_domain-containing_protein	AF-C4K236-F1-model_v4	DESULFOASV1_0444_DUF167_domain-containing_protein	AF-C4K236-F1-model_v4 UPF0235 protein RPR_04990	0.213	89	65	6	89	4	92	2.772E-08	285
DESULFOASV1_0444_DUF167_domain-containing_protein	AF-A8F059-F1-model_v4	DESULFOASV1_0444_DUF167_domain-containing_protein	AF-A8F059-F1-model_v4 UPF0235 protein A1E_05380	0.191	89	67	6	89	4	92	2.595E-08	285
DESULFOASV1_0444_DUF167_domain-containing_protein	AF-Q68Y09-F1-model_v4	DESULFOASV1_0444_DUF167_domain-containing_protein	AF-Q68Y09-F1-model_v4 UPF0235 protein RT0827	0.202	89	66	6	89	4	92	2.274E-08	285
DESULFOASV1_0444_DUF167_domain-containing_protein	AF-A8GQ50-F1-model_v4	DESULFOASV1_0444_DUF167_domain-containing_protein	AF-A8GQ50-F1-model_v4 UPF0235 protein A1C_06510	0.206	92	68	3	89	1	92	2.595E-08	284
DESULFOASV1_0444_DUF167_domain-containing_protein	AF-Q92G24-F1-model_v4	DESULFOASV1_0444_DUF167_domain-containing_protein	AF-Q92G24-F1-model_v4 UPF0235 protein RC1301	0.211	90	66	5	89	3	92	2.772E-08	283
DESULFOASV1_0444_DUF167_domain-containing_protein	AF-Q8UC38-F1-model_v4	DESULFOASV1_0444_DUF167_domain-containing_protein	AF-Q8UC38-F1-model_v4 UPF0235 protein Atu2660	0.333	86	54	7	88	14	99	3.378E-08	281
DESULFOASV1_0444_DUF167_domain-containing_protein	AF-Q8YS95-F1-model_v4	DESULFOASV1_0444_DUF167_domain-containing_protein	AF-Q8YS95-F1-model_v4 UPF0235 protein asl3196	0.297	74	51	16	89	2	75	7.967E-08	279
DESULFOASV1_0444_DUF167_domain-containing_protein	AF-B2J1T0-F1-model_v4	DESULFOASV1_0444_DUF167_domain-containing_protein	AF-B2J1T0-F1-model_v4 UPF0235 protein Npun_R3528	0.297	74	51	16	89	2	75	9.091E-08	276
DESULFOASV1_0444_DUF167_domain-containing_protein	AF-B3ER80-F1-model_v4	DESULFOASV1_0444_DUF167_domain-containing_protein	AF-B3ER80-F1-model_v4 UPF0235 protein Aasi_0294	0.243	74	55	14	87	2	75	2.290E-07	276
DESULFOASV1_0444_DUF167_domain-containing_protein	AF-Q9PK06-F1-model_v4	DESULFOASV1_0444_DUF167_domain-containing_protein	AF-Q9PK06-F1-model_v4 UPF0235 protein TC_0667	0.310	74	50	13	86	4	77	1.184E-07	276
DESULFOASV1_0444_DUF167_domain-containing_protein	AF-B7KEV7-F1-model_v4	DESULFOASV1_0444_DUF167_domain-containing_protein	AF-B7KEV7-F1-model_v4 UPF0235 protein PCC7424_0673	0.333	72	47	16	87	2	73	1.351E-07	275
DESULFOASV1_0444_DUF167_domain-containing_protein	AF-Q8TYM3-F1-model_v4	DESULFOASV1_0444_DUF167_domain-containing_protein	AF-Q8TYM3-F1-model_v4 UPF0235 protein MK0273	0.290	84	58	3	86	1	82	6.119E-08	275
DESULFOASV1_0444_DUF167_domain-containing_protein	AF-Q3M687-F1-model_v4	DESULFOASV1_0444_DUF167_domain-containing_protein	AF-Q3M687-F1-model_v4 UPF0235 protein Ava_3894	0.297	74	51	16	89	2	75	1.108E-07	274
DESULFOASV1_0444_DUF167_domain-containing_protein	AF-Q8U052-F1-model_v4	DESULFOASV1_0444_DUF167_domain-containing_protein	AF-Q8U052-F1-model_v4 UPF0235 protein PF1765	0.329	80	52	7	86	2	79	1.037E-07	274
DESULFOASV1_0444_DUF167_domain-containing_protein	AF-Q9V1C6-F1-model_v4	DESULFOASV1_0444_DUF167_domain-containing_protein	AF-Q9V1C6-F1-model_v4 UPF0235 protein PYRAB05010	0.317	80	53	7	86	2	79	1.184E-07	273
DESULFOASV1_0444_DUF167_domain-containing_protein	AF-Q9ZCC0-F1-model_v4	DESULFOASV1_0444_DUF167_domain-containing_protein	AF-Q9ZCC0-F1-model_v4 UPF0235 protein RP839	0.222	90	65	5	89	3	92	6.536E-08	273
DESULFOASV1_0444_DUF167_domain-containing_protein	AF-Q0BVH7-F1-model_v4	DESULFOASV1_0444_DUF167_domain-containing_protein	AF-Q0BVH7-F1-model_v4 UPF0235 protein GbCGDNIH1_0277	0.303	88	58	5	88	2	89	8.511E-08	270
DESULFOASV1_0444_DUF167_domain-containing_protein	AF-Q72QP5-F1-model_v4	DESULFOASV1_0444_DUF167_domain-containing_protein	AF-Q72QP5-F1-model_v4 UPF0235 protein LIC_12068	0.277	72	51	16	87	2	73	1.541E-07	267
DESULFOASV1_0444_DUF167_domain-containing_protein	AF-Q98EP2-F1-model_v4	DESULFOASV1_0444_DUF167_domain-containing_protein	AF-Q98EP2-F1-model_v4 UPF0235 protein msl4154	0.329	90	57	3	88	1	90	9.091E-08	265
DESULFOASV1_0444_DUF167_domain-containing_protein	AF-Q8F5E6-F1-model_v4	DESULFOASV1_0444_DUF167_domain-containing_protein	AF-Q8F5E6-F1-model_v4 UPF0235 protein LA_1736	0.277	72	51	16	87	2	73	2.144E-07	263
DESULFOASV1_0444_DUF167_domain-containing_protein	AF-B2V7H9-F1-model_v4	DESULFOASV1_0444_DUF167_domain-containing_protein	AF-B2V7H9-F1-model_v4 UPF0235 protein SYO3AOP1_0257	0.305	72	49	16	87	2	73	2.982E-07	262
DESULFOASV1_0444_DUF167_domain-containing_protein	AF-B2HE69-F1-model_v4	DESULFOASV1_0444_DUF167_domain-containing_protein	AF-B2HE69-F1-model_v4 UPF0235 protein MMAR_2910	0.360	75	47	14	87	2	76	3.403E-07	260
DESULFOASV1_0444_DUF167_domain-containing_protein	AF-B6JAU6-F1-model_v4	DESULFOASV1_0444_DUF167_domain-containing_protein	AF-B6JAU6-F1-model_v4 UPF0235 protein OCAR_4310/OCA5_c02140	0.290	90	62	1	88	1	90	9.712E-08	259
DESULFOASV1_0444_DUF167_domain-containing_protein	AF-A1T903-F1-model_v4	DESULFOASV1_0444_DUF167_domain-containing_protein	AF-A1T903-F1-model_v4 UPF0235 protein Mvan_2846	0.342	73	47	14	85	2	74	4.431E-07	258
DESULFOASV1_0444_DUF167_domain-containing_protein	AF-C0QR78-F1-model_v4	DESULFOASV1_0444_DUF167_domain-containing_protein	AF-C0QR78-F1-model_v4 UPF0235 protein PERMA_1406	0.291	72	50	16	87	2	73	3.186E-07	257
DESULFOASV1_0444_DUF167_domain-containing_protein	AF-Q8DHG5-F1-model_v4	DESULFOASV1_0444_DUF167_domain-containing_protein	AF-Q8DHG5-F1-model_v4 UPF0235 protein tsr1994	0.333	72	47	16	87	3	74	1.647E-07	257
DESULFOASV1_0444_DUF167_domain-containing_protein	AF-Q5L6M2-F1-model_v4	DESULFOASV1_0444_DUF167_domain-containing_protein	AF-Q5L6M2-F1-model_v4 UPF0235 protein CAB243	0.298	77	53	10	86	1	77	1.759E-07	257
DESULFOASV1_0444_DUF167_domain-containing_protein	AF-Q9YFR7-F1-model_v4	DESULFOASV1_0444_DUF167_domain-containing_protein	AF-Q9YFR7-F1-model_v4 UPF0235 protein APE_0182.1	0.238	88	63	5	92	10	93	1.351E-07	256
DESULFOASV1_0444_DUF167_domain-containing_protein	AF-Q2K3C8-F1-model_v4	DESULFOASV1_0444_DUF167_domain-containing_protein	AF-Q2K3C8-F1-model_v4 UPF0235 protein RHE_CH03912	0.323	99	59	1	88	1	99	2.595E-08	255
DESULFOASV1_0444_DUF167_domain-containing_protein	AF-O26734-F1-model_v4	DESULFOASV1_0444_DUF167_domain-containing_protein	AF-O26734-F1-model_v4 UPF0235 protein MTH_637	0.250	86	62	1	86	1	84	2.007E-07	246
DESULFOASV1_0444_DUF167_domain-containing_protein	AF-Q04TD1-F1-model_v4	DESULFOASV1_0444_DUF167_domain-containing_protein	AF-Q04TD1-F1-model_v4 UPF0235 protein LBJ_1240	0.291	72	50	16	87	2	73	6.584E-07	245
DESULFOASV1_0444_DUF167_domain-containing_protein	AF-Q052F7-F1-model_v4	DESULFOASV1_0444_DUF167_domain-containing_protein	AF-Q052F7-F1-model_v4 UPF0235 protein LBL_1291	0.291	72	50	16	87	2	73	6.584E-07	244
DESULFOASV1_0444_DUF167_domain-containing_protein	AF-B0UH52-F1-model_v4	DESULFOASV1_0444_DUF167_domain-containing_protein	AF-B0UH52-F1-model_v4 UPF0235 protein M446_3939	0.279	90	63	1	88	1	90	5.770E-07	241
DESULFOASV1_0444_DUF167_domain-containing_protein	AF-A0QYZ8-F1-model_v4	DESULFOASV1_0444_DUF167_domain-containing_protein	AF-A0QYZ8-F1-model_v4 UPF0235 protein MSMEG_3845	0.297	74	51	14	86	2	75	1.659E-06	240
DESULFOASV1_0444_DUF167_domain-containing_protein	AF-A1B422-F1-model_v4	DESULFOASV1_0444_DUF167_domain-containing_protein	AF-A1B422-F1-model_v4 UPF0235 protein Pden_2174	0.328	76	49	11	86	9	82	6.163E-07	240
DESULFOASV1_0444_DUF167_domain-containing_protein	AF-Q3Z6Z5-F1-model_v4	DESULFOASV1_0444_DUF167_domain-containing_protein	AF-Q3Z6Z5-F1-model_v4 UPF0235 protein DET1292	0.337	80	51	8	87	3	80	2.982E-07	240
DESULFOASV1_0444_DUF167_domain-containing_protein	AF-A5U406-F1-model_v4	DESULFOASV1_0444_DUF167_domain-containing_protein	AF-A5U406-F1-model_v4 UPF0235 protein MRA_1997	0.337	75	48	14	87	2	76	6.584E-07	239
DESULFOASV1_0444_DUF167_domain-containing_protein	AF-A5FQ39-F1-model_v4	DESULFOASV1_0444_DUF167_domain-containing_protein	AF-A5FQ39-F1-model_v4 UPF0235 protein DehaBAV1_1103	0.350	80	50	8	87	3	80	5.401E-07	238
DESULFOASV1_0444_DUF167_domain-containing_protein	AF-A4T9S3-F1-model_v4	DESULFOASV1_0444_DUF167_domain-containing_protein	AF-A4T9S3-F1-model_v4 UPF0235 protein Mflv_3569	0.328	73	48	14	85	2	74	1.772E-06	236
DESULFOASV1_0444_DUF167_domain-containing_protein	AF-Q3ZYH5-F1-model_v4	DESULFOASV1_0444_DUF167_domain-containing_protein	AF-Q3ZYH5-F1-model_v4 UPF0235 protein cbdbA1230	0.354	79	49	9	87	4	80	7.513E-07	233
DESULFOASV1_0444_DUF167_domain-containing_protein	AF-Q6LYD6-F1-model_v4	DESULFOASV1_0444_DUF167_domain-containing_protein	AF-Q6LYD6-F1-model_v4 UPF0235 protein MMP1055	0.280	80	55	6	85	5	82	1.659E-06	231
DESULFOASV1_0444_DUF167_domain-containing_protein	AF-A6UVA1-F1-model_v4	DESULFOASV1_0444_DUF167_domain-containing_protein	AF-A6UVA1-F1-model_v4 UPF0235 protein Maeo_0841	0.304	89	58	5	93	4	88	9.782E-07	226
DESULFOASV1_0444_DUF167_domain-containing_protein	AF-O28207-F1-model_v4	DESULFOASV1_0444_DUF167_domain-containing_protein	AF-O28207-F1-model_v4 UPF0235 protein AF_2072	0.283	80	54	8	87	1	77	1.274E-06	225
DESULFOASV1_0444_DUF167_domain-containing_protein	AF-A9AAP2-F1-model_v4	DESULFOASV1_0444_DUF167_domain-containing_protein	AF-A9AAP2-F1-model_v4 UPF0235 protein MmarC6_1603	0.301	81	55	5	85	4	82	5.093E-06	219
DESULFOASV1_0444_DUF167_domain-containing_protein	AF-A6VG03-F1-model_v4	DESULFOASV1_0444_DUF167_domain-containing_protein	AF-A6VG03-F1-model_v4 UPF0235 protein MmarC7_0309	0.313	81	54	5	85	4	82	7.084E-06	216
DESULFOASV1_0444_DUF167_domain-containing_protein	AF-A6UP65-F1-model_v4	DESULFOASV1_0444_DUF167_domain-containing_protein	AF-A6UP65-F1-model_v4 UPF0235 protein Mevan_0378	0.264	85	60	5	89	4	86	3.911E-06	212
DESULFOASV1_0444_DUF167_domain-containing_protein	AF-A4FXC3-F1-model_v4	DESULFOASV1_0444_DUF167_domain-containing_protein	AF-A4FXC3-F1-model_v4 UPF0235 protein MmarC5_0538	0.280	80	55	6	85	5	82	1.053E-05	210
DESULFOASV1_0444_DUF167_domain-containing_protein	AF-Q9A2E3-F1-model_v4	DESULFOASV1_0444_DUF167_domain-containing_protein	AF-Q9A2E3-F1-model_v4 UPF0235 protein CC_3622	0.301	83	54	9	86	1	83	2.812E-06	205
DESULFOASV1_0444_DUF167_domain-containing_protein	AF-B8H6E1-F1-model_v4	DESULFOASV1_0444_DUF167_domain-containing_protein	AF-B8H6E1-F1-model_v4 UPF0235 protein CCNA_03737	0.296	87	60	9	94	1	87	1.772E-06	202
DESULFOASV1_0444_DUF167_domain-containing_protein	AF-P52064-F1-model_v4	DESULFOASV1_0444_DUF167_domain-containing_protein	AF-P52064-F1-model_v4 UPF0235 protein in proC 3'region	0.339	53	34	3	55	1	52	1.485E-03	132
DESULFOASV1_0444_DUF167_domain-containing_protein	AF-O27965-F1-model_v4	DESULFOASV1_0444_DUF167_domain-containing_protein	AF-O27965-F1-model_v4 50S ribosomal protein L15e	0.146	78	66	8	85	54	131	4.332E-01	38
DESULFOASV1_0444_DUF167_domain-containing_protein	AF-Q4ZW13-F1-model_v4	DESULFOASV1_0444_DUF167_domain-containing_protein	AF-Q4ZW13-F1-model_v4 Cell division topological specificity factor	0.129	82	59	8	89	16	84	3.327E-01	37
DESULFOASV1_0444_DUF167_domain-containing_protein	AF-A9I8B8-F1-model_v4	DESULFOASV1_0444_DUF167_domain-containing_protein	AF-A9I8B8-F1-model_v4 Cell division topological specificity factor	0.117	83	61	10	92	17	86	6.437E-01	36
DESULFOASV1_0444_DUF167_domain-containing_protein	AF-Q18E75-F1-model_v4	DESULFOASV1_0444_DUF167_domain-containing_protein	AF-Q18E75-F1-model_v4 Replication factor C small subunit	0.097	82	50	5	86	220	275	1.330E+00	36
DESULFOASV1_0444_DUF167_domain-containing_protein	AF-Q7VU91-F1-model_v4	DESULFOASV1_0444_DUF167_domain-containing_protein	AF-Q7VU91-F1-model_v4 Cell division topological specificity factor	0.102	78	55	8	85	15	76	4.628E-01	35
DESULFOASV1_0444_DUF167_domain-containing_protein	AF-Q48L75-F1-model_v4	DESULFOASV1_0444_DUF167_domain-containing_protein	AF-Q48L75-F1-model_v4 Cell division topological specificity factor	0.129	82	59	8	89	16	84	4.943E-01	35
DESULFOASV1_0444_DUF167_domain-containing_protein	AF-Q0W2Z5-F1-model_v4	DESULFOASV1_0444_DUF167_domain-containing_protein	AF-Q0W2Z5-F1-model_v4 50S ribosomal protein L15e	0.129	78	67	8	85	55	132	4.055E-01	35
DESULFOASV1_0444_DUF167_domain-containing_protein	AF-Q8PTU5-F1-model_v4	DESULFOASV1_0444_DUF167_domain-containing_protein	AF-Q8PTU5-F1-model_v4 50S ribosomal protein L15e	0.121	78	68	8	85	55	132	6.876E-01	35
DESULFOASV1_0444_DUF167_domain-containing_protein	AF-A4YCU5-F1-model_v4	DESULFOASV1_0444_DUF167_domain-containing_protein	AF-A4YCU5-F1-model_v4 50S ribosomal protein L15e	0.166	78	64	8	85	53	130	1.720E-01	35
DESULFOASV1_0444_DUF167_domain-containing_protein	AF-Q7W4S7-F1-model_v4	DESULFOASV1_0444_DUF167_domain-containing_protein	AF-Q7W4S7-F1-model_v4 Cell division topological specificity factor	0.102	78	55	8	85	15	76	5.280E-01	34
DESULFOASV1_0444_DUF167_domain-containing_protein	AF-Q7WGA3-F1-model_v4	DESULFOASV1_0444_DUF167_domain-containing_protein	AF-Q7WGA3-F1-model_v4 Cell division topological specificity factor	0.101	79	56	8	86	15	77	6.437E-01	34
DESULFOASV1_0444_DUF167_domain-containing_protein	AF-A4JCA9-F1-model_v4	DESULFOASV1_0444_DUF167_domain-containing_protein	AF-A4JCA9-F1-model_v4 Cell division topological specificity factor	0.112	85	63	2	86	9	80	3.796E-01	34
DESULFOASV1_0444_DUF167_domain-containing_protein	AF-A4VJG3-F1-model_v4	DESULFOASV1_0444_DUF167_domain-containing_protein	AF-A4VJG3-F1-model_v4 Cell division topological specificity factor	0.120	80	58	10	89	19	85	6.876E-01	34
DESULFOASV1_0444_DUF167_domain-containing_protein	AF-A3DMU2-F1-model_v4	DESULFOASV1_0444_DUF167_domain-containing_protein	AF-A3DMU2-F1-model_v4 50S ribosomal protein L15e	0.154	78	65	8	85	55	132	2.096E-01	34
DESULFOASV1_0444_DUF167_domain-containing_protein	AF-B3M383-F1-model_v4	DESULFOASV1_0444_DUF167_domain-containing_protein	AF-B3M383-F1-model_v4 Probable ATP-dependent RNA helicase spindle-E	0.136	44	37	45	88	764	807	2.409E+00	34
DESULFOASV1_0444_DUF167_domain-containing_protein	AF-A9AER8-F1-model_v4	DESULFOASV1_0444_DUF167_domain-containing_protein	AF-A9AER8-F1-model_v4 Cell division topological specificity factor	0.114	85	63	2	86	9	80	6.026E-01	33
DESULFOASV1_0444_DUF167_domain-containing_protein	AF-Q5WVX1-F1-model_v4	DESULFOASV1_0444_DUF167_domain-containing_protein	AF-Q5WVX1-F1-model_v4 Cell division topological specificity factor	0.129	83	59	10	92	16	84	1.091E+00	33
DESULFOASV1_0444_DUF167_domain-containing_protein	AF-A5ICN0-F1-model_v4	DESULFOASV1_0444_DUF167_domain-containing_protein	AF-A5ICN0-F1-model_v4 Cell division topological specificity factor	0.126	85	61	8	92	14	84	1.166E+00	33
DESULFOASV1_0444_DUF167_domain-containing_protein	AF-Q602J5-F1-model_v4	DESULFOASV1_0444_DUF167_domain-containing_protein	AF-Q602J5-F1-model_v4 Cell division topological specificity factor	0.146	86	61	10	95	17	89	6.437E-01	33
DESULFOASV1_0444_DUF167_domain-containing_protein	AF-B3DH20-F1-model_v4	DESULFOASV1_0444_DUF167_domain-containing_protein	AF-B3DH20-F1-model_v4 Protein tilB homolog	0.091	89	72	7	95	285	364	6.437E-01	33
DESULFOASV1_0444_DUF167_domain-containing_protein	AF-Q3JPR4-F1-model_v4	DESULFOASV1_0444_DUF167_domain-containing_protein	AF-Q3JPR4-F1-model_v4 Cell division topological specificity factor	0.113	77	56	10	86	17	80	8.381E-01	32
DESULFOASV1_0444_DUF167_domain-containing_protein	AF-C1DQM6-F1-model_v4	DESULFOASV1_0444_DUF167_domain-containing_protein	AF-C1DQM6-F1-model_v4 Cell division topological specificity factor	0.129	82	61	8	89	14	84	8.953E-01	32
DESULFOASV1_0444_DUF167_domain-containing_protein	AF-Q2KVW5-F1-model_v4	DESULFOASV1_0444_DUF167_domain-containing_protein	AF-Q2KVW5-F1-model_v4 Cell division topological specificity factor	0.108	86	67	8	93	15	90	8.953E-01	32
DESULFOASV1_0444_DUF167_domain-containing_protein	AF-Q1IDE4-F1-model_v4	DESULFOASV1_0444_DUF167_domain-containing_protein	AF-Q1IDE4-F1-model_v4 Cell division topological specificity factor	0.112	78	56	9	86	17	80	1.330E+00	31
DESULFOASV1_0444_DUF167_domain-containing_protein	AF-B4EBQ9-F1-model_v4	DESULFOASV1_0444_DUF167_domain-containing_protein	AF-B4EBQ9-F1-model_v4 Cell division topological specificity factor	0.136	85	61	2	86	9	80	7.345E-01	31
DESULFOASV1_0444_DUF167_domain-containing_protein	AF-B2AG17-F1-model_v4	DESULFOASV1_0444_DUF167_domain-containing_protein	AF-B2AG17-F1-model_v4 Cell division topological specificity factor	0.109	79	58	8	86	15	80	8.953E-01	31
DESULFOASV1_0444_DUF167_domain-containing_protein	AF-A1K616-F1-model_v4	DESULFOASV1_0444_DUF167_domain-containing_protein	AF-A1K616-F1-model_v4 Cell division topological specificity factor	0.068	85	66	8	92	15	86	1.330E+00	31
DESULFOASV1_0444_DUF167_domain-containing_protein	AF-P54060-F1-model_v4	DESULFOASV1_0444_DUF167_domain-containing_protein	AF-P54060-F1-model_v4 50S ribosomal protein L15e	0.134	78	67	8	85	53	130	1.421E+00	31
DESULFOASV1_0444_DUF167_domain-containing_protein	AF-A1U344-F1-model_v4	DESULFOASV1_0444_DUF167_domain-containing_protein	AF-A1U344-F1-model_v4 Cell division topological specificity factor	0.098	79	58	8	86	15	79	1.091E+00	30
DESULFOASV1_0444_DUF167_domain-containing_protein	AF-Q87YC6-F1-model_v4	DESULFOASV1_0444_DUF167_domain-containing_protein	AF-Q87YC6-F1-model_v4 Cell division topological specificity factor	0.129	82	59	8	89	16	84	1.166E+00	30
DESULFOASV1_0444_DUF167_domain-containing_protein	AF-Q6AQH6-F1-model_v4	DESULFOASV1_0444_DUF167_domain-containing_protein	AF-Q6AQH6-F1-model_v4 Cell division topological specificity factor	0.094	85	62	8	92	16	84	1.166E+00	30
DESULFOASV1_0444_DUF167_domain-containing_protein	AF-Q1LSF7-F1-model_v4	DESULFOASV1_0444_DUF167_domain-containing_protein	AF-Q1LSF7-F1-model_v4 Cell division topological specificity factor	0.113	85	63	2	86	9	80	8.953E-01	30
DESULFOASV1_0444_DUF167_domain-containing_protein	AF-A4XRN2-F1-model_v4	DESULFOASV1_0444_DUF167_domain-containing_protein	AF-A4XRN2-F1-model_v4 Cell division topological specificity factor	0.108	80	59	10	89	18	84	1.421E+00	30
DESULFOASV1_0444_DUF167_domain-containing_protein	AF-Q8XU28-F1-model_v4	DESULFOASV1_0444_DUF167_domain-containing_protein	AF-Q8XU28-F1-model_v4 Cell division topological specificity factor	0.113	85	63	2	86	9	80	1.091E+00	30
DESULFOASV1_0444_DUF167_domain-containing_protein	AF-B7V7X4-F1-model_v4	DESULFOASV1_0444_DUF167_domain-containing_protein	AF-B7V7X4-F1-model_v4 Cell division topological specificity factor	0.096	80	60	10	89	18	84	1.245E+00	30
DESULFOASV1_0444_DUF167_domain-containing_protein	AF-B1JXA3-F1-model_v4	DESULFOASV1_0444_DUF167_domain-containing_protein	AF-B1JXA3-F1-model_v4 Cell division topological specificity factor	0.108	79	58	8	86	15	80	8.953E-01	30
DESULFOASV1_0444_DUF167_domain-containing_protein	AF-Q143C7-F1-model_v4	DESULFOASV1_0444_DUF167_domain-containing_protein	AF-Q143C7-F1-model_v4 Cell division topological specificity factor	0.101	85	64	2	86	9	80	9.564E-01	30
DESULFOASV1_0444_DUF167_domain-containing_protein	AF-Q3KFM0-F1-model_v4	DESULFOASV1_0444_DUF167_domain-containing_protein	AF-Q3KFM0-F1-model_v4 Cell division topological specificity factor	0.117	82	60	8	89	16	84	1.330E+00	30
DESULFOASV1_0444_DUF167_domain-containing_protein	AF-A1V1P2-F1-model_v4	DESULFOASV1_0444_DUF167_domain-containing_protein	AF-A1V1P2-F1-model_v4 Cell division topological specificity factor	0.101	77	57	10	86	17	80	1.518E+00	30
DESULFOASV1_0444_DUF167_domain-containing_protein	AF-B3PCV7-F1-model_v4	DESULFOASV1_0444_DUF167_domain-containing_protein	AF-B3PCV7-F1-model_v4 Cell division topological specificity factor	0.111	79	59	8	86	16	82	1.518E+00	30
DESULFOASV1_0444_DUF167_domain-containing_protein	AF-A1VI55-F1-model_v4	DESULFOASV1_0444_DUF167_domain-containing_protein	AF-A1VI55-F1-model_v4 Cell division topological specificity factor	0.114	85	64	2	86	10	82	1.091E+00	30
DESULFOASV1_0444_DUF167_domain-containing_protein	AF-A4G413-F1-model_v4	DESULFOASV1_0444_DUF167_domain-containing_protein	AF-A4G413-F1-model_v4 Cell division topological specificity factor	0.088	87	67	8	94	15	88	1.330E+00	30
