query	target	qheader	theader	fident	alnlen	mismatch	qstart	qend	tstart	tend	evalue	bits
DESULFOASV1_1572_hypothetical_protein	AF-A4QTI0-F1-model_v4	DESULFOASV1_1572_hypothetical_protein	AF-A4QTI0-F1-model_v4 Inclusion body clearance protein IML2	0.155	178	134	64	223	438	615	6.762E-01	53
DESULFOASV1_1572_hypothetical_protein	AF-Q69ZJ7-F1-model_v4	DESULFOASV1_1572_hypothetical_protein	AF-Q69ZJ7-F1-model_v4 Guanine nucleotide exchange factor subunit RIC1	0.127	142	108	82	206	854	995	6.762E-01	53
DESULFOASV1_1572_hypothetical_protein	AF-Q8L6Y7-F1-model_v4	DESULFOASV1_1572_hypothetical_protein	AF-Q8L6Y7-F1-model_v4 Pentatricopeptide repeat-containing protein At2g38420, mitochondrial	0.124	135	115	84	215	266	400	3.045E+00	52
DESULFOASV1_1572_hypothetical_protein	AF-A1D6T6-F1-model_v4	DESULFOASV1_1572_hypothetical_protein	AF-A1D6T6-F1-model_v4 Eukaryotic translation initiation factor 3 subunit E	0.109	235	142	59	218	104	338	3.598E-01	52
DESULFOASV1_1572_hypothetical_protein	AF-A3KPN8-F1-model_v4	DESULFOASV1_1572_hypothetical_protein	AF-A3KPN8-F1-model_v4 Tetratricopeptide repeat protein 38	0.171	160	126	71	223	225	384	1.701E+00	52
DESULFOASV1_1572_hypothetical_protein	AF-B2VDC8-F1-model_v4	DESULFOASV1_1572_hypothetical_protein	AF-B2VDC8-F1-model_v4 Penicillin-binding protein activator LpoA	0.186	143	116	80	222	40	182	1.785E+00	52
DESULFOASV1_1572_hypothetical_protein	AF-Q9FRI5-F1-model_v4	DESULFOASV1_1572_hypothetical_protein	AF-Q9FRI5-F1-model_v4 Pentatricopeptide repeat-containing protein At1g25360	0.167	168	126	68	219	483	650	1.967E+00	52
DESULFOASV1_1572_hypothetical_protein	AF-Q7SA06-F1-model_v4	DESULFOASV1_1572_hypothetical_protein	AF-Q7SA06-F1-model_v4 Inclusion body clearance protein iml2	0.162	160	119	64	223	480	622	9.499E-01	52
DESULFOASV1_1572_hypothetical_protein	AF-B1X764-F1-model_v4	DESULFOASV1_1572_hypothetical_protein	AF-B1X764-F1-model_v4 HTH-type transcriptional regulator MalT	0.139	158	133	64	218	573	730	1.211E+00	52
DESULFOASV1_1572_hypothetical_protein	AF-A8X0L4-F1-model_v4	DESULFOASV1_1572_hypothetical_protein	AF-A8X0L4-F1-model_v4 Protein ST7 homolog	0.105	260	185	15	222	34	293	3.427E-01	51
DESULFOASV1_1572_hypothetical_protein	AF-A0M8U1-F1-model_v4	DESULFOASV1_1572_hypothetical_protein	AF-A0M8U1-F1-model_v4 Suppressor of tumorigenicity 7 protein homolog	0.115	278	185	14	223	46	323	3.265E-01	50
DESULFOASV1_1572_hypothetical_protein	AF-Q93903-F1-model_v4	DESULFOASV1_1572_hypothetical_protein	AF-Q93903-F1-model_v4 Protein gfi-3	0.111	186	140	64	221	605	790	1.099E+00	50
DESULFOASV1_1572_hypothetical_protein	AF-O43683-F1-model_v4	DESULFOASV1_1572_hypothetical_protein	AF-O43683-F1-model_v4 Mitotic checkpoint serine/threonine-protein kinase BUB1	0.135	146	106	101	224	4	149	9.499E-01	50
DESULFOASV1_1572_hypothetical_protein	AF-P22137-F1-model_v4	DESULFOASV1_1572_hypothetical_protein	AF-P22137-F1-model_v4 Clathrin heavy chain	0.141	187	142	59	224	1002	1188	7.452E-01	50
DESULFOASV1_1572_hypothetical_protein	AF-Q9JKU3-F1-model_v4	DESULFOASV1_1572_hypothetical_protein	AF-Q9JKU3-F1-model_v4 Intraflagellar transport protein 172 homolog	0.176	211	169	14	224	722	927	7.822E-01	50
DESULFOASV1_1572_hypothetical_protein	AF-A8AQX2-F1-model_v4	DESULFOASV1_1572_hypothetical_protein	AF-A8AQX2-F1-model_v4 HTH-type transcriptional regulator MalT	0.145	158	132	64	218	573	730	1.701E+00	49
DESULFOASV1_1572_hypothetical_protein	AF-Q5L5J7-F1-model_v4	DESULFOASV1_1572_hypothetical_protein	AF-Q5L5J7-F1-model_v4 Serine/threonine-protein kinase PknD	0.152	161	131	64	219	478	638	2.764E+00	49
DESULFOASV1_1572_hypothetical_protein	AF-Q22830-F1-model_v4	DESULFOASV1_1572_hypothetical_protein	AF-Q22830-F1-model_v4 Intraflagellar transport protein osm-1	0.164	218	155	14	199	716	933	1.914E-01	49
DESULFOASV1_1572_hypothetical_protein	AF-O24968-F1-model_v4	DESULFOASV1_1572_hypothetical_protein	AF-O24968-F1-model_v4 Putative beta-lactamase HcpD	0.121	141	117	84	224	158	291	1.620E+00	48
DESULFOASV1_1572_hypothetical_protein	AF-Q60YJ7-F1-model_v4	DESULFOASV1_1572_hypothetical_protein	AF-Q60YJ7-F1-model_v4 PCI domain-containing protein 2 homolog	0.118	175	138	61	218	89	263	1.047E+00	48
DESULFOASV1_1572_hypothetical_protein	AF-O95782-F1-model_v4	DESULFOASV1_1572_hypothetical_protein	AF-O95782-F1-model_v4 AP-2 complex subunit alpha-1	0.177	173	114	62	200	278	450	1.271E+00	48
DESULFOASV1_1572_hypothetical_protein	AF-Q54TH4-F1-model_v4	DESULFOASV1_1572_hypothetical_protein	AF-Q54TH4-F1-model_v4 Golgi to ER traffic protein 4 homolog	0.105	237	172	33	225	7	243	5.054E-01	47
DESULFOASV1_1572_hypothetical_protein	AF-P61202-F1-model_v4	DESULFOASV1_1572_hypothetical_protein	AF-P61202-F1-model_v4 COP9 signalosome complex subunit 2	0.111	272	190	1	215	9	280	5.054E-01	47
DESULFOASV1_1572_hypothetical_protein	AF-Q8C159-F1-model_v4	DESULFOASV1_1572_hypothetical_protein	AF-Q8C159-F1-model_v4 Tetratricopeptide repeat protein 22	0.157	179	119	84	225	85	263	2.440E-01	47
DESULFOASV1_1572_hypothetical_protein	AF-Q683I9-F1-model_v4	DESULFOASV1_1572_hypothetical_protein	AF-Q683I9-F1-model_v4 Pentatricopeptide repeat-containing protein At3g62890	0.119	172	121	86	223	251	422	1.543E+00	47
DESULFOASV1_1572_hypothetical_protein	AF-P53271-F1-model_v4	DESULFOASV1_1572_hypothetical_protein	AF-P53271-F1-model_v4 Conserved oligomeric Golgi complex subunit 2	0.173	176	136	10	185	97	261	5.569E-01	46
DESULFOASV1_1572_hypothetical_protein	AF-Q95QU0-F1-model_v4	DESULFOASV1_1572_hypothetical_protein	AF-Q95QU0-F1-model_v4 PCI domain-containing protein 2 homolog	0.118	175	138	61	218	89	263	9.971E-01	46
DESULFOASV1_1572_hypothetical_protein	AF-Q2H2B2-F1-model_v4	DESULFOASV1_1572_hypothetical_protein	AF-Q2H2B2-F1-model_v4 Inclusion body clearance protein IML2	0.133	160	132	64	223	491	643	1.874E+00	46
DESULFOASV1_1572_hypothetical_protein	AF-P18484-F1-model_v4	DESULFOASV1_1572_hypothetical_protein	AF-P18484-F1-model_v4 AP-2 complex subunit alpha-2	0.172	188	127	62	215	277	464	6.762E-01	46
DESULFOASV1_1572_hypothetical_protein	AF-Q5RHH4-F1-model_v4	DESULFOASV1_1572_hypothetical_protein	AF-Q5RHH4-F1-model_v4 Intraflagellar transport protein 172 homolog	0.140	242	178	14	221	722	963	2.689E-01	46
DESULFOASV1_1572_hypothetical_protein	AF-Q9UG01-F1-model_v4	DESULFOASV1_1572_hypothetical_protein	AF-Q9UG01-F1-model_v4 Intraflagellar transport protein 172 homolog	0.150	235	178	14	223	722	956	6.137E-01	46
DESULFOASV1_1572_hypothetical_protein	AF-A0QNI9-F1-model_v4	DESULFOASV1_1572_hypothetical_protein	AF-A0QNI9-F1-model_v4 ESX-1 secretion system protein EccA1	0.157	149	117	68	216	108	247	3.523E+00	45
DESULFOASV1_1572_hypothetical_protein	AF-O65543-F1-model_v4	DESULFOASV1_1572_hypothetical_protein	AF-O65543-F1-model_v4 Pentatricopeptide repeat-containing protein At4g31070, mitochondrial	0.150	149	121	82	224	447	595	6.308E+00	45
DESULFOASV1_1572_hypothetical_protein	AF-Q9STS9-F1-model_v4	DESULFOASV1_1572_hypothetical_protein	AF-Q9STS9-F1-model_v4 Putative pentatricopeptide repeat-containing protein At3g47840	0.161	142	115	83	224	495	632	7.659E+00	45
DESULFOASV1_1572_hypothetical_protein	AF-Q9SSR4-F1-model_v4	DESULFOASV1_1572_hypothetical_protein	AF-Q9SSR4-F1-model_v4 Pentatricopeptide repeat-containing protein At1g52620	0.143	141	112	84	215	351	491	4.490E+00	45
DESULFOASV1_1572_hypothetical_protein	AF-Q0VCK5-F1-model_v4	DESULFOASV1_1572_hypothetical_protein	AF-Q0VCK5-F1-model_v4 AP-2 complex subunit alpha-2	0.177	173	114	62	200	278	450	1.334E+00	45
DESULFOASV1_1572_hypothetical_protein	AF-P32565-F1-model_v4	DESULFOASV1_1572_hypothetical_protein	AF-P32565-F1-model_v4 26S proteasome regulatory subunit RPN2	0.142	150	114	82	215	40	189	1.785E+00	45
DESULFOASV1_1572_hypothetical_protein	AF-Q6C161-F1-model_v4	DESULFOASV1_1572_hypothetical_protein	AF-Q6C161-F1-model_v4 Eukaryotic translation initiation factor 3 subunit A	0.119	176	115	84	215	157	332	6.009E+00	45
DESULFOASV1_1572_hypothetical_protein	AF-Q28C74-F1-model_v4	DESULFOASV1_1572_hypothetical_protein	AF-Q28C74-F1-model_v4 Leucine-rich PPR motif-containing protein, mitochondrial	0.103	209	145	60	222	754	962	4.369E-01	45
DESULFOASV1_1572_hypothetical_protein	AF-Q5ZLF0-F1-model_v4	DESULFOASV1_1572_hypothetical_protein	AF-Q5ZLF0-F1-model_v4 Hsc70-interacting protein	0.132	148	119	77	224	101	238	2.901E+00	44
DESULFOASV1_1572_hypothetical_protein	AF-Q680Z7-F1-model_v4	DESULFOASV1_1572_hypothetical_protein	AF-Q680Z7-F1-model_v4 Pentatricopeptide repeat-containing protein At1g09220, mitochondrial	0.123	182	123	84	224	307	488	2.168E+00	44
DESULFOASV1_1572_hypothetical_protein	AF-Q4PSD1-F1-model_v4	DESULFOASV1_1572_hypothetical_protein	AF-Q4PSD1-F1-model_v4 Pumilio homolog 14	0.133	127	107	72	195	205	331	1.334E+00	44
DESULFOASV1_1572_hypothetical_protein	AF-Q9FJY7-F1-model_v4	DESULFOASV1_1572_hypothetical_protein	AF-Q9FJY7-F1-model_v4 Pentatricopeptide repeat-containing protein At5g66520	0.139	148	121	83	224	331	478	6.308E+00	44
DESULFOASV1_1572_hypothetical_protein	AF-Q94KD3-F1-model_v4	DESULFOASV1_1572_hypothetical_protein	AF-Q94KD3-F1-model_v4 Vacuolar protein sorting-associated protein 52 A	0.126	187	159	16	202	109	291	3.265E-01	44
DESULFOASV1_1572_hypothetical_protein	AF-Q6FIP2-F1-model_v4	DESULFOASV1_1572_hypothetical_protein	AF-Q6FIP2-F1-model_v4 26S proteasome regulatory subunit RPN2	0.133	180	112	85	214	6	185	1.401E+00	44
DESULFOASV1_1572_hypothetical_protein	AF-Q5ZKV9-F1-model_v4	DESULFOASV1_1572_hypothetical_protein	AF-Q5ZKV9-F1-model_v4 Syndetin	0.113	266	186	14	224	109	374	7.822E-01	44
DESULFOASV1_1572_hypothetical_protein	AF-O60142-F1-model_v4	DESULFOASV1_1572_hypothetical_protein	AF-O60142-F1-model_v4 Pentatricopeptide repeat-containing protein 2, mitochondrial	0.095	231	183	16	218	24	254	2.901E+00	43
DESULFOASV1_1572_hypothetical_protein	AF-Q5TAA0-F1-model_v4	DESULFOASV1_1572_hypothetical_protein	AF-Q5TAA0-F1-model_v4 Tetratricopeptide repeat protein 22	0.167	220	135	63	225	44	263	4.586E-01	43
DESULFOASV1_1572_hypothetical_protein	AF-Q9SR82-F1-model_v4	DESULFOASV1_1572_hypothetical_protein	AF-Q9SR82-F1-model_v4 Putative pentatricopeptide repeat-containing protein At3g08820	0.151	129	98	87	202	416	544	3.698E+00	43
DESULFOASV1_1572_hypothetical_protein	AF-Q80WQ2-F1-model_v4	DESULFOASV1_1572_hypothetical_protein	AF-Q80WQ2-F1-model_v4 Protein VAC14 homolog	0.074	172	124	82	216	547	718	1.211E+00	43
DESULFOASV1_1572_hypothetical_protein	AF-Q08AM6-F1-model_v4	DESULFOASV1_1572_hypothetical_protein	AF-Q08AM6-F1-model_v4 Protein VAC14 homolog	0.082	157	106	100	216	562	718	1.470E+00	43
DESULFOASV1_1572_hypothetical_protein	AF-Q5KU39-F1-model_v4	DESULFOASV1_1572_hypothetical_protein	AF-Q5KU39-F1-model_v4 Vacuolar protein sorting-associated protein 41 homolog	0.125	182	141	59	220	369	550	1.211E+00	43
DESULFOASV1_1572_hypothetical_protein	AF-Q54KG3-F1-model_v4	DESULFOASV1_1572_hypothetical_protein	AF-Q54KG3-F1-model_v4 Vacuolar protein sorting-associated protein 51 homolog	0.117	260	184	14	222	204	463	4.586E-01	43
DESULFOASV1_1572_hypothetical_protein	AF-P17426-F1-model_v4	DESULFOASV1_1572_hypothetical_protein	AF-P17426-F1-model_v4 AP-2 complex subunit alpha-1	0.177	190	128	62	217	278	467	1.470E+00	43
DESULFOASV1_1572_hypothetical_protein	AF-P25822-F1-model_v4	DESULFOASV1_1572_hypothetical_protein	AF-P25822-F1-model_v4 Maternal protein pumilio	0.102	203	158	26	202	1053	1255	1.401E+00	43
DESULFOASV1_1572_hypothetical_protein	AF-Q0WNJ6-F1-model_v4	DESULFOASV1_1572_hypothetical_protein	AF-Q0WNJ6-F1-model_v4 Clathrin heavy chain 1	0.126	222	186	4	217	975	1196	1.211E+00	43
DESULFOASV1_1572_hypothetical_protein	AF-Q9SAA6-F1-model_v4	DESULFOASV1_1572_hypothetical_protein	AF-Q9SAA6-F1-model_v4 Pentatricopeptide repeat-containing protein At1g11710, mitochondrial	0.091	245	194	10	223	2	246	3.197E+00	42
DESULFOASV1_1572_hypothetical_protein	AF-A1D345-F1-model_v4	DESULFOASV1_1572_hypothetical_protein	AF-A1D345-F1-model_v4 Inclusion body clearance protein iml2	0.145	99	81	117	215	362	457	7.297E+00	42
DESULFOASV1_1572_hypothetical_protein	AF-Q80W92-F1-model_v4	DESULFOASV1_1572_hypothetical_protein	AF-Q80W92-F1-model_v4 Protein VAC14 homolog	0.074	172	124	82	216	548	719	1.401E+00	42
DESULFOASV1_1572_hypothetical_protein	AF-Q9PK92-F1-model_v4	DESULFOASV1_1572_hypothetical_protein	AF-Q9PK92-F1-model_v4 Serine/threonine-protein kinase PknD	0.136	188	145	56	224	635	822	1.967E+00	42
DESULFOASV1_1572_hypothetical_protein	AF-O25728-F1-model_v4	DESULFOASV1_1572_hypothetical_protein	AF-O25728-F1-model_v4 Putative beta-lactamase HcpC	0.107	173	121	65	201	29	201	1.967E+00	41
DESULFOASV1_1572_hypothetical_protein	AF-Q0P5I8-F1-model_v4	DESULFOASV1_1572_hypothetical_protein	AF-Q0P5I8-F1-model_v4 Golgi to ER traffic protein 4 homolog	0.108	267	185	18	225	2	268	1.785E+00	41
DESULFOASV1_1572_hypothetical_protein	AF-Q94JY0-F1-model_v4	DESULFOASV1_1572_hypothetical_protein	AF-Q94JY0-F1-model_v4 Protein IN CHLOROPLAST ATPASE BIOGENESIS, chloroplastic	0.151	127	101	97	216	128	254	4.714E+00	41
DESULFOASV1_1572_hypothetical_protein	AF-Q0T0D4-F1-model_v4	DESULFOASV1_1572_hypothetical_protein	AF-Q0T0D4-F1-model_v4 Penicillin-binding protein activator LpoA	0.097	148	132	71	218	34	180	8.860E+00	41
DESULFOASV1_1572_hypothetical_protein	AF-Q95XZ0-F1-model_v4	DESULFOASV1_1572_hypothetical_protein	AF-Q95XZ0-F1-model_v4 Conserved oligomeric Golgi complex subunit 4	0.122	260	190	8	224	70	329	8.620E-01	41
DESULFOASV1_1572_hypothetical_protein	AF-P17051-F1-model_v4	DESULFOASV1_1572_hypothetical_protein	AF-P17051-F1-model_v4 HTH-type transcriptional regulator AlkS	0.141	152	125	67	218	656	802	4.714E+00	41
DESULFOASV1_1572_hypothetical_protein	AF-Q96WV5-F1-model_v4	DESULFOASV1_1572_hypothetical_protein	AF-Q96WV5-F1-model_v4 Putative coatomer subunit alpha	0.154	195	153	29	223	605	786	1.334E+00	41
DESULFOASV1_1572_hypothetical_protein	AF-Q92JD2-F1-model_v4	DESULFOASV1_1572_hypothetical_protein	AF-Q92JD2-F1-model_v4 Uncharacterized protein RC0135	0.077	142	90	65	206	21	119	5.569E-01	40
DESULFOASV1_1572_hypothetical_protein	AF-Q9SKU6-F1-model_v4	DESULFOASV1_1572_hypothetical_protein	AF-Q9SKU6-F1-model_v4 Pentatricopeptide repeat-containing protein At2g20710, mitochondrial	0.126	212	130	75	224	129	340	2.168E+00	40
DESULFOASV1_1572_hypothetical_protein	AF-Q5ZIW5-F1-model_v4	DESULFOASV1_1572_hypothetical_protein	AF-Q5ZIW5-F1-model_v4 Protein VAC14 homolog	0.081	149	132	72	216	568	716	2.065E+00	40
DESULFOASV1_1572_hypothetical_protein	AF-P17427-F1-model_v4	DESULFOASV1_1572_hypothetical_protein	AF-P17427-F1-model_v4 AP-2 complex subunit alpha-2	0.173	173	114	62	200	277	449	1.211E+00	40
DESULFOASV1_1572_hypothetical_protein	AF-Q9CA73-F1-model_v4	DESULFOASV1_1572_hypothetical_protein	AF-Q9CA73-F1-model_v4 Putative pentatricopeptide repeat-containing protein At1g74400	0.081	212	165	38	218	2	213	7.297E+00	39
DESULFOASV1_1572_hypothetical_protein	AF-Q9LZ19-F1-model_v4	DESULFOASV1_1572_hypothetical_protein	AF-Q9LZ19-F1-model_v4 Pentatricopeptide repeat-containing protein At5g04780, mitochondrial	0.155	168	134	65	224	314	481	6.951E+00	39
DESULFOASV1_1572_hypothetical_protein	AF-Q5AH25-F1-model_v4	DESULFOASV1_1572_hypothetical_protein	AF-Q5AH25-F1-model_v4 Exocyst complex protein EXO70	0.104	305	185	16	223	30	334	1.470E+00	39
DESULFOASV1_1572_hypothetical_protein	AF-A2VE70-F1-model_v4	DESULFOASV1_1572_hypothetical_protein	AF-A2VE70-F1-model_v4 Protein VAC14 homolog	0.088	184	138	65	216	536	719	1.271E+00	39
DESULFOASV1_1572_hypothetical_protein	AF-Q96MW5-F1-model_v4	DESULFOASV1_1572_hypothetical_protein	AF-Q96MW5-F1-model_v4 Conserved oligomeric Golgi complex subunit 8	0.131	269	182	14	224	64	332	6.762E-01	38
DESULFOASV1_1572_hypothetical_protein	AF-Q9LSK8-F1-model_v4	DESULFOASV1_1572_hypothetical_protein	AF-Q9LSK8-F1-model_v4 Pentatricopeptide repeat-containing protein At3g18020	0.135	162	114	83	215	257	418	4.075E+00	38
DESULFOASV1_1572_hypothetical_protein	AF-O94973-F1-model_v4	DESULFOASV1_1572_hypothetical_protein	AF-O94973-F1-model_v4 AP-2 complex subunit alpha-2	0.167	173	115	62	200	277	449	1.470E+00	38
DESULFOASV1_1572_hypothetical_protein	AF-Q4PCV8-F1-model_v4	DESULFOASV1_1572_hypothetical_protein	AF-Q4PCV8-F1-model_v4 mRNA 3'-end-processing protein RNA14	0.166	148	115	77	224	421	559	8.860E+00	38
DESULFOASV1_1572_hypothetical_protein	AF-Q92JH6-F1-model_v4	DESULFOASV1_1572_hypothetical_protein	AF-Q92JH6-F1-model_v4 Uncharacterized protein RC0091	0.153	142	117	63	204	4	142	2.633E+00	37
DESULFOASV1_1572_hypothetical_protein	AF-L8FMA1-F1-model_v4	DESULFOASV1_1572_hypothetical_protein	AF-L8FMA1-F1-model_v4 ESX-1 secretion system protein EccA1	0.167	148	110	84	216	100	247	5.724E+00	37
DESULFOASV1_1572_hypothetical_protein	AF-O17736-F1-model_v4	DESULFOASV1_1572_hypothetical_protein	AF-O17736-F1-model_v4 E3 ubiquitin-protein ligase etc-1	0.159	215	158	14	202	7	221	2.389E+00	37
DESULFOASV1_1572_hypothetical_protein	AF-Q9SVP7-F1-model_v4	DESULFOASV1_1572_hypothetical_protein	AF-Q9SVP7-F1-model_v4 Pentatricopeptide repeat-containing protein At4g13650	0.125	147	123	83	224	539	685	9.764E+00	37
DESULFOASV1_1572_hypothetical_protein	AF-Q9W040-F1-model_v4	DESULFOASV1_1572_hypothetical_protein	AF-Q9W040-F1-model_v4 Intraflagellar transport protein 172 homolog	0.142	219	175	14	218	738	956	4.369E-01	37
DESULFOASV1_1572_hypothetical_protein	AF-Q9M8J9-F1-model_v4	DESULFOASV1_1572_hypothetical_protein	AF-Q9M8J9-F1-model_v4 BTB/POZ and MATH domain-containing protein 2	0.080	118	108	90	207	270	387	4.490E+00	36
DESULFOASV1_1572_hypothetical_protein	AF-Q8BKS9-F1-model_v4	DESULFOASV1_1572_hypothetical_protein	AF-Q8BKS9-F1-model_v4 Pumilio homolog 3	0.166	144	118	58	199	118	261	3.356E+00	36
DESULFOASV1_1572_hypothetical_protein	AF-Q15397-F1-model_v4	DESULFOASV1_1572_hypothetical_protein	AF-Q15397-F1-model_v4 Pumilio homolog 3	0.126	199	138	1	199	104	262	1.620E+00	36
DESULFOASV1_1572_hypothetical_protein	AF-A6QQ47-F1-model_v4	DESULFOASV1_1572_hypothetical_protein	AF-A6QQ47-F1-model_v4 Vacuolar protein sorting-associated protein 51 homolog	0.175	214	172	14	222	130	343	1.543E+00	36
DESULFOASV1_1572_hypothetical_protein	AF-Q8CI71-F1-model_v4	DESULFOASV1_1572_hypothetical_protein	AF-Q8CI71-F1-model_v4 Syndetin	0.103	261	187	16	224	129	389	2.065E+00	36
DESULFOASV1_1572_hypothetical_protein	AF-F1LSG8-F1-model_v4	DESULFOASV1_1572_hypothetical_protein	AF-F1LSG8-F1-model_v4 Syndetin	0.118	261	183	16	224	129	389	2.276E+00	36
DESULFOASV1_1572_hypothetical_protein	AF-Q1LUT1-F1-model_v4	DESULFOASV1_1572_hypothetical_protein	AF-Q1LUT1-F1-model_v4 Enhancer of mRNA-decapping protein 4	0.123	229	180	14	219	1151	1379	5.724E+00	36
DESULFOASV1_1572_hypothetical_protein	AF-Q8FDA1-F1-model_v4	DESULFOASV1_1572_hypothetical_protein	AF-Q8FDA1-F1-model_v4 Penicillin-binding protein activator LpoA	0.123	247	189	1	216	4	250	6.308E+00	35
DESULFOASV1_1572_hypothetical_protein	AF-Q8L838-F1-model_v4	DESULFOASV1_1572_hypothetical_protein	AF-Q8L838-F1-model_v4 Conserved oligomeric Golgi complex subunit 4	0.133	228	177	16	220	86	313	4.948E+00	35
DESULFOASV1_1572_hypothetical_protein	AF-Q9CAA8-F1-model_v4	DESULFOASV1_1572_hypothetical_protein	AF-Q9CAA8-F1-model_v4 Putative pentatricopeptide repeat-containing protein At1g68930	0.117	255	145	60	224	348	602	1.099E+00	35
DESULFOASV1_1572_hypothetical_protein	AF-Q505L3-F1-model_v4	DESULFOASV1_1572_hypothetical_protein	AF-Q505L3-F1-model_v4 Vacuolar protein sorting-associated protein 51 homolog	0.142	229	178	14	222	91	319	8.620E-01	35
DESULFOASV1_1572_hypothetical_protein	AF-Q8R1U1-F1-model_v4	DESULFOASV1_1572_hypothetical_protein	AF-Q8R1U1-F1-model_v4 Conserved oligomeric Golgi complex subunit 4	0.147	254	177	13	221	67	320	1.543E+00	35
DESULFOASV1_1572_hypothetical_protein	AF-Q8CI04-F1-model_v4	DESULFOASV1_1572_hypothetical_protein	AF-Q8CI04-F1-model_v4 Conserved oligomeric Golgi complex subunit 3	0.116	200	166	14	202	138	337	1.874E+00	35
DESULFOASV1_1572_hypothetical_protein	AF-P87140-F1-model_v4	DESULFOASV1_1572_hypothetical_protein	AF-P87140-F1-model_v4 Probable coatomer subunit gamma	0.132	150	121	72	221	421	560	2.168E+00	35
DESULFOASV1_1572_hypothetical_protein	AF-O74762-F1-model_v4	DESULFOASV1_1572_hypothetical_protein	AF-O74762-F1-model_v4 26S proteasome regulatory subunit rpn2	0.171	140	114	85	223	15	154	7.659E+00	35
DESULFOASV1_1572_hypothetical_protein	AF-Q6C457-F1-model_v4	DESULFOASV1_1572_hypothetical_protein	AF-Q6C457-F1-model_v4 U3 small nucleolar RNA-associated protein 10	0.098	190	145	57	218	811	1000	8.860E+00	35
DESULFOASV1_1572_hypothetical_protein	AF-Q9ZMM1-F1-model_v4	DESULFOASV1_1572_hypothetical_protein	AF-Q9ZMM1-F1-model_v4 Beta-lactamase HcpA	0.088	195	145	42	201	3	197	2.633E+00	34
DESULFOASV1_1572_hypothetical_protein	AF-Q9FVV6-F1-model_v4	DESULFOASV1_1572_hypothetical_protein	AF-Q9FVV6-F1-model_v4 Vacuolar protein sorting-associated protein 52 B	0.116	187	161	16	202	103	285	1.874E+00	34
DESULFOASV1_1572_hypothetical_protein	AF-Q09829-F1-model_v4	DESULFOASV1_1572_hypothetical_protein	AF-Q09829-F1-model_v4 Pumilio domain-containing protein C4G8.03c	0.109	178	142	61	220	525	702	8.040E+00	34
DESULFOASV1_1572_hypothetical_protein	AF-Q9CA56-F1-model_v4	DESULFOASV1_1572_hypothetical_protein	AF-Q9CA56-F1-model_v4 Pentatricopeptide repeat-containing protein At1g74600, chloroplastic	0.103	178	123	85	222	691	868	7.297E+00	34
DESULFOASV1_1572_hypothetical_protein	AF-B8LQF9-F1-model_v4	DESULFOASV1_1572_hypothetical_protein	AF-B8LQF9-F1-model_v4 CASP-like protein 2BC2	0.112	227	196	1	222	3	229	2.901E+00	33
DESULFOASV1_1572_hypothetical_protein	AF-Q9ZMS0-F1-model_v4	DESULFOASV1_1572_hypothetical_protein	AF-Q9ZMS0-F1-model_v4 Putative beta-lactamase HcpD	0.119	242	161	32	215	5	246	2.508E+00	33
DESULFOASV1_1572_hypothetical_protein	AF-P59917-F1-model_v4	DESULFOASV1_1572_hypothetical_protein	AF-P59917-F1-model_v4 UPF0283 membrane protein HD_1769	0.113	271	192	1	218	19	289	2.168E+00	33
DESULFOASV1_1572_hypothetical_protein	AF-P34316-F1-model_v4	DESULFOASV1_1572_hypothetical_protein	AF-P34316-F1-model_v4 Uncharacterized calcium-binding protein C07A9.5	0.114	199	170	24	216	78	276	2.389E+00	33
DESULFOASV1_1572_hypothetical_protein	AF-Q8L765-F1-model_v4	DESULFOASV1_1572_hypothetical_protein	AF-Q8L765-F1-model_v4 BTB/POZ and MATH domain-containing protein 1	0.083	116	97	90	196	271	386	8.040E+00	33
DESULFOASV1_1572_hypothetical_protein	AF-D2A869-F1-model_v4	DESULFOASV1_1572_hypothetical_protein	AF-D2A869-F1-model_v4 Penicillin-binding protein activator LpoA	0.123	247	189	1	216	4	250	8.040E+00	33
DESULFOASV1_1572_hypothetical_protein	AF-P0C8Q3-F1-model_v4	DESULFOASV1_1572_hypothetical_protein	AF-P0C8Q3-F1-model_v4 Pentatricopeptide repeat-containing protein At4g19890	0.101	193	125	85	224	502	694	5.194E+00	33
DESULFOASV1_1572_hypothetical_protein	AF-Q9UID3-F1-model_v4	DESULFOASV1_1572_hypothetical_protein	AF-Q9UID3-F1-model_v4 Vacuolar protein sorting-associated protein 51 homolog	0.166	212	168	16	218	133	344	2.065E+00	33
DESULFOASV1_1572_hypothetical_protein	AF-Q3MHG0-F1-model_v4	DESULFOASV1_1572_hypothetical_protein	AF-Q3MHG0-F1-model_v4 Conserved oligomeric Golgi complex subunit 4	0.128	254	181	13	221	67	320	1.211E+00	33
DESULFOASV1_1572_hypothetical_protein	AF-Q96JB2-F1-model_v4	DESULFOASV1_1572_hypothetical_protein	AF-Q96JB2-F1-model_v4 Conserved oligomeric Golgi complex subunit 3	0.087	264	190	14	222	146	409	2.764E+00	33
DESULFOASV1_1572_hypothetical_protein	AF-O22286-F1-model_v4	DESULFOASV1_1572_hypothetical_protein	AF-O22286-F1-model_v4 BTB/POZ and MATH domain-containing protein 3	0.073	119	109	88	206	260	378	7.659E+00	32
DESULFOASV1_1572_hypothetical_protein	AF-O04504-F1-model_v4	DESULFOASV1_1572_hypothetical_protein	AF-O04504-F1-model_v4 Pentatricopeptide repeat-containing protein At1g09820	0.089	178	146	60	220	112	289	9.764E+00	32
DESULFOASV1_1572_hypothetical_protein	AF-Q8MSY4-F1-model_v4	DESULFOASV1_1572_hypothetical_protein	AF-Q8MSY4-F1-model_v4 Vacuolar protein sorting-associated protein 51 homolog	0.144	229	175	14	218	61	289	1.153E+00	32
DESULFOASV1_1572_hypothetical_protein	AF-Q4V9Y0-F1-model_v4	DESULFOASV1_1572_hypothetical_protein	AF-Q4V9Y0-F1-model_v4 Vacuolar protein sorting-associated protein 51 homolog	0.134	229	180	14	222	94	322	1.334E+00	32
DESULFOASV1_1572_hypothetical_protein	AF-Q3UVL4-F1-model_v4	DESULFOASV1_1572_hypothetical_protein	AF-Q3UVL4-F1-model_v4 Vacuolar protein sorting-associated protein 51 homolog	0.184	214	170	14	222	131	344	2.065E+00	32
DESULFOASV1_1572_hypothetical_protein	AF-E3WDQ9-F1-model_v4	DESULFOASV1_1572_hypothetical_protein	AF-E3WDQ9-F1-model_v4 Pumilio homolog 2	0.137	164	137	65	224	977	1140	8.040E+00	32
DESULFOASV1_1572_hypothetical_protein	AF-Q1ZXH8-F1-model_v4	DESULFOASV1_1572_hypothetical_protein	AF-Q1ZXH8-F1-model_v4 Guanine exchange factor for Rac 30	0.111	225	184	16	223	409	633	1.701E+00	32
DESULFOASV1_1572_hypothetical_protein	AF-Q5ZII9-F1-model_v4	DESULFOASV1_1572_hypothetical_protein	AF-Q5ZII9-F1-model_v4 Tuftelin-interacting protein 11	0.093	249	193	1	214	296	544	8.440E+00	31
DESULFOASV1_1572_hypothetical_protein	AF-Q06706-F1-model_v4	DESULFOASV1_1572_hypothetical_protein	AF-Q06706-F1-model_v4 Elongator complex protein 1	0.151	155	127	65	219	856	1005	5.724E+00	31
DESULFOASV1_1572_hypothetical_protein	AF-Q9UU81-F1-model_v4	DESULFOASV1_1572_hypothetical_protein	AF-Q9UU81-F1-model_v4 AP-1 complex subunit gamma-1	0.136	170	133	61	215	390	559	8.440E+00	30
DESULFOASV1_1572_hypothetical_protein	AF-P0DN95-F1-model_v4	DESULFOASV1_1572_hypothetical_protein	AF-P0DN95-F1-model_v4 Pumilio homolog 15	0.107	245	179	1	201	107	351	3.882E+00	29
DESULFOASV1_1572_hypothetical_protein	AF-Q84K25-F1-model_v4	DESULFOASV1_1572_hypothetical_protein	AF-Q84K25-F1-model_v4 Conserved oligomeric Golgi complex subunit 8	0.109	212	180	16	218	80	291	2.276E+00	29
DESULFOASV1_1572_hypothetical_protein	AF-Q9LJX4-F1-model_v4	DESULFOASV1_1572_hypothetical_protein	AF-Q9LJX4-F1-model_v4 Pumilio homolog 5	0.125	156	132	71	222	776	931	9.301E+00	29
DESULFOASV1_1572_hypothetical_protein	AF-Q9VT41-F1-model_v4	DESULFOASV1_1572_hypothetical_protein	AF-Q9VT41-F1-model_v4 Integrator complex subunit 7	0.130	177	134	65	219	498	674	4.278E+00	29
