query	target	qheader	theader	fident	alnlen	mismatch	qstart	qend	tstart	tend	evalue	bits
DESULFOASV1_3007_hypothetical_protein	AF-Q7A5Y8-F1-model_v4	DESULFOASV1_3007_hypothetical_protein	AF-Q7A5Y8-F1-model_v4 Probable cell wall hydrolase LytN	0.066	134	117	1	134	1	126	1.215E+00	48
DESULFOASV1_3007_hypothetical_protein	AF-Q99UM3-F1-model_v4	DESULFOASV1_3007_hypothetical_protein	AF-Q99UM3-F1-model_v4 Probable cell wall hydrolase LytN	0.116	134	112	1	134	1	128	1.135E+00	47
DESULFOASV1_3007_hypothetical_protein	AF-Q9H3P7-F1-model_v4	DESULFOASV1_3007_hypothetical_protein	AF-Q9H3P7-F1-model_v4 Golgi resident protein GCP60	0.113	128	112	7	134	228	354	1.215E+00	47
DESULFOASV1_3007_hypothetical_protein	AF-B1WBS9-F1-model_v4	DESULFOASV1_3007_hypothetical_protein	AF-B1WBS9-F1-model_v4 Protein FAM24A	0.164	90	74	46	134	2	91	1.061E+00	46
DESULFOASV1_3007_hypothetical_protein	AF-Q39138-F1-model_v4	DESULFOASV1_3007_hypothetical_protein	AF-Q39138-F1-model_v4 Late embryogenesis abundant protein 6	0.123	124	104	14	133	4	127	2.740E-01	46
DESULFOASV1_3007_hypothetical_protein	AF-A1YER0-F1-model_v4	DESULFOASV1_3007_hypothetical_protein	AF-A1YER0-F1-model_v4 Homeobox protein SIX1	0.149	105	81	30	134	134	229	9.265E-01	41
DESULFOASV1_3007_hypothetical_protein	AF-Q9LN27-F1-model_v4	DESULFOASV1_3007_hypothetical_protein	AF-Q9LN27-F1-model_v4 Mitochondrial import inner membrane translocase subunit TIM17-1	0.084	125	112	10	134	74	196	2.087E+00	40
DESULFOASV1_3007_hypothetical_protein	AF-Q9I8H0-F1-model_v4	DESULFOASV1_3007_hypothetical_protein	AF-Q9I8H0-F1-model_v4 Homeobox protein six1	0.140	105	82	30	134	134	229	1.135E+00	40
DESULFOASV1_3007_hypothetical_protein	AF-Q3K6W8-F1-model_v4	DESULFOASV1_3007_hypothetical_protein	AF-Q3K6W8-F1-model_v4 Glutamyl-tRNA reductase	0.081	98	85	9	101	331	428	3.352E+00	40
DESULFOASV1_3007_hypothetical_protein	AF-Q9Y0V2-F1-model_v4	DESULFOASV1_3007_hypothetical_protein	AF-Q9Y0V2-F1-model_v4 Mitochondrial import inner membrane translocase subunit Tim10B	0.200	108	85	13	120	2	108	1.391E+00	39
DESULFOASV1_3007_hypothetical_protein	AF-Q6GR66-F1-model_v4	DESULFOASV1_3007_hypothetical_protein	AF-Q6GR66-F1-model_v4 Mitochondrial import inner membrane translocase subunit Tim10 B	0.091	120	100	14	124	4	123	1.391E+00	39
DESULFOASV1_3007_hypothetical_protein	AF-Q7A123-F1-model_v4	DESULFOASV1_3007_hypothetical_protein	AF-Q7A123-F1-model_v4 Probable cell wall hydrolase LytN	0.096	134	110	1	134	1	123	7.562E-01	39
DESULFOASV1_3007_hypothetical_protein	AF-O74438-F1-model_v4	DESULFOASV1_3007_hypothetical_protein	AF-O74438-F1-model_v4 Meiotic coiled-coil protein 2	0.139	134	113	1	134	1	132	8.092E-01	39
DESULFOASV1_3007_hypothetical_protein	AF-P50538-F1-model_v4	DESULFOASV1_3007_hypothetical_protein	AF-P50538-F1-model_v4 Max dimerization protein 1	0.100	138	119	2	134	46	183	1.061E+00	38
DESULFOASV1_3007_hypothetical_protein	AF-A4XR60-F1-model_v4	DESULFOASV1_3007_hypothetical_protein	AF-A4XR60-F1-model_v4 Glutamyl-tRNA reductase	0.093	96	85	9	103	331	426	4.702E+00	38
DESULFOASV1_3007_hypothetical_protein	AF-C3KDC5-F1-model_v4	DESULFOASV1_3007_hypothetical_protein	AF-C3KDC5-F1-model_v4 Glutamyl-tRNA reductase	0.131	99	83	9	105	331	429	3.838E+00	38
DESULFOASV1_3007_hypothetical_protein	AF-P40621-F1-model_v4	DESULFOASV1_3007_hypothetical_protein	AF-P40621-F1-model_v4 HMG1/2-like protein	0.207	109	85	27	134	49	157	1.215E+00	37
DESULFOASV1_3007_hypothetical_protein	AF-A4VPC0-F1-model_v4	DESULFOASV1_3007_hypothetical_protein	AF-A4VPC0-F1-model_v4 Glutamyl-tRNA reductase	0.108	92	80	9	99	331	422	5.384E+00	37
DESULFOASV1_3007_hypothetical_protein	AF-Q7TNY6-F1-model_v4	DESULFOASV1_3007_hypothetical_protein	AF-Q7TNY6-F1-model_v4 Golgi resident protein GCP60	0.105	128	113	7	134	225	351	3.352E+00	37
DESULFOASV1_3007_hypothetical_protein	AF-Q946J2-F1-model_v4	DESULFOASV1_3007_hypothetical_protein	AF-Q946J2-F1-model_v4 Probable inactive histone-lysine N-methyltransferase SUVR1	0.150	106	87	29	134	22	124	3.133E+00	37
DESULFOASV1_3007_hypothetical_protein	AF-E0CPH4-F1-model_v4	DESULFOASV1_3007_hypothetical_protein	AF-E0CPH4-F1-model_v4 Agamous-like MADS-box protein AP3	0.099	158	118	3	134	62	219	3.357E-01	36
DESULFOASV1_3007_hypothetical_protein	AF-Q07472-F1-model_v4	DESULFOASV1_3007_hypothetical_protein	AF-Q07472-F1-model_v4 Floral homeotic protein PMADS 1	0.108	155	117	3	134	62	216	8.092E-01	36
DESULFOASV1_3007_hypothetical_protein	AF-P25189-F1-model_v4	DESULFOASV1_3007_hypothetical_protein	AF-P25189-F1-model_v4 Myelin protein P0	0.164	97	77	42	134	147	243	4.702E+00	36
DESULFOASV1_3007_hypothetical_protein	AF-Q15475-F1-model_v4	DESULFOASV1_3007_hypothetical_protein	AF-Q15475-F1-model_v4 Homeobox protein SIX1	0.149	105	81	30	134	134	229	1.823E+00	36
DESULFOASV1_3007_hypothetical_protein	AF-Q16U25-F1-model_v4	DESULFOASV1_3007_hypothetical_protein	AF-Q16U25-F1-model_v4 Protein FAM50 homolog	0.126	149	116	1	134	1	149	2.736E+00	36
DESULFOASV1_3007_hypothetical_protein	AF-Q5RCJ1-F1-model_v4	DESULFOASV1_3007_hypothetical_protein	AF-Q5RCJ1-F1-model_v4 Cdc42-interacting protein 4	0.111	139	118	1	134	385	523	1.592E+00	36
DESULFOASV1_3007_hypothetical_protein	AF-Q9R1B1-F1-model_v4	DESULFOASV1_3007_hypothetical_protein	AF-Q9R1B1-F1-model_v4 Mitochondrial import inner membrane translocase subunit Tim10 B	0.120	98	83	13	107	3	100	3.352E+00	35
DESULFOASV1_3007_hypothetical_protein	AF-A2D5H2-F1-model_v4	DESULFOASV1_3007_hypothetical_protein	AF-A2D5H2-F1-model_v4 Homeobox protein SIX1	0.152	103	79	30	132	134	227	2.233E+00	35
DESULFOASV1_3007_hypothetical_protein	AF-Q4K694-F1-model_v4	DESULFOASV1_3007_hypothetical_protein	AF-Q4K694-F1-model_v4 Glutamyl-tRNA reductase	0.127	94	79	9	100	331	424	6.164E+00	35
DESULFOASV1_3007_hypothetical_protein	AF-Q48MV5-F1-model_v4	DESULFOASV1_3007_hypothetical_protein	AF-Q48MV5-F1-model_v4 Glutamyl-tRNA reductase	0.105	95	82	9	101	331	425	6.164E+00	35
DESULFOASV1_3007_hypothetical_protein	AF-O83964-F1-model_v4	DESULFOASV1_3007_hypothetical_protein	AF-O83964-F1-model_v4 DNA translocase FtsK	0.191	112	88	25	134	89	200	1.488E+00	35
DESULFOASV1_3007_hypothetical_protein	AF-F4J394-F1-model_v4	DESULFOASV1_3007_hypothetical_protein	AF-F4J394-F1-model_v4 Kinesin-like protein KIN-7G	0.148	134	102	1	134	350	470	1.704E+00	35
DESULFOASV1_3007_hypothetical_protein	AF-P97273-F1-model_v4	DESULFOASV1_3007_hypothetical_protein	AF-P97273-F1-model_v4 Thyroid transcription factor 1	0.129	102	87	31	132	12	112	1.215E+00	34
DESULFOASV1_3007_hypothetical_protein	AF-Q3SZW4-F1-model_v4	DESULFOASV1_3007_hypothetical_protein	AF-Q3SZW4-F1-model_v4 Mitochondrial import inner membrane translocase subunit Tim10 B	0.108	109	91	7	109	3	111	3.587E+00	34
DESULFOASV1_3007_hypothetical_protein	AF-A6PVL3-F1-model_v4	DESULFOASV1_3007_hypothetical_protein	AF-A6PVL3-F1-model_v4 Kinocilin	0.156	134	102	1	134	1	122	1.823E+00	34
DESULFOASV1_3007_hypothetical_protein	AF-A0A0H3MGR4-F1-model_v4	DESULFOASV1_3007_hypothetical_protein	AF-A0A0H3MGR4-F1-model_v4 Inclusion membrane protein G	0.141	122	101	1	119	12	133	3.587E+00	34
DESULFOASV1_3007_hypothetical_protein	AF-P17839-F1-model_v4	DESULFOASV1_3007_hypothetical_protein	AF-P17839-F1-model_v4 Floral homeotic protein AGAMOUS	0.140	145	114	2	134	95	239	1.135E+00	34
DESULFOASV1_3007_hypothetical_protein	AF-B0KNE3-F1-model_v4	DESULFOASV1_3007_hypothetical_protein	AF-B0KNE3-F1-model_v4 Glutamyl-tRNA reductase	0.087	91	80	13	101	335	425	7.057E+00	34
DESULFOASV1_3007_hypothetical_protein	AF-B4R4H1-F1-model_v4	DESULFOASV1_3007_hypothetical_protein	AF-B4R4H1-F1-model_v4 Bifunctional lysine-specific demethylase and histidyl-hydroxylase NO66	0.113	149	115	4	134	156	304	2.557E+00	34
DESULFOASV1_3007_hypothetical_protein	AF-Q96MC5-F1-model_v4	DESULFOASV1_3007_hypothetical_protein	AF-Q96MC5-F1-model_v4 bMERB domain-containing protein 1	0.100	159	116	1	130	46	204	8.658E-01	33
DESULFOASV1_3007_hypothetical_protein	AF-A5VYG4-F1-model_v4	DESULFOASV1_3007_hypothetical_protein	AF-A5VYG4-F1-model_v4 Glutamyl-tRNA reductase	0.094	95	83	9	101	331	425	7.552E+00	33
DESULFOASV1_3007_hypothetical_protein	AF-Q95RW8-F1-model_v4	DESULFOASV1_3007_hypothetical_protein	AF-Q95RW8-F1-model_v4 Protein Optix	0.192	107	83	31	134	167	273	1.823E+00	33
DESULFOASV1_3007_hypothetical_protein	AF-Q80WJ7-F1-model_v4	DESULFOASV1_3007_hypothetical_protein	AF-Q80WJ7-F1-model_v4 Protein LYRIC	0.133	134	108	1	134	1	125	1.300E+00	33
DESULFOASV1_3007_hypothetical_protein	AF-Q5ZJA4-F1-model_v4	DESULFOASV1_3007_hypothetical_protein	AF-Q5ZJA4-F1-model_v4 Actin-related protein 5	0.082	143	122	1	134	287	429	1.215E+00	33
DESULFOASV1_3007_hypothetical_protein	AF-P92528-F1-model_v4	DESULFOASV1_3007_hypothetical_protein	AF-P92528-F1-model_v4 Uncharacterized mitochondrial protein AtMg00910	0.161	133	107	7	134	20	152	4.107E+00	32
DESULFOASV1_3007_hypothetical_protein	AF-Q40885-F1-model_v4	DESULFOASV1_3007_hypothetical_protein	AF-Q40885-F1-model_v4 Floral homeotic protein AGAMOUS	0.135	147	111	6	134	92	238	2.233E+00	32
DESULFOASV1_3007_hypothetical_protein	AF-Q68FU0-F1-model_v4	DESULFOASV1_3007_hypothetical_protein	AF-Q68FU0-F1-model_v4 Transmembrane protein 174	0.097	136	120	1	134	18	153	1.215E+00	32
DESULFOASV1_3007_hypothetical_protein	AF-P0C7U9-F1-model_v4	DESULFOASV1_3007_hypothetical_protein	AF-P0C7U9-F1-model_v4 Protein FAM87A	0.157	93	76	44	134	152	244	4.702E+00	32
DESULFOASV1_3007_hypothetical_protein	AF-Q6P4W0-F1-model_v4	DESULFOASV1_3007_hypothetical_protein	AF-Q6P4W0-F1-model_v4 BRISC complex subunit Abraxas 2	0.141	140	114	1	134	177	316	2.736E+00	32
DESULFOASV1_3007_hypothetical_protein	AF-P45819-F1-model_v4	DESULFOASV1_3007_hypothetical_protein	AF-P45819-F1-model_v4 Sporulation-specific protein 74	0.089	136	117	2	130	155	290	2.390E+00	32
DESULFOASV1_3007_hypothetical_protein	AF-Q920D5-F1-model_v4	DESULFOASV1_3007_hypothetical_protein	AF-Q920D5-F1-model_v4 Caspase-12	0.194	134	98	1	134	1	123	3.352E+00	32
DESULFOASV1_3007_hypothetical_protein	AF-Q75EV9-F1-model_v4	DESULFOASV1_3007_hypothetical_protein	AF-Q75EV9-F1-model_v4 Protein FYV6	0.105	136	119	1	134	1	136	3.587E+00	31
DESULFOASV1_3007_hypothetical_protein	AF-Q9XJ60-F1-model_v4	DESULFOASV1_3007_hypothetical_protein	AF-Q9XJ60-F1-model_v4 MADS-box transcription factor 50	0.109	142	116	4	134	79	220	1.951E+00	31
DESULFOASV1_3007_hypothetical_protein	AF-Q01540-F1-model_v4	DESULFOASV1_3007_hypothetical_protein	AF-Q01540-F1-model_v4 Floral homeotic protein AGAMOUS	0.140	145	114	2	134	95	239	2.087E+00	31
DESULFOASV1_3007_hypothetical_protein	AF-Q550T1-F1-model_v4	DESULFOASV1_3007_hypothetical_protein	AF-Q550T1-F1-model_v4 Uncharacterized transmembrane protein DDB_G0276999	0.105	137	111	3	127	81	217	2.087E+00	31
DESULFOASV1_3007_hypothetical_protein	AF-P17657-F1-model_v4	DESULFOASV1_3007_hypothetical_protein	AF-P17657-F1-model_v4 Cuticle collagen dpy-13	0.112	132	103	3	134	1	117	2.233E+00	31
DESULFOASV1_3007_hypothetical_protein	AF-Q4ZXW8-F1-model_v4	DESULFOASV1_3007_hypothetical_protein	AF-Q4ZXW8-F1-model_v4 Glutamyl-tRNA reductase	0.126	95	80	9	101	331	425	9.252E+00	31
DESULFOASV1_3007_hypothetical_protein	AF-Q1IEX2-F1-model_v4	DESULFOASV1_3007_hypothetical_protein	AF-Q1IEX2-F1-model_v4 Glutamyl-tRNA reductase	0.094	95	83	9	101	331	425	9.252E+00	31
DESULFOASV1_3007_hypothetical_protein	AF-Q8BMP6-F1-model_v4	DESULFOASV1_3007_hypothetical_protein	AF-Q8BMP6-F1-model_v4 Golgi resident protein GCP60	0.095	128	114	7	134	225	351	8.080E+00	31
DESULFOASV1_3007_hypothetical_protein	AF-Q6C7F7-F1-model_v4	DESULFOASV1_3007_hypothetical_protein	AF-Q6C7F7-F1-model_v4 Sensitive to high expression protein 9 homolog, mitochondrial	0.128	131	111	7	134	337	467	5.761E+00	31
DESULFOASV1_3007_hypothetical_protein	AF-O42967-F1-model_v4	DESULFOASV1_3007_hypothetical_protein	AF-O42967-F1-model_v4 Uncharacterized ubiquitin-like protein C1E8.02	0.136	130	110	1	130	452	579	1.704E+00	31
DESULFOASV1_3007_hypothetical_protein	AF-G5E829-F1-model_v4	DESULFOASV1_3007_hypothetical_protein	AF-G5E829-F1-model_v4 Plasma membrane calcium-transporting ATPase 1	0.168	100	75	44	134	1079	1178	5.761E+00	31
DESULFOASV1_3007_hypothetical_protein	AF-Q707Y8-F1-model_v4	DESULFOASV1_3007_hypothetical_protein	AF-Q707Y8-F1-model_v4 Mating-type protein ALPHA2	0.194	75	56	63	133	4	78	5.031E+00	30
DESULFOASV1_3007_hypothetical_protein	AF-Q9C8Z9-F1-model_v4	DESULFOASV1_3007_hypothetical_protein	AF-Q9C8Z9-F1-model_v4 Transcription factor bHLH148	0.120	133	112	1	128	30	162	4.107E+00	30
DESULFOASV1_3007_hypothetical_protein	AF-Q8UEQ0-F1-model_v4	DESULFOASV1_3007_hypothetical_protein	AF-Q8UEQ0-F1-model_v4 Sec-independent protein translocase protein TatB	0.169	126	90	9	134	30	138	2.736E+00	30
DESULFOASV1_3007_hypothetical_protein	AF-Q64281-F1-model_v4	DESULFOASV1_3007_hypothetical_protein	AF-Q64281-F1-model_v4 Leukocyte immunoglobulin-like receptor subfamily B member 4	0.138	94	73	41	134	226	311	8.646E+00	30
DESULFOASV1_3007_hypothetical_protein	AF-Q4JAM9-F1-model_v4	DESULFOASV1_3007_hypothetical_protein	AF-Q4JAM9-F1-model_v4 Glutamyl-tRNA reductase	0.068	102	89	9	105	313	414	6.164E+00	30
DESULFOASV1_3007_hypothetical_protein	AF-Q3U1Y4-F1-model_v4	DESULFOASV1_3007_hypothetical_protein	AF-Q3U1Y4-F1-model_v4 DENN domain-containing protein 4B	0.176	85	66	49	133	874	954	9.252E+00	30
DESULFOASV1_3007_hypothetical_protein	AF-Q7W5P0-F1-model_v4	DESULFOASV1_3007_hypothetical_protein	AF-Q7W5P0-F1-model_v4 Cell division protein FtsB	0.175	114	91	24	134	2	115	3.587E+00	29
DESULFOASV1_3007_hypothetical_protein	AF-Q2G9D3-F1-model_v4	DESULFOASV1_3007_hypothetical_protein	AF-Q2G9D3-F1-model_v4 Sec-independent protein translocase protein TatB	0.164	134	109	1	134	1	131	3.587E+00	29
DESULFOASV1_3007_hypothetical_protein	AF-Q2KTS6-F1-model_v4	DESULFOASV1_3007_hypothetical_protein	AF-Q2KTS6-F1-model_v4 Sec-independent protein translocase protein TatB	0.152	130	109	5	134	22	151	4.107E+00	29
DESULFOASV1_3007_hypothetical_protein	AF-Q15528-F1-model_v4	DESULFOASV1_3007_hypothetical_protein	AF-Q15528-F1-model_v4 Mediator of RNA polymerase II transcription subunit 22	0.124	197	117	1	134	1	197	2.087E+00	29
DESULFOASV1_3007_hypothetical_protein	AF-Q9D8Y8-F1-model_v4	DESULFOASV1_3007_hypothetical_protein	AF-Q9D8Y8-F1-model_v4 Inhibitor of growth protein 5	0.116	137	102	19	134	23	159	1.592E+00	29
DESULFOASV1_3007_hypothetical_protein	AF-Q03489-F1-model_v4	DESULFOASV1_3007_hypothetical_protein	AF-Q03489-F1-model_v4 Agamous-like MADS-box protein AGL9 homolog	0.092	147	119	3	134	79	225	6.164E+00	29
DESULFOASV1_3007_hypothetical_protein	AF-Q8LLR2-F1-model_v4	DESULFOASV1_3007_hypothetical_protein	AF-Q8LLR2-F1-model_v4 Agamous-like MADS-box protein MADS2	0.170	151	109	3	134	81	231	2.087E+00	29
DESULFOASV1_3007_hypothetical_protein	AF-Q568K9-F1-model_v4	DESULFOASV1_3007_hypothetical_protein	AF-Q568K9-F1-model_v4 Protein FAM50A	0.140	164	114	1	133	1	164	1.951E+00	29
DESULFOASV1_3007_hypothetical_protein	AF-Q4WTH0-F1-model_v4	DESULFOASV1_3007_hypothetical_protein	AF-Q4WTH0-F1-model_v4 Eukaryotic translation initiation factor 3 subunit F	0.110	138	118	1	134	208	345	7.057E+00	29
DESULFOASV1_3007_hypothetical_protein	AF-P9WI24-F1-model_v4	DESULFOASV1_3007_hypothetical_protein	AF-P9WI24-F1-model_v4 Uncharacterized PPE family protein PPE19	0.163	136	111	1	134	171	306	3.133E+00	29
DESULFOASV1_3007_hypothetical_protein	AF-Q8SV57-F1-model_v4	DESULFOASV1_3007_hypothetical_protein	AF-Q8SV57-F1-model_v4 UPF0329 protein ECU06_1680	0.171	99	75	44	134	133	231	7.057E+00	29
DESULFOASV1_3007_hypothetical_protein	AF-C5DLJ3-F1-model_v4	DESULFOASV1_3007_hypothetical_protein	AF-C5DLJ3-F1-model_v4 Outer spore wall assembly protein SHE10	0.158	132	109	5	134	94	225	2.087E+00	29
DESULFOASV1_3007_hypothetical_protein	AF-Q54LH5-F1-model_v4	DESULFOASV1_3007_hypothetical_protein	AF-Q54LH5-F1-model_v4 Integrator complex subunit 4 homolog	0.123	130	101	2	131	1	116	5.031E+00	29
DESULFOASV1_3007_hypothetical_protein	AF-P04089-F1-model_v4	DESULFOASV1_3007_hypothetical_protein	AF-P04089-F1-model_v4 Parathyroid hormone	0.141	111	93	21	129	5	115	4.702E+00	28
DESULFOASV1_3007_hypothetical_protein	AF-O60090-F1-model_v4	DESULFOASV1_3007_hypothetical_protein	AF-O60090-F1-model_v4 IMPACT family member C14C8.09c	0.095	128	114	7	134	155	281	4.394E+00	28
DESULFOASV1_3007_hypothetical_protein	AF-Q99706-F1-model_v4	DESULFOASV1_3007_hypothetical_protein	AF-Q99706-F1-model_v4 Killer cell immunoglobulin-like receptor 2DL4	0.195	94	74	41	134	225	317	5.761E+00	28
DESULFOASV1_3007_hypothetical_protein	AF-Q7TSH7-F1-model_v4	DESULFOASV1_3007_hypothetical_protein	AF-Q7TSH7-F1-model_v4 Potassium voltage-gated channel subfamily F member 1	0.096	177	118	3	133	307	483	1.823E+00	28
DESULFOASV1_3007_hypothetical_protein	AF-Q5PQS5-F1-model_v4	DESULFOASV1_3007_hypothetical_protein	AF-Q5PQS5-F1-model_v4 Cysteine and tyrosine-rich protein 1	0.155	147	112	1	134	1	147	2.233E+00	27
DESULFOASV1_3007_hypothetical_protein	AF-Q21FP7-F1-model_v4	DESULFOASV1_3007_hypothetical_protein	AF-Q21FP7-F1-model_v4 Sec-independent protein translocase protein TatB	0.125	124	106	13	134	24	147	5.031E+00	27
DESULFOASV1_3007_hypothetical_protein	AF-A5EJW1-F1-model_v4	DESULFOASV1_3007_hypothetical_protein	AF-A5EJW1-F1-model_v4 Sec-independent protein translocase protein TatB	0.159	130	99	5	134	22	140	2.557E+00	27
DESULFOASV1_3007_hypothetical_protein	AF-Q003J2-F1-model_v4	DESULFOASV1_3007_hypothetical_protein	AF-Q003J2-F1-model_v4 Agamous-like MADS-box protein TM6	0.119	148	115	3	134	62	209	4.702E+00	27
DESULFOASV1_3007_hypothetical_protein	AF-O94318-F1-model_v4	DESULFOASV1_3007_hypothetical_protein	AF-O94318-F1-model_v4 Vacuolar protein sorting-associated protein 20	0.133	133	108	9	134	80	212	2.390E+00	27
DESULFOASV1_3007_hypothetical_protein	AF-Q84NC5-F1-model_v4	DESULFOASV1_3007_hypothetical_protein	AF-Q84NC5-F1-model_v4 MADS-box transcription factor 25	0.117	147	112	4	131	81	227	2.087E+00	27
DESULFOASV1_3007_hypothetical_protein	AF-Q9BXL8-F1-model_v4	DESULFOASV1_3007_hypothetical_protein	AF-Q9BXL8-F1-model_v4 Cell division cycle-associated protein 4	0.076	135	123	1	134	10	144	3.352E+00	27
DESULFOASV1_3007_hypothetical_protein	AF-Q6Z6W2-F1-model_v4	DESULFOASV1_3007_hypothetical_protein	AF-Q6Z6W2-F1-model_v4 MADS-box transcription factor 57	0.110	133	104	2	134	115	232	4.702E+00	27
DESULFOASV1_3007_hypothetical_protein	AF-Q8R4V1-F1-model_v4	DESULFOASV1_3007_hypothetical_protein	AF-Q8R4V1-F1-model_v4 NFAT activation molecule 1	0.127	94	76	41	134	149	236	6.596E+00	27
DESULFOASV1_3007_hypothetical_protein	AF-Q19503-F1-model_v4	DESULFOASV1_3007_hypothetical_protein	AF-Q19503-F1-model_v4 Homeobox protein ceh-40	0.149	125	105	10	134	179	302	3.838E+00	27
DESULFOASV1_3007_hypothetical_protein	AF-B2VE88-F1-model_v4	DESULFOASV1_3007_hypothetical_protein	AF-B2VE88-F1-model_v4 Cytoskeleton protein RodZ	0.159	94	78	41	134	102	195	7.057E+00	27
DESULFOASV1_3007_hypothetical_protein	AF-P29303-F1-model_v4	DESULFOASV1_3007_hypothetical_protein	AF-P29303-F1-model_v4 Protein hairy	0.117	126	102	9	134	93	209	3.133E+00	27
DESULFOASV1_3007_hypothetical_protein	AF-Q6G9W6-F1-model_v4	DESULFOASV1_3007_hypothetical_protein	AF-Q6G9W6-F1-model_v4 Probable cell wall hydrolase LytN	0.096	134	110	1	134	1	123	5.031E+00	27
DESULFOASV1_3007_hypothetical_protein	AF-Q9YGL6-F1-model_v4	DESULFOASV1_3007_hypothetical_protein	AF-Q9YGL6-F1-model_v4 Paralemmin-1	0.124	129	111	7	134	21	149	5.031E+00	27
DESULFOASV1_3007_hypothetical_protein	AF-Q8AWC3-F1-model_v4	DESULFOASV1_3007_hypothetical_protein	AF-Q8AWC3-F1-model_v4 Activity-regulated cytoskeleton-associated protein	0.136	127	107	8	134	41	165	4.394E+00	27
DESULFOASV1_3007_hypothetical_protein	AF-Q9Z0G2-F1-model_v4	DESULFOASV1_3007_hypothetical_protein	AF-Q9Z0G2-F1-model_v4 SRSF protein kinase 3	0.177	94	75	41	134	256	347	9.252E+00	27
DESULFOASV1_3007_hypothetical_protein	AF-Q5RH01-F1-model_v4	DESULFOASV1_3007_hypothetical_protein	AF-Q5RH01-F1-model_v4 Condensin-2 complex subunit H2	0.113	126	107	3	124	1	126	5.761E+00	27
DESULFOASV1_3007_hypothetical_protein	AF-A7ERG1-F1-model_v4	DESULFOASV1_3007_hypothetical_protein	AF-A7ERG1-F1-model_v4 ATP-dependent DNA helicase CHL1	0.126	108	89	31	133	73	180	7.552E+00	27
DESULFOASV1_3007_hypothetical_protein	AF-Q7W2X4-F1-model_v4	DESULFOASV1_3007_hypothetical_protein	AF-Q7W2X4-F1-model_v4 Sec-independent protein translocase protein TatB	0.129	130	110	5	134	25	151	5.031E+00	26
DESULFOASV1_3007_hypothetical_protein	AF-Q03205-F1-model_v4	DESULFOASV1_3007_hypothetical_protein	AF-Q03205-F1-model_v4 Uncharacterized protein YDR042C	0.177	152	105	5	133	13	164	7.057E+00	26
DESULFOASV1_3007_hypothetical_protein	AF-Q9FIS1-F1-model_v4	DESULFOASV1_3007_hypothetical_protein	AF-Q9FIS1-F1-model_v4 MADS-box protein AGL42	0.157	126	105	5	129	77	202	4.702E+00	26
DESULFOASV1_3007_hypothetical_protein	AF-A1XQU3-F1-model_v4	DESULFOASV1_3007_hypothetical_protein	AF-A1XQU3-F1-model_v4 60S ribosomal protein L14	0.187	135	107	2	134	67	201	2.390E+00	26
DESULFOASV1_3007_hypothetical_protein	AF-Q8R1H8-F1-model_v4	DESULFOASV1_3007_hypothetical_protein	AF-Q8R1H8-F1-model_v4 Basic leucine zipper transcriptional factor ATF-like 2	0.132	133	112	2	134	7	136	5.761E+00	26
DESULFOASV1_3007_hypothetical_protein	AF-P12114-F1-model_v4	DESULFOASV1_3007_hypothetical_protein	AF-P12114-F1-model_v4 Cuticle collagen sqt-1	0.166	125	89	10	134	2	109	7.552E+00	26
DESULFOASV1_3007_hypothetical_protein	AF-A0PJT0-F1-model_v4	DESULFOASV1_3007_hypothetical_protein	AF-A0PJT0-F1-model_v4 RILP-like protein 1	0.132	120	102	5	124	173	291	8.646E+00	26
DESULFOASV1_3007_hypothetical_protein	AF-P43253-F1-model_v4	DESULFOASV1_3007_hypothetical_protein	AF-P43253-F1-model_v4 Prostacyclin receptor	0.142	148	113	2	134	251	398	5.031E+00	26
DESULFOASV1_3007_hypothetical_protein	AF-O75901-F1-model_v4	DESULFOASV1_3007_hypothetical_protein	AF-O75901-F1-model_v4 Ras association domain-containing protein 9	0.131	159	110	7	134	267	425	4.107E+00	26
DESULFOASV1_3007_hypothetical_protein	AF-A7MB54-F1-model_v4	DESULFOASV1_3007_hypothetical_protein	AF-A7MB54-F1-model_v4 H2.0-like homeobox protein	0.154	105	83	30	134	286	384	3.133E+00	26
DESULFOASV1_3007_hypothetical_protein	AF-A0A2R6QE26-F1-model_v4	DESULFOASV1_3007_hypothetical_protein	AF-A0A2R6QE26-F1-model_v4 Transcription factor BHLH42	0.152	133	112	1	133	475	607	5.031E+00	26
DESULFOASV1_3007_hypothetical_protein	AF-Q3SI72-F1-model_v4	DESULFOASV1_3007_hypothetical_protein	AF-Q3SI72-F1-model_v4 Sec-independent protein translocase protein TatB	0.106	122	103	13	134	24	139	9.899E+00	25
DESULFOASV1_3007_hypothetical_protein	AF-Q91605-F1-model_v4	DESULFOASV1_3007_hypothetical_protein	AF-Q91605-F1-model_v4 Transcription factor XE1.1	0.109	128	99	1	112	22	149	7.552E+00	25
DESULFOASV1_3007_hypothetical_protein	AF-Q6FER0-F1-model_v4	DESULFOASV1_3007_hypothetical_protein	AF-Q6FER0-F1-model_v4 Sec-independent protein translocase protein TatB	0.137	130	97	5	134	24	136	5.031E+00	25
DESULFOASV1_3007_hypothetical_protein	AF-Q9UW23-F1-model_v4	DESULFOASV1_3007_hypothetical_protein	AF-Q9UW23-F1-model_v4 Mating-type-like protein A1	0.138	137	110	6	134	1	137	3.838E+00	25
DESULFOASV1_3007_hypothetical_protein	AF-Q17DI7-F1-model_v4	DESULFOASV1_3007_hypothetical_protein	AF-Q17DI7-F1-model_v4 Mediator of RNA polymerase II transcription subunit 31	0.102	172	119	1	134	4	175	4.702E+00	25
DESULFOASV1_3007_hypothetical_protein	AF-B5XNL4-F1-model_v4	DESULFOASV1_3007_hypothetical_protein	AF-B5XNL4-F1-model_v4 Cytoskeleton protein RodZ	0.150	98	79	41	134	100	197	8.646E+00	25
DESULFOASV1_3007_hypothetical_protein	AF-Q6RUU0-F1-model_v4	DESULFOASV1_3007_hypothetical_protein	AF-Q6RUU0-F1-model_v4 Pentraxin-4	0.161	130	107	5	134	105	233	5.761E+00	25
DESULFOASV1_3007_hypothetical_protein	AF-A6URV8-F1-model_v4	DESULFOASV1_3007_hypothetical_protein	AF-A6URV8-F1-model_v4 Replication factor C large subunit	0.095	157	119	2	134	328	484	5.384E+00	25
DESULFOASV1_3007_hypothetical_protein	AF-Q80US4-F1-model_v4	DESULFOASV1_3007_hypothetical_protein	AF-Q80US4-F1-model_v4 Actin-related protein 5	0.107	140	117	2	133	287	426	5.384E+00	25
DESULFOASV1_3007_hypothetical_protein	AF-P11420-F1-model_v4	DESULFOASV1_3007_hypothetical_protein	AF-P11420-F1-model_v4 Protein daughterless	0.139	133	112	2	134	543	673	7.057E+00	25
DESULFOASV1_3007_hypothetical_protein	AF-Q54D75-F1-model_v4	DESULFOASV1_3007_hypothetical_protein	AF-Q54D75-F1-model_v4 Probable cyclin-dependent serine/threonine-protein kinase DDB_G0292550	0.044	134	120	1	134	340	465	8.646E+00	25
DESULFOASV1_3007_hypothetical_protein	AF-B4NXA8-F1-model_v4	DESULFOASV1_3007_hypothetical_protein	AF-B4NXA8-F1-model_v4 AF4/FMR2 family member lilli	0.140	130	106	11	134	2	131	6.596E+00	25
DESULFOASV1_3007_hypothetical_protein	AF-Q59ZG8-F1-model_v4	DESULFOASV1_3007_hypothetical_protein	AF-Q59ZG8-F1-model_v4 DASH complex subunit DAD2	0.139	131	102	4	134	1	119	9.252E+00	24
DESULFOASV1_3007_hypothetical_protein	AF-Q82IL9-F1-model_v4	DESULFOASV1_3007_hypothetical_protein	AF-Q82IL9-F1-model_v4 Sec-independent protein translocase protein TatB	0.134	126	100	9	134	31	147	6.164E+00	24
DESULFOASV1_3007_hypothetical_protein	AF-Q9VBQ9-F1-model_v4	DESULFOASV1_3007_hypothetical_protein	AF-Q9VBQ9-F1-model_v4 Mediator of RNA polymerase II transcription subunit 28	0.122	134	112	1	134	30	157	7.552E+00	24
DESULFOASV1_3007_hypothetical_protein	AF-Q4FQ60-F1-model_v4	DESULFOASV1_3007_hypothetical_protein	AF-Q4FQ60-F1-model_v4 Sec-independent protein translocase protein TatB	0.131	134	112	1	134	1	130	6.596E+00	24
DESULFOASV1_3007_hypothetical_protein	AF-Q9HB20-F1-model_v4	DESULFOASV1_3007_hypothetical_protein	AF-Q9HB20-F1-model_v4 Pleckstrin homology domain-containing family A member 3	0.149	130	97	5	134	102	216	8.080E+00	24
DESULFOASV1_3007_hypothetical_protein	AF-Q9WTJ8-F1-model_v4	DESULFOASV1_3007_hypothetical_protein	AF-Q9WTJ8-F1-model_v4 Protein FAM50B	0.149	154	111	1	132	1	154	8.080E+00	24
DESULFOASV1_3007_hypothetical_protein	AF-Q4R3X1-F1-model_v4	DESULFOASV1_3007_hypothetical_protein	AF-Q4R3X1-F1-model_v4 5-azacytidine-induced protein 2	0.083	142	120	3	134	152	293	9.899E+00	24
