query	target	qheader	theader	fident	alnlen	mismatch	qstart	qend	tstart	tend	evalue	bits
DESULFOASV1_3493_hypothetical_protein	AF-P19737-F1-model_v4	DESULFOASV1_3493_hypothetical_protein	AF-P19737-F1-model_v4 TPR repeat-containing protein SYNPCC7002_A0425	0.218	110	85	43	152	63	172	2.501E-03	196
DESULFOASV1_3493_hypothetical_protein	AF-Q43468-F1-model_v4	DESULFOASV1_3493_hypothetical_protein	AF-Q43468-F1-model_v4 Hsp70-Hsp90 organizing protein 1	0.200	115	87	43	152	383	497	1.612E-03	194
DESULFOASV1_3493_hypothetical_protein	AF-Q9STH1-F1-model_v4	DESULFOASV1_3493_hypothetical_protein	AF-Q9STH1-F1-model_v4 Hsp70-Hsp90 organizing protein 3	0.182	115	89	43	152	369	483	1.777E-03	193
DESULFOASV1_3493_hypothetical_protein	AF-Q9UNE7-F1-model_v4	DESULFOASV1_3493_hypothetical_protein	AF-Q9UNE7-F1-model_v4 E3 ubiquitin-protein ligase CHIP	0.173	143	111	43	185	26	160	3.549E-04	189
DESULFOASV1_3493_hypothetical_protein	AF-Q96EQ0-F1-model_v4	DESULFOASV1_3493_hypothetical_protein	AF-Q96EQ0-F1-model_v4 Small glutamine-rich tetratricopeptide repeat-containing protein beta	0.160	137	100	43	179	85	204	4.109E-04	189
DESULFOASV1_3493_hypothetical_protein	AF-Q7ZWU1-F1-model_v4	DESULFOASV1_3493_hypothetical_protein	AF-Q7ZWU1-F1-model_v4 Stress-induced-phosphoprotein 1	0.172	122	96	43	159	4	125	2.501E-03	185
DESULFOASV1_3493_hypothetical_protein	AF-O70593-F1-model_v4	DESULFOASV1_3493_hypothetical_protein	AF-O70593-F1-model_v4 Small glutamine-rich tetratricopeptide repeat-containing protein alpha	0.165	139	101	39	177	87	208	7.750E-04	184
DESULFOASV1_3493_hypothetical_protein	AF-Q496Y0-F1-model_v4	DESULFOASV1_3493_hypothetical_protein	AF-Q496Y0-F1-model_v4 LON peptidase N-terminal domain and RING finger protein 3	0.190	120	95	43	162	243	360	3.192E-03	181
DESULFOASV1_3493_hypothetical_protein	AF-Q9WUD1-F1-model_v4	DESULFOASV1_3493_hypothetical_protein	AF-Q9WUD1-F1-model_v4 E3 ubiquitin-protein ligase CHIP	0.180	142	110	43	184	27	161	6.072E-04	180
DESULFOASV1_3493_hypothetical_protein	AF-Q8VD33-F1-model_v4	DESULFOASV1_3493_hypothetical_protein	AF-Q8VD33-F1-model_v4 Small glutamine-rich tetratricopeptide repeat-containing protein beta	0.145	137	102	43	179	85	204	7.381E-04	180
DESULFOASV1_3493_hypothetical_protein	AF-Q7CKI5-F1-model_v4	DESULFOASV1_3493_hypothetical_protein	AF-Q7CKI5-F1-model_v4 Lipoprotein NlpI	0.210	113	88	43	154	96	208	1.326E-03	179
DESULFOASV1_3493_hypothetical_protein	AF-Q32LM2-F1-model_v4	DESULFOASV1_3493_hypothetical_protein	AF-Q32LM2-F1-model_v4 Small glutamine-rich tetratricopeptide repeat-containing protein alpha	0.166	138	100	39	176	87	207	1.091E-03	179
DESULFOASV1_3493_hypothetical_protein	AF-Q20144-F1-model_v4	DESULFOASV1_3493_hypothetical_protein	AF-Q20144-F1-model_v4 Protein O-mannosyl-transferase TMTC1	0.247	113	84	43	155	466	578	4.493E-03	179
DESULFOASV1_3493_hypothetical_protein	AF-Q8BG19-F1-model_v4	DESULFOASV1_3493_hypothetical_protein	AF-Q8BG19-F1-model_v4 Protein O-mannosyl-transferase TMTC4	0.201	133	105	43	175	516	648	1.866E-03	179
DESULFOASV1_3493_hypothetical_protein	AF-P17885-F1-model_v4	DESULFOASV1_3493_hypothetical_protein	AF-P17885-F1-model_v4 Protein bimA	0.218	132	102	43	174	615	746	1.866E-03	179
DESULFOASV1_3493_hypothetical_protein	AF-Q80W98-F1-model_v4	DESULFOASV1_3493_hypothetical_protein	AF-Q80W98-F1-model_v4 Small glutamine-rich tetratricopeptide repeat-containing protein beta	0.145	137	102	43	179	85	204	8.972E-04	178
DESULFOASV1_3493_hypothetical_protein	AF-Q12118-F1-model_v4	DESULFOASV1_3493_hypothetical_protein	AF-Q12118-F1-model_v4 Small glutamine-rich tetratricopeptide repeat-containing protein 2	0.212	146	102	39	184	98	227	7.381E-04	178
DESULFOASV1_3493_hypothetical_protein	AF-F1RBN2-F1-model_v4	DESULFOASV1_3493_hypothetical_protein	AF-F1RBN2-F1-model_v4 Sperm-associated antigen 1A	0.162	166	120	22	187	284	427	7.029E-04	178
DESULFOASV1_3493_hypothetical_protein	AF-Q5ZHY5-F1-model_v4	DESULFOASV1_3493_hypothetical_protein	AF-Q5ZHY5-F1-model_v4 E3 ubiquitin-protein ligase CHIP	0.159	143	113	43	185	36	170	9.421E-04	176
DESULFOASV1_3493_hypothetical_protein	AF-Q9HGM9-F1-model_v4	DESULFOASV1_3493_hypothetical_protein	AF-Q9HGM9-F1-model_v4 DnaJ homolog subfamily C member 7 homolog	0.175	131	100	39	160	219	349	4.953E-03	175
DESULFOASV1_3493_hypothetical_protein	AF-Q8BW49-F1-model_v4	DESULFOASV1_3493_hypothetical_protein	AF-Q8BW49-F1-model_v4 Tetratricopeptide repeat protein 12	0.161	186	134	1	186	69	229	3.913E-04	174
DESULFOASV1_3493_hypothetical_protein	AF-Q04737-F1-model_v4	DESULFOASV1_3493_hypothetical_protein	AF-Q04737-F1-model_v4 TPR repeat-containing protein slr0751	0.170	117	93	46	158	132	248	4.953E-03	173
DESULFOASV1_3493_hypothetical_protein	AF-Q8XG77-F1-model_v4	DESULFOASV1_3493_hypothetical_protein	AF-Q8XG77-F1-model_v4 Lipoprotein NlpI	0.219	113	87	43	154	96	208	2.501E-03	173
DESULFOASV1_3493_hypothetical_protein	AF-Q9SUT5-F1-model_v4	DESULFOASV1_3493_hypothetical_protein	AF-Q9SUT5-F1-model_v4 Protein SGT1 homolog B	0.121	140	107	43	182	2	124	1.145E-03	173
DESULFOASV1_3493_hypothetical_protein	AF-Q5T4D3-F1-model_v4	DESULFOASV1_3493_hypothetical_protein	AF-Q5T4D3-F1-model_v4 Protein O-mannosyl-transferase TMTC4	0.201	133	105	43	175	516	648	2.895E-03	173
DESULFOASV1_3493_hypothetical_protein	AF-Q96301-F1-model_v4	DESULFOASV1_3493_hypothetical_protein	AF-Q96301-F1-model_v4 Probable UDP-N-acetylglucosamine--peptide N-acetylglucosaminyltransferase SPINDLY	0.203	113	89	45	157	45	157	6.971E-03	173
DESULFOASV1_3493_hypothetical_protein	AF-Q8BJU0-F1-model_v4	DESULFOASV1_3493_hypothetical_protein	AF-Q8BJU0-F1-model_v4 Small glutamine-rich tetratricopeptide repeat-containing protein alpha	0.165	139	101	39	177	88	209	1.692E-03	172
DESULFOASV1_3493_hypothetical_protein	AF-Q57JI4-F1-model_v4	DESULFOASV1_3493_hypothetical_protein	AF-Q57JI4-F1-model_v4 Lipoprotein NlpI	0.219	113	87	43	154	96	208	2.895E-03	171
DESULFOASV1_3493_hypothetical_protein	AF-Q9UIM3-F1-model_v4	DESULFOASV1_3493_hypothetical_protein	AF-Q9UIM3-F1-model_v4 FK506-binding protein-like	0.185	143	108	43	185	210	343	1.039E-03	171
DESULFOASV1_3493_hypothetical_protein	AF-O43765-F1-model_v4	DESULFOASV1_3493_hypothetical_protein	AF-O43765-F1-model_v4 Small glutamine-rich tetratricopeptide repeat-containing protein alpha	0.172	139	100	39	177	87	208	2.057E-03	170
DESULFOASV1_3493_hypothetical_protein	AF-O13797-F1-model_v4	DESULFOASV1_3493_hypothetical_protein	AF-O13797-F1-model_v4 Small glutamine-rich tetratricopeptide repeat-containing protein 2	0.157	133	97	43	175	83	198	2.160E-03	170
DESULFOASV1_3493_hypothetical_protein	AF-Q9SUR9-F1-model_v4	DESULFOASV1_3493_hypothetical_protein	AF-Q9SUR9-F1-model_v4 Protein SGT1 homolog A	0.114	140	108	43	182	2	124	1.462E-03	169
DESULFOASV1_3493_hypothetical_protein	AF-Q9MUK5-F1-model_v4	DESULFOASV1_3493_hypothetical_protein	AF-Q9MUK5-F1-model_v4 Translocon at the outer membrane of chloroplasts 64	0.157	114	91	43	151	477	590	8.898E-03	169
DESULFOASV1_3493_hypothetical_protein	AF-Q9D4H7-F1-model_v4	DESULFOASV1_3493_hypothetical_protein	AF-Q9D4H7-F1-model_v4 LON peptidase N-terminal domain and RING finger protein 3	0.168	125	99	43	162	244	368	3.696E-03	169
DESULFOASV1_3493_hypothetical_protein	AF-Q7CPQ1-F1-model_v4	DESULFOASV1_3493_hypothetical_protein	AF-Q7CPQ1-F1-model_v4 Lipoprotein NlpI	0.219	113	87	43	154	96	208	3.520E-03	168
DESULFOASV1_3493_hypothetical_protein	AF-Q6MG81-F1-model_v4	DESULFOASV1_3493_hypothetical_protein	AF-Q6MG81-F1-model_v4 FK506-binding protein-like	0.187	141	111	43	183	208	345	2.268E-03	168
DESULFOASV1_3493_hypothetical_protein	AF-Q0JL44-F1-model_v4	DESULFOASV1_3493_hypothetical_protein	AF-Q0JL44-F1-model_v4 Protein SGT1 homolog	0.144	138	103	43	180	6	126	1.692E-03	168
DESULFOASV1_3493_hypothetical_protein	AF-Q9M8Y0-F1-model_v4	DESULFOASV1_3493_hypothetical_protein	AF-Q9M8Y0-F1-model_v4 Probable UDP-N-acetylglucosamine--peptide N-acetylglucosaminyltransferase SEC	0.119	133	116	42	174	52	184	6.322E-03	167
DESULFOASV1_3493_hypothetical_protein	AF-P0AFB2-F1-model_v4	DESULFOASV1_3493_hypothetical_protein	AF-P0AFB2-F1-model_v4 Lipoprotein NlpI	0.219	113	87	43	154	96	208	4.493E-03	165
DESULFOASV1_3493_hypothetical_protein	AF-Q9H892-F1-model_v4	DESULFOASV1_3493_hypothetical_protein	AF-Q9H892-F1-model_v4 Tetratricopeptide repeat protein 12	0.161	186	134	1	186	70	230	9.421E-04	165
DESULFOASV1_3493_hypothetical_protein	AF-Q6YZI0-F1-model_v4	DESULFOASV1_3493_hypothetical_protein	AF-Q6YZI0-F1-model_v4 Probable UDP-N-acetylglucosamine--peptide N-acetylglucosaminyltransferase SPINDLY	0.191	115	92	43	157	34	148	1.252E-02	165
DESULFOASV1_3493_hypothetical_protein	AF-Q9H3U1-F1-model_v4	DESULFOASV1_3493_hypothetical_protein	AF-Q9H3U1-F1-model_v4 Protein unc-45 homolog A	0.166	141	103	43	183	21	144	1.612E-03	165
DESULFOASV1_3493_hypothetical_protein	AF-E4P9W4-F1-model_v4	DESULFOASV1_3493_hypothetical_protein	AF-E4P9W4-F1-model_v4 Lipoprotein NlpI	0.219	113	87	43	154	96	208	4.493E-03	164
DESULFOASV1_3493_hypothetical_protein	AF-A8XBR9-F1-model_v4	DESULFOASV1_3493_hypothetical_protein	AF-A8XBR9-F1-model_v4 Tetratricopeptide repeat protein 30 homolog	0.205	112	88	46	157	12	123	8.070E-03	164
DESULFOASV1_3493_hypothetical_protein	AF-O43049-F1-model_v4	DESULFOASV1_3493_hypothetical_protein	AF-O43049-F1-model_v4 Serine/threonine-protein phosphatase T	0.150	133	102	41	161	3	135	4.279E-03	163
DESULFOASV1_3493_hypothetical_protein	AF-Q5R8D8-F1-model_v4	DESULFOASV1_3493_hypothetical_protein	AF-Q5R8D8-F1-model_v4 DnaJ homolog subfamily C member 7	0.153	155	122	1	155	1	145	2.626E-03	163
DESULFOASV1_3493_hypothetical_protein	AF-Q4R8N7-F1-model_v4	DESULFOASV1_3493_hypothetical_protein	AF-Q4R8N7-F1-model_v4 Stress-induced-phosphoprotein 1	0.159	138	101	43	180	4	124	2.057E-03	163
DESULFOASV1_3493_hypothetical_protein	AF-Q95LY5-F1-model_v4	DESULFOASV1_3493_hypothetical_protein	AF-Q95LY5-F1-model_v4 Tetratricopeptide repeat protein 12	0.166	186	132	1	186	72	230	1.145E-03	163
DESULFOASV1_3493_hypothetical_protein	AF-Q7K4B6-F1-model_v4	DESULFOASV1_3493_hypothetical_protein	AF-Q7K4B6-F1-model_v4 Protein O-mannosyl-transferase Tmtc3	0.205	139	110	43	181	596	734	3.696E-03	163
DESULFOASV1_3493_hypothetical_protein	AF-Q8CGY8-F1-model_v4	DESULFOASV1_3493_hypothetical_protein	AF-Q8CGY8-F1-model_v4 UDP-N-acetylglucosamine--peptide N-acetylglucosaminyltransferase 110 kDa subunit	0.174	132	108	43	174	327	458	6.639E-03	163
DESULFOASV1_3493_hypothetical_protein	AF-A1AG68-F1-model_v4	DESULFOASV1_3493_hypothetical_protein	AF-A1AG68-F1-model_v4 Lipoprotein NlpI	0.219	113	87	43	154	96	208	5.461E-03	162
DESULFOASV1_3493_hypothetical_protein	AF-B1XGX5-F1-model_v4	DESULFOASV1_3493_hypothetical_protein	AF-B1XGX5-F1-model_v4 Lipoprotein NlpI	0.219	113	87	43	154	96	208	5.461E-03	162
DESULFOASV1_3493_hypothetical_protein	AF-Q9CYG7-F1-model_v4	DESULFOASV1_3493_hypothetical_protein	AF-Q9CYG7-F1-model_v4 Mitochondrial import receptor subunit TOM34	0.163	116	92	43	153	193	308	1.252E-02	162
DESULFOASV1_3493_hypothetical_protein	AF-A4K2V0-F1-model_v4	DESULFOASV1_3493_hypothetical_protein	AF-A4K2V0-F1-model_v4 Mitochondrial import receptor subunit TOM34	0.137	138	104	38	175	188	308	4.493E-03	162
DESULFOASV1_3493_hypothetical_protein	AF-P0DO20-F1-model_v4	DESULFOASV1_3493_hypothetical_protein	AF-P0DO20-F1-model_v4 Magnetosome protein MamA	0.121	157	128	9	155	2	158	3.881E-03	161
DESULFOASV1_3493_hypothetical_protein	AF-Q3ZBZ8-F1-model_v4	DESULFOASV1_3493_hypothetical_protein	AF-Q3ZBZ8-F1-model_v4 Stress-induced-phosphoprotein 1	0.159	138	101	43	180	4	124	2.382E-03	161
DESULFOASV1_3493_hypothetical_protein	AF-Q9DAC7-F1-model_v4	DESULFOASV1_3493_hypothetical_protein	AF-Q9DAC7-F1-model_v4 Tetratricopeptide repeat protein 32	0.124	144	116	42	185	11	143	1.777E-03	160
DESULFOASV1_3493_hypothetical_protein	AF-Q1C3L9-F1-model_v4	DESULFOASV1_3493_hypothetical_protein	AF-Q1C3L9-F1-model_v4 Lipoprotein NlpI	0.163	152	116	43	182	96	247	8.138E-04	160
DESULFOASV1_3493_hypothetical_protein	AF-Q15785-F1-model_v4	DESULFOASV1_3493_hypothetical_protein	AF-Q15785-F1-model_v4 Mitochondrial import receptor subunit TOM34	0.137	138	104	38	175	188	308	5.201E-03	160
DESULFOASV1_3493_hypothetical_protein	AF-Q9QYI3-F1-model_v4	DESULFOASV1_3493_hypothetical_protein	AF-Q9QYI3-F1-model_v4 DnaJ homolog subfamily C member 7	0.162	155	118	1	155	4	145	3.352E-03	160
DESULFOASV1_3493_hypothetical_protein	AF-Q49AM3-F1-model_v4	DESULFOASV1_3493_hypothetical_protein	AF-Q49AM3-F1-model_v4 Tetratricopeptide repeat protein 31	0.210	133	98	38	162	300	432	7.686E-03	160
DESULFOASV1_3493_hypothetical_protein	AF-Q5XEP2-F1-model_v4	DESULFOASV1_3493_hypothetical_protein	AF-Q5XEP2-F1-model_v4 Hsp70-Hsp90 organizing protein 2	0.160	131	97	43	173	2	118	4.279E-03	160
DESULFOASV1_3493_hypothetical_protein	AF-Q28IV3-F1-model_v4	DESULFOASV1_3493_hypothetical_protein	AF-Q28IV3-F1-model_v4 RNA polymerase II-associated protein 3	0.118	169	131	18	186	259	407	4.717E-03	160
DESULFOASV1_3493_hypothetical_protein	AF-Q5RAP0-F1-model_v4	DESULFOASV1_3493_hypothetical_protein	AF-Q5RAP0-F1-model_v4 Protein unc-45 homolog A	0.166	141	103	43	183	6	129	2.382E-03	160
DESULFOASV1_3493_hypothetical_protein	AF-A6NLP5-F1-model_v4	DESULFOASV1_3493_hypothetical_protein	AF-A6NLP5-F1-model_v4 Tetratricopeptide repeat protein 36	0.194	144	107	22	155	27	170	3.881E-03	159
DESULFOASV1_3493_hypothetical_protein	AF-Q91Z38-F1-model_v4	DESULFOASV1_3493_hypothetical_protein	AF-Q91Z38-F1-model_v4 Tetratricopeptide repeat protein 1	0.153	186	142	1	186	79	247	1.462E-03	159
DESULFOASV1_3493_hypothetical_protein	AF-P0AFB4-F1-model_v4	DESULFOASV1_3493_hypothetical_protein	AF-P0AFB4-F1-model_v4 Lipoprotein NlpI	0.219	113	87	43	154	96	208	6.639E-03	159
DESULFOASV1_3493_hypothetical_protein	AF-Q0TCU6-F1-model_v4	DESULFOASV1_3493_hypothetical_protein	AF-Q0TCU6-F1-model_v4 Lipoprotein NlpI	0.219	113	87	43	154	96	208	6.322E-03	159
DESULFOASV1_3493_hypothetical_protein	AF-O35450-F1-model_v4	DESULFOASV1_3493_hypothetical_protein	AF-O35450-F1-model_v4 FK506-binding protein-like	0.204	139	100	43	181	208	334	3.040E-03	159
DESULFOASV1_3493_hypothetical_protein	AF-Q23049-F1-model_v4	DESULFOASV1_3493_hypothetical_protein	AF-Q23049-F1-model_v4 Tetratricopeptide repeat protein 8	0.234	115	87	43	156	388	502	1.522E-02	159
DESULFOASV1_3493_hypothetical_protein	AF-Q9D706-F1-model_v4	DESULFOASV1_3493_hypothetical_protein	AF-Q9D706-F1-model_v4 RNA polymerase II-associated protein 3	0.187	185	130	1	161	73	257	1.392E-03	159
DESULFOASV1_3493_hypothetical_protein	AF-Q32PZ3-F1-model_v4	DESULFOASV1_3493_hypothetical_protein	AF-Q32PZ3-F1-model_v4 Protein unc-45 homolog A	0.173	141	102	43	183	21	144	2.757E-03	159
DESULFOASV1_3493_hypothetical_protein	AF-P56558-F1-model_v4	DESULFOASV1_3493_hypothetical_protein	AF-P56558-F1-model_v4 UDP-N-acetylglucosamine--peptide N-acetylglucosaminyltransferase 110 kDa subunit	0.174	132	108	43	174	317	448	8.898E-03	159
DESULFOASV1_3493_hypothetical_protein	AF-P81436-F1-model_v4	DESULFOASV1_3493_hypothetical_protein	AF-P81436-F1-model_v4 UDP-N-acetylglucosamine--peptide N-acetylglucosaminyltransferase 110 kDa subunit	0.174	132	108	43	174	327	458	8.898E-03	159
DESULFOASV1_3493_hypothetical_protein	AF-P0CT30-F1-model_v4	DESULFOASV1_3493_hypothetical_protein	AF-P0CT30-F1-model_v4 Small glutamine-rich tetratricopeptide repeat-containing protein 2	0.139	143	108	43	185	105	230	2.626E-03	158
DESULFOASV1_3493_hypothetical_protein	AF-Q99615-F1-model_v4	DESULFOASV1_3493_hypothetical_protein	AF-Q99615-F1-model_v4 DnaJ homolog subfamily C member 7	0.153	155	122	1	155	1	145	3.696E-03	158
DESULFOASV1_3493_hypothetical_protein	AF-P31948-F1-model_v4	DESULFOASV1_3493_hypothetical_protein	AF-P31948-F1-model_v4 Stress-induced-phosphoprotein 1	0.196	151	115	43	186	360	510	2.626E-03	158
DESULFOASV1_3493_hypothetical_protein	AF-Q84K11-F1-model_v4	DESULFOASV1_3493_hypothetical_protein	AF-Q84K11-F1-model_v4 Serine/threonine-protein phosphatase 5	0.154	136	107	38	165	9	144	6.639E-03	158
DESULFOASV1_3493_hypothetical_protein	AF-Q54DA8-F1-model_v4	DESULFOASV1_3493_hypothetical_protein	AF-Q54DA8-F1-model_v4 Protein STIP1 homolog	0.149	127	102	43	163	379	505	8.898E-03	158
DESULFOASV1_3493_hypothetical_protein	AF-O15294-F1-model_v4	DESULFOASV1_3493_hypothetical_protein	AF-O15294-F1-model_v4 UDP-N-acetylglucosamine--peptide N-acetylglucosaminyltransferase 110 kDa subunit	0.189	132	106	43	174	327	458	6.322E-03	158
DESULFOASV1_3493_hypothetical_protein	AF-P0A2U5-F1-model_v4	DESULFOASV1_3493_hypothetical_protein	AF-P0A2U5-F1-model_v4 Chaperone protein IpgC	0.179	131	95	43	173	36	152	6.021E-03	157
DESULFOASV1_3493_hypothetical_protein	AF-Q55ED0-F1-model_v4	DESULFOASV1_3493_hypothetical_protein	AF-Q55ED0-F1-model_v4 Protein SGT1 homolog	0.173	127	97	45	162	2	128	7.320E-03	157
DESULFOASV1_3493_hypothetical_protein	AF-Q60864-F1-model_v4	DESULFOASV1_3493_hypothetical_protein	AF-Q60864-F1-model_v4 Stress-induced-phosphoprotein 1	0.196	151	115	43	186	360	510	2.895E-03	157
DESULFOASV1_3493_hypothetical_protein	AF-Q99KD5-F1-model_v4	DESULFOASV1_3493_hypothetical_protein	AF-Q99KD5-F1-model_v4 Protein unc-45 homolog A	0.173	141	102	43	183	21	144	2.382E-03	157
DESULFOASV1_3493_hypothetical_protein	AF-P23995-F1-model_v4	DESULFOASV1_3493_hypothetical_protein	AF-P23995-F1-model_v4 Low calcium response locus protein H	0.138	152	123	11	154	1	152	1.193E-02	156
DESULFOASV1_3493_hypothetical_protein	AF-Q93DY9-F1-model_v4	DESULFOASV1_3493_hypothetical_protein	AF-Q93DY9-F1-model_v4 Magnetosome protein MamA	0.145	158	131	2	155	1	158	4.953E-03	156
DESULFOASV1_3493_hypothetical_protein	AF-Q3KRD5-F1-model_v4	DESULFOASV1_3493_hypothetical_protein	AF-Q3KRD5-F1-model_v4 Mitochondrial import receptor subunit TOM34	0.163	116	92	43	153	193	308	1.762E-02	156
DESULFOASV1_3493_hypothetical_protein	AF-P53043-F1-model_v4	DESULFOASV1_3493_hypothetical_protein	AF-P53043-F1-model_v4 Serine/threonine-protein phosphatase T	0.154	136	102	38	159	7	142	6.971E-03	156
DESULFOASV1_3493_hypothetical_protein	AF-O35814-F1-model_v4	DESULFOASV1_3493_hypothetical_protein	AF-O35814-F1-model_v4 Stress-induced-phosphoprotein 1	0.196	151	115	43	186	360	510	2.895E-03	156
DESULFOASV1_3493_hypothetical_protein	AF-F8RP11-F1-model_v4	DESULFOASV1_3493_hypothetical_protein	AF-F8RP11-F1-model_v4 Hsp70-Hsp90 organizing protein	0.162	135	96	43	177	392	506	4.493E-03	156
DESULFOASV1_3493_hypothetical_protein	AF-Q56A06-F1-model_v4	DESULFOASV1_3493_hypothetical_protein	AF-Q56A06-F1-model_v4 Protein O-mannosyl-transferase TMTC2	0.212	141	108	39	176	602	742	5.461E-03	156
DESULFOASV1_3493_hypothetical_protein	AF-Q2K4E6-F1-model_v4	DESULFOASV1_3493_hypothetical_protein	AF-Q2K4E6-F1-model_v4 TPR repeat-containing protein RHE_CH03534.1	0.127	118	98	46	158	87	204	1.315E-02	155
DESULFOASV1_3493_hypothetical_protein	AF-Q6PID6-F1-model_v4	DESULFOASV1_3493_hypothetical_protein	AF-Q6PID6-F1-model_v4 Tetratricopeptide repeat protein 33	0.140	187	159	1	186	1	187	1.692E-03	155
DESULFOASV1_3493_hypothetical_protein	AF-Q9D6K7-F1-model_v4	DESULFOASV1_3493_hypothetical_protein	AF-Q9D6K7-F1-model_v4 Tetratricopeptide repeat protein 33	0.142	184	154	3	186	7	187	1.326E-03	155
DESULFOASV1_3493_hypothetical_protein	AF-Q3ZBR5-F1-model_v4	DESULFOASV1_3493_hypothetical_protein	AF-Q3ZBR5-F1-model_v4 Tetratricopeptide repeat protein 1	0.144	186	143	1	186	80	247	2.268E-03	155
DESULFOASV1_3493_hypothetical_protein	AF-Q1CM50-F1-model_v4	DESULFOASV1_3493_hypothetical_protein	AF-Q1CM50-F1-model_v4 Lipoprotein NlpI	0.163	152	116	43	182	96	247	1.263E-03	155
DESULFOASV1_3493_hypothetical_protein	AF-Q57711-F1-model_v4	DESULFOASV1_3493_hypothetical_protein	AF-Q57711-F1-model_v4 TPR repeat-containing protein MJ0941	0.150	113	95	43	155	29	141	2.249E-02	155
DESULFOASV1_3493_hypothetical_protein	AF-O77033-F1-model_v4	DESULFOASV1_3493_hypothetical_protein	AF-O77033-F1-model_v4 General transcriptional corepressor trfA	0.117	181	153	1	174	124	304	3.040E-03	155
DESULFOASV1_3493_hypothetical_protein	AF-A7RL75-F1-model_v4	DESULFOASV1_3493_hypothetical_protein	AF-A7RL75-F1-model_v4 Tetratricopeptide repeat protein 36 homolog	0.157	121	95	41	154	44	164	9.343E-03	154
DESULFOASV1_3493_hypothetical_protein	AF-O14085-F1-model_v4	DESULFOASV1_3493_hypothetical_protein	AF-O14085-F1-model_v4 Translocation protein sec72	0.135	130	100	38	154	57	186	1.315E-02	154
DESULFOASV1_3493_hypothetical_protein	AF-O34452-F1-model_v4	DESULFOASV1_3493_hypothetical_protein	AF-O34452-F1-model_v4 TPR repeat-containing protein YrrB	0.219	132	102	43	174	24	155	1.030E-02	154
DESULFOASV1_3493_hypothetical_protein	AF-P44585-F1-model_v4	DESULFOASV1_3493_hypothetical_protein	AF-P44585-F1-model_v4 Lipoprotein NlpI homolog	0.202	137	105	43	174	108	244	1.462E-03	154
DESULFOASV1_3493_hypothetical_protein	AF-P31759-F1-model_v4	DESULFOASV1_3493_hypothetical_protein	AF-P31759-F1-model_v4 Protein methyltransferase FrzF	0.161	167	118	43	184	423	589	2.501E-03	154
DESULFOASV1_3493_hypothetical_protein	AF-Q84JR9-F1-model_v4	DESULFOASV1_3493_hypothetical_protein	AF-Q84JR9-F1-model_v4 TPR repeat-containing thioredoxin TTL4	0.148	141	105	39	179	445	568	6.639E-03	154
DESULFOASV1_3493_hypothetical_protein	AF-Q5WA76-F1-model_v4	DESULFOASV1_3493_hypothetical_protein	AF-Q5WA76-F1-model_v4 U-box domain-containing protein 70	0.134	170	128	9	178	124	272	3.696E-03	154
DESULFOASV1_3493_hypothetical_protein	AF-Q8CGY6-F1-model_v4	DESULFOASV1_3493_hypothetical_protein	AF-Q8CGY6-F1-model_v4 Protein unc-45 homolog B	0.187	141	100	43	183	6	129	3.192E-03	154
DESULFOASV1_3493_hypothetical_protein	AF-Q8VBW8-F1-model_v4	DESULFOASV1_3493_hypothetical_protein	AF-Q8VBW8-F1-model_v4 Tetratricopeptide repeat protein 36	0.182	126	97	37	155	42	167	1.082E-02	153
DESULFOASV1_3493_hypothetical_protein	AF-Q2W8Q0-F1-model_v4	DESULFOASV1_3493_hypothetical_protein	AF-Q2W8Q0-F1-model_v4 Magnetosome protein MamA	0.139	158	131	3	155	1	158	6.322E-03	153
DESULFOASV1_3493_hypothetical_protein	AF-Q58741-F1-model_v4	DESULFOASV1_3493_hypothetical_protein	AF-Q58741-F1-model_v4 TPR repeat-containing protein MJ1345	0.187	155	108	43	176	147	301	3.520E-03	153
DESULFOASV1_3493_hypothetical_protein	AF-Q27HV0-F1-model_v4	DESULFOASV1_3493_hypothetical_protein	AF-Q27HV0-F1-model_v4 UDP-N-acetylglucosamine--peptide N-acetylglucosaminyltransferase 110 kDa subunit	0.189	132	106	43	174	327	458	8.898E-03	153
DESULFOASV1_3493_hypothetical_protein	AF-Q9Z3Q0-F1-model_v4	DESULFOASV1_3493_hypothetical_protein	AF-Q9Z3Q0-F1-model_v4 Putative adenylate cyclase 3	0.217	132	100	43	174	455	583	8.474E-03	152
DESULFOASV1_3493_hypothetical_protein	AF-P0A2U4-F1-model_v4	DESULFOASV1_3493_hypothetical_protein	AF-P0A2U4-F1-model_v4 Chaperone protein IpgC	0.192	131	94	43	173	36	152	6.971E-03	151
DESULFOASV1_3493_hypothetical_protein	AF-P54493-F1-model_v4	DESULFOASV1_3493_hypothetical_protein	AF-P54493-F1-model_v4 Rhomboid protease GluP	0.173	115	90	42	151	389	503	1.522E-02	151
DESULFOASV1_3493_hypothetical_protein	AF-Q3B7U9-F1-model_v4	DESULFOASV1_3493_hypothetical_protein	AF-Q3B7U9-F1-model_v4 Peptidyl-prolyl cis-trans isomerase FKBP8	0.164	142	117	43	183	212	353	3.696E-03	150
DESULFOASV1_3493_hypothetical_protein	AF-Q9R0T3-F1-model_v4	DESULFOASV1_3493_hypothetical_protein	AF-Q9R0T3-F1-model_v4 DnaJ homolog subfamily C member 3	0.241	113	84	43	154	37	149	1.252E-02	150
DESULFOASV1_3493_hypothetical_protein	AF-O54981-F1-model_v4	DESULFOASV1_3493_hypothetical_protein	AF-O54981-F1-model_v4 Stress-induced-phosphoprotein 1	0.152	138	102	43	180	4	124	5.201E-03	150
DESULFOASV1_3493_hypothetical_protein	AF-F4JS25-F1-model_v4	DESULFOASV1_3493_hypothetical_protein	AF-F4JS25-F1-model_v4 Suppressor of RPS4-RLD 1	0.115	146	116	40	185	3	134	4.279E-03	150
DESULFOASV1_3493_hypothetical_protein	AF-Q84XU2-F1-model_v4	DESULFOASV1_3493_hypothetical_protein	AF-Q84XU2-F1-model_v4 Serine/threonine-protein phosphatase 5	0.130	146	111	38	183	8	136	6.322E-03	149
DESULFOASV1_3493_hypothetical_protein	AF-Q6NU95-F1-model_v4	DESULFOASV1_3493_hypothetical_protein	AF-Q6NU95-F1-model_v4 RNA polymerase II-associated protein 3	0.149	198	157	1	186	73	270	2.382E-03	149
DESULFOASV1_3493_hypothetical_protein	AF-Q9N593-F1-model_v4	DESULFOASV1_3493_hypothetical_protein	AF-Q9N593-F1-model_v4 Cell division cycle protein 27 homolog	0.151	132	111	43	174	595	726	1.315E-02	149
DESULFOASV1_3493_hypothetical_protein	AF-Q96RK4-F1-model_v4	DESULFOASV1_3493_hypothetical_protein	AF-Q96RK4-F1-model_v4 Bardet-Biedl syndrome 4 protein	0.167	180	146	1	176	17	196	3.881E-03	148
DESULFOASV1_3493_hypothetical_protein	AF-Q9LNB6-F1-model_v4	DESULFOASV1_3493_hypothetical_protein	AF-Q9LNB6-F1-model_v4 Hsp70-Hsp90 organizing protein 1	0.155	135	96	43	177	383	497	7.320E-03	148
DESULFOASV1_3493_hypothetical_protein	AF-Q8N394-F1-model_v4	DESULFOASV1_3493_hypothetical_protein	AF-Q8N394-F1-model_v4 Protein O-mannosyl-transferase TMTC2	0.205	141	109	39	176	602	742	9.810E-03	148
DESULFOASV1_3493_hypothetical_protein	AF-Q75A03-F1-model_v4	DESULFOASV1_3493_hypothetical_protein	AF-Q75A03-F1-model_v4 Protein DIA2	0.167	162	118	43	185	6	167	1.462E-03	147
DESULFOASV1_3493_hypothetical_protein	AF-Q5I0X7-F1-model_v4	DESULFOASV1_3493_hypothetical_protein	AF-Q5I0X7-F1-model_v4 Tetratricopeptide repeat protein 32	0.136	145	121	41	185	6	146	3.352E-03	146
DESULFOASV1_3493_hypothetical_protein	AF-Q5M990-F1-model_v4	DESULFOASV1_3493_hypothetical_protein	AF-Q5M990-F1-model_v4 Tetratricopeptide repeat protein 33	0.136	192	159	3	187	7	198	2.057E-03	146
DESULFOASV1_3493_hypothetical_protein	AF-Q1JQ97-F1-model_v4	DESULFOASV1_3493_hypothetical_protein	AF-Q1JQ97-F1-model_v4 Bardet-Biedl syndrome 4 protein homolog	0.194	133	103	43	175	101	229	1.082E-02	146
DESULFOASV1_3493_hypothetical_protein	AF-Q9H6T3-F1-model_v4	DESULFOASV1_3493_hypothetical_protein	AF-Q9H6T3-F1-model_v4 RNA polymerase II-associated protein 3	0.186	193	132	1	163	66	258	3.696E-03	146
DESULFOASV1_3493_hypothetical_protein	AF-Q86TV6-F1-model_v4	DESULFOASV1_3493_hypothetical_protein	AF-Q86TV6-F1-model_v4 Tetratricopeptide repeat protein 7B	0.163	92	76	46	137	733	824	6.270E-02	146
