query	target	qheader	theader	fident	alnlen	mismatch	qstart	qend	tstart	tend	evalue	bits
DESULFOASV1_0780_YitT_family_protein	AF-O34792-F1-model_v4	DESULFOASV1_0780_YitT_family_protein	AF-O34792-F1-model_v4 UPF0750 membrane protein YvjA	0.313	290	192	13	302	1	280	1.757E-21	967
DESULFOASV1_0780_YitT_family_protein	AF-P94357-F1-model_v4	DESULFOASV1_0780_YitT_family_protein	AF-P94357-F1-model_v4 UPF0750 membrane protein YxkD	0.268	290	202	15	304	1	277	3.628E-20	901
DESULFOASV1_0780_YitT_family_protein	AF-P42978-F1-model_v4	DESULFOASV1_0780_YitT_family_protein	AF-P42978-F1-model_v4 UPF0750 membrane protein YpjC	0.287	277	194	23	299	7	279	5.408E-19	859
DESULFOASV1_0780_YitT_family_protein	AF-P96672-F1-model_v4	DESULFOASV1_0780_YitT_family_protein	AF-P96672-F1-model_v4 UPF0750 membrane protein YdeO	0.281	294	206	11	304	1	288	9.211E-20	838
DESULFOASV1_0780_YitT_family_protein	AF-P54478-F1-model_v4	DESULFOASV1_0780_YitT_family_protein	AF-P54478-F1-model_v4 UPF0750 membrane protein YqfU	0.265	303	214	1	303	1	292	1.311E-18	734
DESULFOASV1_0780_YitT_family_protein	AF-P39803-F1-model_v4	DESULFOASV1_0780_YitT_family_protein	AF-P39803-F1-model_v4 UPF0750 membrane protein YitT	0.250	279	206	19	297	2	276	3.652E-18	695
DESULFOASV1_0780_YitT_family_protein	AF-P55815-F1-model_v4	DESULFOASV1_0780_YitT_family_protein	AF-P55815-F1-model_v4 Uncharacterized protein in cccA 5'region	0.348	149	96	152	300	1	148	7.199E-10	441
DESULFOASV1_0780_YitT_family_protein	AF-P75166-F1-model_v4	DESULFOASV1_0780_YitT_family_protein	AF-P75166-F1-model_v4 Uncharacterized protein MG432 homolog	0.165	348	229	23	297	34	381	4.927E-12	387
DESULFOASV1_0780_YitT_family_protein	AF-O06740-F1-model_v4	DESULFOASV1_0780_YitT_family_protein	AF-O06740-F1-model_v4 UPF0750 membrane protein YitE	0.196	197	152	17	213	2	191	4.765E-08	385
DESULFOASV1_0780_YitT_family_protein	AF-P47681-F1-model_v4	DESULFOASV1_0780_YitT_family_protein	AF-P47681-F1-model_v4 Uncharacterized protein MG443	0.139	353	245	12	297	37	389	2.292E-11	359
DESULFOASV1_0780_YitT_family_protein	AF-P75134-F1-model_v4	DESULFOASV1_0780_YitT_family_protein	AF-P75134-F1-model_v4 Uncharacterized protein MG443 homolog	0.126	356	249	12	297	39	394	1.170E-10	349
DESULFOASV1_0780_YitT_family_protein	AF-Q49432-F1-model_v4	DESULFOASV1_0780_YitT_family_protein	AF-Q49432-F1-model_v4 Uncharacterized protein MG432	0.143	358	244	23	308	34	391	6.096E-11	319
DESULFOASV1_0780_YitT_family_protein	AF-P27712-F1-model_v4	DESULFOASV1_0780_YitT_family_protein	AF-P27712-F1-model_v4 Uncharacterized protein in fibril gene 3'region	0.161	298	176	2	212	38	335	9.209E-06	219
DESULFOASV1_0780_YitT_family_protein	AF-Q9KF65-F1-model_v4	DESULFOASV1_0780_YitT_family_protein	AF-Q9KF65-F1-model_v4 UPF0316 protein BH0621	0.187	188	138	111	298	2	172	1.497E-06	200
DESULFOASV1_0780_YitT_family_protein	AF-Q30YE7-F1-model_v4	DESULFOASV1_0780_YitT_family_protein	AF-Q30YE7-F1-model_v4 UPF0316 protein Dde_2502	0.213	174	131	124	297	2	169	3.981E-06	194
DESULFOASV1_0780_YitT_family_protein	AF-Q67MN1-F1-model_v4	DESULFOASV1_0780_YitT_family_protein	AF-Q67MN1-F1-model_v4 UPF0316 protein STH2077	0.201	187	133	111	297	3	170	8.008E-06	194
DESULFOASV1_0780_YitT_family_protein	AF-A3CVP0-F1-model_v4	DESULFOASV1_0780_YitT_family_protein	AF-A3CVP0-F1-model_v4 UPF0316 protein Memar_1511	0.177	169	127	129	297	23	177	6.963E-06	191
DESULFOASV1_0780_YitT_family_protein	AF-Q8Y6B5-F1-model_v4	DESULFOASV1_0780_YitT_family_protein	AF-Q8Y6B5-F1-model_v4 UPF0316 protein lmo1776	0.192	170	132	130	299	5	168	4.579E-06	189
DESULFOASV1_0780_YitT_family_protein	AF-Q3A1T4-F1-model_v4	DESULFOASV1_0780_YitT_family_protein	AF-Q3A1T4-F1-model_v4 UPF0316 protein Pcar_2434	0.167	181	138	117	297	9	175	7.295E-06	189
DESULFOASV1_0780_YitT_family_protein	AF-A0AJN0-F1-model_v4	DESULFOASV1_0780_YitT_family_protein	AF-A0AJN0-F1-model_v4 UPF0316 protein lwe1794	0.197	170	131	130	299	5	168	4.797E-06	188
DESULFOASV1_0780_YitT_family_protein	AF-A8MLK3-F1-model_v4	DESULFOASV1_0780_YitT_family_protein	AF-A8MLK3-F1-model_v4 UPF0316 protein Clos_0555	0.179	166	128	132	297	9	165	2.689E-05	186
DESULFOASV1_0780_YitT_family_protein	AF-Q92AN2-F1-model_v4	DESULFOASV1_0780_YitT_family_protein	AF-Q92AN2-F1-model_v4 UPF0316 protein lin1888	0.192	170	132	130	299	5	168	6.344E-06	186
DESULFOASV1_0780_YitT_family_protein	AF-Q21N99-F1-model_v4	DESULFOASV1_0780_YitT_family_protein	AF-Q21N99-F1-model_v4 UPF0316 protein Sde_0566	0.157	184	144	115	298	1	172	1.537E-05	185
DESULFOASV1_0780_YitT_family_protein	AF-Q8F8F1-F1-model_v4	DESULFOASV1_0780_YitT_family_protein	AF-Q8F8F1-F1-model_v4 UPF0316 protein LA_0606	0.161	174	134	129	302	22	182	1.276E-05	185
DESULFOASV1_0780_YitT_family_protein	AF-P61547-F1-model_v4	DESULFOASV1_0780_YitT_family_protein	AF-P61547-F1-model_v4 UPF0316 protein LIC_12973	0.165	192	156	110	301	2	189	5.265E-06	185
DESULFOASV1_0780_YitT_family_protein	AF-A1SUM3-F1-model_v4	DESULFOASV1_0780_YitT_family_protein	AF-A1SUM3-F1-model_v4 UPF0316 protein Ping_1367	0.158	177	136	129	305	5	167	2.449E-05	184
DESULFOASV1_0780_YitT_family_protein	AF-A7Z241-F1-model_v4	DESULFOASV1_0780_YitT_family_protein	AF-A7Z241-F1-model_v4 UPF0316 protein RBAM_006820	0.192	181	138	118	298	1	172	9.209E-06	183
DESULFOASV1_0780_YitT_family_protein	AF-Q65MT6-F1-model_v4	DESULFOASV1_0780_YitT_family_protein	AF-Q65MT6-F1-model_v4 UPF0316 protein BLi00691/BL01474	0.192	170	135	136	305	12	179	5.265E-06	182
DESULFOASV1_0780_YitT_family_protein	AF-Q0AZJ4-F1-model_v4	DESULFOASV1_0780_YitT_family_protein	AF-Q0AZJ4-F1-model_v4 UPF0316 protein Swol_0526	0.186	169	129	129	297	4	163	1.852E-05	181
DESULFOASV1_0780_YitT_family_protein	AF-A6TLV6-F1-model_v4	DESULFOASV1_0780_YitT_family_protein	AF-A6TLV6-F1-model_v4 UPF0316 protein Amet_0954	0.191	177	134	128	304	5	171	2.951E-05	181
DESULFOASV1_0780_YitT_family_protein	AF-B8DDY1-F1-model_v4	DESULFOASV1_0780_YitT_family_protein	AF-B8DDY1-F1-model_v4 UPF0316 protein LMHCC_0787	0.193	169	131	130	298	5	167	8.389E-06	181
DESULFOASV1_0780_YitT_family_protein	AF-B9DMS4-F1-model_v4	DESULFOASV1_0780_YitT_family_protein	AF-B9DMS4-F1-model_v4 UPF0316 protein Sca_1484	0.174	182	140	117	298	2	171	5.516E-06	181
DESULFOASV1_0780_YitT_family_protein	AF-Q2FLQ6-F1-model_v4	DESULFOASV1_0780_YitT_family_protein	AF-Q2FLQ6-F1-model_v4 UPF0316 protein Mhun_0543	0.168	184	141	114	297	5	175	1.337E-05	181
DESULFOASV1_0780_YitT_family_protein	AF-Q04UZ1-F1-model_v4	DESULFOASV1_0780_YitT_family_protein	AF-Q04UZ1-F1-model_v4 UPF0316 protein LBJ_0597	0.175	171	127	129	299	20	174	1.940E-05	180
DESULFOASV1_0780_YitT_family_protein	AF-C1KW75-F1-model_v4	DESULFOASV1_0780_YitT_family_protein	AF-C1KW75-F1-model_v4 UPF0316 protein Lm4b_01790	0.192	170	132	130	299	5	168	1.059E-05	179
DESULFOASV1_0780_YitT_family_protein	AF-O34624-F1-model_v4	DESULFOASV1_0780_YitT_family_protein	AF-O34624-F1-model_v4 UPF0316 protein YebE	0.178	184	140	115	298	2	172	8.790E-06	179
DESULFOASV1_0780_YitT_family_protein	AF-B1YKE7-F1-model_v4	DESULFOASV1_0780_YitT_family_protein	AF-B1YKE7-F1-model_v4 UPF0316 protein Exig_2248	0.176	174	138	136	309	3	170	1.611E-05	177
DESULFOASV1_0780_YitT_family_protein	AF-Q71YP2-F1-model_v4	DESULFOASV1_0780_YitT_family_protein	AF-Q71YP2-F1-model_v4 UPF0316 protein LMOf2365_1801	0.192	170	132	130	299	5	168	1.276E-05	177
DESULFOASV1_0780_YitT_family_protein	AF-A8FAL9-F1-model_v4	DESULFOASV1_0780_YitT_family_protein	AF-A8FAL9-F1-model_v4 UPF0316 protein BPUM_0594	0.178	177	143	129	305	5	179	6.055E-06	177
DESULFOASV1_0780_YitT_family_protein	AF-A3DHI6-F1-model_v4	DESULFOASV1_0780_YitT_family_protein	AF-A3DHI6-F1-model_v4 UPF0316 protein Cthe_2213	0.153	197	158	128	324	18	204	9.209E-06	177
DESULFOASV1_0780_YitT_family_protein	AF-B9ISM3-F1-model_v4	DESULFOASV1_0780_YitT_family_protein	AF-B9ISM3-F1-model_v4 UPF0316 protein BCQ_3166	0.162	168	138	136	303	3	168	1.109E-05	175
DESULFOASV1_0780_YitT_family_protein	AF-Q88XQ3-F1-model_v4	DESULFOASV1_0780_YitT_family_protein	AF-Q88XQ3-F1-model_v4 UPF0316 protein lp_1140	0.148	168	137	130	297	5	166	1.537E-05	174
DESULFOASV1_0780_YitT_family_protein	AF-C3LBH7-F1-model_v4	DESULFOASV1_0780_YitT_family_protein	AF-C3LBH7-F1-model_v4 UPF0316 protein BAMEG_1207	0.167	163	133	136	298	3	163	1.218E-05	174
DESULFOASV1_0780_YitT_family_protein	AF-A7GAZ7-F1-model_v4	DESULFOASV1_0780_YitT_family_protein	AF-A7GAZ7-F1-model_v4 UPF0316 protein CLI_0673	0.148	170	141	130	299	2	167	3.555E-05	173
DESULFOASV1_0780_YitT_family_protein	AF-Q24WB0-F1-model_v4	DESULFOASV1_0780_YitT_family_protein	AF-Q24WB0-F1-model_v4 UPF0316 protein DSY1893	0.166	168	138	132	299	3	168	1.537E-05	173
DESULFOASV1_0780_YitT_family_protein	AF-C3P314-F1-model_v4	DESULFOASV1_0780_YitT_family_protein	AF-C3P314-F1-model_v4 UPF0316 protein BAA_3454	0.167	163	133	136	298	3	163	1.218E-05	173
DESULFOASV1_0780_YitT_family_protein	AF-P61546-F1-model_v4	DESULFOASV1_0780_YitT_family_protein	AF-P61546-F1-model_v4 UPF0316 protein BCE_3390	0.166	163	133	136	298	3	163	1.218E-05	173
DESULFOASV1_0780_YitT_family_protein	AF-C1ELN0-F1-model_v4	DESULFOASV1_0780_YitT_family_protein	AF-C1ELN0-F1-model_v4 UPF0316 protein BCA_3456	0.167	163	133	136	298	3	163	1.218E-05	173
DESULFOASV1_0780_YitT_family_protein	AF-Q04YI7-F1-model_v4	DESULFOASV1_0780_YitT_family_protein	AF-Q04YI7-F1-model_v4 UPF0316 protein LBL_2483	0.173	178	133	129	306	20	181	2.689E-05	173
DESULFOASV1_0780_YitT_family_protein	AF-Q8ESA3-F1-model_v4	DESULFOASV1_0780_YitT_family_protein	AF-Q8ESA3-F1-model_v4 UPF0316 protein OB0738	0.172	186	151	130	312	2	187	3.305E-06	173
DESULFOASV1_0780_YitT_family_protein	AF-B1IDK9-F1-model_v4	DESULFOASV1_0780_YitT_family_protein	AF-B1IDK9-F1-model_v4 UPF0316 protein CLD_0163	0.162	171	139	130	300	2	168	3.903E-05	172
DESULFOASV1_0780_YitT_family_protein	AF-Q81MZ9-F1-model_v4	DESULFOASV1_0780_YitT_family_protein	AF-Q81MZ9-F1-model_v4 UPF0316 protein BA_3420/GBAA_3420/BAS3170	0.167	163	133	136	298	3	163	1.467E-05	172
DESULFOASV1_0780_YitT_family_protein	AF-A0RGF6-F1-model_v4	DESULFOASV1_0780_YitT_family_protein	AF-A0RGF6-F1-model_v4 UPF0316 protein BALH_3038	0.167	163	133	136	298	3	163	1.276E-05	172
DESULFOASV1_0780_YitT_family_protein	AF-B7IPN4-F1-model_v4	DESULFOASV1_0780_YitT_family_protein	AF-B7IPN4-F1-model_v4 UPF0316 protein BCG9842_B1857	0.166	163	133	136	298	3	163	1.467E-05	172
DESULFOASV1_0780_YitT_family_protein	AF-B7H698-F1-model_v4	DESULFOASV1_0780_YitT_family_protein	AF-B7H698-F1-model_v4 UPF0316 protein BCB4264_A3368	0.166	163	133	136	298	3	163	1.218E-05	172
DESULFOASV1_0780_YitT_family_protein	AF-B7HY28-F1-model_v4	DESULFOASV1_0780_YitT_family_protein	AF-B7HY28-F1-model_v4 UPF0316 protein BCAH187_A3394	0.166	163	133	136	298	3	163	1.337E-05	172
DESULFOASV1_0780_YitT_family_protein	AF-B7JG51-F1-model_v4	DESULFOASV1_0780_YitT_family_protein	AF-B7JG51-F1-model_v4 UPF0316 protein BCAH820_3389	0.167	163	133	136	298	3	163	1.276E-05	172
DESULFOASV1_0780_YitT_family_protein	AF-Q6HG49-F1-model_v4	DESULFOASV1_0780_YitT_family_protein	AF-Q6HG49-F1-model_v4 UPF0316 protein BT9727_3154	0.167	163	133	136	298	3	163	1.276E-05	172
DESULFOASV1_0780_YitT_family_protein	AF-A4ILH7-F1-model_v4	DESULFOASV1_0780_YitT_family_protein	AF-A4ILH7-F1-model_v4 UPF0316 protein GTNG_0803	0.135	163	139	136	298	4	165	1.611E-05	172
DESULFOASV1_0780_YitT_family_protein	AF-A7FRK3-F1-model_v4	DESULFOASV1_0780_YitT_family_protein	AF-A7FRK3-F1-model_v4 UPF0316 protein CLB_0632	0.147	170	141	130	299	2	167	3.903E-05	171
DESULFOASV1_0780_YitT_family_protein	AF-A7GQJ0-F1-model_v4	DESULFOASV1_0780_YitT_family_protein	AF-A7GQJ0-F1-model_v4 UPF0316 protein Bcer98_2136	0.172	163	132	136	298	3	163	1.467E-05	171
DESULFOASV1_0780_YitT_family_protein	AF-Q638L6-F1-model_v4	DESULFOASV1_0780_YitT_family_protein	AF-Q638L6-F1-model_v4 UPF0316 protein BCE33L3064	0.167	163	133	136	298	3	163	1.400E-05	171
DESULFOASV1_0780_YitT_family_protein	AF-Q834N5-F1-model_v4	DESULFOASV1_0780_YitT_family_protein	AF-Q834N5-F1-model_v4 UPF0316 protein EF_1609	0.163	175	140	124	298	2	169	7.643E-06	171
DESULFOASV1_0780_YitT_family_protein	AF-O34927-F1-model_v4	DESULFOASV1_0780_YitT_family_protein	AF-O34927-F1-model_v4 Uncharacterized membrane protein YczE	0.151	194	159	20	213	3	190	1.953E-03	171
DESULFOASV1_0780_YitT_family_protein	AF-C1FT66-F1-model_v4	DESULFOASV1_0780_YitT_family_protein	AF-C1FT66-F1-model_v4 UPF0316 protein CLM_0701	0.153	170	140	130	299	2	167	4.702E-05	170
DESULFOASV1_0780_YitT_family_protein	AF-B8G014-F1-model_v4	DESULFOASV1_0780_YitT_family_protein	AF-B8G014-F1-model_v4 UPF0316 protein Dhaf_3052	0.167	167	137	132	298	3	167	1.611E-05	170
DESULFOASV1_0780_YitT_family_protein	AF-Q81B38-F1-model_v4	DESULFOASV1_0780_YitT_family_protein	AF-Q81B38-F1-model_v4 UPF0316 protein BC_3353	0.166	163	133	136	298	3	163	1.537E-05	170
DESULFOASV1_0780_YitT_family_protein	AF-B1KVR4-F1-model_v4	DESULFOASV1_0780_YitT_family_protein	AF-B1KVR4-F1-model_v4 UPF0316 protein CLK_3798	0.148	170	141	130	299	2	167	4.702E-05	169
DESULFOASV1_0780_YitT_family_protein	AF-C3L101-F1-model_v4	DESULFOASV1_0780_YitT_family_protein	AF-C3L101-F1-model_v4 UPF0316 protein CLJ_B0679	0.156	171	140	130	300	2	168	4.284E-05	169
DESULFOASV1_0780_YitT_family_protein	AF-A9VM05-F1-model_v4	DESULFOASV1_0780_YitT_family_protein	AF-A9VM05-F1-model_v4 UPF0316 protein BcerKBAB4_3093	0.172	162	132	136	297	3	162	1.611E-05	169
DESULFOASV1_0780_YitT_family_protein	AF-Q6AJ39-F1-model_v4	DESULFOASV1_0780_YitT_family_protein	AF-Q6AJ39-F1-model_v4 UPF0316 protein DP2912	0.162	187	142	110	296	5	175	2.951E-05	169
DESULFOASV1_0780_YitT_family_protein	AF-A5HZD5-F1-model_v4	DESULFOASV1_0780_YitT_family_protein	AF-A5HZD5-F1-model_v4 UPF0316 protein CBO0591/CLC_0646	0.163	170	138	130	299	2	167	5.161E-05	166
DESULFOASV1_0780_YitT_family_protein	AF-B1HYA2-F1-model_v4	DESULFOASV1_0780_YitT_family_protein	AF-B1HYA2-F1-model_v4 UPF0316 protein Bsph_0745	0.155	163	135	136	298	3	163	2.566E-05	165
DESULFOASV1_0780_YitT_family_protein	AF-A8Z2S6-F1-model_v4	DESULFOASV1_0780_YitT_family_protein	AF-A8Z2S6-F1-model_v4 UPF0316 protein USA300HOU_1913	0.164	181	140	117	297	2	170	4.702E-05	165
DESULFOASV1_0780_YitT_family_protein	AF-Q8CRT4-F1-model_v4	DESULFOASV1_0780_YitT_family_protein	AF-Q8CRT4-F1-model_v4 UPF0316 protein SE_1595	0.164	181	140	117	297	2	170	4.926E-05	165
DESULFOASV1_0780_YitT_family_protein	AF-C4L5I5-F1-model_v4	DESULFOASV1_0780_YitT_family_protein	AF-C4L5I5-F1-model_v4 UPF0316 protein EAT1b_0871	0.196	162	127	136	297	3	161	1.537E-05	163
DESULFOASV1_0780_YitT_family_protein	AF-Q2FFI4-F1-model_v4	DESULFOASV1_0780_YitT_family_protein	AF-Q2FFI4-F1-model_v4 UPF0316 protein SAUSA300_1892	0.164	181	140	117	297	2	170	5.407E-05	163
DESULFOASV1_0780_YitT_family_protein	AF-Q4L7M5-F1-model_v4	DESULFOASV1_0780_YitT_family_protein	AF-Q4L7M5-F1-model_v4 UPF0316 protein SH1041	0.161	179	142	119	297	1	170	4.702E-05	163
DESULFOASV1_0780_YitT_family_protein	AF-Q5HN24-F1-model_v4	DESULFOASV1_0780_YitT_family_protein	AF-Q5HN24-F1-model_v4 UPF0316 protein SERP1448	0.164	181	140	117	297	2	170	6.515E-05	162
DESULFOASV1_0780_YitT_family_protein	AF-Q5WH46-F1-model_v4	DESULFOASV1_0780_YitT_family_protein	AF-Q5WH46-F1-model_v4 UPF0316 protein ABC1774	0.172	170	132	129	298	5	164	2.338E-05	161
DESULFOASV1_0780_YitT_family_protein	AF-Q49YV5-F1-model_v4	DESULFOASV1_0780_YitT_family_protein	AF-Q49YV5-F1-model_v4 UPF0316 protein SSP0880	0.163	183	142	117	299	2	172	4.488E-05	161
DESULFOASV1_0780_YitT_family_protein	AF-Q6GFE5-F1-model_v4	DESULFOASV1_0780_YitT_family_protein	AF-Q6GFE5-F1-model_v4 UPF0316 protein SAR2004	0.197	164	129	134	297	9	170	5.407E-05	161
DESULFOASV1_0780_YitT_family_protein	AF-A6U317-F1-model_v4	DESULFOASV1_0780_YitT_family_protein	AF-A6U317-F1-model_v4 UPF0316 protein SaurJH1_2001	0.197	164	129	134	297	9	170	5.935E-05	160
DESULFOASV1_0780_YitT_family_protein	AF-Q2YU61-F1-model_v4	DESULFOASV1_0780_YitT_family_protein	AF-Q2YU61-F1-model_v4 UPF0316 protein SAB1848c	0.191	164	130	134	297	9	170	5.665E-05	160
DESULFOASV1_0780_YitT_family_protein	AF-A6QID9-F1-model_v4	DESULFOASV1_0780_YitT_family_protein	AF-A6QID9-F1-model_v4 UPF0316 protein NWMN_1849	0.197	164	129	134	297	9	170	6.218E-05	159
DESULFOASV1_0780_YitT_family_protein	AF-P61545-F1-model_v4	DESULFOASV1_0780_YitT_family_protein	AF-P61545-F1-model_v4 UPF0316 protein MW1852	0.197	164	129	134	297	9	170	6.218E-05	159
DESULFOASV1_0780_YitT_family_protein	AF-Q5HEL0-F1-model_v4	DESULFOASV1_0780_YitT_family_protein	AF-Q5HEL0-F1-model_v4 UPF0316 protein SACOL1973	0.197	164	129	134	297	9	170	6.515E-05	159
DESULFOASV1_0780_YitT_family_protein	AF-P61543-F1-model_v4	DESULFOASV1_0780_YitT_family_protein	AF-P61543-F1-model_v4 UPF0316 protein SAV1911	0.197	164	129	134	297	9	170	6.218E-05	159
DESULFOASV1_0780_YitT_family_protein	AF-A5IU79-F1-model_v4	DESULFOASV1_0780_YitT_family_protein	AF-A5IU79-F1-model_v4 UPF0316 protein SaurJH9_1967	0.197	164	129	134	297	9	170	5.935E-05	159
DESULFOASV1_0780_YitT_family_protein	AF-A7I6E8-F1-model_v4	DESULFOASV1_0780_YitT_family_protein	AF-A7I6E8-F1-model_v4 UPF0316 protein Mboo_0791	0.175	177	144	121	297	24	198	4.089E-05	159
DESULFOASV1_0780_YitT_family_protein	AF-A7X441-F1-model_v4	DESULFOASV1_0780_YitT_family_protein	AF-A7X441-F1-model_v4 UPF0316 protein SAHV_1896	0.197	164	129	134	297	9	170	6.825E-05	158
DESULFOASV1_0780_YitT_family_protein	AF-Q6G821-F1-model_v4	DESULFOASV1_0780_YitT_family_protein	AF-Q6G821-F1-model_v4 UPF0316 protein SAS1835	0.197	164	129	134	297	9	170	8.616E-05	156
DESULFOASV1_0780_YitT_family_protein	AF-Q2G2R9-F1-model_v4	DESULFOASV1_0780_YitT_family_protein	AF-Q2G2R9-F1-model_v4 UPF0316 protein SAOUHSC_02131	0.192	165	131	134	298	9	171	4.089E-05	154
DESULFOASV1_0780_YitT_family_protein	AF-P61544-F1-model_v4	DESULFOASV1_0780_YitT_family_protein	AF-P61544-F1-model_v4 UPF0316 protein SA1727	0.198	164	129	134	297	9	170	7.849E-05	147
DESULFOASV1_0780_YitT_family_protein	AF-P37505-F1-model_v4	DESULFOASV1_0780_YitT_family_protein	AF-P37505-F1-model_v4 Uncharacterized protein YyaS	0.147	189	157	25	213	2	186	7.198E-03	147
DESULFOASV1_0780_YitT_family_protein	AF-A7I5W2-F1-model_v4	DESULFOASV1_0780_YitT_family_protein	AF-A7I5W2-F1-model_v4 UPF0316 protein Mboo_0605	0.164	186	140	113	298	6	173	2.761E-04	142
DESULFOASV1_0780_YitT_family_protein	AF-B9LU14-F1-model_v4	DESULFOASV1_0780_YitT_family_protein	AF-B9LU14-F1-model_v4 ATP phosphoribosyltransferase	0.221	90	69	208	296	207	296	2.202E-02	131
DESULFOASV1_0780_YitT_family_protein	AF-Q7MSU1-F1-model_v4	DESULFOASV1_0780_YitT_family_protein	AF-Q7MSU1-F1-model_v4 Putative nickel insertion protein	0.116	85	71	217	297	247	331	7.745E-02	126
DESULFOASV1_0780_YitT_family_protein	AF-B3E9Z4-F1-model_v4	DESULFOASV1_0780_YitT_family_protein	AF-B3E9Z4-F1-model_v4 Putative nickel insertion protein	0.084	82	70	217	293	254	335	5.590E-02	123
DESULFOASV1_0780_YitT_family_protein	AF-P37538-F1-model_v4	DESULFOASV1_0780_YitT_family_protein	AF-P37538-F1-model_v4 Cyclic di-AMP receptor A	0.128	108	69	218	297	2	109	3.051E-02	120
DESULFOASV1_0780_YitT_family_protein	AF-Q5SKA7-F1-model_v4	DESULFOASV1_0780_YitT_family_protein	AF-Q5SKA7-F1-model_v4 Elongation factor 4	0.139	76	64	217	291	407	482	8.501E-02	120
DESULFOASV1_0780_YitT_family_protein	AF-P9WNM9-F1-model_v4	DESULFOASV1_0780_YitT_family_protein	AF-P9WNM9-F1-model_v4 Elongation factor G-like protein	0.129	75	63	217	291	624	696	6.136E-02	120
DESULFOASV1_0780_YitT_family_protein	AF-A2BV79-F1-model_v4	DESULFOASV1_0780_YitT_family_protein	AF-A2BV79-F1-model_v4 Elongation factor 4	0.139	75	63	217	291	406	479	8.907E-02	118
DESULFOASV1_0780_YitT_family_protein	AF-Q72KV2-F1-model_v4	DESULFOASV1_0780_YitT_family_protein	AF-Q72KV2-F1-model_v4 Elongation factor 4	0.137	76	64	217	291	407	482	1.355E-01	118
DESULFOASV1_0780_YitT_family_protein	AF-Q46GZ6-F1-model_v4	DESULFOASV1_0780_YitT_family_protein	AF-Q46GZ6-F1-model_v4 Elongation factor 4	0.126	75	64	217	291	406	479	1.024E-01	117
DESULFOASV1_0780_YitT_family_protein	AF-Q8CTP4-F1-model_v4	DESULFOASV1_0780_YitT_family_protein	AF-Q8CTP4-F1-model_v4 Pyridinium-3,5-bisthiocarboxylic acid mononucleotide nickel insertion protein	0.078	88	77	214	297	241	328	1.073E-01	114
DESULFOASV1_0780_YitT_family_protein	AF-Q2NJE6-F1-model_v4	DESULFOASV1_0780_YitT_family_protein	AF-Q2NJE6-F1-model_v4 Elongation factor 4	0.137	75	63	217	291	410	483	1.073E-01	114
DESULFOASV1_0780_YitT_family_protein	AF-Q2N9U6-F1-model_v4	DESULFOASV1_0780_YitT_family_protein	AF-Q2N9U6-F1-model_v4 Elongation factor 4	0.172	77	61	217	291	409	485	6.735E-02	114
DESULFOASV1_0780_YitT_family_protein	AF-Q03KW7-F1-model_v4	DESULFOASV1_0780_YitT_family_protein	AF-Q03KW7-F1-model_v4 Elongation factor 4	0.139	75	63	217	291	411	484	1.024E-01	114
DESULFOASV1_0780_YitT_family_protein	AF-Q4Q3F0-F1-model_v4	DESULFOASV1_0780_YitT_family_protein	AF-Q4Q3F0-F1-model_v4 Translation factor GUF1 homolog, mitochondrial	0.100	76	67	217	291	633	708	1.419E-01	114
DESULFOASV1_0780_YitT_family_protein	AF-Q8FMY8-F1-model_v4	DESULFOASV1_0780_YitT_family_protein	AF-Q8FMY8-F1-model_v4 Pyridinium-3,5-bisthiocarboxylic acid mononucleotide nickel insertion protein	0.125	87	71	214	295	248	334	5.093E-02	113
DESULFOASV1_0780_YitT_family_protein	AF-Q5HRE0-F1-model_v4	DESULFOASV1_0780_YitT_family_protein	AF-Q5HRE0-F1-model_v4 Pyridinium-3,5-bisthiocarboxylic acid mononucleotide nickel insertion protein	0.078	88	77	214	297	241	328	1.234E-01	113
DESULFOASV1_0780_YitT_family_protein	AF-B7K3Z7-F1-model_v4	DESULFOASV1_0780_YitT_family_protein	AF-B7K3Z7-F1-model_v4 Elongation factor 4	0.153	75	62	217	291	406	479	8.907E-02	113
DESULFOASV1_0780_YitT_family_protein	AF-C1CKU6-F1-model_v4	DESULFOASV1_0780_YitT_family_protein	AF-C1CKU6-F1-model_v4 Elongation factor 4	0.113	75	65	217	291	410	483	9.776E-02	113
DESULFOASV1_0780_YitT_family_protein	AF-B5E4T8-F1-model_v4	DESULFOASV1_0780_YitT_family_protein	AF-B5E4T8-F1-model_v4 Elongation factor 4	0.115	75	65	217	291	410	483	8.907E-02	113
DESULFOASV1_0780_YitT_family_protein	AF-Q8PWS3-F1-model_v4	DESULFOASV1_0780_YitT_family_protein	AF-Q8PWS3-F1-model_v4 ATP phosphoribosyltransferase	0.131	94	79	205	296	196	289	5.856E-02	112
DESULFOASV1_0780_YitT_family_protein	AF-Q4A0S3-F1-model_v4	DESULFOASV1_0780_YitT_family_protein	AF-Q4A0S3-F1-model_v4 Pyridinium-3,5-bisthiocarboxylic acid mononucleotide nickel insertion protein	0.095	83	71	217	295	244	326	1.419E-01	112
DESULFOASV1_0780_YitT_family_protein	AF-A5FLU8-F1-model_v4	DESULFOASV1_0780_YitT_family_protein	AF-A5FLU8-F1-model_v4 Elongation factor 4	0.166	75	61	217	291	402	475	8.907E-02	112
DESULFOASV1_0780_YitT_family_protein	AF-Q97QK5-F1-model_v4	DESULFOASV1_0780_YitT_family_protein	AF-Q97QK5-F1-model_v4 Elongation factor 4	0.115	75	65	217	291	410	483	9.776E-02	112
DESULFOASV1_0780_YitT_family_protein	AF-Q5M008-F1-model_v4	DESULFOASV1_0780_YitT_family_protein	AF-Q5M008-F1-model_v4 Elongation factor 4	0.139	75	63	217	291	411	484	1.124E-01	112
DESULFOASV1_0780_YitT_family_protein	AF-Q58782-F1-model_v4	DESULFOASV1_0780_YitT_family_protein	AF-Q58782-F1-model_v4 Putative nickel insertion protein	0.047	84	76	217	297	237	320	1.558E-01	111
DESULFOASV1_0780_YitT_family_protein	AF-P53553-F1-model_v4	DESULFOASV1_0780_YitT_family_protein	AF-P53553-F1-model_v4 Aspartokinase	0.175	75	60	217	290	259	333	7.056E-02	111
DESULFOASV1_0780_YitT_family_protein	AF-B1XPA6-F1-model_v4	DESULFOASV1_0780_YitT_family_protein	AF-B1XPA6-F1-model_v4 Putative nickel insertion protein	0.108	82	67	217	292	268	349	9.776E-02	111
DESULFOASV1_0780_YitT_family_protein	AF-Q30Q17-F1-model_v4	DESULFOASV1_0780_YitT_family_protein	AF-Q30Q17-F1-model_v4 Elongation factor 4	0.151	75	62	217	291	401	474	1.293E-01	111
DESULFOASV1_0780_YitT_family_protein	AF-B9E6X5-F1-model_v4	DESULFOASV1_0780_YitT_family_protein	AF-B9E6X5-F1-model_v4 Elongation factor 4	0.141	75	63	217	291	410	483	1.073E-01	111
DESULFOASV1_0780_YitT_family_protein	AF-C0M8H9-F1-model_v4	DESULFOASV1_0780_YitT_family_protein	AF-C0M8H9-F1-model_v4 Elongation factor 4	0.113	75	65	217	291	410	483	1.124E-01	111
DESULFOASV1_0780_YitT_family_protein	AF-A6H1S4-F1-model_v4	DESULFOASV1_0780_YitT_family_protein	AF-A6H1S4-F1-model_v4 Elongation factor 4	0.192	75	59	217	291	402	475	9.776E-02	110
DESULFOASV1_0780_YitT_family_protein	AF-Q0TNS2-F1-model_v4	DESULFOASV1_0780_YitT_family_protein	AF-Q0TNS2-F1-model_v4 Elongation factor 4	0.151	74	61	217	290	405	477	1.791E-01	110
DESULFOASV1_0780_YitT_family_protein	AF-P60794-F1-model_v4	DESULFOASV1_0780_YitT_family_protein	AF-P60794-F1-model_v4 Elongation factor 4	0.139	75	63	217	291	404	477	1.419E-01	110
DESULFOASV1_0780_YitT_family_protein	AF-B1X3K4-F1-model_v4	DESULFOASV1_0780_YitT_family_protein	AF-B1X3K4-F1-model_v4 Translation factor GUF1 homolog, organellar chromatophore	0.139	75	63	217	291	406	479	1.632E-01	110
DESULFOASV1_0780_YitT_family_protein	AF-A3PBD8-F1-model_v4	DESULFOASV1_0780_YitT_family_protein	AF-A3PBD8-F1-model_v4 Elongation factor 4	0.139	75	63	217	291	406	479	1.632E-01	110
DESULFOASV1_0780_YitT_family_protein	AF-A9VHU6-F1-model_v4	DESULFOASV1_0780_YitT_family_protein	AF-A9VHU6-F1-model_v4 Elongation factor 4	0.102	75	66	217	291	410	483	1.073E-01	110
DESULFOASV1_0780_YitT_family_protein	AF-Q81LR7-F1-model_v4	DESULFOASV1_0780_YitT_family_protein	AF-Q81LR7-F1-model_v4 Elongation factor 4	0.102	75	66	217	291	410	483	1.124E-01	110
DESULFOASV1_0780_YitT_family_protein	AF-Q8DPN5-F1-model_v4	DESULFOASV1_0780_YitT_family_protein	AF-Q8DPN5-F1-model_v4 Elongation factor 4	0.115	75	65	217	291	410	483	1.124E-01	110
DESULFOASV1_0780_YitT_family_protein	AF-B1IC02-F1-model_v4	DESULFOASV1_0780_YitT_family_protein	AF-B1IC02-F1-model_v4 Elongation factor 4	0.113	75	65	217	291	410	483	1.234E-01	110
DESULFOASV1_0780_YitT_family_protein	AF-C3L5S2-F1-model_v4	DESULFOASV1_0780_YitT_family_protein	AF-C3L5S2-F1-model_v4 Elongation factor 4	0.102	75	66	217	291	410	483	1.073E-01	110
DESULFOASV1_0780_YitT_family_protein	AF-Q5KWZ3-F1-model_v4	DESULFOASV1_0780_YitT_family_protein	AF-Q5KWZ3-F1-model_v4 Elongation factor 4	0.141	75	63	217	291	410	483	1.073E-01	110
