query	target	qheader	theader	fident	alnlen	mismatch	qstart	qend	tstart	tend	evalue	bits
DESULFOASV1_1894_YraN_family_protein	AF-Q0T0D3-F1-model_v4	DESULFOASV1_1894_YraN_family_protein	AF-Q0T0D3-F1-model_v4 UPF0102 protein YraN	0.355	116	71	9	124	20	130	5.212E-11	372
DESULFOASV1_1894_YraN_family_protein	AF-B2U2L9-F1-model_v4	DESULFOASV1_1894_YraN_family_protein	AF-B2U2L9-F1-model_v4 UPF0102 protein YraN	0.347	116	72	9	124	20	130	4.883E-11	372
DESULFOASV1_1894_YraN_family_protein	AF-Q83JG9-F1-model_v4	DESULFOASV1_1894_YraN_family_protein	AF-Q83JG9-F1-model_v4 UPF0102 protein YraN	0.355	116	71	9	124	20	130	4.883E-11	372
DESULFOASV1_1894_YraN_family_protein	AF-A9L682-F1-model_v4	DESULFOASV1_1894_YraN_family_protein	AF-A9L682-F1-model_v4 UPF0102 protein Sbal195_4188	0.292	113	74	9	121	4	108	1.577E-10	371
DESULFOASV1_1894_YraN_family_protein	AF-A5CQR8-F1-model_v4	DESULFOASV1_1894_YraN_family_protein	AF-A5CQR8-F1-model_v4 UPF0102 protein CMM_1377	0.341	117	75	5	121	4	118	1.067E-10	371
DESULFOASV1_1894_YraN_family_protein	AF-A0M5Z7-F1-model_v4	DESULFOASV1_1894_YraN_family_protein	AF-A0M5Z7-F1-model_v4 UPF0102 protein GFO_3098	0.324	117	76	5	121	4	116	8.223E-11	371
DESULFOASV1_1894_YraN_family_protein	AF-B7MB69-F1-model_v4	DESULFOASV1_1894_YraN_family_protein	AF-B7MB69-F1-model_v4 UPF0102 protein YraN	0.347	116	72	9	124	20	130	5.563E-11	370
DESULFOASV1_1894_YraN_family_protein	AF-B7NKL7-F1-model_v4	DESULFOASV1_1894_YraN_family_protein	AF-B7NKL7-F1-model_v4 UPF0102 protein YraN	0.355	116	71	9	124	20	130	6.337E-11	370
DESULFOASV1_1894_YraN_family_protein	AF-A3DA02-F1-model_v4	DESULFOASV1_1894_YraN_family_protein	AF-A3DA02-F1-model_v4 UPF0102 protein Sbal_4100	0.292	113	74	9	121	4	108	1.918E-10	369
DESULFOASV1_1894_YraN_family_protein	AF-Q5ZR89-F1-model_v4	DESULFOASV1_1894_YraN_family_protein	AF-Q5ZR89-F1-model_v4 UPF0102 protein lpg2994	0.258	119	85	6	124	3	117	1.918E-10	369
DESULFOASV1_1894_YraN_family_protein	AF-B1II71-F1-model_v4	DESULFOASV1_1894_YraN_family_protein	AF-B1II71-F1-model_v4 UPF0102 protein CLD_2200	0.336	115	76	7	121	7	121	1.478E-10	369
DESULFOASV1_1894_YraN_family_protein	AF-A7ZS44-F1-model_v4	DESULFOASV1_1894_YraN_family_protein	AF-A7ZS44-F1-model_v4 UPF0102 protein YraN	0.347	116	72	9	124	20	130	6.337E-11	369
DESULFOASV1_1894_YraN_family_protein	AF-B7LH86-F1-model_v4	DESULFOASV1_1894_YraN_family_protein	AF-B7LH86-F1-model_v4 UPF0102 protein YraN	0.347	116	72	9	124	20	130	6.763E-11	368
DESULFOASV1_1894_YraN_family_protein	AF-B7LMT7-F1-model_v4	DESULFOASV1_1894_YraN_family_protein	AF-B7LMT7-F1-model_v4 UPF0102 protein YraN	0.347	116	72	9	124	20	130	6.763E-11	368
DESULFOASV1_1894_YraN_family_protein	AF-B7NDD2-F1-model_v4	DESULFOASV1_1894_YraN_family_protein	AF-B7NDD2-F1-model_v4 UPF0102 protein YraN	0.347	116	72	9	124	20	130	7.218E-11	368
DESULFOASV1_1894_YraN_family_protein	AF-B5YS38-F1-model_v4	DESULFOASV1_1894_YraN_family_protein	AF-B5YS38-F1-model_v4 UPF0102 protein YraN	0.347	116	72	9	124	20	130	5.563E-11	368
DESULFOASV1_1894_YraN_family_protein	AF-Q32BI4-F1-model_v4	DESULFOASV1_1894_YraN_family_protein	AF-Q32BI4-F1-model_v4 UPF0102 protein YraN	0.347	116	72	9	124	20	130	6.763E-11	368
DESULFOASV1_1894_YraN_family_protein	AF-Q0AFH8-F1-model_v4	DESULFOASV1_1894_YraN_family_protein	AF-Q0AFH8-F1-model_v4 UPF0102 protein Neut_1662	0.341	117	72	7	123	6	115	7.218E-11	367
DESULFOASV1_1894_YraN_family_protein	AF-Q21FX6-F1-model_v4	DESULFOASV1_1894_YraN_family_protein	AF-Q21FX6-F1-model_v4 UPF0102 protein Sde_3146	0.336	121	76	3	123	2	116	1.297E-10	367
DESULFOASV1_1894_YraN_family_protein	AF-B1J1X8-F1-model_v4	DESULFOASV1_1894_YraN_family_protein	AF-B1J1X8-F1-model_v4 UPF0102 protein PputW619_0932	0.321	114	76	9	122	10	122	1.478E-10	367
DESULFOASV1_1894_YraN_family_protein	AF-Q8XAA3-F1-model_v4	DESULFOASV1_1894_YraN_family_protein	AF-Q8XAA3-F1-model_v4 UPF0102 protein YraN	0.338	116	73	9	124	20	130	6.763E-11	367
DESULFOASV1_1894_YraN_family_protein	AF-B5YFD1-F1-model_v4	DESULFOASV1_1894_YraN_family_protein	AF-B5YFD1-F1-model_v4 UPF0102 protein DICTH_1420	0.327	115	76	7	121	5	118	9.367E-11	366
DESULFOASV1_1894_YraN_family_protein	AF-B7UJ44-F1-model_v4	DESULFOASV1_1894_YraN_family_protein	AF-B7UJ44-F1-model_v4 UPF0102 protein YraN	0.338	116	73	9	124	20	130	7.704E-11	366
DESULFOASV1_1894_YraN_family_protein	AF-Q1R6J4-F1-model_v4	DESULFOASV1_1894_YraN_family_protein	AF-Q1R6J4-F1-model_v4 UPF0102 protein YraN	0.347	116	72	9	124	20	130	8.223E-11	366
DESULFOASV1_1894_YraN_family_protein	AF-Q24UC6-F1-model_v4	DESULFOASV1_1894_YraN_family_protein	AF-Q24UC6-F1-model_v4 UPF0102 protein DSY2577	0.301	116	80	5	119	5	120	8.223E-11	365
DESULFOASV1_1894_YraN_family_protein	AF-B2V4E9-F1-model_v4	DESULFOASV1_1894_YraN_family_protein	AF-B2V4E9-F1-model_v4 UPF0102 protein CLH_1204	0.268	121	87	1	121	1	120	1.216E-10	365
DESULFOASV1_1894_YraN_family_protein	AF-Q02H16-F1-model_v4	DESULFOASV1_1894_YraN_family_protein	AF-Q02H16-F1-model_v4 UPF0102 protein PA14_57490	0.341	114	74	9	122	11	124	8.776E-11	365
DESULFOASV1_1894_YraN_family_protein	AF-Q2S9Y0-F1-model_v4	DESULFOASV1_1894_YraN_family_protein	AF-Q2S9Y0-F1-model_v4 UPF0102 protein HCH_05895	0.307	117	78	5	121	9	121	2.047E-10	364
DESULFOASV1_1894_YraN_family_protein	AF-A1T766-F1-model_v4	DESULFOASV1_1894_YraN_family_protein	AF-A1T766-F1-model_v4 UPF0102 protein Mvan_2202	0.384	116	70	6	121	8	121	1.139E-10	363
DESULFOASV1_1894_YraN_family_protein	AF-B6I1M3-F1-model_v4	DESULFOASV1_1894_YraN_family_protein	AF-B6I1M3-F1-model_v4 UPF0102 protein YraN	0.347	116	72	9	124	20	130	9.997E-11	363
DESULFOASV1_1894_YraN_family_protein	AF-B7N0T3-F1-model_v4	DESULFOASV1_1894_YraN_family_protein	AF-B7N0T3-F1-model_v4 UPF0102 protein YraN	0.347	116	72	9	124	20	130	1.067E-10	363
DESULFOASV1_1894_YraN_family_protein	AF-A4FME3-F1-model_v4	DESULFOASV1_1894_YraN_family_protein	AF-A4FME3-F1-model_v4 UPF0102 protein SACE_6045	0.418	121	69	1	121	15	133	1.577E-10	363
DESULFOASV1_1894_YraN_family_protein	AF-A9KBY7-F1-model_v4	DESULFOASV1_1894_YraN_family_protein	AF-A9KBY7-F1-model_v4 UPF0102 protein CBUD_0259	0.324	116	74	5	120	5	115	2.047E-10	362
DESULFOASV1_1894_YraN_family_protein	AF-Q0AWX4-F1-model_v4	DESULFOASV1_1894_YraN_family_protein	AF-Q0AWX4-F1-model_v4 UPF0102 protein Swol_1475	0.408	115	66	7	121	4	115	2.489E-10	361
DESULFOASV1_1894_YraN_family_protein	AF-Q5X0N1-F1-model_v4	DESULFOASV1_1894_YraN_family_protein	AF-Q5X0N1-F1-model_v4 UPF0102 protein lpp3065	0.254	117	84	7	123	4	116	2.656E-10	361
DESULFOASV1_1894_YraN_family_protein	AF-A5IIJ5-F1-model_v4	DESULFOASV1_1894_YraN_family_protein	AF-A5IIJ5-F1-model_v4 UPF0102 protein LPC_3309	0.252	118	85	7	124	4	117	3.026E-10	361
DESULFOASV1_1894_YraN_family_protein	AF-B9MQX5-F1-model_v4	DESULFOASV1_1894_YraN_family_protein	AF-B9MQX5-F1-model_v4 UPF0102 protein Athe_0977	0.341	115	75	7	121	5	119	2.185E-10	361
DESULFOASV1_1894_YraN_family_protein	AF-A8GJZ1-F1-model_v4	DESULFOASV1_1894_YraN_family_protein	AF-A8GJZ1-F1-model_v4 UPF0102 protein Spro_4337	0.350	115	71	9	123	7	116	9.367E-11	360
DESULFOASV1_1894_YraN_family_protein	AF-A5EVA6-F1-model_v4	DESULFOASV1_1894_YraN_family_protein	AF-A5EVA6-F1-model_v4 UPF0102 protein DNO_0639	0.339	115	73	7	121	14	125	9.367E-11	360
DESULFOASV1_1894_YraN_family_protein	AF-Q9JXE2-F1-model_v4	DESULFOASV1_1894_YraN_family_protein	AF-Q9JXE2-F1-model_v4 UPF0102 protein NMB2089	0.315	114	73	7	120	6	113	1.067E-10	359
DESULFOASV1_1894_YraN_family_protein	AF-B1KP82-F1-model_v4	DESULFOASV1_1894_YraN_family_protein	AF-B1KP82-F1-model_v4 UPF0102 protein Swoo_0351	0.286	115	76	7	121	11	117	1.797E-10	358
DESULFOASV1_1894_YraN_family_protein	AF-B8FRJ6-F1-model_v4	DESULFOASV1_1894_YraN_family_protein	AF-B8FRJ6-F1-model_v4 UPF0102 protein Dhaf_3740	0.293	116	81	5	119	5	120	1.385E-10	358
DESULFOASV1_1894_YraN_family_protein	AF-Q0VS15-F1-model_v4	DESULFOASV1_1894_YraN_family_protein	AF-Q0VS15-F1-model_v4 UPF0102 protein ABO_0585	0.307	113	77	9	121	11	122	1.797E-10	358
DESULFOASV1_1894_YraN_family_protein	AF-A9M478-F1-model_v4	DESULFOASV1_1894_YraN_family_protein	AF-A9M478-F1-model_v4 UPF0102 protein NMCC_2054	0.324	114	72	7	120	6	113	1.797E-10	357
DESULFOASV1_1894_YraN_family_protein	AF-A4IYQ8-F1-model_v4	DESULFOASV1_1894_YraN_family_protein	AF-A4IYQ8-F1-model_v4 UPF0102 protein FTW_1281	0.322	116	75	6	121	4	114	1.918E-10	356
DESULFOASV1_1894_YraN_family_protein	AF-Q3AC88-F1-model_v4	DESULFOASV1_1894_YraN_family_protein	AF-Q3AC88-F1-model_v4 UPF0102 protein CHY_1414	0.367	117	72	7	123	5	118	1.139E-10	356
DESULFOASV1_1894_YraN_family_protein	AF-Q025A4-F1-model_v4	DESULFOASV1_1894_YraN_family_protein	AF-Q025A4-F1-model_v4 UPF0102 protein Acid_2433	0.374	125	74	2	121	8	132	3.763E-11	356
DESULFOASV1_1894_YraN_family_protein	AF-A4G1M4-F1-model_v4	DESULFOASV1_1894_YraN_family_protein	AF-A4G1M4-F1-model_v4 UPF0102 protein HEAR0176	0.366	112	65	9	120	18	121	1.139E-10	355
DESULFOASV1_1894_YraN_family_protein	AF-A4WEW3-F1-model_v4	DESULFOASV1_1894_YraN_family_protein	AF-A4WEW3-F1-model_v4 UPF0102 protein Ent638_3585	0.338	116	73	9	124	20	130	1.385E-10	355
DESULFOASV1_1894_YraN_family_protein	AF-C6DIR6-F1-model_v4	DESULFOASV1_1894_YraN_family_protein	AF-C6DIR6-F1-model_v4 UPF0102 protein PC1_0307	0.341	115	72	9	123	7	116	1.577E-10	354
DESULFOASV1_1894_YraN_family_protein	AF-A1SLR5-F1-model_v4	DESULFOASV1_1894_YraN_family_protein	AF-A1SLR5-F1-model_v4 UPF0102 protein Noca_3248	0.338	118	76	2	119	7	122	2.489E-10	354
DESULFOASV1_1894_YraN_family_protein	AF-Q31W27-F1-model_v4	DESULFOASV1_1894_YraN_family_protein	AF-Q31W27-F1-model_v4 UPF0102 protein YraN	0.347	116	72	9	124	20	130	2.047E-10	354
DESULFOASV1_1894_YraN_family_protein	AF-A8G183-F1-model_v4	DESULFOASV1_1894_YraN_family_protein	AF-A8G183-F1-model_v4 UPF0102 protein Ssed_4252	0.310	116	74	6	121	10	117	2.656E-10	353
DESULFOASV1_1894_YraN_family_protein	AF-Q2JWE4-F1-model_v4	DESULFOASV1_1894_YraN_family_protein	AF-Q2JWE4-F1-model_v4 UPF0102 protein CYA_0708	0.370	121	73	6	122	8	128	1.512E-11	352
DESULFOASV1_1894_YraN_family_protein	AF-A1JR73-F1-model_v4	DESULFOASV1_1894_YraN_family_protein	AF-A1JR73-F1-model_v4 UPF0102 protein YE3728	0.322	119	77	5	123	3	116	2.185E-10	351
DESULFOASV1_1894_YraN_family_protein	AF-A6W7V6-F1-model_v4	DESULFOASV1_1894_YraN_family_protein	AF-A6W7V6-F1-model_v4 UPF0102 protein Krad_1407	0.344	115	74	7	121	9	122	3.926E-10	351
DESULFOASV1_1894_YraN_family_protein	AF-Q47S60-F1-model_v4	DESULFOASV1_1894_YraN_family_protein	AF-Q47S60-F1-model_v4 UPF0102 protein Tfu_0669	0.314	120	80	2	121	8	124	1.216E-10	351
DESULFOASV1_1894_YraN_family_protein	AF-Q0A6J0-F1-model_v4	DESULFOASV1_1894_YraN_family_protein	AF-Q0A6J0-F1-model_v4 UPF0102 protein Mlg_2205	0.372	117	69	5	121	12	122	1.067E-10	351
DESULFOASV1_1894_YraN_family_protein	AF-B5FHZ3-F1-model_v4	DESULFOASV1_1894_YraN_family_protein	AF-B5FHZ3-F1-model_v4 UPF0102 protein YraN	0.358	115	70	9	123	20	129	1.797E-10	350
DESULFOASV1_1894_YraN_family_protein	AF-B2SF73-F1-model_v4	DESULFOASV1_1894_YraN_family_protein	AF-B2SF73-F1-model_v4 UPF0102 protein FTM_0486	0.322	116	75	6	121	4	114	2.835E-10	349
DESULFOASV1_1894_YraN_family_protein	AF-B5XSZ5-F1-model_v4	DESULFOASV1_1894_YraN_family_protein	AF-B5XSZ5-F1-model_v4 UPF0102 protein KPK_0567	0.356	113	69	9	121	19	126	2.332E-10	349
DESULFOASV1_1894_YraN_family_protein	AF-A1UEH2-F1-model_v4	DESULFOASV1_1894_YraN_family_protein	AF-A1UEH2-F1-model_v4 UPF0102 protein Mkms_2031	0.353	114	73	8	121	22	135	2.185E-10	349
DESULFOASV1_1894_YraN_family_protein	AF-Q1BRP1-F1-model_v4	DESULFOASV1_1894_YraN_family_protein	AF-Q1BRP1-F1-model_v4 UPF0102 protein Bcen_2816	0.361	118	70	9	126	32	142	1.797E-10	349
DESULFOASV1_1894_YraN_family_protein	AF-Q8EK07-F1-model_v4	DESULFOASV1_1894_YraN_family_protein	AF-Q8EK07-F1-model_v4 UPF0102 protein SO_0299	0.292	113	74	9	121	4	108	8.580E-10	348
DESULFOASV1_1894_YraN_family_protein	AF-Q15PJ2-F1-model_v4	DESULFOASV1_1894_YraN_family_protein	AF-Q15PJ2-F1-model_v4 UPF0102 protein Patl_3694	0.276	110	79	10	119	4	113	4.774E-10	348
DESULFOASV1_1894_YraN_family_protein	AF-Q5R0L0-F1-model_v4	DESULFOASV1_1894_YraN_family_protein	AF-Q5R0L0-F1-model_v4 UPF0102 protein IL0423	0.321	113	74	9	121	7	116	1.797E-10	348
DESULFOASV1_1894_YraN_family_protein	AF-A4THK3-F1-model_v4	DESULFOASV1_1894_YraN_family_protein	AF-A4THK3-F1-model_v4 UPF0102 protein YPDSF_0348	0.336	114	72	9	122	7	115	2.185E-10	348
DESULFOASV1_1894_YraN_family_protein	AF-A5F986-F1-model_v4	DESULFOASV1_1894_YraN_family_protein	AF-A5F986-F1-model_v4 UPF0102 protein VC0395_A0112/VC395_0597	0.285	117	81	5	121	6	119	1.577E-10	348
DESULFOASV1_1894_YraN_family_protein	AF-A5UU10-F1-model_v4	DESULFOASV1_1894_YraN_family_protein	AF-A5UU10-F1-model_v4 UPF0102 protein RoseRS_1723	0.341	122	79	1	122	1	121	9.997E-11	348
DESULFOASV1_1894_YraN_family_protein	AF-O83883-F1-model_v4	DESULFOASV1_1894_YraN_family_protein	AF-O83883-F1-model_v4 UPF0102 protein TP_0913	0.325	123	82	1	122	1	123	3.229E-10	348
DESULFOASV1_1894_YraN_family_protein	AF-P9WFM8-F1-model_v4	DESULFOASV1_1894_YraN_family_protein	AF-P9WFM8-F1-model_v4 UPF0102 protein MT2966	0.369	119	73	6	121	10	128	1.577E-10	347
DESULFOASV1_1894_YraN_family_protein	AF-Q1BAJ0-F1-model_v4	DESULFOASV1_1894_YraN_family_protein	AF-Q1BAJ0-F1-model_v4 UPF0102 protein Mmcs_1985	0.350	114	73	8	121	22	135	2.047E-10	347
DESULFOASV1_1894_YraN_family_protein	AF-Q11XW1-F1-model_v4	DESULFOASV1_1894_YraN_family_protein	AF-Q11XW1-F1-model_v4 UPF0102 protein CHU_0465	0.307	117	76	5	121	3	112	4.473E-10	346
DESULFOASV1_1894_YraN_family_protein	AF-B0U003-F1-model_v4	DESULFOASV1_1894_YraN_family_protein	AF-B0U003-F1-model_v4 UPF0102 protein Fphi_0415	0.338	116	73	6	121	4	114	2.047E-10	346
DESULFOASV1_1894_YraN_family_protein	AF-B4RQP8-F1-model_v4	DESULFOASV1_1894_YraN_family_protein	AF-B4RQP8-F1-model_v4 UPF0102 protein NGK_2254	0.324	114	72	7	120	6	113	3.679E-10	345
DESULFOASV1_1894_YraN_family_protein	AF-A0Q512-F1-model_v4	DESULFOASV1_1894_YraN_family_protein	AF-A0Q512-F1-model_v4 UPF0102 protein FTN_0424	0.322	116	75	6	121	4	114	4.774E-10	345
DESULFOASV1_1894_YraN_family_protein	AF-C5BWW3-F1-model_v4	DESULFOASV1_1894_YraN_family_protein	AF-C5BWW3-F1-model_v4 UPF0102 protein Bcav_2532	0.391	113	67	7	119	6	116	9.367E-11	345
DESULFOASV1_1894_YraN_family_protein	AF-C1AG13-F1-model_v4	DESULFOASV1_1894_YraN_family_protein	AF-C1AG13-F1-model_v4 UPF0102 protein JTY_2914	0.369	119	73	6	121	10	128	1.918E-10	345
DESULFOASV1_1894_YraN_family_protein	AF-P9WFM9-F1-model_v4	DESULFOASV1_1894_YraN_family_protein	AF-P9WFM9-F1-model_v4 UPF0102 protein Rv2898c	0.369	119	73	6	121	10	128	1.918E-10	345
DESULFOASV1_1894_YraN_family_protein	AF-A1KMP2-F1-model_v4	DESULFOASV1_1894_YraN_family_protein	AF-A1KMP2-F1-model_v4 UPF0102 protein BCG_2919c	0.369	119	73	6	121	10	128	1.918E-10	345
DESULFOASV1_1894_YraN_family_protein	AF-Q8ZLU3-F1-model_v4	DESULFOASV1_1894_YraN_family_protein	AF-Q8ZLU3-F1-model_v4 UPF0102 protein YraN	0.358	115	70	9	123	20	129	2.835E-10	345
DESULFOASV1_1894_YraN_family_protein	AF-Q0TCW1-F1-model_v4	DESULFOASV1_1894_YraN_family_protein	AF-Q0TCW1-F1-model_v4 UPF0102 protein YraN	0.350	115	71	9	123	20	129	3.026E-10	345
DESULFOASV1_1894_YraN_family_protein	AF-Q82WG1-F1-model_v4	DESULFOASV1_1894_YraN_family_protein	AF-Q82WG1-F1-model_v4 UPF0102 protein NE0719	0.358	117	71	7	123	6	117	2.047E-10	344
DESULFOASV1_1894_YraN_family_protein	AF-B2S4F0-F1-model_v4	DESULFOASV1_1894_YraN_family_protein	AF-B2S4F0-F1-model_v4 UPF0102 protein TPASS_0913	0.325	123	82	1	122	1	123	2.047E-10	344
DESULFOASV1_1894_YraN_family_protein	AF-A6TEG7-F1-model_v4	DESULFOASV1_1894_YraN_family_protein	AF-A6TEG7-F1-model_v4 UPF0102 protein KPN78578_35270	0.347	113	70	9	121	19	126	3.447E-10	344
DESULFOASV1_1894_YraN_family_protein	AF-P67231-F1-model_v4	DESULFOASV1_1894_YraN_family_protein	AF-P67231-F1-model_v4 UPF0102 protein Mb2922c	0.369	119	73	6	121	10	128	2.047E-10	344
DESULFOASV1_1894_YraN_family_protein	AF-O69890-F1-model_v4	DESULFOASV1_1894_YraN_family_protein	AF-O69890-F1-model_v4 UPF0102 protein SCO5602	0.344	117	76	5	121	14	130	2.047E-10	344
DESULFOASV1_1894_YraN_family_protein	AF-B4T6Y0-F1-model_v4	DESULFOASV1_1894_YraN_family_protein	AF-B4T6Y0-F1-model_v4 UPF0102 protein YraN	0.358	115	70	9	123	20	129	3.026E-10	344
DESULFOASV1_1894_YraN_family_protein	AF-B5QZT7-F1-model_v4	DESULFOASV1_1894_YraN_family_protein	AF-B5QZT7-F1-model_v4 UPF0102 protein YraN	0.358	115	70	9	123	20	129	3.229E-10	344
DESULFOASV1_1894_YraN_family_protein	AF-Q6AEA8-F1-model_v4	DESULFOASV1_1894_YraN_family_protein	AF-Q6AEA8-F1-model_v4 UPF0102 protein Lxx14785	0.347	113	72	7	119	6	116	1.385E-10	343
DESULFOASV1_1894_YraN_family_protein	AF-Q5PL93-F1-model_v4	DESULFOASV1_1894_YraN_family_protein	AF-Q5PL93-F1-model_v4 UPF0102 protein YraN	0.358	115	70	9	123	20	129	3.447E-10	343
DESULFOASV1_1894_YraN_family_protein	AF-B8G6B1-F1-model_v4	DESULFOASV1_1894_YraN_family_protein	AF-B8G6B1-F1-model_v4 UPF0102 protein Cagg_0930	0.347	116	72	9	124	9	120	1.577E-10	342
DESULFOASV1_1894_YraN_family_protein	AF-Q8DI54-F1-model_v4	DESULFOASV1_1894_YraN_family_protein	AF-Q8DI54-F1-model_v4 UPF0102 protein tll1737	0.336	121	79	4	124	2	121	2.185E-10	342
DESULFOASV1_1894_YraN_family_protein	AF-B4TWB9-F1-model_v4	DESULFOASV1_1894_YraN_family_protein	AF-B4TWB9-F1-model_v4 UPF0102 protein YraN	0.350	115	71	9	123	20	129	4.774E-10	342
DESULFOASV1_1894_YraN_family_protein	AF-A9MPP3-F1-model_v4	DESULFOASV1_1894_YraN_family_protein	AF-A9MPP3-F1-model_v4 UPF0102 protein YraN	0.347	116	72	9	124	20	130	3.679E-10	342
DESULFOASV1_1894_YraN_family_protein	AF-A5E8I4-F1-model_v4	DESULFOASV1_1894_YraN_family_protein	AF-A5E8I4-F1-model_v4 UPF0102 protein BBta_0181	0.380	120	69	5	124	23	135	3.679E-10	342
DESULFOASV1_1894_YraN_family_protein	AF-B0REN8-F1-model_v4	DESULFOASV1_1894_YraN_family_protein	AF-B0REN8-F1-model_v4 UPF0102 protein CMS0765	0.347	115	73	7	121	8	120	5.804E-10	341
DESULFOASV1_1894_YraN_family_protein	AF-A1WYV5-F1-model_v4	DESULFOASV1_1894_YraN_family_protein	AF-A1WYV5-F1-model_v4 UPF0102 protein Hhal_2103	0.339	115	69	7	121	13	117	1.797E-10	341
DESULFOASV1_1894_YraN_family_protein	AF-B6ELI6-F1-model_v4	DESULFOASV1_1894_YraN_family_protein	AF-B6ELI6-F1-model_v4 UPF0102 protein VSAL_I2655	0.313	113	75	9	121	11	120	3.679E-10	341
DESULFOASV1_1894_YraN_family_protein	AF-B5F6R8-F1-model_v4	DESULFOASV1_1894_YraN_family_protein	AF-B5F6R8-F1-model_v4 UPF0102 protein YraN	0.358	115	70	9	123	20	129	3.926E-10	341
DESULFOASV1_1894_YraN_family_protein	AF-C0PZ33-F1-model_v4	DESULFOASV1_1894_YraN_family_protein	AF-C0PZ33-F1-model_v4 UPF0102 protein YraN	0.358	115	70	9	123	20	129	3.926E-10	341
DESULFOASV1_1894_YraN_family_protein	AF-Q1GYY7-F1-model_v4	DESULFOASV1_1894_YraN_family_protein	AF-Q1GYY7-F1-model_v4 UPF0102 protein Mfla_2283	0.353	113	69	9	121	5	111	2.489E-10	340
DESULFOASV1_1894_YraN_family_protein	AF-A9R1Q7-F1-model_v4	DESULFOASV1_1894_YraN_family_protein	AF-A9R1Q7-F1-model_v4 UPF0102 protein YpAngola_A1121	0.336	114	72	9	122	7	115	4.191E-10	340
DESULFOASV1_1894_YraN_family_protein	AF-Q7NEX4-F1-model_v4	DESULFOASV1_1894_YraN_family_protein	AF-Q7NEX4-F1-model_v4 UPF0102 protein gll3754	0.361	127	78	5	131	4	126	3.926E-10	340
DESULFOASV1_1894_YraN_family_protein	AF-Q46W60-F1-model_v4	DESULFOASV1_1894_YraN_family_protein	AF-Q46W60-F1-model_v4 UPF0102 protein Reut_A3265	0.335	126	78	5	130	9	127	2.656E-10	340
DESULFOASV1_1894_YraN_family_protein	AF-A5U6Q3-F1-model_v4	DESULFOASV1_1894_YraN_family_protein	AF-A5U6Q3-F1-model_v4 UPF0102 protein MRA_2923	0.369	119	73	6	121	10	128	2.656E-10	340
DESULFOASV1_1894_YraN_family_protein	AF-Q1CE21-F1-model_v4	DESULFOASV1_1894_YraN_family_protein	AF-Q1CE21-F1-model_v4 UPF0102 protein YPN_3432	0.327	114	73	9	122	7	115	3.926E-10	339
DESULFOASV1_1894_YraN_family_protein	AF-Q5NGE7-F1-model_v4	DESULFOASV1_1894_YraN_family_protein	AF-Q5NGE7-F1-model_v4 UPF0102 protein FTT_0898c	0.313	116	76	6	121	4	114	6.195E-10	339
DESULFOASV1_1894_YraN_family_protein	AF-Q1C1F7-F1-model_v4	DESULFOASV1_1894_YraN_family_protein	AF-Q1C1F7-F1-model_v4 UPF0102 protein YPA_3753	0.327	114	73	9	122	7	115	4.191E-10	339
DESULFOASV1_1894_YraN_family_protein	AF-Q83AY5-F1-model_v4	DESULFOASV1_1894_YraN_family_protein	AF-Q83AY5-F1-model_v4 UPF0102 protein CBU_1742	0.324	116	74	5	120	5	115	8.039E-10	339
DESULFOASV1_1894_YraN_family_protein	AF-B2HJM5-F1-model_v4	DESULFOASV1_1894_YraN_family_protein	AF-B2HJM5-F1-model_v4 UPF0102 protein MMAR_1812	0.364	116	73	6	121	7	122	4.473E-10	339
DESULFOASV1_1894_YraN_family_protein	AF-Q12SK8-F1-model_v4	DESULFOASV1_1894_YraN_family_protein	AF-Q12SK8-F1-model_v4 UPF0102 protein Sden_0272	0.292	113	74	9	121	4	108	1.875E-09	338
DESULFOASV1_1894_YraN_family_protein	AF-B1JL80-F1-model_v4	DESULFOASV1_1894_YraN_family_protein	AF-B1JL80-F1-model_v4 UPF0102 protein YPK_0538	0.327	114	73	9	122	7	115	4.191E-10	338
DESULFOASV1_1894_YraN_family_protein	AF-A7FDY9-F1-model_v4	DESULFOASV1_1894_YraN_family_protein	AF-A7FDY9-F1-model_v4 UPF0102 protein YpsIP31758_0474	0.327	114	73	9	122	7	115	4.191E-10	338
DESULFOASV1_1894_YraN_family_protein	AF-B2K3Y3-F1-model_v4	DESULFOASV1_1894_YraN_family_protein	AF-B2K3Y3-F1-model_v4 UPF0102 protein YPTS_3679	0.327	114	73	9	122	7	115	4.191E-10	338
DESULFOASV1_1894_YraN_family_protein	AF-Q14HU9-F1-model_v4	DESULFOASV1_1894_YraN_family_protein	AF-Q14HU9-F1-model_v4 UPF0102 protein FTF0898c	0.313	116	76	6	121	4	114	7.057E-10	338
DESULFOASV1_1894_YraN_family_protein	AF-A0QVA9-F1-model_v4	DESULFOASV1_1894_YraN_family_protein	AF-A0QVA9-F1-model_v4 UPF0102 protein MSMEG_2508/MSMEI_2448	0.378	116	72	6	121	9	124	3.026E-10	338
DESULFOASV1_1894_YraN_family_protein	AF-Q7N090-F1-model_v4	DESULFOASV1_1894_YraN_family_protein	AF-Q7N090-F1-model_v4 UPF0102 protein plu4003	0.295	120	80	9	128	12	126	7.532E-10	338
DESULFOASV1_1894_YraN_family_protein	AF-B4TIY8-F1-model_v4	DESULFOASV1_1894_YraN_family_protein	AF-B4TIY8-F1-model_v4 UPF0102 protein YraN	0.358	115	70	9	123	20	129	5.095E-10	338
DESULFOASV1_1894_YraN_family_protein	AF-B5BGH7-F1-model_v4	DESULFOASV1_1894_YraN_family_protein	AF-B5BGH7-F1-model_v4 UPF0102 protein YraN	0.350	115	71	9	123	20	129	6.195E-10	338
DESULFOASV1_1894_YraN_family_protein	AF-Q8ZB75-F1-model_v4	DESULFOASV1_1894_YraN_family_protein	AF-Q8ZB75-F1-model_v4 UPF0102 protein YPO3549/y0119/YP_3803	0.336	114	72	9	122	7	115	5.095E-10	337
DESULFOASV1_1894_YraN_family_protein	AF-A0JXT3-F1-model_v4	DESULFOASV1_1894_YraN_family_protein	AF-A0JXT3-F1-model_v4 UPF0102 protein Arth_2474	0.356	114	71	8	121	7	118	3.026E-10	337
DESULFOASV1_1894_YraN_family_protein	AF-A8L6C8-F1-model_v4	DESULFOASV1_1894_YraN_family_protein	AF-A8L6C8-F1-model_v4 UPF0102 protein Franean1_1156	0.376	117	71	5	121	4	118	3.926E-10	337
DESULFOASV1_1894_YraN_family_protein	AF-Q2KU88-F1-model_v4	DESULFOASV1_1894_YraN_family_protein	AF-Q2KU88-F1-model_v4 UPF0102 protein BAV3162	0.319	119	75	4	122	18	128	3.447E-10	337
DESULFOASV1_1894_YraN_family_protein	AF-Q665M2-F1-model_v4	DESULFOASV1_1894_YraN_family_protein	AF-Q665M2-F1-model_v4 UPF0102 protein YPTB3494	0.336	114	72	9	122	7	115	5.438E-10	336
DESULFOASV1_1894_YraN_family_protein	AF-A9KLL5-F1-model_v4	DESULFOASV1_1894_YraN_family_protein	AF-A9KLL5-F1-model_v4 UPF0102 protein Cphy_2398	0.400	114	64	9	122	7	114	4.473E-10	336
DESULFOASV1_1894_YraN_family_protein	AF-A4TEA7-F1-model_v4	DESULFOASV1_1894_YraN_family_protein	AF-A4TEA7-F1-model_v4 UPF0102 protein Mflv_4140	0.427	114	65	8	121	10	123	3.679E-10	336
DESULFOASV1_1894_YraN_family_protein	AF-A9WJJ9-F1-model_v4	DESULFOASV1_1894_YraN_family_protein	AF-A9WJJ9-F1-model_v4 UPF0102 protein Caur_2698	0.344	118	74	5	122	5	118	7.057E-10	335
DESULFOASV1_1894_YraN_family_protein	AF-B9LLE9-F1-model_v4	DESULFOASV1_1894_YraN_family_protein	AF-B9LLE9-F1-model_v4 UPF0102 protein Chy400_2915	0.344	118	74	5	122	5	118	7.532E-10	335
DESULFOASV1_1894_YraN_family_protein	AF-A0PQ75-F1-model_v4	DESULFOASV1_1894_YraN_family_protein	AF-A0PQ75-F1-model_v4 UPF0102 protein MUL_2060	0.361	116	73	6	121	7	122	4.473E-10	335
DESULFOASV1_1894_YraN_family_protein	AF-Q8Z3I8-F1-model_v4	DESULFOASV1_1894_YraN_family_protein	AF-Q8Z3I8-F1-model_v4 UPF0102 protein YraN	0.350	115	71	9	123	20	129	6.195E-10	335
DESULFOASV1_1894_YraN_family_protein	AF-B1VYV2-F1-model_v4	DESULFOASV1_1894_YraN_family_protein	AF-B1VYV2-F1-model_v4 UPF0102 protein SGR_1878	0.366	117	73	5	121	4	119	4.473E-10	334
DESULFOASV1_1894_YraN_family_protein	AF-Q47VU1-F1-model_v4	DESULFOASV1_1894_YraN_family_protein	AF-Q47VU1-F1-model_v4 UPF0102 protein CPS_4433	0.273	115	82	7	121	16	129	4.473E-10	334
DESULFOASV1_1894_YraN_family_protein	AF-Q63PU8-F1-model_v4	DESULFOASV1_1894_YraN_family_protein	AF-Q63PU8-F1-model_v4 UPF0102 protein BPSL3274	0.336	118	73	9	126	33	143	6.612E-10	334
DESULFOASV1_1894_YraN_family_protein	AF-Q088R4-F1-model_v4	DESULFOASV1_1894_YraN_family_protein	AF-Q088R4-F1-model_v4 UPF0102 protein Sfri_0388	0.274	113	76	9	121	4	108	2.001E-09	333
DESULFOASV1_1894_YraN_family_protein	AF-A8GZ42-F1-model_v4	DESULFOASV1_1894_YraN_family_protein	AF-A8GZ42-F1-model_v4 UPF0102 protein Spea_0251	0.318	116	73	6	121	5	112	1.268E-09	333
DESULFOASV1_1894_YraN_family_protein	AF-A1R7F9-F1-model_v4	DESULFOASV1_1894_YraN_family_protein	AF-A1R7F9-F1-model_v4 UPF0102 protein AAur_2443	0.366	112	69	8	119	10	119	8.039E-10	333
DESULFOASV1_1894_YraN_family_protein	AF-Q5E2N9-F1-model_v4	DESULFOASV1_1894_YraN_family_protein	AF-Q5E2N9-F1-model_v4 UPF0102 protein VF_2212	0.304	121	83	1	121	1	120	2.656E-10	333
DESULFOASV1_1894_YraN_family_protein	AF-Q3SWF7-F1-model_v4	DESULFOASV1_1894_YraN_family_protein	AF-Q3SWF7-F1-model_v4 UPF0102 protein Nwi_0116	0.360	124	74	1	124	1	117	1.646E-09	331
DESULFOASV1_1894_YraN_family_protein	AF-Q8DEJ8-F1-model_v4	DESULFOASV1_1894_YraN_family_protein	AF-Q8DEJ8-F1-model_v4 UPF0102 protein VV1_0590	0.271	116	82	5	120	6	118	5.804E-10	331
DESULFOASV1_1894_YraN_family_protein	AF-B5REL5-F1-model_v4	DESULFOASV1_1894_YraN_family_protein	AF-B5REL5-F1-model_v4 UPF0102 protein YraN	0.358	115	70	9	123	20	129	8.580E-10	331
DESULFOASV1_1894_YraN_family_protein	AF-A1K3T3-F1-model_v4	DESULFOASV1_1894_YraN_family_protein	AF-A1K3T3-F1-model_v4 UPF0102 protein azo0871	0.398	116	68	7	122	22	135	6.195E-10	331
