query	target	qheader	theader	fident	alnlen	mismatch	qstart	qend	tstart	tend	evalue	bits
DESULFOASV1_2393_hypothetical_protein	AF-Q55E69-F1-model_v4	DESULFOASV1_2393_hypothetical_protein	AF-Q55E69-F1-model_v4 Protein SYS1 homolog	0.066	121	112	3	123	14	134	8.030E+00	42
DESULFOASV1_2393_hypothetical_protein	AF-P43008-F1-model_v4	DESULFOASV1_2393_hypothetical_protein	AF-P43008-F1-model_v4 Biopolymer transport protein ExbB	0.115	118	90	6	123	20	122	1.012E+00	36
DESULFOASV1_2393_hypothetical_protein	AF-Q9VX31-F1-model_v4	DESULFOASV1_2393_hypothetical_protein	AF-Q9VX31-F1-model_v4 Integrator complex subunit 2	0.139	85	71	39	123	1014	1097	8.457E+00	33
DESULFOASV1_2393_hypothetical_protein	AF-O51808-F1-model_v4	DESULFOASV1_2393_hypothetical_protein	AF-O51808-F1-model_v4 Biopolymer transport protein ExbB	0.115	118	90	6	123	20	122	1.985E+00	32
DESULFOASV1_2393_hypothetical_protein	AF-O25897-F1-model_v4	DESULFOASV1_2393_hypothetical_protein	AF-O25897-F1-model_v4 Biopolymer transport protein ExbB	0.115	118	89	6	123	21	122	2.318E+00	31
DESULFOASV1_2393_hypothetical_protein	AF-Q9ZJP6-F1-model_v4	DESULFOASV1_2393_hypothetical_protein	AF-Q9ZJP6-F1-model_v4 Biopolymer transport protein ExbB	0.107	118	90	6	123	21	122	3.162E+00	29
DESULFOASV1_2393_hypothetical_protein	AF-Q8GWT5-F1-model_v4	DESULFOASV1_2393_hypothetical_protein	AF-Q8GWT5-F1-model_v4 Protein cornichon homolog 3	0.157	119	99	5	123	6	123	7.240E+00	27
DESULFOASV1_2393_hypothetical_protein	AF-O67637-F1-model_v4	DESULFOASV1_2393_hypothetical_protein	AF-O67637-F1-model_v4 Biopolymer transport protein ExbB	0.132	118	82	6	123	17	111	3.507E+00	27
DESULFOASV1_2393_hypothetical_protein	AF-Q2F637-F1-model_v4	DESULFOASV1_2393_hypothetical_protein	AF-Q2F637-F1-model_v4 14-3-3 protein zeta	0.148	142	96	10	123	89	230	2.707E+00	26
DESULFOASV1_2393_hypothetical_protein	AF-M1VWN5-F1-model_v4	DESULFOASV1_2393_hypothetical_protein	AF-M1VWN5-F1-model_v4 Anthrone oxygenase CPUR_05435	0.089	142	111	1	123	6	147	8.906E+00	25
DESULFOASV1_2393_hypothetical_protein	AF-O25755-F1-model_v4	DESULFOASV1_2393_hypothetical_protein	AF-O25755-F1-model_v4 Putative biopolymer transport protein ExbB-like 1	0.126	134	102	3	120	24	157	9.878E+00	22
DESULFOASV1_2393_hypothetical_protein	AF-Q7T356-F1-model_v4	DESULFOASV1_2393_hypothetical_protein	AF-Q7T356-F1-model_v4 14-3-3 protein beta/alpha-B	0.112	142	100	10	123	87	228	6.875E+00	21
DESULFOASV1_2393_hypothetical_protein	AF-P29308-F1-model_v4	DESULFOASV1_2393_hypothetical_protein	AF-P29308-F1-model_v4 14-3-3-like protein	0.161	134	88	18	123	57	190	7.625E+00	18
DESULFOASV1_2393_hypothetical_protein	AF-P46826-F1-model_v4	DESULFOASV1_2393_hypothetical_protein	AF-P46826-F1-model_v4 Uncharacterized 29.3 kDa protein in ccpA 3'region	0.217	134	90	6	121	83	216	8.906E+00	17
