query	target	qheader	theader	fident	alnlen	mismatch	qstart	qend	tstart	tend	evalue	bits
DESULFOASV1_3007_hypothetical_protein	AF-Q5ZJ07-F1-model_v4	DESULFOASV1_3007_hypothetical_protein	AF-Q5ZJ07-F1-model_v4 Centrosomal protein CCDC61	0.162	134	103	1	134	139	262	6.164E+00	24
DESULFOASV1_3007_hypothetical_protein	AF-P38753-F1-model_v4	DESULFOASV1_3007_hypothetical_protein	AF-P38753-F1-model_v4 Class E vacuolar protein-sorting machinery protein HSE1	0.119	144	117	1	134	274	417	3.587E+00	24
DESULFOASV1_3007_hypothetical_protein	AF-Q811S9-F1-model_v4	DESULFOASV1_3007_hypothetical_protein	AF-Q811S9-F1-model_v4 Guanine nucleotide-binding protein-like 3	0.095	120	102	1	120	9	122	6.596E+00	24
DESULFOASV1_3007_hypothetical_protein	AF-Q96B18-F1-model_v4	DESULFOASV1_3007_hypothetical_protein	AF-Q96B18-F1-model_v4 Dapper homolog 3	0.147	134	109	1	134	5	133	5.384E+00	24
DESULFOASV1_3007_hypothetical_protein	AF-O13889-F1-model_v4	DESULFOASV1_3007_hypothetical_protein	AF-O13889-F1-model_v4 Eukaryotic translation initiation factor 2-alpha kinase 1	0.100	158	120	1	134	4	161	3.133E+00	24
DESULFOASV1_3007_hypothetical_protein	AF-Q9P3U2-F1-model_v4	DESULFOASV1_3007_hypothetical_protein	AF-Q9P3U2-F1-model_v4 Uncharacterized AAA domain-containing protein C328.04	0.092	130	108	15	134	15	144	8.080E+00	24
DESULFOASV1_3007_hypothetical_protein	AF-Q0I206-F1-model_v4	DESULFOASV1_3007_hypothetical_protein	AF-Q0I206-F1-model_v4 Sec-independent protein translocase protein TatB	0.184	144	105	5	134	22	165	4.702E+00	23
DESULFOASV1_3007_hypothetical_protein	AF-Q04603-F1-model_v4	DESULFOASV1_3007_hypothetical_protein	AF-Q04603-F1-model_v4 DNA polymerase epsilon subunit D	0.161	134	97	1	134	53	169	5.031E+00	23
DESULFOASV1_3007_hypothetical_protein	AF-Q6DAQ3-F1-model_v4	DESULFOASV1_3007_hypothetical_protein	AF-Q6DAQ3-F1-model_v4 Sec-independent protein translocase protein TatB	0.180	121	98	14	134	23	142	5.384E+00	23
DESULFOASV1_3007_hypothetical_protein	AF-P0C5B2-F1-model_v4	DESULFOASV1_3007_hypothetical_protein	AF-P0C5B2-F1-model_v4 MADS-box transcription factor 56	0.107	148	115	5	134	77	224	9.899E+00	23
DESULFOASV1_3007_hypothetical_protein	AF-O22456-F1-model_v4	DESULFOASV1_3007_hypothetical_protein	AF-O22456-F1-model_v4 Developmental protein SEPALLATA 3	0.121	160	117	1	134	77	236	7.057E+00	23
DESULFOASV1_3007_hypothetical_protein	AF-Q810I0-F1-model_v4	DESULFOASV1_3007_hypothetical_protein	AF-Q810I0-F1-model_v4 Vacuolar protein sorting-associated protein 37D	0.179	136	103	8	134	104	239	7.057E+00	23
DESULFOASV1_3007_hypothetical_protein	AF-B3A0Q7-F1-model_v4	DESULFOASV1_3007_hypothetical_protein	AF-B3A0Q7-F1-model_v4 Coiled-coil domain-containing protein 2	0.126	151	116	1	134	127	277	5.761E+00	23
DESULFOASV1_3007_hypothetical_protein	AF-Q8NY74-F1-model_v4	DESULFOASV1_3007_hypothetical_protein	AF-Q8NY74-F1-model_v4 Uncharacterized protein MW0361	0.114	157	115	4	134	89	245	8.646E+00	23
DESULFOASV1_3007_hypothetical_protein	AF-P23441-F1-model_v4	DESULFOASV1_3007_hypothetical_protein	AF-P23441-F1-model_v4 Homeobox protein Nkx-2.1	0.156	110	87	31	134	172	281	5.384E+00	23
DESULFOASV1_3007_hypothetical_protein	AF-O74814-F1-model_v4	DESULFOASV1_3007_hypothetical_protein	AF-O74814-F1-model_v4 UPF0400 protein C337.03	0.118	138	100	21	134	166	303	2.928E+00	23
DESULFOASV1_3007_hypothetical_protein	AF-A7XUX6-F1-model_v4	DESULFOASV1_3007_hypothetical_protein	AF-A7XUX6-F1-model_v4 Selection and upkeep of intraepithelial T-cells protein 2	0.123	134	106	1	134	271	392	5.384E+00	23
DESULFOASV1_3007_hypothetical_protein	AF-Q293Q2-F1-model_v4	DESULFOASV1_3007_hypothetical_protein	AF-Q293Q2-F1-model_v4 Zinc finger protein squeeze	0.095	163	120	1	134	306	468	8.646E+00	23
DESULFOASV1_3007_hypothetical_protein	AF-Q5APT8-F1-model_v4	DESULFOASV1_3007_hypothetical_protein	AF-Q5APT8-F1-model_v4 ATP-dependent RNA helicase DBP3	0.141	114	96	1	113	1	114	7.552E+00	23
DESULFOASV1_3007_hypothetical_protein	AF-Q86UE4-F1-model_v4	DESULFOASV1_3007_hypothetical_protein	AF-Q86UE4-F1-model_v4 Protein LYRIC	0.138	134	104	1	134	1	122	5.761E+00	23
DESULFOASV1_3007_hypothetical_protein	AF-Q01577-F1-model_v4	DESULFOASV1_3007_hypothetical_protein	AF-Q01577-F1-model_v4 Serine/threonine-protein kinase pkpA	0.140	134	95	1	134	350	461	5.761E+00	23
DESULFOASV1_3007_hypothetical_protein	AF-Q86HX9-F1-model_v4	DESULFOASV1_3007_hypothetical_protein	AF-Q86HX9-F1-model_v4 Myb-like protein K	0.136	134	114	1	134	211	343	8.646E+00	23
DESULFOASV1_3007_hypothetical_protein	AF-P32257-F1-model_v4	DESULFOASV1_3007_hypothetical_protein	AF-P32257-F1-model_v4 Mediator of RNA polymerase II transcription subunit 15	0.130	137	116	1	134	177	313	5.031E+00	23
DESULFOASV1_3007_hypothetical_protein	AF-Q0AND7-F1-model_v4	DESULFOASV1_3007_hypothetical_protein	AF-Q0AND7-F1-model_v4 Sec-independent protein translocase protein TatB	0.137	165	115	1	134	1	165	5.031E+00	22
DESULFOASV1_3007_hypothetical_protein	AF-Q2NWT7-F1-model_v4	DESULFOASV1_3007_hypothetical_protein	AF-Q2NWT7-F1-model_v4 Sec-independent protein translocase protein TatB	0.152	122	98	13	134	24	140	6.596E+00	22
DESULFOASV1_3007_hypothetical_protein	AF-Q8LLR0-F1-model_v4	DESULFOASV1_3007_hypothetical_protein	AF-Q8LLR0-F1-model_v4 Agamous-like MADS-box protein MADS4	0.106	149	118	2	134	78	226	9.252E+00	22
DESULFOASV1_3007_hypothetical_protein	AF-Q6BNE1-F1-model_v4	DESULFOASV1_3007_hypothetical_protein	AF-Q6BNE1-F1-model_v4 Pre-mRNA-splicing factor CWC25	0.111	133	116	2	134	81	211	6.596E+00	22
DESULFOASV1_3007_hypothetical_protein	AF-Q05437-F1-model_v4	DESULFOASV1_3007_hypothetical_protein	AF-Q05437-F1-model_v4 Paired mesoderm homeobox protein 1	0.122	134	103	1	134	84	201	8.646E+00	22
DESULFOASV1_3007_hypothetical_protein	AF-O94473-F1-model_v4	DESULFOASV1_3007_hypothetical_protein	AF-O94473-F1-model_v4 Uncharacterized membrane protein C1919.04	0.153	141	110	4	134	52	192	8.080E+00	22
DESULFOASV1_3007_hypothetical_protein	AF-Q8IRJ8-F1-model_v4	DESULFOASV1_3007_hypothetical_protein	AF-Q8IRJ8-F1-model_v4 THO complex protein 7	0.121	134	113	5	134	112	245	6.596E+00	22
DESULFOASV1_3007_hypothetical_protein	AF-Q4R846-F1-model_v4	DESULFOASV1_3007_hypothetical_protein	AF-Q4R846-F1-model_v4 Protein FAM50B	0.160	150	106	1	127	1	150	7.552E+00	22
DESULFOASV1_3007_hypothetical_protein	AF-P43699-F1-model_v4	DESULFOASV1_3007_hypothetical_protein	AF-P43699-F1-model_v4 Homeobox protein Nkx-2.1	0.142	104	88	31	134	172	275	7.552E+00	22
DESULFOASV1_3007_hypothetical_protein	AF-F4K2F0-F1-model_v4	DESULFOASV1_3007_hypothetical_protein	AF-F4K2F0-F1-model_v4 Protein EMSY-LIKE 3	0.136	142	115	1	134	32	173	9.252E+00	22
DESULFOASV1_3007_hypothetical_protein	AF-Q4R914-F1-model_v4	DESULFOASV1_3007_hypothetical_protein	AF-Q4R914-F1-model_v4 Calcium-binding and coiled-coil domain-containing protein 2	0.198	129	95	6	134	225	344	6.596E+00	22
DESULFOASV1_3007_hypothetical_protein	AF-Q61670-F1-model_v4	DESULFOASV1_3007_hypothetical_protein	AF-Q61670-F1-model_v4 H2.0-like homeobox protein	0.145	105	80	30	134	283	376	6.164E+00	22
DESULFOASV1_3007_hypothetical_protein	AF-Q501Q9-F1-model_v4	DESULFOASV1_3007_hypothetical_protein	AF-Q501Q9-F1-model_v4 Mitogen-activated protein kinase 15	0.212	92	69	46	134	331	422	9.899E+00	22
DESULFOASV1_3007_hypothetical_protein	AF-Q5RA29-F1-model_v4	DESULFOASV1_3007_hypothetical_protein	AF-Q5RA29-F1-model_v4 Nucleolar protein 56	0.145	96	77	39	134	407	497	5.761E+00	22
DESULFOASV1_3007_hypothetical_protein	AF-Q8SVF3-F1-model_v4	DESULFOASV1_3007_hypothetical_protein	AF-Q8SVF3-F1-model_v4 UPF0329 protein ECU06_0090	0.088	124	90	35	134	276	399	7.552E+00	22
DESULFOASV1_3007_hypothetical_protein	AF-Q3IJ53-F1-model_v4	DESULFOASV1_3007_hypothetical_protein	AF-Q3IJ53-F1-model_v4 Translation initiation factor IF-2	0.083	135	122	1	134	168	302	9.252E+00	22
DESULFOASV1_3007_hypothetical_protein	AF-Q1R004-F1-model_v4	DESULFOASV1_3007_hypothetical_protein	AF-Q1R004-F1-model_v4 Sec-independent protein translocase protein TatB	0.154	133	99	2	134	1	118	9.252E+00	21
DESULFOASV1_3007_hypothetical_protein	AF-Q9ZM58-F1-model_v4	DESULFOASV1_3007_hypothetical_protein	AF-Q9ZM58-F1-model_v4 Sec-independent protein translocase protein TatB	0.153	128	98	7	134	34	150	9.899E+00	21
DESULFOASV1_3007_hypothetical_protein	AF-Q07N50-F1-model_v4	DESULFOASV1_3007_hypothetical_protein	AF-Q07N50-F1-model_v4 Sec-independent protein translocase protein TatB	0.161	135	108	5	134	22	156	6.596E+00	21
DESULFOASV1_3007_hypothetical_protein	AF-B4RDI3-F1-model_v4	DESULFOASV1_3007_hypothetical_protein	AF-B4RDI3-F1-model_v4 Sec-independent protein translocase protein TatB	0.160	130	101	5	134	23	143	7.552E+00	21
DESULFOASV1_3007_hypothetical_protein	AF-A4YV72-F1-model_v4	DESULFOASV1_3007_hypothetical_protein	AF-A4YV72-F1-model_v4 Sec-independent protein translocase protein TatB	0.151	130	93	5	134	22	131	6.596E+00	21
DESULFOASV1_3007_hypothetical_protein	AF-Q875C2-F1-model_v4	DESULFOASV1_3007_hypothetical_protein	AF-Q875C2-F1-model_v4 Respiratory supercomplex factor 1, mitochondrial	0.146	127	97	8	134	94	208	6.164E+00	21
DESULFOASV1_3007_hypothetical_protein	AF-P29384-F1-model_v4	DESULFOASV1_3007_hypothetical_protein	AF-P29384-F1-model_v4 Developmental protein SEPALLATA 2	0.080	142	120	4	134	81	222	8.646E+00	21
DESULFOASV1_3007_hypothetical_protein	AF-Q9ATE5-F1-model_v4	DESULFOASV1_3007_hypothetical_protein	AF-Q9ATE5-F1-model_v4 MADS-box protein FBP24	0.125	140	115	1	132	117	256	9.899E+00	21
DESULFOASV1_3007_hypothetical_protein	AF-Q99LQ1-F1-model_v4	DESULFOASV1_3007_hypothetical_protein	AF-Q99LQ1-F1-model_v4 MAP3K12-binding inhibitory protein 1	0.128	131	107	1	131	15	138	9.252E+00	21
DESULFOASV1_3007_hypothetical_protein	AF-P43698-F1-model_v4	DESULFOASV1_3007_hypothetical_protein	AF-P43698-F1-model_v4 Thyroid transcription factor 1	0.151	104	87	31	134	172	275	8.646E+00	21
DESULFOASV1_3007_hypothetical_protein	AF-P37285-F1-model_v4	DESULFOASV1_3007_hypothetical_protein	AF-P37285-F1-model_v4 Kinesin light chain 1	0.108	179	116	4	134	20	198	7.552E+00	21
DESULFOASV1_3007_hypothetical_protein	AF-Q9IAM7-F1-model_v4	DESULFOASV1_3007_hypothetical_protein	AF-Q9IAM7-F1-model_v4 Double-strand break repair protein MRE11	0.140	135	114	1	134	440	574	5.761E+00	21
DESULFOASV1_3007_hypothetical_protein	AF-A0A1L8F5J9-F1-model_v4	DESULFOASV1_3007_hypothetical_protein	AF-A0A1L8F5J9-F1-model_v4 Glutamate receptor ionotropic, NMDA 1	0.123	133	107	12	134	766	898	5.384E+00	21
DESULFOASV1_3007_hypothetical_protein	AF-A3M1X6-F1-model_v4	DESULFOASV1_3007_hypothetical_protein	AF-A3M1X6-F1-model_v4 Sec-independent protein translocase protein TatB	0.159	139	111	2	134	3	141	9.252E+00	20
DESULFOASV1_3007_hypothetical_protein	AF-Q4UP02-F1-model_v4	DESULFOASV1_3007_hypothetical_protein	AF-Q4UP02-F1-model_v4 Sec-independent protein translocase protein TatB	0.188	154	108	1	134	1	154	5.031E+00	20
DESULFOASV1_3007_hypothetical_protein	AF-Q3T0U2-F1-model_v4	DESULFOASV1_3007_hypothetical_protein	AF-Q3T0U2-F1-model_v4 60S ribosomal protein L14	0.171	136	109	2	134	67	202	7.552E+00	20
DESULFOASV1_3007_hypothetical_protein	AF-Q9CR57-F1-model_v4	DESULFOASV1_3007_hypothetical_protein	AF-Q9CR57-F1-model_v4 60S ribosomal protein L14	0.176	138	109	2	134	67	204	4.394E+00	20
DESULFOASV1_3007_hypothetical_protein	AF-P29386-F1-model_v4	DESULFOASV1_3007_hypothetical_protein	AF-P29386-F1-model_v4 Agamous-like MADS-box protein AGL6	0.135	155	114	2	134	80	234	7.552E+00	20
DESULFOASV1_3007_hypothetical_protein	AF-Q2VPH1-F1-model_v4	DESULFOASV1_3007_hypothetical_protein	AF-Q2VPH1-F1-model_v4 Protein FAM50A-A	0.140	164	111	1	130	1	164	7.552E+00	20
DESULFOASV1_3007_hypothetical_protein	AF-Q7PYQ5-F1-model_v4	DESULFOASV1_3007_hypothetical_protein	AF-Q7PYQ5-F1-model_v4 Protein FAM50 homolog	0.116	167	118	1	134	1	167	8.646E+00	20
DESULFOASV1_3007_hypothetical_protein	AF-Q7SXL7-F1-model_v4	DESULFOASV1_3007_hypothetical_protein	AF-Q7SXL7-F1-model_v4 Pre-mRNA-splicing regulator WTAP	0.130	134	110	1	134	148	274	9.252E+00	20
DESULFOASV1_3007_hypothetical_protein	AF-Q95K50-F1-model_v4	DESULFOASV1_3007_hypothetical_protein	AF-Q95K50-F1-model_v4 Nucleolar protein 56	0.145	96	77	39	134	407	497	9.252E+00	20
DESULFOASV1_3007_hypothetical_protein	AF-Q9VAP2-F1-model_v4	DESULFOASV1_3007_hypothetical_protein	AF-Q9VAP2-F1-model_v4 Augmin complex subunit dgt6	0.138	149	111	5	134	241	389	9.899E+00	20
DESULFOASV1_3007_hypothetical_protein	AF-Q9D702-F1-model_v4	DESULFOASV1_3007_hypothetical_protein	AF-Q9D702-F1-model_v4 Transmembrane protein 52	0.117	134	101	1	134	1	115	8.646E+00	19
DESULFOASV1_3007_hypothetical_protein	AF-B7K2V6-F1-model_v4	DESULFOASV1_3007_hypothetical_protein	AF-B7K2V6-F1-model_v4 Proton extrusion protein PcxA	0.139	185	108	6	132	1	185	8.080E+00	19
DESULFOASV1_3007_hypothetical_protein	AF-O00567-F1-model_v4	DESULFOASV1_3007_hypothetical_protein	AF-O00567-F1-model_v4 Nucleolar protein 56	0.166	106	79	39	134	407	512	9.252E+00	19
DESULFOASV1_3007_hypothetical_protein	AF-Q9JIM0-F1-model_v4	DESULFOASV1_3007_hypothetical_protein	AF-Q9JIM0-F1-model_v4 Double-strand break repair protein MRE11	0.115	133	111	9	134	457	589	9.899E+00	19
DESULFOASV1_3007_hypothetical_protein	AF-Q31E60-F1-model_v4	DESULFOASV1_3007_hypothetical_protein	AF-Q31E60-F1-model_v4 Sec-independent protein translocase protein TatB	0.121	146	117	1	134	1	146	9.899E+00	18
DESULFOASV1_3007_hypothetical_protein	AF-Q63507-F1-model_v4	DESULFOASV1_3007_hypothetical_protein	AF-Q63507-F1-model_v4 60S ribosomal protein L14	0.189	144	107	2	134	67	210	6.164E+00	18
DESULFOASV1_3007_hypothetical_protein	AF-P20428-F1-model_v4	DESULFOASV1_3007_hypothetical_protein	AF-P20428-F1-model_v4 Myogenin	0.171	130	103	5	134	74	198	7.057E+00	18
DESULFOASV1_3007_hypothetical_protein	AF-P41894-F1-model_v4	DESULFOASV1_3007_hypothetical_protein	AF-P41894-F1-model_v4 Helix-loop-helix protein delilah	0.150	143	113	1	134	81	223	9.252E+00	18
DESULFOASV1_3007_hypothetical_protein	AF-Q9FBK8-F1-model_v4	DESULFOASV1_3007_hypothetical_protein	AF-Q9FBK8-F1-model_v4 Sec-independent protein translocase protein TatB	0.176	126	94	9	134	31	145	9.252E+00	17
DESULFOASV1_3007_hypothetical_protein	AF-O74774-F1-model_v4	DESULFOASV1_3007_hypothetical_protein	AF-O74774-F1-model_v4 Elongation factor 1 alpha-like protein	0.140	113	93	22	134	29	137	9.899E+00	16
