query	target	qheader	theader	fident	alnlen	mismatch	qstart	qend	tstart	tend	evalue	bits
DESULFOASV1_3493_hypothetical_protein	AF-P0AB59-F1-model_v4	DESULFOASV1_3493_hypothetical_protein	AF-P0AB59-F1-model_v4 Lipopolysaccharide assembly protein B	0.183	172	136	15	186	7	174	1.510E-01	104
DESULFOASV1_3493_hypothetical_protein	AF-Q99LG4-F1-model_v4	DESULFOASV1_3493_hypothetical_protein	AF-Q99LG4-F1-model_v4 Tetratricopeptide repeat protein 5	0.206	129	92	61	177	87	215	8.824E-02	104
DESULFOASV1_3493_hypothetical_protein	AF-Q5BK48-F1-model_v4	DESULFOASV1_3493_hypothetical_protein	AF-Q5BK48-F1-model_v4 Tetratricopeptide repeat protein 5	0.223	129	90	61	177	87	215	1.022E-01	104
DESULFOASV1_3493_hypothetical_protein	AF-Q04364-F1-model_v4	DESULFOASV1_3493_hypothetical_protein	AF-Q04364-F1-model_v4 Peroxisomal targeting signal receptor 9	0.123	234	160	1	183	144	377	4.243E-02	104
DESULFOASV1_3493_hypothetical_protein	AF-Q8C437-F1-model_v4	DESULFOASV1_3493_hypothetical_protein	AF-Q8C437-F1-model_v4 PEX5-related protein	0.147	223	148	1	174	179	401	4.243E-02	104
DESULFOASV1_3493_hypothetical_protein	AF-O14217-F1-model_v4	DESULFOASV1_3493_hypothetical_protein	AF-O14217-F1-model_v4 Probable mitochondrial import receptor subunit tom70	0.157	132	110	46	177	418	549	4.678E-02	104
DESULFOASV1_3493_hypothetical_protein	AF-Q9FMA3-F1-model_v4	DESULFOASV1_3493_hypothetical_protein	AF-Q9FMA3-F1-model_v4 Peroxisome biogenesis protein 5	0.126	119	91	59	177	572	676	1.073E-01	104
DESULFOASV1_3493_hypothetical_protein	AF-Q9VGU5-F1-model_v4	DESULFOASV1_3493_hypothetical_protein	AF-Q9VGU5-F1-model_v4 Tetratricopeptide repeat protein 14 homolog	0.174	136	103	43	178	302	427	5.687E-02	104
DESULFOASV1_3493_hypothetical_protein	AF-Q9M3M5-F1-model_v4	DESULFOASV1_3493_hypothetical_protein	AF-Q9M3M5-F1-model_v4 Photosystem I assembly protein Ycf3	0.149	134	96	38	151	27	160	1.927E-01	103
DESULFOASV1_3493_hypothetical_protein	AF-A6YG60-F1-model_v4	DESULFOASV1_3493_hypothetical_protein	AF-A6YG60-F1-model_v4 Photosystem I assembly protein Ycf3	0.146	116	84	39	137	31	146	3.816E-01	103
DESULFOASV1_3493_hypothetical_protein	AF-P12202-F1-model_v4	DESULFOASV1_3493_hypothetical_protein	AF-P12202-F1-model_v4 Photosystem I assembly protein Ycf3	0.158	161	130	1	155	1	161	7.622E-02	103
DESULFOASV1_3493_hypothetical_protein	AF-Q2PMU4-F1-model_v4	DESULFOASV1_3493_hypothetical_protein	AF-Q2PMU4-F1-model_v4 Photosystem I assembly protein Ycf3	0.152	131	93	41	151	33	163	1.835E-01	103
DESULFOASV1_3493_hypothetical_protein	AF-Q0G9W1-F1-model_v4	DESULFOASV1_3493_hypothetical_protein	AF-Q0G9W1-F1-model_v4 Photosystem I assembly protein Ycf3	0.127	146	117	3	137	1	146	1.022E-01	103
DESULFOASV1_3493_hypothetical_protein	AF-Q8AVU9-F1-model_v4	DESULFOASV1_3493_hypothetical_protein	AF-Q8AVU9-F1-model_v4 ER membrane protein complex subunit 2-B	0.104	143	124	44	182	122	264	1.748E-01	103
DESULFOASV1_3493_hypothetical_protein	AF-Q9CRD2-F1-model_v4	DESULFOASV1_3493_hypothetical_protein	AF-Q9CRD2-F1-model_v4 ER membrane protein complex subunit 2	0.173	132	106	46	174	90	221	1.022E-01	103
DESULFOASV1_3493_hypothetical_protein	AF-P16922-F1-model_v4	DESULFOASV1_3493_hypothetical_protein	AF-P16922-F1-model_v4 Transcriptional regulator RedD	0.131	152	111	43	171	184	335	8.003E-02	103
DESULFOASV1_3493_hypothetical_protein	AF-Q9C566-F1-model_v4	DESULFOASV1_3493_hypothetical_protein	AF-Q9C566-F1-model_v4 Peptidyl-prolyl cis-trans isomerase CYP40	0.161	154	124	39	187	208	361	1.369E-01	103
DESULFOASV1_3493_hypothetical_protein	AF-Q9XSH5-F1-model_v4	DESULFOASV1_3493_hypothetical_protein	AF-Q9XSH5-F1-model_v4 Peptidyl-prolyl cis-trans isomerase FKBP5	0.177	148	117	39	186	264	406	9.729E-02	103
DESULFOASV1_3493_hypothetical_protein	AF-Q9XSI2-F1-model_v4	DESULFOASV1_3493_hypothetical_protein	AF-Q9XSI2-F1-model_v4 Peptidyl-prolyl cis-trans isomerase FKBP5	0.177	148	117	39	186	264	406	9.729E-02	103
DESULFOASV1_3493_hypothetical_protein	AF-P38825-F1-model_v4	DESULFOASV1_3493_hypothetical_protein	AF-P38825-F1-model_v4 Protein TOM71	0.114	144	119	43	177	412	555	5.687E-02	103
DESULFOASV1_3493_hypothetical_protein	AF-P50542-F1-model_v4	DESULFOASV1_3493_hypothetical_protein	AF-P50542-F1-model_v4 Peroxisomal targeting signal 1 receptor	0.147	149	101	59	177	468	616	3.166E-02	103
DESULFOASV1_3493_hypothetical_protein	AF-P43112-F1-model_v4	DESULFOASV1_3493_hypothetical_protein	AF-P43112-F1-model_v4 Vi polysaccharide export protein VexE	0.155	148	106	46	171	287	434	4.912E-02	103
DESULFOASV1_3493_hypothetical_protein	AF-Q9CB03-F1-model_v4	DESULFOASV1_3493_hypothetical_protein	AF-Q9CB03-F1-model_v4 Protein NPGR1	0.104	134	117	43	174	551	684	2.124E-01	103
DESULFOASV1_3493_hypothetical_protein	AF-Q20255-F1-model_v4	DESULFOASV1_3493_hypothetical_protein	AF-Q20255-F1-model_v4 Tetratricopeptide repeat protein 21 homolog	0.185	134	107	43	176	737	868	8.824E-02	103
DESULFOASV1_3493_hypothetical_protein	AF-Q6F6B3-F1-model_v4	DESULFOASV1_3493_hypothetical_protein	AF-Q6F6B3-F1-model_v4 Protein TANC1	0.113	145	124	43	187	1279	1419	9.729E-02	103
DESULFOASV1_3493_hypothetical_protein	AF-Q85FT1-F1-model_v4	DESULFOASV1_3493_hypothetical_protein	AF-Q85FT1-F1-model_v4 Photosystem I assembly protein Ycf3	0.141	155	130	3	154	1	155	1.664E-01	102
DESULFOASV1_3493_hypothetical_protein	AF-P12204-F1-model_v4	DESULFOASV1_3493_hypothetical_protein	AF-P12204-F1-model_v4 Photosystem I assembly protein Ycf3	0.138	146	117	1	137	1	146	1.022E-01	102
DESULFOASV1_3493_hypothetical_protein	AF-A6MMC3-F1-model_v4	DESULFOASV1_3493_hypothetical_protein	AF-A6MMC3-F1-model_v4 Photosystem I assembly protein Ycf3	0.157	136	100	41	160	33	168	1.748E-01	102
DESULFOASV1_3493_hypothetical_protein	AF-Q8WI17-F1-model_v4	DESULFOASV1_3493_hypothetical_protein	AF-Q8WI17-F1-model_v4 Photosystem I assembly protein Ycf3	0.147	146	114	3	137	1	146	8.404E-02	102
DESULFOASV1_3493_hypothetical_protein	AF-P51191-F1-model_v4	DESULFOASV1_3493_hypothetical_protein	AF-P51191-F1-model_v4 Uncharacterized protein ycf37	0.141	157	122	15	157	17	173	1.369E-01	102
DESULFOASV1_3493_hypothetical_protein	AF-Q3V038-F1-model_v4	DESULFOASV1_3493_hypothetical_protein	AF-Q3V038-F1-model_v4 Tetratricopeptide repeat protein 9A	0.121	185	160	1	185	36	218	3.848E-02	102
DESULFOASV1_3493_hypothetical_protein	AF-D3ZQF4-F1-model_v4	DESULFOASV1_3493_hypothetical_protein	AF-D3ZQF4-F1-model_v4 Inactive peptidyl-prolyl cis-trans isomerase FKBP6	0.176	141	115	43	182	171	311	6.584E-02	102
DESULFOASV1_3493_hypothetical_protein	AF-P50503-F1-model_v4	DESULFOASV1_3493_hypothetical_protein	AF-P50503-F1-model_v4 Hsc70-interacting protein	0.136	149	122	38	186	108	249	1.242E-01	102
DESULFOASV1_3493_hypothetical_protein	AF-Q99L47-F1-model_v4	DESULFOASV1_3493_hypothetical_protein	AF-Q99L47-F1-model_v4 Hsc70-interacting protein	0.148	144	116	43	186	113	249	1.835E-01	102
DESULFOASV1_3493_hypothetical_protein	AF-P27124-F1-model_v4	DESULFOASV1_3493_hypothetical_protein	AF-P27124-F1-model_v4 Peptidyl-prolyl cis-trans isomerase FKBP4	0.159	148	119	39	186	266	408	1.022E-01	102
DESULFOASV1_3493_hypothetical_protein	AF-Q64282-F1-model_v4	DESULFOASV1_3493_hypothetical_protein	AF-Q64282-F1-model_v4 Interferon-induced protein with tetratricopeptide repeats 1	0.163	177	113	46	181	245	421	5.416E-02	102
DESULFOASV1_3493_hypothetical_protein	AF-O77775-F1-model_v4	DESULFOASV1_3493_hypothetical_protein	AF-O77775-F1-model_v4 Neutrophil cytosol factor 2	0.163	164	112	43	177	6	169	3.166E-02	102
DESULFOASV1_3493_hypothetical_protein	AF-Q6INC1-F1-model_v4	DESULFOASV1_3493_hypothetical_protein	AF-Q6INC1-F1-model_v4 Tetratricopeptide repeat protein 21B	0.165	138	109	46	177	723	860	8.404E-02	102
DESULFOASV1_3493_hypothetical_protein	AF-F4JV59-F1-model_v4	DESULFOASV1_3493_hypothetical_protein	AF-F4JV59-F1-model_v4 Calcineurin-binding protein 1	0.125	151	118	43	178	30	180	1.183E-01	102
DESULFOASV1_3493_hypothetical_protein	AF-Q09FW0-F1-model_v4	DESULFOASV1_3493_hypothetical_protein	AF-Q09FW0-F1-model_v4 Photosystem I assembly protein Ycf3	0.128	146	117	3	137	1	146	1.242E-01	101
DESULFOASV1_3493_hypothetical_protein	AF-Q09X16-F1-model_v4	DESULFOASV1_3493_hypothetical_protein	AF-Q09X16-F1-model_v4 Photosystem I assembly protein Ycf3	0.144	142	111	7	137	5	146	1.369E-01	101
DESULFOASV1_3493_hypothetical_protein	AF-Q70Y02-F1-model_v4	DESULFOASV1_3493_hypothetical_protein	AF-Q70Y02-F1-model_v4 Photosystem I assembly protein Ycf3	0.127	146	117	3	137	1	146	1.242E-01	101
DESULFOASV1_3493_hypothetical_protein	AF-Q06RC8-F1-model_v4	DESULFOASV1_3493_hypothetical_protein	AF-Q06RC8-F1-model_v4 Photosystem I assembly protein Ycf3	0.166	114	80	41	137	33	146	2.712E-01	101
DESULFOASV1_3493_hypothetical_protein	AF-Q7NMQ0-F1-model_v4	DESULFOASV1_3493_hypothetical_protein	AF-Q7NMQ0-F1-model_v4 Photosystem I assembly protein Ycf3	0.162	146	114	1	137	1	146	1.073E-01	101
DESULFOASV1_3493_hypothetical_protein	AF-A5GQJ6-F1-model_v4	DESULFOASV1_3493_hypothetical_protein	AF-A5GQJ6-F1-model_v4 Photosystem I assembly protein Ycf3	0.138	152	128	3	154	1	150	8.824E-02	101
DESULFOASV1_3493_hypothetical_protein	AF-O83463-F1-model_v4	DESULFOASV1_3493_hypothetical_protein	AF-O83463-F1-model_v4 Uncharacterized lipoprotein TP_0449	0.151	131	98	43	173	64	180	1.022E-01	101
DESULFOASV1_3493_hypothetical_protein	AF-O00170-F1-model_v4	DESULFOASV1_3493_hypothetical_protein	AF-O00170-F1-model_v4 AH receptor-interacting protein	0.138	148	126	39	186	175	321	1.126E-01	101
DESULFOASV1_3493_hypothetical_protein	AF-Q6FM42-F1-model_v4	DESULFOASV1_3493_hypothetical_protein	AF-Q6FM42-F1-model_v4 Peroxisomal targeting signal receptor	0.136	234	152	1	177	206	439	7.622E-02	101
DESULFOASV1_3493_hypothetical_protein	AF-O36033-F1-model_v4	DESULFOASV1_3493_hypothetical_protein	AF-O36033-F1-model_v4 TPR repeat-containing protein C19B12.01	0.170	128	93	43	155	521	648	1.304E-01	101
DESULFOASV1_3493_hypothetical_protein	AF-P33339-F1-model_v4	DESULFOASV1_3493_hypothetical_protein	AF-P33339-F1-model_v4 Transcription factor tau 131 kDa subunit	0.111	180	127	1	180	115	258	4.041E-02	101
DESULFOASV1_3493_hypothetical_protein	AF-Q2MII6-F1-model_v4	DESULFOASV1_3493_hypothetical_protein	AF-Q2MII6-F1-model_v4 Photosystem I assembly protein Ycf3	0.131	168	136	3	160	1	168	1.304E-01	100
DESULFOASV1_3493_hypothetical_protein	AF-A1E9S5-F1-model_v4	DESULFOASV1_3493_hypothetical_protein	AF-A1E9S5-F1-model_v4 Photosystem I assembly protein Ycf3	0.157	114	79	43	137	35	148	2.342E-01	100
DESULFOASV1_3493_hypothetical_protein	AF-Q5N149-F1-model_v4	DESULFOASV1_3493_hypothetical_protein	AF-Q5N149-F1-model_v4 Photosystem I assembly protein Ycf3	0.151	146	114	3	137	1	146	2.023E-01	100
DESULFOASV1_3493_hypothetical_protein	AF-O94826-F1-model_v4	DESULFOASV1_3493_hypothetical_protein	AF-O94826-F1-model_v4 Mitochondrial import receptor subunit TOM70	0.143	139	111	43	172	401	539	9.729E-02	100
DESULFOASV1_3493_hypothetical_protein	AF-Q9D4B2-F1-model_v4	DESULFOASV1_3493_hypothetical_protein	AF-Q9D4B2-F1-model_v4 Outer dynein arm-docking complex subunit 4	0.159	220	148	3	179	210	429	1.369E-01	100
DESULFOASV1_3493_hypothetical_protein	AF-Q8IYB4-F1-model_v4	DESULFOASV1_3493_hypothetical_protein	AF-Q8IYB4-F1-model_v4 PEX5-related protein	0.159	219	145	1	174	242	460	5.971E-02	100
DESULFOASV1_3493_hypothetical_protein	AF-Q8HXH0-F1-model_v4	DESULFOASV1_3493_hypothetical_protein	AF-Q8HXH0-F1-model_v4 LON peptidase N-terminal domain and RING finger protein 3	0.206	63	49	43	105	243	305	9.188E-01	100
DESULFOASV1_3493_hypothetical_protein	AF-Q8BGB2-F1-model_v4	DESULFOASV1_3493_hypothetical_protein	AF-Q8BGB2-F1-model_v4 Tetratricopeptide repeat protein 7A	0.150	174	139	1	174	671	835	8.404E-02	100
DESULFOASV1_3493_hypothetical_protein	AF-P25941-F1-model_v4	DESULFOASV1_3493_hypothetical_protein	AF-P25941-F1-model_v4 Regulatory protein AfsR	0.194	154	110	43	179	823	976	1.585E-01	100
DESULFOASV1_3493_hypothetical_protein	AF-Q0G9L8-F1-model_v4	DESULFOASV1_3493_hypothetical_protein	AF-Q0G9L8-F1-model_v4 Photosystem I assembly protein Ycf3	0.127	146	117	3	137	1	146	1.438E-01	99
DESULFOASV1_3493_hypothetical_protein	AF-Q8S8X3-F1-model_v4	DESULFOASV1_3493_hypothetical_protein	AF-Q8S8X3-F1-model_v4 Photosystem I assembly protein Ycf3	0.124	163	130	3	151	1	163	1.510E-01	99
DESULFOASV1_3493_hypothetical_protein	AF-A0A336-F1-model_v4	DESULFOASV1_3493_hypothetical_protein	AF-A0A336-F1-model_v4 Photosystem I assembly protein Ycf3	0.160	112	79	43	137	35	146	3.139E-01	99
DESULFOASV1_3493_hypothetical_protein	AF-A4IHU6-F1-model_v4	DESULFOASV1_3493_hypothetical_protein	AF-A4IHU6-F1-model_v4 Tetratricopeptide repeat protein 9C	0.113	162	127	43	186	15	176	8.003E-02	99
DESULFOASV1_3493_hypothetical_protein	AF-P25047-F1-model_v4	DESULFOASV1_3493_hypothetical_protein	AF-P25047-F1-model_v4 Regulatory protein DnrI	0.136	140	111	43	171	110	249	6.270E-02	99
DESULFOASV1_3493_hypothetical_protein	AF-P50502-F1-model_v4	DESULFOASV1_3493_hypothetical_protein	AF-P50502-F1-model_v4 Hsc70-interacting protein	0.155	144	112	43	186	114	246	2.342E-01	99
DESULFOASV1_3493_hypothetical_protein	AF-Q16JL4-F1-model_v4	DESULFOASV1_3493_hypothetical_protein	AF-Q16JL4-F1-model_v4 Tetratricopeptide repeat protein 30 homolog	0.174	126	98	46	171	13	132	2.990E-01	99
DESULFOASV1_3493_hypothetical_protein	AF-Q4QQS2-F1-model_v4	DESULFOASV1_3493_hypothetical_protein	AF-Q4QQS2-F1-model_v4 Tetratricopeptide repeat protein 30A2	0.179	122	99	46	167	14	134	1.927E-01	99
DESULFOASV1_3493_hypothetical_protein	AF-Q86WT1-F1-model_v4	DESULFOASV1_3493_hypothetical_protein	AF-Q86WT1-F1-model_v4 Tetratricopeptide repeat protein 30A	0.172	132	103	46	177	14	138	1.369E-01	99
DESULFOASV1_3493_hypothetical_protein	AF-O15550-F1-model_v4	DESULFOASV1_3493_hypothetical_protein	AF-O15550-F1-model_v4 Lysine-specific demethylase 6A	0.125	135	102	43	177	284	400	2.023E-01	99
DESULFOASV1_3493_hypothetical_protein	AF-P53804-F1-model_v4	DESULFOASV1_3493_hypothetical_protein	AF-P53804-F1-model_v4 E3 ubiquitin-protein ligase TTC3	0.120	148	114	39	186	227	356	2.583E-01	99
DESULFOASV1_3493_hypothetical_protein	AF-Q3ZJ63-F1-model_v4	DESULFOASV1_3493_hypothetical_protein	AF-Q3ZJ63-F1-model_v4 Photosystem I assembly protein Ycf3	0.154	132	97	39	154	31	162	4.007E-01	98
DESULFOASV1_3493_hypothetical_protein	AF-Q32RY5-F1-model_v4	DESULFOASV1_3493_hypothetical_protein	AF-Q32RY5-F1-model_v4 Photosystem I assembly protein Ycf3	0.134	169	134	3	158	1	169	1.438E-01	98
DESULFOASV1_3493_hypothetical_protein	AF-P44553-F1-model_v4	DESULFOASV1_3493_hypothetical_protein	AF-P44553-F1-model_v4 Outer membrane protein assembly factor BamD	0.127	150	121	43	182	31	180	5.416E-02	98
DESULFOASV1_3493_hypothetical_protein	AF-Q95QT8-F1-model_v4	DESULFOASV1_3493_hypothetical_protein	AF-Q95QT8-F1-model_v4 Intraflagellar transport protein 56 homolog	0.154	134	112	44	176	152	285	8.824E-02	98
DESULFOASV1_3493_hypothetical_protein	AF-Q54D58-F1-model_v4	DESULFOASV1_3493_hypothetical_protein	AF-Q54D58-F1-model_v4 Anaphase-promoting complex subunit 7	0.168	153	113	43	179	355	507	7.259E-02	98
DESULFOASV1_3493_hypothetical_protein	AF-Q99J38-F1-model_v4	DESULFOASV1_3493_hypothetical_protein	AF-Q99J38-F1-model_v4 Tetratricopeptide repeat protein 30A1	0.185	128	97	50	177	18	137	2.023E-01	98
DESULFOASV1_3493_hypothetical_protein	AF-Q14AT2-F1-model_v4	DESULFOASV1_3493_hypothetical_protein	AF-Q14AT2-F1-model_v4 Testis-expressed protein 11	0.124	139	117	43	177	403	541	1.073E-01	98
DESULFOASV1_3493_hypothetical_protein	AF-A8W3I8-F1-model_v4	DESULFOASV1_3493_hypothetical_protein	AF-A8W3I8-F1-model_v4 Photosystem I assembly protein Ycf3	0.127	168	137	3	160	1	168	2.124E-01	97
DESULFOASV1_3493_hypothetical_protein	AF-A1EA09-F1-model_v4	DESULFOASV1_3493_hypothetical_protein	AF-A1EA09-F1-model_v4 Photosystem I assembly protein Ycf3	0.144	146	116	1	137	1	146	1.369E-01	97
DESULFOASV1_3493_hypothetical_protein	AF-P27324-F1-model_v4	DESULFOASV1_3493_hypothetical_protein	AF-P27324-F1-model_v4 Photosystem I assembly protein Ycf3	0.126	163	129	3	151	1	163	1.438E-01	97
DESULFOASV1_3493_hypothetical_protein	AF-P12203-F1-model_v4	DESULFOASV1_3493_hypothetical_protein	AF-P12203-F1-model_v4 Photosystem I assembly protein Ycf3	0.132	146	118	1	137	1	146	1.510E-01	97
DESULFOASV1_3493_hypothetical_protein	AF-P0C516-F1-model_v4	DESULFOASV1_3493_hypothetical_protein	AF-P0C516-F1-model_v4 Photosystem I assembly protein Ycf3	0.128	146	117	3	137	1	146	1.748E-01	97
DESULFOASV1_3493_hypothetical_protein	AF-Q6ZM51-F1-model_v4	DESULFOASV1_3493_hypothetical_protein	AF-Q6ZM51-F1-model_v4 Protein adenylyltransferase FICD	0.155	116	86	43	158	96	198	1.183E-01	97
DESULFOASV1_3493_hypothetical_protein	AF-P43016-F1-model_v4	DESULFOASV1_3493_hypothetical_protein	AF-P43016-F1-model_v4 Transcriptional regulator HilA	0.151	119	99	43	160	372	490	4.418E-01	97
DESULFOASV1_3493_hypothetical_protein	AF-Q1ACM4-F1-model_v4	DESULFOASV1_3493_hypothetical_protein	AF-Q1ACM4-F1-model_v4 Photosystem I assembly protein Ycf3	0.137	116	85	39	137	31	146	4.208E-01	96
DESULFOASV1_3493_hypothetical_protein	AF-Q31KR8-F1-model_v4	DESULFOASV1_3493_hypothetical_protein	AF-Q31KR8-F1-model_v4 Photosystem I assembly protein Ycf3	0.142	140	103	39	159	31	170	3.296E-01	96
DESULFOASV1_3493_hypothetical_protein	AF-Q2JUT9-F1-model_v4	DESULFOASV1_3493_hypothetical_protein	AF-Q2JUT9-F1-model_v4 Photosystem I assembly protein Ycf3	0.166	120	96	39	154	32	151	1.664E-01	96
DESULFOASV1_3493_hypothetical_protein	AF-A6MVX9-F1-model_v4	DESULFOASV1_3493_hypothetical_protein	AF-A6MVX9-F1-model_v4 Photosystem I assembly protein Ycf3	0.139	171	135	3	160	1	171	2.342E-01	96
DESULFOASV1_3493_hypothetical_protein	AF-Q1XDU6-F1-model_v4	DESULFOASV1_3493_hypothetical_protein	AF-Q1XDU6-F1-model_v4 Uncharacterized protein ycf37	0.125	165	134	15	179	23	176	1.438E-01	96
DESULFOASV1_3493_hypothetical_protein	AF-Q5RF31-F1-model_v4	DESULFOASV1_3493_hypothetical_protein	AF-Q5RF31-F1-model_v4 Hsc70-interacting protein	0.128	144	119	43	186	114	250	2.124E-01	96
DESULFOASV1_3493_hypothetical_protein	AF-B2RYD6-F1-model_v4	DESULFOASV1_3493_hypothetical_protein	AF-B2RYD6-F1-model_v4 Tetratricopeptide repeat protein 30B	0.148	155	115	46	181	14	168	1.510E-01	96
DESULFOASV1_3493_hypothetical_protein	AF-P09798-F1-model_v4	DESULFOASV1_3493_hypothetical_protein	AF-P09798-F1-model_v4 Anaphase-promoting complex subunit CDC16	0.113	150	122	46	183	636	785	2.231E-01	96
DESULFOASV1_3493_hypothetical_protein	AF-Q9DBB4-F1-model_v4	DESULFOASV1_3493_hypothetical_protein	AF-Q9DBB4-F1-model_v4 N-alpha-acetyltransferase 16, NatA auxiliary subunit	0.156	135	111	42	174	9	143	1.664E-01	96
DESULFOASV1_3493_hypothetical_protein	AF-Q06SJ8-F1-model_v4	DESULFOASV1_3493_hypothetical_protein	AF-Q06SJ8-F1-model_v4 Photosystem I assembly protein Ycf3	0.127	146	117	3	137	1	146	2.460E-01	95
DESULFOASV1_3493_hypothetical_protein	AF-Q2VEH6-F1-model_v4	DESULFOASV1_3493_hypothetical_protein	AF-Q2VEH6-F1-model_v4 Photosystem I assembly protein Ycf3	0.141	146	115	3	137	1	146	1.748E-01	95
DESULFOASV1_3493_hypothetical_protein	AF-A1E9J2-F1-model_v4	DESULFOASV1_3493_hypothetical_protein	AF-A1E9J2-F1-model_v4 Photosystem I assembly protein Ycf3	0.144	146	116	1	137	1	146	1.664E-01	95
DESULFOASV1_3493_hypothetical_protein	AF-Q8K9W8-F1-model_v4	DESULFOASV1_3493_hypothetical_protein	AF-Q8K9W8-F1-model_v4 UPF0162 protein BUsg_167	0.195	82	64	77	157	181	262	5.371E-01	95
DESULFOASV1_3493_hypothetical_protein	AF-P47133-F1-model_v4	DESULFOASV1_3493_hypothetical_protein	AF-P47133-F1-model_v4 ER membrane protein complex subunit 2	0.126	147	114	43	174	127	273	1.585E-01	95
DESULFOASV1_3493_hypothetical_protein	AF-Q6TGY8-F1-model_v4	DESULFOASV1_3493_hypothetical_protein	AF-Q6TGY8-F1-model_v4 ER membrane protein complex subunit 2	0.140	137	115	43	177	155	291	2.023E-01	95
DESULFOASV1_3493_hypothetical_protein	AF-Q9BXJ9-F1-model_v4	DESULFOASV1_3493_hypothetical_protein	AF-Q9BXJ9-F1-model_v4 N-alpha-acetyltransferase 15, NatA auxiliary subunit	0.194	116	93	42	157	9	124	3.635E-01	95
DESULFOASV1_3493_hypothetical_protein	AF-A8ITV9-F1-model_v4	DESULFOASV1_3493_hypothetical_protein	AF-A8ITV9-F1-model_v4 Cilia- and flagella-associated protein 70	0.155	135	99	46	180	920	1037	2.847E-01	95
DESULFOASV1_3493_hypothetical_protein	AF-B0CA92-F1-model_v4	DESULFOASV1_3493_hypothetical_protein	AF-B0CA92-F1-model_v4 Photosystem I assembly protein Ycf3	0.155	153	127	7	159	1	151	1.126E-01	94
DESULFOASV1_3493_hypothetical_protein	AF-Q06FW6-F1-model_v4	DESULFOASV1_3493_hypothetical_protein	AF-Q06FW6-F1-model_v4 Photosystem I assembly protein Ycf3	0.129	144	115	5	137	3	146	2.124E-01	94
DESULFOASV1_3493_hypothetical_protein	AF-Q9MUT7-F1-model_v4	DESULFOASV1_3493_hypothetical_protein	AF-Q9MUT7-F1-model_v4 Photosystem I assembly protein Ycf3	0.129	146	118	1	137	1	146	3.296E-01	94
DESULFOASV1_3493_hypothetical_protein	AF-P32712-F1-model_v4	DESULFOASV1_3493_hypothetical_protein	AF-P32712-F1-model_v4 Formate-dependent nitrite reductase complex subunit NrfG	0.130	197	152	5	180	1	197	3.490E-02	94
DESULFOASV1_3493_hypothetical_protein	AF-Q95MP0-F1-model_v4	DESULFOASV1_3493_hypothetical_protein	AF-Q95MP0-F1-model_v4 Aryl-hydrocarbon-interacting protein-like 1	0.150	156	125	39	186	174	329	1.927E-01	94
DESULFOASV1_3493_hypothetical_protein	AF-Q4R5F5-F1-model_v4	DESULFOASV1_3493_hypothetical_protein	AF-Q4R5F5-F1-model_v4 Interferon-induced protein with tetratricopeptide repeats 1	0.142	130	93	46	154	254	383	4.639E-01	94
DESULFOASV1_3493_hypothetical_protein	AF-A2VE45-F1-model_v4	DESULFOASV1_3493_hypothetical_protein	AF-A2VE45-F1-model_v4 Tetratricopeptide repeat protein 30A	0.171	132	103	46	177	14	138	2.712E-01	94
DESULFOASV1_3493_hypothetical_protein	AF-A0JMU5-F1-model_v4	DESULFOASV1_3493_hypothetical_protein	AF-A0JMU5-F1-model_v4 Protein arginine N-methyltransferase 9	0.200	134	98	35	157	4	137	1.183E-01	94
DESULFOASV1_3493_hypothetical_protein	AF-Q91YR7-F1-model_v4	DESULFOASV1_3493_hypothetical_protein	AF-Q91YR7-F1-model_v4 Pre-mRNA-processing factor 6	0.127	118	98	43	155	675	792	4.208E-01	94
DESULFOASV1_3493_hypothetical_protein	AF-P0DJD0-F1-model_v4	DESULFOASV1_3493_hypothetical_protein	AF-P0DJD0-F1-model_v4 RANBP2-like and GRIP domain-containing protein 1	0.135	156	128	28	183	2	150	1.748E-01	94
DESULFOASV1_3493_hypothetical_protein	AF-Q6YXP2-F1-model_v4	DESULFOASV1_3493_hypothetical_protein	AF-Q6YXP2-F1-model_v4 Photosystem I assembly protein Ycf3	0.141	146	115	3	137	1	146	1.927E-01	93
DESULFOASV1_3493_hypothetical_protein	AF-B0BNG0-F1-model_v4	DESULFOASV1_3493_hypothetical_protein	AF-B0BNG0-F1-model_v4 ER membrane protein complex subunit 2	0.142	137	115	43	177	155	291	1.438E-01	93
DESULFOASV1_3493_hypothetical_protein	AF-Q86K48-F1-model_v4	DESULFOASV1_3493_hypothetical_protein	AF-Q86K48-F1-model_v4 ER membrane protein complex subunit 2	0.153	111	92	43	152	73	183	3.296E-01	93
DESULFOASV1_3493_hypothetical_protein	AF-Q64345-F1-model_v4	DESULFOASV1_3493_hypothetical_protein	AF-Q64345-F1-model_v4 Interferon-induced protein with tetratricopeptide repeats 3	0.157	119	99	60	177	114	232	6.270E-02	93
DESULFOASV1_3493_hypothetical_protein	AF-P44772-F1-model_v4	DESULFOASV1_3493_hypothetical_protein	AF-P44772-F1-model_v4 Protein HemY homolog	0.152	188	141	15	181	54	241	1.927E-01	93
DESULFOASV1_3493_hypothetical_protein	AF-Q9LYW9-F1-model_v4	DESULFOASV1_3493_hypothetical_protein	AF-Q9LYW9-F1-model_v4 DnaJ protein P58IPK homolog	0.147	190	153	7	186	7	196	6.913E-02	93
DESULFOASV1_3493_hypothetical_protein	AF-Q944A7-F1-model_v4	DESULFOASV1_3493_hypothetical_protein	AF-Q944A7-F1-model_v4 Serine/threonine-protein kinase BSK1	0.125	142	95	39	180	399	507	2.023E-01	93
DESULFOASV1_3493_hypothetical_protein	AF-Q8L718-F1-model_v4	DESULFOASV1_3493_hypothetical_protein	AF-Q8L718-F1-model_v4 ALBINO3-like protein 2, chloroplastic	0.117	177	126	43	186	346	522	1.242E-01	93
DESULFOASV1_3493_hypothetical_protein	AF-Q8RWG2-F1-model_v4	DESULFOASV1_3493_hypothetical_protein	AF-Q8RWG2-F1-model_v4 Protein high chlorophyll fluorescent 107	0.122	174	136	1	174	141	296	1.073E-01	93
DESULFOASV1_3493_hypothetical_protein	AF-Q8WVT3-F1-model_v4	DESULFOASV1_3493_hypothetical_protein	AF-Q8WVT3-F1-model_v4 Trafficking protein particle complex subunit 12	0.169	137	104	46	171	583	719	1.835E-01	93
DESULFOASV1_3493_hypothetical_protein	AF-Q8BWZ3-F1-model_v4	DESULFOASV1_3493_hypothetical_protein	AF-Q8BWZ3-F1-model_v4 N-alpha-acetyltransferase 25, NatB auxiliary subunit	0.201	132	105	44	175	12	143	8.824E-02	93
DESULFOASV1_3493_hypothetical_protein	AF-P52806-F1-model_v4	DESULFOASV1_3493_hypothetical_protein	AF-P52806-F1-model_v4 Photosystem I assembly protein Ycf3	0.163	116	93	43	154	35	150	2.342E-01	92
DESULFOASV1_3493_hypothetical_protein	AF-Q6ENW2-F1-model_v4	DESULFOASV1_3493_hypothetical_protein	AF-Q6ENW2-F1-model_v4 Photosystem I assembly protein Ycf3	0.128	146	118	2	137	1	146	2.231E-01	92
DESULFOASV1_3493_hypothetical_protein	AF-Q8DIQ6-F1-model_v4	DESULFOASV1_3493_hypothetical_protein	AF-Q8DIQ6-F1-model_v4 Photosystem I assembly protein Ycf3	0.164	154	125	1	154	1	150	7.622E-02	92
DESULFOASV1_3493_hypothetical_protein	AF-Q9I3M9-F1-model_v4	DESULFOASV1_3493_hypothetical_protein	AF-Q9I3M9-F1-model_v4 Cytochrome c-type biogenesis protein CycH	0.140	191	151	4	180	84	274	8.824E-02	92
DESULFOASV1_3493_hypothetical_protein	AF-Q9NES8-F1-model_v4	DESULFOASV1_3493_hypothetical_protein	AF-Q9NES8-F1-model_v4 Serine/threonine-protein phosphatase 5	0.110	145	112	39	183	25	151	4.007E-01	92
DESULFOASV1_3493_hypothetical_protein	AF-Q5PR66-F1-model_v4	DESULFOASV1_3493_hypothetical_protein	AF-Q5PR66-F1-model_v4 Intraflagellar transport protein 56	0.098	152	122	43	178	326	477	5.687E-02	92
DESULFOASV1_3493_hypothetical_protein	AF-A8MYJ7-F1-model_v4	DESULFOASV1_3493_hypothetical_protein	AF-A8MYJ7-F1-model_v4 Tetratricopeptide repeat protein 34	0.151	172	120	43	184	390	561	1.510E-01	92
DESULFOASV1_3493_hypothetical_protein	AF-P87312-F1-model_v4	DESULFOASV1_3493_hypothetical_protein	AF-P87312-F1-model_v4 Pre-mRNA-splicing factor cwf4	0.156	179	127	1	152	7	185	6.584E-02	92
DESULFOASV1_3493_hypothetical_protein	AF-Q8GZN1-F1-model_v4	DESULFOASV1_3493_hypothetical_protein	AF-Q8GZN1-F1-model_v4 Protein NPG1	0.076	130	115	50	174	562	691	2.847E-01	92
