query	target	qheader	theader	fident	alnlen	mismatch	qstart	qend	tstart	tend	evalue	bits
DESULFOASV1_2872_HDOD_domain-containing_protein	AF-O48963-F1-model_v4	DESULFOASV1_2872_HDOD_domain-containing_protein	AF-O48963-F1-model_v4 Phototropin-1	0.081	550	301	434	762	190	739	6.661E-03	70
DESULFOASV1_2872_HDOD_domain-containing_protein	AF-P46197-F1-model_v4	DESULFOASV1_2872_HDOD_domain-containing_protein	AF-P46197-F1-model_v4 Atrial natriuretic peptide receptor 2	0.205	141	107	662	796	820	960	1.830E-01	70
DESULFOASV1_2872_HDOD_domain-containing_protein	AF-P70106-F1-model_v4	DESULFOASV1_2872_HDOD_domain-containing_protein	AF-P70106-F1-model_v4 Heat-stable enterotoxin receptor	0.138	178	132	660	813	781	958	3.783E-01	70
DESULFOASV1_2872_HDOD_domain-containing_protein	AF-H2L002-F1-model_v4	DESULFOASV1_2872_HDOD_domain-containing_protein	AF-H2L002-F1-model_v4 Receptor-type guanylate cyclase gcy-7	0.113	177	134	662	813	851	1027	1.111E-01	70
DESULFOASV1_2872_HDOD_domain-containing_protein	AF-Q9VK50-F1-model_v4	DESULFOASV1_2872_HDOD_domain-containing_protein	AF-Q9VK50-F1-model_v4 Adenylyl cyclase X E	0.100	155	122	662	798	243	397	5.198E-01	70
DESULFOASV1_2872_HDOD_domain-containing_protein	AF-Q9VP76-F1-model_v4	DESULFOASV1_2872_HDOD_domain-containing_protein	AF-Q9VP76-F1-model_v4 Adenylyl cyclase 78C	0.124	154	119	662	798	524	677	2.882E-01	70
DESULFOASV1_2872_HDOD_domain-containing_protein	AF-C4R1K8-F1-model_v4	DESULFOASV1_2872_HDOD_domain-containing_protein	AF-C4R1K8-F1-model_v4 Transcription activator of gluconeogenesis ERT1	0.128	119	90	556	659	360	478	9.814E-01	69
DESULFOASV1_2872_HDOD_domain-containing_protein	AF-P9WLZ6-F1-model_v4	DESULFOASV1_2872_HDOD_domain-containing_protein	AF-P9WLZ6-F1-model_v4 Multidomain regulatory protein MT1410	0.120	395	302	430	824	15	358	6.971E-03	69
DESULFOASV1_2872_HDOD_domain-containing_protein	AF-P20594-F1-model_v4	DESULFOASV1_2872_HDOD_domain-containing_protein	AF-P20594-F1-model_v4 Atrial natriuretic peptide receptor 2	0.205	141	107	662	796	820	960	1.915E-01	69
DESULFOASV1_2872_HDOD_domain-containing_protein	AF-Q02846-F1-model_v4	DESULFOASV1_2872_HDOD_domain-containing_protein	AF-Q02846-F1-model_v4 Retinal guanylyl cyclase 1	0.126	147	120	662	799	834	980	3.959E-01	69
DESULFOASV1_2872_HDOD_domain-containing_protein	AF-P51842-F1-model_v4	DESULFOASV1_2872_HDOD_domain-containing_protein	AF-P51842-F1-model_v4 Retinal guanylyl cyclase 2	0.113	148	121	662	798	838	985	4.747E-01	69
DESULFOASV1_2872_HDOD_domain-containing_protein	AF-P91550-F1-model_v4	DESULFOASV1_2872_HDOD_domain-containing_protein	AF-P91550-F1-model_v4 Receptor-type guanylate cyclase gcy-15	0.129	178	132	662	813	848	1025	7.727E-02	69
DESULFOASV1_2872_HDOD_domain-containing_protein	AF-Q09435-F1-model_v4	DESULFOASV1_2872_HDOD_domain-containing_protein	AF-Q09435-F1-model_v4 Receptor-type guanylate cyclase gcy-1	0.128	186	133	662	814	845	1030	1.459E-01	69
DESULFOASV1_2872_HDOD_domain-containing_protein	AF-Q52915-F1-model_v4	DESULFOASV1_2872_HDOD_domain-containing_protein	AF-Q52915-F1-model_v4 Adenylate cyclase 2	0.114	169	126	687	829	130	298	8.962E-01	68
DESULFOASV1_2872_HDOD_domain-containing_protein	AF-Q9WXC3-F1-model_v4	DESULFOASV1_2872_HDOD_domain-containing_protein	AF-Q9WXC3-F1-model_v4 Adenylate cyclase	0.141	170	137	660	829	157	317	9.814E-01	68
DESULFOASV1_2872_HDOD_domain-containing_protein	AF-P26338-F1-model_v4	DESULFOASV1_2872_HDOD_domain-containing_protein	AF-P26338-F1-model_v4 Receptor-type adenylate cyclase	0.105	197	126	688	829	71	267	3.302E-01	68
DESULFOASV1_2872_HDOD_domain-containing_protein	AF-P9WQ28-F1-model_v4	DESULFOASV1_2872_HDOD_domain-containing_protein	AF-P9WQ28-F1-model_v4 Uncharacterized protein MT1362	0.122	173	137	660	816	317	489	3.155E-01	68
DESULFOASV1_2872_HDOD_domain-containing_protein	AF-Q23682-F1-model_v4	DESULFOASV1_2872_HDOD_domain-containing_protein	AF-Q23682-F1-model_v4 Receptor-type guanylate cyclase gcy-5	0.118	176	133	662	813	844	1019	1.216E-01	68
DESULFOASV1_2872_HDOD_domain-containing_protein	AF-P9WQ35-F1-model_v4	DESULFOASV1_2872_HDOD_domain-containing_protein	AF-P9WQ35-F1-model_v4 Adenylate cyclase	0.128	178	133	660	813	202	379	2.296E-01	67
DESULFOASV1_2872_HDOD_domain-containing_protein	AF-P0DMC6-F1-model_v4	DESULFOASV1_2872_HDOD_domain-containing_protein	AF-P0DMC6-F1-model_v4 Sensor histidine kinase RcsC	0.095	536	472	205	740	4	525	4.951E-05	67
DESULFOASV1_2872_HDOD_domain-containing_protein	AF-P55204-F1-model_v4	DESULFOASV1_2872_HDOD_domain-containing_protein	AF-P55204-F1-model_v4 Heat-stable enterotoxin receptor	0.155	146	115	660	796	778	923	7.143E-01	67
DESULFOASV1_2872_HDOD_domain-containing_protein	AF-Q10028-F1-model_v4	DESULFOASV1_2872_HDOD_domain-containing_protein	AF-Q10028-F1-model_v4 Receptor-type guanylate cyclase gcy-3	0.126	176	132	662	813	853	1028	2.403E-01	67
DESULFOASV1_2872_HDOD_domain-containing_protein	AF-Q18331-F1-model_v4	DESULFOASV1_2872_HDOD_domain-containing_protein	AF-Q18331-F1-model_v4 Receptor-type guanylate cyclase gcy-11	0.139	154	117	662	798	913	1066	3.959E-01	67
DESULFOASV1_2872_HDOD_domain-containing_protein	AF-Q99279-F1-model_v4	DESULFOASV1_2872_HDOD_domain-containing_protein	AF-Q99279-F1-model_v4 Receptor-type adenylate cyclase GRESAG 4.1	0.112	168	109	706	829	899	1066	3.959E-01	67
DESULFOASV1_2872_HDOD_domain-containing_protein	AF-P9WNT0-F1-model_v4	DESULFOASV1_2872_HDOD_domain-containing_protein	AF-P9WNT0-F1-model_v4 DNA polymerase IV 2	0.138	166	108	704	829	4	169	6.826E-01	66
DESULFOASV1_2872_HDOD_domain-containing_protein	AF-P27580-F1-model_v4	DESULFOASV1_2872_HDOD_domain-containing_protein	AF-P27580-F1-model_v4 Adenylate cyclase	0.147	169	136	661	829	197	357	8.564E-01	66
DESULFOASV1_2872_HDOD_domain-containing_protein	AF-C4YDV1-F1-model_v4	DESULFOASV1_2872_HDOD_domain-containing_protein	AF-C4YDV1-F1-model_v4 Glucose starvation modulator protein 1	0.098	142	124	404	542	423	564	1.125E+00	66
DESULFOASV1_2872_HDOD_domain-containing_protein	AF-Q03228-F1-model_v4	DESULFOASV1_2872_HDOD_domain-containing_protein	AF-Q03228-F1-model_v4 Histidine protein kinase DivJ	0.082	460	277	105	564	24	326	1.202E-02	66
DESULFOASV1_2872_HDOD_domain-containing_protein	AF-P45675-F1-model_v4	DESULFOASV1_2872_HDOD_domain-containing_protein	AF-P45675-F1-model_v4 Nitrogen regulation protein NtrY homolog	0.106	710	506	42	751	23	589	1.344E-04	66
DESULFOASV1_2872_HDOD_domain-containing_protein	AF-O54853-F1-model_v4	DESULFOASV1_2872_HDOD_domain-containing_protein	AF-O54853-F1-model_v4 Potassium voltage-gated channel subfamily H member 6	0.106	140	113	552	678	17	156	7.821E-01	66
DESULFOASV1_2872_HDOD_domain-containing_protein	AF-Q63472-F1-model_v4	DESULFOASV1_2872_HDOD_domain-containing_protein	AF-Q63472-F1-model_v4 Potassium voltage-gated channel subfamily H member 1	0.161	177	120	559	702	17	193	4.143E-01	66
DESULFOASV1_2872_HDOD_domain-containing_protein	AF-A5W4E3-F1-model_v4	DESULFOASV1_2872_HDOD_domain-containing_protein	AF-A5W4E3-F1-model_v4 Sensor histidine kinase TodS	0.086	652	543	191	785	153	804	8.257E-04	66
DESULFOASV1_2872_HDOD_domain-containing_protein	AF-E0X9C7-F1-model_v4	DESULFOASV1_2872_HDOD_domain-containing_protein	AF-E0X9C7-F1-model_v4 Sensor histidine kinase TodS	0.097	652	536	191	785	153	804	6.581E-04	66
DESULFOASV1_2872_HDOD_domain-containing_protein	AF-O02740-F1-model_v4	DESULFOASV1_2872_HDOD_domain-containing_protein	AF-O02740-F1-model_v4 Retinal guanylyl cyclase 2	0.125	147	122	660	799	838	984	5.692E-01	66
DESULFOASV1_2872_HDOD_domain-containing_protein	AF-Q23310-F1-model_v4	DESULFOASV1_2872_HDOD_domain-containing_protein	AF-Q23310-F1-model_v4 Receptor-type guanylate cyclase gcy-14	0.144	177	129	662	813	830	1006	2.195E-01	66
DESULFOASV1_2872_HDOD_domain-containing_protein	AF-Q7JQ32-F1-model_v4	DESULFOASV1_2872_HDOD_domain-containing_protein	AF-Q7JQ32-F1-model_v4 Receptor-type guanylate cyclase Gyc76C	0.169	143	113	662	798	855	997	5.692E-01	66
DESULFOASV1_2872_HDOD_domain-containing_protein	AF-P49606-F1-model_v4	DESULFOASV1_2872_HDOD_domain-containing_protein	AF-P49606-F1-model_v4 Adenylate cyclase	0.138	217	158	646	829	1988	2204	3.302E-01	66
DESULFOASV1_2872_HDOD_domain-containing_protein	AF-Q52977-F1-model_v4	DESULFOASV1_2872_HDOD_domain-containing_protein	AF-Q52977-F1-model_v4 Sensory histidine kinase/phosphatase NtrB	0.102	277	238	553	829	9	274	5.623E-02	65
DESULFOASV1_2872_HDOD_domain-containing_protein	AF-P59972-F1-model_v4	DESULFOASV1_2872_HDOD_domain-containing_protein	AF-P59972-F1-model_v4 Uncharacterized protein Mb1354c	0.150	170	128	664	815	319	488	5.957E-01	65
DESULFOASV1_2872_HDOD_domain-containing_protein	AF-P92006-F1-model_v4	DESULFOASV1_2872_HDOD_domain-containing_protein	AF-P92006-F1-model_v4 Soluble guanylate cyclase gcy-34	0.086	589	504	211	799	4	555	4.180E-04	65
DESULFOASV1_2872_HDOD_domain-containing_protein	AF-P21865-F1-model_v4	DESULFOASV1_2872_HDOD_domain-containing_protein	AF-P21865-F1-model_v4 Sensor protein KdpD	0.123	552	432	105	656	385	878	1.187E-03	65
DESULFOASV1_2872_HDOD_domain-containing_protein	AF-B1Q257-F1-model_v4	DESULFOASV1_2872_HDOD_domain-containing_protein	AF-B1Q257-F1-model_v4 Receptor-type guanylate cyclase gcy-10	0.134	177	131	662	813	814	990	2.097E-01	65
DESULFOASV1_2872_HDOD_domain-containing_protein	AF-O16544-F1-model_v4	DESULFOASV1_2872_HDOD_domain-containing_protein	AF-O16544-F1-model_v4 Receptor-type guanylate cyclase gcy-19	0.122	179	134	660	813	860	1038	1.915E-01	65
DESULFOASV1_2872_HDOD_domain-containing_protein	AF-Q975M4-F1-model_v4	DESULFOASV1_2872_HDOD_domain-containing_protein	AF-Q975M4-F1-model_v4 GTP cyclohydrolase III	0.138	190	150	642	831	48	222	4.143E-01	64
DESULFOASV1_2872_HDOD_domain-containing_protein	AF-P63988-F1-model_v4	DESULFOASV1_2872_HDOD_domain-containing_protein	AF-P63988-F1-model_v4 DNA polymerase IV 2	0.138	166	108	704	829	4	169	8.564E-01	64
DESULFOASV1_2872_HDOD_domain-containing_protein	AF-Q8NCM2-F1-model_v4	DESULFOASV1_2872_HDOD_domain-containing_protein	AF-Q8NCM2-F1-model_v4 Potassium voltage-gated channel subfamily H member 5	0.125	144	100	559	673	16	159	1.125E+00	64
DESULFOASV1_2872_HDOD_domain-containing_protein	AF-A0A078BQP2-F1-model_v4	DESULFOASV1_2872_HDOD_domain-containing_protein	AF-A0A078BQP2-F1-model_v4 Receptor-type guanylate cyclase gcy-25	0.091	190	154	660	829	772	961	4.968E-01	64
DESULFOASV1_2872_HDOD_domain-containing_protein	AF-P55202-F1-model_v4	DESULFOASV1_2872_HDOD_domain-containing_protein	AF-P55202-F1-model_v4 Atrial natriuretic peptide receptor 2	0.161	141	112	662	796	824	964	2.631E-01	64
DESULFOASV1_2872_HDOD_domain-containing_protein	AF-Q25263-F1-model_v4	DESULFOASV1_2872_HDOD_domain-containing_protein	AF-Q25263-F1-model_v4 Receptor-type adenylate cyclase B	0.135	160	95	705	815	937	1096	3.155E-01	64
DESULFOASV1_2872_HDOD_domain-containing_protein	AF-C3NGF2-F1-model_v4	DESULFOASV1_2872_HDOD_domain-containing_protein	AF-C3NGF2-F1-model_v4 GTP cyclohydrolase III	0.131	190	157	640	829	46	227	2.631E-01	63
DESULFOASV1_2872_HDOD_domain-containing_protein	AF-P9WNT1-F1-model_v4	DESULFOASV1_2872_HDOD_domain-containing_protein	AF-P9WNT1-F1-model_v4 DNA polymerase IV 2	0.138	166	108	704	829	4	169	9.378E-01	63
DESULFOASV1_2872_HDOD_domain-containing_protein	AF-Q9C9W9-F1-model_v4	DESULFOASV1_2872_HDOD_domain-containing_protein	AF-Q9C9W9-F1-model_v4 Adagio protein 3	0.111	114	92	438	541	51	164	1.289E+00	63
DESULFOASV1_2872_HDOD_domain-containing_protein	AF-Q4PD88-F1-model_v4	DESULFOASV1_2872_HDOD_domain-containing_protein	AF-Q4PD88-F1-model_v4 Transcription activator of gluconeogenesis ERT1	0.082	296	221	364	659	477	718	6.158E-02	63
DESULFOASV1_2872_HDOD_domain-containing_protein	AF-E7EAU8-F1-model_v4	DESULFOASV1_2872_HDOD_domain-containing_protein	AF-E7EAU8-F1-model_v4 Receptor-type guanylate cyclase gcy-9	0.125	179	148	660	829	860	1038	5.198E-01	63
DESULFOASV1_2872_HDOD_domain-containing_protein	AF-Q86GV3-F1-model_v4	DESULFOASV1_2872_HDOD_domain-containing_protein	AF-Q86GV3-F1-model_v4 Receptor-type guanylate cyclase gcy-28	0.138	143	118	661	798	1044	1186	7.821E-01	63
DESULFOASV1_2872_HDOD_domain-containing_protein	AF-C3MX03-F1-model_v4	DESULFOASV1_2872_HDOD_domain-containing_protein	AF-C3MX03-F1-model_v4 GTP cyclohydrolase III	0.133	190	157	640	829	46	227	3.015E-01	62
DESULFOASV1_2872_HDOD_domain-containing_protein	AF-P9WQ32-F1-model_v4	DESULFOASV1_2872_HDOD_domain-containing_protein	AF-P9WQ32-F1-model_v4 Uncharacterized protein MT1359	0.154	170	132	660	816	320	489	6.523E-01	62
DESULFOASV1_2872_HDOD_domain-containing_protein	AF-Q6C764-F1-model_v4	DESULFOASV1_2872_HDOD_domain-containing_protein	AF-Q6C764-F1-model_v4 Transcription activator of gluconeogenesis ERT1-2	0.114	148	121	405	542	409	556	1.348E+00	62
DESULFOASV1_2872_HDOD_domain-containing_protein	AF-Q5SDA5-F1-model_v4	DESULFOASV1_2872_HDOD_domain-containing_protein	AF-Q5SDA5-F1-model_v4 Retinal guanylyl cyclase 2	0.117	147	121	662	799	838	984	2.754E-01	62
DESULFOASV1_2872_HDOD_domain-containing_protein	AF-Q99396-F1-model_v4	DESULFOASV1_2872_HDOD_domain-containing_protein	AF-Q99396-F1-model_v4 Receptor-type adenylate cyclase GRESAG 4.2	0.123	196	124	688	829	239	434	5.198E-01	61
DESULFOASV1_2872_HDOD_domain-containing_protein	AF-O18965-F1-model_v4	DESULFOASV1_2872_HDOD_domain-containing_protein	AF-O18965-F1-model_v4 Potassium voltage-gated channel subfamily H member 1	0.161	177	120	559	702	17	193	7.143E-01	61
DESULFOASV1_2872_HDOD_domain-containing_protein	AF-O95259-F1-model_v4	DESULFOASV1_2872_HDOD_domain-containing_protein	AF-O95259-F1-model_v4 Potassium voltage-gated channel subfamily H member 1	0.140	176	123	559	702	18	193	6.826E-01	61
DESULFOASV1_2872_HDOD_domain-containing_protein	AF-P51840-F1-model_v4	DESULFOASV1_2872_HDOD_domain-containing_protein	AF-P51840-F1-model_v4 Retinal guanylyl cyclase 1	0.126	147	120	662	799	837	983	8.564E-01	61
DESULFOASV1_2872_HDOD_domain-containing_protein	AF-Q03100-F1-model_v4	DESULFOASV1_2872_HDOD_domain-containing_protein	AF-Q03100-F1-model_v4 Adenylate cyclase, aggregation specific	0.142	185	145	660	829	1137	1321	9.378E-01	61
DESULFOASV1_2872_HDOD_domain-containing_protein	AF-P27896-F1-model_v4	DESULFOASV1_2872_HDOD_domain-containing_protein	AF-P27896-F1-model_v4 Nitrate/nitrite sensor protein NarQ	0.113	555	421	76	551	11	565	3.079E-03	60
DESULFOASV1_2872_HDOD_domain-containing_protein	AF-Q94BT6-F1-model_v4	DESULFOASV1_2872_HDOD_domain-containing_protein	AF-Q94BT6-F1-model_v4 Adagio protein 1	0.076	114	85	566	658	42	155	1.939E+00	60
DESULFOASV1_2872_HDOD_domain-containing_protein	AF-Q4ZHS0-F1-model_v4	DESULFOASV1_2872_HDOD_domain-containing_protein	AF-Q4ZHS0-F1-model_v4 Guanylate cyclase soluble subunit alpha-1	0.102	693	466	106	798	60	579	4.789E-04	60
DESULFOASV1_2872_HDOD_domain-containing_protein	AF-O54735-F1-model_v4	DESULFOASV1_2872_HDOD_domain-containing_protein	AF-O54735-F1-model_v4 cGMP-specific 3',5'-cyclic phosphodiesterase	0.106	379	232	304	564	107	485	1.459E-01	60
DESULFOASV1_2872_HDOD_domain-containing_protein	AF-Q87GU5-F1-model_v4	DESULFOASV1_2872_HDOD_domain-containing_protein	AF-Q87GU5-F1-model_v4 Autoinducer 2 sensor kinase/phosphatase LuxQ	0.096	553	465	191	743	19	533	2.317E-04	60
DESULFOASV1_2872_HDOD_domain-containing_protein	AF-Q9XTY1-F1-model_v4	DESULFOASV1_2872_HDOD_domain-containing_protein	AF-Q9XTY1-F1-model_v4 Receptor-type guanylate cyclase gcy-22	0.155	174	128	662	813	825	998	3.015E-01	60
DESULFOASV1_2872_HDOD_domain-containing_protein	AF-P25092-F1-model_v4	DESULFOASV1_2872_HDOD_domain-containing_protein	AF-P25092-F1-model_v4 Heat-stable enterotoxin receptor	0.148	148	118	660	798	778	925	7.143E-01	60
DESULFOASV1_2872_HDOD_domain-containing_protein	AF-P52785-F1-model_v4	DESULFOASV1_2872_HDOD_domain-containing_protein	AF-P52785-F1-model_v4 Retinal guanylyl cyclase 1	0.132	147	119	662	799	837	983	8.564E-01	60
DESULFOASV1_2872_HDOD_domain-containing_protein	AF-B4K9L4-F1-model_v4	DESULFOASV1_2872_HDOD_domain-containing_protein	AF-B4K9L4-F1-model_v4 cGMP-specific 3',5'-cyclic phosphodiesterase	0.105	477	287	243	564	159	635	4.283E-02	60
DESULFOASV1_2872_HDOD_domain-containing_protein	AF-Q9SXL4-F1-model_v4	DESULFOASV1_2872_HDOD_domain-containing_protein	AF-Q9SXL4-F1-model_v4 Histidine kinase 1	0.102	476	356	268	743	104	500	1.559E-03	60
DESULFOASV1_2872_HDOD_domain-containing_protein	AF-C3N783-F1-model_v4	DESULFOASV1_2872_HDOD_domain-containing_protein	AF-C3N783-F1-model_v4 GTP cyclohydrolase III	0.122	190	159	640	829	46	227	4.143E-01	59
DESULFOASV1_2872_HDOD_domain-containing_protein	AF-P63528-F1-model_v4	DESULFOASV1_2872_HDOD_domain-containing_protein	AF-P63528-F1-model_v4 Uncharacterized protein Mb1352c	0.154	170	132	660	816	320	489	8.962E-01	59
DESULFOASV1_2872_HDOD_domain-containing_protein	AF-Q59WB9-F1-model_v4	DESULFOASV1_2872_HDOD_domain-containing_protein	AF-Q59WB9-F1-model_v4 Glucose starvation modulator protein 1	0.093	142	125	404	542	423	564	2.325E+00	59
DESULFOASV1_2872_HDOD_domain-containing_protein	AF-P44604-F1-model_v4	DESULFOASV1_2872_HDOD_domain-containing_protein	AF-P44604-F1-model_v4 Sensor protein NarQ homolog	0.096	543	408	88	539	19	561	6.366E-03	59
DESULFOASV1_2872_HDOD_domain-containing_protein	AF-Q920E3-F1-model_v4	DESULFOASV1_2872_HDOD_domain-containing_protein	AF-Q920E3-F1-model_v4 Potassium voltage-gated channel subfamily H member 5	0.154	172	119	559	700	15	186	8.184E-01	59
DESULFOASV1_2872_HDOD_domain-containing_protein	AF-P23897-F1-model_v4	DESULFOASV1_2872_HDOD_domain-containing_protein	AF-P23897-F1-model_v4 Heat-stable enterotoxin receptor	0.142	147	119	660	799	777	923	4.335E-01	59
DESULFOASV1_2872_HDOD_domain-containing_protein	AF-Q9VJ79-F1-model_v4	DESULFOASV1_2872_HDOD_domain-containing_protein	AF-Q9VJ79-F1-model_v4 Dual 3',5'-cyclic-AMP and -GMP phosphodiesterase 11	0.126	372	225	307	564	407	778	1.332E-01	59
DESULFOASV1_2872_HDOD_domain-containing_protein	AF-P41503-F1-model_v4	DESULFOASV1_2872_HDOD_domain-containing_protein	AF-P41503-F1-model_v4 Sensory histidine kinase/phosphatase NtrB	0.121	277	232	553	829	10	274	7.056E-02	58
DESULFOASV1_2872_HDOD_domain-containing_protein	AF-P9WQ33-F1-model_v4	DESULFOASV1_2872_HDOD_domain-containing_protein	AF-P9WQ33-F1-model_v4 Uncharacterized protein Rv1318c	0.154	170	132	660	816	320	489	9.814E-01	58
DESULFOASV1_2872_HDOD_domain-containing_protein	AF-P16065-F1-model_v4	DESULFOASV1_2872_HDOD_domain-containing_protein	AF-P16065-F1-model_v4 Speract receptor	0.147	147	116	662	798	869	1015	5.957E-01	58
DESULFOASV1_2872_HDOD_domain-containing_protein	AF-Q99280-F1-model_v4	DESULFOASV1_2872_HDOD_domain-containing_protein	AF-Q99280-F1-model_v4 Receptor-type adenylate cyclase GRESAG 4.3	0.130	193	112	686	815	853	1045	4.143E-01	58
DESULFOASV1_2872_HDOD_domain-containing_protein	AF-C3MR15-F1-model_v4	DESULFOASV1_2872_HDOD_domain-containing_protein	AF-C3MR15-F1-model_v4 GTP cyclohydrolase III	0.122	190	159	640	829	46	227	4.968E-01	57
DESULFOASV1_2872_HDOD_domain-containing_protein	AF-P40135-F1-model_v4	DESULFOASV1_2872_HDOD_domain-containing_protein	AF-P40135-F1-model_v4 Adenylate cyclase	0.151	153	127	660	812	150	299	1.289E+00	57
DESULFOASV1_2872_HDOD_domain-containing_protein	AF-P40137-F1-model_v4	DESULFOASV1_2872_HDOD_domain-containing_protein	AF-P40137-F1-model_v4 Adenylate cyclase 1	0.112	192	148	662	829	184	375	7.821E-01	57
DESULFOASV1_2872_HDOD_domain-containing_protein	AF-B9W8A8-F1-model_v4	DESULFOASV1_2872_HDOD_domain-containing_protein	AF-B9W8A8-F1-model_v4 Glucose starvation modulator protein 1	0.094	141	124	405	542	423	563	2.664E+00	57
DESULFOASV1_2872_HDOD_domain-containing_protein	AF-Q60603-F1-model_v4	DESULFOASV1_2872_HDOD_domain-containing_protein	AF-Q60603-F1-model_v4 Potassium voltage-gated channel subfamily H member 1	0.138	176	126	556	702	18	193	8.962E-01	57
DESULFOASV1_2872_HDOD_domain-containing_protein	AF-Q6VVW5-F1-model_v4	DESULFOASV1_2872_HDOD_domain-containing_protein	AF-Q6VVW5-F1-model_v4 Atrial natriuretic peptide receptor 2	0.186	141	109	662	796	820	960	5.198E-01	57
DESULFOASV1_2872_HDOD_domain-containing_protein	AF-B4JXX2-F1-model_v4	DESULFOASV1_2872_HDOD_domain-containing_protein	AF-B4JXX2-F1-model_v4 cGMP-specific 3',5'-cyclic phosphodiesterase	0.103	476	408	288	743	165	640	1.258E-02	57
DESULFOASV1_2872_HDOD_domain-containing_protein	AF-Q9VFI9-F1-model_v4	DESULFOASV1_2872_HDOD_domain-containing_protein	AF-Q9VFI9-F1-model_v4 cGMP-specific 3',5'-cyclic phosphodiesterase	0.101	476	409	288	743	213	688	2.072E-02	57
DESULFOASV1_2872_HDOD_domain-containing_protein	AF-P72699-F1-model_v4	DESULFOASV1_2872_HDOD_domain-containing_protein	AF-P72699-F1-model_v4 UPF0045 protein sll0230	0.083	131	105	690	820	6	120	9.814E-01	56
DESULFOASV1_2872_HDOD_domain-containing_protein	AF-C3MZ63-F1-model_v4	DESULFOASV1_2872_HDOD_domain-containing_protein	AF-C3MZ63-F1-model_v4 GTP cyclohydrolase III	0.129	190	158	640	829	46	227	5.440E-01	56
DESULFOASV1_2872_HDOD_domain-containing_protein	AF-C4KIE1-F1-model_v4	DESULFOASV1_2872_HDOD_domain-containing_protein	AF-C4KIE1-F1-model_v4 GTP cyclohydrolase III	0.131	190	157	640	829	46	227	5.440E-01	56
DESULFOASV1_2872_HDOD_domain-containing_protein	AF-Q6CK33-F1-model_v4	DESULFOASV1_2872_HDOD_domain-containing_protein	AF-Q6CK33-F1-model_v4 Glucose starvation modulator protein 1	0.162	144	94	547	659	431	574	1.770E+00	56
DESULFOASV1_2872_HDOD_domain-containing_protein	AF-Q67UX0-F1-model_v4	DESULFOASV1_2872_HDOD_domain-containing_protein	AF-Q67UX0-F1-model_v4 Putative adagio-like protein 2	0.081	117	89	560	657	47	163	2.546E+00	56
DESULFOASV1_2872_HDOD_domain-containing_protein	AF-B4HEM4-F1-model_v4	DESULFOASV1_2872_HDOD_domain-containing_protein	AF-B4HEM4-F1-model_v4 cGMP-specific 3',5'-cyclic phosphodiesterase	0.106	525	447	243	743	176	700	1.202E-02	56
DESULFOASV1_2872_HDOD_domain-containing_protein	AF-P27664-F1-model_v4	DESULFOASV1_2872_HDOD_domain-containing_protein	AF-P27664-F1-model_v4 Rod cGMP-specific 3',5'-cyclic phosphodiesterase subunit alpha	0.075	452	280	262	565	4	455	2.754E-01	55
DESULFOASV1_2872_HDOD_domain-containing_protein	AF-Q3UWA6-F1-model_v4	DESULFOASV1_2872_HDOD_domain-containing_protein	AF-Q3UWA6-F1-model_v4 Heat-stable enterotoxin receptor	0.149	146	116	660	796	777	922	8.962E-01	55
DESULFOASV1_2872_HDOD_domain-containing_protein	AF-Q96L42-F1-model_v4	DESULFOASV1_2872_HDOD_domain-containing_protein	AF-Q96L42-F1-model_v4 Potassium voltage-gated channel subfamily H member 8	0.110	297	204	558	787	16	312	1.273E-01	55
DESULFOASV1_2872_HDOD_domain-containing_protein	AF-Q553Y7-F1-model_v4	DESULFOASV1_2872_HDOD_domain-containing_protein	AF-Q553Y7-F1-model_v4 Guanylyl cyclase, membrane	0.120	185	134	661	813	1113	1297	9.814E-01	55
DESULFOASV1_2872_HDOD_domain-containing_protein	AF-P42950-F1-model_v4	DESULFOASV1_2872_HDOD_domain-containing_protein	AF-P42950-F1-model_v4 Glucose starvation modulator protein 1	0.112	149	94	553	659	465	613	2.433E+00	54
DESULFOASV1_2872_HDOD_domain-containing_protein	AF-A6ZQM3-F1-model_v4	DESULFOASV1_2872_HDOD_domain-containing_protein	AF-A6ZQM3-F1-model_v4 Glucose starvation modulator protein 1	0.104	149	95	553	659	465	613	2.221E+00	54
DESULFOASV1_2872_HDOD_domain-containing_protein	AF-N1NVB7-F1-model_v4	DESULFOASV1_2872_HDOD_domain-containing_protein	AF-N1NVB7-F1-model_v4 Receptor-type guanylate cyclase gcy-6	0.119	177	133	662	813	849	1025	5.957E-01	54
DESULFOASV1_2872_HDOD_domain-containing_protein	AF-Q01513-F1-model_v4	DESULFOASV1_2872_HDOD_domain-containing_protein	AF-Q01513-F1-model_v4 Adenylate cyclase	0.096	465	288	498	817	1447	1911	1.377E-02	54
DESULFOASV1_2872_HDOD_domain-containing_protein	AF-Q57627-F1-model_v4	DESULFOASV1_2872_HDOD_domain-containing_protein	AF-Q57627-F1-model_v4 Uncharacterized protein MJ0163	0.104	135	99	433	567	69	179	5.198E-01	53
DESULFOASV1_2872_HDOD_domain-containing_protein	AF-P84740-F1-model_v4	DESULFOASV1_2872_HDOD_domain-containing_protein	AF-P84740-F1-model_v4 Photoactivated adenylate cyclase subunit beta-like protein 1224-5/9F	0.103	247	164	638	821	505	751	4.537E-01	53
DESULFOASV1_2872_HDOD_domain-containing_protein	AF-P84743-F1-model_v4	DESULFOASV1_2872_HDOD_domain-containing_protein	AF-P84743-F1-model_v4 Photoactivated adenylate cyclase subunit beta-like protein ST-	0.090	254	172	640	829	92	345	1.231E+00	53
DESULFOASV1_2872_HDOD_domain-containing_protein	AF-Q9UQ05-F1-model_v4	DESULFOASV1_2872_HDOD_domain-containing_protein	AF-Q9UQ05-F1-model_v4 Potassium voltage-gated channel subfamily H member 4	0.121	303	201	558	787	16	318	1.749E-01	53
DESULFOASV1_2872_HDOD_domain-containing_protein	AF-P55205-F1-model_v4	DESULFOASV1_2872_HDOD_domain-containing_protein	AF-P55205-F1-model_v4 Guanylate cyclase 2G	0.128	143	119	662	798	860	1002	8.564E-01	53
DESULFOASV1_2872_HDOD_domain-containing_protein	AF-P51839-F1-model_v4	DESULFOASV1_2872_HDOD_domain-containing_protein	AF-P51839-F1-model_v4 Guanylate cyclase 2D	0.145	148	118	660	798	847	994	1.231E+00	53
DESULFOASV1_2872_HDOD_domain-containing_protein	AF-Q8X739-F1-model_v4	DESULFOASV1_2872_HDOD_domain-containing_protein	AF-Q8X739-F1-model_v4 Sensor protein PhoQ	0.142	129	108	434	560	77	205	8.184E-01	52
DESULFOASV1_2872_HDOD_domain-containing_protein	AF-Q83RR1-F1-model_v4	DESULFOASV1_2872_HDOD_domain-containing_protein	AF-Q83RR1-F1-model_v4 Virulence sensor protein PhoQ	0.155	129	106	434	560	77	205	5.957E-01	52
DESULFOASV1_2872_HDOD_domain-containing_protein	AF-A1DG01-F1-model_v4	DESULFOASV1_2872_HDOD_domain-containing_protein	AF-A1DG01-F1-model_v4 Transcription activator of gluconeogenesis acuK	0.081	233	127	404	542	448	680	9.378E-01	52
DESULFOASV1_2872_HDOD_domain-containing_protein	AF-Q8S9F2-F1-model_v4	DESULFOASV1_2872_HDOD_domain-containing_protein	AF-Q8S9F2-F1-model_v4 Photoactivated adenylate cyclase subunit alpha	0.103	145	111	705	829	612	756	3.497E+00	52
DESULFOASV1_2872_HDOD_domain-containing_protein	AF-Q6TL19-F1-model_v4	DESULFOASV1_2872_HDOD_domain-containing_protein	AF-Q6TL19-F1-model_v4 Guanylate cyclase 2G	0.122	147	119	662	798	856	1002	9.814E-01	52
DESULFOASV1_2872_HDOD_domain-containing_protein	AF-P51841-F1-model_v4	DESULFOASV1_2872_HDOD_domain-containing_protein	AF-P51841-F1-model_v4 Retinal guanylyl cyclase 2	0.132	147	119	662	799	838	984	1.770E+00	52
