query	target	qheader	theader	fident	alnlen	mismatch	qstart	qend	tstart	tend	evalue	bits
DESULFOASV1_0444_DUF167_domain-containing_protein	AF-Q5X4I6-F1-model_v4	DESULFOASV1_0444_DUF167_domain-containing_protein	AF-Q5X4I6-F1-model_v4 Cell division topological specificity factor	0.108	89	67	8	96	14	89	8.953E-01	30
DESULFOASV1_0444_DUF167_domain-containing_protein	AF-B6IX35-F1-model_v4	DESULFOASV1_0444_DUF167_domain-containing_protein	AF-B6IX35-F1-model_v4 Cell division topological specificity factor	0.126	77	54	10	86	17	79	1.245E+00	30
DESULFOASV1_0444_DUF167_domain-containing_protein	AF-Q54519-F1-model_v4	DESULFOASV1_0444_DUF167_domain-containing_protein	AF-Q54519-F1-model_v4 Capsular polysaccharide biosynthesis protein CpsC	0.153	92	69	6	88	39	130	3.554E-01	30
DESULFOASV1_0444_DUF167_domain-containing_protein	AF-B7J3B2-F1-model_v4	DESULFOASV1_0444_DUF167_domain-containing_protein	AF-B7J3B2-F1-model_v4 Cell division topological specificity factor	0.111	79	56	8	86	15	78	1.621E+00	29
DESULFOASV1_0444_DUF167_domain-containing_protein	AF-Q0KFI5-F1-model_v4	DESULFOASV1_0444_DUF167_domain-containing_protein	AF-Q0KFI5-F1-model_v4 Cell division topological specificity factor	0.113	85	63	2	86	9	80	1.166E+00	29
DESULFOASV1_0444_DUF167_domain-containing_protein	AF-A3NCA9-F1-model_v4	DESULFOASV1_0444_DUF167_domain-containing_protein	AF-A3NCA9-F1-model_v4 Cell division topological specificity factor	0.114	85	63	2	86	9	80	1.245E+00	29
DESULFOASV1_0444_DUF167_domain-containing_protein	AF-Q0BHG9-F1-model_v4	DESULFOASV1_0444_DUF167_domain-containing_protein	AF-Q0BHG9-F1-model_v4 Cell division topological specificity factor	0.114	85	63	2	86	9	80	1.245E+00	29
DESULFOASV1_0444_DUF167_domain-containing_protein	AF-Q63RS6-F1-model_v4	DESULFOASV1_0444_DUF167_domain-containing_protein	AF-Q63RS6-F1-model_v4 Cell division topological specificity factor	0.114	85	63	2	86	9	80	1.166E+00	29
DESULFOASV1_0444_DUF167_domain-containing_protein	AF-B2UGZ9-F1-model_v4	DESULFOASV1_0444_DUF167_domain-containing_protein	AF-B2UGZ9-F1-model_v4 Cell division topological specificity factor	0.113	85	63	2	86	9	80	1.245E+00	29
DESULFOASV1_0444_DUF167_domain-containing_protein	AF-Q477I9-F1-model_v4	DESULFOASV1_0444_DUF167_domain-containing_protein	AF-Q477I9-F1-model_v4 Cell division topological specificity factor	0.113	85	63	2	86	9	80	1.091E+00	29
DESULFOASV1_0444_DUF167_domain-containing_protein	AF-A0K5G1-F1-model_v4	DESULFOASV1_0444_DUF167_domain-containing_protein	AF-A0K5G1-F1-model_v4 Cell division topological specificity factor	0.114	85	63	2	86	9	80	1.091E+00	29
DESULFOASV1_0444_DUF167_domain-containing_protein	AF-Q2SY86-F1-model_v4	DESULFOASV1_0444_DUF167_domain-containing_protein	AF-Q2SY86-F1-model_v4 Cell division topological specificity factor	0.111	77	56	10	86	17	80	1.166E+00	29
DESULFOASV1_0444_DUF167_domain-containing_protein	AF-A6SX66-F1-model_v4	DESULFOASV1_0444_DUF167_domain-containing_protein	AF-A6SX66-F1-model_v4 Cell division topological specificity factor	0.085	79	59	10	88	17	82	1.245E+00	29
DESULFOASV1_0444_DUF167_domain-containing_protein	AF-Q97SJ6-F1-model_v4	DESULFOASV1_0444_DUF167_domain-containing_protein	AF-Q97SJ6-F1-model_v4 Capsular polysaccharide biosynthesis protein CpsC	0.125	92	72	6	88	39	130	4.055E-01	29
DESULFOASV1_0444_DUF167_domain-containing_protein	AF-P71050-F1-model_v4	DESULFOASV1_0444_DUF167_domain-containing_protein	AF-P71050-F1-model_v4 Uncharacterized protein YveK	0.214	42	28	53	88	83	124	1.166E+00	29
DESULFOASV1_0444_DUF167_domain-containing_protein	AF-Q9NWS0-F1-model_v4	DESULFOASV1_0444_DUF167_domain-containing_protein	AF-Q9NWS0-F1-model_v4 PIH1 domain-containing protein 1	0.113	86	69	7	92	212	290	1.976E+00	29
DESULFOASV1_0444_DUF167_domain-containing_protein	AF-Q09358-F1-model_v4	DESULFOASV1_0444_DUF167_domain-containing_protein	AF-Q09358-F1-model_v4 Uncharacterized protein ZK1128.3	0.140	71	48	12	68	142	212	7.345E-01	29
DESULFOASV1_0444_DUF167_domain-containing_protein	AF-A6V2H6-F1-model_v4	DESULFOASV1_0444_DUF167_domain-containing_protein	AF-A6V2H6-F1-model_v4 Cell division topological specificity factor	0.096	80	60	10	89	18	84	1.732E+00	28
DESULFOASV1_0444_DUF167_domain-containing_protein	AF-Q02Q76-F1-model_v4	DESULFOASV1_0444_DUF167_domain-containing_protein	AF-Q02Q76-F1-model_v4 Cell division topological specificity factor	0.096	80	60	10	89	18	84	1.732E+00	28
DESULFOASV1_0444_DUF167_domain-containing_protein	AF-Q62HY7-F1-model_v4	DESULFOASV1_0444_DUF167_domain-containing_protein	AF-Q62HY7-F1-model_v4 Cell division topological specificity factor	0.113	77	56	10	86	17	80	1.732E+00	28
DESULFOASV1_0444_DUF167_domain-containing_protein	AF-B2T1B8-F1-model_v4	DESULFOASV1_0444_DUF167_domain-containing_protein	AF-B2T1B8-F1-model_v4 Cell division topological specificity factor	0.136	85	61	2	86	9	80	1.518E+00	28
DESULFOASV1_0444_DUF167_domain-containing_protein	AF-Q1BY87-F1-model_v4	DESULFOASV1_0444_DUF167_domain-containing_protein	AF-Q1BY87-F1-model_v4 Cell division topological specificity factor	0.114	85	63	2	86	9	80	1.421E+00	28
DESULFOASV1_0444_DUF167_domain-containing_protein	AF-Q39IN0-F1-model_v4	DESULFOASV1_0444_DUF167_domain-containing_protein	AF-Q39IN0-F1-model_v4 Cell division topological specificity factor	0.114	85	63	2	86	9	80	1.732E+00	28
DESULFOASV1_0444_DUF167_domain-containing_protein	AF-Q4US05-F1-model_v4	DESULFOASV1_0444_DUF167_domain-containing_protein	AF-Q4US05-F1-model_v4 Cell division topological specificity factor	0.069	84	64	10	93	16	85	2.574E+00	28
DESULFOASV1_0444_DUF167_domain-containing_protein	AF-Q12HK7-F1-model_v4	DESULFOASV1_0444_DUF167_domain-containing_protein	AF-Q12HK7-F1-model_v4 Cell division topological specificity factor	0.091	85	65	2	86	10	81	1.421E+00	28
DESULFOASV1_0444_DUF167_domain-containing_protein	AF-B1Y580-F1-model_v4	DESULFOASV1_0444_DUF167_domain-containing_protein	AF-B1Y580-F1-model_v4 Cell division topological specificity factor	0.091	84	65	9	92	16	87	1.850E+00	28
DESULFOASV1_0444_DUF167_domain-containing_protein	AF-C1DBV9-F1-model_v4	DESULFOASV1_0444_DUF167_domain-containing_protein	AF-C1DBV9-F1-model_v4 Cell division topological specificity factor	0.058	82	64	10	91	17	85	1.850E+00	28
DESULFOASV1_0444_DUF167_domain-containing_protein	AF-C5CW30-F1-model_v4	DESULFOASV1_0444_DUF167_domain-containing_protein	AF-C5CW30-F1-model_v4 Cell division topological specificity factor	0.103	83	65	10	92	17	89	1.850E+00	28
DESULFOASV1_0444_DUF167_domain-containing_protein	AF-B1YXE9-F1-model_v4	DESULFOASV1_0444_DUF167_domain-containing_protein	AF-B1YXE9-F1-model_v4 Hydroxylamine reductase	0.103	29	25	41	69	455	483	9.018E+00	28
DESULFOASV1_0444_DUF167_domain-containing_protein	AF-C3K0D5-F1-model_v4	DESULFOASV1_0444_DUF167_domain-containing_protein	AF-C3K0D5-F1-model_v4 Cell division topological specificity factor	0.117	82	60	8	89	16	84	2.409E+00	27
DESULFOASV1_0444_DUF167_domain-containing_protein	AF-A3MMM6-F1-model_v4	DESULFOASV1_0444_DUF167_domain-containing_protein	AF-A3MMM6-F1-model_v4 Cell division topological specificity factor	0.111	77	56	10	86	17	80	1.732E+00	27
DESULFOASV1_0444_DUF167_domain-containing_protein	AF-Q3SGJ3-F1-model_v4	DESULFOASV1_0444_DUF167_domain-containing_protein	AF-Q3SGJ3-F1-model_v4 Cell division topological specificity factor	0.101	78	55	8	85	15	76	1.166E+00	27
DESULFOASV1_0444_DUF167_domain-containing_protein	AF-Q9HYZ5-F1-model_v4	DESULFOASV1_0444_DUF167_domain-containing_protein	AF-Q9HYZ5-F1-model_v4 Cell division topological specificity factor	0.096	80	60	10	89	18	84	2.255E+00	27
DESULFOASV1_0444_DUF167_domain-containing_protein	AF-B1YUM1-F1-model_v4	DESULFOASV1_0444_DUF167_domain-containing_protein	AF-B1YUM1-F1-model_v4 Cell division topological specificity factor	0.112	85	63	2	86	9	80	1.518E+00	27
DESULFOASV1_0444_DUF167_domain-containing_protein	AF-A3NY50-F1-model_v4	DESULFOASV1_0444_DUF167_domain-containing_protein	AF-A3NY50-F1-model_v4 Cell division topological specificity factor	0.114	85	63	2	86	9	80	1.621E+00	27
DESULFOASV1_0444_DUF167_domain-containing_protein	AF-Q5GWY5-F1-model_v4	DESULFOASV1_0444_DUF167_domain-containing_protein	AF-Q5GWY5-F1-model_v4 Cell division topological specificity factor	0.068	85	65	9	93	15	85	2.937E+00	27
DESULFOASV1_0444_DUF167_domain-containing_protein	AF-Q223G5-F1-model_v4	DESULFOASV1_0444_DUF167_domain-containing_protein	AF-Q223G5-F1-model_v4 Cell division topological specificity factor	0.085	79	60	8	86	15	81	1.850E+00	27
DESULFOASV1_0444_DUF167_domain-containing_protein	AF-A1WID5-F1-model_v4	DESULFOASV1_0444_DUF167_domain-containing_protein	AF-A1WID5-F1-model_v4 Cell division topological specificity factor	0.083	81	63	10	90	18	87	2.574E+00	27
DESULFOASV1_0444_DUF167_domain-containing_protein	AF-P63858-F1-model_v4	DESULFOASV1_0444_DUF167_domain-containing_protein	AF-P63858-F1-model_v4 Capsular polysaccharide biosynthesis protein CapA	0.139	43	31	53	89	83	125	1.732E+00	27
DESULFOASV1_0444_DUF167_domain-containing_protein	AF-P12294-F1-model_v4	DESULFOASV1_0444_DUF167_domain-containing_protein	AF-P12294-F1-model_v4 Endonuclease SceI small subunit	0.121	74	37	14	87	350	392	1.518E+00	27
DESULFOASV1_0444_DUF167_domain-containing_protein	AF-Q0VQI2-F1-model_v4	DESULFOASV1_0444_DUF167_domain-containing_protein	AF-Q0VQI2-F1-model_v4 Cell division topological specificity factor	0.102	78	55	8	85	15	76	1.621E+00	26
DESULFOASV1_0444_DUF167_domain-containing_protein	AF-Q88M43-F1-model_v4	DESULFOASV1_0444_DUF167_domain-containing_protein	AF-Q88M43-F1-model_v4 Cell division topological specificity factor	0.117	82	60	8	89	16	84	2.255E+00	26
DESULFOASV1_0444_DUF167_domain-containing_protein	AF-Q07LX8-F1-model_v4	DESULFOASV1_0444_DUF167_domain-containing_protein	AF-Q07LX8-F1-model_v4 Cell division topological specificity factor	0.135	79	55	8	86	14	78	2.111E+00	26
DESULFOASV1_0444_DUF167_domain-containing_protein	AF-B2JEH0-F1-model_v4	DESULFOASV1_0444_DUF167_domain-containing_protein	AF-B2JEH0-F1-model_v4 Cell division topological specificity factor	0.125	85	62	2	86	9	80	1.976E+00	26
DESULFOASV1_0444_DUF167_domain-containing_protein	AF-B0KTU2-F1-model_v4	DESULFOASV1_0444_DUF167_domain-containing_protein	AF-B0KTU2-F1-model_v4 Cell division topological specificity factor	0.120	80	58	10	89	18	84	2.409E+00	26
DESULFOASV1_0444_DUF167_domain-containing_protein	AF-A2S9H0-F1-model_v4	DESULFOASV1_0444_DUF167_domain-containing_protein	AF-A2S9H0-F1-model_v4 Cell division topological specificity factor	0.111	77	56	10	86	17	80	2.111E+00	26
DESULFOASV1_0444_DUF167_domain-containing_protein	AF-Q5NY33-F1-model_v4	DESULFOASV1_0444_DUF167_domain-containing_protein	AF-Q5NY33-F1-model_v4 Cell division topological specificity factor	0.098	85	66	8	92	15	88	1.850E+00	26
DESULFOASV1_0444_DUF167_domain-containing_protein	AF-B9MA02-F1-model_v4	DESULFOASV1_0444_DUF167_domain-containing_protein	AF-B9MA02-F1-model_v4 Cell division topological specificity factor	0.091	85	65	2	86	9	81	1.976E+00	26
DESULFOASV1_0444_DUF167_domain-containing_protein	AF-P95695-F1-model_v4	DESULFOASV1_0444_DUF167_domain-containing_protein	AF-P95695-F1-model_v4 Capsular polysaccharide type 5 biosynthesis protein cap5A	0.136	82	65	14	89	45	126	1.245E+00	26
DESULFOASV1_0444_DUF167_domain-containing_protein	AF-P96715-F1-model_v4	DESULFOASV1_0444_DUF167_domain-containing_protein	AF-P96715-F1-model_v4 Probable capsular polysaccharide biosynthesis protein YwqC	0.130	86	67	12	89	41	126	4.943E-01	26
DESULFOASV1_0444_DUF167_domain-containing_protein	AF-O43076-F1-model_v4	DESULFOASV1_0444_DUF167_domain-containing_protein	AF-O43076-F1-model_v4 Protein shq1	0.115	93	73	1	93	1	84	1.850E+00	26
DESULFOASV1_0444_DUF167_domain-containing_protein	AF-P35672-F1-model_v4	DESULFOASV1_0444_DUF167_domain-containing_protein	AF-P35672-F1-model_v4 SPI-1 type 3 secretion system secretin	0.066	115	77	6	88	171	285	4.085E+00	26
DESULFOASV1_0444_DUF167_domain-containing_protein	AF-Q23652-F1-model_v4	DESULFOASV1_0444_DUF167_domain-containing_protein	AF-Q23652-F1-model_v4 U6 snRNA-specific terminal uridylyltransferase	0.200	39	29	54	90	35	73	2.749E+00	26
DESULFOASV1_0444_DUF167_domain-containing_protein	AF-P52824-F1-model_v4	DESULFOASV1_0444_DUF167_domain-containing_protein	AF-P52824-F1-model_v4 Diacylglycerol kinase theta	0.090	64	46	37	88	486	549	2.409E+00	26
DESULFOASV1_0444_DUF167_domain-containing_protein	AF-B4K5R2-F1-model_v4	DESULFOASV1_0444_DUF167_domain-containing_protein	AF-B4K5R2-F1-model_v4 Probable ATP-dependent RNA helicase spindle-E	0.054	37	34	53	89	776	812	6.926E+00	26
DESULFOASV1_0444_DUF167_domain-containing_protein	AF-B3P3W1-F1-model_v4	DESULFOASV1_0444_DUF167_domain-containing_protein	AF-B3P3W1-F1-model_v4 Probable ATP-dependent RNA helicase spindle-E	0.054	37	34	53	89	775	811	7.903E+00	26
DESULFOASV1_0444_DUF167_domain-containing_protein	AF-Q7NSP3-F1-model_v4	DESULFOASV1_0444_DUF167_domain-containing_protein	AF-Q7NSP3-F1-model_v4 Cell division topological specificity factor	0.060	79	61	10	88	17	82	2.749E+00	25
DESULFOASV1_0444_DUF167_domain-containing_protein	AF-Q9K1H9-F1-model_v4	DESULFOASV1_0444_DUF167_domain-containing_protein	AF-Q9K1H9-F1-model_v4 Cell division topological specificity factor	0.082	82	63	8	89	15	84	2.409E+00	25
DESULFOASV1_0444_DUF167_domain-containing_protein	AF-A2SL57-F1-model_v4	DESULFOASV1_0444_DUF167_domain-containing_protein	AF-A2SL57-F1-model_v4 Cell division topological specificity factor	0.118	75	53	14	88	21	81	2.937E+00	25
DESULFOASV1_0444_DUF167_domain-containing_protein	AF-Q5HCN3-F1-model_v4	DESULFOASV1_0444_DUF167_domain-containing_protein	AF-Q5HCN3-F1-model_v4 Capsular polysaccharide biosynthesis protein CapA	0.119	81	66	14	89	45	125	2.111E+00	25
DESULFOASV1_0444_DUF167_domain-containing_protein	AF-P63859-F1-model_v4	DESULFOASV1_0444_DUF167_domain-containing_protein	AF-P63859-F1-model_v4 Capsular polysaccharide biosynthesis protein CapA	0.146	41	29	55	89	85	125	2.409E+00	25
DESULFOASV1_0444_DUF167_domain-containing_protein	AF-Q9CQJ2-F1-model_v4	DESULFOASV1_0444_DUF167_domain-containing_protein	AF-Q9CQJ2-F1-model_v4 PIH1 domain-containing protein 1	0.103	86	70	7	92	212	290	3.824E+00	25
DESULFOASV1_0444_DUF167_domain-containing_protein	AF-B5YGX0-F1-model_v4	DESULFOASV1_0444_DUF167_domain-containing_protein	AF-B5YGX0-F1-model_v4 Phosphoglucosamine mutase	0.125	76	50	14	89	374	431	3.580E+00	25
DESULFOASV1_0444_DUF167_domain-containing_protein	AF-Q83NS5-F1-model_v4	DESULFOASV1_0444_DUF167_domain-containing_protein	AF-Q83NS5-F1-model_v4 Phosphoglucosamine mutase	0.105	76	47	14	89	378	431	3.824E+00	25
DESULFOASV1_0444_DUF167_domain-containing_protein	AF-Q7NUG7-F1-model_v4	DESULFOASV1_0444_DUF167_domain-containing_protein	AF-Q7NUG7-F1-model_v4 Probable potassium transport system protein kup 1	0.169	53	38	21	67	526	578	4.979E+00	25
DESULFOASV1_0444_DUF167_domain-containing_protein	AF-Q8Y754-F1-model_v4	DESULFOASV1_0444_DUF167_domain-containing_protein	AF-Q8Y754-F1-model_v4 Glycine--tRNA ligase beta subunit	0.140	66	51	27	92	65	124	2.937E+00	25
DESULFOASV1_0444_DUF167_domain-containing_protein	AF-Q8L785-F1-model_v4	DESULFOASV1_0444_DUF167_domain-containing_protein	AF-Q8L785-F1-model_v4 Glycine--tRNA ligase, chloroplastic/mitochondrial 2	0.125	39	32	48	86	463	499	6.483E+00	25
DESULFOASV1_0444_DUF167_domain-containing_protein	AF-Q296Q5-F1-model_v4	DESULFOASV1_0444_DUF167_domain-containing_protein	AF-Q296Q5-F1-model_v4 Probable ATP-dependent RNA helicase spindle-E	0.100	50	41	47	93	765	814	4.085E+00	25
DESULFOASV1_0444_DUF167_domain-containing_protein	AF-B4JT42-F1-model_v4	DESULFOASV1_0444_DUF167_domain-containing_protein	AF-B4JT42-F1-model_v4 Probable ATP-dependent RNA helicase spindle-E	0.081	37	33	53	89	776	812	8.442E+00	25
DESULFOASV1_0444_DUF167_domain-containing_protein	AF-B4GEU5-F1-model_v4	DESULFOASV1_0444_DUF167_domain-containing_protein	AF-B4GEU5-F1-model_v4 Probable ATP-dependent RNA helicase spindle-E	0.111	45	36	47	88	766	810	5.319E+00	25
DESULFOASV1_0444_DUF167_domain-containing_protein	AF-B1J1S5-F1-model_v4	DESULFOASV1_0444_DUF167_domain-containing_protein	AF-B1J1S5-F1-model_v4 Cell division topological specificity factor	0.117	82	60	8	89	16	84	3.824E+00	24
DESULFOASV1_0444_DUF167_domain-containing_protein	AF-Q3BW76-F1-model_v4	DESULFOASV1_0444_DUF167_domain-containing_protein	AF-Q3BW76-F1-model_v4 Cell division topological specificity factor	0.081	84	63	10	93	16	85	4.979E+00	24
DESULFOASV1_0444_DUF167_domain-containing_protein	AF-A9M3T6-F1-model_v4	DESULFOASV1_0444_DUF167_domain-containing_protein	AF-A9M3T6-F1-model_v4 Cell division topological specificity factor	0.082	82	63	8	89	15	84	3.137E+00	24
DESULFOASV1_0444_DUF167_domain-containing_protein	AF-A1W247-F1-model_v4	DESULFOASV1_0444_DUF167_domain-containing_protein	AF-A1W247-F1-model_v4 Cell division topological specificity factor	0.091	85	65	2	86	9	81	2.937E+00	24
DESULFOASV1_0444_DUF167_domain-containing_protein	AF-P39850-F1-model_v4	DESULFOASV1_0444_DUF167_domain-containing_protein	AF-P39850-F1-model_v4 Capsular polysaccharide biosynthesis protein CapA	0.106	82	66	14	88	43	124	8.381E-01	24
DESULFOASV1_0444_DUF167_domain-containing_protein	AF-A9W9G7-F1-model_v4	DESULFOASV1_0444_DUF167_domain-containing_protein	AF-A9W9G7-F1-model_v4 Phosphoglucosamine mutase	0.113	77	49	13	89	371	426	3.351E+00	24
DESULFOASV1_0444_DUF167_domain-containing_protein	AF-Q83GU5-F1-model_v4	DESULFOASV1_0444_DUF167_domain-containing_protein	AF-Q83GU5-F1-model_v4 Phosphoglucosamine mutase	0.105	76	47	14	89	378	431	4.661E+00	24
DESULFOASV1_0444_DUF167_domain-containing_protein	AF-Q89AF3-F1-model_v4	DESULFOASV1_0444_DUF167_domain-containing_protein	AF-Q89AF3-F1-model_v4 Phosphoglucosamine mutase	0.115	76	49	14	89	369	424	3.137E+00	24
DESULFOASV1_0444_DUF167_domain-containing_protein	AF-Q9JKL7-F1-model_v4	DESULFOASV1_0444_DUF167_domain-containing_protein	AF-Q9JKL7-F1-model_v4 Splicing regulatory glutamine/lysine-rich protein 1	0.125	89	60	1	89	50	118	3.351E+00	24
DESULFOASV1_0444_DUF167_domain-containing_protein	AF-Q8BZX4-F1-model_v4	DESULFOASV1_0444_DUF167_domain-containing_protein	AF-Q8BZX4-F1-model_v4 Splicing regulatory glutamine/lysine-rich protein 1	0.125	89	60	1	89	50	118	2.937E+00	24
DESULFOASV1_0444_DUF167_domain-containing_protein	AF-Q6PI26-F1-model_v4	DESULFOASV1_0444_DUF167_domain-containing_protein	AF-Q6PI26-F1-model_v4 Protein SHQ1 homolog	0.101	93	75	1	93	1	84	3.824E+00	24
DESULFOASV1_0444_DUF167_domain-containing_protein	AF-Q8XR16-F1-model_v4	DESULFOASV1_0444_DUF167_domain-containing_protein	AF-Q8XR16-F1-model_v4 Probable potassium transport system protein kup 1	0.132	53	39	21	66	500	552	6.926E+00	24
DESULFOASV1_0444_DUF167_domain-containing_protein	AF-A9KBT7-F1-model_v4	DESULFOASV1_0444_DUF167_domain-containing_protein	AF-A9KBT7-F1-model_v4 Glycine--tRNA ligase beta subunit	0.151	32	26	56	87	91	122	5.682E+00	24
DESULFOASV1_0444_DUF167_domain-containing_protein	AF-P45651-F1-model_v4	DESULFOASV1_0444_DUF167_domain-containing_protein	AF-P45651-F1-model_v4 Glycine--tRNA ligase beta subunit	0.162	37	28	56	92	91	125	7.903E+00	24
DESULFOASV1_0444_DUF167_domain-containing_protein	AF-A5W7K1-F1-model_v4	DESULFOASV1_0444_DUF167_domain-containing_protein	AF-A5W7K1-F1-model_v4 Cell division topological specificity factor	0.120	80	58	10	89	18	84	4.661E+00	23
DESULFOASV1_0444_DUF167_domain-containing_protein	AF-Q47JE5-F1-model_v4	DESULFOASV1_0444_DUF167_domain-containing_protein	AF-Q47JE5-F1-model_v4 Cell division topological specificity factor	0.080	80	62	10	89	17	84	2.937E+00	23
DESULFOASV1_0444_DUF167_domain-containing_protein	AF-B4SNY7-F1-model_v4	DESULFOASV1_0444_DUF167_domain-containing_protein	AF-B4SNY7-F1-model_v4 Cell division topological specificity factor	0.065	89	66	8	96	14	85	4.085E+00	23
DESULFOASV1_0444_DUF167_domain-containing_protein	AF-A1KRK3-F1-model_v4	DESULFOASV1_0444_DUF167_domain-containing_protein	AF-A1KRK3-F1-model_v4 Cell division topological specificity factor	0.109	71	53	16	86	21	80	4.363E+00	23
DESULFOASV1_0444_DUF167_domain-containing_protein	AF-A1TIF0-F1-model_v4	DESULFOASV1_0444_DUF167_domain-containing_protein	AF-A1TIF0-F1-model_v4 Cell division topological specificity factor	0.088	77	58	10	86	18	82	4.661E+00	23
DESULFOASV1_0444_DUF167_domain-containing_protein	AF-Q2LRX3-F1-model_v4	DESULFOASV1_0444_DUF167_domain-containing_protein	AF-Q2LRX3-F1-model_v4 Cell division topological specificity factor	0.129	89	67	8	96	16	93	4.085E+00	23
DESULFOASV1_0444_DUF167_domain-containing_protein	AF-Q9RQQ1-F1-model_v4	DESULFOASV1_0444_DUF167_domain-containing_protein	AF-Q9RQQ1-F1-model_v4 Capsular polysaccharide biosynthesis protein CapA	0.146	41	29	55	89	85	125	3.580E+00	23
DESULFOASV1_0444_DUF167_domain-containing_protein	AF-Q6G610-F1-model_v4	DESULFOASV1_0444_DUF167_domain-containing_protein	AF-Q6G610-F1-model_v4 Capsular polysaccharide biosynthesis protein CapA	0.146	41	29	55	89	85	125	3.137E+00	23
DESULFOASV1_0444_DUF167_domain-containing_protein	AF-P72367-F1-model_v4	DESULFOASV1_0444_DUF167_domain-containing_protein	AF-P72367-F1-model_v4 Capsular polysaccharide type 8 biosynthesis protein cap8A	0.117	88	70	10	89	39	126	1.166E+00	23
DESULFOASV1_0444_DUF167_domain-containing_protein	AF-Q0VCI6-F1-model_v4	DESULFOASV1_0444_DUF167_domain-containing_protein	AF-Q0VCI6-F1-model_v4 PIH1 domain-containing protein 1	0.100	88	69	7	94	212	289	3.824E+00	23
DESULFOASV1_0444_DUF167_domain-containing_protein	AF-Q4V7F5-F1-model_v4	DESULFOASV1_0444_DUF167_domain-containing_protein	AF-Q4V7F5-F1-model_v4 PIH1 domain-containing protein 1	0.103	86	70	7	92	212	290	5.682E+00	23
DESULFOASV1_0444_DUF167_domain-containing_protein	AF-A6VP84-F1-model_v4	DESULFOASV1_0444_DUF167_domain-containing_protein	AF-A6VP84-F1-model_v4 Phosphoglucosamine mutase	0.113	77	50	14	90	371	427	4.979E+00	23
DESULFOASV1_0444_DUF167_domain-containing_protein	AF-B3H286-F1-model_v4	DESULFOASV1_0444_DUF167_domain-containing_protein	AF-B3H286-F1-model_v4 Phosphoglucosamine mutase	0.128	76	48	14	89	371	426	4.661E+00	23
DESULFOASV1_0444_DUF167_domain-containing_protein	AF-B8D9G5-F1-model_v4	DESULFOASV1_0444_DUF167_domain-containing_protein	AF-B8D9G5-F1-model_v4 Phosphoglucosamine mutase	0.142	77	48	14	90	371	427	3.824E+00	23
DESULFOASV1_0444_DUF167_domain-containing_protein	AF-Q4QKI9-F1-model_v4	DESULFOASV1_0444_DUF167_domain-containing_protein	AF-Q4QKI9-F1-model_v4 Phosphoglucosamine mutase	0.113	77	50	14	90	371	427	6.069E+00	23
DESULFOASV1_0444_DUF167_domain-containing_protein	AF-P45164-F1-model_v4	DESULFOASV1_0444_DUF167_domain-containing_protein	AF-P45164-F1-model_v4 Phosphoglucosamine mutase	0.113	77	50	14	90	371	427	6.069E+00	23
DESULFOASV1_0444_DUF167_domain-containing_protein	AF-A1S7U2-F1-model_v4	DESULFOASV1_0444_DUF167_domain-containing_protein	AF-A1S7U2-F1-model_v4 Phosphoglucosamine mutase 2	0.113	77	51	14	90	375	432	3.137E+00	23
DESULFOASV1_0444_DUF167_domain-containing_protein	AF-Q9VF26-F1-model_v4	DESULFOASV1_0444_DUF167_domain-containing_protein	AF-Q9VF26-F1-model_v4 Probable ATP-dependent RNA helicase spindle-E	0.119	42	34	53	92	777	818	7.903E+00	23
DESULFOASV1_0444_DUF167_domain-containing_protein	AF-P65366-F1-model_v4	DESULFOASV1_0444_DUF167_domain-containing_protein	AF-P65366-F1-model_v4 Cell division topological specificity factor	0.061	78	60	12	89	18	82	5.319E+00	22
DESULFOASV1_0444_DUF167_domain-containing_protein	AF-B2I965-F1-model_v4	DESULFOASV1_0444_DUF167_domain-containing_protein	AF-B2I965-F1-model_v4 Cell division topological specificity factor	0.058	83	65	10	92	16	85	5.682E+00	22
DESULFOASV1_0444_DUF167_domain-containing_protein	AF-Q5F5V5-F1-model_v4	DESULFOASV1_0444_DUF167_domain-containing_protein	AF-Q5F5V5-F1-model_v4 Cell division topological specificity factor	0.082	82	65	8	89	13	84	4.363E+00	22
DESULFOASV1_0444_DUF167_domain-containing_protein	AF-A9BQN8-F1-model_v4	DESULFOASV1_0444_DUF167_domain-containing_protein	AF-A9BQN8-F1-model_v4 Cell division topological specificity factor	0.086	79	58	14	92	23	87	4.979E+00	22
DESULFOASV1_0444_DUF167_domain-containing_protein	AF-Q9JX18-F1-model_v4	DESULFOASV1_0444_DUF167_domain-containing_protein	AF-Q9JX18-F1-model_v4 Cell division topological specificity factor	0.093	82	65	8	89	12	84	3.824E+00	22
DESULFOASV1_0444_DUF167_domain-containing_protein	AF-Q3JDR7-F1-model_v4	DESULFOASV1_0444_DUF167_domain-containing_protein	AF-Q3JDR7-F1-model_v4 Cell division topological specificity factor	0.070	82	63	8	89	15	83	4.661E+00	22
DESULFOASV1_0444_DUF167_domain-containing_protein	AF-P28707-F1-model_v4	DESULFOASV1_0444_DUF167_domain-containing_protein	AF-P28707-F1-model_v4 Co-chaperone protein SBA1	0.100	93	81	5	95	14	106	2.255E+00	22
DESULFOASV1_0444_DUF167_domain-containing_protein	AF-Q6GDE0-F1-model_v4	DESULFOASV1_0444_DUF167_domain-containing_protein	AF-Q6GDE0-F1-model_v4 Capsular polysaccharide biosynthesis protein CapA	0.146	41	29	55	89	85	125	3.824E+00	22
DESULFOASV1_0444_DUF167_domain-containing_protein	AF-Q3K0S9-F1-model_v4	DESULFOASV1_0444_DUF167_domain-containing_protein	AF-Q3K0S9-F1-model_v4 Capsular polysaccharide biosynthesis protein CpsC	0.097	92	75	6	89	41	132	1.518E+00	22
DESULFOASV1_0444_DUF167_domain-containing_protein	AF-Q04662-F1-model_v4	DESULFOASV1_0444_DUF167_domain-containing_protein	AF-Q04662-F1-model_v4 Capsular polysaccharide biosynthesis protein CpsC	0.103	92	74	6	89	41	132	9.564E-01	22
DESULFOASV1_0444_DUF167_domain-containing_protein	AF-P22191-F1-model_v4	DESULFOASV1_0444_DUF167_domain-containing_protein	AF-P22191-F1-model_v4 Uncharacterized cox1 intron-1 45.6 kDa protein	0.103	83	50	6	88	264	320	2.749E+00	22
DESULFOASV1_0444_DUF167_domain-containing_protein	AF-B8D7R7-F1-model_v4	DESULFOASV1_0444_DUF167_domain-containing_protein	AF-B8D7R7-F1-model_v4 Phosphoglucosamine mutase	0.142	77	48	14	90	371	427	4.085E+00	22
DESULFOASV1_0444_DUF167_domain-containing_protein	AF-A0QKT1-F1-model_v4	DESULFOASV1_0444_DUF167_domain-containing_protein	AF-A0QKT1-F1-model_v4 Phosphoglucosamine mutase	0.126	77	49	13	89	369	425	4.661E+00	22
DESULFOASV1_0444_DUF167_domain-containing_protein	AF-P57461-F1-model_v4	DESULFOASV1_0444_DUF167_domain-containing_protein	AF-P57461-F1-model_v4 Phosphoglucosamine mutase	0.142	77	48	14	90	371	427	4.363E+00	22
