query	target	qheader	theader	fident	alnlen	mismatch	qstart	qend	tstart	tend	evalue	bits
DESULFOASV1_2872_HDOD_domain-containing_protein	AF-O64511-F1-model_v4	DESULFOASV1_2872_HDOD_domain-containing_protein	AF-O64511-F1-model_v4 Protein TWIN LOV 1	0.095	335	205	433	659	29	363	1.360E-03	100
DESULFOASV1_2872_HDOD_domain-containing_protein	AF-P9WGL4-F1-model_v4	DESULFOASV1_2872_HDOD_domain-containing_protein	AF-P9WGL4-F1-model_v4 Probable sensor histidine kinase PdtaS	0.111	344	295	441	784	40	372	8.157E-05	100
DESULFOASV1_2872_HDOD_domain-containing_protein	AF-O75343-F1-model_v4	DESULFOASV1_2872_HDOD_domain-containing_protein	AF-O75343-F1-model_v4 Guanylate cyclase soluble subunit beta-2	0.098	514	302	478	813	7	520	3.604E-05	100
DESULFOASV1_2872_HDOD_domain-containing_protein	AF-P27540-F1-model_v4	DESULFOASV1_2872_HDOD_domain-containing_protein	AF-P27540-F1-model_v4 Aryl hydrocarbon receptor nuclear translocator	0.100	400	352	263	662	77	468	1.121E-04	100
DESULFOASV1_2872_HDOD_domain-containing_protein	AF-P0DMC5-F1-model_v4	DESULFOASV1_2872_HDOD_domain-containing_protein	AF-P0DMC5-F1-model_v4 Sensor histidine kinase RcsC	0.091	541	482	211	751	10	540	4.832E-07	100
DESULFOASV1_2872_HDOD_domain-containing_protein	AF-B1YAW1-F1-model_v4	DESULFOASV1_2872_HDOD_domain-containing_protein	AF-B1YAW1-F1-model_v4 GTP cyclohydrolase III	0.144	190	149	642	831	47	221	1.148E-02	99
DESULFOASV1_2872_HDOD_domain-containing_protein	AF-P93025-F1-model_v4	DESULFOASV1_2872_HDOD_domain-containing_protein	AF-P93025-F1-model_v4 Phototropin-2	0.089	531	301	432	762	123	653	8.932E-05	99
DESULFOASV1_2872_HDOD_domain-containing_protein	AF-O74539-F1-model_v4	DESULFOASV1_2872_HDOD_domain-containing_protein	AF-O74539-F1-model_v4 Peroxide stress-activated histidine kinase mak3	0.093	714	639	41	745	1140	1853	2.678E-07	99
DESULFOASV1_2872_HDOD_domain-containing_protein	AF-P9WGL5-F1-model_v4	DESULFOASV1_2872_HDOD_domain-containing_protein	AF-P9WGL5-F1-model_v4 Probable sensor histidine kinase PdtaS	0.111	344	295	441	784	40	372	1.024E-04	98
DESULFOASV1_2872_HDOD_domain-containing_protein	AF-A1RRI0-F1-model_v4	DESULFOASV1_2872_HDOD_domain-containing_protein	AF-A1RRI0-F1-model_v4 GTP cyclohydrolase III	0.110	192	155	640	831	47	221	2.484E-02	97
DESULFOASV1_2872_HDOD_domain-containing_protein	AF-Q8NWF3-F1-model_v4	DESULFOASV1_2872_HDOD_domain-containing_protein	AF-Q8NWF3-F1-model_v4 Sensor protein SrrB	0.090	434	297	426	752	65	498	3.604E-05	97
DESULFOASV1_2872_HDOD_domain-containing_protein	AF-P37739-F1-model_v4	DESULFOASV1_2872_HDOD_domain-containing_protein	AF-P37739-F1-model_v4 C4-dicarboxylate transport sensor protein DctS	0.117	540	407	250	789	37	498	3.005E-05	97
DESULFOASV1_2872_HDOD_domain-containing_protein	AF-P19686-F1-model_v4	DESULFOASV1_2872_HDOD_domain-containing_protein	AF-P19686-F1-model_v4 Guanylate cyclase soluble subunit alpha-1	0.107	694	464	105	798	58	578	3.145E-05	97
DESULFOASV1_2872_HDOD_domain-containing_protein	AF-Q04850-F1-model_v4	DESULFOASV1_2872_HDOD_domain-containing_protein	AF-Q04850-F1-model_v4 Nitrogen regulation protein NtrY	0.119	647	498	105	751	16	581	2.366E-06	97
DESULFOASV1_2872_HDOD_domain-containing_protein	AF-B0D0T8-F1-model_v4	DESULFOASV1_2872_HDOD_domain-containing_protein	AF-B0D0T8-F1-model_v4 Transcription activator of gluconeogenesis ERT1	0.165	124	92	550	660	424	547	2.097E-01	96
DESULFOASV1_2872_HDOD_domain-containing_protein	AF-Q9L523-F1-model_v4	DESULFOASV1_2872_HDOD_domain-containing_protein	AF-Q9L523-F1-model_v4 Sensor protein SrrB	0.092	435	297	425	752	64	498	2.623E-05	96
DESULFOASV1_2872_HDOD_domain-containing_protein	AF-P53762-F1-model_v4	DESULFOASV1_2872_HDOD_domain-containing_protein	AF-P53762-F1-model_v4 Aryl hydrocarbon receptor nuclear translocator	0.094	401	355	262	662	76	468	5.937E-05	96
DESULFOASV1_2872_HDOD_domain-containing_protein	AF-Q6NNF2-F1-model_v4	DESULFOASV1_2872_HDOD_domain-containing_protein	AF-Q6NNF2-F1-model_v4 High affinity cAMP-specific and IBMX-insensitive 3',5'-cyclic phosphodiesterase 8	0.123	109	91	554	658	310	418	3.959E-01	96
DESULFOASV1_2872_HDOD_domain-containing_protein	AF-Q9ULD8-F1-model_v4	DESULFOASV1_2872_HDOD_domain-containing_protein	AF-Q9ULD8-F1-model_v4 Potassium voltage-gated channel subfamily H member 3	0.137	124	93	558	666	16	139	2.882E-01	96
DESULFOASV1_2872_HDOD_domain-containing_protein	AF-P0AFB6-F1-model_v4	DESULFOASV1_2872_HDOD_domain-containing_protein	AF-P0AFB6-F1-model_v4 Sensory histidine kinase/phosphatase NtrB	0.117	182	150	561	742	10	180	1.808E-02	95
DESULFOASV1_2872_HDOD_domain-containing_protein	AF-Q6C5G3-F1-model_v4	DESULFOASV1_2872_HDOD_domain-containing_protein	AF-Q6C5G3-F1-model_v4 Transcription activator of gluconeogenesis ERT1-1	0.107	130	114	413	542	224	352	1.459E-01	95
DESULFOASV1_2872_HDOD_domain-containing_protein	AF-A8N767-F1-model_v4	DESULFOASV1_2872_HDOD_domain-containing_protein	AF-A8N767-F1-model_v4 Transcription activator of gluconeogenesis ERT1	0.131	142	119	405	542	398	539	7.384E-02	95
DESULFOASV1_2872_HDOD_domain-containing_protein	AF-Q6GGK7-F1-model_v4	DESULFOASV1_2872_HDOD_domain-containing_protein	AF-Q6GGK7-F1-model_v4 Sensor protein SrrB	0.091	434	296	426	752	65	498	8.157E-05	95
DESULFOASV1_2872_HDOD_domain-containing_protein	AF-Q6G973-F1-model_v4	DESULFOASV1_2872_HDOD_domain-containing_protein	AF-Q6G973-F1-model_v4 Sensor protein SrrB	0.087	435	299	425	752	64	498	3.771E-05	95
DESULFOASV1_2872_HDOD_domain-containing_protein	AF-P05709-F1-model_v4	DESULFOASV1_2872_HDOD_domain-containing_protein	AF-P05709-F1-model_v4 Protein single-minded	0.094	351	289	426	745	98	448	4.577E-04	95
DESULFOASV1_2872_HDOD_domain-containing_protein	AF-P30561-F1-model_v4	DESULFOASV1_2872_HDOD_domain-containing_protein	AF-P30561-F1-model_v4 Aryl hydrocarbon receptor	0.097	384	326	289	672	31	392	2.778E-04	95
DESULFOASV1_2872_HDOD_domain-containing_protein	AF-P90895-F1-model_v4	DESULFOASV1_2872_HDOD_domain-containing_protein	AF-P90895-F1-model_v4 Soluble guanylate cyclase gcy-33	0.107	457	288	475	798	82	538	4.732E-05	95
DESULFOASV1_2872_HDOD_domain-containing_protein	AF-O89047-F1-model_v4	DESULFOASV1_2872_HDOD_domain-containing_protein	AF-O89047-F1-model_v4 Potassium voltage-gated channel subfamily H member 3	0.133	127	96	555	666	13	139	3.155E-01	95
DESULFOASV1_2872_HDOD_domain-containing_protein	AF-Q9HQT7-F1-model_v4	DESULFOASV1_2872_HDOD_domain-containing_protein	AF-Q9HQT7-F1-model_v4 GTP cyclohydrolase III 1	0.149	202	162	640	830	49	250	3.117E-02	94
DESULFOASV1_2872_HDOD_domain-containing_protein	AF-P9WQ31-F1-model_v4	DESULFOASV1_2872_HDOD_domain-containing_protein	AF-P9WQ31-F1-model_v4 Uncharacterized protein Rv1319c	0.145	174	134	660	817	318	491	6.444E-02	93
DESULFOASV1_2872_HDOD_domain-containing_protein	AF-Q2FY80-F1-model_v4	DESULFOASV1_2872_HDOD_domain-containing_protein	AF-Q2FY80-F1-model_v4 Sensor protein SrrB	0.088	434	297	426	752	65	498	7.795E-05	93
DESULFOASV1_2872_HDOD_domain-containing_protein	AF-Q02482-F1-model_v4	DESULFOASV1_2872_HDOD_domain-containing_protein	AF-Q02482-F1-model_v4 Putative sensor protein Sfri_3689	0.160	160	122	405	564	269	414	1.002E-02	93
DESULFOASV1_2872_HDOD_domain-containing_protein	AF-P59111-F1-model_v4	DESULFOASV1_2872_HDOD_domain-containing_protein	AF-P59111-F1-model_v4 Potassium voltage-gated channel subfamily H member 8	0.167	156	117	558	699	16	171	9.265E-02	93
DESULFOASV1_2872_HDOD_domain-containing_protein	AF-Q00738-F1-model_v4	DESULFOASV1_2872_HDOD_domain-containing_protein	AF-Q00738-F1-model_v4 Protein TraJ	0.094	149	125	420	568	7	145	6.158E-02	92
DESULFOASV1_2872_HDOD_domain-containing_protein	AF-A5ULV0-F1-model_v4	DESULFOASV1_2872_HDOD_domain-containing_protein	AF-A5ULV0-F1-model_v4 GTP cyclohydrolase III	0.128	198	156	652	831	56	253	6.158E-02	92
DESULFOASV1_2872_HDOD_domain-containing_protein	AF-P14203-F1-model_v4	DESULFOASV1_2872_HDOD_domain-containing_protein	AF-P14203-F1-model_v4 Uncharacterized protein YuxH	0.150	258	168	25	282	208	406	2.168E-02	92
DESULFOASV1_2872_HDOD_domain-containing_protein	AF-O34206-F1-model_v4	DESULFOASV1_2872_HDOD_domain-containing_protein	AF-O34206-F1-model_v4 Alginate biosynthesis sensor protein KinB	0.100	678	400	68	745	2	446	5.937E-05	92
DESULFOASV1_2872_HDOD_domain-containing_protein	AF-O02747-F1-model_v4	DESULFOASV1_2872_HDOD_domain-containing_protein	AF-O02747-F1-model_v4 Aryl hydrocarbon receptor	0.136	289	213	426	672	108	396	3.486E-04	92
DESULFOASV1_2872_HDOD_domain-containing_protein	AF-Q9WVJ0-F1-model_v4	DESULFOASV1_2872_HDOD_domain-containing_protein	AF-Q9WVJ0-F1-model_v4 Potassium voltage-gated channel subfamily H member 3	0.129	124	94	558	666	16	139	4.747E-01	92
DESULFOASV1_2872_HDOD_domain-containing_protein	AF-P16575-F1-model_v4	DESULFOASV1_2872_HDOD_domain-containing_protein	AF-P16575-F1-model_v4 Virulence sensor protein BvgS	0.146	246	206	543	784	567	812	4.043E-03	92
DESULFOASV1_2872_HDOD_domain-containing_protein	AF-Q5HFT1-F1-model_v4	DESULFOASV1_2872_HDOD_domain-containing_protein	AF-Q5HFT1-F1-model_v4 Sensor protein SrrB	0.097	435	295	425	752	64	498	9.781E-05	91
DESULFOASV1_2872_HDOD_domain-containing_protein	AF-Q99TZ9-F1-model_v4	DESULFOASV1_2872_HDOD_domain-containing_protein	AF-Q99TZ9-F1-model_v4 Sensor protein SrrB	0.092	435	297	425	752	64	498	6.501E-05	91
DESULFOASV1_2872_HDOD_domain-containing_protein	AF-Q02108-F1-model_v4	DESULFOASV1_2872_HDOD_domain-containing_protein	AF-Q02108-F1-model_v4 Guanylate cyclase soluble subunit alpha-1	0.099	694	469	105	798	59	579	7.795E-05	90
DESULFOASV1_2872_HDOD_domain-containing_protein	AF-Q56128-F1-model_v4	DESULFOASV1_2872_HDOD_domain-containing_protein	AF-Q56128-F1-model_v4 Sensor histidine kinase RcsC	0.106	467	400	295	742	61	527	2.161E-06	90
DESULFOASV1_2872_HDOD_domain-containing_protein	AF-P0A4Y1-F1-model_v4	DESULFOASV1_2872_HDOD_domain-containing_protein	AF-P0A4Y1-F1-model_v4 Adenylate cyclase	0.138	148	119	660	798	202	349	8.854E-02	89
DESULFOASV1_2872_HDOD_domain-containing_protein	AF-D8Q8R5-F1-model_v4	DESULFOASV1_2872_HDOD_domain-containing_protein	AF-D8Q8R5-F1-model_v4 Transcription activator of gluconeogenesis ERT1	0.144	129	101	542	660	431	559	1.749E-01	89
DESULFOASV1_2872_HDOD_domain-containing_protein	AF-Q9ST27-F1-model_v4	DESULFOASV1_2872_HDOD_domain-containing_protein	AF-Q9ST27-F1-model_v4 Phototropin-2	0.093	558	297	434	762	95	652	1.765E-04	89
DESULFOASV1_2872_HDOD_domain-containing_protein	AF-Q9QWS8-F1-model_v4	DESULFOASV1_2872_HDOD_domain-containing_protein	AF-Q9QWS8-F1-model_v4 Potassium voltage-gated channel subfamily H member 8	0.167	156	117	558	699	16	171	1.162E-01	89
DESULFOASV1_2872_HDOD_domain-containing_protein	AF-P0A4Y3-F1-model_v4	DESULFOASV1_2872_HDOD_domain-containing_protein	AF-P0A4Y3-F1-model_v4 Uncharacterized protein Mb1353c	0.145	173	133	660	816	318	490	1.015E-01	88
DESULFOASV1_2872_HDOD_domain-containing_protein	AF-O44712-F1-model_v4	DESULFOASV1_2872_HDOD_domain-containing_protein	AF-O44712-F1-model_v4 Aryl hydrocarbon receptor protein 1	0.102	270	220	430	675	131	400	4.427E-03	88
DESULFOASV1_2872_HDOD_domain-containing_protein	AF-Q6DNF4-F1-model_v4	DESULFOASV1_2872_HDOD_domain-containing_protein	AF-Q6DNF4-F1-model_v4 Soluble guanylate cyclase gcy-36	0.097	527	321	457	813	53	579	2.744E-05	88
DESULFOASV1_2872_HDOD_domain-containing_protein	AF-Q8INF0-F1-model_v4	DESULFOASV1_2872_HDOD_domain-containing_protein	AF-Q8INF0-F1-model_v4 Soluble guanylate cyclase 88E	0.098	606	493	208	813	3	550	4.079E-06	88
DESULFOASV1_2872_HDOD_domain-containing_protein	AF-P22717-F1-model_v4	DESULFOASV1_2872_HDOD_domain-containing_protein	AF-P22717-F1-model_v4 Guanylate cyclase soluble subunit beta-2	0.105	483	287	478	799	24	506	1.846E-04	87
DESULFOASV1_2872_HDOD_domain-containing_protein	AF-Q03101-F1-model_v4	DESULFOASV1_2872_HDOD_domain-containing_protein	AF-Q03101-F1-model_v4 Adenylate cyclase, germination specific	0.107	417	332	441	813	111	527	1.173E-04	87
DESULFOASV1_2872_HDOD_domain-containing_protein	AF-Q9GYQ4-F1-model_v4	DESULFOASV1_2872_HDOD_domain-containing_protein	AF-Q9GYQ4-F1-model_v4 Receptor-type guanylate cyclase gcy-8	0.132	174	131	662	813	885	1058	6.158E-02	87
DESULFOASV1_2872_HDOD_domain-containing_protein	AF-Q869S5-F1-model_v4	DESULFOASV1_2872_HDOD_domain-containing_protein	AF-Q869S5-F1-model_v4 Hybrid signal transduction protein dokA	0.105	456	364	287	742	694	1101	2.537E-04	87
DESULFOASV1_2872_HDOD_domain-containing_protein	AF-P40138-F1-model_v4	DESULFOASV1_2872_HDOD_domain-containing_protein	AF-P40138-F1-model_v4 Adenylate cyclase 2	0.123	195	147	661	829	122	316	4.093E-02	86
DESULFOASV1_2872_HDOD_domain-containing_protein	AF-Q7A5H7-F1-model_v4	DESULFOASV1_2872_HDOD_domain-containing_protein	AF-Q7A5H7-F1-model_v4 Sensor protein SrrB	0.090	547	428	297	767	37	583	5.937E-05	86
DESULFOASV1_2872_HDOD_domain-containing_protein	AF-C5MCK5-F1-model_v4	DESULFOASV1_2872_HDOD_domain-containing_protein	AF-C5MCK5-F1-model_v4 Glucose starvation modulator protein 1	0.141	127	107	418	543	462	588	3.155E-01	86
DESULFOASV1_2872_HDOD_domain-containing_protein	AF-Q9VEU5-F1-model_v4	DESULFOASV1_2872_HDOD_domain-containing_protein	AF-Q9VEU5-F1-model_v4 Soluble guanylate cyclase 89Db	0.095	619	544	212	813	3	621	1.454E-05	86
DESULFOASV1_2872_HDOD_domain-containing_protein	AF-E1WAA4-F1-model_v4	DESULFOASV1_2872_HDOD_domain-containing_protein	AF-E1WAA4-F1-model_v4 Formate hydrogenlyase transcriptional activator	0.113	438	341	305	742	12	397	1.490E-03	86
DESULFOASV1_2872_HDOD_domain-containing_protein	AF-Q10029-F1-model_v4	DESULFOASV1_2872_HDOD_domain-containing_protein	AF-Q10029-F1-model_v4 Receptor-type guanylate cyclase gcy-2	0.116	176	133	662	813	828	1003	5.374E-02	86
DESULFOASV1_2872_HDOD_domain-containing_protein	AF-P9WMU8-F1-model_v4	DESULFOASV1_2872_HDOD_domain-containing_protein	AF-P9WMU8-F1-model_v4 pH-sensitive adenylate cyclase MT1302	0.163	153	126	660	811	171	323	8.461E-02	85
DESULFOASV1_2872_HDOD_domain-containing_protein	AF-P9WQ30-F1-model_v4	DESULFOASV1_2872_HDOD_domain-containing_protein	AF-P9WQ30-F1-model_v4 Uncharacterized protein MT1361	0.145	173	133	660	816	318	490	1.394E-01	85
DESULFOASV1_2872_HDOD_domain-containing_protein	AF-P33639-F1-model_v4	DESULFOASV1_2872_HDOD_domain-containing_protein	AF-P33639-F1-model_v4 Sensor protein kinase PilS	0.104	452	258	113	564	26	314	1.631E-03	84
DESULFOASV1_2872_HDOD_domain-containing_protein	AF-P58662-F1-model_v4	DESULFOASV1_2872_HDOD_domain-containing_protein	AF-P58662-F1-model_v4 Sensor histidine kinase RcsC	0.095	538	473	205	742	4	527	1.372E-06	84
DESULFOASV1_2872_HDOD_domain-containing_protein	AF-P18293-F1-model_v4	DESULFOASV1_2872_HDOD_domain-containing_protein	AF-P18293-F1-model_v4 Atrial natriuretic peptide receptor 1	0.211	141	106	662	796	831	971	4.093E-02	84
DESULFOASV1_2872_HDOD_domain-containing_protein	AF-P64266-F1-model_v4	DESULFOASV1_2872_HDOD_domain-containing_protein	AF-P64266-F1-model_v4 Uncharacterized protein Mb2235	0.170	168	127	662	829	174	327	2.403E-01	83
DESULFOASV1_2872_HDOD_domain-containing_protein	AF-P9WQ34-F1-model_v4	DESULFOASV1_2872_HDOD_domain-containing_protein	AF-P9WQ34-F1-model_v4 Adenylate cyclase	0.143	148	118	660	798	202	349	1.526E-01	83
DESULFOASV1_2872_HDOD_domain-containing_protein	AF-P19485-F1-model_v4	DESULFOASV1_2872_HDOD_domain-containing_protein	AF-P19485-F1-model_v4 Adenylate cyclase 1	0.102	542	478	297	829	74	615	4.951E-05	83
DESULFOASV1_2872_HDOD_domain-containing_protein	AF-P19687-F1-model_v4	DESULFOASV1_2872_HDOD_domain-containing_protein	AF-P19687-F1-model_v4 Guanylate cyclase soluble subunit alpha-1	0.103	406	282	484	798	175	580	2.537E-04	83
DESULFOASV1_2872_HDOD_domain-containing_protein	AF-Q9YC89-F1-model_v4	DESULFOASV1_2872_HDOD_domain-containing_protein	AF-Q9YC89-F1-model_v4 GTP cyclohydrolase III	0.138	192	160	638	829	52	238	4.093E-02	82
DESULFOASV1_2872_HDOD_domain-containing_protein	AF-P9WMU9-F1-model_v4	DESULFOASV1_2872_HDOD_domain-containing_protein	AF-P9WMU9-F1-model_v4 pH-sensitive adenylate cyclase Rv1264	0.163	153	126	660	811	171	323	1.111E-01	82
DESULFOASV1_2872_HDOD_domain-containing_protein	AF-A7TQK0-F1-model_v4	DESULFOASV1_2872_HDOD_domain-containing_protein	AF-A7TQK0-F1-model_v4 Glucose starvation modulator protein 1	0.128	136	99	546	659	336	471	2.754E-01	82
DESULFOASV1_2872_HDOD_domain-containing_protein	AF-Q6DNF7-F1-model_v4	DESULFOASV1_2872_HDOD_domain-containing_protein	AF-Q6DNF7-F1-model_v4 Soluble guanylate cyclase gcy-32	0.081	502	314	457	799	53	554	2.116E-04	82
DESULFOASV1_2872_HDOD_domain-containing_protein	AF-O02298-F1-model_v4	DESULFOASV1_2872_HDOD_domain-containing_protein	AF-O02298-F1-model_v4 Soluble guanylate cyclase gcy-35	0.111	469	301	457	796	53	521	2.907E-04	82
DESULFOASV1_2872_HDOD_domain-containing_protein	AF-Q07553-F1-model_v4	DESULFOASV1_2872_HDOD_domain-containing_protein	AF-Q07553-F1-model_v4 Guanylate cyclase 32E	0.150	195	138	662	824	831	1025	6.743E-02	82
DESULFOASV1_2872_HDOD_domain-containing_protein	AF-O25026-F1-model_v4	DESULFOASV1_2872_HDOD_domain-containing_protein	AF-O25026-F1-model_v4 Sensor histidine kinase FlgS	0.086	197	140	543	739	71	224	2.269E-02	81
DESULFOASV1_2872_HDOD_domain-containing_protein	AF-Q9VEU6-F1-model_v4	DESULFOASV1_2872_HDOD_domain-containing_protein	AF-Q9VEU6-F1-model_v4 Soluble guanylate cyclase 89Da	0.094	591	529	208	798	4	588	1.212E-05	81
DESULFOASV1_2872_HDOD_domain-containing_protein	AF-Q03003-F1-model_v4	DESULFOASV1_2872_HDOD_domain-containing_protein	AF-Q03003-F1-model_v4 Uncharacterized protein in P47K 3'region	0.137	180	147	405	575	54	233	2.754E-01	80
DESULFOASV1_2872_HDOD_domain-containing_protein	AF-Q9KLK7-F1-model_v4	DESULFOASV1_2872_HDOD_domain-containing_protein	AF-Q9KLK7-F1-model_v4 Autoinducer 2 sensor kinase/phosphatase LuxQ	0.130	417	303	329	745	199	547	9.781E-05	80
DESULFOASV1_2872_HDOD_domain-containing_protein	AF-Q2QYY8-F1-model_v4	DESULFOASV1_2872_HDOD_domain-containing_protein	AF-Q2QYY8-F1-model_v4 Phototropin-1A	0.079	545	306	430	762	126	670	1.786E-03	80
DESULFOASV1_2872_HDOD_domain-containing_protein	AF-Q9PT84-F1-model_v4	DESULFOASV1_2872_HDOD_domain-containing_protein	AF-Q9PT84-F1-model_v4 Potassium voltage-gated channel subfamily H member 6	0.121	136	102	557	673	11	146	3.302E-01	80
DESULFOASV1_2872_HDOD_domain-containing_protein	AF-Q26721-F1-model_v4	DESULFOASV1_2872_HDOD_domain-containing_protein	AF-Q26721-F1-model_v4 Receptor-type adenylate cyclase ESAG 4	0.136	171	111	701	829	894	1064	2.296E-01	80
DESULFOASV1_2872_HDOD_domain-containing_protein	AF-Q6BJW8-F1-model_v4	DESULFOASV1_2872_HDOD_domain-containing_protein	AF-Q6BJW8-F1-model_v4 Glucose starvation modulator protein 1	0.085	140	113	418	542	394	533	3.015E-01	79
DESULFOASV1_2872_HDOD_domain-containing_protein	AF-Q9EPI9-F1-model_v4	DESULFOASV1_2872_HDOD_domain-containing_protein	AF-Q9EPI9-F1-model_v4 Potassium voltage-gated channel subfamily H member 5	0.144	172	121	559	700	15	186	2.631E-01	78
DESULFOASV1_2872_HDOD_domain-containing_protein	AF-P58402-F1-model_v4	DESULFOASV1_2872_HDOD_domain-containing_protein	AF-P58402-F1-model_v4 Sensor protein EvgS	0.095	424	263	362	785	470	761	9.042E-04	78
DESULFOASV1_2872_HDOD_domain-containing_protein	AF-Q55F68-F1-model_v4	DESULFOASV1_2872_HDOD_domain-containing_protein	AF-Q55F68-F1-model_v4 Adenylate cyclase, terminal-differentiation specific	0.126	203	163	642	829	1522	1724	8.854E-02	78
DESULFOASV1_2872_HDOD_domain-containing_protein	AF-P9WQ29-F1-model_v4	DESULFOASV1_2872_HDOD_domain-containing_protein	AF-P9WQ29-F1-model_v4 Uncharacterized protein Rv1320c	0.150	171	129	664	816	319	489	1.915E-01	77
DESULFOASV1_2872_HDOD_domain-containing_protein	AF-P16067-F1-model_v4	DESULFOASV1_2872_HDOD_domain-containing_protein	AF-P16067-F1-model_v4 Atrial natriuretic peptide receptor 2	0.200	173	121	662	813	820	992	6.444E-02	77
DESULFOASV1_2872_HDOD_domain-containing_protein	AF-P16066-F1-model_v4	DESULFOASV1_2872_HDOD_domain-containing_protein	AF-P16066-F1-model_v4 Atrial natriuretic peptide receptor 1	0.190	143	110	662	798	835	977	7.384E-02	77
DESULFOASV1_2872_HDOD_domain-containing_protein	AF-X5M8U1-F1-model_v4	DESULFOASV1_2872_HDOD_domain-containing_protein	AF-X5M8U1-F1-model_v4 Receptor-type guanylate cyclase gcy-17	0.134	177	131	662	813	837	1013	8.854E-02	77
DESULFOASV1_2872_HDOD_domain-containing_protein	AF-O62179-F1-model_v4	DESULFOASV1_2872_HDOD_domain-containing_protein	AF-O62179-F1-model_v4 Receptor-type guanylate cyclase gcy-20	0.142	185	130	662	813	823	1007	7.056E-02	77
DESULFOASV1_2872_HDOD_domain-containing_protein	AF-Q2NB77-F1-model_v4	DESULFOASV1_2872_HDOD_domain-containing_protein	AF-Q2NB77-F1-model_v4 Blue-light-activated histidine kinase 2	0.122	221	176	564	784	13	214	2.847E-02	76
DESULFOASV1_2872_HDOD_domain-containing_protein	AF-P9WMU7-F1-model_v4	DESULFOASV1_2872_HDOD_domain-containing_protein	AF-P9WMU7-F1-model_v4 Uncharacterized protein Rv2212	0.171	154	121	662	815	174	320	3.783E-01	76
DESULFOASV1_2872_HDOD_domain-containing_protein	AF-B8PBQ6-F1-model_v4	DESULFOASV1_2872_HDOD_domain-containing_protein	AF-B8PBQ6-F1-model_v4 Transcription activator of gluconeogenesis ERT1	0.136	142	118	405	542	250	391	2.631E-01	76
DESULFOASV1_2872_HDOD_domain-containing_protein	AF-A8WPG9-F1-model_v4	DESULFOASV1_2872_HDOD_domain-containing_protein	AF-A8WPG9-F1-model_v4 Receptor-type guanylate cyclase gcy-4	0.122	179	134	660	813	848	1026	6.743E-02	76
DESULFOASV1_2872_HDOD_domain-containing_protein	AF-Q19187-F1-model_v4	DESULFOASV1_2872_HDOD_domain-containing_protein	AF-Q19187-F1-model_v4 Receptor-type guanylate cyclase gcy-12	0.155	180	130	660	814	981	1160	1.332E-01	76
DESULFOASV1_2872_HDOD_domain-containing_protein	AF-P9WMU6-F1-model_v4	DESULFOASV1_2872_HDOD_domain-containing_protein	AF-P9WMU6-F1-model_v4 Uncharacterized protein MT2268	0.174	154	121	662	815	174	320	2.754E-01	75
DESULFOASV1_2872_HDOD_domain-containing_protein	AF-Q2RBR1-F1-model_v4	DESULFOASV1_2872_HDOD_domain-containing_protein	AF-Q2RBR1-F1-model_v4 Phototropin-1B	0.075	545	307	430	762	126	670	1.631E-03	75
DESULFOASV1_2872_HDOD_domain-containing_protein	AF-Q54YH4-F1-model_v4	DESULFOASV1_2872_HDOD_domain-containing_protein	AF-Q54YH4-F1-model_v4 Hybrid signal transduction histidine kinase B	0.101	425	270	138	562	659	959	6.971E-03	75
DESULFOASV1_2872_HDOD_domain-containing_protein	AF-C4Y4V1-F1-model_v4	DESULFOASV1_2872_HDOD_domain-containing_protein	AF-C4Y4V1-F1-model_v4 Glucose starvation modulator protein 1	0.091	136	115	417	543	342	477	6.826E-01	74
DESULFOASV1_2872_HDOD_domain-containing_protein	AF-P9WLZ7-F1-model_v4	DESULFOASV1_2872_HDOD_domain-containing_protein	AF-P9WLZ7-F1-model_v4 Multidomain regulatory protein Rv1364c	0.094	414	322	430	785	15	428	4.848E-03	74
DESULFOASV1_2872_HDOD_domain-containing_protein	AF-Q07093-F1-model_v4	DESULFOASV1_2872_HDOD_domain-containing_protein	AF-Q07093-F1-model_v4 Head-specific guanylate cyclase	0.108	654	466	145	798	42	564	2.454E-03	74
DESULFOASV1_2872_HDOD_domain-containing_protein	AF-Q9H252-F1-model_v4	DESULFOASV1_2872_HDOD_domain-containing_protein	AF-Q9H252-F1-model_v4 Potassium voltage-gated channel subfamily H member 6	0.106	140	113	552	678	17	156	3.959E-01	74
DESULFOASV1_2872_HDOD_domain-containing_protein	AF-Q19768-F1-model_v4	DESULFOASV1_2872_HDOD_domain-containing_protein	AF-Q19768-F1-model_v4 Receptor-type guanylate cyclase gcy-13	0.139	177	130	662	813	799	975	5.623E-02	74
DESULFOASV1_2872_HDOD_domain-containing_protein	AF-O19179-F1-model_v4	DESULFOASV1_2872_HDOD_domain-containing_protein	AF-O19179-F1-model_v4 Retinal guanylyl cyclase 1	0.127	146	117	662	796	838	983	3.959E-01	74
DESULFOASV1_2872_HDOD_domain-containing_protein	AF-Q9HXE2-F1-model_v4	DESULFOASV1_2872_HDOD_domain-containing_protein	AF-Q9HXE2-F1-model_v4 Transcriptional regulator DauR	0.105	264	170	562	825	20	210	3.911E-02	73
DESULFOASV1_2872_HDOD_domain-containing_protein	AF-Q9XU42-F1-model_v4	DESULFOASV1_2872_HDOD_domain-containing_protein	AF-Q9XU42-F1-model_v4 Receptor-type guanylate cyclase gcy-27	0.110	146	121	660	796	492	637	1.273E-01	73
DESULFOASV1_2872_HDOD_domain-containing_protein	AF-P18910-F1-model_v4	DESULFOASV1_2872_HDOD_domain-containing_protein	AF-P18910-F1-model_v4 Atrial natriuretic peptide receptor 1	0.228	141	103	662	796	831	971	1.332E-01	73
DESULFOASV1_2872_HDOD_domain-containing_protein	AF-P40330-F1-model_v4	DESULFOASV1_2872_HDOD_domain-containing_protein	AF-P40330-F1-model_v4 Virulence sensor protein BvgS	0.123	395	287	390	784	485	812	2.943E-03	72
DESULFOASV1_2872_HDOD_domain-containing_protein	AF-O83208-F1-model_v4	DESULFOASV1_2872_HDOD_domain-containing_protein	AF-O83208-F1-model_v4 Uncharacterized protein TP_0178	0.109	270	224	545	796	19	288	1.002E-02	71
DESULFOASV1_2872_HDOD_domain-containing_protein	AF-Q86C56-F1-model_v4	DESULFOASV1_2872_HDOD_domain-containing_protein	AF-Q86C56-F1-model_v4 Soluble guanylate cyclase gcy-31	0.088	589	483	208	796	3	533	5.422E-05	71
DESULFOASV1_2872_HDOD_domain-containing_protein	AF-Q23681-F1-model_v4	DESULFOASV1_2872_HDOD_domain-containing_protein	AF-Q23681-F1-model_v4 Receptor-type guanylate cyclase gcy-4	0.119	176	133	662	813	847	1022	9.265E-02	71
DESULFOASV1_2872_HDOD_domain-containing_protein	AF-A8XQC7-F1-model_v4	DESULFOASV1_2872_HDOD_domain-containing_protein	AF-A8XQC7-F1-model_v4 Receptor-type guanylate cyclase gcy-19	0.123	179	134	660	813	870	1048	1.526E-01	71
DESULFOASV1_2872_HDOD_domain-containing_protein	AF-P25848-F1-model_v4	DESULFOASV1_2872_HDOD_domain-containing_protein	AF-P25848-F1-model_v4 Light-sensor Protein kinase	0.094	702	471	301	821	195	896	5.488E-04	71
DESULFOASV1_2872_HDOD_domain-containing_protein	AF-Q2NB98-F1-model_v4	DESULFOASV1_2872_HDOD_domain-containing_protein	AF-Q2NB98-F1-model_v4 Light-activated DNA-binding protein EL222	0.119	219	168	559	777	31	222	1.526E-01	70
DESULFOASV1_2872_HDOD_domain-containing_protein	AF-B0R9Z1-F1-model_v4	DESULFOASV1_2872_HDOD_domain-containing_protein	AF-B0R9Z1-F1-model_v4 Transducer protein Car	0.142	199	157	545	743	36	219	4.537E-01	70
DESULFOASV1_2872_HDOD_domain-containing_protein	AF-Q1KKS3-F1-model_v4	DESULFOASV1_2872_HDOD_domain-containing_protein	AF-Q1KKS3-F1-model_v4 Dual 3',5'-cyclic-AMP and -GMP phosphodiesterase 11A	0.106	428	265	269	565	109	536	3.572E-02	70
