query	target	qheader	theader	fident	alnlen	mismatch	qstart	qend	tstart	tend	evalue	bits
DESULFOASV1_2872_HDOD_domain-containing_protein	AF-O08785-F1-model_v4	DESULFOASV1_2872_HDOD_domain-containing_protein	AF-O08785-F1-model_v4 Circadian locomoter output cycles protein kaput	0.108	279	213	430	669	109	387	7.119E-05	130
DESULFOASV1_2872_HDOD_domain-containing_protein	AF-Q6G6S9-F1-model_v4	DESULFOASV1_2872_HDOD_domain-containing_protein	AF-Q6G6S9-F1-model_v4 Oxygen sensor histidine kinase NreB	0.120	227	164	559	785	12	198	1.135E-03	129
DESULFOASV1_2872_HDOD_domain-containing_protein	AF-Q5HJX6-F1-model_v4	DESULFOASV1_2872_HDOD_domain-containing_protein	AF-Q5HJX6-F1-model_v4 Sensor protein kinase WalK	0.076	451	364	293	743	38	432	2.837E-06	129
DESULFOASV1_2872_HDOD_domain-containing_protein	AF-P79832-F1-model_v4	DESULFOASV1_2872_HDOD_domain-containing_protein	AF-P79832-F1-model_v4 Aryl hydrocarbon receptor nuclear translocator	0.114	320	221	429	678	138	457	3.771E-05	129
DESULFOASV1_2872_HDOD_domain-containing_protein	AF-P81133-F1-model_v4	DESULFOASV1_2872_HDOD_domain-containing_protein	AF-P81133-F1-model_v4 Single-minded homolog 1	0.084	260	216	424	660	73	332	7.449E-05	129
DESULFOASV1_2872_HDOD_domain-containing_protein	AF-Q61079-F1-model_v4	DESULFOASV1_2872_HDOD_domain-containing_protein	AF-Q61079-F1-model_v4 Single-minded homolog 2	0.089	283	225	424	671	73	355	4.129E-05	128
DESULFOASV1_2872_HDOD_domain-containing_protein	AF-Q9HPU8-F1-model_v4	DESULFOASV1_2872_HDOD_domain-containing_protein	AF-Q9HPU8-F1-model_v4 Bacterioopsin transcriptional activator	0.124	458	336	426	810	154	611	1.011E-05	128
DESULFOASV1_2872_HDOD_domain-containing_protein	AF-Q9DG12-F1-model_v4	DESULFOASV1_2872_HDOD_domain-containing_protein	AF-Q9DG12-F1-model_v4 Aryl hydrocarbon receptor nuclear translocator 2	0.079	344	239	410	669	119	462	1.159E-05	128
DESULFOASV1_2872_HDOD_domain-containing_protein	AF-Q8IUM7-F1-model_v4	DESULFOASV1_2872_HDOD_domain-containing_protein	AF-Q8IUM7-F1-model_v4 Neuronal PAS domain-containing protein 4	0.077	259	222	434	674	76	334	2.116E-04	128
DESULFOASV1_2872_HDOD_domain-containing_protein	AF-Q40762-F1-model_v4	DESULFOASV1_2872_HDOD_domain-containing_protein	AF-Q40762-F1-model_v4 Phytochrome	0.116	576	418	270	743	395	970	5.724E-08	128
DESULFOASV1_2872_HDOD_domain-containing_protein	AF-P10955-F1-model_v4	DESULFOASV1_2872_HDOD_domain-containing_protein	AF-P10955-F1-model_v4 Sensor protein FixL	0.132	237	172	545	743	124	360	2.655E-04	127
DESULFOASV1_2872_HDOD_domain-containing_protein	AF-Q881J7-F1-model_v4	DESULFOASV1_2872_HDOD_domain-containing_protein	AF-Q881J7-F1-model_v4 Blue-light-activated protein	0.099	229	168	557	785	21	208	9.462E-04	127
DESULFOASV1_2872_HDOD_domain-containing_protein	AF-Q6GD71-F1-model_v4	DESULFOASV1_2872_HDOD_domain-containing_protein	AF-Q6GD71-F1-model_v4 Sensor protein kinase WalK	0.083	451	361	293	743	38	432	3.402E-06	127
DESULFOASV1_2872_HDOD_domain-containing_protein	AF-O60658-F1-model_v4	DESULFOASV1_2872_HDOD_domain-containing_protein	AF-O60658-F1-model_v4 High affinity cAMP-specific and IBMX-insensitive 3',5'-cyclic phosphodiesterase 8A	0.147	119	96	547	659	207	325	2.072E-02	127
DESULFOASV1_2872_HDOD_domain-containing_protein	AF-E9Q4S1-F1-model_v4	DESULFOASV1_2872_HDOD_domain-containing_protein	AF-E9Q4S1-F1-model_v4 High affinity cAMP-specific and IBMX-insensitive 3',5'-cyclic phosphodiesterase 8B	0.109	126	102	553	668	244	369	4.482E-02	127
DESULFOASV1_2872_HDOD_domain-containing_protein	AF-Q9I4N4-F1-model_v4	DESULFOASV1_2872_HDOD_domain-containing_protein	AF-Q9I4N4-F1-model_v4 Sensor protein kinase FleS	0.165	243	144	543	785	58	231	6.501E-05	126
DESULFOASV1_2872_HDOD_domain-containing_protein	AF-Q9RC53-F1-model_v4	DESULFOASV1_2872_HDOD_domain-containing_protein	AF-Q9RC53-F1-model_v4 Sensor protein CitS	0.094	307	238	300	563	31	337	1.521E-05	126
DESULFOASV1_2872_HDOD_domain-containing_protein	AF-B9LRB1-F1-model_v4	DESULFOASV1_2872_HDOD_domain-containing_protein	AF-B9LRB1-F1-model_v4 GTP cyclohydrolase III	0.129	194	156	652	831	58	251	3.864E-03	125
DESULFOASV1_2872_HDOD_domain-containing_protein	AF-Q5HLK5-F1-model_v4	DESULFOASV1_2872_HDOD_domain-containing_protein	AF-Q5HLK5-F1-model_v4 Oxygen sensor histidine kinase NreB	0.125	229	168	557	785	10	202	9.462E-04	125
DESULFOASV1_2872_HDOD_domain-containing_protein	AF-P37047-F1-model_v4	DESULFOASV1_2872_HDOD_domain-containing_protein	AF-P37047-F1-model_v4 Carbohydrate diacid regulator	0.090	265	239	566	829	21	285	4.374E-04	125
DESULFOASV1_2872_HDOD_domain-containing_protein	AF-Q6GKS6-F1-model_v4	DESULFOASV1_2872_HDOD_domain-containing_protein	AF-Q6GKS6-F1-model_v4 Sensor protein kinase WalK	0.076	451	364	293	743	38	432	5.118E-06	125
DESULFOASV1_2872_HDOD_domain-containing_protein	AF-Q9WVS9-F1-model_v4	DESULFOASV1_2872_HDOD_domain-containing_protein	AF-Q9WVS9-F1-model_v4 Circadian locomoter output cycles protein kaput	0.100	279	215	430	669	109	387	5.937E-05	125
DESULFOASV1_2872_HDOD_domain-containing_protein	AF-O95263-F1-model_v4	DESULFOASV1_2872_HDOD_domain-containing_protein	AF-O95263-F1-model_v4 High affinity cAMP-specific and IBMX-insensitive 3',5'-cyclic phosphodiesterase 8B	0.113	120	99	547	659	261	380	3.413E-02	125
DESULFOASV1_2872_HDOD_domain-containing_protein	AF-P14712-F1-model_v4	DESULFOASV1_2872_HDOD_domain-containing_protein	AF-P14712-F1-model_v4 Phytochrome A	0.096	572	468	270	788	383	954	2.560E-07	125
DESULFOASV1_2872_HDOD_domain-containing_protein	AF-A7X624-F1-model_v4	DESULFOASV1_2872_HDOD_domain-containing_protein	AF-A7X624-F1-model_v4 Oxygen sensor histidine kinase NreB	0.133	226	164	559	784	12	201	1.786E-03	124
DESULFOASV1_2872_HDOD_domain-containing_protein	AF-Q8CU87-F1-model_v4	DESULFOASV1_2872_HDOD_domain-containing_protein	AF-Q8CU87-F1-model_v4 Sensor protein kinase WalK	0.079	490	404	254	743	2	441	3.251E-06	124
DESULFOASV1_2872_HDOD_domain-containing_protein	AF-Q4A159-F1-model_v4	DESULFOASV1_2872_HDOD_domain-containing_protein	AF-Q4A159-F1-model_v4 Sensor protein kinase WalK	0.080	451	363	293	743	38	433	8.433E-06	124
DESULFOASV1_2872_HDOD_domain-containing_protein	AF-Q8BGD7-F1-model_v4	DESULFOASV1_2872_HDOD_domain-containing_protein	AF-Q8BGD7-F1-model_v4 Neuronal PAS domain-containing protein 4	0.084	261	220	434	674	76	336	2.317E-04	124
DESULFOASV1_2872_HDOD_domain-containing_protein	AF-Q8R4S6-F1-model_v4	DESULFOASV1_2872_HDOD_domain-containing_protein	AF-Q8R4S6-F1-model_v4 Aryl hydrocarbon receptor	0.105	284	218	429	673	110	393	3.331E-04	124
DESULFOASV1_2872_HDOD_domain-containing_protein	AF-Q5HDG4-F1-model_v4	DESULFOASV1_2872_HDOD_domain-containing_protein	AF-Q5HDG4-F1-model_v4 Oxygen sensor histidine kinase NreB	0.132	226	164	559	784	12	201	1.559E-03	123
DESULFOASV1_2872_HDOD_domain-containing_protein	AF-P28788-F1-model_v4	DESULFOASV1_2872_HDOD_domain-containing_protein	AF-P28788-F1-model_v4 Sensory histidine kinase/phosphatase NtrB	0.102	182	153	561	742	10	180	2.241E-03	123
DESULFOASV1_2872_HDOD_domain-containing_protein	AF-P35164-F1-model_v4	DESULFOASV1_2872_HDOD_domain-containing_protein	AF-P35164-F1-model_v4 Sensor histidine kinase ResE	0.124	362	294	406	742	60	421	7.701E-06	123
DESULFOASV1_2872_HDOD_domain-containing_protein	AF-Q2YUQ2-F1-model_v4	DESULFOASV1_2872_HDOD_domain-containing_protein	AF-Q2YUQ2-F1-model_v4 Sensor protein kinase WalK	0.080	490	396	254	743	2	432	3.402E-06	123
DESULFOASV1_2872_HDOD_domain-containing_protein	AF-Q2G2U4-F1-model_v4	DESULFOASV1_2872_HDOD_domain-containing_protein	AF-Q2G2U4-F1-model_v4 Sensor protein kinase WalK	0.080	451	362	293	743	38	432	5.865E-06	123
DESULFOASV1_2872_HDOD_domain-containing_protein	AF-O15516-F1-model_v4	DESULFOASV1_2872_HDOD_domain-containing_protein	AF-O15516-F1-model_v4 Circadian locomoter output cycles protein kaput	0.103	279	214	430	669	109	387	1.024E-04	123
DESULFOASV1_2872_HDOD_domain-containing_protein	AF-Q8QGQ6-F1-model_v4	DESULFOASV1_2872_HDOD_domain-containing_protein	AF-Q8QGQ6-F1-model_v4 Circadian locomoter output cycles protein kaput	0.100	280	219	426	669	108	387	7.795E-05	123
DESULFOASV1_2872_HDOD_domain-containing_protein	AF-Q48IV1-F1-model_v4	DESULFOASV1_2872_HDOD_domain-containing_protein	AF-Q48IV1-F1-model_v4 Blue-light-activated protein	0.114	230	167	556	785	20	208	1.360E-03	122
DESULFOASV1_2872_HDOD_domain-containing_protein	AF-O88502-F1-model_v4	DESULFOASV1_2872_HDOD_domain-containing_protein	AF-O88502-F1-model_v4 High affinity cAMP-specific and IBMX-insensitive 3',5'-cyclic phosphodiesterase 8A	0.144	119	96	547	659	203	321	3.413E-02	122
DESULFOASV1_2872_HDOD_domain-containing_protein	AF-Q8K3T3-F1-model_v4	DESULFOASV1_2872_HDOD_domain-containing_protein	AF-Q8K3T3-F1-model_v4 Period circadian protein homolog 1	0.131	296	221	405	659	166	461	2.506E-05	122
DESULFOASV1_2872_HDOD_domain-containing_protein	AF-Q4ZSY3-F1-model_v4	DESULFOASV1_2872_HDOD_domain-containing_protein	AF-Q4ZSY3-F1-model_v4 Blue-light-activated protein	0.129	224	159	562	785	26	208	9.901E-04	121
DESULFOASV1_2872_HDOD_domain-containing_protein	AF-A1YFY6-F1-model_v4	DESULFOASV1_2872_HDOD_domain-containing_protein	AF-A1YFY6-F1-model_v4 Single-minded homolog 1	0.088	260	215	424	660	73	332	1.846E-04	121
DESULFOASV1_2872_HDOD_domain-containing_protein	AF-Q57609-F1-model_v4	DESULFOASV1_2872_HDOD_domain-containing_protein	AF-Q57609-F1-model_v4 GTP cyclohydrolase III	0.159	201	161	638	829	47	247	2.943E-03	120
DESULFOASV1_2872_HDOD_domain-containing_protein	AF-P96601-F1-model_v4	DESULFOASV1_2872_HDOD_domain-containing_protein	AF-P96601-F1-model_v4 Probable C4-dicarboxylate sensor kinase	0.118	314	255	274	563	18	331	3.291E-05	120
DESULFOASV1_2872_HDOD_domain-containing_protein	AF-A0A0H2XCS3-F1-model_v4	DESULFOASV1_2872_HDOD_domain-containing_protein	AF-A0A0H2XCS3-F1-model_v4 Bacteriophytochrome	0.099	504	320	304	659	129	632	9.781E-05	120
DESULFOASV1_2872_HDOD_domain-containing_protein	AF-P51392-F1-model_v4	DESULFOASV1_2872_HDOD_domain-containing_protein	AF-P51392-F1-model_v4 Uncharacterized sensor-like histidine kinase ycf26	0.093	400	300	420	751	93	492	1.521E-05	120
DESULFOASV1_2872_HDOD_domain-containing_protein	AF-Q91YB0-F1-model_v4	DESULFOASV1_2872_HDOD_domain-containing_protein	AF-Q91YB0-F1-model_v4 Circadian locomoter output cycles protein kaput	0.103	279	214	430	669	109	387	8.157E-05	120
DESULFOASV1_2872_HDOD_domain-containing_protein	AF-Q9HBZ2-F1-model_v4	DESULFOASV1_2872_HDOD_domain-containing_protein	AF-Q9HBZ2-F1-model_v4 Aryl hydrocarbon receptor nuclear translocator 2	0.082	395	352	288	671	55	449	1.666E-05	119
DESULFOASV1_2872_HDOD_domain-containing_protein	AF-O31522-F1-model_v4	DESULFOASV1_2872_HDOD_domain-containing_protein	AF-O31522-F1-model_v4 HTH-type transcriptional regulator YesS	0.105	577	444	253	829	34	530	6.947E-07	119
DESULFOASV1_2872_HDOD_domain-containing_protein	AF-Q95LD9-F1-model_v4	DESULFOASV1_2872_HDOD_domain-containing_protein	AF-Q95LD9-F1-model_v4 Aryl hydrocarbon receptor	0.104	294	223	424	673	105	398	2.317E-04	119
DESULFOASV1_2872_HDOD_domain-containing_protein	AF-Q53226-F1-model_v4	DESULFOASV1_2872_HDOD_domain-containing_protein	AF-Q53226-F1-model_v4 Photoactive yellow protein	0.163	117	93	427	543	13	124	2.269E-02	118
DESULFOASV1_2872_HDOD_domain-containing_protein	AF-A6US18-F1-model_v4	DESULFOASV1_2872_HDOD_domain-containing_protein	AF-A6US18-F1-model_v4 GTP cyclohydrolase III	0.144	192	152	652	829	56	247	8.358E-03	118
DESULFOASV1_2872_HDOD_domain-containing_protein	AF-Q5RAK8-F1-model_v4	DESULFOASV1_2872_HDOD_domain-containing_protein	AF-Q5RAK8-F1-model_v4 Circadian locomoter output cycles protein kaput	0.104	279	214	430	669	109	387	9.781E-05	118
DESULFOASV1_2872_HDOD_domain-containing_protein	AF-Q6YGZ4-F1-model_v4	DESULFOASV1_2872_HDOD_domain-containing_protein	AF-Q6YGZ4-F1-model_v4 Circadian locomoter output cycles protein kaput	0.095	280	220	426	669	108	387	6.803E-05	118
DESULFOASV1_2872_HDOD_domain-containing_protein	AF-P13949-F1-model_v4	DESULFOASV1_2872_HDOD_domain-containing_protein	AF-P13949-F1-model_v4 Protein TraJ	0.157	118	90	425	542	17	124	1.808E-02	117
DESULFOASV1_2872_HDOD_domain-containing_protein	AF-P35841-F1-model_v4	DESULFOASV1_2872_HDOD_domain-containing_protein	AF-P35841-F1-model_v4 Chemoreceptor protein A	0.106	360	279	431	743	71	430	5.673E-05	117
DESULFOASV1_2872_HDOD_domain-containing_protein	AF-P0A2D9-F1-model_v4	DESULFOASV1_2872_HDOD_domain-containing_protein	AF-P0A2D9-F1-model_v4 Sensory histidine kinase/phosphatase NtrB	0.127	182	148	561	742	10	180	3.222E-03	116
DESULFOASV1_2872_HDOD_domain-containing_protein	AF-P07604-F1-model_v4	DESULFOASV1_2872_HDOD_domain-containing_protein	AF-P07604-F1-model_v4 Transcriptional regulatory protein TyrR	0.135	224	189	482	705	11	229	5.245E-04	116
DESULFOASV1_2872_HDOD_domain-containing_protein	AF-Q61045-F1-model_v4	DESULFOASV1_2872_HDOD_domain-containing_protein	AF-Q61045-F1-model_v4 Single-minded homolog 1	0.081	260	217	424	660	73	332	3.994E-04	116
DESULFOASV1_2872_HDOD_domain-containing_protein	AF-Q8R4S5-F1-model_v4	DESULFOASV1_2872_HDOD_domain-containing_protein	AF-Q8R4S5-F1-model_v4 Aryl hydrocarbon receptor	0.112	283	216	429	672	110	392	3.042E-04	116
DESULFOASV1_2872_HDOD_domain-containing_protein	AF-P05837-F1-model_v4	DESULFOASV1_2872_HDOD_domain-containing_protein	AF-P05837-F1-model_v4 Protein TraJ	0.155	119	91	424	542	16	124	1.980E-02	115
DESULFOASV1_2872_HDOD_domain-containing_protein	AF-A9A6P4-F1-model_v4	DESULFOASV1_2872_HDOD_domain-containing_protein	AF-A9A6P4-F1-model_v4 GTP cyclohydrolase III	0.140	192	152	652	829	56	247	1.316E-02	115
DESULFOASV1_2872_HDOD_domain-containing_protein	AF-A0QR01-F1-model_v4	DESULFOASV1_2872_HDOD_domain-containing_protein	AF-A0QR01-F1-model_v4 Signal-transduction histidine kinase SenX3	0.135	156	125	405	560	7	151	1.808E-02	115
DESULFOASV1_2872_HDOD_domain-containing_protein	AF-P06626-F1-model_v4	DESULFOASV1_2872_HDOD_domain-containing_protein	AF-P06626-F1-model_v4 Protein TraJ	0.173	115	87	428	542	17	122	2.979E-02	114
DESULFOASV1_2872_HDOD_domain-containing_protein	AF-Q1M667-F1-model_v4	DESULFOASV1_2872_HDOD_domain-containing_protein	AF-Q1M667-F1-model_v4 Blue-light-activated histidine kinase	0.110	322	223	553	804	22	343	1.406E-04	114
DESULFOASV1_2872_HDOD_domain-containing_protein	AF-P43524-F1-model_v4	DESULFOASV1_2872_HDOD_domain-containing_protein	AF-P43524-F1-model_v4 Adenylate cyclase	0.121	390	248	547	829	74	463	4.129E-05	114
DESULFOASV1_2872_HDOD_domain-containing_protein	AF-Q9K997-F1-model_v4	DESULFOASV1_2872_HDOD_domain-containing_protein	AF-Q9K997-F1-model_v4 Probable C4-dicarboxylate sensor kinase	0.114	314	268	442	745	91	404	4.951E-05	114
DESULFOASV1_2872_HDOD_domain-containing_protein	AF-P0CL46-F1-model_v4	DESULFOASV1_2872_HDOD_domain-containing_protein	AF-P0CL46-F1-model_v4 Formate hydrogenlyase transcriptional activator	0.114	256	198	262	486	145	400	1.956E-03	114
DESULFOASV1_2872_HDOD_domain-containing_protein	AF-B6YWB8-F1-model_v4	DESULFOASV1_2872_HDOD_domain-containing_protein	AF-B6YWB8-F1-model_v4 CRISPR system single-strand-specific deoxyribonuclease Cas10/Csm1 (subtype III-A)	0.134	146	107	704	827	510	655	5.623E-02	114
DESULFOASV1_2872_HDOD_domain-containing_protein	AF-Q8R4S2-F1-model_v4	DESULFOASV1_2872_HDOD_domain-containing_protein	AF-Q8R4S2-F1-model_v4 Aryl hydrocarbon receptor	0.107	288	218	429	673	110	397	3.817E-04	114
DESULFOASV1_2872_HDOD_domain-containing_protein	AF-Q6M066-F1-model_v4	DESULFOASV1_2872_HDOD_domain-containing_protein	AF-Q6M066-F1-model_v4 GTP cyclohydrolase III	0.140	192	152	652	829	56	247	1.578E-02	113
DESULFOASV1_2872_HDOD_domain-containing_protein	AF-Q8CR97-F1-model_v4	DESULFOASV1_2872_HDOD_domain-containing_protein	AF-Q8CR97-F1-model_v4 Oxygen sensor histidine kinase NreB	0.136	229	166	557	785	10	202	1.135E-03	113
DESULFOASV1_2872_HDOD_domain-containing_protein	AF-A2T6X9-F1-model_v4	DESULFOASV1_2872_HDOD_domain-containing_protein	AF-A2T6X9-F1-model_v4 Single-minded homolog 1	0.077	260	218	424	660	73	332	5.012E-04	113
DESULFOASV1_2872_HDOD_domain-containing_protein	AF-P97460-F1-model_v4	DESULFOASV1_2872_HDOD_domain-containing_protein	AF-P97460-F1-model_v4 Neuronal PAS domain-containing protein 2	0.095	327	244	400	670	40	366	7.795E-05	113
DESULFOASV1_2872_HDOD_domain-containing_protein	AF-Q8ZU20-F1-model_v4	DESULFOASV1_2872_HDOD_domain-containing_protein	AF-Q8ZU20-F1-model_v4 GTP cyclohydrolase III	0.139	192	150	640	831	47	221	3.372E-03	112
DESULFOASV1_2872_HDOD_domain-containing_protein	AF-A6VJ40-F1-model_v4	DESULFOASV1_2872_HDOD_domain-containing_protein	AF-A6VJ40-F1-model_v4 GTP cyclohydrolase III	0.144	192	152	652	829	56	247	1.728E-02	112
DESULFOASV1_2872_HDOD_domain-containing_protein	AF-P0A2E0-F1-model_v4	DESULFOASV1_2872_HDOD_domain-containing_protein	AF-P0A2E0-F1-model_v4 Sensory histidine kinase/phosphatase NtrB	0.127	191	162	561	751	10	196	2.568E-03	112
DESULFOASV1_2872_HDOD_domain-containing_protein	AF-O15945-F1-model_v4	DESULFOASV1_2872_HDOD_domain-containing_protein	AF-O15945-F1-model_v4 Aryl hydrocarbon receptor nuclear translocator homolog	0.080	304	215	429	663	86	389	5.743E-04	112
DESULFOASV1_2872_HDOD_domain-containing_protein	AF-P41739-F1-model_v4	DESULFOASV1_2872_HDOD_domain-containing_protein	AF-P41739-F1-model_v4 Aryl hydrocarbon receptor nuclear translocator	0.094	302	211	426	659	162	463	1.472E-04	112
DESULFOASV1_2872_HDOD_domain-containing_protein	AF-Q8R4S7-F1-model_v4	DESULFOASV1_2872_HDOD_domain-containing_protein	AF-Q8R4S7-F1-model_v4 Aryl hydrocarbon receptor	0.113	306	242	400	673	92	397	2.655E-04	112
DESULFOASV1_2872_HDOD_domain-containing_protein	AF-O05250-F1-model_v4	DESULFOASV1_2872_HDOD_domain-containing_protein	AF-O05250-F1-model_v4 Sensor histidine kinase MalK	0.159	287	214	309	563	58	344	5.422E-05	111
DESULFOASV1_2872_HDOD_domain-containing_protein	AF-P26762-F1-model_v4	DESULFOASV1_2872_HDOD_domain-containing_protein	AF-P26762-F1-model_v4 Virulence sensor protein BvgS	0.131	232	150	390	563	485	716	5.309E-03	111
DESULFOASV1_2872_HDOD_domain-containing_protein	AF-Q52969-F1-model_v4	DESULFOASV1_2872_HDOD_domain-containing_protein	AF-Q52969-F1-model_v4 Uncharacterized sensor-like histidine kinase R01002	0.144	208	158	560	745	104	311	5.555E-03	110
DESULFOASV1_2872_HDOD_domain-containing_protein	AF-Q99743-F1-model_v4	DESULFOASV1_2872_HDOD_domain-containing_protein	AF-Q99743-F1-model_v4 Neuronal PAS domain-containing protein 2	0.100	328	244	400	671	40	367	3.291E-05	110
DESULFOASV1_2872_HDOD_domain-containing_protein	AF-P41738-F1-model_v4	DESULFOASV1_2872_HDOD_domain-containing_protein	AF-P41738-F1-model_v4 Aryl hydrocarbon receptor	0.092	302	248	400	673	96	397	4.374E-04	110
DESULFOASV1_2872_HDOD_domain-containing_protein	AF-P94608-F1-model_v4	DESULFOASV1_2872_HDOD_domain-containing_protein	AF-P94608-F1-model_v4 Sensor protein KdpD	0.115	302	256	208	497	412	713	6.289E-04	110
DESULFOASV1_2872_HDOD_domain-containing_protein	AF-A4FZ97-F1-model_v4	DESULFOASV1_2872_HDOD_domain-containing_protein	AF-A4FZ97-F1-model_v4 GTP cyclohydrolase III	0.132	196	155	652	831	56	251	1.578E-02	109
DESULFOASV1_2872_HDOD_domain-containing_protein	AF-P19323-F1-model_v4	DESULFOASV1_2872_HDOD_domain-containing_protein	AF-P19323-F1-model_v4 Formate hydrogenlyase transcriptional activator FhlA	0.111	256	199	262	486	145	400	3.222E-03	109
DESULFOASV1_2872_HDOD_domain-containing_protein	AF-P19541-F1-model_v4	DESULFOASV1_2872_HDOD_domain-containing_protein	AF-P19541-F1-model_v4 Regulator of drug sensitivity 2	0.132	148	120	404	542	297	444	2.072E-02	108
DESULFOASV1_2872_HDOD_domain-containing_protein	AF-Q9ZIB7-F1-model_v4	DESULFOASV1_2872_HDOD_domain-containing_protein	AF-Q9ZIB7-F1-model_v4 Transcriptional regulatory protein TyrR	0.132	224	190	482	705	11	230	1.631E-03	108
DESULFOASV1_2872_HDOD_domain-containing_protein	AF-P0A2D8-F1-model_v4	DESULFOASV1_2872_HDOD_domain-containing_protein	AF-P0A2D8-F1-model_v4 Transcriptional regulatory protein TyrR	0.130	215	184	482	696	11	223	2.047E-03	107
DESULFOASV1_2872_HDOD_domain-containing_protein	AF-P0A2D7-F1-model_v4	DESULFOASV1_2872_HDOD_domain-containing_protein	AF-P0A2D7-F1-model_v4 Transcriptional regulatory protein TyrR	0.136	224	188	482	705	11	229	1.300E-03	107
DESULFOASV1_2872_HDOD_domain-containing_protein	AF-Q1XD95-F1-model_v4	DESULFOASV1_2872_HDOD_domain-containing_protein	AF-Q1XD95-F1-model_v4 Uncharacterized sensor-like histidine kinase ycf26	0.085	384	293	422	742	92	475	1.227E-04	107
DESULFOASV1_2872_HDOD_domain-containing_protein	AF-Q54SP4-F1-model_v4	DESULFOASV1_2872_HDOD_domain-containing_protein	AF-Q54SP4-F1-model_v4 Hybrid signal transduction histidine kinase D	0.144	218	173	541	743	44	261	5.073E-03	107
DESULFOASV1_2872_HDOD_domain-containing_protein	AF-P06218-F1-model_v4	DESULFOASV1_2872_HDOD_domain-containing_protein	AF-P06218-F1-model_v4 Sensory histidine kinase/phosphatase NtrB	0.117	191	164	561	751	10	196	3.372E-03	106
DESULFOASV1_2872_HDOD_domain-containing_protein	AF-P9WGK4-F1-model_v4	DESULFOASV1_2872_HDOD_domain-containing_protein	AF-P9WGK4-F1-model_v4 Sensor-like histidine kinase senX3	0.150	156	118	405	560	23	162	4.093E-02	106
DESULFOASV1_2872_HDOD_domain-containing_protein	AF-Q78E60-F1-model_v4	DESULFOASV1_2872_HDOD_domain-containing_protein	AF-Q78E60-F1-model_v4 Aryl hydrocarbon receptor nuclear translocator 2	0.090	395	349	288	671	55	449	1.592E-05	106
DESULFOASV1_2872_HDOD_domain-containing_protein	AF-Q5ZQU2-F1-model_v4	DESULFOASV1_2872_HDOD_domain-containing_protein	AF-Q5ZQU2-F1-model_v4 Neuronal PAS domain-containing protein 2	0.098	325	244	400	671	40	364	8.157E-05	106
DESULFOASV1_2872_HDOD_domain-containing_protein	AF-Q1ECW2-F1-model_v4	DESULFOASV1_2872_HDOD_domain-containing_protein	AF-Q1ECW2-F1-model_v4 Neuronal PAS domain-containing protein 4A	0.093	283	241	436	702	82	364	1.932E-04	106
DESULFOASV1_2872_HDOD_domain-containing_protein	AF-O07014-F1-model_v4	DESULFOASV1_2872_HDOD_domain-containing_protein	AF-O07014-F1-model_v4 Phosphoserine phosphatase RsbP	0.125	283	207	562	798	3	285	9.462E-04	105
DESULFOASV1_2872_HDOD_domain-containing_protein	AF-P52687-F1-model_v4	DESULFOASV1_2872_HDOD_domain-containing_protein	AF-P52687-F1-model_v4 Sensor histidine kinase CitA	0.133	324	277	424	743	82	405	9.347E-05	105
DESULFOASV1_2872_HDOD_domain-containing_protein	AF-Q8R4S4-F1-model_v4	DESULFOASV1_2872_HDOD_domain-containing_protein	AF-Q8R4S4-F1-model_v4 Aryl hydrocarbon receptor	0.108	288	222	424	673	110	397	5.743E-04	105
DESULFOASV1_2872_HDOD_domain-containing_protein	AF-O61735-F1-model_v4	DESULFOASV1_2872_HDOD_domain-containing_protein	AF-O61735-F1-model_v4 Circadian locomoter output cycles protein kaput	0.079	328	241	409	671	51	378	6.886E-04	105
DESULFOASV1_2872_HDOD_domain-containing_protein	AF-A3MV81-F1-model_v4	DESULFOASV1_2872_HDOD_domain-containing_protein	AF-A3MV81-F1-model_v4 GTP cyclohydrolase III	0.123	190	153	642	831	47	221	3.262E-02	104
DESULFOASV1_2872_HDOD_domain-containing_protein	AF-Q2NEH8-F1-model_v4	DESULFOASV1_2872_HDOD_domain-containing_protein	AF-Q2NEH8-F1-model_v4 GTP cyclohydrolase III	0.107	202	171	638	829	47	248	1.892E-02	104
DESULFOASV1_2872_HDOD_domain-containing_protein	AF-P0A601-F1-model_v4	DESULFOASV1_2872_HDOD_domain-containing_protein	AF-P0A601-F1-model_v4 Sensor-like histidine kinase SenX3	0.139	156	131	405	560	10	162	2.600E-02	104
DESULFOASV1_2872_HDOD_domain-containing_protein	AF-O02748-F1-model_v4	DESULFOASV1_2872_HDOD_domain-containing_protein	AF-O02748-F1-model_v4 Aryl hydrocarbon receptor nuclear translocator	0.088	339	230	410	662	130	468	1.284E-04	104
DESULFOASV1_2872_HDOD_domain-containing_protein	AF-Q15788-F1-model_v4	DESULFOASV1_2872_HDOD_domain-containing_protein	AF-Q15788-F1-model_v4 Nuclear receptor coactivator 1	0.100	260	212	426	661	110	369	4.577E-04	104
DESULFOASV1_2872_HDOD_domain-containing_protein	AF-P9WGK5-F1-model_v4	DESULFOASV1_2872_HDOD_domain-containing_protein	AF-P9WGK5-F1-model_v4 Sensor-like histidine kinase SenX3	0.133	156	132	405	560	10	162	2.847E-02	103
DESULFOASV1_2872_HDOD_domain-containing_protein	AF-O54426-F1-model_v4	DESULFOASV1_2872_HDOD_domain-containing_protein	AF-O54426-F1-model_v4 Transcriptional regulatory protein TyrR	0.141	224	187	482	705	11	229	1.631E-03	103
DESULFOASV1_2872_HDOD_domain-containing_protein	AF-Q46802-F1-model_v4	DESULFOASV1_2872_HDOD_domain-containing_protein	AF-Q46802-F1-model_v4 Putative uric acid sigma-54-dependent transcriptional regulator UacR	0.138	237	198	424	654	12	248	1.932E-04	103
DESULFOASV1_2872_HDOD_domain-containing_protein	AF-Q61324-F1-model_v4	DESULFOASV1_2872_HDOD_domain-containing_protein	AF-Q61324-F1-model_v4 Aryl hydrocarbon receptor nuclear translocator 2	0.084	395	351	288	671	55	449	1.269E-05	103
DESULFOASV1_2872_HDOD_domain-containing_protein	AF-E5KK10-F1-model_v4	DESULFOASV1_2872_HDOD_domain-containing_protein	AF-E5KK10-F1-model_v4 Methanogenesis regulatory histidine kinase FilI	0.112	652	491	269	822	2	653	1.573E-06	103
DESULFOASV1_2872_HDOD_domain-containing_protein	AF-P30855-F1-model_v4	DESULFOASV1_2872_HDOD_domain-containing_protein	AF-P30855-F1-model_v4 Sensor protein EvgS	0.121	241	178	362	564	470	710	9.901E-04	103
DESULFOASV1_2872_HDOD_domain-containing_protein	AF-P20169-F1-model_v4	DESULFOASV1_2872_HDOD_domain-containing_protein	AF-P20169-F1-model_v4 Drug sensory protein A	0.112	499	424	245	743	7	484	2.187E-05	102
DESULFOASV1_2872_HDOD_domain-containing_protein	AF-Q9BE97-F1-model_v4	DESULFOASV1_2872_HDOD_domain-containing_protein	AF-Q9BE97-F1-model_v4 Aryl hydrocarbon receptor nuclear translocator	0.088	341	231	409	662	128	468	8.932E-05	102
DESULFOASV1_2872_HDOD_domain-containing_protein	AF-A4WKJ7-F1-model_v4	DESULFOASV1_2872_HDOD_domain-containing_protein	AF-A4WKJ7-F1-model_v4 GTP cyclohydrolase III	0.136	192	150	640	831	47	221	7.987E-03	101
DESULFOASV1_2872_HDOD_domain-containing_protein	AF-P54883-F1-model_v4	DESULFOASV1_2872_HDOD_domain-containing_protein	AF-P54883-F1-model_v4 Sensor-like histidine kinase SenX3	0.147	156	122	405	560	19	162	5.623E-02	101
DESULFOASV1_2872_HDOD_domain-containing_protein	AF-P77510-F1-model_v4	DESULFOASV1_2872_HDOD_domain-containing_protein	AF-P77510-F1-model_v4 Sensor histidine kinase DpiB	0.111	323	285	422	743	80	402	1.173E-04	101
