query	target	qheader	theader	fident	alnlen	mismatch	qstart	qend	tstart	tend	evalue	bits
DESULFOASV1_0780_YitT_family_protein	AF-B7N9N7-F1-model_v4	DESULFOASV1_0780_YitT_family_protein	AF-B7N9N7-F1-model_v4 UPF0250 protein YbeD	0.125	72	59	220	287	16	87	5.230E-01	79
DESULFOASV1_0780_YitT_family_protein	AF-Q0T6P1-F1-model_v4	DESULFOASV1_0780_YitT_family_protein	AF-Q0T6P1-F1-model_v4 UPF0250 protein YbeD	0.125	72	59	220	287	16	87	5.479E-01	79
DESULFOASV1_0780_YitT_family_protein	AF-A8AJH3-F1-model_v4	DESULFOASV1_0780_YitT_family_protein	AF-A8AJH3-F1-model_v4 UPF0250 protein CKO_02527	0.111	72	60	220	287	16	87	5.479E-01	79
DESULFOASV1_0780_YitT_family_protein	AF-A7ZJ19-F1-model_v4	DESULFOASV1_0780_YitT_family_protein	AF-A7ZJ19-F1-model_v4 UPF0250 protein YbeD	0.125	72	59	220	287	16	87	5.230E-01	79
DESULFOASV1_0780_YitT_family_protein	AF-B6I140-F1-model_v4	DESULFOASV1_0780_YitT_family_protein	AF-B6I140-F1-model_v4 UPF0250 protein YbeD	0.125	72	59	220	287	16	87	5.479E-01	79
DESULFOASV1_0780_YitT_family_protein	AF-B7MRR8-F1-model_v4	DESULFOASV1_0780_YitT_family_protein	AF-B7MRR8-F1-model_v4 UPF0250 protein YbeD	0.125	72	59	220	287	16	87	5.230E-01	79
DESULFOASV1_0780_YitT_family_protein	AF-A6WRL0-F1-model_v4	DESULFOASV1_0780_YitT_family_protein	AF-A6WRL0-F1-model_v4 UPF0250 protein Shew185_3322	0.108	74	60	218	285	15	88	6.014E-01	79
DESULFOASV1_0780_YitT_family_protein	AF-Q7MN15-F1-model_v4	DESULFOASV1_0780_YitT_family_protein	AF-Q7MN15-F1-model_v4 UPF0250 protein VV0902	0.139	74	62	219	291	19	92	3.775E-01	79
DESULFOASV1_0780_YitT_family_protein	AF-Q8DFD3-F1-model_v4	DESULFOASV1_0780_YitT_family_protein	AF-Q8DFD3-F1-model_v4 UPF0250 protein VV1_0282	0.139	74	62	219	291	19	92	3.775E-01	79
DESULFOASV1_0780_YitT_family_protein	AF-P0CW48-F1-model_v4	DESULFOASV1_0780_YitT_family_protein	AF-P0CW48-F1-model_v4 Uncharacterized protein in radB 5'region	0.077	102	73	218	297	2	103	2.724E-01	79
DESULFOASV1_0780_YitT_family_protein	AF-B5RLI9-F1-model_v4	DESULFOASV1_0780_YitT_family_protein	AF-B5RLI9-F1-model_v4 30S ribosomal protein S6	0.097	130	97	217	324	3	132	4.861E-02	79
DESULFOASV1_0780_YitT_family_protein	AF-B7J148-F1-model_v4	DESULFOASV1_0780_YitT_family_protein	AF-B7J148-F1-model_v4 30S ribosomal protein S6	0.084	95	71	217	294	3	97	7.056E-02	79
DESULFOASV1_0780_YitT_family_protein	AF-O51142-F1-model_v4	DESULFOASV1_0780_YitT_family_protein	AF-O51142-F1-model_v4 30S ribosomal protein S6	0.073	95	71	217	294	3	97	7.056E-02	79
DESULFOASV1_0780_YitT_family_protein	AF-P16331-F1-model_v4	DESULFOASV1_0780_YitT_family_protein	AF-P16331-F1-model_v4 Phenylalanine-4-hydroxylase	0.102	77	66	217	290	32	108	1.487E-01	79
DESULFOASV1_0780_YitT_family_protein	AF-B9KD01-F1-model_v4	DESULFOASV1_0780_YitT_family_protein	AF-B9KD01-F1-model_v4 Elongation factor 4	0.150	75	62	217	291	401	474	4.992E-01	79
DESULFOASV1_0780_YitT_family_protein	AF-Q9Z8I4-F1-model_v4	DESULFOASV1_0780_YitT_family_protein	AF-Q9Z8I4-F1-model_v4 Elongation factor 4	0.128	75	64	217	291	407	480	7.246E-01	79
DESULFOASV1_0780_YitT_family_protein	AF-Q2JDK2-F1-model_v4	DESULFOASV1_0780_YitT_family_protein	AF-Q2JDK2-F1-model_v4 Elongation factor 4	0.151	75	62	217	291	437	510	6.014E-01	79
DESULFOASV1_0780_YitT_family_protein	AF-Q13TG7-F1-model_v4	DESULFOASV1_0780_YitT_family_protein	AF-Q13TG7-F1-model_v4 Elongation factor G 2	0.109	98	83	194	291	588	681	1.710E-01	79
DESULFOASV1_0780_YitT_family_protein	AF-A9B746-F1-model_v4	DESULFOASV1_0780_YitT_family_protein	AF-A9B746-F1-model_v4 Elongation factor G	0.130	94	81	198	291	589	682	3.955E-01	79
DESULFOASV1_0780_YitT_family_protein	AF-Q6MJ13-F1-model_v4	DESULFOASV1_0780_YitT_family_protein	AF-Q6MJ13-F1-model_v4 Elongation factor G 1	0.063	104	91	201	298	585	688	1.558E-01	79
DESULFOASV1_0780_YitT_family_protein	AF-A1A8Q6-F1-model_v4	DESULFOASV1_0780_YitT_family_protein	AF-A1A8Q6-F1-model_v4 UPF0250 protein YbeD	0.120	75	62	217	287	13	87	5.479E-01	78
DESULFOASV1_0780_YitT_family_protein	AF-Q7N765-F1-model_v4	DESULFOASV1_0780_YitT_family_protein	AF-Q7N765-F1-model_v4 UPF0250 protein plu1293	0.097	72	61	220	287	16	87	4.548E-01	78
DESULFOASV1_0780_YitT_family_protein	AF-B8E4W6-F1-model_v4	DESULFOASV1_0780_YitT_family_protein	AF-B8E4W6-F1-model_v4 UPF0250 protein Sbal223_1087	0.132	68	55	218	281	15	82	6.602E-01	78
DESULFOASV1_0780_YitT_family_protein	AF-Q4V7D6-F1-model_v4	DESULFOASV1_0780_YitT_family_protein	AF-Q4V7D6-F1-model_v4 NIF3-like protein 1	0.152	83	64	215	291	162	244	9.776E-02	78
DESULFOASV1_0780_YitT_family_protein	AF-Q0RP81-F1-model_v4	DESULFOASV1_0780_YitT_family_protein	AF-Q0RP81-F1-model_v4 Elongation factor 4	0.151	75	62	217	291	412	485	6.301E-01	78
DESULFOASV1_0780_YitT_family_protein	AF-A4S3R2-F1-model_v4	DESULFOASV1_0780_YitT_family_protein	AF-A4S3R2-F1-model_v4 Translation factor GUF1 homolog, mitochondrial	0.139	75	63	217	291	454	527	6.014E-01	78
DESULFOASV1_0780_YitT_family_protein	AF-C4Y8M4-F1-model_v4	DESULFOASV1_0780_YitT_family_protein	AF-C4Y8M4-F1-model_v4 Translation factor GUF1, mitochondrial	0.144	74	61	217	290	469	540	7.246E-01	78
DESULFOASV1_0780_YitT_family_protein	AF-Q38BU9-F1-model_v4	DESULFOASV1_0780_YitT_family_protein	AF-Q38BU9-F1-model_v4 Translation factor GUF1 homolog, mitochondrial	0.100	76	67	217	291	568	643	1.155E+00	78
DESULFOASV1_0780_YitT_family_protein	AF-P0A8J6-F1-model_v4	DESULFOASV1_0780_YitT_family_protein	AF-P0A8J6-F1-model_v4 UPF0250 protein YbeD	0.125	72	59	220	287	16	87	6.602E-01	77
DESULFOASV1_0780_YitT_family_protein	AF-A7ZXQ8-F1-model_v4	DESULFOASV1_0780_YitT_family_protein	AF-A7ZXQ8-F1-model_v4 UPF0250 protein YbeD	0.125	72	59	220	287	16	87	6.602E-01	77
DESULFOASV1_0780_YitT_family_protein	AF-Q5PMA0-F1-model_v4	DESULFOASV1_0780_YitT_family_protein	AF-Q5PMA0-F1-model_v4 UPF0250 protein YbeD	0.111	72	60	220	287	16	87	6.014E-01	77
DESULFOASV1_0780_YitT_family_protein	AF-Q1RET1-F1-model_v4	DESULFOASV1_0780_YitT_family_protein	AF-Q1RET1-F1-model_v4 UPF0250 protein YbeD	0.125	72	59	220	287	16	87	6.602E-01	77
DESULFOASV1_0780_YitT_family_protein	AF-B7NLZ0-F1-model_v4	DESULFOASV1_0780_YitT_family_protein	AF-B7NLZ0-F1-model_v4 UPF0250 protein YbeD	0.125	72	59	220	287	16	87	6.301E-01	77
DESULFOASV1_0780_YitT_family_protein	AF-B1KDX1-F1-model_v4	DESULFOASV1_0780_YitT_family_protein	AF-B1KDX1-F1-model_v4 UPF0250 protein Swoo_3713	0.121	74	59	218	285	15	88	6.301E-01	77
DESULFOASV1_0780_YitT_family_protein	AF-A3QH58-F1-model_v4	DESULFOASV1_0780_YitT_family_protein	AF-A3QH58-F1-model_v4 UPF0250 protein Shew_2940	0.125	72	57	220	285	17	88	5.479E-01	77
DESULFOASV1_0780_YitT_family_protein	AF-C6E503-F1-model_v4	DESULFOASV1_0780_YitT_family_protein	AF-C6E503-F1-model_v4 30S ribosomal protein S6	0.094	125	97	217	324	2	126	1.791E-01	77
DESULFOASV1_0780_YitT_family_protein	AF-B3PLU0-F1-model_v4	DESULFOASV1_0780_YitT_family_protein	AF-B3PLU0-F1-model_v4 Elongation factor 4	0.087	75	67	217	291	399	472	7.246E-01	77
DESULFOASV1_0780_YitT_family_protein	AF-Q1B684-F1-model_v4	DESULFOASV1_0780_YitT_family_protein	AF-Q1B684-F1-model_v4 Elongation factor 4	0.113	75	65	217	291	436	509	1.457E+00	77
DESULFOASV1_0780_YitT_family_protein	AF-Q2GD82-F1-model_v4	DESULFOASV1_0780_YitT_family_protein	AF-Q2GD82-F1-model_v4 Elongation factor G	0.120	103	85	201	298	577	679	2.990E-01	77
DESULFOASV1_0780_YitT_family_protein	AF-Q39DL2-F1-model_v4	DESULFOASV1_0780_YitT_family_protein	AF-Q39DL2-F1-model_v4 Elongation factor G 2	0.127	102	88	197	298	588	689	3.955E-01	77
DESULFOASV1_0780_YitT_family_protein	AF-Q3JV86-F1-model_v4	DESULFOASV1_0780_YitT_family_protein	AF-Q3JV86-F1-model_v4 Elongation factor G 1	0.112	105	90	194	298	588	689	3.133E-01	77
DESULFOASV1_0780_YitT_family_protein	AF-B2TU87-F1-model_v4	DESULFOASV1_0780_YitT_family_protein	AF-B2TU87-F1-model_v4 UPF0250 protein YbeD	0.120	75	62	217	287	13	87	6.602E-01	76
DESULFOASV1_0780_YitT_family_protein	AF-Q8EHQ4-F1-model_v4	DESULFOASV1_0780_YitT_family_protein	AF-Q8EHQ4-F1-model_v4 UPF0250 protein SO_1163	0.108	74	62	218	287	15	88	9.147E-01	76
DESULFOASV1_0780_YitT_family_protein	AF-A1S8T9-F1-model_v4	DESULFOASV1_0780_YitT_family_protein	AF-A1S8T9-F1-model_v4 UPF0250 protein Sama_2593	0.094	74	61	218	285	15	88	6.916E-01	76
DESULFOASV1_0780_YitT_family_protein	AF-A5F2Y2-F1-model_v4	DESULFOASV1_0780_YitT_family_protein	AF-A5F2Y2-F1-model_v4 UPF0250 protein VC0395_A0469/VC395_0960	0.131	74	60	218	287	19	92	3.955E-01	76
DESULFOASV1_0780_YitT_family_protein	AF-Q03432-F1-model_v4	DESULFOASV1_0780_YitT_family_protein	AF-Q03432-F1-model_v4 Formyltetrahydrofolate deformylase	0.051	76	69	218	291	3	78	3.603E-01	76
DESULFOASV1_0780_YitT_family_protein	AF-P75498-F1-model_v4	DESULFOASV1_0780_YitT_family_protein	AF-P75498-F1-model_v4 Elongation factor 4	0.076	75	67	217	291	402	475	7.954E-01	76
DESULFOASV1_0780_YitT_family_protein	AF-Q13UU8-F1-model_v4	DESULFOASV1_0780_YitT_family_protein	AF-Q13UU8-F1-model_v4 Elongation factor G 1	0.100	102	91	197	298	588	689	4.765E-01	76
DESULFOASV1_0780_YitT_family_protein	AF-A7MK40-F1-model_v4	DESULFOASV1_0780_YitT_family_protein	AF-A7MK40-F1-model_v4 UPF0250 protein ESA_02696	0.129	75	63	217	289	13	87	3.955E-01	75
DESULFOASV1_0780_YitT_family_protein	AF-A1RGT4-F1-model_v4	DESULFOASV1_0780_YitT_family_protein	AF-A1RGT4-F1-model_v4 UPF0250 protein Sputw3181_1029	0.094	74	61	218	285	15	88	8.333E-01	75
DESULFOASV1_0780_YitT_family_protein	AF-A4Y9G0-F1-model_v4	DESULFOASV1_0780_YitT_family_protein	AF-A4Y9G0-F1-model_v4 UPF0250 protein Sputcn32_2874	0.094	74	61	218	285	15	88	8.333E-01	75
DESULFOASV1_0780_YitT_family_protein	AF-B3PUT7-F1-model_v4	DESULFOASV1_0780_YitT_family_protein	AF-B3PUT7-F1-model_v4 30S ribosomal protein S6	0.094	134	96	218	324	2	135	1.487E-01	75
DESULFOASV1_0780_YitT_family_protein	AF-Q6BRU4-F1-model_v4	DESULFOASV1_0780_YitT_family_protein	AF-Q6BRU4-F1-model_v4 ATP phosphoribosyltransferase	0.106	99	82	196	294	210	302	2.261E-01	75
DESULFOASV1_0780_YitT_family_protein	AF-Q87RS1-F1-model_v4	DESULFOASV1_0780_YitT_family_protein	AF-Q87RS1-F1-model_v4 Methionine import ATP-binding protein MetN	0.168	79	62	217	291	265	343	2.482E-01	75
DESULFOASV1_0780_YitT_family_protein	AF-B1JGB5-F1-model_v4	DESULFOASV1_0780_YitT_family_protein	AF-B1JGB5-F1-model_v4 UPF0250 protein YPK_3025	0.155	72	60	220	291	16	87	3.775E-01	74
DESULFOASV1_0780_YitT_family_protein	AF-A7FKY7-F1-model_v4	DESULFOASV1_0780_YitT_family_protein	AF-A7FKY7-F1-model_v4 UPF0250 protein YpsIP31758_2953	0.155	72	60	220	291	16	87	3.439E-01	74
DESULFOASV1_0780_YitT_family_protein	AF-Q0HLK1-F1-model_v4	DESULFOASV1_0780_YitT_family_protein	AF-Q0HLK1-F1-model_v4 UPF0250 protein Shewmr4_0986	0.081	74	62	218	285	15	88	8.731E-01	74
DESULFOASV1_0780_YitT_family_protein	AF-Q0HXV5-F1-model_v4	DESULFOASV1_0780_YitT_family_protein	AF-Q0HXV5-F1-model_v4 UPF0250 protein Shewmr7_1051	0.081	74	62	218	285	15	88	8.731E-01	74
DESULFOASV1_0780_YitT_family_protein	AF-A3D7P7-F1-model_v4	DESULFOASV1_0780_YitT_family_protein	AF-A3D7P7-F1-model_v4 UPF0250 protein Sbal_3280	0.121	74	59	218	285	15	88	8.731E-01	74
DESULFOASV1_0780_YitT_family_protein	AF-Q86KZ5-F1-model_v4	DESULFOASV1_0780_YitT_family_protein	AF-Q86KZ5-F1-model_v4 Ribosome maturation protein SBDS	0.151	124	96	201	324	150	263	9.331E-02	74
DESULFOASV1_0780_YitT_family_protein	AF-B1ZUS4-F1-model_v4	DESULFOASV1_0780_YitT_family_protein	AF-B1ZUS4-F1-model_v4 Ribosomal protein L11 methyltransferase	0.112	76	65	218	291	2	77	5.479E-01	74
DESULFOASV1_0780_YitT_family_protein	AF-P09952-F1-model_v4	DESULFOASV1_0780_YitT_family_protein	AF-P09952-F1-model_v4 Elongation factor G	0.129	105	84	201	298	584	688	4.143E-01	74
DESULFOASV1_0780_YitT_family_protein	AF-O74945-F1-model_v4	DESULFOASV1_0780_YitT_family_protein	AF-O74945-F1-model_v4 Ribosome assembly protein 1	0.079	126	114	173	298	827	951	8.114E-02	74
DESULFOASV1_0780_YitT_family_protein	AF-Q8ZDG8-F1-model_v4	DESULFOASV1_0780_YitT_family_protein	AF-Q8ZDG8-F1-model_v4 UPF0250 protein YPO2600/y1174/YP_1113	0.155	72	60	220	291	16	87	4.341E-01	73
DESULFOASV1_0780_YitT_family_protein	AF-A9L012-F1-model_v4	DESULFOASV1_0780_YitT_family_protein	AF-A9L012-F1-model_v4 UPF0250 protein Sbal195_3458	0.121	74	59	218	285	15	88	9.583E-01	73
DESULFOASV1_0780_YitT_family_protein	AF-C3MQC7-F1-model_v4	DESULFOASV1_0780_YitT_family_protein	AF-C3MQC7-F1-model_v4 Putative nickel-responsive regulator	0.074	80	69	215	289	48	127	6.602E-01	73
DESULFOASV1_0780_YitT_family_protein	AF-B5EHW9-F1-model_v4	DESULFOASV1_0780_YitT_family_protein	AF-B5EHW9-F1-model_v4 30S ribosomal protein S6	0.085	120	98	217	324	2	121	2.600E-01	73
DESULFOASV1_0780_YitT_family_protein	AF-Q0SP49-F1-model_v4	DESULFOASV1_0780_YitT_family_protein	AF-Q0SP49-F1-model_v4 30S ribosomal protein S6	0.073	95	71	217	294	3	97	1.178E-01	73
DESULFOASV1_0780_YitT_family_protein	AF-Q57092-F1-model_v4	DESULFOASV1_0780_YitT_family_protein	AF-Q57092-F1-model_v4 Endolytic peptidoglycan transglycosylase RlpA	0.089	89	77	205	293	203	287	3.282E-01	73
DESULFOASV1_0780_YitT_family_protein	AF-Q7TU56-F1-model_v4	DESULFOASV1_0780_YitT_family_protein	AF-Q7TU56-F1-model_v4 Ribosomal protein L11 methyltransferase	0.079	85	69	216	291	3	87	9.583E-01	73
DESULFOASV1_0780_YitT_family_protein	AF-A2BY60-F1-model_v4	DESULFOASV1_0780_YitT_family_protein	AF-A2BY60-F1-model_v4 Ribosomal protein L11 methyltransferase	0.112	86	67	218	293	4	89	6.014E-01	73
DESULFOASV1_0780_YitT_family_protein	AF-Q88EI9-F1-model_v4	DESULFOASV1_0780_YitT_family_protein	AF-Q88EI9-F1-model_v4 Aspartate kinase	0.109	88	68	215	291	259	346	1.710E-01	73
DESULFOASV1_0780_YitT_family_protein	AF-Q7S0P6-F1-model_v4	DESULFOASV1_0780_YitT_family_protein	AF-Q7S0P6-F1-model_v4 Translation factor guf1, mitochondrial	0.101	75	66	217	291	525	598	7.592E-01	73
DESULFOASV1_0780_YitT_family_protein	AF-P66015-F1-model_v4	DESULFOASV1_0780_YitT_family_protein	AF-P66015-F1-model_v4 Probable GTP pyrophosphokinase	0.155	84	67	215	294	706	789	3.775E-01	73
DESULFOASV1_0780_YitT_family_protein	AF-Q32IU9-F1-model_v4	DESULFOASV1_0780_YitT_family_protein	AF-Q32IU9-F1-model_v4 UPF0250 protein YbeD	0.142	75	60	217	287	13	87	6.916E-01	72
DESULFOASV1_0780_YitT_family_protein	AF-B4SYJ4-F1-model_v4	DESULFOASV1_0780_YitT_family_protein	AF-B4SYJ4-F1-model_v4 UPF0250 protein YbeD	0.129	72	62	220	291	16	87	4.548E-01	72
DESULFOASV1_0780_YitT_family_protein	AF-A8GB11-F1-model_v4	DESULFOASV1_0780_YitT_family_protein	AF-A8GB11-F1-model_v4 UPF0250 protein Spro_1197	0.129	72	62	220	291	16	87	4.143E-01	72
DESULFOASV1_0780_YitT_family_protein	AF-A1JPR7-F1-model_v4	DESULFOASV1_0780_YitT_family_protein	AF-A1JPR7-F1-model_v4 UPF0250 protein YE3006	0.133	72	60	220	289	16	87	4.548E-01	72
DESULFOASV1_0780_YitT_family_protein	AF-B2K876-F1-model_v4	DESULFOASV1_0780_YitT_family_protein	AF-B2K876-F1-model_v4 UPF0250 protein YPTS_1150	0.151	74	62	218	291	14	87	4.548E-01	72
DESULFOASV1_0780_YitT_family_protein	AF-Q1CKR4-F1-model_v4	DESULFOASV1_0780_YitT_family_protein	AF-Q1CKR4-F1-model_v4 UPF0250 protein YPN_1085	0.155	72	60	220	291	16	87	4.341E-01	72
DESULFOASV1_0780_YitT_family_protein	AF-A0KTV6-F1-model_v4	DESULFOASV1_0780_YitT_family_protein	AF-A0KTV6-F1-model_v4 UPF0250 protein Shewana3_0990	0.081	74	62	218	285	15	88	1.004E+00	72
DESULFOASV1_0780_YitT_family_protein	AF-O29665-F1-model_v4	DESULFOASV1_0780_YitT_family_protein	AF-O29665-F1-model_v4 ATP phosphoribosyltransferase	0.178	125	95	200	324	162	277	3.133E-01	72
DESULFOASV1_0780_YitT_family_protein	AF-Q8XRM7-F1-model_v4	DESULFOASV1_0780_YitT_family_protein	AF-Q8XRM7-F1-model_v4 Elongation factor G 2	0.094	105	92	194	298	587	688	5.479E-01	72
DESULFOASV1_0780_YitT_family_protein	AF-B7L9H5-F1-model_v4	DESULFOASV1_0780_YitT_family_protein	AF-B7L9H5-F1-model_v4 UPF0250 protein YbeD	0.142	75	60	217	287	13	87	7.246E-01	71
DESULFOASV1_0780_YitT_family_protein	AF-A4TP07-F1-model_v4	DESULFOASV1_0780_YitT_family_protein	AF-A4TP07-F1-model_v4 UPF0250 protein YPDSF_2653	0.151	74	62	218	291	14	87	4.992E-01	71
DESULFOASV1_0780_YitT_family_protein	AF-B5YQI2-F1-model_v4	DESULFOASV1_0780_YitT_family_protein	AF-B5YQI2-F1-model_v4 UPF0250 protein YbeD	0.142	72	61	220	291	16	87	4.992E-01	71
DESULFOASV1_0780_YitT_family_protein	AF-B1IYH7-F1-model_v4	DESULFOASV1_0780_YitT_family_protein	AF-B1IYH7-F1-model_v4 UPF0250 protein YbeD	0.142	72	61	220	291	16	87	4.992E-01	71
DESULFOASV1_0780_YitT_family_protein	AF-Q2NUV6-F1-model_v4	DESULFOASV1_0780_YitT_family_protein	AF-Q2NUV6-F1-model_v4 UPF0250 protein SG0794	0.139	74	63	218	291	14	87	4.992E-01	71
DESULFOASV1_0780_YitT_family_protein	AF-Q66DF3-F1-model_v4	DESULFOASV1_0780_YitT_family_protein	AF-Q66DF3-F1-model_v4 UPF0250 protein YPTB1093	0.155	72	60	220	291	16	87	4.765E-01	71
DESULFOASV1_0780_YitT_family_protein	AF-B3PN60-F1-model_v4	DESULFOASV1_0780_YitT_family_protein	AF-B3PN60-F1-model_v4 30S ribosomal protein S6	0.139	117	91	218	324	2	118	3.439E-01	71
DESULFOASV1_0780_YitT_family_protein	AF-A3Q2A6-F1-model_v4	DESULFOASV1_0780_YitT_family_protein	AF-A3Q2A6-F1-model_v4 Elongation factor 4	0.113	75	65	217	291	436	509	2.116E+00	71
DESULFOASV1_0780_YitT_family_protein	AF-Q0V3J4-F1-model_v4	DESULFOASV1_0780_YitT_family_protein	AF-Q0V3J4-F1-model_v4 Translation factor GUF1, mitochondrial	0.112	75	65	217	291	466	539	1.457E+00	71
DESULFOASV1_0780_YitT_family_protein	AF-C8VPJ1-F1-model_v4	DESULFOASV1_0780_YitT_family_protein	AF-C8VPJ1-F1-model_v4 Translation factor guf1, mitochondrial	0.102	74	65	217	290	468	540	1.600E+00	71
DESULFOASV1_0780_YitT_family_protein	AF-C4JWU3-F1-model_v4	DESULFOASV1_0780_YitT_family_protein	AF-C4JWU3-F1-model_v4 Translation factor GUF1, mitochondrial	0.105	74	64	217	290	469	541	1.210E+00	71
DESULFOASV1_0780_YitT_family_protein	AF-Q0CS42-F1-model_v4	DESULFOASV1_0780_YitT_family_protein	AF-Q0CS42-F1-model_v4 Translation factor guf1, mitochondrial	0.103	75	65	217	291	471	544	1.102E+00	71
DESULFOASV1_0780_YitT_family_protein	AF-O94316-F1-model_v4	DESULFOASV1_0780_YitT_family_protein	AF-O94316-F1-model_v4 Pre-mRNA-splicing factor cwf10	0.105	100	78	204	291	822	921	3.603E-01	71
DESULFOASV1_0780_YitT_family_protein	AF-Q324R2-F1-model_v4	DESULFOASV1_0780_YitT_family_protein	AF-Q324R2-F1-model_v4 UPF0250 protein YbeD	0.137	75	64	217	291	13	87	5.230E-01	70
DESULFOASV1_0780_YitT_family_protein	AF-C6DBV8-F1-model_v4	DESULFOASV1_0780_YitT_family_protein	AF-C6DBV8-F1-model_v4 UPF0250 protein PC1_1177	0.151	74	61	219	291	14	87	4.143E-01	70
DESULFOASV1_0780_YitT_family_protein	AF-Q1C509-F1-model_v4	DESULFOASV1_0780_YitT_family_protein	AF-Q1C509-F1-model_v4 UPF0250 protein YPA_2499	0.155	72	60	220	291	16	87	5.479E-01	70
DESULFOASV1_0780_YitT_family_protein	AF-Q8TV90-F1-model_v4	DESULFOASV1_0780_YitT_family_protein	AF-Q8TV90-F1-model_v4 Putative nickel-responsive regulator	0.052	94	83	206	294	48	141	5.741E-01	70
DESULFOASV1_0780_YitT_family_protein	AF-Q98PV8-F1-model_v4	DESULFOASV1_0780_YitT_family_protein	AF-Q98PV8-F1-model_v4 30S ribosomal protein S6	0.066	120	98	219	324	2	121	2.482E-01	70
DESULFOASV1_0780_YitT_family_protein	AF-Q9KTJ5-F1-model_v4	DESULFOASV1_0780_YitT_family_protein	AF-Q9KTJ5-F1-model_v4 Methionine import ATP-binding protein MetN	0.144	79	63	217	291	265	343	3.955E-01	70
DESULFOASV1_0780_YitT_family_protein	AF-Q5NFU5-F1-model_v4	DESULFOASV1_0780_YitT_family_protein	AF-Q5NFU5-F1-model_v4 Methionine import ATP-binding protein MetN	0.100	78	67	217	291	268	345	4.992E-01	70
DESULFOASV1_0780_YitT_family_protein	AF-B6QW35-F1-model_v4	DESULFOASV1_0780_YitT_family_protein	AF-B6QW35-F1-model_v4 Translation factor guf1, mitochondrial	0.116	75	65	217	291	469	542	1.210E+00	70
DESULFOASV1_0780_YitT_family_protein	AF-P52560-F1-model_v4	DESULFOASV1_0780_YitT_family_protein	AF-P52560-F1-model_v4 GTP pyrophosphokinase	0.071	82	70	219	294	766	847	1.052E+00	70
DESULFOASV1_0780_YitT_family_protein	AF-B7M5F8-F1-model_v4	DESULFOASV1_0780_YitT_family_protein	AF-B7M5F8-F1-model_v4 UPF0250 protein YbeD	0.142	75	60	217	287	13	87	8.333E-01	69
DESULFOASV1_0780_YitT_family_protein	AF-B1LKM2-F1-model_v4	DESULFOASV1_0780_YitT_family_protein	AF-B1LKM2-F1-model_v4 UPF0250 protein YbeD	0.142	72	61	220	291	16	87	6.014E-01	69
DESULFOASV1_0780_YitT_family_protein	AF-Q3Z4G1-F1-model_v4	DESULFOASV1_0780_YitT_family_protein	AF-Q3Z4G1-F1-model_v4 UPF0250 protein YbeD	0.142	75	60	217	287	13	87	8.731E-01	69
DESULFOASV1_0780_YitT_family_protein	AF-C4ZWB8-F1-model_v4	DESULFOASV1_0780_YitT_family_protein	AF-C4ZWB8-F1-model_v4 UPF0250 protein YbeD	0.142	72	61	220	291	16	87	5.741E-01	69
DESULFOASV1_0780_YitT_family_protein	AF-B4TAI9-F1-model_v4	DESULFOASV1_0780_YitT_family_protein	AF-B4TAI9-F1-model_v4 UPF0250 protein YbeD	0.129	75	61	217	287	13	87	8.731E-01	69
DESULFOASV1_0780_YitT_family_protein	AF-P0A8J5-F1-model_v4	DESULFOASV1_0780_YitT_family_protein	AF-P0A8J5-F1-model_v4 UPF0250 protein YbeD	0.142	72	61	220	291	16	87	6.014E-01	69
DESULFOASV1_0780_YitT_family_protein	AF-A7MY91-F1-model_v4	DESULFOASV1_0780_YitT_family_protein	AF-A7MY91-F1-model_v4 UPF0250 protein VIBHAR_01213	0.129	72	62	220	291	21	92	4.548E-01	69
DESULFOASV1_0780_YitT_family_protein	AF-Q0BMC9-F1-model_v4	DESULFOASV1_0780_YitT_family_protein	AF-Q0BMC9-F1-model_v4 Methionine import ATP-binding protein MetN	0.113	78	66	217	291	268	345	3.282E-01	69
DESULFOASV1_0780_YitT_family_protein	AF-Q2A3Z2-F1-model_v4	DESULFOASV1_0780_YitT_family_protein	AF-Q2A3Z2-F1-model_v4 Methionine import ATP-binding protein MetN	0.100	78	67	217	291	268	345	5.741E-01	69
DESULFOASV1_0780_YitT_family_protein	AF-O74452-F1-model_v4	DESULFOASV1_0780_YitT_family_protein	AF-O74452-F1-model_v4 Cell wall integrity protein scw1	0.095	93	79	215	302	105	197	8.333E-01	69
DESULFOASV1_0780_YitT_family_protein	AF-A8QCE7-F1-model_v4	DESULFOASV1_0780_YitT_family_protein	AF-A8QCE7-F1-model_v4 Translation factor GUF1 homolog, mitochondrial	0.112	74	64	217	290	451	523	1.527E+00	69
DESULFOASV1_0780_YitT_family_protein	AF-A2QU25-F1-model_v4	DESULFOASV1_0780_YitT_family_protein	AF-A2QU25-F1-model_v4 Translation factor guf1, mitochondrial	0.103	75	65	217	291	472	545	1.328E+00	69
DESULFOASV1_0780_YitT_family_protein	AF-D1ZET3-F1-model_v4	DESULFOASV1_0780_YitT_family_protein	AF-D1ZET3-F1-model_v4 Translation factor GUF1, mitochondrial	0.101	75	66	217	291	496	569	1.328E+00	69
DESULFOASV1_0780_YitT_family_protein	AF-Q754C8-F1-model_v4	DESULFOASV1_0780_YitT_family_protein	AF-Q754C8-F1-model_v4 Elongation factor 2	0.074	105	85	201	293	702	806	2.854E-01	69
DESULFOASV1_0780_YitT_family_protein	AF-B2VBJ9-F1-model_v4	DESULFOASV1_0780_YitT_family_protein	AF-B2VBJ9-F1-model_v4 UPF0250 protein ETA_23570	0.121	72	59	220	287	16	87	9.583E-01	68
DESULFOASV1_0780_YitT_family_protein	AF-Q14H97-F1-model_v4	DESULFOASV1_0780_YitT_family_protein	AF-Q14H97-F1-model_v4 Methionine import ATP-binding protein MetN	0.113	78	66	217	291	268	345	3.955E-01	68
DESULFOASV1_0780_YitT_family_protein	AF-Q04DA7-F1-model_v4	DESULFOASV1_0780_YitT_family_protein	AF-Q04DA7-F1-model_v4 Methionine import ATP-binding protein MetN 2	0.061	75	69	217	291	277	350	2.158E-01	68
DESULFOASV1_0780_YitT_family_protein	AF-Q98DA2-F1-model_v4	DESULFOASV1_0780_YitT_family_protein	AF-Q98DA2-F1-model_v4 Methionine import ATP-binding protein MetN	0.096	77	68	215	290	281	357	5.479E-01	68
DESULFOASV1_0780_YitT_family_protein	AF-Q9S281-F1-model_v4	DESULFOASV1_0780_YitT_family_protein	AF-Q9S281-F1-model_v4 Phosphoserine phosphatase	0.164	81	61	217	290	9	89	6.301E-01	68
DESULFOASV1_0780_YitT_family_protein	AF-C6HPI9-F1-model_v4	DESULFOASV1_0780_YitT_family_protein	AF-C6HPI9-F1-model_v4 Translation factor GUF1, mitochondrial	0.103	74	65	217	290	463	535	1.840E+00	68
DESULFOASV1_0780_YitT_family_protein	AF-O51216-F1-model_v4	DESULFOASV1_0780_YitT_family_protein	AF-O51216-F1-model_v4 Guanosine-3',5'-bis(diphosphate) 3'-pyrophosphohydrolase	0.084	80	71	215	293	581	660	8.731E-01	68
DESULFOASV1_0780_YitT_family_protein	AF-B8D816-F1-model_v4	DESULFOASV1_0780_YitT_family_protein	AF-B8D816-F1-model_v4 UPF0250 protein BUAPTUC7_482	0.128	72	62	220	291	16	87	5.479E-01	67
DESULFOASV1_0780_YitT_family_protein	AF-Q6D7M6-F1-model_v4	DESULFOASV1_0780_YitT_family_protein	AF-Q6D7M6-F1-model_v4 UPF0250 protein ECA1299	0.151	74	61	219	291	14	87	5.479E-01	67
DESULFOASV1_0780_YitT_family_protein	AF-P0A8J4-F1-model_v4	DESULFOASV1_0780_YitT_family_protein	AF-P0A8J4-F1-model_v4 UPF0250 protein YbeD	0.142	72	61	220	291	16	87	7.246E-01	67
DESULFOASV1_0780_YitT_family_protein	AF-Q9CJR6-F1-model_v4	DESULFOASV1_0780_YitT_family_protein	AF-Q9CJR6-F1-model_v4 Endolytic peptidoglycan transglycosylase RlpA	0.179	75	60	217	291	219	292	9.147E-01	67
DESULFOASV1_0780_YitT_family_protein	AF-Q58091-F1-model_v4	DESULFOASV1_0780_YitT_family_protein	AF-Q58091-F1-model_v4 Uncharacterized protein MJ0678	0.118	93	77	218	310	2	89	4.765E-01	67
DESULFOASV1_0780_YitT_family_protein	AF-C0NZL9-F1-model_v4	DESULFOASV1_0780_YitT_family_protein	AF-C0NZL9-F1-model_v4 Translation factor GUF1, mitochondrial	0.103	74	65	217	290	463	535	2.019E+00	67
DESULFOASV1_0780_YitT_family_protein	AF-C1GGI6-F1-model_v4	DESULFOASV1_0780_YitT_family_protein	AF-C1GGI6-F1-model_v4 Translation factor GUF1, mitochondrial	0.103	74	65	217	290	464	536	2.116E+00	67
DESULFOASV1_0780_YitT_family_protein	AF-C5PCH4-F1-model_v4	DESULFOASV1_0780_YitT_family_protein	AF-C5PCH4-F1-model_v4 Translation factor GUF1, mitochondrial	0.105	74	64	217	290	469	541	1.391E+00	67
DESULFOASV1_0780_YitT_family_protein	AF-A1CLD7-F1-model_v4	DESULFOASV1_0780_YitT_family_protein	AF-A1CLD7-F1-model_v4 Translation factor guf1, mitochondrial	0.103	75	65	217	291	470	543	1.457E+00	67
DESULFOASV1_0780_YitT_family_protein	AF-O14460-F1-model_v4	DESULFOASV1_0780_YitT_family_protein	AF-O14460-F1-model_v4 Elongation factor 2	0.097	195	130	156	300	612	806	1.024E-01	67
DESULFOASV1_0780_YitT_family_protein	AF-B8D9R4-F1-model_v4	DESULFOASV1_0780_YitT_family_protein	AF-B8D9R4-F1-model_v4 UPF0250 protein BUAP5A_481	0.128	72	62	220	291	16	87	5.741E-01	66
DESULFOASV1_0780_YitT_family_protein	AF-Q0TK42-F1-model_v4	DESULFOASV1_0780_YitT_family_protein	AF-Q0TK42-F1-model_v4 UPF0250 protein YbeD	0.142	72	61	220	291	16	87	7.592E-01	66
