query	target	qheader	theader	fident	alnlen	mismatch	qstart	qend	tstart	tend	evalue	bits
DESULFOASV1_1751_OmpA_family_protein	AF-P0A138-F1-model_v4	DESULFOASV1_1751_OmpA_family_protein	AF-P0A138-F1-model_v4 Peptidoglycan-associated lipoprotein	0.431	102	57	254	355	64	165	2.011E-11	475
DESULFOASV1_1751_OmpA_family_protein	AF-Q9I4Z4-F1-model_v4	DESULFOASV1_1751_OmpA_family_protein	AF-Q9I4Z4-F1-model_v4 Peptidoglycan-associated lipoprotein	0.431	102	57	254	355	66	167	2.690E-11	470
DESULFOASV1_1751_OmpA_family_protein	AF-P22263-F1-model_v4	DESULFOASV1_1751_OmpA_family_protein	AF-P22263-F1-model_v4 Outer membrane porin F	0.418	110	62	248	354	228	337	1.419E-11	470
DESULFOASV1_1751_OmpA_family_protein	AF-P0A139-F1-model_v4	DESULFOASV1_1751_OmpA_family_protein	AF-P0A139-F1-model_v4 Peptidoglycan-associated lipoprotein	0.431	102	57	254	355	64	165	3.598E-11	466
DESULFOASV1_1751_OmpA_family_protein	AF-P0A912-F1-model_v4	DESULFOASV1_1751_OmpA_family_protein	AF-P0A912-F1-model_v4 Peptidoglycan-associated lipoprotein	0.413	104	60	254	356	70	173	8.611E-11	453
DESULFOASV1_1751_OmpA_family_protein	AF-P0A914-F1-model_v4	DESULFOASV1_1751_OmpA_family_protein	AF-P0A914-F1-model_v4 Peptidoglycan-associated lipoprotein	0.413	104	60	254	356	70	173	1.453E-10	444
DESULFOASV1_1751_OmpA_family_protein	AF-P0A913-F1-model_v4	DESULFOASV1_1751_OmpA_family_protein	AF-P0A913-F1-model_v4 Peptidoglycan-associated lipoprotein	0.413	104	60	254	356	70	173	2.061E-10	439
DESULFOASV1_1751_OmpA_family_protein	AF-Q05146-F1-model_v4	DESULFOASV1_1751_OmpA_family_protein	AF-Q05146-F1-model_v4 Outer membrane protein A	0.436	103	57	255	356	87	189	6.074E-11	426
DESULFOASV1_1751_OmpA_family_protein	AF-P0A3S9-F1-model_v4	DESULFOASV1_1751_OmpA_family_protein	AF-P0A3S9-F1-model_v4 Peptidoglycan-associated lipoprotein	0.342	105	68	254	357	60	164	8.323E-10	424
DESULFOASV1_1751_OmpA_family_protein	AF-P10324-F1-model_v4	DESULFOASV1_1751_OmpA_family_protein	AF-P10324-F1-model_v4 Peptidoglycan-associated lipoprotein	0.413	104	60	254	356	50	153	4.389E-10	423
DESULFOASV1_1751_OmpA_family_protein	AF-P0A3S8-F1-model_v4	DESULFOASV1_1751_OmpA_family_protein	AF-P0A3S8-F1-model_v4 Peptidoglycan-associated lipoprotein	0.342	105	68	254	357	60	164	9.350E-10	422
DESULFOASV1_1751_OmpA_family_protein	AF-P26493-F1-model_v4	DESULFOASV1_1751_OmpA_family_protein	AF-P26493-F1-model_v4 Peptidoglycan-associated lipoprotein	0.333	105	69	254	357	69	173	3.686E-10	421
DESULFOASV1_1751_OmpA_family_protein	AF-Q98F85-F1-model_v4	DESULFOASV1_1751_OmpA_family_protein	AF-Q98F85-F1-model_v4 Peptidoglycan-associated lipoprotein	0.352	105	67	254	357	60	164	1.489E-09	414
DESULFOASV1_1751_OmpA_family_protein	AF-P0A3S7-F1-model_v4	DESULFOASV1_1751_OmpA_family_protein	AF-P0A3S7-F1-model_v4 Peptidoglycan-associated lipoprotein	0.342	105	68	254	357	60	164	1.673E-09	412
DESULFOASV1_1751_OmpA_family_protein	AF-P37726-F1-model_v4	DESULFOASV1_1751_OmpA_family_protein	AF-P37726-F1-model_v4 Outer membrane porin F	0.371	140	82	223	354	180	319	5.594E-12	411
DESULFOASV1_1751_OmpA_family_protein	AF-Q89AJ5-F1-model_v4	DESULFOASV1_1751_OmpA_family_protein	AF-Q89AJ5-F1-model_v4 Peptidoglycan-associated lipoprotein	0.342	105	68	254	357	69	173	1.050E-09	408
DESULFOASV1_1751_OmpA_family_protein	AF-Q926C3-F1-model_v4	DESULFOASV1_1751_OmpA_family_protein	AF-Q926C3-F1-model_v4 Peptidoglycan-associated lipoprotein	0.361	105	66	254	357	68	172	1.992E-09	408
DESULFOASV1_1751_OmpA_family_protein	AF-Q51886-F1-model_v4	DESULFOASV1_1751_OmpA_family_protein	AF-Q51886-F1-model_v4 Peptidoglycan-associated lipoprotein	0.394	104	62	254	356	47	150	1.673E-09	401
DESULFOASV1_1751_OmpA_family_protein	AF-Q8U9L5-F1-model_v4	DESULFOASV1_1751_OmpA_family_protein	AF-Q8U9L5-F1-model_v4 Peptidoglycan-associated lipoprotein	0.333	105	69	254	357	69	173	4.003E-09	396
DESULFOASV1_1751_OmpA_family_protein	AF-P13794-F1-model_v4	DESULFOASV1_1751_OmpA_family_protein	AF-P13794-F1-model_v4 Outer membrane porin F	0.345	162	86	223	354	182	343	3.513E-12	389
DESULFOASV1_1751_OmpA_family_protein	AF-P37665-F1-model_v4	DESULFOASV1_1751_OmpA_family_protein	AF-P37665-F1-model_v4 Probable lipoprotein YiaD	0.366	101	63	255	354	114	214	2.823E-09	372
DESULFOASV1_1751_OmpA_family_protein	AF-Q7NFT5-F1-model_v4	DESULFOASV1_1751_OmpA_family_protein	AF-Q7NFT5-F1-model_v4 Photosystem I P700 chlorophyll a apoprotein A2	0.363	110	65	255	357	756	865	3.172E-09	363
DESULFOASV1_1751_OmpA_family_protein	AF-P38369-F1-model_v4	DESULFOASV1_1751_OmpA_family_protein	AF-P38369-F1-model_v4 Outer membrane protein Tpn50	0.305	108	73	251	356	307	414	1.816E-08	351
DESULFOASV1_1751_OmpA_family_protein	AF-A3M8K2-F1-model_v4	DESULFOASV1_1751_OmpA_family_protein	AF-A3M8K2-F1-model_v4 Outer membrane protein Omp38	0.344	144	86	223	354	190	333	1.834E-10	347
DESULFOASV1_1751_OmpA_family_protein	AF-Q6RYW5-F1-model_v4	DESULFOASV1_1751_OmpA_family_protein	AF-Q6RYW5-F1-model_v4 Outer membrane protein Omp38	0.344	144	86	223	354	190	333	2.921E-10	342
DESULFOASV1_1751_OmpA_family_protein	AF-P84838-F1-model_v4	DESULFOASV1_1751_OmpA_family_protein	AF-P84838-F1-model_v4 Outer membrane protein	0.280	142	96	223	357	237	378	1.489E-09	325
DESULFOASV1_1751_OmpA_family_protein	AF-P28612-F1-model_v4	DESULFOASV1_1751_OmpA_family_protein	AF-P28612-F1-model_v4 Motility protein B	0.314	108	69	255	356	143	250	5.051E-09	322
DESULFOASV1_1751_OmpA_family_protein	AF-A0A160PAH3-F1-model_v4	DESULFOASV1_1751_OmpA_family_protein	AF-A0A160PAH3-F1-model_v4 Outer membrane protein Omp38	0.340	147	86	223	354	187	333	4.766E-09	304
DESULFOASV1_1751_OmpA_family_protein	AF-P46827-F1-model_v4	DESULFOASV1_1751_OmpA_family_protein	AF-P46827-F1-model_v4 Uncharacterized 24.6 kDa protein in ccpA 3'region	0.292	112	76	249	356	101	212	4.100E-08	303
DESULFOASV1_1751_OmpA_family_protein	AF-P02935-F1-model_v4	DESULFOASV1_1751_OmpA_family_protein	AF-P02935-F1-model_v4 Outer membrane protein A	0.326	146	88	223	354	192	337	8.323E-10	303
DESULFOASV1_1751_OmpA_family_protein	AF-Q8Z7S0-F1-model_v4	DESULFOASV1_1751_OmpA_family_protein	AF-Q8Z7S0-F1-model_v4 Outer membrane protein A	0.313	152	92	223	357	191	342	8.821E-10	298
DESULFOASV1_1751_OmpA_family_protein	AF-P07021-F1-model_v4	DESULFOASV1_1751_OmpA_family_protein	AF-P07021-F1-model_v4 Putative lipoprotein YfiB	0.290	109	75	249	354	47	155	4.606E-08	296
DESULFOASV1_1751_OmpA_family_protein	AF-P0A911-F1-model_v4	DESULFOASV1_1751_OmpA_family_protein	AF-P0A911-F1-model_v4 Outer membrane protein A	0.328	146	88	223	354	187	332	1.578E-09	296
DESULFOASV1_1751_OmpA_family_protein	AF-B7LNW7-F1-model_v4	DESULFOASV1_1751_OmpA_family_protein	AF-B7LNW7-F1-model_v4 Outer membrane protein A	0.326	146	88	223	354	192	337	1.489E-09	296
DESULFOASV1_1751_OmpA_family_protein	AF-P02936-F1-model_v4	DESULFOASV1_1751_OmpA_family_protein	AF-P02936-F1-model_v4 Outer membrane protein A	0.313	152	92	223	357	191	342	9.910E-10	294
DESULFOASV1_1751_OmpA_family_protein	AF-P0C8Z2-F1-model_v4	DESULFOASV1_1751_OmpA_family_protein	AF-P0C8Z2-F1-model_v4 Outer membrane protein A	0.315	148	89	224	354	91	238	4.931E-10	293
DESULFOASV1_1751_OmpA_family_protein	AF-A4T9I4-F1-model_v4	DESULFOASV1_1751_OmpA_family_protein	AF-A4T9I4-F1-model_v4 UPF0353 protein Mflv_3659	0.161	218	168	29	229	88	305	1.944E-10	293
DESULFOASV1_1751_OmpA_family_protein	AF-P24016-F1-model_v4	DESULFOASV1_1751_OmpA_family_protein	AF-P24016-F1-model_v4 Outer membrane protein A	0.308	148	90	224	354	86	233	1.050E-09	292
DESULFOASV1_1751_OmpA_family_protein	AF-Q9S3R8-F1-model_v4	DESULFOASV1_1751_OmpA_family_protein	AF-Q9S3R8-F1-model_v4 Outer membrane protein 40	0.228	152	106	206	357	242	379	5.674E-09	292
DESULFOASV1_1751_OmpA_family_protein	AF-Q9S3R9-F1-model_v4	DESULFOASV1_1751_OmpA_family_protein	AF-Q9S3R9-F1-model_v4 Outer membrane protein 41	0.258	152	105	206	357	249	391	7.161E-09	292
DESULFOASV1_1751_OmpA_family_protein	AF-P0A910-F1-model_v4	DESULFOASV1_1751_OmpA_family_protein	AF-P0A910-F1-model_v4 Outer membrane protein A	0.326	146	88	223	354	187	332	1.992E-09	291
DESULFOASV1_1751_OmpA_family_protein	AF-P57414-F1-model_v4	DESULFOASV1_1751_OmpA_family_protein	AF-P57414-F1-model_v4 Outer membrane protein A	0.236	147	101	223	355	197	343	4.496E-09	290
DESULFOASV1_1751_OmpA_family_protein	AF-Q5YU15-F1-model_v4	DESULFOASV1_1751_OmpA_family_protein	AF-Q5YU15-F1-model_v4 UPF0353 protein NFA_34780	0.183	225	162	29	227	80	304	5.539E-10	289
DESULFOASV1_1751_OmpA_family_protein	AF-O07887-F1-model_v4	DESULFOASV1_1751_OmpA_family_protein	AF-O07887-F1-model_v4 Motility protein B	0.303	110	70	255	356	123	232	7.775E-08	288
DESULFOASV1_1751_OmpA_family_protein	AF-P0DJO6-F1-model_v4	DESULFOASV1_1751_OmpA_family_protein	AF-P0DJO6-F1-model_v4 Outer membrane protein A	0.315	148	89	224	354	89	236	1.992E-09	288
DESULFOASV1_1751_OmpA_family_protein	AF-P24017-F1-model_v4	DESULFOASV1_1751_OmpA_family_protein	AF-P24017-F1-model_v4 Outer membrane protein A	0.307	152	93	223	357	185	336	1.773E-09	288
DESULFOASV1_1751_OmpA_family_protein	AF-P24754-F1-model_v4	DESULFOASV1_1751_OmpA_family_protein	AF-P24754-F1-model_v4 Outer membrane protein A	0.300	149	91	224	354	90	238	6.595E-10	287
DESULFOASV1_1751_OmpA_family_protein	AF-P09146-F1-model_v4	DESULFOASV1_1751_OmpA_family_protein	AF-P09146-F1-model_v4 Outer membrane protein A	0.313	152	92	223	357	191	342	1.578E-09	285
DESULFOASV1_1751_OmpA_family_protein	AF-Q9CBL9-F1-model_v4	DESULFOASV1_1751_OmpA_family_protein	AF-Q9CBL9-F1-model_v4 UPF0353 protein ML1808	0.173	218	165	29	229	88	305	2.061E-10	284
DESULFOASV1_1751_OmpA_family_protein	AF-I2BAK7-F1-model_v4	DESULFOASV1_1751_OmpA_family_protein	AF-I2BAK7-F1-model_v4 Outer membrane protein A	0.321	146	89	223	354	196	341	5.674E-09	284
DESULFOASV1_1751_OmpA_family_protein	AF-P70960-F1-model_v4	DESULFOASV1_1751_OmpA_family_protein	AF-P70960-F1-model_v4 Uncharacterized protein YwmC	0.179	199	162	21	219	21	218	6.595E-10	282
DESULFOASV1_1751_OmpA_family_protein	AF-P24755-F1-model_v4	DESULFOASV1_1751_OmpA_family_protein	AF-P24755-F1-model_v4 Outer membrane protein A	0.310	148	90	224	354	91	238	3.776E-09	282
DESULFOASV1_1751_OmpA_family_protein	AF-A1UFT9-F1-model_v4	DESULFOASV1_1751_OmpA_family_protein	AF-A1UFT9-F1-model_v4 UPF0353 protein Mkms_2500	0.165	218	167	29	229	88	305	5.226E-10	281
DESULFOASV1_1751_OmpA_family_protein	AF-P9WFJ6-F1-model_v4	DESULFOASV1_1751_OmpA_family_protein	AF-P9WFJ6-F1-model_v4 UPF0353 protein MT1528	0.173	218	165	29	229	88	305	2.921E-10	281
DESULFOASV1_1751_OmpA_family_protein	AF-P38368-F1-model_v4	DESULFOASV1_1751_OmpA_family_protein	AF-P38368-F1-model_v4 Outer membrane protein P5	0.272	131	84	239	354	217	347	1.439E-08	281
DESULFOASV1_1751_OmpA_family_protein	AF-P04845-F1-model_v4	DESULFOASV1_1751_OmpA_family_protein	AF-P04845-F1-model_v4 Outer membrane protein A	0.302	145	91	223	354	201	345	2.823E-09	280
DESULFOASV1_1751_OmpA_family_protein	AF-P56427-F1-model_v4	DESULFOASV1_1751_OmpA_family_protein	AF-P56427-F1-model_v4 Motility protein B	0.293	109	71	255	356	124	232	1.656E-07	279
DESULFOASV1_1751_OmpA_family_protein	AF-A0A160PB22-F1-model_v4	DESULFOASV1_1751_OmpA_family_protein	AF-A0A160PB22-F1-model_v4 Trimeric autotransporter adhesin- and peptidogylcan-associated protein A	0.226	113	79	254	356	152	264	4.452E-07	278
DESULFOASV1_1751_OmpA_family_protein	AF-P70961-F1-model_v4	DESULFOASV1_1751_OmpA_family_protein	AF-P70961-F1-model_v4 Uncharacterized protein YwmD	0.203	199	157	23	220	18	216	3.907E-10	276
DESULFOASV1_1751_OmpA_family_protein	AF-Q8ZG77-F1-model_v4	DESULFOASV1_1751_OmpA_family_protein	AF-Q8ZG77-F1-model_v4 Outer membrane protein A	0.269	151	98	223	357	195	345	1.992E-09	274
DESULFOASV1_1751_OmpA_family_protein	AF-P45996-F1-model_v4	DESULFOASV1_1751_OmpA_family_protein	AF-P45996-F1-model_v4 Outer membrane protein P5	0.276	129	82	241	354	225	353	3.444E-08	272
DESULFOASV1_1751_OmpA_family_protein	AF-P0A0V2-F1-model_v4	DESULFOASV1_1751_OmpA_family_protein	AF-P0A0V2-F1-model_v4 Outer membrane protein class 4	0.329	157	85	227	354	67	223	1.879E-09	271
DESULFOASV1_1751_OmpA_family_protein	AF-P0A0V3-F1-model_v4	DESULFOASV1_1751_OmpA_family_protein	AF-P0A0V3-F1-model_v4 Outer membrane protein class 4	0.335	157	84	227	354	67	223	1.578E-09	271
DESULFOASV1_1751_OmpA_family_protein	AF-A1T8Q8-F1-model_v4	DESULFOASV1_1751_OmpA_family_protein	AF-A1T8Q8-F1-model_v4 UPF0353 protein Mvan_2751	0.173	218	165	29	229	88	305	1.405E-09	271
DESULFOASV1_1751_OmpA_family_protein	AF-P38399-F1-model_v4	DESULFOASV1_1751_OmpA_family_protein	AF-P38399-F1-model_v4 Outer membrane protein A	0.276	158	97	223	357	188	345	3.776E-09	271
DESULFOASV1_1751_OmpA_family_protein	AF-P39064-F1-model_v4	DESULFOASV1_1751_OmpA_family_protein	AF-P39064-F1-model_v4 Uncharacterized protein YtxE	0.287	108	73	255	357	128	235	8.442E-07	270
DESULFOASV1_1751_OmpA_family_protein	AF-A3PZE9-F1-model_v4	DESULFOASV1_1751_OmpA_family_protein	AF-A3PZE9-F1-model_v4 UPF0353 protein Mjls_2492	0.170	218	166	29	229	88	305	1.673E-09	270
DESULFOASV1_1751_OmpA_family_protein	AF-B8ZS82-F1-model_v4	DESULFOASV1_1751_OmpA_family_protein	AF-B8ZS82-F1-model_v4 UPF0353 protein MLBr01808	0.182	218	164	29	229	88	305	1.731E-10	268
DESULFOASV1_1751_OmpA_family_protein	AF-P07050-F1-model_v4	DESULFOASV1_1751_OmpA_family_protein	AF-P07050-F1-model_v4 Outer membrane protein P.III	0.289	151	87	231	354	67	217	4.003E-09	267
DESULFOASV1_1751_OmpA_family_protein	AF-P43840-F1-model_v4	DESULFOASV1_1751_OmpA_family_protein	AF-P43840-F1-model_v4 Outer membrane protein P5	0.274	130	83	240	354	218	347	4.882E-08	267
DESULFOASV1_1751_OmpA_family_protein	AF-A0A2S4N3N0-F1-model_v4	DESULFOASV1_1751_OmpA_family_protein	AF-A0A2S4N3N0-F1-model_v4 Outer membrane protein A	0.301	150	94	223	357	191	340	5.051E-09	266
DESULFOASV1_1751_OmpA_family_protein	AF-Q740Y5-F1-model_v4	DESULFOASV1_1751_OmpA_family_protein	AF-Q740Y5-F1-model_v4 UPF0353 protein MAP_1207	0.161	218	168	29	229	88	305	1.489E-09	265
DESULFOASV1_1751_OmpA_family_protein	AF-Q9S3P9-F1-model_v4	DESULFOASV1_1751_OmpA_family_protein	AF-Q9S3P9-F1-model_v4 Sodium-type flagellar protein MotY	0.235	106	79	254	357	184	289	1.269E-06	264
DESULFOASV1_1751_OmpA_family_protein	AF-B2HPD3-F1-model_v4	DESULFOASV1_1751_OmpA_family_protein	AF-B2HPD3-F1-model_v4 UPF0353 protein MMAR_2288	0.169	218	166	29	229	88	305	1.773E-09	262
DESULFOASV1_1751_OmpA_family_protein	AF-P46233-F1-model_v4	DESULFOASV1_1751_OmpA_family_protein	AF-P46233-F1-model_v4 Sodium-type flagellar protein MotY	0.207	106	82	254	357	184	289	1.425E-06	258
DESULFOASV1_1751_OmpA_family_protein	AF-Q8K9L4-F1-model_v4	DESULFOASV1_1751_OmpA_family_protein	AF-Q8K9L4-F1-model_v4 Outer membrane protein A	0.230	152	102	222	354	191	342	5.485E-08	258
DESULFOASV1_1751_OmpA_family_protein	AF-Q1B971-F1-model_v4	DESULFOASV1_1751_OmpA_family_protein	AF-Q1B971-F1-model_v4 UPF0353 protein Mmcs_2455	0.170	218	166	29	229	88	305	6.990E-10	257
DESULFOASV1_1751_OmpA_family_protein	AF-C1ANC7-F1-model_v4	DESULFOASV1_1751_OmpA_family_protein	AF-C1ANC7-F1-model_v4 UPF0353 protein JTY_1518	0.169	218	166	29	229	88	305	6.756E-09	250
DESULFOASV1_1751_OmpA_family_protein	AF-Q73UD3-F1-model_v4	DESULFOASV1_1751_OmpA_family_protein	AF-Q73UD3-F1-model_v4 UPF0353 protein MAP_3435c	0.163	221	168	28	229	85	305	2.371E-09	246
DESULFOASV1_1751_OmpA_family_protein	AF-O00534-F1-model_v4	DESULFOASV1_1751_OmpA_family_protein	AF-O00534-F1-model_v4 von Willebrand factor A domain-containing protein 5A	0.166	186	153	33	217	274	459	5.175E-08	244
DESULFOASV1_1751_OmpA_family_protein	AF-P9WIU4-F1-model_v4	DESULFOASV1_1751_OmpA_family_protein	AF-P9WIU4-F1-model_v4 Peptidoglycan-binding protein ArfA	0.244	225	150	156	354	99	323	4.141E-10	231
DESULFOASV1_1751_OmpA_family_protein	AF-Q75WE7-F1-model_v4	DESULFOASV1_1751_OmpA_family_protein	AF-Q75WE7-F1-model_v4 von Willebrand factor A domain-containing protein 5A	0.176	168	136	35	202	277	442	9.812E-08	230
DESULFOASV1_1751_OmpA_family_protein	AF-Q9ZL29-F1-model_v4	DESULFOASV1_1751_OmpA_family_protein	AF-Q9ZL29-F1-model_v4 Motility protein B	0.218	165	101	227	356	68	232	6.921E-08	229
DESULFOASV1_1751_OmpA_family_protein	AF-P9WIU5-F1-model_v4	DESULFOASV1_1751_OmpA_family_protein	AF-P9WIU5-F1-model_v4 Peptidoglycan-binding protein ArfA	0.234	225	152	156	354	99	323	6.595E-10	228
DESULFOASV1_1751_OmpA_family_protein	AF-P65594-F1-model_v4	DESULFOASV1_1751_OmpA_family_protein	AF-P65594-F1-model_v4 Peptidoglycan-binding protein ArfA	0.239	225	151	156	354	99	323	1.405E-09	221
DESULFOASV1_1751_OmpA_family_protein	AF-Q73UD4-F1-model_v4	DESULFOASV1_1751_OmpA_family_protein	AF-Q73UD4-F1-model_v4 UPF0353 protein MAP_3434	0.179	267	183	4	227	32	298	6.921E-08	215
DESULFOASV1_1751_OmpA_family_protein	AF-Q8YDY8-F1-model_v4	DESULFOASV1_1751_OmpA_family_protein	AF-Q8YDY8-F1-model_v4 Type IV secretion system putative outer membrane lipoprotein BMEII0036	0.209	148	108	209	356	33	169	1.798E-06	214
DESULFOASV1_1751_OmpA_family_protein	AF-P0AF07-F1-model_v4	DESULFOASV1_1751_OmpA_family_protein	AF-P0AF07-F1-model_v4 Motility protein B	0.229	105	77	256	356	160	264	7.699E-06	213
DESULFOASV1_1751_OmpA_family_protein	AF-A1KH31-F1-model_v4	DESULFOASV1_1751_OmpA_family_protein	AF-A1KH31-F1-model_v4 Peptidoglycan-binding protein ArfA	0.231	232	162	143	354	92	323	1.773E-09	211
DESULFOASV1_1751_OmpA_family_protein	AF-Q99KC8-F1-model_v4	DESULFOASV1_1751_OmpA_family_protein	AF-Q99KC8-F1-model_v4 von Willebrand factor A domain-containing protein 5A	0.174	194	156	24	217	274	463	1.755E-07	210
DESULFOASV1_1751_OmpA_family_protein	AF-Q9RPX3-F1-model_v4	DESULFOASV1_1751_OmpA_family_protein	AF-Q9RPX3-F1-model_v4 Type IV secretion system putative outer membrane lipoprotein BRA0058/BS1330_II0058	0.202	148	109	209	356	33	169	3.035E-06	208
DESULFOASV1_1751_OmpA_family_protein	AF-D3GSC3-F1-model_v4	DESULFOASV1_1751_OmpA_family_protein	AF-D3GSC3-F1-model_v4 Putative flagellar export/assembly protein LafU	0.209	103	79	256	356	166	268	2.934E-05	207
DESULFOASV1_1751_OmpA_family_protein	AF-B8AMB8-F1-model_v4	DESULFOASV1_1751_OmpA_family_protein	AF-B8AMB8-F1-model_v4 Magnesium-chelatase subunit ChlD, chloroplastic	0.156	193	154	38	220	553	745	1.168E-07	206
DESULFOASV1_1751_OmpA_family_protein	AF-P0AF06-F1-model_v4	DESULFOASV1_1751_OmpA_family_protein	AF-P0AF06-F1-model_v4 Motility protein B	0.229	105	77	256	356	160	264	1.547E-05	205
DESULFOASV1_1751_OmpA_family_protein	AF-Q03478-F1-model_v4	DESULFOASV1_1751_OmpA_family_protein	AF-Q03478-F1-model_v4 Chemotaxis protein LafU	0.205	105	80	256	356	170	274	3.493E-05	203
DESULFOASV1_1751_OmpA_family_protein	AF-Q47154-F1-model_v4	DESULFOASV1_1751_OmpA_family_protein	AF-Q47154-F1-model_v4 Putative truncated flagellar export/assembly protein LafU	0.205	103	80	256	356	70	172	3.493E-05	202
DESULFOASV1_1751_OmpA_family_protein	AF-Q9ZVN9-F1-model_v4	DESULFOASV1_1751_OmpA_family_protein	AF-Q9ZVN9-F1-model_v4 General transcription factor IIH subunit 2	0.147	202	164	18	219	65	257	4.346E-08	202
DESULFOASV1_1751_OmpA_family_protein	AF-P55892-F1-model_v4	DESULFOASV1_1751_OmpA_family_protein	AF-P55892-F1-model_v4 Motility protein B	0.238	105	76	256	356	161	265	3.110E-05	200
DESULFOASV1_1751_OmpA_family_protein	AF-O61742-F1-model_v4	DESULFOASV1_1751_OmpA_family_protein	AF-O61742-F1-model_v4 26S proteasome non-ATPase regulatory subunit 4	0.117	169	146	37	202	4	172	6.101E-06	200
DESULFOASV1_1751_OmpA_family_protein	AF-P9WPR3-F1-model_v4	DESULFOASV1_1751_OmpA_family_protein	AF-P9WPR3-F1-model_v4 Uncharacterized protein Rv2850c	0.197	172	133	37	208	450	616	8.948E-07	200
DESULFOASV1_1751_OmpA_family_protein	AF-Q55G98-F1-model_v4	DESULFOASV1_1751_OmpA_family_protein	AF-Q55G98-F1-model_v4 von Willebrand factor A domain-containing protein DDB_G0267758	0.113	182	152	37	218	315	486	1.129E-06	200
DESULFOASV1_1751_OmpA_family_protein	AF-Q5EA76-F1-model_v4	DESULFOASV1_1751_OmpA_family_protein	AF-Q5EA76-F1-model_v4 Integrator complex subunit 14	0.153	200	153	38	219	2	201	2.405E-06	197
DESULFOASV1_1751_OmpA_family_protein	AF-Q7RX73-F1-model_v4	DESULFOASV1_1751_OmpA_family_protein	AF-Q7RX73-F1-model_v4 ATP-dependent DNA helicase II subunit 2	0.109	205	151	39	209	7	211	2.549E-06	197
DESULFOASV1_1751_OmpA_family_protein	AF-Q9ZGE6-F1-model_v4	DESULFOASV1_1751_OmpA_family_protein	AF-Q9ZGE6-F1-model_v4 Magnesium-chelatase 67 kDa subunit	0.199	191	146	38	220	475	665	4.201E-07	195
DESULFOASV1_1751_OmpA_family_protein	AF-Q2H6C5-F1-model_v4	DESULFOASV1_1751_OmpA_family_protein	AF-Q2H6C5-F1-model_v4 ATP-dependent DNA helicase II subunit 2	0.140	205	146	39	209	7	211	2.549E-06	195
DESULFOASV1_1751_OmpA_family_protein	AF-Q2YJ83-F1-model_v4	DESULFOASV1_1751_OmpA_family_protein	AF-Q2YJ83-F1-model_v4 Type IV secretion system putative outer membrane lipoprotein BAB2_0057	0.214	148	107	209	356	33	169	5.124E-06	193
DESULFOASV1_1751_OmpA_family_protein	AF-Q66H58-F1-model_v4	DESULFOASV1_1751_OmpA_family_protein	AF-Q66H58-F1-model_v4 Integrator complex subunit 14	0.149	200	154	38	219	2	201	2.864E-06	191
DESULFOASV1_1751_OmpA_family_protein	AF-P55034-F1-model_v4	DESULFOASV1_1751_OmpA_family_protein	AF-P55034-F1-model_v4 26S proteasome non-ATPase regulatory subunit 4 homolog	0.117	191	160	36	217	3	193	4.060E-06	190
DESULFOASV1_1751_OmpA_family_protein	AF-Q9HGM8-F1-model_v4	DESULFOASV1_1751_OmpA_family_protein	AF-Q9HGM8-F1-model_v4 ATP-dependent DNA helicase II subunit 2	0.084	205	158	37	210	5	209	3.217E-06	190
DESULFOASV1_1751_OmpA_family_protein	AF-O50313-F1-model_v4	DESULFOASV1_1751_OmpA_family_protein	AF-O50313-F1-model_v4 Magnesium-chelatase 67 kDa subunit	0.161	185	144	38	210	431	615	7.515E-07	188
DESULFOASV1_1751_OmpA_family_protein	AF-P05555-F1-model_v4	DESULFOASV1_1751_OmpA_family_protein	AF-P05555-F1-model_v4 Integrin alpha-M	0.146	198	167	25	222	137	332	1.798E-06	188
DESULFOASV1_1751_OmpA_family_protein	AF-Q5ZK21-F1-model_v4	DESULFOASV1_1751_OmpA_family_protein	AF-Q5ZK21-F1-model_v4 Integrator complex subunit 14	0.144	200	155	38	219	2	201	4.060E-06	187
DESULFOASV1_1751_OmpA_family_protein	AF-Q14CN2-F1-model_v4	DESULFOASV1_1751_OmpA_family_protein	AF-Q14CN2-F1-model_v4 Calcium-activated chloride channel regulator 4	0.185	155	119	39	193	307	453	2.020E-06	187
DESULFOASV1_1751_OmpA_family_protein	AF-Q5B4H8-F1-model_v4	DESULFOASV1_1751_OmpA_family_protein	AF-Q5B4H8-F1-model_v4 ATP-dependent DNA helicase II subunit 2	0.112	213	155	37	212	5	217	4.060E-06	186
DESULFOASV1_1751_OmpA_family_protein	AF-P0C536-F1-model_v4	DESULFOASV1_1751_OmpA_family_protein	AF-P0C536-F1-model_v4 Type IV secretion system putative outer membrane lipoprotein BruAb2_0058	0.214	148	107	209	356	33	169	1.091E-05	185
DESULFOASV1_1751_OmpA_family_protein	AF-A8XP79-F1-model_v4	DESULFOASV1_1751_OmpA_family_protein	AF-A8XP79-F1-model_v4 C-type lectin protein 160	0.140	202	168	26	221	271	472	1.798E-06	185
DESULFOASV1_1751_OmpA_family_protein	AF-Q2MHH2-F1-model_v4	DESULFOASV1_1751_OmpA_family_protein	AF-Q2MHH2-F1-model_v4 ATP-dependent DNA helicase II subunit 2	0.107	205	154	37	210	5	209	5.756E-06	185
DESULFOASV1_1751_OmpA_family_protein	AF-P34567-F1-model_v4	DESULFOASV1_1751_OmpA_family_protein	AF-P34567-F1-model_v4 General transcription factor IIH subunit 2	0.120	209	180	11	219	36	240	5.301E-07	183
DESULFOASV1_1751_OmpA_family_protein	AF-Q2MHH1-F1-model_v4	DESULFOASV1_1751_OmpA_family_protein	AF-Q2MHH1-F1-model_v4 ATP-dependent DNA helicase II subunit 2	0.117	208	160	29	210	2	209	4.060E-06	183
DESULFOASV1_1751_OmpA_family_protein	AF-Q864V9-F1-model_v4	DESULFOASV1_1751_OmpA_family_protein	AF-Q864V9-F1-model_v4 Complement factor B	0.173	198	148	38	217	270	467	1.129E-06	183
DESULFOASV1_1751_OmpA_family_protein	AF-Q8R3P6-F1-model_v4	DESULFOASV1_1751_OmpA_family_protein	AF-Q8R3P6-F1-model_v4 Integrator complex subunit 14	0.158	200	152	38	219	2	201	9.166E-06	182
DESULFOASV1_1751_OmpA_family_protein	AF-Q93SW0-F1-model_v4	DESULFOASV1_1751_OmpA_family_protein	AF-Q93SW0-F1-model_v4 Magnesium-chelatase 67 kDa subunit	0.161	185	144	38	210	432	616	2.020E-06	182
DESULFOASV1_1751_OmpA_family_protein	AF-P12110-F1-model_v4	DESULFOASV1_1751_OmpA_family_protein	AF-P12110-F1-model_v4 Collagen alpha-2(VI) chain	0.151	186	156	38	222	833	1018	9.715E-06	182
DESULFOASV1_1751_OmpA_family_protein	AF-P38886-F1-model_v4	DESULFOASV1_1751_OmpA_family_protein	AF-P38886-F1-model_v4 26S proteasome regulatory subunit RPN10	0.112	189	165	36	222	3	191	6.853E-06	180
DESULFOASV1_1751_OmpA_family_protein	AF-O74995-F1-model_v4	DESULFOASV1_1751_OmpA_family_protein	AF-O74995-F1-model_v4 General transcription and DNA repair factor IIH subunit ssl1	0.103	208	184	14	219	59	266	2.269E-06	180
DESULFOASV1_1751_OmpA_family_protein	AF-Q54MG1-F1-model_v4	DESULFOASV1_1751_OmpA_family_protein	AF-Q54MG1-F1-model_v4 von Willebrand factor A domain-containing protein DDB_G0285981	0.168	186	141	37	222	311	480	1.798E-06	180
DESULFOASV1_1751_OmpA_family_protein	AF-Q66KD9-F1-model_v4	DESULFOASV1_1751_OmpA_family_protein	AF-Q66KD9-F1-model_v4 Integrator complex subunit 14	0.150	200	154	38	219	2	201	5.431E-06	177
DESULFOASV1_1751_OmpA_family_protein	AF-P34393-F1-model_v4	DESULFOASV1_1751_OmpA_family_protein	AF-P34393-F1-model_v4 C-type lectin domain-containing protein 160	0.130	199	171	26	222	273	471	4.561E-06	177
DESULFOASV1_1751_OmpA_family_protein	AF-Q4WI96-F1-model_v4	DESULFOASV1_1751_OmpA_family_protein	AF-Q4WI96-F1-model_v4 ATP-dependent DNA helicase II subunit 2	0.115	207	155	37	212	5	211	1.157E-05	175
DESULFOASV1_1751_OmpA_family_protein	AF-A2A3N6-F1-model_v4	DESULFOASV1_1751_OmpA_family_protein	AF-A2A3N6-F1-model_v4 Putative PIP5K1A and PSMD4-like protein	0.131	170	146	36	204	488	657	2.464E-05	175
DESULFOASV1_1751_OmpA_family_protein	AF-Q2UY11-F1-model_v4	DESULFOASV1_1751_OmpA_family_protein	AF-Q2UY11-F1-model_v4 Collagen alpha-1(XXVIII) chain	0.131	207	173	14	220	779	978	6.101E-06	175
DESULFOASV1_1751_OmpA_family_protein	AF-P76396-F1-model_v4	DESULFOASV1_1751_OmpA_family_protein	AF-P76396-F1-model_v4 Uncharacterized protein YegL	0.148	183	153	38	220	21	201	1.906E-06	172
DESULFOASV1_1751_OmpA_family_protein	AF-Q58DA0-F1-model_v4	DESULFOASV1_1751_OmpA_family_protein	AF-Q58DA0-F1-model_v4 26S proteasome non-ATPase regulatory subunit 4	0.138	189	156	36	217	3	191	9.166E-06	171
