query	target	qheader	theader	fident	alnlen	mismatch	qstart	qend	tstart	tend	evalue	bits
DESULFOASV1_1572_hypothetical_protein	AF-O52728-F1-model_v4	DESULFOASV1_1572_hypothetical_protein	AF-O52728-F1-model_v4 Ancillary SecYEG translocon subunit	0.185	206	162	12	217	4	203	3.455E-06	269
DESULFOASV1_1572_hypothetical_protein	AF-P43989-F1-model_v4	DESULFOASV1_1572_hypothetical_protein	AF-P43989-F1-model_v4 Ancillary SecYEG translocon subunit	0.188	208	163	10	217	2	203	8.690E-06	238
DESULFOASV1_1572_hypothetical_protein	AF-O83306-F1-model_v4	DESULFOASV1_1572_hypothetical_protein	AF-O83306-F1-model_v4 TPR repeat-containing protein TP_0282	0.161	237	178	12	224	1	237	4.108E-05	229
DESULFOASV1_1572_hypothetical_protein	AF-P57663-F1-model_v4	DESULFOASV1_1572_hypothetical_protein	AF-P57663-F1-model_v4 Ancillary SecYEG translocon subunit	0.111	185	163	38	221	8	192	1.195E-04	223
DESULFOASV1_1572_hypothetical_protein	AF-P76576-F1-model_v4	DESULFOASV1_1572_hypothetical_protein	AF-P76576-F1-model_v4 Ancillary SecYEG translocon subunit	0.161	207	166	13	219	7	205	2.140E-04	217
DESULFOASV1_1572_hypothetical_protein	AF-O51880-F1-model_v4	DESULFOASV1_1572_hypothetical_protein	AF-O51880-F1-model_v4 Ancillary SecYEG translocon subunit	0.137	182	156	38	219	12	193	8.932E-05	214
DESULFOASV1_1572_hypothetical_protein	AF-A1Z9G2-F1-model_v4	DESULFOASV1_1572_hypothetical_protein	AF-A1Z9G2-F1-model_v4 Pre-mRNA-splicing factor syf1 homolog	0.167	160	130	65	221	553	712	4.885E-04	191
DESULFOASV1_1572_hypothetical_protein	AF-O87406-F1-model_v4	DESULFOASV1_1572_hypothetical_protein	AF-O87406-F1-model_v4 Ancillary SecYEG translocon subunit	0.201	207	160	18	218	2	208	2.140E-04	188
DESULFOASV1_1572_hypothetical_protein	AF-Q54Z08-F1-model_v4	DESULFOASV1_1572_hypothetical_protein	AF-Q54Z08-F1-model_v4 Pre-mRNA-splicing factor SYF1	0.160	156	128	68	220	570	725	5.650E-04	181
DESULFOASV1_1572_hypothetical_protein	AF-Q7SAK5-F1-model_v4	DESULFOASV1_1572_hypothetical_protein	AF-Q7SAK5-F1-model_v4 Pre-mRNA-splicing factor syf1	0.145	158	133	65	221	566	723	8.332E-04	178
DESULFOASV1_1572_hypothetical_protein	AF-Q52DF3-F1-model_v4	DESULFOASV1_1572_hypothetical_protein	AF-Q52DF3-F1-model_v4 Pre-mRNA-splicing factor SYF1	0.152	157	131	66	221	570	726	1.012E-03	178
DESULFOASV1_1572_hypothetical_protein	AF-Q4WVF4-F1-model_v4	DESULFOASV1_1572_hypothetical_protein	AF-Q4WVF4-F1-model_v4 Pre-mRNA-splicing factor syf1	0.158	158	131	65	221	563	720	1.170E-03	174
DESULFOASV1_1572_hypothetical_protein	AF-P0AB60-F1-model_v4	DESULFOASV1_1572_hypothetical_protein	AF-P0AB60-F1-model_v4 Lipopolysaccharide assembly protein B	0.125	188	160	35	222	3	186	2.545E-03	173
DESULFOASV1_1572_hypothetical_protein	AF-P0AB58-F1-model_v4	DESULFOASV1_1572_hypothetical_protein	AF-P0AB58-F1-model_v4 Lipopolysaccharide assembly protein B	0.125	188	160	35	222	3	186	2.804E-03	172
DESULFOASV1_1572_hypothetical_protein	AF-P0CO09-F1-model_v4	DESULFOASV1_1572_hypothetical_protein	AF-P0CO09-F1-model_v4 Pre-mRNA-splicing factor SYF1	0.125	184	140	65	225	756	939	2.358E-04	172
DESULFOASV1_1572_hypothetical_protein	AF-P0AB59-F1-model_v4	DESULFOASV1_1572_hypothetical_protein	AF-P0AB59-F1-model_v4 Lipopolysaccharide assembly protein B	0.125	188	160	35	222	3	186	2.944E-03	171
DESULFOASV1_1572_hypothetical_protein	AF-Q9ZDU3-F1-model_v4	DESULFOASV1_1572_hypothetical_protein	AF-Q9ZDU3-F1-model_v4 Uncharacterized protein RP231	0.130	214	180	16	223	6	219	6.227E-04	169
DESULFOASV1_1572_hypothetical_protein	AF-Q9P7R9-F1-model_v4	DESULFOASV1_1572_hypothetical_protein	AF-Q9P7R9-F1-model_v4 Pre-mRNA-splicing factor cwf3	0.130	183	137	65	223	550	732	2.599E-04	169
DESULFOASV1_1572_hypothetical_protein	AF-Q5BH69-F1-model_v4	DESULFOASV1_1572_hypothetical_protein	AF-Q5BH69-F1-model_v4 Pre-mRNA-splicing factor syf1	0.122	180	139	65	223	580	759	5.383E-04	165
DESULFOASV1_1572_hypothetical_protein	AF-P0CO08-F1-model_v4	DESULFOASV1_1572_hypothetical_protein	AF-P0CO08-F1-model_v4 Pre-mRNA-splicing factor SYF1	0.125	184	140	65	225	756	939	5.128E-04	162
DESULFOASV1_1572_hypothetical_protein	AF-Q8NA56-F1-model_v4	DESULFOASV1_1572_hypothetical_protein	AF-Q8NA56-F1-model_v4 Tetratricopeptide repeat protein 29	0.125	176	139	65	224	234	409	2.309E-03	160
DESULFOASV1_1572_hypothetical_protein	AF-B9DHG0-F1-model_v4	DESULFOASV1_1572_hypothetical_protein	AF-B9DHG0-F1-model_v4 Tetratricopeptide repeat domain-containing protein PYG7, chloroplastic	0.150	222	172	1	222	92	294	1.599E-04	159
DESULFOASV1_1572_hypothetical_protein	AF-Q9DAC7-F1-model_v4	DESULFOASV1_1572_hypothetical_protein	AF-Q9DAC7-F1-model_v4 Tetratricopeptide repeat protein 32	0.145	133	110	95	224	6	138	2.944E-03	157
DESULFOASV1_1572_hypothetical_protein	AF-Q89A13-F1-model_v4	DESULFOASV1_1572_hypothetical_protein	AF-Q89A13-F1-model_v4 Ancillary SecYEG translocon subunit	0.092	207	173	12	218	1	192	4.885E-04	157
DESULFOASV1_1572_hypothetical_protein	AF-A2VE45-F1-model_v4	DESULFOASV1_1572_hypothetical_protein	AF-A2VE45-F1-model_v4 Tetratricopeptide repeat protein 30A	0.148	158	132	67	224	13	168	7.053E-03	157
DESULFOASV1_1572_hypothetical_protein	AF-O13895-F1-model_v4	DESULFOASV1_1572_hypothetical_protein	AF-O13895-F1-model_v4 COP9 signalosome complex subunit 4	0.148	194	133	62	218	30	223	6.227E-04	155
DESULFOASV1_1572_hypothetical_protein	AF-P85969-F1-model_v4	DESULFOASV1_1572_hypothetical_protein	AF-P85969-F1-model_v4 Beta-soluble NSF attachment protein	0.196	169	129	63	224	8	176	1.812E-03	152
DESULFOASV1_1572_hypothetical_protein	AF-Q80VM3-F1-model_v4	DESULFOASV1_1572_hypothetical_protein	AF-Q80VM3-F1-model_v4 Tetratricopeptide repeat protein 29	0.141	170	131	65	218	234	403	3.244E-03	152
DESULFOASV1_1572_hypothetical_protein	AF-Q4R6M4-F1-model_v4	DESULFOASV1_1572_hypothetical_protein	AF-Q4R6M4-F1-model_v4 Tetratricopeptide repeat protein 29	0.136	165	134	64	219	233	397	2.200E-03	152
DESULFOASV1_1572_hypothetical_protein	AF-Q6AYP3-F1-model_v4	DESULFOASV1_1572_hypothetical_protein	AF-Q6AYP3-F1-model_v4 Tetratricopeptide repeat protein 29	0.135	170	132	65	218	234	403	3.244E-03	150
DESULFOASV1_1572_hypothetical_protein	AF-Q80XJ3-F1-model_v4	DESULFOASV1_1572_hypothetical_protein	AF-Q80XJ3-F1-model_v4 Tetratricopeptide repeat protein 28	0.164	158	118	83	224	849	1006	7.772E-03	148
DESULFOASV1_1572_hypothetical_protein	AF-Q8VDU0-F1-model_v4	DESULFOASV1_1572_hypothetical_protein	AF-Q8VDU0-F1-model_v4 G-protein-signaling modulator 2	0.135	155	122	84	225	224	378	1.263E-02	147
DESULFOASV1_1572_hypothetical_protein	AF-Q9HCS7-F1-model_v4	DESULFOASV1_1572_hypothetical_protein	AF-Q9HCS7-F1-model_v4 Pre-mRNA-splicing factor SYF1	0.118	161	138	65	222	554	714	6.400E-03	144
DESULFOASV1_1572_hypothetical_protein	AF-Q9P7N6-F1-model_v4	DESULFOASV1_1572_hypothetical_protein	AF-Q9P7N6-F1-model_v4 TPR repeat-containing protein P27G11.02	0.148	249	176	16	222	95	343	1.492E-03	143
DESULFOASV1_1572_hypothetical_protein	AF-Q99PK0-F1-model_v4	DESULFOASV1_1572_hypothetical_protein	AF-Q99PK0-F1-model_v4 Pre-mRNA-splicing factor SYF1	0.103	183	143	65	224	554	736	2.671E-03	141
DESULFOASV1_1572_hypothetical_protein	AF-B4K4X6-F1-model_v4	DESULFOASV1_1572_hypothetical_protein	AF-B4K4X6-F1-model_v4 MAU2 chromatid cohesion factor homolog	0.105	166	141	61	218	11	176	5.021E-03	140
DESULFOASV1_1572_hypothetical_protein	AF-O74458-F1-model_v4	DESULFOASV1_1572_hypothetical_protein	AF-O74458-F1-model_v4 Transcription factor tau subunit sfc4	0.138	160	134	67	222	131	290	1.610E-02	140
DESULFOASV1_1572_hypothetical_protein	AF-Q8BYG0-F1-model_v4	DESULFOASV1_1572_hypothetical_protein	AF-Q8BYG0-F1-model_v4 Tetratricopeptide repeat protein 24	0.158	151	116	84	222	54	204	1.203E-02	139
DESULFOASV1_1572_hypothetical_protein	AF-Q9H115-F1-model_v4	DESULFOASV1_1572_hypothetical_protein	AF-Q9H115-F1-model_v4 Beta-soluble NSF attachment protein	0.201	170	129	63	224	8	177	5.021E-03	138
DESULFOASV1_1572_hypothetical_protein	AF-P28663-F1-model_v4	DESULFOASV1_1572_hypothetical_protein	AF-P28663-F1-model_v4 Beta-soluble NSF attachment protein	0.201	170	129	63	224	8	177	5.808E-03	136
DESULFOASV1_1572_hypothetical_protein	AF-Q9DCD2-F1-model_v4	DESULFOASV1_1572_hypothetical_protein	AF-Q9DCD2-F1-model_v4 Pre-mRNA-splicing factor SYF1	0.114	183	141	65	224	554	736	3.090E-03	136
DESULFOASV1_1572_hypothetical_protein	AF-Q9DBB4-F1-model_v4	DESULFOASV1_1572_hypothetical_protein	AF-Q9DBB4-F1-model_v4 N-alpha-acetyltransferase 16, NatA auxiliary subunit	0.119	156	137	65	220	114	269	1.533E-02	136
DESULFOASV1_1572_hypothetical_protein	AF-A6H739-F1-model_v4	DESULFOASV1_1572_hypothetical_protein	AF-A6H739-F1-model_v4 Tetratricopeptide repeat protein 30B	0.157	146	117	67	212	13	152	3.026E-02	135
DESULFOASV1_1572_hypothetical_protein	AF-P81126-F1-model_v4	DESULFOASV1_1572_hypothetical_protein	AF-P81126-F1-model_v4 Beta-soluble NSF attachment protein	0.201	170	129	63	224	8	177	7.053E-03	134
DESULFOASV1_1572_hypothetical_protein	AF-Q13099-F1-model_v4	DESULFOASV1_1572_hypothetical_protein	AF-Q13099-F1-model_v4 Intraflagellar transport protein 88 homolog	0.153	160	125	64	223	418	566	6.400E-03	134
DESULFOASV1_1572_hypothetical_protein	AF-Q96AY4-F1-model_v4	DESULFOASV1_1572_hypothetical_protein	AF-Q96AY4-F1-model_v4 Tetratricopeptide repeat protein 28	0.120	158	124	83	224	735	892	1.203E-02	134
DESULFOASV1_1572_hypothetical_protein	AF-Q3T0I5-F1-model_v4	DESULFOASV1_1572_hypothetical_protein	AF-Q3T0I5-F1-model_v4 Mitochondrial fission 1 protein	0.208	89	69	137	224	32	120	5.161E-02	133
DESULFOASV1_1572_hypothetical_protein	AF-P93798-F1-model_v4	DESULFOASV1_1572_hypothetical_protein	AF-P93798-F1-model_v4 Alpha-soluble NSF attachment protein	0.145	162	138	63	224	6	167	8.990E-03	133
DESULFOASV1_1572_hypothetical_protein	AF-Q9BXJ9-F1-model_v4	DESULFOASV1_1572_hypothetical_protein	AF-Q9BXJ9-F1-model_v4 N-alpha-acetyltransferase 15, NatA auxiliary subunit	0.166	138	112	83	220	135	269	3.176E-02	133
DESULFOASV1_1572_hypothetical_protein	AF-Q8CC21-F1-model_v4	DESULFOASV1_1572_hypothetical_protein	AF-Q8CC21-F1-model_v4 Tetratricopeptide repeat protein 19, mitochondrial	0.154	164	135	65	224	200	363	7.772E-03	132
DESULFOASV1_1572_hypothetical_protein	AF-Q9FKV5-F1-model_v4	DESULFOASV1_1572_hypothetical_protein	AF-Q9FKV5-F1-model_v4 Protein POLLENLESS 3-LIKE 1	0.150	180	133	64	220	56	235	7.404E-03	132
DESULFOASV1_1572_hypothetical_protein	AF-Q6LME4-F1-model_v4	DESULFOASV1_1572_hypothetical_protein	AF-Q6LME4-F1-model_v4 Penicillin-binding protein activator LpoA	0.186	144	116	76	218	43	186	1.690E-02	132
DESULFOASV1_1572_hypothetical_protein	AF-B4JHK2-F1-model_v4	DESULFOASV1_1572_hypothetical_protein	AF-B4JHK2-F1-model_v4 MAU2 chromatid cohesion factor homolog	0.094	175	150	52	218	2	176	1.092E-02	132
DESULFOASV1_1572_hypothetical_protein	AF-P81274-F1-model_v4	DESULFOASV1_1572_hypothetical_protein	AF-P81274-F1-model_v4 G-protein-signaling modulator 2	0.121	155	124	84	225	224	378	2.746E-02	132
DESULFOASV1_1572_hypothetical_protein	AF-Q9CQ92-F1-model_v4	DESULFOASV1_1572_hypothetical_protein	AF-Q9CQ92-F1-model_v4 Mitochondrial fission 1 protein	0.197	89	70	137	224	32	120	5.970E-02	131
DESULFOASV1_1572_hypothetical_protein	AF-Q1XDU6-F1-model_v4	DESULFOASV1_1572_hypothetical_protein	AF-Q1XDU6-F1-model_v4 Uncharacterized protein ycf37	0.134	186	150	38	223	4	177	1.092E-02	131
DESULFOASV1_1572_hypothetical_protein	AF-Q61371-F1-model_v4	DESULFOASV1_1572_hypothetical_protein	AF-Q61371-F1-model_v4 Intraflagellar transport protein 88 homolog	0.150	153	120	83	224	570	722	8.990E-03	130
DESULFOASV1_1572_hypothetical_protein	AF-Q9CWZ7-F1-model_v4	DESULFOASV1_1572_hypothetical_protein	AF-Q9CWZ7-F1-model_v4 Gamma-soluble NSF attachment protein	0.145	183	138	63	224	7	189	1.326E-02	129
DESULFOASV1_1572_hypothetical_protein	AF-O70525-F1-model_v4	DESULFOASV1_1572_hypothetical_protein	AF-O70525-F1-model_v4 Peroxisomal targeting signal 1 receptor	0.156	148	120	83	225	471	618	3.176E-02	128
DESULFOASV1_1572_hypothetical_protein	AF-B5X0I6-F1-model_v4	DESULFOASV1_1572_hypothetical_protein	AF-B5X0I6-F1-model_v4 Protein CTR9 homolog	0.159	134	111	85	218	288	420	2.746E-02	128
DESULFOASV1_1572_hypothetical_protein	AF-Q95MP0-F1-model_v4	DESULFOASV1_1572_hypothetical_protein	AF-Q95MP0-F1-model_v4 Aryl-hydrocarbon-interacting protein-like 1	0.145	141	109	97	224	174	314	2.882E-02	127
DESULFOASV1_1572_hypothetical_protein	AF-Q23049-F1-model_v4	DESULFOASV1_1572_hypothetical_protein	AF-Q23049-F1-model_v4 Tetratricopeptide repeat protein 8	0.128	140	116	86	225	373	506	1.610E-02	127
DESULFOASV1_1572_hypothetical_protein	AF-Q9R080-F1-model_v4	DESULFOASV1_1572_hypothetical_protein	AF-Q9R080-F1-model_v4 G-protein-signaling modulator 1	0.167	152	118	83	225	231	382	4.049E-02	127
DESULFOASV1_1572_hypothetical_protein	AF-Q5R4J9-F1-model_v4	DESULFOASV1_1572_hypothetical_protein	AF-Q5R4J9-F1-model_v4 N-alpha-acetyltransferase 15, NatA auxiliary subunit	0.163	156	130	65	220	114	269	3.176E-02	126
DESULFOASV1_1572_hypothetical_protein	AF-Q5T0N1-F1-model_v4	DESULFOASV1_1572_hypothetical_protein	AF-Q5T0N1-F1-model_v4 Cilia- and flagella-associated protein 70	0.130	144	119	82	225	980	1117	1.862E-02	126
DESULFOASV1_1572_hypothetical_protein	AF-Q9Y3D6-F1-model_v4	DESULFOASV1_1572_hypothetical_protein	AF-Q9Y3D6-F1-model_v4 Mitochondrial fission 1 protein	0.197	89	70	137	224	32	120	9.241E-02	125
DESULFOASV1_1572_hypothetical_protein	AF-Q96EF9-F1-model_v4	DESULFOASV1_1572_hypothetical_protein	AF-Q96EF9-F1-model_v4 Zinc fingers and homeoboxes protein 1, isoform 2	0.136	130	110	95	222	16	145	1.178E-01	125
DESULFOASV1_1572_hypothetical_protein	AF-Q9SUC3-F1-model_v4	DESULFOASV1_1572_hypothetical_protein	AF-Q9SUC3-F1-model_v4 Protein POLLENLESS 3	0.134	161	116	83	217	79	239	2.492E-02	125
DESULFOASV1_1572_hypothetical_protein	AF-P51191-F1-model_v4	DESULFOASV1_1572_hypothetical_protein	AF-P51191-F1-model_v4 Uncharacterized protein ycf37	0.135	177	144	39	215	5	171	9.907E-03	124
DESULFOASV1_1572_hypothetical_protein	AF-Q99747-F1-model_v4	DESULFOASV1_1572_hypothetical_protein	AF-Q99747-F1-model_v4 Gamma-soluble NSF attachment protein	0.165	183	134	63	224	7	189	1.533E-02	124
DESULFOASV1_1572_hypothetical_protein	AF-Q54D58-F1-model_v4	DESULFOASV1_1572_hypothetical_protein	AF-Q54D58-F1-model_v4 Anaphase-promoting complex subunit 7	0.095	192	147	62	224	11	202	6.719E-03	124
DESULFOASV1_1572_hypothetical_protein	AF-O76094-F1-model_v4	DESULFOASV1_1572_hypothetical_protein	AF-O76094-F1-model_v4 Signal recognition particle subunit SRP72	0.156	133	103	83	215	29	151	1.690E-02	124
DESULFOASV1_1572_hypothetical_protein	AF-Q80UM3-F1-model_v4	DESULFOASV1_1572_hypothetical_protein	AF-Q80UM3-F1-model_v4 N-alpha-acetyltransferase 15, NatA auxiliary subunit	0.164	156	130	65	220	114	269	1.533E-02	124
DESULFOASV1_1572_hypothetical_protein	AF-P81127-F1-model_v4	DESULFOASV1_1572_hypothetical_protein	AF-P81127-F1-model_v4 Gamma-soluble NSF attachment protein	0.174	187	134	62	224	3	189	1.774E-02	123
DESULFOASV1_1572_hypothetical_protein	AF-P33731-F1-model_v4	DESULFOASV1_1572_hypothetical_protein	AF-P33731-F1-model_v4 Signal recognition particle subunit SRP72	0.156	133	103	83	215	29	151	1.862E-02	123
DESULFOASV1_1572_hypothetical_protein	AF-F4K487-F1-model_v4	DESULFOASV1_1572_hypothetical_protein	AF-F4K487-F1-model_v4 Protein PHOX3	0.150	210	177	16	224	40	249	2.804E-03	123
DESULFOASV1_1572_hypothetical_protein	AF-P25941-F1-model_v4	DESULFOASV1_1572_hypothetical_protein	AF-P25941-F1-model_v4 Regulatory protein AfsR	0.161	153	116	82	220	840	992	2.492E-02	123
DESULFOASV1_1572_hypothetical_protein	AF-D4A6D7-F1-model_v4	DESULFOASV1_1572_hypothetical_protein	AF-D4A6D7-F1-model_v4 Tetratricopeptide repeat protein 19, mitochondrial	0.134	160	138	65	224	197	356	5.021E-03	122
DESULFOASV1_1572_hypothetical_protein	AF-A1Z6M6-F1-model_v4	DESULFOASV1_1572_hypothetical_protein	AF-A1Z6M6-F1-model_v4 DNA polymerase interacting tetratricopeptide repeat-containing, protein of 47 kDa	0.160	127	104	97	223	88	212	5.970E-02	122
DESULFOASV1_1572_hypothetical_protein	AF-P44772-F1-model_v4	DESULFOASV1_1572_hypothetical_protein	AF-P44772-F1-model_v4 Protein HemY homolog	0.146	193	155	36	218	42	234	2.882E-02	122
DESULFOASV1_1572_hypothetical_protein	AF-Q32NR4-F1-model_v4	DESULFOASV1_1572_hypothetical_protein	AF-Q32NR4-F1-model_v4 Tetratricopeptide repeat protein 29	0.133	180	139	62	222	238	417	2.261E-02	122
DESULFOASV1_1572_hypothetical_protein	AF-Q54DA8-F1-model_v4	DESULFOASV1_1572_hypothetical_protein	AF-Q54DA8-F1-model_v4 Protein STIP1 homolog	0.157	147	114	78	224	232	367	2.492E-02	122
DESULFOASV1_1572_hypothetical_protein	AF-P84817-F1-model_v4	DESULFOASV1_1572_hypothetical_protein	AF-P84817-F1-model_v4 Mitochondrial fission 1 protein	0.185	110	86	115	224	15	120	6.906E-02	119
DESULFOASV1_1572_hypothetical_protein	AF-Q9SPE5-F1-model_v4	DESULFOASV1_1572_hypothetical_protein	AF-Q9SPE5-F1-model_v4 Gamma-soluble NSF attachment protein	0.166	154	113	65	201	5	158	2.746E-02	119
DESULFOASV1_1572_hypothetical_protein	AF-Q4P7S1-F1-model_v4	DESULFOASV1_1572_hypothetical_protein	AF-Q4P7S1-F1-model_v4 Pre-mRNA-splicing factor SYF1	0.130	222	176	19	221	741	962	1.263E-02	119
DESULFOASV1_1572_hypothetical_protein	AF-Q9SPE6-F1-model_v4	DESULFOASV1_1572_hypothetical_protein	AF-Q9SPE6-F1-model_v4 Alpha-soluble NSF attachment protein 2	0.146	189	132	64	218	7	195	1.902E-03	118
DESULFOASV1_1572_hypothetical_protein	AF-P44942-F1-model_v4	DESULFOASV1_1572_hypothetical_protein	AF-P44942-F1-model_v4 Formate-dependent nitrite reductase complex bifunctional subunit NrfFG	0.175	222	169	1	222	171	376	1.354E-03	118
DESULFOASV1_1572_hypothetical_protein	AF-P33313-F1-model_v4	DESULFOASV1_1572_hypothetical_protein	AF-P33313-F1-model_v4 Hsp70/Hsp90 co-chaperone CNS1	0.120	153	129	77	224	53	205	3.334E-02	118
DESULFOASV1_1572_hypothetical_protein	AF-O67066-F1-model_v4	DESULFOASV1_1572_hypothetical_protein	AF-O67066-F1-model_v4 Signal recognition particle receptor FtsY	0.168	162	122	64	225	10	157	2.746E-02	118
DESULFOASV1_1572_hypothetical_protein	AF-B3M1B7-F1-model_v4	DESULFOASV1_1572_hypothetical_protein	AF-B3M1B7-F1-model_v4 MAU2 chromatid cohesion factor homolog	0.104	176	150	51	218	3	178	2.052E-02	118
DESULFOASV1_1572_hypothetical_protein	AF-Q2M2R8-F1-model_v4	DESULFOASV1_1572_hypothetical_protein	AF-Q2M2R8-F1-model_v4 Peroxisomal targeting signal 1 receptor	0.156	148	120	83	225	471	618	6.579E-02	118
DESULFOASV1_1572_hypothetical_protein	AF-Q75D68-F1-model_v4	DESULFOASV1_1572_hypothetical_protein	AF-Q75D68-F1-model_v4 Vesicular-fusion protein SEC17	0.149	199	132	63	218	2	200	2.671E-03	117
DESULFOASV1_1572_hypothetical_protein	AF-Q6B4Z3-F1-model_v4	DESULFOASV1_1572_hypothetical_protein	AF-Q6B4Z3-F1-model_v4 Histone demethylase UTY	0.116	165	141	64	224	236	400	2.616E-02	117
DESULFOASV1_1572_hypothetical_protein	AF-P38111-F1-model_v4	DESULFOASV1_1572_hypothetical_protein	AF-P38111-F1-model_v4 Serine/threonine-protein kinase MEC1	0.161	136	107	97	225	1683	1818	2.746E-02	117
DESULFOASV1_1572_hypothetical_protein	AF-Q8R3H9-F1-model_v4	DESULFOASV1_1572_hypothetical_protein	AF-Q8R3H9-F1-model_v4 Tetratricopeptide repeat protein 4	0.145	156	126	77	224	48	203	5.161E-02	116
DESULFOASV1_1572_hypothetical_protein	AF-Q6N069-F1-model_v4	DESULFOASV1_1572_hypothetical_protein	AF-Q6N069-F1-model_v4 N-alpha-acetyltransferase 16, NatA auxiliary subunit	0.111	156	138	65	220	114	269	3.176E-02	116
DESULFOASV1_1572_hypothetical_protein	AF-P32602-F1-model_v4	DESULFOASV1_1572_hypothetical_protein	AF-P32602-F1-model_v4 Alpha-soluble NSF attachment protein	0.130	198	133	65	218	4	201	5.533E-03	115
DESULFOASV1_1572_hypothetical_protein	AF-Q00828-F1-model_v4	DESULFOASV1_1572_hypothetical_protein	AF-Q00828-F1-model_v4 Response regulator aspartate phosphatase A	0.108	155	126	83	224	122	276	4.250E-02	115
DESULFOASV1_1572_hypothetical_protein	AF-E7F211-F1-model_v4	DESULFOASV1_1572_hypothetical_protein	AF-E7F211-F1-model_v4 Tetratricopeptide repeat protein 17	0.170	142	114	83	224	227	364	8.803E-02	114
DESULFOASV1_1572_hypothetical_protein	AF-Q23983-F1-model_v4	DESULFOASV1_1572_hypothetical_protein	AF-Q23983-F1-model_v4 Alpha-soluble NSF attachment protein	0.125	198	136	63	218	6	203	3.244E-03	113
DESULFOASV1_1572_hypothetical_protein	AF-F4HSX9-F1-model_v4	DESULFOASV1_1572_hypothetical_protein	AF-F4HSX9-F1-model_v4 Protein KINESIN LIGHT CHAIN-RELATED 3	0.115	164	124	84	224	463	626	7.989E-02	113
DESULFOASV1_1572_hypothetical_protein	AF-O74835-F1-model_v4	DESULFOASV1_1572_hypothetical_protein	AF-O74835-F1-model_v4 rRNA biogenesis protein rrp5	0.163	155	122	68	222	1483	1629	2.616E-02	113
DESULFOASV1_1572_hypothetical_protein	AF-Q95QJ7-F1-model_v4	DESULFOASV1_1572_hypothetical_protein	AF-Q95QJ7-F1-model_v4 G-protein regulator 1	0.149	201	140	59	224	5	205	7.249E-02	111
DESULFOASV1_1572_hypothetical_protein	AF-Q9LII8-F1-model_v4	DESULFOASV1_1572_hypothetical_protein	AF-Q9LII8-F1-model_v4 Protein KINESIN LIGHT CHAIN-RELATED 2	0.121	165	124	84	225	473	637	8.803E-02	111
DESULFOASV1_1572_hypothetical_protein	AF-Q9U9R7-F1-model_v4	DESULFOASV1_1572_hypothetical_protein	AF-Q9U9R7-F1-model_v4 Gamma-soluble NSF attachment protein	0.102	191	145	62	224	3	193	2.492E-02	110
DESULFOASV1_1572_hypothetical_protein	AF-Q4V7F0-F1-model_v4	DESULFOASV1_1572_hypothetical_protein	AF-Q4V7F0-F1-model_v4 Tetratricopeptide repeat protein 23	0.127	182	139	64	223	231	412	6.906E-02	110
DESULFOASV1_1572_hypothetical_protein	AF-P91240-F1-model_v4	DESULFOASV1_1572_hypothetical_protein	AF-P91240-F1-model_v4 Signal recognition particle subunit SRP72	0.174	169	134	60	222	308	476	2.374E-02	110
DESULFOASV1_1572_hypothetical_protein	AF-Q96NG3-F1-model_v4	DESULFOASV1_1572_hypothetical_protein	AF-Q96NG3-F1-model_v4 Outer dynein arm-docking complex subunit 4	0.178	207	166	16	222	248	450	2.154E-02	109
DESULFOASV1_1572_hypothetical_protein	AF-O83463-F1-model_v4	DESULFOASV1_1572_hypothetical_protein	AF-O83463-F1-model_v4 Uncharacterized lipoprotein TP_0449	0.153	160	127	62	221	31	181	6.579E-02	108
DESULFOASV1_1572_hypothetical_protein	AF-P33746-F1-model_v4	DESULFOASV1_1572_hypothetical_protein	AF-P33746-F1-model_v4 Sol locus transcriptional repressor	0.134	212	165	34	224	4	215	5.808E-03	108
DESULFOASV1_1572_hypothetical_protein	AF-A7SUU7-F1-model_v4	DESULFOASV1_1572_hypothetical_protein	AF-A7SUU7-F1-model_v4 MAU2 chromatid cohesion factor homolog	0.124	162	137	62	218	12	173	7.989E-02	108
DESULFOASV1_1572_hypothetical_protein	AF-Q6CAR6-F1-model_v4	DESULFOASV1_1572_hypothetical_protein	AF-Q6CAR6-F1-model_v4 Pre-mRNA-splicing factor SYF1	0.151	199	158	29	215	466	664	3.176E-02	108
DESULFOASV1_1572_hypothetical_protein	AF-A0JM23-F1-model_v4	DESULFOASV1_1572_hypothetical_protein	AF-A0JM23-F1-model_v4 Nephrocystin-3	0.180	241	159	29	223	1026	1266	3.244E-03	108
DESULFOASV1_1572_hypothetical_protein	AF-A7MB10-F1-model_v4	DESULFOASV1_1572_hypothetical_protein	AF-A7MB10-F1-model_v4 Protein RRP5 homolog	0.143	248	189	1	221	1563	1810	1.392E-02	108
DESULFOASV1_1572_hypothetical_protein	AF-O34327-F1-model_v4	DESULFOASV1_1572_hypothetical_protein	AF-O34327-F1-model_v4 Response regulator aspartate phosphatase J	0.107	156	138	63	218	150	304	4.049E-02	107
DESULFOASV1_1572_hypothetical_protein	AF-O95801-F1-model_v4	DESULFOASV1_1572_hypothetical_protein	AF-O95801-F1-model_v4 Tetratricopeptide repeat protein 4	0.130	159	127	78	224	49	207	6.906E-02	107
DESULFOASV1_1572_hypothetical_protein	AF-P96649-F1-model_v4	DESULFOASV1_1572_hypothetical_protein	AF-P96649-F1-model_v4 Response regulator aspartate phosphatase I	0.130	173	139	64	224	106	278	5.970E-02	107
DESULFOASV1_1572_hypothetical_protein	AF-Q9LP45-F1-model_v4	DESULFOASV1_1572_hypothetical_protein	AF-Q9LP45-F1-model_v4 26S proteasome non-ATPase regulatory subunit 11 homolog	0.152	164	128	71	222	10	173	3.674E-02	107
DESULFOASV1_1572_hypothetical_protein	AF-P54920-F1-model_v4	DESULFOASV1_1572_hypothetical_protein	AF-P54920-F1-model_v4 Alpha-soluble NSF attachment protein	0.127	199	140	58	218	7	205	3.405E-03	106
DESULFOASV1_1572_hypothetical_protein	AF-P78603-F1-model_v4	DESULFOASV1_1572_hypothetical_protein	AF-P78603-F1-model_v4 Vesicular-fusion protein SEC17	0.128	192	136	62	218	8	199	7.772E-03	105
DESULFOASV1_1572_hypothetical_protein	AF-P0C1I1-F1-model_v4	DESULFOASV1_1572_hypothetical_protein	AF-P0C1I1-F1-model_v4 Peptidyl-prolyl cis-trans isomerase D	0.120	162	129	77	224	196	357	3.674E-02	105
DESULFOASV1_1572_hypothetical_protein	AF-Q20938-F1-model_v4	DESULFOASV1_1572_hypothetical_protein	AF-Q20938-F1-model_v4 Probable 26S proteasome regulatory subunit rpn-6.1	0.137	163	138	63	223	34	196	3.176E-02	105
DESULFOASV1_1572_hypothetical_protein	AF-Q9M5P8-F1-model_v4	DESULFOASV1_1572_hypothetical_protein	AF-Q9M5P8-F1-model_v4 Alpha-soluble NSF attachment protein	0.130	189	135	63	218	6	194	1.326E-02	104
DESULFOASV1_1572_hypothetical_protein	AF-Q6DKK2-F1-model_v4	DESULFOASV1_1572_hypothetical_protein	AF-Q6DKK2-F1-model_v4 Tetratricopeptide repeat protein 19, mitochondrial	0.128	296	194	1	224	71	366	5.808E-03	104
DESULFOASV1_1572_hypothetical_protein	AF-A7S641-F1-model_v4	DESULFOASV1_1572_hypothetical_protein	AF-A7S641-F1-model_v4 Protein ST7 homolog	0.128	173	135	67	222	183	355	7.989E-02	104
DESULFOASV1_1572_hypothetical_protein	AF-Q58073-F1-model_v4	DESULFOASV1_1572_hypothetical_protein	AF-Q58073-F1-model_v4 Uncharacterized protein MJ0659	0.134	154	118	72	225	2	138	6.579E-02	103
DESULFOASV1_1572_hypothetical_protein	AF-Q9HXJ2-F1-model_v4	DESULFOASV1_1572_hypothetical_protein	AF-Q9HXJ2-F1-model_v4 Type IV pilus assembly protein PilF	0.111	167	139	58	224	34	190	9.701E-02	103
DESULFOASV1_1572_hypothetical_protein	AF-Q54NP6-F1-model_v4	DESULFOASV1_1572_hypothetical_protein	AF-Q54NP6-F1-model_v4 Alpha-soluble NSF attachment protein	0.145	168	138	63	224	5	172	2.052E-02	103
DESULFOASV1_1572_hypothetical_protein	AF-Q9D2X8-F1-model_v4	DESULFOASV1_1572_hypothetical_protein	AF-Q9D2X8-F1-model_v4 Uncharacterized protein C8orf76 homolog	0.140	126	106	95	218	48	173	3.110E-01	103
DESULFOASV1_1572_hypothetical_protein	AF-O42393-F1-model_v4	DESULFOASV1_1572_hypothetical_protein	AF-O42393-F1-model_v4 43 kDa receptor-associated protein of the synapse	0.125	163	137	58	215	3	165	4.683E-02	103
