LOKIASV2_0831_ESMFold_MFS_transporter	AF-A0A0R4IIC8-F1-model_v4	AF-A0A0R4IIC8-F1-model_v4 Solute carrier family 2 member 8	3.812E-07	1.000	277	1	473	479	1	496	498	547	0.987	0.996
LOKIASV2_0831_ESMFold_MFS_transporter	AF-C1H911-F1-model_v4	AF-C1H911-F1-model_v4 Sugar transporter	2.570E-07	1.000	277	26	474	479	7	486	525	518	0.937	0.914
LOKIASV2_0831_ESMFold_MFS_transporter	AF-Q9UPI3-F1-model_v4	AF-Q9UPI3-F1-model_v4 Feline leukemia virus subgroup C receptor-related protein 2	2.110E-07	1.000	277	28	472	479	81	499	526	476	0.929	0.797
LOKIASV2_0831_ESMFold_MFS_transporter	AF-Q8R0G7-F1-model_v4	AF-Q8R0G7-F1-model_v4 Protein spinster homolog 1	4.290E-07	1.000	277	24	477	479	56	507	528	499	0.948	0.856
LOKIASV2_0831_ESMFold_MFS_transporter	AF-Q9HUR3-F1-model_v4	AF-Q9HUR3-F1-model_v4 Probable major facilitator superfamily (MFS) transporter	3.523E-07	1.000	276	22	464	479	10	432	446	483	0.925	0.948
LOKIASV2_0831_ESMFold_MFS_transporter	AF-U7PY03-F1-model_v4	AF-U7PY03-F1-model_v4 MFS domain-containing protein	3.664E-07	1.000	276	17	479	479	40	475	487	491	0.967	0.895
LOKIASV2_0831_ESMFold_MFS_transporter	AF-P19357-F1-model_v4	AF-P19357-F1-model_v4 Solute carrier family 2, facilitated glucose transporter member 4	1.038E-07	1.000	276	31	479	479	30	500	509	505	0.937	0.925
LOKIASV2_0831_ESMFold_MFS_transporter	AF-Q94JG1-F1-model_v4	AF-Q94JG1-F1-model_v4 High-affinity nitrate transporter 2.3	1.802E-07	1.000	276	30	478	479	48	474	516	489	0.937	0.828
LOKIASV2_0831_ESMFold_MFS_transporter	AF-I1M280-F1-model_v4	AF-I1M280-F1-model_v4 MFS domain-containing protein	3.009E-07	1.000	276	9	472	479	33	511	524	516	0.969	0.914
LOKIASV2_0831_ESMFold_MFS_transporter	AF-A0A0G2L3Z8-F1-model_v4	AF-A0A0G2L3Z8-F1-model_v4 MFS domain-containing protein	1.733E-07	1.000	276	32	477	479	80	502	528	469	0.931	0.801
LOKIASV2_0831_ESMFold_MFS_transporter	AF-A0A1C1CFM0-F1-model_v4	AF-A0A1C1CFM0-F1-model_v4 Putative transporter	6.620E-07	1.000	276	17	459	479	69	479	603	471	0.925	0.682
LOKIASV2_0831_ESMFold_MFS_transporter	AF-A0A5K4F6G3-F1-model_v4	AF-A0A5K4F6G3-F1-model_v4 Uncharacterized protein	6.886E-07	1.000	276	27	471	479	1	552	605	591	0.929	0.912
LOKIASV2_0831_ESMFold_MFS_transporter	AF-A0A0D2DIY2-F1-model_v4	AF-A0A0D2DIY2-F1-model_v4 Unplaced genomic scaffold supercont1.6, whole genome shotgun sequence	1.875E-07	1.000	276	15	474	479	82	592	606	562	0.960	0.843
LOKIASV2_0831_ESMFold_MFS_transporter	AF-P38724-F1-model_v4	AF-P38724-F1-model_v4 Siderophore iron transporter ARN2	1.480E-07	1.000	276	9	463	479	30	585	620	598	0.950	0.897
LOKIASV2_0831_ESMFold_MFS_transporter	AF-P28246-F1-model_v4	AF-P28246-F1-model_v4 Bicyclomycin resistance protein	2.847E-06	1.000	275	25	463	479	5	395	396	444	0.916	0.987
LOKIASV2_0831_ESMFold_MFS_transporter	AF-D3ZCZ0-F1-model_v4	AF-D3ZCZ0-F1-model_v4 Sphingolipid transporter 3	1.666E-07	1.000	275	34	478	479	45	470	492	492	0.929	0.866
LOKIASV2_0831_ESMFold_MFS_transporter	AF-C0NF83-F1-model_v4	AF-C0NF83-F1-model_v4 Sugar transporter	5.023E-07	1.000	275	31	459	479	14	462	527	503	0.896	0.852
LOKIASV2_0831_ESMFold_MFS_transporter	AF-Q9LXH0-F1-model_v4	AF-Q9LXH0-F1-model_v4 High affinity nitrate transporter 2.6	4.463E-07	1.000	275	30	459	479	74	464	542	454	0.898	0.721
LOKIASV2_0831_ESMFold_MFS_transporter	AF-C0NI37-F1-model_v4	AF-C0NI37-F1-model_v4 MSTA protein	5.225E-07	1.000	275	28	462	479	20	491	549	508	0.908	0.860
LOKIASV2_0831_ESMFold_MFS_transporter	AF-A0A0K0DYR3-F1-model_v4	AF-A0A0K0DYR3-F1-model_v4 Uncharacterized protein	5.435E-07	1.000	274	16	470	479	1	420	426	480	0.950	0.986
LOKIASV2_0831_ESMFold_MFS_transporter	AF-K0F4A9-F1-model_v4	AF-K0F4A9-F1-model_v4 Mfs transporter	1.845E-06	1.000	274	27	463	479	6	423	429	471	0.912	0.974
LOKIASV2_0831_ESMFold_MFS_transporter	AF-Q6I5Y4-F1-model_v4	AF-Q6I5Y4-F1-model_v4 Os05g0389400 protein	3.204E-06	1.000	274	17	467	479	4	433	438	477	0.942	0.982
LOKIASV2_0831_ESMFold_MFS_transporter	AF-Q0DMT0-F1-model_v4	AF-Q0DMT0-F1-model_v4 Os03g0795000 protein	7.163E-07	1.000	274	35	465	479	38	453	464	457	0.900	0.897
LOKIASV2_0831_ESMFold_MFS_transporter	AF-A0A368UIG5-F1-model_v4	AF-A0A368UIG5-F1-model_v4 MFS domain-containing protein	4.463E-07	1.000	274	10	462	479	17	456	472	503	0.946	0.932
LOKIASV2_0831_ESMFold_MFS_transporter	AF-Q66H95-F1-model_v4	AF-Q66H95-F1-model_v4 Solute carrier family 49 member 4	8.062E-07	1.000	274	28	470	479	49	472	478	477	0.925	0.887
LOKIASV2_0831_ESMFold_MFS_transporter	AF-A0A0N7KPU5-F1-model_v4	AF-A0A0N7KPU5-F1-model_v4 Os08g0410500 protein	2.781E-07	1.000	274	17	471	479	3	446	486	487	0.950	0.914
LOKIASV2_0831_ESMFold_MFS_transporter	AF-A0A1D6HVY9-F1-model_v4	AF-A0A1D6HVY9-F1-model_v4 Oligosaccharide transferase1	1.062E-06	1.000	274	23	472	479	32	476	487	494	0.939	0.914
LOKIASV2_0831_ESMFold_MFS_transporter	AF-A0A1D6IHY2-F1-model_v4	AF-A0A1D6IHY2-F1-model_v4 Putative polyol transporter 1	5.023E-07	1.000	274	23	455	479	12	470	495	500	0.904	0.927
LOKIASV2_0831_ESMFold_MFS_transporter	AF-O80905-F1-model_v4	AF-O80905-F1-model_v4 Solute carrier family 40 member 1	4.463E-07	1.000	274	1	471	479	1	499	524	552	0.983	0.952
LOKIASV2_0831_ESMFold_MFS_transporter	AF-Q9JI12-F1-model_v4	AF-Q9JI12-F1-model_v4 Vesicular glutamate transporter 2	4.642E-07	1.000	274	9	476	479	61	505	582	516	0.977	0.765
LOKIASV2_0831_ESMFold_MFS_transporter	AF-Q8NDX2-F1-model_v4	AF-Q8NDX2-F1-model_v4 Vesicular glutamate transporter 3	3.965E-07	1.000	274	9	462	479	66	502	589	497	0.948	0.742
LOKIASV2_0831_ESMFold_MFS_transporter	AF-A0A0D2DKE4-F1-model_v4	AF-A0A0D2DKE4-F1-model_v4 Unplaced genomic scaffold supercont1.5, whole genome shotgun sequence	4.290E-07	1.000	274	10	472	479	91	583	594	538	0.967	0.830
LOKIASV2_0831_ESMFold_MFS_transporter	AF-Q7CPT9-F1-model_v4	AF-Q7CPT9-F1-model_v4 MFS family galactose:proton symporter	3.523E-07	1.000	273	31	477	479	15	459	464	497	0.933	0.959
LOKIASV2_0831_ESMFold_MFS_transporter	AF-Q6NUT3-F1-model_v4	AF-Q6NUT3-F1-model_v4 Major facilitator superfamily domain-containing protein 12	2.631E-06	1.000	273	28	476	479	18	473	480	501	0.937	0.950
LOKIASV2_0831_ESMFold_MFS_transporter	AF-Q8MS84-F1-model_v4	AF-Q8MS84-F1-model_v4 LP04804p	2.673E-07	1.000	273	22	479	479	13	453	482	497	0.956	0.915
LOKIASV2_0831_ESMFold_MFS_transporter	AF-A0A0D2GRW4-F1-model_v4	AF-A0A0D2GRW4-F1-model_v4 Unplaced genomic scaffold supercont1.8, whole genome shotgun sequence	2.110E-07	1.000	273	15	478	479	20	493	516	534	0.969	0.919
LOKIASV2_0831_ESMFold_MFS_transporter	AF-C1H4T5-F1-model_v4	AF-C1H4T5-F1-model_v4 MFS domain-containing protein	6.996E-08	1.000	273	17	459	479	65	475	519	477	0.925	0.792
LOKIASV2_0831_ESMFold_MFS_transporter	AF-A0A0D2DC80-F1-model_v4	AF-A0A0D2DC80-F1-model_v4 Unplaced genomic scaffold supercont1.8, whole genome shotgun sequence	1.456E-06	1.000	273	5	476	479	34	511	525	524	0.985	0.910
LOKIASV2_0831_ESMFold_MFS_transporter	AF-A0A1D6F983-F1-model_v4	AF-A0A1D6F983-F1-model_v4 Biopterin transport-related protein BT1	2.337E-06	1.000	273	15	465	479	66	520	531	503	0.942	0.857
LOKIASV2_0831_ESMFold_MFS_transporter	AF-A0A175VVK2-F1-model_v4	AF-A0A175VVK2-F1-model_v4 Putative glucose transporter rco-3	8.723E-07	1.000	273	27	458	479	17	469	569	483	0.902	0.796
LOKIASV2_0831_ESMFold_MFS_transporter	AF-U7PXR7-F1-model_v4	AF-U7PXR7-F1-model_v4 MFS domain-containing protein	6.886E-07	1.000	273	29	465	479	59	567	633	549	0.912	0.804
LOKIASV2_0831_ESMFold_MFS_transporter	AF-I1KB37-F1-model_v4	AF-I1KB37-F1-model_v4 Uncharacterized protein	1.105E-06	1.000	272	29	479	479	30	455	460	482	0.942	0.926
LOKIASV2_0831_ESMFold_MFS_transporter	AF-Q94AA1-F1-model_v4	AF-Q94AA1-F1-model_v4 UNC93-like protein 3	2.892E-07	1.000	272	1	473	479	12	443	464	494	0.987	0.931
LOKIASV2_0831_ESMFold_MFS_transporter	AF-P9WJX3-F1-model_v4	AF-P9WJX3-F1-model_v4 Probable multidrug-efflux transporter Rv1634	1.150E-06	1.000	272	9	468	479	4	467	471	520	0.960	0.985
LOKIASV2_0831_ESMFold_MFS_transporter	AF-A0A0D2DPF6-F1-model_v4	AF-A0A0D2DPF6-F1-model_v4 Unplaced genomic scaffold supercont1.4, whole genome shotgun sequence	5.023E-07	1.000	272	29	474	479	15	459	489	493	0.931	0.910
LOKIASV2_0831_ESMFold_MFS_transporter	AF-A0A158Q406-F1-model_v4	AF-A0A158Q406-F1-model_v4 MFS domain-containing protein	5.023E-07	1.000	272	5	471	479	2	488	505	537	0.975	0.964
LOKIASV2_0831_ESMFold_MFS_transporter	AF-B4FW72-F1-model_v4	AF-B4FW72-F1-model_v4 Folate-biopterin transporter 1 chloroplastic	1.105E-06	1.000	272	35	473	479	91	514	517	465	0.916	0.820
LOKIASV2_0831_ESMFold_MFS_transporter	AF-A0A175VSI8-F1-model_v4	AF-A0A175VSI8-F1-model_v4 Putative transporter mfs2	2.892E-07	1.000	272	14	473	479	121	565	570	506	0.960	0.781
LOKIASV2_0831_ESMFold_MFS_transporter	AF-A0A0H3GR29-F1-model_v4	AF-A0A0H3GR29-F1-model_v4 sn-glycerol-3-phosphate transporter	5.435E-07	1.000	271	20	470	479	17	447	448	480	0.942	0.962
LOKIASV2_0831_ESMFold_MFS_transporter	AF-Q9JJZ1-F1-model_v4	AF-Q9JJZ1-F1-model_v4 Solute carrier family 2, facilitated glucose transporter member 8	1.150E-06	1.000	271	25	472	479	20	476	478	514	0.935	0.956
LOKIASV2_0831_ESMFold_MFS_transporter	AF-Q21385-F1-model_v4	AF-Q21385-F1-model_v4 MFS domain-containing protein	3.523E-07	1.000	271	30	477	479	7	464	521	505	0.935	0.879
LOKIASV2_0831_ESMFold_MFS_transporter	AF-A0A0D2GP55-F1-model_v4	AF-A0A0D2GP55-F1-model_v4 Unplaced genomic scaffold supercont1.4, whole genome shotgun sequence	2.470E-07	1.000	271	21	474	479	88	541	548	500	0.948	0.828
LOKIASV2_0831_ESMFold_MFS_transporter	AF-A0A1C1D0S5-F1-model_v4	AF-A0A1C1D0S5-F1-model_v4 Vacuolar membrane amino acid uptake transporter fnx2	3.009E-07	1.000	271	11	462	479	52	557	561	544	0.944	0.902
LOKIASV2_0831_ESMFold_MFS_transporter	AF-C0NRA2-F1-model_v4	AF-C0NRA2-F1-model_v4 Sugar transporter	6.364E-07	1.000	271	17	462	479	112	571	649	510	0.931	0.709
LOKIASV2_0831_ESMFold_MFS_transporter	AF-Q5ANE1-F1-model_v4	AF-Q5ANE1-F1-model_v4 Glucose sensor	2.737E-06	1.000	271	17	459	479	23	478	748	500	0.925	0.610
LOKIASV2_0831_ESMFold_MFS_transporter	AF-U7Q0U9-F1-model_v4	AF-U7Q0U9-F1-model_v4 MFS domain-containing protein	8.386E-07	1.000	270	9	463	479	37	445	456	467	0.950	0.897
LOKIASV2_0831_ESMFold_MFS_transporter	AF-A0A1D6JU23-F1-model_v4	AF-A0A1D6JU23-F1-model_v4 Major facilitator superfamily protein	1.062E-06	1.000	270	17	471	479	3	445	484	484	0.950	0.915
LOKIASV2_0831_ESMFold_MFS_transporter	AF-A0A0K0DU83-F1-model_v4	AF-A0A0K0DU83-F1-model_v4 Uncharacterized protein	3.130E-07	1.000	270	3	472	479	20	476	493	512	0.981	0.927
LOKIASV2_0831_ESMFold_MFS_transporter	AF-A0A1C1CLK3-F1-model_v4	AF-A0A1C1CLK3-F1-model_v4 Major facilitator transporter	4.829E-07	1.000	270	15	476	479	41	511	546	512	0.965	0.863
LOKIASV2_0831_ESMFold_MFS_transporter	AF-A0A0D2DE03-F1-model_v4	AF-A0A0D2DE03-F1-model_v4 Unplaced genomic scaffold supercont1.7, whole genome shotgun sequence	3.256E-07	1.000	270	25	463	479	154	614	617	505	0.916	0.747
LOKIASV2_0831_ESMFold_MFS_transporter	AF-A0A1D6L8U4-F1-model_v4	AF-A0A1D6L8U4-F1-model_v4 Major facilitator superfamily protein	1.705E-06	1.000	269	23	473	479	26	471	481	491	0.942	0.927
LOKIASV2_0831_ESMFold_MFS_transporter	AF-A0A1C1D2V1-F1-model_v4	AF-A0A1C1D2V1-F1-model_v4 Putative phthalate transporter	2.337E-06	1.000	269	4	473	479	28	469	484	500	0.981	0.913
LOKIASV2_0831_ESMFold_MFS_transporter	AF-I1JRG9-F1-model_v4	AF-I1JRG9-F1-model_v4 MFS domain-containing protein	1.845E-06	1.000	269	15	478	479	46	492	497	506	0.969	0.899
LOKIASV2_0831_ESMFold_MFS_transporter	AF-Q6PXP3-F1-model_v4	AF-Q6PXP3-F1-model_v4 Solute carrier family 2, facilitated glucose transporter member 7	2.110E-07	1.000	269	11	477	479	10	492	512	533	0.975	0.943
LOKIASV2_0831_ESMFold_MFS_transporter	AF-Q2YDU8-F1-model_v4	AF-Q2YDU8-F1-model_v4 Protein spinster homolog 1	6.364E-07	1.000	269	24	473	479	56	500	528	493	0.939	0.843
LOKIASV2_0831_ESMFold_MFS_transporter	AF-K0F8E7-F1-model_v4	AF-K0F8E7-F1-model_v4 Transporter	8.062E-07	1.000	269	28	477	479	15	533	535	559	0.939	0.970
LOKIASV2_0831_ESMFold_MFS_transporter	AF-Q91X85-F1-model_v4	AF-Q91X85-F1-model_v4 Feline leukemia virus subgroup C receptor-related protein 2	1.062E-06	1.000	269	23	475	479	99	524	551	476	0.946	0.773
LOKIASV2_0831_ESMFold_MFS_transporter	AF-P39932-F1-model_v4	AF-P39932-F1-model_v4 Sugar transporter STL1	6.620E-07	1.000	269	16	476	479	1	499	569	539	0.962	0.877
LOKIASV2_0831_ESMFold_MFS_transporter	AF-A0A0D2GEZ0-F1-model_v4	AF-A0A0D2GEZ0-F1-model_v4 Unplaced genomic scaffold supercont1.6, whole genome shotgun sequence	1.456E-06	1.000	269	31	462	479	115	551	618	477	0.902	0.707
LOKIASV2_0831_ESMFold_MFS_transporter	AF-Q86WB7-F1-model_v4	AF-Q86WB7-F1-model_v4 Protein unc-93 homolog A	2.077E-06	1.000	268	27	473	479	3	438	457	491	0.933	0.954
LOKIASV2_0831_ESMFold_MFS_transporter	AF-F1QYH9-F1-model_v4	AF-F1QYH9-F1-model_v4 MFS domain-containing protein	4.829E-07	1.000	268	31	471	479	18	471	484	496	0.921	0.938
LOKIASV2_0831_ESMFold_MFS_transporter	AF-I1K0V0-F1-model_v4	AF-I1K0V0-F1-model_v4 G3P/Pi transporter	2.160E-06	1.000	268	30	475	479	30	477	496	495	0.931	0.903
LOKIASV2_0831_ESMFold_MFS_transporter	AF-A0A0D2H1D7-F1-model_v4	AF-A0A0D2H1D7-F1-model_v4 Unplaced genomic scaffold supercont1.1, whole genome shotgun sequence	6.466E-08	1.000	268	7	472	479	22	470	497	504	0.973	0.903
LOKIASV2_0831_ESMFold_MFS_transporter	AF-A0A0D2E679-F1-model_v4	AF-A0A0D2E679-F1-model_v4 Unplaced genomic scaffold supercont1.1, whole genome shotgun sequence	8.062E-07	1.000	268	17	475	479	51	489	505	493	0.958	0.869
LOKIASV2_0831_ESMFold_MFS_transporter	AF-U7PH55-F1-model_v4	AF-U7PH55-F1-model_v4 MFS domain-containing protein	2.247E-06	1.000	268	9	471	479	31	481	507	497	0.967	0.890
LOKIASV2_0831_ESMFold_MFS_transporter	AF-B5BP49-F1-model_v4	AF-B5BP49-F1-model_v4 Uncharacterized transporter C460.05	1.666E-07	1.000	268	19	470	479	85	498	530	475	0.944	0.781
LOKIASV2_0831_ESMFold_MFS_transporter	AF-C1GNB5-F1-model_v4	AF-C1GNB5-F1-model_v4 Arabinose-proton symporter	4.124E-07	1.000	268	22	458	479	4	481	551	508	0.912	0.868
LOKIASV2_0831_ESMFold_MFS_transporter	AF-Q8BFU8-F1-model_v4	AF-Q8BFU8-F1-model_v4 Vesicular glutamate transporter 3	6.620E-07	1.000	268	17	462	479	88	515	601	492	0.931	0.712
LOKIASV2_0831_ESMFold_MFS_transporter	AF-A0A044V0E5-F1-model_v4	AF-A0A044V0E5-F1-model_v4 MFS domain-containing protein	9.074E-07	1.000	267	15	463	479	20	440	445	477	0.937	0.946
LOKIASV2_0831_ESMFold_MFS_transporter	AF-A0A0K0EBV6-F1-model_v4	AF-A0A0K0EBV6-F1-model_v4 MFS domain-containing protein	2.431E-06	1.000	267	27	479	479	2	448	448	496	0.946	0.998
LOKIASV2_0831_ESMFold_MFS_transporter	AF-A0A175WEX4-F1-model_v4	AF-A0A175WEX4-F1-model_v4 Polyamine transporter 4	1.666E-07	1.000	267	20	466	479	37	478	480	499	0.933	0.921
LOKIASV2_0831_ESMFold_MFS_transporter	AF-A0A1D6FKM5-F1-model_v4	AF-A0A1D6FKM5-F1-model_v4 Solute carrier family 2, facilitated glucose transporter member 8	8.062E-07	1.000	267	29	463	479	55	524	538	525	0.908	0.874
LOKIASV2_0831_ESMFold_MFS_transporter	AF-F1QX10-F1-model_v4	AF-F1QX10-F1-model_v4 Solute carrier family 18 member B1	4.753E-06	1.000	266	27	475	479	1	421	434	479	0.937	0.970
LOKIASV2_0831_ESMFold_MFS_transporter	AF-A0A5S6PNU1-F1-model_v4	AF-A0A5S6PNU1-F1-model_v4 BMA-VNUT-1, isoform a	1.456E-06	1.000	266	15	463	479	20	441	446	480	0.937	0.946
LOKIASV2_0831_ESMFold_MFS_transporter	AF-O94491-F1-model_v4	AF-O94491-F1-model_v4 Uncharacterized transporter C417.10	4.124E-07	1.000	266	17	473	479	55	485	508	491	0.954	0.848
LOKIASV2_0831_ESMFold_MFS_transporter	AF-A0A0D2GRW9-F1-model_v4	AF-A0A0D2GRW9-F1-model_v4 Unplaced genomic scaffold supercont1.8, whole genome shotgun sequence	1.950E-07	1.000	266	20	476	479	83	531	535	511	0.954	0.839
LOKIASV2_0831_ESMFold_MFS_transporter	AF-B4FWK6-F1-model_v4	AF-B4FWK6-F1-model_v4 Organic cation/carnitine transporter 3	2.247E-06	1.000	266	8	472	479	17	516	538	556	0.971	0.929
LOKIASV2_0831_ESMFold_MFS_transporter	AF-A0A1C1CZH8-F1-model_v4	AF-A0A1C1CZH8-F1-model_v4 Transporter mfs1	4.124E-07	1.000	266	23	476	479	129	571	573	507	0.948	0.773
LOKIASV2_0831_ESMFold_MFS_transporter	AF-A3QK31-F1-model_v4	AF-A3QK31-F1-model_v4 MGC163045 protein	6.364E-07	1.000	266	10	476	479	54	497	582	516	0.975	0.763
LOKIASV2_0831_ESMFold_MFS_transporter	AF-Q8TD20-F1-model_v4	AF-Q8TD20-F1-model_v4 Solute carrier family 2, facilitated glucose transporter member 12	5.881E-07	1.000	266	28	472	479	37	573	617	569	0.929	0.870
LOKIASV2_0831_ESMFold_MFS_transporter	AF-Q2G1E2-F1-model_v4	AF-Q2G1E2-F1-model_v4 Membrane protein, putative	5.881E-07	1.000	265	15	471	479	15	456	459	494	0.954	0.963
LOKIASV2_0831_ESMFold_MFS_transporter	AF-A0A0D2ETA4-F1-model_v4	AF-A0A0D2ETA4-F1-model_v4 Unplaced genomic scaffold supercont1.6, whole genome shotgun sequence	3.607E-06	1.000	265	24	471	479	38	471	489	487	0.935	0.888
LOKIASV2_0831_ESMFold_MFS_transporter	AF-A0A1C1CF51-F1-model_v4	AF-A0A1C1CF51-F1-model_v4 MFS transporter	1.315E-07	1.000	265	17	477	479	55	487	506	494	0.962	0.856
LOKIASV2_0831_ESMFold_MFS_transporter	AF-A0A0D2DK13-F1-model_v4	AF-A0A0D2DK13-F1-model_v4 Unplaced genomic scaffold supercont1.5, whole genome shotgun sequence	5.654E-07	1.000	265	24	476	479	116	560	562	502	0.946	0.792
LOKIASV2_0831_ESMFold_MFS_transporter	AF-Q1L8X9-F1-model_v4	AF-Q1L8X9-F1-model_v4 Vesicular glutamate transporter 3	8.062E-07	1.000	265	17	479	479	75	529	590	521	0.967	0.771
LOKIASV2_0831_ESMFold_MFS_transporter	AF-X8FIQ9-F1-model_v4	AF-X8FIQ9-F1-model_v4 Sugar (And other) transporter family protein	2.160E-06	1.000	264	31	415	479	7	379	383	410	0.804	0.974
LOKIASV2_0831_ESMFold_MFS_transporter	AF-A0A0R0KNA6-F1-model_v4	AF-A0A0R0KNA6-F1-model_v4 MFS domain-containing protein	9.819E-07	1.000	264	11	476	479	27	483	487	518	0.973	0.938
LOKIASV2_0831_ESMFold_MFS_transporter	AF-Q6ZA55-F1-model_v4	AF-Q6ZA55-F1-model_v4 Os07g0172900 protein	2.247E-06	1.000	264	4	465	479	33	479	490	502	0.965	0.912
LOKIASV2_0831_ESMFold_MFS_transporter	AF-A0A0G2JUB6-F1-model_v4	AF-A0A0G2JUB6-F1-model_v4 Major facilitator superfamily domain-containing 13A	1.456E-06	1.000	264	31	472	479	15	499	517	537	0.923	0.938
LOKIASV2_0831_ESMFold_MFS_transporter	AF-A0A077Z5C9-F1-model_v4	AF-A0A077Z5C9-F1-model_v4 Solute carrier family 2, facilitated glucose	1.294E-06	1.000	264	27	472	479	34	507	518	511	0.931	0.915
LOKIASV2_0831_ESMFold_MFS_transporter	AF-A0A1C1CSD6-F1-model_v4	AF-A0A1C1CSD6-F1-model_v4 Putative transporter	6.620E-07	1.000	264	15	461	479	36	469	523	481	0.933	0.830
LOKIASV2_0831_ESMFold_MFS_transporter	AF-D4A237-F1-model_v4	AF-D4A237-F1-model_v4 Solute carrier family 2 member 9	3.387E-07	1.000	264	29	477	479	45	513	545	509	0.937	0.861
LOKIASV2_0831_ESMFold_MFS_transporter	AF-A0A1C1CUY2-F1-model_v4	AF-A0A1C1CUY2-F1-model_v4 Putative transporter MCH2	2.847E-06	1.000	263	29	472	479	5	402	474	467	0.927	0.840
LOKIASV2_0831_ESMFold_MFS_transporter	AF-Q9XVK0-F1-model_v4	AF-Q9XVK0-F1-model_v4 MFS domain-containing protein	3.467E-06	1.000	263	30	458	479	36	454	485	472	0.896	0.864
LOKIASV2_0831_ESMFold_MFS_transporter	AF-J3QNS5-F1-model_v4	AF-J3QNS5-F1-model_v4 Major facilitator superfamily domain-containing 4B4	7.875E-08	1.000	263	34	471	479	2	419	503	467	0.914	0.831
LOKIASV2_0831_ESMFold_MFS_transporter	AF-E9QGX4-F1-model_v4	AF-E9QGX4-F1-model_v4 Solute carrier family 2 member 5	2.077E-06	1.000	263	22	461	479	19	461	511	488	0.919	0.867
LOKIASV2_0831_ESMFold_MFS_transporter	AF-C0NTD2-F1-model_v4	AF-C0NTD2-F1-model_v4 Sugar transporter	6.886E-07	1.000	263	26	475	479	7	487	530	533	0.939	0.908
LOKIASV2_0831_ESMFold_MFS_transporter	AF-Q4DPU2-F1-model_v4	AF-Q4DPU2-F1-model_v4 Uncharacterized protein	2.077E-06	1.000	263	1	477	479	1	513	552	554	0.996	0.929
LOKIASV2_0831_ESMFold_MFS_transporter	AF-Q9I2V9-F1-model_v4	AF-Q9I2V9-F1-model_v4 Nitrate/nitrite transporter	6.118E-07	1.000	262	22	470	479	19	391	403	455	0.937	0.926
LOKIASV2_0831_ESMFold_MFS_transporter	AF-Q8VCV9-F1-model_v4	AF-Q8VCV9-F1-model_v4 Sodium-dependent glucose transporter 1A	2.375E-07	1.000	262	32	477	479	2	422	425	477	0.931	0.991
LOKIASV2_0831_ESMFold_MFS_transporter	AF-Q1W0R3-F1-model_v4	AF-Q1W0R3-F1-model_v4 Uncharacterized protein	1.613E-05	1.000	262	30	473	479	30	457	471	462	0.927	0.909
LOKIASV2_0831_ESMFold_MFS_transporter	AF-A0A0R0ETB5-F1-model_v4	AF-A0A0R0ETB5-F1-model_v4 MFS domain-containing protein	9.074E-07	1.000	262	22	461	479	34	455	478	483	0.919	0.883
LOKIASV2_0831_ESMFold_MFS_transporter	AF-Q62634-F1-model_v4	AF-Q62634-F1-model_v4 Vesicular glutamate transporter 1	1.346E-06	1.000	262	19	476	479	64	497	560	506	0.956	0.775
LOKIASV2_0831_ESMFold_MFS_transporter	AF-A0A175W3H7-F1-model_v4	AF-A0A175W3H7-F1-model_v4 Putative transporter mfs2	1.845E-06	1.000	262	15	476	479	76	516	577	506	0.965	0.764
LOKIASV2_0831_ESMFold_MFS_transporter	AF-Q5W8I7-F1-model_v4	AF-Q5W8I7-F1-model_v4 Vesicular glutamate transporter 2.2	6.620E-07	1.000	262	19	462	479	72	499	587	491	0.927	0.729
LOKIASV2_0831_ESMFold_MFS_transporter	AF-C1GQJ8-F1-model_v4	AF-C1GQJ8-F1-model_v4 MFS domain-containing protein	2.337E-06	1.000	262	8	458	479	76	597	708	566	0.942	0.737
LOKIASV2_0831_ESMFold_MFS_transporter	AF-P9WJY1-F1-model_v4	AF-P9WJY1-F1-model_v4 Uncharacterized MFS-type transporter Rv0037c	7.163E-07	1.000	261	9	465	479	9	439	441	483	0.954	0.977
LOKIASV2_0831_ESMFold_MFS_transporter	AF-P08194-F1-model_v4	AF-P08194-F1-model_v4 Glycerol-3-phosphate transporter	1.996E-06	1.000	261	20	471	479	17	448	452	475	0.944	0.956
LOKIASV2_0831_ESMFold_MFS_transporter	AF-M0RA42-F1-model_v4	AF-M0RA42-F1-model_v4 Unc-93 homolog A	3.467E-06	1.000	261	27	472	479	3	442	457	489	0.931	0.963
LOKIASV2_0831_ESMFold_MFS_transporter	AF-B4FA98-F1-model_v4	AF-B4FA98-F1-model_v4 Putative glycerol-3-phosphate transporter 4	2.470E-07	1.000	261	28	475	479	36	485	495	492	0.935	0.909
LOKIASV2_0831_ESMFold_MFS_transporter	AF-Q688W0-F1-model_v4	AF-Q688W0-F1-model_v4 Os05g0567800 protein	5.023E-07	1.000	261	7	462	479	39	485	501	510	0.952	0.892
LOKIASV2_0831_ESMFold_MFS_transporter	AF-A0A1D6MM01-F1-model_v4	AF-A0A1D6MM01-F1-model_v4 Plastidic glucose transporter 4	6.021E-06	1.000	261	9	462	479	79	520	539	485	0.948	0.820
LOKIASV2_0831_ESMFold_MFS_transporter	AF-K7MWN2-F1-model_v4	AF-K7MWN2-F1-model_v4 MFS domain-containing protein	1.996E-06	1.000	261	9	473	479	93	551	551	498	0.971	0.833
LOKIASV2_0831_ESMFold_MFS_transporter	AF-Q7TSF2-F1-model_v4	AF-Q7TSF2-F1-model_v4 Vesicular glutamate transporter 3	1.105E-06	1.000	261	17	478	479	75	527	588	517	0.965	0.770
LOKIASV2_0831_ESMFold_MFS_transporter	AF-A0A1C1D3H2-F1-model_v4	AF-A0A1C1D3H2-F1-model_v4 Caffeine resistance protein 5	8.386E-07	1.000	261	25	475	479	154	611	617	518	0.942	0.742
LOKIASV2_0831_ESMFold_MFS_transporter	AF-Q32DU7-F1-model_v4	AF-Q32DU7-F1-model_v4 sn-glycerol-3-phosphate permease	2.247E-06	1.000	260	20	471	479	17	448	452	475	0.944	0.956
LOKIASV2_0831_ESMFold_MFS_transporter	AF-Q9JIF3-F1-model_v4	AF-Q9JIF3-F1-model_v4 Solute carrier family 2, facilitated glucose transporter member 8	1.196E-06	1.000	260	9	472	479	9	475	477	524	0.969	0.979
LOKIASV2_0831_ESMFold_MFS_transporter	AF-Q9LTP6-F1-model_v4	AF-Q9LTP6-F1-model_v4 Putative sugar transporter ERD6-like 13	5.881E-07	1.000	260	4	462	479	13	471	488	518	0.958	0.941
LOKIASV2_0831_ESMFold_MFS_transporter	AF-C0NY13-F1-model_v4	AF-C0NY13-F1-model_v4 MFS domain-containing protein	3.664E-07	1.000	260	2	470	479	7	463	495	512	0.979	0.923
LOKIASV2_0831_ESMFold_MFS_transporter	AF-Q9BYW1-F1-model_v4	AF-Q9BYW1-F1-model_v4 Solute carrier family 2, facilitated glucose transporter member 11	1.400E-06	1.000	260	16	461	479	1	455	496	497	0.931	0.917
LOKIASV2_0831_ESMFold_MFS_transporter	AF-A0A0D2GQE7-F1-model_v4	AF-A0A0D2GQE7-F1-model_v4 Unplaced genomic scaffold supercont1.4, whole genome shotgun sequence	1.996E-06	1.000	260	32	476	479	32	481	510	495	0.929	0.882
LOKIASV2_0831_ESMFold_MFS_transporter	AF-U7Q4Q4-F1-model_v4	AF-U7Q4Q4-F1-model_v4 MFS domain-containing protein	1.168E-07	1.000	260	5	475	479	52	507	532	512	0.983	0.857
LOKIASV2_0831_ESMFold_MFS_transporter	AF-A0A0D2H5I7-F1-model_v4	AF-A0A0D2H5I7-F1-model_v4 Unplaced genomic scaffold supercont1.1, whole genome shotgun sequence	1.774E-06	1.000	260	32	463	479	48	559	604	547	0.902	0.848
LOKIASV2_0831_ESMFold_MFS_transporter	AF-A0A0D2DJE6-F1-model_v4	AF-A0A0D2DJE6-F1-model_v4 Unplaced genomic scaffold supercont1.5, whole genome shotgun sequence	1.639E-06	1.000	260	17	461	479	111	565	639	488	0.929	0.712
LOKIASV2_0831_ESMFold_MFS_transporter	AF-C1GPR7-F1-model_v4	AF-C1GPR7-F1-model_v4 Sugar transporter	7.750E-07	1.000	260	17	462	479	112	571	649	495	0.931	0.709
LOKIASV2_0831_ESMFold_MFS_transporter	AF-A0A0A2V0J8-F1-model_v4	AF-A0A0A2V0J8-F1-model_v4 Uncharacterized protein	4.829E-07	1.000	260	28	473	479	134	596	651	503	0.931	0.711
LOKIASV2_0831_ESMFold_MFS_transporter	AF-Q8ZNG6-F1-model_v4	AF-Q8ZNG6-F1-model_v4 MFS family, sn-glycerol-3-phosphate transport protein	1.244E-06	1.000	259	20	471	479	17	451	452	477	0.944	0.962
LOKIASV2_0831_ESMFold_MFS_transporter	AF-Q63344-F1-model_v4	AF-Q63344-F1-model_v4 Monocarboxylate transporter 2	1.639E-06	1.000	259	30	473	479	32	440	489	464	0.927	0.836
LOKIASV2_0831_ESMFold_MFS_transporter	AF-A0A175VNJ6-F1-model_v4	AF-A0A175VNJ6-F1-model_v4 High-affinity nicotinic acid transporter	6.886E-07	1.000	259	17	472	479	40	473	492	483	0.952	0.882
LOKIASV2_0831_ESMFold_MFS_transporter	AF-A0A0D2GK55-F1-model_v4	AF-A0A0D2GK55-F1-model_v4 Unplaced genomic scaffold supercont1.3, whole genome shotgun sequence	9.074E-07	1.000	259	16	474	479	48	477	512	495	0.958	0.840
LOKIASV2_0831_ESMFold_MFS_transporter	AF-A0A0D2H4Z1-F1-model_v4	AF-A0A0D2H4Z1-F1-model_v4 Unplaced genomic scaffold supercont1.4, whole genome shotgun sequence	5.023E-07	1.000	259	7	473	479	56	495	518	497	0.975	0.849
LOKIASV2_0831_ESMFold_MFS_transporter	AF-P13090-F1-model_v4	AF-P13090-F1-model_v4 Aminotriazole resistance protein	4.059E-06	1.000	259	27	474	479	63	531	542	506	0.935	0.865
LOKIASV2_0831_ESMFold_MFS_transporter	AF-Q5A7L9-F1-model_v4	AF-Q5A7L9-F1-model_v4 Hgt19p	2.247E-06	1.000	259	8	461	479	91	557	630	506	0.948	0.741
LOKIASV2_0831_ESMFold_MFS_transporter	AF-C0NUX0-F1-model_v4	AF-C0NUX0-F1-model_v4 Sugar transporter	3.812E-07	1.000	259	8	462	479	81	550	632	516	0.950	0.744
