LOKIASV2_3409_ESMFold_DEAD-DEAH_box_helicase_family_protein	AF-Q59PU6-F1-model_v4	AF-Q59PU6-F1-model_v4 Uncharacterized protein	1.401E-18	1.000	560	292	680	729	17	381	623	423	0.534	0.586
LOKIASV2_3409_ESMFold_DEAD-DEAH_box_helicase_family_protein	AF-C0ND54-F1-model_v4	AF-C0ND54-F1-model_v4 Uncharacterized protein	1.389E-19	1.000	549	292	703	729	42	438	653	457	0.565	0.608
LOKIASV2_3409_ESMFold_DEAD-DEAH_box_helicase_family_protein	AF-K0EP56-F1-model_v4	AF-K0EP56-F1-model_v4 Type III restriction protein res subunit	2.119E-14	1.000	537	492	729	729	6	254	275	253	0.326	0.905
LOKIASV2_3409_ESMFold_DEAD-DEAH_box_helicase_family_protein	AF-U7PNC7-F1-model_v4	AF-U7PNC7-F1-model_v4 Uncharacterized protein	2.274E-18	1.000	532	296	702	729	20	422	679	456	0.558	0.594
LOKIASV2_3409_ESMFold_DEAD-DEAH_box_helicase_family_protein	AF-A0A0A2V717-F1-model_v4	AF-A0A0A2V717-F1-model_v4 Uncharacterized protein	6.257E-19	1.000	529	292	705	729	42	437	652	458	0.568	0.607
LOKIASV2_3409_ESMFold_DEAD-DEAH_box_helicase_family_protein	AF-Q2FVC3-F1-model_v4	AF-Q2FVC3-F1-model_v4 Uncharacterized protein	4.773E-25	1.000	516	18	679	729	29	557	953	690	0.908	0.555
LOKIASV2_3409_ESMFold_DEAD-DEAH_box_helicase_family_protein	AF-A0A0D2GKB3-F1-model_v4	AF-A0A0D2GKB3-F1-model_v4 Unplaced genomic scaffold supercont1.5, whole genome shotgun sequence	4.826E-18	1.000	515	291	709	729	33	439	671	467	0.575	0.607
LOKIASV2_3409_ESMFold_DEAD-DEAH_box_helicase_family_protein	AF-A0A1C1CXU0-F1-model_v4	AF-A0A1C1CXU0-F1-model_v4 Putative ATP-dependent helicase irc3	1.834E-18	1.000	508	295	708	729	41	441	677	461	0.568	0.592
LOKIASV2_3409_ESMFold_DEAD-DEAH_box_helicase_family_protein	AF-Q59PU5-F1-model_v4	AF-Q59PU5-F1-model_v4 Double-stranded DNA-dependent ATPase	1.193E-18	1.000	504	292	725	729	20	447	655	495	0.595	0.653
LOKIASV2_3409_ESMFold_DEAD-DEAH_box_helicase_family_protein	AF-A0A0H3GVM2-F1-model_v4	AF-A0A0H3GVM2-F1-model_v4 Putative helicase	3.169E-17	1.000	493	289	716	729	89	503	519	472	0.587	0.800
LOKIASV2_3409_ESMFold_DEAD-DEAH_box_helicase_family_protein	AF-Q1MTR1-F1-model_v4	AF-Q1MTR1-F1-model_v4 Putative mitochondrial ATP-dependent helicase irc3	5.374E-18	1.000	491	290	708	729	15	434	606	474	0.575	0.693
LOKIASV2_3409_ESMFold_DEAD-DEAH_box_helicase_family_protein	AF-Q06683-F1-model_v4	AF-Q06683-F1-model_v4 Putative ATP-dependent helicase IRC3	2.155E-18	1.000	491	263	713	729	12	443	689	508	0.619	0.627
LOKIASV2_3409_ESMFold_DEAD-DEAH_box_helicase_family_protein	AF-P9WL21-F1-model_v4	AF-P9WL21-F1-model_v4 Uncharacterized protein Rv2917	1.953E-17	1.000	474	289	708	729	33	421	602	461	0.576	0.646
LOKIASV2_3409_ESMFold_DEAD-DEAH_box_helicase_family_protein	AF-A0A175W992-F1-model_v4	AF-A0A175W992-F1-model_v4 Putative mitochondrial ATP-dependent helicase irc3	1.662E-17	1.000	469	292	720	729	42	468	684	493	0.588	0.624
LOKIASV2_3409_ESMFold_DEAD-DEAH_box_helicase_family_protein	AF-Q4D326-F1-model_v4	AF-Q4D326-F1-model_v4 Probable helicase A859L	2.080E-16	1.000	444	280	713	729	219	618	953	464	0.595	0.420
LOKIASV2_3409_ESMFold_DEAD-DEAH_box_helicase_family_protein	AF-Q32HY4-F1-model_v4	AF-Q32HY4-F1-model_v4 Putative ATP-dependent helicase	5.777E-16	1.000	437	301	684	729	4	360	586	427	0.527	0.609
LOKIASV2_3409_ESMFold_DEAD-DEAH_box_helicase_family_protein	AF-O33011-F1-model_v4	AF-O33011-F1-model_v4 Uncharacterized protein ML1624	1.885E-15	1.000	426	280	681	729	20	402	596	439	0.551	0.643
LOKIASV2_3409_ESMFold_DEAD-DEAH_box_helicase_family_protein	AF-Q7CQ72-F1-model_v4	AF-Q7CQ72-F1-model_v4 Putative ATP-dependent helicase	1.990E-15	1.000	423	301	684	729	4	360	586	429	0.527	0.609
LOKIASV2_3409_ESMFold_DEAD-DEAH_box_helicase_family_protein	AF-P33919-F1-model_v4	AF-P33919-F1-model_v4 Putative DNA repair helicase RadD	4.002E-15	1.000	419	301	678	729	4	355	586	417	0.519	0.601
LOKIASV2_3409_ESMFold_DEAD-DEAH_box_helicase_family_protein	AF-B4F769-F1-model_v4	AF-B4F769-F1-model_v4 SWI/SNF-related matrix-associated actin-dependent regulator of chromatin subfamily A-like protein 1	1.620E-14	1.000	419	289	703	729	382	809	910	473	0.569	0.470
LOKIASV2_3409_ESMFold_DEAD-DEAH_box_helicase_family_protein	AF-Q9VMX6-F1-model_v4	AF-Q9VMX6-F1-model_v4 SWI/SNF-related matrix-associated actin-dependent regulator of chromatin subfamily A-like protein 1	4.223E-15	1.000	412	267	713	729	195	675	755	531	0.613	0.637
LOKIASV2_3409_ESMFold_DEAD-DEAH_box_helicase_family_protein	AF-P31380-F1-model_v4	AF-P31380-F1-model_v4 ATP-dependent helicase FUN30	1.215E-16	1.000	407	288	725	729	555	1124	1131	596	0.601	0.504
LOKIASV2_3409_ESMFold_DEAD-DEAH_box_helicase_family_protein	AF-D3ZDS8-F1-model_v4	AF-D3ZDS8-F1-model_v4 Zinc finger RANBP2-type-containing 3	5.577E-14	1.000	397	294	710	729	45	486	1072	482	0.572	0.412
LOKIASV2_3409_ESMFold_DEAD-DEAH_box_helicase_family_protein	AF-A0A0H3GW57-F1-model_v4	AF-A0A0H3GW57-F1-model_v4 Putative ATP-dependent helicase	4.223E-15	1.000	395	301	686	729	4	362	585	432	0.529	0.614
LOKIASV2_3409_ESMFold_DEAD-DEAH_box_helicase_family_protein	AF-Q9NZC9-F1-model_v4	AF-Q9NZC9-F1-model_v4 SWI/SNF-related matrix-associated actin-dependent regulator of chromatin subfamily A-like protein 1	1.635E-13	1.000	395	292	705	729	426	855	954	474	0.568	0.451
LOKIASV2_3409_ESMFold_DEAD-DEAH_box_helicase_family_protein	AF-Q6NZP1-F1-model_v4	AF-Q6NZP1-F1-model_v4 DNA annealing helicase and endonuclease ZRANB3	4.498E-14	1.000	393	280	710	729	17	470	1069	500	0.591	0.425
LOKIASV2_3409_ESMFold_DEAD-DEAH_box_helicase_family_protein	AF-B0R061-F1-model_v4	AF-B0R061-F1-model_v4 SWI/SNF-related matrix-associated actin-dependent regulator of chromatin subfamily A containing DEAD/H box 1A	3.965E-16	1.000	390	238	729	729	389	972	972	618	0.675	0.601
LOKIASV2_3409_ESMFold_DEAD-DEAH_box_helicase_family_protein	AF-Q7F2E4-F1-model_v4	AF-Q7F2E4-F1-model_v4 DNA excision repair protein CSB	2.382E-13	1.000	390	300	702	729	370	853	1187	509	0.553	0.408
LOKIASV2_3409_ESMFold_DEAD-DEAH_box_helicase_family_protein	AF-Q389B2-F1-model_v4	AF-Q389B2-F1-model_v4 Probable helicase A859L	7.977E-16	1.000	385	251	717	729	149	618	922	534	0.641	0.510
LOKIASV2_3409_ESMFold_DEAD-DEAH_box_helicase_family_protein	AF-X8FAU2-F1-model_v4	AF-X8FAU2-F1-model_v4 Helicase conserved C-terminal domain protein	6.852E-15	1.000	380	312	704	729	2	372	553	444	0.539	0.671
LOKIASV2_3409_ESMFold_DEAD-DEAH_box_helicase_family_protein	AF-A0A158Q5V8-F1-model_v4	AF-A0A158Q5V8-F1-model_v4 Uncharacterized protein	2.382E-13	1.000	380	280	715	729	78	523	555	489	0.598	0.804
LOKIASV2_3409_ESMFold_DEAD-DEAH_box_helicase_family_protein	AF-A4I6A0-F1-model_v4	AF-A4I6A0-F1-model_v4 Probable helicase A859L	4.002E-15	1.000	380	259	704	729	162	608	950	513	0.612	0.471
LOKIASV2_3409_ESMFold_DEAD-DEAH_box_helicase_family_protein	AF-Q4CVA8-F1-model_v4	AF-Q4CVA8-F1-model_v4 Helicase-like protein, putative	3.438E-14	1.000	376	301	717	729	126	529	837	468	0.572	0.483
LOKIASV2_3409_ESMFold_DEAD-DEAH_box_helicase_family_protein	AF-D4ACG6-F1-model_v4	AF-D4ACG6-F1-model_v4 Chromodomain helicase DNA-binding protein 1-like	2.628E-14	1.000	374	276	703	729	10	481	903	507	0.587	0.523
LOKIASV2_3409_ESMFold_DEAD-DEAH_box_helicase_family_protein	AF-Q2G090-F1-model_v4	AF-Q2G090-F1-model_v4 DNA helicase	2.027E-13	1.000	364	301	703	729	14	363	593	427	0.553	0.590
LOKIASV2_3409_ESMFold_DEAD-DEAH_box_helicase_family_protein	AF-Q5F8R6-F1-model_v4	AF-Q5F8R6-F1-model_v4 Type I site-specific deoxyribonuclease	2.382E-13	1.000	358	303	725	729	292	716	1001	461	0.580	0.425
LOKIASV2_3409_ESMFold_DEAD-DEAH_box_helicase_family_protein	AF-A0A175W8E9-F1-model_v4	AF-A0A175W8E9-F1-model_v4 DNA repair protein rhp26	4.747E-14	1.000	358	254	702	729	328	860	1167	570	0.616	0.457
LOKIASV2_3409_ESMFold_DEAD-DEAH_box_helicase_family_protein	AF-Q8MNV7-F1-model_v4	AF-Q8MNV7-F1-model_v4 SWI/SNF-related matrix-associated actin-dependent regulator of chromatin subfamily A-like protein 1 homolog	1.195E-12	1.000	356	281	703	729	170	618	690	490	0.580	0.651
LOKIASV2_3409_ESMFold_DEAD-DEAH_box_helicase_family_protein	AF-A0A077ZGS4-F1-model_v4	AF-A0A077ZGS4-F1-model_v4 ATP-dependent DNA helicase	2.652E-13	1.000	355	298	704	729	13	365	583	433	0.558	0.605
LOKIASV2_3409_ESMFold_DEAD-DEAH_box_helicase_family_protein	AF-Q4CXR8-F1-model_v4	AF-Q4CXR8-F1-model_v4 SNF2 DNA repair protein, putative	3.828E-14	1.000	347	259	698	729	126	583	697	525	0.604	0.657
LOKIASV2_3409_ESMFold_DEAD-DEAH_box_helicase_family_protein	AF-A4HUR7-F1-model_v4	AF-A4HUR7-F1-model_v4 Putative SNF2/RAD54 related DNA helicase	1.635E-13	1.000	345	280	709	729	149	593	958	517	0.590	0.465
LOKIASV2_3409_ESMFold_DEAD-DEAH_box_helicase_family_protein	AF-A4I473-F1-model_v4	AF-A4I473-F1-model_v4 SNF2_family_N-terminal_domain /Helicase_conserved_C-terminal_domain_containing_protein_-_putative	1.903E-14	1.000	344	291	701	729	24	632	1581	625	0.564	0.385
LOKIASV2_3409_ESMFold_DEAD-DEAH_box_helicase_family_protein	AF-Q58083-F1-model_v4	AF-Q58083-F1-model_v4 Probable ATP-dependent RNA helicase MJ0669	1.650E-12	1.000	343	293	701	729	4	356	367	431	0.561	0.962
LOKIASV2_3409_ESMFold_DEAD-DEAH_box_helicase_family_protein	AF-Q4D0U9-F1-model_v4	AF-Q4D0U9-F1-model_v4 RNA helicase, putative	8.202E-13	1.000	343	304	702	729	62	413	436	421	0.547	0.807
LOKIASV2_3409_ESMFold_DEAD-DEAH_box_helicase_family_protein	AF-P39517-F1-model_v4	AF-P39517-F1-model_v4 ATP-dependent RNA helicase DHH1	2.278E-12	1.000	343	305	701	729	72	401	506	407	0.545	0.652
LOKIASV2_3409_ESMFold_DEAD-DEAH_box_helicase_family_protein	AF-Q5FA80-F1-model_v4	AF-Q5FA80-F1-model_v4 RNA helicase	1.073E-12	1.000	342	301	701	729	25	369	457	419	0.550	0.755
LOKIASV2_3409_ESMFold_DEAD-DEAH_box_helicase_family_protein	AF-A0A0K0ETJ5-F1-model_v4	AF-A0A0K0ETJ5-F1-model_v4 ATP-dependent DNA helicase	2.257E-13	1.000	339	240	680	729	22	408	588	467	0.605	0.658
LOKIASV2_3409_ESMFold_DEAD-DEAH_box_helicase_family_protein	AF-Q5A9Z6-F1-model_v4	AF-Q5A9Z6-F1-model_v4 ATP-dependent RNA helicase FAL1	1.482E-12	1.000	336	297	702	729	41	384	399	423	0.557	0.862
LOKIASV2_3409_ESMFold_DEAD-DEAH_box_helicase_family_protein	AF-I1KRZ4-F1-model_v4	AF-I1KRZ4-F1-model_v4 Uncharacterized protein	1.482E-12	1.000	336	275	691	729	240	591	904	441	0.572	0.389
LOKIASV2_3409_ESMFold_DEAD-DEAH_box_helicase_family_protein	AF-A0A0K0ET69-F1-model_v4	AF-A0A0K0ET69-F1-model_v4 RNA helicase	2.981E-12	1.000	335	297	700	729	43	387	401	421	0.554	0.860
LOKIASV2_3409_ESMFold_DEAD-DEAH_box_helicase_family_protein	AF-A4I3N2-F1-model_v4	AF-A4I3N2-F1-model_v4 ATP-dependent_RNA_helicase_FAL1_-_putative	9.218E-12	1.000	334	294	702	729	24	374	389	429	0.561	0.902
LOKIASV2_3409_ESMFold_DEAD-DEAH_box_helicase_family_protein	AF-A0A0D2HI34-F1-model_v4	AF-A0A0D2HI34-F1-model_v4 Unplaced genomic scaffold supercont1.2, whole genome shotgun sequence	1.184E-13	1.000	334	322	713	729	392	928	937	575	0.538	0.573
LOKIASV2_3409_ESMFold_DEAD-DEAH_box_helicase_family_protein	AF-A0A0J9YG30-F1-model_v4	AF-A0A0J9YG30-F1-model_v4 RNA helicase	1.741E-12	1.000	333	297	702	729	46	389	404	422	0.557	0.851
LOKIASV2_3409_ESMFold_DEAD-DEAH_box_helicase_family_protein	AF-A0A133CSR1-F1-model_v4	AF-A0A133CSR1-F1-model_v4 DNA helicase	7.366E-13	1.000	333	301	703	729	13	362	590	428	0.553	0.593
LOKIASV2_3409_ESMFold_DEAD-DEAH_box_helicase_family_protein	AF-A0A3P7GD63-F1-model_v4	AF-A0A3P7GD63-F1-model_v4 ATP-dependent DNA helicase	2.953E-13	1.000	333	260	729	729	37	460	609	500	0.645	0.696
LOKIASV2_3409_ESMFold_DEAD-DEAH_box_helicase_family_protein	AF-P38919-F1-model_v4	AF-P38919-F1-model_v4 Eukaryotic initiation factor 4A-III	4.302E-13	1.000	332	290	702	729	33	396	411	442	0.567	0.886
LOKIASV2_3409_ESMFold_DEAD-DEAH_box_helicase_family_protein	AF-P46063-F1-model_v4	AF-P46063-F1-model_v4 ATP-dependent DNA helicase Q1	5.940E-13	1.000	331	255	682	729	21	419	649	464	0.587	0.615
LOKIASV2_3409_ESMFold_DEAD-DEAH_box_helicase_family_protein	AF-A0A0D2G063-F1-model_v4	AF-A0A0D2G063-F1-model_v4 RNA helicase	6.327E-12	1.000	330	297	699	729	40	384	399	419	0.553	0.865
LOKIASV2_3409_ESMFold_DEAD-DEAH_box_helicase_family_protein	AF-U7PY22-F1-model_v4	AF-U7PY22-F1-model_v4 ATP-dependent RNA helicase fal-1	6.980E-13	1.000	330	290	699	729	22	386	401	436	0.562	0.910
LOKIASV2_3409_ESMFold_DEAD-DEAH_box_helicase_family_protein	AF-A0A044US53-F1-model_v4	AF-A0A044US53-F1-model_v4 Uncharacterized protein	5.286E-14	1.000	329	232	711	729	210	702	737	561	0.658	0.669
LOKIASV2_3409_ESMFold_DEAD-DEAH_box_helicase_family_protein	AF-P71359-F1-model_v4	AF-P71359-F1-model_v4 ATP-dependent DNA helicase RecQ	1.635E-13	1.000	328	280	722	729	10	393	619	473	0.608	0.620
LOKIASV2_3409_ESMFold_DEAD-DEAH_box_helicase_family_protein	AF-Q9SA27-F1-model_v4	AF-Q9SA27-F1-model_v4 DEAD-box ATP-dependent RNA helicase 36	1.709E-14	1.000	327	280	728	729	47	473	491	498	0.616	0.870
LOKIASV2_3409_ESMFold_DEAD-DEAH_box_helicase_family_protein	AF-G4VEF4-F1-model_v4	AF-G4VEF4-F1-model_v4 RNA helicase	6.980E-13	1.000	326	267	700	729	2	387	401	459	0.595	0.963
LOKIASV2_3409_ESMFold_DEAD-DEAH_box_helicase_family_protein	AF-Q3B8Q2-F1-model_v4	AF-Q3B8Q2-F1-model_v4 Eukaryotic initiation factor 4A-III	4.343E-12	1.000	326	297	702	729	53	396	411	422	0.557	0.837
LOKIASV2_3409_ESMFold_DEAD-DEAH_box_helicase_family_protein	AF-Q0JM17-F1-model_v4	AF-Q0JM17-F1-model_v4 DEAD-box ATP-dependent RNA helicase 56	1.017E-12	1.000	326	304	702	729	76	412	432	421	0.547	0.780
LOKIASV2_3409_ESMFold_DEAD-DEAH_box_helicase_family_protein	AF-Q95YF3-F1-model_v4	AF-Q95YF3-F1-model_v4 ATP-dependent RNA helicase cgh-1	2.299E-11	1.000	325	305	681	729	69	385	430	387	0.517	0.737
LOKIASV2_3409_ESMFold_DEAD-DEAH_box_helicase_family_protein	AF-Q55A06-F1-model_v4	AF-Q55A06-F1-model_v4 ATP-dependent DNA helicase	5.384E-12	1.000	325	298	703	729	475	818	973	422	0.557	0.354
LOKIASV2_3409_ESMFold_DEAD-DEAH_box_helicase_family_protein	AF-A0A0N4SVP8-F1-model_v4	AF-A0A0N4SVP8-F1-model_v4 RNA helicase	3.864E-13	1.000	324	260	700	729	4	397	411	476	0.605	0.959
LOKIASV2_3409_ESMFold_DEAD-DEAH_box_helicase_family_protein	AF-A0A0K0EI97-F1-model_v4	AF-A0A0K0EI97-F1-model_v4 RNA helicase	2.537E-12	1.000	324	304	702	729	67	403	425	419	0.547	0.793
LOKIASV2_3409_ESMFold_DEAD-DEAH_box_helicase_family_protein	AF-Q384F2-F1-model_v4	AF-Q384F2-F1-model_v4 ATP-dependent RNA helicase eIF4A	7.045E-12	1.000	323	297	702	729	44	386	401	424	0.557	0.855
LOKIASV2_3409_ESMFold_DEAD-DEAH_box_helicase_family_protein	AF-A0A044RHY8-F1-model_v4	AF-A0A044RHY8-F1-model_v4 RNA helicase	7.366E-13	1.000	323	284	702	729	11	389	404	454	0.575	0.938
LOKIASV2_3409_ESMFold_DEAD-DEAH_box_helicase_family_protein	AF-Q5RGB7-F1-model_v4	AF-Q5RGB7-F1-model_v4 RNA helicase	2.953E-13	1.000	323	295	724	729	2	416	468	483	0.590	0.887
LOKIASV2_3409_ESMFold_DEAD-DEAH_box_helicase_family_protein	AF-Q55D61-F1-model_v4	AF-Q55D61-F1-model_v4 Eukaryotic initiation factor 4A	9.133E-13	1.000	322	280	700	729	13	391	405	452	0.578	0.936
LOKIASV2_3409_ESMFold_DEAD-DEAH_box_helicase_family_protein	AF-A0A158Q439-F1-model_v4	AF-A0A158Q439-F1-model_v4 RNA helicase	1.083E-11	1.000	322	305	702	729	59	388	425	408	0.546	0.776
LOKIASV2_3409_ESMFold_DEAD-DEAH_box_helicase_family_protein	AF-A0A0R0JKX7-F1-model_v4	AF-A0A0R0JKX7-F1-model_v4 Uncharacterized protein	1.837E-12	1.000	322	304	702	729	71	407	427	422	0.547	0.789
LOKIASV2_3409_ESMFold_DEAD-DEAH_box_helicase_family_protein	AF-Q27268-F1-model_v4	AF-Q27268-F1-model_v4 ATP-dependent RNA helicase WM6	3.502E-12	1.000	321	280	702	729	37	403	424	446	0.580	0.866
LOKIASV2_3409_ESMFold_DEAD-DEAH_box_helicase_family_protein	AF-O26066-F1-model_v4	AF-O26066-F1-model_v4 Transcription-repair-coupling factor	7.298E-14	1.000	321	250	721	729	425	830	999	499	0.647	0.406
LOKIASV2_3409_ESMFold_DEAD-DEAH_box_helicase_family_protein	AF-A0A175VR56-F1-model_v4	AF-A0A175VR56-F1-model_v4 ATP-dependent RNA helicase eIF4A	1.665E-11	1.000	320	297	702	729	39	380	397	422	0.557	0.861
LOKIASV2_3409_ESMFold_DEAD-DEAH_box_helicase_family_protein	AF-C0NT99-F1-model_v4	AF-C0NT99-F1-model_v4 RNA helicase	2.537E-12	1.000	320	290	699	729	20	384	399	438	0.562	0.915
LOKIASV2_3409_ESMFold_DEAD-DEAH_box_helicase_family_protein	AF-A0A0N4UBZ5-F1-model_v4	AF-A0A0N4UBZ5-F1-model_v4 ATP-dependent DNA helicase	3.470E-13	1.000	320	211	724	729	4	438	505	537	0.705	0.861
LOKIASV2_3409_ESMFold_DEAD-DEAH_box_helicase_family_protein	AF-P40724-F1-model_v4	AF-P40724-F1-model_v4 ATP-dependent DNA helicase RecQ	1.564E-12	1.000	320	301	722	729	25	390	609	455	0.579	0.601
LOKIASV2_3409_ESMFold_DEAD-DEAH_box_helicase_family_protein	AF-D3ZD73-F1-model_v4	AF-D3ZD73-F1-model_v4 RNA helicase	1.578E-11	1.000	319	305	701	729	122	452	483	412	0.545	0.685
LOKIASV2_3409_ESMFold_DEAD-DEAH_box_helicase_family_protein	AF-A0A0H3GKF3-F1-model_v4	AF-A0A0H3GKF3-F1-model_v4 DNA helicase	2.278E-12	1.000	319	275	709	729	2	375	608	460	0.597	0.615
LOKIASV2_3409_ESMFold_DEAD-DEAH_box_helicase_family_protein	AF-A4I0Z1-F1-model_v4	AF-A4I0Z1-F1-model_v4 Putative ATP-dependent DEAD/H DNA helicase recQ	1.417E-11	1.000	319	301	707	729	523	882	1946	435	0.558	0.185
LOKIASV2_3409_ESMFold_DEAD-DEAH_box_helicase_family_protein	AF-Q8DP61-F1-model_v4	AF-Q8DP61-F1-model_v4 DEAD RNA helicase	5.996E-12	1.000	318	294	702	729	5	344	360	431	0.561	0.944
LOKIASV2_3409_ESMFold_DEAD-DEAH_box_helicase_family_protein	AF-Q18212-F1-model_v4	AF-Q18212-F1-model_v4 Spliceosome RNA helicase DDX39B homolog	5.103E-12	1.000	318	304	702	729	66	402	425	416	0.547	0.793
LOKIASV2_3409_ESMFold_DEAD-DEAH_box_helicase_family_protein	AF-A0A1D6GNJ3-F1-model_v4	AF-A0A1D6GNJ3-F1-model_v4 DEAD-box ATP-dependent RNA helicase 8	5.735E-11	1.000	317	321	702	729	3	321	340	396	0.524	0.938
LOKIASV2_3409_ESMFold_DEAD-DEAH_box_helicase_family_protein	AF-Q54E49-F1-model_v4	AF-Q54E49-F1-model_v4 Probable ATP-dependent RNA helicase ddx6	3.936E-11	1.000	317	305	701	729	75	404	423	407	0.545	0.780
LOKIASV2_3409_ESMFold_DEAD-DEAH_box_helicase_family_protein	AF-Q7SXU7-F1-model_v4	AF-Q7SXU7-F1-model_v4 RNA helicase	7.045E-12	1.000	317	304	702	729	77	413	435	415	0.547	0.775
LOKIASV2_3409_ESMFold_DEAD-DEAH_box_helicase_family_protein	AF-P79051-F1-model_v4	AF-P79051-F1-model_v4 ATP-dependent helicase rhp16	3.662E-13	1.000	317	263	716	729	215	857	861	678	0.623	0.747
LOKIASV2_3409_ESMFold_DEAD-DEAH_box_helicase_family_protein	AF-A0A044V704-F1-model_v4	AF-A0A044V704-F1-model_v4 RNA helicase	3.116E-13	1.000	316	294	727	729	12	430	576	496	0.595	0.727
LOKIASV2_3409_ESMFold_DEAD-DEAH_box_helicase_family_protein	AF-Q5F644-F1-model_v4	AF-Q5F644-F1-model_v4 DNA helicase	2.537E-12	1.000	316	281	709	729	2	371	767	455	0.588	0.482
LOKIASV2_3409_ESMFold_DEAD-DEAH_box_helicase_family_protein	AF-A0A0K0EIT5-F1-model_v4	AF-A0A0K0EIT5-F1-model_v4 Uncharacterized protein	7.773E-13	1.000	316	294	699	729	470	843	851	440	0.557	0.439
LOKIASV2_3409_ESMFold_DEAD-DEAH_box_helicase_family_protein	AF-A0A5S6PCA5-F1-model_v4	AF-A0A5S6PCA5-F1-model_v4 DNA helicase	8.736E-12	1.000	316	301	718	729	297	646	1054	436	0.573	0.332
LOKIASV2_3409_ESMFold_DEAD-DEAH_box_helicase_family_protein	AF-Q8ILG5-F1-model_v4	AF-Q8ILG5-F1-model_v4 ADP-dependent DNA helicase RecQ	1.837E-12	1.000	316	280	680	729	24	389	1440	436	0.550	0.254
LOKIASV2_3409_ESMFold_DEAD-DEAH_box_helicase_family_protein	AF-A0A0K0DSI4-F1-model_v4	AF-A0A0K0DSI4-F1-model_v4 Uncharacterized protein	9.727E-12	1.000	315	305	709	729	55	413	418	421	0.556	0.859
LOKIASV2_3409_ESMFold_DEAD-DEAH_box_helicase_family_protein	AF-Q9Z1N5-F1-model_v4	AF-Q9Z1N5-F1-model_v4 Spliceosome RNA helicase Ddx39b	4.343E-12	1.000	315	304	702	729	70	406	428	421	0.547	0.787
LOKIASV2_3409_ESMFold_DEAD-DEAH_box_helicase_family_protein	AF-Q8ZQN8-F1-model_v4	AF-Q8ZQN8-F1-model_v4 ATP-dependent RNA helicase RhlE	3.535E-11	1.000	315	297	700	729	16	365	454	424	0.554	0.771
LOKIASV2_3409_ESMFold_DEAD-DEAH_box_helicase_family_protein	AF-P23128-F1-model_v4	AF-P23128-F1-model_v4 ATP-dependent RNA helicase me31b	1.578E-11	1.000	315	305	701	729	84	413	459	409	0.545	0.719
LOKIASV2_3409_ESMFold_DEAD-DEAH_box_helicase_family_protein	AF-A0A044URA8-F1-model_v4	AF-A0A044URA8-F1-model_v4 Uncharacterized protein	3.662E-13	1.000	315	232	716	729	210	691	728	560	0.665	0.662
LOKIASV2_3409_ESMFold_DEAD-DEAH_box_helicase_family_protein	AF-C0PHE3-F1-model_v4	AF-C0PHE3-F1-model_v4 Eucaryotic initiation factor4	1.195E-12	1.000	314	273	700	729	18	400	414	464	0.587	0.925
LOKIASV2_3409_ESMFold_DEAD-DEAH_box_helicase_family_protein	AF-Q56XG6-F1-model_v4	AF-Q56XG6-F1-model_v4 DEAD-box ATP-dependent RNA helicase 15	3.145E-12	1.000	314	304	702	729	71	407	427	422	0.547	0.789
LOKIASV2_3409_ESMFold_DEAD-DEAH_box_helicase_family_protein	AF-A0A077Z3Z4-F1-model_v4	AF-A0A077Z3Z4-F1-model_v4 RNA helicase	3.319E-12	1.000	314	280	724	729	6	416	444	489	0.610	0.926
LOKIASV2_3409_ESMFold_DEAD-DEAH_box_helicase_family_protein	AF-P54823-F1-model_v4	AF-P54823-F1-model_v4 Probable ATP-dependent RNA helicase DDX6	2.560E-11	1.000	314	305	701	729	122	452	483	412	0.545	0.685
LOKIASV2_3409_ESMFold_DEAD-DEAH_box_helicase_family_protein	AF-A0A0N4U3K4-F1-model_v4	AF-A0A0N4U3K4-F1-model_v4 RNA helicase	2.404E-12	1.000	313	280	702	729	10	389	404	456	0.580	0.941
LOKIASV2_3409_ESMFold_DEAD-DEAH_box_helicase_family_protein	AF-Q5JK84-F1-model_v4	AF-Q5JK84-F1-model_v4 DEAD-box ATP-dependent RNA helicase 15	2.537E-12	1.000	313	304	702	729	76	412	432	422	0.547	0.780
LOKIASV2_3409_ESMFold_DEAD-DEAH_box_helicase_family_protein	AF-A0A0K0ECJ3-F1-model_v4	AF-A0A0K0ECJ3-F1-model_v4 RNA helicase	7.366E-13	1.000	313	270	725	729	88	513	540	504	0.626	0.789
LOKIASV2_3409_ESMFold_DEAD-DEAH_box_helicase_family_protein	AF-Q9Y7C4-F1-model_v4	AF-Q9Y7C4-F1-model_v4 ATP-dependent RNA helicase CHR1	2.299E-11	1.000	313	285	702	729	128	500	578	447	0.573	0.645
LOKIASV2_3409_ESMFold_DEAD-DEAH_box_helicase_family_protein	AF-A0A0K0EA28-F1-model_v4	AF-A0A0K0EA28-F1-model_v4 DNA helicase	2.404E-12	1.000	313	282	709	729	282	681	1053	472	0.587	0.380
LOKIASV2_3409_ESMFold_DEAD-DEAH_box_helicase_family_protein	AF-A4IAT7-F1-model_v4	AF-A4IAT7-F1-model_v4 ATP-dependent_DEAD-box_RNA_helicase_-_putative	3.730E-11	1.000	312	301	701	729	52	386	405	411	0.550	0.827
LOKIASV2_3409_ESMFold_DEAD-DEAH_box_helicase_family_protein	AF-E9PV04-F1-model_v4	AF-E9PV04-F1-model_v4 RNA helicase	1.017E-12	1.000	312	270	700	729	15	397	411	461	0.591	0.932
LOKIASV2_3409_ESMFold_DEAD-DEAH_box_helicase_family_protein	AF-A0A0K0E8X2-F1-model_v4	AF-A0A0K0E8X2-F1-model_v4 RNA helicase	2.702E-11	1.000	312	305	701	729	63	394	433	407	0.545	0.767
LOKIASV2_3409_ESMFold_DEAD-DEAH_box_helicase_family_protein	AF-P26196-F1-model_v4	AF-P26196-F1-model_v4 Probable ATP-dependent RNA helicase DDX6	6.739E-11	1.000	312	305	701	729	122	452	483	408	0.545	0.685
LOKIASV2_3409_ESMFold_DEAD-DEAH_box_helicase_family_protein	AF-A0A3P7DZI0-F1-model_v4	AF-A0A3P7DZI0-F1-model_v4 Uncharacterized protein	1.495E-11	1.000	312	305	700	729	138	471	485	412	0.543	0.689
LOKIASV2_3409_ESMFold_DEAD-DEAH_box_helicase_family_protein	AF-Q5AAW3-F1-model_v4	AF-Q5AAW3-F1-model_v4 ATP-dependent RNA helicase DHH1	2.851E-11	1.000	312	305	701	729	56	385	549	413	0.545	0.601
LOKIASV2_3409_ESMFold_DEAD-DEAH_box_helicase_family_protein	AF-C0NAN2-F1-model_v4	AF-C0NAN2-F1-model_v4 ATP-dependent RNA helicase eIF4A	2.560E-11	1.000	311	297	687	729	40	374	386	414	0.536	0.868
LOKIASV2_3409_ESMFold_DEAD-DEAH_box_helicase_family_protein	AF-A0A0P0X9X6-F1-model_v4	AF-A0A0P0X9X6-F1-model_v4 Os07g0660000 protein	1.331E-12	1.000	311	297	726	729	32	425	445	474	0.590	0.885
LOKIASV2_3409_ESMFold_DEAD-DEAH_box_helicase_family_protein	AF-O94762-F1-model_v4	AF-O94762-F1-model_v4 ATP-dependent DNA helicase Q5	1.026E-11	1.000	311	303	719	729	31	397	991	438	0.572	0.370
LOKIASV2_3409_ESMFold_DEAD-DEAH_box_helicase_family_protein	AF-B0G0Y4-F1-model_v4	AF-B0G0Y4-F1-model_v4 DNA helicase	1.132E-12	1.000	311	292	709	729	280	652	1136	448	0.573	0.328
LOKIASV2_3409_ESMFold_DEAD-DEAH_box_helicase_family_protein	AF-A0A0R4J5N3-F1-model_v4	AF-A0A0R4J5N3-F1-model_v4 Uncharacterized protein	2.046E-12	1.000	310	267	699	729	14	399	413	469	0.594	0.935
LOKIASV2_3409_ESMFold_DEAD-DEAH_box_helicase_family_protein	AF-Q9LFN6-F1-model_v4	AF-Q9LFN6-F1-model_v4 DEAD-box ATP-dependent RNA helicase 56	4.836E-12	1.000	310	304	702	729	71	407	427	422	0.547	0.789
LOKIASV2_3409_ESMFold_DEAD-DEAH_box_helicase_family_protein	AF-A0A3P7EF40-F1-model_v4	AF-A0A3P7EF40-F1-model_v4 RNA helicase	5.435E-11	1.000	310	305	691	729	85	406	454	397	0.531	0.709
LOKIASV2_3409_ESMFold_DEAD-DEAH_box_helicase_family_protein	AF-E9PTF0-F1-model_v4	AF-E9PTF0-F1-model_v4 RNA helicase	3.470E-13	1.000	310	298	724	729	5	416	480	485	0.586	0.858
LOKIASV2_3409_ESMFold_DEAD-DEAH_box_helicase_family_protein	AF-E7FD91-F1-model_v4	AF-E7FD91-F1-model_v4 RNA helicase	5.435E-11	1.000	310	305	701	729	123	453	484	409	0.545	0.684
LOKIASV2_3409_ESMFold_DEAD-DEAH_box_helicase_family_protein	AF-X1WCM8-F1-model_v4	AF-X1WCM8-F1-model_v4 ATP-dependent DNA helicase	6.327E-12	1.000	310	303	722	729	19	386	933	437	0.576	0.394
LOKIASV2_3409_ESMFold_DEAD-DEAH_box_helicase_family_protein	AF-U7PZ95-F1-model_v4	AF-U7PZ95-F1-model_v4 ATP-dependent RNA helicase eIF4A	2.702E-11	1.000	309	297	702	729	39	380	397	424	0.557	0.861
LOKIASV2_3409_ESMFold_DEAD-DEAH_box_helicase_family_protein	AF-A0A175VS02-F1-model_v4	AF-A0A175VS02-F1-model_v4 ATP-dependent RNA helicase fal-1	5.384E-12	1.000	309	290	699	729	21	385	400	439	0.562	0.913
LOKIASV2_3409_ESMFold_DEAD-DEAH_box_helicase_family_protein	AF-O13792-F1-model_v4	AF-O13792-F1-model_v4 ATP-dependent RNA helicase uap56	8.736E-12	1.000	309	304	702	729	76	414	434	419	0.547	0.781
LOKIASV2_3409_ESMFold_DEAD-DEAH_box_helicase_family_protein	AF-Q19546-F1-model_v4	AF-Q19546-F1-model_v4 Probable Werner syndrome ATP-dependent helicase homolog 1	1.017E-12	1.000	309	278	704	729	189	584	1056	475	0.586	0.375
LOKIASV2_3409_ESMFold_DEAD-DEAH_box_helicase_family_protein	AF-P21507-F1-model_v4	AF-P21507-F1-model_v4 ATP-dependent RNA helicase SrmB	4.383E-11	1.000	308	305	699	729	30	368	444	413	0.542	0.764
LOKIASV2_3409_ESMFold_DEAD-DEAH_box_helicase_family_protein	AF-A0A077YZS7-F1-model_v4	AF-A0A077YZS7-F1-model_v4 ATP-dependent DNA helicase	7.434E-12	1.000	308	301	718	729	145	497	876	436	0.573	0.403
