LOKIASV2_4345_ESMFold_MFS_transporter	AF-Q8ZLE4-F1-model_v4	AF-Q8ZLE4-F1-model_v4 Uncharacterized MFS-type transporter YhhS	5.726E-06	1.000	258	1	437	471	1	395	405	447	0.928	0.975
LOKIASV2_4345_ESMFold_MFS_transporter	AF-A0A0H3GQD8-F1-model_v4	AF-A0A0H3GQD8-F1-model_v4 Major facilitator superfamily MFS_1	2.315E-06	1.000	258	1	440	471	1	400	410	460	0.934	0.976
LOKIASV2_4345_ESMFold_MFS_transporter	AF-Q8ZRJ1-F1-model_v4	AF-Q8ZRJ1-F1-model_v4 Putative permease	1.964E-06	1.000	258	17	437	471	16	402	412	434	0.894	0.939
LOKIASV2_4345_ESMFold_MFS_transporter	AF-K0EUC4-F1-model_v4	AF-K0EUC4-F1-model_v4 Major facilitator transporter	5.713E-07	1.000	258	1	456	471	1	436	439	483	0.968	0.993
LOKIASV2_4345_ESMFold_MFS_transporter	AF-A0A0D2H374-F1-model_v4	AF-A0A0D2H374-F1-model_v4 Unplaced genomic scaffold supercont1.5, whole genome shotgun sequence	1.198E-06	1.000	258	1	430	471	15	441	461	474	0.913	0.926
LOKIASV2_4345_ESMFold_MFS_transporter	AF-I1KV64-F1-model_v4	AF-I1KV64-F1-model_v4 MFS domain-containing protein	1.059E-06	1.000	258	2	451	471	20	478	479	508	0.955	0.958
LOKIASV2_4345_ESMFold_MFS_transporter	AF-Q32JI8-F1-model_v4	AF-Q32JI8-F1-model_v4 Regulates beta-lactamase synthesis	5.966E-06	1.000	258	12	453	471	1	473	491	518	0.938	0.963
LOKIASV2_4345_ESMFold_MFS_transporter	AF-A0A1D6I4K4-F1-model_v4	AF-A0A1D6I4K4-F1-model_v4 Putative folate-biopterin transporter 6	9.756E-07	1.000	258	17	438	471	52	471	527	461	0.896	0.797
LOKIASV2_4345_ESMFold_MFS_transporter	AF-O42885-F1-model_v4	AF-O42885-F1-model_v4 Putative inorganic phosphate transporter C8E4.01c	1.599E-06	1.000	258	15	428	471	46	532	572	525	0.879	0.851
LOKIASV2_4345_ESMFold_MFS_transporter	AF-Q10072-F1-model_v4	AF-Q10072-F1-model_v4 Uncharacterized transporter C3H1.06c	3.346E-07	1.000	258	2	450	471	66	563	589	542	0.953	0.846
LOKIASV2_4345_ESMFold_MFS_transporter	AF-Q9I3Z2-F1-model_v4	AF-Q9I3Z2-F1-model_v4 MFS domain-containing protein	1.304E-05	1.000	257	6	448	471	2	397	403	458	0.941	0.983
LOKIASV2_4345_ESMFold_MFS_transporter	AF-K0ERD0-F1-model_v4	AF-K0ERD0-F1-model_v4 Major facilitator transporter	1.599E-06	1.000	257	13	438	471	1	449	452	498	0.904	0.993
LOKIASV2_4345_ESMFold_MFS_transporter	AF-Q8IIK1-F1-model_v4	AF-Q8IIK1-F1-model_v4 Folate transporter 2	6.736E-07	1.000	257	1	447	471	26	452	455	470	0.949	0.938
LOKIASV2_4345_ESMFold_MFS_transporter	AF-A0A077Z962-F1-model_v4	AF-A0A077Z962-F1-model_v4 MFS 1 domain containing protein	1.104E-06	1.000	257	16	464	471	31	461	463	484	0.953	0.931
LOKIASV2_4345_ESMFold_MFS_transporter	AF-Q3EAQ5-F1-model_v4	AF-Q3EAQ5-F1-model_v4 Probable peptide/nitrate transporter At3g43790	2.310E-07	1.000	257	10	442	471	29	483	484	496	0.919	0.940
LOKIASV2_4345_ESMFold_MFS_transporter	AF-A0A1D6QNY8-F1-model_v4	AF-A0A1D6QNY8-F1-model_v4 Metabolite transport protein csbC	1.732E-07	1.000	257	2	455	471	28	489	495	529	0.964	0.933
LOKIASV2_4345_ESMFold_MFS_transporter	AF-A0A0D2FER2-F1-model_v4	AF-A0A0D2FER2-F1-model_v4 Unplaced genomic scaffold supercont1.1, whole genome shotgun sequence	5.966E-06	1.000	257	15	427	471	64	463	507	444	0.877	0.789
LOKIASV2_4345_ESMFold_MFS_transporter	AF-A0A1D8PSH1-F1-model_v4	AF-A0A1D8PSH1-F1-model_v4 Hxt5p	8.275E-07	1.000	257	7	462	471	70	561	562	524	0.968	0.875
LOKIASV2_4345_ESMFold_MFS_transporter	AF-Q54LA4-F1-model_v4	AF-Q54LA4-F1-model_v4 MFS domain-containing protein	1.413E-06	1.000	257	1	438	471	468	873	880	456	0.930	0.461
LOKIASV2_4345_ESMFold_MFS_transporter	AF-Q32HX0-F1-model_v4	AF-Q32HX0-F1-model_v4 Putative transport	1.019E-05	1.000	256	7	427	471	8	388	393	429	0.894	0.969
LOKIASV2_4345_ESMFold_MFS_transporter	AF-A0A0D2DQE2-F1-model_v4	AF-A0A0D2DQE2-F1-model_v4 Unplaced genomic scaffold supercont1.4, whole genome shotgun sequence	1.599E-06	1.000	256	15	431	471	40	445	451	447	0.885	0.900
LOKIASV2_4345_ESMFold_MFS_transporter	AF-K0EXH6-F1-model_v4	AF-K0EXH6-F1-model_v4 Major facilitator superfamily multidrug resistance protein	1.472E-06	1.000	256	1	430	471	1	466	489	497	0.913	0.953
LOKIASV2_4345_ESMFold_MFS_transporter	AF-A0A0D2G4T6-F1-model_v4	AF-A0A0D2G4T6-F1-model_v4 Unplaced genomic scaffold supercont1.7, whole genome shotgun sequence	2.614E-07	1.000	256	11	471	471	3	501	510	545	0.979	0.978
LOKIASV2_4345_ESMFold_MFS_transporter	AF-P9WG85-F1-model_v4	AF-P9WG85-F1-model_v4 Uncharacterized MFS-type transporter Rv1877	1.472E-06	1.000	256	1	449	471	7	501	687	536	0.953	0.721
LOKIASV2_4345_ESMFold_MFS_transporter	AF-Q9HYQ9-F1-model_v4	AF-Q9HYQ9-F1-model_v4 Probable major facilitator superfamily (MFS) transporter	3.953E-06	1.000	255	12	436	471	1	384	388	437	0.902	0.990
LOKIASV2_4345_ESMFold_MFS_transporter	AF-K0EHY9-F1-model_v4	AF-K0EHY9-F1-model_v4 Transporter	2.132E-06	1.000	255	8	452	471	2	446	465	494	0.945	0.957
LOKIASV2_4345_ESMFold_MFS_transporter	AF-C0NJ10-F1-model_v4	AF-C0NJ10-F1-model_v4 Uncharacterized protein	5.726E-06	1.000	255	15	434	471	91	469	480	437	0.892	0.790
LOKIASV2_4345_ESMFold_MFS_transporter	AF-Q5FV41-F1-model_v4	AF-Q5FV41-F1-model_v4 Probable folate-biopterin transporter 2	1.599E-06	1.000	255	17	467	471	44	497	499	498	0.958	0.910
LOKIASV2_4345_ESMFold_MFS_transporter	AF-A4I388-F1-model_v4	AF-A4I388-F1-model_v4 Major_Facilitator_Superfamily_-_putative	2.844E-06	1.000	255	1	462	471	6	484	528	505	0.981	0.907
LOKIASV2_4345_ESMFold_MFS_transporter	AF-K0EXX5-F1-model_v4	AF-K0EXX5-F1-model_v4 Transporter	1.301E-06	1.000	255	2	452	471	16	521	531	540	0.958	0.953
LOKIASV2_4345_ESMFold_MFS_transporter	AF-J9EQY1-F1-model_v4	AF-J9EQY1-F1-model_v4 MFS domain-containing protein	6.217E-06	1.000	254	12	431	471	1	384	403	442	0.892	0.953
LOKIASV2_4345_ESMFold_MFS_transporter	AF-K0F8X2-F1-model_v4	AF-K0F8X2-F1-model_v4 Major facilitator permease	1.809E-06	1.000	254	16	458	471	19	472	482	504	0.941	0.942
LOKIASV2_4345_ESMFold_MFS_transporter	AF-A0A0D2F270-F1-model_v4	AF-A0A0D2F270-F1-model_v4 Unplaced genomic scaffold supercont1.4, whole genome shotgun sequence	1.736E-06	1.000	254	16	430	471	79	482	523	457	0.881	0.772
LOKIASV2_4345_ESMFold_MFS_transporter	AF-P39386-F1-model_v4	AF-P39386-F1-model_v4 Multidrug resistance protein MdtM	9.756E-07	1.000	253	14	456	471	12	408	410	460	0.941	0.968
LOKIASV2_4345_ESMFold_MFS_transporter	AF-X8F3S2-F1-model_v4	AF-X8F3S2-F1-model_v4 Major Facilitator Superfamily protein	1.019E-05	1.000	253	12	443	471	30	430	432	458	0.917	0.928
LOKIASV2_4345_ESMFold_MFS_transporter	AF-G5ECR3-F1-model_v4	AF-G5ECR3-F1-model_v4 SoLute Carrier Family	7.959E-06	1.000	253	1	431	471	20	419	450	440	0.915	0.889
LOKIASV2_4345_ESMFold_MFS_transporter	AF-U7PPI4-F1-model_v4	AF-U7PPI4-F1-model_v4 MFS domain-containing protein	1.964E-06	1.000	253	1	449	471	37	481	503	491	0.953	0.885
LOKIASV2_4345_ESMFold_MFS_transporter	AF-C1H4T5-F1-model_v4	AF-C1H4T5-F1-model_v4 MFS domain-containing protein	2.620E-06	1.000	253	16	430	471	75	478	519	452	0.881	0.778
LOKIASV2_4345_ESMFold_MFS_transporter	AF-A3QMB7-F1-model_v4	AF-A3QMB7-F1-model_v4 Uncharacterized protein	1.198E-06	1.000	253	13	438	471	80	502	544	456	0.904	0.778
LOKIASV2_4345_ESMFold_MFS_transporter	AF-C1H829-F1-model_v4	AF-C1H829-F1-model_v4 MFS domain-containing protein	1.809E-06	1.000	253	16	453	471	65	524	584	501	0.930	0.788
LOKIASV2_4345_ESMFold_MFS_transporter	AF-A0A1C1CFM0-F1-model_v4	AF-A0A1C1CFM0-F1-model_v4 Putative transporter	1.249E-06	1.000	253	16	429	471	79	481	603	450	0.879	0.668
LOKIASV2_4345_ESMFold_MFS_transporter	AF-A0A0H3H3Z4-F1-model_v4	AF-A0A0H3H3Z4-F1-model_v4 Protein TsgA homolog	7.034E-06	1.000	252	16	447	471	11	393	395	445	0.917	0.970
LOKIASV2_4345_ESMFold_MFS_transporter	AF-Q32CT2-F1-model_v4	AF-Q32CT2-F1-model_v4 Alpha-ketoglutarate permease	1.534E-06	1.000	252	1	427	471	1	421	432	464	0.907	0.975
LOKIASV2_4345_ESMFold_MFS_transporter	AF-A0A0D2DUZ2-F1-model_v4	AF-A0A0D2DUZ2-F1-model_v4 Unplaced genomic scaffold supercont1.3, whole genome shotgun sequence	3.794E-06	1.000	252	8	433	471	67	464	471	450	0.904	0.845
LOKIASV2_4345_ESMFold_MFS_transporter	AF-Q9I482-F1-model_v4	AF-Q9I482-F1-model_v4 Probable major facilitator superfamily (MFS) transporter	9.756E-07	1.000	252	1	455	471	1	469	480	535	0.966	0.977
LOKIASV2_4345_ESMFold_MFS_transporter	AF-A0A1D6EES6-F1-model_v4	AF-A0A1D6EES6-F1-model_v4 Phosphate transporter protein5	1.599E-06	1.000	252	11	471	471	17	508	509	546	0.979	0.967
LOKIASV2_4345_ESMFold_MFS_transporter	AF-I1M978-F1-model_v4	AF-I1M978-F1-model_v4 Uncharacterized protein	1.413E-06	1.000	252	13	445	471	67	500	523	480	0.919	0.830
LOKIASV2_4345_ESMFold_MFS_transporter	AF-A0A1C1C955-F1-model_v4	AF-A0A1C1C955-F1-model_v4 Putative transporter	1.472E-06	1.000	252	6	432	471	94	541	603	499	0.907	0.743
LOKIASV2_4345_ESMFold_MFS_transporter	AF-K0F3E1-F1-model_v4	AF-K0F3E1-F1-model_v4 Transporter	4.473E-06	1.000	251	1	430	471	3	395	406	448	0.913	0.968
LOKIASV2_4345_ESMFold_MFS_transporter	AF-O16697-F1-model_v4	AF-O16697-F1-model_v4 MFS domain-containing protein	4.293E-06	1.000	251	11	432	471	27	465	485	499	0.896	0.905
LOKIASV2_4345_ESMFold_MFS_transporter	AF-O70461-F1-model_v4	AF-O70461-F1-model_v4 Monocarboxylate transporter 3	3.218E-06	1.000	251	20	462	471	17	425	492	472	0.941	0.831
LOKIASV2_4345_ESMFold_MFS_transporter	AF-C1GSC6-F1-model_v4	AF-C1GSC6-F1-model_v4 High-affinity nicotinic acid transporter	3.641E-06	1.000	251	16	432	471	58	455	502	443	0.885	0.793
LOKIASV2_4345_ESMFold_MFS_transporter	AF-Q8TF71-F1-model_v4	AF-Q8TF71-F1-model_v4 Monocarboxylate transporter 10	6.750E-06	1.000	251	15	469	471	71	492	515	485	0.966	0.819
LOKIASV2_4345_ESMFold_MFS_transporter	AF-P53918-F1-model_v4	AF-P53918-F1-model_v4 Uncharacterized transporter ESBP6	1.809E-06	1.000	251	1	453	471	181	652	673	515	0.962	0.701
LOKIASV2_4345_ESMFold_MFS_transporter	AF-Q9HXS3-F1-model_v4	AF-Q9HXS3-F1-model_v4 Probable major facilitator superfamily (MFS) transporter	4.661E-06	1.000	250	1	430	471	4	393	413	443	0.913	0.944
LOKIASV2_4345_ESMFold_MFS_transporter	AF-A0A0K0EQY5-F1-model_v4	AF-A0A0K0EQY5-F1-model_v4 MFS domain-containing protein	2.844E-06	1.000	250	1	470	471	1	453	453	510	0.998	1.000
LOKIASV2_4345_ESMFold_MFS_transporter	AF-A0A0R0J1S7-F1-model_v4	AF-A0A0R0J1S7-F1-model_v4 MFS domain-containing protein	2.413E-06	1.000	250	3	446	471	26	475	479	506	0.943	0.939
LOKIASV2_4345_ESMFold_MFS_transporter	AF-Q8MRB2-F1-model_v4	AF-Q8MRB2-F1-model_v4 RE36877p	3.794E-06	1.000	250	4	442	471	1	510	539	557	0.932	0.946
LOKIASV2_4345_ESMFold_MFS_transporter	AF-K0EPQ9-F1-model_v4	AF-K0EPQ9-F1-model_v4 Transporter	1.153E-05	1.000	249	19	432	471	3	370	388	423	0.879	0.948
LOKIASV2_4345_ESMFold_MFS_transporter	AF-Q9I5M3-F1-model_v4	AF-Q9I5M3-F1-model_v4 Probable major facilitator superfamily (MFS) transporter	2.620E-06	1.000	249	6	427	471	8	417	438	449	0.896	0.936
LOKIASV2_4345_ESMFold_MFS_transporter	AF-K0F578-F1-model_v4	AF-K0F578-F1-model_v4 Transporter	2.222E-06	1.000	249	7	432	471	2	418	457	472	0.904	0.912
LOKIASV2_4345_ESMFold_MFS_transporter	AF-Q8CE47-F1-model_v4	AF-Q8CE47-F1-model_v4 Solute carrier family 49 member A3	3.218E-06	1.000	249	1	440	471	16	451	516	472	0.934	0.845
LOKIASV2_4345_ESMFold_MFS_transporter	AF-Q8ZK49-F1-model_v4	AF-Q8ZK49-F1-model_v4 Putative permease	3.641E-06	1.000	248	6	432	471	2	402	408	454	0.907	0.983
LOKIASV2_4345_ESMFold_MFS_transporter	AF-K0ESG3-F1-model_v4	AF-K0ESG3-F1-model_v4 Multidrug resistance protein stp	2.620E-06	1.000	248	12	453	471	1	445	451	504	0.938	0.987
LOKIASV2_4345_ESMFold_MFS_transporter	AF-K0EW57-F1-model_v4	AF-K0EW57-F1-model_v4 Putative multidrug transporter, MFS superfamily protein	6.750E-06	1.000	248	17	450	471	20	492	494	508	0.921	0.957
LOKIASV2_4345_ESMFold_MFS_transporter	AF-Q8ZML0-F1-model_v4	AF-Q8ZML0-F1-model_v4 Putative inner membrane protein	6.217E-06	1.000	247	6	430	471	2	384	394	433	0.902	0.972
LOKIASV2_4345_ESMFold_MFS_transporter	AF-O44607-F1-model_v4	AF-O44607-F1-model_v4 Solute carrier family 40 protein	4.293E-06	1.000	247	3	461	471	2	505	507	547	0.975	0.994
LOKIASV2_4345_ESMFold_MFS_transporter	AF-Q4E1V0-F1-model_v4	AF-Q4E1V0-F1-model_v4 Transporter, putative	2.724E-07	1.000	247	16	467	471	67	523	529	501	0.960	0.864
LOKIASV2_4345_ESMFold_MFS_transporter	AF-A0A0D2HMS8-F1-model_v4	AF-A0A0D2HMS8-F1-model_v4 Unplaced genomic scaffold supercont1.1, whole genome shotgun sequence	4.120E-06	1.000	247	12	432	471	65	528	769	504	0.894	0.603
LOKIASV2_4345_ESMFold_MFS_transporter	AF-A0A0H3GUS7-F1-model_v4	AF-A0A0H3GUS7-F1-model_v4 Putative 3-hydroxyphenylpropionic transporter MhpT	5.726E-06	1.000	246	1	426	471	1	389	398	434	0.904	0.977
LOKIASV2_4345_ESMFold_MFS_transporter	AF-Q2FW83-F1-model_v4	AF-Q2FW83-F1-model_v4 MFS domain-containing protein	2.046E-06	1.000	246	12	437	471	1	442	447	499	0.904	0.989
LOKIASV2_4345_ESMFold_MFS_transporter	AF-A0A1C1CY47-F1-model_v4	AF-A0A1C1CY47-F1-model_v4 Major Facilitator Superfamily protein	4.661E-06	1.000	246	1	444	471	28	446	456	485	0.943	0.919
LOKIASV2_4345_ESMFold_MFS_transporter	AF-A0A0H3GV24-F1-model_v4	AF-A0A0H3GV24-F1-model_v4 Putative general substrate transporter	7.034E-06	1.000	246	11	435	471	16	435	456	467	0.902	0.921
LOKIASV2_4345_ESMFold_MFS_transporter	AF-X8FCI4-F1-model_v4	AF-X8FCI4-F1-model_v4 Sugar (And other) transporter family protein	3.494E-06	1.000	246	13	452	471	1	484	485	527	0.934	0.998
LOKIASV2_4345_ESMFold_MFS_transporter	AF-A4I8Z5-F1-model_v4	AF-A4I8Z5-F1-model_v4 Major_Facilitator_Superfamily/Nucleoside_H+_sympo rter/LacY_proton/sugar_symporter_-_putative	2.046E-06	1.000	246	1	471	471	102	532	591	491	1.000	0.729
LOKIASV2_4345_ESMFold_MFS_transporter	AF-U7PRN0-F1-model_v4	AF-U7PRN0-F1-model_v4 MFS domain-containing protein	3.353E-06	1.000	246	15	444	471	56	571	601	545	0.913	0.859
LOKIASV2_4345_ESMFold_MFS_transporter	AF-A0A132Z6J0-F1-model_v4	AF-A0A132Z6J0-F1-model_v4 MFS transporter	1.472E-06	1.000	245	6	446	471	2	410	412	470	0.936	0.993
LOKIASV2_4345_ESMFold_MFS_transporter	AF-Q9HWG8-F1-model_v4	AF-Q9HWG8-F1-model_v4 Probable transporter	3.494E-06	1.000	245	15	430	471	9	396	414	445	0.883	0.937
LOKIASV2_4345_ESMFold_MFS_transporter	AF-Q327U0-F1-model_v4	AF-Q327U0-F1-model_v4 Putative transport protein	1.356E-06	1.000	245	1	431	471	5	431	440	476	0.915	0.970
LOKIASV2_4345_ESMFold_MFS_transporter	AF-A0A0H3GTT0-F1-model_v4	AF-A0A0H3GTT0-F1-model_v4 MFS domain-containing protein	8.622E-07	1.000	245	10	430	471	18	439	452	451	0.894	0.934
LOKIASV2_4345_ESMFold_MFS_transporter	AF-K0F869-F1-model_v4	AF-K0F869-F1-model_v4 Antibiotic antiporter	7.330E-06	1.000	245	1	437	471	1	465	466	503	0.928	0.998
LOKIASV2_4345_ESMFold_MFS_transporter	AF-A0A0D2HDT0-F1-model_v4	AF-A0A0D2HDT0-F1-model_v4 Unplaced genomic scaffold supercont1.3, whole genome shotgun sequence	9.777E-06	1.000	245	1	471	471	38	573	574	581	1.000	0.934
LOKIASV2_4345_ESMFold_MFS_transporter	AF-Q328L1-F1-model_v4	AF-Q328L1-F1-model_v4 Putative resistance protein	1.968E-05	1.000	244	60	436	471	2	338	347	392	0.800	0.971
LOKIASV2_4345_ESMFold_MFS_transporter	AF-Q96ES6-F1-model_v4	AF-Q96ES6-F1-model_v4 Major facilitator superfamily domain-containing protein 3	6.750E-06	1.000	244	14	439	471	6	411	412	465	0.904	0.985
LOKIASV2_4345_ESMFold_MFS_transporter	AF-A0A077Z1E4-F1-model_v4	AF-A0A077Z1E4-F1-model_v4 Putative permease of the major facilitator superf amily	3.088E-06	1.000	244	15	432	471	35	459	469	472	0.887	0.906
LOKIASV2_4345_ESMFold_MFS_transporter	AF-Q9HZ88-F1-model_v4	AF-Q9HZ88-F1-model_v4 Probable major facilitator superfamily (MFS) transporter	7.638E-06	1.000	244	14	446	471	1	494	499	537	0.919	0.990
LOKIASV2_4345_ESMFold_MFS_transporter	AF-A0A0D2DUW2-F1-model_v4	AF-A0A0D2DUW2-F1-model_v4 Unplaced genomic scaffold supercont1.3, whole genome shotgun sequence	2.844E-06	1.000	244	11	442	471	45	570	595	561	0.917	0.884
LOKIASV2_4345_ESMFold_MFS_transporter	AF-Q7CQ96-F1-model_v4	AF-Q7CQ96-F1-model_v4 Putative MFS family transport protein	7.959E-06	1.000	243	14	432	471	1	399	423	429	0.890	0.943
LOKIASV2_4345_ESMFold_MFS_transporter	AF-K0EVI3-F1-model_v4	AF-K0EVI3-F1-model_v4 Major facilitator superfamily protein	1.249E-06	1.000	243	1	432	471	1	466	471	509	0.917	0.989
LOKIASV2_4345_ESMFold_MFS_transporter	AF-K0F8F0-F1-model_v4	AF-K0F8F0-F1-model_v4 Major facilitator superfamily protein	7.959E-06	1.000	242	1	427	471	1	390	400	448	0.907	0.975
LOKIASV2_4345_ESMFold_MFS_transporter	AF-K0ES06-F1-model_v4	AF-K0ES06-F1-model_v4 Major facilitator superfamily protein	4.661E-06	1.000	242	1	431	471	17	407	418	441	0.915	0.935
LOKIASV2_4345_ESMFold_MFS_transporter	AF-P9WJY1-F1-model_v4	AF-P9WJY1-F1-model_v4 Uncharacterized MFS-type transporter Rv0037c	4.651E-07	1.000	242	1	437	471	5	436	441	481	0.928	0.980
LOKIASV2_4345_ESMFold_MFS_transporter	AF-E7FCW8-F1-model_v4	AF-E7FCW8-F1-model_v4 Solute carrier family 22 member 13b	1.666E-06	1.000	242	50	467	471	133	541	542	460	0.887	0.755
LOKIASV2_4345_ESMFold_MFS_transporter	AF-Q0DMT0-F1-model_v4	AF-Q0DMT0-F1-model_v4 Os03g0795000 protein	1.736E-06	1.000	241	1	433	471	23	450	464	459	0.919	0.922
LOKIASV2_4345_ESMFold_MFS_transporter	AF-K0EXR1-F1-model_v4	AF-K0EXR1-F1-model_v4 Major facilitator superfamily protein	2.413E-06	1.000	241	1	437	471	3	459	465	504	0.928	0.983
LOKIASV2_4345_ESMFold_MFS_transporter	AF-A0A1C1CSL4-F1-model_v4	AF-A0A1C1CSL4-F1-model_v4 Putative transporter	1.885E-06	1.000	241	16	427	471	63	475	507	467	0.875	0.815
LOKIASV2_4345_ESMFold_MFS_transporter	AF-A0A0D2GXK9-F1-model_v4	AF-A0A0D2GXK9-F1-model_v4 Unplaced genomic scaffold supercont1.1, whole genome shotgun sequence	7.959E-06	1.000	241	15	471	471	415	844	980	484	0.970	0.439
LOKIASV2_4345_ESMFold_MFS_transporter	AF-A0A0N4U5Y8-F1-model_v4	AF-A0A0N4U5Y8-F1-model_v4 MFS domain-containing protein	1.201E-05	1.000	240	11	446	471	1	394	404	459	0.926	0.975
LOKIASV2_4345_ESMFold_MFS_transporter	AF-P44610-F1-model_v4	AF-P44610-F1-model_v4 Putative metabolite transport protein HI_0281	5.966E-06	1.000	240	8	427	471	2	425	438	478	0.892	0.968
LOKIASV2_4345_ESMFold_MFS_transporter	AF-Q5F886-F1-model_v4	AF-Q5F886-F1-model_v4 Major facilitator transporter	4.857E-06	1.000	240	8	431	471	7	453	468	482	0.900	0.955
LOKIASV2_4345_ESMFold_MFS_transporter	AF-C1H543-F1-model_v4	AF-C1H543-F1-model_v4 MFS domain-containing protein	3.502E-05	1.000	240	6	430	471	60	456	470	450	0.902	0.845
LOKIASV2_4345_ESMFold_MFS_transporter	AF-K0F3T8-F1-model_v4	AF-K0F3T8-F1-model_v4 Chloramphenicol resistance protein	7.959E-06	1.000	239	21	436	471	2	378	395	422	0.883	0.954
LOKIASV2_4345_ESMFold_MFS_transporter	AF-F1QY19-F1-model_v4	AF-F1QY19-F1-model_v4 Zgc:114041	2.514E-06	1.000	239	1	459	471	1	420	433	489	0.975	0.970
LOKIASV2_4345_ESMFold_MFS_transporter	AF-A0A0H3GYM1-F1-model_v4	AF-A0A0H3GYM1-F1-model_v4 Metabolite/H+ symporter, major facilitator superfamily (MFS)	2.132E-06	1.000	239	2	431	471	6	431	440	479	0.913	0.968
LOKIASV2_4345_ESMFold_MFS_transporter	AF-P31675-F1-model_v4	AF-P31675-F1-model_v4 Sugar efflux transporter A	1.106E-05	1.000	238	15	426	471	13	387	392	421	0.875	0.957
LOKIASV2_4345_ESMFold_MFS_transporter	AF-Q9HT43-F1-model_v4	AF-Q9HT43-F1-model_v4 Probable MFS dicarboxylate transporter	2.315E-06	1.000	238	1	440	471	3	428	435	483	0.934	0.979
LOKIASV2_4345_ESMFold_MFS_transporter	AF-E1JHT4-F1-model_v4	AF-E1JHT4-F1-model_v4 Uncharacterized protein, isoform B	3.494E-06	1.000	238	1	470	471	33	489	496	511	0.998	0.921
LOKIASV2_4345_ESMFold_MFS_transporter	AF-U7PRW5-F1-model_v4	AF-U7PRW5-F1-model_v4 MFS domain-containing protein	2.620E-06	1.000	238	13	450	471	44	537	548	537	0.930	0.901
LOKIASV2_4345_ESMFold_MFS_transporter	AF-A0A1C1CSX7-F1-model_v4	AF-A0A1C1CSX7-F1-model_v4 Putative MFS-type transporter	4.661E-06	1.000	238	11	435	471	57	524	762	513	0.902	0.614
LOKIASV2_4345_ESMFold_MFS_transporter	AF-Q8DN45-F1-model_v4	AF-Q8DN45-F1-model_v4 Uncharacterized protein	4.293E-06	1.000	237	16	427	471	9	408	415	444	0.875	0.964
LOKIASV2_4345_ESMFold_MFS_transporter	AF-F4KGN5-F1-model_v4	AF-F4KGN5-F1-model_v4 Solute carrier family 40 member 2	2.964E-06	1.000	237	6	442	471	21	503	512	525	0.928	0.943
LOKIASV2_4345_ESMFold_MFS_transporter	AF-Q91Y77-F1-model_v4	AF-Q91Y77-F1-model_v4 Monocarboxylate transporter 10	3.218E-06	1.000	237	4	469	471	51	491	514	508	0.989	0.858
LOKIASV2_4345_ESMFold_MFS_transporter	AF-A0A0D2GJY5-F1-model_v4	AF-A0A0D2GJY5-F1-model_v4 Unplaced genomic scaffold supercont1.3, whole genome shotgun sequence	1.017E-06	1.000	237	16	446	471	15	471	515	503	0.915	0.887
LOKIASV2_4345_ESMFold_MFS_transporter	AF-A0A0D2GJB1-F1-model_v4	AF-A0A0D2GJB1-F1-model_v4 Unplaced genomic scaffold supercont1.3, whole genome shotgun sequence	2.046E-06	1.000	237	7	432	471	43	470	516	474	0.904	0.829
LOKIASV2_4345_ESMFold_MFS_transporter	AF-B4FW72-F1-model_v4	AF-B4FW72-F1-model_v4 Folate-biopterin transporter 1 chloroplastic	7.941E-07	1.000	237	1	433	471	71	503	517	478	0.919	0.838
LOKIASV2_4345_ESMFold_MFS_transporter	AF-Q6UXD7-F1-model_v4	AF-Q6UXD7-F1-model_v4 Solute carrier family 49 member A3	4.473E-06	1.000	237	7	440	471	20	448	560	469	0.921	0.766
LOKIASV2_4345_ESMFold_MFS_transporter	AF-A0A0D2GU23-F1-model_v4	AF-A0A0D2GU23-F1-model_v4 Unplaced genomic scaffold supercont1.3, whole genome shotgun sequence	2.132E-06	1.000	237	9	446	471	26	531	600	554	0.930	0.843
LOKIASV2_4345_ESMFold_MFS_transporter	AF-P21503-F1-model_v4	AF-P21503-F1-model_v4 Uncharacterized MFS-type transporter YcaD	7.034E-06	1.000	236	16	425	471	6	368	382	422	0.870	0.950
LOKIASV2_4345_ESMFold_MFS_transporter	AF-Q32IC2-F1-model_v4	AF-Q32IC2-F1-model_v4 Putative DEOR-type transcriptional regulator	2.418E-05	1.000	236	17	441	471	12	397	402	449	0.902	0.960
LOKIASV2_4345_ESMFold_MFS_transporter	AF-A0A044QLY0-F1-model_v4	AF-A0A044QLY0-F1-model_v4 MFS domain-containing protein	7.034E-06	1.000	236	15	453	471	9	393	407	461	0.932	0.946
LOKIASV2_4345_ESMFold_MFS_transporter	AF-I6XHB8-F1-model_v4	AF-I6XHB8-F1-model_v4 Probable dicarboxylic acid transport integral membrane protein KgtP (Dicarboxylate transporter)	5.966E-06	1.000	236	3	446	471	2	444	449	491	0.943	0.987
LOKIASV2_4345_ESMFold_MFS_transporter	AF-U7PQT4-F1-model_v4	AF-U7PQT4-F1-model_v4 MFS domain-containing protein	1.059E-06	1.000	236	16	438	471	71	460	464	453	0.898	0.841
LOKIASV2_4345_ESMFold_MFS_transporter	AF-Q8ZK64-F1-model_v4	AF-Q8ZK64-F1-model_v4 Sugar (And other) transporter	2.315E-06	1.000	236	6	454	471	2	467	477	503	0.953	0.977
LOKIASV2_4345_ESMFold_MFS_transporter	AF-A0A0D2DUZ7-F1-model_v4	AF-A0A0D2DUZ7-F1-model_v4 Unplaced genomic scaffold supercont1.3, whole genome shotgun sequence	1.019E-05	1.000	236	5	427	471	18	447	487	474	0.898	0.883
LOKIASV2_4345_ESMFold_MFS_transporter	AF-Q2FVI5-F1-model_v4	AF-Q2FVI5-F1-model_v4 Bcr/CflA family efflux transporter	9.777E-06	1.000	235	3	430	471	2	394	403	448	0.909	0.975
LOKIASV2_4345_ESMFold_MFS_transporter	AF-K0EQT3-F1-model_v4	AF-K0EQT3-F1-model_v4 Major facilitator superfamily protein	7.638E-06	1.000	235	17	437	471	19	407	413	435	0.894	0.942
LOKIASV2_4345_ESMFold_MFS_transporter	AF-A0A0D2H7W5-F1-model_v4	AF-A0A0D2H7W5-F1-model_v4 Unplaced genomic scaffold supercont1.4, whole genome shotgun sequence	7.959E-06	1.000	235	4	468	471	18	531	550	560	0.987	0.935
LOKIASV2_4345_ESMFold_MFS_transporter	AF-A0A1D8PU23-F1-model_v4	AF-A0A1D8PU23-F1-model_v4 MFS domain-containing protein	2.315E-06	1.000	235	12	449	471	35	540	560	548	0.930	0.904
LOKIASV2_4345_ESMFold_MFS_transporter	AF-Q559K0-F1-model_v4	AF-Q559K0-F1-model_v4 Folate-like transporter DDB_G0272544	2.514E-06	1.000	235	15	466	471	99	515	566	483	0.960	0.737
LOKIASV2_4345_ESMFold_MFS_transporter	AF-A0A0D2DHQ8-F1-model_v4	AF-A0A0D2DHQ8-F1-model_v4 Unplaced genomic scaffold supercont1.6, whole genome shotgun sequence	9.383E-06	1.000	235	1	471	471	42	582	587	579	1.000	0.922
LOKIASV2_4345_ESMFold_MFS_transporter	AF-U7Q7E2-F1-model_v4	AF-U7Q7E2-F1-model_v4 MFS domain-containing protein	2.315E-06	1.000	235	17	449	471	107	600	620	540	0.919	0.797
LOKIASV2_4345_ESMFold_MFS_transporter	AF-F1QVM2-F1-model_v4	AF-F1QVM2-F1-model_v4 Solute carrier family 16 member 7	1.736E-06	1.000	234	18	467	471	18	447	465	487	0.955	0.925
LOKIASV2_4345_ESMFold_MFS_transporter	AF-C1GV11-F1-model_v4	AF-C1GV11-F1-model_v4 MFS domain-containing protein	5.495E-06	1.000	234	10	425	471	9	469	482	499	0.883	0.956
LOKIASV2_4345_ESMFold_MFS_transporter	AF-U7Q2D3-F1-model_v4	AF-U7Q2D3-F1-model_v4 MFS domain-containing protein	7.959E-06	1.000	234	15	425	471	72	472	516	446	0.873	0.777
LOKIASV2_4345_ESMFold_MFS_transporter	AF-Q54IX9-F1-model_v4	AF-Q54IX9-F1-model_v4 MFS domain-containing protein	3.353E-06	1.000	234	1	466	471	39	511	517	527	0.989	0.915
LOKIASV2_4345_ESMFold_MFS_transporter	AF-A0A1C1CDN1-F1-model_v4	AF-A0A1C1CDN1-F1-model_v4 Putative HC-toxin efflux carrier TOXA	1.472E-06	1.000	234	2	447	471	26	537	572	566	0.947	0.895
LOKIASV2_4345_ESMFold_MFS_transporter	AF-A0A0D2GMJ6-F1-model_v4	AF-A0A0D2GMJ6-F1-model_v4 Unplaced genomic scaffold supercont1.4, whole genome shotgun sequence	3.353E-06	1.000	234	1	447	471	30	551	602	560	0.949	0.867
LOKIASV2_4345_ESMFold_MFS_transporter	AF-Q2G1R0-F1-model_v4	AF-Q2G1R0-F1-model_v4 MFS domain-containing protein	2.413E-06	1.000	233	16	438	471	13	398	406	437	0.898	0.951
LOKIASV2_4345_ESMFold_MFS_transporter	AF-A0A3Q0KJD0-F1-model_v4	AF-A0A3Q0KJD0-F1-model_v4 Putative sodium-dependent phosphate transporter	9.777E-06	1.000	233	1	431	471	4	415	423	470	0.915	0.974
LOKIASV2_4345_ESMFold_MFS_transporter	AF-A0A132Z4A1-F1-model_v4	AF-A0A132Z4A1-F1-model_v4 MFS transporter	8.641E-06	1.000	233	8	462	471	10	417	430	473	0.966	0.949
LOKIASV2_4345_ESMFold_MFS_transporter	AF-A0A0D2GIA5-F1-model_v4	AF-A0A0D2GIA5-F1-model_v4 Unplaced genomic scaffold supercont1.4, whole genome shotgun sequence	1.106E-05	1.000	233	12	471	471	21	458	469	498	0.977	0.934
LOKIASV2_4345_ESMFold_MFS_transporter	AF-A0A0K0E3W4-F1-model_v4	AF-A0A0K0E3W4-F1-model_v4 MFS domain-containing protein	5.273E-06	1.000	233	1	445	471	3	509	515	562	0.945	0.984
LOKIASV2_4345_ESMFold_MFS_transporter	AF-A0A0K0E0B5-F1-model_v4	AF-A0A0K0E0B5-F1-model_v4 Solute carrier family 40 protein	9.383E-06	1.000	233	16	462	471	15	533	537	574	0.949	0.966
LOKIASV2_4345_ESMFold_MFS_transporter	AF-A0A0D2G8V8-F1-model_v4	AF-A0A0D2G8V8-F1-model_v4 Unplaced genomic scaffold supercont1.6, whole genome shotgun sequence	5.726E-06	1.000	233	2	450	471	31	549	557	560	0.953	0.932
