LOKIASV2_1161_ESMFold_hypothetical_protein	AF-A0A144A3K9-F1-model_v4	AF-A0A144A3K9-F1-model_v4 OST-HTH associated domain protein, putative	6.284E-02	0.663	56	18	369	377	1	410	699	462	0.934	0.587
LOKIASV2_1161_ESMFold_hypothetical_protein	AF-A0A7S0UAF0-F1-model_v4	AF-A0A7S0UAF0-F1-model_v4 Hypothetical protein	5.121E+00	0.076	28	14	227	377	3	210	241	224	0.568	0.863
LOKIASV2_1161_ESMFold_hypothetical_protein	AF-Q54TN2-F1-model_v4	AF-Q54TN2-F1-model_v4 Myb-like protein C	2.827E-02	0.254	42	1	366	377	127	497	580	418	0.971	0.640
LOKIASV2_1161_ESMFold_hypothetical_protein	AF-P18183-F1-model_v4	AF-P18183-F1-model_v4 RNA polymerase principal sigma factor HrdB	4.079E-02	0.196	39	1	364	377	83	509	511	455	0.966	0.836
LOKIASV2_1161_ESMFold_hypothetical_protein	AF-B1VXR4-F1-model_v4	AF-B1VXR4-F1-model_v4 RNA polymerase principal sigma factor HrdB	4.298E-02	0.179	38	1	364	377	90	512	514	459	0.966	0.823
LOKIASV2_1161_ESMFold_hypothetical_protein	AF-Q0V9S3-F1-model_v4	AF-Q0V9S3-F1-model_v4 CBP80/20-dependent translation initiation factor	1.511E-01	0.150	36	3	344	377	200	530	583	370	0.907	0.568
LOKIASV2_1161_ESMFold_hypothetical_protein	AF-P0A603-F1-model_v4	AF-P0A603-F1-model_v4 RNA polymerase sigma factor SigA	1.593E-01	0.138	35	1	364	377	74	526	528	478	0.966	0.858
LOKIASV2_1161_ESMFold_hypothetical_protein	AF-Q12797-F1-model_v4	AF-Q12797-F1-model_v4 Aspartyl/asparaginyl beta-hydroxylase	4.541E-01	0.126	34	1	345	377	187	539	758	391	0.915	0.466
LOKIASV2_1161_ESMFold_hypothetical_protein	AF-Q5TM49-F1-model_v4	AF-Q5TM49-F1-model_v4 POU domain, class 5, transcription factor 1	3.682E-01	0.098	31	1	345	377	4	286	360	367	0.915	0.786
LOKIASV2_1161_ESMFold_hypothetical_protein	AF-Q0P5D2-F1-model_v4	AF-Q0P5D2-F1-model_v4 Cleavage and polyadenylation specificity factor subunit 6	1.295E+00	0.098	31	6	237	377	302	499	551	236	0.615	0.359
LOKIASV2_1161_ESMFold_hypothetical_protein	AF-Q5B4Z3-F1-model_v4	AF-Q5B4Z3-F1-model_v4 Cytokinesis protein sepH	7.667E-01	0.098	31	1	367	377	557	898	1346	405	0.973	0.254
LOKIASV2_1161_ESMFold_hypothetical_protein	AF-Q9QY42-F1-model_v4	AF-Q9QY42-F1-model_v4 Prosaposin receptor GPR37	3.682E-01	0.090	30	1	352	377	117	466	600	384	0.934	0.583
LOKIASV2_1161_ESMFold_hypothetical_protein	AF-P28069-F1-model_v4	AF-P28069-F1-model_v4 Pituitary-specific positive transcription factor 1	9.963E-01	0.082	29	18	261	377	4	259	291	275	0.647	0.880
LOKIASV2_1161_ESMFold_hypothetical_protein	AF-Q90Z80-F1-model_v4	AF-Q90Z80-F1-model_v4 F-box only protein 5-A	7.667E-01	0.082	29	1	270	377	19	244	392	279	0.716	0.577
LOKIASV2_1161_ESMFold_hypothetical_protein	AF-Q16630-F1-model_v4	AF-Q16630-F1-model_v4 Cleavage and polyadenylation specificity factor subunit 6	1.682E+00	0.082	29	6	237	377	302	499	551	236	0.615	0.359
LOKIASV2_1161_ESMFold_hypothetical_protein	AF-Q6P6R0-F1-model_v4	AF-Q6P6R0-F1-model_v4 Protein lifeguard 1	4.541E-01	0.076	28	1	366	377	7	291	348	374	0.971	0.819
LOKIASV2_1161_ESMFold_hypothetical_protein	AF-Q5R5T1-F1-model_v4	AF-Q5R5T1-F1-model_v4 FYVE, RhoGEF and PH domain-containing protein 3	6.552E-01	0.076	28	1	372	377	14	367	737	417	0.987	0.480
LOKIASV2_1161_ESMFold_hypothetical_protein	AF-Q8BSY0-F1-model_v4	AF-Q8BSY0-F1-model_v4 Aspartyl/asparaginyl beta-hydroxylase	1.364E+00	0.076	28	1	345	377	175	522	741	385	0.915	0.470
LOKIASV2_1161_ESMFold_hypothetical_protein	AF-Q54LR6-F1-model_v4	AF-Q54LR6-F1-model_v4 Probable serine/threonine-protein kinase DDB_G0286481	4.541E-01	0.069	27	1	313	377	49	414	605	377	0.830	0.605
LOKIASV2_1161_ESMFold_hypothetical_protein	AF-Q05958-F1-model_v4	AF-Q05958-F1-model_v4 Sterol regulatory element-binding protein ECM22	1.969E+00	0.069	27	1	319	377	368	666	814	340	0.846	0.367
LOKIASV2_1161_ESMFold_hypothetical_protein	AF-Q9AYT5-F1-model_v4	AF-Q9AYT5-F1-model_v4 Putative GTP diphosphokinase RSH1, chloroplastic	8.079E-01	0.069	27	1	367	377	1	366	892	411	0.973	0.410
LOKIASV2_1161_ESMFold_hypothetical_protein	AF-Q6PEE2-F1-model_v4	AF-Q6PEE2-F1-model_v4 CBP80/20-dependent translation initiation factor	9.963E-01	0.063	26	7	344	377	199	547	600	396	0.897	0.582
LOKIASV2_1161_ESMFold_hypothetical_protein	AF-Q9H079-F1-model_v4	AF-Q9H079-F1-model_v4 KATNB1-like protein 1	1.438E+00	0.057	25	1	340	377	3	298	304	369	0.902	0.974
LOKIASV2_1161_ESMFold_hypothetical_protein	AF-Q7Z429-F1-model_v4	AF-Q7Z429-F1-model_v4 Protein lifeguard 1	6.904E-01	0.057	25	1	366	377	7	314	371	386	0.971	0.830
LOKIASV2_1161_ESMFold_hypothetical_protein	AF-Q9MZT7-F1-model_v4	AF-Q9MZT7-F1-model_v4 Myc proto-oncogene protein	2.427E+00	0.057	25	2	211	377	199	424	439	242	0.557	0.515
LOKIASV2_1161_ESMFold_hypothetical_protein	AF-P49033-F1-model_v4	AF-P49033-F1-model_v4 Myc proto-oncogene protein	2.074E+00	0.057	25	2	211	377	199	424	439	247	0.557	0.515
LOKIASV2_1161_ESMFold_hypothetical_protein	AF-P0CX58-F1-model_v4	AF-P0CX58-F1-model_v4 Transposon Ty1-PR1 Gag polyprotein	1.773E+00	0.057	25	1	343	377	21	355	440	379	0.910	0.761
LOKIASV2_1161_ESMFold_hypothetical_protein	AF-A5DZP0-F1-model_v4	AF-A5DZP0-F1-model_v4 Altered inheritance of mitochondria protein 23, mitochondrial	1.050E+00	0.057	25	1	291	377	8	394	463	405	0.772	0.836
LOKIASV2_1161_ESMFold_hypothetical_protein	AF-Q9QYC6-F1-model_v4	AF-Q9QYC6-F1-model_v4 Prosaposin receptor GPR37	8.079E-01	0.057	25	2	344	377	125	465	603	372	0.910	0.566
LOKIASV2_1161_ESMFold_hypothetical_protein	AF-Q86DA5-F1-model_v4	AF-Q86DA5-F1-model_v4 NAD(+) hydrolase tir-1	1.106E+00	0.057	25	1	346	377	112	456	981	404	0.918	0.352
LOKIASV2_1161_ESMFold_hypothetical_protein	AF-Q28GK6-F1-model_v4	AF-Q28GK6-F1-model_v4 F-box only protein 5	9.963E-01	0.051	24	1	280	377	1	272	391	315	0.743	0.696
LOKIASV2_1161_ESMFold_hypothetical_protein	AF-Q04213-F1-model_v4	AF-Q04213-F1-model_v4 ISWI one complex protein 4	2.841E+00	0.051	24	11	270	377	191	433	475	273	0.690	0.512
LOKIASV2_1161_ESMFold_hypothetical_protein	AF-Q5U4W6-F1-model_v4	AF-Q5U4W6-F1-model_v4 Integrator complex subunit 6-B	7.685E+00	0.051	24	1	210	377	673	874	883	220	0.557	0.229
LOKIASV2_1161_ESMFold_hypothetical_protein	AF-P11075-F1-model_v4	AF-P11075-F1-model_v4 Protein transport protein SEC7	2.074E+00	0.051	24	1	366	377	91	474	2009	411	0.971	0.191
LOKIASV2_1161_ESMFold_hypothetical_protein	AF-P04725-F1-model_v4	AF-P04725-F1-model_v4 Alpha/beta-gliadin A-V	2.304E+00	0.045	23	1	269	377	16	289	319	304	0.714	0.859
LOKIASV2_1161_ESMFold_hypothetical_protein	AF-Q32L53-F1-model_v4	AF-Q32L53-F1-model_v4 Protein lifeguard 1	1.295E+00	0.045	23	1	345	377	8	299	366	359	0.915	0.798
LOKIASV2_1161_ESMFold_hypothetical_protein	AF-A1YG22-F1-model_v4	AF-A1YG22-F1-model_v4 Myc proto-oncogene protein	3.154E+00	0.045	23	3	211	377	200	424	439	241	0.554	0.513
LOKIASV2_1161_ESMFold_hypothetical_protein	AF-P0CX72-F1-model_v4	AF-P0CX72-F1-model_v4 Transposon Ty1-LR2 Gag polyprotein	2.427E+00	0.045	23	1	351	377	28	359	440	389	0.931	0.755
LOKIASV2_1161_ESMFold_hypothetical_protein	AF-P87233-F1-model_v4	AF-P87233-F1-model_v4 SWM histone demethylase complex subunit phf1	3.503E+00	0.045	23	1	291	377	22	422	461	415	0.772	0.870
LOKIASV2_1161_ESMFold_hypothetical_protein	AF-Q6DVA0-F1-model_v4	AF-Q6DVA0-F1-model_v4 LEM domain-containing protein 2	2.074E+00	0.045	23	1	357	377	88	501	511	454	0.947	0.810
LOKIASV2_1161_ESMFold_hypothetical_protein	AF-Q9LM20-F1-model_v4	AF-Q9LM20-F1-model_v4 Putative pumilio homolog 8, chloroplastic	1.969E+00	0.045	23	1	346	377	44	424	515	441	0.918	0.740
LOKIASV2_1161_ESMFold_hypothetical_protein	AF-P53632-F1-model_v4	AF-P53632-F1-model_v4 Poly(A) RNA polymerase protein 2	9.454E-01	0.045	23	1	373	377	5	419	584	462	0.989	0.711
LOKIASV2_1161_ESMFold_hypothetical_protein	AF-Q7M732-F1-model_v4	AF-Q7M732-F1-model_v4 Retrotransposon-like protein 1	1.773E+00	0.045	23	1	361	377	287	636	1744	398	0.958	0.201
LOKIASV2_1161_ESMFold_hypothetical_protein	AF-A2QCR5-F1-model_v4	AF-A2QCR5-F1-model_v4 Required for respiratory growth protein 9, mitochondrial	3.890E+00	0.040	22	2	225	377	34	273	284	255	0.594	0.845
LOKIASV2_1161_ESMFold_hypothetical_protein	AF-O08609-F1-model_v4	AF-O08609-F1-model_v4 Max-like protein X	3.154E+00	0.040	22	6	270	377	13	290	298	292	0.703	0.933
LOKIASV2_1161_ESMFold_hypothetical_protein	AF-P22555-F1-model_v4	AF-P22555-F1-model_v4 Myc proto-oncogene protein	4.099E+00	0.040	22	2	211	377	199	424	439	241	0.557	0.515
LOKIASV2_1161_ESMFold_hypothetical_protein	AF-P0CX75-F1-model_v4	AF-P0CX75-F1-model_v4 Transposon Ty1-LR3 Gag polyprotein	3.503E+00	0.040	22	1	343	377	21	355	440	375	0.910	0.761
LOKIASV2_1161_ESMFold_hypothetical_protein	AF-Q99L90-F1-model_v4	AF-Q99L90-F1-model_v4 Microspherule protein 1	3.324E+00	0.040	22	2	345	377	1	320	462	369	0.912	0.693
LOKIASV2_1161_ESMFold_hypothetical_protein	AF-Q9HAP2-F1-model_v4	AF-Q9HAP2-F1-model_v4 MLX-interacting protein	8.972E-01	0.040	22	1	343	377	583	918	919	390	0.910	0.366
LOKIASV2_1161_ESMFold_hypothetical_protein	AF-A2A432-F1-model_v4	AF-A2A432-F1-model_v4 Cullin-4B	1.229E+00	0.040	22	1	367	377	114	453	970	409	0.973	0.351
LOKIASV2_1161_ESMFold_hypothetical_protein	AF-A6NKG5-F1-model_v4	AF-A6NKG5-F1-model_v4 Retrotransposon-like protein 1	1.969E+00	0.040	22	1	345	377	12	365	1358	406	0.915	0.261
LOKIASV2_1161_ESMFold_hypothetical_protein	AF-C4R5T1-F1-model_v4	AF-C4R5T1-F1-model_v4 Autophagy-related protein 30	4.552E+00	0.034	21	1	224	377	1	234	384	255	0.594	0.609
LOKIASV2_1161_ESMFold_hypothetical_protein	AF-A2T7L5-F1-model_v4	AF-A2T7L5-F1-model_v4 Myc proto-oncogene protein	4.552E+00	0.034	21	2	211	377	199	424	439	242	0.557	0.515
LOKIASV2_1161_ESMFold_hypothetical_protein	AF-P09416-F1-model_v4	AF-P09416-F1-model_v4 Myc proto-oncogene protein	5.326E+00	0.034	21	3	211	377	201	424	439	240	0.554	0.510
LOKIASV2_1161_ESMFold_hypothetical_protein	AF-S4W177-F1-model_v4	AF-S4W177-F1-model_v4 Equisetin cluster transcription factor eqxR	1.438E+00	0.034	21	6	343	377	61	468	469	433	0.897	0.870
LOKIASV2_1161_ESMFold_hypothetical_protein	AF-F4HTH8-F1-model_v4	AF-F4HTH8-F1-model_v4 Katanin p80 WD40 repeat-containing subunit B1 homolog KTN80.2	3.154E+00	0.034	21	2	339	377	886	1179	1181	356	0.897	0.249
LOKIASV2_1161_ESMFold_hypothetical_protein	AF-Q9P7D5-F1-model_v4	AF-Q9P7D5-F1-model_v4 Uncharacterized protein P4H10.14c	7.685E+00	0.029	20	1	211	377	105	295	308	219	0.560	0.620
LOKIASV2_1161_ESMFold_hypothetical_protein	AF-Q640H3-F1-model_v4	AF-Q640H3-F1-model_v4 OTU domain-containing protein 5-B	1.868E+00	0.029	20	1	345	377	1	362	518	413	0.915	0.699
LOKIASV2_1161_ESMFold_hypothetical_protein	AF-Q96M96-F1-model_v4	AF-Q96M96-F1-model_v4 FYVE, RhoGEF and PH domain-containing protein 4	2.186E+00	0.029	20	1	367	377	66	409	766	411	0.973	0.449
LOKIASV2_1161_ESMFold_hypothetical_protein	AF-C0PEY7-F1-model_v4	AF-C0PEY7-F1-model_v4 Tetratricopeptide repeat domain-containing protein PYG7, chloroplastic	3.154E+00	0.024	19	3	355	377	16	321	321	370	0.936	0.953
LOKIASV2_1161_ESMFold_hypothetical_protein	AF-Q91989-F1-model_v4	AF-Q91989-F1-model_v4 POU domain, class 5, transcription factor 1.3	3.691E+00	0.024	19	2	345	377	82	352	426	364	0.912	0.636
LOKIASV2_1161_ESMFold_hypothetical_protein	AF-P68271-F1-model_v4	AF-P68271-F1-model_v4 Myc proto-oncogene protein	7.685E+00	0.024	19	3	211	377	200	424	439	241	0.554	0.513
LOKIASV2_1161_ESMFold_hypothetical_protein	AF-Q14CN4-F1-model_v4	AF-Q14CN4-F1-model_v4 Keratin, type II cytoskeletal 72	3.154E+00	0.024	19	6	363	377	1	297	511	361	0.950	0.581
LOKIASV2_1161_ESMFold_hypothetical_protein	AF-G0LEU0-F1-model_v4	AF-G0LEU0-F1-model_v4 C6 finger domain transcription factor BOA13	2.841E+00	0.024	19	1	342	377	226	567	568	396	0.907	0.602
LOKIASV2_1161_ESMFold_hypothetical_protein	AF-Q9I9A7-F1-model_v4	AF-Q9I9A7-F1-model_v4 DNA replication factor Cdt1	6.921E+00	0.024	19	1	359	377	67	597	617	570	0.952	0.861
LOKIASV2_1161_ESMFold_hypothetical_protein	AF-Q7KRW8-F1-model_v4	AF-Q7KRW8-F1-model_v4 Pre-mRNA-processing factor 39	2.841E+00	0.024	19	2	376	377	176	523	1066	427	0.995	0.326
LOKIASV2_1161_ESMFold_hypothetical_protein	AF-Q6PAJ1-F1-model_v4	AF-Q6PAJ1-F1-model_v4 Breakpoint cluster region protein	2.427E+00	0.024	19	1	345	377	347	821	1270	496	0.915	0.374
LOKIASV2_1161_ESMFold_hypothetical_protein	AF-A8JUV0-F1-model_v4	AF-A8JUV0-F1-model_v4 Protein strawberry notch	2.993E+00	0.024	19	1	299	377	936	1181	1653	315	0.793	0.149
LOKIASV2_1161_ESMFold_hypothetical_protein	AF-Q08182-F1-model_v4	AF-Q08182-F1-model_v4 AP-1-like transcription factor YAP7	7.293E+00	0.020	18	1	226	377	2	227	245	239	0.599	0.922
LOKIASV2_1161_ESMFold_hypothetical_protein	AF-Q4X0T4-F1-model_v4	AF-Q4X0T4-F1-model_v4 Required for respiratory growth protein 9, mitochondrial	8.993E+00	0.020	18	1	267	377	30	275	280	284	0.708	0.879
LOKIASV2_1161_ESMFold_hypothetical_protein	AF-Q5XIB5-F1-model_v4	AF-Q5XIB5-F1-model_v4 Coiled-coil domain-containing protein 86	8.099E+00	0.020	18	1	227	377	105	313	341	248	0.602	0.613
LOKIASV2_1161_ESMFold_hypothetical_protein	AF-Q5ZLY0-F1-model_v4	AF-Q5ZLY0-F1-model_v4 Phosphorylated adapter RNA export protein	1.682E+00	0.020	18	2	345	377	1	330	399	384	0.912	0.827
LOKIASV2_1161_ESMFold_hypothetical_protein	AF-P0CX73-F1-model_v4	AF-P0CX73-F1-model_v4 Transposon Ty1-PL Gag polyprotein	8.099E+00	0.020	18	1	343	377	28	355	440	392	0.910	0.745
LOKIASV2_1161_ESMFold_hypothetical_protein	AF-Q60YF6-F1-model_v4	AF-Q60YF6-F1-model_v4 Mediator of RNA polymerase II transcription subunit 29	7.685E+00	0.020	18	1	270	377	213	435	473	272	0.716	0.471
LOKIASV2_1161_ESMFold_hypothetical_protein	AF-Q61MR2-F1-model_v4	AF-Q61MR2-F1-model_v4 IWS1-like protein	9.477E+00	0.020	18	1	319	377	69	399	497	362	0.846	0.666
LOKIASV2_1161_ESMFold_hypothetical_protein	AF-Q8R4E9-F1-model_v4	AF-Q8R4E9-F1-model_v4 DNA replication factor Cdt1	9.477E+00	0.020	18	1	364	377	34	547	557	568	0.966	0.923
LOKIASV2_1161_ESMFold_hypothetical_protein	AF-Q0IHQ3-F1-model_v4	AF-Q0IHQ3-F1-model_v4 MARVEL domain-containing protein 2	5.326E+00	0.020	18	1	269	377	20	370	568	367	0.714	0.618
LOKIASV2_1161_ESMFold_hypothetical_protein	AF-P27123-F1-model_v4	AF-P27123-F1-model_v4 Nuclear autoantigenic sperm protein	5.613E+00	0.020	18	2	345	377	304	566	693	360	0.912	0.380
LOKIASV2_1161_ESMFold_hypothetical_protein	AF-C5DY19-F1-model_v4	AF-C5DY19-F1-model_v4 Spindle pole body component 110	2.186E+00	0.020	18	1	367	377	1	320	835	377	0.973	0.383
LOKIASV2_1161_ESMFold_hypothetical_protein	AF-Q09446-F1-model_v4	AF-Q09446-F1-model_v4 DnaJ homolog dnj-5	3.503E+00	0.020	18	1	356	377	406	761	915	389	0.944	0.389
LOKIASV2_1161_ESMFold_hypothetical_protein	AF-Q5A4K7-F1-model_v4	AF-Q5A4K7-F1-model_v4 Transcriptional regulator of yeast form adherence 5	4.796E+00	0.020	18	1	314	377	90	391	988	339	0.833	0.306
LOKIASV2_1161_ESMFold_hypothetical_protein	AF-A2RUW0-F1-model_v4	AF-A2RUW0-F1-model_v4 Maestro heat-like repeat-containing protein family member 7	3.503E+00	0.020	18	1	374	377	261	627	1122	424	0.992	0.327
LOKIASV2_1161_ESMFold_hypothetical_protein	AF-Q9USV1-F1-model_v4	AF-Q9USV1-F1-model_v4 Swi5-dependent recombination DNA repair protein 1	5.613E+00	0.016	17	2	355	377	39	298	299	372	0.939	0.870
LOKIASV2_1161_ESMFold_hypothetical_protein	AF-P53850-F1-model_v4	AF-P53850-F1-model_v4 Restriction of telomere capping protein 4	3.154E+00	0.016	17	1	262	377	6	288	401	324	0.695	0.706
LOKIASV2_1161_ESMFold_hypothetical_protein	AF-Q8NC56-F1-model_v4	AF-Q8NC56-F1-model_v4 LEM domain-containing protein 2	9.987E+00	0.016	17	5	356	377	75	488	503	452	0.934	0.823
LOKIASV2_1161_ESMFold_hypothetical_protein	AF-Q7ZX21-F1-model_v4	AF-Q7ZX21-F1-model_v4 OTU domain-containing protein 5-A	7.293E+00	0.016	17	1	345	377	1	357	513	408	0.915	0.696
LOKIASV2_1161_ESMFold_hypothetical_protein	AF-Q148H8-F1-model_v4	AF-Q148H8-F1-model_v4 Keratin, type II cytoskeletal 72	6.233E+00	0.016	17	1	363	377	1	309	524	365	0.963	0.590
LOKIASV2_1161_ESMFold_hypothetical_protein	AF-Q6ZV73-F1-model_v4	AF-Q6ZV73-F1-model_v4 FYVE, RhoGEF and PH domain-containing protein 6	5.326E+00	0.016	17	1	345	377	726	1064	1430	397	0.915	0.237
LOKIASV2_1161_ESMFold_hypothetical_protein	AF-Q8N4S9-F1-model_v4	AF-Q8N4S9-F1-model_v4 MARVEL domain-containing protein 2	8.993E+00	0.014	16	1	269	377	35	358	558	344	0.714	0.581
LOKIASV2_1161_ESMFold_hypothetical_protein	AF-A0A060KY90-F1-model_v4	AF-A0A060KY90-F1-model_v4 Transcription factor MYC1	4.552E+00	0.014	16	2	301	377	336	625	630	344	0.796	0.460
LOKIASV2_1161_ESMFold_hypothetical_protein	AF-Q61210-F1-model_v4	AF-Q61210-F1-model_v4 Rho guanine nucleotide exchange factor 1	7.293E+00	0.014	16	6	366	377	291	619	920	392	0.958	0.358
LOKIASV2_1161_ESMFold_hypothetical_protein	AF-P52734-F1-model_v4	AF-P52734-F1-model_v4 FYVE, RhoGEF and PH domain-containing protein 1	8.099E+00	0.014	16	2	346	377	240	566	960	374	0.915	0.341
LOKIASV2_1161_ESMFold_hypothetical_protein	AF-Q54GU5-F1-model_v4	AF-Q54GU5-F1-model_v4 Uncharacterized protein DDB_G0289917	7.685E+00	0.014	16	1	361	377	77	346	968	366	0.958	0.279
LOKIASV2_1161_ESMFold_hypothetical_protein	AF-B5VQF5-F1-model_v4	AF-B5VQF5-F1-model_v4 Restriction of telomere capping protein 4	6.921E+00	0.011	15	1	262	377	1	288	401	318	0.695	0.718
LOKIASV2_1161_ESMFold_hypothetical_protein	AF-O49687-F1-model_v4	AF-O49687-F1-model_v4 Transcription factor MYC4	6.921E+00	0.011	15	1	301	377	285	584	589	339	0.798	0.509
LOKIASV2_1161_ESMFold_hypothetical_protein	AF-Q6BLJ9-F1-model_v4	AF-Q6BLJ9-F1-model_v4 Serine/threonine-protein kinase CBK1	6.568E+00	0.011	15	6	331	377	115	436	716	381	0.865	0.450
LOKIASV2_1161_ESMFold_hypothetical_protein	AF-P98174-F1-model_v4	AF-P98174-F1-model_v4 FYVE, RhoGEF and PH domain-containing protein 1	8.993E+00	0.011	15	6	346	377	267	567	961	362	0.905	0.313
LOKIASV2_1161_ESMFold_hypothetical_protein	AF-Q9H0A9-F1-model_v4	AF-Q9H0A9-F1-model_v4 Speriolin-like protein	8.534E+00	0.010	14	16	345	377	45	333	340	362	0.875	0.850
LOKIASV2_1161_ESMFold_hypothetical_protein	AF-Q148H7-F1-model_v4	AF-Q148H7-F1-model_v4 Keratin, type II cytoskeletal 79	9.477E+00	0.010	14	1	363	377	10	316	535	365	0.963	0.574
LOKIASV2_1161_ESMFold_hypothetical_protein	AF-O60067-F1-model_v4	AF-O60067-F1-model_v4 Endoplasmic reticulum membrane protein 65	9.987E+00	0.010	14	2	323	377	9	364	649	395	0.854	0.549
LOKIASV2_1161_ESMFold_hypothetical_protein	AF-Q4I0J6-F1-model_v4	AF-Q4I0J6-F1-model_v4 Probable kinetochore protein NDC80	9.987E+00	0.010	14	2	376	377	24	366	726	429	0.995	0.472
LOKIASV2_1161_ESMFold_hypothetical_protein	AF-O24600-F1-model_v4	AF-O24600-F1-model_v4 DNA-directed RNA polymerase 3, chloroplastic	6.921E+00	0.010	14	1	356	377	8	376	993	409	0.944	0.372
LOKIASV2_1161_ESMFold_hypothetical_protein	AF-Q8IUD2-F1-model_v4	AF-Q8IUD2-F1-model_v4 ELKS/Rab6-interacting/CAST family member 1	8.534E+00	0.010	14	2	344	377	4	315	1116	363	0.910	0.280
LOKIASV2_1161_ESMFold_hypothetical_protein	AF-Q02724-F1-model_v4	AF-Q02724-F1-model_v4 Ubiquitin-like-specific protease 1	9.987E+00	0.009	13	8	352	377	110	500	621	429	0.915	0.630
LOKIASV2_1161_ESMFold_hypothetical_protein	AF-Q80UU1-F1-model_v4	AF-Q80UU1-F1-model_v4 Ankyrin repeat and zinc finger domain-containing protein 1	9.987E+00	0.009	13	6	319	377	393	698	748	357	0.833	0.409
LOKIASV2_1161_ESMFold_hypothetical_protein	AF-Q55DB7-F1-model_v4	AF-Q55DB7-F1-model_v4 Uncharacterized protein	6.675E-02	0.277	43	1	363	377	516	924	1442	452	0.963	0.284
LOKIASV2_1161_ESMFold_hypothetical_protein	AF-A0A7I4KG90-F1-model_v4	AF-A0A7I4KG90-F1-model_v4 BMA-INSC-1, isoform b	8.674E-02	0.150	36	2	368	377	328	659	863	396	0.973	0.385
LOKIASV2_1161_ESMFold_hypothetical_protein	AF-Q12797-F1-model_v4	AF-Q12797-F1-model_v4 Aspartyl/asparaginyl beta-hydroxylase	4.886E-01	0.126	34	1	345	377	187	539	758	391	0.915	0.466
LOKIASV2_1161_ESMFold_hypothetical_protein	AF-C1GNF1-F1-model_v4	AF-C1GNF1-F1-model_v4 Transport protein SEC7	5.149E-01	0.106	32	1	344	377	63	371	2025	358	0.912	0.153
LOKIASV2_1161_ESMFold_hypothetical_protein	AF-A0A3P7DN31-F1-model_v4	AF-A0A3P7DN31-F1-model_v4 CDT1 domain-containing protein	5.439E+00	0.082	29	1	208	377	63	253	351	211	0.552	0.544
LOKIASV2_1161_ESMFold_hypothetical_protein	AF-A0A158N844-F1-model_v4	AF-A0A158N844-F1-model_v4 Uncharacterized protein	7.051E-01	0.076	28	1	270	377	24	283	301	295	0.716	0.864
LOKIASV2_1161_ESMFold_hypothetical_protein	AF-Q5AAR0-F1-model_v4	AF-Q5AAR0-F1-model_v4 Transcription factor IWS1	1.908E+00	0.069	27	9	263	377	2	288	400	294	0.676	0.717
LOKIASV2_1161_ESMFold_hypothetical_protein	AF-A0A0K0EEY1-F1-model_v4	AF-A0A0K0EEY1-F1-model_v4 Uncharacterized protein	8.251E-01	0.069	27	1	351	377	55	355	494	354	0.931	0.609
LOKIASV2_1161_ESMFold_hypothetical_protein	AF-K7KZL1-F1-model_v4	AF-K7KZL1-F1-model_v4 Uncharacterized protein	4.886E-01	0.069	27	1	340	377	143	526	535	429	0.902	0.718
LOKIASV2_1161_ESMFold_hypothetical_protein	AF-A0A1D6MNE5-F1-model_v4	AF-A0A1D6MNE5-F1-model_v4 Uncharacterized protein	1.810E+00	0.069	27	1	220	377	193	429	602	245	0.584	0.394
LOKIASV2_1161_ESMFold_hypothetical_protein	AF-Q54LR6-F1-model_v4	AF-Q54LR6-F1-model_v4 Probable serine/threonine-protein kinase DDB_G0286481	4.886E-01	0.069	27	1	313	377	49	414	605	377	0.830	0.605
LOKIASV2_1161_ESMFold_hypothetical_protein	AF-A0A175VQZ2-F1-model_v4	AF-A0A175VQZ2-F1-model_v4 Cytokinesis protein sepH	1.017E+00	0.069	27	1	341	377	553	890	1514	376	0.905	0.223
LOKIASV2_1161_ESMFold_hypothetical_protein	AF-A0A1C1D231-F1-model_v4	AF-A0A1C1D231-F1-model_v4 Uncharacterized protein	1.718E+00	0.063	26	1	346	377	82	342	379	358	0.918	0.689
LOKIASV2_1161_ESMFold_hypothetical_protein	AF-Q0E938-F1-model_v4	AF-Q0E938-F1-model_v4 Uncharacterized protein, isoform A	1.547E+00	0.063	26	1	350	377	304	641	798	387	0.928	0.424
LOKIASV2_1161_ESMFold_hypothetical_protein	AF-Q9XTS3-F1-model_v4	AF-Q9XTS3-F1-model_v4 Katanin_con80 domain-containing protein	1.468E+00	0.057	25	1	340	377	6	279	280	356	0.902	0.979
LOKIASV2_1161_ESMFold_hypothetical_protein	AF-Q9H079-F1-model_v4	AF-Q9H079-F1-model_v4 KATNB1-like protein 1	1.547E+00	0.057	25	1	340	377	3	298	304	369	0.902	0.974
LOKIASV2_1161_ESMFold_hypothetical_protein	AF-K7U372-F1-model_v4	AF-K7U372-F1-model_v4 GrpE protein homolog	1.718E+00	0.057	25	1	277	377	11	271	332	292	0.735	0.786
LOKIASV2_1161_ESMFold_hypothetical_protein	AF-Q7Z429-F1-model_v4	AF-Q7Z429-F1-model_v4 Protein lifeguard 1	7.430E-01	0.057	25	1	366	377	7	314	371	386	0.971	0.830
LOKIASV2_1161_ESMFold_hypothetical_protein	AF-K7KGK8-F1-model_v4	AF-K7KGK8-F1-model_v4 Uncharacterized protein	5.439E+00	0.057	25	2	210	377	591	823	912	242	0.554	0.255
LOKIASV2_1161_ESMFold_hypothetical_protein	AF-A0A175VYT8-F1-model_v4	AF-A0A175VYT8-F1-model_v4 Cullin-4B	2.901E+00	0.057	25	180	356	377	644	941	943	299	0.469	0.316
LOKIASV2_1161_ESMFold_hypothetical_protein	AF-Q86DA5-F1-model_v4	AF-Q86DA5-F1-model_v4 NAD(+) hydrolase tir-1	1.191E+00	0.057	25	1	346	377	112	456	981	404	0.918	0.352
LOKIASV2_1161_ESMFold_hypothetical_protein	AF-I1LIL7-F1-model_v4	AF-I1LIL7-F1-model_v4 Uncharacterized protein	1.718E+00	0.057	25	1	340	377	431	748	1158	381	0.902	0.275
LOKIASV2_1161_ESMFold_hypothetical_protein	AF-Q57UM3-F1-model_v4	AF-Q57UM3-F1-model_v4 Uncharacterized protein	1.255E+00	0.057	25	16	362	377	13	310	1452	369	0.920	0.205
LOKIASV2_1161_ESMFold_hypothetical_protein	AF-Q9VT59-F1-model_v4	AF-Q9VT59-F1-model_v4 AT16804p	1.810E+00	0.051	24	1	366	377	14	327	358	390	0.971	0.877
LOKIASV2_1161_ESMFold_hypothetical_protein	AF-I1JUF7-F1-model_v4	AF-I1JUF7-F1-model_v4 ENT domain-containing protein	4.898E+00	0.051	24	1	210	377	191	388	391	215	0.557	0.506
LOKIASV2_1161_ESMFold_hypothetical_protein	AF-Q7XIK0-F1-model_v4	AF-Q7XIK0-F1-model_v4 Peptidylprolyl isomerase	2.753E+00	0.051	24	1	268	377	9	243	465	279	0.711	0.505
LOKIASV2_1161_ESMFold_hypothetical_protein	AF-Q04213-F1-model_v4	AF-Q04213-F1-model_v4 ISWI one complex protein 4	3.057E+00	0.051	24	11	270	377	191	433	475	273	0.690	0.512
LOKIASV2_1161_ESMFold_hypothetical_protein	AF-C1GS10-F1-model_v4	AF-C1GS10-F1-model_v4 C6 finger domain transcription factor nscR	2.232E+00	0.051	24	14	310	377	71	375	670	339	0.788	0.455
LOKIASV2_1161_ESMFold_hypothetical_protein	AF-C0NH66-F1-model_v4	AF-C0NH66-F1-model_v4 Iron-sulfur clusters transporter atm1	1.468E+00	0.051	24	6	343	377	2	333	724	373	0.897	0.459
LOKIASV2_1161_ESMFold_hypothetical_protein	AF-I1L672-F1-model_v4	AF-I1L672-F1-model_v4 Leucine zipper-EF-hand-containing transmembrane protein 1	7.430E-01	0.051	24	11	370	377	22	376	755	400	0.955	0.470
LOKIASV2_1161_ESMFold_hypothetical_protein	AF-I1K2A6-F1-model_v4	AF-I1K2A6-F1-model_v4 Uncharacterized protein	1.718E+00	0.051	24	1	342	377	161	491	1050	374	0.907	0.315
LOKIASV2_1161_ESMFold_hypothetical_protein	AF-A0A1C1CAQ3-F1-model_v4	AF-A0A1C1CAQ3-F1-model_v4 Uncharacterized protein	7.830E-01	0.045	23	1	339	377	24	372	395	395	0.899	0.884
LOKIASV2_1161_ESMFold_hypothetical_protein	AF-Q6IRJ7-F1-model_v4	AF-Q6IRJ7-F1-model_v4 Annexin	3.769E+00	0.045	23	2	317	377	28	328	463	351	0.838	0.650
LOKIASV2_1161_ESMFold_hypothetical_protein	AF-B3DID5-F1-model_v4	AF-B3DID5-F1-model_v4 Coiled-coil domain-containing 96	6.026E-01	0.045	23	1	366	377	32	349	479	382	0.971	0.664
LOKIASV2_1161_ESMFold_hypothetical_protein	AF-A0A1C1CDW9-F1-model_v4	AF-A0A1C1CDW9-F1-model_v4 Sexual development transcription factor NsdD	4.648E+00	0.045	23	2	272	377	163	460	481	316	0.719	0.620
LOKIASV2_1161_ESMFold_hypothetical_protein	AF-Q6DVA0-F1-model_v4	AF-Q6DVA0-F1-model_v4 LEM domain-containing protein 2	2.232E+00	0.045	23	1	357	377	88	501	511	454	0.947	0.810
LOKIASV2_1161_ESMFold_hypothetical_protein	AF-A0A175WDW0-F1-model_v4	AF-A0A175WDW0-F1-model_v4 Transcription factor ste11	5.162E+00	0.045	23	10	220	377	73	302	579	247	0.560	0.397
LOKIASV2_1161_ESMFold_hypothetical_protein	AF-I1J5A3-F1-model_v4	AF-I1J5A3-F1-model_v4 Uncharacterized protein	3.972E+00	0.045	23	1	220	377	208	421	588	233	0.584	0.364
LOKIASV2_1161_ESMFold_hypothetical_protein	AF-C0NJN4-F1-model_v4	AF-C0NJN4-F1-model_v4 Serine/threonine-protein kinase cot-1	1.191E+00	0.045	23	3	313	377	55	371	649	362	0.825	0.488
LOKIASV2_1161_ESMFold_hypothetical_protein	AF-A0A0P0Y8Q6-F1-model_v4	AF-A0A0P0Y8Q6-F1-model_v4 Os12g0236100 protein	2.612E+00	0.045	23	1	319	377	265	592	906	372	0.846	0.362
