LOKIASV2_3444_ESMFold_hypothetical_protein	AF-Q57760-F1-model_v4	AF-Q57760-F1-model_v4 Uncharacterized protein MJ0312	2.644E-05	1.000	153	30	190	190	32	204	206	181	0.847	0.840
LOKIASV2_3444_ESMFold_hypothetical_protein	AF-P34605-F1-model_v4	AF-P34605-F1-model_v4 Trafficking protein particle complex subunit 3 homolog	1.063E-04	1.000	133	42	189	190	17	170	181	164	0.779	0.851
LOKIASV2_3444_ESMFold_hypothetical_protein	AF-Q58168-F1-model_v4	AF-Q58168-F1-model_v4 Uncharacterized protein MJ0758	4.024E-04	1.000	127	38	189	190	20	159	159	155	0.800	0.881
LOKIASV2_3444_ESMFold_hypothetical_protein	AF-A0A0K0DZ40-F1-model_v4	AF-A0A0K0DZ40-F1-model_v4 Trafficking protein particle complex subunit	2.480E-04	1.000	122	45	189	190	8	160	171	161	0.763	0.895
LOKIASV2_3444_ESMFold_hypothetical_protein	AF-Q8I1Q2-F1-model_v4	AF-Q8I1Q2-F1-model_v4 Trafficking protein particle complex subunit	2.963E-03	0.997	92	38	190	190	22	177	187	174	0.805	0.834
LOKIASV2_3444_ESMFold_hypothetical_protein	AF-I1LMN0-F1-model_v4	AF-I1LMN0-F1-model_v4 Trafficking protein particle complex subunit	5.765E-03	0.997	92	38	187	190	27	183	194	164	0.789	0.809
LOKIASV2_3444_ESMFold_hypothetical_protein	AF-Q7K2Q8-F1-model_v4	AF-Q7K2Q8-F1-model_v4 Trafficking protein particle complex subunit 5	4.526E-03	0.994	87	38	187	190	32	181	194	166	0.789	0.773
LOKIASV2_3444_ESMFold_hypothetical_protein	AF-Q5N9C8-F1-model_v4	AF-Q5N9C8-F1-model_v4 Trafficking protein particle complex subunit	7.343E-03	0.994	87	38	187	190	27	183	194	166	0.789	0.809
LOKIASV2_3444_ESMFold_hypothetical_protein	AF-B4FGI9-F1-model_v4	AF-B4FGI9-F1-model_v4 Trafficking protein particle complex subunit	9.354E-03	0.991	84	38	187	190	27	183	194	168	0.789	0.809
LOKIASV2_3444_ESMFold_hypothetical_protein	AF-A0A077Z489-F1-model_v4	AF-A0A077Z489-F1-model_v4 Trafficking protein particle complex subunit 5	2.318E-02	0.984	80	39	187	190	27	175	188	157	0.784	0.793
LOKIASV2_3444_ESMFold_hypothetical_protein	AF-O75865-F1-model_v4	AF-O75865-F1-model_v4 Trafficking protein particle complex subunit 6A	7.318E-02	0.978	78	42	188	190	4	158	159	160	0.774	0.975
LOKIASV2_3444_ESMFold_hypothetical_protein	AF-K7MPM2-F1-model_v4	AF-K7MPM2-F1-model_v4 Trafficking protein particle complex subunit	1.056E-02	0.978	78	38	187	190	27	183	194	169	0.789	0.809
LOKIASV2_3444_ESMFold_hypothetical_protein	AF-D3ZES2-F1-model_v4	AF-D3ZES2-F1-model_v4 Trafficking protein particle complex 6B	6.103E-02	0.975	77	38	189	190	4	158	158	169	0.800	0.981
LOKIASV2_3444_ESMFold_hypothetical_protein	AF-A0A077YXQ2-F1-model_v4	AF-A0A077YXQ2-F1-model_v4 Trafficking protein particle complex subunit 6B	4.510E-02	0.949	72	42	190	190	9	168	168	176	0.784	0.952
LOKIASV2_3444_ESMFold_hypothetical_protein	AF-Q9NA81-F1-model_v4	AF-Q9NA81-F1-model_v4 Trafficking protein particle complex subunit 5	3.761E-02	0.949	72	38	187	190	21	170	185	161	0.789	0.811
LOKIASV2_3444_ESMFold_hypothetical_protein	AF-K0ETZ4-F1-model_v4	AF-K0ETZ4-F1-model_v4 Uncharacterized protein	1.345E-02	0.941	71	53	187	190	81	210	270	150	0.711	0.481
LOKIASV2_3444_ESMFold_hypothetical_protein	AF-A0A077Z9K9-F1-model_v4	AF-A0A077Z9K9-F1-model_v4 Trafficking protein particle complex subunit	1.612E-02	0.900	67	29	190	190	5	155	163	180	0.853	0.926
LOKIASV2_3444_ESMFold_hypothetical_protein	AF-A0A0H5S0V6-F1-model_v4	AF-A0A0H5S0V6-F1-model_v4 Trafficking protein particle complex subunit 5	9.903E-02	0.837	63	38	187	190	26	175	190	164	0.789	0.789
LOKIASV2_3444_ESMFold_hypothetical_protein	AF-A0A0K0E8K6-F1-model_v4	AF-A0A0K0E8K6-F1-model_v4 Trafficking protein particle complex subunit 5	1.813E-01	0.795	61	43	188	190	25	174	186	157	0.768	0.806
LOKIASV2_3444_ESMFold_hypothetical_protein	AF-A0A0K0EHF7-F1-model_v4	AF-A0A0K0EHF7-F1-model_v4 Uncharacterized protein	5.407E-02	0.632	55	34	187	190	3	189	191	195	0.811	0.979
LOKIASV2_3444_ESMFold_hypothetical_protein	AF-Q6NUY4-F1-model_v4	AF-Q6NUY4-F1-model_v4 Trafficking protein particle complex 6b-like	1.813E-01	0.601	54	36	189	190	9	161	161	179	0.811	0.950
LOKIASV2_3444_ESMFold_hypothetical_protein	AF-A0A0H3H408-F1-model_v4	AF-A0A0H3H408-F1-model_v4 Uncharacterized protein	2.616E-02	0.601	54	3	190	190	17	173	177	194	0.989	0.887
LOKIASV2_3444_ESMFold_hypothetical_protein	AF-A0A158Q5M0-F1-model_v4	AF-A0A158Q5M0-F1-model_v4 Mitochondrial DNA polymerase catalytic subunit	9.868E-01	0.411	48	43	187	190	28	176	1213	155	0.763	0.123
LOKIASV2_3444_ESMFold_hypothetical_protein	AF-P25061-F1-model_v4	AF-P25061-F1-model_v4 Type II secretion system protein M	9.354E-03	0.382	47	29	190	190	30	174	174	175	0.853	0.833
LOKIASV2_3444_ESMFold_hypothetical_protein	AF-Q5FAC9-F1-model_v4	AF-Q5FAC9-F1-model_v4 Pilus assembly protein PilP	1.345E-02	0.382	47	29	187	190	21	178	199	175	0.837	0.794
LOKIASV2_3444_ESMFold_hypothetical_protein	AF-P37461-F1-model_v4	AF-P37461-F1-model_v4 Sensor protein ZraS	2.182E-02	0.382	47	28	190	190	238	465	465	234	0.858	0.490
LOKIASV2_3444_ESMFold_hypothetical_protein	AF-P31769-F1-model_v4	AF-P31769-F1-model_v4 Competence protein B	1.052E-01	0.301	44	3	188	190	14	163	168	193	0.979	0.893
LOKIASV2_3444_ESMFold_hypothetical_protein	AF-Q03337-F1-model_v4	AF-Q03337-F1-model_v4 Trafficking protein particle complex subunit 31	2.310E-01	0.301	44	104	187	190	186	271	283	94	0.442	0.304
LOKIASV2_3444_ESMFold_hypothetical_protein	AF-Q46832-F1-model_v4	AF-Q46832-F1-model_v4 Putative type II secretion system M-type protein YghD	8.774E-02	0.254	42	31	190	190	35	178	178	167	0.842	0.809
LOKIASV2_3444_ESMFold_hypothetical_protein	AF-Q06067-F1-model_v4	AF-Q06067-F1-model_v4 Signal transduction histidine-protein kinase AtoS	5.407E-02	0.254	42	29	189	190	377	600	608	228	0.847	0.368
LOKIASV2_3444_ESMFold_hypothetical_protein	AF-A0A0H3GKS7-F1-model_v4	AF-A0A0H3GKS7-F1-model_v4 Histidine kinase	5.090E-02	0.233	41	28	190	190	233	455	464	228	0.858	0.481
LOKIASV2_3444_ESMFold_hypothetical_protein	AF-Q32AK5-F1-model_v4	AF-Q32AK5-F1-model_v4 Uncharacterized protein	1.512E-01	0.214	40	34	188	190	28	171	179	161	0.816	0.804
LOKIASV2_3444_ESMFold_hypothetical_protein	AF-Q8ZLJ9-F1-model_v4	AF-Q8ZLJ9-F1-model_v4 Putative inner membrane protein	8.774E-02	0.214	40	33	190	190	28	172	179	164	0.832	0.810
LOKIASV2_3444_ESMFold_hypothetical_protein	AF-Q2FUZ0-F1-model_v4	AF-Q2FUZ0-F1-model_v4 Sensor histidine kinase, putative	2.174E-01	0.196	39	10	188	190	36	294	295	265	0.942	0.878
LOKIASV2_3444_ESMFold_hypothetical_protein	AF-Q9HV40-F1-model_v4	AF-Q9HV40-F1-model_v4 SsrA-binding protein	8.774E-02	0.179	38	102	190	190	37	131	159	96	0.468	0.597
LOKIASV2_3444_ESMFold_hypothetical_protein	AF-A0A0H3H1S8-F1-model_v4	AF-A0A0H3H1S8-F1-model_v4 SsrA-binding protein	5.745E-02	0.179	38	100	190	190	37	134	160	99	0.479	0.613
LOKIASV2_3444_ESMFold_hypothetical_protein	AF-Q9HU20-F1-model_v4	AF-Q9HU20-F1-model_v4 C4-dicarboxylate transport sensor protein DctB	2.454E-01	0.179	38	69	190	190	453	599	612	150	0.642	0.240
LOKIASV2_3444_ESMFold_hypothetical_protein	AF-O25051-F1-model_v4	AF-O25051-F1-model_v4 Uncharacterized protein	2.310E-01	0.164	37	27	190	190	19	179	179	182	0.863	0.899
LOKIASV2_3444_ESMFold_hypothetical_protein	AF-P64634-F1-model_v4	AF-P64634-F1-model_v4 DNA utilization protein HofN	2.607E-01	0.164	37	24	188	190	18	171	179	171	0.868	0.860
LOKIASV2_3444_ESMFold_hypothetical_protein	AF-Q99394-F1-model_v4	AF-Q99394-F1-model_v4 Trafficking protein particle complex subunit 33	1.512E-01	0.164	37	30	190	190	31	266	268	246	0.847	0.881
LOKIASV2_3444_ESMFold_hypothetical_protein	AF-Q9I0G8-F1-model_v4	AF-Q9I0G8-F1-model_v4 Uncharacterized protein	2.047E-01	0.138	35	28	188	190	175	323	328	168	0.847	0.454
LOKIASV2_3444_ESMFold_hypothetical_protein	AF-P0A2G1-F1-model_v4	AF-P0A2G1-F1-model_v4 SsrA-binding protein	1.512E-01	0.126	34	100	190	190	37	134	160	99	0.479	0.613
LOKIASV2_3444_ESMFold_hypothetical_protein	AF-P0A832-F1-model_v4	AF-P0A832-F1-model_v4 SsrA-binding protein	1.813E-01	0.126	34	100	190	190	37	134	160	99	0.479	0.613
LOKIASV2_3444_ESMFold_hypothetical_protein	AF-G3XD30-F1-model_v4	AF-G3XD30-F1-model_v4 Type IV pilus inner membrane component PilN	1.707E-01	0.126	34	29	188	190	16	180	198	186	0.842	0.833
LOKIASV2_3444_ESMFold_hypothetical_protein	AF-A0A132Z0I3-F1-model_v4	AF-A0A132Z0I3-F1-model_v4 GHKL domain-containing protein	1.424E-01	0.126	34	43	184	190	36	243	261	214	0.747	0.797
LOKIASV2_3444_ESMFold_hypothetical_protein	AF-K0F218-F1-model_v4	AF-K0F218-F1-model_v4 Histidine kinase	1.927E-01	0.126	34	30	190	190	76	326	453	255	0.847	0.554
LOKIASV2_3444_ESMFold_hypothetical_protein	AF-Q32CW9-F1-model_v4	AF-Q32CW9-F1-model_v4 SsrA-binding protein	2.174E-01	0.116	33	100	190	190	37	134	160	99	0.479	0.613
LOKIASV2_3444_ESMFold_hypothetical_protein	AF-P44967-F1-model_v4	AF-P44967-F1-model_v4 SsrA-binding protein	1.813E-01	0.116	33	100	190	190	36	133	161	99	0.479	0.609
LOKIASV2_3444_ESMFold_hypothetical_protein	AF-A0A0N4UJ13-F1-model_v4	AF-A0A0N4UJ13-F1-model_v4 MTS domain-containing protein	5.055E+00	0.116	33	152	189	190	172	209	209	38	0.200	0.182
LOKIASV2_3444_ESMFold_hypothetical_protein	AF-Q6XFQ3-F1-model_v4	AF-Q6XFQ3-F1-model_v4 Phytochrome	4.494E-01	0.116	33	28	190	190	916	1151	1161	237	0.858	0.203
LOKIASV2_3444_ESMFold_hypothetical_protein	AF-Q389N8-F1-model_v4	AF-Q389N8-F1-model_v4 Uncharacterized protein	1.507E+00	0.106	32	83	188	190	187	277	298	119	0.558	0.305
LOKIASV2_3444_ESMFold_hypothetical_protein	AF-Q9I1P2-F1-model_v4	AF-Q9I1P2-F1-model_v4 HTH-type transcriptional regulator VqsM	9.868E-01	0.106	32	89	165	190	72	138	325	78	0.405	0.206
LOKIASV2_3444_ESMFold_hypothetical_protein	AF-Q9I4N4-F1-model_v4	AF-Q9I4N4-F1-model_v4 Sensor protein kinase FleS	4.774E-01	0.106	32	97	190	190	289	395	402	113	0.495	0.266
LOKIASV2_3444_ESMFold_hypothetical_protein	AF-Q2G023-F1-model_v4	AF-Q2G023-F1-model_v4 SsrA-binding protein	3.982E-01	0.098	31	103	190	190	36	128	154	94	0.463	0.604
LOKIASV2_3444_ESMFold_hypothetical_protein	AF-A0A1D6IYC8-F1-model_v4	AF-A0A1D6IYC8-F1-model_v4 Phytochrome B	9.289E-01	0.098	31	98	190	190	269	378	440	112	0.489	0.250
LOKIASV2_3444_ESMFold_hypothetical_protein	AF-A0A133CTN5-F1-model_v4	AF-A0A133CTN5-F1-model_v4 SsrA-binding protein	5.389E-01	0.090	30	112	190	190	46	127	154	85	0.416	0.532
LOKIASV2_3444_ESMFold_hypothetical_protein	AF-Q9I5P1-F1-model_v4	AF-Q9I5P1-F1-model_v4 Probable type II secretion system protein	8.743E-01	0.082	29	30	188	190	35	188	197	176	0.837	0.782
LOKIASV2_3444_ESMFold_hypothetical_protein	AF-A0A0R0I8J8-F1-model_v4	AF-A0A0R0I8J8-F1-model_v4 Kinesin motor domain-containing protein	2.932E+00	0.082	29	95	185	190	108	176	517	91	0.479	0.133
LOKIASV2_3444_ESMFold_hypothetical_protein	AF-Q8DQ29-F1-model_v4	AF-Q8DQ29-F1-model_v4 SsrA-binding protein	7.292E-01	0.069	27	103	190	190	35	128	155	97	0.463	0.606
LOKIASV2_3444_ESMFold_hypothetical_protein	AF-Q32HJ0-F1-model_v4	AF-Q32HJ0-F1-model_v4 Probable diguanylate cyclase DgcQ	3.982E-01	0.069	27	36	183	190	28	185	564	172	0.779	0.280
LOKIASV2_3444_ESMFold_hypothetical_protein	AF-Q0DWC7-F1-model_v4	AF-Q0DWC7-F1-model_v4 Ethylene receptor 3	7.292E-01	0.069	27	20	189	190	206	390	836	198	0.895	0.221
LOKIASV2_3444_ESMFold_hypothetical_protein	AF-Q0PB59-F1-model_v4	AF-Q0PB59-F1-model_v4 Putative membrane protein	2.302E+00	0.063	26	17	190	190	31	188	189	185	0.916	0.836
LOKIASV2_3444_ESMFold_hypothetical_protein	AF-P76330-F1-model_v4	AF-P76330-F1-model_v4 Probable diguanylate cyclase DgcQ	5.072E-01	0.063	26	36	183	190	28	185	564	172	0.779	0.280
LOKIASV2_3444_ESMFold_hypothetical_protein	AF-Q8ZNT5-F1-model_v4	AF-Q8ZNT5-F1-model_v4 Probable diguanylate cyclase DgcQ	3.528E-01	0.063	26	29	183	190	14	185	570	186	0.816	0.302
LOKIASV2_3444_ESMFold_hypothetical_protein	AF-O32881-F1-model_v4	AF-O32881-F1-model_v4 SsrA-binding protein	1.419E+00	0.057	25	112	190	190	49	130	160	89	0.416	0.512
LOKIASV2_3444_ESMFold_hypothetical_protein	AF-Q6JN51-F1-model_v4	AF-Q6JN51-F1-model_v4 Ethylene receptor	8.743E-01	0.057	25	25	190	190	339	588	634	251	0.874	0.394
LOKIASV2_3444_ESMFold_hypothetical_protein	AF-Q53RH0-F1-model_v4	AF-Q53RH0-F1-model_v4 Probable ethylene response sensor 1	6.082E-01	0.057	25	25	190	190	339	588	636	259	0.874	0.393
LOKIASV2_3444_ESMFold_hypothetical_protein	AF-A0A1C1CBN0-F1-model_v4	AF-A0A1C1CBN0-F1-model_v4 Centromere/kinetochore protein zw10	7.747E-01	0.057	25	29	188	190	119	278	850	183	0.842	0.188
LOKIASV2_3444_ESMFold_hypothetical_protein	AF-P42497-F1-model_v4	AF-P42497-F1-model_v4 Phytochrome D	9.868E-01	0.057	25	28	190	190	921	1156	1164	243	0.858	0.203
LOKIASV2_3444_ESMFold_hypothetical_protein	AF-A0A0R0G5W5-F1-model_v4	AF-A0A0R0G5W5-F1-model_v4 BHLH domain-containing protein	9.289E-01	0.051	24	29	190	190	50	186	196	168	0.853	0.699
LOKIASV2_3444_ESMFold_hypothetical_protein	AF-Q8N6M8-F1-model_v4	AF-Q8N6M8-F1-model_v4 IQ domain-containing protein F1	9.256E+00	0.051	24	2	131	190	84	188	205	132	0.684	0.512
LOKIASV2_3444_ESMFold_hypothetical_protein	AF-A0A1D6GJW9-F1-model_v4	AF-A0A1D6GJW9-F1-model_v4 Ethylene receptor1-14	8.230E-01	0.051	24	25	190	190	339	588	634	252	0.874	0.394
LOKIASV2_3444_ESMFold_hypothetical_protein	AF-A0A0D2ESG9-F1-model_v4	AF-A0A0D2ESG9-F1-model_v4 Unplaced genomic scaffold supercont1.6, whole genome shotgun sequence	6.461E-01	0.051	24	28	187	190	90	278	838	207	0.842	0.226
LOKIASV2_3444_ESMFold_hypothetical_protein	AF-Q8CY70-F1-model_v4	AF-Q8CY70-F1-model_v4 Uncharacterized protein	6.840E+00	0.045	23	1	131	190	1	131	154	144	0.689	0.851
LOKIASV2_3444_ESMFold_hypothetical_protein	AF-K7M9Y0-F1-model_v4	AF-K7M9Y0-F1-model_v4 BHLH domain-containing protein	8.743E-01	0.045	23	29	189	190	52	191	218	174	0.847	0.642
LOKIASV2_3444_ESMFold_hypothetical_protein	AF-P38167-F1-model_v4	AF-P38167-F1-model_v4 Protein ECM21	8.713E+00	0.045	23	83	129	190	180	223	1117	47	0.247	0.039
LOKIASV2_3444_ESMFold_hypothetical_protein	AF-Q54P75-F1-model_v4	AF-Q54P75-F1-model_v4 DNA mismatch repair protein	5.055E+00	0.040	22	73	188	190	406	485	880	118	0.611	0.091
LOKIASV2_3444_ESMFold_hypothetical_protein	AF-Q9I2C9-F1-model_v4	AF-Q9I2C9-F1-model_v4 Histidine kinase	3.968E+00	0.040	22	98	190	190	629	734	881	111	0.489	0.120
LOKIASV2_3444_ESMFold_hypothetical_protein	AF-I1NB93-F1-model_v4	AF-I1NB93-F1-model_v4 Histidine kinase domain-containing protein	2.598E+00	0.034	21	30	190	190	345	589	636	254	0.847	0.385
LOKIASV2_3444_ESMFold_hypothetical_protein	AF-K7N4P0-F1-model_v4	AF-K7N4P0-F1-model_v4 Ethylene receptor	1.701E+00	0.034	21	28	186	190	127	300	762	192	0.837	0.228
LOKIASV2_3444_ESMFold_hypothetical_protein	AF-Q4D0P5-F1-model_v4	AF-Q4D0P5-F1-model_v4 J domain-containing protein	4.758E+00	0.029	20	28	146	190	135	244	325	131	0.626	0.338
LOKIASV2_3444_ESMFold_hypothetical_protein	AF-Q4D4R4-F1-model_v4	AF-Q4D4R4-F1-model_v4 J domain-containing protein	4.758E+00	0.029	20	28	146	190	135	244	325	133	0.626	0.338
LOKIASV2_3444_ESMFold_hypothetical_protein	AF-Q54BH4-F1-model_v4	AF-Q54BH4-F1-model_v4 Uncharacterized protein	8.201E+00	0.029	20	3	176	190	400	530	575	175	0.916	0.228
LOKIASV2_3444_ESMFold_hypothetical_protein	AF-I1JQP1-F1-model_v4	AF-I1JQP1-F1-model_v4 Histidine kinase domain-containing protein	3.309E+00	0.029	20	30	184	190	354	582	636	235	0.816	0.360
LOKIASV2_3444_ESMFold_hypothetical_protein	AF-A0A0G2K6C6-F1-model_v4	AF-A0A0G2K6C6-F1-model_v4 Killer cell lectin-like receptor 5	9.256E+00	0.024	19	25	132	190	45	150	223	116	0.568	0.475
LOKIASV2_3444_ESMFold_hypothetical_protein	AF-A0A1D8PSR5-F1-model_v4	AF-A0A1D8PSR5-F1-model_v4 Uncharacterized protein	8.201E+00	0.024	19	29	129	190	168	254	441	103	0.532	0.197
LOKIASV2_3444_ESMFold_hypothetical_protein	AF-Q6P8Y2-F1-model_v4	AF-Q6P8Y2-F1-model_v4 IQ motif-containing F4	9.256E+00	0.020	18	2	129	190	83	183	204	129	0.674	0.495
LOKIASV2_3444_ESMFold_hypothetical_protein	AF-B0UYS8-F1-model_v4	AF-B0UYS8-F1-model_v4 Kinetochore protein SPC25	8.201E+00	0.020	18	25	128	190	63	163	234	110	0.547	0.432
LOKIASV2_3444_ESMFold_hypothetical_protein	AF-X8FDP2-F1-model_v4	AF-X8FDP2-F1-model_v4 Uncharacterized protein	5.055E+00	0.020	18	29	138	190	12	136	333	126	0.579	0.375
LOKIASV2_3444_ESMFold_hypothetical_protein	AF-Q0JDT0-F1-model_v4	AF-Q0JDT0-F1-model_v4 Os04g0379800 protein	6.840E+00	0.020	18	71	131	190	167	220	408	61	0.321	0.132
LOKIASV2_3444_ESMFold_hypothetical_protein	AF-Q7XX84-F1-model_v4	AF-Q7XX84-F1-model_v4 Ethylene receptor 2	6.060E+00	0.020	18	20	184	190	127	309	763	196	0.868	0.240
LOKIASV2_3444_ESMFold_hypothetical_protein	AF-Q3UA16-F1-model_v4	AF-Q3UA16-F1-model_v4 Kinetochore protein Spc25	8.201E+00	0.016	17	28	128	190	77	159	226	102	0.532	0.367
LOKIASV2_3444_ESMFold_hypothetical_protein	AF-Q54Q96-F1-model_v4	AF-Q54Q96-F1-model_v4 Kinetochore protein SPC25	9.834E+00	0.016	17	28	128	190	170	255	324	102	0.532	0.265
LOKIASV2_3444_ESMFold_hypothetical_protein	AF-A0A1D6GEQ7-F1-model_v4	AF-A0A1D6GEQ7-F1-model_v4 Histidine kinase CKI1	9.256E+00	0.016	17	124	190	190	265	338	735	77	0.353	0.101
LOKIASV2_3444_ESMFold_hypothetical_protein	AF-Q0DKM0-F1-model_v4	AF-Q0DKM0-F1-model_v4 Probable ethylene response sensor 2	3.735E+00	0.014	16	30	186	190	354	582	635	242	0.826	0.361
LOKIASV2_3444_ESMFold_hypothetical_protein	AF-A0A1D6F7B0-F1-model_v4	AF-A0A1D6F7B0-F1-model_v4 Centromere/kinetochore protein zw10-like protein	4.216E+00	0.011	15	74	190	190	120	299	766	187	0.616	0.235
LOKIASV2_3444_ESMFold_hypothetical_protein	AF-A8MTL0-F1-model_v4	AF-A8MTL0-F1-model_v4 IQ domain-containing protein F5	6.840E+00	0.010	14	26	129	190	16	127	148	119	0.547	0.757
LOKIASV2_3444_ESMFold_hypothetical_protein	AF-C1GQE7-F1-model_v4	AF-C1GQE7-F1-model_v4 Uncharacterized protein	7.267E+00	0.010	14	30	190	190	114	284	840	198	0.847	0.204
LOKIASV2_3444_ESMFold_hypothetical_protein	AF-Q9N3Y9-F1-model_v4	AF-Q9N3Y9-F1-model_v4 ANK_REP_REGION domain-containing protein	9.256E+00	0.009	13	95	157	190	293	350	756	66	0.332	0.077
LOKIASV2_3444_ESMFold_hypothetical_protein	AF-A0A0P0WDT1-F1-model_v4	AF-A0A0P0WDT1-F1-model_v4 Os04g0561550 protein	9.256E+00	0.008	12	30	190	190	118	287	314	194	0.847	0.541
