LOKIASV2_4345_ESMFold_MFS_transporter	AF-P39381-F1-model_v4	AF-P39381-F1-model_v4 Uncharacterized protein YjiJ	6.478E-06	1.000	232	6	432	471	2	383	392	442	0.907	0.974
LOKIASV2_4345_ESMFold_MFS_transporter	AF-Q32C86-F1-model_v4	AF-Q32C86-F1-model_v4 Lysophospholipid transporter LplT	1.476E-05	1.000	232	1	432	471	1	390	397	453	0.917	0.982
LOKIASV2_4345_ESMFold_MFS_transporter	AF-Q8GXH4-F1-model_v4	AF-Q8GXH4-F1-model_v4 Major facilitator superfamily protein	9.383E-06	1.000	232	4	437	471	39	440	449	454	0.921	0.895
LOKIASV2_4345_ESMFold_MFS_transporter	AF-A0A0D2GMQ9-F1-model_v4	AF-A0A0D2GMQ9-F1-model_v4 Unplaced genomic scaffold supercont1.4, whole genome shotgun sequence	3.494E-06	1.000	232	1	433	471	74	484	490	467	0.919	0.839
LOKIASV2_4345_ESMFold_MFS_transporter	AF-Q07647-F1-model_v4	AF-Q07647-F1-model_v4 Solute carrier family 2, facilitated glucose transporter member 3	8.293E-06	1.000	232	8	452	471	2	471	493	517	0.945	0.953
LOKIASV2_4345_ESMFold_MFS_transporter	AF-A0A0D2E697-F1-model_v4	AF-A0A0D2E697-F1-model_v4 Unplaced genomic scaffold supercont1.1, whole genome shotgun sequence	1.106E-05	1.000	232	12	432	471	67	445	497	440	0.894	0.763
LOKIASV2_4345_ESMFold_MFS_transporter	AF-A0A0D2DWR6-F1-model_v4	AF-A0A0D2DWR6-F1-model_v4 Unplaced genomic scaffold supercont1.3, whole genome shotgun sequence	7.959E-06	1.000	232	4	446	471	2	471	512	515	0.941	0.918
LOKIASV2_4345_ESMFold_MFS_transporter	AF-Q54QF0-F1-model_v4	AF-Q54QF0-F1-model_v4 Uncharacterized protein	3.218E-06	1.000	232	1	446	471	72	478	535	477	0.947	0.761
LOKIASV2_4345_ESMFold_MFS_transporter	AF-Q9Y7Q9-F1-model_v4	AF-Q9Y7Q9-F1-model_v4 Probable metabolite transporter C2H8.02	1.669E-05	1.000	232	8	433	471	26	544	583	562	0.904	0.890
LOKIASV2_4345_ESMFold_MFS_transporter	AF-A0A1C1CSH9-F1-model_v4	AF-A0A1C1CSH9-F1-model_v4 Major facilitator transporter	2.519E-05	1.000	231	43	430	471	4	380	421	417	0.824	0.895
LOKIASV2_4345_ESMFold_MFS_transporter	AF-Q2FVL1-F1-model_v4	AF-Q2FVL1-F1-model_v4 MFS domain-containing protein	1.669E-05	1.000	231	43	437	471	8	446	452	477	0.839	0.971
LOKIASV2_4345_ESMFold_MFS_transporter	AF-A0A0D2GDU3-F1-model_v4	AF-A0A0D2GDU3-F1-model_v4 Unplaced genomic scaffold supercont1.5, whole genome shotgun sequence	9.004E-06	1.000	231	2	432	471	30	443	458	469	0.915	0.904
LOKIASV2_4345_ESMFold_MFS_transporter	AF-E7F7B3-F1-model_v4	AF-E7F7B3-F1-model_v4 Monocarboxylate transporter 1	1.736E-06	1.000	231	1	469	471	1	441	461	508	0.996	0.957
LOKIASV2_4345_ESMFold_MFS_transporter	AF-A0A0D2G4U3-F1-model_v4	AF-A0A0D2G4U3-F1-model_v4 Unplaced genomic scaffold supercont1.7, whole genome shotgun sequence	1.740E-05	1.000	231	15	470	471	10	504	504	546	0.968	0.982
LOKIASV2_4345_ESMFold_MFS_transporter	AF-A0A1C1CGN1-F1-model_v4	AF-A0A1C1CGN1-F1-model_v4 Putative transporter	5.273E-06	1.000	231	8	471	471	45	492	511	516	0.985	0.877
LOKIASV2_4345_ESMFold_MFS_transporter	AF-Q32EA7-F1-model_v4	AF-Q32EA7-F1-model_v4 Putative nucleoside permease protein	1.304E-05	1.000	230	14	438	471	1	404	425	437	0.902	0.951
LOKIASV2_4345_ESMFold_MFS_transporter	AF-O70451-F1-model_v4	AF-O70451-F1-model_v4 Monocarboxylate transporter 2	7.959E-06	1.000	230	1	469	471	1	453	484	507	0.996	0.936
LOKIASV2_4345_ESMFold_MFS_transporter	AF-Q63344-F1-model_v4	AF-Q63344-F1-model_v4 Monocarboxylate transporter 2	1.019E-05	1.000	230	1	469	471	4	458	489	510	0.996	0.930
LOKIASV2_4345_ESMFold_MFS_transporter	AF-A0A0D2F8P2-F1-model_v4	AF-A0A0D2F8P2-F1-model_v4 Unplaced genomic scaffold supercont1.2, whole genome shotgun sequence	1.062E-05	1.000	230	14	446	471	14	467	510	501	0.919	0.890
LOKIASV2_4345_ESMFold_MFS_transporter	AF-A0A1D6F983-F1-model_v4	AF-A0A1D6F983-F1-model_v4 Biopterin transport-related protein BT1	1.534E-06	1.000	230	1	433	471	66	517	531	483	0.919	0.851
LOKIASV2_4345_ESMFold_MFS_transporter	AF-P60778-F1-model_v4	AF-P60778-F1-model_v4 Protein TsgA	2.418E-05	1.000	229	16	438	471	11	387	393	434	0.898	0.959
LOKIASV2_4345_ESMFold_MFS_transporter	AF-A0A0K0EFA7-F1-model_v4	AF-A0A0K0EFA7-F1-model_v4 MFS domain-containing protein	3.953E-06	1.000	229	4	467	471	3	432	440	505	0.985	0.977
LOKIASV2_4345_ESMFold_MFS_transporter	AF-K0ENE4-F1-model_v4	AF-K0ENE4-F1-model_v4 Drug resistance efflux protein	8.641E-06	1.000	229	14	439	471	1	503	514	525	0.904	0.979
LOKIASV2_4345_ESMFold_MFS_transporter	AF-P9WJY5-F1-model_v4	AF-P9WJY5-F1-model_v4 Uncharacterized MFS-type transporter EfpA	3.218E-06	1.000	229	1	469	471	35	530	530	556	0.996	0.936
LOKIASV2_4345_ESMFold_MFS_transporter	AF-A0A0D2EUF1-F1-model_v4	AF-A0A0D2EUF1-F1-model_v4 Unplaced genomic scaffold supercont1.5, whole genome shotgun sequence	1.472E-06	1.000	229	1	445	471	36	526	533	535	0.945	0.921
LOKIASV2_4345_ESMFold_MFS_transporter	AF-Q9M8M1-F1-model_v4	AF-Q9M8M1-F1-model_v4 Major facilitator superfamily protein	3.794E-06	1.000	229	4	452	471	1	549	561	590	0.953	0.979
LOKIASV2_4345_ESMFold_MFS_transporter	AF-A0A1D6KZF0-F1-model_v4	AF-A0A1D6KZF0-F1-model_v4 Major facilitator superfamily protein	7.034E-06	1.000	229	15	471	471	31	611	634	603	0.970	0.916
LOKIASV2_4345_ESMFold_MFS_transporter	AF-Q2FVG2-F1-model_v4	AF-Q2FVG2-F1-model_v4 MFS domain-containing protein	5.966E-06	1.000	228	25	437	471	2	368	375	431	0.877	0.979
LOKIASV2_4345_ESMFold_MFS_transporter	AF-P0A2G3-F1-model_v4	AF-P0A2G3-F1-model_v4 Citrate-proton symporter	5.726E-06	1.000	228	20	441	471	15	431	434	459	0.896	0.961
LOKIASV2_4345_ESMFold_MFS_transporter	AF-Q710D3-F1-model_v4	AF-Q710D3-F1-model_v4 Protein unc-93 homolog A	5.966E-06	1.000	228	12	463	471	1	457	458	521	0.960	0.998
LOKIASV2_4345_ESMFold_MFS_transporter	AF-Q9HWG1-F1-model_v4	AF-Q9HWG1-F1-model_v4 Probable major facilitator superfamily (MFS) transporter	1.669E-05	1.000	228	4	431	471	1	391	462	443	0.909	0.846
LOKIASV2_4345_ESMFold_MFS_transporter	AF-O16698-F1-model_v4	AF-O16698-F1-model_v4 MFS domain-containing protein	9.383E-06	1.000	228	17	432	471	19	453	474	485	0.883	0.918
LOKIASV2_4345_ESMFold_MFS_transporter	AF-K0F1I2-F1-model_v4	AF-K0F1I2-F1-model_v4 Transporter	9.777E-06	1.000	228	11	433	471	1	388	518	440	0.898	0.749
LOKIASV2_4345_ESMFold_MFS_transporter	AF-A0A1D6J484-F1-model_v4	AF-A0A1D6J484-F1-model_v4 Phosphate transporter protein4	8.641E-06	1.000	228	1	446	471	3	497	524	533	0.947	0.945
LOKIASV2_4345_ESMFold_MFS_transporter	AF-O22780-F1-model_v4	AF-O22780-F1-model_v4 Probable folate-biopterin transporter 9, chloroplastic	1.472E-06	1.000	228	1	471	471	65	525	538	515	1.000	0.857
LOKIASV2_4345_ESMFold_MFS_transporter	AF-F4I5Q2-F1-model_v4	AF-F4I5Q2-F1-model_v4 Probable folate-biopterin transporter 8, chloroplastic	3.794E-06	1.000	228	17	435	471	85	498	542	453	0.890	0.764
LOKIASV2_4345_ESMFold_MFS_transporter	AF-P24326-F1-model_v4	AF-P24326-F1-model_v4 Uncharacterized protein HI_0350	3.649E-05	1.000	227	1	437	471	1	418	425	465	0.928	0.984
LOKIASV2_4345_ESMFold_MFS_transporter	AF-Q5F7X9-F1-model_v4	AF-Q5F7X9-F1-model_v4 Membrane protein	2.137E-05	1.000	227	4	433	471	1	394	460	444	0.913	0.857
LOKIASV2_4345_ESMFold_MFS_transporter	AF-Q94BZ1-F1-model_v4	AF-Q94BZ1-F1-model_v4 Protein ZINC INDUCED FACILITATOR-LIKE 1	3.641E-06	1.000	227	8	431	471	29	470	478	480	0.900	0.925
LOKIASV2_4345_ESMFold_MFS_transporter	AF-Q4DME1-F1-model_v4	AF-Q4DME1-F1-model_v4 MFS domain-containing protein	1.740E-05	1.000	227	12	471	471	27	495	506	509	0.977	0.927
LOKIASV2_4345_ESMFold_MFS_transporter	AF-A0A175VNG1-F1-model_v4	AF-A0A175VNG1-F1-model_v4 Uncharacterized transporter YgaY	1.359E-05	1.000	227	12	425	471	89	468	523	432	0.879	0.727
LOKIASV2_4345_ESMFold_MFS_transporter	AF-K7KJL2-F1-model_v4	AF-K7KJL2-F1-model_v4 Uncharacterized protein	4.473E-06	1.000	227	15	464	471	87	522	540	476	0.955	0.807
LOKIASV2_4345_ESMFold_MFS_transporter	AF-A0A1C1CNS7-F1-model_v4	AF-A0A1C1CNS7-F1-model_v4 Phthalate transporter	1.968E-05	1.000	227	14	431	471	58	524	553	507	0.887	0.844
LOKIASV2_4345_ESMFold_MFS_transporter	AF-A0A132Z251-F1-model_v4	AF-A0A132Z251-F1-model_v4 MFS transporter	4.671E-05	1.000	226	15	430	471	18	388	400	425	0.883	0.928
LOKIASV2_4345_ESMFold_MFS_transporter	AF-Q4DHB3-F1-model_v4	AF-Q4DHB3-F1-model_v4 MFS domain-containing protein	1.153E-05	1.000	226	12	471	471	27	494	505	515	0.977	0.927
LOKIASV2_4345_ESMFold_MFS_transporter	AF-A0A0D2E4B7-F1-model_v4	AF-A0A0D2E4B7-F1-model_v4 Unplaced genomic scaffold supercont1.1, whole genome shotgun sequence	1.968E-05	1.000	226	2	438	471	89	504	511	476	0.928	0.814
LOKIASV2_4345_ESMFold_MFS_transporter	AF-A0A0D2HED2-F1-model_v4	AF-A0A0D2HED2-F1-model_v4 Unplaced genomic scaffold supercont1.2, whole genome shotgun sequence	7.638E-06	1.000	226	16	427	471	59	466	512	458	0.875	0.797
LOKIASV2_4345_ESMFold_MFS_transporter	AF-A1ZA52-F1-model_v4	AF-A1ZA52-F1-model_v4 FI02132p	7.638E-06	1.000	226	1	446	471	19	496	521	517	0.947	0.917
LOKIASV2_4345_ESMFold_MFS_transporter	AF-A0A1C1CND1-F1-model_v4	AF-A0A1C1CND1-F1-model_v4 Putative HC-toxin efflux carrier TOXA	8.641E-06	1.000	226	3	447	471	41	541	573	542	0.945	0.874
LOKIASV2_4345_ESMFold_MFS_transporter	AF-Q58713-F1-model_v4	AF-Q58713-F1-model_v4 Uncharacterized MFS-type transporter MJ1317	5.507E-05	1.000	225	15	430	471	22	396	398	426	0.883	0.942
LOKIASV2_4345_ESMFold_MFS_transporter	AF-A0A0K0E131-F1-model_v4	AF-A0A0K0E131-F1-model_v4 MFS domain-containing protein	7.959E-06	1.000	225	1	470	471	37	491	495	505	0.998	0.919
LOKIASV2_4345_ESMFold_MFS_transporter	AF-U7PMD3-F1-model_v4	AF-U7PMD3-F1-model_v4 Uncharacterized protein	1.062E-05	1.000	225	16	429	471	38	458	507	454	0.879	0.830
LOKIASV2_4345_ESMFold_MFS_transporter	AF-A0A1D6JSE6-F1-model_v4	AF-A0A1D6JSE6-F1-model_v4 Putative polyol transporter 1	3.353E-06	1.000	225	1	470	471	1	512	524	562	0.998	0.977
LOKIASV2_4345_ESMFold_MFS_transporter	AF-Q4DA01-F1-model_v4	AF-Q4DA01-F1-model_v4 Transporter, putative	8.275E-07	1.000	225	16	467	471	67	523	529	503	0.960	0.864
LOKIASV2_4345_ESMFold_MFS_transporter	AF-A0A5S6PMP0-F1-model_v4	AF-A0A5S6PMP0-F1-model_v4 Major Facilitator Superfamily protein	5.507E-05	1.000	225	2	388	471	150	531	532	408	0.822	0.718
LOKIASV2_4345_ESMFold_MFS_transporter	AF-Q9VS51-F1-model_v4	AF-Q9VS51-F1-model_v4 Cln7, isoform A	3.794E-06	1.000	225	1	446	471	13	486	546	533	0.947	0.868
LOKIASV2_4345_ESMFold_MFS_transporter	AF-A0A133CDU1-F1-model_v4	AF-A0A133CDU1-F1-model_v4 MFS transporter	7.959E-06	1.000	224	7	434	471	2	449	457	489	0.909	0.980
LOKIASV2_4345_ESMFold_MFS_transporter	AF-P11169-F1-model_v4	AF-P11169-F1-model_v4 Solute carrier family 2, facilitated glucose transporter member 3	1.153E-05	1.000	224	8	451	471	2	470	496	513	0.943	0.946
LOKIASV2_4345_ESMFold_MFS_transporter	AF-Q19845-F1-model_v4	AF-Q19845-F1-model_v4 MFS domain-containing protein	7.959E-06	1.000	224	1	461	471	20	493	498	556	0.979	0.952
LOKIASV2_4345_ESMFold_MFS_transporter	AF-Q5F680-F1-model_v4	AF-Q5F680-F1-model_v4 Multidrug resistance protein B	1.019E-05	1.000	224	15	445	471	12	495	507	519	0.915	0.955
LOKIASV2_4345_ESMFold_MFS_transporter	AF-A0A0D2H6T7-F1-model_v4	AF-A0A0D2H6T7-F1-model_v4 Unplaced genomic scaffold supercont1.4, whole genome shotgun sequence	2.222E-06	1.000	224	10	450	471	46	559	601	551	0.936	0.855
LOKIASV2_4345_ESMFold_MFS_transporter	AF-Q5U419-F1-model_v4	AF-Q5U419-F1-model_v4 Major facilitator superfamily domain-containing protein 3	1.416E-05	1.000	223	14	439	471	6	411	412	463	0.904	0.985
LOKIASV2_4345_ESMFold_MFS_transporter	AF-A0A077Z9R8-F1-model_v4	AF-A0A077Z9R8-F1-model_v4 Transporter, major facilitator family	1.889E-05	1.000	223	1	466	471	1	441	442	500	0.989	0.998
LOKIASV2_4345_ESMFold_MFS_transporter	AF-K0EUH3-F1-model_v4	AF-K0EUH3-F1-model_v4 Putative multidrug efflux transporter	6.750E-06	1.000	223	1	449	471	1	486	499	522	0.953	0.974
LOKIASV2_4345_ESMFold_MFS_transporter	AF-A0A286Y8I9-F1-model_v4	AF-A0A286Y8I9-F1-model_v4 Solute carrier family 2 member 3a	4.857E-06	1.000	223	6	446	471	2	466	550	510	0.936	0.845
LOKIASV2_4345_ESMFold_MFS_transporter	AF-Q9HW46-F1-model_v4	AF-Q9HW46-F1-model_v4 Probable major facilitator superfamily (MFS) transporter	6.765E-05	1.000	222	16	437	471	4	382	388	428	0.896	0.977
LOKIASV2_4345_ESMFold_MFS_transporter	AF-Q8ZMA5-F1-model_v4	AF-Q8ZMA5-F1-model_v4 Lysophospholipid transporter LplT	2.418E-05	1.000	222	1	432	471	1	390	400	453	0.917	0.975
LOKIASV2_4345_ESMFold_MFS_transporter	AF-A0A0K0EB44-F1-model_v4	AF-A0A0K0EB44-F1-model_v4 MFS domain-containing protein	1.304E-05	1.000	222	5	455	471	7	415	438	484	0.958	0.934
LOKIASV2_4345_ESMFold_MFS_transporter	AF-U7PNS4-F1-model_v4	AF-U7PNS4-F1-model_v4 MFS domain-containing protein	9.777E-06	1.000	222	8	446	471	2	466	503	511	0.932	0.924
LOKIASV2_4345_ESMFold_MFS_transporter	AF-P9WJW9-F1-model_v4	AF-P9WJW9-F1-model_v4 Drug efflux pump JefA	1.252E-05	1.000	222	12	447	471	1	499	508	531	0.926	0.982
LOKIASV2_4345_ESMFold_MFS_transporter	AF-U7Q7M6-F1-model_v4	AF-U7Q7M6-F1-model_v4 MFS domain-containing protein	2.320E-05	1.000	222	16	428	471	75	478	512	447	0.877	0.789
LOKIASV2_4345_ESMFold_MFS_transporter	AF-Q32E16-F1-model_v4	AF-Q32E16-F1-model_v4 Uncharacterized MFS-type transporter YcaD	2.320E-05	1.000	221	16	425	471	6	368	382	420	0.870	0.950
LOKIASV2_4345_ESMFold_MFS_transporter	AF-A0A0H3GVC9-F1-model_v4	AF-A0A0H3GVC9-F1-model_v4 Transporter, major facilitator family	9.383E-06	1.000	221	18	470	471	4	406	406	486	0.962	0.993
LOKIASV2_4345_ESMFold_MFS_transporter	AF-K0FAR9-F1-model_v4	AF-K0FAR9-F1-model_v4 Enterobactin exporter EntS	5.726E-06	1.000	221	1	447	471	1	405	418	471	0.949	0.969
LOKIASV2_4345_ESMFold_MFS_transporter	AF-A0A0D2GMP1-F1-model_v4	AF-A0A0D2GMP1-F1-model_v4 Unplaced genomic scaffold supercont1.4, whole genome shotgun sequence	1.062E-05	1.000	221	1	471	471	1	499	499	561	1.000	1.000
LOKIASV2_4345_ESMFold_MFS_transporter	AF-Q59X41-F1-model_v4	AF-Q59X41-F1-model_v4 MFS domain-containing protein	1.359E-05	1.000	221	15	433	471	73	481	501	455	0.890	0.816
LOKIASV2_4345_ESMFold_MFS_transporter	AF-A0A0R4IMT8-F1-model_v4	AF-A0A0R4IMT8-F1-model_v4 Solute carrier family 22 member 5	3.353E-06	1.000	221	50	443	471	137	525	549	442	0.837	0.709
LOKIASV2_4345_ESMFold_MFS_transporter	AF-U7PLS2-F1-model_v4	AF-U7PLS2-F1-model_v4 MFS domain-containing protein	1.106E-05	1.000	221	1	471	471	52	585	615	588	1.000	0.868
LOKIASV2_4345_ESMFold_MFS_transporter	AF-P76417-F1-model_v4	AF-P76417-F1-model_v4 Putative nucleoside transporter YegT	3.962E-05	1.000	220	14	437	471	1	403	425	434	0.900	0.948
LOKIASV2_4345_ESMFold_MFS_transporter	AF-C1H2P6-F1-model_v4	AF-C1H2P6-F1-model_v4 Riboflavin transporter MCH5	7.959E-06	1.000	220	2	438	471	76	479	486	462	0.928	0.831
LOKIASV2_4345_ESMFold_MFS_transporter	AF-A0A1C1CUD0-F1-model_v4	AF-A0A1C1CUD0-F1-model_v4 Putative transporter YgaY	2.051E-05	1.000	220	11	440	471	66	454	493	449	0.913	0.789
LOKIASV2_4345_ESMFold_MFS_transporter	AF-P9WG91-F1-model_v4	AF-P9WG91-F1-model_v4 Multidrug resistance protein Stp	7.330E-06	1.000	220	12	432	471	1	490	537	516	0.894	0.912
LOKIASV2_4345_ESMFold_MFS_transporter	AF-A0A0A2V5J1-F1-model_v4	AF-A0A0A2V5J1-F1-model_v4 MFS domain-containing protein	1.201E-05	1.000	220	6	436	471	68	562	571	525	0.915	0.867
LOKIASV2_4345_ESMFold_MFS_transporter	AF-P75810-F1-model_v4	AF-P75810-F1-model_v4 Inner membrane protein YbjJ	2.227E-05	1.000	219	17	429	471	12	388	402	436	0.877	0.938
LOKIASV2_4345_ESMFold_MFS_transporter	AF-A0A0K0E5Y1-F1-model_v4	AF-A0A0K0E5Y1-F1-model_v4 MFS domain-containing protein	2.519E-05	1.000	219	16	430	471	30	464	474	487	0.881	0.918
LOKIASV2_4345_ESMFold_MFS_transporter	AF-A1L1W9-F1-model_v4	AF-A1L1W9-F1-model_v4 Monocarboxylate transporter 10	2.320E-05	1.000	219	1	471	471	47	490	505	509	1.000	0.879
LOKIASV2_4345_ESMFold_MFS_transporter	AF-K0EI49-F1-model_v4	AF-K0EI49-F1-model_v4 Transporter	6.217E-06	1.000	219	17	450	471	7	481	520	513	0.921	0.913
LOKIASV2_4345_ESMFold_MFS_transporter	AF-A0A0D2H3F0-F1-model_v4	AF-A0A0D2H3F0-F1-model_v4 Unplaced genomic scaffold supercont1.4, whole genome shotgun sequence	1.740E-05	1.000	219	6	446	471	46	514	554	523	0.936	0.847
LOKIASV2_4345_ESMFold_MFS_transporter	AF-A0A1C1CBZ9-F1-model_v4	AF-A0A1C1CBZ9-F1-model_v4 Putative transporter	4.661E-06	1.000	219	7	450	471	83	579	605	548	0.943	0.821
LOKIASV2_4345_ESMFold_MFS_transporter	AF-A0A0H3GXL6-F1-model_v4	AF-A0A0H3GXL6-F1-model_v4 MFS family transporter	2.227E-05	1.000	218	1	432	471	1	385	402	439	0.917	0.958
LOKIASV2_4345_ESMFold_MFS_transporter	AF-Q32FB1-F1-model_v4	AF-Q32FB1-F1-model_v4 Bcr/CflA family efflux transporter	2.519E-05	1.000	218	11	428	471	2	381	403	430	0.887	0.943
LOKIASV2_4345_ESMFold_MFS_transporter	AF-X8F5X6-F1-model_v4	AF-X8F5X6-F1-model_v4 Major Facilitator Superfamily protein	2.227E-05	1.000	218	55	471	471	4	391	449	444	0.885	0.864
LOKIASV2_4345_ESMFold_MFS_transporter	AF-A0A0K3AR66-F1-model_v4	AF-A0A0K3AR66-F1-model_v4 PLugged Excretory Pore	1.062E-05	1.000	218	10	461	471	2	431	456	502	0.960	0.943
LOKIASV2_4345_ESMFold_MFS_transporter	AF-U7Q1H6-F1-model_v4	AF-U7Q1H6-F1-model_v4 MFS domain-containing protein	1.359E-05	1.000	218	11	444	471	19	468	469	498	0.921	0.959
LOKIASV2_4345_ESMFold_MFS_transporter	AF-H9C1D0-F1-model_v4	AF-H9C1D0-F1-model_v4 Inorganic phosphate transporter	1.359E-05	1.000	218	4	459	471	2	510	516	554	0.968	0.986
LOKIASV2_4345_ESMFold_MFS_transporter	AF-Q9XWR7-F1-model_v4	AF-Q9XWR7-F1-model_v4 Uncharacterized protein	5.061E-06	1.000	217	1	431	471	11	456	475	493	0.915	0.939
LOKIASV2_4345_ESMFold_MFS_transporter	AF-B5DFC0-F1-model_v4	AF-B5DFC0-F1-model_v4 Slc16a11 protein	1.740E-05	1.000	217	1	433	471	116	531	575	463	0.919	0.723
LOKIASV2_4345_ESMFold_MFS_transporter	AF-A0A0H3GQM8-F1-model_v4	AF-A0A0H3GQM8-F1-model_v4 Uncharacterized MFS-type transporter KPHS_18090	3.225E-05	1.000	216	13	437	471	4	373	382	439	0.902	0.969
LOKIASV2_4345_ESMFold_MFS_transporter	AF-P39196-F1-model_v4	AF-P39196-F1-model_v4 Lysophospholipid transporter LplT	6.492E-05	1.000	216	1	427	471	1	392	397	447	0.907	0.987
LOKIASV2_4345_ESMFold_MFS_transporter	AF-P9WJX1-F1-model_v4	AF-P9WJX1-F1-model_v4 Uncharacterized MFS-type transporter Rv2456c	1.062E-05	1.000	216	6	446	471	2	411	418	472	0.936	0.981
LOKIASV2_4345_ESMFold_MFS_transporter	AF-A0A0H3GNW7-F1-model_v4	AF-A0A0H3GNW7-F1-model_v4 Energy-dependent efflux protein for methyl viologen resistance	8.641E-06	1.000	216	14	446	471	1	489	499	524	0.919	0.980
LOKIASV2_4345_ESMFold_MFS_transporter	AF-Q9I247-F1-model_v4	AF-Q9I247-F1-model_v4 Probable major facilitator superfamily (MFS) transporter	4.302E-05	1.000	215	21	460	471	2	386	387	459	0.934	0.995
LOKIASV2_4345_ESMFold_MFS_transporter	AF-A0A3Q0KMB4-F1-model_v4	AF-A0A3Q0KMB4-F1-model_v4 Putative oxalate:formate antiporter	1.669E-05	1.000	215	14	445	471	8	467	488	512	0.917	0.943
LOKIASV2_4345_ESMFold_MFS_transporter	AF-X8EXZ3-F1-model_v4	AF-X8EXZ3-F1-model_v4 Putative membrane protein	2.320E-05	1.000	214	17	427	471	17	401	403	434	0.873	0.955
LOKIASV2_4345_ESMFold_MFS_transporter	AF-A0A0N4UL80-F1-model_v4	AF-A0A0N4UL80-F1-model_v4 Uncharacterized protein	7.049E-05	1.000	214	11	432	471	28	409	416	438	0.896	0.918
LOKIASV2_4345_ESMFold_MFS_transporter	AF-O53668-F1-model_v4	AF-O53668-F1-model_v4 Probable conserved integral membrane protein	2.625E-05	1.000	214	16	433	471	19	413	436	441	0.887	0.906
LOKIASV2_4345_ESMFold_MFS_transporter	AF-A0A1D6NMM6-F1-model_v4	AF-A0A1D6NMM6-F1-model_v4 High affinity nitrate transporter 2.7	1.669E-05	1.000	214	15	427	471	53	444	485	442	0.877	0.808
LOKIASV2_4345_ESMFold_MFS_transporter	AF-Q384T5-F1-model_v4	AF-Q384T5-F1-model_v4 MFS domain-containing protein	5.495E-06	1.000	214	1	471	471	9	500	512	545	1.000	0.961
LOKIASV2_4345_ESMFold_MFS_transporter	AF-A0A3P7EBF6-F1-model_v4	AF-A0A3P7EBF6-F1-model_v4 MFS domain-containing protein	1.062E-05	1.000	214	1	433	471	2	469	517	527	0.919	0.905
LOKIASV2_4345_ESMFold_MFS_transporter	AF-A0A7I4KHP8-F1-model_v4	AF-A0A7I4KHP8-F1-model_v4 MFS domain-containing protein	1.252E-05	1.000	214	16	433	471	37	487	531	513	0.887	0.849
LOKIASV2_4345_ESMFold_MFS_transporter	AF-U7PVY3-F1-model_v4	AF-U7PVY3-F1-model_v4 MFS domain-containing protein	3.794E-06	1.000	214	1	446	471	73	570	656	550	0.947	0.759
LOKIASV2_4345_ESMFold_MFS_transporter	AF-P9WJY7-F1-model_v4	AF-P9WJY7-F1-model_v4 Probable nitrate/nitrite transporter NarK2	2.970E-05	1.000	213	16	433	471	10	385	395	426	0.887	0.952
LOKIASV2_4345_ESMFold_MFS_transporter	AF-P37758-F1-model_v4	AF-P37758-F1-model_v4 Nitrate/nitrite transporter NarU	1.476E-05	1.000	213	15	438	471	33	459	462	474	0.900	0.924
LOKIASV2_4345_ESMFold_MFS_transporter	AF-Q19932-F1-model_v4	AF-Q19932-F1-model_v4 Uncharacterized protein	8.293E-06	1.000	213	10	470	471	2	439	470	509	0.979	0.932
LOKIASV2_4345_ESMFold_MFS_transporter	AF-A0A0R0FEL0-F1-model_v4	AF-A0A0R0FEL0-F1-model_v4 MFS domain-containing protein	3.962E-05	1.000	213	3	446	471	55	525	529	514	0.943	0.890
LOKIASV2_4345_ESMFold_MFS_transporter	AF-A0A0K0E048-F1-model_v4	AF-A0A0K0E048-F1-model_v4 Uncharacterized protein	3.361E-05	1.000	213	5	430	471	32	514	531	531	0.904	0.910
LOKIASV2_4345_ESMFold_MFS_transporter	AF-K7KYK3-F1-model_v4	AF-K7KYK3-F1-model_v4 Uncharacterized protein	1.019E-05	1.000	213	18	469	471	89	529	542	485	0.960	0.814
LOKIASV2_4345_ESMFold_MFS_transporter	AF-U7PTP6-F1-model_v4	AF-U7PTP6-F1-model_v4 MFS domain-containing protein	1.968E-05	1.000	213	11	446	471	121	630	646	552	0.926	0.789
LOKIASV2_4345_ESMFold_MFS_transporter	AF-Q9I2P7-F1-model_v4	AF-Q9I2P7-F1-model_v4 Probable major facilitator superfamily (MFS) transporter	3.361E-05	1.000	212	15	437	471	9	384	389	438	0.898	0.967
LOKIASV2_4345_ESMFold_MFS_transporter	AF-Q2G0C4-F1-model_v4	AF-Q2G0C4-F1-model_v4 Major facilitator superfamily protein superfamily	1.602E-05	1.000	212	11	431	471	9	392	406	441	0.894	0.946
LOKIASV2_4345_ESMFold_MFS_transporter	AF-A0A0K0EIW2-F1-model_v4	AF-A0A0K0EIW2-F1-model_v4 MFS domain-containing protein	7.638E-06	1.000	212	2	467	471	4	441	444	511	0.989	0.986
LOKIASV2_4345_ESMFold_MFS_transporter	AF-Q54QU6-F1-model_v4	AF-Q54QU6-F1-model_v4 Uncharacterized protein	2.320E-05	1.000	212	1	443	471	61	470	471	465	0.941	0.870
LOKIASV2_4345_ESMFold_MFS_transporter	AF-A0A2K6VJH1-F1-model_v4	AF-A0A2K6VJH1-F1-model_v4 MFS domain-containing protein	1.106E-05	1.000	212	16	470	471	35	515	525	540	0.966	0.916
LOKIASV2_4345_ESMFold_MFS_transporter	AF-C0NKH1-F1-model_v4	AF-C0NKH1-F1-model_v4 MFS domain-containing protein	2.736E-05	1.000	212	1	450	471	31	535	546	551	0.955	0.925
LOKIASV2_4345_ESMFold_MFS_transporter	AF-A4IG77-F1-model_v4	AF-A4IG77-F1-model_v4 Solute carrier family 22 member 7a	1.602E-05	1.000	212	50	433	471	142	514	560	423	0.815	0.666
LOKIASV2_4345_ESMFold_MFS_transporter	AF-A0A0D2DYU5-F1-model_v4	AF-A0A0D2DYU5-F1-model_v4 Unplaced genomic scaffold supercont1.2, whole genome shotgun sequence	1.019E-05	1.000	212	6	446	471	121	616	632	539	0.936	0.785
LOKIASV2_4345_ESMFold_MFS_transporter	AF-Q32AR1-F1-model_v4	AF-Q32AR1-F1-model_v4 Uncharacterized MFS-type transporter YhhS	4.867E-05	1.000	211	56	436	471	40	376	387	387	0.809	0.871
LOKIASV2_4345_ESMFold_MFS_transporter	AF-A0A0H3GMD9-F1-model_v4	AF-A0A0H3GMD9-F1-model_v4 MFS domain-containing protein	6.765E-05	1.000	211	15	433	471	13	391	397	438	0.890	0.955
LOKIASV2_4345_ESMFold_MFS_transporter	AF-A0A0K0E736-F1-model_v4	AF-A0A0K0E736-F1-model_v4 MFS domain-containing protein	1.968E-05	1.000	211	13	455	471	20	457	458	501	0.941	0.956
LOKIASV2_4345_ESMFold_MFS_transporter	AF-Q2RAW4-F1-model_v4	AF-Q2RAW4-F1-model_v4 Major facilitator superfamily antiporter, putative, expressed	1.153E-05	1.000	211	11	438	471	28	469	470	484	0.909	0.940
LOKIASV2_4345_ESMFold_MFS_transporter	AF-A4HXN0-F1-model_v4	AF-A4HXN0-F1-model_v4 Major_facilitator_superfamily_protein_(MFS)_-_put ative	2.051E-05	1.000	211	8	471	471	33	507	538	518	0.985	0.883
LOKIASV2_4345_ESMFold_MFS_transporter	AF-A0A0R4IKJ8-F1-model_v4	AF-A0A0R4IKJ8-F1-model_v4 Solute carrier family 22 member 21	1.889E-05	1.000	211	10	433	471	14	511	546	556	0.900	0.912
LOKIASV2_4345_ESMFold_MFS_transporter	AF-K0EPQ6-F1-model_v4	AF-K0EPQ6-F1-model_v4 Major facilitator superfamily protein	1.304E-05	1.000	210	1	470	471	8	498	503	538	0.998	0.976
LOKIASV2_4345_ESMFold_MFS_transporter	AF-U7PYY1-F1-model_v4	AF-U7PYY1-F1-model_v4 MFS domain-containing protein	1.669E-05	1.000	210	16	448	471	4	500	520	537	0.919	0.956
LOKIASV2_4345_ESMFold_MFS_transporter	AF-A0A1D6GTC9-F1-model_v4	AF-A0A1D6GTC9-F1-model_v4 D-xylose-proton symporter-like 1	8.641E-06	1.000	210	1	444	471	71	540	542	527	0.943	0.867
LOKIASV2_4345_ESMFold_MFS_transporter	AF-I1LQM5-F1-model_v4	AF-I1LQM5-F1-model_v4 MFS domain-containing protein	1.416E-05	1.000	210	1	447	471	83	559	560	532	0.949	0.852
LOKIASV2_4345_ESMFold_MFS_transporter	AF-Q2G2B3-F1-model_v4	AF-Q2G2B3-F1-model_v4 Uncharacterized protein	3.225E-05	1.000	209	14	432	471	7	392	397	433	0.890	0.972
LOKIASV2_4345_ESMFold_MFS_transporter	AF-P24077-F1-model_v4	AF-P24077-F1-model_v4 Enterobactin exporter EntS	4.483E-05	1.000	209	8	433	471	4	399	416	449	0.904	0.952
LOKIASV2_4345_ESMFold_MFS_transporter	AF-A0A0H3GT04-F1-model_v4	AF-A0A0H3GT04-F1-model_v4 Major facilitator superfamily transporter MFS_1	9.403E-05	1.000	209	1	436	471	13	418	418	459	0.926	0.971
LOKIASV2_4345_ESMFold_MFS_transporter	AF-Q19933-F1-model_v4	AF-Q19933-F1-model_v4 Uncharacterized protein	6.217E-06	1.000	209	11	460	471	2	429	457	505	0.955	0.937
LOKIASV2_4345_ESMFold_MFS_transporter	AF-Q5A4J7-F1-model_v4	AF-Q5A4J7-F1-model_v4 MFS domain-containing protein	9.383E-06	1.000	209	14	450	471	163	658	676	545	0.928	0.734
LOKIASV2_4345_ESMFold_MFS_transporter	AF-A0A0H3GZI0-F1-model_v4	AF-A0A0H3GZI0-F1-model_v4 Tetracycline resistance protein	4.302E-05	1.000	208	14	433	471	1	390	391	451	0.892	0.997
LOKIASV2_4345_ESMFold_MFS_transporter	AF-A0A0D2GTW4-F1-model_v4	AF-A0A0D2GTW4-F1-model_v4 Unplaced genomic scaffold supercont1.7, whole genome shotgun sequence	1.201E-05	1.000	208	2	456	471	17	479	481	509	0.966	0.963
LOKIASV2_4345_ESMFold_MFS_transporter	AF-A0A0D2G334-F1-model_v4	AF-A0A0D2G334-F1-model_v4 Unplaced genomic scaffold supercont1.8, whole genome shotgun sequence	1.153E-05	1.000	208	1	467	471	3	503	527	566	0.992	0.951
