LOKIASV2_1437_ESMFold_PadR_family_transcriptional_regulator	AF-K0EVH0-F1-model_v4	AF-K0EVH0-F1-model_v4 Transcriptional regulator	2.289E-08	1.000	339	7	183	186	4	175	185	180	0.952	0.930
LOKIASV2_1437_ESMFold_PadR_family_transcriptional_regulator	AF-K0ER50-F1-model_v4	AF-K0ER50-F1-model_v4 PadR-like family transcriptional regulator	3.553E-08	1.000	317	7	183	186	4	170	173	177	0.952	0.965
LOKIASV2_1437_ESMFold_PadR_family_transcriptional_regulator	AF-K0EIX1-F1-model_v4	AF-K0EIX1-F1-model_v4 PadR family transcriptional regulator	8.057E-09	1.000	299	1	181	186	1	179	217	191	0.973	0.825
LOKIASV2_1437_ESMFold_PadR_family_transcriptional_regulator	AF-A0A132Z1G1-F1-model_v4	AF-A0A132Z1G1-F1-model_v4 PadR family transcriptional regulator	2.418E-08	1.000	295	3	185	186	1	168	171	186	0.984	0.982
LOKIASV2_1437_ESMFold_PadR_family_transcriptional_regulator	AF-A0A132ZAH6-F1-model_v4	AF-A0A132ZAH6-F1-model_v4 PadR family transcriptional regulator	2.541E-09	1.000	293	2	185	186	3	181	183	192	0.989	0.978
LOKIASV2_1437_ESMFold_PadR_family_transcriptional_regulator	AF-X8EX89-F1-model_v4	AF-X8EX89-F1-model_v4 Transcriptional regulator PadR-like family protein	4.451E-07	1.000	277	18	184	186	4	169	177	173	0.898	0.938
LOKIASV2_1437_ESMFold_PadR_family_transcriptional_regulator	AF-K0F776-F1-model_v4	AF-K0F776-F1-model_v4 PadR family transcriptional regulator	2.302E-07	1.000	259	3	184	186	11	175	176	186	0.978	0.938
LOKIASV2_1437_ESMFold_PadR_family_transcriptional_regulator	AF-K0FBL8-F1-model_v4	AF-K0FBL8-F1-model_v4 Putative transcriptional regulator	1.009E-07	1.000	251	3	185	186	1	176	181	187	0.984	0.972
LOKIASV2_1437_ESMFold_PadR_family_transcriptional_regulator	AF-X8FB13-F1-model_v4	AF-X8FB13-F1-model_v4 Transcriptional regulator PadR-like family protein	4.451E-07	1.000	242	3	185	186	1	171	181	186	0.984	0.945
LOKIASV2_1437_ESMFold_PadR_family_transcriptional_regulator	AF-K0F443-F1-model_v4	AF-K0F443-F1-model_v4 PadR-like family transcriptional regulator	2.569E-07	1.000	239	4	183	186	10	180	197	184	0.968	0.868
LOKIASV2_1437_ESMFold_PadR_family_transcriptional_regulator	AF-K0F5R0-F1-model_v4	AF-K0F5R0-F1-model_v4 PadR family transcriptional regulator	5.249E-07	1.000	238	4	185	186	10	184	230	189	0.978	0.761
LOKIASV2_1437_ESMFold_PadR_family_transcriptional_regulator	AF-K0F272-F1-model_v4	AF-K0F272-F1-model_v4 Putative PadR-like family transcriptional regulator	1.015E-06	1.000	225	3	185	186	8	183	209	188	0.984	0.842
LOKIASV2_1437_ESMFold_PadR_family_transcriptional_regulator	AF-O50432-F1-model_v4	AF-O50432-F1-model_v4 Uncharacterized protein	1.329E-07	1.000	217	3	185	186	1	187	189	198	0.984	0.989
LOKIASV2_1437_ESMFold_PadR_family_transcriptional_regulator	AF-K0FDC7-F1-model_v4	AF-K0FDC7-F1-model_v4 PadR family transcriptional regulator	2.584E-06	1.000	204	6	185	186	11	183	190	185	0.968	0.911
LOKIASV2_1437_ESMFold_PadR_family_transcriptional_regulator	AF-K0F2A6-F1-model_v4	AF-K0F2A6-F1-model_v4 Putative transcriptional regulator	2.584E-06	1.000	181	3	179	186	1	176	182	189	0.952	0.967
LOKIASV2_1437_ESMFold_PadR_family_transcriptional_regulator	AF-X8FFX7-F1-model_v4	AF-X8FFX7-F1-model_v4 Transcriptional regulator PadR-like family protein	3.219E-06	1.000	173	16	186	186	6	181	181	186	0.919	0.972
LOKIASV2_1437_ESMFold_PadR_family_transcriptional_regulator	AF-Q2FUS4-F1-model_v4	AF-Q2FUS4-F1-model_v4 PadR domain-containing protein	5.052E-04	1.000	168	7	110	186	13	108	112	108	0.559	0.857
LOKIASV2_1437_ESMFold_PadR_family_transcriptional_regulator	AF-K0ETD0-F1-model_v4	AF-K0ETD0-F1-model_v4 PadR-like family transcriptional regulator	9.248E-04	1.000	160	32	183	186	2	151	187	161	0.817	0.802
LOKIASV2_1437_ESMFold_PadR_family_transcriptional_regulator	AF-A0A132P2W7-F1-model_v4	AF-A0A132P2W7-F1-model_v4 PadR family transcriptional regulator	1.159E-02	1.000	149	6	90	186	11	93	108	86	0.457	0.769
LOKIASV2_1437_ESMFold_PadR_family_transcriptional_regulator	AF-K0EVL8-F1-model_v4	AF-K0EVL8-F1-model_v4 PadR protein	1.084E-04	1.000	146	4	185	186	1	191	201	204	0.978	0.950
LOKIASV2_1437_ESMFold_PadR_family_transcriptional_regulator	AF-Q9CCY3-F1-model_v4	AF-Q9CCY3-F1-model_v4 PadR domain-containing protein	6.259E-05	1.000	145	7	185	186	3	176	180	190	0.962	0.967
LOKIASV2_1437_ESMFold_PadR_family_transcriptional_regulator	AF-K0F9X3-F1-model_v4	AF-K0F9X3-F1-model_v4 Putative transcriptional regulator	6.613E-05	1.000	144	7	185	186	3	171	185	186	0.962	0.914
LOKIASV2_1437_ESMFold_PadR_family_transcriptional_regulator	AF-P71704-F1-model_v4	AF-P71704-F1-model_v4 Conserved protein	4.756E-05	1.000	143	7	186	186	3	173	180	190	0.968	0.950
LOKIASV2_1437_ESMFold_PadR_family_transcriptional_regulator	AF-K0F6H3-F1-model_v4	AF-K0F6H3-F1-model_v4 Putative transcriptional regulator	2.745E-05	1.000	142	3	185	186	1	178	187	195	0.984	0.952
LOKIASV2_1437_ESMFold_PadR_family_transcriptional_regulator	AF-X8FML0-F1-model_v4	AF-X8FML0-F1-model_v4 Transcriptional regulator PadR-like family protein	5.958E-04	1.000	137	7	122	186	3	121	201	125	0.624	0.592
LOKIASV2_1437_ESMFold_PadR_family_transcriptional_regulator	AF-K0EPJ0-F1-model_v4	AF-K0EPJ0-F1-model_v4 ROK family protein	1.097E-02	1.000	129	2	77	186	1	74	388	83	0.409	0.191
LOKIASV2_1437_ESMFold_PadR_family_transcriptional_regulator	AF-Q57807-F1-model_v4	AF-Q57807-F1-model_v4 Uncharacterized HTH-type transcriptional regulator MJ0361	1.702E-02	1.000	123	4	99	186	8	99	107	102	0.516	0.860
LOKIASV2_1437_ESMFold_PadR_family_transcriptional_regulator	AF-Q58910-F1-model_v4	AF-Q58910-F1-model_v4 Uncharacterized protein MJ1515	1.366E-02	1.000	122	2	100	186	256	355	355	103	0.532	0.282
LOKIASV2_1437_ESMFold_PadR_family_transcriptional_regulator	AF-K0EMS2-F1-model_v4	AF-K0EMS2-F1-model_v4 ROK family protein	6.725E-02	1.000	107	5	76	186	12	76	410	74	0.387	0.159
LOKIASV2_1437_ESMFold_PadR_family_transcriptional_regulator	AF-P41411-F1-model_v4	AF-P41411-F1-model_v4 Cell division control protein 18	5.703E-02	0.994	87	2	109	186	475	577	577	113	0.581	0.179
LOKIASV2_1437_ESMFold_PadR_family_transcriptional_regulator	AF-O94689-F1-model_v4	AF-O94689-F1-model_v4 Mitochondrial escape protein 2	1.525E-02	0.991	84	6	185	186	624	767	773	181	0.968	0.186
LOKIASV2_1437_ESMFold_PadR_family_transcriptional_regulator	AF-A0A0G2JW81-F1-model_v4	AF-A0A0G2JW81-F1-model_v4 Membrane-spanning 4-domains subfamily A member 12-like	1.238E+00	0.988	82	101	185	186	26	106	111	85	0.457	0.730
LOKIASV2_1437_ESMFold_PadR_family_transcriptional_regulator	AF-Q9I1X2-F1-model_v4	AF-Q9I1X2-F1-model_v4 Uncharacterized protein	2.807E-01	0.986	81	1	100	186	1	93	95	106	0.538	0.979
LOKIASV2_1437_ESMFold_PadR_family_transcriptional_regulator	AF-Q9HTM5-F1-model_v4	AF-Q9HTM5-F1-model_v4 Uncharacterized protein	1.534E-01	0.986	81	62	185	186	61	188	205	134	0.667	0.624
LOKIASV2_1437_ESMFold_PadR_family_transcriptional_regulator	AF-F1Q6L3-F1-model_v4	AF-F1Q6L3-F1-model_v4 Forkhead box N2b	2.253E-01	0.986	81	1	101	186	121	223	388	104	0.543	0.265
LOKIASV2_1437_ESMFold_PadR_family_transcriptional_regulator	AF-Q9D9Y7-F1-model_v4	AF-Q9D9Y7-F1-model_v4 Membrane-spanning 4-domains, subfamily A, member 19	1.382E+00	0.975	77	101	185	186	26	106	111	85	0.457	0.730
LOKIASV2_1437_ESMFold_PadR_family_transcriptional_regulator	AF-C0NYC3-F1-model_v4	AF-C0NYC3-F1-model_v4 Mitochondrial escape protein 2	1.224E-02	0.975	77	3	185	186	679	829	834	187	0.984	0.181
LOKIASV2_1437_ESMFold_PadR_family_transcriptional_regulator	AF-K7DY44-F1-model_v4	AF-K7DY44-F1-model_v4 Forkhead box N3	3.695E-01	0.971	76	4	100	186	117	217	441	102	0.522	0.229
LOKIASV2_1437_ESMFold_PadR_family_transcriptional_regulator	AF-Q8C3P7-F1-model_v4	AF-Q8C3P7-F1-model_v4 N6-adenosine-methyltransferase subunit METTL3	2.515E-01	0.961	74	1	99	186	70	172	580	108	0.532	0.178
LOKIASV2_1437_ESMFold_PadR_family_transcriptional_regulator	AF-I1KT43-F1-model_v4	AF-I1KT43-F1-model_v4 Uncharacterized protein	6.059E-01	0.956	73	89	185	186	173	273	300	107	0.522	0.337
LOKIASV2_1437_ESMFold_PadR_family_transcriptional_regulator	AF-E7F234-F1-model_v4	AF-E7F234-F1-model_v4 Fork-head domain-containing protein	4.863E-01	0.956	73	3	100	186	112	210	300	101	0.527	0.330
LOKIASV2_1437_ESMFold_PadR_family_transcriptional_regulator	AF-Q54K38-F1-model_v4	AF-Q54K38-F1-model_v4 Mitochondrial escape protein 2 homolog	9.880E-02	0.956	73	2	184	186	678	827	878	186	0.984	0.171
LOKIASV2_1437_ESMFold_PadR_family_transcriptional_regulator	AF-I1K4K7-F1-model_v4	AF-I1K4K7-F1-model_v4 Uncharacterized protein	7.975E-01	0.949	72	89	185	186	172	271	286	103	0.522	0.350
LOKIASV2_1437_ESMFold_PadR_family_transcriptional_regulator	AF-A0A2K6W851-F1-model_v4	AF-A0A2K6W851-F1-model_v4 Fork-head domain-containing protein	2.515E-01	0.941	71	6	110	186	59	163	297	109	0.565	0.354
LOKIASV2_1437_ESMFold_PadR_family_transcriptional_regulator	AF-F1R777-F1-model_v4	AF-F1R777-F1-model_v4 N6-adenosine-methyltransferase subunit METTL3	2.018E-01	0.941	71	1	100	186	59	164	584	111	0.538	0.182
LOKIASV2_1437_ESMFold_PadR_family_transcriptional_regulator	AF-A0A1C1CV61-F1-model_v4	AF-A0A1C1CV61-F1-model_v4 Mitochondrial escape protein 2	4.836E-02	0.941	71	3	185	186	696	843	849	185	0.984	0.174
LOKIASV2_1437_ESMFold_PadR_family_transcriptional_regulator	AF-U7PWV7-F1-model_v4	AF-U7PWV7-F1-model_v4 Mitochondrial escape protein 2	5.398E-02	0.941	71	8	185	186	941	1089	1095	183	0.957	0.136
LOKIASV2_1437_ESMFold_PadR_family_transcriptional_regulator	AF-Q58187-F1-model_v4	AF-Q58187-F1-model_v4 Transcription factor E	2.133E-01	0.933	70	4	122	186	19	111	173	120	0.640	0.538
LOKIASV2_1437_ESMFold_PadR_family_transcriptional_regulator	AF-A0A0N4U3Y0-F1-model_v4	AF-A0A0N4U3Y0-F1-model_v4 MARVEL domain-containing protein	2.266E+00	0.933	70	113	185	186	99	175	230	77	0.392	0.335
LOKIASV2_1437_ESMFold_PadR_family_transcriptional_regulator	AF-A0A0R0EYP7-F1-model_v4	AF-A0A0R0EYP7-F1-model_v4 NB-ARC domain-containing protein	1.374E-01	0.933	70	5	99	186	142	244	377	108	0.511	0.273
LOKIASV2_1437_ESMFold_PadR_family_transcriptional_regulator	AF-A0A1P8AST1-F1-model_v4	AF-A0A1P8AST1-F1-model_v4 B-block-binding subunit of TFIIIC protein	7.930E-02	0.933	70	5	106	186	506	642	662	137	0.548	0.207
LOKIASV2_1437_ESMFold_PadR_family_transcriptional_regulator	AF-Q499D0-F1-model_v4	AF-Q499D0-F1-model_v4 Forkhead box protein N3	7.145E-01	0.923	69	4	100	186	117	217	457	102	0.522	0.221
LOKIASV2_1437_ESMFold_PadR_family_transcriptional_regulator	AF-A0A3P7Q5J5-F1-model_v4	AF-A0A3P7Q5J5-F1-model_v4 Uncharacterized protein	4.603E-01	0.912	68	1	95	186	175	278	298	106	0.511	0.349
LOKIASV2_1437_ESMFold_PadR_family_transcriptional_regulator	AF-A0A0H3GZC6-F1-model_v4	AF-A0A0H3GZC6-F1-model_v4 Putative ATP-binding component of a transport system	6.059E-01	0.912	68	74	185	186	505	632	634	128	0.602	0.202
LOKIASV2_1437_ESMFold_PadR_family_transcriptional_regulator	AF-A0A0G2JYT8-F1-model_v4	AF-A0A0G2JYT8-F1-model_v4 Forkhead box N3	3.903E-01	0.900	67	4	110	186	117	221	478	113	0.575	0.220
LOKIASV2_1437_ESMFold_PadR_family_transcriptional_regulator	AF-Q75JZ0-F1-model_v4	AF-Q75JZ0-F1-model_v4 GATA zinc finger domain-containing protein 8	1.819E+00	0.900	67	90	182	186	340	430	519	93	0.500	0.175
LOKIASV2_1437_ESMFold_PadR_family_transcriptional_regulator	AF-Q86U44-F1-model_v4	AF-Q86U44-F1-model_v4 N6-adenosine-methyltransferase catalytic subunit	5.735E-01	0.900	67	7	99	186	79	172	580	99	0.500	0.162
LOKIASV2_1437_ESMFold_PadR_family_transcriptional_regulator	AF-Q583J5-F1-model_v4	AF-Q583J5-F1-model_v4 Uncharacterized protein	1.044E-01	0.900	67	17	116	186	43	144	831	106	0.538	0.123
LOKIASV2_1437_ESMFold_PadR_family_transcriptional_regulator	AF-Q9D3R9-F1-model_v4	AF-Q9D3R9-F1-model_v4 Transcription initiation factor TFIID subunit 7-like	1.050E+00	0.887	66	58	186	186	346	471	471	135	0.694	0.268
LOKIASV2_1437_ESMFold_PadR_family_transcriptional_regulator	AF-Q86A83-F1-model_v4	AF-Q86A83-F1-model_v4 Putative ZDHHC-type palmitoyltransferase 2	4.381E+00	0.872	65	117	183	186	307	373	446	67	0.360	0.150
LOKIASV2_1437_ESMFold_PadR_family_transcriptional_regulator	AF-I6Y187-F1-model_v4	AF-I6Y187-F1-model_v4 Possible transcriptional regulatory protein	3.882E-02	0.837	63	1	166	186	7	146	224	180	0.892	0.625
LOKIASV2_1437_ESMFold_PadR_family_transcriptional_regulator	AF-F1LZM0-F1-model_v4	AF-F1LZM0-F1-model_v4 Forkhead box N2	1.308E+00	0.837	63	4	100	186	115	213	428	100	0.522	0.231
LOKIASV2_1437_ESMFold_PadR_family_transcriptional_regulator	AF-Q4V8G6-F1-model_v4	AF-Q4V8G6-F1-model_v4 Methyltransferase-like 3	5.428E-01	0.837	63	6	100	186	78	176	580	104	0.511	0.171
LOKIASV2_1437_ESMFold_PadR_family_transcriptional_regulator	AF-A0A3P7QWN7-F1-model_v4	AF-A0A3P7QWN7-F1-model_v4 Fork-head domain-containing protein	2.380E-01	0.795	61	6	152	186	26	164	263	152	0.790	0.529
LOKIASV2_1437_ESMFold_PadR_family_transcriptional_regulator	AF-Q21194-F1-model_v4	AF-Q21194-F1-model_v4 Guanine nucleotide exchange factor rei-2	5.767E+00	0.795	61	110	185	186	102	177	431	76	0.409	0.176
LOKIASV2_1437_ESMFold_PadR_family_transcriptional_regulator	AF-A0A1C1CZ40-F1-model_v4	AF-A0A1C1CZ40-F1-model_v4 PHD-finger family protein	1.460E+00	0.795	61	85	185	186	4	110	810	108	0.543	0.132
LOKIASV2_1437_ESMFold_PadR_family_transcriptional_regulator	AF-Q4CTC8-F1-model_v4	AF-Q4CTC8-F1-model_v4 Uncharacterized protein	5.428E-01	0.795	61	61	185	186	360	463	818	127	0.672	0.127
LOKIASV2_1437_ESMFold_PadR_family_transcriptional_regulator	AF-A0A1D6FJU4-F1-model_v4	AF-A0A1D6FJU4-F1-model_v4 Tetratricopeptide repeat (TPR)-like superfamily protein	4.890E+00	0.772	60	101	185	186	12	93	204	85	0.457	0.402
LOKIASV2_1437_ESMFold_PadR_family_transcriptional_regulator	AF-E9Q7L6-F1-model_v4	AF-E9Q7L6-F1-model_v4 Forkhead box N2	1.050E+00	0.772	60	4	110	186	115	217	429	110	0.575	0.240
LOKIASV2_1437_ESMFold_PadR_family_transcriptional_regulator	AF-Q5W6R5-F1-model_v4	AF-Q5W6R5-F1-model_v4 Os05g0346100 protein	7.185E+00	0.772	60	115	185	186	411	481	540	71	0.382	0.131
LOKIASV2_1437_ESMFold_PadR_family_transcriptional_regulator	AF-A0A0R0G7X3-F1-model_v4	AF-A0A0R0G7X3-F1-model_v4 NB-ARC domain-containing protein	2.807E-01	0.772	60	2	116	186	311	434	718	130	0.618	0.173
LOKIASV2_1437_ESMFold_PadR_family_transcriptional_regulator	AF-B6TZB6-F1-model_v4	AF-B6TZB6-F1-model_v4 Chlorophyllide a oxygenase	2.144E+00	0.747	59	90	185	186	59	154	542	100	0.516	0.177
LOKIASV2_1437_ESMFold_PadR_family_transcriptional_regulator	AF-A0A0N4U6P3-F1-model_v4	AF-A0A0N4U6P3-F1-model_v4 Uncharacterized protein	2.144E+00	0.720	58	101	183	186	16	91	103	83	0.446	0.738
LOKIASV2_1437_ESMFold_PadR_family_transcriptional_regulator	AF-A0A0N4ULS3-F1-model_v4	AF-A0A0N4ULS3-F1-model_v4 Uncharacterized protein	6.800E+00	0.720	58	110	183	186	89	162	449	74	0.398	0.165
LOKIASV2_1437_ESMFold_PadR_family_transcriptional_regulator	AF-A0A0K0ELF4-F1-model_v4	AF-A0A0K0ELF4-F1-model_v4 Uncharacterized protein	5.767E+00	0.720	58	102	184	186	132	211	473	83	0.446	0.169
LOKIASV2_1437_ESMFold_PadR_family_transcriptional_regulator	AF-A0A0K0ER93-F1-model_v4	AF-A0A0K0ER93-F1-model_v4 Uncharacterized protein	5.458E+00	0.692	57	101	185	186	87	171	175	85	0.457	0.486
LOKIASV2_1437_ESMFold_PadR_family_transcriptional_regulator	AF-G4VMD6-F1-model_v4	AF-G4VMD6-F1-model_v4 Synaptogyrin	4.381E+00	0.692	57	105	185	186	87	177	241	92	0.435	0.378
LOKIASV2_1437_ESMFold_PadR_family_transcriptional_regulator	AF-Q86AD6-F1-model_v4	AF-Q86AD6-F1-model_v4 Origin recognition complex subunit 4	2.030E+00	0.692	57	2	97	186	325	429	440	109	0.516	0.239
LOKIASV2_1437_ESMFold_PadR_family_transcriptional_regulator	AF-M9PJS6-F1-model_v4	AF-M9PJS6-F1-model_v4 Uncharacterized protein, isoform D	6.093E+00	0.692	57	101	184	186	269	355	603	87	0.452	0.144
LOKIASV2_1437_ESMFold_PadR_family_transcriptional_regulator	AF-C1H888-F1-model_v4	AF-C1H888-F1-model_v4 E3 ubiquitin-protein ligase	3.715E+00	0.663	56	92	182	186	656	735	736	91	0.489	0.109
LOKIASV2_1437_ESMFold_PadR_family_transcriptional_regulator	AF-Q9SCJ4-F1-model_v4	AF-Q9SCJ4-F1-model_v4 Kinesin-like protein KIN-8B	5.138E-01	0.663	56	41	185	186	329	489	813	176	0.780	0.198
LOKIASV2_1437_ESMFold_PadR_family_transcriptional_regulator	AF-A0A0D2H4X2-F1-model_v4	AF-A0A0D2H4X2-F1-model_v4 Mitochondrial escape protein 2	7.105E-02	0.663	56	2	181	186	712	863	866	190	0.968	0.176
LOKIASV2_1437_ESMFold_PadR_family_transcriptional_regulator	AF-A0A0R0EY30-F1-model_v4	AF-A0A0R0EY30-F1-model_v4 Uncharacterized protein	6.059E-01	0.632	55	17	99	186	6	95	177	93	0.446	0.508
LOKIASV2_1437_ESMFold_PadR_family_transcriptional_regulator	AF-C1HB55-F1-model_v4	AF-C1HB55-F1-model_v4 Mitochondrial escape protein 2	7.930E-02	0.632	55	3	182	186	672	826	828	191	0.968	0.187
LOKIASV2_1437_ESMFold_PadR_family_transcriptional_regulator	AF-A0A044QJN4-F1-model_v4	AF-A0A044QJN4-F1-model_v4 Uncharacterized protein	4.381E+00	0.632	55	90	185	186	112	215	999	104	0.516	0.104
LOKIASV2_1437_ESMFold_PadR_family_transcriptional_regulator	AF-F4I7J9-F1-model_v4	AF-F4I7J9-F1-model_v4 B-block binding subunit of TFIIIC	9.404E-01	0.632	55	5	96	186	555	670	1844	116	0.495	0.063
LOKIASV2_1437_ESMFold_PadR_family_transcriptional_regulator	AF-A0A2K6VD69-F1-model_v4	AF-A0A2K6VD69-F1-model_v4 Uncharacterized protein	7.185E+00	0.601	54	118	183	186	117	189	236	73	0.355	0.309
LOKIASV2_1437_ESMFold_PadR_family_transcriptional_regulator	AF-A0A0J9XNW7-F1-model_v4	AF-A0A0J9XNW7-F1-model_v4 Bm4790	7.590E+00	0.601	54	101	185	186	102	183	477	85	0.457	0.172
LOKIASV2_1437_ESMFold_PadR_family_transcriptional_regulator	AF-A0A077YYP8-F1-model_v4	AF-A0A077YYP8-F1-model_v4 FCH and SH3 1 domain containing protein	6.800E+00	0.601	54	91	185	186	316	413	561	100	0.511	0.175
LOKIASV2_1437_ESMFold_PadR_family_transcriptional_regulator	AF-Q8ZLL2-F1-model_v4	AF-Q8ZLL2-F1-model_v4 Putative ATPase component of ABC transporter	2.672E+00	0.601	54	79	185	186	520	633	635	115	0.575	0.180
LOKIASV2_1437_ESMFold_PadR_family_transcriptional_regulator	AF-P11346-F1-model_v4	AF-P11346-F1-model_v4 Raf homolog serine/threonine-protein kinase Raf	4.381E+00	0.601	54	90	185	186	2	82	739	96	0.516	0.110
LOKIASV2_1437_ESMFold_PadR_family_transcriptional_regulator	AF-F6P8R2-F1-model_v4	AF-F6P8R2-F1-model_v4 Oxysterol-binding protein	8.425E-01	0.601	54	57	185	186	65	214	760	155	0.694	0.197
LOKIASV2_1437_ESMFold_PadR_family_transcriptional_regulator	AF-Q4CYL3-F1-model_v4	AF-Q4CYL3-F1-model_v4 Uncharacterized protein	3.133E-01	0.601	54	44	185	186	317	463	821	170	0.763	0.179
LOKIASV2_1437_ESMFold_PadR_family_transcriptional_regulator	AF-A0A0J9XY43-F1-model_v4	AF-A0A0J9XY43-F1-model_v4 Bm3802	2.982E+00	0.601	54	90	185	186	85	197	976	113	0.516	0.116
LOKIASV2_1437_ESMFold_PadR_family_transcriptional_regulator	AF-A0A0N4UQQ1-F1-model_v4	AF-A0A0N4UQQ1-F1-model_v4 Uncharacterized protein	7.590E+00	0.569	53	114	181	186	89	163	202	75	0.366	0.371
LOKIASV2_1437_ESMFold_PadR_family_transcriptional_regulator	AF-A7E288-F1-model_v4	AF-A7E288-F1-model_v4 Synaptogyrin	4.890E+00	0.569	53	102	183	186	87	174	233	89	0.441	0.378
LOKIASV2_1437_ESMFold_PadR_family_transcriptional_regulator	AF-O55100-F1-model_v4	AF-O55100-F1-model_v4 Synaptogyrin-1	4.381E+00	0.569	53	102	185	186	86	177	234	94	0.452	0.393
LOKIASV2_1437_ESMFold_PadR_family_transcriptional_regulator	AF-A0A0R0EV89-F1-model_v4	AF-A0A0R0EV89-F1-model_v4 NB-ARC domain-containing protein	7.145E-01	0.569	53	17	101	186	116	200	583	90	0.457	0.146
LOKIASV2_1437_ESMFold_PadR_family_transcriptional_regulator	AF-U7PPR9-F1-model_v4	AF-U7PPR9-F1-model_v4 Uncharacterized protein	1.050E+00	0.537	52	16	100	186	296	377	445	86	0.457	0.184
LOKIASV2_1437_ESMFold_PadR_family_transcriptional_regulator	AF-Q9ULJ1-F1-model_v4	AF-Q9ULJ1-F1-model_v4 Protein BCAP	2.030E+00	0.537	52	60	185	186	1	118	636	126	0.677	0.186
LOKIASV2_1437_ESMFold_PadR_family_transcriptional_regulator	AF-Q4DRF8-F1-model_v4	AF-Q4DRF8-F1-model_v4 Rav1p_C domain-containing protein	7.145E-01	0.537	52	22	183	186	1629	1786	2361	180	0.871	0.067
LOKIASV2_1437_ESMFold_PadR_family_transcriptional_regulator	AF-A0A0P0VHQ8-F1-model_v4	AF-A0A0P0VHQ8-F1-model_v4 Os02g0286850 protein	1.172E+00	0.505	51	2	99	186	239	349	393	114	0.527	0.282
LOKIASV2_1437_ESMFold_PadR_family_transcriptional_regulator	AF-A0A0K0DZ39-F1-model_v4	AF-A0A0K0DZ39-F1-model_v4 Origin recognition complex subunit 4	1.109E+00	0.505	51	2	89	186	287	400	402	116	0.473	0.284
LOKIASV2_1437_ESMFold_PadR_family_transcriptional_regulator	AF-I1MA46-F1-model_v4	AF-I1MA46-F1-model_v4 Rieske domain-containing protein	4.629E+00	0.505	51	89	185	186	56	148	534	97	0.522	0.174
LOKIASV2_1437_ESMFold_PadR_family_transcriptional_regulator	AF-Q15642-F1-model_v4	AF-Q15642-F1-model_v4 Cdc42-interacting protein 4	6.800E+00	0.505	51	91	185	186	380	473	601	100	0.511	0.156
LOKIASV2_1437_ESMFold_PadR_family_transcriptional_regulator	AF-C0NMZ4-F1-model_v4	AF-C0NMZ4-F1-model_v4 E3 ubiquitin-protein ligase	5.767E+00	0.505	51	92	182	186	622	701	702	91	0.489	0.114
LOKIASV2_1437_ESMFold_PadR_family_transcriptional_regulator	AF-K7LTM0-F1-model_v4	AF-K7LTM0-F1-model_v4 Homeobox domain-containing protein	2.529E+00	0.505	51	90	185	186	393	483	760	100	0.516	0.120
LOKIASV2_1437_ESMFold_PadR_family_transcriptional_regulator	AF-K7LQD5-F1-model_v4	AF-K7LQD5-F1-model_v4 Homeobox domain-containing protein	2.823E+00	0.505	51	90	185	186	398	488	768	99	0.516	0.118
LOKIASV2_1437_ESMFold_PadR_family_transcriptional_regulator	AF-A0A5K4F900-F1-model_v4	AF-A0A5K4F900-F1-model_v4 Uncharacterized protein	9.457E+00	0.505	51	99	184	186	1	84	972	86	0.462	0.086
LOKIASV2_1437_ESMFold_PadR_family_transcriptional_regulator	AF-U7PYJ1-F1-model_v4	AF-U7PYJ1-F1-model_v4 Tubulin-specific chaperone A	3.715E+00	0.473	50	79	173	186	33	126	130	95	0.511	0.723
LOKIASV2_1437_ESMFold_PadR_family_transcriptional_regulator	AF-Q5PPF5-F1-model_v4	AF-Q5PPF5-F1-model_v4 Zinc finger CCCH-type with G patch domain-containing protein	1.238E+00	0.473	50	39	185	186	348	500	507	157	0.790	0.302
LOKIASV2_1437_ESMFold_PadR_family_transcriptional_regulator	AF-I1JIE7-F1-model_v4	AF-I1JIE7-F1-model_v4 Methyltransferase	4.124E-01	0.473	50	32	100	186	310	376	595	69	0.371	0.113
LOKIASV2_1437_ESMFold_PadR_family_transcriptional_regulator	AF-I1KUN5-F1-model_v4	AF-I1KUN5-F1-model_v4 DNA helicase	1.620E-01	0.473	50	6	185	186	833	1051	1160	238	0.968	0.189
LOKIASV2_1437_ESMFold_PadR_family_transcriptional_regulator	AF-O14686-F14-model_v4	AF-O14686-F14-model_v4 Histone-lysine N-methyltransferase 2D	9.404E-01	0.473	50	41	185	186	826	990	1400	178	0.780	0.118
LOKIASV2_1437_ESMFold_PadR_family_transcriptional_regulator	AF-A0A3P7FSI0-F1-model_v4	AF-A0A3P7FSI0-F1-model_v4 Uncharacterized protein	1.172E+00	0.442	49	7	185	186	19	147	150	179	0.962	0.860
LOKIASV2_1437_ESMFold_PadR_family_transcriptional_regulator	AF-A0A044VBV0-F1-model_v4	AF-A0A044VBV0-F1-model_v4 Uncharacterized protein	3.903E-01	0.442	49	4	184	186	15	216	228	232	0.973	0.886
LOKIASV2_1437_ESMFold_PadR_family_transcriptional_regulator	AF-K0F2P8-F1-model_v4	AF-K0F2P8-F1-model_v4 Uncharacterized protein	1.721E+00	0.442	49	108	185	186	162	236	314	78	0.419	0.239
LOKIASV2_1437_ESMFold_PadR_family_transcriptional_regulator	AF-A4I5K0-F1-model_v4	AF-A4I5K0-F1-model_v4 Hypothetical_protein_-_conserved	3.517E+00	0.442	49	90	185	186	285	388	391	108	0.516	0.266
LOKIASV2_1437_ESMFold_PadR_family_transcriptional_regulator	AF-P44808-F1-model_v4	AF-P44808-F1-model_v4 Probable ATP-binding protein YheS	1.050E+00	0.442	49	23	186	186	468	638	638	182	0.882	0.268
LOKIASV2_1437_ESMFold_PadR_family_transcriptional_regulator	AF-K0F0E3-F1-model_v4	AF-K0F0E3-F1-model_v4 TrwC domain-containing protein	1.721E+00	0.442	49	39	185	186	1768	1895	1997	153	0.790	0.064
LOKIASV2_1437_ESMFold_PadR_family_transcriptional_regulator	AF-Q92949-F1-model_v4	AF-Q92949-F1-model_v4 Forkhead box protein J1	1.819E+00	0.411	48	6	110	186	126	231	421	113	0.565	0.252
LOKIASV2_1437_ESMFold_PadR_family_transcriptional_regulator	AF-A0A077ZK00-F1-model_v4	AF-A0A077ZK00-F1-model_v4 Oxysterol-binding protein	1.542E+00	0.411	48	49	183	186	35	188	705	159	0.726	0.218
LOKIASV2_1437_ESMFold_PadR_family_transcriptional_regulator	AF-Q550H7-F1-model_v4	AF-Q550H7-F1-model_v4 Uncharacterized protein	4.381E+00	0.411	48	3	82	186	726	810	821	86	0.430	0.104
LOKIASV2_1437_ESMFold_PadR_family_transcriptional_regulator	AF-Q810P8-F1-model_v4	AF-Q810P8-F1-model_v4 Membrane-spanning 4-domains, subfamily A, member 5	8.951E+00	0.382	47	102	185	186	103	190	197	88	0.452	0.447
LOKIASV2_1437_ESMFold_PadR_family_transcriptional_regulator	AF-J9B967-F1-model_v4	AF-J9B967-F1-model_v4 Uncharacterized protein	4.357E-01	0.382	47	22	183	186	66	215	244	178	0.871	0.615
LOKIASV2_1437_ESMFold_PadR_family_transcriptional_regulator	AF-A0A0K0DVP0-F1-model_v4	AF-A0A0K0DVP0-F1-model_v4 Uncharacterized protein	3.715E+00	0.382	47	79	178	186	267	359	365	101	0.538	0.255
LOKIASV2_1437_ESMFold_PadR_family_transcriptional_regulator	AF-A0A175VZP3-F1-model_v4	AF-A0A175VZP3-F1-model_v4 Inhibitor of growth protein 3	2.266E+00	0.382	47	58	185	186	9	142	899	144	0.688	0.149
LOKIASV2_1437_ESMFold_PadR_family_transcriptional_regulator	AF-K7LVE9-F1-model_v4	AF-K7LVE9-F1-model_v4 DNA helicase	2.380E-01	0.382	47	7	185	186	826	1050	1152	238	0.962	0.195
LOKIASV2_1437_ESMFold_PadR_family_transcriptional_regulator	AF-Q07986-F1-model_v4	AF-Q07986-F1-model_v4 Uncharacterized protein YLR036C	5.166E+00	0.353	46	78	183	186	80	178	203	108	0.570	0.488
LOKIASV2_1437_ESMFold_PadR_family_transcriptional_regulator	AF-A0A3Q0KKA0-F1-model_v4	AF-A0A3Q0KKA0-F1-model_v4 Uncharacterized protein	4.890E+00	0.353	46	78	183	186	46	180	219	135	0.570	0.616
LOKIASV2_1437_ESMFold_PadR_family_transcriptional_regulator	AF-Q9VNB1-F1-model_v4	AF-Q9VNB1-F1-model_v4 AT23701p	4.629E+00	0.353	46	91	182	186	40	142	270	108	0.495	0.381
LOKIASV2_1437_ESMFold_PadR_family_transcriptional_regulator	AF-Q4DVV5-F1-model_v4	AF-Q4DVV5-F1-model_v4 Uncharacterized protein	2.030E+00	0.353	46	58	185	186	200	330	333	147	0.688	0.393
LOKIASV2_1437_ESMFold_PadR_family_transcriptional_regulator	AF-Q63247-F1-model_v4	AF-Q63247-F1-model_v4 Forkhead box protein J1	2.266E+00	0.353	46	6	109	186	126	231	421	113	0.559	0.252
