LOKIASV2_0831_ESMFold_MFS_transporter	AF-P9WJX1-F1-model_v4	AF-P9WJX1-F1-model_v4 Uncharacterized MFS-type transporter Rv2456c	2.337E-06	1.000	294	27	475	479	10	414	418	467	0.937	0.969
LOKIASV2_0831_ESMFold_MFS_transporter	AF-C0P753-F1-model_v4	AF-C0P753-F1-model_v4 Sugar transporter ERD6-like 6	6.216E-08	1.000	294	15	462	479	48	490	506	497	0.935	0.875
LOKIASV2_0831_ESMFold_MFS_transporter	AF-A0A175W0Z0-F1-model_v4	AF-A0A175W0Z0-F1-model_v4 Putative MFS-type transporter YusP	3.723E-08	1.000	294	15	459	479	38	509	520	526	0.929	0.908
LOKIASV2_0831_ESMFold_MFS_transporter	AF-Q21381-F1-model_v4	AF-Q21381-F1-model_v4 MFS domain-containing protein	1.875E-07	1.000	294	13	477	479	3	464	524	510	0.971	0.882
LOKIASV2_0831_ESMFold_MFS_transporter	AF-A0A286Y9P8-F1-model_v4	AF-A0A286Y9P8-F1-model_v4 Solute carrier family 2 member 3b	4.191E-08	1.000	294	17	462	479	6	477	552	515	0.931	0.855
LOKIASV2_0831_ESMFold_MFS_transporter	AF-A0A175W325-F1-model_v4	AF-A0A175W325-F1-model_v4 Vacuolar basic amino acid transporter 5	6.726E-08	1.000	294	15	459	479	58	541	605	540	0.929	0.800
LOKIASV2_0831_ESMFold_MFS_transporter	AF-A0A1C1CRE9-F1-model_v4	AF-A0A1C1CRE9-F1-model_v4 Putative MFS-type transporter	3.812E-07	1.000	293	15	473	479	3	484	484	523	0.958	0.996
LOKIASV2_0831_ESMFold_MFS_transporter	AF-U7PRW5-F1-model_v4	AF-U7PRW5-F1-model_v4 MFS domain-containing protein	3.579E-08	1.000	293	25	459	479	39	519	548	525	0.908	0.878
LOKIASV2_0831_ESMFold_MFS_transporter	AF-Q4D4C1-F1-model_v4	AF-Q4D4C1-F1-model_v4 MFS transporter, putative	2.110E-07	1.000	293	31	470	479	88	571	590	525	0.919	0.820
LOKIASV2_0831_ESMFold_MFS_transporter	AF-A0A0D2DW95-F1-model_v4	AF-A0A0D2DW95-F1-model_v4 Unplaced genomic scaffold supercont1.3, whole genome shotgun sequence	2.673E-07	1.000	293	6	463	479	89	564	648	528	0.956	0.735
LOKIASV2_0831_ESMFold_MFS_transporter	AF-Q9C5L6-F1-model_v4	AF-Q9C5L6-F1-model_v4 Major facilitator superfamily protein	2.028E-07	1.000	292	27	472	479	1	445	488	484	0.931	0.912
LOKIASV2_0831_ESMFold_MFS_transporter	AF-A0A0D2GS00-F1-model_v4	AF-A0A0D2GS00-F1-model_v4 Unplaced genomic scaffold supercont1.8, whole genome shotgun sequence	1.802E-07	1.000	292	30	461	479	14	450	506	490	0.902	0.864
LOKIASV2_0831_ESMFold_MFS_transporter	AF-Q9I0E1-F1-model_v4	AF-Q9I0E1-F1-model_v4 Probable major facilitator superfamily (MFS) transporter	1.705E-06	1.000	292	22	457	479	8	398	529	443	0.910	0.739
LOKIASV2_0831_ESMFold_MFS_transporter	AF-A0A1C1CS01-F1-model_v4	AF-A0A1C1CS01-F1-model_v4 Aminotriazole resistance protein	6.118E-07	1.000	292	1	459	479	26	521	535	538	0.958	0.927
LOKIASV2_0831_ESMFold_MFS_transporter	AF-A0A175VZP9-F1-model_v4	AF-A0A175VZP9-F1-model_v4 Hippocampus abundant transcript 1 protein	2.892E-07	1.000	292	10	468	479	44	543	550	539	0.958	0.909
LOKIASV2_0831_ESMFold_MFS_transporter	AF-C1GTI0-F1-model_v4	AF-C1GTI0-F1-model_v4 MFS domain-containing protein	1.601E-07	1.000	292	1	459	479	3	497	587	537	0.958	0.843
LOKIASV2_0831_ESMFold_MFS_transporter	AF-P53283-F1-model_v4	AF-P53283-F1-model_v4 Polyamine transporter 2	2.470E-07	1.000	292	32	476	479	173	607	614	491	0.929	0.708
LOKIASV2_0831_ESMFold_MFS_transporter	AF-A0A044QU88-F1-model_v4	AF-A0A044QU88-F1-model_v4 Uncharacterized protein	4.463E-07	1.000	291	13	471	479	1	429	442	498	0.958	0.971
LOKIASV2_0831_ESMFold_MFS_transporter	AF-A0A0K0DWV4-F1-model_v4	AF-A0A0K0DWV4-F1-model_v4 Uncharacterized protein	1.802E-07	1.000	291	30	470	479	6	446	447	482	0.921	0.987
LOKIASV2_0831_ESMFold_MFS_transporter	AF-A0A175VZ11-F1-model_v4	AF-A0A175VZ11-F1-model_v4 Monocarboxylate transporter 10	4.290E-07	1.000	291	2	473	479	35	456	456	494	0.985	0.925
LOKIASV2_0831_ESMFold_MFS_transporter	AF-Q32C12-F1-model_v4	AF-Q32C12-F1-model_v4 Galactose-proton symport of transport system	5.523E-08	1.000	291	31	455	479	15	433	464	468	0.887	0.903
LOKIASV2_0831_ESMFold_MFS_transporter	AF-Q5Z922-F1-model_v4	AF-Q5Z922-F1-model_v4 Solute carrier family 40 member 1	2.195E-07	1.000	291	9	472	479	8	477	484	530	0.969	0.971
LOKIASV2_0831_ESMFold_MFS_transporter	AF-A0A0D2GSZ1-F1-model_v4	AF-A0A0D2GSZ1-F1-model_v4 Unplaced genomic scaffold supercont1.3, whole genome shotgun sequence	2.781E-07	1.000	291	9	472	479	42	471	488	487	0.969	0.881
LOKIASV2_0831_ESMFold_MFS_transporter	AF-Q9SX48-F1-model_v4	AF-Q9SX48-F1-model_v4 Sugar transport protein 9	1.105E-06	1.000	291	28	459	479	22	472	517	484	0.902	0.872
LOKIASV2_0831_ESMFold_MFS_transporter	AF-A0A0D2GPH0-F1-model_v4	AF-A0A0D2GPH0-F1-model_v4 Unplaced genomic scaffold supercont1.2, whole genome shotgun sequence	1.168E-07	1.000	291	27	462	479	45	538	560	531	0.910	0.882
LOKIASV2_0831_ESMFold_MFS_transporter	AF-U7PQ31-F1-model_v4	AF-U7PQ31-F1-model_v4 MFS domain-containing protein	7.570E-08	1.000	291	23	463	479	143	583	629	495	0.921	0.701
LOKIASV2_0831_ESMFold_MFS_transporter	AF-A0A5K4F2H2-F1-model_v4	AF-A0A5K4F2H2-F1-model_v4 Uncharacterized protein	6.886E-07	1.000	290	30	461	479	3	427	435	478	0.902	0.977
LOKIASV2_0831_ESMFold_MFS_transporter	AF-Q5NC32-F1-model_v4	AF-Q5NC32-F1-model_v4 Monocarboxylate transporter 11	4.569E-06	1.000	290	30	461	479	13	402	447	445	0.902	0.872
LOKIASV2_0831_ESMFold_MFS_transporter	AF-Q6NT16-F1-model_v4	AF-Q6NT16-F1-model_v4 MFS-type transporter SLC18B1	1.400E-06	1.000	290	25	471	479	32	439	456	468	0.933	0.895
LOKIASV2_0831_ESMFold_MFS_transporter	AF-C0NR60-F1-model_v4	AF-C0NR60-F1-model_v4 MFS domain-containing protein	4.290E-07	1.000	290	4	459	479	14	451	493	484	0.952	0.888
LOKIASV2_0831_ESMFold_MFS_transporter	AF-A0A0D2G2E1-F1-model_v4	AF-A0A0D2G2E1-F1-model_v4 Unplaced genomic scaffold supercont1.8, whole genome shotgun sequence	9.591E-08	1.000	290	21	461	479	6	453	518	488	0.921	0.865
LOKIASV2_0831_ESMFold_MFS_transporter	AF-Q07904-F1-model_v4	AF-Q07904-F1-model_v4 Thiamine pathway transporter THI73	4.191E-08	1.000	290	15	472	479	71	499	523	495	0.956	0.820
LOKIASV2_0831_ESMFold_MFS_transporter	AF-A0A0D2H3F0-F1-model_v4	AF-A0A0D2H3F0-F1-model_v4 Unplaced genomic scaffold supercont1.4, whole genome shotgun sequence	5.745E-08	1.000	290	27	474	479	53	518	554	505	0.935	0.841
LOKIASV2_0831_ESMFold_MFS_transporter	AF-A0A0H3GUW0-F1-model_v4	AF-A0A0H3GUW0-F1-model_v4 Permease protein	3.607E-06	1.000	289	33	469	479	2	394	395	454	0.912	0.995
LOKIASV2_0831_ESMFold_MFS_transporter	AF-A0A0H3H0W3-F1-model_v4	AF-A0A0H3H0W3-F1-model_v4 Bcr/CflA family efflux transporter	1.400E-06	1.000	289	25	473	479	5	398	398	454	0.937	0.990
LOKIASV2_0831_ESMFold_MFS_transporter	AF-A0A0K0JB97-F1-model_v4	AF-A0A0K0JB97-F1-model_v4 Bm3661	1.950E-07	1.000	289	30	472	479	5	460	463	500	0.925	0.985
LOKIASV2_0831_ESMFold_MFS_transporter	AF-P0AEP1-F1-model_v4	AF-P0AEP1-F1-model_v4 Galactose-proton symporter	1.539E-07	1.000	289	23	455	479	8	433	464	472	0.904	0.918
LOKIASV2_0831_ESMFold_MFS_transporter	AF-A0A0B4KHM5-F1-model_v4	AF-A0A0B4KHM5-F1-model_v4 Uncharacterized protein, isoform D	5.023E-07	1.000	289	16	459	479	1	489	493	532	0.927	0.992
LOKIASV2_0831_ESMFold_MFS_transporter	AF-A0A0D2H6R3-F1-model_v4	AF-A0A0D2H6R3-F1-model_v4 Unplaced genomic scaffold supercont1.4, whole genome shotgun sequence	1.215E-07	1.000	289	2	460	479	27	496	503	519	0.958	0.934
LOKIASV2_0831_ESMFold_MFS_transporter	AF-A0A0D2HK85-F1-model_v4	AF-A0A0D2HK85-F1-model_v4 Unplaced genomic scaffold supercont1.1, whole genome shotgun sequence	5.225E-07	1.000	289	27	471	479	54	490	503	488	0.929	0.869
LOKIASV2_0831_ESMFold_MFS_transporter	AF-Q54IX9-F1-model_v4	AF-Q54IX9-F1-model_v4 MFS domain-containing protein	3.387E-07	1.000	289	4	478	479	30	486	517	494	0.992	0.884
LOKIASV2_0831_ESMFold_MFS_transporter	AF-A0A0D2HE55-F1-model_v4	AF-A0A0D2HE55-F1-model_v4 Unplaced genomic scaffold supercont1.2, whole genome shotgun sequence	6.118E-07	1.000	289	28	462	479	13	460	518	493	0.908	0.865
LOKIASV2_0831_ESMFold_MFS_transporter	AF-A0A0D2HHC2-F1-model_v4	AF-A0A0D2HHC2-F1-model_v4 Unplaced genomic scaffold supercont1.2, whole genome shotgun sequence	3.130E-07	1.000	289	20	470	479	17	477	532	511	0.942	0.867
LOKIASV2_0831_ESMFold_MFS_transporter	AF-U7PIM2-F1-model_v4	AF-U7PIM2-F1-model_v4 MFS domain-containing protein	5.104E-08	1.000	289	15	457	479	38	486	533	515	0.925	0.842
LOKIASV2_0831_ESMFold_MFS_transporter	AF-A0A1C1CAF3-F1-model_v4	AF-A0A1C1CAF3-F1-model_v4 High-affinity glucose transporter	2.375E-07	1.000	289	8	474	479	28	540	570	562	0.975	0.900
LOKIASV2_0831_ESMFold_MFS_transporter	AF-Q32C86-F1-model_v4	AF-Q32C86-F1-model_v4 Lysophospholipid transporter LplT	1.576E-06	1.000	288	1	460	479	1	396	397	465	0.960	0.997
LOKIASV2_0831_ESMFold_MFS_transporter	AF-B4FQW4-F1-model_v4	AF-B4FQW4-F1-model_v4 UNC93-like protein 3	9.439E-07	1.000	288	22	465	479	22	428	429	462	0.927	0.949
LOKIASV2_0831_ESMFold_MFS_transporter	AF-I1LFJ6-F1-model_v4	AF-I1LFJ6-F1-model_v4 MFS domain-containing protein	3.965E-07	1.000	288	27	477	479	28	480	491	499	0.942	0.923
LOKIASV2_0831_ESMFold_MFS_transporter	AF-A0A175W3D8-F1-model_v4	AF-A0A175W3D8-F1-model_v4 High-affinity nicotinic acid transporter	4.124E-07	1.000	288	17	477	479	48	481	497	487	0.962	0.873
LOKIASV2_0831_ESMFold_MFS_transporter	AF-A0A1D6IHX5-F1-model_v4	AF-A0A1D6IHX5-F1-model_v4 Putative polyol transporter 1	8.062E-07	1.000	288	26	477	479	15	496	513	515	0.944	0.940
LOKIASV2_0831_ESMFold_MFS_transporter	AF-A0A0K0DT84-F1-model_v4	AF-A0A0K0DT84-F1-model_v4 MFS domain-containing protein	1.733E-07	1.000	288	25	461	479	31	488	521	501	0.912	0.879
LOKIASV2_0831_ESMFold_MFS_transporter	AF-A0A175VMU0-F1-model_v4	AF-A0A175VMU0-F1-model_v4 Aminotriazole resistance protein	1.919E-06	1.000	288	9	460	479	28	513	527	530	0.944	0.922
LOKIASV2_0831_ESMFold_MFS_transporter	AF-C1HCI1-F1-model_v4	AF-C1HCI1-F1-model_v4 Hexose transporter 2	1.733E-07	1.000	288	28	475	479	15	497	534	523	0.935	0.904
LOKIASV2_0831_ESMFold_MFS_transporter	AF-K0F334-F1-model_v4	AF-K0F334-F1-model_v4 Major facilitator superfamily protein	7.451E-07	1.000	287	9	463	479	5	422	432	469	0.950	0.968
LOKIASV2_0831_ESMFold_MFS_transporter	AF-A0A0D2F8P2-F1-model_v4	AF-A0A0D2F8P2-F1-model_v4 Unplaced genomic scaffold supercont1.2, whole genome shotgun sequence	4.534E-08	1.000	287	15	462	479	6	452	510	496	0.935	0.876
LOKIASV2_0831_ESMFold_MFS_transporter	AF-Q6ZFM7-F1-model_v4	AF-Q6ZFM7-F1-model_v4 Os07g0582400 protein	5.654E-07	1.000	287	28	461	479	17	469	510	489	0.906	0.888
LOKIASV2_0831_ESMFold_MFS_transporter	AF-A0A3P7PKM2-F1-model_v4	AF-A0A3P7PKM2-F1-model_v4 MFS domain-containing protein	1.079E-07	1.000	287	4	471	479	35	503	535	532	0.977	0.877
LOKIASV2_0831_ESMFold_MFS_transporter	AF-A0A0P0Y4S0-F1-model_v4	AF-A0A0P0Y4S0-F1-model_v4 Os11g0637100 protein	9.591E-08	1.000	287	10	462	479	85	524	541	490	0.946	0.813
LOKIASV2_0831_ESMFold_MFS_transporter	AF-C1GZH5-F1-model_v4	AF-C1GZH5-F1-model_v4 MFS domain-containing protein	3.130E-07	1.000	287	1	472	479	83	544	590	511	0.985	0.783
LOKIASV2_0831_ESMFold_MFS_transporter	AF-A0A0D2GJ46-F1-model_v4	AF-A0A0D2GJ46-F1-model_v4 Unplaced genomic scaffold supercont1.3, whole genome shotgun sequence	4.642E-07	1.000	287	8	463	479	50	531	618	510	0.952	0.780
LOKIASV2_0831_ESMFold_MFS_transporter	AF-A0A175WAS9-F1-model_v4	AF-A0A175WAS9-F1-model_v4 Putative transporter mfs2	4.463E-07	1.000	287	30	475	479	140	574	642	495	0.931	0.678
LOKIASV2_0831_ESMFold_MFS_transporter	AF-Q54LA4-F1-model_v4	AF-Q54LA4-F1-model_v4 MFS domain-containing protein	3.523E-07	1.000	287	25	463	479	479	869	880	454	0.916	0.444
LOKIASV2_0831_ESMFold_MFS_transporter	AF-A0A077Z530-F1-model_v4	AF-A0A077Z530-F1-model_v4 MFS 1 domain containing protein	2.781E-07	1.000	286	10	464	479	2	394	394	473	0.950	0.997
LOKIASV2_0831_ESMFold_MFS_transporter	AF-A0A5K4F0Q2-F1-model_v4	AF-A0A5K4F0Q2-F1-model_v4 Uncharacterized protein	4.290E-07	1.000	286	17	463	479	5	427	464	475	0.933	0.912
LOKIASV2_0831_ESMFold_MFS_transporter	AF-A0A3Q0KMB4-F1-model_v4	AF-A0A3Q0KMB4-F1-model_v4 Putative oxalate:formate antiporter	2.375E-07	1.000	286	16	472	479	1	467	488	512	0.954	0.957
LOKIASV2_0831_ESMFold_MFS_transporter	AF-Q8GXR2-F1-model_v4	AF-Q8GXR2-F1-model_v4 Probable polyol transporter 6	1.105E-06	1.000	286	28	461	479	14	463	493	488	0.906	0.913
LOKIASV2_0831_ESMFold_MFS_transporter	AF-I1JL28-F1-model_v4	AF-I1JL28-F1-model_v4 Solute carrier family 40 protein	5.309E-08	1.000	286	8	478	479	8	491	502	546	0.983	0.964
LOKIASV2_0831_ESMFold_MFS_transporter	AF-A0A0D2GJY6-F1-model_v4	AF-A0A0D2GJY6-F1-model_v4 Unplaced genomic scaffold supercont1.5, whole genome shotgun sequence	3.965E-07	1.000	286	28	462	479	12	458	521	481	0.908	0.858
LOKIASV2_0831_ESMFold_MFS_transporter	AF-U7PKR7-F1-model_v4	AF-U7PKR7-F1-model_v4 MFS domain-containing protein	3.387E-07	1.000	286	9	473	479	127	587	587	510	0.971	0.785
LOKIASV2_0831_ESMFold_MFS_transporter	AF-Q92341-F1-model_v4	AF-Q92341-F1-model_v4 Siderophore iron transporter 3	2.470E-07	1.000	286	1	475	479	45	622	630	614	0.992	0.917
LOKIASV2_0831_ESMFold_MFS_transporter	AF-U7Q692-F1-model_v4	AF-U7Q692-F1-model_v4 MFS domain-containing protein	2.825E-08	1.000	285	9	478	479	23	483	505	521	0.981	0.913
LOKIASV2_0831_ESMFold_MFS_transporter	AF-A4ZYQ5-F1-model_v4	AF-A4ZYQ5-F1-model_v4 Solute carrier family 2, facilitated glucose transporter member 7	2.283E-07	1.000	285	22	477	479	15	492	512	515	0.952	0.934
LOKIASV2_0831_ESMFold_MFS_transporter	AF-A0A1C1CMJ7-F1-model_v4	AF-A0A1C1CMJ7-F1-model_v4 Putative transporter	1.480E-07	1.000	285	19	476	479	60	494	529	492	0.956	0.822
LOKIASV2_0831_ESMFold_MFS_transporter	AF-A0A0D2H1W0-F1-model_v4	AF-A0A0D2H1W0-F1-model_v4 Unplaced genomic scaffold supercont1.1, whole genome shotgun sequence	9.976E-08	1.000	285	1	470	479	25	487	539	521	0.981	0.859
LOKIASV2_0831_ESMFold_MFS_transporter	AF-F1M4E3-F1-model_v4	AF-F1M4E3-F1-model_v4 Major facilitator superfamily domain-containing 12	1.400E-06	1.000	284	28	475	479	17	468	476	498	0.935	0.950
LOKIASV2_0831_ESMFold_MFS_transporter	AF-U7PJU4-F1-model_v4	AF-U7PJU4-F1-model_v4 MFS domain-containing protein	3.965E-07	1.000	284	22	477	479	3	476	494	506	0.952	0.960
LOKIASV2_0831_ESMFold_MFS_transporter	AF-A0A0D2GK09-F1-model_v4	AF-A0A0D2GK09-F1-model_v4 Unplaced genomic scaffold supercont1.3, whole genome shotgun sequence	1.875E-07	1.000	284	28	475	479	9	480	507	522	0.935	0.931
LOKIASV2_0831_ESMFold_MFS_transporter	AF-A0A1C1CC67-F1-model_v4	AF-A0A1C1CC67-F1-model_v4 Putative sugar transporter	9.439E-07	1.000	284	22	462	479	2	460	520	507	0.921	0.883
LOKIASV2_0831_ESMFold_MFS_transporter	AF-A0A1C1CHA4-F1-model_v4	AF-A0A1C1CHA4-F1-model_v4 General alpha-glucoside permease	7.451E-07	1.000	284	17	476	479	26	514	527	524	0.960	0.928
LOKIASV2_0831_ESMFold_MFS_transporter	AF-O94342-F1-model_v4	AF-O94342-F1-model_v4 Probable metabolite transport protein C1271.09	2.283E-07	1.000	284	12	479	479	59	511	543	516	0.977	0.834
LOKIASV2_0831_ESMFold_MFS_transporter	AF-C1H0W2-F1-model_v4	AF-C1H0W2-F1-model_v4 Low-affinity glucose transporter HXT1	3.965E-07	1.000	284	27	476	479	19	494	558	511	0.939	0.853
LOKIASV2_0831_ESMFold_MFS_transporter	AF-A0A0D2DI97-F1-model_v4	AF-A0A0D2DI97-F1-model_v4 Unplaced genomic scaffold supercont1.6, whole genome shotgun sequence	1.315E-07	1.000	284	31	470	479	141	567	576	484	0.919	0.741
LOKIASV2_0831_ESMFold_MFS_transporter	AF-D3Z5L6-F1-model_v4	AF-D3Z5L6-F1-model_v4 MFS-type transporter SLC18B1	1.639E-06	1.000	283	31	472	479	35	442	459	466	0.923	0.889
LOKIASV2_0831_ESMFold_MFS_transporter	AF-A0A0D2H6I6-F1-model_v4	AF-A0A0D2H6I6-F1-model_v4 Unplaced genomic scaffold supercont1.4, whole genome shotgun sequence	3.009E-07	1.000	283	29	477	479	34	438	497	466	0.937	0.815
LOKIASV2_0831_ESMFold_MFS_transporter	AF-P43427-F1-model_v4	AF-P43427-F1-model_v4 Solute carrier family 2, facilitated glucose transporter member 5	4.642E-07	1.000	283	15	472	479	1	491	502	524	0.956	0.978
LOKIASV2_0831_ESMFold_MFS_transporter	AF-C0NTN1-F1-model_v4	AF-C0NTN1-F1-model_v4 MFS domain-containing protein	3.812E-07	1.000	283	8	471	479	33	477	503	505	0.969	0.885
LOKIASV2_0831_ESMFold_MFS_transporter	AF-Q8GW61-F1-model_v4	AF-Q8GW61-F1-model_v4 Sugar transport protein 14	9.819E-07	1.000	283	28	459	479	23	471	504	489	0.902	0.891
LOKIASV2_0831_ESMFold_MFS_transporter	AF-Q5W8I8-F1-model_v4	AF-Q5W8I8-F1-model_v4 Vesicular glutamate transporter 2.1	4.290E-07	1.000	283	19	476	479	71	505	584	503	0.956	0.745
LOKIASV2_0831_ESMFold_MFS_transporter	AF-A0A175VY31-F1-model_v4	AF-A0A175VY31-F1-model_v4 High-affinity glucose transporter	3.387E-07	1.000	282	31	474	479	6	445	471	491	0.927	0.934
LOKIASV2_0831_ESMFold_MFS_transporter	AF-Q23514-F1-model_v4	AF-Q23514-F1-model_v4 MFS domain-containing protein	4.534E-08	1.000	282	4	463	479	10	461	479	520	0.960	0.944
LOKIASV2_0831_ESMFold_MFS_transporter	AF-A0A1D8PPX9-F1-model_v4	AF-A0A1D8PPX9-F1-model_v4 Uncharacterized protein	9.976E-08	1.000	282	17	471	479	27	462	485	488	0.950	0.899
LOKIASV2_0831_ESMFold_MFS_transporter	AF-Q8MRP7-F1-model_v4	AF-Q8MRP7-F1-model_v4 GH07529p	2.283E-07	1.000	282	16	463	479	1	469	497	519	0.935	0.944
LOKIASV2_0831_ESMFold_MFS_transporter	AF-A0A0D2GA41-F1-model_v4	AF-A0A0D2GA41-F1-model_v4 Unplaced genomic scaffold supercont1.7, whole genome shotgun sequence	1.168E-07	1.000	282	29	462	479	2	433	499	489	0.906	0.866
LOKIASV2_0831_ESMFold_MFS_transporter	AF-A0A0D2DAE8-F1-model_v4	AF-A0A0D2DAE8-F1-model_v4 Unplaced genomic scaffold supercont1.8, whole genome shotgun sequence	6.364E-07	1.000	282	27	457	479	18	457	505	478	0.900	0.871
LOKIASV2_0831_ESMFold_MFS_transporter	AF-A0A1D6NJW4-F1-model_v4	AF-A0A1D6NJW4-F1-model_v4 Sugar transport protein 1	1.105E-06	1.000	282	28	461	479	18	470	509	488	0.906	0.890
LOKIASV2_0831_ESMFold_MFS_transporter	AF-A0A1D8PN12-F1-model_v4	AF-A0A1D8PN12-F1-model_v4 Glycerophosphodiester transporter GIT2	5.435E-07	1.000	282	27	472	479	51	484	534	477	0.931	0.813
LOKIASV2_0831_ESMFold_MFS_transporter	AF-C1H832-F1-model_v4	AF-C1H832-F1-model_v4 Sugar transporter STL1	3.387E-07	1.000	282	27	459	479	11	460	551	494	0.904	0.817
LOKIASV2_0831_ESMFold_MFS_transporter	AF-Q9HYE1-F1-model_v4	AF-Q9HYE1-F1-model_v4 MFS domain-containing protein	2.847E-06	1.000	282	22	463	479	27	421	571	450	0.923	0.692
LOKIASV2_0831_ESMFold_MFS_transporter	AF-A0A1C1CF05-F1-model_v4	AF-A0A1C1CF05-F1-model_v4 Siderophore iron transporter mirB	1.601E-07	1.000	282	11	459	479	63	581	606	564	0.937	0.856
LOKIASV2_0831_ESMFold_MFS_transporter	AF-A0A0H3GT04-F1-model_v4	AF-A0A0H3GT04-F1-model_v4 Major facilitator superfamily transporter MFS_1	1.950E-07	1.000	281	9	459	479	14	412	418	460	0.942	0.955
LOKIASV2_0831_ESMFold_MFS_transporter	AF-K0ERD0-F1-model_v4	AF-K0ERD0-F1-model_v4 Major facilitator transporter	1.845E-06	1.000	281	31	465	479	4	451	452	491	0.908	0.991
LOKIASV2_0831_ESMFold_MFS_transporter	AF-Q23063-F1-model_v4	AF-Q23063-F1-model_v4 Uncharacterized protein	4.642E-07	1.000	281	27	462	479	2	425	465	469	0.910	0.912
LOKIASV2_0831_ESMFold_MFS_transporter	AF-A0A0D2DNX5-F1-model_v4	AF-A0A0D2DNX5-F1-model_v4 Unplaced genomic scaffold supercont1.4, whole genome shotgun sequence	2.375E-07	1.000	281	1	475	479	24	474	483	503	0.992	0.934
LOKIASV2_0831_ESMFold_MFS_transporter	AF-Q9FRL3-F1-model_v4	AF-Q9FRL3-F1-model_v4 Sugar transporter ERD6-like 6	2.892E-07	1.000	281	2	462	479	23	471	487	510	0.962	0.922
LOKIASV2_0831_ESMFold_MFS_transporter	AF-Q9C9R9-F1-model_v4	AF-Q9C9R9-F1-model_v4 At1g78130	4.829E-07	1.000	281	21	472	479	5	457	490	499	0.944	0.924
LOKIASV2_0831_ESMFold_MFS_transporter	AF-A0A1C1CPU6-F1-model_v4	AF-A0A1C1CPU6-F1-model_v4 Putative transporter	1.123E-07	1.000	281	10	479	479	53	489	495	498	0.981	0.883
LOKIASV2_0831_ESMFold_MFS_transporter	AF-Q7XUX7-F1-model_v4	AF-Q7XUX7-F1-model_v4 Os04g0453200 protein	3.812E-07	1.000	281	25	461	479	10	469	507	501	0.912	0.907
LOKIASV2_0831_ESMFold_MFS_transporter	AF-A0A0D2G4T6-F1-model_v4	AF-A0A0D2G4T6-F1-model_v4 Unplaced genomic scaffold supercont1.7, whole genome shotgun sequence	2.673E-07	1.000	281	28	461	479	5	455	510	489	0.906	0.884
LOKIASV2_0831_ESMFold_MFS_transporter	AF-A0A1D6IHX8-F1-model_v4	AF-A0A1D6IHX8-F1-model_v4 Putative polyol transporter 1	6.886E-07	1.000	281	25	472	479	16	483	512	515	0.935	0.914
LOKIASV2_0831_ESMFold_MFS_transporter	AF-A0A0D2DU56-F1-model_v4	AF-A0A0D2DU56-F1-model_v4 Unplaced genomic scaffold supercont1.3, whole genome shotgun sequence	6.620E-07	1.000	281	9	465	479	27	503	538	521	0.954	0.887
LOKIASV2_0831_ESMFold_MFS_transporter	AF-A0A0D2GP98-F1-model_v4	AF-A0A0D2GP98-F1-model_v4 Unplaced genomic scaffold supercont1.9, whole genome shotgun sequence	2.470E-07	1.000	281	30	463	479	55	490	571	480	0.906	0.764
LOKIASV2_0831_ESMFold_MFS_transporter	AF-Q9P2U8-F1-model_v4	AF-Q9P2U8-F1-model_v4 Vesicular glutamate transporter 2	3.965E-07	1.000	281	9	476	479	61	505	582	512	0.977	0.765
LOKIASV2_0831_ESMFold_MFS_transporter	AF-C1H6X5-F1-model_v4	AF-C1H6X5-F1-model_v4 Siderophore iron transporter 1	6.996E-08	1.000	281	15	459	479	57	549	583	539	0.929	0.846
LOKIASV2_0831_ESMFold_MFS_transporter	AF-C0P0V6-F1-model_v4	AF-C0P0V6-F1-model_v4 Siderophore iron transporter	3.523E-07	1.000	281	1	459	479	34	563	588	568	0.958	0.901
LOKIASV2_0831_ESMFold_MFS_transporter	AF-Q8ZNJ7-F1-model_v4	AF-Q8ZNJ7-F1-model_v4 Bcr/CflA family efflux transporter	1.845E-06	1.000	280	27	462	479	7	391	396	441	0.910	0.972
LOKIASV2_0831_ESMFold_MFS_transporter	AF-A0A133CDU1-F1-model_v4	AF-A0A133CDU1-F1-model_v4 MFS transporter	6.118E-07	1.000	280	29	461	479	10	450	457	493	0.904	0.965
LOKIASV2_0831_ESMFold_MFS_transporter	AF-Q8I2V8-F1-model_v4	AF-Q8I2V8-F1-model_v4 Major facilitator superfamily domain-containing protein, putative	2.195E-07	1.000	280	16	472	479	1	460	476	513	0.954	0.966
LOKIASV2_0831_ESMFold_MFS_transporter	AF-A0A175WBY8-F1-model_v4	AF-A0A175WBY8-F1-model_v4 Putative transporter mfs2	5.023E-07	1.000	280	27	476	479	45	483	489	494	0.939	0.898
LOKIASV2_0831_ESMFold_MFS_transporter	AF-A0A0D2H6C0-F1-model_v4	AF-A0A0D2H6C0-F1-model_v4 Unplaced genomic scaffold supercont1.4, whole genome shotgun sequence	2.283E-07	1.000	280	17	479	479	33	480	491	507	0.967	0.912
LOKIASV2_0831_ESMFold_MFS_transporter	AF-O44607-F1-model_v4	AF-O44607-F1-model_v4 Solute carrier family 40 protein	4.642E-07	1.000	280	8	474	479	4	486	507	551	0.975	0.953
LOKIASV2_0831_ESMFold_MFS_transporter	AF-A0A0D2GXL9-F1-model_v4	AF-A0A0D2GXL9-F1-model_v4 Unplaced genomic scaffold supercont1.2, whole genome shotgun sequence	2.470E-07	1.000	280	17	479	479	71	507	513	492	0.967	0.852
LOKIASV2_0831_ESMFold_MFS_transporter	AF-Q8CE47-F1-model_v4	AF-Q8CE47-F1-model_v4 Solute carrier family 49 member A3	1.244E-06	1.000	280	30	477	479	35	464	516	487	0.935	0.833
LOKIASV2_0831_ESMFold_MFS_transporter	AF-Q6YXB7-F1-model_v4	AF-Q6YXB7-F1-model_v4 Os02g0574100 protein	1.456E-06	1.000	280	28	461	479	25	480	518	493	0.906	0.880
LOKIASV2_0831_ESMFold_MFS_transporter	AF-P33532-F1-model_v4	AF-P33532-F1-model_v4 Vitamin B6 transporter bsu1	1.038E-07	1.000	280	15	471	479	76	520	526	495	0.954	0.846
LOKIASV2_0831_ESMFold_MFS_transporter	AF-Q32HY2-F1-model_v4	AF-Q32HY2-F1-model_v4 Bcr/CflA family efflux transporter	2.737E-06	1.000	279	27	462	479	7	391	396	443	0.910	0.972
LOKIASV2_0831_ESMFold_MFS_transporter	AF-Q3U481-F1-model_v4	AF-Q3U481-F1-model_v4 Major facilitator superfamily domain-containing protein 12	2.337E-06	1.000	279	28	476	479	17	469	476	493	0.937	0.952
LOKIASV2_0831_ESMFold_MFS_transporter	AF-U7Q0I1-F1-model_v4	AF-U7Q0I1-F1-model_v4 MFS domain-containing protein	1.875E-07	1.000	279	9	471	479	13	464	482	511	0.967	0.938
LOKIASV2_0831_ESMFold_MFS_transporter	AF-Q9USN4-F1-model_v4	AF-Q9USN4-F1-model_v4 Uncharacterized transporter C1529.01	4.124E-07	1.000	279	31	459	479	46	472	491	473	0.896	0.870
LOKIASV2_0831_ESMFold_MFS_transporter	AF-H9G2Z4-F1-model_v4	AF-H9G2Z4-F1-model_v4 Uncharacterized protein	2.470E-07	1.000	279	9	471	479	13	475	499	526	0.967	0.928
LOKIASV2_0831_ESMFold_MFS_transporter	AF-Q0IGX4-F1-model_v4	AF-Q0IGX4-F1-model_v4 IP16073p	6.886E-07	1.000	279	25	461	479	41	484	516	484	0.912	0.860
LOKIASV2_0831_ESMFold_MFS_transporter	AF-A0A0D2F270-F1-model_v4	AF-A0A0D2F270-F1-model_v4 Unplaced genomic scaffold supercont1.4, whole genome shotgun sequence	6.364E-07	1.000	279	15	472	479	60	488	523	495	0.956	0.820
LOKIASV2_0831_ESMFold_MFS_transporter	AF-Q66GI9-F1-model_v4	AF-Q66GI9-F1-model_v4 Probable anion transporter 4, chloroplastic	2.283E-07	1.000	279	1	477	479	88	530	533	510	0.996	0.831
LOKIASV2_0831_ESMFold_MFS_transporter	AF-A0A5K4F3E0-F1-model_v4	AF-A0A5K4F3E0-F1-model_v4 Uncharacterized protein	3.009E-07	1.000	279	30	471	479	5	557	605	606	0.923	0.914
LOKIASV2_0831_ESMFold_MFS_transporter	AF-A0A0H3GJ43-F1-model_v4	AF-A0A0H3GJ43-F1-model_v4 General substrate transporter	9.819E-07	1.000	278	15	461	479	8	435	454	490	0.933	0.943
LOKIASV2_0831_ESMFold_MFS_transporter	AF-Q96SL1-F1-model_v4	AF-Q96SL1-F1-model_v4 Solute carrier family 49 member 4	1.021E-06	1.000	278	1	468	479	28	470	478	504	0.977	0.927
LOKIASV2_0831_ESMFold_MFS_transporter	AF-A0A1C1CD72-F1-model_v4	AF-A0A1C1CD72-F1-model_v4 Glucose/galactose transporter	3.965E-07	1.000	278	15	477	479	28	438	484	478	0.967	0.849
LOKIASV2_0831_ESMFold_MFS_transporter	AF-Q9P6J7-F1-model_v4	AF-Q9P6J7-F1-model_v4 Uncharacterized MFS-type transporter C1683.03c	6.886E-07	1.000	278	4	479	479	2	511	519	546	0.994	0.983
LOKIASV2_0831_ESMFold_MFS_transporter	AF-A0A1C1CSX7-F1-model_v4	AF-A0A1C1CSX7-F1-model_v4 Putative MFS-type transporter	2.247E-06	1.000	278	27	470	479	58	527	762	502	0.927	0.617
LOKIASV2_0831_ESMFold_MFS_transporter	AF-C0NNT5-F1-model_v4	AF-C0NNT5-F1-model_v4 tRNA(Phe) (4-demethylwyosine(37)-C(7)) aminocarboxypropyltransferase	2.570E-07	1.000	278	1	475	479	37	496	995	515	0.992	0.462
LOKIASV2_0831_ESMFold_MFS_transporter	AF-A0A3P7EBZ0-F1-model_v4	AF-A0A3P7EBZ0-F1-model_v4 MFS domain-containing protein	4.463E-07	1.000	277	15	463	479	20	441	446	484	0.937	0.946
LOKIASV2_0831_ESMFold_MFS_transporter	AF-Q7KJP2-F1-model_v4	AF-Q7KJP2-F1-model_v4 FI08437p	2.110E-07	1.000	277	28	461	479	9	451	476	487	0.906	0.931
LOKIASV2_0831_ESMFold_MFS_transporter	AF-C1H6C1-F1-model_v4	AF-C1H6C1-F1-model_v4 Sugar transporter STL1	2.892E-07	1.000	277	30	461	479	7	438	484	483	0.902	0.893
