LOKIASV2_4345_ESMFold_MFS_transporter	AF-Q8DPT0-F1-model_v4	AF-Q8DPT0-F1-model_v4 ABC transporter membrane-spanning permease-macrolide efflux	8.275E-07	1.000	285	12	432	471	1	383	392	433	0.894	0.977
LOKIASV2_4345_ESMFold_MFS_transporter	AF-Q9HWP5-F1-model_v4	AF-Q9HWP5-F1-model_v4 Bcr/CflA family efflux transporter	2.128E-07	1.000	285	4	435	471	2	402	402	456	0.917	0.998
LOKIASV2_4345_ESMFold_MFS_transporter	AF-A0A0H3GNI8-F1-model_v4	AF-A0A0H3GNI8-F1-model_v4 Major facilitator superfamily MFS_1	2.724E-07	1.000	285	1	450	471	12	431	432	479	0.955	0.972
LOKIASV2_4345_ESMFold_MFS_transporter	AF-Q9VS47-F1-model_v4	AF-Q9VS47-F1-model_v4 LD39967p	9.342E-08	1.000	285	15	457	471	53	477	478	472	0.941	0.889
LOKIASV2_4345_ESMFold_MFS_transporter	AF-Q9LXH0-F1-model_v4	AF-Q9LXH0-F1-model_v4 High affinity nitrate transporter 2.6	5.713E-07	1.000	285	1	428	471	36	465	542	479	0.909	0.793
LOKIASV2_4345_ESMFold_MFS_transporter	AF-P37662-F1-model_v4	AF-P37662-F1-model_v4 Uncharacterized MFS-type transporter YhjX	6.204E-07	1.000	284	16	437	471	9	392	402	445	0.896	0.955
LOKIASV2_4345_ESMFold_MFS_transporter	AF-K0EY38-F1-model_v4	AF-K0EY38-F1-model_v4 Major facilitator transporter	1.104E-06	1.000	284	1	437	471	1	398	412	452	0.928	0.966
LOKIASV2_4345_ESMFold_MFS_transporter	AF-Q7CP73-F1-model_v4	AF-Q7CP73-F1-model_v4 Multidrug resistance protein MdtM	3.633E-07	1.000	284	14	456	471	15	411	413	454	0.941	0.961
LOKIASV2_4345_ESMFold_MFS_transporter	AF-K0ERL6-F1-model_v4	AF-K0ERL6-F1-model_v4 Major facilitator superfamily protein	1.249E-06	1.000	284	1	432	471	1	467	476	504	0.917	0.981
LOKIASV2_4345_ESMFold_MFS_transporter	AF-Q9SQN2-F1-model_v4	AF-Q9SQN2-F1-model_v4 Probable folate-biopterin transporter 3	1.732E-07	1.000	284	9	438	471	42	465	497	474	0.913	0.853
LOKIASV2_4345_ESMFold_MFS_transporter	AF-Q09852-F1-model_v4	AF-Q09852-F1-model_v4 Putative inorganic phosphate transporter C23D3.12	1.301E-06	1.000	284	1	447	471	10	539	559	565	0.949	0.948
LOKIASV2_4345_ESMFold_MFS_transporter	AF-U7Q400-F1-model_v4	AF-U7Q400-F1-model_v4 MFS domain-containing protein	3.211E-07	1.000	284	1	439	471	106	648	697	574	0.932	0.779
LOKIASV2_4345_ESMFold_MFS_transporter	AF-Q8ZQD2-F1-model_v4	AF-Q8ZQD2-F1-model_v4 Uncharacterized MFS-type transporter YcaD	2.730E-06	1.000	283	16	425	471	6	368	382	414	0.870	0.950
LOKIASV2_4345_ESMFold_MFS_transporter	AF-Q7K1D7-F1-model_v4	AF-Q7K1D7-F1-model_v4 GH15861p	1.469E-07	1.000	283	6	432	471	46	462	482	466	0.907	0.865
LOKIASV2_4345_ESMFold_MFS_transporter	AF-A0A1D6HVY9-F1-model_v4	AF-A0A1D6HVY9-F1-model_v4 Oligosaccharide transferase1	1.732E-07	1.000	283	1	461	471	12	485	487	515	0.979	0.973
LOKIASV2_4345_ESMFold_MFS_transporter	AF-P25346-F1-model_v4	AF-P25346-F1-model_v4 Glycerophosphoinositol transporter 1	2.614E-07	1.000	283	1	471	471	10	502	518	537	1.000	0.952
LOKIASV2_4345_ESMFold_MFS_transporter	AF-O13880-F1-model_v4	AF-O13880-F1-model_v4 Vitamin H transporter 1	1.595E-07	1.000	283	16	471	471	86	559	568	519	0.968	0.835
LOKIASV2_4345_ESMFold_MFS_transporter	AF-Q8ZQK8-F1-model_v4	AF-Q8ZQK8-F1-model_v4 Multidrug translocase	1.104E-06	1.000	282	1	430	471	1	399	410	446	0.913	0.973
LOKIASV2_4345_ESMFold_MFS_transporter	AF-I1L0J7-F1-model_v4	AF-I1L0J7-F1-model_v4 Uncharacterized protein	1.732E-07	1.000	282	7	433	471	3	426	437	460	0.907	0.970
LOKIASV2_4345_ESMFold_MFS_transporter	AF-Q6I5Y4-F1-model_v4	AF-Q6I5Y4-F1-model_v4 Os05g0389400 protein	4.111E-07	1.000	282	15	437	471	16	432	438	454	0.898	0.952
LOKIASV2_4345_ESMFold_MFS_transporter	AF-K0EWA3-F1-model_v4	AF-K0EWA3-F1-model_v4 Multidrug resistance transporter, MFS superfamily protein	8.985E-07	1.000	282	4	437	471	2	467	474	504	0.921	0.983
LOKIASV2_4345_ESMFold_MFS_transporter	AF-U7PHC3-F1-model_v4	AF-U7PHC3-F1-model_v4 MFS domain-containing protein	3.794E-06	1.000	281	16	433	471	111	495	501	438	0.887	0.768
LOKIASV2_4345_ESMFold_MFS_transporter	AF-A0A0D2F254-F1-model_v4	AF-A0A0D2F254-F1-model_v4 Unplaced genomic scaffold supercont1.4, whole genome shotgun sequence	1.150E-06	1.000	280	1	434	471	37	441	452	453	0.921	0.896
LOKIASV2_4345_ESMFold_MFS_transporter	AF-Q8ZKY1-F1-model_v4	AF-Q8ZKY1-F1-model_v4 Multidrug resistance protein MdtL	3.211E-07	1.000	279	19	427	471	3	375	395	425	0.868	0.944
LOKIASV2_4345_ESMFold_MFS_transporter	AF-A0A0H3GJU2-F1-model_v4	AF-A0A0H3GJU2-F1-model_v4 Putative drug efflux protein	3.953E-06	1.000	279	16	437	471	4	390	396	433	0.896	0.977
LOKIASV2_4345_ESMFold_MFS_transporter	AF-P0AEY8-F1-model_v4	AF-P0AEY8-F1-model_v4 Multidrug transporter MdfA	1.249E-06	1.000	279	1	440	471	2	400	410	453	0.934	0.973
LOKIASV2_4345_ESMFold_MFS_transporter	AF-A0A0P0WFB6-F1-model_v4	AF-A0A0P0WFB6-F1-model_v4 Os04g0631100 protein	4.111E-07	1.000	279	56	448	471	12	411	412	453	0.834	0.971
LOKIASV2_4345_ESMFold_MFS_transporter	AF-Q8ZRC2-F1-model_v4	AF-Q8ZRC2-F1-model_v4 MFS family, muropeptide transporter	2.844E-06	1.000	279	17	444	471	14	411	491	446	0.909	0.811
LOKIASV2_4345_ESMFold_MFS_transporter	AF-C1H5W7-F1-model_v4	AF-C1H5W7-F1-model_v4 Uncharacterized protein	7.621E-07	1.000	279	15	424	471	66	471	511	443	0.870	0.795
LOKIASV2_4345_ESMFold_MFS_transporter	AF-U7Q168-F1-model_v4	AF-U7Q168-F1-model_v4 Uncharacterized protein	3.487E-07	1.000	279	1	455	471	75	516	527	481	0.966	0.839
LOKIASV2_4345_ESMFold_MFS_transporter	AF-O70324-F1-model_v4	AF-O70324-F1-model_v4 Monocarboxylate transporter 8	1.881E-07	1.000	279	2	471	471	85	528	545	510	0.998	0.815
LOKIASV2_4345_ESMFold_MFS_transporter	AF-P28246-F1-model_v4	AF-P28246-F1-model_v4 Bicyclomycin resistance protein	8.275E-07	1.000	278	7	430	471	2	391	396	444	0.900	0.985
LOKIASV2_4345_ESMFold_MFS_transporter	AF-Q95XM8-F1-model_v4	AF-Q95XM8-F1-model_v4 MFS domain-containing protein	1.964E-06	1.000	278	17	439	471	8	398	407	448	0.898	0.961
LOKIASV2_4345_ESMFold_MFS_transporter	AF-P36032-F1-model_v4	AF-P36032-F1-model_v4 Probable transporter MCH2	1.249E-06	1.000	278	3	430	471	22	425	473	455	0.909	0.854
LOKIASV2_4345_ESMFold_MFS_transporter	AF-K7LUQ1-F1-model_v4	AF-K7LUQ1-F1-model_v4 MFS domain-containing protein	8.965E-08	1.000	278	16	433	471	62	538	564	532	0.887	0.846
LOKIASV2_4345_ESMFold_MFS_transporter	AF-Q9P6J9-F1-model_v4	AF-Q9P6J9-F1-model_v4 Putative inorganic phosphate transporter C1683.01	4.111E-07	1.000	278	1	446	471	9	551	573	577	0.947	0.948
LOKIASV2_4345_ESMFold_MFS_transporter	AF-A0A0D2FHI5-F1-model_v4	AF-A0A0D2FHI5-F1-model_v4 Unplaced genomic scaffold supercont1.1, whole genome shotgun sequence	6.464E-07	1.000	278	2	432	471	87	542	611	505	0.915	0.746
LOKIASV2_4345_ESMFold_MFS_transporter	AF-Q9LPV5-F1-model_v4	AF-Q9LPV5-F1-model_v4 High affinity nitrate transporter 2.5	5.713E-07	1.000	277	18	453	471	47	491	502	489	0.926	0.886
LOKIASV2_4345_ESMFold_MFS_transporter	AF-C0NN54-F1-model_v4	AF-C0NN54-F1-model_v4 Maltose permease	4.463E-07	1.000	277	14	453	471	76	537	583	512	0.934	0.792
LOKIASV2_4345_ESMFold_MFS_transporter	AF-Q6NLL3-F1-model_v4	AF-Q6NLL3-F1-model_v4 GH21943p	8.965E-08	1.000	277	1	471	471	217	691	705	519	1.000	0.674
LOKIASV2_4345_ESMFold_MFS_transporter	AF-A0A044RAL1-F1-model_v4	AF-A0A044RAL1-F1-model_v4 MFS domain-containing protein	7.924E-08	1.000	276	1	446	471	16	460	493	486	0.947	0.903
LOKIASV2_4345_ESMFold_MFS_transporter	AF-B4FSV9-F1-model_v4	AF-B4FSV9-F1-model_v4 Nitrate transport1	7.621E-07	1.000	276	17	471	471	62	522	524	508	0.966	0.880
LOKIASV2_4345_ESMFold_MFS_transporter	AF-C8VV48-F1-model_v4	AF-C8VV48-F1-model_v4 Karmoisin, isoform B	1.666E-06	1.000	276	1	437	471	65	478	612	465	0.928	0.676
LOKIASV2_4345_ESMFold_MFS_transporter	AF-K0FA85-F1-model_v4	AF-K0FA85-F1-model_v4 Transporter	1.249E-06	1.000	275	6	429	471	2	388	395	442	0.900	0.980
LOKIASV2_4345_ESMFold_MFS_transporter	AF-P45123-F1-model_v4	AF-P45123-F1-model_v4 Bicyclomycin resistance protein homolog	6.464E-07	1.000	275	11	432	471	1	389	398	442	0.896	0.977
LOKIASV2_4345_ESMFold_MFS_transporter	AF-Q7CQJ8-F1-model_v4	AF-Q7CQJ8-F1-model_v4 Putative MFS familty transport protein	1.017E-06	1.000	275	1	430	471	7	412	417	455	0.913	0.974
LOKIASV2_4345_ESMFold_MFS_transporter	AF-K0ES24-F1-model_v4	AF-K0ES24-F1-model_v4 Major facilitator transporter	6.736E-07	1.000	275	1	427	471	1	419	442	468	0.907	0.948
LOKIASV2_4345_ESMFold_MFS_transporter	AF-Q9FYG3-F1-model_v4	AF-Q9FYG3-F1-model_v4 Probable plastidic glucose transporter 2	1.805E-07	1.000	275	9	447	471	43	490	493	500	0.932	0.909
LOKIASV2_4345_ESMFold_MFS_transporter	AF-A0A5K4EJL2-F1-model_v4	AF-A0A5K4EJL2-F1-model_v4 Putative vesicular amine transporter	1.104E-06	1.000	275	51	438	471	159	505	512	400	0.824	0.678
LOKIASV2_4345_ESMFold_MFS_transporter	AF-A0A1D6NTI2-F1-model_v4	AF-A0A1D6NTI2-F1-model_v4 Putative folate-biopterin transporter 2	4.463E-07	1.000	275	17	470	471	60	506	534	496	0.964	0.837
LOKIASV2_4345_ESMFold_MFS_transporter	AF-Q9FJH7-F1-model_v4	AF-Q9FJH7-F1-model_v4 High affinity nitrate transporter 2.3	3.211E-07	1.000	275	17	453	471	71	515	539	490	0.928	0.826
LOKIASV2_4345_ESMFold_MFS_transporter	AF-Q8ZPR2-F1-model_v4	AF-Q8ZPR2-F1-model_v4 Putative MFS family transport protein	1.736E-06	1.000	274	16	468	471	12	403	403	466	0.962	0.973
LOKIASV2_4345_ESMFold_MFS_transporter	AF-Q10917-F1-model_v4	AF-Q10917-F1-model_v4 Putative transporter B0252.3	2.128E-07	1.000	274	1	456	471	10	482	484	526	0.968	0.977
LOKIASV2_4345_ESMFold_MFS_transporter	AF-C1GW05-F1-model_v4	AF-C1GW05-F1-model_v4 Uncharacterized protein	4.463E-07	1.000	274	1	444	471	38	472	495	471	0.943	0.879
LOKIASV2_4345_ESMFold_MFS_transporter	AF-C0RSI9-F1-model_v4	AF-C0RSI9-F1-model_v4 MFS domain-containing protein	1.150E-06	1.000	273	15	437	471	8	395	403	448	0.898	0.963
LOKIASV2_4345_ESMFold_MFS_transporter	AF-C0H4E1-F1-model_v4	AF-C0H4E1-F1-model_v4 Major facilitator superfamily domain-containing protein, putative	4.111E-07	1.000	273	2	456	471	14	440	442	488	0.966	0.966
LOKIASV2_4345_ESMFold_MFS_transporter	AF-Q17675-F1-model_v4	AF-Q17675-F1-model_v4 Uncharacterized protein	4.463E-07	1.000	273	1	467	471	1	455	456	498	0.992	0.998
LOKIASV2_4345_ESMFold_MFS_transporter	AF-Q329U1-F1-model_v4	AF-Q329U1-F1-model_v4 Putative transport protein	7.941E-07	1.000	273	16	431	471	12	449	475	479	0.883	0.922
LOKIASV2_4345_ESMFold_MFS_transporter	AF-A0A0K0E2J2-F1-model_v4	AF-A0A0K0E2J2-F1-model_v4 Uncharacterized protein	6.204E-07	1.000	273	1	470	471	1	498	526	555	0.998	0.947
LOKIASV2_4345_ESMFold_MFS_transporter	AF-Q5SMV1-F1-model_v4	AF-Q5SMV1-F1-model_v4 Os06g0186700 protein	7.019E-07	1.000	273	14	466	471	58	508	539	495	0.962	0.837
LOKIASV2_4345_ESMFold_MFS_transporter	AF-K0EGL9-F1-model_v4	AF-K0EGL9-F1-model_v4 Major facilitator superfamily multidrug transporter	5.050E-07	1.000	273	1	454	471	1	575	604	604	0.964	0.952
LOKIASV2_4345_ESMFold_MFS_transporter	AF-P76197-F1-model_v4	AF-P76197-F1-model_v4 Inner membrane transport protein YdiM	2.964E-06	1.000	272	14	462	471	10	399	404	460	0.953	0.965
LOKIASV2_4345_ESMFold_MFS_transporter	AF-Q6ATP9-F1-model_v4	AF-Q6ATP9-F1-model_v4 Os03g0809100 protein	4.283E-07	1.000	272	14	452	471	14	457	470	484	0.932	0.945
LOKIASV2_4345_ESMFold_MFS_transporter	AF-C0NH70-F1-model_v4	AF-C0NH70-F1-model_v4 Monocarboxylate permease-like protein	5.061E-06	1.000	272	11	438	471	105	494	501	446	0.909	0.778
LOKIASV2_4345_ESMFold_MFS_transporter	AF-A0A1D6JF71-F1-model_v4	AF-A0A1D6JF71-F1-model_v4 Organic cation/carnitine transporter 4	5.953E-07	1.000	272	16	433	471	57	505	528	504	0.887	0.850
LOKIASV2_4345_ESMFold_MFS_transporter	AF-A0A0R0JT45-F1-model_v4	AF-A0A0R0JT45-F1-model_v4 MFS domain-containing protein	1.805E-07	1.000	272	16	433	471	62	541	567	543	0.887	0.847
LOKIASV2_4345_ESMFold_MFS_transporter	AF-Q8DN11-F1-model_v4	AF-Q8DN11-F1-model_v4 MFS domain-containing protein	1.881E-07	1.000	271	15	430	471	12	385	392	438	0.883	0.954
LOKIASV2_4345_ESMFold_MFS_transporter	AF-Q62666-F1-model_v4	AF-Q62666-F1-model_v4 Vesicular acetylcholine transporter	9.756E-07	1.000	271	17	442	471	31	484	530	498	0.904	0.857
LOKIASV2_4345_ESMFold_MFS_transporter	AF-U7Q7X2-F1-model_v4	AF-U7Q7X2-F1-model_v4 Uncharacterized protein	1.599E-06	1.000	271	3	438	471	120	571	576	487	0.926	0.785
LOKIASV2_4345_ESMFold_MFS_transporter	AF-Q9HTX1-F1-model_v4	AF-Q9HTX1-F1-model_v4 MFS domain-containing protein	2.315E-06	1.000	270	15	444	471	6	391	397	446	0.913	0.972
LOKIASV2_4345_ESMFold_MFS_transporter	AF-A0A133CSP4-F1-model_v4	AF-A0A133CSP4-F1-model_v4 MFS transporter	2.222E-06	1.000	270	15	463	471	8	401	402	466	0.953	0.980
LOKIASV2_4345_ESMFold_MFS_transporter	AF-K0F7F2-F1-model_v4	AF-K0F7F2-F1-model_v4 Major facilitator transporter	4.846E-07	1.000	270	3	451	471	2	493	501	526	0.953	0.982
LOKIASV2_4345_ESMFold_MFS_transporter	AF-Q8IBB7-F1-model_v4	AF-Q8IBB7-F1-model_v4 Folate transporter 1	1.017E-06	1.000	270	8	451	471	41	470	505	476	0.943	0.851
LOKIASV2_4345_ESMFold_MFS_transporter	AF-C0P495-F1-model_v4	AF-C0P495-F1-model_v4 Organic cation/carnitine transporter 4	3.786E-07	1.000	270	16	448	471	47	505	506	512	0.919	0.907
LOKIASV2_4345_ESMFold_MFS_transporter	AF-A0A1D6EZM7-F1-model_v4	AF-A0A1D6EZM7-F1-model_v4 Putative polyol transporter 1	1.960E-07	1.000	270	1	470	471	7	510	516	544	0.998	0.977
LOKIASV2_4345_ESMFold_MFS_transporter	AF-A0A175W0Z0-F1-model_v4	AF-A0A175W0Z0-F1-model_v4 Putative MFS-type transporter YusP	3.633E-07	1.000	270	1	449	471	22	519	520	545	0.953	0.958
LOKIASV2_4345_ESMFold_MFS_transporter	AF-A0A175W1Q6-F1-model_v4	AF-A0A175W1Q6-F1-model_v4 Dityrosine transporter 1	5.262E-07	1.000	270	11	466	471	73	517	524	510	0.968	0.849
LOKIASV2_4345_ESMFold_MFS_transporter	AF-Q54N46-F1-model_v4	AF-Q54N46-F1-model_v4 MFS domain-containing protein	3.945E-07	1.000	270	1	470	471	91	560	560	526	0.998	0.839
LOKIASV2_4345_ESMFold_MFS_transporter	AF-Q9I4C6-F1-model_v4	AF-Q9I4C6-F1-model_v4 Probable major facilitator superfamily (MFS) transporter	1.249E-06	1.000	269	1	427	471	1	399	409	448	0.907	0.976
LOKIASV2_4345_ESMFold_MFS_transporter	AF-A0A0R4ICC7-F1-model_v4	AF-A0A0R4ICC7-F1-model_v4 Si:dkey-229d2.4	9.362E-07	1.000	269	15	438	471	3	408	417	450	0.900	0.974
LOKIASV2_4345_ESMFold_MFS_transporter	AF-Q9HTJ4-F1-model_v4	AF-Q9HTJ4-F1-model_v4 Probable major facilitator superfamily (MFS) transporter	7.019E-07	1.000	269	1	437	471	1	432	438	482	0.928	0.986
LOKIASV2_4345_ESMFold_MFS_transporter	AF-K0F1X9-F1-model_v4	AF-K0F1X9-F1-model_v4 Drug resistance transporter EmrB/QacA subfamily protein	1.666E-06	1.000	269	11	438	471	6	465	479	496	0.909	0.960
LOKIASV2_4345_ESMFold_MFS_transporter	AF-U7PXR1-F1-model_v4	AF-U7PXR1-F1-model_v4 MFS domain-containing protein	3.794E-06	1.000	269	1	455	471	75	503	504	486	0.966	0.851
LOKIASV2_4345_ESMFold_MFS_transporter	AF-Q8ZNJ7-F1-model_v4	AF-Q8ZNJ7-F1-model_v4 Bcr/CflA family efflux transporter	2.132E-06	1.000	268	7	427	471	2	388	396	436	0.894	0.977
LOKIASV2_4345_ESMFold_MFS_transporter	AF-Q9HT26-F1-model_v4	AF-Q9HT26-F1-model_v4 Probable major facilitator superfamily (MFS) transporter	1.301E-06	1.000	268	1	436	471	1	401	401	450	0.926	1.000
LOKIASV2_4345_ESMFold_MFS_transporter	AF-K0F7Y4-F1-model_v4	AF-K0F7Y4-F1-model_v4 Putative transport integral membrane protein	6.464E-07	1.000	268	1	466	471	13	412	414	485	0.989	0.966
LOKIASV2_4345_ESMFold_MFS_transporter	AF-K0ESM1-F1-model_v4	AF-K0ESM1-F1-model_v4 YqjV-like MFS-type transporter	4.120E-06	1.000	268	1	432	471	8	416	433	464	0.917	0.945
LOKIASV2_4345_ESMFold_MFS_transporter	AF-A0A133CZJ2-F1-model_v4	AF-A0A133CZJ2-F1-model_v4 MFS transporter	1.472E-06	1.000	268	7	432	471	2	476	490	511	0.904	0.969
LOKIASV2_4345_ESMFold_MFS_transporter	AF-P0AE16-F1-model_v4	AF-P0AE16-F1-model_v4 Anhydromuropeptide permease	5.726E-06	1.000	268	12	444	471	1	411	491	459	0.919	0.837
LOKIASV2_4345_ESMFold_MFS_transporter	AF-I1JL28-F1-model_v4	AF-I1JL28-F1-model_v4 Solute carrier family 40 protein	7.941E-07	1.000	268	1	448	471	7	499	502	527	0.951	0.982
LOKIASV2_4345_ESMFold_MFS_transporter	AF-A0A0D2FBQ6-F1-model_v4	AF-A0A0D2FBQ6-F1-model_v4 Unplaced genomic scaffold supercont1.2, whole genome shotgun sequence	3.088E-06	1.000	268	14	448	471	11	467	504	495	0.924	0.907
LOKIASV2_4345_ESMFold_MFS_transporter	AF-Q08C75-F1-model_v4	AF-Q08C75-F1-model_v4 Probable vesicular acetylcholine transporter-A	2.315E-06	1.000	268	15	469	471	36	482	513	495	0.966	0.871
LOKIASV2_4345_ESMFold_MFS_transporter	AF-X8FDX5-F1-model_v4	AF-X8FDX5-F1-model_v4 Sugar (And other) transporter family protein	5.471E-08	1.000	268	12	450	471	1	493	517	533	0.932	0.954
LOKIASV2_4345_ESMFold_MFS_transporter	AF-Q9SYQ1-F1-model_v4	AF-Q9SYQ1-F1-model_v4 Probable inorganic phosphate transporter 1-8	2.046E-06	1.000	268	10	453	471	11	515	534	528	0.943	0.946
LOKIASV2_4345_ESMFold_MFS_transporter	AF-Q54E67-F1-model_v4	AF-Q54E67-F1-model_v4 MFS domain-containing protein	3.346E-07	1.000	267	1	448	471	13	420	425	480	0.951	0.960
LOKIASV2_4345_ESMFold_MFS_transporter	AF-A0A0H3GQF4-F1-model_v4	AF-A0A0H3GQF4-F1-model_v4 MFS superfamily transporter signal transducer	4.293E-06	1.000	267	17	430	471	17	411	426	436	0.879	0.927
LOKIASV2_4345_ESMFold_MFS_transporter	AF-Q9XIQ7-F1-model_v4	AF-Q9XIQ7-F1-model_v4 Probable folate-biopterin transporter 7	2.957E-07	1.000	267	1	447	471	4	441	442	475	0.949	0.991
LOKIASV2_4345_ESMFold_MFS_transporter	AF-U7PLA7-F1-model_v4	AF-U7PLA7-F1-model_v4 Uncharacterized protein	1.104E-06	1.000	267	7	430	471	120	514	532	443	0.900	0.742
LOKIASV2_4345_ESMFold_MFS_transporter	AF-Q16572-F1-model_v4	AF-Q16572-F1-model_v4 Vesicular acetylcholine transporter	2.514E-06	1.000	267	17	442	471	31	484	532	497	0.904	0.853
LOKIASV2_4345_ESMFold_MFS_transporter	AF-A0A0D2GFQ0-F1-model_v4	AF-A0A0D2GFQ0-F1-model_v4 Unplaced genomic scaffold supercont1.6, whole genome shotgun sequence	3.945E-07	1.000	267	11	445	471	54	574	596	557	0.924	0.874
LOKIASV2_4345_ESMFold_MFS_transporter	AF-Q32HY2-F1-model_v4	AF-Q32HY2-F1-model_v4 Bcr/CflA family efflux transporter	1.809E-06	1.000	266	7	427	471	2	388	396	439	0.894	0.977
LOKIASV2_4345_ESMFold_MFS_transporter	AF-A0A0H3GR58-F1-model_v4	AF-A0A0H3GR58-F1-model_v4 Major facilitator superfamily permease	1.150E-06	1.000	266	8	427	471	2	390	404	429	0.892	0.963
LOKIASV2_4345_ESMFold_MFS_transporter	AF-P37621-F1-model_v4	AF-P37621-F1-model_v4 Uncharacterized MFS-type transporter YhhS	2.964E-06	1.000	266	6	437	471	4	395	405	439	0.917	0.968
LOKIASV2_4345_ESMFold_MFS_transporter	AF-K0F721-F1-model_v4	AF-K0F721-F1-model_v4 Putative transporter	1.666E-06	1.000	266	1	455	471	1	453	463	506	0.966	0.978
LOKIASV2_4345_ESMFold_MFS_transporter	AF-A0A0D2G9N2-F1-model_v4	AF-A0A0D2G9N2-F1-model_v4 Unplaced genomic scaffold supercont1.6, whole genome shotgun sequence	6.464E-07	1.000	266	1	453	471	33	534	595	541	0.962	0.844
LOKIASV2_4345_ESMFold_MFS_transporter	AF-Q2G1E2-F1-model_v4	AF-Q2G1E2-F1-model_v4 Membrane protein, putative	1.196E-07	1.000	265	16	427	471	30	448	459	453	0.875	0.913
LOKIASV2_4345_ESMFold_MFS_transporter	AF-A0A1D6HY58-F1-model_v4	AF-A0A1D6HY58-F1-model_v4 Folate/biopterin transporter family protein	2.620E-06	1.000	265	15	433	471	89	507	520	450	0.890	0.806
LOKIASV2_4345_ESMFold_MFS_transporter	AF-Q7AQ40-F1-model_v4	AF-Q7AQ40-F1-model_v4 Putative transmembrane efflux protein	1.249E-06	1.000	265	1	452	471	39	533	534	532	0.960	0.927
LOKIASV2_4345_ESMFold_MFS_transporter	AF-I1LE37-F1-model_v4	AF-I1LE37-F1-model_v4 Uncharacterized protein	9.342E-08	1.000	265	1	448	471	103	551	554	483	0.951	0.810
LOKIASV2_4345_ESMFold_MFS_transporter	AF-Q9Y5Y0-F1-model_v4	AF-Q9Y5Y0-F1-model_v4 Feline leukemia virus subgroup C receptor-related protein 1	8.622E-07	1.000	265	1	441	471	89	518	555	474	0.936	0.775
LOKIASV2_4345_ESMFold_MFS_transporter	AF-Q2G2W1-F1-model_v4	AF-Q2G2W1-F1-model_v4 Drug resistance transporter, EmrB/QacA subfamily, putative	1.809E-06	1.000	265	10	456	471	134	642	643	541	0.949	0.792
LOKIASV2_4345_ESMFold_MFS_transporter	AF-E7EYD2-F1-model_v4	AF-E7EYD2-F1-model_v4 Solute carrier family 45 member 1	1.201E-05	1.000	265	1	431	471	71	783	802	736	0.915	0.889
LOKIASV2_4345_ESMFold_MFS_transporter	AF-A0A0H3GZQ5-F1-model_v4	AF-A0A0H3GZQ5-F1-model_v4 Uncharacterized MFS-type transporter KPHS_49930	7.330E-06	1.000	264	1	437	471	1	395	406	450	0.928	0.973
LOKIASV2_4345_ESMFold_MFS_transporter	AF-K0EYB1-F1-model_v4	AF-K0EYB1-F1-model_v4 Putative major facilitator superfamily transporter	2.964E-06	1.000	264	9	432	471	16	408	419	444	0.900	0.938
LOKIASV2_4345_ESMFold_MFS_transporter	AF-F4KIL8-F1-model_v4	AF-F4KIL8-F1-model_v4 Probable folate-biopterin transporter 5	2.042E-07	1.000	264	17	463	471	44	491	492	498	0.949	0.911
LOKIASV2_4345_ESMFold_MFS_transporter	AF-Q8K1P8-F1-model_v4	AF-Q8K1P8-F1-model_v4 Monocarboxylate transporter 8	9.756E-07	1.000	264	2	471	471	88	528	545	509	0.998	0.809
LOKIASV2_4345_ESMFold_MFS_transporter	AF-A0A0H3GUM7-F1-model_v4	AF-A0A0H3GUM7-F1-model_v4 Putative DEOR-type transcriptional regulator	1.059E-06	1.000	263	9	429	471	2	388	400	444	0.894	0.967
LOKIASV2_4345_ESMFold_MFS_transporter	AF-Q8ZQK6-F1-model_v4	AF-Q8ZQK6-F1-model_v4 Putative transport protein/putative regulator	2.413E-06	1.000	263	9	429	471	2	388	403	445	0.894	0.960
LOKIASV2_4345_ESMFold_MFS_transporter	AF-K0F3M3-F1-model_v4	AF-K0F3M3-F1-model_v4 Major facilitator superfamily permease	1.885E-06	1.000	263	1	433	471	4	394	403	447	0.919	0.970
LOKIASV2_4345_ESMFold_MFS_transporter	AF-K0EM48-F1-model_v4	AF-K0EM48-F1-model_v4 Multidrug-efflux transporter	5.273E-06	1.000	263	17	444	471	13	388	406	436	0.909	0.926
LOKIASV2_4345_ESMFold_MFS_transporter	AF-A0A0K0JNK7-F1-model_v4	AF-A0A0K0JNK7-F1-model_v4 Bm6543, isoform a	1.104E-06	1.000	263	15	444	471	25	445	448	477	0.913	0.940
LOKIASV2_4345_ESMFold_MFS_transporter	AF-A0A1C1CUY2-F1-model_v4	AF-A0A1C1CUY2-F1-model_v4 Putative transporter MCH2	2.620E-06	1.000	263	11	471	471	1	422	474	474	0.979	0.890
LOKIASV2_4345_ESMFold_MFS_transporter	AF-A4I8J0-F1-model_v4	AF-A4I8J0-F1-model_v4 BT1_family_-_putative	3.346E-07	1.000	263	20	448	471	2	453	475	479	0.911	0.952
LOKIASV2_4345_ESMFold_MFS_transporter	AF-Q9HYE1-F1-model_v4	AF-Q9HYE1-F1-model_v4 MFS domain-containing protein	9.756E-07	1.000	263	1	442	471	2	427	571	479	0.938	0.746
LOKIASV2_4345_ESMFold_MFS_transporter	AF-P76628-F1-model_v4	AF-P76628-F1-model_v4 Putative uncharacterized transporter YgaY	1.809E-06	1.000	262	6	430	471	2	384	394	433	0.902	0.972
LOKIASV2_4345_ESMFold_MFS_transporter	AF-A0A0D2GPI7-F1-model_v4	AF-A0A0D2GPI7-F1-model_v4 Unplaced genomic scaffold supercont1.4, whole genome shotgun sequence	6.478E-06	1.000	262	1	432	471	32	432	446	450	0.917	0.899
LOKIASV2_4345_ESMFold_MFS_transporter	AF-A0A1C1CZZ2-F1-model_v4	AF-A0A1C1CZZ2-F1-model_v4 Putative monocarboxylate permease like protein, mch4	1.964E-06	1.000	262	2	439	471	54	486	490	467	0.930	0.884
LOKIASV2_4345_ESMFold_MFS_transporter	AF-A0A1D6EIK9-F1-model_v4	AF-A0A1D6EIK9-F1-model_v4 Transporter of mugineic acid3	4.283E-07	1.000	262	1	436	471	9	485	492	516	0.926	0.970
LOKIASV2_4345_ESMFold_MFS_transporter	AF-A0A077Z4Q9-F1-model_v4	AF-A0A077Z4Q9-F1-model_v4 Major facilitator superfamily transporter	6.204E-07	1.000	262	11	451	471	62	503	522	476	0.936	0.847
LOKIASV2_4345_ESMFold_MFS_transporter	AF-C0NS77-F1-model_v4	AF-C0NS77-F1-model_v4 Multidrug resistance protein fnx1	1.960E-07	1.000	262	1	455	471	39	537	540	542	0.966	0.924
LOKIASV2_4345_ESMFold_MFS_transporter	AF-H2KYF2-F1-model_v4	AF-H2KYF2-F1-model_v4 MFS domain-containing protein	7.621E-07	1.000	262	1	456	471	196	627	628	495	0.968	0.688
LOKIASV2_4345_ESMFold_MFS_transporter	AF-A0A1C1CFV3-F1-model_v4	AF-A0A1C1CFV3-F1-model_v4 MFS monocarboxylate transporter	4.473E-06	1.000	261	5	374	471	18	381	383	397	0.786	0.950
LOKIASV2_4345_ESMFold_MFS_transporter	AF-Q18797-F1-model_v4	AF-Q18797-F1-model_v4 MFS domain-containing protein	8.985E-07	1.000	261	1	442	471	1	408	415	473	0.938	0.983
LOKIASV2_4345_ESMFold_MFS_transporter	AF-A0A0H3GKG9-F1-model_v4	AF-A0A0H3GKG9-F1-model_v4 Beta-lactamase synthesis regulator/muropeptide transporter	4.293E-06	1.000	261	23	444	471	12	411	491	446	0.896	0.815
LOKIASV2_4345_ESMFold_MFS_transporter	AF-A0A175VNJ6-F1-model_v4	AF-A0A175VNJ6-F1-model_v4 High-affinity nicotinic acid transporter	5.262E-07	1.000	261	16	427	471	54	459	492	447	0.875	0.825
LOKIASV2_4345_ESMFold_MFS_transporter	AF-A0A1C1CC30-F1-model_v4	AF-A0A1C1CC30-F1-model_v4 MFS domain-containing protein	1.472E-06	1.000	261	16	446	471	15	475	510	509	0.915	0.904
LOKIASV2_4345_ESMFold_MFS_transporter	AF-A0A1C1CY26-F1-model_v4	AF-A0A1C1CY26-F1-model_v4 Putative siderophore iron transporter	1.059E-06	1.000	261	11	451	471	57	580	604	555	0.936	0.868
LOKIASV2_4345_ESMFold_MFS_transporter	AF-K0EKR5-F1-model_v4	AF-K0EKR5-F1-model_v4 Major facilitator transporter	1.413E-06	1.000	260	11	447	471	7	428	453	468	0.928	0.932
LOKIASV2_4345_ESMFold_MFS_transporter	AF-Q9HVD8-F1-model_v4	AF-Q9HVD8-F1-model_v4 Probable major facilitator superfamily (MFS) transporter	2.964E-06	1.000	260	1	471	471	1	457	457	503	1.000	1.000
LOKIASV2_4345_ESMFold_MFS_transporter	AF-Q9LHQ6-F1-model_v4	AF-Q9LHQ6-F1-model_v4 Organic cation/carnitine transporter 4	7.019E-07	1.000	260	16	433	471	56	496	526	502	0.887	0.838
LOKIASV2_4345_ESMFold_MFS_transporter	AF-A0A175W660-F1-model_v4	AF-A0A175W660-F1-model_v4 Putative MFS-type transporter YusP	8.622E-07	1.000	260	1	454	471	26	525	563	549	0.964	0.888
LOKIASV2_4345_ESMFold_MFS_transporter	AF-A0A1D8PTJ9-F1-model_v4	AF-A0A1D8PTJ9-F1-model_v4 Hgt14p	2.957E-07	1.000	260	1	471	471	46	571	592	566	1.000	0.889
LOKIASV2_4345_ESMFold_MFS_transporter	AF-Q2FW71-F1-model_v4	AF-Q2FW71-F1-model_v4 Staphyloferrin A transporter	6.478E-06	1.000	259	15	456	471	3	395	397	463	0.938	0.990
LOKIASV2_4345_ESMFold_MFS_transporter	AF-Q6NT16-F1-model_v4	AF-Q6NT16-F1-model_v4 MFS-type transporter SLC18B1	1.666E-06	1.000	259	2	467	471	19	443	456	493	0.989	0.932
LOKIASV2_4345_ESMFold_MFS_transporter	AF-Q9XIH7-F1-model_v4	AF-Q9XIH7-F1-model_v4 Putative polyol transporter 1	2.724E-07	1.000	259	1	467	471	3	506	511	555	0.992	0.986
LOKIASV2_4345_ESMFold_MFS_transporter	AF-A0A0D2G873-F1-model_v4	AF-A0A0D2G873-F1-model_v4 Unplaced genomic scaffold supercont1.8, whole genome shotgun sequence	7.314E-07	1.000	259	16	471	471	70	493	512	496	0.968	0.828
