LOKIASV2_1533_ESMFold_hypothetical_protein	AF-A1TAQ3-F1-model_v4	AF-A1TAQ3-F1-model_v4 Proteasome-associated ATPase	5.355E+00	0.411	48	2	63	64	18	80	615	63	0.969	0.102
LOKIASV2_1533_ESMFold_hypothetical_protein	AF-Q17QX2-F1-model_v4	AF-Q17QX2-F1-model_v4 Zinc finger CCCH-type with G patch domain-containing protein	5.355E+00	0.326	45	3	58	64	438	496	513	59	0.875	0.115
LOKIASV2_1533_ESMFold_hypothetical_protein	AF-C5IJB0-F1-model_v4	AF-C5IJB0-F1-model_v4 Zinc finger CCCH-type with G patch domain-containing protein	5.355E+00	0.301	44	3	58	64	438	496	513	59	0.875	0.115
LOKIASV2_1533_ESMFold_hypothetical_protein	AF-Q52280-F1-model_v4	AF-Q52280-F1-model_v4 Protein KleE	4.311E+00	0.277	43	5	53	64	49	98	109	50	0.766	0.459
LOKIASV2_1533_ESMFold_hypothetical_protein	AF-Q8N5A5-F1-model_v4	AF-Q8N5A5-F1-model_v4 Zinc finger CCCH-type with G patch domain-containing protein	6.188E+00	0.277	43	3	58	64	456	514	531	59	0.875	0.111
LOKIASV2_1533_ESMFold_hypothetical_protein	AF-Q99373-F1-model_v4	AF-Q99373-F1-model_v4 Protein PET20, mitochondrial	8.884E+00	0.254	42	3	50	64	205	252	253	48	0.750	0.190
LOKIASV2_1533_ESMFold_hypothetical_protein	AF-A8GPX3-F1-model_v4	AF-A8GPX3-F1-model_v4 Serine--tRNA ligase	4.634E+00	0.214	40	3	58	64	34	88	425	56	0.875	0.129
LOKIASV2_1533_ESMFold_hypothetical_protein	AF-A2RLU3-F1-model_v4	AF-A2RLU3-F1-model_v4 Exodeoxyribonuclease 7 small subunit	4.311E+00	0.196	39	1	63	64	1	62	79	65	0.984	0.785
LOKIASV2_1533_ESMFold_hypothetical_protein	AF-A8GTQ7-F1-model_v4	AF-A8GTQ7-F1-model_v4 Serine--tRNA ligase	4.982E+00	0.196	39	1	58	64	32	88	425	58	0.906	0.134
LOKIASV2_1533_ESMFold_hypothetical_protein	AF-A7SBN6-F1-model_v4	AF-A7SBN6-F1-model_v4 Zinc finger CCCH-type with G patch domain-containing protein	2.092E+00	0.179	38	3	62	64	433	505	508	73	0.938	0.144
LOKIASV2_1533_ESMFold_hypothetical_protein	AF-P0ADK9-F1-model_v4	AF-P0ADK9-F1-model_v4 Uncharacterized protein YibL	6.652E+00	0.164	37	9	62	64	5	58	120	56	0.844	0.450
LOKIASV2_1533_ESMFold_hypothetical_protein	AF-P26376-F1-model_v4	AF-P26376-F1-model_v4 Interferon-induced transmembrane protein 3	5.757E+00	0.150	36	3	63	64	61	123	137	63	0.953	0.460
LOKIASV2_1533_ESMFold_hypothetical_protein	AF-Q5ACW6-F1-model_v4	AF-Q5ACW6-F1-model_v4 Golgi to ER traffic protein 1	6.652E+00	0.150	36	11	62	64	51	102	199	52	0.812	0.261
LOKIASV2_1533_ESMFold_hypothetical_protein	AF-B4SG04-F1-model_v4	AF-B4SG04-F1-model_v4 Acetyl-coenzyme A carboxylase carboxyl transferase subunit alpha	7.151E+00	0.126	34	9	55	64	10	55	335	47	0.734	0.137
LOKIASV2_1533_ESMFold_hypothetical_protein	AF-B0B894-F1-model_v4	AF-B0B894-F1-model_v4 50S ribosomal protein L29	4.982E+00	0.116	33	6	62	64	16	71	72	57	0.891	0.778
LOKIASV2_1533_ESMFold_hypothetical_protein	AF-A6Q0K5-F1-model_v4	AF-A6Q0K5-F1-model_v4 Calvin cycle protein CP12, chloroplastic	7.151E+00	0.116	33	16	59	64	35	78	107	44	0.688	0.411
LOKIASV2_1533_ESMFold_hypothetical_protein	AF-Q19714-F1-model_v4	AF-Q19714-F1-model_v4 Calcium load-activated calcium channel homolog	9.550E+00	0.116	33	4	62	64	28	86	186	59	0.922	0.317
LOKIASV2_1533_ESMFold_hypothetical_protein	AF-C5G729-F1-model_v4	AF-C5G729-F1-model_v4 Protein GET1	8.264E+00	0.116	33	6	63	64	41	98	206	58	0.906	0.282
LOKIASV2_1533_ESMFold_hypothetical_protein	AF-Q5M7C3-F1-model_v4	AF-Q5M7C3-F1-model_v4 Histone deacetylase complex subunit SAP130-B	9.550E+00	0.116	33	3	57	64	942	1007	1041	66	0.859	0.063
LOKIASV2_1533_ESMFold_hypothetical_protein	AF-Q28UU6-F1-model_v4	AF-Q28UU6-F1-model_v4 50S ribosomal protein L29	6.652E+00	0.106	32	6	63	64	11	67	69	58	0.906	0.826
LOKIASV2_1533_ESMFold_hypothetical_protein	AF-C5FEL7-F1-model_v4	AF-C5FEL7-F1-model_v4 Protein GET1	8.884E+00	0.106	32	5	59	64	40	94	212	55	0.859	0.259
LOKIASV2_1533_ESMFold_hypothetical_protein	AF-A1CXY5-F1-model_v4	AF-A1CXY5-F1-model_v4 Protein get1	9.550E+00	0.098	31	6	59	64	41	94	200	54	0.844	0.270
LOKIASV2_1533_ESMFold_hypothetical_protein	AF-B3EL67-F1-model_v4	AF-B3EL67-F1-model_v4 Acetyl-coenzyme A carboxylase carboxyl transferase subunit alpha	8.264E+00	0.098	31	9	64	64	10	63	335	57	0.875	0.161
LOKIASV2_1533_ESMFold_hypothetical_protein	AF-Q7VYV6-F1-model_v4	AF-Q7VYV6-F1-model_v4 Chaperone protein ClpB	6.188E+00	0.098	31	12	60	64	410	458	865	49	0.766	0.057
LOKIASV2_1533_ESMFold_hypothetical_protein	AF-Q7W9E6-F1-model_v4	AF-Q7W9E6-F1-model_v4 Chaperone protein ClpB	6.188E+00	0.098	31	12	60	64	410	458	865	49	0.766	0.057
LOKIASV2_1533_ESMFold_hypothetical_protein	AF-Q7WHB6-F1-model_v4	AF-Q7WHB6-F1-model_v4 Chaperone protein ClpB	6.188E+00	0.098	31	12	60	64	410	458	865	49	0.766	0.057
LOKIASV2_1533_ESMFold_hypothetical_protein	AF-Q9FT70-F1-model_v4	AF-Q9FT70-F1-model_v4 ATP-dependent DNA helicase Q-like 4B	7.688E+00	0.098	31	10	63	64	300	360	1150	61	0.844	0.053
LOKIASV2_1533_ESMFold_hypothetical_protein	AF-A1VIQ8-F1-model_v4	AF-A1VIQ8-F1-model_v4 50S ribosomal protein L29	4.982E+00	0.076	28	10	58	64	15	66	67	52	0.766	0.776
LOKIASV2_1533_ESMFold_hypothetical_protein	AF-A5JYQ9-F1-model_v4	AF-A5JYQ9-F1-model_v4 Vacuolar ATPase assembly integral membrane protein VMA21 homolog	5.757E+00	0.076	28	2	62	64	26	89	102	64	0.953	0.627
LOKIASV2_1533_ESMFold_hypothetical_protein	AF-B1AIQ4-F1-model_v4	AF-B1AIQ4-F1-model_v4 UPF0154 protein UPA3_0273	9.550E+00	0.069	27	4	63	64	8	64	109	60	0.938	0.523
LOKIASV2_1533_ESMFold_hypothetical_protein	AF-Q6IE21-F1-model_v4	AF-Q6IE21-F1-model_v4 OTU domain-containing protein 6A	8.264E+00	0.069	27	6	62	64	4	64	290	61	0.891	0.210
LOKIASV2_1533_ESMFold_hypothetical_protein	AF-C0HAV3-F1-model_v4	AF-C0HAV3-F1-model_v4 Zinc finger CCCH-type with G patch domain-containing protein	8.264E+00	0.069	27	3	62	64	452	521	527	70	0.938	0.133
LOKIASV2_1533_ESMFold_hypothetical_protein	AF-Q21489-F1-model_v4	AF-Q21489-F1-model_v4 ATP-dependent DNA helicase chl-1	7.688E+00	0.069	27	7	60	64	55	108	830	54	0.844	0.065
LOKIASV2_1533_ESMFold_hypothetical_protein	AF-Q9PGC1-F1-model_v4	AF-Q9PGC1-F1-model_v4 Chaperone protein ClpB	9.550E+00	0.069	27	13	58	64	412	460	861	49	0.719	0.057
LOKIASV2_1533_ESMFold_hypothetical_protein	AF-A0PW28-F1-model_v4	AF-A0PW28-F1-model_v4 Glutamyl-tRNA reductase	8.884E+00	0.063	26	3	59	64	342	403	473	62	0.891	0.131
