LOKIASV2_0831_ESMFold_MFS_transporter	AF-K0ERX1-F1-model_v4	AF-K0ERX1-F1-model_v4 Transporter	7.400E-14	1.000	645	28	477	479	15	448	452	470	0.939	0.960
LOKIASV2_0831_ESMFold_MFS_transporter	AF-Q9CCU4-F1-model_v4	AF-Q9CCU4-F1-model_v4 Putative membrane protein	1.481E-12	1.000	574	30	471	479	14	439	454	466	0.923	0.938
LOKIASV2_0831_ESMFold_MFS_transporter	AF-A0A133CGB6-F1-model_v4	AF-A0A133CGB6-F1-model_v4 MFS transporter	9.297E-11	1.000	499	26	459	479	2	387	398	443	0.906	0.970
LOKIASV2_0831_ESMFold_MFS_transporter	AF-Q6DEJ6-F1-model_v4	AF-Q6DEJ6-F1-model_v4 Sodium-dependent lysophosphatidylcholine symporter 1-B	1.046E-10	1.000	494	9	472	479	17	499	523	521	0.969	0.924
LOKIASV2_0831_ESMFold_MFS_transporter	AF-B1WBW6-F1-model_v4	AF-B1WBW6-F1-model_v4 Hypothetical LOC298504 (Predicted)	2.917E-10	1.000	467	28	472	479	41	507	534	503	0.929	0.875
LOKIASV2_0831_ESMFold_MFS_transporter	AF-Q2G1P5-F1-model_v4	AF-Q2G1P5-F1-model_v4 MFS domain-containing protein	1.817E-10	1.000	465	30	462	479	10	451	462	479	0.904	0.957
LOKIASV2_0831_ESMFold_MFS_transporter	AF-F1R3C0-F1-model_v4	AF-F1R3C0-F1-model_v4 Zgc:171501	1.966E-10	1.000	465	9	472	479	2	497	600	528	0.969	0.827
LOKIASV2_0831_ESMFold_MFS_transporter	AF-A0A2R8Q8K6-F1-model_v4	AF-A0A2R8Q8K6-F1-model_v4 Uncharacterized protein	4.159E-10	1.000	453	29	470	479	36	503	522	499	0.923	0.897
LOKIASV2_0831_ESMFold_MFS_transporter	AF-Q9DA75-F1-model_v4	AF-Q9DA75-F1-model_v4 Sodium-dependent lysophosphatidylcholine symporter 1	1.861E-09	1.000	452	1	474	479	16	509	534	531	0.990	0.925
LOKIASV2_0831_ESMFold_MFS_transporter	AF-P25744-F1-model_v4	AF-P25744-F1-model_v4 Multidrug resistance protein MdtG	2.013E-09	1.000	451	30	475	479	14	404	408	451	0.931	0.958
LOKIASV2_0831_ESMFold_MFS_transporter	AF-Q2FYJ5-F1-model_v4	AF-Q2FYJ5-F1-model_v4 Quinolone resistance protein NorB	7.513E-10	1.000	442	28	461	479	12	454	463	481	0.906	0.957
LOKIASV2_0831_ESMFold_MFS_transporter	AF-Q5AAP8-F1-model_v4	AF-Q5AAP8-F1-model_v4 MFS domain-containing protein	2.452E-09	1.000	438	9	474	479	36	461	465	474	0.973	0.916
LOKIASV2_0831_ESMFold_MFS_transporter	AF-Q55GN9-F1-model_v4	AF-Q55GN9-F1-model_v4 MFS domain-containing protein	4.500E-10	1.000	437	2	475	479	35	490	492	511	0.990	0.927
LOKIASV2_0831_ESMFold_MFS_transporter	AF-O25793-F1-model_v4	AF-O25793-F1-model_v4 Multidrug-efflux transporter	6.675E-10	1.000	436	31	463	479	7	382	443	439	0.904	0.849
LOKIASV2_0831_ESMFold_MFS_transporter	AF-A0A0R4J720-F1-model_v4	AF-A0A0R4J720-F1-model_v4 Major facilitator superfamily domain-containing 2B	2.871E-09	1.000	430	9	472	479	42	528	551	524	0.969	0.884
LOKIASV2_0831_ESMFold_MFS_transporter	AF-P71369-F1-model_v4	AF-P71369-F1-model_v4 Putative metabolite transport protein HI_1104	1.653E-09	1.000	429	31	461	479	11	397	407	446	0.900	0.951
LOKIASV2_0831_ESMFold_MFS_transporter	AF-O06171-F1-model_v4	AF-O06171-F1-model_v4 Probable conserved integral membrane leucine and alanine rich protein	1.653E-09	1.000	427	17	462	479	6	431	445	465	0.931	0.957
LOKIASV2_0831_ESMFold_MFS_transporter	AF-Q9I201-F1-model_v4	AF-Q9I201-F1-model_v4 Probable major facilitator superfamily (MFS) transporter	1.305E-09	1.000	426	28	452	479	23	411	423	432	0.887	0.920
LOKIASV2_0831_ESMFold_MFS_transporter	AF-Q0P915-F1-model_v4	AF-Q0P915-F1-model_v4 Putative MFS (Major Facilitator Superfamily) transporter protein	2.266E-09	1.000	425	27	471	479	2	394	399	453	0.929	0.985
LOKIASV2_0831_ESMFold_MFS_transporter	AF-U7PQN8-F1-model_v4	AF-U7PQN8-F1-model_v4 Uncharacterized protein	1.357E-09	1.000	425	9	471	479	14	435	444	481	0.967	0.950
LOKIASV2_0831_ESMFold_MFS_transporter	AF-A0A0P0XKZ3-F1-model_v4	AF-A0A0P0XKZ3-F1-model_v4 Os09g0371200 protein	1.254E-09	1.000	424	9	473	479	23	483	548	501	0.971	0.841
LOKIASV2_0831_ESMFold_MFS_transporter	AF-P32136-F1-model_v4	AF-P32136-F1-model_v4 Putative sulfoquinovose importer	1.114E-09	1.000	423	28	472	479	12	444	467	474	0.929	0.927
LOKIASV2_0831_ESMFold_MFS_transporter	AF-Q2FVH2-F1-model_v4	AF-Q2FVH2-F1-model_v4 Drug transporter, putative	1.861E-09	1.000	422	28	461	479	10	458	466	490	0.906	0.964
LOKIASV2_0831_ESMFold_MFS_transporter	AF-C1GWG3-F1-model_v4	AF-C1GWG3-F1-model_v4 MFS domain-containing protein	6.169E-10	1.000	421	30	472	479	19	478	490	500	0.925	0.939
LOKIASV2_0831_ESMFold_MFS_transporter	AF-Q6NLL3-F1-model_v4	AF-Q6NLL3-F1-model_v4 GH21943p	2.871E-09	1.000	414	7	477	479	218	678	705	513	0.983	0.654
LOKIASV2_0831_ESMFold_MFS_transporter	AF-A0A0D2FFS4-F1-model_v4	AF-A0A0D2FFS4-F1-model_v4 Unplaced genomic scaffold supercont1.1, whole genome shotgun sequence	1.254E-09	1.000	412	8	477	479	33	556	564	561	0.981	0.929
LOKIASV2_0831_ESMFold_MFS_transporter	AF-Q9LWT7-F1-model_v4	AF-Q9LWT7-F1-model_v4 Os06g0113900 protein	4.093E-09	1.000	411	4	464	479	73	546	585	517	0.962	0.810
LOKIASV2_0831_ESMFold_MFS_transporter	AF-A0A0D2GK76-F1-model_v4	AF-A0A0D2GK76-F1-model_v4 Unplaced genomic scaffold supercont1.3, whole genome shotgun sequence	4.429E-09	1.000	410	9	473	479	41	457	457	477	0.971	0.912
LOKIASV2_0831_ESMFold_MFS_transporter	AF-Q5A6K2-F1-model_v4	AF-Q5A6K2-F1-model_v4 Autophagy-related protein 22	1.159E-09	1.000	410	1	473	479	11	500	500	518	0.987	0.980
LOKIASV2_0831_ESMFold_MFS_transporter	AF-A0A2R8QR65-F1-model_v4	AF-A0A2R8QR65-F1-model_v4 Si:ch211-87m7.2	3.935E-09	1.000	406	9	463	479	10	440	494	481	0.950	0.872
LOKIASV2_0831_ESMFold_MFS_transporter	AF-B6TZS3-F1-model_v4	AF-B6TZS3-F1-model_v4 Uncharacterized protein	6.570E-09	1.000	406	1	479	479	64	559	593	549	1.000	0.836
LOKIASV2_0831_ESMFold_MFS_transporter	AF-A0A0D2ELG4-F1-model_v4	AF-A0A0D2ELG4-F1-model_v4 Autophagy-related protein	3.231E-09	1.000	403	12	472	479	25	521	558	517	0.962	0.891
LOKIASV2_0831_ESMFold_MFS_transporter	AF-A6NFX1-F1-model_v4	AF-A6NFX1-F1-model_v4 Major facilitator superfamily domain-containing protein 2B	7.395E-09	1.000	402	11	471	479	22	489	504	510	0.962	0.929
LOKIASV2_0831_ESMFold_MFS_transporter	AF-A0A0D2HCQ3-F1-model_v4	AF-A0A0D2HCQ3-F1-model_v4 Unplaced genomic scaffold supercont1.3, whole genome shotgun sequence	4.258E-09	1.000	402	9	465	479	23	544	567	560	0.954	0.921
LOKIASV2_0831_ESMFold_MFS_transporter	AF-Q2G199-F1-model_v4	AF-Q2G199-F1-model_v4 Drug transporter, putative	3.361E-09	1.000	401	27	461	479	5	451	458	489	0.908	0.976
LOKIASV2_0831_ESMFold_MFS_transporter	AF-I1LF67-F1-model_v4	AF-I1LF67-F1-model_v4 MFS domain-containing protein	3.637E-09	1.000	400	21	465	479	2	426	443	480	0.929	0.959
LOKIASV2_0831_ESMFold_MFS_transporter	AF-I1KTR2-F1-model_v4	AF-I1KTR2-F1-model_v4 Uncharacterized protein	1.390E-08	1.000	400	13	463	479	1	439	452	490	0.942	0.971
LOKIASV2_0831_ESMFold_MFS_transporter	AF-P59845-F1-model_v4	AF-P59845-F1-model_v4 Probable vesicular acetylcholine transporter-B	6.417E-10	1.000	400	17	475	479	25	449	493	470	0.958	0.862
LOKIASV2_0831_ESMFold_MFS_transporter	AF-O17444-F1-model_v4	AF-O17444-F1-model_v4 Vesicular acetylcholine transporter	1.071E-09	1.000	398	13	479	479	13	468	578	503	0.975	0.789
LOKIASV2_0831_ESMFold_MFS_transporter	AF-A0A0H3GVX7-F1-model_v4	AF-A0A0H3GVX7-F1-model_v4 Putative transport protein	1.981E-08	1.000	397	25	463	479	4	406	427	447	0.916	0.944
LOKIASV2_0831_ESMFold_MFS_transporter	AF-U7PNZ6-F1-model_v4	AF-U7PNZ6-F1-model_v4 MFS domain-containing protein	1.861E-09	1.000	397	24	477	479	137	687	687	572	0.948	0.802
LOKIASV2_0831_ESMFold_MFS_transporter	AF-A0A1P8AXC3-F1-model_v4	AF-A0A1P8AXC3-F1-model_v4 Major facilitator superfamily protein	1.935E-09	1.000	395	16	471	479	1	450	460	512	0.952	0.978
LOKIASV2_0831_ESMFold_MFS_transporter	AF-F4IQK9-F1-model_v4	AF-F4IQK9-F1-model_v4 Major facilitator superfamily protein	2.452E-09	1.000	394	27	471	479	13	467	473	491	0.929	0.962
LOKIASV2_0831_ESMFold_MFS_transporter	AF-Q09752-F1-model_v4	AF-Q09752-F1-model_v4 Multidrug resistance protein fnx1	4.093E-09	1.000	394	4	462	479	10	520	531	553	0.958	0.962
LOKIASV2_0831_ESMFold_MFS_transporter	AF-A0A2R8Q1P7-F1-model_v4	AF-A0A2R8Q1P7-F1-model_v4 Uncharacterized protein	5.837E-09	1.000	393	30	472	479	21	474	480	483	0.925	0.946
LOKIASV2_0831_ESMFold_MFS_transporter	AF-Q9HY47-F1-model_v4	AF-Q9HY47-F1-model_v4 Bcr/CflA family efflux transporter	9.368E-09	1.000	391	27	473	479	1	392	392	456	0.933	1.000
LOKIASV2_0831_ESMFold_MFS_transporter	AF-A0A077ZJI4-F1-model_v4	AF-A0A077ZJI4-F1-model_v4 MFS 2 domain containing protein	2.653E-09	1.000	390	28	470	479	12	443	467	477	0.925	0.925
LOKIASV2_0831_ESMFold_MFS_transporter	AF-Q8T2G9-F1-model_v4	AF-Q8T2G9-F1-model_v4 MFS domain-containing protein	1.114E-09	1.000	390	4	472	479	31	493	498	501	0.979	0.930
LOKIASV2_0831_ESMFold_MFS_transporter	AF-A0A0D2DV20-F1-model_v4	AF-A0A0D2DV20-F1-model_v4 Unplaced genomic scaffold supercont1.3, whole genome shotgun sequence	5.837E-09	1.000	390	26	462	479	2	453	525	483	0.912	0.861
LOKIASV2_0831_ESMFold_MFS_transporter	AF-Q8ZMH0-F1-model_v4	AF-Q8ZMH0-F1-model_v4 Putative permease	2.611E-08	1.000	389	26	473	479	4	401	402	453	0.935	0.990
LOKIASV2_0831_ESMFold_MFS_transporter	AF-Q2G0K4-F1-model_v4	AF-Q2G0K4-F1-model_v4 Proline/betaine transporter, putative	6.834E-09	1.000	389	25	462	479	12	426	466	462	0.914	0.891
LOKIASV2_0831_ESMFold_MFS_transporter	AF-Q8XEK9-F1-model_v4	AF-Q8XEK9-F1-model_v4 Putative permease	1.141E-08	1.000	388	33	462	479	9	381	396	447	0.898	0.942
LOKIASV2_0831_ESMFold_MFS_transporter	AF-Q08777-F1-model_v4	AF-Q08777-F1-model_v4 Riboflavin transporter MCH5	1.141E-08	1.000	388	1	474	479	80	518	521	492	0.990	0.843
LOKIASV2_0831_ESMFold_MFS_transporter	AF-A0A0D2G1Q2-F1-model_v4	AF-A0A0D2G1Q2-F1-model_v4 Unplaced genomic scaffold supercont1.8, whole genome shotgun sequence	3.935E-09	1.000	387	9	463	479	12	428	431	471	0.950	0.968
LOKIASV2_0831_ESMFold_MFS_transporter	AF-P76269-F1-model_v4	AF-P76269-F1-model_v4 Uncharacterized transporter YebQ	1.141E-08	1.000	387	23	458	479	5	446	457	486	0.910	0.967
LOKIASV2_0831_ESMFold_MFS_transporter	AF-A0A133CZJ2-F1-model_v4	AF-A0A133CZJ2-F1-model_v4 MFS transporter	4.429E-09	1.000	385	28	463	479	15	478	490	503	0.910	0.947
LOKIASV2_0831_ESMFold_MFS_transporter	AF-C0NN43-F1-model_v4	AF-C0NN43-F1-model_v4 Carboxylic acid transporter	2.013E-09	1.000	385	12	477	479	5	489	532	533	0.973	0.912
LOKIASV2_0831_ESMFold_MFS_transporter	AF-A0A3Q0KLZ6-F1-model_v4	AF-A0A3Q0KLZ6-F1-model_v4 Putative sugar transporter	2.986E-09	1.000	385	8	468	479	2	495	589	548	0.962	0.839
LOKIASV2_0831_ESMFold_MFS_transporter	AF-K0F656-F1-model_v4	AF-K0F656-F1-model_v4 Putative Multidrug resistance transporter	1.284E-08	1.000	384	30	472	479	24	481	485	505	0.925	0.944
LOKIASV2_0831_ESMFold_MFS_transporter	AF-K7ME40-F1-model_v4	AF-K7ME40-F1-model_v4 Uncharacterized protein	2.611E-08	1.000	383	13	463	479	1	439	452	487	0.942	0.971
LOKIASV2_0831_ESMFold_MFS_transporter	AF-B4FAZ2-F1-model_v4	AF-B4FAZ2-F1-model_v4 Putative peptide/nitrate transporter	1.014E-08	1.000	383	24	466	479	57	498	502	464	0.925	0.880
LOKIASV2_0831_ESMFold_MFS_transporter	AF-Q9I260-F1-model_v4	AF-Q9I260-F1-model_v4 Probable major facilitator superfamily (MFS) transporter	5.186E-09	1.000	382	32	473	479	12	470	471	500	0.923	0.975
LOKIASV2_0831_ESMFold_MFS_transporter	AF-Q9VY22-F1-model_v4	AF-Q9VY22-F1-model_v4 FI18259p1	2.452E-09	1.000	382	11	471	479	54	519	599	505	0.962	0.778
LOKIASV2_0831_ESMFold_MFS_transporter	AF-Q9V395-F1-model_v4	AF-Q9V395-F1-model_v4 BcDNA.LD28419	3.496E-09	1.000	380	9	461	479	24	475	477	494	0.946	0.948
LOKIASV2_0831_ESMFold_MFS_transporter	AF-K0F2K4-F1-model_v4	AF-K0F2K4-F1-model_v4 Bcr/CflA family efflux transporter	5.186E-09	1.000	379	25	475	479	11	415	415	470	0.942	0.976
LOKIASV2_0831_ESMFold_MFS_transporter	AF-Q7CPF6-F1-model_v4	AF-Q7CPF6-F1-model_v4 Putative L-fucose permease	2.825E-08	1.000	379	27	471	479	17	435	438	463	0.929	0.957
LOKIASV2_0831_ESMFold_MFS_transporter	AF-Q9I5M3-F1-model_v4	AF-Q9I5M3-F1-model_v4 Probable major facilitator superfamily (MFS) transporter	2.320E-08	1.000	377	24	475	479	11	433	438	463	0.944	0.966
LOKIASV2_0831_ESMFold_MFS_transporter	AF-Q9I482-F1-model_v4	AF-Q9I482-F1-model_v4 Probable major facilitator superfamily (MFS) transporter	7.109E-09	1.000	377	25	477	479	8	476	480	507	0.946	0.977
LOKIASV2_0831_ESMFold_MFS_transporter	AF-I1L4I4-F1-model_v4	AF-I1L4I4-F1-model_v4 MFS domain-containing protein	4.793E-09	1.000	377	8	462	479	44	523	543	516	0.950	0.884
LOKIASV2_0831_ESMFold_MFS_transporter	AF-X8FH22-F1-model_v4	AF-X8FH22-F1-model_v4 Major Facilitator Superfamily protein	7.692E-09	1.000	376	31	465	479	2	383	394	443	0.908	0.970
LOKIASV2_0831_ESMFold_MFS_transporter	AF-A0A0H3GPT9-F1-model_v4	AF-A0A0H3GPT9-F1-model_v4 Putative general substrate transporter	4.258E-09	1.000	376	29	463	479	39	449	456	469	0.908	0.901
LOKIASV2_0831_ESMFold_MFS_transporter	AF-Q3T9M1-F1-model_v4	AF-Q3T9M1-F1-model_v4 Major facilitator superfamily domain-containing protein 2B	2.939E-08	1.000	376	28	471	479	30	482	494	488	0.927	0.917
LOKIASV2_0831_ESMFold_MFS_transporter	AF-P50080-F1-model_v4	AF-P50080-F1-model_v4 Azole resistance protein 1	1.653E-09	1.000	376	3	463	479	28	605	613	614	0.962	0.943
LOKIASV2_0831_ESMFold_MFS_transporter	AF-P27669-F1-model_v4	AF-P27669-F1-model_v4 Membrane sensor protein UhpC	1.187E-08	1.000	375	13	479	479	14	441	442	491	0.975	0.968
LOKIASV2_0831_ESMFold_MFS_transporter	AF-A0A0K0E4U1-F1-model_v4	AF-A0A0K0E4U1-F1-model_v4 MFS domain-containing protein	2.094E-09	1.000	375	15	472	479	1	455	467	502	0.956	0.974
LOKIASV2_0831_ESMFold_MFS_transporter	AF-A0A0P0Y6M3-F1-model_v4	AF-A0A0P0Y6M3-F1-model_v4 Os12g0133000 protein	3.106E-09	1.000	374	17	460	479	32	475	488	471	0.927	0.910
LOKIASV2_0831_ESMFold_MFS_transporter	AF-A0A1D6I3B3-F1-model_v4	AF-A0A1D6I3B3-F1-model_v4 Major facilitator superfamily protein	7.395E-09	1.000	374	22	473	479	4	450	509	485	0.944	0.878
LOKIASV2_0831_ESMFold_MFS_transporter	AF-E7FCM0-F1-model_v4	AF-E7FCM0-F1-model_v4 Si:ch211-224l10.4	6.834E-09	1.000	373	79	470	479	7	434	455	451	0.818	0.941
LOKIASV2_0831_ESMFold_MFS_transporter	AF-K0F1P1-F1-model_v4	AF-K0F1P1-F1-model_v4 Drug resistance MFS transporter, drug:H+ antiporter-2 family protein	7.109E-09	1.000	373	25	475	479	5	470	478	503	0.942	0.975
LOKIASV2_0831_ESMFold_MFS_transporter	AF-Q5AN98-F1-model_v4	AF-Q5AN98-F1-model_v4 Hgt5p	3.496E-09	1.000	372	30	462	479	192	635	744	479	0.904	0.597
LOKIASV2_0831_ESMFold_MFS_transporter	AF-F4K1G9-F1-model_v4	AF-F4K1G9-F1-model_v4 Major facilitator superfamily protein	5.745E-08	1.000	370	18	462	479	2	427	438	472	0.929	0.973
LOKIASV2_0831_ESMFold_MFS_transporter	AF-U7Q7X2-F1-model_v4	AF-U7Q7X2-F1-model_v4 Uncharacterized protein	1.097E-08	1.000	370	4	474	479	113	574	576	517	0.983	0.802
LOKIASV2_0831_ESMFold_MFS_transporter	AF-Q2G2W1-F1-model_v4	AF-Q2G2W1-F1-model_v4 Drug resistance transporter, EmrB/QacA subfamily, putative	5.611E-09	1.000	370	31	472	479	140	631	643	530	0.923	0.765
LOKIASV2_0831_ESMFold_MFS_transporter	AF-Q8ZNZ6-F1-model_v4	AF-Q8ZNZ6-F1-model_v4 Putative transport protein	2.144E-08	1.000	369	27	465	479	11	454	457	487	0.916	0.972
LOKIASV2_0831_ESMFold_MFS_transporter	AF-P76350-F1-model_v4	AF-P76350-F1-model_v4 Shikimate transporter	2.716E-08	1.000	368	9	466	479	4	437	438	480	0.956	0.991
LOKIASV2_0831_ESMFold_MFS_transporter	AF-Q62666-F1-model_v4	AF-Q62666-F1-model_v4 Vesicular acetylcholine transporter	4.429E-09	1.000	368	17	479	479	15	493	530	524	0.967	0.904
LOKIASV2_0831_ESMFold_MFS_transporter	AF-P9WJX5-F1-model_v4	AF-P9WJX5-F1-model_v4 Uncharacterized MFS-type transporter Rv0849	5.309E-08	1.000	367	28	471	479	11	407	419	459	0.927	0.947
LOKIASV2_0831_ESMFold_MFS_transporter	AF-Q32BB5-F1-model_v4	AF-Q32BB5-F1-model_v4 Sialic acid transporter NanT	1.235E-08	1.000	367	9	472	479	12	475	506	523	0.969	0.917
LOKIASV2_0831_ESMFold_MFS_transporter	AF-A0A1C1CC30-F1-model_v4	AF-A0A1C1CC30-F1-model_v4 MFS domain-containing protein	3.180E-08	1.000	367	27	474	479	5	479	510	506	0.935	0.931
LOKIASV2_0831_ESMFold_MFS_transporter	AF-A0A1C1C7V7-F1-model_v4	AF-A0A1C1C7V7-F1-model_v4 Putative HC-toxin efflux carrier TOXA	1.235E-08	1.000	367	8	465	479	22	539	542	557	0.956	0.956
LOKIASV2_0831_ESMFold_MFS_transporter	AF-I1N9Z8-F1-model_v4	AF-I1N9Z8-F1-model_v4 Uncharacterized protein	7.395E-09	1.000	366	1	460	479	17	456	469	493	0.960	0.938
LOKIASV2_0831_ESMFold_MFS_transporter	AF-Q9I428-F1-model_v4	AF-Q9I428-F1-model_v4 Probable major facilitator superfamily (MFS) transporter	2.061E-08	1.000	366	27	463	479	1	490	513	524	0.912	0.955
LOKIASV2_0831_ESMFold_MFS_transporter	AF-A0A0D2HL26-F1-model_v4	AF-A0A0D2HL26-F1-model_v4 Unplaced genomic scaffold supercont1.1, whole genome shotgun sequence	8.658E-09	1.000	366	27	474	479	5	469	515	501	0.935	0.903
LOKIASV2_0831_ESMFold_MFS_transporter	AF-A0A0K0EGA3-F1-model_v4	AF-A0A0K0EGA3-F1-model_v4 MFS domain-containing protein	5.186E-09	1.000	366	10	477	479	6	481	553	523	0.977	0.861
LOKIASV2_0831_ESMFold_MFS_transporter	AF-P32137-F1-model_v4	AF-P32137-F1-model_v4 Putative 2,3-dihydroxypropane-1-sulfonate exporter	5.186E-09	1.000	365	29	470	479	16	449	461	469	0.923	0.941
LOKIASV2_0831_ESMFold_MFS_transporter	AF-C1H543-F1-model_v4	AF-C1H543-F1-model_v4 MFS domain-containing protein	2.825E-08	1.000	364	33	476	479	78	468	470	455	0.927	0.832
LOKIASV2_0831_ESMFold_MFS_transporter	AF-A0A175WCV4-F1-model_v4	AF-A0A175WCV4-F1-model_v4 Riboflavin transporter MCH5	1.504E-08	1.000	364	2	471	479	57	491	509	491	0.981	0.855
LOKIASV2_0831_ESMFold_MFS_transporter	AF-Q57U73-F1-model_v4	AF-Q57U73-F1-model_v4 MFS domain-containing protein	1.097E-08	1.000	363	15	462	479	21	453	455	488	0.935	0.952
LOKIASV2_0831_ESMFold_MFS_transporter	AF-U7PXF3-F1-model_v4	AF-U7PXF3-F1-model_v4 MFS domain-containing protein	1.564E-08	1.000	362	24	472	479	29	459	482	474	0.937	0.894
LOKIASV2_0831_ESMFold_MFS_transporter	AF-A0A0D2HAN2-F1-model_v4	AF-A0A0D2HAN2-F1-model_v4 Unplaced genomic scaffold supercont1.3, whole genome shotgun sequence	1.564E-08	1.000	362	25	470	479	110	553	562	498	0.931	0.790
LOKIASV2_0831_ESMFold_MFS_transporter	AF-Q86M88-F1-model_v4	AF-Q86M88-F1-model_v4 ComD	9.745E-09	1.000	362	25	472	479	594	1105	1175	551	0.935	0.436
LOKIASV2_0831_ESMFold_MFS_transporter	AF-A0A175WDH7-F1-model_v4	AF-A0A175WDH7-F1-model_v4 Repressible high-affinity phosphate permease	2.716E-08	1.000	361	2	464	479	6	549	654	574	0.967	0.832
LOKIASV2_0831_ESMFold_MFS_transporter	AF-K0EXC1-F1-model_v4	AF-K0EXC1-F1-model_v4 Transporter	5.186E-09	1.000	360	9	479	479	6	472	490	532	0.983	0.953
LOKIASV2_0831_ESMFold_MFS_transporter	AF-A0A1C1CQL5-F1-model_v4	AF-A0A1C1CQL5-F1-model_v4 Carboxylic acid transport protein	2.510E-08	1.000	360	20	472	479	57	490	514	476	0.946	0.844
LOKIASV2_0831_ESMFold_MFS_transporter	AF-A0A175WGU0-F1-model_v4	AF-A0A175WGU0-F1-model_v4 Putative HC-toxin efflux carrier TOXA	1.504E-08	1.000	360	27	459	479	69	558	601	530	0.904	0.815
LOKIASV2_0831_ESMFold_MFS_transporter	AF-C8VV48-F1-model_v4	AF-C8VV48-F1-model_v4 Karmoisin, isoform B	9.745E-09	1.000	360	25	465	479	74	481	612	458	0.921	0.667
LOKIASV2_0831_ESMFold_MFS_transporter	AF-Q8IIV4-F1-model_v4	AF-Q8IIV4-F1-model_v4 Metabolite/drug transporter, putative	8.521E-08	1.000	359	31	459	479	13	405	417	445	0.896	0.942
LOKIASV2_0831_ESMFold_MFS_transporter	AF-A0A0D2E6N4-F1-model_v4	AF-A0A0D2E6N4-F1-model_v4 Unplaced genomic scaffold supercont1.1, whole genome shotgun sequence	8.521E-08	1.000	359	17	479	479	29	439	439	465	0.967	0.936
LOKIASV2_0831_ESMFold_MFS_transporter	AF-Q9L7R5-F1-model_v4	AF-Q9L7R5-F1-model_v4 Putative 2,3-dihydroxypropane-1-sulfonate exporter	1.692E-08	1.000	359	29	470	479	15	448	460	469	0.923	0.943
LOKIASV2_0831_ESMFold_MFS_transporter	AF-P09836-F1-model_v4	AF-P09836-F1-model_v4 Membrane sensor protein UhpC	9.368E-09	1.000	358	20	477	479	18	438	439	491	0.956	0.959
LOKIASV2_0831_ESMFold_MFS_transporter	AF-Q9I6P2-F1-model_v4	AF-Q9I6P2-F1-model_v4 Probable major facilitator superfamily (MFS) transporter	3.106E-09	1.000	358	29	463	479	11	486	501	513	0.908	0.950
LOKIASV2_0831_ESMFold_MFS_transporter	AF-Q16572-F1-model_v4	AF-Q16572-F1-model_v4 Vesicular acetylcholine transporter	1.981E-08	1.000	358	1	479	479	4	497	532	543	1.000	0.929
LOKIASV2_0831_ESMFold_MFS_transporter	AF-Q04301-F1-model_v4	AF-Q04301-F1-model_v4 Vacuolar basic amino acid transporter 1	8.658E-09	1.000	358	11	473	479	16	562	562	578	0.967	0.973
LOKIASV2_0831_ESMFold_MFS_transporter	AF-A0A175VRW6-F1-model_v4	AF-A0A175VRW6-F1-model_v4 Carboxylic acid transporter protein	3.308E-08	1.000	357	10	462	479	50	465	526	464	0.946	0.791
LOKIASV2_0831_ESMFold_MFS_transporter	AF-C1H903-F1-model_v4	AF-C1H903-F1-model_v4 Polyamine transporter 2	1.789E-09	1.000	357	27	471	479	85	540	544	503	0.929	0.838
LOKIASV2_0831_ESMFold_MFS_transporter	AF-A0A0D2DKN9-F1-model_v4	AF-A0A0D2DKN9-F1-model_v4 Unplaced genomic scaffold supercont1.5, whole genome shotgun sequence	4.191E-08	1.000	357	28	474	479	10	481	547	501	0.933	0.863
LOKIASV2_0831_ESMFold_MFS_transporter	AF-A0A2R8PVN8-F1-model_v4	AF-A0A2R8PVN8-F1-model_v4 MFS domain-containing protein	2.178E-09	1.000	356	16	475	479	1	467	480	525	0.960	0.973
LOKIASV2_0831_ESMFold_MFS_transporter	AF-A0A077ZBU1-F1-model_v4	AF-A0A077ZBU1-F1-model_v4 Sugar tr and Osmo CC domain containing protein	2.510E-08	1.000	355	29	459	479	23	436	500	457	0.900	0.828
LOKIASV2_0831_ESMFold_MFS_transporter	AF-A0A077Z5X8-F1-model_v4	AF-A0A077Z5X8-F1-model_v4 MFS 1 domain containing protein	2.939E-08	1.000	354	20	461	479	5	417	426	467	0.923	0.969
LOKIASV2_0831_ESMFold_MFS_transporter	AF-Q8ZMA0-F1-model_v4	AF-Q8ZMA0-F1-model_v4 L-arabinose: proton symport protein	2.230E-08	1.000	354	15	477	479	11	469	472	509	0.967	0.972
LOKIASV2_0831_ESMFold_MFS_transporter	AF-K7KJQ6-F1-model_v4	AF-K7KJQ6-F1-model_v4 MFS domain-containing protein	4.534E-08	1.000	354	18	463	479	29	476	478	473	0.931	0.937
LOKIASV2_0831_ESMFold_MFS_transporter	AF-U7PHC3-F1-model_v4	AF-U7PHC3-F1-model_v4 MFS domain-containing protein	3.441E-08	1.000	354	25	474	479	102	496	501	456	0.939	0.788
LOKIASV2_0831_ESMFold_MFS_transporter	AF-O35304-F1-model_v4	AF-O35304-F1-model_v4 Vesicular acetylcholine transporter	1.014E-08	1.000	354	17	471	479	15	483	530	514	0.950	0.885
LOKIASV2_0831_ESMFold_MFS_transporter	AF-A0A0H3GVC9-F1-model_v4	AF-A0A0H3GVC9-F1-model_v4 Transporter, major facilitator family	1.564E-08	1.000	353	26	475	479	6	406	406	457	0.939	0.988
LOKIASV2_0831_ESMFold_MFS_transporter	AF-A0A1D6JL79-F1-model_v4	AF-A0A1D6JL79-F1-model_v4 Major facilitator superfamily protein	1.905E-08	1.000	353	15	472	479	100	515	526	475	0.956	0.791
LOKIASV2_0831_ESMFold_MFS_transporter	AF-Q0P9W1-F1-model_v4	AF-Q0P9W1-F1-model_v4 Putative 2-acylglycerophosphoethanolamine acyltransferase / acyl-acyl carrier protein synthetase	7.570E-08	1.000	353	31	471	479	14	425	1170	452	0.921	0.352
LOKIASV2_0831_ESMFold_MFS_transporter	AF-K0EZU5-F1-model_v4	AF-K0EZU5-F1-model_v4 General substrate transporter	2.939E-08	1.000	352	30	475	479	28	474	475	486	0.931	0.941
LOKIASV2_0831_ESMFold_MFS_transporter	AF-Q961H2-F1-model_v4	AF-Q961H2-F1-model_v4 GH23453p	5.976E-08	1.000	352	27	476	479	51	502	507	496	0.939	0.892
LOKIASV2_0831_ESMFold_MFS_transporter	AF-K0ERK5-F1-model_v4	AF-K0ERK5-F1-model_v4 Major facilitator superfamily protein	7.109E-09	1.000	352	1	477	479	1	510	516	563	0.996	0.988
LOKIASV2_0831_ESMFold_MFS_transporter	AF-A0A0D2F9K3-F1-model_v4	AF-A0A0D2F9K3-F1-model_v4 Unplaced genomic scaffold supercont1.2, whole genome shotgun sequence	3.308E-08	1.000	352	28	475	479	6	474	519	503	0.935	0.904
LOKIASV2_0831_ESMFold_MFS_transporter	AF-A0A0H3GQC8-F1-model_v4	AF-A0A0H3GQC8-F1-model_v4 Proline/glycine betaine transporter	2.230E-08	1.000	351	30	459	479	25	436	500	459	0.898	0.824
LOKIASV2_0831_ESMFold_MFS_transporter	AF-P23586-F1-model_v4	AF-P23586-F1-model_v4 Sugar transport protein 1	2.061E-08	1.000	351	32	461	479	23	473	522	481	0.898	0.864
LOKIASV2_0831_ESMFold_MFS_transporter	AF-A0A0H3GXW7-F1-model_v4	AF-A0A0H3GXW7-F1-model_v4 Lysophospholipid transporter LplT	3.441E-08	1.000	350	1	460	479	1	396	397	471	0.960	0.997
LOKIASV2_0831_ESMFold_MFS_transporter	AF-C1GV11-F1-model_v4	AF-C1GV11-F1-model_v4 MFS domain-containing protein	5.745E-08	1.000	350	26	473	479	10	476	482	512	0.935	0.969
LOKIASV2_0831_ESMFold_MFS_transporter	AF-A0A0R0J555-F1-model_v4	AF-A0A0R0J555-F1-model_v4 MFS domain-containing protein	3.057E-08	1.000	350	28	461	479	20	473	518	482	0.906	0.876
LOKIASV2_0831_ESMFold_MFS_transporter	AF-P44699-F1-model_v4	AF-P44699-F1-model_v4 Putative metabolite transport protein HI_0418	9.976E-08	1.000	349	26	463	479	17	440	447	470	0.914	0.949
LOKIASV2_0831_ESMFold_MFS_transporter	AF-K0F8X2-F1-model_v4	AF-K0F8X2-F1-model_v4 Major facilitator permease	2.611E-08	1.000	349	15	475	479	5	475	482	522	0.962	0.977
LOKIASV2_0831_ESMFold_MFS_transporter	AF-I1LVZ1-F1-model_v4	AF-I1LVZ1-F1-model_v4 MFS domain-containing protein	4.985E-09	1.000	349	31	476	479	24	494	502	505	0.931	0.938
LOKIASV2_0831_ESMFold_MFS_transporter	AF-U7PU61-F1-model_v4	AF-U7PU61-F1-model_v4 MFS domain-containing protein	5.309E-08	1.000	349	17	478	479	21	475	512	496	0.965	0.889
LOKIASV2_0831_ESMFold_MFS_transporter	AF-A0A175W4N4-F1-model_v4	AF-A0A175W4N4-F1-model_v4 Riboflavin transporter MCH5	3.723E-08	1.000	349	28	462	479	103	511	518	461	0.908	0.790
LOKIASV2_0831_ESMFold_MFS_transporter	AF-A0A0N4U726-F1-model_v4	AF-A0A0N4U726-F1-model_v4 MFS domain-containing protein	2.413E-08	1.000	349	10	479	479	5	474	530	523	0.981	0.887
LOKIASV2_0831_ESMFold_MFS_transporter	AF-A0A0D2DUW2-F1-model_v4	AF-A0A0D2DUW2-F1-model_v4 Unplaced genomic scaffold supercont1.3, whole genome shotgun sequence	5.976E-08	1.000	349	11	463	479	12	565	595	592	0.946	0.931
LOKIASV2_0831_ESMFold_MFS_transporter	AF-A0A0H3H4S0-F1-model_v4	AF-A0A0H3H4S0-F1-model_v4 Regulatory protein UhpC	1.390E-08	1.000	348	15	475	479	16	437	442	485	0.962	0.955
LOKIASV2_0831_ESMFold_MFS_transporter	AF-A0A0D2E2J1-F1-model_v4	AF-A0A0D2E2J1-F1-model_v4 Unplaced genomic scaffold supercont1.2, whole genome shotgun sequence	1.905E-08	1.000	348	1	474	479	23	460	464	506	0.990	0.944
LOKIASV2_0831_ESMFold_MFS_transporter	AF-Q18152-F1-model_v4	AF-Q18152-F1-model_v4 Uncharacterized protein	5.523E-08	1.000	348	11	472	479	2	490	492	524	0.965	0.994
