LOKIASV2_4345_ESMFold_MFS_transporter	AF-B1WBW6-F1-model_v4	AF-B1WBW6-F1-model_v4 Hypothetical LOC298504 (Predicted)	3.128E-19	1.000	977	1	470	471	27	534	534	512	0.998	0.951
LOKIASV2_4345_ESMFold_MFS_transporter	AF-Q9DA75-F1-model_v4	AF-Q9DA75-F1-model_v4 Sodium-dependent lysophosphatidylcholine symporter 1	4.919E-19	1.000	966	6	470	471	34	534	534	505	0.987	0.938
LOKIASV2_4345_ESMFold_MFS_transporter	AF-Q8NA29-F1-model_v4	AF-Q8NA29-F1-model_v4 Sodium-dependent lysophosphatidylcholine symporter 1	5.566E-19	1.000	954	1	470	471	30	543	543	521	0.998	0.947
LOKIASV2_4345_ESMFold_MFS_transporter	AF-A0A0H3GNB4-F1-model_v4	AF-A0A0H3GNB4-F1-model_v4 Putative permease of the Na+:galactoside symporter family	5.126E-19	1.000	953	11	467	471	5	463	468	468	0.970	0.981
LOKIASV2_4345_ESMFold_MFS_transporter	AF-A0A0R4J720-F1-model_v4	AF-A0A0R4J720-F1-model_v4 Major facilitator superfamily domain-containing 2B	5.126E-19	1.000	951	2	465	471	44	550	551	513	0.985	0.920
LOKIASV2_4345_ESMFold_MFS_transporter	AF-H9L454-F1-model_v4	AF-H9L454-F1-model_v4 Putative permease of the Na+:galactoside symporter family	9.120E-19	1.000	937	11	467	471	5	464	468	468	0.970	0.983
LOKIASV2_4345_ESMFold_MFS_transporter	AF-Q6DEJ6-F1-model_v4	AF-Q6DEJ6-F1-model_v4 Sodium-dependent lysophosphatidylcholine symporter 1-B	6.297E-19	1.000	927	1	464	471	13	521	523	519	0.985	0.973
LOKIASV2_4345_ESMFold_MFS_transporter	AF-P75683-F1-model_v4	AF-P75683-F1-model_v4 Putative glycoside/cation symporter YagG	6.852E-18	1.000	901	11	453	471	3	447	460	452	0.941	0.967
LOKIASV2_4345_ESMFold_MFS_transporter	AF-A0A0H3H4M0-F1-model_v4	AF-A0A0H3H4M0-F1-model_v4 Putative transporter	2.255E-18	1.000	899	8	471	471	2	458	464	479	0.985	0.985
LOKIASV2_4345_ESMFold_MFS_transporter	AF-P31435-F1-model_v4	AF-P31435-F1-model_v4 Inner membrane symporter YicJ	5.812E-18	1.000	896	12	460	471	6	459	460	465	0.953	0.987
LOKIASV2_4345_ESMFold_MFS_transporter	AF-Q8ZKR3-F1-model_v4	AF-Q8ZKR3-F1-model_v4 Putative permease of the Na+:galactoside symporter family	1.078E-17	1.000	890	11	448	471	2	441	444	450	0.930	0.991
LOKIASV2_4345_ESMFold_MFS_transporter	AF-A0A077Z405-F1-model_v4	AF-A0A077Z405-F1-model_v4 MFS 2 and Gal mutarotas 2 and Glyco hydro 31 doma in containing protein	2.894E-17	1.000	886	6	448	471	19	463	1238	455	0.941	0.359
LOKIASV2_4345_ESMFold_MFS_transporter	AF-Q7CPH1-F1-model_v4	AF-Q7CPH1-F1-model_v4 Putative GPH family transport protein	3.009E-18	1.000	882	12	460	471	6	459	460	464	0.953	0.987
LOKIASV2_4345_ESMFold_MFS_transporter	AF-A0A0H3H346-F1-model_v4	AF-A0A0H3H346-F1-model_v4 Putative permease of the Na+:galactoside symporter family	8.079E-18	1.000	864	7	456	471	2	460	472	470	0.955	0.972
LOKIASV2_4345_ESMFold_MFS_transporter	AF-F1R3C0-F1-model_v4	AF-F1R3C0-F1-model_v4 Zgc:171501	5.365E-17	1.000	846	5	471	471	30	510	600	499	0.992	0.802
LOKIASV2_4345_ESMFold_MFS_transporter	AF-A0A4U3XEM6-F1-model_v4	AF-A0A4U3XEM6-F1-model_v4 MFS transporter	4.191E-17	1.000	842	9	450	471	2	457	458	462	0.938	0.996
LOKIASV2_4345_ESMFold_MFS_transporter	AF-Q8ZRZ1-F1-model_v4	AF-Q8ZRZ1-F1-model_v4 Putative sodium galactoside symporter	9.160E-17	1.000	839	1	452	471	5	451	457	462	0.960	0.978
LOKIASV2_4345_ESMFold_MFS_transporter	AF-A0A133CZM6-F1-model_v4	AF-A0A133CZM6-F1-model_v4 MFS transporter	3.142E-17	1.000	826	1	451	471	8	471	472	469	0.958	0.983
LOKIASV2_4345_ESMFold_MFS_transporter	AF-A0A077ZJI4-F1-model_v4	AF-A0A077ZJI4-F1-model_v4 MFS 2 domain containing protein	1.498E-17	1.000	825	1	464	471	1	466	467	477	0.985	0.998
LOKIASV2_4345_ESMFold_MFS_transporter	AF-A0A2R8Q8K6-F1-model_v4	AF-A0A2R8Q8K6-F1-model_v4 Uncharacterized protein	7.770E-17	1.000	821	2	450	471	23	512	522	498	0.953	0.939
LOKIASV2_4345_ESMFold_MFS_transporter	AF-A0A2R8RHV2-F1-model_v4	AF-A0A2R8RHV2-F1-model_v4 Uncharacterized protein	1.273E-16	1.000	812	1	446	471	1	498	508	499	0.947	0.980
LOKIASV2_4345_ESMFold_MFS_transporter	AF-P32136-F1-model_v4	AF-P32136-F1-model_v4 Putative sulfoquinovose importer	3.411E-17	1.000	810	1	464	471	1	466	467	481	0.985	0.998
LOKIASV2_4345_ESMFold_MFS_transporter	AF-Q9L7R4-F1-model_v4	AF-Q9L7R4-F1-model_v4 Putative sulfoquinovose importer	1.498E-17	1.000	797	1	467	471	1	466	473	482	0.992	0.985
LOKIASV2_4345_ESMFold_MFS_transporter	AF-A0A2R8QBJ5-F1-model_v4	AF-A0A2R8QBJ5-F1-model_v4 Uncharacterized protein	8.810E-16	1.000	770	1	450	471	1	503	509	514	0.955	0.988
LOKIASV2_4345_ESMFold_MFS_transporter	AF-Q9L7R5-F1-model_v4	AF-Q9L7R5-F1-model_v4 Putative 2,3-dihydroxypropane-1-sulfonate exporter	9.946E-17	1.000	769	1	459	471	1	459	460	479	0.975	0.998
LOKIASV2_4345_ESMFold_MFS_transporter	AF-A0A077ZG05-F1-model_v4	AF-A0A077ZG05-F1-model_v4 MFS 2 domain containing protein	1.770E-16	1.000	763	1	456	471	1	460	461	476	0.968	0.998
LOKIASV2_4345_ESMFold_MFS_transporter	AF-P32137-F1-model_v4	AF-P32137-F1-model_v4 Putative 2,3-dihydroxypropane-1-sulfonate exporter	1.921E-16	1.000	748	1	456	471	1	460	461	480	0.968	0.998
LOKIASV2_4345_ESMFold_MFS_transporter	AF-A0A0H3GM44-F1-model_v4	AF-A0A0H3GM44-F1-model_v4 Melibiose:sodium symporter	8.810E-16	1.000	729	11	453	471	2	454	471	468	0.941	0.962
LOKIASV2_4345_ESMFold_MFS_transporter	AF-A0A0H3GNY0-F1-model_v4	AF-A0A0H3GNY0-F1-model_v4 Putative sugar transport protein	7.489E-15	1.000	716	40	456	471	2	410	427	424	0.885	0.958
LOKIASV2_4345_ESMFold_MFS_transporter	AF-P0CE44-F1-model_v4	AF-P0CE44-F1-model_v4 Glucuronide carrier protein homolog	6.338E-16	1.000	713	10	464	471	3	456	457	467	0.966	0.993
LOKIASV2_4345_ESMFold_MFS_transporter	AF-Q54SX3-F1-model_v4	AF-Q54SX3-F1-model_v4 Uncharacterized protein	6.882E-16	1.000	713	4	453	471	60	536	544	481	0.955	0.877
LOKIASV2_4345_ESMFold_MFS_transporter	AF-A0A0G2JUB6-F1-model_v4	AF-A0A0G2JUB6-F1-model_v4 Major facilitator superfamily domain-containing 13A	2.179E-15	1.000	705	16	459	471	15	516	517	512	0.943	0.971
LOKIASV2_4345_ESMFold_MFS_transporter	AF-P30878-F1-model_v4	AF-P30878-F1-model_v4 Melibiose carrier protein	3.288E-15	1.000	702	12	452	471	3	453	476	465	0.936	0.947
LOKIASV2_4345_ESMFold_MFS_transporter	AF-Q5U3U7-F1-model_v4	AF-Q5U3U7-F1-model_v4 Sodium-dependent lysophosphatidylcholine symporter 1-A	2.906E-15	1.000	691	1	471	471	28	528	532	514	1.000	0.942
LOKIASV2_4345_ESMFold_MFS_transporter	AF-D4A482-F1-model_v4	AF-D4A482-F1-model_v4 Major facilitator superfamily domain-containing 2B	1.852E-14	1.000	690	1	455	471	16	492	494	487	0.966	0.966
LOKIASV2_4345_ESMFold_MFS_transporter	AF-Q6PDE8-F1-model_v4	AF-Q6PDE8-F1-model_v4 Transmembrane protein 180	1.447E-14	1.000	667	16	459	471	15	518	519	517	0.943	0.971
LOKIASV2_4345_ESMFold_MFS_transporter	AF-A0A0H3GIH6-F1-model_v4	AF-A0A0H3GIH6-F1-model_v4 Uncharacterized protein	2.184E-14	1.000	665	12	446	471	11	474	479	479	0.924	0.969
LOKIASV2_4345_ESMFold_MFS_transporter	AF-E7FCM0-F1-model_v4	AF-E7FCM0-F1-model_v4 Si:ch211-224l10.4	1.388E-14	1.000	662	49	460	471	2	453	455	458	0.875	0.993
LOKIASV2_4345_ESMFold_MFS_transporter	AF-Q5PRC2-F1-model_v4	AF-Q5PRC2-F1-model_v4 Major facilitator superfamily domain-containing 13A	1.637E-14	1.000	649	10	457	471	10	498	504	505	0.951	0.970
LOKIASV2_4345_ESMFold_MFS_transporter	AF-A0A2R8RNG9-F1-model_v4	AF-A0A2R8RNG9-F1-model_v4 Uncharacterized protein	1.930E-14	1.000	619	1	461	471	18	523	524	516	0.979	0.966
LOKIASV2_4345_ESMFold_MFS_transporter	AF-Q32FG0-F1-model_v4	AF-Q32FG0-F1-model_v4 Glucuronide permease	2.476E-13	1.000	607	29	465	471	6	432	433	449	0.928	0.986
LOKIASV2_4345_ESMFold_MFS_transporter	AF-H2KZ27-F1-model_v4	AF-H2KZ27-F1-model_v4 Major Facilitator Superfamily Domain containing homolog	7.522E-13	1.000	550	15	430	471	10	488	507	495	0.883	0.945
LOKIASV2_4345_ESMFold_MFS_transporter	AF-H2KZU5-F1-model_v4	AF-H2KZU5-F1-model_v4 Major Facilitator Superfamily Domain containing homolog	4.415E-12	1.000	538	16	433	471	4	455	468	466	0.887	0.966
LOKIASV2_4345_ESMFold_MFS_transporter	AF-F1QZ62-F1-model_v4	AF-F1QZ62-F1-model_v4 Zgc:171489	1.135E-12	1.000	528	10	438	471	2	451	460	464	0.911	0.978
LOKIASV2_4345_ESMFold_MFS_transporter	AF-Q8I3H5-F1-model_v4	AF-Q8I3H5-F1-model_v4 Sugar transporter, putative	2.386E-11	1.000	491	3	448	471	58	519	548	477	0.947	0.843
LOKIASV2_4345_ESMFold_MFS_transporter	AF-G4VA06-F1-model_v4	AF-G4VA06-F1-model_v4 Transporter spinster-related	1.398E-11	1.000	479	1	455	471	20	467	496	492	0.966	0.903
LOKIASV2_4345_ESMFold_MFS_transporter	AF-A0A2K6VQY6-F1-model_v4	AF-A0A2K6VQY6-F1-model_v4 Uncharacterized protein	6.958E-11	1.000	455	12	432	471	1	448	463	461	0.894	0.968
LOKIASV2_4345_ESMFold_MFS_transporter	AF-Q54XU7-F1-model_v4	AF-Q54XU7-F1-model_v4 MFS domain-containing protein	5.228E-10	1.000	438	1	434	471	78	499	512	461	0.921	0.824
LOKIASV2_4345_ESMFold_MFS_transporter	AF-A0A3P7DVN9-F1-model_v4	AF-A0A3P7DVN9-F1-model_v4 Uncharacterized protein	1.401E-10	1.000	433	12	454	471	3	464	465	489	0.941	0.994
LOKIASV2_4345_ESMFold_MFS_transporter	AF-A0A1L1SUA2-F1-model_v4	AF-A0A1L1SUA2-F1-model_v4 Major facilitator superfamily domain-containing 13B	1.463E-09	1.000	432	16	437	471	9	448	455	455	0.896	0.967
LOKIASV2_4345_ESMFold_MFS_transporter	AF-Q54GH6-F1-model_v4	AF-Q54GH6-F1-model_v4 MFS domain-containing protein	2.029E-10	1.000	430	8	470	471	38	492	514	493	0.983	0.885
LOKIASV2_4345_ESMFold_MFS_transporter	AF-A0A158Q435-F1-model_v4	AF-A0A158Q435-F1-model_v4 MFS domain-containing protein	5.228E-10	1.000	428	26	452	471	2	428	429	466	0.907	0.995
LOKIASV2_4345_ESMFold_MFS_transporter	AF-A0A5K4FE40-F1-model_v4	AF-A0A5K4FE40-F1-model_v4 Uncharacterized protein	1.404E-09	1.000	420	12	453	471	3	591	592	613	0.938	0.995
LOKIASV2_4345_ESMFold_MFS_transporter	AF-I1KTR2-F1-model_v4	AF-I1KTR2-F1-model_v4 Uncharacterized protein	3.769E-09	1.000	406	1	437	471	1	442	452	472	0.928	0.978
LOKIASV2_4345_ESMFold_MFS_transporter	AF-F1M4E3-F1-model_v4	AF-F1M4E3-F1-model_v4 Major facilitator superfamily domain-containing 12	1.010E-09	1.000	403	1	437	471	1	468	476	480	0.928	0.983
LOKIASV2_4345_ESMFold_MFS_transporter	AF-K7ME40-F1-model_v4	AF-K7ME40-F1-model_v4 Uncharacterized protein	2.944E-09	1.000	402	1	437	471	1	442	452	471	0.928	0.978
LOKIASV2_4345_ESMFold_MFS_transporter	AF-A0A077Z946-F1-model_v4	AF-A0A077Z946-F1-model_v4 MFS 2 domain containing protein	9.321E-09	1.000	399	11	365	471	2	370	383	380	0.754	0.963
LOKIASV2_4345_ESMFold_MFS_transporter	AF-Q2FVB6-F1-model_v4	AF-Q2FVB6-F1-model_v4 MFS domain-containing protein	5.927E-09	1.000	388	11	438	471	1	385	387	444	0.909	0.995
LOKIASV2_4345_ESMFold_MFS_transporter	AF-Q8ZN22-F1-model_v4	AF-Q8ZN22-F1-model_v4 Putative permease	3.769E-09	1.000	387	11	446	471	2	397	398	447	0.926	0.995
LOKIASV2_4345_ESMFold_MFS_transporter	AF-Q5SR56-F1-model_v4	AF-Q5SR56-F1-model_v4 Hippocampus abundant transcript-like protein 1	1.347E-09	1.000	387	1	437	471	21	454	506	462	0.928	0.858
LOKIASV2_4345_ESMFold_MFS_transporter	AF-A0A1D6EZJ3-F1-model_v4	AF-A0A1D6EZJ3-F1-model_v4 Major facilitator superfamily protein	4.630E-09	1.000	382	10	431	471	53	480	497	460	0.896	0.861
LOKIASV2_4345_ESMFold_MFS_transporter	AF-F1M4T5-F1-model_v4	AF-F1M4T5-F1-model_v4 Similar to F28B3.5a	2.402E-08	1.000	382	14	432	471	66	502	514	448	0.890	0.850
LOKIASV2_4345_ESMFold_MFS_transporter	AF-Q3U481-F1-model_v4	AF-Q3U481-F1-model_v4 Major facilitator superfamily domain-containing protein 12	2.602E-09	1.000	381	1	438	471	1	469	476	484	0.930	0.985
LOKIASV2_4345_ESMFold_MFS_transporter	AF-A0A1D6IHU8-F1-model_v4	AF-A0A1D6IHU8-F1-model_v4 Major facilitator superfamily protein	5.688E-09	1.000	375	10	431	471	29	433	452	458	0.896	0.896
LOKIASV2_4345_ESMFold_MFS_transporter	AF-C0NMS9-F1-model_v4	AF-C0NMS9-F1-model_v4 Uncharacterized protein	3.617E-09	1.000	374	2	470	471	37	474	537	490	0.996	0.816
LOKIASV2_4345_ESMFold_MFS_transporter	AF-Q0PC91-F1-model_v4	AF-Q0PC91-F1-model_v4 Bcr/CflA family efflux transporter	4.453E-08	1.000	370	4	430	471	1	392	400	440	0.907	0.980
LOKIASV2_4345_ESMFold_MFS_transporter	AF-A0A0K0EGN8-F1-model_v4	AF-A0A0K0EGN8-F1-model_v4 Uncharacterized protein	1.407E-08	1.000	369	15	451	471	50	511	515	486	0.928	0.897
LOKIASV2_4345_ESMFold_MFS_transporter	AF-Q329E8-F1-model_v4	AF-Q329E8-F1-model_v4 Regulator of uhpT	5.239E-09	1.000	368	16	432	471	33	431	440	454	0.885	0.907
LOKIASV2_4345_ESMFold_MFS_transporter	AF-Q8K0H7-F1-model_v4	AF-Q8K0H7-F1-model_v4 Solute carrier family 45 member 3	1.801E-08	1.000	368	16	441	471	17	550	553	563	0.904	0.966
LOKIASV2_4345_ESMFold_MFS_transporter	AF-A0A5K4F3E0-F1-model_v4	AF-A0A5K4F3E0-F1-model_v4 Uncharacterized protein	4.630E-09	1.000	367	12	471	471	1	571	605	610	0.977	0.944
LOKIASV2_4345_ESMFold_MFS_transporter	AF-Q8L7S2-F1-model_v4	AF-Q8L7S2-F1-model_v4 AT3g60070/T2O9_50	2.037E-08	1.000	366	2	437	471	11	450	462	471	0.926	0.952
LOKIASV2_4345_ESMFold_MFS_transporter	AF-Q8L7Z7-F1-model_v4	AF-Q8L7Z7-F1-model_v4 AT3g60070/T2O9_50	9.321E-09	1.000	363	1	448	471	1	457	458	483	0.951	0.998
LOKIASV2_4345_ESMFold_MFS_transporter	AF-I1MAS9-F1-model_v4	AF-I1MAS9-F1-model_v4 MFS domain-containing protein	9.321E-09	1.000	362	14	471	471	1	482	503	515	0.972	0.958
LOKIASV2_4345_ESMFold_MFS_transporter	AF-Q9I2J6-F1-model_v4	AF-Q9I2J6-F1-model_v4 Probable major facilitator superfamily (MFS) transporter	1.592E-08	1.000	361	1	426	471	1	386	403	449	0.904	0.958
LOKIASV2_4345_ESMFold_MFS_transporter	AF-C1HAT0-F1-model_v4	AF-C1HAT0-F1-model_v4 Carboxylic acid transport protein	1.145E-08	1.000	358	16	428	471	72	463	544	431	0.877	0.721
LOKIASV2_4345_ESMFold_MFS_transporter	AF-C0PHD3-F1-model_v4	AF-C0PHD3-F1-model_v4 Major facilitator superfamily protein	3.769E-09	1.000	356	17	466	471	9	466	486	488	0.955	0.942
LOKIASV2_4345_ESMFold_MFS_transporter	AF-P09836-F1-model_v4	AF-P09836-F1-model_v4 Membrane sensor protein UhpC	2.305E-08	1.000	355	16	432	471	32	430	439	450	0.885	0.909
LOKIASV2_4345_ESMFold_MFS_transporter	AF-A0A0H3GPT9-F1-model_v4	AF-A0A0H3GPT9-F1-model_v4 Putative general substrate transporter	2.402E-08	1.000	355	1	431	471	19	446	456	464	0.915	0.939
LOKIASV2_4345_ESMFold_MFS_transporter	AF-B1H293-F1-model_v4	AF-B1H293-F1-model_v4 Hippocampus abundant gene transcript 1	1.145E-08	1.000	354	7	444	471	27	460	490	464	0.930	0.886
LOKIASV2_4345_ESMFold_MFS_transporter	AF-B2RYH9-F1-model_v4	AF-B2RYH9-F1-model_v4 Hippocampus abundant transcript-like protein 1	8.946E-09	1.000	353	17	437	471	47	456	507	441	0.894	0.809
LOKIASV2_4345_ESMFold_MFS_transporter	AF-P34711-F1-model_v4	AF-P34711-F1-model_v4 Vesicular acetylcholine transporter unc-17	4.453E-08	1.000	353	15	471	471	31	475	532	502	0.970	0.836
LOKIASV2_4345_ESMFold_MFS_transporter	AF-F1R4M7-F1-model_v4	AF-F1R4M7-F1-model_v4 Zgc:77158	4.453E-08	1.000	352	11	440	471	1	550	551	576	0.913	0.998
LOKIASV2_4345_ESMFold_MFS_transporter	AF-K0F416-F1-model_v4	AF-K0F416-F1-model_v4 Transmembrane transport protein	2.503E-08	1.000	351	16	433	471	12	387	410	428	0.887	0.917
LOKIASV2_4345_ESMFold_MFS_transporter	AF-A0A0P0XKZ3-F1-model_v4	AF-A0A0P0XKZ3-F1-model_v4 Os09g0371200 protein	9.321E-09	1.000	351	1	467	471	20	496	548	512	0.992	0.870
LOKIASV2_4345_ESMFold_MFS_transporter	AF-Q9I224-F1-model_v4	AF-Q9I224-F1-model_v4 MFS domain-containing protein	3.936E-08	1.000	350	1	430	471	1	408	427	461	0.913	0.956
LOKIASV2_4345_ESMFold_MFS_transporter	AF-Q6NUT3-F1-model_v4	AF-Q6NUT3-F1-model_v4 Major facilitator superfamily domain-containing protein 12	1.193E-08	1.000	350	2	438	471	7	473	480	481	0.928	0.973
LOKIASV2_4345_ESMFold_MFS_transporter	AF-Q96JT2-F1-model_v4	AF-Q96JT2-F1-model_v4 Solute carrier family 45 member 3	5.039E-08	1.000	350	16	447	471	17	549	553	567	0.917	0.964
LOKIASV2_4345_ESMFold_MFS_transporter	AF-A0A132YYH9-F1-model_v4	AF-A0A132YYH9-F1-model_v4 Major facilitator superfamily transporter	1.662E-07	1.000	349	10	430	471	3	392	394	443	0.894	0.990
LOKIASV2_4345_ESMFold_MFS_transporter	AF-K0ERK5-F1-model_v4	AF-K0ERK5-F1-model_v4 Major facilitator superfamily protein	5.459E-09	1.000	349	1	450	471	1	491	516	528	0.955	0.952
LOKIASV2_4345_ESMFold_MFS_transporter	AF-P77549-F1-model_v4	AF-P77549-F1-model_v4 Uncharacterized MFS-type transporter YfcJ	1.196E-07	1.000	348	15	436	471	15	392	392	430	0.896	0.964
LOKIASV2_4345_ESMFold_MFS_transporter	AF-A0A0D2GV33-F1-model_v4	AF-A0A0D2GV33-F1-model_v4 Unplaced genomic scaffold supercont1.7, whole genome shotgun sequence	7.907E-09	1.000	348	1	449	471	16	475	506	498	0.953	0.909
LOKIASV2_4345_ESMFold_MFS_transporter	AF-A2CER7-F1-model_v4	AF-A2CER7-F1-model_v4 Protein spinster homolog 3	4.825E-09	1.000	347	1	451	471	31	483	498	490	0.958	0.910
LOKIASV2_4345_ESMFold_MFS_transporter	AF-Q91VM4-F1-model_v4	AF-Q91VM4-F1-model_v4 Protein spinster homolog 2	8.239E-09	1.000	347	1	459	471	81	539	549	498	0.975	0.836
LOKIASV2_4345_ESMFold_MFS_transporter	AF-Q8CIA9-F1-model_v4	AF-Q8CIA9-F1-model_v4 Hippocampus abundant transcript-like protein 1	5.239E-09	1.000	346	6	437	471	28	456	507	461	0.917	0.846
LOKIASV2_4345_ESMFold_MFS_transporter	AF-A0A3Q0KI28-F1-model_v4	AF-A0A3Q0KI28-F1-model_v4 MFS domain-containing protein	5.688E-09	1.000	346	1	448	471	13	462	777	487	0.951	0.579
LOKIASV2_4345_ESMFold_MFS_transporter	AF-A0A0H3GRF1-F1-model_v4	AF-A0A0H3GRF1-F1-model_v4 Multidrug resistance protein MdtG	5.250E-08	1.000	345	6	438	471	2	400	408	455	0.919	0.978
LOKIASV2_4345_ESMFold_MFS_transporter	AF-Q9I201-F1-model_v4	AF-Q9I201-F1-model_v4 Probable major facilitator superfamily (MFS) transporter	3.339E-08	1.000	345	12	428	471	21	412	423	443	0.885	0.927
LOKIASV2_4345_ESMFold_MFS_transporter	AF-A0A0H3GTB8-F1-model_v4	AF-A0A0H3GTB8-F1-model_v4 Purine ribonucleoside efflux pump NepI	1.196E-07	1.000	344	1	431	471	5	388	412	436	0.915	0.932
LOKIASV2_4345_ESMFold_MFS_transporter	AF-Q0D566-F1-model_v4	AF-Q0D566-F1-model_v4 Os07g0578200 protein	5.039E-08	1.000	344	1	431	471	1	437	454	473	0.915	0.963
LOKIASV2_4345_ESMFold_MFS_transporter	AF-P39352-F1-model_v4	AF-P39352-F1-model_v4 Putative metabolite transport protein YjhB	3.479E-08	1.000	343	11	448	471	8	404	405	453	0.930	0.980
LOKIASV2_4345_ESMFold_MFS_transporter	AF-A0A3P7DHK5-F1-model_v4	AF-A0A3P7DHK5-F1-model_v4 Uncharacterized protein	2.944E-09	1.000	343	1	467	471	58	528	542	511	0.992	0.869
LOKIASV2_4345_ESMFold_MFS_transporter	AF-A0A1C1CPH3-F1-model_v4	AF-A0A1C1CPH3-F1-model_v4 Putative metabolite transport protein GIT1	9.713E-09	1.000	342	1	452	471	16	478	506	499	0.960	0.915
LOKIASV2_4345_ESMFold_MFS_transporter	AF-A0A3Q0KMG4-F1-model_v4	AF-A0A3Q0KMG4-F1-model_v4 Uncharacterized protein	4.274E-08	1.000	342	12	471	471	1	580	607	621	0.977	0.956
LOKIASV2_4345_ESMFold_MFS_transporter	AF-Q8S7U2-F1-model_v4	AF-Q8S7U2-F1-model_v4 Lactose permease, putative, expressed	4.641E-08	1.000	341	1	446	471	1	451	457	482	0.947	0.987
LOKIASV2_4345_ESMFold_MFS_transporter	AF-P31474-F1-model_v4	AF-P31474-F1-model_v4 Probable transport protein HsrA	2.718E-08	1.000	341	16	443	471	12	459	475	487	0.909	0.943
LOKIASV2_4345_ESMFold_MFS_transporter	AF-A0A1C1CJH2-F1-model_v4	AF-A0A1C1CJH2-F1-model_v4 Carboxylic acid transporter protein like protein	3.479E-08	1.000	341	12	451	471	59	489	520	465	0.934	0.829
LOKIASV2_4345_ESMFold_MFS_transporter	AF-D3ZPP5-F1-model_v4	AF-D3ZPP5-F1-model_v4 Solute carrier family 45, member 3	7.924E-08	1.000	341	16	441	471	17	550	553	562	0.904	0.966
LOKIASV2_4345_ESMFold_MFS_transporter	AF-Q8ZKV6-F1-model_v4	AF-Q8ZKV6-F1-model_v4 Putative MFS family tranport protein	5.039E-08	1.000	340	16	442	471	12	458	475	489	0.907	0.941
LOKIASV2_4345_ESMFold_MFS_transporter	AF-A0A0D2GXZ0-F1-model_v4	AF-A0A0D2GXZ0-F1-model_v4 Unplaced genomic scaffold supercont1.6, whole genome shotgun sequence	1.955E-08	1.000	340	11	456	471	58	494	514	471	0.947	0.850
LOKIASV2_4345_ESMFold_MFS_transporter	AF-D3ZPS4-F1-model_v4	AF-D3ZPS4-F1-model_v4 RCG35099, isoform CRA_a	8.946E-09	1.000	340	15	466	471	103	553	750	486	0.960	0.601
LOKIASV2_4345_ESMFold_MFS_transporter	AF-A0A0H3H142-F1-model_v4	AF-A0A0H3H142-F1-model_v4 Uncharacterized MFS-type transporter KPHS_37810	1.595E-07	1.000	338	1	435	471	1	391	391	445	0.924	1.000
LOKIASV2_4345_ESMFold_MFS_transporter	AF-B7F8I2-F1-model_v4	AF-B7F8I2-F1-model_v4 Os09g0394500 protein	1.193E-08	1.000	336	6	446	471	89	538	547	500	0.936	0.823
LOKIASV2_4345_ESMFold_MFS_transporter	AF-A0A0H3GK07-F1-model_v4	AF-A0A0H3GK07-F1-model_v4 MFS family transporter	4.274E-08	1.000	335	16	430	471	12	448	465	477	0.881	0.940
LOKIASV2_4345_ESMFold_MFS_transporter	AF-Q1LV45-F1-model_v4	AF-Q1LV45-F1-model_v4 Hippocampus abundant transcript 1b	2.832E-08	1.000	335	17	437	471	35	448	485	453	0.894	0.854
LOKIASV2_4345_ESMFold_MFS_transporter	AF-P25744-F1-model_v4	AF-P25744-F1-model_v4 Multidrug resistance protein MdtG	5.250E-08	1.000	334	1	430	471	1	395	408	453	0.913	0.968
LOKIASV2_4345_ESMFold_MFS_transporter	AF-Q0P9S1-F1-model_v4	AF-Q0P9S1-F1-model_v4 Putative MFS (Major Facilitator Superfamily) transport protein	5.039E-08	1.000	334	14	446	471	1	414	415	457	0.919	0.998
LOKIASV2_4345_ESMFold_MFS_transporter	AF-Q9VPD8-F1-model_v4	AF-Q9VPD8-F1-model_v4 MFS domain-containing protein	1.728E-08	1.000	334	19	467	471	26	445	447	467	0.953	0.940
LOKIASV2_4345_ESMFold_MFS_transporter	AF-Q2YDU8-F1-model_v4	AF-Q2YDU8-F1-model_v4 Protein spinster homolog 1	1.955E-08	1.000	334	1	448	471	31	494	528	501	0.951	0.879
LOKIASV2_4345_ESMFold_MFS_transporter	AF-Q9I6P2-F1-model_v4	AF-Q9I6P2-F1-model_v4 Probable major facilitator superfamily (MFS) transporter	2.608E-08	1.000	333	15	437	471	12	492	501	506	0.898	0.960
LOKIASV2_4345_ESMFold_MFS_transporter	AF-Q54SQ1-F1-model_v4	AF-Q54SQ1-F1-model_v4 Major facilitator superfamily protein	4.836E-08	1.000	333	2	432	471	180	605	663	469	0.915	0.643
LOKIASV2_4345_ESMFold_MFS_transporter	AF-A0A0H3GKF4-F1-model_v4	AF-A0A0H3GKF4-F1-model_v4 Putative transport protein	9.342E-08	1.000	332	11	431	471	5	387	454	435	0.894	0.844
LOKIASV2_4345_ESMFold_MFS_transporter	AF-Q57U73-F1-model_v4	AF-Q57U73-F1-model_v4 MFS domain-containing protein	3.204E-08	1.000	332	8	435	471	41	455	455	449	0.909	0.912
LOKIASV2_4345_ESMFold_MFS_transporter	AF-Q8DPW8-F1-model_v4	AF-Q8DPW8-F1-model_v4 ABC transporter membrane-spanning permease-macrolide efflux	4.274E-08	1.000	331	15	429	471	5	392	403	437	0.881	0.963
LOKIASV2_4345_ESMFold_MFS_transporter	AF-K0F427-F1-model_v4	AF-K0F427-F1-model_v4 Putative MFS transporter	1.148E-07	1.000	331	19	437	471	17	418	423	444	0.890	0.950
LOKIASV2_4345_ESMFold_MFS_transporter	AF-K0EXW3-F1-model_v4	AF-K0EXW3-F1-model_v4 MFS superfamily, multidrug transport protein	5.039E-08	1.000	331	1	452	471	7	440	480	486	0.960	0.904
LOKIASV2_4345_ESMFold_MFS_transporter	AF-Q8IVW8-F1-model_v4	AF-Q8IVW8-F1-model_v4 Protein spinster homolog 2	3.204E-08	1.000	331	10	453	471	90	540	549	485	0.943	0.821
LOKIASV2_4345_ESMFold_MFS_transporter	AF-Q4DHV3-F1-model_v4	AF-Q4DHV3-F1-model_v4 MFS domain-containing protein	2.212E-08	1.000	331	1	471	471	1	569	576	622	1.000	0.988
LOKIASV2_4345_ESMFold_MFS_transporter	AF-Q9GQQ0-F1-model_v4	AF-Q9GQQ0-F1-model_v4 Protein spinster	6.436E-09	1.000	331	2	466	471	99	604	605	539	0.987	0.836
LOKIASV2_4345_ESMFold_MFS_transporter	AF-K0EVD9-F1-model_v4	AF-K0EVD9-F1-model_v4 Major facilitator superfamily transporter	8.604E-08	1.000	330	15	456	471	8	412	415	458	0.938	0.976
LOKIASV2_4345_ESMFold_MFS_transporter	AF-A0A0H3GVX7-F1-model_v4	AF-A0A0H3GVX7-F1-model_v4 Putative transport protein	4.641E-08	1.000	330	4	438	471	1	408	427	450	0.924	0.956
LOKIASV2_4345_ESMFold_MFS_transporter	AF-Q9C5L6-F1-model_v4	AF-Q9C5L6-F1-model_v4 Major facilitator superfamily protein	2.118E-09	1.000	330	14	469	471	1	465	488	499	0.968	0.953
LOKIASV2_4345_ESMFold_MFS_transporter	AF-A0A0K0J367-F1-model_v4	AF-A0A0K0J367-F1-model_v4 Bm1803	1.876E-08	1.000	330	1	467	471	59	529	543	509	0.992	0.867
LOKIASV2_4345_ESMFold_MFS_transporter	AF-A0A077ZHM6-F1-model_v4	AF-A0A077ZHM6-F1-model_v4 MFS 1 domain containing protein	9.734E-08	1.000	329	1	437	471	9	402	404	451	0.928	0.975
LOKIASV2_4345_ESMFold_MFS_transporter	AF-A0A0N4U726-F1-model_v4	AF-A0A0N4U726-F1-model_v4 MFS domain-containing protein	5.701E-08	1.000	329	15	471	471	31	475	530	508	0.970	0.840
LOKIASV2_4345_ESMFold_MFS_transporter	AF-K0F0M0-F1-model_v4	AF-K0F0M0-F1-model_v4 Major facilitator transporter	1.595E-07	1.000	328	11	446	471	2	404	407	457	0.926	0.990
LOKIASV2_4345_ESMFold_MFS_transporter	AF-Q5ALJ4-F1-model_v4	AF-Q5ALJ4-F1-model_v4 MFS domain-containing protein	1.595E-07	1.000	328	1	434	471	90	500	510	458	0.921	0.806
LOKIASV2_4345_ESMFold_MFS_transporter	AF-A0A0K0JS60-F1-model_v4	AF-A0A0K0JS60-F1-model_v4 Bm7386	1.531E-07	1.000	328	15	470	471	31	478	528	504	0.968	0.848
LOKIASV2_4345_ESMFold_MFS_transporter	AF-K0F1P1-F1-model_v4	AF-K0F1P1-F1-model_v4 Drug resistance MFS transporter, drug:H+ antiporter-2 family protein	2.951E-08	1.000	327	8	444	471	2	466	478	503	0.928	0.973
LOKIASV2_4345_ESMFold_MFS_transporter	AF-Q9I660-F1-model_v4	AF-Q9I660-F1-model_v4 Probable major facilitator superfamily (MFS) transporter	1.805E-07	1.000	326	7	430	471	2	455	477	489	0.900	0.952
LOKIASV2_4345_ESMFold_MFS_transporter	AF-A0A0K0EGA3-F1-model_v4	AF-A0A0K0EGA3-F1-model_v4 MFS domain-containing protein	1.732E-07	1.000	326	15	430	471	32	452	553	467	0.883	0.761
LOKIASV2_4345_ESMFold_MFS_transporter	AF-Q8R0G7-F1-model_v4	AF-Q8R0G7-F1-model_v4 Protein spinster homolog 1	1.955E-08	1.000	325	1	448	471	31	494	528	502	0.951	0.879
LOKIASV2_4345_ESMFold_MFS_transporter	AF-Q9I2B6-F1-model_v4	AF-Q9I2B6-F1-model_v4 Uncharacterized MFS-type transporter PA1993	1.960E-07	1.000	324	15	431	471	21	393	402	424	0.885	0.928
LOKIASV2_4345_ESMFold_MFS_transporter	AF-Q6AY78-F1-model_v4	AF-Q6AY78-F1-model_v4 Solute carrier family 22 member 18	2.305E-08	1.000	324	16	437	471	10	399	404	437	0.896	0.965
LOKIASV2_4345_ESMFold_MFS_transporter	AF-U7PXF3-F1-model_v4	AF-U7PXF3-F1-model_v4 MFS domain-containing protein	8.965E-08	1.000	324	1	452	471	11	468	482	489	0.960	0.950
LOKIASV2_4345_ESMFold_MFS_transporter	AF-A0A0D2F361-F1-model_v4	AF-A0A0D2F361-F1-model_v4 Unplaced genomic scaffold supercont1.3, whole genome shotgun sequence	4.102E-08	1.000	324	2	446	471	4	481	484	522	0.945	0.988
LOKIASV2_4345_ESMFold_MFS_transporter	AF-P77589-F1-model_v4	AF-P77589-F1-model_v4 3-(3-hydroxy-phenyl)propionate transporter	2.508E-07	1.000	323	1	426	471	1	391	403	437	0.904	0.970
