LOKIASV2_0831_ESMFold_MFS_transporter	AF-A0A0D2GHY9-F1-model_v4	AF-A0A0D2GHY9-F1-model_v4 Unplaced genomic scaffold supercont1.4, whole genome shotgun sequence	1.284E-08	1.000	318	15	460	479	37	479	486	494	0.931	0.912
LOKIASV2_0831_ESMFold_MFS_transporter	AF-X8EXZ3-F1-model_v4	AF-X8EXZ3-F1-model_v4 Putative membrane protein	3.130E-07	1.000	317	30	453	479	17	402	403	437	0.885	0.958
LOKIASV2_0831_ESMFold_MFS_transporter	AF-U7PPI4-F1-model_v4	AF-U7PPI4-F1-model_v4 MFS domain-containing protein	5.745E-08	1.000	317	15	474	479	49	489	503	501	0.960	0.877
LOKIASV2_0831_ESMFold_MFS_transporter	AF-A0A0D2H3G2-F1-model_v4	AF-A0A0D2H3G2-F1-model_v4 Unplaced genomic scaffold supercont1.4, whole genome shotgun sequence	1.445E-08	1.000	317	25	474	479	7	487	538	527	0.939	0.894
LOKIASV2_0831_ESMFold_MFS_transporter	AF-A0A1C1CH26-F1-model_v4	AF-A0A1C1CH26-F1-model_v4 MFS domain-containing protein	4.359E-08	1.000	317	31	478	479	107	564	567	511	0.935	0.808
LOKIASV2_0831_ESMFold_MFS_transporter	AF-A0A0K0EB44-F1-model_v4	AF-A0A0K0EB44-F1-model_v4 MFS domain-containing protein	4.642E-07	1.000	316	18	470	479	2	432	438	482	0.946	0.984
LOKIASV2_0831_ESMFold_MFS_transporter	AF-A0A1C1CS31-F1-model_v4	AF-A0A1C1CS31-F1-model_v4 Putative metabolite transport protein	1.215E-07	1.000	316	10	478	479	12	475	500	508	0.979	0.928
LOKIASV2_0831_ESMFold_MFS_transporter	AF-A0A1C1C869-F1-model_v4	AF-A0A1C1C869-F1-model_v4 Myo-inositol transporter	1.802E-07	1.000	316	5	462	479	93	565	650	513	0.956	0.728
LOKIASV2_0831_ESMFold_MFS_transporter	AF-O69695-F1-model_v4	AF-O69695-F1-model_v4 Probable conserved two-domain membrane protein	5.745E-08	1.000	316	31	475	479	41	496	1065	507	0.929	0.428
LOKIASV2_0831_ESMFold_MFS_transporter	AF-I6XHB8-F1-model_v4	AF-I6XHB8-F1-model_v4 Probable dicarboxylic acid transport integral membrane protein KgtP (Dicarboxylate transporter)	2.570E-07	1.000	315	9	479	479	2	449	449	494	0.983	0.998
LOKIASV2_0831_ESMFold_MFS_transporter	AF-A0A0H3GUX1-F1-model_v4	AF-A0A0H3GUX1-F1-model_v4 Low-affinity L-arabinose transport system proton symport component	1.480E-07	1.000	315	1	474	479	1	472	478	522	0.990	0.987
LOKIASV2_0831_ESMFold_MFS_transporter	AF-A0A1C1CMF5-F1-model_v4	AF-A0A1C1CMF5-F1-model_v4 Sugar transporter family protein	1.264E-07	1.000	315	25	476	479	4	496	522	528	0.944	0.944
LOKIASV2_0831_ESMFold_MFS_transporter	AF-C6TMP6-F1-model_v4	AF-C6TMP6-F1-model_v4 MFS domain-containing protein	5.104E-08	1.000	315	17	461	479	36	483	529	493	0.929	0.847
LOKIASV2_0831_ESMFold_MFS_transporter	AF-A0A175VN71-F1-model_v4	AF-A0A175VN71-F1-model_v4 Putative HC-toxin efflux carrier TOXA	1.368E-07	1.000	315	31	458	479	100	580	601	519	0.894	0.800
LOKIASV2_0831_ESMFold_MFS_transporter	AF-P24326-F1-model_v4	AF-P24326-F1-model_v4 Uncharacterized protein HI_0350	1.215E-07	1.000	314	13	463	479	2	414	425	481	0.942	0.972
LOKIASV2_0831_ESMFold_MFS_transporter	AF-Q9VS47-F1-model_v4	AF-Q9VS47-F1-model_v4 LD39967p	2.939E-08	1.000	314	15	477	479	47	459	478	480	0.967	0.864
LOKIASV2_0831_ESMFold_MFS_transporter	AF-C0NJ10-F1-model_v4	AF-C0NJ10-F1-model_v4 Uncharacterized protein	5.523E-08	1.000	314	22	474	479	89	476	480	467	0.946	0.808
LOKIASV2_0831_ESMFold_MFS_transporter	AF-C1H369-F1-model_v4	AF-C1H369-F1-model_v4 MFS domain-containing protein	7.875E-08	1.000	314	9	472	479	32	472	499	488	0.969	0.884
LOKIASV2_0831_ESMFold_MFS_transporter	AF-C1GSC6-F1-model_v4	AF-C1GSC6-F1-model_v4 High-affinity nicotinic acid transporter	7.875E-08	1.000	314	15	474	479	39	487	502	502	0.960	0.894
LOKIASV2_0831_ESMFold_MFS_transporter	AF-Q94EC3-F1-model_v4	AF-Q94EC3-F1-model_v4 Sugar transport protein MST7	2.781E-07	1.000	314	28	461	479	19	471	512	486	0.906	0.885
LOKIASV2_0831_ESMFold_MFS_transporter	AF-K7MA42-F1-model_v4	AF-K7MA42-F1-model_v4 MFS domain-containing protein	5.745E-08	1.000	314	9	471	479	28	513	523	517	0.967	0.929
LOKIASV2_0831_ESMFold_MFS_transporter	AF-C0NQ91-F1-model_v4	AF-C0NQ91-F1-model_v4 Cycloheximide resistance protein	1.601E-07	1.000	314	31	479	479	96	534	536	498	0.937	0.819
LOKIASV2_0831_ESMFold_MFS_transporter	AF-A0A1C1CAU5-F1-model_v4	AF-A0A1C1CAU5-F1-model_v4 Sugar transporter	7.875E-08	1.000	314	28	463	479	21	469	536	484	0.910	0.838
LOKIASV2_0831_ESMFold_MFS_transporter	AF-B8A122-F1-model_v4	AF-B8A122-F1-model_v4 Sugar transport protein 1	1.950E-07	1.000	314	32	461	479	27	479	536	481	0.898	0.845
LOKIASV2_0831_ESMFold_MFS_transporter	AF-A0A0D2GU23-F1-model_v4	AF-A0A0D2GU23-F1-model_v4 Unplaced genomic scaffold supercont1.3, whole genome shotgun sequence	5.976E-08	1.000	314	15	462	479	30	523	600	534	0.935	0.823
LOKIASV2_0831_ESMFold_MFS_transporter	AF-P37643-F1-model_v4	AF-P37643-F1-model_v4 Inner membrane metabolite transport protein YhjE	1.079E-07	1.000	313	27	466	479	17	438	440	466	0.919	0.959
LOKIASV2_0831_ESMFold_MFS_transporter	AF-A0A0K0EH41-F1-model_v4	AF-A0A0K0EH41-F1-model_v4 Solute carrier family 40 protein	1.539E-07	1.000	313	26	470	479	6	465	466	506	0.929	0.987
LOKIASV2_0831_ESMFold_MFS_transporter	AF-Q4DJ57-F1-model_v4	AF-Q4DJ57-F1-model_v4 Sugar transporter, putative	7.570E-08	1.000	313	31	462	479	4	427	486	477	0.902	0.872
LOKIASV2_0831_ESMFold_MFS_transporter	AF-Q8BGC3-F1-model_v4	AF-Q8BGC3-F1-model_v4 Monocarboxylate transporter 12	8.191E-08	1.000	313	25	477	479	12	444	486	481	0.946	0.891
LOKIASV2_0831_ESMFold_MFS_transporter	AF-C1H623-F1-model_v4	AF-C1H623-F1-model_v4 Fluconazole resistance protein	5.104E-08	1.000	313	21	476	479	83	523	528	506	0.952	0.835
LOKIASV2_0831_ESMFold_MFS_transporter	AF-A0A0D2DS73-F1-model_v4	AF-A0A0D2DS73-F1-model_v4 Unplaced genomic scaffold supercont1.4, whole genome shotgun sequence	5.309E-08	1.000	313	30	461	479	18	456	530	473	0.902	0.828
LOKIASV2_0831_ESMFold_MFS_transporter	AF-I1KF36-F1-model_v4	AF-I1KF36-F1-model_v4 MFS domain-containing protein	7.278E-08	1.000	313	17	472	479	43	512	531	506	0.952	0.885
LOKIASV2_0831_ESMFold_MFS_transporter	AF-A0A175VV52-F1-model_v4	AF-A0A175VV52-F1-model_v4 Transporter mfs1	9.591E-08	1.000	313	17	474	479	55	522	537	524	0.956	0.872
LOKIASV2_0831_ESMFold_MFS_transporter	AF-C0NXN5-F1-model_v4	AF-C0NXN5-F1-model_v4 Membrane transporter	2.144E-08	1.000	313	9	459	479	35	539	555	557	0.942	0.910
LOKIASV2_0831_ESMFold_MFS_transporter	AF-A0A1D6E9C2-F1-model_v4	AF-A0A1D6E9C2-F1-model_v4 Sugar transport protein 5	5.309E-08	1.000	312	28	461	479	23	475	513	480	0.906	0.883
LOKIASV2_0831_ESMFold_MFS_transporter	AF-U7PMD2-F1-model_v4	AF-U7PMD2-F1-model_v4 MFS domain-containing protein	5.745E-08	1.000	312	20	474	479	15	485	520	515	0.950	0.906
LOKIASV2_0831_ESMFold_MFS_transporter	AF-I1LS03-F1-model_v4	AF-I1LS03-F1-model_v4 MFS domain-containing protein	4.191E-08	1.000	312	17	472	479	42	511	530	506	0.952	0.887
LOKIASV2_0831_ESMFold_MFS_transporter	AF-A0A1D6J968-F1-model_v4	AF-A0A1D6J968-F1-model_v4 Inositol transporter 1	5.745E-08	1.000	312	9	477	479	3	519	533	570	0.979	0.970
LOKIASV2_0831_ESMFold_MFS_transporter	AF-A0A175W515-F1-model_v4	AF-A0A175W515-F1-model_v4 Putative HC-toxin efflux carrier TOXA	1.215E-07	1.000	312	9	471	479	38	555	557	558	0.967	0.930
LOKIASV2_0831_ESMFold_MFS_transporter	AF-P36035-F1-model_v4	AF-P36035-F1-model_v4 Carboxylic acid transporter protein homolog	2.892E-07	1.000	312	23	474	479	130	585	616	506	0.944	0.740
LOKIASV2_0831_ESMFold_MFS_transporter	AF-A0A1C1CH32-F1-model_v4	AF-A0A1C1CH32-F1-model_v4 MFS transporter	5.309E-08	1.000	312	8	461	479	102	562	616	508	0.948	0.748
LOKIASV2_0831_ESMFold_MFS_transporter	AF-A0A077ZHI1-F1-model_v4	AF-A0A077ZHI1-F1-model_v4 MFS 1 and Sugar tr domain containing protein	1.601E-07	1.000	311	27	466	479	17	438	440	466	0.919	0.959
LOKIASV2_0831_ESMFold_MFS_transporter	AF-Q4DRL0-F1-model_v4	AF-Q4DRL0-F1-model_v4 MFS domain-containing protein	2.892E-07	1.000	311	15	471	479	1	464	471	524	0.954	0.985
LOKIASV2_0831_ESMFold_MFS_transporter	AF-Q9W1Z3-F1-model_v4	AF-Q9W1Z3-F1-model_v4 FI22427p1	2.028E-07	1.000	311	25	463	479	12	440	485	479	0.916	0.885
LOKIASV2_0831_ESMFold_MFS_transporter	AF-A0A175W6Q9-F1-model_v4	AF-A0A175W6Q9-F1-model_v4 High-affinity glucose transporter	4.359E-08	1.000	311	31	476	479	6	469	493	510	0.931	0.941
LOKIASV2_0831_ESMFold_MFS_transporter	AF-A0A0D2GGZ7-F1-model_v4	AF-A0A0D2GGZ7-F1-model_v4 Unplaced genomic scaffold supercont1.5, whole genome shotgun sequence	4.717E-08	1.000	311	32	475	479	8	463	496	504	0.927	0.919
LOKIASV2_0831_ESMFold_MFS_transporter	AF-Q6ZAK1-F1-model_v4	AF-Q6ZAK1-F1-model_v4 Os08g0409900 protein	2.939E-08	1.000	311	16	472	479	1	442	508	494	0.954	0.870
LOKIASV2_0831_ESMFold_MFS_transporter	AF-A0A3Q0KMY9-F1-model_v4	AF-A0A3Q0KMY9-F1-model_v4 Putative drug transporter	7.875E-08	1.000	311	32	474	479	79	524	540	487	0.925	0.826
LOKIASV2_0831_ESMFold_MFS_transporter	AF-A0A175WA44-F1-model_v4	AF-A0A175WA44-F1-model_v4 Aminotriazole resistance protein	4.463E-07	1.000	311	27	461	479	54	529	561	507	0.908	0.848
LOKIASV2_0831_ESMFold_MFS_transporter	AF-C0NTB0-F1-model_v4	AF-C0NTB0-F1-model_v4 Drug resistance transporter EmrB/QacA subfamily	6.216E-08	1.000	311	28	471	479	50	569	570	554	0.927	0.912
LOKIASV2_0831_ESMFold_MFS_transporter	AF-O74899-F1-model_v4	AF-O74899-F1-model_v4 Uncharacterized transporter C576.17c	2.413E-08	1.000	310	1	467	479	35	517	525	542	0.975	0.920
LOKIASV2_0831_ESMFold_MFS_transporter	AF-A0A1D6DT50-F1-model_v4	AF-A0A1D6DT50-F1-model_v4 Putative polyol transporter 4	6.466E-08	1.000	310	30	462	479	68	511	549	485	0.904	0.809
LOKIASV2_0831_ESMFold_MFS_transporter	AF-U7Q3L9-F1-model_v4	AF-U7Q3L9-F1-model_v4 MFS domain-containing protein	2.892E-07	1.000	310	25	463	479	43	554	571	550	0.916	0.897
LOKIASV2_0831_ESMFold_MFS_transporter	AF-Q12300-F1-model_v4	AF-Q12300-F1-model_v4 High glucose sensor RGT2	9.220E-08	1.000	310	11	475	479	74	563	763	538	0.971	0.642
LOKIASV2_0831_ESMFold_MFS_transporter	AF-Q9HWP5-F1-model_v4	AF-Q9HWP5-F1-model_v4 Bcr/CflA family efflux transporter	1.539E-07	1.000	309	9	463	479	4	401	402	467	0.950	0.990
LOKIASV2_0831_ESMFold_MFS_transporter	AF-D4A734-F1-model_v4	AF-D4A734-F1-model_v4 Monocarboxylate transporter 12	6.726E-08	1.000	309	34	478	479	20	453	486	476	0.929	0.893
LOKIASV2_0831_ESMFold_MFS_transporter	AF-U7PVQ5-F1-model_v4	AF-U7PVQ5-F1-model_v4 MFS domain-containing protein	7.570E-08	1.000	309	26	474	479	10	471	513	506	0.937	0.901
LOKIASV2_0831_ESMFold_MFS_transporter	AF-A0A1C1CZD2-F1-model_v4	AF-A0A1C1CZD2-F1-model_v4 Sugar transporter family protein	8.521E-08	1.000	309	28	478	479	8	487	549	508	0.942	0.874
LOKIASV2_0831_ESMFold_MFS_transporter	AF-Q6UXD7-F1-model_v4	AF-Q6UXD7-F1-model_v4 Solute carrier family 49 member A3	1.264E-07	1.000	309	15	478	479	13	461	560	504	0.969	0.802
LOKIASV2_0831_ESMFold_MFS_transporter	AF-Q8W4E7-F1-model_v4	AF-Q8W4E7-F1-model_v4 Solute carrier family 40 member 3, chloroplastic	1.097E-08	1.000	309	4	475	479	122	595	598	524	0.985	0.793
LOKIASV2_0831_ESMFold_MFS_transporter	AF-A0A133D047-F1-model_v4	AF-A0A133D047-F1-model_v4 MFS transporter	1.235E-08	1.000	308	27	459	479	5	472	490	505	0.904	0.955
LOKIASV2_0831_ESMFold_MFS_transporter	AF-A0A175WG04-F1-model_v4	AF-A0A175WG04-F1-model_v4 Thiamine pathway transporter THI73	2.375E-07	1.000	308	15	474	479	52	515	571	525	0.960	0.813
LOKIASV2_0831_ESMFold_MFS_transporter	AF-C0NGI6-F1-model_v4	AF-C0NGI6-F1-model_v4 Polyamine transporter 1	1.831E-08	1.000	308	22	478	479	86	553	576	520	0.954	0.812
LOKIASV2_0831_ESMFold_MFS_transporter	AF-Q9XXR3-F1-model_v4	AF-Q9XXR3-F1-model_v4 Proton myo-inositol cotransporter hmit-1.1	5.976E-08	1.000	308	28	474	479	22	580	606	597	0.933	0.922
LOKIASV2_0831_ESMFold_MFS_transporter	AF-A0A0H3GZZ1-F1-model_v4	AF-A0A0H3GZZ1-F1-model_v4 General substrate transporter	5.523E-08	1.000	307	13	469	479	1	419	426	481	0.954	0.984
LOKIASV2_0831_ESMFold_MFS_transporter	AF-A0A0D2EJ46-F1-model_v4	AF-A0A0D2EJ46-F1-model_v4 Unplaced genomic scaffold supercont1.9, whole genome shotgun sequence	9.976E-08	1.000	307	6	471	479	22	473	483	494	0.973	0.936
LOKIASV2_0831_ESMFold_MFS_transporter	AF-A0A175W1Q6-F1-model_v4	AF-A0A175W1Q6-F1-model_v4 Dityrosine transporter 1	2.110E-07	1.000	307	1	473	479	48	508	524	515	0.987	0.880
LOKIASV2_0831_ESMFold_MFS_transporter	AF-A0A0H3GM13-F1-model_v4	AF-A0A0H3GM13-F1-model_v4 Multidrug resistance protein MdtM	8.386E-07	1.000	306	15	472	479	1	405	413	465	0.956	0.981
LOKIASV2_0831_ESMFold_MFS_transporter	AF-P36554-F1-model_v4	AF-P36554-F1-model_v4 Putative multidrug resistance protein MdtD	2.570E-07	1.000	306	32	463	479	7	455	471	494	0.902	0.953
LOKIASV2_0831_ESMFold_MFS_transporter	AF-Q8ZKV6-F1-model_v4	AF-Q8ZKV6-F1-model_v4 Putative MFS family tranport protein	3.130E-07	1.000	306	27	475	479	1	464	475	505	0.937	0.977
LOKIASV2_0831_ESMFold_MFS_transporter	AF-Q2R0P8-F1-model_v4	AF-Q2R0P8-F1-model_v4 Os11g0637200 protein	3.664E-07	1.000	306	25	472	479	21	470	476	488	0.935	0.945
LOKIASV2_0831_ESMFold_MFS_transporter	AF-A0A0D2GTY1-F1-model_v4	AF-A0A0D2GTY1-F1-model_v4 Unplaced genomic scaffold supercont1.2, whole genome shotgun sequence	1.264E-07	1.000	306	10	459	479	48	471	508	474	0.939	0.835
LOKIASV2_0831_ESMFold_MFS_transporter	AF-A0A175VPQ3-F1-model_v4	AF-A0A175VPQ3-F1-model_v4 Polyamine transporter 3	2.230E-08	1.000	306	23	472	479	36	491	517	511	0.939	0.882
LOKIASV2_0831_ESMFold_MFS_transporter	AF-A0A0D2DQZ7-F1-model_v4	AF-A0A0D2DQZ7-F1-model_v4 Unplaced genomic scaffold supercont1.4, whole genome shotgun sequence	9.591E-08	1.000	306	9	478	479	21	510	531	530	0.981	0.923
LOKIASV2_0831_ESMFold_MFS_transporter	AF-A0A0D2DZ34-F1-model_v4	AF-A0A0D2DZ34-F1-model_v4 Unplaced genomic scaffold supercont1.2, whole genome shotgun sequence	3.256E-07	1.000	306	9	462	479	13	483	548	512	0.948	0.859
LOKIASV2_0831_ESMFold_MFS_transporter	AF-K0EPN3-F1-model_v4	AF-K0EPN3-F1-model_v4 EmrB/QacA subfamily drug resistance transporter	1.215E-07	1.000	306	10	459	479	19	546	561	575	0.939	0.941
LOKIASV2_0831_ESMFold_MFS_transporter	AF-A0A7I4KCQ9-F1-model_v4	AF-A0A7I4KCQ9-F1-model_v4 MFS domain-containing protein	8.864E-08	1.000	306	9	461	479	2	544	589	590	0.946	0.922
LOKIASV2_0831_ESMFold_MFS_transporter	AF-P45123-F1-model_v4	AF-P45123-F1-model_v4 Bicyclomycin resistance protein homolog	5.654E-07	1.000	305	15	473	479	2	398	398	463	0.958	0.997
LOKIASV2_0831_ESMFold_MFS_transporter	AF-O74923-F1-model_v4	AF-O74923-F1-model_v4 Uncharacterized transporter C757.13	1.423E-07	1.000	305	10	471	479	39	484	522	498	0.965	0.854
LOKIASV2_0831_ESMFold_MFS_transporter	AF-A0A0D2GKA4-F1-model_v4	AF-A0A0D2GKA4-F1-model_v4 Unplaced genomic scaffold supercont1.5, whole genome shotgun sequence	9.976E-08	1.000	305	25	478	479	105	562	564	510	0.948	0.812
LOKIASV2_0831_ESMFold_MFS_transporter	AF-A0A0D2GF80-F1-model_v4	AF-A0A0D2GF80-F1-model_v4 Unplaced genomic scaffold supercont1.6, whole genome shotgun sequence	5.104E-08	1.000	305	15	463	479	67	564	567	548	0.937	0.878
LOKIASV2_0831_ESMFold_MFS_transporter	AF-P44610-F1-model_v4	AF-P44610-F1-model_v4 Putative metabolite transport protein HI_0281	1.264E-07	1.000	304	27	463	479	3	429	438	477	0.912	0.975
LOKIASV2_0831_ESMFold_MFS_transporter	AF-K0EHY9-F1-model_v4	AF-K0EHY9-F1-model_v4 Transporter	8.521E-08	1.000	304	17	472	479	9	439	465	483	0.952	0.927
LOKIASV2_0831_ESMFold_MFS_transporter	AF-A0A3Q0KME7-F1-model_v4	AF-A0A3Q0KME7-F1-model_v4 Putative oxalate:formate antiporter	2.375E-07	1.000	304	16	463	479	1	443	486	489	0.935	0.912
LOKIASV2_0831_ESMFold_MFS_transporter	AF-U7PSD9-F1-model_v4	AF-U7PSD9-F1-model_v4 MFS domain-containing protein	4.359E-08	1.000	304	17	472	479	51	488	498	480	0.952	0.880
LOKIASV2_0831_ESMFold_MFS_transporter	AF-Q22406-F1-model_v4	AF-Q22406-F1-model_v4 MFS domain-containing protein	3.664E-07	1.000	304	27	471	479	23	459	499	473	0.929	0.876
LOKIASV2_0831_ESMFold_MFS_transporter	AF-I1MAS9-F1-model_v4	AF-I1MAS9-F1-model_v4 MFS domain-containing protein	1.480E-07	1.000	304	21	472	479	5	447	503	490	0.944	0.881
LOKIASV2_0831_ESMFold_MFS_transporter	AF-A0A1D6I4K4-F1-model_v4	AF-A0A1D6I4K4-F1-model_v4 Putative folate-biopterin transporter 6	2.781E-07	1.000	304	2	463	479	27	467	527	494	0.965	0.837
LOKIASV2_0831_ESMFold_MFS_transporter	AF-Q9W1Z2-F1-model_v4	AF-Q9W1Z2-F1-model_v4 MIP04353p	2.110E-07	1.000	303	29	479	479	19	454	479	489	0.942	0.910
LOKIASV2_0831_ESMFold_MFS_transporter	AF-K7UPD5-F1-model_v4	AF-K7UPD5-F1-model_v4 Putative polyol transporter 1	1.950E-07	1.000	303	25	462	479	27	470	487	485	0.914	0.912
LOKIASV2_0831_ESMFold_MFS_transporter	AF-A0A1C1CN64-F1-model_v4	AF-A0A1C1CN64-F1-model_v4 Putative Polyamine transporter	1.368E-07	1.000	303	9	477	479	35	494	498	512	0.979	0.924
LOKIASV2_0831_ESMFold_MFS_transporter	AF-Q0JCR9-F1-model_v4	AF-Q0JCR9-F1-model_v4 Sugar transport protein MST1	3.256E-07	1.000	303	23	457	479	18	476	517	495	0.908	0.888
LOKIASV2_0831_ESMFold_MFS_transporter	AF-A0A0D2GTY4-F1-model_v4	AF-A0A0D2GTY4-F1-model_v4 Unplaced genomic scaffold supercont1.7, whole genome shotgun sequence	3.057E-08	1.000	303	15	474	479	12	477	521	523	0.960	0.894
LOKIASV2_0831_ESMFold_MFS_transporter	AF-Q5RGT2-F1-model_v4	AF-Q5RGT2-F1-model_v4 FLVCR heme transporter 1	1.802E-07	1.000	303	1	477	479	40	504	527	527	0.996	0.882
LOKIASV2_0831_ESMFold_MFS_transporter	AF-A0A0D2GKN9-F1-model_v4	AF-A0A0D2GKN9-F1-model_v4 Unplaced genomic scaffold supercont1.3, whole genome shotgun sequence	1.038E-07	1.000	303	10	475	479	71	587	598	540	0.973	0.865
LOKIASV2_0831_ESMFold_MFS_transporter	AF-A0A0D2DMR7-F1-model_v4	AF-A0A0D2DMR7-F1-model_v4 Unplaced genomic scaffold supercont1.5, whole genome shotgun sequence	9.220E-08	1.000	303	15	475	479	69	519	641	505	0.962	0.704
LOKIASV2_0831_ESMFold_MFS_transporter	AF-K0ERJ8-F1-model_v4	AF-K0ERJ8-F1-model_v4 Inner membrane metabolite transport protein YhjE	2.283E-07	1.000	302	11	478	479	4	436	451	485	0.977	0.960
LOKIASV2_0831_ESMFold_MFS_transporter	AF-Q8L7Z7-F1-model_v4	AF-Q8L7Z7-F1-model_v4 AT3g60070/T2O9_50	6.620E-07	1.000	302	28	463	479	15	441	458	470	0.910	0.932
LOKIASV2_0831_ESMFold_MFS_transporter	AF-A0A175W7Y5-F1-model_v4	AF-A0A175W7Y5-F1-model_v4 High-affinity glucose transporter	4.029E-08	1.000	302	30	462	479	12	452	494	486	0.904	0.893
LOKIASV2_0831_ESMFold_MFS_transporter	AF-A0A1C1CE59-F1-model_v4	AF-A0A1C1CE59-F1-model_v4 Putative transporter	1.875E-07	1.000	302	11	477	479	49	488	508	491	0.975	0.866
LOKIASV2_0831_ESMFold_MFS_transporter	AF-D3ZVY8-F1-model_v4	AF-D3ZVY8-F1-model_v4 Solute carrier family 2 member 10	2.570E-07	1.000	302	27	477	479	6	516	536	560	0.942	0.953
LOKIASV2_0831_ESMFold_MFS_transporter	AF-P0CE00-F1-model_v4	AF-P0CE00-F1-model_v4 Alpha-glucosides permease MPH3	1.950E-07	1.000	302	14	474	479	60	566	602	544	0.962	0.842
LOKIASV2_0831_ESMFold_MFS_transporter	AF-P31436-F1-model_v4	AF-P31436-F1-model_v4 Sugar efflux transporter C	3.664E-07	1.000	301	11	464	479	3	394	394	478	0.948	0.995
LOKIASV2_0831_ESMFold_MFS_transporter	AF-Q8ZLC3-F1-model_v4	AF-Q8ZLC3-F1-model_v4 Putative MFS family transport protein	3.130E-07	1.000	301	28	463	479	18	434	440	461	0.910	0.948
LOKIASV2_0831_ESMFold_MFS_transporter	AF-K0EXV6-F1-model_v4	AF-K0EXV6-F1-model_v4 Sugar-transport integral membrane protein SugI	2.570E-07	1.000	301	16	475	479	1	457	467	507	0.960	0.979
LOKIASV2_0831_ESMFold_MFS_transporter	AF-C1GUJ6-F1-model_v4	AF-C1GUJ6-F1-model_v4 MFS transporter	6.726E-08	1.000	301	15	471	479	46	474	488	487	0.954	0.879
LOKIASV2_0831_ESMFold_MFS_transporter	AF-Q6ZKF0-F1-model_v4	AF-Q6ZKF0-F1-model_v4 Sugar transport protein MST5	5.225E-07	1.000	301	28	461	479	20	472	519	487	0.906	0.873
LOKIASV2_0831_ESMFold_MFS_transporter	AF-A0A0D2GZI1-F1-model_v4	AF-A0A0D2GZI1-F1-model_v4 Unplaced genomic scaffold supercont1.5, whole genome shotgun sequence	1.539E-07	1.000	301	26	474	479	6	481	531	515	0.937	0.896
LOKIASV2_0831_ESMFold_MFS_transporter	AF-U7PNF9-F1-model_v4	AF-U7PNF9-F1-model_v4 MFS domain-containing protein	7.278E-08	1.000	301	9	459	479	99	619	637	569	0.942	0.818
LOKIASV2_0831_ESMFold_MFS_transporter	AF-Q2QNF9-F1-model_v4	AF-Q2QNF9-F1-model_v4 Os12g0566900 protein	1.733E-07	1.000	300	4	465	479	21	449	450	478	0.965	0.953
LOKIASV2_0831_ESMFold_MFS_transporter	AF-A0A0D2GNZ9-F1-model_v4	AF-A0A0D2GNZ9-F1-model_v4 Unplaced genomic scaffold supercont1.4, whole genome shotgun sequence	1.079E-07	1.000	300	1	472	479	36	472	513	496	0.985	0.852
LOKIASV2_0831_ESMFold_MFS_transporter	AF-Q66I15-F1-model_v4	AF-Q66I15-F1-model_v4 Disrupted in renal carcinoma 2	2.028E-07	1.000	299	30	468	479	44	458	466	467	0.916	0.891
LOKIASV2_0831_ESMFold_MFS_transporter	AF-A0A0H3H069-F1-model_v4	AF-A0A0H3H069-F1-model_v4 Putative oligogalacturonide transporter	5.023E-07	1.000	299	28	474	479	7	462	527	495	0.933	0.865
LOKIASV2_0831_ESMFold_MFS_transporter	AF-A0A1D8PQG0-F1-model_v4	AF-A0A1D8PQG0-F1-model_v4 Major facilitator superfamily multidrug transporter NAG3	8.864E-08	1.000	299	32	471	479	117	545	561	492	0.919	0.765
LOKIASV2_0831_ESMFold_MFS_transporter	AF-F1LTM4-F1-model_v4	AF-F1LTM4-F1-model_v4 RCG19957	1.564E-08	1.000	299	8	478	479	30	486	568	511	0.983	0.805
LOKIASV2_0831_ESMFold_MFS_transporter	AF-A0A1D6HSI3-F1-model_v4	AF-A0A1D6HSI3-F1-model_v4 Putative inositol transporter 2	1.733E-07	1.000	299	17	479	479	14	567	585	594	0.967	0.947
LOKIASV2_0831_ESMFold_MFS_transporter	AF-U7PPA7-F1-model_v4	AF-U7PPA7-F1-model_v4 MFS domain-containing protein	1.802E-07	1.000	299	28	472	479	82	572	591	538	0.929	0.831
LOKIASV2_0831_ESMFold_MFS_transporter	AF-A0A175VSX6-F1-model_v4	AF-A0A175VSX6-F1-model_v4 Putative drug/proton antiporter YHK8	2.283E-07	1.000	299	25	473	479	97	649	657	592	0.937	0.842
LOKIASV2_0831_ESMFold_MFS_transporter	AF-A0A0N4URB2-F1-model_v4	AF-A0A0N4URB2-F1-model_v4 MFS domain-containing protein	2.283E-07	1.000	298	25	471	479	10	421	432	462	0.933	0.954
LOKIASV2_0831_ESMFold_MFS_transporter	AF-K0F578-F1-model_v4	AF-K0F578-F1-model_v4 Transporter	1.105E-06	1.000	298	29	477	479	11	445	457	478	0.937	0.952
LOKIASV2_0831_ESMFold_MFS_transporter	AF-A0A5K4F3G9-F1-model_v4	AF-A0A5K4F3G9-F1-model_v4 Uncharacterized protein	4.290E-07	1.000	298	9	463	479	4	436	468	481	0.950	0.925
LOKIASV2_0831_ESMFold_MFS_transporter	AF-A0A0H3GPJ5-F1-model_v4	AF-A0A0H3GPJ5-F1-model_v4 Major facilitator superfamily transporter MFS_1	2.375E-07	1.000	298	28	477	479	9	472	475	515	0.939	0.977
LOKIASV2_0831_ESMFold_MFS_transporter	AF-A0A175VQ81-F1-model_v4	AF-A0A175VQ81-F1-model_v4 Fluconazole resistance protein 1	7.570E-08	1.000	298	30	462	479	41	476	479	477	0.904	0.910
LOKIASV2_0831_ESMFold_MFS_transporter	AF-B4FG51-F1-model_v4	AF-B4FG51-F1-model_v4 Major facilitator superfamily protein	5.523E-08	1.000	298	26	472	479	13	456	506	492	0.933	0.877
LOKIASV2_0831_ESMFold_MFS_transporter	AF-Q9SA71-F1-model_v4	AF-Q9SA71-F1-model_v4 Putative glycerol-3-phosphate transporter 3	1.168E-07	1.000	298	22	478	479	33	494	510	510	0.954	0.906
LOKIASV2_0831_ESMFold_MFS_transporter	AF-A0A0R4J3V5-F1-model_v4	AF-A0A0R4J3V5-F1-model_v4 MFS domain-containing protein	2.110E-07	1.000	298	31	476	479	32	494	511	503	0.931	0.906
LOKIASV2_0831_ESMFold_MFS_transporter	AF-P0C6A1-F1-model_v4	AF-P0C6A1-F1-model_v4 Solute carrier family 2, facilitated glucose transporter member 7	1.168E-07	1.000	298	28	475	479	20	491	513	517	0.935	0.920
LOKIASV2_0831_ESMFold_MFS_transporter	AF-O05884-F1-model_v4	AF-O05884-F1-model_v4 Probable conserved transmembrane transport protein	1.038E-07	1.000	298	31	465	479	24	470	1048	496	0.908	0.427
LOKIASV2_0831_ESMFold_MFS_transporter	AF-A0A0H3GJ68-F1-model_v4	AF-A0A0H3GJ68-F1-model_v4 Sugar efflux protein	1.539E-07	1.000	297	17	464	479	9	394	394	452	0.935	0.980
LOKIASV2_0831_ESMFold_MFS_transporter	AF-Q8RWQ5-F1-model_v4	AF-Q8RWQ5-F1-model_v4 Probable folate-biopterin transporter 4	1.601E-07	1.000	297	15	463	479	1	483	491	534	0.937	0.984
LOKIASV2_0831_ESMFold_MFS_transporter	AF-Q688U6-F1-model_v4	AF-Q688U6-F1-model_v4 Os05g0579000 protein	1.038E-07	1.000	297	1	462	479	30	501	501	525	0.965	0.942
LOKIASV2_0831_ESMFold_MFS_transporter	AF-Q69P43-F1-model_v4	AF-Q69P43-F1-model_v4 Os09g0423400 protein	1.315E-07	1.000	297	6	463	479	20	455	504	490	0.956	0.865
LOKIASV2_0831_ESMFold_MFS_transporter	AF-A0A0D2E593-F1-model_v4	AF-A0A0D2E593-F1-model_v4 Unplaced genomic scaffold supercont1.1, whole genome shotgun sequence	1.480E-07	1.000	297	7	465	479	35	517	527	538	0.958	0.917
LOKIASV2_0831_ESMFold_MFS_transporter	AF-Q59RG0-F1-model_v4	AF-Q59RG0-F1-model_v4 Major facilitator superfamily multidrug transporter NAG4	2.110E-07	1.000	297	25	474	479	122	572	581	501	0.939	0.776
LOKIASV2_0831_ESMFold_MFS_transporter	AF-Q4DCM9-F1-model_v4	AF-Q4DCM9-F1-model_v4 MFS domain-containing protein	4.717E-08	1.000	297	9	465	479	42	486	748	496	0.954	0.595
LOKIASV2_0831_ESMFold_MFS_transporter	AF-Q5F886-F1-model_v4	AF-Q5F886-F1-model_v4 Major facilitator transporter	5.435E-07	1.000	296	29	475	479	17	466	468	497	0.933	0.962
LOKIASV2_0831_ESMFold_MFS_transporter	AF-A0A1C1CXK5-F1-model_v4	AF-A0A1C1CXK5-F1-model_v4 High-affinity glucose transporter	1.950E-07	1.000	296	31	472	479	5	455	483	494	0.923	0.934
LOKIASV2_0831_ESMFold_MFS_transporter	AF-A0A1C1CP84-F1-model_v4	AF-A0A1C1CP84-F1-model_v4 Putative transporter	1.601E-07	1.000	296	9	474	479	12	484	530	522	0.973	0.892
LOKIASV2_0831_ESMFold_MFS_transporter	AF-A0A1C1CCW2-F1-model_v4	AF-A0A1C1CCW2-F1-model_v4 Quinate permease	1.733E-07	1.000	296	11	462	479	22	485	531	503	0.944	0.874
LOKIASV2_0831_ESMFold_MFS_transporter	AF-Q8BFW9-F1-model_v4	AF-Q8BFW9-F1-model_v4 Solute carrier family 2, facilitated glucose transporter member 12	2.028E-07	1.000	296	31	462	479	44	554	622	545	0.902	0.822
LOKIASV2_0831_ESMFold_MFS_transporter	AF-A0A175WH00-F1-model_v4	AF-A0A175WH00-F1-model_v4 Thiamine pathway transporter THI73	1.802E-07	1.000	295	4	475	479	38	480	508	503	0.985	0.872
LOKIASV2_0831_ESMFold_MFS_transporter	AF-A0A1D8PKH9-F1-model_v4	AF-A0A1D8PKH9-F1-model_v4 Jen1p	1.423E-07	1.000	295	15	472	479	71	529	541	511	0.956	0.848
LOKIASV2_0831_ESMFold_MFS_transporter	AF-Q8ZRM5-F1-model_v4	AF-Q8ZRM5-F1-model_v4 Putative drug efflux protein (Perhaps for chloramphenicol)	2.247E-06	1.000	294	32	465	479	3	387	391	439	0.906	0.985
LOKIASV2_0831_ESMFold_MFS_transporter	AF-Q7CP73-F1-model_v4	AF-Q7CP73-F1-model_v4 Multidrug resistance protein MdtM	6.364E-07	1.000	294	16	473	479	1	413	413	474	0.956	1.000
