query	target	qheader	theader	fident	alnlen	mismatch	qstart	qend	tstart	tend	evalue	bits
LOKIASV2_1586_ESMFold_hypothetical_protein	AF-G2K3G6-F1-model_v4	LOKIASV2_1586_ESMFold_hypothetical_protein	AF-G2K3G6-F1-model_v4 Internalin A	0.330	138	91	56	193	220	356	3.833E-08	325
LOKIASV2_1586_ESMFold_hypothetical_protein	AF-P0DJM0-F1-model_v4	LOKIASV2_1586_ESMFold_hypothetical_protein	AF-P0DJM0-F1-model_v4 Internalin A	0.330	138	91	56	193	220	356	1.004E-07	314
LOKIASV2_1586_ESMFold_hypothetical_protein	AF-Q723K6-F1-model_v4	LOKIASV2_1586_ESMFold_hypothetical_protein	AF-Q723K6-F1-model_v4 Internalin A	0.330	138	91	56	193	220	356	1.808E-07	303
LOKIASV2_1586_ESMFold_hypothetical_protein	AF-Q8BGR2-F1-model_v4	LOKIASV2_1586_ESMFold_hypothetical_protein	AF-Q8BGR2-F1-model_v4 Volume-regulated anion channel subunit LRRC8D	0.263	143	100	49	185	643	785	5.268E-07	301
LOKIASV2_1586_ESMFold_hypothetical_protein	AF-Q7L1W4-F1-model_v4	LOKIASV2_1586_ESMFold_hypothetical_protein	AF-Q7L1W4-F1-model_v4 Volume-regulated anion channel subunit LRRC8D	0.266	153	106	49	194	642	794	1.056E-06	281
LOKIASV2_1586_ESMFold_hypothetical_protein	AF-Q24020-F1-model_v4	LOKIASV2_1586_ESMFold_hypothetical_protein	AF-Q24020-F1-model_v4 Protein flightless-1	0.293	143	95	49	184	36	178	1.709E-06	281
LOKIASV2_1586_ESMFold_hypothetical_protein	AF-P45969-F1-model_v4	LOKIASV2_1586_ESMFold_hypothetical_protein	AF-P45969-F1-model_v4 Protein phosphatase 1 regulatory subunit SDS22 homolog	0.321	140	94	46	185	40	178	5.542E-06	278
LOKIASV2_1586_ESMFold_hypothetical_protein	AF-Q3T0W4-F1-model_v4	LOKIASV2_1586_ESMFold_hypothetical_protein	AF-Q3T0W4-F1-model_v4 Protein phosphatase 1 regulatory subunit 7	0.330	134	88	56	189	111	243	2.485E-06	278
LOKIASV2_1586_ESMFold_hypothetical_protein	AF-Q01730-F1-model_v4	LOKIASV2_1586_ESMFold_hypothetical_protein	AF-Q01730-F1-model_v4 Ras suppressor protein 1	0.246	164	117	54	209	75	238	1.620E-06	276
LOKIASV2_1586_ESMFold_hypothetical_protein	AF-Q7ZV84-F1-model_v4	LOKIASV2_1586_ESMFold_hypothetical_protein	AF-Q7ZV84-F1-model_v4 Dynein assembly factor 1, axonemal	0.213	162	125	45	204	77	238	8.081E-07	274
LOKIASV2_1586_ESMFold_hypothetical_protein	AF-A8JAM0-F1-model_v4	LOKIASV2_1586_ESMFold_hypothetical_protein	AF-A8JAM0-F1-model_v4 Dynein regulatory complex subunit 7	0.198	183	125	54	210	64	246	2.369E-08	274
LOKIASV2_1586_ESMFold_hypothetical_protein	AF-A4D1F6-F1-model_v4	LOKIASV2_1586_ESMFold_hypothetical_protein	AF-A4D1F6-F1-model_v4 Leucine-rich repeat and death domain-containing protein 1	0.261	132	94	54	181	476	607	2.765E-06	270
LOKIASV2_1586_ESMFold_hypothetical_protein	AF-Q7XDQ7-F1-model_v4	LOKIASV2_1586_ESMFold_hypothetical_protein	AF-Q7XDQ7-F1-model_v4 Plant intracellular Ras-group-related LRR protein 8	0.266	154	106	49	193	137	290	3.077E-06	269
LOKIASV2_1586_ESMFold_hypothetical_protein	AF-F1R6I3-F1-model_v4	LOKIASV2_1586_ESMFold_hypothetical_protein	AF-F1R6I3-F1-model_v4 Leucine-rich repeat-containing protein 39	0.256	193	124	21	188	50	242	1.714E-07	268
LOKIASV2_1586_ESMFold_hypothetical_protein	AF-Q5RFS7-F1-model_v4	LOKIASV2_1586_ESMFold_hypothetical_protein	AF-Q5RFS7-F1-model_v4 Protein phosphatase 1 regulatory subunit 7	0.259	172	121	25	188	69	240	1.243E-07	267
LOKIASV2_1586_ESMFold_hypothetical_protein	AF-A5PK13-F1-model_v4	LOKIASV2_1586_ESMFold_hypothetical_protein	AF-A5PK13-F1-model_v4 Volume-regulated anion channel subunit LRRC8C	0.273	145	100	52	190	599	743	3.613E-06	266
LOKIASV2_1586_ESMFold_hypothetical_protein	AF-Q5HZV9-F1-model_v4	LOKIASV2_1586_ESMFold_hypothetical_protein	AF-Q5HZV9-F1-model_v4 Protein phosphatase 1 regulatory subunit 7	0.294	151	97	39	189	105	243	1.240E-06	265
LOKIASV2_1586_ESMFold_hypothetical_protein	AF-Q8TDW0-F1-model_v4	LOKIASV2_1586_ESMFold_hypothetical_protein	AF-Q8TDW0-F1-model_v4 Volume-regulated anion channel subunit LRRC8C	0.273	145	100	52	190	599	743	3.811E-06	265
LOKIASV2_1586_ESMFold_hypothetical_protein	AF-Q3UM45-F1-model_v4	LOKIASV2_1586_ESMFold_hypothetical_protein	AF-Q3UM45-F1-model_v4 Protein phosphatase 1 regulatory subunit 7	0.300	128	87	61	188	161	285	4.475E-06	263
LOKIASV2_1586_ESMFold_hypothetical_protein	AF-Q9BTT6-F1-model_v4	LOKIASV2_1586_ESMFold_hypothetical_protein	AF-Q9BTT6-F1-model_v4 Leucine-rich repeat-containing protein 1	0.279	135	94	54	184	163	297	4.475E-06	263
LOKIASV2_1586_ESMFold_hypothetical_protein	AF-A7SFP1-F1-model_v4	LOKIASV2_1586_ESMFold_hypothetical_protein	AF-A7SFP1-F1-model_v4 Leucine-rich repeat protein soc-2 homolog	0.342	143	91	45	183	89	231	4.980E-06	263
LOKIASV2_1586_ESMFold_hypothetical_protein	AF-Q96II8-F1-model_v4	LOKIASV2_1586_ESMFold_hypothetical_protein	AF-Q96II8-F1-model_v4 DISP complex protein LRCH3	0.255	182	117	54	211	94	275	6.903E-08	259
LOKIASV2_1586_ESMFold_hypothetical_protein	AF-Q8BGI7-F1-model_v4	LOKIASV2_1586_ESMFold_hypothetical_protein	AF-Q8BGI7-F1-model_v4 Leucine-rich repeat-containing protein 39	0.245	195	134	6	184	36	230	1.059E-07	258
LOKIASV2_1586_ESMFold_hypothetical_protein	AF-A8XWW4-F1-model_v4	LOKIASV2_1586_ESMFold_hypothetical_protein	AF-A8XWW4-F1-model_v4 Leucine-rich repeat protein soc-2	0.232	176	127	13	188	56	221	8.994E-07	257
LOKIASV2_1586_ESMFold_hypothetical_protein	AF-Q22875-F1-model_v4	LOKIASV2_1586_ESMFold_hypothetical_protein	AF-Q22875-F1-model_v4 Leucine-rich repeat protein soc-2	0.257	162	117	54	211	387	548	2.917E-06	257
LOKIASV2_1586_ESMFold_hypothetical_protein	AF-Q6GPJ5-F1-model_v4	LOKIASV2_1586_ESMFold_hypothetical_protein	AF-Q6GPJ5-F1-model_v4 Leucine-rich repeat-containing protein 40	0.240	163	119	54	211	440	602	8.058E-06	256
LOKIASV2_1586_ESMFold_hypothetical_protein	AF-Q5M8G4-F1-model_v4	LOKIASV2_1586_ESMFold_hypothetical_protein	AF-Q5M8G4-F1-model_v4 Leucine-rich repeat-containing protein 40	0.218	174	131	38	211	434	602	1.803E-06	255
LOKIASV2_1586_ESMFold_hypothetical_protein	AF-Q8IW35-F1-model_v4	LOKIASV2_1586_ESMFold_hypothetical_protein	AF-Q8IW35-F1-model_v4 Centrosomal protein of 97 kDa	0.294	133	90	56	184	49	181	2.917E-06	255
LOKIASV2_1586_ESMFold_hypothetical_protein	AF-Q9CZ62-F1-model_v4	LOKIASV2_1586_ESMFold_hypothetical_protein	AF-Q9CZ62-F1-model_v4 Centrosomal protein of 97 kDa	0.282	134	95	56	189	49	181	3.425E-06	252
LOKIASV2_1586_ESMFold_hypothetical_protein	AF-Q01631-F1-model_v4	LOKIASV2_1586_ESMFold_hypothetical_protein	AF-Q01631-F1-model_v4 Adenylate cyclase	0.234	142	105	52	189	926	1067	8.968E-06	249
LOKIASV2_1586_ESMFold_hypothetical_protein	AF-Q6UWE0-F1-model_v4	LOKIASV2_1586_ESMFold_hypothetical_protein	AF-Q6UWE0-F1-model_v4 E3 ubiquitin-protein ligase LRSAM1	0.200	199	156	13	208	6	204	8.081E-07	248
LOKIASV2_1586_ESMFold_hypothetical_protein	AF-Q15435-F1-model_v4	LOKIASV2_1586_ESMFold_hypothetical_protein	AF-Q15435-F1-model_v4 Protein phosphatase 1 regulatory subunit 7	0.262	172	120	25	188	69	240	6.525E-07	246
LOKIASV2_1586_ESMFold_hypothetical_protein	AF-Q6DIQ3-F1-model_v4	LOKIASV2_1586_ESMFold_hypothetical_protein	AF-Q6DIQ3-F1-model_v4 Protein phosphatase 1 regulatory subunit 7	0.325	133	87	56	188	97	226	1.376E-05	243
LOKIASV2_1586_ESMFold_hypothetical_protein	AF-A4IHG1-F1-model_v4	LOKIASV2_1586_ESMFold_hypothetical_protein	AF-A4IHG1-F1-model_v4 Leucine-rich repeat-containing protein 58	0.266	153	91	54	178	46	198	1.243E-07	243
LOKIASV2_1586_ESMFold_hypothetical_protein	AF-Q4R3P6-F1-model_v4	LOKIASV2_1586_ESMFold_hypothetical_protein	AF-Q4R3P6-F1-model_v4 Leucine-rich repeat-containing protein 40	0.186	163	128	54	211	437	599	1.896E-05	241
LOKIASV2_1586_ESMFold_hypothetical_protein	AF-P62046-F1-model_v4	LOKIASV2_1586_ESMFold_hypothetical_protein	AF-P62046-F1-model_v4 Leucine-rich repeat and calponin homology domain-containing protein 1	0.225	156	119	54	208	122	277	1.620E-06	240
LOKIASV2_1586_ESMFold_hypothetical_protein	AF-D3ZXS4-F1-model_v4	LOKIASV2_1586_ESMFold_hypothetical_protein	AF-D3ZXS4-F1-model_v4 Leucine-rich repeat-containing protein 39	0.230	195	137	6	184	36	230	5.268E-07	239
LOKIASV2_1586_ESMFold_hypothetical_protein	AF-Q5U308-F1-model_v4	LOKIASV2_1586_ESMFold_hypothetical_protein	AF-Q5U308-F1-model_v4 Volume-regulated anion channel subunit LRRC8D	0.239	170	107	49	189	642	811	2.355E-06	239
LOKIASV2_1586_ESMFold_hypothetical_protein	AF-P0DO09-F1-model_v4	LOKIASV2_1586_ESMFold_hypothetical_protein	AF-P0DO09-F1-model_v4 Disease resistance protein Piks-1	0.240	136	99	56	186	723	858	8.968E-06	238
LOKIASV2_1586_ESMFold_hypothetical_protein	AF-Q9CRC8-F1-model_v4	LOKIASV2_1586_ESMFold_hypothetical_protein	AF-Q9CRC8-F1-model_v4 Leucine-rich repeat-containing protein 40	0.321	138	92	54	189	117	254	7.241E-06	237
LOKIASV2_1586_ESMFold_hypothetical_protein	AF-Q96DD0-F1-model_v4	LOKIASV2_1586_ESMFold_hypothetical_protein	AF-Q96DD0-F1-model_v4 Leucine-rich repeat-containing protein 39	0.225	198	142	6	189	36	233	5.558E-07	236
LOKIASV2_1586_ESMFold_hypothetical_protein	AF-Q68F79-F1-model_v4	LOKIASV2_1586_ESMFold_hypothetical_protein	AF-Q68F79-F1-model_v4 Volume-regulated anion channel subunit LRRC8E	0.259	133	93	52	178	602	734	2.477E-05	236
LOKIASV2_1586_ESMFold_hypothetical_protein	AF-Q9SRL2-F1-model_v4	LOKIASV2_1586_ESMFold_hypothetical_protein	AF-Q9SRL2-F1-model_v4 Receptor-like protein 34	0.261	166	111	34	184	87	252	1.620E-06	236
LOKIASV2_1586_ESMFold_hypothetical_protein	AF-Q7SXW3-F1-model_v4	LOKIASV2_1586_ESMFold_hypothetical_protein	AF-Q7SXW3-F1-model_v4 Leucine-rich repeat-containing protein 40	0.242	135	99	54	184	115	249	3.068E-05	235
LOKIASV2_1586_ESMFold_hypothetical_protein	AF-Q54XZ5-F1-model_v4	LOKIASV2_1586_ESMFold_hypothetical_protein	AF-Q54XZ5-F1-model_v4 Probable serine/threonine-protein kinase DDB_G0278509	0.254	157	116	54	210	583	739	1.615E-05	235
LOKIASV2_1586_ESMFold_hypothetical_protein	AF-Q4H4B6-F1-model_v4	LOKIASV2_1586_ESMFold_hypothetical_protein	AF-Q4H4B6-F1-model_v4 Protein scribble homolog	0.272	135	95	54	184	163	297	2.909E-05	235
LOKIASV2_1586_ESMFold_hypothetical_protein	AF-Q6NU09-F1-model_v4	LOKIASV2_1586_ESMFold_hypothetical_protein	AF-Q6NU09-F1-model_v4 Volume-regulated anion channel subunit LRRC8E	0.270	136	94	49	178	599	734	3.415E-05	234
LOKIASV2_1586_ESMFold_hypothetical_protein	AF-Q55CS8-F1-model_v4	LOKIASV2_1586_ESMFold_hypothetical_protein	AF-Q55CS8-F1-model_v4 MAP kinase phosphatase with leucine-rich repeats protein 2	0.239	164	105	50	188	108	271	4.734E-07	233
LOKIASV2_1586_ESMFold_hypothetical_protein	AF-Q9SKK2-F1-model_v4	LOKIASV2_1586_ESMFold_hypothetical_protein	AF-Q9SKK2-F1-model_v4 Receptor like protein 21	0.209	139	102	60	189	161	299	2.917E-06	233
LOKIASV2_1586_ESMFold_hypothetical_protein	AF-Q7AP87-F1-model_v4	LOKIASV2_1586_ESMFold_hypothetical_protein	AF-Q7AP87-F1-model_v4 Internalin H	0.211	192	148	2	193	38	225	2.917E-06	232
LOKIASV2_1586_ESMFold_hypothetical_protein	AF-P0DQD2-F1-model_v4	LOKIASV2_1586_ESMFold_hypothetical_protein	AF-P0DQD2-F1-model_v4 Internalin B	0.200	193	150	1	193	37	225	2.233E-06	232
LOKIASV2_1586_ESMFold_hypothetical_protein	AF-Q9M9C5-F1-model_v4	LOKIASV2_1586_ESMFold_hypothetical_protein	AF-Q9M9C5-F1-model_v4 Probable leucine-rich repeat receptor-like protein kinase At1g68400	0.216	208	144	6	190	20	227	4.487E-07	232
LOKIASV2_1586_ESMFold_hypothetical_protein	AF-A6H694-F1-model_v4	LOKIASV2_1586_ESMFold_hypothetical_protein	AF-A6H694-F1-model_v4 Leucine-rich repeat-containing protein 63	0.221	187	139	12	198	344	523	2.233E-06	230
LOKIASV2_1586_ESMFold_hypothetical_protein	AF-B5UBC1-F1-model_v4	LOKIASV2_1586_ESMFold_hypothetical_protein	AF-B5UBC1-F1-model_v4 Disease resistance protein Pikm1-TS	0.242	135	98	57	186	724	858	1.615E-05	230
LOKIASV2_1586_ESMFold_hypothetical_protein	AF-Q14160-F1-model_v4	LOKIASV2_1586_ESMFold_hypothetical_protein	AF-Q14160-F1-model_v4 Protein scribble homolog	0.257	135	97	54	184	163	297	4.462E-05	229
LOKIASV2_1586_ESMFold_hypothetical_protein	AF-Q5R5V8-F1-model_v4	LOKIASV2_1586_ESMFold_hypothetical_protein	AF-Q5R5V8-F1-model_v4 Relaxin receptor 1	0.291	148	96	54	190	210	357	1.236E-05	227
LOKIASV2_1586_ESMFold_hypothetical_protein	AF-Q8BVU0-F1-model_v4	LOKIASV2_1586_ESMFold_hypothetical_protein	AF-Q8BVU0-F1-model_v4 DISP complex protein LRCH3	0.228	182	121	54	211	94	275	5.558E-07	227
LOKIASV2_1586_ESMFold_hypothetical_protein	AF-Q4R6F0-F1-model_v4	LOKIASV2_1586_ESMFold_hypothetical_protein	AF-Q4R6F0-F1-model_v4 Leucine-rich repeat and death domain-containing protein 1	0.255	187	116	54	210	571	757	2.006E-06	227
LOKIASV2_1586_ESMFold_hypothetical_protein	AF-Q15404-F1-model_v4	LOKIASV2_1586_ESMFold_hypothetical_protein	AF-Q15404-F1-model_v4 Ras suppressor protein 1	0.227	187	120	54	209	52	238	1.308E-06	226
LOKIASV2_1586_ESMFold_hypothetical_protein	AF-Q86X40-F1-model_v4	LOKIASV2_1586_ESMFold_hypothetical_protein	AF-Q86X40-F1-model_v4 Leucine-rich repeat-containing protein 28	0.216	152	112	45	188	68	219	2.226E-05	226
LOKIASV2_1586_ESMFold_hypothetical_protein	AF-B4GT53-F1-model_v4	LOKIASV2_1586_ESMFold_hypothetical_protein	AF-B4GT53-F1-model_v4 Dynein axonemal assembly factor 1 homolog	0.225	167	120	45	200	41	207	6.506E-06	226
LOKIASV2_1586_ESMFold_hypothetical_protein	AF-B6D5P1-F1-model_v4	LOKIASV2_1586_ESMFold_hypothetical_protein	AF-B6D5P1-F1-model_v4 Dynein axonemal assembly factor 1	0.235	164	123	45	206	104	267	7.639E-06	224
LOKIASV2_1586_ESMFold_hypothetical_protein	AF-Q9FL28-F1-model_v4	LOKIASV2_1586_ESMFold_hypothetical_protein	AF-Q9FL28-F1-model_v4 LRR receptor-like serine/threonine-protein kinase FLS2	0.260	142	98	56	188	183	324	4.720E-06	224
LOKIASV2_1586_ESMFold_hypothetical_protein	AF-Q9D9Q0-F1-model_v4	LOKIASV2_1586_ESMFold_hypothetical_protein	AF-Q9D9Q0-F1-model_v4 Leucine-rich repeat-containing protein 69	0.227	173	125	17	189	2	164	1.531E-05	223
LOKIASV2_1586_ESMFold_hypothetical_protein	AF-Q5ZLN0-F1-model_v4	LOKIASV2_1586_ESMFold_hypothetical_protein	AF-Q5ZLN0-F1-model_v4 Leucine-rich repeat-containing protein 40	0.245	163	119	54	211	438	600	7.220E-05	223
LOKIASV2_1586_ESMFold_hypothetical_protein	AF-Q9FRS6-F1-model_v4	LOKIASV2_1586_ESMFold_hypothetical_protein	AF-Q9FRS6-F1-model_v4 Leucine-rich repeat receptor-like protein kinase PXL1	0.239	162	116	37	189	71	232	6.167E-06	222
LOKIASV2_1586_ESMFold_hypothetical_protein	AF-B0W6M9-F1-model_v4	LOKIASV2_1586_ESMFold_hypothetical_protein	AF-B0W6M9-F1-model_v4 Leucine-rich repeat protein soc-2 homolog	0.230	182	134	13	194	130	304	3.811E-06	221
LOKIASV2_1586_ESMFold_hypothetical_protein	AF-Q9C699-F1-model_v4	LOKIASV2_1586_ESMFold_hypothetical_protein	AF-Q9C699-F1-model_v4 Receptor-like protein 7	0.255	146	98	57	189	294	439	5.846E-06	221
LOKIASV2_1586_ESMFold_hypothetical_protein	AF-Q32KX5-F1-model_v4	LOKIASV2_1586_ESMFold_hypothetical_protein	AF-Q32KX5-F1-model_v4 Leucine-rich repeat-containing protein 28	0.212	150	113	45	189	68	217	3.800E-05	220
LOKIASV2_1586_ESMFold_hypothetical_protein	AF-O75427-F1-model_v4	LOKIASV2_1586_ESMFold_hypothetical_protein	AF-O75427-F1-model_v4 Leucine-rich repeat and calponin homology domain-containing protein 4	0.226	179	119	54	208	80	258	2.355E-06	220
LOKIASV2_1586_ESMFold_hypothetical_protein	AF-Q9ZUK7-F1-model_v4	LOKIASV2_1586_ESMFold_hypothetical_protein	AF-Q9ZUK7-F1-model_v4 Receptor-like protein 18	0.274	141	93	56	184	71	211	8.501E-06	220
LOKIASV2_1586_ESMFold_hypothetical_protein	AF-F4K6B8-F1-model_v4	LOKIASV2_1586_ESMFold_hypothetical_protein	AF-F4K6B8-F1-model_v4 Leucine-rich repeat receptor-like serine/threonine-protein kinase RGI4	0.267	139	94	56	184	424	562	5.253E-06	220
LOKIASV2_1586_ESMFold_hypothetical_protein	AF-Q29KL8-F1-model_v4	LOKIASV2_1586_ESMFold_hypothetical_protein	AF-Q29KL8-F1-model_v4 Dynein axonemal assembly factor 1 homolog	0.222	167	121	45	200	41	207	2.110E-05	220
LOKIASV2_1586_ESMFold_hypothetical_protein	AF-Q9FIZ3-F1-model_v4	LOKIASV2_1586_ESMFold_hypothetical_protein	AF-Q9FIZ3-F1-model_v4 LRR receptor-like serine/threonine-protein kinase GSO2	0.281	132	88	56	178	159	290	8.501E-06	219
LOKIASV2_1586_ESMFold_hypothetical_protein	AF-Q8YA32-F1-model_v4	LOKIASV2_1586_ESMFold_hypothetical_protein	AF-Q8YA32-F1-model_v4 Internalin I	0.343	131	80	59	181	626	756	6.844E-05	219
LOKIASV2_1586_ESMFold_hypothetical_protein	AF-Q5RFE9-F1-model_v4	LOKIASV2_1586_ESMFold_hypothetical_protein	AF-Q5RFE9-F1-model_v4 Leucine-rich repeat-containing protein 40	0.300	138	95	54	189	117	254	4.965E-05	218
LOKIASV2_1586_ESMFold_hypothetical_protein	AF-C0LGU1-F1-model_v4	LOKIASV2_1586_ESMFold_hypothetical_protein	AF-C0LGU1-F1-model_v4 Probable LRR receptor-like serine/threonine-protein kinase At5g37450	0.180	198	137	11	178	26	223	2.765E-06	218
LOKIASV2_1586_ESMFold_hypothetical_protein	AF-Q1MX30-F1-model_v4	LOKIASV2_1586_ESMFold_hypothetical_protein	AF-Q1MX30-F1-model_v4 Receptor kinase-like protein Xa21	0.271	185	113	33	188	66	250	1.114E-06	218
LOKIASV2_1586_ESMFold_hypothetical_protein	AF-Q6GLE8-F1-model_v4	LOKIASV2_1586_ESMFold_hypothetical_protein	AF-Q6GLE8-F1-model_v4 Leucine-rich repeat-containing protein 28	0.191	137	107	53	185	76	212	4.462E-05	217
LOKIASV2_1586_ESMFold_hypothetical_protein	AF-Q9D1G5-F1-model_v4	LOKIASV2_1586_ESMFold_hypothetical_protein	AF-Q9D1G5-F1-model_v4 Leucine-rich repeat-containing protein 57	0.243	173	126	19	191	4	171	7.241E-06	216
LOKIASV2_1586_ESMFold_hypothetical_protein	AF-Q8VDB8-F1-model_v4	LOKIASV2_1586_ESMFold_hypothetical_protein	AF-Q8VDB8-F1-model_v4 Leucine-rich repeat-containing protein 2	0.224	174	110	54	196	133	306	8.081E-07	216
LOKIASV2_1586_ESMFold_hypothetical_protein	AF-Q4V8G0-F1-model_v4	LOKIASV2_1586_ESMFold_hypothetical_protein	AF-Q4V8G0-F1-model_v4 Leucine-rich repeat-containing protein 63	0.168	214	161	15	209	314	527	1.902E-06	216
LOKIASV2_1586_ESMFold_hypothetical_protein	AF-Q2R2D5-F1-model_v4	LOKIASV2_1586_ESMFold_hypothetical_protein	AF-Q2R2D5-F1-model_v4 Receptor kinase-like protein Xa21	0.223	217	140	1	181	22	238	1.240E-06	216
LOKIASV2_1586_ESMFold_hypothetical_protein	AF-C0LGV1-F1-model_v4	LOKIASV2_1586_ESMFold_hypothetical_protein	AF-C0LGV1-F1-model_v4 LRR receptor-like serine/threonine-protein kinase RGI2	0.295	142	93	56	188	362	503	6.506E-06	216
LOKIASV2_1586_ESMFold_hypothetical_protein	AF-Q13045-F1-model_v4	LOKIASV2_1586_ESMFold_hypothetical_protein	AF-Q13045-F1-model_v4 Protein flightless-1 homolog	0.261	156	106	50	193	41	196	2.757E-05	216
LOKIASV2_1586_ESMFold_hypothetical_protein	AF-Q80TE7-F1-model_v4	LOKIASV2_1586_ESMFold_hypothetical_protein	AF-Q80TE7-F1-model_v4 Leucine-rich repeat-containing protein 7	0.215	140	106	54	189	81	220	5.526E-05	216
LOKIASV2_1586_ESMFold_hypothetical_protein	AF-Q05C16-F1-model_v4	LOKIASV2_1586_ESMFold_hypothetical_protein	AF-Q05C16-F1-model_v4 Leucine-rich repeat-containing protein 63	0.201	156	123	45	199	325	480	2.909E-05	215
LOKIASV2_1586_ESMFold_hypothetical_protein	AF-Q80ZI6-F1-model_v4	LOKIASV2_1586_ESMFold_hypothetical_protein	AF-Q80ZI6-F1-model_v4 E3 ubiquitin-protein ligase LRSAM1	0.180	199	160	13	208	6	204	1.111E-05	215
LOKIASV2_1586_ESMFold_hypothetical_protein	AF-Q9C7T7-F1-model_v4	LOKIASV2_1586_ESMFold_hypothetical_protein	AF-Q9C7T7-F1-model_v4 Receptor protein-tyrosine kinase CEPR2	0.220	202	132	12	181	29	230	2.116E-06	215
LOKIASV2_1586_ESMFold_hypothetical_protein	AF-Q96CX6-F1-model_v4	LOKIASV2_1586_ESMFold_hypothetical_protein	AF-Q96CX6-F1-model_v4 Leucine-rich repeat-containing protein 58	0.270	159	91	54	178	56	214	6.884E-07	214
LOKIASV2_1586_ESMFold_hypothetical_protein	AF-Q9LP77-F1-model_v4	LOKIASV2_1586_ESMFold_hypothetical_protein	AF-Q9LP77-F1-model_v4 Probable inactive receptor kinase At1g48480	0.219	217	145	6	192	18	234	4.254E-07	214
LOKIASV2_1586_ESMFold_hypothetical_protein	AF-Q6NRC9-F1-model_v4	LOKIASV2_1586_ESMFold_hypothetical_protein	AF-Q6NRC9-F1-model_v4 Leucine-rich repeat and coiled-coil domain-containing protein 1	0.211	165	121	49	202	13	177	1.172E-05	214
LOKIASV2_1586_ESMFold_hypothetical_protein	AF-Q9FMD7-F1-model_v4	LOKIASV2_1586_ESMFold_hypothetical_protein	AF-Q9FMD7-F1-model_v4 Probable inactive receptor kinase At5g16590	0.163	196	151	9	189	19	214	1.803E-06	213
LOKIASV2_1586_ESMFold_hypothetical_protein	AF-C0LGD7-F1-model_v4	LOKIASV2_1586_ESMFold_hypothetical_protein	AF-C0LGD7-F1-model_v4 Probable LRR receptor-like serine/threonine-protein kinase At1g06840	0.229	224	129	12	179	32	255	3.086E-07	213
LOKIASV2_1586_ESMFold_hypothetical_protein	AF-C0LGT6-F1-model_v4	LOKIASV2_1586_ESMFold_hypothetical_protein	AF-C0LGT6-F1-model_v4 LRR receptor-like serine/threonine-protein kinase EFR	0.218	194	139	5	183	31	224	2.116E-06	213
LOKIASV2_1586_ESMFold_hypothetical_protein	AF-Q9SHI2-F1-model_v4	LOKIASV2_1586_ESMFold_hypothetical_protein	AF-Q9SHI2-F1-model_v4 Leucine-rich repeat receptor-like serine/threonine-protein kinase At1g17230	0.265	142	96	57	188	491	632	7.639E-06	213
LOKIASV2_1586_ESMFold_hypothetical_protein	AF-Q8BXA7-F1-model_v4	LOKIASV2_1586_ESMFold_hypothetical_protein	AF-Q8BXA7-F1-model_v4 PH domain leucine-rich repeat-containing protein phosphatase 2	0.237	137	101	52	184	329	465	5.526E-05	213
LOKIASV2_1586_ESMFold_hypothetical_protein	AF-Q6Z8P4-F1-model_v4	LOKIASV2_1586_ESMFold_hypothetical_protein	AF-Q6Z8P4-F1-model_v4 Plant intracellular Ras-group-related LRR protein 4	0.255	138	101	54	189	285	422	5.542E-06	212
LOKIASV2_1586_ESMFold_hypothetical_protein	AF-Q9SYQ8-F1-model_v4	LOKIASV2_1586_ESMFold_hypothetical_protein	AF-Q9SYQ8-F1-model_v4 Receptor protein kinase CLAVATA1	0.237	155	108	37	178	64	218	2.110E-05	212
LOKIASV2_1586_ESMFold_hypothetical_protein	AF-Q01513-F1-model_v4	LOKIASV2_1586_ESMFold_hypothetical_protein	AF-Q01513-F1-model_v4 Adenylate cyclase	0.243	163	101	50	184	810	972	3.425E-06	212
LOKIASV2_1586_ESMFold_hypothetical_protein	AF-Q6INV3-F1-model_v4	LOKIASV2_1586_ESMFold_hypothetical_protein	AF-Q6INV3-F1-model_v4 Leucine-rich repeat-containing protein 57	0.282	165	110	54	207	73	237	1.053E-05	211
LOKIASV2_1586_ESMFold_hypothetical_protein	AF-Q5G5E0-F1-model_v4	LOKIASV2_1586_ESMFold_hypothetical_protein	AF-Q5G5E0-F1-model_v4 Plant intracellular Ras-group-related LRR protein 5	0.246	183	133	12	194	187	364	5.846E-06	211
LOKIASV2_1586_ESMFold_hypothetical_protein	AF-Q9FK10-F1-model_v4	LOKIASV2_1586_ESMFold_hypothetical_protein	AF-Q9FK10-F1-model_v4 Probable inactive receptor kinase At5g53320	0.240	220	143	15	203	24	243	5.268E-07	211
LOKIASV2_1586_ESMFold_hypothetical_protein	AF-A0JM56-F1-model_v4	LOKIASV2_1586_ESMFold_hypothetical_protein	AF-A0JM56-F1-model_v4 Leucine-rich repeat-containing protein 9	0.218	216	156	3	203	846	1061	3.811E-06	211
LOKIASV2_1586_ESMFold_hypothetical_protein	AF-A0A0R0HPY5-F1-model_v4	LOKIASV2_1586_ESMFold_hypothetical_protein	AF-A0A0R0HPY5-F1-model_v4 Leucine-rich repeat receptor-like kinase protein CLV1a	0.232	164	117	37	189	67	230	1.236E-05	210
LOKIASV2_1586_ESMFold_hypothetical_protein	AF-Q8T888-F1-model_v4	LOKIASV2_1586_ESMFold_hypothetical_protein	AF-Q8T888-F1-model_v4 Dynein axonemal light chain 1	0.236	142	99	52	181	35	176	1.376E-05	209
LOKIASV2_1586_ESMFold_hypothetical_protein	AF-A6NM36-F1-model_v4	LOKIASV2_1586_ESMFold_hypothetical_protein	AF-A6NM36-F1-model_v4 Leucine-rich repeat-containing protein 30	0.235	185	123	23	184	33	217	4.475E-06	209
LOKIASV2_1586_ESMFold_hypothetical_protein	AF-Q3UGP9-F1-model_v4	LOKIASV2_1586_ESMFold_hypothetical_protein	AF-Q3UGP9-F1-model_v4 Leucine-rich repeat-containing protein 58	0.259	202	110	54	203	51	252	9.020E-08	209
LOKIASV2_1586_ESMFold_hypothetical_protein	AF-Q3UMG5-F1-model_v4	LOKIASV2_1586_ESMFold_hypothetical_protein	AF-Q3UMG5-F1-model_v4 Leucine-rich repeat and calponin homology domain-containing protein 2	0.184	240	171	1	211	73	312	4.254E-07	209
LOKIASV2_1586_ESMFold_hypothetical_protein	AF-Q8N9N7-F1-model_v4	LOKIASV2_1586_ESMFold_hypothetical_protein	AF-Q8N9N7-F1-model_v4 Leucine-rich repeat-containing protein 57	0.259	157	115	54	210	74	229	3.068E-05	208
LOKIASV2_1586_ESMFold_hypothetical_protein	AF-B4QVR7-F1-model_v4	LOKIASV2_1586_ESMFold_hypothetical_protein	AF-B4QVR7-F1-model_v4 Leucine-rich repeat protein soc-2 homolog	0.237	179	128	15	193	148	316	7.639E-06	208
LOKIASV2_1586_ESMFold_hypothetical_protein	AF-Q9ZUK3-F1-model_v4	LOKIASV2_1586_ESMFold_hypothetical_protein	AF-Q9ZUK3-F1-model_v4 Receptor-like protein 19	0.283	140	91	57	184	128	267	1.704E-05	208
LOKIASV2_1586_ESMFold_hypothetical_protein	AF-Q8K3W2-F1-model_v4	LOKIASV2_1586_ESMFold_hypothetical_protein	AF-Q8K3W2-F1-model_v4 Leucine-rich repeat-containing protein 10	0.198	189	142	1	189	1	178	2.226E-05	207
LOKIASV2_1586_ESMFold_hypothetical_protein	AF-Q8BHA1-F1-model_v4	LOKIASV2_1586_ESMFold_hypothetical_protein	AF-Q8BHA1-F1-model_v4 Leucine-rich repeat-containing protein 24	0.251	141	100	45	178	40	180	1.372E-04	207
LOKIASV2_1586_ESMFold_hypothetical_protein	AF-Q6R6I6-F1-model_v4	LOKIASV2_1586_ESMFold_hypothetical_protein	AF-Q6R6I6-F1-model_v4 Relaxin receptor 1	0.278	145	97	54	189	210	354	7.220E-05	207
LOKIASV2_1586_ESMFold_hypothetical_protein	AF-C0LGR3-F1-model_v4	LOKIASV2_1586_ESMFold_hypothetical_protein	AF-C0LGR3-F1-model_v4 LRR receptor-like serine/threonine-protein kinase RGI3	0.277	141	95	56	188	421	561	8.968E-06	207
LOKIASV2_1586_ESMFold_hypothetical_protein	AF-P34268-F1-model_v4	LOKIASV2_1586_ESMFold_hypothetical_protein	AF-P34268-F1-model_v4 Protein flightless-1 homolog	0.270	147	101	50	189	230	376	1.447E-04	207
LOKIASV2_1586_ESMFold_hypothetical_protein	AF-Q3ZC49-F1-model_v4	LOKIASV2_1586_ESMFold_hypothetical_protein	AF-Q3ZC49-F1-model_v4 Leucine-rich repeat-containing protein 39	0.187	280	166	6	210	36	315	3.256E-07	206
LOKIASV2_1586_ESMFold_hypothetical_protein	AF-Q8C0R9-F1-model_v4	LOKIASV2_1586_ESMFold_hypothetical_protein	AF-Q8C0R9-F1-model_v4 Leucine-rich repeat and death domain-containing protein 1	0.245	162	99	54	185	516	677	4.720E-06	206
LOKIASV2_1586_ESMFold_hypothetical_protein	AF-O49545-F1-model_v4	LOKIASV2_1586_ESMFold_hypothetical_protein	AF-O49545-F1-model_v4 Leucine-rich repeat receptor-like serine/threonine-protein kinase BAM1	0.230	202	140	7	189	27	228	5.253E-06	205
LOKIASV2_1586_ESMFold_hypothetical_protein	AF-A2AL36-F1-model_v4	LOKIASV2_1586_ESMFold_hypothetical_protein	AF-A2AL36-F1-model_v4 Centriolin	0.251	162	110	56	203	116	277	8.968E-06	205
