query	target	qheader	theader	fident	alnlen	mismatch	qstart	qend	tstart	tend	evalue	bits
LOKIASV2_1506_ESMFold_hypothetical_protein	AF-P46227-F1-model_v4	LOKIASV2_1506_ESMFold_hypothetical_protein	AF-P46227-F1-model_v4 Transcriptional repressor NrdR	0.113	44	35	1	44	3	43	5.075E+00	31
LOKIASV2_1506_ESMFold_hypothetical_protein	AF-B0JTA9-F1-model_v4	LOKIASV2_1506_ESMFold_hypothetical_protein	AF-B0JTA9-F1-model_v4 Transcriptional repressor NrdR	0.128	39	31	6	44	8	43	6.306E+00	31
LOKIASV2_1506_ESMFold_hypothetical_protein	AF-B0RVE0-F1-model_v4	LOKIASV2_1506_ESMFold_hypothetical_protein	AF-B0RVE0-F1-model_v4 Transcriptional repressor NrdR	0.113	44	35	1	44	3	43	4.312E+00	31
LOKIASV2_1506_ESMFold_hypothetical_protein	AF-Q2NZ85-F1-model_v4	LOKIASV2_1506_ESMFold_hypothetical_protein	AF-Q2NZ85-F1-model_v4 Transcriptional repressor NrdR	0.113	44	35	1	44	3	43	4.553E+00	31
LOKIASV2_1506_ESMFold_hypothetical_protein	AF-A9HHY9-F1-model_v4	LOKIASV2_1506_ESMFold_hypothetical_protein	AF-A9HHY9-F1-model_v4 Transcriptional repressor NrdR	0.090	44	36	1	44	3	43	7.836E+00	31
LOKIASV2_1506_ESMFold_hypothetical_protein	AF-B7JX64-F1-model_v4	LOKIASV2_1506_ESMFold_hypothetical_protein	AF-B7JX64-F1-model_v4 Transcriptional repressor NrdR	0.113	44	35	1	44	3	43	4.807E+00	31
LOKIASV2_1506_ESMFold_hypothetical_protein	AF-A9VYW5-F1-model_v4	LOKIASV2_1506_ESMFold_hypothetical_protein	AF-A9VYW5-F1-model_v4 Transcriptional repressor NrdR	0.131	38	30	7	44	9	43	5.973E+00	31
LOKIASV2_1506_ESMFold_hypothetical_protein	AF-P12004-F1-model_v4	LOKIASV2_1506_ESMFold_hypothetical_protein	AF-P12004-F1-model_v4 Proliferating cell nuclear antigen	0.090	95	75	9	91	26	120	1.379E+00	31
LOKIASV2_1506_ESMFold_hypothetical_protein	AF-O66423-F1-model_v4	LOKIASV2_1506_ESMFold_hypothetical_protein	AF-O66423-F1-model_v4 Uncharacterized protein aq_aa34	0.090	33	29	11	43	19	51	7.030E+00	31
LOKIASV2_1506_ESMFold_hypothetical_protein	AF-P67448-F1-model_v4	LOKIASV2_1506_ESMFold_hypothetical_protein	AF-P67448-F1-model_v4 Exodeoxyribonuclease 7 large subunit	0.066	83	74	8	90	29	108	5.973E+00	31
LOKIASV2_1506_ESMFold_hypothetical_protein	AF-Q8NRM3-F1-model_v4	LOKIASV2_1506_ESMFold_hypothetical_protein	AF-Q8NRM3-F1-model_v4 Exodeoxyribonuclease 7 large subunit	0.100	83	69	8	90	37	114	4.807E+00	31
LOKIASV2_1506_ESMFold_hypothetical_protein	AF-A4QCY8-F1-model_v4	LOKIASV2_1506_ESMFold_hypothetical_protein	AF-A4QCY8-F1-model_v4 Exodeoxyribonuclease 7 large subunit	0.123	82	66	9	90	39	114	5.075E+00	31
LOKIASV2_1506_ESMFold_hypothetical_protein	AF-Q5YQ92-F1-model_v4	LOKIASV2_1506_ESMFold_hypothetical_protein	AF-Q5YQ92-F1-model_v4 Exodeoxyribonuclease 7 large subunit	0.100	83	69	8	90	37	114	4.807E+00	31
LOKIASV2_1506_ESMFold_hypothetical_protein	AF-A3LN69-F1-model_v4	LOKIASV2_1506_ESMFold_hypothetical_protein	AF-A3LN69-F1-model_v4 Probable metalloreductase AIM14	0.090	82	74	9	90	252	333	1.623E+00	31
LOKIASV2_1506_ESMFold_hypothetical_protein	AF-P9WL46-F1-model_v4	LOKIASV2_1506_ESMFold_hypothetical_protein	AF-P9WL46-F1-model_v4 Uncharacterized protein MT2734.1	0.122	50	42	14	63	42	90	3.470E+00	30
LOKIASV2_1506_ESMFold_hypothetical_protein	AF-A7I807-F1-model_v4	LOKIASV2_1506_ESMFold_hypothetical_protein	AF-A7I807-F1-model_v4 Translation initiation factor 5A	0.102	38	32	9	45	23	60	8.273E+00	30
LOKIASV2_1506_ESMFold_hypothetical_protein	AF-P45934-F1-model_v4	LOKIASV2_1506_ESMFold_hypothetical_protein	AF-P45934-F1-model_v4 Uncharacterized protein YqbS	0.100	40	35	6	45	100	139	4.553E+00	30
LOKIASV2_1506_ESMFold_hypothetical_protein	AF-B1JIE4-F1-model_v4	LOKIASV2_1506_ESMFold_hypothetical_protein	AF-B1JIE4-F1-model_v4 Transcriptional repressor NrdR	0.113	44	35	1	44	3	43	5.973E+00	30
LOKIASV2_1506_ESMFold_hypothetical_protein	AF-B1LJG3-F1-model_v4	LOKIASV2_1506_ESMFold_hypothetical_protein	AF-B1LJG3-F1-model_v4 Transcriptional repressor NrdR	0.136	44	35	1	44	3	43	5.358E+00	30
LOKIASV2_1506_ESMFold_hypothetical_protein	AF-Q6LU16-F1-model_v4	LOKIASV2_1506_ESMFold_hypothetical_protein	AF-Q6LU16-F1-model_v4 Transcriptional repressor NrdR	0.136	44	35	1	44	3	43	5.657E+00	30
LOKIASV2_1506_ESMFold_hypothetical_protein	AF-A1VRC9-F1-model_v4	LOKIASV2_1506_ESMFold_hypothetical_protein	AF-A1VRC9-F1-model_v4 Transcriptional repressor NrdR	0.136	44	35	1	44	3	43	5.358E+00	30
LOKIASV2_1506_ESMFold_hypothetical_protein	AF-Q0TKM8-F1-model_v4	LOKIASV2_1506_ESMFold_hypothetical_protein	AF-Q0TKM8-F1-model_v4 Transcriptional repressor NrdR	0.136	44	35	1	44	3	43	5.358E+00	30
LOKIASV2_1506_ESMFold_hypothetical_protein	AF-B8E395-F1-model_v4	LOKIASV2_1506_ESMFold_hypothetical_protein	AF-B8E395-F1-model_v4 Transcriptional repressor NrdR	0.142	35	27	13	44	9	43	8.735E+00	30
LOKIASV2_1506_ESMFold_hypothetical_protein	AF-Q2RTB9-F1-model_v4	LOKIASV2_1506_ESMFold_hypothetical_protein	AF-Q2RTB9-F1-model_v4 Transcriptional repressor NrdR	0.136	44	35	1	44	3	43	9.222E+00	30
LOKIASV2_1506_ESMFold_hypothetical_protein	AF-Q3YSX9-F1-model_v4	LOKIASV2_1506_ESMFold_hypothetical_protein	AF-Q3YSX9-F1-model_v4 Transcriptional repressor NrdR	0.200	35	25	13	44	9	43	8.735E+00	30
LOKIASV2_1506_ESMFold_hypothetical_protein	AF-Q1IFM4-F1-model_v4	LOKIASV2_1506_ESMFold_hypothetical_protein	AF-Q1IFM4-F1-model_v4 Transcriptional repressor NrdR	0.113	44	35	1	44	3	43	6.306E+00	30
LOKIASV2_1506_ESMFold_hypothetical_protein	AF-B7V7Q1-F1-model_v4	LOKIASV2_1506_ESMFold_hypothetical_protein	AF-B7V7Q1-F1-model_v4 Transcriptional repressor NrdR	0.113	44	35	1	44	3	43	6.306E+00	30
LOKIASV2_1506_ESMFold_hypothetical_protein	AF-A5VXV6-F1-model_v4	LOKIASV2_1506_ESMFold_hypothetical_protein	AF-A5VXV6-F1-model_v4 Transcriptional repressor NrdR	0.113	44	35	1	44	3	43	5.973E+00	30
LOKIASV2_1506_ESMFold_hypothetical_protein	AF-A4XZ39-F1-model_v4	LOKIASV2_1506_ESMFold_hypothetical_protein	AF-A4XZ39-F1-model_v4 Transcriptional repressor NrdR	0.113	44	35	1	44	3	43	5.973E+00	30
LOKIASV2_1506_ESMFold_hypothetical_protein	AF-B8FJ73-F1-model_v4	LOKIASV2_1506_ESMFold_hypothetical_protein	AF-B8FJ73-F1-model_v4 Transcriptional repressor NrdR	0.142	49	39	1	49	3	48	5.973E+00	30
LOKIASV2_1506_ESMFold_hypothetical_protein	AF-Q0BTE7-F1-model_v4	LOKIASV2_1506_ESMFold_hypothetical_protein	AF-Q0BTE7-F1-model_v4 Transcriptional repressor NrdR	0.113	44	35	1	44	3	43	5.973E+00	30
LOKIASV2_1506_ESMFold_hypothetical_protein	AF-B0T1I4-F1-model_v4	LOKIASV2_1506_ESMFold_hypothetical_protein	AF-B0T1I4-F1-model_v4 Transcriptional repressor NrdR	0.131	38	30	7	44	9	43	7.836E+00	30
LOKIASV2_1506_ESMFold_hypothetical_protein	AF-B6JGI0-F1-model_v4	LOKIASV2_1506_ESMFold_hypothetical_protein	AF-B6JGI0-F1-model_v4 Transcriptional repressor NrdR	0.136	44	35	1	44	3	43	9.737E+00	30
LOKIASV2_1506_ESMFold_hypothetical_protein	AF-Q82UQ0-F1-model_v4	LOKIASV2_1506_ESMFold_hypothetical_protein	AF-Q82UQ0-F1-model_v4 Transcriptional repressor NrdR	0.171	35	26	13	44	9	43	8.273E+00	30
LOKIASV2_1506_ESMFold_hypothetical_protein	AF-Q9GU68-F1-model_v4	LOKIASV2_1506_ESMFold_hypothetical_protein	AF-Q9GU68-F1-model_v4 Eukaryotic translation initiation factor 5A	0.115	52	36	3	44	24	75	5.358E+00	30
LOKIASV2_1506_ESMFold_hypothetical_protein	AF-P24922-F1-model_v4	LOKIASV2_1506_ESMFold_hypothetical_protein	AF-P24922-F1-model_v4 Eukaryotic translation initiation factor 5A-2	0.115	52	36	3	44	25	76	5.657E+00	30
LOKIASV2_1506_ESMFold_hypothetical_protein	AF-Q5M5X8-F1-model_v4	LOKIASV2_1506_ESMFold_hypothetical_protein	AF-Q5M5X8-F1-model_v4 Transcriptional repressor NrdR	0.076	52	42	1	52	3	48	9.222E+00	30
LOKIASV2_1506_ESMFold_hypothetical_protein	AF-Q0AFT7-F1-model_v4	LOKIASV2_1506_ESMFold_hypothetical_protein	AF-Q0AFT7-F1-model_v4 Transcriptional repressor NrdR	0.090	44	36	1	44	3	43	5.657E+00	30
LOKIASV2_1506_ESMFold_hypothetical_protein	AF-P80639-F1-model_v4	LOKIASV2_1506_ESMFold_hypothetical_protein	AF-P80639-F1-model_v4 Eukaryotic translation initiation factor 5A	0.113	53	37	2	44	25	77	5.075E+00	30
LOKIASV2_1506_ESMFold_hypothetical_protein	AF-Q136T8-F1-model_v4	LOKIASV2_1506_ESMFold_hypothetical_protein	AF-Q136T8-F1-model_v4 Transcriptional repressor NrdR	0.113	44	35	1	44	3	43	9.737E+00	30
LOKIASV2_1506_ESMFold_hypothetical_protein	AF-B2T084-F1-model_v4	LOKIASV2_1506_ESMFold_hypothetical_protein	AF-B2T084-F1-model_v4 Transcriptional repressor NrdR	0.113	44	35	1	44	3	43	5.657E+00	30
LOKIASV2_1506_ESMFold_hypothetical_protein	AF-P56333-F1-model_v4	LOKIASV2_1506_ESMFold_hypothetical_protein	AF-P56333-F1-model_v4 Eukaryotic translation initiation factor 5A-1/2	0.115	52	36	3	44	25	76	5.075E+00	30
LOKIASV2_1506_ESMFold_hypothetical_protein	AF-Q9UST4-F1-model_v4	LOKIASV2_1506_ESMFold_hypothetical_protein	AF-Q9UST4-F1-model_v4 Eukaryotic translation initiation factor 5A-2	0.096	52	37	3	44	37	88	5.973E+00	30
LOKIASV2_1506_ESMFold_hypothetical_protein	AF-Q3BXI6-F1-model_v4	LOKIASV2_1506_ESMFold_hypothetical_protein	AF-Q3BXI6-F1-model_v4 Transcriptional repressor NrdR	0.113	44	35	1	44	3	43	4.807E+00	30
LOKIASV2_1506_ESMFold_hypothetical_protein	AF-Q4UQT7-F1-model_v4	LOKIASV2_1506_ESMFold_hypothetical_protein	AF-Q4UQT7-F1-model_v4 Transcriptional repressor NrdR	0.113	44	35	1	44	3	43	4.807E+00	30
LOKIASV2_1506_ESMFold_hypothetical_protein	AF-Q8PPE2-F1-model_v4	LOKIASV2_1506_ESMFold_hypothetical_protein	AF-Q8PPE2-F1-model_v4 Transcriptional repressor NrdR	0.113	44	35	1	44	3	43	4.807E+00	30
LOKIASV2_1506_ESMFold_hypothetical_protein	AF-Q87AS3-F1-model_v4	LOKIASV2_1506_ESMFold_hypothetical_protein	AF-Q87AS3-F1-model_v4 Transcriptional repressor NrdR	0.121	41	33	4	44	6	43	5.657E+00	30
LOKIASV2_1506_ESMFold_hypothetical_protein	AF-B2I8Q9-F1-model_v4	LOKIASV2_1506_ESMFold_hypothetical_protein	AF-B2I8Q9-F1-model_v4 Transcriptional repressor NrdR	0.121	41	33	4	44	6	43	5.657E+00	30
LOKIASV2_1506_ESMFold_hypothetical_protein	AF-B0U4K7-F1-model_v4	LOKIASV2_1506_ESMFold_hypothetical_protein	AF-B0U4K7-F1-model_v4 Transcriptional repressor NrdR	0.121	41	33	4	44	6	43	5.657E+00	30
LOKIASV2_1506_ESMFold_hypothetical_protein	AF-B8DSV1-F1-model_v4	LOKIASV2_1506_ESMFold_hypothetical_protein	AF-B8DSV1-F1-model_v4 Transcriptional repressor NrdR	0.159	44	34	1	44	3	43	5.358E+00	30
LOKIASV2_1506_ESMFold_hypothetical_protein	AF-Q9W644-F1-model_v4	LOKIASV2_1506_ESMFold_hypothetical_protein	AF-Q9W644-F1-model_v4 Proliferating cell nuclear antigen	0.088	95	75	9	91	26	120	1.537E+00	30
LOKIASV2_1506_ESMFold_hypothetical_protein	AF-Q3ZBW4-F1-model_v4	LOKIASV2_1506_ESMFold_hypothetical_protein	AF-Q3ZBW4-F1-model_v4 Proliferating cell nuclear antigen	0.101	85	68	15	91	36	120	1.910E+00	30
LOKIASV2_1506_ESMFold_hypothetical_protein	AF-Q9DEA3-F1-model_v4	LOKIASV2_1506_ESMFold_hypothetical_protein	AF-Q9DEA3-F1-model_v4 Proliferating cell nuclear antigen	0.090	95	75	9	91	26	120	1.809E+00	30
LOKIASV2_1506_ESMFold_hypothetical_protein	AF-Q9MAY3-F1-model_v4	LOKIASV2_1506_ESMFold_hypothetical_protein	AF-Q9MAY3-F1-model_v4 Proliferating cell nuclear antigen	0.070	95	76	9	91	26	120	2.016E+00	30
LOKIASV2_1506_ESMFold_hypothetical_protein	AF-P53358-F1-model_v4	LOKIASV2_1506_ESMFold_hypothetical_protein	AF-P53358-F1-model_v4 Proliferating cell nuclear antigen	0.078	95	76	9	91	26	120	1.537E+00	30
LOKIASV2_1506_ESMFold_hypothetical_protein	AF-Q8DEE1-F1-model_v4	LOKIASV2_1506_ESMFold_hypothetical_protein	AF-Q8DEE1-F1-model_v4 2-isopropylmalate synthase	0.120	78	63	9	86	391	463	1.237E+00	30
LOKIASV2_1506_ESMFold_hypothetical_protein	AF-A1CX75-F1-model_v4	LOKIASV2_1506_ESMFold_hypothetical_protein	AF-A1CX75-F1-model_v4 Molybdenum cofactor sulfurase	0.115	87	65	15	89	561	647	2.373E+00	30
LOKIASV2_1506_ESMFold_hypothetical_protein	AF-P9WL47-F1-model_v4	LOKIASV2_1506_ESMFold_hypothetical_protein	AF-P9WL47-F1-model_v4 Uncharacterized protein Rv2658c	0.114	54	46	14	67	42	94	3.287E+00	29
LOKIASV2_1506_ESMFold_hypothetical_protein	AF-Q45549-F1-model_v4	LOKIASV2_1506_ESMFold_hypothetical_protein	AF-Q45549-F1-model_v4 Transcriptional repressor NrdR	0.113	44	35	1	44	3	43	5.973E+00	29
LOKIASV2_1506_ESMFold_hypothetical_protein	AF-Q9K861-F1-model_v4	LOKIASV2_1506_ESMFold_hypothetical_protein	AF-Q9K861-F1-model_v4 Transcriptional repressor NrdR	0.115	52	40	1	52	3	48	9.737E+00	29
LOKIASV2_1506_ESMFold_hypothetical_protein	AF-Q47MY6-F1-model_v4	LOKIASV2_1506_ESMFold_hypothetical_protein	AF-Q47MY6-F1-model_v4 Transcriptional repressor NrdR	0.113	44	35	1	44	3	43	6.306E+00	29
LOKIASV2_1506_ESMFold_hypothetical_protein	AF-Q9HWX1-F1-model_v4	LOKIASV2_1506_ESMFold_hypothetical_protein	AF-Q9HWX1-F1-model_v4 Transcriptional repressor NrdR	0.113	44	35	1	44	3	43	6.658E+00	29
LOKIASV2_1506_ESMFold_hypothetical_protein	AF-A0PT74-F1-model_v4	LOKIASV2_1506_ESMFold_hypothetical_protein	AF-A0PT74-F1-model_v4 Transcriptional repressor NrdR	0.090	44	36	1	44	3	43	5.973E+00	29
LOKIASV2_1506_ESMFold_hypothetical_protein	AF-P67314-F1-model_v4	LOKIASV2_1506_ESMFold_hypothetical_protein	AF-P67314-F1-model_v4 Transcriptional repressor NrdR	0.090	44	36	1	44	3	43	5.973E+00	29
LOKIASV2_1506_ESMFold_hypothetical_protein	AF-B1J3F1-F1-model_v4	LOKIASV2_1506_ESMFold_hypothetical_protein	AF-B1J3F1-F1-model_v4 Transcriptional repressor NrdR	0.113	44	35	1	44	3	43	6.658E+00	29
LOKIASV2_1506_ESMFold_hypothetical_protein	AF-C1DLH3-F1-model_v4	LOKIASV2_1506_ESMFold_hypothetical_protein	AF-C1DLH3-F1-model_v4 Transcriptional repressor NrdR	0.113	44	35	1	44	3	43	6.658E+00	29
LOKIASV2_1506_ESMFold_hypothetical_protein	AF-Q7UG92-F1-model_v4	LOKIASV2_1506_ESMFold_hypothetical_protein	AF-Q7UG92-F1-model_v4 Transcriptional repressor NrdR	0.102	39	31	6	44	8	43	8.273E+00	29
LOKIASV2_1506_ESMFold_hypothetical_protein	AF-P69039-F1-model_v4	LOKIASV2_1506_ESMFold_hypothetical_protein	AF-P69039-F1-model_v4 Eukaryotic translation initiation factor 5A-1	0.115	52	36	3	44	25	76	6.658E+00	29
LOKIASV2_1506_ESMFold_hypothetical_protein	AF-P69040-F1-model_v4	LOKIASV2_1506_ESMFold_hypothetical_protein	AF-P69040-F1-model_v4 Eukaryotic translation initiation factor 5A-1	0.115	52	36	3	44	25	76	6.658E+00	29
LOKIASV2_1506_ESMFold_hypothetical_protein	AF-Q945F4-F1-model_v4	LOKIASV2_1506_ESMFold_hypothetical_protein	AF-Q945F4-F1-model_v4 Eukaryotic translation initiation factor 5A-2	0.115	52	36	3	44	25	76	6.306E+00	29
LOKIASV2_1506_ESMFold_hypothetical_protein	AF-Q2YD57-F1-model_v4	LOKIASV2_1506_ESMFold_hypothetical_protein	AF-Q2YD57-F1-model_v4 Transcriptional repressor NrdR	0.113	44	35	1	44	3	43	6.306E+00	29
LOKIASV2_1506_ESMFold_hypothetical_protein	AF-Q6FFE5-F1-model_v4	LOKIASV2_1506_ESMFold_hypothetical_protein	AF-Q6FFE5-F1-model_v4 Transcriptional repressor NrdR	0.090	44	36	1	44	3	43	6.306E+00	29
LOKIASV2_1506_ESMFold_hypothetical_protein	AF-P56336-F1-model_v4	LOKIASV2_1506_ESMFold_hypothetical_protein	AF-P56336-F1-model_v4 Eukaryotic translation initiation factor 5A-4	0.115	52	36	3	44	25	76	5.973E+00	29
LOKIASV2_1506_ESMFold_hypothetical_protein	AF-P62925-F1-model_v4	LOKIASV2_1506_ESMFold_hypothetical_protein	AF-P62925-F1-model_v4 Eukaryotic translation initiation factor 5A	0.115	52	36	3	44	25	76	5.973E+00	29
LOKIASV2_1506_ESMFold_hypothetical_protein	AF-Q9AXQ3-F1-model_v4	LOKIASV2_1506_ESMFold_hypothetical_protein	AF-Q9AXQ3-F1-model_v4 Eukaryotic translation initiation factor 5A-4	0.115	52	36	3	44	25	76	5.973E+00	29
LOKIASV2_1506_ESMFold_hypothetical_protein	AF-Q9AXQ5-F1-model_v4	LOKIASV2_1506_ESMFold_hypothetical_protein	AF-Q9AXQ5-F1-model_v4 Eukaryotic translation initiation factor 5A-2	0.115	52	36	3	44	25	76	6.306E+00	29
LOKIASV2_1506_ESMFold_hypothetical_protein	AF-Q9AXQ7-F1-model_v4	LOKIASV2_1506_ESMFold_hypothetical_protein	AF-Q9AXQ7-F1-model_v4 Eukaryotic translation initiation factor 5A	0.115	52	36	3	44	25	76	6.658E+00	29
LOKIASV2_1506_ESMFold_hypothetical_protein	AF-A5GR10-F1-model_v4	LOKIASV2_1506_ESMFold_hypothetical_protein	AF-A5GR10-F1-model_v4 Transcriptional repressor NrdR	0.113	44	35	1	44	3	43	6.658E+00	29
LOKIASV2_1506_ESMFold_hypothetical_protein	AF-P38672-F1-model_v4	LOKIASV2_1506_ESMFold_hypothetical_protein	AF-P38672-F1-model_v4 Eukaryotic translation initiation factor 5A	0.132	53	36	2	44	29	81	5.973E+00	29
LOKIASV2_1506_ESMFold_hypothetical_protein	AF-B4SJB3-F1-model_v4	LOKIASV2_1506_ESMFold_hypothetical_protein	AF-B4SJB3-F1-model_v4 Transcriptional repressor NrdR	0.090	44	36	1	44	3	43	6.306E+00	29
LOKIASV2_1506_ESMFold_hypothetical_protein	AF-B2FNK6-F1-model_v4	LOKIASV2_1506_ESMFold_hypothetical_protein	AF-B2FNK6-F1-model_v4 Transcriptional repressor NrdR	0.090	44	36	1	44	3	43	6.658E+00	29
LOKIASV2_1506_ESMFold_hypothetical_protein	AF-Q5GW09-F1-model_v4	LOKIASV2_1506_ESMFold_hypothetical_protein	AF-Q5GW09-F1-model_v4 Transcriptional repressor NrdR	0.113	44	35	1	44	3	43	5.657E+00	29
LOKIASV2_1506_ESMFold_hypothetical_protein	AF-Q8PCN3-F1-model_v4	LOKIASV2_1506_ESMFold_hypothetical_protein	AF-Q8PCN3-F1-model_v4 Transcriptional repressor NrdR	0.113	44	35	1	44	3	43	5.973E+00	29
LOKIASV2_1506_ESMFold_hypothetical_protein	AF-B7KFG7-F1-model_v4	LOKIASV2_1506_ESMFold_hypothetical_protein	AF-B7KFG7-F1-model_v4 Transcriptional repressor NrdR	0.102	39	31	6	44	8	43	8.273E+00	29
LOKIASV2_1506_ESMFold_hypothetical_protein	AF-B7KUT4-F1-model_v4	LOKIASV2_1506_ESMFold_hypothetical_protein	AF-B7KUT4-F1-model_v4 Transcriptional repressor NrdR	0.113	44	35	1	44	3	43	5.657E+00	29
LOKIASV2_1506_ESMFold_hypothetical_protein	AF-A9HX42-F1-model_v4	LOKIASV2_1506_ESMFold_hypothetical_protein	AF-A9HX42-F1-model_v4 Elongation factor P	0.098	51	37	3	44	5	55	5.973E+00	29
LOKIASV2_1506_ESMFold_hypothetical_protein	AF-Q9UKL6-F1-model_v4	LOKIASV2_1506_ESMFold_hypothetical_protein	AF-Q9UKL6-F1-model_v4 Phosphatidylcholine transfer protein	0.053	98	75	12	91	85	182	1.306E+00	29
LOKIASV2_1506_ESMFold_hypothetical_protein	AF-P61258-F1-model_v4	LOKIASV2_1506_ESMFold_hypothetical_protein	AF-P61258-F1-model_v4 Proliferating cell nuclear antigen	0.090	95	75	9	91	26	120	2.016E+00	29
LOKIASV2_1506_ESMFold_hypothetical_protein	AF-P04961-F1-model_v4	LOKIASV2_1506_ESMFold_hypothetical_protein	AF-P04961-F1-model_v4 Proliferating cell nuclear antigen	0.093	103	80	3	91	18	120	1.713E+00	29
LOKIASV2_1506_ESMFold_hypothetical_protein	AF-P57761-F1-model_v4	LOKIASV2_1506_ESMFold_hypothetical_protein	AF-P57761-F1-model_v4 Proliferating cell nuclear antigen	0.093	103	80	3	91	18	120	1.809E+00	29
LOKIASV2_1506_ESMFold_hypothetical_protein	AF-O66402-F1-model_v4	LOKIASV2_1506_ESMFold_hypothetical_protein	AF-O66402-F1-model_v4 Uncharacterized protein aq_aa07	0.105	38	32	6	43	14	50	7.030E+00	29
LOKIASV2_1506_ESMFold_hypothetical_protein	AF-Q72PE5-F1-model_v4	LOKIASV2_1506_ESMFold_hypothetical_protein	AF-Q72PE5-F1-model_v4 Sulfate/thiosulfate import ATP-binding protein CysA	0.098	85	58	7	91	290	354	4.807E+00	29
LOKIASV2_1506_ESMFold_hypothetical_protein	AF-Q6NI37-F1-model_v4	LOKIASV2_1506_ESMFold_hypothetical_protein	AF-Q6NI37-F1-model_v4 Exodeoxyribonuclease 7 large subunit	0.077	83	71	8	90	33	110	6.658E+00	29
LOKIASV2_1506_ESMFold_hypothetical_protein	AF-Q4JU84-F1-model_v4	LOKIASV2_1506_ESMFold_hypothetical_protein	AF-Q4JU84-F1-model_v4 Exodeoxyribonuclease 7 large subunit	0.082	83	66	8	90	32	104	6.658E+00	29
LOKIASV2_1506_ESMFold_hypothetical_protein	AF-Q6CT29-F1-model_v4	LOKIASV2_1506_ESMFold_hypothetical_protein	AF-Q6CT29-F1-model_v4 RuvB-like helicase 2	0.162	37	29	9	45	136	171	6.306E+00	29
LOKIASV2_1506_ESMFold_hypothetical_protein	AF-Q9KP83-F1-model_v4	LOKIASV2_1506_ESMFold_hypothetical_protein	AF-Q9KP83-F1-model_v4 2-isopropylmalate synthase	0.108	78	64	9	86	391	463	1.379E+00	29
LOKIASV2_1506_ESMFold_hypothetical_protein	AF-O15016-F1-model_v4	LOKIASV2_1506_ESMFold_hypothetical_protein	AF-O15016-F1-model_v4 Tripartite motif-containing protein 66	0.153	39	30	14	50	879	917	4.084E+00	29
LOKIASV2_1506_ESMFold_hypothetical_protein	AF-Q21V28-F1-model_v4	LOKIASV2_1506_ESMFold_hypothetical_protein	AF-Q21V28-F1-model_v4 Transcriptional repressor NrdR	0.113	44	35	1	44	3	43	7.422E+00	28
LOKIASV2_1506_ESMFold_hypothetical_protein	AF-A4TPG9-F1-model_v4	LOKIASV2_1506_ESMFold_hypothetical_protein	AF-A4TPG9-F1-model_v4 Transcriptional repressor NrdR	0.113	44	35	1	44	3	43	7.836E+00	28
LOKIASV2_1506_ESMFold_hypothetical_protein	AF-B5E858-F1-model_v4	LOKIASV2_1506_ESMFold_hypothetical_protein	AF-B5E858-F1-model_v4 Transcriptional repressor NrdR	0.102	39	31	6	44	8	43	9.737E+00	28
LOKIASV2_1506_ESMFold_hypothetical_protein	AF-B9KHI5-F1-model_v4	LOKIASV2_1506_ESMFold_hypothetical_protein	AF-B9KHI5-F1-model_v4 Transcriptional repressor NrdR	0.136	44	35	1	44	3	43	7.836E+00	28
LOKIASV2_1506_ESMFold_hypothetical_protein	AF-B0VMH0-F1-model_v4	LOKIASV2_1506_ESMFold_hypothetical_protein	AF-B0VMH0-F1-model_v4 Transcriptional repressor NrdR	0.090	44	36	1	44	3	43	7.422E+00	28
LOKIASV2_1506_ESMFold_hypothetical_protein	AF-A7Z7I6-F1-model_v4	LOKIASV2_1506_ESMFold_hypothetical_protein	AF-A7Z7I6-F1-model_v4 Transcriptional repressor NrdR	0.133	45	36	1	45	3	44	7.836E+00	28
LOKIASV2_1506_ESMFold_hypothetical_protein	AF-B7I302-F1-model_v4	LOKIASV2_1506_ESMFold_hypothetical_protein	AF-B7I302-F1-model_v4 Transcriptional repressor NrdR	0.090	44	36	1	44	3	43	7.422E+00	28
LOKIASV2_1506_ESMFold_hypothetical_protein	AF-Q5SM09-F1-model_v4	LOKIASV2_1506_ESMFold_hypothetical_protein	AF-Q5SM09-F1-model_v4 Transcriptional repressor NrdR	0.113	44	35	1	44	3	43	7.422E+00	28
LOKIASV2_1506_ESMFold_hypothetical_protein	AF-A4XL57-F1-model_v4	LOKIASV2_1506_ESMFold_hypothetical_protein	AF-A4XL57-F1-model_v4 Transcriptional repressor NrdR	0.090	44	36	1	44	3	43	7.422E+00	28
LOKIASV2_1506_ESMFold_hypothetical_protein	AF-A4X4W8-F1-model_v4	LOKIASV2_1506_ESMFold_hypothetical_protein	AF-A4X4W8-F1-model_v4 Transcriptional repressor NrdR	0.090	44	36	1	44	3	43	7.030E+00	28
LOKIASV2_1506_ESMFold_hypothetical_protein	AF-Q1LJX2-F1-model_v4	LOKIASV2_1506_ESMFold_hypothetical_protein	AF-Q1LJX2-F1-model_v4 Transcriptional repressor NrdR	0.090	44	36	1	44	3	43	7.030E+00	28
LOKIASV2_1506_ESMFold_hypothetical_protein	AF-A6T0T5-F1-model_v4	LOKIASV2_1506_ESMFold_hypothetical_protein	AF-A6T0T5-F1-model_v4 Transcriptional repressor NrdR	0.090	44	36	1	44	3	43	7.422E+00	28
LOKIASV2_1506_ESMFold_hypothetical_protein	AF-A4G7M3-F1-model_v4	LOKIASV2_1506_ESMFold_hypothetical_protein	AF-A4G7M3-F1-model_v4 Transcriptional repressor NrdR	0.113	44	35	1	44	3	43	6.658E+00	28
LOKIASV2_1506_ESMFold_hypothetical_protein	AF-B6J8Q8-F1-model_v4	LOKIASV2_1506_ESMFold_hypothetical_protein	AF-B6J8Q8-F1-model_v4 Transcriptional repressor NrdR	0.113	44	35	1	44	3	43	7.030E+00	28
LOKIASV2_1506_ESMFold_hypothetical_protein	AF-Q2YN94-F1-model_v4	LOKIASV2_1506_ESMFold_hypothetical_protein	AF-Q2YN94-F1-model_v4 Transcriptional repressor NrdR	0.090	44	36	1	44	3	43	7.422E+00	28
LOKIASV2_1506_ESMFold_hypothetical_protein	AF-B2S514-F1-model_v4	LOKIASV2_1506_ESMFold_hypothetical_protein	AF-B2S514-F1-model_v4 Transcriptional repressor NrdR	0.090	44	36	1	44	3	43	7.030E+00	28
LOKIASV2_1506_ESMFold_hypothetical_protein	AF-C5CHN3-F1-model_v4	LOKIASV2_1506_ESMFold_hypothetical_protein	AF-C5CHN3-F1-model_v4 Transcriptional repressor NrdR	0.088	45	37	1	45	3	44	7.422E+00	28
LOKIASV2_1506_ESMFold_hypothetical_protein	AF-P67311-F1-model_v4	LOKIASV2_1506_ESMFold_hypothetical_protein	AF-P67311-F1-model_v4 Transcriptional repressor NrdR	0.090	44	36	1	44	3	43	7.422E+00	28
LOKIASV2_1506_ESMFold_hypothetical_protein	AF-B5ZXT9-F1-model_v4	LOKIASV2_1506_ESMFold_hypothetical_protein	AF-B5ZXT9-F1-model_v4 Transcriptional repressor NrdR	0.113	44	35	1	44	3	43	6.658E+00	28
LOKIASV2_1506_ESMFold_hypothetical_protein	AF-A1USI1-F1-model_v4	LOKIASV2_1506_ESMFold_hypothetical_protein	AF-A1USI1-F1-model_v4 Transcriptional repressor NrdR	0.090	44	36	1	44	3	43	7.030E+00	28
LOKIASV2_1506_ESMFold_hypothetical_protein	AF-Q20751-F1-model_v4	LOKIASV2_1506_ESMFold_hypothetical_protein	AF-Q20751-F1-model_v4 Eukaryotic translation initiation factor 5A-2	0.075	53	39	2	44	26	78	7.030E+00	28
LOKIASV2_1506_ESMFold_hypothetical_protein	AF-Q8DHT4-F1-model_v4	LOKIASV2_1506_ESMFold_hypothetical_protein	AF-Q8DHT4-F1-model_v4 Transcriptional repressor NrdR	0.090	44	36	1	44	3	43	7.836E+00	28
LOKIASV2_1506_ESMFold_hypothetical_protein	AF-A9WS75-F1-model_v4	LOKIASV2_1506_ESMFold_hypothetical_protein	AF-A9WS75-F1-model_v4 Transcriptional repressor NrdR	0.113	44	35	1	44	3	43	7.422E+00	28
LOKIASV2_1506_ESMFold_hypothetical_protein	AF-B0BZ87-F1-model_v4	LOKIASV2_1506_ESMFold_hypothetical_protein	AF-B0BZ87-F1-model_v4 Transcriptional repressor NrdR	0.113	44	35	1	44	3	43	7.422E+00	28
LOKIASV2_1506_ESMFold_hypothetical_protein	AF-Q9NVQ4-F1-model_v4	LOKIASV2_1506_ESMFold_hypothetical_protein	AF-Q9NVQ4-F1-model_v4 Fas apoptotic inhibitory molecule 1	0.057	78	72	12	88	4	81	5.973E+00	28
LOKIASV2_1506_ESMFold_hypothetical_protein	AF-Q9PET0-F1-model_v4	LOKIASV2_1506_ESMFold_hypothetical_protein	AF-Q9PET0-F1-model_v4 Transcriptional repressor NrdR	0.121	41	33	4	44	6	43	7.422E+00	28
LOKIASV2_1506_ESMFold_hypothetical_protein	AF-Q0K8N9-F1-model_v4	LOKIASV2_1506_ESMFold_hypothetical_protein	AF-Q0K8N9-F1-model_v4 Elongation factor P	0.058	51	39	3	44	5	55	6.306E+00	28
LOKIASV2_1506_ESMFold_hypothetical_protein	AF-Q8R5H8-F1-model_v4	LOKIASV2_1506_ESMFold_hypothetical_protein	AF-Q8R5H8-F1-model_v4 Fas apoptotic inhibitory molecule 1	0.051	88	82	1	88	17	103	5.973E+00	28
LOKIASV2_1506_ESMFold_hypothetical_protein	AF-P17918-F1-model_v4	LOKIASV2_1506_ESMFold_hypothetical_protein	AF-P17918-F1-model_v4 Proliferating cell nuclear antigen	0.102	103	79	3	91	18	120	2.016E+00	28
LOKIASV2_1506_ESMFold_hypothetical_protein	AF-O02115-F1-model_v4	LOKIASV2_1506_ESMFold_hypothetical_protein	AF-O02115-F1-model_v4 Proliferating cell nuclear antigen	0.098	99	68	15	90	88	186	3.113E+00	28
LOKIASV2_1506_ESMFold_hypothetical_protein	AF-O82134-F1-model_v4	LOKIASV2_1506_ESMFold_hypothetical_protein	AF-O82134-F1-model_v4 Proliferating cell nuclear antigen	0.118	95	65	15	89	88	182	3.470E+00	28
LOKIASV2_1506_ESMFold_hypothetical_protein	AF-Q87DT9-F1-model_v4	LOKIASV2_1506_ESMFold_hypothetical_protein	AF-Q87DT9-F1-model_v4 Sulfate/thiosulfate import ATP-binding protein CysA	0.096	83	47	6	88	284	336	8.735E+00	28
