query	target	qheader	theader	fident	alnlen	mismatch	qstart	qend	tstart	tend	evalue	bits
LOKIASV2_2673_ESMFold_MFS_transporter	AF-P9WJX3-F1-model_v4	LOKIASV2_2673_ESMFold_MFS_transporter	AF-P9WJX3-F1-model_v4 Probable multidrug-efflux transporter Rv1634	0.121	442	348	15	411	19	460	1.343E-07	328
LOKIASV2_2673_ESMFold_MFS_transporter	AF-Q10PW9-F1-model_v4	LOKIASV2_2673_ESMFold_MFS_transporter	AF-Q10PW9-F1-model_v4 Sugar transport protein MST4	0.142	457	352	12	422	24	480	3.041E-07	328
LOKIASV2_2673_ESMFold_MFS_transporter	AF-P9WG91-F1-model_v4	LOKIASV2_2673_ESMFold_MFS_transporter	AF-P9WG91-F1-model_v4 Multidrug resistance protein Stp	0.122	484	351	11	411	5	488	4.638E-08	328
LOKIASV2_2673_ESMFold_MFS_transporter	AF-P87110-F1-model_v4	LOKIASV2_2673_ESMFold_MFS_transporter	AF-P87110-F1-model_v4 Myo-inositol transporter 2	0.161	439	339	8	412	79	517	1.787E-07	328
LOKIASV2_2673_ESMFold_MFS_transporter	AF-Q9XIH6-F1-model_v4	LOKIASV2_2673_ESMFold_MFS_transporter	AF-Q9XIH6-F1-model_v4 Putative polyol transporter 2	0.139	456	347	11	414	19	474	5.389E-07	327
LOKIASV2_2673_ESMFold_MFS_transporter	AF-B5F4V3-F1-model_v4	LOKIASV2_2673_ESMFold_MFS_transporter	AF-B5F4V3-F1-model_v4 Lysophospholipid transporter LplT	0.144	407	330	16	422	14	400	2.479E-07	326
LOKIASV2_2673_ESMFold_MFS_transporter	AF-Q7EZD7-F1-model_v4	LOKIASV2_2673_ESMFold_MFS_transporter	AF-Q7EZD7-F1-model_v4 Sugar transport protein MST3	0.120	450	354	12	414	25	474	9.681E-08	326
LOKIASV2_2673_ESMFold_MFS_transporter	AF-Q59RG0-F1-model_v4	LOKIASV2_2673_ESMFold_MFS_transporter	AF-Q59RG0-F1-model_v4 Major facilitator superfamily multidrug transporter NAG4	0.117	431	354	12	413	129	559	2.802E-07	326
LOKIASV2_2673_ESMFold_MFS_transporter	AF-Q02563-F1-model_v4	LOKIASV2_2673_ESMFold_MFS_transporter	AF-Q02563-F1-model_v4 Synaptic vesicle glycoprotein 2A	0.131	569	347	13	412	164	732	9.681E-08	326
LOKIASV2_2673_ESMFold_MFS_transporter	AF-B4T502-F1-model_v4	LOKIASV2_2673_ESMFold_MFS_transporter	AF-B4T502-F1-model_v4 Lysophospholipid transporter LplT	0.144	407	330	16	422	14	400	2.020E-07	325
LOKIASV2_2673_ESMFold_MFS_transporter	AF-P0AEY9-F1-model_v4	LOKIASV2_2673_ESMFold_MFS_transporter	AF-P0AEY9-F1-model_v4 Multidrug transporter MdfA	0.148	411	333	15	425	16	407	4.767E-07	325
LOKIASV2_2673_ESMFold_MFS_transporter	AF-P0C6A1-F1-model_v4	LOKIASV2_2673_ESMFold_MFS_transporter	AF-P0C6A1-F1-model_v4 Solute carrier family 2, facilitated glucose transporter member 7	0.149	456	344	17	421	22	477	5.690E-08	325
LOKIASV2_2673_ESMFold_MFS_transporter	AF-A6ZX88-F1-model_v4	LOKIASV2_2673_ESMFold_MFS_transporter	AF-A6ZX88-F1-model_v4 Alpha-glucosides permease MPH3	0.104	473	369	2	414	73	545	1.581E-07	325
LOKIASV2_2673_ESMFold_MFS_transporter	AF-P38227-F1-model_v4	LOKIASV2_2673_ESMFold_MFS_transporter	AF-P38227-F1-model_v4 Quinidine resistance protein 3	0.098	563	360	12	411	104	666	2.479E-07	325
LOKIASV2_2673_ESMFold_MFS_transporter	AF-P55705-F1-model_v4	LOKIASV2_2673_ESMFold_MFS_transporter	AF-P55705-F1-model_v4 Uncharacterized MFS-type transporter y4xM	0.105	408	350	4	411	2	393	2.379E-07	324
LOKIASV2_2673_ESMFold_MFS_transporter	AF-A0ST42-F1-model_v4	LOKIASV2_2673_ESMFold_MFS_transporter	AF-A0ST42-F1-model_v4 Cercosporin MFS transporter CTB4	0.108	431	358	14	415	71	501	7.575E-08	324
LOKIASV2_2673_ESMFold_MFS_transporter	AF-Q57VW6-F1-model_v4	LOKIASV2_2673_ESMFold_MFS_transporter	AF-Q57VW6-F1-model_v4 Riboflavin transporter RibJ	0.101	512	356	18	414	15	526	2.105E-07	324
LOKIASV2_2673_ESMFold_MFS_transporter	AF-Q21455-F1-model_v4	LOKIASV2_2673_ESMFold_MFS_transporter	AF-Q21455-F1-model_v4 Proton myo-inositol cotransporter hmit-1.3	0.130	530	349	13	414	27	556	3.041E-07	324
LOKIASV2_2673_ESMFold_MFS_transporter	AF-Q7L0J3-F1-model_v4	LOKIASV2_2673_ESMFold_MFS_transporter	AF-Q7L0J3-F1-model_v4 Synaptic vesicle glycoprotein 2A	0.127	591	363	2	418	144	734	1.581E-07	324
LOKIASV2_2673_ESMFold_MFS_transporter	AF-Q8Z407-F1-model_v4	LOKIASV2_2673_ESMFold_MFS_transporter	AF-Q8Z407-F1-model_v4 Lysophospholipid transporter LplT	0.144	407	330	16	422	14	400	2.690E-07	323
LOKIASV2_2673_ESMFold_MFS_transporter	AF-B8MYS7-F1-model_v4	LOKIASV2_2673_ESMFold_MFS_transporter	AF-B8MYS7-F1-model_v4 MFS glucose transporter mfs1	0.126	452	344	20	414	13	464	7.272E-08	323
LOKIASV2_2673_ESMFold_MFS_transporter	AF-P33335-F1-model_v4	LOKIASV2_2673_ESMFold_MFS_transporter	AF-P33335-F1-model_v4 Protein SGE1	0.118	538	364	12	425	5	542	2.919E-07	323
LOKIASV2_2673_ESMFold_MFS_transporter	AF-O74713-F1-model_v4	LOKIASV2_2673_ESMFold_MFS_transporter	AF-O74713-F1-model_v4 High-affinity glucose transporter	0.149	451	340	14	414	29	479	3.437E-07	323
LOKIASV2_2673_ESMFold_MFS_transporter	AF-A0A1E1FFK8-F1-model_v4	LOKIASV2_2673_ESMFold_MFS_transporter	AF-A0A1E1FFK8-F1-model_v4 MFS-type transporter prhG	0.106	484	358	10	410	82	565	1.518E-07	323
LOKIASV2_2673_ESMFold_MFS_transporter	AF-E5AE35-F1-model_v4	LOKIASV2_2673_ESMFold_MFS_transporter	AF-E5AE35-F1-model_v4 Phomenoic acid biosynthesis cluster MFS-type transporter	0.111	520	363	2	410	89	608	1.051E-07	323
LOKIASV2_2673_ESMFold_MFS_transporter	AF-Q9JIS5-F1-model_v4	LOKIASV2_2673_ESMFold_MFS_transporter	AF-Q9JIS5-F1-model_v4 Synaptic vesicle glycoprotein 2A	0.125	567	347	13	410	164	730	9.293E-08	323
LOKIASV2_2673_ESMFold_MFS_transporter	AF-B4KR05-F1-model_v4	LOKIASV2_2673_ESMFold_MFS_transporter	AF-B4KR05-F1-model_v4 Facilitated trehalose transporter Tret1	0.120	432	354	12	414	397	828	3.581E-07	323
LOKIASV2_2673_ESMFold_MFS_transporter	AF-B2K5S2-F1-model_v4	LOKIASV2_2673_ESMFold_MFS_transporter	AF-B2K5S2-F1-model_v4 Protein TsgA homolog	0.117	395	329	17	411	5	378	8.563E-08	322
LOKIASV2_2673_ESMFold_MFS_transporter	AF-Q9SQN2-F1-model_v4	LOKIASV2_2673_ESMFold_MFS_transporter	AF-Q9SQN2-F1-model_v4 Probable folate-biopterin transporter 3	0.133	405	339	20	411	53	457	3.168E-07	322
LOKIASV2_2673_ESMFold_MFS_transporter	AF-Q62866-F1-model_v4	LOKIASV2_2673_ESMFold_MFS_transporter	AF-Q62866-F1-model_v4 Reduced folate transporter	0.141	432	351	2	411	9	440	1.237E-07	322
LOKIASV2_2673_ESMFold_MFS_transporter	AF-B0UYT5-F1-model_v4	LOKIASV2_2673_ESMFold_MFS_transporter	AF-B0UYT5-F1-model_v4 Major facilitator superfamily domain-containing protein 6-B	0.105	554	354	17	413	5	558	2.919E-07	322
LOKIASV2_2673_ESMFold_MFS_transporter	AF-Q664N1-F1-model_v4	LOKIASV2_2673_ESMFold_MFS_transporter	AF-Q664N1-F1-model_v4 Protein TsgA homolog	0.122	395	327	17	411	5	378	8.220E-08	321
LOKIASV2_2673_ESMFold_MFS_transporter	AF-Q2FW71-F1-model_v4	LOKIASV2_2673_ESMFold_MFS_transporter	AF-Q2FW71-F1-model_v4 Staphyloferrin A transporter	0.119	399	337	18	416	2	384	1.271E-06	321
LOKIASV2_2673_ESMFold_MFS_transporter	AF-A5D7V7-F1-model_v4	LOKIASV2_2673_ESMFold_MFS_transporter	AF-A5D7V7-F1-model_v4 Solute carrier family 46 member 3	0.111	436	354	18	416	7	442	1.647E-07	321
LOKIASV2_2673_ESMFold_MFS_transporter	AF-P23462-F1-model_v4	LOKIASV2_2673_ESMFold_MFS_transporter	AF-P23462-F1-model_v4 Protein PucC	0.178	426	328	17	416	33	458	5.033E-08	321
LOKIASV2_2673_ESMFold_MFS_transporter	AF-Q61983-F1-model_v4	LOKIASV2_2673_ESMFold_MFS_transporter	AF-Q61983-F1-model_v4 Sodium-dependent phosphate transport protein 1	0.127	450	359	13	424	16	465	1.140E-07	321
LOKIASV2_2673_ESMFold_MFS_transporter	AF-A2RJJ9-F1-model_v4	LOKIASV2_2673_ESMFold_MFS_transporter	AF-A2RJJ9-F1-model_v4 Uridine/deoxyuridine transporter	0.125	449	342	20	411	19	467	2.919E-07	321
LOKIASV2_2673_ESMFold_MFS_transporter	AF-Q9C757-F1-model_v4	LOKIASV2_2673_ESMFold_MFS_transporter	AF-Q9C757-F1-model_v4 Probable inositol transporter 2	0.133	540	362	3	421	12	551	5.848E-07	321
LOKIASV2_2673_ESMFold_MFS_transporter	AF-A0A0B5EMG9-F1-model_v4	LOKIASV2_2673_ESMFold_MFS_transporter	AF-A0A0B5EMG9-F1-model_v4 Efflux pump FUBT	0.135	429	344	14	412	97	525	2.284E-07	321
LOKIASV2_2673_ESMFold_MFS_transporter	AF-A6V6H6-F1-model_v4	LOKIASV2_2673_ESMFold_MFS_transporter	AF-A6V6H6-F1-model_v4 Uncharacterized MFS-type transporter PSPA7_3302	0.136	418	339	1	418	9	401	3.437E-07	320
LOKIASV2_2673_ESMFold_MFS_transporter	AF-Q02443-F1-model_v4	LOKIASV2_2673_ESMFold_MFS_transporter	AF-Q02443-F1-model_v4 Protein PucC	0.143	423	342	17	416	30	452	1.647E-07	320
LOKIASV2_2673_ESMFold_MFS_transporter	AF-P9WJW8-F1-model_v4	LOKIASV2_2673_ESMFold_MFS_transporter	AF-P9WJW8-F1-model_v4 Drug efflux pump JefA	0.112	503	356	17	418	4	506	4.576E-07	320
LOKIASV2_2673_ESMFold_MFS_transporter	AF-F2SH39-F1-model_v4	LOKIASV2_2673_ESMFold_MFS_transporter	AF-F2SH39-F1-model_v4 MFS-type efflux pump MFS1	0.109	505	364	2	411	15	519	9.551E-07	320
LOKIASV2_2673_ESMFold_MFS_transporter	AF-P13090-F1-model_v4	LOKIASV2_2673_ESMFold_MFS_transporter	AF-P13090-F1-model_v4 Aminotriazole resistance protein	0.107	458	366	6	416	66	523	2.479E-07	320
LOKIASV2_2673_ESMFold_MFS_transporter	AF-A0A3G1DJG1-F1-model_v4	LOKIASV2_2673_ESMFold_MFS_transporter	AF-A0A3G1DJG1-F1-model_v4 MFS-type transporter M2	0.110	494	362	16	423	19	512	6.887E-07	320
LOKIASV2_2673_ESMFold_MFS_transporter	AF-P36035-F1-model_v4	LOKIASV2_2673_ESMFold_MFS_transporter	AF-P36035-F1-model_v4 Carboxylic acid transporter protein homolog	0.138	413	340	17	411	137	549	2.479E-07	320
LOKIASV2_2673_ESMFold_MFS_transporter	AF-Q1CCQ2-F1-model_v4	LOKIASV2_2673_ESMFold_MFS_transporter	AF-Q1CCQ2-F1-model_v4 Protein TsgA homolog	0.119	395	329	17	411	5	378	7.575E-08	319
LOKIASV2_2673_ESMFold_MFS_transporter	AF-B4TUM8-F1-model_v4	LOKIASV2_2673_ESMFold_MFS_transporter	AF-B4TUM8-F1-model_v4 Lysophospholipid transporter LplT	0.146	407	330	16	422	14	400	3.168E-07	319
LOKIASV2_2673_ESMFold_MFS_transporter	AF-Q8ZMA5-F1-model_v4	LOKIASV2_2673_ESMFold_MFS_transporter	AF-Q8ZMA5-F1-model_v4 Lysophospholipid transporter LplT	0.142	407	331	16	422	14	400	2.802E-07	319
LOKIASV2_2673_ESMFold_MFS_transporter	AF-P11545-F1-model_v4	LOKIASV2_2673_ESMFold_MFS_transporter	AF-P11545-F1-model_v4 Methylenomycin A resistance protein	0.114	440	355	15	416	25	464	4.767E-07	319
LOKIASV2_2673_ESMFold_MFS_transporter	AF-P30878-F1-model_v4	LOKIASV2_2673_ESMFold_MFS_transporter	AF-P30878-F1-model_v4 Melibiose carrier protein	0.114	434	358	16	420	6	439	3.581E-07	319
LOKIASV2_2673_ESMFold_MFS_transporter	AF-F4KGN5-F1-model_v4	LOKIASV2_2673_ESMFold_MFS_transporter	AF-F4KGN5-F1-model_v4 Solute carrier family 40 member 2	0.116	503	374	1	424	1	503	1.940E-07	319
LOKIASV2_2673_ESMFold_MFS_transporter	AF-Q8CE47-F1-model_v4	LOKIASV2_2673_ESMFold_MFS_transporter	AF-Q8CE47-F1-model_v4 Solute carrier family 49 member A3	0.121	413	348	17	413	32	444	3.168E-07	319
LOKIASV2_2673_ESMFold_MFS_transporter	AF-A0A1D8PQG0-F1-model_v4	LOKIASV2_2673_ESMFold_MFS_transporter	AF-A0A1D8PQG0-F1-model_v4 Major facilitator superfamily multidrug transporter NAG3	0.117	430	353	13	413	112	541	4.393E-07	319
LOKIASV2_2673_ESMFold_MFS_transporter	AF-Q5ABU7-F1-model_v4	LOKIASV2_2673_ESMFold_MFS_transporter	AF-Q5ABU7-F1-model_v4 Multidrug resistance protein 1	0.139	439	344	12	411	113	551	1.647E-07	319
LOKIASV2_2673_ESMFold_MFS_transporter	AF-P28873-F1-model_v4	LOKIASV2_2673_ESMFold_MFS_transporter	AF-P28873-F1-model_v4 Benomyl/methotrexate resistance protein	0.127	440	353	12	416	113	552	3.168E-07	319
LOKIASV2_2673_ESMFold_MFS_transporter	AF-P0DPR5-F1-model_v4	LOKIASV2_2673_ESMFold_MFS_transporter	AF-P0DPR5-F1-model_v4 Fosfomycin resistance protein AbaF	0.140	412	342	13	411	4	415	8.220E-08	318
LOKIASV2_2673_ESMFold_MFS_transporter	AF-Q8VCL5-F1-model_v4	LOKIASV2_2673_ESMFold_MFS_transporter	AF-Q8VCL5-F1-model_v4 Solute carrier family 17 member 9	0.119	400	351	14	413	34	432	8.563E-08	318
LOKIASV2_2673_ESMFold_MFS_transporter	AF-Q1JQC1-F1-model_v4	LOKIASV2_2673_ESMFold_MFS_transporter	AF-Q1JQC1-F1-model_v4 Major facilitator superfamily domain-containing protein 1	0.152	398	333	18	411	45	442	4.832E-08	318
LOKIASV2_2673_ESMFold_MFS_transporter	AF-P53142-F1-model_v4	LOKIASV2_2673_ESMFold_MFS_transporter	AF-P53142-F1-model_v4 Vacuolar protein sorting-associated protein 73	0.130	453	349	13	414	27	479	3.730E-07	318
LOKIASV2_2673_ESMFold_MFS_transporter	AF-Q8GW61-F1-model_v4	LOKIASV2_2673_ESMFold_MFS_transporter	AF-Q8GW61-F1-model_v4 Sugar transport protein 14	0.122	450	349	17	414	25	474	3.730E-07	318
LOKIASV2_2673_ESMFold_MFS_transporter	AF-Q8VZR6-F1-model_v4	LOKIASV2_2673_ESMFold_MFS_transporter	AF-Q8VZR6-F1-model_v4 Inositol transporter 1	0.120	435	353	13	414	30	464	3.300E-07	318
LOKIASV2_2673_ESMFold_MFS_transporter	AF-Q5A1L6-F1-model_v4	LOKIASV2_2673_ESMFold_MFS_transporter	AF-Q5A1L6-F1-model_v4 Major glycerophosphoinositol permease GIT3	0.159	420	341	7	413	55	474	4.832E-08	318
LOKIASV2_2673_ESMFold_MFS_transporter	AF-P36173-F1-model_v4	LOKIASV2_2673_ESMFold_MFS_transporter	AF-P36173-F1-model_v4 Glutathione exchanger 2	0.110	526	360	6	411	34	559	1.940E-07	318
LOKIASV2_2673_ESMFold_MFS_transporter	AF-C5BGP5-F1-model_v4	LOKIASV2_2673_ESMFold_MFS_transporter	AF-C5BGP5-F1-model_v4 Protein TsgA homolog	0.116	414	345	12	425	4	394	3.300E-07	317
LOKIASV2_2673_ESMFold_MFS_transporter	AF-Q323U7-F1-model_v4	LOKIASV2_2673_ESMFold_MFS_transporter	AF-Q323U7-F1-model_v4 Multidrug transporter MdfA	0.146	411	334	15	425	16	407	8.801E-07	317
LOKIASV2_2673_ESMFold_MFS_transporter	AF-Q6PB15-F1-model_v4	LOKIASV2_2673_ESMFold_MFS_transporter	AF-Q6PB15-F1-model_v4 UNC93-like protein MFSD11	0.123	442	360	11	422	4	445	3.041E-07	317
LOKIASV2_2673_ESMFold_MFS_transporter	AF-P08194-F1-model_v4	LOKIASV2_2673_ESMFold_MFS_transporter	AF-P08194-F1-model_v4 Glycerol-3-phosphate transporter	0.125	413	353	8	411	20	432	1.647E-07	317
LOKIASV2_2673_ESMFold_MFS_transporter	AF-C8V3Y8-F1-model_v4	LOKIASV2_2673_ESMFold_MFS_transporter	AF-C8V3Y8-F1-model_v4 MFS efflux pump atnC	0.126	445	363	10	425	57	501	2.617E-08	317
LOKIASV2_2673_ESMFold_MFS_transporter	AF-Q9Z2I7-F1-model_v4	LOKIASV2_2673_ESMFold_MFS_transporter	AF-Q9Z2I7-F1-model_v4 Synaptic vesicle 2-related protein	0.158	428	338	13	414	82	509	1.237E-07	317
LOKIASV2_2673_ESMFold_MFS_transporter	AF-W7N2B4-F1-model_v4	LOKIASV2_2673_ESMFold_MFS_transporter	AF-W7N2B4-F1-model_v4 Efflux pump FUB11	0.137	429	343	14	412	97	525	3.730E-07	317
LOKIASV2_2673_ESMFold_MFS_transporter	AF-P25596-F1-model_v4	LOKIASV2_2673_ESMFold_MFS_transporter	AF-P25596-F1-model_v4 Glutathione exchanger 1	0.116	523	355	11	413	39	561	2.105E-07	317
LOKIASV2_2673_ESMFold_MFS_transporter	AF-A8GKP6-F1-model_v4	LOKIASV2_2673_ESMFold_MFS_transporter	AF-A8GKP6-F1-model_v4 Protein TsgA homolog	0.138	405	330	17	421	5	388	8.220E-08	316
LOKIASV2_2673_ESMFold_MFS_transporter	AF-B8NU03-F1-model_v4	LOKIASV2_2673_ESMFold_MFS_transporter	AF-B8NU03-F1-model_v4 MFS-type transporter lnaF	0.125	417	357	17	425	56	472	3.437E-07	316
LOKIASV2_2673_ESMFold_MFS_transporter	AF-Q94JG1-F1-model_v4	LOKIASV2_2673_ESMFold_MFS_transporter	AF-Q94JG1-F1-model_v4 High-affinity nitrate transporter 2.3	0.141	394	338	17	410	47	440	7.174E-07	316
LOKIASV2_2673_ESMFold_MFS_transporter	AF-A0A1V6PBC8-F1-model_v4	LOKIASV2_2673_ESMFold_MFS_transporter	AF-A0A1V6PBC8-F1-model_v4 MFS-type transporter calB	0.115	489	346	20	411	58	546	3.730E-07	316
LOKIASV2_2673_ESMFold_MFS_transporter	AF-Q3UHK1-F1-model_v4	LOKIASV2_2673_ESMFold_MFS_transporter	AF-Q3UHK1-F1-model_v4 Proton myo-inositol cotransporter	0.132	542	364	2	421	52	593	3.041E-07	316
LOKIASV2_2673_ESMFold_MFS_transporter	AF-B3MG58-F1-model_v4	LOKIASV2_2673_ESMFold_MFS_transporter	AF-B3MG58-F1-model_v4 Facilitated trehalose transporter Tret1	0.129	428	345	18	414	404	831	4.393E-07	316
LOKIASV2_2673_ESMFold_MFS_transporter	AF-Q9DC37-F1-model_v4	LOKIASV2_2673_ESMFold_MFS_transporter	AF-Q9DC37-F1-model_v4 Major facilitator superfamily domain-containing protein 1	0.140	398	338	18	411	41	438	6.433E-08	315
LOKIASV2_2673_ESMFold_MFS_transporter	AF-Q7ZWG6-F1-model_v4	LOKIASV2_2673_ESMFold_MFS_transporter	AF-Q7ZWG6-F1-model_v4 Proton-coupled folate transporter	0.124	417	342	21	411	45	461	2.379E-07	315
LOKIASV2_2673_ESMFold_MFS_transporter	AF-P42237-F1-model_v4	LOKIASV2_2673_ESMFold_MFS_transporter	AF-P42237-F1-model_v4 Probable glucarate transporter	0.131	418	348	13	414	17	434	2.690E-07	314
LOKIASV2_2673_ESMFold_MFS_transporter	AF-Q28722-F1-model_v4	LOKIASV2_2673_ESMFold_MFS_transporter	AF-Q28722-F1-model_v4 Sodium-dependent phosphate transport protein 1	0.129	433	354	6	413	16	448	1.343E-07	314
LOKIASV2_2673_ESMFold_MFS_transporter	AF-Q1C5L8-F1-model_v4	LOKIASV2_2673_ESMFold_MFS_transporter	AF-Q1C5L8-F1-model_v4 Putative multidrug resistance protein MdtD	0.153	449	337	12	410	2	450	1.399E-07	314
LOKIASV2_2673_ESMFold_MFS_transporter	AF-Q4H425-F1-model_v4	LOKIASV2_2673_ESMFold_MFS_transporter	AF-Q4H425-F1-model_v4 MFS-type transporter EF102	0.125	399	346	14	412	54	449	2.379E-07	314
LOKIASV2_2673_ESMFold_MFS_transporter	AF-Q9P6J7-F1-model_v4	LOKIASV2_2673_ESMFold_MFS_transporter	AF-Q9P6J7-F1-model_v4 Uncharacterized MFS-type transporter C1683.03c	0.118	473	366	10	425	42	514	2.020E-07	314
LOKIASV2_2673_ESMFold_MFS_transporter	AF-Q94AZ2-F1-model_v4	LOKIASV2_2673_ESMFold_MFS_transporter	AF-Q94AZ2-F1-model_v4 Sugar transport protein 13	0.145	463	343	21	422	22	484	3.437E-07	314
LOKIASV2_2673_ESMFold_MFS_transporter	AF-P49374-F1-model_v4	LOKIASV2_2673_ESMFold_MFS_transporter	AF-P49374-F1-model_v4 High-affinity glucose transporter	0.126	453	347	16	413	26	478	3.730E-07	314
LOKIASV2_2673_ESMFold_MFS_transporter	AF-P0CD99-F1-model_v4	LOKIASV2_2673_ESMFold_MFS_transporter	AF-P0CD99-F1-model_v4 Alpha-glucosides permease MPH2	0.114	451	354	15	414	95	545	2.802E-07	314
LOKIASV2_2673_ESMFold_MFS_transporter	AF-P76350-F1-model_v4	LOKIASV2_2673_ESMFold_MFS_transporter	AF-P76350-F1-model_v4 Shikimate transporter	0.131	428	361	2	417	11	438	5.173E-07	313
LOKIASV2_2673_ESMFold_MFS_transporter	AF-Q6DIT7-F1-model_v4	LOKIASV2_2673_ESMFold_MFS_transporter	AF-Q6DIT7-F1-model_v4 UNC93-like protein MFSD11	0.119	442	362	11	422	4	445	1.940E-07	313
LOKIASV2_2673_ESMFold_MFS_transporter	AF-Q9H3U5-F1-model_v4	LOKIASV2_2673_ESMFold_MFS_transporter	AF-Q9H3U5-F1-model_v4 Major facilitator superfamily domain-containing protein 1	0.142	398	337	18	411	42	439	5.928E-08	313
LOKIASV2_2673_ESMFold_MFS_transporter	AF-Q62795-F1-model_v4	LOKIASV2_2673_ESMFold_MFS_transporter	AF-Q62795-F1-model_v4 Sodium-dependent phosphate transport protein 1	0.143	450	352	13	424	16	465	1.518E-07	313
LOKIASV2_2673_ESMFold_MFS_transporter	AF-O59700-F1-model_v4	LOKIASV2_2673_ESMFold_MFS_transporter	AF-O59700-F1-model_v4 Uncharacterized transporter C36.03c	0.124	425	345	18	412	100	524	2.284E-07	313
LOKIASV2_2673_ESMFold_MFS_transporter	AF-Q5J316-F1-model_v4	LOKIASV2_2673_ESMFold_MFS_transporter	AF-Q5J316-F1-model_v4 Solute carrier family 2, facilitated glucose transporter member 12	0.117	511	354	13	414	43	553	8.448E-07	313
LOKIASV2_2673_ESMFold_MFS_transporter	AF-B2VK30-F1-model_v4	LOKIASV2_2673_ESMFold_MFS_transporter	AF-B2VK30-F1-model_v4 Protein TsgA homolog	0.129	408	335	17	424	5	390	1.862E-07	312
LOKIASV2_2673_ESMFold_MFS_transporter	AF-Q17766-F1-model_v4	LOKIASV2_2673_ESMFold_MFS_transporter	AF-Q17766-F1-model_v4 Folate transporter 1	0.114	424	361	14	421	3	426	1.399E-07	312
LOKIASV2_2673_ESMFold_MFS_transporter	AF-Q5R8G5-F1-model_v4	LOKIASV2_2673_ESMFold_MFS_transporter	AF-Q5R8G5-F1-model_v4 Major facilitator superfamily domain-containing protein 1	0.139	395	337	20	411	45	439	7.272E-08	312
LOKIASV2_2673_ESMFold_MFS_transporter	AF-P0CE00-F1-model_v4	LOKIASV2_2673_ESMFold_MFS_transporter	AF-P0CE00-F1-model_v4 Alpha-glucosides permease MPH3	0.102	483	367	2	411	60	542	3.581E-07	312
LOKIASV2_2673_ESMFold_MFS_transporter	AF-B4HNS0-F1-model_v4	LOKIASV2_2673_ESMFold_MFS_transporter	AF-B4HNS0-F1-model_v4 Facilitated trehalose transporter Tret1-1	0.112	428	353	17	414	395	822	5.848E-07	312
LOKIASV2_2673_ESMFold_MFS_transporter	AF-P42306-F1-model_v4	LOKIASV2_2673_ESMFold_MFS_transporter	AF-P42306-F1-model_v4 Uncharacterized MFS-type transporter YxiO	0.131	412	351	16	420	7	418	3.581E-07	311
LOKIASV2_2673_ESMFold_MFS_transporter	AF-F1PZV2-F1-model_v4	LOKIASV2_2673_ESMFold_MFS_transporter	AF-F1PZV2-F1-model_v4 Major facilitator superfamily domain-containing protein 12	0.156	457	345	16	425	20	476	1.457E-07	311
LOKIASV2_2673_ESMFold_MFS_transporter	AF-P0A0J9-F1-model_v4	LOKIASV2_2673_ESMFold_MFS_transporter	AF-P0A0J9-F1-model_v4 Antiseptic resistance protein	0.156	491	343	14	420	17	507	1.457E-07	311
LOKIASV2_2673_ESMFold_MFS_transporter	AF-B5VF36-F1-model_v4	LOKIASV2_2673_ESMFold_MFS_transporter	AF-B5VF36-F1-model_v4 Alpha-glucosides permease MPH3	0.104	483	366	2	411	60	542	2.919E-07	311
LOKIASV2_2673_ESMFold_MFS_transporter	AF-Q96QE2-F1-model_v4	LOKIASV2_2673_ESMFold_MFS_transporter	AF-Q96QE2-F1-model_v4 Proton myo-inositol cotransporter	0.141	542	360	2	421	63	604	5.173E-07	311
LOKIASV2_2673_ESMFold_MFS_transporter	AF-Q1R7H6-F1-model_v4	LOKIASV2_2673_ESMFold_MFS_transporter	AF-Q1R7H6-F1-model_v4 Lysophospholipid transporter LplT	0.145	396	320	16	411	14	388	4.393E-07	310
LOKIASV2_2673_ESMFold_MFS_transporter	AF-Q7ZU13-F1-model_v4	LOKIASV2_2673_ESMFold_MFS_transporter	AF-Q7ZU13-F1-model_v4 Protein spinster homolog 1	0.154	419	339	14	415	47	465	3.630E-08	310
LOKIASV2_2673_ESMFold_MFS_transporter	AF-Q39524-F1-model_v4	LOKIASV2_2673_ESMFold_MFS_transporter	AF-Q39524-F1-model_v4 H(+)/hexose cotransporter 2	0.137	451	338	22	414	29	479	2.284E-07	310
LOKIASV2_2673_ESMFold_MFS_transporter	AF-Q8TD20-F1-model_v4	LOKIASV2_2673_ESMFold_MFS_transporter	AF-Q8TD20-F1-model_v4 Solute carrier family 2, facilitated glucose transporter member 12	0.119	511	353	13	414	39	549	1.172E-06	310
LOKIASV2_2673_ESMFold_MFS_transporter	AF-Q1C2Q4-F1-model_v4	LOKIASV2_2673_ESMFold_MFS_transporter	AF-Q1C2Q4-F1-model_v4 Protein TsgA homolog	0.123	395	327	17	411	5	378	1.237E-07	309
LOKIASV2_2673_ESMFold_MFS_transporter	AF-Q9LTP6-F1-model_v4	LOKIASV2_2673_ESMFold_MFS_transporter	AF-Q9LTP6-F1-model_v4 Putative sugar transporter ERD6-like 13	0.125	420	351	13	414	52	471	9.551E-07	309
LOKIASV2_2673_ESMFold_MFS_transporter	AF-Q2UAZ7-F1-model_v4	LOKIASV2_2673_ESMFold_MFS_transporter	AF-Q2UAZ7-F1-model_v4 MFS-type transporter ppsE	0.136	421	340	17	411	52	472	4.767E-07	309
LOKIASV2_2673_ESMFold_MFS_transporter	AF-Q9LPV5-F1-model_v4	LOKIASV2_2673_ESMFold_MFS_transporter	AF-Q9LPV5-F1-model_v4 High affinity nitrate transporter 2.5	0.136	394	339	17	410	46	438	3.437E-07	309
LOKIASV2_2673_ESMFold_MFS_transporter	AF-B2KWH6-F1-model_v4	LOKIASV2_2673_ESMFold_MFS_transporter	AF-B2KWH6-F1-model_v4 MFS siderochrome iron transporter 1	0.115	494	349	17	411	70	563	3.300E-07	309
LOKIASV2_2673_ESMFold_MFS_transporter	AF-A0A0D2YFZ8-F1-model_v4	LOKIASV2_2673_ESMFold_MFS_transporter	AF-A0A0D2YFZ8-F1-model_v4 Efflux pump FUB11	0.140	430	340	17	412	96	525	2.479E-07	309
LOKIASV2_2673_ESMFold_MFS_transporter	AF-P02921-F1-model_v4	LOKIASV2_2673_ESMFold_MFS_transporter	AF-P02921-F1-model_v4 Melibiose carrier protein	0.112	434	359	16	420	6	439	9.551E-07	308
LOKIASV2_2673_ESMFold_MFS_transporter	AF-Q8W4E7-F1-model_v4	LOKIASV2_2673_ESMFold_MFS_transporter	AF-Q8W4E7-F1-model_v4 Solute carrier family 40 member 3, chloroplastic	0.114	450	363	8	418	134	583	1.036E-06	308
LOKIASV2_2673_ESMFold_MFS_transporter	AF-Q6NWF1-F1-model_v4	LOKIASV2_2673_ESMFold_MFS_transporter	AF-Q6NWF1-F1-model_v4 Solute carrier family 2, facilitated glucose transporter member 12	0.104	521	360	12	414	42	562	1.560E-06	308
LOKIASV2_2673_ESMFold_MFS_transporter	AF-P31141-F1-model_v4	LOKIASV2_2673_ESMFold_MFS_transporter	AF-P31141-F1-model_v4 Chloramphenicol resistance protein	0.106	408	347	18	425	4	392	1.497E-06	307
LOKIASV2_2673_ESMFold_MFS_transporter	AF-Q8N434-F1-model_v4	LOKIASV2_2673_ESMFold_MFS_transporter	AF-Q8N434-F1-model_v4 Putative transporter SVOPL	0.132	435	348	13	414	46	480	1.125E-06	307
LOKIASV2_2673_ESMFold_MFS_transporter	AF-Q851G4-F1-model_v4	LOKIASV2_2673_ESMFold_MFS_transporter	AF-Q851G4-F1-model_v4 Sugar transport protein MST2	0.118	456	355	11	414	26	481	3.886E-07	307
LOKIASV2_2673_ESMFold_MFS_transporter	AF-C8Z6M6-F1-model_v4	LOKIASV2_2673_ESMFold_MFS_transporter	AF-C8Z6M6-F1-model_v4 Alpha-glucosides permease MPH3	0.104	470	361	8	411	73	542	4.048E-07	307
LOKIASV2_2673_ESMFold_MFS_transporter	AF-P57601-F1-model_v4	LOKIASV2_2673_ESMFold_MFS_transporter	AF-P57601-F1-model_v4 Protein TsgA homolog	0.130	409	333	17	425	5	388	5.389E-07	306
LOKIASV2_2673_ESMFold_MFS_transporter	AF-A7FNS4-F1-model_v4	LOKIASV2_2673_ESMFold_MFS_transporter	AF-A7FNS4-F1-model_v4 Protein TsgA homolog	0.127	395	326	17	411	5	378	1.094E-07	306
LOKIASV2_2673_ESMFold_MFS_transporter	AF-O43081-F1-model_v4	LOKIASV2_2673_ESMFold_MFS_transporter	AF-O43081-F1-model_v4 Uncharacterized MFS-type transporter C947.06c	0.130	443	356	12	421	53	495	3.781E-08	306
LOKIASV2_2673_ESMFold_MFS_transporter	AF-P0DKG9-F1-model_v4	LOKIASV2_2673_ESMFold_MFS_transporter	AF-P0DKG9-F1-model_v4 High-affinity nitrate transporter 2.1	0.122	392	342	17	408	65	455	4.048E-07	306
LOKIASV2_2673_ESMFold_MFS_transporter	AF-Q9BE72-F1-model_v4	LOKIASV2_2673_ESMFold_MFS_transporter	AF-Q9BE72-F1-model_v4 Solute carrier family 2, facilitated glucose transporter member 12	0.121	512	353	12	414	42	553	1.913E-06	306
LOKIASV2_2673_ESMFold_MFS_transporter	AF-Q29397-F1-model_v4	LOKIASV2_2673_ESMFold_MFS_transporter	AF-Q29397-F1-model_v4 Synaptic vesicle glycoprotein 2A	0.125	587	357	2	410	144	730	2.284E-07	306
LOKIASV2_2673_ESMFold_MFS_transporter	AF-Q8CBH5-F1-model_v4	LOKIASV2_2673_ESMFold_MFS_transporter	AF-Q8CBH5-F1-model_v4 Major facilitator superfamily domain-containing protein 6	0.109	569	364	17	425	68	636	2.479E-07	306
LOKIASV2_2673_ESMFold_MFS_transporter	AF-O31577-F1-model_v4	LOKIASV2_2673_ESMFold_MFS_transporter	AF-O31577-F1-model_v4 Uncharacterized MFS-type transporter YfhI	0.136	407	328	14	420	8	388	8.448E-07	305
LOKIASV2_2673_ESMFold_MFS_transporter	AF-Q5XGK0-F1-model_v4	LOKIASV2_2673_ESMFold_MFS_transporter	AF-Q5XGK0-F1-model_v4 Protein spinster homolog 1	0.133	439	357	2	414	39	477	1.399E-07	305
LOKIASV2_2673_ESMFold_MFS_transporter	AF-Q921A2-F1-model_v4	LOKIASV2_2673_ESMFold_MFS_transporter	AF-Q921A2-F1-model_v4 Proton myo-inositol cotransporter	0.132	542	364	2	421	52	593	6.346E-07	305
