query	target	qheader	theader	fident	alnlen	mismatch	qstart	qend	tstart	tend	evalue	bits
LOKIASV2_1684_ESMFold_hypothetical_protein	AF-A0QCA6-F1-model_v4	LOKIASV2_1684_ESMFold_hypothetical_protein	AF-A0QCA6-F1-model_v4 Putative pterin-4-alpha-carbinolamine dehydratase	0.083	48	42	2	48	28	75	8.053E+00	30
LOKIASV2_1684_ESMFold_hypothetical_protein	AF-P61733-F1-model_v4	LOKIASV2_1684_ESMFold_hypothetical_protein	AF-P61733-F1-model_v4 Putative pterin-4-alpha-carbinolamine dehydratase	0.083	48	42	2	48	28	75	8.053E+00	30
LOKIASV2_1684_ESMFold_hypothetical_protein	AF-C0RGE2-F1-model_v4	LOKIASV2_1684_ESMFold_hypothetical_protein	AF-C0RGE2-F1-model_v4 Putative pterin-4-alpha-carbinolamine dehydratase	0.065	46	41	2	46	32	77	7.549E+00	30
LOKIASV2_1684_ESMFold_hypothetical_protein	AF-B2S7X9-F1-model_v4	LOKIASV2_1684_ESMFold_hypothetical_protein	AF-B2S7X9-F1-model_v4 Putative pterin-4-alpha-carbinolamine dehydratase	0.065	46	41	2	46	32	77	7.549E+00	30
LOKIASV2_1684_ESMFold_hypothetical_protein	AF-A5VN26-F1-model_v4	LOKIASV2_1684_ESMFold_hypothetical_protein	AF-A5VN26-F1-model_v4 Putative pterin-4-alpha-carbinolamine dehydratase	0.065	46	41	2	46	32	77	7.549E+00	30
LOKIASV2_1684_ESMFold_hypothetical_protein	AF-P65722-F1-model_v4	LOKIASV2_1684_ESMFold_hypothetical_protein	AF-P65722-F1-model_v4 Putative pterin-4-alpha-carbinolamine dehydratase	0.065	46	41	2	46	32	77	7.549E+00	30
LOKIASV2_1684_ESMFold_hypothetical_protein	AF-P65723-F1-model_v4	LOKIASV2_1684_ESMFold_hypothetical_protein	AF-P65723-F1-model_v4 Putative pterin-4-alpha-carbinolamine dehydratase	0.065	46	41	2	46	32	77	7.549E+00	30
LOKIASV2_1684_ESMFold_hypothetical_protein	AF-B0CIJ4-F1-model_v4	LOKIASV2_1684_ESMFold_hypothetical_protein	AF-B0CIJ4-F1-model_v4 Putative pterin-4-alpha-carbinolamine dehydratase	0.065	46	41	2	46	32	77	7.549E+00	30
LOKIASV2_1684_ESMFold_hypothetical_protein	AF-Q57FT6-F1-model_v4	LOKIASV2_1684_ESMFold_hypothetical_protein	AF-Q57FT6-F1-model_v4 Putative pterin-4-alpha-carbinolamine dehydratase	0.065	46	41	2	46	32	77	8.053E+00	30
LOKIASV2_1684_ESMFold_hypothetical_protein	AF-Q1GDR0-F1-model_v4	LOKIASV2_1684_ESMFold_hypothetical_protein	AF-Q1GDR0-F1-model_v4 Putative pterin-4-alpha-carbinolamine dehydratase	0.065	46	41	2	46	33	78	7.549E+00	30
LOKIASV2_1684_ESMFold_hypothetical_protein	AF-Q1QXY2-F1-model_v4	LOKIASV2_1684_ESMFold_hypothetical_protein	AF-Q1QXY2-F1-model_v4 Putative pterin-4-alpha-carbinolamine dehydratase	0.088	45	39	2	45	47	91	8.591E+00	30
LOKIASV2_1684_ESMFold_hypothetical_protein	AF-Q87X00-F1-model_v4	LOKIASV2_1684_ESMFold_hypothetical_protein	AF-Q87X00-F1-model_v4 UPF0234 protein PSPTO_4393	0.257	35	23	13	44	98	132	4.801E+00	30
LOKIASV2_1684_ESMFold_hypothetical_protein	AF-Q02H45-F1-model_v4	LOKIASV2_1684_ESMFold_hypothetical_protein	AF-Q02H45-F1-model_v4 UPF0234 protein PA14_57130	0.243	37	25	13	46	98	134	5.464E+00	30
LOKIASV2_1684_ESMFold_hypothetical_protein	AF-Q7VUZ9-F1-model_v4	LOKIASV2_1684_ESMFold_hypothetical_protein	AF-Q7VUZ9-F1-model_v4 UPF0234 protein BP2916	0.285	35	22	13	44	99	133	5.829E+00	30
LOKIASV2_1684_ESMFold_hypothetical_protein	AF-B3PLN2-F1-model_v4	LOKIASV2_1684_ESMFold_hypothetical_protein	AF-B3PLN2-F1-model_v4 UPF0234 protein CJA_2652	0.228	35	24	13	44	99	133	5.122E+00	30
LOKIASV2_1684_ESMFold_hypothetical_protein	AF-Q7WMU0-F1-model_v4	LOKIASV2_1684_ESMFold_hypothetical_protein	AF-Q7WMU0-F1-model_v4 UPF0234 protein BB1300	0.285	35	22	13	44	99	133	5.829E+00	30
LOKIASV2_1684_ESMFold_hypothetical_protein	AF-Q0K786-F1-model_v4	LOKIASV2_1684_ESMFold_hypothetical_protein	AF-Q0K786-F1-model_v4 UPF0234 protein H16_A3060	0.194	36	27	13	46	101	136	7.077E+00	30
LOKIASV2_1684_ESMFold_hypothetical_protein	AF-Q13UQ9-F1-model_v4	LOKIASV2_1684_ESMFold_hypothetical_protein	AF-Q13UQ9-F1-model_v4 UPF0234 protein Bxeno_A3642	0.222	36	26	13	46	101	136	7.077E+00	30
LOKIASV2_1684_ESMFold_hypothetical_protein	AF-Q2W141-F1-model_v4	LOKIASV2_1684_ESMFold_hypothetical_protein	AF-Q2W141-F1-model_v4 UPF0234 protein amb3630	0.228	35	24	13	44	100	134	5.829E+00	30
LOKIASV2_1684_ESMFold_hypothetical_protein	AF-B0TR14-F1-model_v4	LOKIASV2_1684_ESMFold_hypothetical_protein	AF-B0TR14-F1-model_v4 UPF0234 protein Shal_3198	0.270	37	24	13	46	100	136	8.053E+00	30
LOKIASV2_1684_ESMFold_hypothetical_protein	AF-A9L2C1-F1-model_v4	LOKIASV2_1684_ESMFold_hypothetical_protein	AF-A9L2C1-F1-model_v4 UPF0234 protein Sbal195_3724	0.270	37	24	13	46	100	136	8.053E+00	30
LOKIASV2_1684_ESMFold_hypothetical_protein	AF-Q0T7G3-F1-model_v4	LOKIASV2_1684_ESMFold_hypothetical_protein	AF-Q0T7G3-F1-model_v4 UPF0234 protein YajQ	0.297	37	23	13	46	102	138	6.634E+00	30
LOKIASV2_1684_ESMFold_hypothetical_protein	AF-P44096-F1-model_v4	LOKIASV2_1684_ESMFold_hypothetical_protein	AF-P44096-F1-model_v4 UPF0234 protein HI_1034	0.216	37	26	13	46	102	138	5.829E+00	30
LOKIASV2_1684_ESMFold_hypothetical_protein	AF-A5UD62-F1-model_v4	LOKIASV2_1684_ESMFold_hypothetical_protein	AF-A5UD62-F1-model_v4 UPF0234 protein CGSHiEE_06890	0.216	37	26	13	46	102	138	5.829E+00	30
LOKIASV2_1684_ESMFold_hypothetical_protein	AF-Q1RGT4-F1-model_v4	LOKIASV2_1684_ESMFold_hypothetical_protein	AF-Q1RGT4-F1-model_v4 Probable chromosome-partitioning protein ParB	0.216	37	25	12	44	237	273	9.777E+00	30
LOKIASV2_1684_ESMFold_hypothetical_protein	AF-Q8DTM9-F1-model_v4	LOKIASV2_1684_ESMFold_hypothetical_protein	AF-Q8DTM9-F1-model_v4 Probable cell division protein WhiA	0.078	38	31	3	40	146	180	6.218E+00	30
LOKIASV2_1684_ESMFold_hypothetical_protein	AF-Q0VCU0-F1-model_v4	LOKIASV2_1684_ESMFold_hypothetical_protein	AF-Q0VCU0-F1-model_v4 Poly(rC)-binding protein 4	0.104	48	36	2	42	244	291	7.549E+00	30
LOKIASV2_1684_ESMFold_hypothetical_protein	AF-Q97F79-F1-model_v4	LOKIASV2_1684_ESMFold_hypothetical_protein	AF-Q97F79-F1-model_v4 UDP-N-acetylglucosamine 1-carboxyvinyltransferase 1	0.241	29	20	13	40	256	284	5.122E+00	30
LOKIASV2_1684_ESMFold_hypothetical_protein	AF-Q6GEX5-F1-model_v4	LOKIASV2_1684_ESMFold_hypothetical_protein	AF-Q6GEX5-F1-model_v4 UDP-N-acetylglucosamine 1-carboxyvinyltransferase 1	0.156	32	25	14	44	259	290	8.053E+00	30
LOKIASV2_1684_ESMFold_hypothetical_protein	AF-C0R4M1-F1-model_v4	LOKIASV2_1684_ESMFold_hypothetical_protein	AF-C0R4M1-F1-model_v4 UDP-N-acetylglucosamine 1-carboxyvinyltransferase	0.218	32	24	13	44	196	227	8.053E+00	30
LOKIASV2_1684_ESMFold_hypothetical_protein	AF-C6DFR7-F1-model_v4	LOKIASV2_1684_ESMFold_hypothetical_protein	AF-C6DFR7-F1-model_v4 Ribosomal RNA small subunit methyltransferase B	0.137	51	42	2	51	172	222	7.549E+00	30
LOKIASV2_1684_ESMFold_hypothetical_protein	AF-Q8ZLM5-F1-model_v4	LOKIASV2_1684_ESMFold_hypothetical_protein	AF-Q8ZLM5-F1-model_v4 Ribosomal RNA small subunit methyltransferase B	0.113	44	37	2	44	172	215	8.053E+00	30
LOKIASV2_1684_ESMFold_hypothetical_protein	AF-Q5EA36-F1-model_v4	LOKIASV2_1684_ESMFold_hypothetical_protein	AF-Q5EA36-F1-model_v4 RNA-binding protein 14	0.111	44	38	1	44	1	44	9.777E+00	30
LOKIASV2_1684_ESMFold_hypothetical_protein	AF-Q8A4N6-F1-model_v4	LOKIASV2_1684_ESMFold_hypothetical_protein	AF-Q8A4N6-F1-model_v4 Polyribonucleotide nucleotidyltransferase	0.069	43	35	2	40	560	602	7.077E+00	30
LOKIASV2_1684_ESMFold_hypothetical_protein	AF-A6L0A5-F1-model_v4	LOKIASV2_1684_ESMFold_hypothetical_protein	AF-A6L0A5-F1-model_v4 Polyribonucleotide nucleotidyltransferase	0.069	43	35	2	40	560	602	7.077E+00	30
LOKIASV2_1684_ESMFold_hypothetical_protein	AF-B3EU51-F1-model_v4	LOKIASV2_1684_ESMFold_hypothetical_protein	AF-B3EU51-F1-model_v4 Polyribonucleotide nucleotidyltransferase	0.093	43	34	2	40	564	606	7.549E+00	30
LOKIASV2_1684_ESMFold_hypothetical_protein	AF-A6W815-F1-model_v4	LOKIASV2_1684_ESMFold_hypothetical_protein	AF-A6W815-F1-model_v4 Polyribonucleotide nucleotidyltransferase	0.078	49	39	2	44	587	635	5.829E+00	30
LOKIASV2_1684_ESMFold_hypothetical_protein	AF-Q7N3Q1-F1-model_v4	LOKIASV2_1684_ESMFold_hypothetical_protein	AF-Q7N3Q1-F1-model_v4 Phenylalanine--tRNA ligase beta subunit	0.140	55	41	1	49	401	455	9.165E+00	30
LOKIASV2_1684_ESMFold_hypothetical_protein	AF-Q8NQN6-F1-model_v4	LOKIASV2_1684_ESMFold_hypothetical_protein	AF-Q8NQN6-F1-model_v4 Phenylalanine--tRNA ligase beta subunit	0.066	45	37	1	41	421	465	7.077E+00	30
LOKIASV2_1684_ESMFold_hypothetical_protein	AF-A9WI69-F1-model_v4	LOKIASV2_1684_ESMFold_hypothetical_protein	AF-A9WI69-F1-model_v4 Putative pterin-4-alpha-carbinolamine dehydratase	0.119	42	35	2	42	28	69	9.165E+00	29
LOKIASV2_1684_ESMFold_hypothetical_protein	AF-B9LCC8-F1-model_v4	LOKIASV2_1684_ESMFold_hypothetical_protein	AF-B9LCC8-F1-model_v4 Putative pterin-4-alpha-carbinolamine dehydratase	0.119	42	35	2	42	28	69	9.165E+00	29
LOKIASV2_1684_ESMFold_hypothetical_protein	AF-A9M6T4-F1-model_v4	LOKIASV2_1684_ESMFold_hypothetical_protein	AF-A9M6T4-F1-model_v4 Putative pterin-4-alpha-carbinolamine dehydratase	0.065	46	41	2	46	32	77	8.053E+00	29
LOKIASV2_1684_ESMFold_hypothetical_protein	AF-Q2YNV0-F1-model_v4	LOKIASV2_1684_ESMFold_hypothetical_protein	AF-Q2YNV0-F1-model_v4 Putative pterin-4-alpha-carbinolamine dehydratase	0.068	44	39	2	44	32	75	9.165E+00	29
LOKIASV2_1684_ESMFold_hypothetical_protein	AF-C3MZU9-F1-model_v4	LOKIASV2_1684_ESMFold_hypothetical_protein	AF-C3MZU9-F1-model_v4 Putative pterin-4-alpha-carbinolamine dehydratase	0.125	40	33	2	40	28	67	7.549E+00	29
LOKIASV2_1684_ESMFold_hypothetical_protein	AF-A6VSD2-F1-model_v4	LOKIASV2_1684_ESMFold_hypothetical_protein	AF-A6VSD2-F1-model_v4 Putative pterin-4-alpha-carbinolamine dehydratase	0.068	44	39	2	44	35	78	8.591E+00	29
LOKIASV2_1684_ESMFold_hypothetical_protein	AF-Q48EH2-F1-model_v4	LOKIASV2_1684_ESMFold_hypothetical_protein	AF-Q48EH2-F1-model_v4 UPF0234 protein PSPPH_4093	0.257	35	23	13	44	98	132	5.464E+00	29
LOKIASV2_1684_ESMFold_hypothetical_protein	AF-Q8D9E8-F1-model_v4	LOKIASV2_1684_ESMFold_hypothetical_protein	AF-Q8D9E8-F1-model_v4 UPF0234 protein VV1_2655	0.312	32	19	13	41	99	130	5.464E+00	29
LOKIASV2_1684_ESMFold_hypothetical_protein	AF-B2JDU3-F1-model_v4	LOKIASV2_1684_ESMFold_hypothetical_protein	AF-B2JDU3-F1-model_v4 UPF0234 protein Bphy_0527	0.162	37	28	13	46	100	136	6.218E+00	29
LOKIASV2_1684_ESMFold_hypothetical_protein	AF-Q5H505-F1-model_v4	LOKIASV2_1684_ESMFold_hypothetical_protein	AF-Q5H505-F1-model_v4 UPF0234 protein XOO0711	0.243	37	25	13	46	100	136	6.634E+00	29
LOKIASV2_1684_ESMFold_hypothetical_protein	AF-Q5ZWB8-F1-model_v4	LOKIASV2_1684_ESMFold_hypothetical_protein	AF-Q5ZWB8-F1-model_v4 UPF0234 protein lpg1167	0.216	37	26	13	46	100	136	7.077E+00	29
LOKIASV2_1684_ESMFold_hypothetical_protein	AF-B7J7F3-F1-model_v4	LOKIASV2_1684_ESMFold_hypothetical_protein	AF-B7J7F3-F1-model_v4 UPF0234 protein AFE_0977	0.216	37	26	13	46	100	136	6.634E+00	29
LOKIASV2_1684_ESMFold_hypothetical_protein	AF-Q8PGE6-F1-model_v4	LOKIASV2_1684_ESMFold_hypothetical_protein	AF-Q8PGE6-F1-model_v4 UPF0234 protein XAC3671	0.228	35	24	13	44	100	134	5.829E+00	29
LOKIASV2_1684_ESMFold_hypothetical_protein	AF-A5IB64-F1-model_v4	LOKIASV2_1684_ESMFold_hypothetical_protein	AF-A5IB64-F1-model_v4 UPF0234 protein LPC_0632	0.216	37	26	13	46	100	136	7.549E+00	29
LOKIASV2_1684_ESMFold_hypothetical_protein	AF-A3D0H5-F1-model_v4	LOKIASV2_1684_ESMFold_hypothetical_protein	AF-A3D0H5-F1-model_v4 UPF0234 protein Sbal_0710	0.270	37	24	13	46	100	136	9.777E+00	29
LOKIASV2_1684_ESMFold_hypothetical_protein	AF-B7M3R5-F1-model_v4	LOKIASV2_1684_ESMFold_hypothetical_protein	AF-B7M3R5-F1-model_v4 UPF0234 protein YajQ	0.297	37	23	13	46	102	138	7.549E+00	29
LOKIASV2_1684_ESMFold_hypothetical_protein	AF-B7LMG1-F1-model_v4	LOKIASV2_1684_ESMFold_hypothetical_protein	AF-B7LMG1-F1-model_v4 UPF0234 protein YajQ	0.297	37	23	13	46	102	138	7.549E+00	29
LOKIASV2_1684_ESMFold_hypothetical_protein	AF-A7ZX79-F1-model_v4	LOKIASV2_1684_ESMFold_hypothetical_protein	AF-A7ZX79-F1-model_v4 UPF0234 protein YajQ	0.297	37	23	13	46	102	138	7.549E+00	29
LOKIASV2_1684_ESMFold_hypothetical_protein	AF-A6T5G0-F1-model_v4	LOKIASV2_1684_ESMFold_hypothetical_protein	AF-A6T5G0-F1-model_v4 UPF0234 protein KPN78578_03700	0.297	37	23	13	46	102	138	7.077E+00	29
LOKIASV2_1684_ESMFold_hypothetical_protein	AF-B3H202-F1-model_v4	LOKIASV2_1684_ESMFold_hypothetical_protein	AF-B3H202-F1-model_v4 UPF0234 protein APP7_1280	0.243	37	25	13	46	102	138	7.077E+00	29
LOKIASV2_1684_ESMFold_hypothetical_protein	AF-Q5PFQ2-F1-model_v4	LOKIASV2_1684_ESMFold_hypothetical_protein	AF-Q5PFQ2-F1-model_v4 UPF0234 protein YajQ	0.297	37	23	13	46	102	138	7.077E+00	29
LOKIASV2_1684_ESMFold_hypothetical_protein	AF-Q57SC9-F1-model_v4	LOKIASV2_1684_ESMFold_hypothetical_protein	AF-Q57SC9-F1-model_v4 UPF0234 protein YajQ	0.297	37	23	13	46	102	138	7.077E+00	29
LOKIASV2_1684_ESMFold_hypothetical_protein	AF-Q4QLP7-F1-model_v4	LOKIASV2_1684_ESMFold_hypothetical_protein	AF-Q4QLP7-F1-model_v4 UPF0234 protein NTHI1194	0.216	37	26	13	46	102	138	7.077E+00	29
LOKIASV2_1684_ESMFold_hypothetical_protein	AF-A5UIG4-F1-model_v4	LOKIASV2_1684_ESMFold_hypothetical_protein	AF-A5UIG4-F1-model_v4 UPF0234 protein CGSHiGG_08790	0.216	37	26	13	46	102	138	7.077E+00	29
LOKIASV2_1684_ESMFold_hypothetical_protein	AF-B5Z3T2-F1-model_v4	LOKIASV2_1684_ESMFold_hypothetical_protein	AF-B5Z3T2-F1-model_v4 UPF0234 protein YajQ	0.297	37	23	13	46	102	138	7.549E+00	29
LOKIASV2_1684_ESMFold_hypothetical_protein	AF-B1J023-F1-model_v4	LOKIASV2_1684_ESMFold_hypothetical_protein	AF-B1J023-F1-model_v4 UPF0234 protein YajQ	0.297	37	23	13	46	102	138	7.549E+00	29
LOKIASV2_1684_ESMFold_hypothetical_protein	AF-Q65RP4-F1-model_v4	LOKIASV2_1684_ESMFold_hypothetical_protein	AF-Q65RP4-F1-model_v4 UPF0234 protein MS1759	0.270	37	24	13	46	102	138	6.634E+00	29
LOKIASV2_1684_ESMFold_hypothetical_protein	AF-B4TMB5-F1-model_v4	LOKIASV2_1684_ESMFold_hypothetical_protein	AF-B4TMB5-F1-model_v4 UPF0234 protein YajQ	0.297	37	23	13	46	102	138	7.077E+00	29
LOKIASV2_1684_ESMFold_hypothetical_protein	AF-P59561-F1-model_v4	LOKIASV2_1684_ESMFold_hypothetical_protein	AF-P59561-F1-model_v4 UPF0234 protein YajQ	0.297	37	23	13	46	102	138	7.549E+00	29
LOKIASV2_1684_ESMFold_hypothetical_protein	AF-B5EXH5-F1-model_v4	LOKIASV2_1684_ESMFold_hypothetical_protein	AF-B5EXH5-F1-model_v4 UPF0234 protein YajQ	0.297	37	23	13	46	102	138	7.077E+00	29
LOKIASV2_1684_ESMFold_hypothetical_protein	AF-B7MD84-F1-model_v4	LOKIASV2_1684_ESMFold_hypothetical_protein	AF-B7MD84-F1-model_v4 UPF0234 protein YajQ	0.297	37	23	13	46	102	138	7.549E+00	29
LOKIASV2_1684_ESMFold_hypothetical_protein	AF-Q8ZRC9-F1-model_v4	LOKIASV2_1684_ESMFold_hypothetical_protein	AF-Q8ZRC9-F1-model_v4 UPF0234 protein YajQ	0.297	37	23	13	46	102	138	7.077E+00	29
LOKIASV2_1684_ESMFold_hypothetical_protein	AF-Q9CKG2-F1-model_v4	LOKIASV2_1684_ESMFold_hypothetical_protein	AF-Q9CKG2-F1-model_v4 UPF0234 protein PM1656	0.243	37	25	13	46	102	138	7.549E+00	29
LOKIASV2_1684_ESMFold_hypothetical_protein	AF-B7MQE1-F1-model_v4	LOKIASV2_1684_ESMFold_hypothetical_protein	AF-B7MQE1-F1-model_v4 UPF0234 protein YajQ	0.297	37	23	13	46	102	138	7.549E+00	29
LOKIASV2_1684_ESMFold_hypothetical_protein	AF-B0R5A9-F1-model_v4	LOKIASV2_1684_ESMFold_hypothetical_protein	AF-B0R5A9-F1-model_v4 Probable tRNA sulfurtransferase	0.075	53	38	3	44	9	61	5.829E+00	29
LOKIASV2_1684_ESMFold_hypothetical_protein	AF-C3N7H2-F1-model_v4	LOKIASV2_1684_ESMFold_hypothetical_protein	AF-C3N7H2-F1-model_v4 3-phosphoshikimate 1-carboxyvinyltransferase	0.153	26	21	17	42	185	210	6.634E+00	29
LOKIASV2_1684_ESMFold_hypothetical_protein	AF-Q73FX6-F1-model_v4	LOKIASV2_1684_ESMFold_hypothetical_protein	AF-Q73FX6-F1-model_v4 UDP-N-acetylglucosamine 1-carboxyvinyltransferase	0.218	32	24	13	44	196	227	9.165E+00	29
LOKIASV2_1684_ESMFold_hypothetical_protein	AF-Q87KD3-F1-model_v4	LOKIASV2_1684_ESMFold_hypothetical_protein	AF-Q87KD3-F1-model_v4 Ribosomal RNA small subunit methyltransferase B	0.160	50	40	3	51	170	219	9.165E+00	29
LOKIASV2_1684_ESMFold_hypothetical_protein	AF-C5CQI8-F1-model_v4	LOKIASV2_1684_ESMFold_hypothetical_protein	AF-C5CQI8-F1-model_v4 UDP-N-acetylglucosamine 1-carboxyvinyltransferase	0.228	35	25	12	45	118	152	5.464E+00	29
LOKIASV2_1684_ESMFold_hypothetical_protein	AF-Q6D000-F1-model_v4	LOKIASV2_1684_ESMFold_hypothetical_protein	AF-Q6D000-F1-model_v4 Ribosomal RNA small subunit methyltransferase B	0.137	51	42	2	51	172	222	8.591E+00	29
LOKIASV2_1684_ESMFold_hypothetical_protein	AF-Q836E5-F1-model_v4	LOKIASV2_1684_ESMFold_hypothetical_protein	AF-Q836E5-F1-model_v4 UDP-N-acetylglucosamine 1-carboxyvinyltransferase 1	0.310	29	19	13	40	256	284	6.218E+00	29
LOKIASV2_1684_ESMFold_hypothetical_protein	AF-Q6MEP6-F1-model_v4	LOKIASV2_1684_ESMFold_hypothetical_protein	AF-Q6MEP6-F1-model_v4 UDP-N-acetylglucosamine 1-carboxyvinyltransferase	0.125	32	26	14	44	263	294	8.053E+00	29
LOKIASV2_1684_ESMFold_hypothetical_protein	AF-O42923-F1-model_v4	LOKIASV2_1684_ESMFold_hypothetical_protein	AF-O42923-F1-model_v4 RNA-binding post-transcriptional regulator cip1	0.073	41	36	1	40	342	382	7.549E+00	29
LOKIASV2_1684_ESMFold_hypothetical_protein	AF-Q9NXZ2-F1-model_v4	LOKIASV2_1684_ESMFold_hypothetical_protein	AF-Q9NXZ2-F1-model_v4 Probable ATP-dependent RNA helicase DDX43	0.100	50	39	1	44	67	116	9.777E+00	29
LOKIASV2_1684_ESMFold_hypothetical_protein	AF-A6H185-F1-model_v4	LOKIASV2_1684_ESMFold_hypothetical_protein	AF-A6H185-F1-model_v4 Polyribonucleotide nucleotidyltransferase	0.063	47	37	2	42	556	602	7.077E+00	29
LOKIASV2_1684_ESMFold_hypothetical_protein	AF-O83206-F1-model_v4	LOKIASV2_1684_ESMFold_hypothetical_protein	AF-O83206-F1-model_v4 Uncharacterized protein TP_0176	0.087	57	37	3	44	32	88	3.475E+00	28
LOKIASV2_1684_ESMFold_hypothetical_protein	AF-C4LBI8-F1-model_v4	LOKIASV2_1684_ESMFold_hypothetical_protein	AF-C4LBI8-F1-model_v4 UPF0234 protein Tola_0795	0.270	37	24	13	46	99	135	8.591E+00	28
LOKIASV2_1684_ESMFold_hypothetical_protein	AF-B4SJP5-F1-model_v4	LOKIASV2_1684_ESMFold_hypothetical_protein	AF-B4SJP5-F1-model_v4 UPF0234 protein Smal_3487	0.216	37	26	13	46	99	135	8.053E+00	28
LOKIASV2_1684_ESMFold_hypothetical_protein	AF-A6SW83-F1-model_v4	LOKIASV2_1684_ESMFold_hypothetical_protein	AF-A6SW83-F1-model_v4 UPF0234 protein mma_0840	0.243	37	25	13	46	100	136	6.218E+00	28
LOKIASV2_1684_ESMFold_hypothetical_protein	AF-A6WSD7-F1-model_v4	LOKIASV2_1684_ESMFold_hypothetical_protein	AF-A6WSD7-F1-model_v4 UPF0234 protein Shew185_3601	0.270	37	24	13	46	100	136	9.777E+00	28
LOKIASV2_1684_ESMFold_hypothetical_protein	AF-A4G3G5-F1-model_v4	LOKIASV2_1684_ESMFold_hypothetical_protein	AF-A4G3G5-F1-model_v4 UPF0234 protein HEAR0865	0.216	37	26	13	46	100	136	6.218E+00	28
LOKIASV2_1684_ESMFold_hypothetical_protein	AF-B1YVE8-F1-model_v4	LOKIASV2_1684_ESMFold_hypothetical_protein	AF-B1YVE8-F1-model_v4 UPF0234 protein BamMC406_2474	0.166	36	28	13	46	101	136	9.165E+00	28
LOKIASV2_1684_ESMFold_hypothetical_protein	AF-B8E801-F1-model_v4	LOKIASV2_1684_ESMFold_hypothetical_protein	AF-B8E801-F1-model_v4 UPF0234 protein Sbal223_3532	0.270	37	24	13	46	100	136	9.777E+00	28
LOKIASV2_1684_ESMFold_hypothetical_protein	AF-B1XTD4-F1-model_v4	LOKIASV2_1684_ESMFold_hypothetical_protein	AF-B1XTD4-F1-model_v4 UPF0234 protein Pnec_0318	0.216	37	26	13	46	100	136	8.053E+00	28
LOKIASV2_1684_ESMFold_hypothetical_protein	AF-A1S8Q3-F1-model_v4	LOKIASV2_1684_ESMFold_hypothetical_protein	AF-A1S8Q3-F1-model_v4 UPF0234 protein Sama_2557	0.312	32	19	13	41	100	131	6.634E+00	28
LOKIASV2_1684_ESMFold_hypothetical_protein	AF-B7L660-F1-model_v4	LOKIASV2_1684_ESMFold_hypothetical_protein	AF-B7L660-F1-model_v4 UPF0234 protein YajQ	0.297	37	23	13	46	102	138	8.591E+00	28
LOKIASV2_1684_ESMFold_hypothetical_protein	AF-A8AK28-F1-model_v4	LOKIASV2_1684_ESMFold_hypothetical_protein	AF-A8AK28-F1-model_v4 UPF0234 protein CKO_02735	0.297	37	23	13	46	102	138	8.053E+00	28
LOKIASV2_1684_ESMFold_hypothetical_protein	AF-Q1RFB4-F1-model_v4	LOKIASV2_1684_ESMFold_hypothetical_protein	AF-Q1RFB4-F1-model_v4 UPF0234 protein YajQ	0.297	37	23	13	46	102	138	8.053E+00	28
LOKIASV2_1684_ESMFold_hypothetical_protein	AF-B4SWS7-F1-model_v4	LOKIASV2_1684_ESMFold_hypothetical_protein	AF-B4SWS7-F1-model_v4 UPF0234 protein YajQ	0.297	37	23	13	46	102	138	8.053E+00	28
LOKIASV2_1684_ESMFold_hypothetical_protein	AF-Q7VNW8-F1-model_v4	LOKIASV2_1684_ESMFold_hypothetical_protein	AF-Q7VNW8-F1-model_v4 UPF0234 protein HD_0358	0.243	37	25	13	46	102	138	9.165E+00	28
LOKIASV2_1684_ESMFold_hypothetical_protein	AF-B5FKU0-F1-model_v4	LOKIASV2_1684_ESMFold_hypothetical_protein	AF-B5FKU0-F1-model_v4 UPF0234 protein YajQ	0.297	37	23	13	46	102	138	8.053E+00	28
LOKIASV2_1684_ESMFold_hypothetical_protein	AF-Q1W375-F1-model_v4	LOKIASV2_1684_ESMFold_hypothetical_protein	AF-Q1W375-F1-model_v4 Phosphomannomutase	0.184	38	29	10	45	151	188	8.053E+00	28
LOKIASV2_1684_ESMFold_hypothetical_protein	AF-A0A1S4A695-F1-model_v4	LOKIASV2_1684_ESMFold_hypothetical_protein	AF-A0A1S4A695-F1-model_v4 Phosphomannomutase	0.184	38	29	10	45	151	188	8.053E+00	28
LOKIASV2_1684_ESMFold_hypothetical_protein	AF-P37526-F1-model_v4	LOKIASV2_1684_ESMFold_hypothetical_protein	AF-P37526-F1-model_v4 Uncharacterized protein YaaC	0.136	43	34	3	42	178	220	9.165E+00	28
LOKIASV2_1684_ESMFold_hypothetical_protein	AF-P0A5L3-F1-model_v4	LOKIASV2_1684_ESMFold_hypothetical_protein	AF-P0A5L3-F1-model_v4 UDP-N-acetylglucosamine 1-carboxyvinyltransferase	0.093	32	28	12	43	326	357	6.218E+00	28
LOKIASV2_1684_ESMFold_hypothetical_protein	AF-Q9HKT9-F1-model_v4	LOKIASV2_1684_ESMFold_hypothetical_protein	AF-Q9HKT9-F1-model_v4 tRNA sulfurtransferase	0.107	56	38	1	44	1	56	8.591E+00	28
LOKIASV2_1684_ESMFold_hypothetical_protein	AF-O74853-F1-model_v4	LOKIASV2_1684_ESMFold_hypothetical_protein	AF-O74853-F1-model_v4 FKBP12-associated protein 1 homolog	0.187	48	34	3	45	952	999	9.165E+00	28
LOKIASV2_1684_ESMFold_hypothetical_protein	AF-O27255-F1-model_v4	LOKIASV2_1684_ESMFold_hypothetical_protein	AF-O27255-F1-model_v4 UPF0045 protein MTH_1187	0.136	44	35	3	44	6	49	4.501E+00	27
LOKIASV2_1684_ESMFold_hypothetical_protein	AF-C4KJC1-F1-model_v4	LOKIASV2_1684_ESMFold_hypothetical_protein	AF-C4KJC1-F1-model_v4 Putative pterin-4-alpha-carbinolamine dehydratase	0.125	40	33	2	40	28	67	9.165E+00	27
LOKIASV2_1684_ESMFold_hypothetical_protein	AF-C4Z0G8-F1-model_v4	LOKIASV2_1684_ESMFold_hypothetical_protein	AF-C4Z0G8-F1-model_v4 Arginine repressor	0.131	38	31	12	49	34	70	7.549E+00	27
LOKIASV2_1684_ESMFold_hypothetical_protein	AF-Q3C167-F1-model_v4	LOKIASV2_1684_ESMFold_hypothetical_protein	AF-Q3C167-F1-model_v4 Arginine regulator	0.181	33	25	13	45	37	67	6.218E+00	27
LOKIASV2_1684_ESMFold_hypothetical_protein	AF-A4VP90-F1-model_v4	LOKIASV2_1684_ESMFold_hypothetical_protein	AF-A4VP90-F1-model_v4 UPF0234 protein PST_3153	0.257	35	23	13	44	98	132	7.549E+00	27
LOKIASV2_1684_ESMFold_hypothetical_protein	AF-Q3J8Y4-F1-model_v4	LOKIASV2_1684_ESMFold_hypothetical_protein	AF-Q3J8Y4-F1-model_v4 UPF0234 protein Noc_2254	0.228	35	24	13	44	99	133	8.591E+00	27
LOKIASV2_1684_ESMFold_hypothetical_protein	AF-B2FHW7-F1-model_v4	LOKIASV2_1684_ESMFold_hypothetical_protein	AF-B2FHW7-F1-model_v4 UPF0234 protein Smlt4090	0.216	37	26	13	46	99	135	9.165E+00	27
LOKIASV2_1684_ESMFold_hypothetical_protein	AF-Q6LQJ9-F1-model_v4	LOKIASV2_1684_ESMFold_hypothetical_protein	AF-Q6LQJ9-F1-model_v4 UPF0234 protein PBPRA2024	0.285	35	22	13	44	99	133	8.053E+00	27
LOKIASV2_1684_ESMFold_hypothetical_protein	AF-B5EQ88-F1-model_v4	LOKIASV2_1684_ESMFold_hypothetical_protein	AF-B5EQ88-F1-model_v4 UPF0234 protein Lferr_1091	0.216	37	26	13	46	100	136	9.165E+00	27
LOKIASV2_1684_ESMFold_hypothetical_protein	AF-B2SY65-F1-model_v4	LOKIASV2_1684_ESMFold_hypothetical_protein	AF-B2SY65-F1-model_v4 UPF0234 protein Bphyt_3208	0.194	36	26	14	46	101	136	7.549E+00	27
LOKIASV2_1684_ESMFold_hypothetical_protein	AF-A7HV58-F1-model_v4	LOKIASV2_1684_ESMFold_hypothetical_protein	AF-A7HV58-F1-model_v4 UPF0234 protein Plav_2177	0.171	35	26	13	44	100	134	8.053E+00	27
LOKIASV2_1684_ESMFold_hypothetical_protein	AF-Q4FMS8-F1-model_v4	LOKIASV2_1684_ESMFold_hypothetical_protein	AF-Q4FMS8-F1-model_v4 UPF0234 protein SAR11_0692	0.257	35	23	13	44	100	134	9.777E+00	27
LOKIASV2_1684_ESMFold_hypothetical_protein	AF-B7N8X9-F1-model_v4	LOKIASV2_1684_ESMFold_hypothetical_protein	AF-B7N8X9-F1-model_v4 UPF0234 protein YajQ	0.297	37	23	13	46	102	138	9.165E+00	27
LOKIASV2_1684_ESMFold_hypothetical_protein	AF-B5Y0W4-F1-model_v4	LOKIASV2_1684_ESMFold_hypothetical_protein	AF-B5Y0W4-F1-model_v4 UPF0234 protein KPK_4305	0.297	37	23	13	46	102	138	8.591E+00	27
LOKIASV2_1684_ESMFold_hypothetical_protein	AF-Q32JI4-F1-model_v4	LOKIASV2_1684_ESMFold_hypothetical_protein	AF-Q32JI4-F1-model_v4 UPF0234 protein YajQ	0.297	37	23	13	46	102	138	9.165E+00	27
LOKIASV2_1684_ESMFold_hypothetical_protein	AF-A7ZII0-F1-model_v4	LOKIASV2_1684_ESMFold_hypothetical_protein	AF-A7ZII0-F1-model_v4 UPF0234 protein YajQ	0.297	37	23	13	46	102	138	9.165E+00	27
LOKIASV2_1684_ESMFold_hypothetical_protein	AF-Q02151-F1-model_v4	LOKIASV2_1684_ESMFold_hypothetical_protein	AF-Q02151-F1-model_v4 Uncharacterized ABC transporter ATP-binding protein YmeB	0.142	35	27	10	44	228	259	7.549E+00	27
LOKIASV2_1684_ESMFold_hypothetical_protein	AF-O31723-F1-model_v4	LOKIASV2_1684_ESMFold_hypothetical_protein	AF-O31723-F1-model_v4 Uncharacterized ABC transporter ATP-binding protein YlmA	0.128	39	31	10	48	228	263	5.464E+00	27
LOKIASV2_1684_ESMFold_hypothetical_protein	AF-A4TGR2-F1-model_v4	LOKIASV2_1684_ESMFold_hypothetical_protein	AF-A4TGR2-F1-model_v4 Rhomboid protease GlpG	0.080	46	40	1	46	1	44	9.777E+00	27
LOKIASV2_1684_ESMFold_hypothetical_protein	AF-B2K5W4-F1-model_v4	LOKIASV2_1684_ESMFold_hypothetical_protein	AF-B2K5W4-F1-model_v4 Rhomboid protease GlpG	0.080	46	40	1	46	1	44	9.777E+00	27
LOKIASV2_1684_ESMFold_hypothetical_protein	AF-Q7CFX8-F1-model_v4	LOKIASV2_1684_ESMFold_hypothetical_protein	AF-Q7CFX8-F1-model_v4 Rhomboid protease GlpG	0.080	46	40	1	46	1	44	9.777E+00	27
LOKIASV2_1684_ESMFold_hypothetical_protein	AF-Q1CCK6-F1-model_v4	LOKIASV2_1684_ESMFold_hypothetical_protein	AF-Q1CCK6-F1-model_v4 Rhomboid protease GlpG	0.080	46	40	1	46	1	44	9.777E+00	27
LOKIASV2_1684_ESMFold_hypothetical_protein	AF-Q1C2L2-F1-model_v4	LOKIASV2_1684_ESMFold_hypothetical_protein	AF-Q1C2L2-F1-model_v4 Rhomboid protease GlpG	0.080	46	40	1	46	1	44	9.777E+00	27
