query	target	qheader	theader	fident	alnlen	mismatch	qstart	qend	tstart	tend	evalue	bits
LOKIASV2_0637_ESMFold_hypothetical_protein	AF-Q8L9S0-F1-model_v4	LOKIASV2_0637_ESMFold_hypothetical_protein	AF-Q8L9S0-F1-model_v4 Bet1-like protein At1g29060	0.253	83	59	45	127	5	84	6.821E+00	31
LOKIASV2_0637_ESMFold_hypothetical_protein	AF-A2YMP7-F1-model_v4	LOKIASV2_0637_ESMFold_hypothetical_protein	AF-A2YMP7-F1-model_v4 Putative secretory carrier-associated membrane protein 1	0.234	108	80	20	124	2	109	2.883E+00	28
LOKIASV2_0637_ESMFold_hypothetical_protein	AF-Q0JAI9-F1-model_v4	LOKIASV2_0637_ESMFold_hypothetical_protein	AF-Q0JAI9-F1-model_v4 Secretory carrier-associated membrane protein 6	0.252	97	67	28	124	5	94	4.764E+00	27
LOKIASV2_0637_ESMFold_hypothetical_protein	AF-Q9MZA9-F1-model_v4	LOKIASV2_0637_ESMFold_hypothetical_protein	AF-Q9MZA9-F1-model_v4 Vimentin	0.176	119	86	18	122	4	122	3.575E+00	25
LOKIASV2_0637_ESMFold_hypothetical_protein	AF-Q9ZTX0-F1-model_v4	LOKIASV2_0637_ESMFold_hypothetical_protein	AF-Q9ZTX0-F1-model_v4 Secretory carrier-associated membrane protein	0.209	105	70	20	124	2	91	2.497E+00	25
LOKIASV2_0637_ESMFold_hypothetical_protein	AF-A8MXQ7-F1-model_v4	LOKIASV2_0637_ESMFold_hypothetical_protein	AF-A8MXQ7-F1-model_v4 IQ motif and ankyrin repeat domain-containing protein 1	0.168	112	81	15	126	4	101	6.821E+00	24
LOKIASV2_0637_ESMFold_hypothetical_protein	AF-P11280-F1-model_v4	LOKIASV2_0637_ESMFold_hypothetical_protein	AF-P11280-F1-model_v4 Pro-opiomelanocortin	0.222	78	54	28	98	2	79	6.348E+00	13
