LOKIASV2_2083_ESMFold_hypothetical_protein	AF-P54121-F1-model_v4	AF-P54121-F1-model_v4 Protein AIG2 A	1.184E-07	1.000	277	4	120	123	10	116	170	117	0.951	0.629
LOKIASV2_2083_ESMFold_hypothetical_protein	AF-Q9MBH2-F1-model_v4	AF-Q9MBH2-F1-model_v4 Protein AIG2 B	2.007E-07	1.000	264	2	120	123	7	116	169	121	0.967	0.651
LOKIASV2_2083_ESMFold_hypothetical_protein	AF-Q57876-F1-model_v4	AF-Q57876-F1-model_v4 Gamma-glutamylcyclotransferase and putative RNase MJ0434	4.053E-07	1.000	259	4	115	123	120	222	222	112	0.911	0.464
LOKIASV2_2083_ESMFold_hypothetical_protein	AF-A2RVS4-F1-model_v4	AF-A2RVS4-F1-model_v4 AIG2-like protein C	3.823E-07	1.000	256	4	120	123	8	114	172	117	0.951	0.622
LOKIASV2_2083_ESMFold_hypothetical_protein	AF-A8MRP2-F1-model_v4	AF-A8MRP2-F1-model_v4 AIG2-like protein D	3.823E-07	1.000	251	4	120	123	8	115	152	118	0.951	0.711
LOKIASV2_2083_ESMFold_hypothetical_protein	AF-Q9FIX2-F1-model_v4	AF-Q9FIX2-F1-model_v4 AIG2-like protein A	1.471E-06	1.000	237	4	120	123	10	116	165	118	0.951	0.648
LOKIASV2_2083_ESMFold_hypothetical_protein	AF-Q9D7X8-F1-model_v4	AF-Q9D7X8-F1-model_v4 Gamma-glutamylcyclotransferase	2.643E-06	1.000	223	4	113	123	17	126	188	119	0.894	0.585
LOKIASV2_2083_ESMFold_hypothetical_protein	AF-Q9FIX1-F1-model_v4	AF-Q9FIX1-F1-model_v4 AIG2-like protein B	5.036E-06	1.000	220	2	118	123	7	114	172	119	0.951	0.628
LOKIASV2_2083_ESMFold_hypothetical_protein	AF-Q32LE4-F1-model_v4	AF-Q32LE4-F1-model_v4 Gamma-glutamylcyclotransferase	2.091E-06	1.000	214	4	114	123	17	132	188	122	0.902	0.617
LOKIASV2_2083_ESMFold_hypothetical_protein	AF-Q9MBH1-F1-model_v4	AF-Q9MBH1-F1-model_v4 Protein AIG2 C	8.533E-06	1.000	203	4	121	123	9	119	165	121	0.959	0.673
LOKIASV2_2083_ESMFold_hypothetical_protein	AF-O75223-F1-model_v4	AF-O75223-F1-model_v4 Gamma-glutamylcyclotransferase	8.047E-06	1.000	203	4	113	123	17	126	188	118	0.894	0.585
LOKIASV2_2083_ESMFold_hypothetical_protein	AF-E9R9Y3-F1-model_v4	AF-E9R9Y3-F1-model_v4 Gamma-glutamyl cyclotransferase gliK	2.598E-05	1.000	189	4	117	123	13	146	273	139	0.927	0.491
LOKIASV2_2083_ESMFold_hypothetical_protein	AF-Q9CQG1-F1-model_v4	AF-Q9CQG1-F1-model_v4 Putative glutathione-specific gamma-glutamylcyclotransferase 2	1.724E-05	1.000	186	5	123	123	2	122	178	130	0.967	0.680
LOKIASV2_2083_ESMFold_hypothetical_protein	AF-A0A1U9YI11-F1-model_v4	AF-A0A1U9YI11-F1-model_v4 Gamma-glutamyl cyclotransferase verK	2.598E-05	1.000	186	1	117	123	18	152	179	141	0.951	0.754
LOKIASV2_2083_ESMFold_hypothetical_protein	AF-B3STU3-F1-model_v4	AF-B3STU3-F1-model_v4 Glutathione-specific gamma-glutamylcyclotransferase 1	2.055E-05	1.000	183	4	121	123	33	151	222	131	0.959	0.536
LOKIASV2_2083_ESMFold_hypothetical_protein	AF-Q8R3J5-F1-model_v4	AF-Q8R3J5-F1-model_v4 Glutathione-specific gamma-glutamylcyclotransferase 1	2.055E-05	1.000	182	4	121	123	34	152	223	131	0.959	0.534
LOKIASV2_2083_ESMFold_hypothetical_protein	AF-Q5ZI66-F1-model_v4	AF-Q5ZI66-F1-model_v4 Putative glutathione-specific gamma-glutamylcyclotransferase 2	2.179E-05	1.000	178	5	123	123	2	122	186	130	0.967	0.651
LOKIASV2_2083_ESMFold_hypothetical_protein	AF-Q4KMJ1-F1-model_v4	AF-Q4KMJ1-F1-model_v4 Putative glutathione-specific gamma-glutamylcyclotransferase 2	2.755E-05	1.000	175	5	123	123	2	123	182	131	0.967	0.670
LOKIASV2_2083_ESMFold_hypothetical_protein	AF-Q9BUX1-F1-model_v4	AF-Q9BUX1-F1-model_v4 Glutathione-specific gamma-glutamylcyclotransferase 1	4.402E-05	1.000	175	4	121	123	33	151	222	131	0.959	0.536
LOKIASV2_2083_ESMFold_hypothetical_protein	AF-Q5PPV4-F1-model_v4	AF-Q5PPV4-F1-model_v4 Putative glutathione-specific gamma-glutamylcyclotransferase 2	3.482E-05	1.000	172	5	123	123	2	122	184	130	0.967	0.658
LOKIASV2_2083_ESMFold_hypothetical_protein	AF-Q641Z5-F1-model_v4	AF-Q641Z5-F1-model_v4 Putative glutathione-specific gamma-glutamylcyclotransferase 2	3.915E-05	1.000	170	5	123	123	2	122	178	130	0.967	0.680
LOKIASV2_2083_ESMFold_hypothetical_protein	AF-Q5SPB6-F1-model_v4	AF-Q5SPB6-F1-model_v4 Glutathione-specific gamma-glutamylcyclotransferase 1	4.949E-05	1.000	169	4	123	123	13	136	196	135	0.976	0.633
LOKIASV2_2083_ESMFold_hypothetical_protein	AF-Q8WUX2-F1-model_v4	AF-Q8WUX2-F1-model_v4 Glutathione-specific gamma-glutamylcyclotransferase 2	8.892E-05	1.000	160	5	123	123	2	122	184	130	0.967	0.658
LOKIASV2_2083_ESMFold_hypothetical_protein	AF-P39759-F1-model_v4	AF-P39759-F1-model_v4 Putative gamma-glutamylcyclotransferase YkqA	4.587E-04	1.000	156	2	114	123	127	234	277	115	0.919	0.390
LOKIASV2_2083_ESMFold_hypothetical_protein	AF-M1W855-F1-model_v4	AF-M1W855-F1-model_v4 Gamma-glutamyl cyclotransferase gliK	2.271E-04	1.000	155	18	116	123	7	108	222	107	0.805	0.459
LOKIASV2_2083_ESMFold_hypothetical_protein	AF-Q0IIH4-F1-model_v4	AF-Q0IIH4-F1-model_v4 Putative glutathione-specific gamma-glutamylcyclotransferase 2	1.694E-04	1.000	154	5	123	123	2	110	176	124	0.967	0.619
LOKIASV2_2083_ESMFold_hypothetical_protein	AF-P39163-F1-model_v4	AF-P39163-F1-model_v4 Glutathione-specific gamma-glutamylcyclotransferase	1.598E-04	1.000	151	1	119	123	45	162	231	132	0.967	0.511
LOKIASV2_2083_ESMFold_hypothetical_protein	AF-A0JMM9-F1-model_v4	AF-A0JMM9-F1-model_v4 Gamma-glutamylaminecyclotransferase A	4.080E-04	1.000	141	2	119	123	18	136	161	132	0.959	0.739
LOKIASV2_2083_ESMFold_hypothetical_protein	AF-Q2UPC2-F1-model_v4	AF-Q2UPC2-F1-model_v4 Gamma-glutamyl cyclotransferase aclK	1.985E-03	1.000	139	4	122	123	18	158	273	147	0.967	0.516
LOKIASV2_2083_ESMFold_hypothetical_protein	AF-Q4H4F0-F1-model_v4	AF-Q4H4F0-F1-model_v4 Gamma-L-glutamyl-butirosin B gamma-glutamyl cyclotransferase	7.330E-04	1.000	135	4	121	123	19	129	156	125	0.959	0.712
LOKIASV2_2083_ESMFold_hypothetical_protein	AF-Q84QC1-F1-model_v4	AF-Q84QC1-F1-model_v4 Gamma-glutamylcyclotransferase 2-3	7.330E-04	1.000	131	4	113	123	3	115	199	122	0.894	0.568
LOKIASV2_2083_ESMFold_hypothetical_protein	AF-Q58909-F1-model_v4	AF-Q58909-F1-model_v4 Putative gamma-glutamylcyclotransferase MJ1514	2.509E-03	1.000	130	3	114	123	1	102	120	114	0.911	0.850
LOKIASV2_2083_ESMFold_hypothetical_protein	AF-Q9W0Y1-F1-model_v4	AF-Q9W0Y1-F1-model_v4 Troponin C-akin-1 protein	1.242E-03	1.000	129	4	116	123	12	123	167	117	0.919	0.671
LOKIASV2_2083_ESMFold_hypothetical_protein	AF-Q8GY54-F1-model_v4	AF-Q8GY54-F1-model_v4 Gamma-glutamylcyclotransferase 2-1	1.042E-03	1.000	128	4	113	123	3	116	216	123	0.894	0.528
LOKIASV2_2083_ESMFold_hypothetical_protein	AF-Q923B0-F1-model_v4	AF-Q923B0-F1-model_v4 Gamma-glutamylaminecyclotransferase	2.366E-03	1.000	123	3	119	123	1	122	149	127	0.951	0.819
LOKIASV2_2083_ESMFold_hypothetical_protein	AF-Q84MC1-F1-model_v4	AF-Q84MC1-F1-model_v4 Gamma-glutamylcyclotransferase 2-2	1.665E-03	1.000	122	4	113	123	3	116	227	123	0.894	0.502
LOKIASV2_2083_ESMFold_hypothetical_protein	AF-Q0VFX9-F1-model_v4	AF-Q0VFX9-F1-model_v4 Gamma-glutamylaminecyclotransferase	2.660E-03	1.000	120	4	119	123	27	141	168	120	0.943	0.685
LOKIASV2_2083_ESMFold_hypothetical_protein	AF-A3KNL6-F1-model_v4	AF-A3KNL6-F1-model_v4 Gamma-glutamylaminecyclotransferase C	3.363E-03	1.000	119	1	119	123	1	122	152	127	0.967	0.803
LOKIASV2_2083_ESMFold_hypothetical_protein	AF-Q9W0Y2-F1-model_v4	AF-Q9W0Y2-F1-model_v4 Putative gamma-glutamylcyclotransferase CG2811	2.991E-03	1.000	117	4	118	123	9	122	157	120	0.935	0.726
LOKIASV2_2083_ESMFold_hypothetical_protein	AF-Q4KM86-F1-model_v4	AF-Q4KM86-F1-model_v4 Gamma-glutamylaminecyclotransferase	6.043E-03	1.000	114	3	119	123	1	122	149	127	0.951	0.819
LOKIASV2_2083_ESMFold_hypothetical_protein	AF-Q66I06-F1-model_v4	AF-Q66I06-F1-model_v4 Gamma-glutamylaminecyclotransferase B	5.374E-03	1.000	112	1	119	123	1	119	191	126	0.967	0.623
LOKIASV2_2083_ESMFold_hypothetical_protein	AF-Q9BVM4-F1-model_v4	AF-Q9BVM4-F1-model_v4 Gamma-glutamylaminecyclotransferase	5.699E-03	1.000	108	3	118	123	1	126	153	134	0.943	0.824
LOKIASV2_2083_ESMFold_hypothetical_protein	AF-Q9M8T3-F1-model_v4	AF-Q9M8T3-F1-model_v4 Putative gamma-glutamylcyclotransferase At3g02910	2.068E-02	0.996	90	2	113	123	10	133	187	134	0.911	0.663
LOKIASV2_2083_ESMFold_hypothetical_protein	AF-Q66KX0-F1-model_v4	AF-Q66KX0-F1-model_v4 Gamma-glutamylaminecyclotransferase	3.248E-01	0.837	63	27	119	123	2	110	138	110	0.756	0.790
LOKIASV2_2083_ESMFold_hypothetical_protein	AF-Q61DP2-F1-model_v4	AF-Q61DP2-F1-model_v4 Spindle-defective protein 2	2.155E-01	0.116	33	32	112	123	510	574	829	87	0.659	0.078
LOKIASV2_2083_ESMFold_hypothetical_protein	AF-P34138-F1-model_v4	AF-P34138-F1-model_v4 Tyrosine-protein phosphatase 2	2.525E+00	0.106	32	90	112	123	222	244	377	23	0.187	0.061
LOKIASV2_2083_ESMFold_hypothetical_protein	AF-P28205-F1-model_v4	AF-P28205-F1-model_v4 Tyrosine-protein phosphatase 13	3.192E+00	0.090	30	89	112	123	52	75	114	24	0.195	0.211
LOKIASV2_2083_ESMFold_hypothetical_protein	AF-E5KIB9-F1-model_v4	AF-E5KIB9-F1-model_v4 Cypemycin cysteine dehydrogenase (decarboxylating)	5.101E+00	0.090	30	70	109	123	129	168	190	40	0.325	0.211
LOKIASV2_2083_ESMFold_hypothetical_protein	AF-Q3UY96-F1-model_v4	AF-Q3UY96-F1-model_v4 Cilia- and flagella-associated protein 74	3.248E-01	0.082	29	33	112	123	826	904	1578	88	0.650	0.050
LOKIASV2_2083_ESMFold_hypothetical_protein	AF-A5WFA2-F1-model_v4	AF-A5WFA2-F1-model_v4 Ribosomal RNA small subunit methyltransferase G	3.011E+00	0.076	28	72	117	123	186	225	225	46	0.374	0.178
LOKIASV2_2083_ESMFold_hypothetical_protein	AF-P82350-F1-model_v4	AF-P82350-F1-model_v4 Alpha-sarcoglycan	9.326E-01	0.069	27	21	112	123	47	121	387	93	0.748	0.194
LOKIASV2_2083_ESMFold_hypothetical_protein	AF-G0S488-F1-model_v4	AF-G0S488-F1-model_v4 60S ribosomal export protein NMD3	3.385E+00	0.069	27	67	114	123	202	252	518	51	0.390	0.098
LOKIASV2_2083_ESMFold_hypothetical_protein	AF-Q03348-F1-model_v4	AF-Q03348-F1-model_v4 Receptor-type tyrosine-protein phosphatase alpha	6.838E+00	0.069	27	89	112	123	663	686	796	24	0.195	0.030
LOKIASV2_2083_ESMFold_hypothetical_protein	AF-P18433-F1-model_v4	AF-P18433-F1-model_v4 Receptor-type tyrosine-protein phosphatase alpha	5.736E+00	0.069	27	89	114	123	669	694	802	26	0.211	0.032
LOKIASV2_2083_ESMFold_hypothetical_protein	AF-P29074-F1-model_v4	AF-P29074-F1-model_v4 Tyrosine-protein phosphatase non-receptor type 4	5.409E+00	0.069	27	89	112	123	790	813	926	24	0.195	0.026
LOKIASV2_2083_ESMFold_hypothetical_protein	AF-Q58538-F1-model_v4	AF-Q58538-F1-model_v4 Uncharacterized protein MJ1138	3.444E-01	0.063	26	31	115	123	63	145	174	94	0.691	0.477
LOKIASV2_2083_ESMFold_hypothetical_protein	AF-D9N164-F1-model_v4	AF-D9N164-F1-model_v4 Inward rectifier potassium channel Kirbac3.1	5.191E-01	0.063	26	31	114	123	175	261	295	94	0.683	0.295
LOKIASV2_2083_ESMFold_hypothetical_protein	AF-P18052-F1-model_v4	AF-P18052-F1-model_v4 Receptor-type tyrosine-protein phosphatase alpha	5.409E+00	0.063	26	89	117	123	696	725	829	30	0.236	0.036
LOKIASV2_2083_ESMFold_hypothetical_protein	AF-P26045-F1-model_v4	AF-P26045-F1-model_v4 Tyrosine-protein phosphatase non-receptor type 3	5.409E+00	0.063	26	89	112	123	781	804	913	24	0.195	0.026
LOKIASV2_2083_ESMFold_hypothetical_protein	AF-Q62130-F1-model_v4	AF-Q62130-F1-model_v4 Tyrosine-protein phosphatase non-receptor type 14	6.838E+00	0.063	26	89	112	123	1051	1074	1189	24	0.195	0.020
LOKIASV2_2083_ESMFold_hypothetical_protein	AF-P28193-F1-model_v4	AF-P28193-F1-model_v4 Tyrosine-protein phosphatase 1	6.449E+00	0.057	25	89	112	123	47	70	107	24	0.195	0.224
LOKIASV2_2083_ESMFold_hypothetical_protein	AF-P28213-F1-model_v4	AF-P28213-F1-model_v4 Tyrosine-protein phosphatase 21	5.736E+00	0.057	25	89	118	123	53	83	115	31	0.244	0.270
LOKIASV2_2083_ESMFold_hypothetical_protein	AF-P35233-F1-model_v4	AF-P35233-F1-model_v4 Tyrosine-protein phosphatase non-receptor type 2	6.838E+00	0.057	25	90	114	123	153	177	416	25	0.203	0.060
LOKIASV2_2083_ESMFold_hypothetical_protein	AF-P35821-F1-model_v4	AF-P35821-F1-model_v4 Tyrosine-protein phosphatase non-receptor type 1	6.449E+00	0.057	25	90	112	123	152	174	432	23	0.187	0.053
LOKIASV2_2083_ESMFold_hypothetical_protein	AF-O70258-F1-model_v4	AF-O70258-F1-model_v4 Epsilon-sarcoglycan	2.118E+00	0.057	25	65	113	123	110	148	437	49	0.398	0.089
LOKIASV2_2083_ESMFold_hypothetical_protein	AF-Q62728-F1-model_v4	AF-Q62728-F1-model_v4 Tyrosine-protein phosphatase non-receptor type 21	7.688E+00	0.057	25	87	112	123	1036	1061	1175	26	0.211	0.022
LOKIASV2_2083_ESMFold_hypothetical_protein	AF-Q15678-F1-model_v4	AF-Q15678-F1-model_v4 Tyrosine-protein phosphatase non-receptor type 14	8.644E+00	0.057	25	87	112	123	1047	1072	1187	26	0.211	0.022
LOKIASV2_2083_ESMFold_hypothetical_protein	AF-Q6PB44-F1-model_v4	AF-Q6PB44-F1-model_v4 Tyrosine-protein phosphatase non-receptor type 23	5.101E+00	0.057	25	89	112	123	1383	1406	1692	24	0.195	0.014
LOKIASV2_2083_ESMFold_hypothetical_protein	AF-Q8YM40-F1-model_v4	AF-Q8YM40-F1-model_v4 Alpha-2-macroglobulin homolog	1.112E+00	0.057	25	33	111	123	896	975	1906	94	0.642	0.042
LOKIASV2_2083_ESMFold_hypothetical_protein	AF-C6Y4A2-F1-model_v4	AF-C6Y4A2-F1-model_v4 Uncharacterized protein C4G9.22	8.644E+00	0.051	24	70	116	123	3	48	94	47	0.382	0.489
LOKIASV2_2083_ESMFold_hypothetical_protein	AF-Q1QBW5-F1-model_v4	AF-Q1QBW5-F1-model_v4 Ribosomal RNA small subunit methyltransferase G	6.082E+00	0.051	24	73	117	123	200	238	238	45	0.366	0.164
LOKIASV2_2083_ESMFold_hypothetical_protein	AF-O70339-F1-model_v4	AF-O70339-F1-model_v4 ATP-sensitive inward rectifier potassium channel 15	1.049E+00	0.051	24	31	114	123	211	301	375	100	0.683	0.243
LOKIASV2_2083_ESMFold_hypothetical_protein	AF-Q64255-F1-model_v4	AF-Q64255-F1-model_v4 Alpha-sarcoglycan	1.112E+00	0.051	24	21	118	123	47	131	387	103	0.797	0.220
LOKIASV2_2083_ESMFold_hypothetical_protein	AF-P20417-F1-model_v4	AF-P20417-F1-model_v4 Tyrosine-protein phosphatase non-receptor type 1	8.152E+00	0.051	24	90	112	123	152	174	432	23	0.187	0.053
LOKIASV2_2083_ESMFold_hypothetical_protein	AF-O13016-F1-model_v4	AF-O13016-F1-model_v4 Tyrosine-protein phosphatase non-receptor type 1	7.688E+00	0.051	24	90	112	123	152	174	434	23	0.187	0.053
LOKIASV2_2083_ESMFold_hypothetical_protein	AF-P18031-F1-model_v4	AF-P18031-F1-model_v4 Tyrosine-protein phosphatase non-receptor type 1	7.688E+00	0.051	24	90	112	123	152	174	435	23	0.187	0.053
LOKIASV2_2083_ESMFold_hypothetical_protein	AF-Q9W0G1-F1-model_v4	AF-Q9W0G1-F1-model_v4 Tyrosine-protein phosphatase non-receptor type 61F	7.688E+00	0.051	24	89	114	123	173	198	548	26	0.211	0.047
LOKIASV2_2083_ESMFold_hypothetical_protein	AF-Q641Z2-F1-model_v4	AF-Q641Z2-F1-model_v4 Tyrosine-protein phosphatase non-receptor type 9	9.166E+00	0.051	24	89	112	123	440	463	593	24	0.195	0.040
LOKIASV2_2083_ESMFold_hypothetical_protein	AF-O35239-F1-model_v4	AF-O35239-F1-model_v4 Tyrosine-protein phosphatase non-receptor type 9	9.166E+00	0.051	24	89	112	123	440	463	593	24	0.195	0.040
LOKIASV2_2083_ESMFold_hypothetical_protein	AF-F4K4C5-F1-model_v4	AF-F4K4C5-F1-model_v4 Kinesin-like protein KIN-14S	8.796E-01	0.051	24	32	114	123	257	361	765	115	0.675	0.137
LOKIASV2_2083_ESMFold_hypothetical_protein	AF-Q6G644-F1-model_v4	AF-Q6G644-F1-model_v4 Clumping factor B	9.889E-01	0.051	24	31	113	123	255	357	905	117	0.675	0.114
LOKIASV2_2083_ESMFold_hypothetical_protein	AF-P56722-F1-model_v4	AF-P56722-F1-model_v4 Receptor-type tyrosine-protein phosphatase-like N	8.152E+00	0.051	24	89	114	123	847	872	979	26	0.211	0.027
LOKIASV2_2083_ESMFold_hypothetical_protein	AF-P07949-F1-model_v4	AF-P07949-F1-model_v4 Proto-oncogene tyrosine-protein kinase receptor Ret	1.179E+00	0.051	24	31	117	123	437	506	1114	87	0.707	0.063
LOKIASV2_2083_ESMFold_hypothetical_protein	AF-C4B8C5-F1-model_v4	AF-C4B8C5-F1-model_v4 EPIDERMAL PATTERNING FACTOR-like protein 7	1.406E+00	0.045	23	40	117	123	86	169	172	86	0.634	0.488
LOKIASV2_2083_ESMFold_hypothetical_protein	AF-A2X208-F1-model_v4	AF-A2X208-F1-model_v4 Outer envelope protein 80, chloroplastic	9.719E+00	0.045	23	70	116	123	282	329	665	48	0.382	0.072
LOKIASV2_2083_ESMFold_hypothetical_protein	AF-G5EGJ5-F1-model_v4	AF-G5EGJ5-F1-model_v4 Receptor-type tyrosine-protein phosphatase-like ida-1	8.644E+00	0.045	23	89	112	123	634	657	767	24	0.195	0.031
LOKIASV2_2083_ESMFold_hypothetical_protein	AF-Q9VI82-F1-model_v4	AF-Q9VI82-F1-model_v4 Nucleolar complex protein 3 homolog	7.688E+00	0.045	23	76	123	123	130	177	822	48	0.390	0.058
LOKIASV2_2083_ESMFold_hypothetical_protein	AF-Q7A382-F1-model_v4	AF-Q7A382-F1-model_v4 Clumping factor B	1.777E+00	0.045	23	31	113	123	255	357	877	114	0.675	0.117
LOKIASV2_2083_ESMFold_hypothetical_protein	AF-Q5HCR7-F1-model_v4	AF-Q5HCR7-F1-model_v4 Clumping factor B	1.777E+00	0.045	23	31	113	123	255	357	913	114	0.675	0.113
LOKIASV2_2083_ESMFold_hypothetical_protein	AF-A2ALK8-F1-model_v4	AF-A2ALK8-F1-model_v4 Tyrosine-protein phosphatase non-receptor type 3	7.251E+00	0.045	23	90	114	123	782	806	913	25	0.203	0.027
LOKIASV2_2083_ESMFold_hypothetical_protein	AF-Q16849-F1-model_v4	AF-Q16849-F1-model_v4 Receptor-type tyrosine-protein phosphatase-like N	8.644E+00	0.045	23	89	114	123	847	872	979	26	0.211	0.027
LOKIASV2_2083_ESMFold_hypothetical_protein	AF-Q54K09-F1-model_v4	AF-Q54K09-F1-model_v4 Metabotropic glutamate receptor-like protein Q	1.406E+00	0.045	23	32	118	123	644	707	1187	88	0.707	0.054
LOKIASV2_2083_ESMFold_hypothetical_protein	AF-O88902-F1-model_v4	AF-O88902-F1-model_v4 Tyrosine-protein phosphatase non-receptor type 23	4.811E+00	0.045	23	89	118	123	1190	1220	1499	31	0.244	0.021
LOKIASV2_2083_ESMFold_hypothetical_protein	AF-Q8TEM1-F1-model_v4	AF-Q8TEM1-F1-model_v4 Nuclear pore membrane glycoprotein 210	9.889E-01	0.045	23	30	123	123	1719	1798	1887	100	0.764	0.042
LOKIASV2_2083_ESMFold_hypothetical_protein	AF-Q74MI5-F1-model_v4	AF-Q74MI5-F1-model_v4 30S ribosomal protein S10	4.537E+00	0.040	22	15	110	123	20	103	109	103	0.780	0.771
LOKIASV2_2083_ESMFold_hypothetical_protein	AF-P75374-F1-model_v4	AF-P75374-F1-model_v4 UPF0134 protein MPN_410	7.688E+00	0.040	22	70	118	123	5	50	148	49	0.398	0.311
LOKIASV2_2083_ESMFold_hypothetical_protein	AF-Q28686-F1-model_v4	AF-Q28686-F1-model_v4 Alpha-sarcoglycan	2.118E+00	0.040	22	39	112	123	59	121	387	83	0.602	0.163
LOKIASV2_2083_ESMFold_hypothetical_protein	AF-P17706-F1-model_v4	AF-P17706-F1-model_v4 Tyrosine-protein phosphatase non-receptor type 2	9.719E+00	0.040	22	90	112	123	153	175	415	23	0.187	0.055
LOKIASV2_2083_ESMFold_hypothetical_protein	AF-Q6YAT4-F1-model_v4	AF-Q6YAT4-F1-model_v4 Epsilon-sarcoglycan	1.490E+00	0.040	22	4	113	123	56	148	437	124	0.894	0.213
LOKIASV2_2083_ESMFold_hypothetical_protein	AF-Q29S03-F1-model_v4	AF-Q29S03-F1-model_v4 Epsilon-sarcoglycan	1.326E+00	0.040	22	4	113	123	56	148	437	121	0.894	0.213
LOKIASV2_2083_ESMFold_hypothetical_protein	AF-O43556-F1-model_v4	AF-O43556-F1-model_v4 Epsilon-sarcoglycan	1.580E+00	0.040	22	4	113	123	56	148	437	126	0.894	0.213
LOKIASV2_2083_ESMFold_hypothetical_protein	AF-P63251-F1-model_v4	AF-P63251-F1-model_v4 G protein-activated inward rectifier potassium channel 1	9.326E-01	0.040	22	31	114	123	225	317	501	99	0.683	0.186
LOKIASV2_2083_ESMFold_hypothetical_protein	AF-Q6GDH2-F1-model_v4	AF-Q6GDH2-F1-model_v4 Clumping factor B	2.678E+00	0.040	22	32	113	123	256	357	873	113	0.667	0.117
LOKIASV2_2083_ESMFold_hypothetical_protein	AF-O60330-F1-model_v4	AF-O60330-F1-model_v4 Protocadherin gamma-A12	5.101E+00	0.040	22	67	112	123	83	122	932	46	0.374	0.043
LOKIASV2_2083_ESMFold_hypothetical_protein	AF-Q5DRB9-F1-model_v4	AF-Q5DRB9-F1-model_v4 Protocadherin gamma-A12	4.537E+00	0.040	22	67	112	123	83	122	932	46	0.374	0.043
LOKIASV2_2083_ESMFold_hypothetical_protein	AF-Q9Y5G7-F1-model_v4	AF-Q9Y5G7-F1-model_v4 Protocadherin gamma-A6	4.036E+00	0.040	22	67	113	123	83	123	932	50	0.382	0.044
LOKIASV2_2083_ESMFold_hypothetical_protein	AF-Q9Y5H0-F1-model_v4	AF-Q9Y5H0-F1-model_v4 Protocadherin gamma-A3	4.537E+00	0.040	22	67	113	123	83	123	932	50	0.382	0.044
LOKIASV2_2083_ESMFold_hypothetical_protein	AF-Q63259-F1-model_v4	AF-Q63259-F1-model_v4 Receptor-type tyrosine-protein phosphatase-like N	9.719E+00	0.040	22	89	114	123	851	876	983	26	0.211	0.026
LOKIASV2_2083_ESMFold_hypothetical_protein	AF-P28191-F1-model_v4	AF-P28191-F1-model_v4 Tyrosine-protein phosphatase 1	8.644E+00	0.040	22	89	112	123	890	913	1026	24	0.195	0.023
LOKIASV2_2083_ESMFold_hypothetical_protein	AF-Q61495-F1-model_v4	AF-Q61495-F1-model_v4 Desmoglein-1-alpha	1.884E+00	0.040	22	26	118	123	415	486	1057	95	0.756	0.068
LOKIASV2_2083_ESMFold_hypothetical_protein	AF-G3V9H8-F1-model_v4	AF-G3V9H8-F1-model_v4 Proto-oncogene tyrosine-protein kinase receptor Ret	2.246E+00	0.040	22	32	121	123	437	515	1115	102	0.732	0.071
LOKIASV2_2083_ESMFold_hypothetical_protein	AF-Q9BYE9-F1-model_v4	AF-Q9BYE9-F1-model_v4 Cadherin-related family member 2	1.580E+00	0.040	22	35	114	123	403	469	1310	86	0.650	0.051
LOKIASV2_2083_ESMFold_hypothetical_protein	AF-Q9H3S7-F1-model_v4	AF-Q9H3S7-F1-model_v4 Tyrosine-protein phosphatase non-receptor type 23	7.688E+00	0.040	22	89	112	123	1327	1350	1636	24	0.195	0.015
LOKIASV2_2083_ESMFold_hypothetical_protein	AF-P28201-F1-model_v4	AF-P28201-F1-model_v4 Tyrosine-protein phosphatase 9	9.166E+00	0.034	21	90	112	123	52	74	111	23	0.187	0.207
LOKIASV2_2083_ESMFold_hypothetical_protein	AF-O66960-F1-model_v4	AF-O66960-F1-model_v4 Uncharacterized protein aq_758	2.678E+00	0.034	21	33	123	123	71	154	165	98	0.740	0.509
LOKIASV2_2083_ESMFold_hypothetical_protein	AF-Q54CU8-F1-model_v4	AF-Q54CU8-F1-model_v4 COMM domain-containing protein 8	4.036E+00	0.034	21	35	115	123	138	187	205	83	0.659	0.244
LOKIASV2_2083_ESMFold_hypothetical_protein	AF-A0B6U3-F1-model_v4	AF-A0B6U3-F1-model_v4 Protein pelota homolog	4.617E-01	0.034	21	25	123	123	73	166	347	113	0.805	0.271
LOKIASV2_2083_ESMFold_hypothetical_protein	AF-Q5NVJ6-F1-model_v4	AF-Q5NVJ6-F1-model_v4 G protein-activated inward rectifier potassium channel 2	1.406E+00	0.034	21	31	114	123	234	326	423	99	0.683	0.220
LOKIASV2_2083_ESMFold_hypothetical_protein	AF-F1NHE9-F1-model_v4	AF-F1NHE9-F1-model_v4 ATP-sensitive inward rectifier potassium channel 12	1.580E+00	0.034	21	31	114	123	225	317	429	98	0.683	0.217
LOKIASV2_2083_ESMFold_hypothetical_protein	AF-P52189-F1-model_v4	AF-P52189-F1-model_v4 Inward rectifier potassium channel 4	1.676E+00	0.034	21	31	114	123	215	307	445	99	0.683	0.209
LOKIASV2_2083_ESMFold_hypothetical_protein	AF-P48050-F1-model_v4	AF-P48050-F1-model_v4 Inward rectifier potassium channel 4	1.580E+00	0.034	21	31	114	123	216	308	445	99	0.683	0.209
LOKIASV2_2083_ESMFold_hypothetical_protein	AF-P52190-F1-model_v4	AF-P52190-F1-model_v4 Inward rectifier potassium channel 4	1.490E+00	0.034	21	31	114	123	216	308	446	99	0.683	0.209
LOKIASV2_2083_ESMFold_hypothetical_protein	AF-P48549-F1-model_v4	AF-P48549-F1-model_v4 G protein-activated inward rectifier potassium channel 1	1.406E+00	0.034	21	31	114	123	225	317	501	99	0.683	0.186
LOKIASV2_2083_ESMFold_hypothetical_protein	AF-P42555-F1-model_v4	AF-P42555-F1-model_v4 Chaperone protein HtpG	1.049E+00	0.034	21	31	113	123	129	224	616	99	0.675	0.156
LOKIASV2_2083_ESMFold_hypothetical_protein	AF-O86476-F1-model_v4	AF-O86476-F1-model_v4 Clumping factor B	1.777E+00	0.034	21	32	113	123	256	357	913	116	0.667	0.112
LOKIASV2_2083_ESMFold_hypothetical_protein	AF-Q5DRB2-F1-model_v4	AF-Q5DRB2-F1-model_v4 Protocadherin gamma-A8	5.101E+00	0.034	21	67	113	123	83	123	932	50	0.382	0.044
LOKIASV2_2083_ESMFold_hypothetical_protein	AF-Q9Y5G6-F1-model_v4	AF-Q9Y5G6-F1-model_v4 Protocadherin gamma-A7	4.811E+00	0.034	21	67	113	123	83	123	932	50	0.382	0.044
LOKIASV2_2083_ESMFold_hypothetical_protein	AF-Q4FS37-F1-model_v4	AF-Q4FS37-F1-model_v4 Ribosomal RNA small subunit methyltransferase G	9.719E+00	0.029	20	73	117	123	200	238	238	45	0.366	0.164
LOKIASV2_2083_ESMFold_hypothetical_protein	AF-Q5EB96-F1-model_v4	AF-Q5EB96-F1-model_v4 Septin-1	9.719E+00	0.029	20	84	112	123	62	88	366	29	0.236	0.074
LOKIASV2_2083_ESMFold_hypothetical_protein	AF-I3V6A7-F1-model_v4	AF-I3V6A7-F1-model_v4 Scoulerine-9-O-methyltransferase 1	6.082E+00	0.029	20	76	118	123	97	135	390	43	0.350	0.100
LOKIASV2_2083_ESMFold_hypothetical_protein	AF-P48550-F1-model_v4	AF-P48550-F1-model_v4 G protein-activated inward rectifier potassium channel 2	1.490E+00	0.029	20	31	114	123	236	328	425	99	0.683	0.219
LOKIASV2_2083_ESMFold_hypothetical_protein	AF-Q4TZY1-F1-model_v4	AF-Q4TZY1-F1-model_v4 ATP-sensitive inward rectifier potassium channel 12	2.118E+00	0.029	20	31	114	123	225	317	427	98	0.683	0.218
LOKIASV2_2083_ESMFold_hypothetical_protein	AF-B7U540-F1-model_v4	AF-B7U540-F1-model_v4 Inward rectifier potassium channel 18	2.246E+00	0.029	20	31	114	123	225	317	433	98	0.683	0.215
LOKIASV2_2083_ESMFold_hypothetical_protein	AF-Q64198-F1-model_v4	AF-Q64198-F1-model_v4 Inward rectifier potassium channel 4	1.884E+00	0.029	20	31	114	123	215	307	444	99	0.683	0.209
LOKIASV2_2083_ESMFold_hypothetical_protein	AF-Q93704-F1-model_v4	AF-Q93704-F1-model_v4 Sex peptide receptor-related protein 2	9.166E+00	0.029	20	76	114	123	185	229	451	45	0.317	0.100
LOKIASV2_2083_ESMFold_hypothetical_protein	AF-P63250-F1-model_v4	AF-P63250-F1-model_v4 G protein-activated inward rectifier potassium channel 1	1.676E+00	0.029	20	31	114	123	225	317	501	99	0.683	0.186
LOKIASV2_2083_ESMFold_hypothetical_protein	AF-E1BNE9-F1-model_v4	AF-E1BNE9-F1-model_v4 G protein-activated inward rectifier potassium channel 1	1.676E+00	0.029	20	31	114	123	225	317	501	99	0.683	0.186
LOKIASV2_2083_ESMFold_hypothetical_protein	AF-P78811-F1-model_v4	AF-P78811-F1-model_v4 Probable UTP--glucose-1-phosphate uridylyltransferase	2.246E+00	0.029	20	55	114	123	297	368	506	79	0.488	0.142
LOKIASV2_2083_ESMFold_hypothetical_protein	AF-D4AIK6-F1-model_v4	AF-D4AIK6-F1-model_v4 Probable tripeptidyl-peptidase SED4	7.688E+00	0.029	20	68	114	123	130	166	600	47	0.382	0.062
LOKIASV2_2083_ESMFold_hypothetical_protein	AF-Q0SMU9-F1-model_v4	AF-Q0SMU9-F1-model_v4 Chaperone protein HtpG	1.580E+00	0.029	20	31	113	123	129	224	616	99	0.675	0.156
LOKIASV2_2083_ESMFold_hypothetical_protein	AF-Q660W4-F1-model_v4	AF-Q660W4-F1-model_v4 Chaperone protein HtpG	1.406E+00	0.029	20	31	113	123	129	224	616	99	0.675	0.156
LOKIASV2_2083_ESMFold_hypothetical_protein	AF-Q9U9K0-F1-model_v4	AF-Q9U9K0-F1-model_v4 Adducin-related protein 1	7.251E+00	0.029	20	74	123	123	407	465	732	61	0.407	0.081
