query	target	qheader	theader	fident	alnlen	mismatch	qstart	qend	tstart	tend	evalue	bits
LOKIASV2_2336_ESMFold_hypothetical_protein	AF-P39612-F1-model_v4	LOKIASV2_2336_ESMFold_hypothetical_protein	AF-P39612-F1-model_v4 Uncharacterized protein YwdD	0.140	143	118	22	159	68	210	4.146E-01	61
LOKIASV2_2336_ESMFold_hypothetical_protein	AF-P55909-F1-model_v4	LOKIASV2_2336_ESMFold_hypothetical_protein	AF-P55909-F1-model_v4 Uncharacterized protein YcgB	0.134	175	139	2	176	11	172	7.048E-01	50
LOKIASV2_2336_ESMFold_hypothetical_protein	AF-P52883-F1-model_v4	LOKIASV2_2336_ESMFold_hypothetical_protein	AF-P52883-F1-model_v4 Uncharacterized protein F46C5.7	0.137	175	148	1	175	1	172	9.190E-01	44
LOKIASV2_2336_ESMFold_hypothetical_protein	AF-P13386-F1-model_v4	LOKIASV2_2336_ESMFold_hypothetical_protein	AF-P13386-F1-model_v4 High affinity immunoglobulin epsilon receptor subunit beta	0.141	169	138	15	176	52	220	1.648E+00	41
LOKIASV2_2336_ESMFold_hypothetical_protein	AF-Q550T1-F1-model_v4	LOKIASV2_2336_ESMFold_hypothetical_protein	AF-Q550T1-F1-model_v4 Uncharacterized transmembrane protein DDB_G0276999	0.178	180	136	7	173	2	181	1.198E+00	41
LOKIASV2_2336_ESMFold_hypothetical_protein	AF-P20490-F1-model_v4	LOKIASV2_2336_ESMFold_hypothetical_protein	AF-P20490-F1-model_v4 High affinity immunoglobulin epsilon receptor subunit beta	0.150	175	142	8	175	40	214	1.832E+00	37
LOKIASV2_2336_ESMFold_hypothetical_protein	AF-P45417-F1-model_v4	LOKIASV2_2336_ESMFold_hypothetical_protein	AF-P45417-F1-model_v4 Uncharacterized protein Dda3937_02003	0.134	124	105	29	152	189	310	2.656E+00	35
LOKIASV2_2336_ESMFold_hypothetical_protein	AF-Q41060-F1-model_v4	LOKIASV2_2336_ESMFold_hypothetical_protein	AF-Q41060-F1-model_v4 Seed biotin-containing protein SBP65	0.100	174	146	3	176	246	408	2.953E+00	35
LOKIASV2_2336_ESMFold_hypothetical_protein	AF-Q8N7C4-F1-model_v4	LOKIASV2_2336_ESMFold_hypothetical_protein	AF-Q8N7C4-F1-model_v4 Transmembrane protein 217	0.135	161	128	29	177	19	179	8.095E+00	32
LOKIASV2_2336_ESMFold_hypothetical_protein	AF-Q6Z8F5-F1-model_v4	LOKIASV2_2336_ESMFold_hypothetical_protein	AF-Q6Z8F5-F1-model_v4 Secretory carrier-associated membrane protein 5	0.154	158	124	21	168	122	279	2.265E+00	32
LOKIASV2_2336_ESMFold_hypothetical_protein	AF-P32867-F1-model_v4	LOKIASV2_2336_ESMFold_hypothetical_protein	AF-P32867-F1-model_v4 Protein SSO1	0.117	188	148	3	171	32	219	2.656E+00	32
LOKIASV2_2336_ESMFold_hypothetical_protein	AF-D8ST13-F1-model_v4	LOKIASV2_2336_ESMFold_hypothetical_protein	AF-D8ST13-F1-model_v4 CASP-like protein 2U7	0.144	95	75	82	176	102	190	9.491E+00	30
LOKIASV2_2336_ESMFold_hypothetical_protein	AF-P42409-F1-model_v4	LOKIASV2_2336_ESMFold_hypothetical_protein	AF-P42409-F1-model_v4 RsbT co-antagonist protein RsbRA	0.102	159	126	7	165	4	144	4.761E+00	30
LOKIASV2_2336_ESMFold_hypothetical_protein	AF-Q940P5-F1-model_v4	LOKIASV2_2336_ESMFold_hypothetical_protein	AF-Q940P5-F1-model_v4 Tetraspanin-19	0.162	163	127	18	169	2	164	5.021E+00	29
LOKIASV2_2336_ESMFold_hypothetical_protein	AF-Q9SKT3-F1-model_v4	LOKIASV2_2336_ESMFold_hypothetical_protein	AF-Q9SKT3-F1-model_v4 Secretory carrier-associated membrane protein 1	0.143	166	133	21	176	105	270	4.515E+00	29
LOKIASV2_2336_ESMFold_hypothetical_protein	AF-P96585-F1-model_v4	LOKIASV2_2336_ESMFold_hypothetical_protein	AF-P96585-F1-model_v4 Uncharacterized membrane protein YdaK	0.121	154	111	23	176	1	127	7.676E+00	29
LOKIASV2_2336_ESMFold_hypothetical_protein	AF-A2YMP7-F1-model_v4	LOKIASV2_2336_ESMFold_hypothetical_protein	AF-A2YMP7-F1-model_v4 Putative secretory carrier-associated membrane protein 1	0.136	204	149	3	175	94	297	3.114E+00	29
LOKIASV2_2336_ESMFold_hypothetical_protein	AF-Q75IC7-F1-model_v4	LOKIASV2_2336_ESMFold_hypothetical_protein	AF-Q75IC7-F1-model_v4 Secretory carrier-associated membrane protein 4	0.152	169	131	21	175	136	304	3.463E+00	29
LOKIASV2_2336_ESMFold_hypothetical_protein	AF-P96665-F1-model_v4	LOKIASV2_2336_ESMFold_hypothetical_protein	AF-P96665-F1-model_v4 Uncharacterized membrane protein YdeH	0.158	155	116	1	155	1	139	5.887E+00	28
LOKIASV2_2336_ESMFold_hypothetical_protein	AF-P43008-F1-model_v4	LOKIASV2_2336_ESMFold_hypothetical_protein	AF-P43008-F1-model_v4 Biopolymer transport protein ExbB	0.121	176	128	1	176	1	147	7.676E+00	28
LOKIASV2_2336_ESMFold_hypothetical_protein	AF-E7EYQ9-F1-model_v4	LOKIASV2_2336_ESMFold_hypothetical_protein	AF-E7EYQ9-F1-model_v4 Transmembrane protein 216	0.157	134	110	26	159	29	159	7.676E+00	28
LOKIASV2_2336_ESMFold_hypothetical_protein	AF-Q55E69-F1-model_v4	LOKIASV2_2336_ESMFold_hypothetical_protein	AF-Q55E69-F1-model_v4 Protein SYS1 homolog	0.142	140	118	22	161	4	141	6.208E+00	28
LOKIASV2_2336_ESMFold_hypothetical_protein	AF-Q9SXA5-F1-model_v4	LOKIASV2_2336_ESMFold_hypothetical_protein	AF-Q9SXA5-F1-model_v4 Secretory carrier-associated membrane protein 5	0.135	169	133	21	175	114	282	4.515E+00	28
LOKIASV2_2336_ESMFold_hypothetical_protein	AF-A1A4P6-F1-model_v4	LOKIASV2_2336_ESMFold_hypothetical_protein	AF-A1A4P6-F1-model_v4 Transmembrane protein 80	0.181	124	93	29	152	26	139	8.536E+00	27
LOKIASV2_2336_ESMFold_hypothetical_protein	AF-P0AET6-F1-model_v4	LOKIASV2_2336_ESMFold_hypothetical_protein	AF-P0AET6-F1-model_v4 Protein HdeD	0.145	173	144	4	172	17	189	4.761E+00	27
LOKIASV2_2336_ESMFold_hypothetical_protein	AF-P0AET7-F1-model_v4	LOKIASV2_2336_ESMFold_hypothetical_protein	AF-P0AET7-F1-model_v4 Protein HdeD	0.151	178	144	2	172	12	189	5.887E+00	27
LOKIASV2_2336_ESMFold_hypothetical_protein	AF-Q96HE8-F1-model_v4	LOKIASV2_2336_ESMFold_hypothetical_protein	AF-Q96HE8-F1-model_v4 Transmembrane protein 80	0.118	138	111	26	163	89	215	8.536E+00	27
LOKIASV2_2336_ESMFold_hypothetical_protein	AF-Q2TA01-F1-model_v4	LOKIASV2_2336_ESMFold_hypothetical_protein	AF-Q2TA01-F1-model_v4 Transmembrane protein 216	0.141	146	112	26	171	10	140	9.491E+00	26
LOKIASV2_2336_ESMFold_hypothetical_protein	AF-P43454-F1-model_v4	LOKIASV2_2336_ESMFold_hypothetical_protein	AF-P43454-F1-model_v4 ATP synthase subunit a	0.130	218	123	33	174	19	236	5.021E+00	26
LOKIASV2_2336_ESMFold_hypothetical_protein	AF-Q0JAI9-F1-model_v4	LOKIASV2_2336_ESMFold_hypothetical_protein	AF-Q0JAI9-F1-model_v4 Secretory carrier-associated membrane protein 6	0.156	158	124	21	168	114	271	5.887E+00	26
LOKIASV2_2336_ESMFold_hypothetical_protein	AF-Q60EA5-F1-model_v4	LOKIASV2_2336_ESMFold_hypothetical_protein	AF-Q60EA5-F1-model_v4 Secretory carrier-associated membrane protein 3	0.156	169	130	21	175	105	273	5.887E+00	26
LOKIASV2_2336_ESMFold_hypothetical_protein	AF-Q8H5X5-F1-model_v4	LOKIASV2_2336_ESMFold_hypothetical_protein	AF-Q8H5X5-F1-model_v4 Secretory carrier-associated membrane protein 1	0.151	201	147	3	176	94	294	5.887E+00	26
LOKIASV2_2336_ESMFold_hypothetical_protein	AF-Q9R049-F1-model_v4	LOKIASV2_2336_ESMFold_hypothetical_protein	AF-Q9R049-F1-model_v4 E3 ubiquitin-protein ligase AMFR	0.106	184	141	11	169	95	278	8.095E+00	26
LOKIASV2_2336_ESMFold_hypothetical_protein	AF-Q8SVY9-F1-model_v4	LOKIASV2_2336_ESMFold_hypothetical_protein	AF-Q8SVY9-F1-model_v4 Uncharacterized protein ECU03_1610	0.046	173	129	5	177	31	166	9.001E+00	25
LOKIASV2_2336_ESMFold_hypothetical_protein	AF-P47987-F1-model_v4	LOKIASV2_2336_ESMFold_hypothetical_protein	AF-P47987-F1-model_v4 Plasmolipin	0.078	144	130	33	174	37	180	9.001E+00	25
LOKIASV2_2336_ESMFold_hypothetical_protein	AF-P0AET5-F1-model_v4	LOKIASV2_2336_ESMFold_hypothetical_protein	AF-P0AET5-F1-model_v4 Protein HdeD	0.155	173	142	4	172	17	189	6.547E+00	24
LOKIASV2_2336_ESMFold_hypothetical_protein	AF-Q8CGF5-F1-model_v4	LOKIASV2_2336_ESMFold_hypothetical_protein	AF-Q8CGF5-F1-model_v4 TLC domain-containing protein 4	0.130	106	90	72	176	159	264	9.491E+00	23
LOKIASV2_2336_ESMFold_hypothetical_protein	AF-Q9LR68-F1-model_v4	LOKIASV2_2336_ESMFold_hypothetical_protein	AF-Q9LR68-F1-model_v4 Secretory carrier-associated membrane protein 2	0.126	200	151	3	176	72	271	9.001E+00	23
LOKIASV2_2336_ESMFold_hypothetical_protein	AF-O31833-F1-model_v4	LOKIASV2_2336_ESMFold_hypothetical_protein	AF-O31833-F1-model_v4 Uncharacterized membrane protein YoaS	0.140	156	129	25	175	1	156	7.676E+00	22
LOKIASV2_2336_ESMFold_hypothetical_protein	AF-Q68EY2-F1-model_v4	LOKIASV2_2336_ESMFold_hypothetical_protein	AF-Q68EY2-F1-model_v4 Protein cornichon homolog 2	0.120	142	124	33	174	20	161	4.282E+00	21
LOKIASV2_2336_ESMFold_hypothetical_protein	AF-Q9M5P2-F1-model_v4	LOKIASV2_2336_ESMFold_hypothetical_protein	AF-Q9M5P2-F1-model_v4 Secretory carrier-associated membrane protein 3	0.148	201	147	3	176	77	277	9.491E+00	21
LOKIASV2_2336_ESMFold_hypothetical_protein	AF-Q9C5W7-F1-model_v4	LOKIASV2_2336_ESMFold_hypothetical_protein	AF-Q9C5W7-F1-model_v4 Tobamovirus multiplication protein 2A	0.125	186	130	11	159	4	189	7.280E+00	20
LOKIASV2_2336_ESMFold_hypothetical_protein	AF-Q8CII8-F1-model_v4	LOKIASV2_2336_ESMFold_hypothetical_protein	AF-Q8CII8-F1-model_v4 Nesprin-4	0.106	155	107	23	177	88	208	7.676E+00	20
LOKIASV2_2336_ESMFold_hypothetical_protein	AF-Q0VFK3-F1-model_v4	LOKIASV2_2336_ESMFold_hypothetical_protein	AF-Q0VFK3-F1-model_v4 Protein cornichon homolog 2	0.108	142	126	33	174	20	161	8.536E+00	18
