query	target	qheader	theader	fident	alnlen	mismatch	qstart	qend	tstart	tend	evalue	bits
LOKIASV2_1679_ESMFold_hypothetical_protein	AF-Q6FLB8-F1-model_v4	LOKIASV2_1679_ESMFold_hypothetical_protein	AF-Q6FLB8-F1-model_v4 Mediator of RNA polymerase II transcription subunit 4	0.137	252	187	1	218	13	264	1.255E+00	24
LOKIASV2_1679_ESMFold_hypothetical_protein	AF-O94414-F1-model_v4	LOKIASV2_1679_ESMFold_hypothetical_protein	AF-O94414-F1-model_v4 Endoplasmic reticulum junction formation protein lunapark	0.116	196	164	4	190	35	230	2.390E+00	24
LOKIASV2_1679_ESMFold_hypothetical_protein	AF-Q940A7-F1-model_v4	LOKIASV2_1679_ESMFold_hypothetical_protein	AF-Q940A7-F1-model_v4 Transcription initiation factor TFIID subunit 12b	0.106	113	97	71	180	555	667	2.549E+00	24
LOKIASV2_1679_ESMFold_hypothetical_protein	AF-Q9Y821-F1-model_v4	LOKIASV2_1679_ESMFold_hypothetical_protein	AF-Q9Y821-F1-model_v4 Mediator of RNA polymerase II transcription subunit 4	0.114	234	186	7	217	2	235	2.549E+00	23
LOKIASV2_1679_ESMFold_hypothetical_protein	AF-Q9ZM58-F1-model_v4	LOKIASV2_1679_ESMFold_hypothetical_protein	AF-Q9ZM58-F1-model_v4 Sec-independent protein translocase protein TatB	0.180	170	130	29	198	1	160	9.701E-01	22
LOKIASV2_1679_ESMFold_hypothetical_protein	AF-Q7T3I0-F1-model_v4	LOKIASV2_1679_ESMFold_hypothetical_protein	AF-Q7T3I0-F1-model_v4 Zinc finger C4H2 domain-containing protein	0.122	212	161	2	185	13	224	2.390E+00	22
LOKIASV2_1679_ESMFold_hypothetical_protein	AF-Q68FG0-F1-model_v4	LOKIASV2_1679_ESMFold_hypothetical_protein	AF-Q68FG0-F1-model_v4 Zinc finger C4H2 domain-containing protein	0.096	202	156	4	177	15	216	3.092E+00	22
LOKIASV2_1679_ESMFold_hypothetical_protein	AF-Q03615-F1-model_v4	LOKIASV2_1679_ESMFold_hypothetical_protein	AF-Q03615-F1-model_v4 Suppressor of activated egl-4 protein 2	0.096	173	149	16	188	4	169	4.267E+00	22
LOKIASV2_1679_ESMFold_hypothetical_protein	AF-O25700-F1-model_v4	LOKIASV2_1679_ESMFold_hypothetical_protein	AF-O25700-F1-model_v4 Sec-independent protein translocase protein TatB	0.175	175	130	29	203	1	159	1.523E+00	21
LOKIASV2_1679_ESMFold_hypothetical_protein	AF-Q9VTY4-F1-model_v4	LOKIASV2_1679_ESMFold_hypothetical_protein	AF-Q9VTY4-F1-model_v4 KxDL motif-containing protein CG10681	0.105	168	139	20	187	32	187	4.001E+00	21
LOKIASV2_1679_ESMFold_hypothetical_protein	AF-Q6CWA7-F1-model_v4	LOKIASV2_1679_ESMFold_hypothetical_protein	AF-Q6CWA7-F1-model_v4 Autophagy-related protein 23	0.126	151	122	39	189	270	410	5.521E+00	21
LOKIASV2_1679_ESMFold_hypothetical_protein	AF-B2C6R6-F1-model_v4	LOKIASV2_1679_ESMFold_hypothetical_protein	AF-B2C6R6-F1-model_v4 Transcription initiation factor TFIID subunit 12b	0.127	118	100	71	185	553	670	3.751E+00	21
LOKIASV2_1679_ESMFold_hypothetical_protein	AF-Q17WP6-F1-model_v4	LOKIASV2_1679_ESMFold_hypothetical_protein	AF-Q17WP6-F1-model_v4 Sec-independent protein translocase protein TatB	0.187	157	124	29	185	1	153	2.549E+00	20
LOKIASV2_1679_ESMFold_hypothetical_protein	AF-Q9NQZ6-F1-model_v4	LOKIASV2_1679_ESMFold_hypothetical_protein	AF-Q9NQZ6-F1-model_v4 Zinc finger C4H2 domain-containing protein	0.122	202	152	4	177	15	216	3.517E+00	20
LOKIASV2_1679_ESMFold_hypothetical_protein	AF-Q9XTA3-F1-model_v4	LOKIASV2_1679_ESMFold_hypothetical_protein	AF-Q9XTA3-F1-model_v4 Myocilin	0.128	178	148	5	182	65	235	7.618E+00	20
LOKIASV2_1679_ESMFold_hypothetical_protein	AF-Q9STF2-F1-model_v4	LOKIASV2_1679_ESMFold_hypothetical_protein	AF-Q9STF2-F1-model_v4 Protein PLASTID TRANSCRIPTIONALLY ACTIVE 16, chloroplastic	0.095	160	143	36	194	346	505	4.001E+00	20
LOKIASV2_1679_ESMFold_hypothetical_protein	AF-Q8XJ80-F1-model_v4	LOKIASV2_1679_ESMFold_hypothetical_protein	AF-Q8XJ80-F1-model_v4 Endonuclease MutS2	0.152	194	159	30	217	508	701	4.267E+00	20
LOKIASV2_1679_ESMFold_hypothetical_protein	AF-Q9U1M8-F1-model_v4	LOKIASV2_1679_ESMFold_hypothetical_protein	AF-Q9U1M8-F1-model_v4 Myosin-I heavy chain	0.127	180	141	2	163	733	912	3.751E+00	20
LOKIASV2_1679_ESMFold_hypothetical_protein	AF-O57595-F1-model_v4	LOKIASV2_1679_ESMFold_hypothetical_protein	AF-O57595-F1-model_v4 Mediator of RNA polymerase II transcription subunit 22	0.113	193	159	1	180	8	200	7.618E+00	19
LOKIASV2_1679_ESMFold_hypothetical_protein	AF-Q42376-F1-model_v4	LOKIASV2_1679_ESMFold_hypothetical_protein	AF-Q42376-F1-model_v4 Late embryogenesis abundant protein, group 3	0.096	193	163	5	185	28	220	5.177E+00	19
LOKIASV2_1679_ESMFold_hypothetical_protein	AF-Q922T2-F1-model_v4	LOKIASV2_1679_ESMFold_hypothetical_protein	AF-Q922T2-F1-model_v4 Microfibril-associated glycoprotein 3	0.076	144	128	34	177	144	282	4.551E+00	19
LOKIASV2_1679_ESMFold_hypothetical_protein	AF-Q19872-F1-model_v4	LOKIASV2_1679_ESMFold_hypothetical_protein	AF-Q19872-F1-model_v4 Uncharacterized protein	0.111	177	155	3	177	92	268	5.888E+00	18
LOKIASV2_1679_ESMFold_hypothetical_protein	AF-Q8CDW1-F1-model_v4	LOKIASV2_1679_ESMFold_hypothetical_protein	AF-Q8CDW1-F1-model_v4 Protein FAM228A	0.139	163	133	31	185	22	184	4.854E+00	18
LOKIASV2_1679_ESMFold_hypothetical_protein	AF-Q58D15-F1-model_v4	LOKIASV2_1679_ESMFold_hypothetical_protein	AF-Q58D15-F1-model_v4 Tripartite motif-containing protein 54	0.128	196	158	3	184	168	363	5.177E+00	18
LOKIASV2_1679_ESMFold_hypothetical_protein	AF-Q14258-F1-model_v4	LOKIASV2_1679_ESMFold_hypothetical_protein	AF-Q14258-F1-model_v4 E3 ubiquitin/ISG15 ligase TRIM25	0.144	203	155	3	184	196	398	6.280E+00	18
LOKIASV2_1679_ESMFold_hypothetical_protein	AF-Q969Q1-F1-model_v4	LOKIASV2_1679_ESMFold_hypothetical_protein	AF-Q969Q1-F1-model_v4 E3 ubiquitin-protein ligase TRIM63	0.142	190	149	3	177	164	353	7.143E+00	17
LOKIASV2_1679_ESMFold_hypothetical_protein	AF-Q9BYV2-F1-model_v4	LOKIASV2_1679_ESMFold_hypothetical_protein	AF-Q9BYV2-F1-model_v4 Tripartite motif-containing protein 54	0.102	189	156	3	177	168	356	7.143E+00	17
LOKIASV2_1679_ESMFold_hypothetical_protein	AF-Q6DF48-F1-model_v4	LOKIASV2_1679_ESMFold_hypothetical_protein	AF-Q6DF48-F1-model_v4 Calcium-binding and coiled-coil domain-containing protein 2	0.129	189	159	2	190	267	450	6.280E+00	17
LOKIASV2_1679_ESMFold_hypothetical_protein	AF-Q0SRU6-F1-model_v4	LOKIASV2_1679_ESMFold_hypothetical_protein	AF-Q0SRU6-F1-model_v4 Endonuclease MutS2	0.134	152	113	54	205	560	690	4.551E+00	17
LOKIASV2_1679_ESMFold_hypothetical_protein	AF-Q9VLD6-F1-model_v4	LOKIASV2_1679_ESMFold_hypothetical_protein	AF-Q9VLD6-F1-model_v4 Borealin	0.109	128	108	50	177	9	130	9.242E+00	16
LOKIASV2_1679_ESMFold_hypothetical_protein	AF-Q5REJ9-F1-model_v4	LOKIASV2_1679_ESMFold_hypothetical_protein	AF-Q5REJ9-F1-model_v4 Tripartite motif-containing protein 54	0.102	189	156	3	177	168	356	8.666E+00	16
LOKIASV2_1679_ESMFold_hypothetical_protein	AF-Q9ERP3-F1-model_v4	LOKIASV2_1679_ESMFold_hypothetical_protein	AF-Q9ERP3-F1-model_v4 Tripartite motif-containing protein 54	0.111	191	155	3	177	168	358	8.125E+00	16
LOKIASV2_1679_ESMFold_hypothetical_protein	AF-Q6DJK9-F1-model_v4	LOKIASV2_1679_ESMFold_hypothetical_protein	AF-Q6DJK9-F1-model_v4 Coiled-coil domain-containing protein 130	0.116	140	120	38	177	146	282	9.242E+00	16
LOKIASV2_1679_ESMFold_hypothetical_protein	AF-Q9ZQ34-F1-model_v4	LOKIASV2_1679_ESMFold_hypothetical_protein	AF-Q9ZQ34-F1-model_v4 Uncharacterized protein At2g24330	0.110	183	148	3	185	80	246	9.857E+00	16
LOKIASV2_1679_ESMFold_hypothetical_protein	AF-B9EKE5-F1-model_v4	LOKIASV2_1679_ESMFold_hypothetical_protein	AF-B9EKE5-F1-model_v4 Ciliogenesis-associated TTC17-interacting protein	0.130	163	130	54	203	289	451	5.888E+00	16
LOKIASV2_1679_ESMFold_hypothetical_protein	AF-O13734-F1-model_v4	LOKIASV2_1679_ESMFold_hypothetical_protein	AF-O13734-F1-model_v4 Shugoshin-2	0.139	178	152	1	177	6	183	7.143E+00	16
LOKIASV2_1679_ESMFold_hypothetical_protein	AF-Q0TP77-F1-model_v4	LOKIASV2_1679_ESMFold_hypothetical_protein	AF-Q0TP77-F1-model_v4 Endonuclease MutS2	0.137	183	151	30	205	508	690	7.618E+00	16
LOKIASV2_1679_ESMFold_hypothetical_protein	AF-Q651J5-F1-model_v4	LOKIASV2_1679_ESMFold_hypothetical_protein	AF-Q651J5-F1-model_v4 Phosphate transporter PHO1-3	0.119	145	117	60	193	138	282	2.719E+00	16
LOKIASV2_1679_ESMFold_hypothetical_protein	AF-A6NNT2-F1-model_v4	LOKIASV2_1679_ESMFold_hypothetical_protein	AF-A6NNT2-F1-model_v4 Uncharacterized protein C16orf96	0.127	184	144	4	187	770	935	5.521E+00	16
LOKIASV2_1679_ESMFold_hypothetical_protein	AF-Q8FQD9-F1-model_v4	LOKIASV2_1679_ESMFold_hypothetical_protein	AF-Q8FQD9-F1-model_v4 Sec-independent protein translocase protein TatB	0.131	155	128	30	177	3	157	6.698E+00	15
LOKIASV2_1679_ESMFold_hypothetical_protein	AF-Q08465-F1-model_v4	LOKIASV2_1679_ESMFold_hypothetical_protein	AF-Q08465-F1-model_v4 Protein YNG1	0.154	202	132	1	202	11	167	6.698E+00	15
LOKIASV2_1679_ESMFold_hypothetical_protein	AF-Q8DH10-F1-model_v4	LOKIASV2_1679_ESMFold_hypothetical_protein	AF-Q8DH10-F1-model_v4 Chaperone protein dnaK3	0.124	158	136	30	185	508	665	9.857E+00	15
LOKIASV2_1679_ESMFold_hypothetical_protein	AF-Q61LN7-F1-model_v4	LOKIASV2_1679_ESMFold_hypothetical_protein	AF-Q61LN7-F1-model_v4 Nucleolar complex protein 3 homolog	0.145	168	136	52	211	6	173	3.298E+00	15
LOKIASV2_1679_ESMFold_hypothetical_protein	AF-Q6C7X8-F1-model_v4	LOKIASV2_1679_ESMFold_hypothetical_protein	AF-Q6C7X8-F1-model_v4 ATP-dependent RNA helicase DBP10	0.090	152	126	54	192	649	800	4.854E+00	15
LOKIASV2_1679_ESMFold_hypothetical_protein	AF-O94704-F1-model_v4	LOKIASV2_1679_ESMFold_hypothetical_protein	AF-O94704-F1-model_v4 INO80 complex subunit 3	0.109	143	112	59	185	6	148	5.521E+00	14
LOKIASV2_1679_ESMFold_hypothetical_protein	AF-Q5XLR4-F1-model_v4	LOKIASV2_1679_ESMFold_hypothetical_protein	AF-Q5XLR4-F1-model_v4 Borealin	0.147	141	113	52	185	15	155	5.521E+00	14
LOKIASV2_1679_ESMFold_hypothetical_protein	AF-Q5RBS5-F1-model_v4	LOKIASV2_1679_ESMFold_hypothetical_protein	AF-Q5RBS5-F1-model_v4 Borealin	0.118	157	120	49	185	10	166	9.242E+00	14
LOKIASV2_1679_ESMFold_hypothetical_protein	AF-Q96T51-F1-model_v4	LOKIASV2_1679_ESMFold_hypothetical_protein	AF-Q96T51-F1-model_v4 RUN and FYVE domain-containing protein 1	0.160	190	132	3	192	515	672	9.857E+00	14
LOKIASV2_1679_ESMFold_hypothetical_protein	AF-Q9SMX5-F1-model_v4	LOKIASV2_1679_ESMFold_hypothetical_protein	AF-Q9SMX5-F1-model_v4 ADP-ribosylation factor GTPase-activating protein AGD4	0.137	217	184	5	218	120	336	9.857E+00	14
LOKIASV2_1679_ESMFold_hypothetical_protein	AF-Q1MTN3-F1-model_v4	LOKIASV2_1679_ESMFold_hypothetical_protein	AF-Q1MTN3-F1-model_v4 Inner centromere protein-related protein pic1	0.180	167	135	51	216	7	173	4.001E+00	14
LOKIASV2_1679_ESMFold_hypothetical_protein	AF-E9QMW4-F1-model_v4	LOKIASV2_1679_ESMFold_hypothetical_protein	AF-E9QMW4-F1-model_v4 Uncharacterized protein C16orf96 homolog	0.105	182	146	4	185	785	948	9.857E+00	14
LOKIASV2_1679_ESMFold_hypothetical_protein	AF-Q17QH7-F1-model_v4	LOKIASV2_1679_ESMFold_hypothetical_protein	AF-Q17QH7-F1-model_v4 TCF3 fusion partner homolog	0.111	165	146	54	218	75	239	7.143E+00	13
LOKIASV2_1679_ESMFold_hypothetical_protein	AF-Q6UE05-F1-model_v4	LOKIASV2_1679_ESMFold_hypothetical_protein	AF-Q6UE05-F1-model_v4 Transmembrane protein 270	0.125	171	122	7	177	125	264	9.857E+00	13
LOKIASV2_1679_ESMFold_hypothetical_protein	AF-Q9UTE6-F1-model_v4	LOKIASV2_1679_ESMFold_hypothetical_protein	AF-Q9UTE6-F1-model_v4 Protein mak16	0.127	153	120	68	205	139	291	3.092E+00	13
LOKIASV2_1679_ESMFold_hypothetical_protein	AF-O84008-F1-model_v4	LOKIASV2_1679_ESMFold_hypothetical_protein	AF-O84008-F1-model_v4 Uncharacterized protein CT_005	0.134	185	151	1	185	85	259	8.666E+00	13
LOKIASV2_1679_ESMFold_hypothetical_protein	AF-Q9PL35-F1-model_v4	LOKIASV2_1679_ESMFold_hypothetical_protein	AF-Q9PL35-F1-model_v4 Uncharacterized protein TC_0273	0.105	216	191	3	218	56	269	7.618E+00	13
LOKIASV2_1679_ESMFold_hypothetical_protein	AF-P22121-F1-model_v4	LOKIASV2_1679_ESMFold_hypothetical_protein	AF-P22121-F1-model_v4 Heat shock transcription factor	0.100	161	125	29	189	309	448	5.177E+00	13
LOKIASV2_1679_ESMFold_hypothetical_protein	AF-Q3ZBA3-F1-model_v4	LOKIASV2_1679_ESMFold_hypothetical_protein	AF-Q3ZBA3-F1-model_v4 Pleckstrin homology domain-containing family A member 2	0.142	91	76	130	218	95	185	6.280E+00	11
