query	target	qheader	theader	fident	alnlen	mismatch	qstart	qend	tstart	tend	evalue	bits
LOKIASV2_3395_ESMFold_hypothetical_protein	AF-Q6FNU6-F1-model_v4	LOKIASV2_3395_ESMFold_hypothetical_protein	AF-Q6FNU6-F1-model_v4 Peptidyl-prolyl cis-trans isomerase D	0.090	160	141	233	388	210	369	2.672E+00	57
LOKIASV2_3395_ESMFold_hypothetical_protein	AF-Q54DA8-F1-model_v4	LOKIASV2_3395_ESMFold_hypothetical_protein	AF-Q54DA8-F1-model_v4 Protein STIP1 homolog	0.095	368	202	158	381	2	369	6.040E-01	57
LOKIASV2_3395_ESMFold_hypothetical_protein	AF-P37650-F1-model_v4	LOKIASV2_3395_ESMFold_hypothetical_protein	AF-P37650-F1-model_v4 Cellulose synthase operon protein C	0.115	241	189	175	389	280	520	2.871E-01	57
LOKIASV2_3395_ESMFold_hypothetical_protein	AF-Q6F6B3-F1-model_v4	LOKIASV2_3395_ESMFold_hypothetical_protein	AF-Q6F6B3-F1-model_v4 Protein TANC1	0.105	166	139	229	394	1267	1422	3.474E+00	57
LOKIASV2_3395_ESMFold_hypothetical_protein	AF-Q5B4E7-F1-model_v4	LOKIASV2_3395_ESMFold_hypothetical_protein	AF-Q5B4E7-F1-model_v4 Peptidyl-prolyl cis-trans isomerase D	0.087	161	138	238	389	208	368	4.138E+00	56
LOKIASV2_3395_ESMFold_hypothetical_protein	AF-B7ZWR6-F1-model_v4	LOKIASV2_3395_ESMFold_hypothetical_protein	AF-B7ZWR6-F1-model_v4 Outer envelope protein 61	0.150	217	177	170	378	9	225	8.570E-01	56
LOKIASV2_3395_ESMFold_hypothetical_protein	AF-A8MYJ7-F1-model_v4	LOKIASV2_3395_ESMFold_hypothetical_protein	AF-A8MYJ7-F1-model_v4 Tetratricopeptide repeat protein 34	0.147	291	207	150	393	243	533	6.040E-01	56
LOKIASV2_3395_ESMFold_hypothetical_protein	AF-Q17QZ7-F1-model_v4	LOKIASV2_3395_ESMFold_hypothetical_protein	AF-Q17QZ7-F1-model_v4 Tetratricopeptide repeat protein 27	0.116	264	180	182	386	583	846	3.420E-01	56
LOKIASV2_3395_ESMFold_hypothetical_protein	AF-Q6BQ23-F1-model_v4	LOKIASV2_3395_ESMFold_hypothetical_protein	AF-Q6BQ23-F1-model_v4 Pre-mRNA-splicing factor SYF1	0.129	251	192	152	373	223	473	2.307E-01	56
LOKIASV2_3395_ESMFold_hypothetical_protein	AF-Q8IYF3-F1-model_v4	LOKIASV2_3395_ESMFold_hypothetical_protein	AF-Q8IYF3-F1-model_v4 Testis-expressed protein 11	0.129	217	172	171	369	280	496	6.310E-01	56
LOKIASV2_3395_ESMFold_hypothetical_protein	AF-A2A690-F1-model_v4	LOKIASV2_3395_ESMFold_hypothetical_protein	AF-A2A690-F1-model_v4 Protein TANC2	0.107	179	136	203	381	1228	1380	1.513E+00	56
LOKIASV2_3395_ESMFold_hypothetical_protein	AF-A6NLP5-F1-model_v4	LOKIASV2_3395_ESMFold_hypothetical_protein	AF-A6NLP5-F1-model_v4 Tetratricopeptide repeat protein 36	0.107	193	159	197	389	3	181	2.792E+00	55
LOKIASV2_3395_ESMFold_hypothetical_protein	AF-Q8AVU9-F1-model_v4	LOKIASV2_3395_ESMFold_hypothetical_protein	AF-Q8AVU9-F1-model_v4 ER membrane protein complex subunit 2-B	0.104	264	210	112	375	57	291	6.592E-01	55
LOKIASV2_3395_ESMFold_hypothetical_protein	AF-Q95MN9-F1-model_v4	LOKIASV2_3395_ESMFold_hypothetical_protein	AF-Q95MN9-F1-model_v4 Aryl-hydrocarbon-interacting protein-like 1	0.097	155	138	235	389	171	324	2.792E+00	55
LOKIASV2_3395_ESMFold_hypothetical_protein	AF-P76639-F1-model_v4	LOKIASV2_3395_ESMFold_hypothetical_protein	AF-P76639-F1-model_v4 Uncharacterized protein YgeH	0.109	223	167	151	373	228	415	8.570E-01	55
LOKIASV2_3395_ESMFold_hypothetical_protein	AF-Q8ZCC3-F1-model_v4	LOKIASV2_3395_ESMFold_hypothetical_protein	AF-Q8ZCC3-F1-model_v4 Beta-barrel assembly-enhancing protease	0.115	242	170	149	390	291	483	2.411E-01	55
LOKIASV2_3395_ESMFold_hypothetical_protein	AF-Q9CKU1-F1-model_v4	LOKIASV2_3395_ESMFold_hypothetical_protein	AF-Q9CKU1-F1-model_v4 Surface lipoprotein assembly modifier	0.091	127	105	249	375	86	202	5.150E+00	55
LOKIASV2_3395_ESMFold_hypothetical_protein	AF-Q32NU8-F1-model_v4	LOKIASV2_3395_ESMFold_hypothetical_protein	AF-Q32NU8-F1-model_v4 Outer dynein arm-docking complex subunit 4	0.113	387	304	3	389	166	509	3.733E-01	55
LOKIASV2_3395_ESMFold_hypothetical_protein	AF-B4NKT1-F1-model_v4	LOKIASV2_3395_ESMFold_hypothetical_protein	AF-B4NKT1-F1-model_v4 MAU2 chromatid cohesion factor homolog	0.108	250	182	154	358	64	313	8.570E-01	55
LOKIASV2_3395_ESMFold_hypothetical_protein	AF-P33731-F1-model_v4	LOKIASV2_3395_ESMFold_hypothetical_protein	AF-P33731-F1-model_v4 Signal recognition particle subunit SRP72	0.070	251	184	158	356	2	252	4.074E-01	55
LOKIASV2_3395_ESMFold_hypothetical_protein	AF-O76094-F1-model_v4	LOKIASV2_3395_ESMFold_hypothetical_protein	AF-O76094-F1-model_v4 Signal recognition particle subunit SRP72	0.067	249	185	158	356	4	252	4.646E-01	55
LOKIASV2_3395_ESMFold_hypothetical_protein	AF-Q9SUD8-F1-model_v4	LOKIASV2_3395_ESMFold_hypothetical_protein	AF-Q9SUD8-F1-model_v4 Pentatricopeptide repeat-containing protein At4g28010	0.099	224	183	167	390	355	558	1.513E+00	55
LOKIASV2_3395_ESMFold_hypothetical_protein	AF-O48802-F1-model_v4	LOKIASV2_3395_ESMFold_hypothetical_protein	AF-O48802-F1-model_v4 Protein CLMP1	0.078	146	121	231	376	40	171	6.695E+00	55
LOKIASV2_3395_ESMFold_hypothetical_protein	AF-Q8IUR5-F1-model_v4	LOKIASV2_3395_ESMFold_hypothetical_protein	AF-Q8IUR5-F1-model_v4 Protein O-mannosyl-transferase TMTC1	0.125	275	218	129	378	491	765	2.749E-01	55
LOKIASV2_3395_ESMFold_hypothetical_protein	AF-Q8RVB2-F1-model_v4	LOKIASV2_3395_ESMFold_hypothetical_protein	AF-Q8RVB2-F1-model_v4 Probable UDP-N-acetylglucosamine--peptide N-acetylglucosaminyltransferase SPINDLY	0.113	285	208	148	383	34	318	2.411E-01	55
LOKIASV2_3395_ESMFold_hypothetical_protein	AF-Q17DK2-F1-model_v4	LOKIASV2_3395_ESMFold_hypothetical_protein	AF-Q17DK2-F1-model_v4 Phagocyte signaling-impaired protein	0.080	220	187	164	383	9	212	1.114E+00	55
LOKIASV2_3395_ESMFold_hypothetical_protein	AF-Q99KD5-F1-model_v4	LOKIASV2_3395_ESMFold_hypothetical_protein	AF-Q99KD5-F1-model_v4 Protein unc-45 homolog A	0.094	132	110	249	380	21	142	9.500E+00	55
LOKIASV2_3395_ESMFold_hypothetical_protein	AF-O14607-F1-model_v4	LOKIASV2_3395_ESMFold_hypothetical_protein	AF-O14607-F1-model_v4 Histone demethylase UTY	0.102	298	242	120	390	10	307	6.592E-01	55
LOKIASV2_3395_ESMFold_hypothetical_protein	AF-O60110-F1-model_v4	LOKIASV2_3395_ESMFold_hypothetical_protein	AF-O60110-F1-model_v4 TPR repeat protein oca3	0.129	278	233	111	388	13	281	5.781E-01	54
LOKIASV2_3395_ESMFold_hypothetical_protein	AF-Q75D68-F1-model_v4	LOKIASV2_3395_ESMFold_hypothetical_protein	AF-Q75D68-F1-model_v4 Vesicular-fusion protein SEC17	0.091	207	169	182	388	78	264	7.852E-01	54
LOKIASV2_3395_ESMFold_hypothetical_protein	AF-Q9P6A5-F1-model_v4	LOKIASV2_3395_ESMFold_hypothetical_protein	AF-Q9P6A5-F1-model_v4 Probable vesicular-fusion protein sec17 homolog	0.104	257	219	129	385	6	250	3.420E-01	54
LOKIASV2_3395_ESMFold_hypothetical_protein	AF-Q5ACI8-F1-model_v4	LOKIASV2_3395_ESMFold_hypothetical_protein	AF-Q5ACI8-F1-model_v4 Peptidyl-prolyl cis-trans isomerase D	0.112	173	140	214	386	210	368	8.953E-01	54
LOKIASV2_3395_ESMFold_hypothetical_protein	AF-A0A0P0VG31-F1-model_v4	LOKIASV2_3395_ESMFold_hypothetical_protein	AF-A0A0P0VG31-F1-model_v4 DnaJ protein P58IPK homolog A	0.116	314	211	146	385	18	331	3.134E-01	54
LOKIASV2_3395_ESMFold_hypothetical_protein	AF-P44087-F1-model_v4	LOKIASV2_3395_ESMFold_hypothetical_protein	AF-P44087-F1-model_v4 Surface lipoprotein assembly modifier 1	0.153	143	101	233	375	71	190	3.047E+00	54
LOKIASV2_3395_ESMFold_hypothetical_protein	AF-Q8C0Q3-F1-model_v4	LOKIASV2_3395_ESMFold_hypothetical_protein	AF-Q8C0Q3-F1-model_v4 Tetratricopeptide repeat protein 34	0.140	207	175	183	386	185	391	2.055E+00	54
LOKIASV2_3395_ESMFold_hypothetical_protein	AF-F8RP11-F1-model_v4	LOKIASV2_3395_ESMFold_hypothetical_protein	AF-F8RP11-F1-model_v4 Hsp70-Hsp90 organizing protein	0.067	253	197	164	375	253	505	1.967E+00	54
LOKIASV2_3395_ESMFold_hypothetical_protein	AF-D3YY23-F1-model_v4	LOKIASV2_3395_ESMFold_hypothetical_protein	AF-D3YY23-F1-model_v4 LON peptidase N-terminal domain and RING finger protein 1	0.112	283	202	145	373	29	311	8.570E-01	54
LOKIASV2_3395_ESMFold_hypothetical_protein	AF-Q9LS88-F1-model_v4	LOKIASV2_3395_ESMFold_hypothetical_protein	AF-Q9LS88-F1-model_v4 Pentatricopeptide repeat-containing protein At3g23020	0.094	283	223	107	389	570	816	6.887E-01	54
LOKIASV2_3395_ESMFold_hypothetical_protein	AF-Q5U2X2-F1-model_v4	LOKIASV2_3395_ESMFold_hypothetical_protein	AF-Q5U2X2-F1-model_v4 Sperm-associated antigen 1	0.105	268	200	158	381	423	690	4.257E-01	54
LOKIASV2_3395_ESMFold_hypothetical_protein	AF-Q0VGY8-F1-model_v4	LOKIASV2_3395_ESMFold_hypothetical_protein	AF-Q0VGY8-F1-model_v4 Protein TANC1	0.100	163	140	227	389	1268	1424	4.516E+00	54
LOKIASV2_3395_ESMFold_hypothetical_protein	AF-O66927-F1-model_v4	LOKIASV2_3395_ESMFold_hypothetical_protein	AF-O66927-F1-model_v4 Uncharacterized protein aq_711	0.097	171	142	207	377	13	170	1.883E+00	53
LOKIASV2_3395_ESMFold_hypothetical_protein	AF-O00170-F1-model_v4	LOKIASV2_3395_ESMFold_hypothetical_protein	AF-O00170-F1-model_v4 AH receptor-interacting protein	0.087	161	143	229	389	168	325	2.448E+00	53
LOKIASV2_3395_ESMFold_hypothetical_protein	AF-Q95MN8-F1-model_v4	LOKIASV2_3395_ESMFold_hypothetical_protein	AF-Q95MN8-F1-model_v4 Aryl-hydrocarbon-interacting protein-like 1	0.097	155	138	235	389	171	324	3.325E+00	53
LOKIASV2_3395_ESMFold_hypothetical_protein	AF-Q9VL78-F1-model_v4	LOKIASV2_3395_ESMFold_hypothetical_protein	AF-Q9VL78-F1-model_v4 FK506-binding protein 59	0.139	159	127	231	389	244	391	4.138E+00	53
LOKIASV2_3395_ESMFold_hypothetical_protein	AF-A8JA42-F1-model_v4	LOKIASV2_3395_ESMFold_hypothetical_protein	AF-A8JA42-F1-model_v4 Intraflagellar transport protein 56	0.122	273	215	107	379	232	477	1.021E+00	53
LOKIASV2_3395_ESMFold_hypothetical_protein	AF-A1A4R8-F1-model_v4	LOKIASV2_3395_ESMFold_hypothetical_protein	AF-A1A4R8-F1-model_v4 Cell division cycle protein 23 homolog	0.099	245	192	165	378	314	558	6.310E-01	53
LOKIASV2_3395_ESMFold_hypothetical_protein	AF-Q8BW49-F1-model_v4	LOKIASV2_3395_ESMFold_hypothetical_protein	AF-Q8BW49-F1-model_v4 Tetratricopeptide repeat protein 12	0.095	227	204	164	389	2	228	1.725E+00	53
LOKIASV2_3395_ESMFold_hypothetical_protein	AF-P19450-F1-model_v4	LOKIASV2_3395_ESMFold_hypothetical_protein	AF-P19450-F1-model_v4 Cellulose synthase operon protein C	0.100	240	212	154	390	31	270	1.066E+00	53
LOKIASV2_3395_ESMFold_hypothetical_protein	AF-Q89AS9-F1-model_v4	LOKIASV2_3395_ESMFold_hypothetical_protein	AF-Q89AS9-F1-model_v4 UPF0162 protein bbp_163	0.159	91	67	285	375	183	263	7.307E+00	52
LOKIASV2_3395_ESMFold_hypothetical_protein	AF-Q9SRS9-F1-model_v4	LOKIASV2_3395_ESMFold_hypothetical_protein	AF-Q9SRS9-F1-model_v4 E3 ubiquitin-protein ligase CHIP	0.108	232	169	163	394	9	199	4.074E-01	52
LOKIASV2_3395_ESMFold_hypothetical_protein	AF-O97628-F1-model_v4	LOKIASV2_3395_ESMFold_hypothetical_protein	AF-O97628-F1-model_v4 AH receptor-interacting protein	0.087	161	143	229	389	168	325	2.792E+00	52
LOKIASV2_3395_ESMFold_hypothetical_protein	AF-P42828-F1-model_v4	LOKIASV2_3395_ESMFold_hypothetical_protein	AF-P42828-F1-model_v4 Modification methylase CeqI	0.085	222	199	162	383	162	380	1.883E+00	52
LOKIASV2_3395_ESMFold_hypothetical_protein	AF-O49287-F1-model_v4	LOKIASV2_3395_ESMFold_hypothetical_protein	AF-O49287-F1-model_v4 Putative pentatricopeptide repeat-containing protein At1g77010, mitochondrial	0.093	274	210	158	390	409	682	6.040E-01	52
LOKIASV2_3395_ESMFold_hypothetical_protein	AF-Q8CD92-F1-model_v4	LOKIASV2_3395_ESMFold_hypothetical_protein	AF-Q8CD92-F1-model_v4 Tetratricopeptide repeat protein 27	0.112	263	180	182	385	583	845	4.853E-01	52
LOKIASV2_3395_ESMFold_hypothetical_protein	AF-Q924K1-F1-model_v4	LOKIASV2_3395_ESMFold_hypothetical_protein	AF-Q924K1-F1-model_v4 Aryl-hydrocarbon-interacting protein-like 1	0.097	155	138	235	389	171	324	2.243E+00	51
LOKIASV2_3395_ESMFold_hypothetical_protein	AF-Q5FWY5-F1-model_v4	LOKIASV2_3395_ESMFold_hypothetical_protein	AF-Q5FWY5-F1-model_v4 AH receptor-interacting protein	0.076	161	145	229	389	168	325	4.323E+00	51
LOKIASV2_3395_ESMFold_hypothetical_protein	AF-P40990-F1-model_v4	LOKIASV2_3395_ESMFold_hypothetical_protein	AF-P40990-F1-model_v4 Protein MSS2, mitochondrial	0.103	281	235	107	387	88	350	7.516E-01	51
LOKIASV2_3395_ESMFold_hypothetical_protein	AF-Q2U0E0-F1-model_v4	LOKIASV2_3395_ESMFold_hypothetical_protein	AF-Q2U0E0-F1-model_v4 Peptidyl-prolyl cis-trans isomerase D	0.073	161	143	235	389	207	367	7.634E+00	51
LOKIASV2_3395_ESMFold_hypothetical_protein	AF-O31986-F1-model_v4	LOKIASV2_3395_ESMFold_hypothetical_protein	AF-O31986-F1-model_v4 SPbeta prophage-derived glycosyltransferase SunS	0.142	241	170	145	385	221	419	3.420E-01	51
LOKIASV2_3395_ESMFold_hypothetical_protein	AF-Q10576-F1-model_v4	LOKIASV2_3395_ESMFold_hypothetical_protein	AF-Q10576-F1-model_v4 Prolyl 4-hydroxylase subunit alpha-1	0.128	253	214	141	393	23	268	8.203E-01	51
LOKIASV2_3395_ESMFold_hypothetical_protein	AF-Q9CZW5-F1-model_v4	LOKIASV2_3395_ESMFold_hypothetical_protein	AF-Q9CZW5-F1-model_v4 Mitochondrial import receptor subunit TOM70	0.132	339	266	84	390	266	604	5.070E-01	51
LOKIASV2_3395_ESMFold_hypothetical_protein	AF-O74985-F1-model_v4	LOKIASV2_3395_ESMFold_hypothetical_protein	AF-O74985-F1-model_v4 N-terminal acetyltransferase A complex subunit nat1	0.148	244	201	149	385	7	250	1.114E+00	51
LOKIASV2_3395_ESMFold_hypothetical_protein	AF-Q9BZJ0-F1-model_v4	LOKIASV2_3395_ESMFold_hypothetical_protein	AF-Q9BZJ0-F1-model_v4 Crooked neck-like protein 1	0.104	333	291	60	385	138	470	2.749E-01	51
LOKIASV2_3395_ESMFold_hypothetical_protein	AF-Q8LP10-F1-model_v4	LOKIASV2_3395_ESMFold_hypothetical_protein	AF-Q8LP10-F1-model_v4 Probable UDP-N-acetylglucosamine--peptide N-acetylglucosaminyltransferase SPINDLY	0.121	245	185	163	373	139	383	4.646E-01	51
LOKIASV2_3395_ESMFold_hypothetical_protein	AF-P0DJD0-F1-model_v4	LOKIASV2_3395_ESMFold_hypothetical_protein	AF-P0DJD0-F1-model_v4 RANBP2-like and GRIP domain-containing protein 1	0.111	248	196	136	357	7	254	1.626E-01	51
LOKIASV2_3395_ESMFold_hypothetical_protein	AF-O83463-F1-model_v4	LOKIASV2_3395_ESMFold_hypothetical_protein	AF-O83463-F1-model_v4 Uncharacterized lipoprotein TP_0449	0.100	188	143	198	385	30	189	3.325E+00	50
LOKIASV2_3395_ESMFold_hypothetical_protein	AF-P96649-F1-model_v4	LOKIASV2_3395_ESMFold_hypothetical_protein	AF-P96649-F1-model_v4 Response regulator aspartate phosphatase I	0.112	209	184	183	390	81	289	3.474E+00	50
LOKIASV2_3395_ESMFold_hypothetical_protein	AF-Q5JNB5-F1-model_v4	LOKIASV2_3395_ESMFold_hypothetical_protein	AF-Q5JNB5-F1-model_v4 DnaJ protein P58IPK homolog B	0.121	309	208	148	385	19	327	3.733E-01	50
LOKIASV2_3395_ESMFold_hypothetical_protein	AF-P66949-F1-model_v4	LOKIASV2_3395_ESMFold_hypothetical_protein	AF-P66949-F1-model_v4 Beta-barrel assembly-enhancing protease	0.121	239	177	140	378	278	479	6.887E-01	50
LOKIASV2_3395_ESMFold_hypothetical_protein	AF-Q5ZMQ9-F1-model_v4	LOKIASV2_3395_ESMFold_hypothetical_protein	AF-Q5ZMQ9-F1-model_v4 Peroxisomal targeting signal 1 receptor	0.073	484	337	26	390	158	641	5.297E-01	50
LOKIASV2_3395_ESMFold_hypothetical_protein	AF-Q8RWG2-F1-model_v4	LOKIASV2_3395_ESMFold_hypothetical_protein	AF-Q8RWG2-F1-model_v4 Protein high chlorophyll fluorescent 107	0.080	242	198	145	386	146	361	2.558E+00	50
LOKIASV2_3395_ESMFold_hypothetical_protein	AF-Q7PRA4-F1-model_v4	LOKIASV2_3395_ESMFold_hypothetical_protein	AF-Q7PRA4-F1-model_v4 Tetratricopeptide repeat protein 30 homolog	0.119	211	175	145	355	5	204	1.021E+00	50
LOKIASV2_3395_ESMFold_hypothetical_protein	AF-Q9Y7X2-F1-model_v4	LOKIASV2_3395_ESMFold_hypothetical_protein	AF-Q9Y7X2-F1-model_v4 N-terminal acetyltransferase A complex subunit-like protein C418.02	0.089	235	193	158	392	2	214	1.581E+00	50
LOKIASV2_3395_ESMFold_hypothetical_protein	AF-Q9SVH3-F1-model_v4	LOKIASV2_3395_ESMFold_hypothetical_protein	AF-Q9SVH3-F1-model_v4 Pentatricopeptide repeat-containing protein At4g20740	0.128	211	176	153	355	357	567	1.581E+00	50
LOKIASV2_3395_ESMFold_hypothetical_protein	AF-Q54KW6-F1-model_v4	LOKIASV2_3395_ESMFold_hypothetical_protein	AF-Q54KW6-F1-model_v4 Putative uncharacterized protein DDB_G0287113	0.107	271	219	116	386	104	349	1.216E+00	50
LOKIASV2_3395_ESMFold_hypothetical_protein	AF-A0JMU5-F1-model_v4	LOKIASV2_3395_ESMFold_hypothetical_protein	AF-A0JMU5-F1-model_v4 Protein arginine N-methyltransferase 9	0.149	141	106	233	373	6	131	2.558E+00	50
LOKIASV2_3395_ESMFold_hypothetical_protein	AF-Q9BXJ9-F1-model_v4	LOKIASV2_3395_ESMFold_hypothetical_protein	AF-Q9BXJ9-F1-model_v4 N-alpha-acetyltransferase 15, NatA auxiliary subunit	0.125	245	211	148	389	5	249	2.055E+00	50
LOKIASV2_3395_ESMFold_hypothetical_protein	AF-Q14AT2-F1-model_v4	LOKIASV2_3395_ESMFold_hypothetical_protein	AF-Q14AT2-F1-model_v4 Testis-expressed protein 11	0.123	261	192	147	366	300	560	1.327E+00	50
LOKIASV2_3395_ESMFold_hypothetical_protein	AF-P51191-F1-model_v4	LOKIASV2_3395_ESMFold_hypothetical_protein	AF-P51191-F1-model_v4 Uncharacterized protein ycf37	0.103	218	144	152	369	11	172	2.055E+00	49
LOKIASV2_3395_ESMFold_hypothetical_protein	AF-O08915-F1-model_v4	LOKIASV2_3395_ESMFold_hypothetical_protein	AF-O08915-F1-model_v4 AH receptor-interacting protein	0.071	160	147	235	394	172	330	2.916E+00	49
LOKIASV2_3395_ESMFold_hypothetical_protein	AF-P45400-F1-model_v4	LOKIASV2_3395_ESMFold_hypothetical_protein	AF-P45400-F1-model_v4 Cytochrome c-type biogenesis protein CycH	0.109	289	241	107	378	83	371	1.557E-01	49
LOKIASV2_3395_ESMFold_hypothetical_protein	AF-Q9NZN9-F1-model_v4	LOKIASV2_3395_ESMFold_hypothetical_protein	AF-Q9NZN9-F1-model_v4 Aryl-hydrocarbon-interacting protein-like 1	0.097	155	138	235	389	171	324	4.718E+00	49
LOKIASV2_3395_ESMFold_hypothetical_protein	AF-Q9LR72-F1-model_v4	LOKIASV2_3395_ESMFold_hypothetical_protein	AF-Q9LR72-F1-model_v4 Putative pentatricopeptide repeat-containing protein At1g03510	0.122	230	184	180	389	181	410	7.852E-01	49
LOKIASV2_3395_ESMFold_hypothetical_protein	AF-A3KMP2-F1-model_v4	LOKIASV2_3395_ESMFold_hypothetical_protein	AF-A3KMP2-F1-model_v4 Tetratricopeptide repeat protein 38	0.102	211	172	180	390	82	274	1.803E+00	49
LOKIASV2_3395_ESMFold_hypothetical_protein	AF-Q9K165-F1-model_v4	LOKIASV2_3395_ESMFold_hypothetical_protein	AF-Q9K165-F1-model_v4 Surface lipoprotein assembly modifier 1	0.110	178	104	197	374	82	199	2.055E+00	49
LOKIASV2_3395_ESMFold_hypothetical_protein	AF-Q9EQR6-F1-model_v4	LOKIASV2_3395_ESMFold_hypothetical_protein	AF-Q9EQR6-F1-model_v4 Fanconi anemia group G protein homolog	0.084	316	199	173	390	262	577	1.883E+00	49
LOKIASV2_3395_ESMFold_hypothetical_protein	AF-Q6INC1-F1-model_v4	LOKIASV2_3395_ESMFold_hypothetical_protein	AF-Q6INC1-F1-model_v4 Tetratricopeptide repeat protein 21B	0.112	342	255	103	390	603	944	4.257E-01	49
LOKIASV2_3395_ESMFold_hypothetical_protein	AF-Q9P4X4-F1-model_v4	LOKIASV2_3395_ESMFold_hypothetical_protein	AF-Q9P4X4-F1-model_v4 Probable vesicular-fusion protein sec17 homolog	0.116	244	210	135	378	6	243	2.448E+00	48
LOKIASV2_3395_ESMFold_hypothetical_protein	AF-Q98KC1-F1-model_v4	LOKIASV2_3395_ESMFold_hypothetical_protein	AF-Q98KC1-F1-model_v4 Outer membrane protein assembly factor BamD	0.105	254	226	128	380	14	267	1.581E+00	48
LOKIASV2_3395_ESMFold_hypothetical_protein	AF-P44585-F1-model_v4	LOKIASV2_3395_ESMFold_hypothetical_protein	AF-P44585-F1-model_v4 Lipoprotein NlpI homolog	0.136	308	207	146	386	4	311	2.024E-01	48
LOKIASV2_3395_ESMFold_hypothetical_protein	AF-P94569-F1-model_v4	LOKIASV2_3395_ESMFold_hypothetical_protein	AF-P94569-F1-model_v4 TPR repeat-containing protein YsoA	0.061	127	111	249	375	17	135	8.704E+00	48
LOKIASV2_3395_ESMFold_hypothetical_protein	AF-Q9ZD72-F1-model_v4	LOKIASV2_3395_ESMFold_hypothetical_protein	AF-Q9ZD72-F1-model_v4 Uncharacterized protein RP472	0.150	279	203	95	373	29	268	7.852E-01	48
LOKIASV2_3395_ESMFold_hypothetical_protein	AF-P66948-F1-model_v4	LOKIASV2_3395_ESMFold_hypothetical_protein	AF-P66948-F1-model_v4 Beta-barrel assembly-enhancing protease	0.121	239	177	140	378	278	479	9.353E-01	48
LOKIASV2_3395_ESMFold_hypothetical_protein	AF-Q95LY5-F1-model_v4	LOKIASV2_3395_ESMFold_hypothetical_protein	AF-Q95LY5-F1-model_v4 Tetratricopeptide repeat protein 12	0.108	233	195	166	385	4	236	2.672E+00	48
LOKIASV2_3395_ESMFold_hypothetical_protein	AF-Q9HF03-F1-model_v4	LOKIASV2_3395_ESMFold_hypothetical_protein	AF-Q9HF03-F1-model_v4 Pre-mRNA-splicing factor CLF1	0.108	282	231	97	378	39	298	8.953E-01	48
LOKIASV2_3395_ESMFold_hypothetical_protein	AF-Q6P3X3-F1-model_v4	LOKIASV2_3395_ESMFold_hypothetical_protein	AF-Q6P3X3-F1-model_v4 Tetratricopeptide repeat protein 27	0.115	373	242	112	386	470	842	4.074E-01	48
LOKIASV2_3395_ESMFold_hypothetical_protein	AF-Q6N069-F1-model_v4	LOKIASV2_3395_ESMFold_hypothetical_protein	AF-Q6N069-F1-model_v4 N-alpha-acetyltransferase 16, NatA auxiliary subunit	0.146	289	238	110	389	1	289	3.573E-01	48
LOKIASV2_3395_ESMFold_hypothetical_protein	AF-Q9S0Y6-F1-model_v4	LOKIASV2_3395_ESMFold_hypothetical_protein	AF-Q9S0Y6-F1-model_v4 Regulatory protein AfsR	0.098	180	158	183	358	663	842	5.380E+00	48
LOKIASV2_3395_ESMFold_hypothetical_protein	AF-Q9WX63-F1-model_v4	LOKIASV2_3395_ESMFold_hypothetical_protein	AF-Q9WX63-F1-model_v4 Cellulose synthase 1 operon protein C	0.073	333	259	106	385	235	567	2.209E-01	48
LOKIASV2_3395_ESMFold_hypothetical_protein	AF-O82861-F1-model_v4	LOKIASV2_3395_ESMFold_hypothetical_protein	AF-O82861-F1-model_v4 Cellulose synthase operon protein C	0.077	307	230	136	385	260	566	4.447E-01	48
LOKIASV2_3395_ESMFold_hypothetical_protein	AF-Q9BT78-F1-model_v4	LOKIASV2_3395_ESMFold_hypothetical_protein	AF-Q9BT78-F1-model_v4 COP9 signalosome complex subunit 4	0.120	189	159	201	389	19	200	1.725E+00	47
LOKIASV2_3395_ESMFold_hypothetical_protein	AF-Q3SZA0-F1-model_v4	LOKIASV2_3395_ESMFold_hypothetical_protein	AF-Q3SZA0-F1-model_v4 COP9 signalosome complex subunit 4	0.120	189	159	201	389	19	200	1.652E+00	47
LOKIASV2_3395_ESMFold_hypothetical_protein	AF-Q9I3M9-F1-model_v4	LOKIASV2_3395_ESMFold_hypothetical_protein	AF-Q9I3M9-F1-model_v4 Cytochrome c-type biogenesis protein CycH	0.062	256	214	153	381	21	276	2.916E+00	47
LOKIASV2_3395_ESMFold_hypothetical_protein	AF-O88543-F1-model_v4	LOKIASV2_3395_ESMFold_hypothetical_protein	AF-O88543-F1-model_v4 COP9 signalosome complex subunit 3	0.088	225	190	165	373	6	230	3.325E+00	47
LOKIASV2_3395_ESMFold_hypothetical_protein	AF-Q6AYP3-F1-model_v4	LOKIASV2_3395_ESMFold_hypothetical_protein	AF-Q6AYP3-F1-model_v4 Tetratricopeptide repeat protein 29	0.123	307	240	103	377	101	407	7.194E-01	47
LOKIASV2_3395_ESMFold_hypothetical_protein	AF-P44089-F1-model_v4	LOKIASV2_3395_ESMFold_hypothetical_protein	AF-P44089-F1-model_v4 Surface lipoprotein assembly modifier 2	0.118	111	89	265	375	89	190	7.975E+00	47
LOKIASV2_3395_ESMFold_hypothetical_protein	AF-Q9LYW9-F1-model_v4	LOKIASV2_3395_ESMFold_hypothetical_protein	AF-Q9LYW9-F1-model_v4 DnaJ protein P58IPK homolog	0.104	292	242	103	373	1	292	4.447E-01	47
LOKIASV2_3395_ESMFold_hypothetical_protein	AF-Q86B11-F1-model_v4	LOKIASV2_3395_ESMFold_hypothetical_protein	AF-Q86B11-F1-model_v4 Anaphase-promoting complex subunit 8	0.100	295	240	114	381	293	587	6.592E-01	47
LOKIASV2_3395_ESMFold_hypothetical_protein	AF-Q9UJX2-F1-model_v4	LOKIASV2_3395_ESMFold_hypothetical_protein	AF-Q9UJX2-F1-model_v4 Cell division cycle protein 23 homolog	0.110	281	220	133	380	280	560	5.297E-01	47
LOKIASV2_3395_ESMFold_hypothetical_protein	AF-Q867T7-F1-model_v4	LOKIASV2_3395_ESMFold_hypothetical_protein	AF-Q867T7-F1-model_v4 NADPH oxidase activator	0.071	178	143	201	378	9	163	4.323E+00	47
LOKIASV2_3395_ESMFold_hypothetical_protein	AF-A6ZRW3-F1-model_v4	LOKIASV2_3395_ESMFold_hypothetical_protein	AF-A6ZRW3-F1-model_v4 Mitochondrial import receptor subunit TOM70	0.116	308	183	182	389	307	614	1.626E-01	47
LOKIASV2_3395_ESMFold_hypothetical_protein	AF-P87312-F1-model_v4	LOKIASV2_3395_ESMFold_hypothetical_protein	AF-P87312-F1-model_v4 Pre-mRNA-splicing factor cwf4	0.113	259	221	127	385	48	297	1.449E+00	47
LOKIASV2_3395_ESMFold_hypothetical_protein	AF-Q6ZHJ5-F1-model_v4	LOKIASV2_3395_ESMFold_hypothetical_protein	AF-Q6ZHJ5-F1-model_v4 Pentatricopeptide repeat-containing protein OTP51, chloroplastic	0.119	221	173	152	372	360	556	4.516E+00	47
LOKIASV2_3395_ESMFold_hypothetical_protein	AF-Q5RBW9-F1-model_v4	LOKIASV2_3395_ESMFold_hypothetical_protein	AF-Q5RBW9-F1-model_v4 Tetratricopeptide repeat protein 27	0.120	263	170	182	375	579	841	7.194E-01	47
LOKIASV2_3395_ESMFold_hypothetical_protein	AF-B5XTR7-F1-model_v4	LOKIASV2_3395_ESMFold_hypothetical_protein	AF-B5XTR7-F1-model_v4 HTH-type transcriptional regulator MalT	0.081	221	176	198	390	341	561	2.792E+00	47
LOKIASV2_3395_ESMFold_hypothetical_protein	AF-B5DEL3-F1-model_v4	LOKIASV2_3395_ESMFold_hypothetical_protein	AF-B5DEL3-F1-model_v4 Tetratricopeptide repeat protein 17	0.122	235	185	158	392	173	384	1.066E+00	47
LOKIASV2_3395_ESMFold_hypothetical_protein	AF-F4J8K6-F1-model_v4	LOKIASV2_3395_ESMFold_hypothetical_protein	AF-F4J8K6-F1-model_v4 rRNA biogenesis protein RRP5	0.092	288	239	103	390	1611	1874	1.270E+00	47
LOKIASV2_3395_ESMFold_hypothetical_protein	AF-Q9D6E4-F1-model_v4	LOKIASV2_3395_ESMFold_hypothetical_protein	AF-Q9D6E4-F1-model_v4 Tetratricopeptide repeat protein 9B	0.112	174	147	220	385	51	224	3.792E+00	46
LOKIASV2_3395_ESMFold_hypothetical_protein	AF-Q9KU21-F1-model_v4	LOKIASV2_3395_ESMFold_hypothetical_protein	AF-Q9KU21-F1-model_v4 Outer membrane protein assembly factor BamD	0.094	240	207	132	361	2	241	1.216E+00	46
LOKIASV2_3395_ESMFold_hypothetical_protein	AF-P77395-F1-model_v4	LOKIASV2_3395_ESMFold_hypothetical_protein	AF-P77395-F1-model_v4 Chaperedoxin	0.120	179	137	233	389	100	278	1.967E+00	46
LOKIASV2_3395_ESMFold_hypothetical_protein	AF-Q9WUD1-F1-model_v4	LOKIASV2_3395_ESMFold_hypothetical_protein	AF-Q9WUD1-F1-model_v4 E3 ubiquitin-protein ligase CHIP	0.090	243	182	147	389	18	218	7.852E-01	46
LOKIASV2_3395_ESMFold_hypothetical_protein	AF-Q5ZHY5-F1-model_v4	LOKIASV2_3395_ESMFold_hypothetical_protein	AF-Q5ZHY5-F1-model_v4 E3 ubiquitin-protein ligase CHIP	0.128	243	175	147	389	27	228	5.070E-01	46
LOKIASV2_3395_ESMFold_hypothetical_protein	AF-Q9LS48-F1-model_v4	LOKIASV2_3395_ESMFold_hypothetical_protein	AF-Q9LS48-F1-model_v4 protein SLOW GREEN 1, chloroplastic	0.093	241	169	148	388	102	288	1.270E+00	46
