query	target	qheader	theader	fident	alnlen	mismatch	qstart	qend	tstart	tend	evalue	bits
LOKIASV2_0664_ESMFold_hypothetical_protein	AF-P56811-F1-model_v4	LOKIASV2_0664_ESMFold_hypothetical_protein	AF-P56811-F1-model_v4 DNA-binding protein Tfx	0.195	46	35	41	86	11	55	1.576E+00	63
LOKIASV2_0664_ESMFold_hypothetical_protein	AF-B1W3T1-F1-model_v4	LOKIASV2_0664_ESMFold_hypothetical_protein	AF-B1W3T1-F1-model_v4 ECF RNA polymerase sigma factor ShbA	0.260	46	33	41	86	146	190	1.378E+00	63
LOKIASV2_0664_ESMFold_hypothetical_protein	AF-Q96YL5-F1-model_v4	LOKIASV2_0664_ESMFold_hypothetical_protein	AF-Q96YL5-F1-model_v4 NH(3)-dependent NAD(+) synthetase	0.170	41	33	39	79	211	251	9.215E-01	63
LOKIASV2_0664_ESMFold_hypothetical_protein	AF-P0AGB4-F1-model_v4	LOKIASV2_0664_ESMFold_hypothetical_protein	AF-P0AGB4-F1-model_v4 RNA polymerase sigma factor RpoH	0.204	49	36	40	85	235	283	1.205E+00	63
LOKIASV2_0664_ESMFold_hypothetical_protein	AF-P9WGH2-F1-model_v4	LOKIASV2_0664_ESMFold_hypothetical_protein	AF-P9WGH2-F1-model_v4 Probable ECF RNA polymerase sigma factor SigI	0.177	45	36	39	83	121	165	1.803E+00	63
LOKIASV2_0664_ESMFold_hypothetical_protein	AF-Q51649-F1-model_v4	LOKIASV2_0664_ESMFold_hypothetical_protein	AF-Q51649-F1-model_v4 Putative transposase for insertion sequence IS408	0.230	39	29	40	78	10	48	1.289E+00	63
LOKIASV2_0664_ESMFold_hypothetical_protein	AF-P17869-F1-model_v4	LOKIASV2_0664_ESMFold_hypothetical_protein	AF-P17869-F1-model_v4 RNA polymerase sigma-H factor	0.187	48	37	40	87	168	214	1.686E+00	62
LOKIASV2_0664_ESMFold_hypothetical_protein	AF-P9WGH3-F1-model_v4	LOKIASV2_0664_ESMFold_hypothetical_protein	AF-P9WGH3-F1-model_v4 Probable ECF RNA polymerase sigma factor SigI	0.170	47	38	39	85	121	167	1.928E+00	62
LOKIASV2_0664_ESMFold_hypothetical_protein	AF-Q31QG5-F1-model_v4	LOKIASV2_0664_ESMFold_hypothetical_protein	AF-Q31QG5-F1-model_v4 RNA polymerase sigma factor SigA3	0.185	54	40	37	86	260	313	1.576E+00	62
LOKIASV2_0664_ESMFold_hypothetical_protein	AF-A6LSM6-F1-model_v4	LOKIASV2_0664_ESMFold_hypothetical_protein	AF-A6LSM6-F1-model_v4 UPF0122 protein Cbei_1174	0.200	50	39	37	86	18	67	1.928E+00	61
LOKIASV2_0664_ESMFold_hypothetical_protein	AF-B1KWP0-F1-model_v4	LOKIASV2_0664_ESMFold_hypothetical_protein	AF-B1KWP0-F1-model_v4 UPF0122 protein CLK_1827	0.191	47	37	37	83	18	64	2.358E+00	61
LOKIASV2_0664_ESMFold_hypothetical_protein	AF-Q38XR2-F1-model_v4	LOKIASV2_0664_ESMFold_hypothetical_protein	AF-Q38XR2-F1-model_v4 UPF0122 protein LCA_0713	0.200	50	39	37	86	20	69	2.205E+00	61
LOKIASV2_0664_ESMFold_hypothetical_protein	AF-Q5HEZ8-F1-model_v4	LOKIASV2_0664_ESMFold_hypothetical_protein	AF-Q5HEZ8-F1-model_v4 RNA polymerase sigma factor SigS	0.260	65	47	21	84	91	155	4.119E-01	61
LOKIASV2_0664_ESMFold_hypothetical_protein	AF-A5ITU6-F1-model_v4	LOKIASV2_0664_ESMFold_hypothetical_protein	AF-A5ITU6-F1-model_v4 RNA polymerase sigma factor SigS	0.260	65	47	21	84	91	155	4.405E-01	61
LOKIASV2_0664_ESMFold_hypothetical_protein	AF-P9WGH8-F1-model_v4	LOKIASV2_0664_ESMFold_hypothetical_protein	AF-P9WGH8-F1-model_v4 ECF RNA polymerase sigma factor SigH	0.246	65	44	37	96	148	212	5.037E-01	61
LOKIASV2_0664_ESMFold_hypothetical_protein	AF-A8A065-F1-model_v4	LOKIASV2_0664_ESMFold_hypothetical_protein	AF-A8A065-F1-model_v4 Transcriptional regulator LsrR	0.146	75	54	39	113	17	80	2.105E-01	61
LOKIASV2_0664_ESMFold_hypothetical_protein	AF-P07105-F1-model_v4	LOKIASV2_0664_ESMFold_hypothetical_protein	AF-P07105-F1-model_v4 Regulatory protein FanB	0.145	48	40	40	87	49	96	1.054E+00	60
LOKIASV2_0664_ESMFold_hypothetical_protein	AF-Q65JQ2-F1-model_v4	LOKIASV2_0664_ESMFold_hypothetical_protein	AF-Q65JQ2-F1-model_v4 UPF0122 protein BLi01817/BL02321	0.160	50	41	37	86	20	69	2.358E+00	60
LOKIASV2_0664_ESMFold_hypothetical_protein	AF-A9VT84-F1-model_v4	LOKIASV2_0664_ESMFold_hypothetical_protein	AF-A9VT84-F1-model_v4 UPF0122 protein BcerKBAB4_3669	0.180	50	40	37	86	19	68	2.358E+00	60
LOKIASV2_0664_ESMFold_hypothetical_protein	AF-B7JJT3-F1-model_v4	LOKIASV2_0664_ESMFold_hypothetical_protein	AF-B7JJT3-F1-model_v4 UPF0122 protein BCAH820_3860	0.180	50	40	37	86	19	68	2.358E+00	60
LOKIASV2_0664_ESMFold_hypothetical_protein	AF-Q02YE3-F1-model_v4	LOKIASV2_0664_ESMFold_hypothetical_protein	AF-Q02YE3-F1-model_v4 UPF0122 protein LACR_1522	0.220	50	37	37	86	20	68	1.289E+00	60
LOKIASV2_0664_ESMFold_hypothetical_protein	AF-Q2SS09-F1-model_v4	LOKIASV2_0664_ESMFold_hypothetical_protein	AF-Q2SS09-F1-model_v4 UPF0122 protein MCAP_0480	0.244	49	36	37	84	25	73	1.054E+00	60
LOKIASV2_0664_ESMFold_hypothetical_protein	AF-A6QHV8-F1-model_v4	LOKIASV2_0664_ESMFold_hypothetical_protein	AF-A6QHV8-F1-model_v4 RNA polymerase sigma factor SigS	0.260	65	47	21	84	91	155	5.037E-01	60
LOKIASV2_0664_ESMFold_hypothetical_protein	AF-P37929-F1-model_v4	LOKIASV2_0664_ESMFold_hypothetical_protein	AF-P37929-F1-model_v4 RNA polymerase sigma factor HrpL	0.195	46	36	37	82	133	178	2.062E+00	60
LOKIASV2_0664_ESMFold_hypothetical_protein	AF-P0AGB5-F1-model_v4	LOKIASV2_0664_ESMFold_hypothetical_protein	AF-P0AGB5-F1-model_v4 RNA polymerase sigma factor RpoH	0.204	49	36	40	85	235	283	1.576E+00	60
LOKIASV2_0664_ESMFold_hypothetical_protein	AF-P11539-F1-model_v4	LOKIASV2_0664_ESMFold_hypothetical_protein	AF-P11539-F1-model_v4 RNA polymerase sigma factor RpoH	0.204	49	36	40	85	235	283	1.576E+00	60
LOKIASV2_0664_ESMFold_hypothetical_protein	AF-P0AGB3-F1-model_v4	LOKIASV2_0664_ESMFold_hypothetical_protein	AF-P0AGB3-F1-model_v4 RNA polymerase sigma factor RpoH	0.204	49	36	40	85	235	283	1.576E+00	60
LOKIASV2_0664_ESMFold_hypothetical_protein	AF-P50508-F1-model_v4	LOKIASV2_0664_ESMFold_hypothetical_protein	AF-P50508-F1-model_v4 RNA polymerase sigma factor RpoH	0.204	49	36	40	85	236	284	1.576E+00	60
LOKIASV2_0664_ESMFold_hypothetical_protein	AF-Q8CP24-F1-model_v4	LOKIASV2_0664_ESMFold_hypothetical_protein	AF-Q8CP24-F1-model_v4 RNA polymerase sigma factor SigA	0.218	55	39	37	87	307	361	1.474E+00	60
LOKIASV2_0664_ESMFold_hypothetical_protein	AF-Q5HFJ9-F1-model_v4	LOKIASV2_0664_ESMFold_hypothetical_protein	AF-Q5HFJ9-F1-model_v4 RNA polymerase sigma factor SigA	0.218	55	39	37	87	307	361	1.474E+00	60
LOKIASV2_0664_ESMFold_hypothetical_protein	AF-Q99TT5-F1-model_v4	LOKIASV2_0664_ESMFold_hypothetical_protein	AF-Q99TT5-F1-model_v4 RNA polymerase sigma factor SigA	0.218	55	39	37	87	307	361	1.474E+00	60
LOKIASV2_0664_ESMFold_hypothetical_protein	AF-Q59549-F1-model_v4	LOKIASV2_0664_ESMFold_hypothetical_protein	AF-Q59549-F1-model_v4 Chromosomal replication initiator protein DnaA	0.122	49	42	39	87	383	431	1.289E+00	60
LOKIASV2_0664_ESMFold_hypothetical_protein	AF-C3L0E8-F1-model_v4	LOKIASV2_0664_ESMFold_hypothetical_protein	AF-C3L0E8-F1-model_v4 UPF0122 protein CLJ_B2675	0.180	50	40	37	86	18	67	2.884E+00	59
LOKIASV2_0664_ESMFold_hypothetical_protein	AF-Q92AK6-F1-model_v4	LOKIASV2_0664_ESMFold_hypothetical_protein	AF-Q92AK6-F1-model_v4 UPF0122 protein lin1916	0.168	89	62	37	125	19	93	4.119E-01	59
LOKIASV2_0664_ESMFold_hypothetical_protein	AF-P0ADD8-F1-model_v4	LOKIASV2_0664_ESMFold_hypothetical_protein	AF-P0ADD8-F1-model_v4 Uncharacterized protein YjjQ	0.238	42	30	40	81	157	197	2.697E+00	59
LOKIASV2_0664_ESMFold_hypothetical_protein	AF-Q92BQ6-F1-model_v4	LOKIASV2_0664_ESMFold_hypothetical_protein	AF-Q92BQ6-F1-model_v4 RNA polymerase sigma factor SigA	0.218	55	39	37	87	313	367	1.576E+00	59
LOKIASV2_0664_ESMFold_hypothetical_protein	AF-Q8CSV1-F1-model_v4	LOKIASV2_0664_ESMFold_hypothetical_protein	AF-Q8CSV1-F1-model_v4 UPF0122 protein SE_0911	0.160	50	41	37	86	23	72	2.884E+00	58
LOKIASV2_0664_ESMFold_hypothetical_protein	AF-Q732M4-F1-model_v4	LOKIASV2_0664_ESMFold_hypothetical_protein	AF-Q732M4-F1-model_v4 UPF0122 protein BCE_3888	0.180	50	40	37	86	19	68	2.884E+00	58
LOKIASV2_0664_ESMFold_hypothetical_protein	AF-C1KWA1-F1-model_v4	LOKIASV2_0664_ESMFold_hypothetical_protein	AF-C1KWA1-F1-model_v4 UPF0122 protein Lm4b_01818	0.157	89	62	37	125	19	93	5.037E-01	58
LOKIASV2_0664_ESMFold_hypothetical_protein	AF-C1FSM0-F1-model_v4	LOKIASV2_0664_ESMFold_hypothetical_protein	AF-C1FSM0-F1-model_v4 UPF0122 protein CLM_2743	0.180	50	40	37	86	18	67	3.084E+00	58
LOKIASV2_0664_ESMFold_hypothetical_protein	AF-Q8Y694-F1-model_v4	LOKIASV2_0664_ESMFold_hypothetical_protein	AF-Q8Y694-F1-model_v4 UPF0122 protein lmo1802	0.157	89	62	37	125	19	93	4.710E-01	58
LOKIASV2_0664_ESMFold_hypothetical_protein	AF-Q71YL5-F1-model_v4	LOKIASV2_0664_ESMFold_hypothetical_protein	AF-Q71YL5-F1-model_v4 UPF0122 protein LMOf2365_1829	0.157	89	62	37	125	19	93	5.037E-01	58
LOKIASV2_0664_ESMFold_hypothetical_protein	AF-C4Z927-F1-model_v4	LOKIASV2_0664_ESMFold_hypothetical_protein	AF-C4Z927-F1-model_v4 UPF0122 protein EUBREC_1504	0.173	46	37	41	86	22	67	2.697E+00	58
LOKIASV2_0664_ESMFold_hypothetical_protein	AF-Q9HR76-F1-model_v4	LOKIASV2_0664_ESMFold_hypothetical_protein	AF-Q9HR76-F1-model_v4 Dimethyl sulfoxide reductase transcriptional activator	0.258	58	36	37	86	158	215	1.054E+00	58
LOKIASV2_0664_ESMFold_hypothetical_protein	AF-P50510-F1-model_v4	LOKIASV2_0664_ESMFold_hypothetical_protein	AF-P50510-F1-model_v4 RNA polymerase sigma factor RpoH	0.204	49	36	40	85	236	284	1.803E+00	58
LOKIASV2_0664_ESMFold_hypothetical_protein	AF-O66381-F1-model_v4	LOKIASV2_0664_ESMFold_hypothetical_protein	AF-O66381-F1-model_v4 RNA polymerase sigma factor SigA	0.218	55	39	37	87	311	365	1.686E+00	58
LOKIASV2_0664_ESMFold_hypothetical_protein	AF-P27790-F1-model_v4	LOKIASV2_0664_ESMFold_hypothetical_protein	AF-P27790-F1-model_v4 Major centromere autoantigen B	0.204	49	37	40	87	12	60	4.710E-01	58
LOKIASV2_0664_ESMFold_hypothetical_protein	AF-Q47133-F1-model_v4	LOKIASV2_0664_ESMFold_hypothetical_protein	AF-Q47133-F1-model_v4 F1845 adhesin operon regulatory protein	0.173	46	37	40	85	23	68	1.686E+00	57
LOKIASV2_0664_ESMFold_hypothetical_protein	AF-P37104-F1-model_v4	LOKIASV2_0664_ESMFold_hypothetical_protein	AF-P37104-F1-model_v4 UPF0122 protein YlxM	0.160	50	41	37	86	20	69	2.884E+00	57
LOKIASV2_0664_ESMFold_hypothetical_protein	AF-B0K1V2-F1-model_v4	LOKIASV2_0664_ESMFold_hypothetical_protein	AF-B0K1V2-F1-model_v4 UPF0122 protein Teth514_1714	0.180	50	40	37	86	19	68	3.772E+00	57
LOKIASV2_0664_ESMFold_hypothetical_protein	AF-O27554-F1-model_v4	LOKIASV2_0664_ESMFold_hypothetical_protein	AF-O27554-F1-model_v4 NH(3)-dependent NAD(+) synthetase	0.227	44	33	39	82	206	249	1.289E+00	57
LOKIASV2_0664_ESMFold_hypothetical_protein	AF-P50511-F1-model_v4	LOKIASV2_0664_ESMFold_hypothetical_protein	AF-P50511-F1-model_v4 RNA polymerase sigma factor RpoH	0.170	47	36	40	83	236	282	1.928E+00	57
LOKIASV2_0664_ESMFold_hypothetical_protein	AF-A0AJQ7-F1-model_v4	LOKIASV2_0664_ESMFold_hypothetical_protein	AF-A0AJQ7-F1-model_v4 UPF0122 protein lwe1821	0.157	89	62	37	125	19	93	6.161E-01	56
LOKIASV2_0664_ESMFold_hypothetical_protein	AF-P13606-F1-model_v4	LOKIASV2_0664_ESMFold_hypothetical_protein	AF-P13606-F1-model_v4 R46 site-specific recombinase	0.190	42	32	41	82	148	188	1.803E+00	56
LOKIASV2_0664_ESMFold_hypothetical_protein	AF-A5I4M8-F1-model_v4	LOKIASV2_0664_ESMFold_hypothetical_protein	AF-A5I4M8-F1-model_v4 UPF0122 protein CBO2450/CLC_2298	0.180	50	40	37	86	18	67	3.772E+00	55
LOKIASV2_0664_ESMFold_hypothetical_protein	AF-A7GG38-F1-model_v4	LOKIASV2_0664_ESMFold_hypothetical_protein	AF-A7GG38-F1-model_v4 UPF0122 protein CLI_2506	0.180	50	40	37	86	18	67	3.772E+00	55
LOKIASV2_0664_ESMFold_hypothetical_protein	AF-Q5HPV5-F1-model_v4	LOKIASV2_0664_ESMFold_hypothetical_protein	AF-Q5HPV5-F1-model_v4 UPF0122 protein SERP0802	0.180	50	40	37	86	23	72	3.772E+00	55
LOKIASV2_0664_ESMFold_hypothetical_protein	AF-P0DJA6-F1-model_v4	LOKIASV2_0664_ESMFold_hypothetical_protein	AF-P0DJA6-F1-model_v4 HTH-type transcriptional regulator Zrp	0.218	54	40	40	93	5	56	3.602E-01	55
LOKIASV2_0664_ESMFold_hypothetical_protein	AF-O30124-F1-model_v4	LOKIASV2_0664_ESMFold_hypothetical_protein	AF-O30124-F1-model_v4 NAD-dependent protein deacylase 2	0.191	47	37	130	176	121	167	1.378E+00	55
LOKIASV2_0664_ESMFold_hypothetical_protein	AF-Q4JCP0-F1-model_v4	LOKIASV2_0664_ESMFold_hypothetical_protein	AF-Q4JCP0-F1-model_v4 NH(3)-dependent NAD(+) synthetase	0.222	45	33	39	82	210	254	1.378E+00	55
LOKIASV2_0664_ESMFold_hypothetical_protein	AF-Q5HNY7-F1-model_v4	LOKIASV2_0664_ESMFold_hypothetical_protein	AF-Q5HNY7-F1-model_v4 RNA polymerase sigma factor SigA	0.218	55	39	37	87	307	361	2.358E+00	55
LOKIASV2_0664_ESMFold_hypothetical_protein	AF-Q6G905-F1-model_v4	LOKIASV2_0664_ESMFold_hypothetical_protein	AF-Q6G905-F1-model_v4 RNA polymerase sigma factor SigA	0.218	55	39	37	87	307	361	2.358E+00	55
LOKIASV2_0664_ESMFold_hypothetical_protein	AF-P0A0J0-F1-model_v4	LOKIASV2_0664_ESMFold_hypothetical_protein	AF-P0A0J0-F1-model_v4 RNA polymerase sigma factor SigA	0.218	55	39	37	87	307	361	2.358E+00	55
LOKIASV2_0664_ESMFold_hypothetical_protein	AF-P48988-F1-model_v4	LOKIASV2_0664_ESMFold_hypothetical_protein	AF-P48988-F1-model_v4 Major centromere autoantigen B	0.204	49	37	40	87	12	60	7.046E-01	55
LOKIASV2_0664_ESMFold_hypothetical_protein	AF-Q6GHJ9-F1-model_v4	LOKIASV2_0664_ESMFold_hypothetical_protein	AF-Q6GHJ9-F1-model_v4 UPF0122 protein SAR1212	0.200	50	39	37	86	23	72	4.033E+00	54
LOKIASV2_0664_ESMFold_hypothetical_protein	AF-C1EP70-F1-model_v4	LOKIASV2_0664_ESMFold_hypothetical_protein	AF-C1EP70-F1-model_v4 UPF0122 protein BCA_3946	0.180	50	40	37	86	19	68	4.033E+00	54
LOKIASV2_0664_ESMFold_hypothetical_protein	AF-A7X1K4-F1-model_v4	LOKIASV2_0664_ESMFold_hypothetical_protein	AF-A7X1K4-F1-model_v4 UPF0122 protein SAHV_1226	0.200	50	39	37	86	23	72	4.033E+00	54
LOKIASV2_0664_ESMFold_hypothetical_protein	AF-P67249-F1-model_v4	LOKIASV2_0664_ESMFold_hypothetical_protein	AF-P67249-F1-model_v4 UPF0122 protein SA1079	0.200	50	39	37	86	23	72	4.033E+00	54
LOKIASV2_0664_ESMFold_hypothetical_protein	AF-A3DDH7-F1-model_v4	LOKIASV2_0664_ESMFold_hypothetical_protein	AF-A3DDH7-F1-model_v4 UPF0122 protein Cthe_0771	0.208	48	36	41	87	22	69	2.358E+00	54
LOKIASV2_0664_ESMFold_hypothetical_protein	AF-F8DT24-F1-model_v4	LOKIASV2_0664_ESMFold_hypothetical_protein	AF-F8DT24-F1-model_v4 HTH-type transcriptional regulator Zrp	0.218	54	40	40	93	5	56	4.405E-01	54
LOKIASV2_0664_ESMFold_hypothetical_protein	AF-P03030-F1-model_v4	LOKIASV2_0664_ESMFold_hypothetical_protein	AF-P03030-F1-model_v4 Transcriptional activator protein LysR	0.309	42	26	40	81	10	47	9.855E-01	54
LOKIASV2_0664_ESMFold_hypothetical_protein	AF-Q2VL51-F1-model_v4	LOKIASV2_0664_ESMFold_hypothetical_protein	AF-Q2VL51-F1-model_v4 Paired box protein Pax-9	0.175	40	31	39	78	24	62	2.205E+00	54
LOKIASV2_0664_ESMFold_hypothetical_protein	AF-Q94K49-F1-model_v4	LOKIASV2_0664_ESMFold_hypothetical_protein	AF-Q94K49-F1-model_v4 Protein ANTAGONIST OF LIKE HETEROCHROMATIN PROTEIN 1	0.282	39	27	44	82	112	149	2.205E+00	54
LOKIASV2_0664_ESMFold_hypothetical_protein	AF-Q04WF7-F1-model_v4	LOKIASV2_0664_ESMFold_hypothetical_protein	AF-Q04WF7-F1-model_v4 Chromosomal replication initiator protein DnaA	0.116	43	37	39	81	376	418	3.772E+00	54
LOKIASV2_0664_ESMFold_hypothetical_protein	AF-A8F346-F1-model_v4	LOKIASV2_0664_ESMFold_hypothetical_protein	AF-A8F346-F1-model_v4 Chromosomal replication initiator protein DnaA	0.224	49	34	39	87	376	420	1.474E+00	54
LOKIASV2_0664_ESMFold_hypothetical_protein	AF-Q8ER03-F1-model_v4	LOKIASV2_0664_ESMFold_hypothetical_protein	AF-Q8ER03-F1-model_v4 UPF0122 protein OB1530	0.140	50	42	37	86	19	68	4.033E+00	53
LOKIASV2_0664_ESMFold_hypothetical_protein	AF-B1YIM8-F1-model_v4	LOKIASV2_0664_ESMFold_hypothetical_protein	AF-B1YIM8-F1-model_v4 UPF0122 protein Exig_1902	0.173	52	41	37	87	20	71	2.358E+00	53
LOKIASV2_0664_ESMFold_hypothetical_protein	AF-C3P5P7-F1-model_v4	LOKIASV2_0664_ESMFold_hypothetical_protein	AF-C3P5P7-F1-model_v4 UPF0122 protein BAA_4008	0.180	50	40	37	86	19	68	4.313E+00	53
LOKIASV2_0664_ESMFold_hypothetical_protein	AF-A0RHL9-F1-model_v4	LOKIASV2_0664_ESMFold_hypothetical_protein	AF-A0RHL9-F1-model_v4 UPF0122 protein BALH_3477	0.180	50	40	37	86	19	68	4.313E+00	53
LOKIASV2_0664_ESMFold_hypothetical_protein	AF-Q03FW7-F1-model_v4	LOKIASV2_0664_ESMFold_hypothetical_protein	AF-Q03FW7-F1-model_v4 UPF0122 protein PEPE_0845	0.179	86	67	37	122	20	101	6.161E-01	53
LOKIASV2_0664_ESMFold_hypothetical_protein	AF-Q3IYV6-F1-model_v4	LOKIASV2_0664_ESMFold_hypothetical_protein	AF-Q3IYV6-F1-model_v4 ECF RNA polymerase sigma factor RpoE	0.142	42	35	41	82	137	178	4.313E+00	53
LOKIASV2_0664_ESMFold_hypothetical_protein	AF-P55407-F1-model_v4	LOKIASV2_0664_ESMFold_hypothetical_protein	AF-P55407-F1-model_v4 Probable transcriptional activator protein TraR	0.190	42	32	40	81	179	219	2.884E+00	53
LOKIASV2_0664_ESMFold_hypothetical_protein	AF-A5VKN9-F1-model_v4	LOKIASV2_0664_ESMFold_hypothetical_protein	AF-A5VKN9-F1-model_v4 UPF0122 protein Lreu_1156	0.180	50	40	37	86	20	69	4.613E+00	52
LOKIASV2_0664_ESMFold_hypothetical_protein	AF-B2G823-F1-model_v4	LOKIASV2_0664_ESMFold_hypothetical_protein	AF-B2G823-F1-model_v4 UPF0122 protein LAR_1089	0.180	50	40	37	86	20	69	4.613E+00	52
LOKIASV2_0664_ESMFold_hypothetical_protein	AF-P53914-F1-model_v4	LOKIASV2_0664_ESMFold_hypothetical_protein	AF-P53914-F1-model_v4 RNA cytidine acetyltransferase	0.100	50	44	37	86	877	926	4.933E+00	52
LOKIASV2_0664_ESMFold_hypothetical_protein	AF-Q5HGJ6-F1-model_v4	LOKIASV2_0664_ESMFold_hypothetical_protein	AF-Q5HGJ6-F1-model_v4 UPF0122 protein SACOL1252	0.200	50	39	37	86	23	72	4.933E+00	51
LOKIASV2_0664_ESMFold_hypothetical_protein	AF-A7GRH6-F1-model_v4	LOKIASV2_0664_ESMFold_hypothetical_protein	AF-A7GRH6-F1-model_v4 UPF0122 protein Bcer98_2498	0.150	93	65	37	129	19	95	8.617E-01	51
LOKIASV2_0664_ESMFold_hypothetical_protein	AF-Q6G9X7-F1-model_v4	LOKIASV2_0664_ESMFold_hypothetical_protein	AF-Q6G9X7-F1-model_v4 UPF0122 protein SAS1170	0.200	50	39	37	86	23	72	4.933E+00	51
LOKIASV2_0664_ESMFold_hypothetical_protein	AF-A5ISC1-F1-model_v4	LOKIASV2_0664_ESMFold_hypothetical_protein	AF-A5ISC1-F1-model_v4 UPF0122 protein SaurJH9_1295	0.200	50	39	37	86	23	72	4.933E+00	51
LOKIASV2_0664_ESMFold_hypothetical_protein	AF-F8DT92-F1-model_v4	LOKIASV2_0664_ESMFold_hypothetical_protein	AF-F8DT92-F1-model_v4 Glutamate uptake regulatory protein	0.191	47	36	36	81	4	50	1.686E+00	51
LOKIASV2_0664_ESMFold_hypothetical_protein	AF-P0AGA8-F1-model_v4	LOKIASV2_0664_ESMFold_hypothetical_protein	AF-P0AGA8-F1-model_v4 Transcriptional regulatory protein UhpA	0.183	59	42	37	88	138	196	1.928E+00	51
LOKIASV2_0664_ESMFold_hypothetical_protein	AF-Q4G384-F1-model_v4	LOKIASV2_0664_ESMFold_hypothetical_protein	AF-Q4G384-F1-model_v4 Probable RuBisCO transcriptional regulator	0.292	41	28	41	81	10	49	2.697E+00	51
LOKIASV2_0664_ESMFold_hypothetical_protein	AF-Q9EZJ8-F1-model_v4	LOKIASV2_0664_ESMFold_hypothetical_protein	AF-Q9EZJ8-F1-model_v4 RNA polymerase sigma factor SigA	0.181	55	41	37	87	376	430	4.033E+00	51
LOKIASV2_0664_ESMFold_hypothetical_protein	AF-O22056-F1-model_v4	LOKIASV2_0664_ESMFold_hypothetical_protein	AF-O22056-F1-model_v4 RNA polymerase sigma factor sigB	0.218	55	39	37	87	508	562	3.298E+00	51
LOKIASV2_0664_ESMFold_hypothetical_protein	AF-P39212-F1-model_v4	LOKIASV2_0664_ESMFold_hypothetical_protein	AF-P39212-F1-model_v4 Putative transposase InsN for insertion sequence element IS911B	0.174	86	60	40	125	10	83	1.969E-01	50
LOKIASV2_0664_ESMFold_hypothetical_protein	AF-C4L5Z9-F1-model_v4	LOKIASV2_0664_ESMFold_hypothetical_protein	AF-C4L5Z9-F1-model_v4 UPF0122 protein EAT1b_2891	0.160	50	41	37	86	20	69	5.642E+00	50
LOKIASV2_0664_ESMFold_hypothetical_protein	AF-C3L781-F1-model_v4	LOKIASV2_0664_ESMFold_hypothetical_protein	AF-C3L781-F1-model_v4 UPF0122 protein BAMEG_0647	0.150	93	65	37	129	19	95	8.058E-01	50
LOKIASV2_0664_ESMFold_hypothetical_protein	AF-P39213-F1-model_v4	LOKIASV2_0664_ESMFold_hypothetical_protein	AF-P39213-F1-model_v4 Transposase InsN for insertion sequence element IS911	0.172	86	60	40	125	22	95	2.575E-01	50
LOKIASV2_0664_ESMFold_hypothetical_protein	AF-P37424-F1-model_v4	LOKIASV2_0664_ESMFold_hypothetical_protein	AF-P37424-F1-model_v4 Leucine-responsive regulatory protein	0.186	59	45	40	98	16	71	4.119E-01	50
LOKIASV2_0664_ESMFold_hypothetical_protein	AF-P0ACJ3-F1-model_v4	LOKIASV2_0664_ESMFold_hypothetical_protein	AF-P0ACJ3-F1-model_v4 Leucine-responsive regulatory protein	0.186	59	45	40	98	16	71	4.405E-01	50
LOKIASV2_0664_ESMFold_hypothetical_protein	AF-O78432-F1-model_v4	LOKIASV2_0664_ESMFold_hypothetical_protein	AF-O78432-F1-model_v4 Probable RuBisCO transcriptional regulator	0.190	42	30	40	81	12	49	1.127E+00	50
LOKIASV2_0664_ESMFold_hypothetical_protein	AF-Q6GGD8-F1-model_v4	LOKIASV2_0664_ESMFold_hypothetical_protein	AF-Q6GGD8-F1-model_v4 RNA polymerase sigma factor SigA	0.218	55	39	37	87	307	361	3.527E+00	50
LOKIASV2_0664_ESMFold_hypothetical_protein	AF-P52328-F1-model_v4	LOKIASV2_0664_ESMFold_hypothetical_protein	AF-P52328-F1-model_v4 RNA polymerase sigma factor SigA	0.196	51	37	41	87	320	370	2.884E+00	50
LOKIASV2_0664_ESMFold_hypothetical_protein	AF-Q6MC93-F1-model_v4	LOKIASV2_0664_ESMFold_hypothetical_protein	AF-Q6MC93-F1-model_v4 Chromosomal replication initiator protein DnaA 1	0.125	48	41	39	86	390	437	4.033E+00	50
LOKIASV2_0664_ESMFold_hypothetical_protein	AF-P96468-F1-model_v4	LOKIASV2_0664_ESMFold_hypothetical_protein	AF-P96468-F1-model_v4 UPF0122 protein SMU_1061	0.163	89	70	37	125	20	104	9.855E-01	49
LOKIASV2_0664_ESMFold_hypothetical_protein	AF-C5D8T9-F1-model_v4	LOKIASV2_0664_ESMFold_hypothetical_protein	AF-C5D8T9-F1-model_v4 UPF0122 protein GWCH70_1086	0.160	50	41	37	86	19	68	6.033E+00	49
LOKIASV2_0664_ESMFold_hypothetical_protein	AF-Q8KA76-F1-model_v4	LOKIASV2_0664_ESMFold_hypothetical_protein	AF-Q8KA76-F1-model_v4 RNA polymerase sigma factor RpoH	0.183	49	37	40	85	236	284	3.298E+00	49
LOKIASV2_0664_ESMFold_hypothetical_protein	AF-P77171-F1-model_v4	LOKIASV2_0664_ESMFold_hypothetical_protein	AF-P77171-F1-model_v4 Uncharacterized HTH-type transcriptional regulator YdcI	0.190	42	30	40	81	17	54	1.803E+00	49
LOKIASV2_0664_ESMFold_hypothetical_protein	AF-P23757-F1-model_v4	LOKIASV2_0664_ESMFold_hypothetical_protein	AF-P23757-F1-model_v4 Paired box pox-meso protein	0.175	40	31	39	78	29	67	3.527E+00	49
LOKIASV2_0664_ESMFold_hypothetical_protein	AF-O84252-F1-model_v4	LOKIASV2_0664_ESMFold_hypothetical_protein	AF-O84252-F1-model_v4 Chromosomal replication initiator protein DnaA 1	0.113	44	38	39	82	383	426	6.033E+00	49
LOKIASV2_0664_ESMFold_hypothetical_protein	AF-Q96MW7-F1-model_v4	LOKIASV2_0664_ESMFold_hypothetical_protein	AF-Q96MW7-F1-model_v4 Tigger transposable element-derived protein 1	0.173	46	36	40	85	19	63	2.884E+00	49
LOKIASV2_0664_ESMFold_hypothetical_protein	AF-O01757-F1-model_v4	LOKIASV2_0664_ESMFold_hypothetical_protein	AF-O01757-F1-model_v4 RNA cytidine acetyltransferase	0.106	47	41	40	86	868	914	6.033E+00	49
LOKIASV2_0664_ESMFold_hypothetical_protein	AF-Q926A6-F1-model_v4	LOKIASV2_0664_ESMFold_hypothetical_protein	AF-Q926A6-F1-model_v4 Uncharacterized phage-related protein Lin1259/Lin1739	0.173	52	41	40	91	91	140	3.084E+00	48
LOKIASV2_0664_ESMFold_hypothetical_protein	AF-P0ACJ2-F1-model_v4	LOKIASV2_0664_ESMFold_hypothetical_protein	AF-P0ACJ2-F1-model_v4 Leucine-responsive regulatory protein	0.186	59	45	40	98	16	71	5.387E-01	48
LOKIASV2_0664_ESMFold_hypothetical_protein	AF-P37425-F1-model_v4	LOKIASV2_0664_ESMFold_hypothetical_protein	AF-P37425-F1-model_v4 Leucine-responsive regulatory protein	0.186	59	45	40	98	16	71	5.387E-01	48
LOKIASV2_0664_ESMFold_hypothetical_protein	AF-P0A2S0-F1-model_v4	LOKIASV2_0664_ESMFold_hypothetical_protein	AF-P0A2S0-F1-model_v4 Leucine-responsive regulatory protein	0.186	59	45	40	98	16	71	5.387E-01	48
LOKIASV2_0664_ESMFold_hypothetical_protein	AF-P0ACJ1-F1-model_v4	LOKIASV2_0664_ESMFold_hypothetical_protein	AF-P0ACJ1-F1-model_v4 Leucine-responsive regulatory protein	0.186	59	45	40	98	16	71	5.387E-01	48
LOKIASV2_0664_ESMFold_hypothetical_protein	AF-P0ACJ0-F1-model_v4	LOKIASV2_0664_ESMFold_hypothetical_protein	AF-P0ACJ0-F1-model_v4 Leucine-responsive regulatory protein	0.186	59	45	40	98	16	71	5.387E-01	48
LOKIASV2_0664_ESMFold_hypothetical_protein	AF-Q2YIQ4-F1-model_v4	LOKIASV2_0664_ESMFold_hypothetical_protein	AF-Q2YIQ4-F1-model_v4 Erythritol catabolism regulatory protein EryD	0.211	49	35	39	87	4	48	8.617E-01	48
LOKIASV2_0664_ESMFold_hypothetical_protein	AF-P45105-F1-model_v4	LOKIASV2_0664_ESMFold_hypothetical_protein	AF-P45105-F1-model_v4 HTH-type transcriptional regulator CysB	0.204	49	33	41	89	5	47	1.205E+00	48
LOKIASV2_0664_ESMFold_hypothetical_protein	AF-Q8FA34-F1-model_v4	LOKIASV2_0664_ESMFold_hypothetical_protein	AF-Q8FA34-F1-model_v4 Chromosomal replication initiator protein DnaA	0.166	48	38	39	86	382	428	3.084E+00	48
LOKIASV2_0664_ESMFold_hypothetical_protein	AF-Q8IY51-F1-model_v4	LOKIASV2_0664_ESMFold_hypothetical_protein	AF-Q8IY51-F1-model_v4 Tigger transposable element-derived protein 4	0.212	47	35	40	86	25	69	1.803E+00	48
LOKIASV2_0664_ESMFold_hypothetical_protein	AF-Q8BUZ3-F1-model_v4	LOKIASV2_0664_ESMFold_hypothetical_protein	AF-Q8BUZ3-F1-model_v4 Tigger transposable element-derived protein 4	0.212	47	35	40	86	25	69	1.803E+00	48
LOKIASV2_0664_ESMFold_hypothetical_protein	AF-Q8EVS4-F1-model_v4	LOKIASV2_0664_ESMFold_hypothetical_protein	AF-Q8EVS4-F1-model_v4 UPF0122 protein MYPE4850	0.139	90	70	37	126	20	101	1.378E+00	47
LOKIASV2_0664_ESMFold_hypothetical_protein	AF-Q49X20-F1-model_v4	LOKIASV2_0664_ESMFold_hypothetical_protein	AF-Q49X20-F1-model_v4 UPF0122 protein SSP1533	0.215	51	38	37	87	23	72	4.933E+00	47
LOKIASV2_0664_ESMFold_hypothetical_protein	AF-P67248-F1-model_v4	LOKIASV2_0664_ESMFold_hypothetical_protein	AF-P67248-F1-model_v4 UPF0122 protein SAV1236	0.188	90	66	37	126	23	104	1.205E+00	47
LOKIASV2_0664_ESMFold_hypothetical_protein	AF-P55598-F1-model_v4	LOKIASV2_0664_ESMFold_hypothetical_protein	AF-P55598-F1-model_v4 Uncharacterized protein y4oM	0.204	49	33	39	87	41	82	9.215E-01	47
LOKIASV2_0664_ESMFold_hypothetical_protein	AF-P0ACJ6-F1-model_v4	LOKIASV2_0664_ESMFold_hypothetical_protein	AF-P0ACJ6-F1-model_v4 DNA-binding transcriptional activator DecR	0.127	54	45	40	93	5	56	1.205E+00	47
