query	target	qheader	theader	fident	alnlen	mismatch	qstart	qend	tstart	tend	evalue	bits
LOKIASV2_3395_ESMFold_hypothetical_protein	AF-Q9NES8-F1-model_v4	LOKIASV2_3395_ESMFold_hypothetical_protein	AF-Q9NES8-F1-model_v4 Serine/threonine-protein phosphatase 5	0.094	153	130	233	385	8	151	2.827E-02	138
LOKIASV2_3395_ESMFold_hypothetical_protein	AF-Q84XU2-F1-model_v4	LOKIASV2_3395_ESMFold_hypothetical_protein	AF-Q84XU2-F1-model_v4 Serine/threonine-protein phosphatase 5	0.117	153	117	233	385	4	136	2.272E-02	138
LOKIASV2_3395_ESMFold_hypothetical_protein	AF-O43049-F1-model_v4	LOKIASV2_3395_ESMFold_hypothetical_protein	AF-O43049-F1-model_v4 Serine/threonine-protein phosphatase T	0.123	138	109	249	386	5	129	5.449E-02	136
LOKIASV2_3395_ESMFold_hypothetical_protein	AF-Q84K11-F1-model_v4	LOKIASV2_3395_ESMFold_hypothetical_protein	AF-Q84K11-F1-model_v4 Serine/threonine-protein phosphatase 5	0.111	153	117	233	385	5	137	3.368E-02	132
LOKIASV2_3395_ESMFold_hypothetical_protein	AF-Q55ED0-F1-model_v4	LOKIASV2_3395_ESMFold_hypothetical_protein	AF-Q55ED0-F1-model_v4 Protein SGT1 homolog	0.105	123	98	256	378	7	116	1.050E-01	128
LOKIASV2_3395_ESMFold_hypothetical_protein	AF-Q60676-F1-model_v4	LOKIASV2_3395_ESMFold_hypothetical_protein	AF-Q60676-F1-model_v4 Serine/threonine-protein phosphatase 5	0.064	155	122	231	385	21	151	4.378E-02	127
LOKIASV2_3395_ESMFold_hypothetical_protein	AF-Q9D4H7-F1-model_v4	LOKIASV2_3395_ESMFold_hypothetical_protein	AF-Q9D4H7-F1-model_v4 LON peptidase N-terminal domain and RING finger protein 3	0.119	126	99	249	374	244	356	1.365E-01	126
LOKIASV2_3395_ESMFold_hypothetical_protein	AF-O70145-F1-model_v4	LOKIASV2_3395_ESMFold_hypothetical_protein	AF-O70145-F1-model_v4 Neutrophil cytosol factor 2	0.202	152	116	230	375	17	168	3.676E-02	124
LOKIASV2_3395_ESMFold_hypothetical_protein	AF-Q496Y0-F1-model_v4	LOKIASV2_3395_ESMFold_hypothetical_protein	AF-Q496Y0-F1-model_v4 LON peptidase N-terminal domain and RING finger protein 3	0.110	136	108	236	371	231	352	9.621E-02	122
LOKIASV2_3395_ESMFold_hypothetical_protein	AF-P69065-F1-model_v4	LOKIASV2_3395_ESMFold_hypothetical_protein	AF-P69065-F1-model_v4 Chaperone protein SicA	0.103	161	143	226	385	3	163	3.676E-02	120
LOKIASV2_3395_ESMFold_hypothetical_protein	AF-P53042-F1-model_v4	LOKIASV2_3395_ESMFold_hypothetical_protein	AF-P53042-F1-model_v4 Serine/threonine-protein phosphatase 5	0.064	155	122	231	385	21	151	8.077E-02	118
LOKIASV2_3395_ESMFold_hypothetical_protein	AF-P53041-F1-model_v4	LOKIASV2_3395_ESMFold_hypothetical_protein	AF-P53041-F1-model_v4 Serine/threonine-protein phosphatase 5	0.064	155	122	231	385	21	151	9.209E-02	117
LOKIASV2_3395_ESMFold_hypothetical_protein	AF-P69064-F1-model_v4	LOKIASV2_3395_ESMFold_hypothetical_protein	AF-P69064-F1-model_v4 Chaperone protein SicA	0.103	161	143	226	385	3	163	4.779E-02	116
LOKIASV2_3395_ESMFold_hypothetical_protein	AF-P69066-F1-model_v4	LOKIASV2_3395_ESMFold_hypothetical_protein	AF-P69066-F1-model_v4 Chaperone protein SicA	0.103	161	143	226	385	3	163	4.992E-02	116
LOKIASV2_3395_ESMFold_hypothetical_protein	AF-O34452-F1-model_v4	LOKIASV2_3395_ESMFold_hypothetical_protein	AF-O34452-F1-model_v4 TPR repeat-containing protein YrrB	0.111	195	146	184	378	10	174	2.827E-02	116
LOKIASV2_3395_ESMFold_hypothetical_protein	AF-P53043-F1-model_v4	LOKIASV2_3395_ESMFold_hypothetical_protein	AF-P53043-F1-model_v4 Serine/threonine-protein phosphatase T	0.102	156	118	231	386	5	136	1.426E-01	113
LOKIASV2_3395_ESMFold_hypothetical_protein	AF-P23995-F1-model_v4	LOKIASV2_3395_ESMFold_hypothetical_protein	AF-P23995-F1-model_v4 Low calcium response locus protein H	0.140	158	132	228	385	12	166	9.209E-02	112
LOKIASV2_3395_ESMFold_hypothetical_protein	AF-Q8R368-F1-model_v4	LOKIASV2_3395_ESMFold_hypothetical_protein	AF-Q8R368-F1-model_v4 Dynein assembly factor 4, axonemal	0.100	164	139	226	380	251	414	1.490E-01	111
LOKIASV2_3395_ESMFold_hypothetical_protein	AF-Q6AZN0-F1-model_v4	LOKIASV2_3395_ESMFold_hypothetical_protein	AF-Q6AZN0-F1-model_v4 Dynein axonemal assembly factor 4	0.095	152	135	229	378	253	404	1.699E-01	111
LOKIASV2_3395_ESMFold_hypothetical_protein	AF-Q9CYG7-F1-model_v4	LOKIASV2_3395_ESMFold_hypothetical_protein	AF-Q9CYG7-F1-model_v4 Mitochondrial import receptor subunit TOM34	0.078	255	194	167	377	54	308	1.179E-02	110
LOKIASV2_3395_ESMFold_hypothetical_protein	AF-Q8WXU2-F1-model_v4	LOKIASV2_3395_ESMFold_hypothetical_protein	AF-Q8WXU2-F1-model_v4 Dynein assembly factor 4, axonemal	0.106	174	143	207	380	256	416	8.815E-02	110
LOKIASV2_3395_ESMFold_hypothetical_protein	AF-C4NYP8-F1-model_v4	LOKIASV2_3395_ESMFold_hypothetical_protein	AF-C4NYP8-F1-model_v4 Hsc70-interacting protein 1	0.139	141	110	249	389	126	254	2.518E-01	109
LOKIASV2_3395_ESMFold_hypothetical_protein	AF-A4K2V0-F1-model_v4	LOKIASV2_3395_ESMFold_hypothetical_protein	AF-A4K2V0-F1-model_v4 Mitochondrial import receptor subunit TOM34	0.074	253	193	167	375	54	306	1.287E-02	108
LOKIASV2_3395_ESMFold_hypothetical_protein	AF-Q80ZX8-F1-model_v4	LOKIASV2_3395_ESMFold_hypothetical_protein	AF-Q80ZX8-F1-model_v4 Sperm-associated antigen 1	0.116	153	112	226	378	201	328	1.626E-01	108
LOKIASV2_3395_ESMFold_hypothetical_protein	AF-Q15785-F1-model_v4	LOKIASV2_3395_ESMFold_hypothetical_protein	AF-Q15785-F1-model_v4 Mitochondrial import receptor subunit TOM34	0.078	253	192	167	375	54	306	1.533E-02	107
LOKIASV2_3395_ESMFold_hypothetical_protein	AF-Q9SIN1-F1-model_v4	LOKIASV2_3395_ESMFold_hypothetical_protein	AF-Q9SIN1-F1-model_v4 Inactive TPR repeat-containing thioredoxin TTL3	0.117	260	202	158	387	214	473	1.533E-02	107
LOKIASV2_3395_ESMFold_hypothetical_protein	AF-F4I3Z5-F1-model_v4	LOKIASV2_3395_ESMFold_hypothetical_protein	AF-F4I3Z5-F1-model_v4 Tetratricopeptide repeat protein SKI3	0.102	221	185	183	389	397	617	4.191E-02	107
LOKIASV2_3395_ESMFold_hypothetical_protein	AF-P21207-F1-model_v4	LOKIASV2_3395_ESMFold_hypothetical_protein	AF-P21207-F1-model_v4 Low calcium response locus protein H	0.140	158	132	228	385	12	166	1.490E-01	106
LOKIASV2_3395_ESMFold_hypothetical_protein	AF-Q5VJS5-F1-model_v4	LOKIASV2_3395_ESMFold_hypothetical_protein	AF-Q5VJS5-F1-model_v4 Dynein assembly factor 4, axonemal	0.094	164	140	226	380	251	414	1.775E-01	106
LOKIASV2_3395_ESMFold_hypothetical_protein	AF-Q8NBP0-F1-model_v4	LOKIASV2_3395_ESMFold_hypothetical_protein	AF-Q8NBP0-F1-model_v4 Tetratricopeptide repeat protein 13	0.111	248	176	178	376	192	439	1.080E-02	105
LOKIASV2_3395_ESMFold_hypothetical_protein	AF-Q9SUR9-F1-model_v4	LOKIASV2_3395_ESMFold_hypothetical_protein	AF-Q9SUR9-F1-model_v4 Protein SGT1 homolog A	0.101	138	110	249	386	2	124	4.646E-01	104
LOKIASV2_3395_ESMFold_hypothetical_protein	AF-Q58823-F1-model_v4	LOKIASV2_3395_ESMFold_hypothetical_protein	AF-Q58823-F1-model_v4 TPR repeat-containing protein MJ1428	0.105	216	168	152	367	2	190	1.826E-02	104
LOKIASV2_3395_ESMFold_hypothetical_protein	AF-Q84JR9-F1-model_v4	LOKIASV2_3395_ESMFold_hypothetical_protein	AF-Q84JR9-F1-model_v4 TPR repeat-containing thioredoxin TTL4	0.134	275	210	145	387	190	464	1.179E-02	104
LOKIASV2_3395_ESMFold_hypothetical_protein	AF-Q9D6K7-F1-model_v4	LOKIASV2_3395_ESMFold_hypothetical_protein	AF-Q9D6K7-F1-model_v4 Tetratricopeptide repeat protein 33	0.139	164	127	226	389	39	187	1.775E-01	103
LOKIASV2_3395_ESMFold_hypothetical_protein	AF-Q863A6-F1-model_v4	LOKIASV2_3395_ESMFold_hypothetical_protein	AF-Q863A6-F1-model_v4 Dynein axonemal assembly factor 4	0.102	172	142	207	378	256	414	1.490E-01	103
LOKIASV2_3395_ESMFold_hypothetical_protein	AF-Q9LVH5-F1-model_v4	LOKIASV2_3395_ESMFold_hypothetical_protein	AF-Q9LVH5-F1-model_v4 Outer envelope protein 64, chloroplastic	0.119	173	131	203	375	438	587	1.005E-01	103
LOKIASV2_3395_ESMFold_hypothetical_protein	AF-F4JS25-F1-model_v4	LOKIASV2_3395_ESMFold_hypothetical_protein	AF-F4JS25-F1-model_v4 Suppressor of RPS4-RLD 1	0.107	210	184	167	373	368	577	3.676E-02	103
LOKIASV2_3395_ESMFold_hypothetical_protein	AF-Q3KRD5-F1-model_v4	LOKIASV2_3395_ESMFold_hypothetical_protein	AF-Q3KRD5-F1-model_v4 Mitochondrial import receptor subunit TOM34	0.074	255	194	167	377	54	308	2.480E-02	102
LOKIASV2_3395_ESMFold_hypothetical_protein	AF-Q58741-F1-model_v4	LOKIASV2_3395_ESMFold_hypothetical_protein	AF-Q58741-F1-model_v4 TPR repeat-containing protein MJ1345	0.095	231	181	155	385	104	304	7.400E-02	102
LOKIASV2_3395_ESMFold_hypothetical_protein	AF-Q9UIM3-F1-model_v4	LOKIASV2_3395_ESMFold_hypothetical_protein	AF-Q9UIM3-F1-model_v4 FK506-binding protein-like	0.125	142	121	248	389	209	347	2.209E-01	102
LOKIASV2_3395_ESMFold_hypothetical_protein	AF-Q49AM3-F1-model_v4	LOKIASV2_3395_ESMFold_hypothetical_protein	AF-Q49AM3-F1-model_v4 Tetratricopeptide repeat protein 31	0.104	159	123	226	384	289	426	2.411E-01	102
LOKIASV2_3395_ESMFold_hypothetical_protein	AF-Q86DS1-F1-model_v4	LOKIASV2_3395_ESMFold_hypothetical_protein	AF-Q86DS1-F1-model_v4 Hsc70-interacting protein 2	0.124	159	118	231	389	119	254	2.411E-01	101
LOKIASV2_3395_ESMFold_hypothetical_protein	AF-Q863A4-F1-model_v4	LOKIASV2_3395_ESMFold_hypothetical_protein	AF-Q863A4-F1-model_v4 Dynein axonemal assembly factor 4	0.102	172	142	207	378	256	414	1.699E-01	101
LOKIASV2_3395_ESMFold_hypothetical_protein	AF-Q9HXT5-F1-model_v4	LOKIASV2_3395_ESMFold_hypothetical_protein	AF-Q9HXT5-F1-model_v4 Probable biofilm formation methyltransferase WspC	0.118	101	77	256	356	327	414	3.420E-01	101
LOKIASV2_3395_ESMFold_hypothetical_protein	AF-F1RBN2-F1-model_v4	LOKIASV2_3395_ESMFold_hypothetical_protein	AF-F1RBN2-F1-model_v4 Sperm-associated antigen 1A	0.087	272	214	152	386	155	426	2.480E-02	101
LOKIASV2_3395_ESMFold_hypothetical_protein	AF-A7E3N7-F1-model_v4	LOKIASV2_3395_ESMFold_hypothetical_protein	AF-A7E3N7-F1-model_v4 NADPH oxidase activator 1	0.123	156	136	220	375	14	169	9.209E-02	101
LOKIASV2_3395_ESMFold_hypothetical_protein	AF-Q9MUK5-F1-model_v4	LOKIASV2_3395_ESMFold_hypothetical_protein	AF-Q9MUK5-F1-model_v4 Translocon at the outer membrane of chloroplasts 64	0.121	173	131	203	375	441	590	1.146E-01	101
LOKIASV2_3395_ESMFold_hypothetical_protein	AF-Q8R3H9-F1-model_v4	LOKIASV2_3395_ESMFold_hypothetical_protein	AF-Q8R3H9-F1-model_v4 Tetratricopeptide repeat protein 4	0.114	176	148	222	389	38	213	6.780E-02	100
LOKIASV2_3395_ESMFold_hypothetical_protein	AF-Q863A7-F1-model_v4	LOKIASV2_3395_ESMFold_hypothetical_protein	AF-Q863A7-F1-model_v4 Dynein axonemal assembly factor 4	0.089	154	138	225	378	263	414	3.134E-01	100
LOKIASV2_3395_ESMFold_hypothetical_protein	AF-Q20144-F1-model_v4	LOKIASV2_3395_ESMFold_hypothetical_protein	AF-Q20144-F1-model_v4 Protein O-mannosyl-transferase TMTC1	0.106	221	193	165	381	467	687	6.490E-02	100
LOKIASV2_3395_ESMFold_hypothetical_protein	AF-Q9ULT0-F1-model_v4	LOKIASV2_3395_ESMFold_hypothetical_protein	AF-Q9ULT0-F1-model_v4 Tetratricopeptide repeat protein 7A	0.105	217	181	167	383	417	619	4.992E-02	100
LOKIASV2_3395_ESMFold_hypothetical_protein	AF-Q9M8Y0-F1-model_v4	LOKIASV2_3395_ESMFold_hypothetical_protein	AF-Q9M8Y0-F1-model_v4 Probable UDP-N-acetylglucosamine--peptide N-acetylglucosaminyltransferase SEC	0.098	221	195	167	383	260	480	6.213E-02	100
LOKIASV2_3395_ESMFold_hypothetical_protein	AF-Q9KB79-F1-model_v4	LOKIASV2_3395_ESMFold_hypothetical_protein	AF-Q9KB79-F1-model_v4 TPR repeat-containing protein BH2049	0.107	251	192	131	381	4	219	5.692E-02	99
LOKIASV2_3395_ESMFold_hypothetical_protein	AF-Q9HXJ2-F1-model_v4	LOKIASV2_3395_ESMFold_hypothetical_protein	AF-Q9HXJ2-F1-model_v4 Type IV pilus assembly protein PilF	0.145	268	203	123	390	1	239	1.404E-02	99
LOKIASV2_3395_ESMFold_hypothetical_protein	AF-Q9C566-F1-model_v4	LOKIASV2_3395_ESMFold_hypothetical_protein	AF-Q9C566-F1-model_v4 Peptidyl-prolyl cis-trans isomerase CYP40	0.104	155	136	235	389	205	357	1.854E-01	99
LOKIASV2_3395_ESMFold_hypothetical_protein	AF-Q8VD72-F1-model_v4	LOKIASV2_3395_ESMFold_hypothetical_protein	AF-Q8VD72-F1-model_v4 Tetratricopeptide repeat protein 8	0.133	208	156	181	388	275	455	6.780E-02	99
LOKIASV2_3395_ESMFold_hypothetical_protein	AF-Q1JQ97-F1-model_v4	LOKIASV2_3395_ESMFold_hypothetical_protein	AF-Q1JQ97-F1-model_v4 Bardet-Biedl syndrome 4 protein homolog	0.139	213	179	182	390	186	398	5.215E-02	99
LOKIASV2_3395_ESMFold_hypothetical_protein	AF-F4KCL7-F1-model_v4	LOKIASV2_3395_ESMFold_hypothetical_protein	AF-F4KCL7-F1-model_v4 Outer envelope protein 64, mitochondrial	0.131	190	129	186	375	452	601	9.621E-02	99
LOKIASV2_3395_ESMFold_hypothetical_protein	AF-Q9Y5Q9-F1-model_v4	LOKIASV2_3395_ESMFold_hypothetical_protein	AF-Q9Y5Q9-F1-model_v4 General transcription factor 3C polypeptide 3	0.115	213	184	165	373	218	430	6.780E-02	99
LOKIASV2_3395_ESMFold_hypothetical_protein	AF-Q8N394-F1-model_v4	LOKIASV2_3395_ESMFold_hypothetical_protein	AF-Q8N394-F1-model_v4 Protein O-mannosyl-transferase TMTC2	0.155	245	191	164	390	493	737	1.907E-02	98
LOKIASV2_3395_ESMFold_hypothetical_protein	AF-Q8BGB2-F1-model_v4	LOKIASV2_3395_ESMFold_hypothetical_protein	AF-Q8BGB2-F1-model_v4 Tetratricopeptide repeat protein 7A	0.094	217	183	167	383	418	620	4.779E-02	98
LOKIASV2_3395_ESMFold_hypothetical_protein	AF-Q54IP0-F1-model_v4	LOKIASV2_3395_ESMFold_hypothetical_protein	AF-Q54IP0-F1-model_v4 DnaJ homolog subfamily C member 7 homolog	0.138	276	222	105	380	99	357	2.082E-02	97
LOKIASV2_3395_ESMFold_hypothetical_protein	AF-Q8C1F5-F1-model_v4	LOKIASV2_3395_ESMFold_hypothetical_protein	AF-Q8C1F5-F1-model_v4 Tetratricopeptide repeat protein 16	0.135	242	189	148	389	2	221	5.692E-02	97
LOKIASV2_3395_ESMFold_hypothetical_protein	AF-Q54BW6-F1-model_v4	LOKIASV2_3395_ESMFold_hypothetical_protein	AF-Q54BW6-F1-model_v4 Tetratricopeptide repeat protein 27 homolog	0.141	209	147	165	373	500	671	7.084E-02	97
LOKIASV2_3395_ESMFold_hypothetical_protein	AF-Q32LM2-F1-model_v4	LOKIASV2_3395_ESMFold_hypothetical_protein	AF-Q32LM2-F1-model_v4 Small glutamine-rich tetratricopeptide repeat-containing protein alpha	0.090	130	106	249	378	91	207	8.570E-01	96
LOKIASV2_3395_ESMFold_hypothetical_protein	AF-Q96RK4-F1-model_v4	LOKIASV2_3395_ESMFold_hypothetical_protein	AF-Q96RK4-F1-model_v4 Bardet-Biedl syndrome 4 protein	0.152	213	176	182	390	186	398	6.780E-02	96
LOKIASV2_3395_ESMFold_hypothetical_protein	AF-O74711-F1-model_v4	LOKIASV2_3395_ESMFold_hypothetical_protein	AF-O74711-F1-model_v4 Peroxisomal targeting signal receptor	0.150	243	184	167	384	333	575	4.992E-02	96
LOKIASV2_3395_ESMFold_hypothetical_protein	AF-P41889-F1-model_v4	LOKIASV2_3395_ESMFold_hypothetical_protein	AF-P41889-F1-model_v4 Anaphase-promoting complex subunit cut9	0.118	242	204	152	383	328	569	8.077E-02	96
LOKIASV2_3395_ESMFold_hypothetical_protein	AF-Q8LGU6-F1-model_v4	LOKIASV2_3395_ESMFold_hypothetical_protein	AF-Q8LGU6-F1-model_v4 Cell division cycle protein 27 homolog B	0.133	223	190	167	386	487	709	5.449E-02	96
LOKIASV2_3395_ESMFold_hypothetical_protein	AF-Q9SUT5-F1-model_v4	LOKIASV2_3395_ESMFold_hypothetical_protein	AF-Q9SUT5-F1-model_v4 Protein SGT1 homolog B	0.102	135	110	249	383	2	125	6.592E-01	95
LOKIASV2_3395_ESMFold_hypothetical_protein	AF-Q9VF81-F1-model_v4	LOKIASV2_3395_ESMFold_hypothetical_protein	AF-Q9VF81-F1-model_v4 Protein O-mannosyl-transferase TMTC4	0.116	227	192	168	385	478	704	4.992E-02	95
LOKIASV2_3395_ESMFold_hypothetical_protein	AF-Q8IZP2-F1-model_v4	LOKIASV2_3395_ESMFold_hypothetical_protein	AF-Q8IZP2-F1-model_v4 Putative protein FAM10A4	0.112	159	119	231	389	103	237	3.900E-01	94
LOKIASV2_3395_ESMFold_hypothetical_protein	AF-O95801-F1-model_v4	LOKIASV2_3395_ESMFold_hypothetical_protein	AF-O95801-F1-model_v4 Tetratricopeptide repeat protein 4	0.113	158	122	232	389	76	213	1.557E-01	94
LOKIASV2_3395_ESMFold_hypothetical_protein	AF-A1Z6M6-F1-model_v4	LOKIASV2_3395_ESMFold_hypothetical_protein	AF-A1Z6M6-F1-model_v4 DNA polymerase interacting tetratricopeptide repeat-containing, protein of 47 kDa	0.126	173	130	217	389	71	220	1.307E-01	94
LOKIASV2_3395_ESMFold_hypothetical_protein	AF-P43016-F1-model_v4	LOKIASV2_3395_ESMFold_hypothetical_protein	AF-P43016-F1-model_v4 Transcriptional regulator HilA	0.114	258	212	136	393	230	469	3.368E-02	94
LOKIASV2_3395_ESMFold_hypothetical_protein	AF-P43015-F1-model_v4	LOKIASV2_3395_ESMFold_hypothetical_protein	AF-P43015-F1-model_v4 Transcriptional regulator HilA	0.124	258	209	136	393	230	469	2.954E-02	94
LOKIASV2_3395_ESMFold_hypothetical_protein	AF-P56558-F1-model_v4	LOKIASV2_3395_ESMFold_hypothetical_protein	AF-P56558-F1-model_v4 UDP-N-acetylglucosamine--peptide N-acetylglucosaminyltransferase 110 kDa subunit	0.122	220	189	163	378	214	433	1.097E-01	94
LOKIASV2_3395_ESMFold_hypothetical_protein	AF-Q8TAM2-F1-model_v4	LOKIASV2_3395_ESMFold_hypothetical_protein	AF-Q8TAM2-F1-model_v4 Tetratricopeptide repeat protein 8	0.134	208	156	181	388	301	481	1.050E-01	93
LOKIASV2_3395_ESMFold_hypothetical_protein	AF-Q86WT1-F1-model_v4	LOKIASV2_3395_ESMFold_hypothetical_protein	AF-Q86WT1-F1-model_v4 Tetratricopeptide repeat protein 30A	0.095	232	195	159	390	7	222	8.815E-02	93
LOKIASV2_3395_ESMFold_hypothetical_protein	AF-Q8BSY0-F1-model_v4	LOKIASV2_3395_ESMFold_hypothetical_protein	AF-Q8BSY0-F1-model_v4 Aspartyl/asparaginyl beta-hydroxylase	0.147	214	182	162	375	322	535	3.086E-02	93
LOKIASV2_3395_ESMFold_hypothetical_protein	AF-Q96301-F1-model_v4	LOKIASV2_3395_ESMFold_hypothetical_protein	AF-Q96301-F1-model_v4 Probable UDP-N-acetylglucosamine--peptide N-acetylglucosaminyltransferase SPINDLY	0.106	202	170	183	373	205	406	1.365E-01	93
LOKIASV2_3395_ESMFold_hypothetical_protein	AF-P33313-F1-model_v4	LOKIASV2_3395_ESMFold_hypothetical_protein	AF-P33313-F1-model_v4 Hsp70/Hsp90 co-chaperone CNS1	0.096	158	136	232	389	65	215	2.209E-01	92
LOKIASV2_3395_ESMFold_hypothetical_protein	AF-Q8C1Z7-F1-model_v4	LOKIASV2_3395_ESMFold_hypothetical_protein	AF-Q8C1Z7-F1-model_v4 Bardet-Biedl syndrome 4 protein homolog	0.147	213	177	182	390	186	398	1.050E-01	92
LOKIASV2_3395_ESMFold_hypothetical_protein	AF-P21296-F1-model_v4	LOKIASV2_3395_ESMFold_hypothetical_protein	AF-P21296-F1-model_v4 Protein FlbA	0.105	221	190	149	361	38	258	2.590E-02	92
LOKIASV2_3395_ESMFold_hypothetical_protein	AF-Q6BM14-F1-model_v4	LOKIASV2_3395_ESMFold_hypothetical_protein	AF-Q6BM14-F1-model_v4 Peroxisomal targeting signal receptor	0.131	245	189	167	384	342	586	4.574E-02	92
LOKIASV2_3395_ESMFold_hypothetical_protein	AF-P30260-F1-model_v4	LOKIASV2_3395_ESMFold_hypothetical_protein	AF-P30260-F1-model_v4 Cell division cycle protein 27 homolog	0.126	201	149	183	383	586	756	1.557E-01	92
LOKIASV2_3395_ESMFold_hypothetical_protein	AF-Q56A06-F1-model_v4	LOKIASV2_3395_ESMFold_hypothetical_protein	AF-Q56A06-F1-model_v4 Protein O-mannosyl-transferase TMTC2	0.149	248	195	164	393	493	740	3.224E-02	92
LOKIASV2_3395_ESMFold_hypothetical_protein	AF-Q6DCD5-F1-model_v4	LOKIASV2_3395_ESMFold_hypothetical_protein	AF-Q6DCD5-F1-model_v4 Protein O-mannosyl-transferase TMTC2	0.147	245	193	164	390	493	737	3.518E-02	92
LOKIASV2_3395_ESMFold_hypothetical_protein	AF-Q8CGY8-F1-model_v4	LOKIASV2_3395_ESMFold_hypothetical_protein	AF-Q8CGY8-F1-model_v4 UDP-N-acetylglucosamine--peptide N-acetylglucosaminyltransferase 110 kDa subunit	0.120	220	189	163	378	224	443	1.490E-01	92
LOKIASV2_3395_ESMFold_hypothetical_protein	AF-B0BN85-F1-model_v4	LOKIASV2_3395_ESMFold_hypothetical_protein	AF-B0BN85-F1-model_v4 Protein SGT1 homolog	0.107	121	96	258	378	20	127	1.066E+00	91
LOKIASV2_3395_ESMFold_hypothetical_protein	AF-Q5CZ52-F1-model_v4	LOKIASV2_3395_ESMFold_hypothetical_protein	AF-Q5CZ52-F1-model_v4 Bardet-Biedl syndrome 4 protein homolog	0.149	278	217	106	383	133	388	6.780E-02	91
LOKIASV2_3395_ESMFold_hypothetical_protein	AF-Q95LZ5-F1-model_v4	LOKIASV2_3395_ESMFold_hypothetical_protein	AF-Q95LZ5-F1-model_v4 Tetratricopeptide repeat protein 16	0.127	243	200	136	378	225	454	7.731E-02	91
LOKIASV2_3395_ESMFold_hypothetical_protein	AF-Q27HV0-F1-model_v4	LOKIASV2_3395_ESMFold_hypothetical_protein	AF-Q27HV0-F1-model_v4 UDP-N-acetylglucosamine--peptide N-acetylglucosaminyltransferase 110 kDa subunit	0.122	220	189	163	378	224	443	1.426E-01	91
LOKIASV2_3395_ESMFold_hypothetical_protein	AF-Q5EBF2-F1-model_v4	LOKIASV2_3395_ESMFold_hypothetical_protein	AF-Q5EBF2-F1-model_v4 Tetratricopeptide repeat protein 36	0.094	164	140	226	389	25	179	2.411E-01	90
LOKIASV2_3395_ESMFold_hypothetical_protein	AF-Q54NS3-F1-model_v4	LOKIASV2_3395_ESMFold_hypothetical_protein	AF-Q54NS3-F1-model_v4 TPR repeat-containing protein DDB_G0285095	0.100	199	158	180	378	69	245	1.251E-01	90
LOKIASV2_3395_ESMFold_hypothetical_protein	AF-P0CT30-F1-model_v4	LOKIASV2_3395_ESMFold_hypothetical_protein	AF-P0CT30-F1-model_v4 Small glutamine-rich tetratricopeptide repeat-containing protein 2	0.068	141	121	249	389	105	235	6.040E-01	90
LOKIASV2_3395_ESMFold_hypothetical_protein	AF-Q0JL44-F1-model_v4	LOKIASV2_3395_ESMFold_hypothetical_protein	AF-Q0JL44-F1-model_v4 Protein SGT1 homolog	0.082	132	110	249	380	6	126	1.114E+00	90
LOKIASV2_3395_ESMFold_hypothetical_protein	AF-P54389-F1-model_v4	LOKIASV2_3395_ESMFold_hypothetical_protein	AF-P54389-F1-model_v4 TPR repeat-containing protein YpiA	0.114	206	159	183	388	52	232	1.626E-01	90
LOKIASV2_3395_ESMFold_hypothetical_protein	AF-Q5PEB1-F1-model_v4	LOKIASV2_3395_ESMFold_hypothetical_protein	AF-Q5PEB1-F1-model_v4 Transcriptional regulator HilA	0.121	258	210	136	393	230	469	4.779E-02	90
LOKIASV2_3395_ESMFold_hypothetical_protein	AF-P35056-F1-model_v4	LOKIASV2_3395_ESMFold_hypothetical_protein	AF-P35056-F1-model_v4 Peroxisomal targeting signal receptor	0.146	247	180	183	394	366	612	4.191E-02	90
LOKIASV2_3395_ESMFold_hypothetical_protein	AF-O23052-F1-model_v4	LOKIASV2_3395_ESMFold_hypothetical_protein	AF-O23052-F1-model_v4 Uncharacterized TPR repeat-containing protein At1g05150	0.084	228	202	170	390	245	472	1.426E-01	90
LOKIASV2_3395_ESMFold_hypothetical_protein	AF-Q6PID6-F1-model_v4	LOKIASV2_3395_ESMFold_hypothetical_protein	AF-Q6PID6-F1-model_v4 Tetratricopeptide repeat protein 33	0.122	174	143	226	389	14	187	2.871E-01	89
LOKIASV2_3395_ESMFold_hypothetical_protein	AF-Q54MD1-F1-model_v4	LOKIASV2_3395_ESMFold_hypothetical_protein	AF-Q54MD1-F1-model_v4 Peroxisomal targeting signal 1 receptor	0.138	224	183	175	387	406	629	1.626E-01	89
LOKIASV2_3395_ESMFold_hypothetical_protein	AF-Q8BG19-F1-model_v4	LOKIASV2_3395_ESMFold_hypothetical_protein	AF-Q8BG19-F1-model_v4 Protein O-mannosyl-transferase TMTC4	0.105	227	199	162	384	514	740	1.146E-01	89
LOKIASV2_3395_ESMFold_hypothetical_protein	AF-A7Z061-F1-model_v4	LOKIASV2_3395_ESMFold_hypothetical_protein	AF-A7Z061-F1-model_v4 Cell division cycle protein 27 homolog	0.120	201	150	183	383	587	757	2.209E-01	89
LOKIASV2_3395_ESMFold_hypothetical_protein	AF-P81436-F1-model_v4	LOKIASV2_3395_ESMFold_hypothetical_protein	AF-P81436-F1-model_v4 UDP-N-acetylglucosamine--peptide N-acetylglucosaminyltransferase 110 kDa subunit	0.122	220	189	163	378	224	443	1.699E-01	89
LOKIASV2_3395_ESMFold_hypothetical_protein	AF-Q20683-F1-model_v4	LOKIASV2_3395_ESMFold_hypothetical_protein	AF-Q20683-F1-model_v4 Tetratricopeptide repeat protein 36	0.115	142	119	249	390	43	178	4.257E-01	88
LOKIASV2_3395_ESMFold_hypothetical_protein	AF-Q99614-F1-model_v4	LOKIASV2_3395_ESMFold_hypothetical_protein	AF-Q99614-F1-model_v4 Tetratricopeptide repeat protein 1	0.085	169	139	221	389	94	246	2.518E-01	88
LOKIASV2_3395_ESMFold_hypothetical_protein	AF-Q3ZBR5-F1-model_v4	LOKIASV2_3395_ESMFold_hypothetical_protein	AF-Q3ZBR5-F1-model_v4 Tetratricopeptide repeat protein 1	0.091	168	137	222	389	95	246	3.000E-01	88
LOKIASV2_3395_ESMFold_hypothetical_protein	AF-O70593-F1-model_v4	LOKIASV2_3395_ESMFold_hypothetical_protein	AF-O70593-F1-model_v4 Small glutamine-rich tetratricopeptide repeat-containing protein alpha	0.086	147	112	232	378	84	207	7.852E-01	88
LOKIASV2_3395_ESMFold_hypothetical_protein	AF-Q9XSH5-F1-model_v4	LOKIASV2_3395_ESMFold_hypothetical_protein	AF-Q9XSH5-F1-model_v4 Peptidyl-prolyl cis-trans isomerase FKBP5	0.146	142	120	249	389	268	409	6.592E-01	88
LOKIASV2_3395_ESMFold_hypothetical_protein	AF-Q02790-F1-model_v4	LOKIASV2_3395_ESMFold_hypothetical_protein	AF-Q02790-F1-model_v4 Peptidyl-prolyl cis-trans isomerase FKBP4	0.114	152	124	249	389	270	421	4.074E-01	88
LOKIASV2_3395_ESMFold_hypothetical_protein	AF-A8ITV9-F1-model_v4	LOKIASV2_3395_ESMFold_hypothetical_protein	AF-A8ITV9-F1-model_v4 Cilia- and flagella-associated protein 70	0.137	186	135	200	385	919	1075	1.937E-01	88
LOKIASV2_3395_ESMFold_hypothetical_protein	AF-Q6CE38-F1-model_v4	LOKIASV2_3395_ESMFold_hypothetical_protein	AF-Q6CE38-F1-model_v4 Clustered mitochondria protein homolog	0.111	247	205	158	389	889	1135	6.213E-02	88
LOKIASV2_3395_ESMFold_hypothetical_protein	AF-Q6PGP7-F1-model_v4	LOKIASV2_3395_ESMFold_hypothetical_protein	AF-Q6PGP7-F1-model_v4 Tetratricopeptide repeat protein 37	0.106	232	185	183	390	846	1077	9.209E-02	88
LOKIASV2_3395_ESMFold_hypothetical_protein	AF-Q46787-F1-model_v4	LOKIASV2_3395_ESMFold_hypothetical_protein	AF-Q46787-F1-model_v4 Uncharacterized protein YgeG	0.091	155	137	226	380	11	162	5.534E-01	87
LOKIASV2_3395_ESMFold_hypothetical_protein	AF-P50503-F1-model_v4	LOKIASV2_3395_ESMFold_hypothetical_protein	AF-P50503-F1-model_v4 Hsc70-interacting protein	0.102	141	117	249	389	113	243	6.887E-01	87
LOKIASV2_3395_ESMFold_hypothetical_protein	AF-Q99L47-F1-model_v4	LOKIASV2_3395_ESMFold_hypothetical_protein	AF-Q99L47-F1-model_v4 Hsc70-interacting protein	0.102	141	117	249	389	113	243	6.887E-01	87
LOKIASV2_3395_ESMFold_hypothetical_protein	AF-Q8VWG7-F1-model_v4	LOKIASV2_3395_ESMFold_hypothetical_protein	AF-Q8VWG7-F1-model_v4 TPR repeat-containing thioredoxin TDX	0.121	165	136	225	389	100	255	1.557E-01	87
LOKIASV2_3395_ESMFold_hypothetical_protein	AF-Q64378-F1-model_v4	LOKIASV2_3395_ESMFold_hypothetical_protein	AF-Q64378-F1-model_v4 Peptidyl-prolyl cis-trans isomerase FKBP5	0.132	144	122	249	389	268	411	6.592E-01	87
LOKIASV2_3395_ESMFold_hypothetical_protein	AF-Q9XSI2-F1-model_v4	LOKIASV2_3395_ESMFold_hypothetical_protein	AF-Q9XSI2-F1-model_v4 Peptidyl-prolyl cis-trans isomerase FKBP5	0.159	142	118	249	389	268	409	6.592E-01	87
