query	target	qheader	theader	fident	alnlen	mismatch	qstart	qend	tstart	tend	evalue	bits
LOKIASV2_1604_ESMFold_hypothetical_protein	AF-P59543-F1-model_v4	LOKIASV2_1604_ESMFold_hypothetical_protein	AF-P59543-F1-model_v4 Taste receptor type 2 member 20	0.109	289	212	1	239	2	290	2.016E-03	153
LOKIASV2_1604_ESMFold_hypothetical_protein	AF-Q645V4-F1-model_v4	LOKIASV2_1604_ESMFold_hypothetical_protein	AF-Q645V4-F1-model_v4 Taste receptor type 2 member 30	0.114	303	210	1	238	2	304	2.640E-03	145
LOKIASV2_1604_ESMFold_hypothetical_protein	AF-Q646A0-F1-model_v4	LOKIASV2_1604_ESMFold_hypothetical_protein	AF-Q646A0-F1-model_v4 Taste receptor type 2 member 20	0.109	279	209	4	239	12	290	1.928E-03	143
LOKIASV2_1604_ESMFold_hypothetical_protein	AF-Q646E3-F1-model_v4	LOKIASV2_1604_ESMFold_hypothetical_protein	AF-Q646E3-F1-model_v4 Taste receptor type 2 member 20	0.111	293	212	1	239	2	294	2.524E-03	143
LOKIASV2_1604_ESMFold_hypothetical_protein	AF-Q645T4-F1-model_v4	LOKIASV2_1604_ESMFold_hypothetical_protein	AF-Q645T4-F1-model_v4 Taste receptor type 2 member 46	0.110	292	212	1	239	2	293	4.527E-03	142
LOKIASV2_1604_ESMFold_hypothetical_protein	AF-Q9TX43-F1-model_v4	LOKIASV2_1604_ESMFold_hypothetical_protein	AF-Q9TX43-F1-model_v4 Cyclic AMP receptor 4	0.131	266	206	2	239	8	273	6.200E-03	139
LOKIASV2_1604_ESMFold_hypothetical_protein	AF-A0A2L0P0K0-F1-model_v4	LOKIASV2_1604_ESMFold_hypothetical_protein	AF-A0A2L0P0K0-F1-model_v4 Wortmanamides biosynthesis cluster protein C	0.126	271	206	2	238	8	278	7.095E-03	137
LOKIASV2_1604_ESMFold_hypothetical_protein	AF-Q646C1-F1-model_v4	LOKIASV2_1604_ESMFold_hypothetical_protein	AF-Q646C1-F1-model_v4 Taste receptor type 2 member 30	0.095	292	214	2	239	3	294	5.928E-03	136
LOKIASV2_1604_ESMFold_hypothetical_protein	AF-P59541-F1-model_v4	LOKIASV2_1604_ESMFold_hypothetical_protein	AF-P59541-F1-model_v4 Taste receptor type 2 member 30	0.111	303	211	1	238	2	304	5.180E-03	136
LOKIASV2_1604_ESMFold_hypothetical_protein	AF-Q7M723-F1-model_v4	LOKIASV2_1604_ESMFold_hypothetical_protein	AF-Q7M723-F1-model_v4 Taste receptor type 2 member 104	0.105	291	212	1	238	2	292	9.290E-03	135
LOKIASV2_1604_ESMFold_hypothetical_protein	AF-P0DSN6-F1-model_v4	LOKIASV2_1604_ESMFold_hypothetical_protein	AF-P0DSN6-F1-model_v4 Putative taste receptor type 2 member 33	0.128	283	205	4	239	12	294	5.928E-03	134
LOKIASV2_1604_ESMFold_hypothetical_protein	AF-D6VTK4-F1-model_v4	LOKIASV2_1604_ESMFold_hypothetical_protein	AF-D6VTK4-F1-model_v4 Pheromone alpha factor receptor	0.103	259	209	3	236	46	304	1.523E-02	133
LOKIASV2_1604_ESMFold_hypothetical_protein	AF-Q6C8U1-F1-model_v4	LOKIASV2_1604_ESMFold_hypothetical_protein	AF-Q6C8U1-F1-model_v4 Chitin synthase export chaperone	0.172	236	190	11	240	61	296	1.112E-02	131
LOKIASV2_1604_ESMFold_hypothetical_protein	AF-P28088-F1-model_v4	LOKIASV2_1604_ESMFold_hypothetical_protein	AF-P28088-F1-model_v4 Endothelin receptor type B	0.112	305	211	1	239	96	400	8.118E-03	131
LOKIASV2_1604_ESMFold_hypothetical_protein	AF-Q86V85-F1-model_v4	LOKIASV2_1604_ESMFold_hypothetical_protein	AF-Q86V85-F1-model_v4 Integral membrane protein GPR180	0.108	254	211	2	239	168	421	1.063E-02	130
LOKIASV2_1604_ESMFold_hypothetical_protein	AF-Q95NT6-F1-model_v4	LOKIASV2_1604_ESMFold_hypothetical_protein	AF-Q95NT6-F1-model_v4 G-protein coupled receptor Mth2	0.077	277	216	4	238	206	482	5.928E-03	130
LOKIASV2_1604_ESMFold_hypothetical_protein	AF-Q8K3J9-F1-model_v4	LOKIASV2_1604_ESMFold_hypothetical_protein	AF-Q8K3J9-F1-model_v4 G-protein coupled receptor family C group 5 member C	0.098	256	207	2	232	46	301	8.118E-03	128
LOKIASV2_1604_ESMFold_hypothetical_protein	AF-Q54LY7-F1-model_v4	LOKIASV2_1604_ESMFold_hypothetical_protein	AF-Q54LY7-F1-model_v4 Cyclic AMP receptor-like protein E	0.127	304	202	3	234	1	304	1.163E-02	127
LOKIASV2_1604_ESMFold_hypothetical_protein	AF-Q7M721-F1-model_v4	LOKIASV2_1604_ESMFold_hypothetical_protein	AF-Q7M721-F1-model_v4 Taste receptor type 2 member 120	0.085	293	218	1	239	1	293	2.181E-02	126
LOKIASV2_1604_ESMFold_hypothetical_protein	AF-Q9NYW4-F1-model_v4	LOKIASV2_1604_ESMFold_hypothetical_protein	AF-Q9NYW4-F1-model_v4 Taste receptor type 2 member 5	0.109	288	211	2	239	3	290	1.456E-02	126
LOKIASV2_1604_ESMFold_hypothetical_protein	AF-Q646E2-F1-model_v4	LOKIASV2_1604_ESMFold_hypothetical_protein	AF-Q646E2-F1-model_v4 Taste receptor type 2 member 30	0.098	290	212	4	239	5	294	1.063E-02	126
LOKIASV2_1604_ESMFold_hypothetical_protein	AF-Q76LL8-F1-model_v4	LOKIASV2_1604_ESMFold_hypothetical_protein	AF-Q76LL8-F1-model_v4 Corticotropin-releasing factor receptor 1	0.096	264	212	4	239	115	378	1.593E-02	126
LOKIASV2_1604_ESMFold_hypothetical_protein	AF-Q8BPS4-F1-model_v4	LOKIASV2_1604_ESMFold_hypothetical_protein	AF-Q8BPS4-F1-model_v4 Integral membrane protein GPR180	0.133	254	205	2	239	169	422	7.095E-03	126
LOKIASV2_1604_ESMFold_hypothetical_protein	AF-Q95NQ0-F1-model_v4	LOKIASV2_1604_ESMFold_hypothetical_protein	AF-Q95NQ0-F1-model_v4 G-protein coupled receptor Mth2	0.084	277	214	4	238	206	482	1.666E-02	125
LOKIASV2_1604_ESMFold_hypothetical_protein	AF-Q646G0-F1-model_v4	LOKIASV2_1604_ESMFold_hypothetical_protein	AF-Q646G0-F1-model_v4 Taste receptor type 2 member 46	0.111	292	211	2	239	3	294	1.742E-02	124
LOKIASV2_1604_ESMFold_hypothetical_protein	AF-Q5AA40-F1-model_v4	LOKIASV2_1604_ESMFold_hypothetical_protein	AF-Q5AA40-F1-model_v4 Chitin synthase export chaperone	0.167	234	194	1	234	51	284	1.994E-02	124
LOKIASV2_1604_ESMFold_hypothetical_protein	AF-Q15743-F1-model_v4	LOKIASV2_1604_ESMFold_hypothetical_protein	AF-Q15743-F1-model_v4 Ovarian cancer G-protein coupled receptor 1	0.120	292	209	2	239	22	313	1.331E-02	124
LOKIASV2_1604_ESMFold_hypothetical_protein	AF-Q9NZD1-F1-model_v4	LOKIASV2_1604_ESMFold_hypothetical_protein	AF-Q9NZD1-F1-model_v4 G-protein coupled receptor family C group 5 member D	0.092	254	215	1	238	19	272	8.881E-03	123
LOKIASV2_1604_ESMFold_hypothetical_protein	AF-Q3UG61-F1-model_v4	LOKIASV2_1604_ESMFold_hypothetical_protein	AF-Q3UG61-F1-model_v4 Mas-related G-protein coupled receptor member B1	0.107	259	209	4	238	45	303	1.112E-02	122
LOKIASV2_1604_ESMFold_hypothetical_protein	AF-Q8BFQ3-F1-model_v4	LOKIASV2_1604_ESMFold_hypothetical_protein	AF-Q8BFQ3-F1-model_v4 Ovarian cancer G-protein coupled receptor 1	0.116	294	209	3	239	20	313	1.272E-02	122
LOKIASV2_1604_ESMFold_hypothetical_protein	AF-P0CI39-F1-model_v4	LOKIASV2_1604_ESMFold_hypothetical_protein	AF-P0CI39-F1-model_v4 Pheromone alpha factor receptor	0.110	257	206	3	234	46	302	3.740E-02	122
LOKIASV2_1604_ESMFold_hypothetical_protein	AF-Q646E4-F1-model_v4	LOKIASV2_1604_ESMFold_hypothetical_protein	AF-Q646E4-F1-model_v4 Taste receptor type 2 member 50	0.099	279	212	4	239	12	290	7.762E-03	121
LOKIASV2_1604_ESMFold_hypothetical_protein	AF-Q645V3-F1-model_v4	LOKIASV2_1604_ESMFold_hypothetical_protein	AF-Q645V3-F1-model_v4 Taste receptor type 2 member 31	0.104	293	213	1	239	2	294	1.823E-02	121
LOKIASV2_1604_ESMFold_hypothetical_protein	AF-P0DTE0-F1-model_v4	LOKIASV2_1604_ESMFold_hypothetical_protein	AF-P0DTE0-F1-model_v4 Putative taste receptor type 2 member 36	0.102	283	211	4	239	12	294	1.742E-02	120
LOKIASV2_1604_ESMFold_hypothetical_protein	AF-Q6YNI2-F1-model_v4	LOKIASV2_1604_ESMFold_hypothetical_protein	AF-Q6YNI2-F1-model_v4 G-protein coupled receptor 6	0.133	273	206	1	239	73	345	1.163E-02	120
LOKIASV2_1604_ESMFold_hypothetical_protein	AF-Q8SQA4-F1-model_v4	LOKIASV2_1604_ESMFold_hypothetical_protein	AF-Q8SQA4-F1-model_v4 Adhesion G protein-coupled receptor E5	0.111	260	212	1	240	441	700	1.523E-02	119
LOKIASV2_1604_ESMFold_hypothetical_protein	AF-P59540-F1-model_v4	LOKIASV2_1604_ESMFold_hypothetical_protein	AF-P59540-F1-model_v4 Taste receptor type 2 member 46	0.104	283	211	4	239	12	294	1.906E-02	118
LOKIASV2_1604_ESMFold_hypothetical_protein	AF-Q646D2-F1-model_v4	LOKIASV2_1604_ESMFold_hypothetical_protein	AF-Q646D2-F1-model_v4 Taste receptor type 2 member 3	0.134	297	206	1	239	1	297	1.456E-02	118
LOKIASV2_1604_ESMFold_hypothetical_protein	AF-P13773-F1-model_v4	LOKIASV2_1604_ESMFold_hypothetical_protein	AF-P13773-F1-model_v4 Cyclic AMP receptor 1	0.121	262	208	2	239	11	272	3.419E-02	118
LOKIASV2_1604_ESMFold_hypothetical_protein	AF-Q3KRC4-F1-model_v4	LOKIASV2_1604_ESMFold_hypothetical_protein	AF-Q3KRC4-F1-model_v4 G-protein coupled receptor family C group 5 member C	0.093	257	211	2	235	46	302	1.994E-02	117
LOKIASV2_1604_ESMFold_hypothetical_protein	AF-Q86SQ3-F1-model_v4	LOKIASV2_1604_ESMFold_hypothetical_protein	AF-Q86SQ3-F1-model_v4 Putative adhesion G protein-coupled receptor E4P	0.125	265	208	1	239	186	450	1.456E-02	117
LOKIASV2_1604_ESMFold_hypothetical_protein	AF-O28812-F1-model_v4	LOKIASV2_1604_ESMFold_hypothetical_protein	AF-O28812-F1-model_v4 Uncharacterized protein AF_1460	0.133	227	185	1	227	12	225	3.125E-02	116
LOKIASV2_1604_ESMFold_hypothetical_protein	AF-Q5IS73-F1-model_v4	LOKIASV2_1604_ESMFold_hypothetical_protein	AF-Q5IS73-F1-model_v4 Cannabinoid receptor 1	0.094	301	216	1	239	112	412	3.268E-02	116
LOKIASV2_1604_ESMFold_hypothetical_protein	AF-Q333S9-F1-model_v4	LOKIASV2_1604_ESMFold_hypothetical_protein	AF-Q333S9-F1-model_v4 Cannabinoid receptor 1	0.089	297	217	1	239	104	400	2.386E-02	115
LOKIASV2_1604_ESMFold_hypothetical_protein	AF-Q09204-F1-model_v4	LOKIASV2_1604_ESMFold_hypothetical_protein	AF-Q09204-F1-model_v4 Serpentine receptor class alpha-2	0.133	288	204	2	237	17	304	2.181E-02	114
LOKIASV2_1604_ESMFold_hypothetical_protein	AF-Q9HBW0-F1-model_v4	LOKIASV2_1604_ESMFold_hypothetical_protein	AF-Q9HBW0-F1-model_v4 Lysophosphatidic acid receptor 2	0.104	282	213	1	239	28	309	2.496E-02	114
LOKIASV2_1604_ESMFold_hypothetical_protein	AF-Q8C206-F1-model_v4	LOKIASV2_1604_ESMFold_hypothetical_protein	AF-Q8C206-F1-model_v4 G-protein coupled receptor 157	0.119	283	208	1	237	11	293	4.897E-02	113
LOKIASV2_1604_ESMFold_hypothetical_protein	AF-Q9PUI7-F1-model_v4	LOKIASV2_1604_ESMFold_hypothetical_protein	AF-Q9PUI7-F1-model_v4 Cannabinoid receptor 1	0.102	297	214	1	239	114	410	1.994E-02	112
LOKIASV2_1604_ESMFold_hypothetical_protein	AF-Q91ZC4-F1-model_v4	LOKIASV2_1604_ESMFold_hypothetical_protein	AF-Q91ZC4-F1-model_v4 Mas-related G-protein coupled receptor member A8	0.112	245	197	4	226	16	260	2.856E-02	111
LOKIASV2_1604_ESMFold_hypothetical_protein	AF-Q645Z7-F1-model_v4	LOKIASV2_1604_ESMFold_hypothetical_protein	AF-Q645Z7-F1-model_v4 Taste receptor type 2 member 46	0.100	283	212	4	239	12	294	3.576E-02	111
LOKIASV2_1604_ESMFold_hypothetical_protein	AF-Q5J3K5-F1-model_v4	LOKIASV2_1604_ESMFold_hypothetical_protein	AF-Q5J3K5-F1-model_v4 Vomeronasal type-1 receptor 102	0.115	294	210	2	239	37	330	6.707E-02	111
LOKIASV2_1604_ESMFold_hypothetical_protein	AF-O02777-F1-model_v4	LOKIASV2_1604_ESMFold_hypothetical_protein	AF-O02777-F1-model_v4 Cannabinoid receptor 1	0.092	301	216	1	239	112	412	3.268E-02	111
LOKIASV2_1604_ESMFold_hypothetical_protein	AF-Q8VBS7-F1-model_v4	LOKIASV2_1604_ESMFold_hypothetical_protein	AF-Q8VBS7-F1-model_v4 Vomeronasal type-1 receptor 42	0.100	313	215	1	240	17	329	6.707E-02	110
LOKIASV2_1604_ESMFold_hypothetical_protein	AF-Q9JKT2-F1-model_v4	LOKIASV2_1604_ESMFold_hypothetical_protein	AF-Q9JKT2-F1-model_v4 Taste receptor type 2 member 119	0.099	288	214	1	239	2	289	3.576E-02	110
LOKIASV2_1604_ESMFold_hypothetical_protein	AF-P41588-F1-model_v4	LOKIASV2_1604_ESMFold_hypothetical_protein	AF-P41588-F1-model_v4 Vasoactive intestinal polypeptide receptor 2	0.136	269	203	4	239	121	389	1.742E-02	110
LOKIASV2_1604_ESMFold_hypothetical_protein	AF-Q9NQ84-F1-model_v4	LOKIASV2_1604_ESMFold_hypothetical_protein	AF-Q9NQ84-F1-model_v4 G-protein coupled receptor family C group 5 member C	0.089	257	212	2	235	47	303	2.731E-02	110
LOKIASV2_1604_ESMFold_hypothetical_protein	AF-Q5Y4Y9-F1-model_v4	LOKIASV2_1604_ESMFold_hypothetical_protein	AF-Q5Y4Y9-F1-model_v4 Taste receptor type 2 member 64	0.116	283	208	4	239	12	294	2.386E-02	109
LOKIASV2_1604_ESMFold_hypothetical_protein	AF-Q646F9-F1-model_v4	LOKIASV2_1604_ESMFold_hypothetical_protein	AF-Q646F9-F1-model_v4 Taste receptor type 2 member 31	0.094	293	216	1	239	2	294	7.675E-02	109
LOKIASV2_1604_ESMFold_hypothetical_protein	AF-Q9DDK4-F1-model_v4	LOKIASV2_1604_ESMFold_hypothetical_protein	AF-Q9DDK4-F1-model_v4 Sphingosine 1-phosphate receptor 1	0.131	282	206	1	238	24	305	3.125E-02	109
LOKIASV2_1604_ESMFold_hypothetical_protein	AF-P21554-F1-model_v4	LOKIASV2_1604_ESMFold_hypothetical_protein	AF-P21554-F1-model_v4 Cannabinoid receptor 1	0.097	301	215	1	239	112	412	4.682E-02	109
LOKIASV2_1604_ESMFold_hypothetical_protein	AF-Q67ET3-F1-model_v4	LOKIASV2_1604_ESMFold_hypothetical_protein	AF-Q67ET3-F1-model_v4 Taste receptor type 2 member 120	0.132	290	207	1	239	1	290	3.576E-02	108
LOKIASV2_1604_ESMFold_hypothetical_protein	AF-Q646C3-F1-model_v4	LOKIASV2_1604_ESMFold_hypothetical_protein	AF-Q646C3-F1-model_v4 Taste receptor type 2 member 50	0.104	283	211	4	239	12	294	2.988E-02	108
LOKIASV2_1604_ESMFold_hypothetical_protein	AF-Q91ZC5-F1-model_v4	LOKIASV2_1604_ESMFold_hypothetical_protein	AF-Q91ZC5-F1-model_v4 Mas-related G-protein coupled receptor member A7	0.116	252	199	1	226	9	260	4.280E-02	108
LOKIASV2_1604_ESMFold_hypothetical_protein	AF-Q864J3-F1-model_v4	LOKIASV2_1604_ESMFold_hypothetical_protein	AF-Q864J3-F1-model_v4 Melanocyte-stimulating hormone receptor	0.116	276	210	1	239	38	313	1.523E-02	108
LOKIASV2_1604_ESMFold_hypothetical_protein	AF-O46685-F1-model_v4	LOKIASV2_1604_ESMFold_hypothetical_protein	AF-O46685-F1-model_v4 Ovarian cancer G-protein coupled receptor 1	0.118	280	206	3	237	20	299	4.682E-02	108
LOKIASV2_1604_ESMFold_hypothetical_protein	AF-P51651-F1-model_v4	LOKIASV2_1604_ESMFold_hypothetical_protein	AF-P51651-F1-model_v4 G-protein coupled receptor 6	0.144	273	204	1	239	73	345	2.496E-02	108
LOKIASV2_1604_ESMFold_hypothetical_protein	AF-Q7Z601-F1-model_v4	LOKIASV2_1604_ESMFold_hypothetical_protein	AF-Q7Z601-F1-model_v4 Probable G-protein coupled receptor 142	0.063	279	223	1	239	150	428	1.823E-02	108
LOKIASV2_1604_ESMFold_hypothetical_protein	AF-Q801M1-F1-model_v4	LOKIASV2_1604_ESMFold_hypothetical_protein	AF-Q801M1-F1-model_v4 Cannabinoid receptor 1	0.105	297	213	1	239	112	408	2.386E-02	108
LOKIASV2_1604_ESMFold_hypothetical_protein	AF-Q645V7-F1-model_v4	LOKIASV2_1604_ESMFold_hypothetical_protein	AF-Q645V7-F1-model_v4 Taste receptor type 2 member 50	0.114	283	208	4	239	12	294	3.419E-02	107
LOKIASV2_1604_ESMFold_hypothetical_protein	AF-Q5Y4Y8-F1-model_v4	LOKIASV2_1604_ESMFold_hypothetical_protein	AF-Q5Y4Y8-F1-model_v4 Taste receptor type 2 member 66	0.094	283	213	4	239	12	294	2.611E-02	107
LOKIASV2_1604_ESMFold_hypothetical_protein	AF-Q91ZC1-F1-model_v4	LOKIASV2_1604_ESMFold_hypothetical_protein	AF-Q91ZC1-F1-model_v4 Mas-related G-protein coupled receptor member B3	0.144	265	201	4	239	30	294	3.268E-02	107
LOKIASV2_1604_ESMFold_hypothetical_protein	AF-Q9TT23-F1-model_v4	LOKIASV2_1604_ESMFold_hypothetical_protein	AF-Q9TT23-F1-model_v4 Melanocortin receptor 5	0.136	275	206	1	239	36	310	2.086E-02	107
LOKIASV2_1604_ESMFold_hypothetical_protein	AF-Q98895-F1-model_v4	LOKIASV2_1604_ESMFold_hypothetical_protein	AF-Q98895-F1-model_v4 Cannabinoid receptor type 1B	0.120	297	209	1	239	109	405	3.576E-02	107
LOKIASV2_1604_ESMFold_hypothetical_protein	AF-Q9W0R5-F1-model_v4	LOKIASV2_1604_ESMFold_hypothetical_protein	AF-Q9W0R5-F1-model_v4 Probable G-protein coupled receptor Mth-like 10	0.088	287	213	4	238	245	531	3.740E-02	107
LOKIASV2_1604_ESMFold_hypothetical_protein	AF-Q645Z9-F1-model_v4	LOKIASV2_1604_ESMFold_hypothetical_protein	AF-Q645Z9-F1-model_v4 Taste receptor type 2 member 19	0.101	283	211	4	239	12	294	3.912E-02	106
LOKIASV2_1604_ESMFold_hypothetical_protein	AF-Q646G2-F1-model_v4	LOKIASV2_1604_ESMFold_hypothetical_protein	AF-Q646G2-F1-model_v4 Taste receptor type 2 member 50	0.104	283	211	4	239	12	294	4.476E-02	106
LOKIASV2_1604_ESMFold_hypothetical_protein	AF-P47936-F1-model_v4	LOKIASV2_1604_ESMFold_hypothetical_protein	AF-P47936-F1-model_v4 Cannabinoid receptor 2	0.093	286	216	1	239	29	314	5.358E-02	106
LOKIASV2_1604_ESMFold_hypothetical_protein	AF-F4K2U8-F1-model_v4	LOKIASV2_1604_ESMFold_hypothetical_protein	AF-F4K2U8-F1-model_v4 Protein CANDIDATE G-PROTEIN COUPLED RECEPTOR 8	0.110	242	209	4	239	37	278	2.086E-02	105
LOKIASV2_1604_ESMFold_hypothetical_protein	AF-Q6BUS8-F1-model_v4	LOKIASV2_1604_ESMFold_hypothetical_protein	AF-Q6BUS8-F1-model_v4 Chitin synthase export chaperone	0.158	228	187	8	235	55	277	5.358E-02	105
LOKIASV2_1604_ESMFold_hypothetical_protein	AF-Q9JIL6-F1-model_v4	LOKIASV2_1604_ESMFold_hypothetical_protein	AF-Q9JIL6-F1-model_v4 G-protein coupled receptor family C group 5 member D	0.124	254	208	1	238	19	272	3.125E-02	105
LOKIASV2_1604_ESMFold_hypothetical_protein	AF-Q646F8-F1-model_v4	LOKIASV2_1604_ESMFold_hypothetical_protein	AF-Q646F8-F1-model_v4 Taste receptor type 2 member 43	0.097	282	212	4	239	12	293	4.476E-02	104
LOKIASV2_1604_ESMFold_hypothetical_protein	AF-Q91WW2-F1-model_v4	LOKIASV2_1604_ESMFold_hypothetical_protein	AF-Q91WW2-F1-model_v4 Mas-related G-protein coupled receptor member A4	0.125	252	197	1	226	17	268	4.092E-02	104
LOKIASV2_1604_ESMFold_hypothetical_protein	AF-Q645U1-F1-model_v4	LOKIASV2_1604_ESMFold_hypothetical_protein	AF-Q645U1-F1-model_v4 Taste receptor type 2 member 16	0.088	278	213	4	238	13	290	2.496E-02	103
LOKIASV2_1604_ESMFold_hypothetical_protein	AF-Q645T0-F1-model_v4	LOKIASV2_1604_ESMFold_hypothetical_protein	AF-Q645T0-F1-model_v4 Taste receptor type 2 member 9	0.121	284	207	4	239	12	295	3.419E-02	103
LOKIASV2_1604_ESMFold_hypothetical_protein	AF-Q8K1Q3-F1-model_v4	LOKIASV2_1604_ESMFold_hypothetical_protein	AF-Q8K1Q3-F1-model_v4 G-protein coupled receptor 3	0.120	271	208	1	237	39	309	2.496E-02	103
LOKIASV2_1604_ESMFold_hypothetical_protein	AF-Q862A9-F1-model_v4	LOKIASV2_1604_ESMFold_hypothetical_protein	AF-Q862A9-F1-model_v4 G-protein coupled bile acid receptor 1	0.099	285	210	4	237	17	301	4.897E-02	103
LOKIASV2_1604_ESMFold_hypothetical_protein	AF-Q5UAW9-F1-model_v4	LOKIASV2_1604_ESMFold_hypothetical_protein	AF-Q5UAW9-F1-model_v4 G-protein coupled receptor 157	0.100	282	212	1	237	11	292	1.316E-01	103
LOKIASV2_1604_ESMFold_hypothetical_protein	AF-P0CM73-F1-model_v4	LOKIASV2_1604_ESMFold_hypothetical_protein	AF-P0CM73-F1-model_v4 Chitin synthase export chaperone	0.146	231	192	8	238	54	279	1.005E-01	103
LOKIASV2_1604_ESMFold_hypothetical_protein	AF-Q2YDG0-F1-model_v4	LOKIASV2_1604_ESMFold_hypothetical_protein	AF-Q2YDG0-F1-model_v4 G-protein coupled receptor family C group 5 member C	0.088	258	212	2	235	47	304	4.280E-02	103
LOKIASV2_1604_ESMFold_hypothetical_protein	AF-Q71SP5-F1-model_v4	LOKIASV2_1604_ESMFold_hypothetical_protein	AF-Q71SP5-F1-model_v4 Cannabinoid receptor 1	0.097	301	215	1	239	112	412	4.280E-02	103
LOKIASV2_1604_ESMFold_hypothetical_protein	AF-P20272-F1-model_v4	LOKIASV2_1604_ESMFold_hypothetical_protein	AF-P20272-F1-model_v4 Cannabinoid receptor 1	0.087	300	216	1	238	113	412	3.740E-02	103
LOKIASV2_1604_ESMFold_hypothetical_protein	AF-Q7TN49-F1-model_v4	LOKIASV2_1604_ESMFold_hypothetical_protein	AF-Q7TN49-F1-model_v4 Mas-related G-protein coupled receptor member A	0.104	253	200	1	224	9	261	8.027E-02	102
LOKIASV2_1604_ESMFold_hypothetical_protein	AF-Q7TQA8-F1-model_v4	LOKIASV2_1604_ESMFold_hypothetical_protein	AF-Q7TQA8-F1-model_v4 Taste receptor type 2 member 136	0.126	276	205	4	239	12	287	2.386E-02	102
LOKIASV2_1604_ESMFold_hypothetical_protein	AF-Q5Y4Z8-F1-model_v4	LOKIASV2_1604_ESMFold_hypothetical_protein	AF-Q5Y4Z8-F1-model_v4 Taste receptor type 2 member 45	0.087	283	215	4	239	12	294	3.419E-02	102
LOKIASV2_1604_ESMFold_hypothetical_protein	AF-P59537-F1-model_v4	LOKIASV2_1604_ESMFold_hypothetical_protein	AF-P59537-F1-model_v4 Taste receptor type 2 member 43	0.096	285	214	2	239	10	294	5.358E-02	102
LOKIASV2_1604_ESMFold_hypothetical_protein	AF-Q8R2E6-F1-model_v4	LOKIASV2_1604_ESMFold_hypothetical_protein	AF-Q8R2E6-F1-model_v4 Vomeronasal type-1 receptor A11	0.089	302	207	1	228	17	318	1.099E-01	102
LOKIASV2_1604_ESMFold_hypothetical_protein	AF-G5ECD9-F1-model_v4	LOKIASV2_1604_ESMFold_hypothetical_protein	AF-G5ECD9-F1-model_v4 G-protein coupled receptor aex-2	0.125	258	205	1	235	19	276	3.419E-02	102
LOKIASV2_1604_ESMFold_hypothetical_protein	AF-P46095-F1-model_v4	LOKIASV2_1604_ESMFold_hypothetical_protein	AF-P46095-F1-model_v4 G-protein coupled receptor 6	0.145	271	200	1	235	72	342	1.906E-02	102
LOKIASV2_1604_ESMFold_hypothetical_protein	AF-Q62850-F1-model_v4	LOKIASV2_1604_ESMFold_hypothetical_protein	AF-Q62850-F1-model_v4 Vomeronasal type-1 receptor 105	0.095	290	214	2	238	15	304	6.131E-02	101
LOKIASV2_1604_ESMFold_hypothetical_protein	AF-Q1DKX4-F1-model_v4	LOKIASV2_1604_ESMFold_hypothetical_protein	AF-Q1DKX4-F1-model_v4 Chitin synthase export chaperone	0.137	228	191	8	235	53	274	8.027E-02	101
LOKIASV2_1604_ESMFold_hypothetical_protein	AF-Q0UDX8-F1-model_v4	LOKIASV2_1604_ESMFold_hypothetical_protein	AF-Q0UDX8-F1-model_v4 Chitin synthase export chaperone	0.135	230	196	8	237	53	280	1.203E-01	101
LOKIASV2_1604_ESMFold_hypothetical_protein	AF-O62772-F1-model_v4	LOKIASV2_1604_ESMFold_hypothetical_protein	AF-O62772-F1-model_v4 Corticotropin-releasing factor receptor 1	0.099	266	214	2	239	113	378	1.099E-01	101
LOKIASV2_1604_ESMFold_hypothetical_protein	AF-P32082-F1-model_v4	LOKIASV2_1604_ESMFold_hypothetical_protein	AF-P32082-F1-model_v4 Growth hormone-releasing hormone receptor	0.101	265	213	2	239	127	391	5.861E-02	101
LOKIASV2_1604_ESMFold_hypothetical_protein	AF-Q9W0R6-F1-model_v4	LOKIASV2_1604_ESMFold_hypothetical_protein	AF-Q9W0R6-F1-model_v4 Probable G-protein coupled receptor Mth-like 9	0.115	268	206	1	234	204	471	1.150E-01	101
LOKIASV2_1604_ESMFold_hypothetical_protein	AF-Q864J2-F1-model_v4	LOKIASV2_1604_ESMFold_hypothetical_protein	AF-Q864J2-F1-model_v4 Melanocyte-stimulating hormone receptor	0.116	276	210	1	239	38	313	3.419E-02	100
LOKIASV2_1604_ESMFold_hypothetical_protein	AF-Q684M3-F1-model_v4	LOKIASV2_1604_ESMFold_hypothetical_protein	AF-Q684M3-F1-model_v4 Sphingosine 1-phosphate receptor 5	0.108	281	209	1	235	36	316	8.782E-02	100
LOKIASV2_1604_ESMFold_hypothetical_protein	AF-P56971-F1-model_v4	LOKIASV2_1604_ESMFold_hypothetical_protein	AF-P56971-F1-model_v4 Cannabinoid receptor 1	0.112	301	211	1	239	114	414	5.861E-02	100
LOKIASV2_1604_ESMFold_hypothetical_protein	AF-P59544-F1-model_v4	LOKIASV2_1604_ESMFold_hypothetical_protein	AF-P59544-F1-model_v4 Taste receptor type 2 member 50	0.105	279	210	4	239	12	290	4.280E-02	99
LOKIASV2_1604_ESMFold_hypothetical_protein	AF-Q646E1-F1-model_v4	LOKIASV2_1604_ESMFold_hypothetical_protein	AF-Q646E1-F1-model_v4 Taste receptor type 2 member 46	0.103	286	210	5	239	9	294	6.707E-02	99
LOKIASV2_1604_ESMFold_hypothetical_protein	AF-O13780-F1-model_v4	LOKIASV2_1604_ESMFold_hypothetical_protein	AF-O13780-F1-model_v4 Uncharacterized protein C17G6.02c	0.100	257	201	9	232	13	269	3.125E-02	99
LOKIASV2_1604_ESMFold_hypothetical_protein	AF-Q67ES7-F1-model_v4	LOKIASV2_1604_ESMFold_hypothetical_protein	AF-Q67ES7-F1-model_v4 Taste receptor type 2 member 134	0.105	282	209	5	239	34	315	3.740E-02	99
LOKIASV2_1604_ESMFold_hypothetical_protein	AF-O45300-F1-model_v4	LOKIASV2_1604_ESMFold_hypothetical_protein	AF-O45300-F1-model_v4 Serpentine receptor class epsilon-13	0.139	271	201	5	239	30	300	5.358E-02	99
LOKIASV2_1604_ESMFold_hypothetical_protein	AF-P41586-F1-model_v4	LOKIASV2_1604_ESMFold_hypothetical_protein	AF-P41586-F1-model_v4 Pituitary adenylate cyclase-activating polypeptide type I receptor	0.118	269	209	2	239	147	415	8.396E-02	99
LOKIASV2_1604_ESMFold_hypothetical_protein	AF-P59538-F1-model_v4	LOKIASV2_1604_ESMFold_hypothetical_protein	AF-P59538-F1-model_v4 Taste receptor type 2 member 31	0.093	285	215	2	239	10	294	1.203E-01	98
LOKIASV2_1604_ESMFold_hypothetical_protein	AF-Q5Y4Z2-F1-model_v4	LOKIASV2_1604_ESMFold_hypothetical_protein	AF-Q5Y4Z2-F1-model_v4 Taste receptor type 2 member 42	0.113	297	211	1	239	3	299	6.707E-02	98
LOKIASV2_1604_ESMFold_hypothetical_protein	AF-Q8BX79-F1-model_v4	LOKIASV2_1604_ESMFold_hypothetical_protein	AF-Q8BX79-F1-model_v4 Probable G-protein coupled receptor 21	0.126	288	205	4	239	31	318	7.675E-02	98
LOKIASV2_1604_ESMFold_hypothetical_protein	AF-Q90812-F1-model_v4	LOKIASV2_1604_ESMFold_hypothetical_protein	AF-Q90812-F1-model_v4 Corticotropin-releasing factor receptor 1	0.104	264	211	4	239	120	383	1.316E-01	98
LOKIASV2_1604_ESMFold_hypothetical_protein	AF-P83120-F1-model_v4	LOKIASV2_1604_ESMFold_hypothetical_protein	AF-P83120-F1-model_v4 G-protein coupled receptor Mth	0.121	270	202	9	239	219	488	6.131E-02	98
LOKIASV2_1604_ESMFold_hypothetical_protein	AF-P59539-F1-model_v4	LOKIASV2_1604_ESMFold_hypothetical_protein	AF-P59539-F1-model_v4 Taste receptor type 2 member 45	0.087	286	214	5	239	9	294	8.027E-02	97
LOKIASV2_1604_ESMFold_hypothetical_protein	AF-Q645T3-F1-model_v4	LOKIASV2_1604_ESMFold_hypothetical_protein	AF-Q645T3-F1-model_v4 Taste receptor type 2 member 43	0.100	285	211	5	239	9	293	9.608E-02	97
LOKIASV2_1604_ESMFold_hypothetical_protein	AF-Q5YCW8-F1-model_v4	LOKIASV2_1604_ESMFold_hypothetical_protein	AF-Q5YCW8-F1-model_v4 Chitin synthase export chaperone	0.123	230	199	8	237	55	282	2.157E-01	97
LOKIASV2_1604_ESMFold_hypothetical_protein	AF-Q99679-F1-model_v4	LOKIASV2_1604_ESMFold_hypothetical_protein	AF-Q99679-F1-model_v4 Probable G-protein coupled receptor 21	0.108	288	210	4	239	31	318	6.412E-02	97
LOKIASV2_1604_ESMFold_hypothetical_protein	AF-Q1ZXB0-F1-model_v4	LOKIASV2_1604_ESMFold_hypothetical_protein	AF-Q1ZXB0-F1-model_v4 Frizzled/smoothened-like sans CRD protein F	0.083	291	212	2	233	91	381	3.740E-02	97
LOKIASV2_1604_ESMFold_hypothetical_protein	AF-P47746-F1-model_v4	LOKIASV2_1604_ESMFold_hypothetical_protein	AF-P47746-F1-model_v4 Cannabinoid receptor 1	0.101	300	213	1	238	113	412	8.396E-02	97
LOKIASV2_1604_ESMFold_hypothetical_protein	AF-Q49HI0-F1-model_v4	LOKIASV2_1604_ESMFold_hypothetical_protein	AF-Q49HI0-F1-model_v4 Taste receptor type 1 member 2	0.085	249	210	1	230	561	809	1.258E-01	97
