query	target	qheader	theader	fident	alnlen	mismatch	qstart	qend	tstart	tend	evalue	bits
LOKIASV2_0201_ESMFold_hypothetical_protein	AF-Q09346-F1-model_v4	LOKIASV2_0201_ESMFold_hypothetical_protein	AF-Q09346-F1-model_v4 Guanine nucleotide exchange protein smcr-8	0.151	182	130	2	155	26	207	2.693E-06	172
LOKIASV2_0201_ESMFold_hypothetical_protein	AF-Q4FZX0-F1-model_v4	LOKIASV2_0201_ESMFold_hypothetical_protein	AF-Q4FZX0-F1-model_v4 DENN domain-containing protein 11	0.125	123	106	4	125	60	182	2.038E-03	118
LOKIASV2_0201_ESMFold_hypothetical_protein	AF-Q5E9U9-F1-model_v4	LOKIASV2_0201_ESMFold_hypothetical_protein	AF-Q5E9U9-F1-model_v4 GATOR complex protein NPRL2	0.126	330	280	4	333	9	329	1.472E-05	112
LOKIASV2_0201_ESMFold_hypothetical_protein	AF-Q9WUE4-F1-model_v4	LOKIASV2_0201_ESMFold_hypothetical_protein	AF-Q9WUE4-F1-model_v4 GATOR complex protein NPRL2	0.126	330	280	4	333	9	329	5.188E-05	103
LOKIASV2_0201_ESMFold_hypothetical_protein	AF-Q8WTW4-F1-model_v4	LOKIASV2_0201_ESMFold_hypothetical_protein	AF-Q8WTW4-F1-model_v4 GATOR complex protein NPRL2	0.127	325	269	4	328	9	317	1.001E-04	102
LOKIASV2_0201_ESMFold_hypothetical_protein	AF-O42857-F1-model_v4	LOKIASV2_0201_ESMFold_hypothetical_protein	AF-O42857-F1-model_v4 Nitrogen permease regulator 2 homolog	0.098	324	288	4	323	21	344	1.832E-05	100
LOKIASV2_0201_ESMFold_hypothetical_protein	AF-O42907-F1-model_v4	LOKIASV2_0201_ESMFold_hypothetical_protein	AF-O42907-F1-model_v4 Uncharacterized protein C119.16c	0.136	175	141	4	167	5	179	9.996E-04	95
LOKIASV2_0201_ESMFold_hypothetical_protein	AF-Q3UHG7-F1-model_v4	LOKIASV2_0201_ESMFold_hypothetical_protein	AF-Q3UHG7-F1-model_v4 DENN domain-containing protein 11	0.120	363	284	4	327	79	441	1.639E-04	75
LOKIASV2_0201_ESMFold_hypothetical_protein	AF-A4D1U4-F1-model_v4	LOKIASV2_0201_ESMFold_hypothetical_protein	AF-A4D1U4-F1-model_v4 DENN domain-containing protein 11	0.115	363	286	4	327	79	441	1.117E-04	75
LOKIASV2_0201_ESMFold_hypothetical_protein	AF-Q0PGW2-F1-model_v4	LOKIASV2_0201_ESMFold_hypothetical_protein	AF-Q0PGW2-F1-model_v4 DENN domain-containing protein 11	0.123	363	283	4	327	79	441	1.469E-04	72
LOKIASV2_0201_ESMFold_hypothetical_protein	AF-Q9STP2-F1-model_v4	LOKIASV2_0201_ESMFold_hypothetical_protein	AF-Q9STP2-F1-model_v4 Phytolongin Phyl2.1	0.102	146	106	4	149	10	128	2.146E-01	59
LOKIASV2_0201_ESMFold_hypothetical_protein	AF-Q1LX49-F1-model_v4	LOKIASV2_0201_ESMFold_hypothetical_protein	AF-Q1LX49-F1-model_v4 DENN domain-containing protein 11	0.112	364	287	4	327	113	476	2.152E-03	58
LOKIASV2_0201_ESMFold_hypothetical_protein	AF-Q8BLS7-F1-model_v4	LOKIASV2_0201_ESMFold_hypothetical_protein	AF-Q8BLS7-F1-model_v4 Ankyrin repeat domain-containing protein SOWAHA	0.144	142	110	289	430	19	147	1.239E+00	38
LOKIASV2_0201_ESMFold_hypothetical_protein	AF-Q2M3V2-F1-model_v4	LOKIASV2_0201_ESMFold_hypothetical_protein	AF-Q2M3V2-F1-model_v4 Ankyrin repeat domain-containing protein SOWAHA	0.152	147	123	289	434	17	163	2.028E+00	34
LOKIASV2_0201_ESMFold_hypothetical_protein	AF-Q8TB45-F1-model_v4	LOKIASV2_0201_ESMFold_hypothetical_protein	AF-Q8TB45-F1-model_v4 DEP domain-containing mTOR-interacting protein	0.135	275	226	158	432	26	287	7.565E-01	33
LOKIASV2_0201_ESMFold_hypothetical_protein	AF-Q570Y9-F1-model_v4	LOKIASV2_0201_ESMFold_hypothetical_protein	AF-Q570Y9-F1-model_v4 DEP domain-containing mTOR-interacting protein	0.110	283	246	160	436	24	306	3.513E-01	32
LOKIASV2_0201_ESMFold_hypothetical_protein	AF-Q2NL05-F1-model_v4	LOKIASV2_0201_ESMFold_hypothetical_protein	AF-Q2NL05-F1-model_v4 Kinesin-like protein KIF2A	0.144	157	118	324	480	5	143	1.382E+00	31
LOKIASV2_0201_ESMFold_hypothetical_protein	AF-Q03YU3-F1-model_v4	LOKIASV2_0201_ESMFold_hypothetical_protein	AF-Q03YU3-F1-model_v4 Probable DNA-directed RNA polymerase subunit delta	0.100	162	144	278	438	16	177	2.028E+00	30
LOKIASV2_0201_ESMFold_hypothetical_protein	AF-O89047-F1-model_v4	LOKIASV2_0201_ESMFold_hypothetical_protein	AF-O89047-F1-model_v4 Potassium voltage-gated channel subfamily H member 3	0.111	105	69	2	80	26	130	2.976E+00	30
LOKIASV2_0201_ESMFold_hypothetical_protein	AF-O35261-F1-model_v4	LOKIASV2_0201_ESMFold_hypothetical_protein	AF-O35261-F1-model_v4 Transcription factor E2F3	0.124	285	215	155	439	167	412	3.920E-01	28
LOKIASV2_0201_ESMFold_hypothetical_protein	AF-Q6GEU7-F1-model_v4	LOKIASV2_0201_ESMFold_hypothetical_protein	AF-Q6GEU7-F1-model_v4 Probable DNA-directed RNA polymerase subunit delta	0.108	171	146	266	430	3	173	3.320E+00	27
LOKIASV2_0201_ESMFold_hypothetical_protein	AF-Q21341-F1-model_v4	LOKIASV2_0201_ESMFold_hypothetical_protein	AF-Q21341-F1-model_v4 Protein let-99	0.126	186	160	247	430	2	187	7.565E-01	26
LOKIASV2_0201_ESMFold_hypothetical_protein	AF-O00716-F1-model_v4	LOKIASV2_0201_ESMFold_hypothetical_protein	AF-O00716-F1-model_v4 Transcription factor E2F3	0.130	285	213	155	439	175	420	8.441E-01	24
LOKIASV2_0201_ESMFold_hypothetical_protein	AF-D3YXK1-F1-model_v4	LOKIASV2_0201_ESMFold_hypothetical_protein	AF-D3YXK1-F1-model_v4 Atherin	0.131	156	134	286	441	33	187	7.978E+00	24
LOKIASV2_0201_ESMFold_hypothetical_protein	AF-P55265-F1-model_v4	LOKIASV2_0201_ESMFold_hypothetical_protein	AF-P55265-F1-model_v4 Double-stranded RNA-specific adenosine deaminase	0.118	189	130	251	439	127	274	4.613E+00	24
LOKIASV2_0201_ESMFold_hypothetical_protein	AF-Q92615-F1-model_v4	LOKIASV2_0201_ESMFold_hypothetical_protein	AF-Q92615-F1-model_v4 La-related protein 4B	0.104	285	235	155	439	151	413	2.142E+00	23
LOKIASV2_0201_ESMFold_hypothetical_protein	AF-Q22XZ3-F1-model_v4	LOKIASV2_0201_ESMFold_hypothetical_protein	AF-Q22XZ3-F1-model_v4 Alpha-tubulin N-acetyltransferase	0.118	159	125	319	477	150	292	7.552E+00	21
LOKIASV2_0201_ESMFold_hypothetical_protein	AF-C7GWZ2-F1-model_v4	LOKIASV2_0201_ESMFold_hypothetical_protein	AF-C7GWZ2-F1-model_v4 Pheromone-processing carboxypeptidase KEX1	0.162	155	127	315	469	476	628	3.705E+00	21
LOKIASV2_0201_ESMFold_hypothetical_protein	AF-O74889-F1-model_v4	LOKIASV2_0201_ESMFold_hypothetical_protein	AF-O74889-F1-model_v4 SAC3 family protein 1	0.123	325	275	109	433	224	538	1.173E+00	21
LOKIASV2_0201_ESMFold_hypothetical_protein	AF-Q55D16-F1-model_v4	LOKIASV2_0201_ESMFold_hypothetical_protein	AF-Q55D16-F1-model_v4 KIN17-like protein	0.096	376	264	102	477	12	304	3.507E+00	20
LOKIASV2_0201_ESMFold_hypothetical_protein	AF-Q01543-F1-model_v4	LOKIASV2_0201_ESMFold_hypothetical_protein	AF-Q01543-F1-model_v4 Friend leukemia integration 1 transcription factor	0.146	126	94	314	439	332	442	4.613E+00	20
LOKIASV2_0201_ESMFold_hypothetical_protein	AF-Q8TD91-F1-model_v4	LOKIASV2_0201_ESMFold_hypothetical_protein	AF-Q8TD91-F1-model_v4 Melanoma-associated antigen C3	0.142	279	176	156	434	175	380	2.976E+00	20
LOKIASV2_0201_ESMFold_hypothetical_protein	AF-Q9WV63-F1-model_v4	LOKIASV2_0201_ESMFold_hypothetical_protein	AF-Q9WV63-F1-model_v4 Kinesin-like protein KIF2A	0.142	157	134	324	480	32	188	7.978E+00	20
LOKIASV2_0201_ESMFold_hypothetical_protein	AF-Q6A0A2-F1-model_v4	LOKIASV2_0201_ESMFold_hypothetical_protein	AF-Q6A0A2-F1-model_v4 La-related protein 4B	0.112	277	232	154	430	153	414	2.667E+00	20
LOKIASV2_0201_ESMFold_hypothetical_protein	AF-Q9Y2K5-F1-model_v4	LOKIASV2_0201_ESMFold_hypothetical_protein	AF-Q9Y2K5-F1-model_v4 R3H domain-containing protein 2	0.120	191	163	245	430	145	335	3.320E+00	20
LOKIASV2_0201_ESMFold_hypothetical_protein	AF-Q8NCM2-F1-model_v4	LOKIASV2_0201_ESMFold_hypothetical_protein	AF-Q8NCM2-F1-model_v4 Potassium voltage-gated channel subfamily H member 5	0.110	327	281	2	328	25	341	9.418E-01	20
LOKIASV2_0201_ESMFold_hypothetical_protein	AF-A1A5G4-F1-model_v4	LOKIASV2_0201_ESMFold_hypothetical_protein	AF-A1A5G4-F1-model_v4 Membrane-associated guanylate kinase, WW and PDZ domain-containing protein 3	0.157	135	105	318	452	161	286	5.743E+00	20
LOKIASV2_0201_ESMFold_hypothetical_protein	AF-Q9Z7T1-F1-model_v4	LOKIASV2_0201_ESMFold_hypothetical_protein	AF-Q9Z7T1-F1-model_v4 Uncharacterized protein CPn_0623/CP_0124/CPj0623/CpB0649	0.129	153	118	330	482	49	184	6.066E+00	19
LOKIASV2_0201_ESMFold_hypothetical_protein	AF-Q6BXL9-F1-model_v4	LOKIASV2_0201_ESMFold_hypothetical_protein	AF-Q6BXL9-F1-model_v4 Mediator of RNA polymerase II transcription subunit 18	0.114	105	71	27	107	218	322	4.872E+00	19
LOKIASV2_0201_ESMFold_hypothetical_protein	AF-F4KDN0-F1-model_v4	LOKIASV2_0201_ESMFold_hypothetical_protein	AF-F4KDN0-F1-model_v4 KH domain-containing protein HEN4	0.069	301	270	182	482	52	342	2.263E+00	19
LOKIASV2_0201_ESMFold_hypothetical_protein	AF-A1K7B9-F1-model_v4	LOKIASV2_0201_ESMFold_hypothetical_protein	AF-A1K7B9-F1-model_v4 Translation initiation factor IF-2	0.100	245	218	234	476	2	246	2.817E+00	19
LOKIASV2_0201_ESMFold_hypothetical_protein	AF-Q7RZK7-F1-model_v4	LOKIASV2_0201_ESMFold_hypothetical_protein	AF-Q7RZK7-F1-model_v4 Protein AF-9 homolog	0.113	172	149	310	478	129	300	8.902E+00	18
LOKIASV2_0201_ESMFold_hypothetical_protein	AF-E3SXU5-F1-model_v4	LOKIASV2_0201_ESMFold_hypothetical_protein	AF-E3SXU5-F1-model_v4 Truncated basic helix-loop-helix protein A	0.108	216	176	245	442	56	271	3.705E+00	18
LOKIASV2_0201_ESMFold_hypothetical_protein	AF-C8Z852-F1-model_v4	LOKIASV2_0201_ESMFold_hypothetical_protein	AF-C8Z852-F1-model_v4 Pheromone-processing carboxypeptidase KEX1	0.156	155	128	315	469	476	628	5.743E+00	18
LOKIASV2_0201_ESMFold_hypothetical_protein	AF-Q6P1V4-F1-model_v4	LOKIASV2_0201_ESMFold_hypothetical_protein	AF-Q6P1V4-F1-model_v4 Eukaryotic translation initiation factor 3 subunit C	0.148	245	190	238	482	74	297	3.705E+00	18
LOKIASV2_0201_ESMFold_hypothetical_protein	AF-Q4A0X4-F1-model_v4	LOKIASV2_0201_ESMFold_hypothetical_protein	AF-Q4A0X4-F1-model_v4 Probable transglycosylase SceD 2	0.126	141	114	309	439	32	172	7.978E+00	17
LOKIASV2_0201_ESMFold_hypothetical_protein	AF-Q73SA8-F1-model_v4	LOKIASV2_0201_ESMFold_hypothetical_protein	AF-Q73SA8-F1-model_v4 30S ribosomal protein S3	0.161	100	79	330	429	186	280	6.066E+00	17
LOKIASV2_0201_ESMFold_hypothetical_protein	AF-A1UBP2-F1-model_v4	LOKIASV2_0201_ESMFold_hypothetical_protein	AF-A1UBP2-F1-model_v4 30S ribosomal protein S3	0.123	102	87	330	429	186	287	9.932E+00	17
LOKIASV2_0201_ESMFold_hypothetical_protein	AF-Q9PJN7-F1-model_v4	LOKIASV2_0201_ESMFold_hypothetical_protein	AF-Q9PJN7-F1-model_v4 Uncharacterized protein TC_0791	0.101	137	122	330	466	49	185	7.978E+00	17
LOKIASV2_0201_ESMFold_hypothetical_protein	AF-Q8L719-F1-model_v4	LOKIASV2_0201_ESMFold_hypothetical_protein	AF-Q8L719-F1-model_v4 THO complex subunit 4B	0.129	147	111	321	467	162	290	6.408E+00	17
LOKIASV2_0201_ESMFold_hypothetical_protein	AF-P26323-F1-model_v4	LOKIASV2_0201_ESMFold_hypothetical_protein	AF-P26323-F1-model_v4 Friend leukemia integration 1 transcription factor	0.153	126	93	314	439	332	442	9.403E+00	17
LOKIASV2_0201_ESMFold_hypothetical_protein	AF-Q652B0-F1-model_v4	LOKIASV2_0201_ESMFold_hypothetical_protein	AF-Q652B0-F1-model_v4 Heat stress transcription factor B-2c	0.175	237	191	247	478	15	251	7.150E+00	17
LOKIASV2_0201_ESMFold_hypothetical_protein	AF-Q4KMZ1-F1-model_v4	LOKIASV2_0201_ESMFold_hypothetical_protein	AF-Q4KMZ1-F1-model_v4 IQ domain-containing protein C	0.140	186	142	289	474	20	185	7.552E+00	17
LOKIASV2_0201_ESMFold_hypothetical_protein	AF-Q9UUD0-F1-model_v4	LOKIASV2_0201_ESMFold_hypothetical_protein	AF-Q9UUD0-F1-model_v4 Uncharacterized protein C19C2.10	0.107	349	252	84	432	23	305	1.460E+00	17
LOKIASV2_0201_ESMFold_hypothetical_protein	AF-G3XA57-F1-model_v4	LOKIASV2_0201_ESMFold_hypothetical_protein	AF-G3XA57-F1-model_v4 Rab11 family-interacting protein 2	0.128	118	100	318	433	105	222	5.147E+00	17
LOKIASV2_0201_ESMFold_hypothetical_protein	AF-Q3JQ88-F1-model_v4	LOKIASV2_0201_ESMFold_hypothetical_protein	AF-Q3JQ88-F1-model_v4 UvrABC system protein C	0.088	185	154	273	442	196	380	6.769E+00	17
LOKIASV2_0201_ESMFold_hypothetical_protein	AF-O22315-F1-model_v4	LOKIASV2_0201_ESMFold_hypothetical_protein	AF-O22315-F1-model_v4 Serine/arginine-rich-splicing factor SR34	0.119	116	96	319	434	167	276	7.978E+00	16
LOKIASV2_0201_ESMFold_hypothetical_protein	AF-Q7ZX20-F1-model_v4	LOKIASV2_0201_ESMFold_hypothetical_protein	AF-Q7ZX20-F1-model_v4 E3 ubiquitin-protein ligase rnf8-A	0.137	349	280	84	432	210	535	3.320E+00	16
LOKIASV2_0201_ESMFold_hypothetical_protein	AF-Q5RFT7-F1-model_v4	LOKIASV2_0201_ESMFold_hypothetical_protein	AF-Q5RFT7-F1-model_v4 RNA-binding protein 12B	0.122	236	184	199	434	358	568	2.263E+00	16
LOKIASV2_0201_ESMFold_hypothetical_protein	AF-Q92540-F1-model_v4	LOKIASV2_0201_ESMFold_hypothetical_protein	AF-Q92540-F1-model_v4 Protein SMG7	0.114	343	277	90	432	273	586	1.721E+00	16
LOKIASV2_0201_ESMFold_hypothetical_protein	AF-O60225-F1-model_v4	LOKIASV2_0201_ESMFold_hypothetical_protein	AF-O60225-F1-model_v4 Protein SSX5	0.145	160	123	286	445	19	163	8.902E+00	15
LOKIASV2_0201_ESMFold_hypothetical_protein	AF-Q50H33-F1-model_v4	LOKIASV2_0201_ESMFold_hypothetical_protein	AF-Q50H33-F1-model_v4 BTB/POZ domain-containing protein KCTD8	0.123	122	103	317	434	279	400	7.150E+00	15
LOKIASV2_0201_ESMFold_hypothetical_protein	AF-A5PLL1-F1-model_v4	LOKIASV2_0201_ESMFold_hypothetical_protein	AF-A5PLL1-F1-model_v4 Ankyrin repeat domain-containing protein 34B	0.166	164	133	270	430	84	247	4.367E+00	15
LOKIASV2_0201_ESMFold_hypothetical_protein	AF-A1YEQ3-F1-model_v4	LOKIASV2_0201_ESMFold_hypothetical_protein	AF-A1YEQ3-F1-model_v4 Zinc finger protein 449	0.115	225	190	240	464	7	222	2.525E+00	15
LOKIASV2_0201_ESMFold_hypothetical_protein	AF-Q81A26-F1-model_v4	LOKIASV2_0201_ESMFold_hypothetical_protein	AF-Q81A26-F1-model_v4 DNA mismatch repair protein MutL	0.081	285	176	276	468	162	446	9.403E+00	15
LOKIASV2_0201_ESMFold_hypothetical_protein	AF-Q8J0U2-F1-model_v4	LOKIASV2_0201_ESMFold_hypothetical_protein	AF-Q8J0U2-F1-model_v4 Histone H1	0.139	175	120	258	432	40	179	8.902E+00	14
LOKIASV2_0201_ESMFold_hypothetical_protein	AF-P70333-F1-model_v4	LOKIASV2_0201_ESMFold_hypothetical_protein	AF-P70333-F1-model_v4 Heterogeneous nuclear ribonucleoprotein H2	0.091	249	196	199	447	62	278	5.147E+00	14
LOKIASV2_0201_ESMFold_hypothetical_protein	AF-Q02203-F1-model_v4	LOKIASV2_0201_ESMFold_hypothetical_protein	AF-Q02203-F1-model_v4 Uncharacterized protein YKR005C	0.146	162	111	309	439	105	266	7.552E+00	14
LOKIASV2_0201_ESMFold_hypothetical_protein	AF-B9IV58-F1-model_v4	LOKIASV2_0201_ESMFold_hypothetical_protein	AF-B9IV58-F1-model_v4 DNA mismatch repair protein MutL	0.090	285	175	276	468	162	446	7.552E+00	14
LOKIASV2_0201_ESMFold_hypothetical_protein	AF-Q03601-F1-model_v4	LOKIASV2_0201_ESMFold_hypothetical_protein	AF-Q03601-F1-model_v4 RING finger protein nhl-1	0.116	456	380	27	482	113	543	5.147E+00	14
LOKIASV2_0201_ESMFold_hypothetical_protein	AF-Q9JK71-F1-model_v4	LOKIASV2_0201_ESMFold_hypothetical_protein	AF-Q9JK71-F1-model_v4 Membrane-associated guanylate kinase, WW and PDZ domain-containing protein 3	0.136	158	135	279	435	128	285	8.902E+00	14
LOKIASV2_0201_ESMFold_hypothetical_protein	AF-Q5E9J1-F1-model_v4	LOKIASV2_0201_ESMFold_hypothetical_protein	AF-Q5E9J1-F1-model_v4 Heterogeneous nuclear ribonucleoprotein F	0.086	250	201	199	448	62	282	7.552E+00	13
LOKIASV2_0201_ESMFold_hypothetical_protein	AF-Q794E4-F1-model_v4	LOKIASV2_0201_ESMFold_hypothetical_protein	AF-Q794E4-F1-model_v4 Heterogeneous nuclear ribonucleoprotein F	0.095	248	195	199	446	62	278	6.769E+00	13
LOKIASV2_0201_ESMFold_hypothetical_protein	AF-Q8I480-F1-model_v4	LOKIASV2_0201_ESMFold_hypothetical_protein	AF-Q8I480-F1-model_v4 RING finger protein PFE0100w	0.123	396	296	83	478	578	915	9.403E+00	13
LOKIASV2_0201_ESMFold_hypothetical_protein	AF-Q8LST2-F1-model_v4	LOKIASV2_0201_ESMFold_hypothetical_protein	AF-Q8LST2-F1-model_v4 Probable serine/threonine-protein kinase WNK7	0.081	345	221	236	476	197	541	7.552E+00	12
LOKIASV2_0201_ESMFold_hypothetical_protein	AF-Q66JV4-F1-model_v4	LOKIASV2_0201_ESMFold_hypothetical_protein	AF-Q66JV4-F1-model_v4 RNA-binding protein 12B-B	0.121	236	164	199	434	357	544	8.427E+00	12
LOKIASV2_0201_ESMFold_hypothetical_protein	AF-Q5RJH6-F1-model_v4	LOKIASV2_0201_ESMFold_hypothetical_protein	AF-Q5RJH6-F1-model_v4 Protein SMG7	0.113	345	276	90	434	273	584	5.437E+00	12
LOKIASV2_0201_ESMFold_hypothetical_protein	AF-Q6FSJ9-F1-model_v4	LOKIASV2_0201_ESMFold_hypothetical_protein	AF-Q6FSJ9-F1-model_v4 Autophagy-related protein 13	0.090	219	187	225	430	112	330	9.932E+00	10
LOKIASV2_0201_ESMFold_hypothetical_protein	AF-Q9VJJ7-F1-model_v4	LOKIASV2_0201_ESMFold_hypothetical_protein	AF-Q9VJJ7-F1-model_v4 Transient receptor potential-gamma protein	0.120	332	277	105	436	597	912	7.552E+00	10
