query	target	qheader	theader	fident	alnlen	mismatch	qstart	qend	tstart	tend	evalue	bits
LOKIASV2_0664_ESMFold_hypothetical_protein	AF-Q9HNM7-F1-model_v4	LOKIASV2_0664_ESMFold_hypothetical_protein	AF-Q9HNM7-F1-model_v4 NH(3)-dependent NAD(+) synthetase	0.136	44	35	39	79	218	261	7.379E+00	34
LOKIASV2_0664_ESMFold_hypothetical_protein	AF-Q6P4K6-F1-model_v4	LOKIASV2_0664_ESMFold_hypothetical_protein	AF-Q6P4K6-F1-model_v4 Serine/threonine-protein kinase 11-interacting protein	0.191	82	57	106	176	616	697	9.215E-01	34
LOKIASV2_0664_ESMFold_hypothetical_protein	AF-Q95YM8-F1-model_v4	LOKIASV2_0664_ESMFold_hypothetical_protein	AF-Q95YM8-F1-model_v4 Mushroom body large-type Kenyon cell-specific protein 1	0.275	57	38	40	96	595	648	4.033E+00	34
LOKIASV2_0664_ESMFold_hypothetical_protein	AF-P03052-F1-model_v4	LOKIASV2_0664_ESMFold_hypothetical_protein	AF-P03052-F1-model_v4 TrfB transcriptional repressor protein	0.175	99	76	35	127	3	101	1.289E+00	33
LOKIASV2_0664_ESMFold_hypothetical_protein	AF-Q5L0Q0-F1-model_v4	LOKIASV2_0664_ESMFold_hypothetical_protein	AF-Q5L0Q0-F1-model_v4 UPF0122 protein GK1195	0.163	86	68	37	122	19	100	6.033E+00	33
LOKIASV2_0664_ESMFold_hypothetical_protein	AF-Q88WJ7-F1-model_v4	LOKIASV2_0664_ESMFold_hypothetical_protein	AF-Q88WJ7-F1-model_v4 UPF0122 protein lp_1634	0.135	93	76	37	129	20	108	5.275E+00	33
LOKIASV2_0664_ESMFold_hypothetical_protein	AF-P0CF45-F1-model_v4	LOKIASV2_0664_ESMFold_hypothetical_protein	AF-P0CF45-F1-model_v4 Transposase InsC for insertion element IS2K	0.078	51	46	41	91	18	68	9.024E+00	33
LOKIASV2_0664_ESMFold_hypothetical_protein	AF-P0CF50-F1-model_v4	LOKIASV2_0664_ESMFold_hypothetical_protein	AF-P0CF50-F1-model_v4 Transposase InsC for insertion element IS2-11	0.078	51	46	41	91	18	68	9.650E+00	33
LOKIASV2_0664_ESMFold_hypothetical_protein	AF-W0TAA4-F1-model_v4	LOKIASV2_0664_ESMFold_hypothetical_protein	AF-W0TAA4-F1-model_v4 Autophagy-related protein 29	0.101	78	68	40	116	36	113	3.084E+00	33
LOKIASV2_0664_ESMFold_hypothetical_protein	AF-P60046-F1-model_v4	LOKIASV2_0664_ESMFold_hypothetical_protein	AF-P60046-F1-model_v4 Insertion element IS150 uncharacterized 19.7 kDa protein	0.102	87	75	40	126	67	150	2.884E+00	33
LOKIASV2_0664_ESMFold_hypothetical_protein	AF-P10038-F1-model_v4	LOKIASV2_0664_ESMFold_hypothetical_protein	AF-P10038-F1-model_v4 Homeobox protein mab-5	0.155	75	60	36	107	124	198	1.576E+00	33
LOKIASV2_0664_ESMFold_hypothetical_protein	AF-P43697-F1-model_v4	LOKIASV2_0664_ESMFold_hypothetical_protein	AF-P43697-F1-model_v4 Homeobox protein Nkx-2.2	0.126	71	57	39	104	138	208	2.205E+00	33
LOKIASV2_0664_ESMFold_hypothetical_protein	AF-A3DP41-F1-model_v4	LOKIASV2_0664_ESMFold_hypothetical_protein	AF-A3DP41-F1-model_v4 NH(3)-dependent NAD(+) synthetase	0.175	57	43	44	100	218	270	1.378E+00	33
LOKIASV2_0664_ESMFold_hypothetical_protein	AF-Q91907-F1-model_v4	LOKIASV2_0664_ESMFold_hypothetical_protein	AF-Q91907-F1-model_v4 Homeobox protein GBX-2	0.096	93	75	36	119	246	338	2.884E+00	33
LOKIASV2_0664_ESMFold_hypothetical_protein	AF-Q8X854-F1-model_v4	LOKIASV2_0664_ESMFold_hypothetical_protein	AF-Q8X854-F1-model_v4 Anaerobic nitric oxide reductase transcription regulator NorR	0.089	65	55	12	76	440	500	3.772E+00	33
LOKIASV2_0664_ESMFold_hypothetical_protein	AF-Q6YRL3-F1-model_v4	LOKIASV2_0664_ESMFold_hypothetical_protein	AF-Q6YRL3-F1-model_v4 Chromosomal replication initiator protein DnaA	0.088	45	36	39	83	447	487	9.024E+00	33
LOKIASV2_0664_ESMFold_hypothetical_protein	AF-P44580-F1-model_v4	LOKIASV2_0664_ESMFold_hypothetical_protein	AF-P44580-F1-model_v4 Uncharacterized HTH-type transcriptional regulator HI_0224	0.156	63	43	19	81	13	64	5.275E+00	32
LOKIASV2_0664_ESMFold_hypothetical_protein	AF-P56179-F1-model_v4	LOKIASV2_0664_ESMFold_hypothetical_protein	AF-P56179-F1-model_v4 Homeobox protein DLX-6	0.165	115	89	41	155	60	166	9.855E-01	32
LOKIASV2_0664_ESMFold_hypothetical_protein	AF-B0W1V2-F1-model_v4	LOKIASV2_0664_ESMFold_hypothetical_protein	AF-B0W1V2-F1-model_v4 Homeobox protein abdominal-A homolog	0.135	92	76	36	127	50	138	3.527E+00	32
LOKIASV2_0664_ESMFold_hypothetical_protein	AF-P48031-F1-model_v4	LOKIASV2_0664_ESMFold_hypothetical_protein	AF-P48031-F1-model_v4 Homeobox protein GBX-2	0.168	93	69	36	119	254	346	1.289E+00	32
LOKIASV2_0664_ESMFold_hypothetical_protein	AF-P52951-F1-model_v4	LOKIASV2_0664_ESMFold_hypothetical_protein	AF-P52951-F1-model_v4 Homeobox protein GBX-2	0.161	93	70	36	119	254	346	1.576E+00	32
LOKIASV2_0664_ESMFold_hypothetical_protein	AF-P0C5S5-F1-model_v4	LOKIASV2_0664_ESMFold_hypothetical_protein	AF-P0C5S5-F1-model_v4 Luminescence regulatory protein LuxO	0.164	73	53	21	84	380	452	4.313E+00	32
LOKIASV2_0664_ESMFold_hypothetical_protein	AF-B7M9E6-F1-model_v4	LOKIASV2_0664_ESMFold_hypothetical_protein	AF-B7M9E6-F1-model_v4 Anaerobic nitric oxide reductase transcription regulator NorR	0.088	66	56	11	76	439	500	4.313E+00	32
LOKIASV2_0664_ESMFold_hypothetical_protein	AF-B7MKH8-F1-model_v4	LOKIASV2_0664_ESMFold_hypothetical_protein	AF-B7MKH8-F1-model_v4 Anaerobic nitric oxide reductase transcription regulator NorR	0.089	65	55	12	76	440	500	4.613E+00	32
LOKIASV2_0664_ESMFold_hypothetical_protein	AF-Q8S4P5-F1-model_v4	LOKIASV2_0664_ESMFold_hypothetical_protein	AF-Q8S4P5-F1-model_v4 Histone-lysine N-methyltransferase EZ2	0.104	67	56	21	84	191	257	6.033E+00	32
LOKIASV2_0664_ESMFold_hypothetical_protein	AF-O09053-F1-model_v4	LOKIASV2_0664_ESMFold_hypothetical_protein	AF-O09053-F1-model_v4 Werner syndrome ATP-dependent helicase homolog	0.139	79	57	10	88	1198	1264	2.205E+00	32
LOKIASV2_0664_ESMFold_hypothetical_protein	AF-O07920-F1-model_v4	LOKIASV2_0664_ESMFold_hypothetical_protein	AF-O07920-F1-model_v4 Transcriptional regulator AzlB	0.155	87	63	40	115	8	94	1.054E+00	31
LOKIASV2_0664_ESMFold_hypothetical_protein	AF-E1V7V9-F1-model_v4	LOKIASV2_0664_ESMFold_hypothetical_protein	AF-E1V7V9-F1-model_v4 Transcriptional regulatory protein DoeX	0.122	138	119	40	175	6	143	3.851E-01	31
LOKIASV2_0664_ESMFold_hypothetical_protein	AF-P19768-F1-model_v4	LOKIASV2_0664_ESMFold_hypothetical_protein	AF-P19768-F1-model_v4 Insertion element IS150 protein InsJ	0.113	87	74	40	126	67	150	3.527E+00	31
LOKIASV2_0664_ESMFold_hypothetical_protein	AF-B0R6W9-F1-model_v4	LOKIASV2_0664_ESMFold_hypothetical_protein	AF-B0R6W9-F1-model_v4 NH(3)-dependent NAD(+) synthetase	0.150	40	31	43	79	222	261	7.891E+00	31
LOKIASV2_0664_ESMFold_hypothetical_protein	AF-O42365-F1-model_v4	LOKIASV2_0664_ESMFold_hypothetical_protein	AF-O42365-F1-model_v4 Homeobox protein Hox-A2b	0.105	57	46	36	87	140	196	5.642E+00	31
LOKIASV2_0664_ESMFold_hypothetical_protein	AF-Q96JN0-F1-model_v4	LOKIASV2_0664_ESMFold_hypothetical_protein	AF-Q96JN0-F1-model_v4 Ligand-dependent corepressor	0.170	47	36	36	82	349	392	7.379E+00	31
LOKIASV2_0664_ESMFold_hypothetical_protein	AF-Q28ZA9-F1-model_v4	LOKIASV2_0664_ESMFold_hypothetical_protein	AF-Q28ZA9-F1-model_v4 Homeobox protein unplugged	0.158	98	72	37	122	330	427	1.378E+00	31
LOKIASV2_0664_ESMFold_hypothetical_protein	AF-B7MZ04-F1-model_v4	LOKIASV2_0664_ESMFold_hypothetical_protein	AF-B7MZ04-F1-model_v4 Anaerobic nitric oxide reductase transcription regulator NorR	0.089	65	55	12	76	440	500	4.933E+00	31
LOKIASV2_0664_ESMFold_hypothetical_protein	AF-Q79CE8-F1-model_v4	LOKIASV2_0664_ESMFold_hypothetical_protein	AF-Q79CE8-F1-model_v4 Probable transposase for insertion sequence element IS1353	0.151	85	62	40	124	123	196	1.686E+00	31
LOKIASV2_0664_ESMFold_hypothetical_protein	AF-Q499M4-F1-model_v4	LOKIASV2_0664_ESMFold_hypothetical_protein	AF-Q499M4-F1-model_v4 Tigger transposable element derived 5	0.102	68	57	21	88	53	117	5.642E+00	31
LOKIASV2_0664_ESMFold_hypothetical_protein	AF-Q6IE82-F1-model_v4	LOKIASV2_0664_ESMFold_hypothetical_protein	AF-Q6IE82-F1-model_v4 Protein Jade-3	0.149	87	71	39	125	397	481	1.686E+00	31
LOKIASV2_0664_ESMFold_hypothetical_protein	AF-P14083-F1-model_v4	LOKIASV2_0664_ESMFold_hypothetical_protein	AF-P14083-F1-model_v4 Protein jim lovell	0.212	47	36	40	86	794	840	9.650E+00	31
LOKIASV2_0664_ESMFold_hypothetical_protein	AF-P29552-F1-model_v4	LOKIASV2_0664_ESMFold_hypothetical_protein	AF-P29552-F1-model_v4 Homeobox protein abdominal-A homolog	0.135	92	76	36	127	28	116	4.613E+00	30
LOKIASV2_0664_ESMFold_hypothetical_protein	AF-O76762-F1-model_v4	LOKIASV2_0664_ESMFold_hypothetical_protein	AF-O76762-F1-model_v4 Homeobox protein abdominal-A homolog	0.117	90	76	36	125	145	231	5.275E+00	30
LOKIASV2_0664_ESMFold_hypothetical_protein	AF-P09085-F1-model_v4	LOKIASV2_0664_ESMFold_hypothetical_protein	AF-P09085-F1-model_v4 Homeotic protein caudal	0.105	81	72	36	116	280	360	4.933E+00	30
LOKIASV2_0664_ESMFold_hypothetical_protein	AF-Q96IS3-F1-model_v4	LOKIASV2_0664_ESMFold_hypothetical_protein	AF-Q96IS3-F1-model_v4 Retina and anterior neural fold homeobox protein 2	0.122	57	45	36	87	34	90	7.891E+00	29
LOKIASV2_0664_ESMFold_hypothetical_protein	AF-P02830-F1-model_v4	LOKIASV2_0664_ESMFold_hypothetical_protein	AF-P02830-F1-model_v4 Homeobox protein Hox-A7	0.113	114	93	15	120	114	227	1.686E+00	29
LOKIASV2_0664_ESMFold_hypothetical_protein	AF-Q22910-F1-model_v4	LOKIASV2_0664_ESMFold_hypothetical_protein	AF-Q22910-F1-model_v4 Homeobox protein ceh-31	0.134	120	94	40	159	105	213	2.522E+00	29
LOKIASV2_0664_ESMFold_hypothetical_protein	AF-P42586-F1-model_v4	LOKIASV2_0664_ESMFold_hypothetical_protein	AF-P42586-F1-model_v4 Homeobox protein Nkx-2.2	0.104	120	85	36	155	135	230	1.686E+00	29
LOKIASV2_0664_ESMFold_hypothetical_protein	AF-Q14549-F1-model_v4	LOKIASV2_0664_ESMFold_hypothetical_protein	AF-Q14549-F1-model_v4 Homeobox protein GBX-1	0.140	105	83	25	121	257	361	1.803E+00	29
LOKIASV2_0664_ESMFold_hypothetical_protein	AF-Q50D79-F1-model_v4	LOKIASV2_0664_ESMFold_hypothetical_protein	AF-Q50D79-F1-model_v4 Homeobox protein unc-4 homolog	0.106	94	76	40	125	112	205	5.275E+00	29
LOKIASV2_0664_ESMFold_hypothetical_protein	AF-B1LQ27-F1-model_v4	LOKIASV2_0664_ESMFold_hypothetical_protein	AF-B1LQ27-F1-model_v4 Anaerobic nitric oxide reductase transcription regulator NorR	0.088	66	56	11	76	439	500	6.452E+00	29
LOKIASV2_0664_ESMFold_hypothetical_protein	AF-B7NSI9-F1-model_v4	LOKIASV2_0664_ESMFold_hypothetical_protein	AF-B7NSI9-F1-model_v4 Anaerobic nitric oxide reductase transcription regulator NorR	0.088	65	55	12	76	440	500	6.033E+00	29
LOKIASV2_0664_ESMFold_hypothetical_protein	AF-P0CF40-F1-model_v4	LOKIASV2_0664_ESMFold_hypothetical_protein	AF-P0CF40-F1-model_v4 Transposase InsC for insertion element IS2A	0.117	85	69	41	125	18	96	6.452E+00	28
LOKIASV2_0664_ESMFold_hypothetical_protein	AF-P18864-F1-model_v4	LOKIASV2_0664_ESMFold_hypothetical_protein	AF-P18864-F1-model_v4 Homeobox protein Hox-B7	0.132	98	79	9	100	116	213	2.205E+00	28
LOKIASV2_0664_ESMFold_hypothetical_protein	AF-O95231-F1-model_v4	LOKIASV2_0664_ESMFold_hypothetical_protein	AF-O95231-F1-model_v4 Homeobox protein VENTX	0.161	63	51	40	101	101	163	7.379E+00	28
LOKIASV2_0664_ESMFold_hypothetical_protein	AF-P82976-F1-model_v4	LOKIASV2_0664_ESMFold_hypothetical_protein	AF-P82976-F1-model_v4 Homeobox protein GBX-1	0.125	94	74	36	121	323	416	2.697E+00	28
LOKIASV2_0664_ESMFold_hypothetical_protein	AF-Q9VBW9-F1-model_v4	LOKIASV2_0664_ESMFold_hypothetical_protein	AF-Q9VBW9-F1-model_v4 Protein distal antenna-related	0.103	72	62	16	87	5	74	5.642E+00	28
LOKIASV2_0664_ESMFold_hypothetical_protein	AF-P49749-F1-model_v4	LOKIASV2_0664_ESMFold_hypothetical_protein	AF-P49749-F1-model_v4 Homeobox even-skipped homolog protein 2	0.180	78	62	40	115	201	278	4.313E+00	28
LOKIASV2_0664_ESMFold_hypothetical_protein	AF-Q4V5A3-F1-model_v4	LOKIASV2_0664_ESMFold_hypothetical_protein	AF-Q4V5A3-F1-model_v4 Homeobox protein unplugged	0.157	102	74	25	113	315	416	1.474E+00	28
LOKIASV2_0664_ESMFold_hypothetical_protein	AF-P0CF47-F1-model_v4	LOKIASV2_0664_ESMFold_hypothetical_protein	AF-P0CF47-F1-model_v4 Transposase InsC for insertion element IS2-8	0.070	85	66	41	125	18	89	7.379E+00	27
LOKIASV2_0664_ESMFold_hypothetical_protein	AF-Q93PU7-F1-model_v4	LOKIASV2_0664_ESMFold_hypothetical_protein	AF-Q93PU7-F1-model_v4 Uncharacterized HTH-type transcriptional regulator TtgW	0.106	47	41	40	86	19	65	6.900E+00	27
LOKIASV2_0664_ESMFold_hypothetical_protein	AF-Q8U0P3-F1-model_v4	LOKIASV2_0664_ESMFold_hypothetical_protein	AF-Q8U0P3-F1-model_v4 HTH-type transcriptional regulator FL11	0.104	132	115	40	171	9	137	1.127E+00	27
LOKIASV2_0664_ESMFold_hypothetical_protein	AF-P09629-F1-model_v4	LOKIASV2_0664_ESMFold_hypothetical_protein	AF-P09629-F1-model_v4 Homeobox protein Hox-B7	0.121	98	80	9	100	116	213	2.358E+00	27
LOKIASV2_0664_ESMFold_hypothetical_protein	AF-Q90481-F1-model_v4	LOKIASV2_0664_ESMFold_hypothetical_protein	AF-Q90481-F1-model_v4 Homeobox protein Nkx-2.2a	0.141	110	90	39	144	135	244	2.062E+00	27
LOKIASV2_0664_ESMFold_hypothetical_protein	AF-Q6ZA74-F1-model_v4	LOKIASV2_0664_ESMFold_hypothetical_protein	AF-Q6ZA74-F1-model_v4 Homeobox-leucine zipper protein HOX5	0.194	71	54	17	87	79	146	4.313E+00	27
LOKIASV2_0664_ESMFold_hypothetical_protein	AF-Q9XH36-F1-model_v4	LOKIASV2_0664_ESMFold_hypothetical_protein	AF-Q9XH36-F1-model_v4 Homeobox-leucine zipper protein HOX5	0.210	57	40	37	87	90	146	8.438E+00	27
LOKIASV2_0664_ESMFold_hypothetical_protein	AF-G5EGQ5-F1-model_v4	LOKIASV2_0664_ESMFold_hypothetical_protein	AF-G5EGQ5-F1-model_v4 Mblk-1-related factor 1	0.139	86	57	40	125	158	224	2.697E+00	27
LOKIASV2_0664_ESMFold_hypothetical_protein	AF-O08934-F1-model_v4	LOKIASV2_0664_ESMFold_hypothetical_protein	AF-O08934-F1-model_v4 Homeobox protein unc-4 homolog	0.095	94	77	40	125	120	213	6.452E+00	27
LOKIASV2_0664_ESMFold_hypothetical_protein	AF-Q10S83-F1-model_v4	LOKIASV2_0664_ESMFold_hypothetical_protein	AF-Q10S83-F1-model_v4 Protein NLP1	0.211	52	33	44	86	622	673	9.024E+00	27
LOKIASV2_0664_ESMFold_hypothetical_protein	AF-P31261-F1-model_v4	LOKIASV2_0664_ESMFold_hypothetical_protein	AF-P31261-F1-model_v4 Homeobox protein Hox-A2	0.117	82	69	36	114	9	90	4.313E+00	26
LOKIASV2_0664_ESMFold_hypothetical_protein	AF-Q79E92-F1-model_v4	LOKIASV2_0664_ESMFold_hypothetical_protein	AF-Q79E92-F1-model_v4 Putative transposase YkgN	0.138	86	68	41	126	11	90	6.033E+00	26
LOKIASV2_0664_ESMFold_hypothetical_protein	AF-P05837-F1-model_v4	LOKIASV2_0664_ESMFold_hypothetical_protein	AF-P05837-F1-model_v4 Protein TraJ	0.090	55	39	44	87	158	212	9.650E+00	26
LOKIASV2_0664_ESMFold_hypothetical_protein	AF-A8A3I6-F1-model_v4	LOKIASV2_0664_ESMFold_hypothetical_protein	AF-A8A3I6-F1-model_v4 Anaerobic nitric oxide reductase transcription regulator NorR	0.121	65	53	12	76	440	500	7.891E+00	26
LOKIASV2_0664_ESMFold_hypothetical_protein	AF-O59188-F1-model_v4	LOKIASV2_0664_ESMFold_hypothetical_protein	AF-O59188-F1-model_v4 HTH-type transcriptional regulator FL11	0.107	136	118	40	175	9	141	1.378E+00	25
LOKIASV2_0664_ESMFold_hypothetical_protein	AF-P31273-F1-model_v4	LOKIASV2_0664_ESMFold_hypothetical_protein	AF-P31273-F1-model_v4 Homeobox protein Hox-C8	0.063	95	84	23	113	143	237	7.891E+00	25
LOKIASV2_0664_ESMFold_hypothetical_protein	AF-O13023-F1-model_v4	LOKIASV2_0664_ESMFold_hypothetical_protein	AF-O13023-F1-model_v4 Hematopoietically-expressed homeobox protein hhex	0.126	83	71	40	122	148	229	9.650E+00	25
LOKIASV2_0664_ESMFold_hypothetical_protein	AF-Q8AWG6-F1-model_v4	LOKIASV2_0664_ESMFold_hypothetical_protein	AF-Q8AWG6-F1-model_v4 Hematopoietically-expressed homeobox protein hhex	0.114	83	72	40	122	150	231	9.650E+00	25
LOKIASV2_0664_ESMFold_hypothetical_protein	AF-Q6IND7-F1-model_v4	LOKIASV2_0664_ESMFold_hypothetical_protein	AF-Q6IND7-F1-model_v4 LRP2-binding protein	0.180	49	38	39	87	293	339	4.313E+00	25
LOKIASV2_0664_ESMFold_hypothetical_protein	AF-Q6YPD0-F1-model_v4	LOKIASV2_0664_ESMFold_hypothetical_protein	AF-Q6YPD0-F1-model_v4 Homeobox-leucine zipper protein HOX27	0.147	107	89	42	146	185	291	2.358E+00	25
LOKIASV2_0664_ESMFold_hypothetical_protein	AF-A6NJT0-F1-model_v4	LOKIASV2_0664_ESMFold_hypothetical_protein	AF-A6NJT0-F1-model_v4 Homeobox protein unc-4 homolog	0.085	94	78	40	125	116	209	9.024E+00	25
LOKIASV2_0664_ESMFold_hypothetical_protein	AF-Q6IRN0-F1-model_v4	LOKIASV2_0664_ESMFold_hypothetical_protein	AF-Q6IRN0-F1-model_v4 Serine/threonine-protein kinase 11-interacting protein	0.120	104	77	65	168	612	699	2.205E+00	25
LOKIASV2_0664_ESMFold_hypothetical_protein	AF-Q7MWV3-F1-model_v4	LOKIASV2_0664_ESMFold_hypothetical_protein	AF-Q7MWV3-F1-model_v4 Dephospho-CoA kinase	0.152	46	38	51	96	132	177	9.650E+00	24
LOKIASV2_0664_ESMFold_hypothetical_protein	AF-Q8GRL4-F1-model_v4	LOKIASV2_0664_ESMFold_hypothetical_protein	AF-Q8GRL4-F1-model_v4 Homeobox-leucine zipper protein HOX19	0.148	151	124	26	176	120	266	1.054E+00	24
LOKIASV2_0664_ESMFold_hypothetical_protein	AF-Q9P445-F1-model_v4	LOKIASV2_0664_ESMFold_hypothetical_protein	AF-Q9P445-F1-model_v4 Mating-type protein MAT-2	0.123	81	64	40	113	136	216	3.772E+00	24
LOKIASV2_0664_ESMFold_hypothetical_protein	AF-A2YW03-F1-model_v4	LOKIASV2_0664_ESMFold_hypothetical_protein	AF-A2YW03-F1-model_v4 Homeobox-leucine zipper protein HOX27	0.147	107	89	42	146	185	291	2.697E+00	24
LOKIASV2_0664_ESMFold_hypothetical_protein	AF-O43364-F1-model_v4	LOKIASV2_0664_ESMFold_hypothetical_protein	AF-O43364-F1-model_v4 Homeobox protein Hox-A2	0.113	96	78	29	117	143	238	4.933E+00	24
LOKIASV2_0664_ESMFold_hypothetical_protein	AF-Q26656-F1-model_v4	LOKIASV2_0664_ESMFold_hypothetical_protein	AF-Q26656-F1-model_v4 Homeobox protein Hmx	0.105	107	91	23	129	247	349	4.033E+00	24
LOKIASV2_0664_ESMFold_hypothetical_protein	AF-P23683-F1-model_v4	LOKIASV2_0664_ESMFold_hypothetical_protein	AF-P23683-F1-model_v4 Homeobox even-skipped homolog protein 1	0.180	78	62	40	115	193	270	7.891E+00	24
LOKIASV2_0664_ESMFold_hypothetical_protein	AF-O87455-F1-model_v4	LOKIASV2_0664_ESMFold_hypothetical_protein	AF-O87455-F1-model_v4 Regulatory protein LuxO	0.118	69	54	15	76	448	516	9.024E+00	24
LOKIASV2_0664_ESMFold_hypothetical_protein	AF-Q6ZQF7-F1-model_v4	LOKIASV2_0664_ESMFold_hypothetical_protein	AF-Q6ZQF7-F1-model_v4 E3 ubiquitin-protein ligase Jade-2	0.144	69	56	45	113	400	465	4.313E+00	24
LOKIASV2_0664_ESMFold_hypothetical_protein	AF-D3ZVK1-F1-model_v4	LOKIASV2_0664_ESMFold_hypothetical_protein	AF-D3ZVK1-F1-model_v4 DNA helicase MCM8	0.112	168	129	25	170	100	267	6.161E-01	24
LOKIASV2_0664_ESMFold_hypothetical_protein	AF-Q2MHN3-F1-model_v4	LOKIASV2_0664_ESMFold_hypothetical_protein	AF-Q2MHN3-F1-model_v4 Zinc finger homeobox protein 2	0.150	79	56	37	103	2065	2143	8.438E+00	24
LOKIASV2_0664_ESMFold_hypothetical_protein	AF-P0CF48-F1-model_v4	LOKIASV2_0664_ESMFold_hypothetical_protein	AF-P0CF48-F1-model_v4 Transposase InsC for insertion element IS2-9	0.106	103	87	23	125	3	100	9.650E+00	23
LOKIASV2_0664_ESMFold_hypothetical_protein	AF-B3EFQ8-F1-model_v4	LOKIASV2_0664_ESMFold_hypothetical_protein	AF-B3EFQ8-F1-model_v4 Transcription antitermination protein NusB	0.096	52	43	57	105	110	161	7.379E+00	23
LOKIASV2_0664_ESMFold_hypothetical_protein	AF-P24061-F1-model_v4	LOKIASV2_0664_ESMFold_hypothetical_protein	AF-P24061-F1-model_v4 Homeobox protein Hox-A7	0.108	111	93	16	120	115	225	4.933E+00	23
LOKIASV2_0664_ESMFold_hypothetical_protein	AF-A2Y931-F1-model_v4	LOKIASV2_0664_ESMFold_hypothetical_protein	AF-A2Y931-F1-model_v4 Homeobox-leucine zipper protein HOX28	0.100	120	104	47	163	110	229	1.928E+00	23
LOKIASV2_0664_ESMFold_hypothetical_protein	AF-P09080-F1-model_v4	LOKIASV2_0664_ESMFold_hypothetical_protein	AF-P09080-F1-model_v4 Homeobox protein HB1	0.148	74	55	22	87	181	254	6.900E+00	23
LOKIASV2_0664_ESMFold_hypothetical_protein	AF-Q7YTC2-F1-model_v4	LOKIASV2_0664_ESMFold_hypothetical_protein	AF-Q7YTC2-F1-model_v4 Homeobox protein orthopedia	0.123	61	49	39	99	100	156	7.891E+00	23
LOKIASV2_0664_ESMFold_hypothetical_protein	AF-Q5XKR4-F1-model_v4	LOKIASV2_0664_ESMFold_hypothetical_protein	AF-Q5XKR4-F1-model_v4 Homeobox protein orthopedia	0.123	61	49	39	99	114	170	8.438E+00	23
LOKIASV2_0664_ESMFold_hypothetical_protein	AF-Q08727-F1-model_v4	LOKIASV2_0664_ESMFold_hypothetical_protein	AF-Q08727-F1-model_v4 Homeobox protein Hox-A2	0.133	152	127	29	176	140	291	1.378E+00	23
LOKIASV2_0664_ESMFold_hypothetical_protein	AF-Q9SYH3-F1-model_v4	LOKIASV2_0664_ESMFold_hypothetical_protein	AF-Q9SYH3-F1-model_v4 E3 ubiquitin-protein ligase SPL2	0.142	105	87	66	170	279	380	2.884E+00	23
LOKIASV2_0664_ESMFold_hypothetical_protein	AF-Q94FL7-F1-model_v4	LOKIASV2_0664_ESMFold_hypothetical_protein	AF-Q94FL7-F1-model_v4 Transcription factor MYB120	0.148	89	74	40	127	88	176	7.891E+00	23
LOKIASV2_0664_ESMFold_hypothetical_protein	AF-P07548-F1-model_v4	LOKIASV2_0664_ESMFold_hypothetical_protein	AF-P07548-F1-model_v4 Homeotic protein deformed	0.127	115	86	20	119	360	474	5.642E+00	23
LOKIASV2_0664_ESMFold_hypothetical_protein	AF-Q9FJS2-F1-model_v4	LOKIASV2_0664_ESMFold_hypothetical_protein	AF-Q9FJS2-F1-model_v4 Homeobox-leucine zipper protein HDG5	0.080	107	83	40	146	122	212	6.033E+00	23
LOKIASV2_0664_ESMFold_hypothetical_protein	AF-P18866-F1-model_v4	LOKIASV2_0664_ESMFold_hypothetical_protein	AF-P18866-F1-model_v4 Homeobox protein Hox-C8	0.060	80	72	36	113	22	101	9.024E+00	22
LOKIASV2_0664_ESMFold_hypothetical_protein	AF-G5EFY5-F1-model_v4	LOKIASV2_0664_ESMFold_hypothetical_protein	AF-G5EFY5-F1-model_v4 Homeobox domain-containing protein	0.108	92	75	15	99	148	239	6.033E+00	22
LOKIASV2_0664_ESMFold_hypothetical_protein	AF-P28361-F1-model_v4	LOKIASV2_0664_ESMFold_hypothetical_protein	AF-P28361-F1-model_v4 Homeobox protein MSX-1	0.148	91	73	1	87	97	187	7.379E+00	22
LOKIASV2_0664_ESMFold_hypothetical_protein	AF-P35548-F1-model_v4	LOKIASV2_0664_ESMFold_hypothetical_protein	AF-P35548-F1-model_v4 Homeobox protein MSX-2	0.178	84	59	15	87	124	207	7.379E+00	22
LOKIASV2_0664_ESMFold_hypothetical_protein	AF-P43688-F1-model_v4	LOKIASV2_0664_ESMFold_hypothetical_protein	AF-P43688-F1-model_v4 Homeobox protein Nkx-2.6	0.135	105	76	41	145	134	222	4.933E+00	22
LOKIASV2_0664_ESMFold_hypothetical_protein	AF-P52950-F1-model_v4	LOKIASV2_0664_ESMFold_hypothetical_protein	AF-P52950-F1-model_v4 Homeobox protein DBX1	0.126	68	52	41	101	192	259	4.933E+00	22
LOKIASV2_0664_ESMFold_hypothetical_protein	AF-Q03372-F1-model_v4	LOKIASV2_0664_ESMFold_hypothetical_protein	AF-Q03372-F1-model_v4 Muscle segmentation homeobox	0.127	80	68	9	87	407	486	6.900E+00	22
LOKIASV2_0664_ESMFold_hypothetical_protein	AF-Q9NQC1-F1-model_v4	LOKIASV2_0664_ESMFold_hypothetical_protein	AF-Q9NQC1-F1-model_v4 E3 ubiquitin-protein ligase Jade-2	0.154	69	55	45	113	400	465	4.313E+00	22
LOKIASV2_0664_ESMFold_hypothetical_protein	AF-E1BPX4-F1-model_v4	LOKIASV2_0664_ESMFold_hypothetical_protein	AF-E1BPX4-F1-model_v4 DNA helicase MCM8	0.111	170	131	23	170	100	269	1.127E+00	22
LOKIASV2_0664_ESMFold_hypothetical_protein	AF-Q803A0-F1-model_v4	LOKIASV2_0664_ESMFold_hypothetical_protein	AF-Q803A0-F1-model_v4 Protein Jade-1	0.148	81	55	45	125	420	485	4.033E+00	22
LOKIASV2_0664_ESMFold_hypothetical_protein	AF-Q6ZPI0-F1-model_v4	LOKIASV2_0664_ESMFold_hypothetical_protein	AF-Q6ZPI0-F1-model_v4 Protein Jade-1	0.111	72	60	42	113	421	489	6.452E+00	22
LOKIASV2_0664_ESMFold_hypothetical_protein	AF-Q9N0M2-F1-model_v4	LOKIASV2_0664_ESMFold_hypothetical_protein	AF-Q9N0M2-F1-model_v4 Homeobox protein BarH-like 2	0.100	110	95	43	152	1	106	7.379E+00	21
LOKIASV2_0664_ESMFold_hypothetical_protein	AF-P55461-F1-model_v4	LOKIASV2_0664_ESMFold_hypothetical_protein	AF-P55461-F1-model_v4 Uncharacterized protein y4gE	0.095	119	94	41	159	129	233	3.772E+00	21
LOKIASV2_0664_ESMFold_hypothetical_protein	AF-Q5VPE5-F1-model_v4	LOKIASV2_0664_ESMFold_hypothetical_protein	AF-Q5VPE5-F1-model_v4 Homeobox-leucine zipper protein HOX28	0.120	120	102	47	163	110	229	2.358E+00	21
LOKIASV2_0664_ESMFold_hypothetical_protein	AF-A4R4J0-F1-model_v4	LOKIASV2_0664_ESMFold_hypothetical_protein	AF-A4R4J0-F1-model_v4 37S ribosomal protein S25, mitochondrial	0.133	124	104	39	162	137	257	2.205E+00	21
LOKIASV2_0664_ESMFold_hypothetical_protein	AF-Q94398-F1-model_v4	LOKIASV2_0664_ESMFold_hypothetical_protein	AF-Q94398-F1-model_v4 Homeobox protein ceh-8	0.139	89	73	18	103	49	137	6.900E+00	21
LOKIASV2_0664_ESMFold_hypothetical_protein	AF-Q05466-F1-model_v4	LOKIASV2_0664_ESMFold_hypothetical_protein	AF-Q05466-F1-model_v4 Homeobox-leucine zipper protein HAT4	0.132	130	89	47	176	145	247	1.928E+00	21
LOKIASV2_0664_ESMFold_hypothetical_protein	AF-Q8JJ26-F1-model_v4	LOKIASV2_0664_ESMFold_hypothetical_protein	AF-Q8JJ26-F1-model_v4 Homeobox protein SEBOX	0.131	99	77	5	94	29	127	9.650E+00	21
LOKIASV2_0664_ESMFold_hypothetical_protein	AF-A6NCS4-F1-model_v4	LOKIASV2_0664_ESMFold_hypothetical_protein	AF-A6NCS4-F1-model_v4 Homeobox protein Nkx-2.6	0.137	122	85	41	162	143	242	3.772E+00	21
LOKIASV2_0664_ESMFold_hypothetical_protein	AF-Q90277-F1-model_v4	LOKIASV2_0664_ESMFold_hypothetical_protein	AF-Q90277-F1-model_v4 Visual system homeobox 1	0.130	94	78	36	129	155	245	8.438E+00	21
LOKIASV2_0664_ESMFold_hypothetical_protein	AF-P53292-F1-model_v4	LOKIASV2_0664_ESMFold_hypothetical_protein	AF-P53292-F1-model_v4 37S ribosomal protein S35, mitochondrial	0.108	198	120	36	171	147	344	2.358E+00	21
LOKIASV2_0664_ESMFold_hypothetical_protein	AF-A7HN01-F1-model_v4	LOKIASV2_0664_ESMFold_hypothetical_protein	AF-A7HN01-F1-model_v4 Translation initiation factor IF-2	0.165	94	77	34	126	79	172	1.054E+00	21
LOKIASV2_0664_ESMFold_hypothetical_protein	AF-Q3LU41-F1-model_v4	LOKIASV2_0664_ESMFold_hypothetical_protein	AF-Q3LU41-F1-model_v4 Homeobox protein prophet of Pit-1	0.142	125	88	39	163	79	182	3.084E+00	20
LOKIASV2_0664_ESMFold_hypothetical_protein	AF-Q0JB92-F1-model_v4	LOKIASV2_0664_ESMFold_hypothetical_protein	AF-Q0JB92-F1-model_v4 Homeobox-leucine zipper protein HOX17	0.129	124	91	41	164	90	195	4.613E+00	20
LOKIASV2_0664_ESMFold_hypothetical_protein	AF-P23410-F1-model_v4	LOKIASV2_0664_ESMFold_hypothetical_protein	AF-P23410-F1-model_v4 Homeobox protein MSX-2	0.151	114	84	5	104	106	219	2.884E+00	20
LOKIASV2_0664_ESMFold_hypothetical_protein	AF-A2T756-F1-model_v4	LOKIASV2_0664_ESMFold_hypothetical_protein	AF-A2T756-F1-model_v4 Pancreas/duodenum homeobox protein 1	0.141	98	73	20	105	134	231	6.900E+00	20
