query	target	qheader	theader	fident	alnlen	mismatch	qstart	qend	tstart	tend	evalue	bits
LOKIASV2_0929_ESMFold_ABC_transporter_substrate-binding_protein	AF-Q8YBP0-F1-model_v4	LOKIASV2_0929_ESMFold_ABC_transporter_substrate-binding_protein	AF-Q8YBP0-F1-model_v4 Putative ABC transporter peptide-binding protein BMEII0859	0.174	571	401	26	596	16	501	2.227E-24	749
LOKIASV2_0929_ESMFold_ABC_transporter_substrate-binding_protein	AF-Q577J8-F1-model_v4	LOKIASV2_0929_ESMFold_ABC_transporter_substrate-binding_protein	AF-Q577J8-F1-model_v4 Putative ABC transporter peptide-binding protein BruAb2_0792	0.188	580	404	27	606	17	515	4.693E-24	745
LOKIASV2_0929_ESMFold_ABC_transporter_substrate-binding_protein	AF-Q2YK66-F1-model_v4	LOKIASV2_0929_ESMFold_ABC_transporter_substrate-binding_protein	AF-Q2YK66-F1-model_v4 Putative ABC transporter peptide-binding protein BAB2_0812	0.175	600	419	27	626	17	525	4.000E-24	737
LOKIASV2_0929_ESMFold_ABC_transporter_substrate-binding_protein	AF-P33590-F1-model_v4	LOKIASV2_0929_ESMFold_ABC_transporter_substrate-binding_protein	AF-P33590-F1-model_v4 Nickel-binding periplasmic protein	0.146	573	418	25	597	13	502	4.275E-25	735
LOKIASV2_0929_ESMFold_ABC_transporter_substrate-binding_protein	AF-P42061-F1-model_v4	LOKIASV2_0929_ESMFold_ABC_transporter_substrate-binding_protein	AF-P42061-F1-model_v4 Oligopeptide-binding protein AppA	0.146	627	462	1	627	1	542	6.544E-25	732
LOKIASV2_0929_ESMFold_ABC_transporter_substrate-binding_protein	AF-A5VU91-F1-model_v4	LOKIASV2_0929_ESMFold_ABC_transporter_substrate-binding_protein	AF-A5VU91-F1-model_v4 Putative ABC transporter peptide-binding protein BOV_A0352	0.172	602	422	25	626	15	525	6.812E-24	727
LOKIASV2_0929_ESMFold_ABC_transporter_substrate-binding_protein	AF-Q8FWN7-F1-model_v4	LOKIASV2_0929_ESMFold_ABC_transporter_substrate-binding_protein	AF-Q8FWN7-F1-model_v4 Putative ABC transporter peptide-binding protein BRA0409/BS1330_II0406	0.181	575	404	25	599	15	508	8.429E-24	723
LOKIASV2_0929_ESMFold_ABC_transporter_substrate-binding_protein	AF-A0A0H2ZGV7-F1-model_v4	LOKIASV2_0929_ESMFold_ABC_transporter_substrate-binding_protein	AF-A0A0H2ZGV7-F1-model_v4 Di/tripeptide-binding protein 4	0.136	568	430	29	596	14	512	1.950E-22	671
LOKIASV2_0929_ESMFold_ABC_transporter_substrate-binding_protein	AF-P23847-F1-model_v4	LOKIASV2_0929_ESMFold_ABC_transporter_substrate-binding_protein	AF-P23847-F1-model_v4 Dipeptide-binding protein	0.172	564	410	41	604	29	524	1.029E-22	668
LOKIASV2_0929_ESMFold_ABC_transporter_substrate-binding_protein	AF-P06202-F1-model_v4	LOKIASV2_0929_ESMFold_ABC_transporter_substrate-binding_protein	AF-P06202-F1-model_v4 Periplasmic oligopeptide-binding protein	0.131	586	435	41	626	39	540	3.947E-23	666
LOKIASV2_0929_ESMFold_ABC_transporter_substrate-binding_protein	AF-P76128-F1-model_v4	LOKIASV2_0929_ESMFold_ABC_transporter_substrate-binding_protein	AF-P76128-F1-model_v4 Probable D,D-dipeptide-binding periplasmic protein DdpA	0.143	593	427	24	616	15	513	2.287E-22	660
LOKIASV2_0929_ESMFold_ABC_transporter_substrate-binding_protein	AF-P23843-F1-model_v4	LOKIASV2_0929_ESMFold_ABC_transporter_substrate-binding_protein	AF-P23843-F1-model_v4 Periplasmic oligopeptide-binding protein	0.130	586	436	41	626	39	540	1.494E-22	657
LOKIASV2_0929_ESMFold_ABC_transporter_substrate-binding_protein	AF-Q2FVE7-F1-model_v4	LOKIASV2_0929_ESMFold_ABC_transporter_substrate-binding_protein	AF-Q2FVE7-F1-model_v4 Metal-staphylopine-binding protein CntA	0.149	567	418	38	604	31	522	5.362E-22	655
LOKIASV2_0929_ESMFold_ABC_transporter_substrate-binding_protein	AF-Q46863-F1-model_v4	LOKIASV2_0929_ESMFold_ABC_transporter_substrate-binding_protein	AF-Q46863-F1-model_v4 Probable deoxycholate-binding periplasmic protein YgiS	0.117	582	440	45	626	34	532	2.056E-22	641
LOKIASV2_0929_ESMFold_ABC_transporter_substrate-binding_protein	AF-A0A0H2ZGW2-F1-model_v4	LOKIASV2_0929_ESMFold_ABC_transporter_substrate-binding_protein	AF-A0A0H2ZGW2-F1-model_v4 Di/tripeptide-binding protein 2	0.147	572	425	25	596	14	512	4.333E-22	636
LOKIASV2_0929_ESMFold_ABC_transporter_substrate-binding_protein	AF-P24141-F1-model_v4	LOKIASV2_0929_ESMFold_ABC_transporter_substrate-binding_protein	AF-P24141-F1-model_v4 Oligopeptide-binding protein OppA	0.130	587	441	30	616	28	535	4.820E-22	635
LOKIASV2_0929_ESMFold_ABC_transporter_substrate-binding_protein	AF-P06109-F1-model_v4	LOKIASV2_0929_ESMFold_ABC_transporter_substrate-binding_protein	AF-P06109-F1-model_v4 Protein XP55	0.158	574	402	29	602	38	516	4.277E-21	633
LOKIASV2_0929_ESMFold_ABC_transporter_substrate-binding_protein	AF-A0A0H2ZGN2-F1-model_v4	LOKIASV2_0929_ESMFold_ABC_transporter_substrate-binding_protein	AF-A0A0H2ZGN2-F1-model_v4 Di/tripeptide-binding protein 3	0.146	576	437	31	606	16	528	1.130E-21	632
LOKIASV2_0929_ESMFold_ABC_transporter_substrate-binding_protein	AF-A0A0H2ZI72-F1-model_v4	LOKIASV2_0929_ESMFold_ABC_transporter_substrate-binding_protein	AF-A0A0H2ZI72-F1-model_v4 Probable di/tripeptide-binding protein 5	0.148	573	427	32	604	13	514	7.783E-22	627
LOKIASV2_0929_ESMFold_ABC_transporter_substrate-binding_protein	AF-A0A0H3JTL0-F1-model_v4	LOKIASV2_0929_ESMFold_ABC_transporter_substrate-binding_protein	AF-A0A0H3JTL0-F1-model_v4 Metal-staphylopine-binding protein CntA	0.141	564	417	41	604	36	522	1.474E-21	619
LOKIASV2_0929_ESMFold_ABC_transporter_substrate-binding_protein	AF-Q0T6D2-F1-model_v4	LOKIASV2_0929_ESMFold_ABC_transporter_substrate-binding_protein	AF-Q0T6D2-F1-model_v4 Glutathione-binding protein GsiB	0.146	589	417	28	616	16	504	2.648E-21	618
LOKIASV2_0929_ESMFold_ABC_transporter_substrate-binding_protein	AF-P26906-F1-model_v4	LOKIASV2_0929_ESMFold_ABC_transporter_substrate-binding_protein	AF-P26906-F1-model_v4 Dipeptide-binding protein DppE	0.129	573	429	27	599	33	525	7.887E-23	618
LOKIASV2_0929_ESMFold_ABC_transporter_substrate-binding_protein	AF-P55669-F1-model_v4	LOKIASV2_0929_ESMFold_ABC_transporter_substrate-binding_protein	AF-P55669-F1-model_v4 Probable peptide ABC transporter periplasmic-binding protein y4tO	0.162	581	425	26	606	20	527	1.849E-22	616
LOKIASV2_0929_ESMFold_ABC_transporter_substrate-binding_protein	AF-P77348-F1-model_v4	LOKIASV2_0929_ESMFold_ABC_transporter_substrate-binding_protein	AF-P77348-F1-model_v4 Periplasmic murein peptide-binding protein	0.128	586	435	41	626	35	534	4.757E-21	616
LOKIASV2_0929_ESMFold_ABC_transporter_substrate-binding_protein	AF-A0A0H2ZGV2-F1-model_v4	LOKIASV2_0929_ESMFold_ABC_transporter_substrate-binding_protein	AF-A0A0H2ZGV2-F1-model_v4 Di/tripeptide-binding protein 1	0.144	573	430	30	602	19	521	6.905E-21	613
LOKIASV2_0929_ESMFold_ABC_transporter_substrate-binding_protein	AF-Q57RB1-F1-model_v4	LOKIASV2_0929_ESMFold_ABC_transporter_substrate-binding_protein	AF-Q57RB1-F1-model_v4 Glutathione-binding protein GsiB	0.129	572	416	28	599	16	494	1.555E-21	605
LOKIASV2_0929_ESMFold_ABC_transporter_substrate-binding_protein	AF-Q5PGP4-F1-model_v4	LOKIASV2_0929_ESMFold_ABC_transporter_substrate-binding_protein	AF-Q5PGP4-F1-model_v4 Glutathione-binding protein GsiB	0.126	559	406	41	599	30	494	2.511E-21	600
LOKIASV2_0929_ESMFold_ABC_transporter_substrate-binding_protein	AF-Q9RU24-F1-model_v4	LOKIASV2_0929_ESMFold_ABC_transporter_substrate-binding_protein	AF-Q9RU24-F1-model_v4 Probable ABC transporter-binding protein DR_1571	0.162	567	450	43	609	40	577	1.730E-21	598
LOKIASV2_0929_ESMFold_ABC_transporter_substrate-binding_protein	AF-Q47622-F1-model_v4	LOKIASV2_0929_ESMFold_ABC_transporter_substrate-binding_protein	AF-Q47622-F1-model_v4 Probable ABC transporter periplasmic-binding protein SapA	0.153	600	442	27	626	16	538	1.899E-20	596
LOKIASV2_0929_ESMFold_ABC_transporter_substrate-binding_protein	AF-Q8CW88-F1-model_v4	LOKIASV2_0929_ESMFold_ABC_transporter_substrate-binding_protein	AF-Q8CW88-F1-model_v4 Glutathione-binding protein GsiB	0.131	589	423	28	616	15	502	8.101E-21	595
LOKIASV2_0929_ESMFold_ABC_transporter_substrate-binding_protein	AF-P36634-F1-model_v4	LOKIASV2_0929_ESMFold_ABC_transporter_substrate-binding_protein	AF-P36634-F1-model_v4 Peptide transport periplasmic protein SapA	0.156	596	433	31	626	27	540	1.380E-20	595
LOKIASV2_0929_ESMFold_ABC_transporter_substrate-binding_protein	AF-Q821B3-F1-model_v4	LOKIASV2_0929_ESMFold_ABC_transporter_substrate-binding_protein	AF-Q821B3-F1-model_v4 Glutathione-binding protein GsiB	0.134	589	421	28	616	16	502	6.905E-21	594
LOKIASV2_0929_ESMFold_ABC_transporter_substrate-binding_protein	AF-Q6D3B0-F1-model_v4	LOKIASV2_0929_ESMFold_ABC_transporter_substrate-binding_protein	AF-Q6D3B0-F1-model_v4 Glutathione-binding protein GsiB	0.152	562	396	41	602	31	498	3.645E-21	594
LOKIASV2_0929_ESMFold_ABC_transporter_substrate-binding_protein	AF-Q8ZQM3-F1-model_v4	LOKIASV2_0929_ESMFold_ABC_transporter_substrate-binding_protein	AF-Q8ZQM3-F1-model_v4 Glutathione-binding protein GsiB	0.132	559	403	41	599	30	494	1.824E-21	591
LOKIASV2_0929_ESMFold_ABC_transporter_substrate-binding_protein	AF-P33950-F1-model_v4	LOKIASV2_0929_ESMFold_ABC_transporter_substrate-binding_protein	AF-P33950-F1-model_v4 Heme-binding protein A	0.158	570	420	27	596	26	525	1.824E-21	588
LOKIASV2_0929_ESMFold_ABC_transporter_substrate-binding_protein	AF-Q32IB6-F1-model_v4	LOKIASV2_0929_ESMFold_ABC_transporter_substrate-binding_protein	AF-Q32IB6-F1-model_v4 Glutathione-binding protein GsiB	0.135	587	420	30	616	17	502	2.478E-20	587
LOKIASV2_0929_ESMFold_ABC_transporter_substrate-binding_protein	AF-Q0TJL8-F1-model_v4	LOKIASV2_0929_ESMFold_ABC_transporter_substrate-binding_protein	AF-Q0TJL8-F1-model_v4 Glutathione-binding protein GsiB	0.133	589	421	28	616	16	502	1.455E-20	587
LOKIASV2_0929_ESMFold_ABC_transporter_substrate-binding_protein	AF-Q8Z863-F1-model_v4	LOKIASV2_0929_ESMFold_ABC_transporter_substrate-binding_protein	AF-Q8Z863-F1-model_v4 Glutathione-binding protein GsiB	0.132	559	403	41	599	30	494	3.645E-21	585
LOKIASV2_0929_ESMFold_ABC_transporter_substrate-binding_protein	AF-Q323W4-F1-model_v4	LOKIASV2_0929_ESMFold_ABC_transporter_substrate-binding_protein	AF-Q323W4-F1-model_v4 Glutathione-binding protein GsiB	0.135	587	420	30	616	17	502	3.066E-20	582
LOKIASV2_0929_ESMFold_ABC_transporter_substrate-binding_protein	AF-A1A968-F1-model_v4	LOKIASV2_0929_ESMFold_ABC_transporter_substrate-binding_protein	AF-A1A968-F1-model_v4 Glutathione-binding protein GsiB	0.131	587	421	30	616	17	502	2.907E-20	581
LOKIASV2_0929_ESMFold_ABC_transporter_substrate-binding_protein	AF-Q1RE95-F1-model_v4	LOKIASV2_0929_ESMFold_ABC_transporter_substrate-binding_protein	AF-Q1RE95-F1-model_v4 Glutathione-binding protein GsiB	0.136	587	419	30	616	17	502	1.801E-20	581
LOKIASV2_0929_ESMFold_ABC_transporter_substrate-binding_protein	AF-Q2G2P5-F1-model_v4	LOKIASV2_0929_ESMFold_ABC_transporter_substrate-binding_protein	AF-Q2G2P5-F1-model_v4 Nickel-binding protein NikA	0.121	575	404	28	602	14	474	7.188E-20	577
LOKIASV2_0929_ESMFold_ABC_transporter_substrate-binding_protein	AF-Q8X6V9-F1-model_v4	LOKIASV2_0929_ESMFold_ABC_transporter_substrate-binding_protein	AF-Q8X6V9-F1-model_v4 Glutathione-binding protein GsiB	0.127	574	418	26	599	15	494	6.547E-21	577
LOKIASV2_0929_ESMFold_ABC_transporter_substrate-binding_protein	AF-Q3Z3V3-F1-model_v4	LOKIASV2_0929_ESMFold_ABC_transporter_substrate-binding_protein	AF-Q3Z3V3-F1-model_v4 Glutathione-binding protein GsiB	0.136	587	419	30	616	17	502	7.581E-20	573
LOKIASV2_0929_ESMFold_ABC_transporter_substrate-binding_protein	AF-Q8FUX2-F1-model_v4	LOKIASV2_0929_ESMFold_ABC_transporter_substrate-binding_protein	AF-Q8FUX2-F1-model_v4 Putative peptide-binding periplasmic protein BRA1090/BS1330_II1082	0.132	564	407	41	604	32	501	4.451E-20	561
LOKIASV2_0929_ESMFold_ABC_transporter_substrate-binding_protein	AF-Q9X4Y1-F1-model_v4	LOKIASV2_0929_ESMFold_ABC_transporter_substrate-binding_protein	AF-Q9X4Y1-F1-model_v4 Periplasmic alpha-galactoside-binding protein	0.152	600	488	41	640	104	679	2.029E-21	558
LOKIASV2_0929_ESMFold_ABC_transporter_substrate-binding_protein	AF-A2RI74-F1-model_v4	LOKIASV2_0929_ESMFold_ABC_transporter_substrate-binding_protein	AF-A2RI74-F1-model_v4 Dipeptide-binding protein	0.131	574	449	30	603	20	537	6.127E-20	557
LOKIASV2_0929_ESMFold_ABC_transporter_substrate-binding_protein	AF-P75797-F1-model_v4	LOKIASV2_0929_ESMFold_ABC_transporter_substrate-binding_protein	AF-P75797-F1-model_v4 Glutathione-binding protein GsiB	0.137	572	412	28	599	17	494	2.478E-20	556
LOKIASV2_0929_ESMFold_ABC_transporter_substrate-binding_protein	AF-Q8VQK3-F1-model_v4	LOKIASV2_0929_ESMFold_ABC_transporter_substrate-binding_protein	AF-Q8VQK3-F1-model_v4 Putative peptide-binding periplasmic protein BruAb2_1030	0.131	579	429	28	606	14	508	1.362E-19	532
LOKIASV2_0929_ESMFold_ABC_transporter_substrate-binding_protein	AF-Q8YDG6-F1-model_v4	LOKIASV2_0929_ESMFold_ABC_transporter_substrate-binding_protein	AF-Q8YDG6-F1-model_v4 Putative peptide-binding periplasmic protein BMEII0210	0.134	564	406	41	604	32	501	7.188E-20	528
LOKIASV2_0929_ESMFold_ABC_transporter_substrate-binding_protein	AF-Q2YJK2-F1-model_v4	LOKIASV2_0929_ESMFold_ABC_transporter_substrate-binding_protein	AF-Q2YJK2-F1-model_v4 Putative peptide-binding periplasmic protein BAB2_1049	0.134	566	412	41	606	32	508	1.224E-19	523
LOKIASV2_0929_ESMFold_ABC_transporter_substrate-binding_protein	AF-P45285-F1-model_v4	LOKIASV2_0929_ESMFold_ABC_transporter_substrate-binding_protein	AF-P45285-F1-model_v4 Peptide transport periplasmic protein SapA	0.133	600	474	5	604	3	550	4.886E-19	520
LOKIASV2_0929_ESMFold_ABC_transporter_substrate-binding_protein	AF-Q577X5-F1-model_v4	LOKIASV2_0929_ESMFold_ABC_transporter_substrate-binding_protein	AF-Q577X5-F1-model_v4 Putative binding protein BruAb2_0648	0.161	556	441	41	596	67	593	9.504E-21	517
LOKIASV2_0929_ESMFold_ABC_transporter_substrate-binding_protein	AF-Q8YC41-F1-model_v4	LOKIASV2_0929_ESMFold_ABC_transporter_substrate-binding_protein	AF-Q8YC41-F1-model_v4 Putative binding protein BMEII0691	0.167	556	438	41	596	66	592	4.510E-21	513
LOKIASV2_0929_ESMFold_ABC_transporter_substrate-binding_protein	AF-P9WGU4-F1-model_v4	LOKIASV2_0929_ESMFold_ABC_transporter_substrate-binding_protein	AF-P9WGU4-F1-model_v4 Uncharacterized protein MT1317	0.139	557	414	40	596	88	569	8.777E-19	511
LOKIASV2_0929_ESMFold_ABC_transporter_substrate-binding_protein	AF-Q2YKJ5-F1-model_v4	LOKIASV2_0929_ESMFold_ABC_transporter_substrate-binding_protein	AF-Q2YKJ5-F1-model_v4 Putative binding protein BAB2_0664	0.158	556	443	41	596	67	593	1.455E-20	511
LOKIASV2_0929_ESMFold_ABC_transporter_substrate-binding_protein	AF-P66772-F1-model_v4	LOKIASV2_0929_ESMFold_ABC_transporter_substrate-binding_protein	AF-P66772-F1-model_v4 Uncharacterized protein Mb1311c	0.136	557	416	40	596	88	569	1.495E-18	506
LOKIASV2_0929_ESMFold_ABC_transporter_substrate-binding_protein	AF-Q8FW84-F1-model_v4	LOKIASV2_0929_ESMFold_ABC_transporter_substrate-binding_protein	AF-Q8FW84-F1-model_v4 Putative binding protein BRA0576/BS1330_II0571	0.165	556	439	41	596	67	593	1.619E-20	501
LOKIASV2_0929_ESMFold_ABC_transporter_substrate-binding_protein	AF-P9WGU5-F1-model_v4	LOKIASV2_0929_ESMFold_ABC_transporter_substrate-binding_protein	AF-P9WGU5-F1-model_v4 Uncharacterized protein Rv1280c	0.141	557	413	40	596	88	569	3.504E-18	500
LOKIASV2_0929_ESMFold_ABC_transporter_substrate-binding_protein	AF-P9WL77-F1-model_v4	LOKIASV2_0929_ESMFold_ABC_transporter_substrate-binding_protein	AF-P9WL77-F1-model_v4 Uncharacterized lipoprotein Rv2585c	0.135	585	456	25	609	22	549	7.481E-19	497
LOKIASV2_0929_ESMFold_ABC_transporter_substrate-binding_protein	AF-Q07741-F1-model_v4	LOKIASV2_0929_ESMFold_ABC_transporter_substrate-binding_protein	AF-Q07741-F1-model_v4 Oligopeptide-binding protein OppA	0.138	588	465	40	627	54	593	1.145E-18	496
LOKIASV2_0929_ESMFold_ABC_transporter_substrate-binding_protein	AF-Q02VA9-F1-model_v4	LOKIASV2_0929_ESMFold_ABC_transporter_substrate-binding_protein	AF-Q02VA9-F1-model_v4 Oligopeptide-binding protein OppA	0.144	588	461	40	627	54	593	1.495E-18	491
LOKIASV2_0929_ESMFold_ABC_transporter_substrate-binding_protein	AF-Q9CEK0-F1-model_v4	LOKIASV2_0929_ESMFold_ABC_transporter_substrate-binding_protein	AF-Q9CEK0-F1-model_v4 Oligopeptide-binding protein OppA	0.141	588	463	40	627	54	593	4.111E-18	488
LOKIASV2_0929_ESMFold_ABC_transporter_substrate-binding_protein	AF-P33913-F1-model_v4	LOKIASV2_0929_ESMFold_ABC_transporter_substrate-binding_protein	AF-P33913-F1-model_v4 Uncharacterized protein YejA	0.145	583	466	41	623	56	601	4.165E-19	484
LOKIASV2_0929_ESMFold_ABC_transporter_substrate-binding_protein	AF-P0A4G1-F1-model_v4	LOKIASV2_0929_ESMFold_ABC_transporter_substrate-binding_protein	AF-P0A4G1-F1-model_v4 Oligopeptide-binding protein AliB	0.133	571	490	27	592	18	588	6.127E-20	482
LOKIASV2_0929_ESMFold_ABC_transporter_substrate-binding_protein	AF-Q49646-F1-model_v4	LOKIASV2_0929_ESMFold_ABC_transporter_substrate-binding_protein	AF-Q49646-F1-model_v4 Uncharacterized lipoprotein ML0489	0.129	582	456	28	609	23	547	3.897E-18	479
LOKIASV2_0929_ESMFold_ABC_transporter_substrate-binding_protein	AF-P55691-F1-model_v4	LOKIASV2_0929_ESMFold_ABC_transporter_substrate-binding_protein	AF-P55691-F1-model_v4 Uncharacterized protein y4wM	0.153	568	456	41	608	67	605	5.733E-19	479
LOKIASV2_0929_ESMFold_ABC_transporter_substrate-binding_protein	AF-P9WL76-F1-model_v4	LOKIASV2_0929_ESMFold_ABC_transporter_substrate-binding_protein	AF-P9WL76-F1-model_v4 Uncharacterized lipoprotein MT2662	0.137	585	455	25	609	22	549	5.086E-18	477
LOKIASV2_0929_ESMFold_ABC_transporter_substrate-binding_protein	AF-P0A4G0-F1-model_v4	LOKIASV2_0929_ESMFold_ABC_transporter_substrate-binding_protein	AF-P0A4G0-F1-model_v4 Oligopeptide-binding protein AliB	0.138	568	484	30	592	21	588	2.869E-19	475
LOKIASV2_0929_ESMFold_ABC_transporter_substrate-binding_protein	AF-P59984-F1-model_v4	LOKIASV2_0929_ESMFold_ABC_transporter_substrate-binding_protein	AF-P59984-F1-model_v4 Uncharacterized lipoprotein Mb2616c	0.147	585	450	25	609	22	549	2.832E-18	473
LOKIASV2_0929_ESMFold_ABC_transporter_substrate-binding_protein	AF-P44572-F1-model_v4	LOKIASV2_0929_ESMFold_ABC_transporter_substrate-binding_protein	AF-P44572-F1-model_v4 Putative binding protein HI_0213	0.104	563	400	41	603	50	496	5.364E-18	452
LOKIASV2_0929_ESMFold_ABC_transporter_substrate-binding_protein	AF-P31306-F1-model_v4	LOKIASV2_0929_ESMFold_ABC_transporter_substrate-binding_protein	AF-P31306-F1-model_v4 Oligopeptide-binding protein SarA	0.135	567	487	28	591	31	597	1.597E-19	445
LOKIASV2_0929_ESMFold_ABC_transporter_substrate-binding_protein	AF-P35592-F1-model_v4	LOKIASV2_0929_ESMFold_ABC_transporter_substrate-binding_protein	AF-P35592-F1-model_v4 Oligopeptide-binding protein AliA	0.138	576	491	27	597	23	598	1.145E-18	433
LOKIASV2_0929_ESMFold_ABC_transporter_substrate-binding_protein	AF-A0R2I8-F1-model_v4	LOKIASV2_0929_ESMFold_ABC_transporter_substrate-binding_protein	AF-A0R2I8-F1-model_v4 Probable monoacyl phosphatidylinositol tetramannoside-binding protein LpqW	0.120	602	517	25	626	37	625	1.475E-17	422
LOKIASV2_0929_ESMFold_ABC_transporter_substrate-binding_protein	AF-P18791-F1-model_v4	LOKIASV2_0929_ESMFold_ABC_transporter_substrate-binding_protein	AF-P18791-F1-model_v4 Oligopeptide-binding protein AmiA	0.118	588	513	45	627	36	623	2.650E-17	416
LOKIASV2_0929_ESMFold_ABC_transporter_substrate-binding_protein	AF-O07570-F1-model_v4	LOKIASV2_0929_ESMFold_ABC_transporter_substrate-binding_protein	AF-O07570-F1-model_v4 Uncharacterized protein YhjP	0.111	564	382	42	605	135	565	5.735E-15	390
LOKIASV2_0929_ESMFold_ABC_transporter_substrate-binding_protein	AF-P9WGU7-F1-model_v4	LOKIASV2_0929_ESMFold_ABC_transporter_substrate-binding_protein	AF-P9WGU7-F1-model_v4 Probable monoacyl phosphatidylinositol tetramannoside-binding protein LpqW	0.110	602	530	25	626	37	632	9.897E-16	384
LOKIASV2_0929_ESMFold_ABC_transporter_substrate-binding_protein	AF-P9WGU6-F1-model_v4	LOKIASV2_0929_ESMFold_ABC_transporter_substrate-binding_protein	AF-P9WGU6-F1-model_v4 Probable monoacyl phosphatidylinositol tetramannoside-binding protein LpqW	0.120	602	524	25	626	37	632	1.101E-15	376
LOKIASV2_0929_ESMFold_ABC_transporter_substrate-binding_protein	AF-Q3Z5U2-F1-model_v4	LOKIASV2_0929_ESMFold_ABC_transporter_substrate-binding_protein	AF-Q3Z5U2-F1-model_v4 HTH-type transcriptional regulator SgrR	0.105	563	371	42	604	121	536	2.142E-13	341
LOKIASV2_0929_ESMFold_ABC_transporter_substrate-binding_protein	AF-A1A7B8-F1-model_v4	LOKIASV2_0929_ESMFold_ABC_transporter_substrate-binding_protein	AF-A1A7B8-F1-model_v4 HTH-type transcriptional regulator SgrR	0.110	563	369	42	604	121	536	1.642E-13	341
LOKIASV2_0929_ESMFold_ABC_transporter_substrate-binding_protein	AF-P33595-F1-model_v4	LOKIASV2_0929_ESMFold_ABC_transporter_substrate-binding_protein	AF-P33595-F1-model_v4 HTH-type transcriptional regulator SgrR	0.101	563	373	42	604	121	536	3.280E-13	329
LOKIASV2_0929_ESMFold_ABC_transporter_substrate-binding_protein	AF-Q326G6-F1-model_v4	LOKIASV2_0929_ESMFold_ABC_transporter_substrate-binding_protein	AF-Q326G6-F1-model_v4 HTH-type transcriptional regulator SgrR	0.096	563	375	42	604	121	536	4.280E-13	327
LOKIASV2_0929_ESMFold_ABC_transporter_substrate-binding_protein	AF-Q0T8C8-F1-model_v4	LOKIASV2_0929_ESMFold_ABC_transporter_substrate-binding_protein	AF-Q0T8C8-F1-model_v4 HTH-type transcriptional regulator SgrR	0.101	563	373	42	604	121	536	5.586E-13	325
LOKIASV2_0929_ESMFold_ABC_transporter_substrate-binding_protein	AF-Q8FL80-F1-model_v4	LOKIASV2_0929_ESMFold_ABC_transporter_substrate-binding_protein	AF-Q8FL80-F1-model_v4 HTH-type transcriptional regulator SgrR	0.098	563	374	42	604	121	536	6.214E-13	323
LOKIASV2_0929_ESMFold_ABC_transporter_substrate-binding_protein	AF-Q83SP3-F1-model_v4	LOKIASV2_0929_ESMFold_ABC_transporter_substrate-binding_protein	AF-Q83SP3-F1-model_v4 HTH-type transcriptional regulator SgrR	0.103	563	372	42	604	121	536	7.688E-13	322
LOKIASV2_0929_ESMFold_ABC_transporter_substrate-binding_protein	AF-Q32K24-F1-model_v4	LOKIASV2_0929_ESMFold_ABC_transporter_substrate-binding_protein	AF-Q32K24-F1-model_v4 HTH-type transcriptional regulator SgrR	0.102	563	373	42	604	121	536	1.116E-12	322
LOKIASV2_0929_ESMFold_ABC_transporter_substrate-binding_protein	AF-Q1RGC7-F1-model_v4	LOKIASV2_0929_ESMFold_ABC_transporter_substrate-binding_protein	AF-Q1RGC7-F1-model_v4 HTH-type transcriptional regulator SgrR	0.098	563	374	42	604	121	536	8.552E-13	321
LOKIASV2_0929_ESMFold_ABC_transporter_substrate-binding_protein	AF-Q0TLR9-F1-model_v4	LOKIASV2_0929_ESMFold_ABC_transporter_substrate-binding_protein	AF-Q0TLR9-F1-model_v4 HTH-type transcriptional regulator SgrR	0.102	563	373	42	604	121	536	1.058E-12	317
LOKIASV2_0929_ESMFold_ABC_transporter_substrate-binding_protein	AF-Q8XA02-F1-model_v4	LOKIASV2_0929_ESMFold_ABC_transporter_substrate-binding_protein	AF-Q8XA02-F1-model_v4 HTH-type transcriptional regulator SgrR	0.103	563	372	42	604	121	536	8.552E-13	316
LOKIASV2_0929_ESMFold_ABC_transporter_substrate-binding_protein	AF-Q74Q56-F1-model_v4	LOKIASV2_0929_ESMFold_ABC_transporter_substrate-binding_protein	AF-Q74Q56-F1-model_v4 HTH-type transcriptional regulator SgrR	0.098	563	376	42	604	121	538	1.536E-12	316
LOKIASV2_0929_ESMFold_ABC_transporter_substrate-binding_protein	AF-A4TQA7-F1-model_v4	LOKIASV2_0929_ESMFold_ABC_transporter_substrate-binding_protein	AF-A4TQA7-F1-model_v4 HTH-type transcriptional regulator SgrR	0.095	563	376	42	604	123	538	2.114E-12	309
LOKIASV2_0929_ESMFold_ABC_transporter_substrate-binding_protein	AF-Q5PDG5-F1-model_v4	LOKIASV2_0929_ESMFold_ABC_transporter_substrate-binding_protein	AF-Q5PDG5-F1-model_v4 HTH-type transcriptional regulator SgrR	0.102	563	374	42	604	121	537	3.798E-12	308
LOKIASV2_0929_ESMFold_ABC_transporter_substrate-binding_protein	AF-Q1C1Y8-F1-model_v4	LOKIASV2_0929_ESMFold_ABC_transporter_substrate-binding_protein	AF-Q1C1Y8-F1-model_v4 HTH-type transcriptional regulator SgrR	0.093	563	378	42	604	121	538	2.230E-12	305
LOKIASV2_0929_ESMFold_ABC_transporter_substrate-binding_protein	AF-Q66EM6-F1-model_v4	LOKIASV2_0929_ESMFold_ABC_transporter_substrate-binding_protein	AF-Q66EM6-F1-model_v4 HTH-type transcriptional regulator SgrR	0.100	563	374	42	604	123	538	5.513E-12	294
LOKIASV2_0929_ESMFold_ABC_transporter_substrate-binding_protein	AF-Q1CMQ0-F1-model_v4	LOKIASV2_0929_ESMFold_ABC_transporter_substrate-binding_protein	AF-Q1CMQ0-F1-model_v4 HTH-type transcriptional regulator SgrR	0.094	563	376	42	604	123	538	6.821E-12	289
LOKIASV2_0929_ESMFold_ABC_transporter_substrate-binding_protein	AF-Q8Z9I4-F1-model_v4	LOKIASV2_0929_ESMFold_ABC_transporter_substrate-binding_protein	AF-Q8Z9I4-F1-model_v4 HTH-type transcriptional regulator SgrR	0.100	563	374	42	604	121	537	2.087E-11	288
LOKIASV2_0929_ESMFold_ABC_transporter_substrate-binding_protein	AF-Q57TF2-F1-model_v4	LOKIASV2_0929_ESMFold_ABC_transporter_substrate-binding_protein	AF-Q57TF2-F1-model_v4 HTH-type transcriptional regulator SgrR	0.101	563	372	42	604	123	537	9.902E-12	280
LOKIASV2_0929_ESMFold_ABC_transporter_substrate-binding_protein	AF-A1JJG7-F1-model_v4	LOKIASV2_0929_ESMFold_ABC_transporter_substrate-binding_protein	AF-A1JJG7-F1-model_v4 HTH-type transcriptional regulator SgrR	0.091	563	377	42	604	123	538	4.956E-12	278
LOKIASV2_0929_ESMFold_ABC_transporter_substrate-binding_protein	AF-Q8ZRV0-F1-model_v4	LOKIASV2_0929_ESMFold_ABC_transporter_substrate-binding_protein	AF-Q8ZRV0-F1-model_v4 HTH-type transcriptional regulator SgrR	0.096	563	374	42	604	123	537	1.599E-11	274
LOKIASV2_0929_ESMFold_ABC_transporter_substrate-binding_protein	AF-P46890-F1-model_v4	LOKIASV2_0929_ESMFold_ABC_transporter_substrate-binding_protein	AF-P46890-F1-model_v4 Uncharacterized protein YbaE	0.097	571	382	56	626	138	561	5.738E-11	271
LOKIASV2_0929_ESMFold_ABC_transporter_substrate-binding_protein	AF-Q6D0F8-F1-model_v4	LOKIASV2_0929_ESMFold_ABC_transporter_substrate-binding_protein	AF-Q6D0F8-F1-model_v4 HTH-type transcriptional regulator SgrR	0.092	563	376	42	604	123	537	1.087E-10	256
