query	target	qheader	theader	fident	alnlen	mismatch	qstart	qend	tstart	tend	evalue	bits
LOKIASV2_1058_ESMFold_hypothetical_protein	AF-P71333-F1-model_v4	LOKIASV2_1058_ESMFold_hypothetical_protein	AF-P71333-F1-model_v4 Ferric uptake regulation protein	0.131	89	72	124	212	4	87	2.720E-01	66
LOKIASV2_1058_ESMFold_hypothetical_protein	AF-O93479-F1-model_v4	LOKIASV2_1058_ESMFold_hypothetical_protein	AF-O93479-F1-model_v4 Origin recognition complex subunit 4	0.132	83	65	139	214	325	407	5.972E-01	58
LOKIASV2_1058_ESMFold_hypothetical_protein	AF-Q99T18-F1-model_v4	LOKIASV2_1058_ESMFold_hypothetical_protein	AF-Q99T18-F1-model_v4 Peroxide-responsive repressor PerR	0.131	119	93	118	225	8	126	2.010E-01	56
LOKIASV2_1058_ESMFold_hypothetical_protein	AF-Q03456-F1-model_v4	LOKIASV2_1058_ESMFold_hypothetical_protein	AF-Q03456-F1-model_v4 Ferric uptake regulation protein	0.125	88	71	125	212	3	84	8.586E-01	54
LOKIASV2_1058_ESMFold_hypothetical_protein	AF-Q6P9Z8-F1-model_v4	LOKIASV2_1058_ESMFold_hypothetical_protein	AF-Q6P9Z8-F1-model_v4 Origin recognition complex subunit 4	0.120	83	66	139	214	325	407	1.029E+00	54
LOKIASV2_1058_ESMFold_hypothetical_protein	AF-P9WN84-F1-model_v4	LOKIASV2_1058_ESMFold_hypothetical_protein	AF-P9WN84-F1-model_v4 Zinc uptake regulation protein	0.130	69	54	144	212	15	77	7.161E-01	53
LOKIASV2_1058_ESMFold_hypothetical_protein	AF-Q4U3P8-F1-model_v4	LOKIASV2_1058_ESMFold_hypothetical_protein	AF-Q4U3P8-F1-model_v4 Origin recognition complex subunit 4	0.120	83	66	139	214	327	409	1.029E+00	53
LOKIASV2_1058_ESMFold_hypothetical_protein	AF-P9WN85-F1-model_v4	LOKIASV2_1058_ESMFold_hypothetical_protein	AF-P9WN85-F1-model_v4 Zinc uptake regulation protein	0.130	69	54	144	212	15	77	8.082E-01	52
LOKIASV2_1058_ESMFold_hypothetical_protein	AF-Q48835-F1-model_v4	LOKIASV2_1058_ESMFold_hypothetical_protein	AF-Q48835-F1-model_v4 Ferric uptake regulation protein	0.073	117	95	124	227	2	118	3.465E-01	51
LOKIASV2_1058_ESMFold_hypothetical_protein	AF-Q6GFJ6-F1-model_v4	LOKIASV2_1058_ESMFold_hypothetical_protein	AF-Q6GFJ6-F1-model_v4 Peroxide-responsive repressor PerR	0.119	120	95	117	225	7	126	2.890E-01	51
LOKIASV2_1058_ESMFold_hypothetical_protein	AF-Q2YDI2-F1-model_v4	LOKIASV2_1058_ESMFold_hypothetical_protein	AF-Q2YDI2-F1-model_v4 Origin recognition complex subunit 4	0.120	83	66	139	214	327	409	1.234E+00	51
LOKIASV2_1058_ESMFold_hypothetical_protein	AF-Q9RQL3-F1-model_v4	LOKIASV2_1058_ESMFold_hypothetical_protein	AF-Q9RQL3-F1-model_v4 Peroxide-responsive repressor PerR	0.112	120	96	117	225	7	126	3.681E-01	50
LOKIASV2_1058_ESMFold_hypothetical_protein	AF-Q97FU2-F1-model_v4	LOKIASV2_1058_ESMFold_hypothetical_protein	AF-Q97FU2-F1-model_v4 Transcriptional regulator PerR	0.139	110	84	126	223	4	113	3.681E-01	49
LOKIASV2_1058_ESMFold_hypothetical_protein	AF-O88708-F1-model_v4	LOKIASV2_1058_ESMFold_hypothetical_protein	AF-O88708-F1-model_v4 Origin recognition complex subunit 4	0.120	83	66	139	214	324	406	1.670E+00	49
LOKIASV2_1058_ESMFold_hypothetical_protein	AF-Q5R6Z7-F1-model_v4	LOKIASV2_1058_ESMFold_hypothetical_protein	AF-Q5R6Z7-F1-model_v4 Origin recognition complex subunit 4	0.108	83	67	139	214	327	409	1.775E+00	49
LOKIASV2_1058_ESMFold_hypothetical_protein	AF-Q6EWX1-F1-model_v4	LOKIASV2_1058_ESMFold_hypothetical_protein	AF-Q6EWX1-F1-model_v4 Origin of replication complex subunit 4	0.095	84	69	136	212	310	393	1.029E+00	47
LOKIASV2_1058_ESMFold_hypothetical_protein	AF-O43929-F1-model_v4	LOKIASV2_1058_ESMFold_hypothetical_protein	AF-O43929-F1-model_v4 Origin recognition complex subunit 4	0.129	85	66	138	214	325	409	1.885E+00	46
LOKIASV2_1058_ESMFold_hypothetical_protein	AF-Q2NIC5-F1-model_v4	LOKIASV2_1058_ESMFold_hypothetical_protein	AF-Q2NIC5-F1-model_v4 ORC1-type DNA replication protein	0.112	103	89	123	223	281	383	1.234E+00	44
LOKIASV2_1058_ESMFold_hypothetical_protein	AF-Q58910-F1-model_v4	LOKIASV2_1058_ESMFold_hypothetical_protein	AF-Q58910-F1-model_v4 Uncharacterized protein MJ1515	0.152	70	58	155	223	274	343	2.710E+00	42
LOKIASV2_1058_ESMFold_hypothetical_protein	AF-Q54RM2-F1-model_v4	LOKIASV2_1058_ESMFold_hypothetical_protein	AF-Q54RM2-F1-model_v4 Origin recognition complex subunit 1	0.182	98	79	117	213	512	609	1.480E+00	42
LOKIASV2_1058_ESMFold_hypothetical_protein	AF-O68563-F1-model_v4	LOKIASV2_1058_ESMFold_hypothetical_protein	AF-O68563-F1-model_v4 Ferric uptake regulation protein	0.110	111	86	125	222	3	113	1.162E+00	40
LOKIASV2_1058_ESMFold_hypothetical_protein	AF-O93774-F1-model_v4	LOKIASV2_1058_ESMFold_hypothetical_protein	AF-O93774-F1-model_v4 HTH-type transcriptional regulator lrs14	0.055	103	88	139	241	31	124	6.345E-01	40
LOKIASV2_1058_ESMFold_hypothetical_protein	AF-Q9P2W1-F1-model_v4	LOKIASV2_1058_ESMFold_hypothetical_protein	AF-Q9P2W1-F1-model_v4 Homologous-pairing protein 2 homolog	0.131	156	129	139	287	12	167	4.413E-01	40
LOKIASV2_1058_ESMFold_hypothetical_protein	AF-A4YJ15-F1-model_v4	LOKIASV2_1058_ESMFold_hypothetical_protein	AF-A4YJ15-F1-model_v4 Transcription factor E	0.148	147	92	119	265	4	112	6.740E-01	39
LOKIASV2_1058_ESMFold_hypothetical_protein	AF-B8APQ0-F1-model_v4	LOKIASV2_1058_ESMFold_hypothetical_protein	AF-B8APQ0-F1-model_v4 Origin of replication complex subunit 2	0.118	99	83	119	217	279	373	4.963E+00	39
LOKIASV2_1058_ESMFold_hypothetical_protein	AF-Q10QS7-F1-model_v4	LOKIASV2_1058_ESMFold_hypothetical_protein	AF-Q10QS7-F1-model_v4 Origin of replication complex subunit 2	0.132	119	96	104	222	267	378	4.139E+00	38
LOKIASV2_1058_ESMFold_hypothetical_protein	AF-Q0W8N8-F1-model_v4	LOKIASV2_1058_ESMFold_hypothetical_protein	AF-Q0W8N8-F1-model_v4 Transcription factor E	0.114	147	113	139	267	20	166	1.029E+00	35
LOKIASV2_1058_ESMFold_hypothetical_protein	AF-A2BLW2-F1-model_v4	LOKIASV2_1058_ESMFold_hypothetical_protein	AF-A2BLW2-F1-model_v4 Transcription factor E	0.114	135	113	126	260	5	133	1.670E+00	35
LOKIASV2_1058_ESMFold_hypothetical_protein	AF-P39044-F1-model_v4	LOKIASV2_1058_ESMFold_hypothetical_protein	AF-P39044-F1-model_v4 Uncharacterized protein X	0.130	84	70	158	241	29	109	2.003E+00	34
LOKIASV2_1058_ESMFold_hypothetical_protein	AF-Q2KI56-F1-model_v4	LOKIASV2_1058_ESMFold_hypothetical_protein	AF-Q2KI56-F1-model_v4 COP9 signalosome complex subunit 7b	0.149	149	112	139	287	97	229	9.121E-01	34
LOKIASV2_1058_ESMFold_hypothetical_protein	AF-Q5V3R0-F1-model_v4	LOKIASV2_1058_ESMFold_hypothetical_protein	AF-Q5V3R0-F1-model_v4 Transcription factor E	0.092	115	98	125	239	2	110	1.234E+00	33
LOKIASV2_1058_ESMFold_hypothetical_protein	AF-Q91ZY6-F1-model_v4	LOKIASV2_1058_ESMFold_hypothetical_protein	AF-Q91ZY6-F1-model_v4 Homologous-pairing protein 2 homolog	0.113	157	132	138	287	11	167	1.572E+00	33
LOKIASV2_1058_ESMFold_hypothetical_protein	AF-Q8BV13-F1-model_v4	LOKIASV2_1058_ESMFold_hypothetical_protein	AF-Q8BV13-F1-model_v4 COP9 signalosome complex subunit 7b	0.149	149	112	139	287	97	229	9.690E-01	33
LOKIASV2_1058_ESMFold_hypothetical_protein	AF-Q12YV9-F1-model_v4	LOKIASV2_1058_ESMFold_hypothetical_protein	AF-Q12YV9-F1-model_v4 Transcription factor E	0.176	68	52	172	239	44	107	1.885E+00	31
LOKIASV2_1058_ESMFold_hypothetical_protein	AF-Q3IP08-F1-model_v4	LOKIASV2_1058_ESMFold_hypothetical_protein	AF-Q3IP08-F1-model_v4 Transcription factor E	0.079	88	71	152	239	33	110	3.896E+00	30
LOKIASV2_1058_ESMFold_hypothetical_protein	AF-Q9UUJ7-F1-model_v4	LOKIASV2_1058_ESMFold_hypothetical_protein	AF-Q9UUJ7-F1-model_v4 COP9 signalosome complex subunit 7	0.156	122	95	156	277	81	194	8.082E-01	30
LOKIASV2_1058_ESMFold_hypothetical_protein	AF-Q9HGK2-F1-model_v4	LOKIASV2_1058_ESMFold_hypothetical_protein	AF-Q9HGK2-F1-model_v4 Homologous-pairing protein 2	0.093	158	136	136	286	14	171	2.551E+00	29
LOKIASV2_1058_ESMFold_hypothetical_protein	AF-Q46G12-F1-model_v4	LOKIASV2_1058_ESMFold_hypothetical_protein	AF-Q46G12-F1-model_v4 Transcription factor E	0.116	85	66	155	239	32	107	5.951E+00	28
LOKIASV2_1058_ESMFold_hypothetical_protein	AF-Q5B0Y2-F1-model_v4	LOKIASV2_1058_ESMFold_hypothetical_protein	AF-Q5B0Y2-F1-model_v4 COP9 signalosome complex subunit 3	0.141	145	119	139	278	347	491	3.896E+00	28
LOKIASV2_1058_ESMFold_hypothetical_protein	AF-Q80WW9-F1-model_v4	LOKIASV2_1058_ESMFold_hypothetical_protein	AF-Q80WW9-F1-model_v4 DDRGK domain-containing protein 1	0.108	215	176	26	223	74	288	1.393E+00	27
LOKIASV2_1058_ESMFold_hypothetical_protein	AF-Q5JDD5-F1-model_v4	LOKIASV2_1058_ESMFold_hypothetical_protein	AF-Q5JDD5-F1-model_v4 Transcription factor E	0.082	178	150	114	277	1	178	4.672E+00	25
LOKIASV2_1058_ESMFold_hypothetical_protein	AF-Q48AN9-F1-model_v4	LOKIASV2_1058_ESMFold_hypothetical_protein	AF-Q48AN9-F1-model_v4 UPF0502 protein CPS_0106	0.144	112	86	155	266	110	210	5.951E+00	25
LOKIASV2_1058_ESMFold_hypothetical_protein	AF-Q58651-F1-model_v4	LOKIASV2_1058_ESMFold_hypothetical_protein	AF-Q58651-F1-model_v4 Uncharacterized protein MJ1254	0.146	207	138	6	212	301	463	2.551E+00	25
LOKIASV2_1058_ESMFold_hypothetical_protein	AF-Q55BD5-F1-model_v4	LOKIASV2_1058_ESMFold_hypothetical_protein	AF-Q55BD5-F1-model_v4 COP9 signalosome complex subunit 7	0.096	144	126	139	278	99	242	3.059E+00	24
LOKIASV2_1058_ESMFold_hypothetical_protein	AF-Q9VDD1-F1-model_v4	LOKIASV2_1058_ESMFold_hypothetical_protein	AF-Q9VDD1-F1-model_v4 DDRGK domain-containing protein 1	0.103	184	164	40	223	94	277	4.397E+00	24
LOKIASV2_1058_ESMFold_hypothetical_protein	AF-Q14188-F1-model_v4	LOKIASV2_1058_ESMFold_hypothetical_protein	AF-Q14188-F1-model_v4 Transcription factor Dp-2	0.139	102	85	139	238	135	236	9.089E+00	24
LOKIASV2_1058_ESMFold_hypothetical_protein	AF-Q55CM7-F1-model_v4	LOKIASV2_1058_ESMFold_hypothetical_protein	AF-Q55CM7-F1-model_v4 DDRGK domain-containing protein 1	0.147	250	171	3	252	134	335	1.393E+00	23
LOKIASV2_1058_ESMFold_hypothetical_protein	AF-O58353-F1-model_v4	LOKIASV2_1058_ESMFold_hypothetical_protein	AF-O58353-F1-model_v4 Transcription factor E	0.109	134	94	172	277	44	177	2.260E+00	22
LOKIASV2_1058_ESMFold_hypothetical_protein	AF-B4JG35-F1-model_v4	LOKIASV2_1058_ESMFold_hypothetical_protein	AF-B4JG35-F1-model_v4 DDRGK domain-containing protein 1	0.103	217	176	27	223	57	273	3.668E+00	22
LOKIASV2_1058_ESMFold_hypothetical_protein	AF-Q4A917-F1-model_v4	LOKIASV2_1058_ESMFold_hypothetical_protein	AF-Q4A917-F1-model_v4 Valine--tRNA ligase	0.122	130	107	137	266	693	815	4.139E+00	22
LOKIASV2_1058_ESMFold_hypothetical_protein	AF-B0K9H1-F1-model_v4	LOKIASV2_1058_ESMFold_hypothetical_protein	AF-B0K9H1-F1-model_v4 Segregation and condensation protein A	0.149	225	172	11	213	13	237	3.250E+00	21
LOKIASV2_1058_ESMFold_hypothetical_protein	AF-Q9UYS6-F1-model_v4	LOKIASV2_1058_ESMFold_hypothetical_protein	AF-Q9UYS6-F1-model_v4 Transcription factor E	0.118	172	130	140	287	12	183	4.963E+00	20
LOKIASV2_1058_ESMFold_hypothetical_protein	AF-Q9V4S8-F1-model_v4	LOKIASV2_1058_ESMFold_hypothetical_protein	AF-Q9V4S8-F1-model_v4 COP9 signalosome complex subunit 7	0.116	149	114	139	287	105	234	9.655E+00	20
LOKIASV2_1058_ESMFold_hypothetical_protein	AF-C0KYB6-F1-model_v4	LOKIASV2_1058_ESMFold_hypothetical_protein	AF-C0KYB6-F1-model_v4 DDRGK domain-containing protein 1	0.115	219	177	23	223	45	263	6.716E+00	20
LOKIASV2_1058_ESMFold_hypothetical_protein	AF-B0K158-F1-model_v4	LOKIASV2_1058_ESMFold_hypothetical_protein	AF-B0K158-F1-model_v4 Segregation and condensation protein A	0.149	225	172	11	213	13	237	4.672E+00	19
LOKIASV2_1058_ESMFold_hypothetical_protein	AF-C3Y431-F1-model_v4	LOKIASV2_1058_ESMFold_hypothetical_protein	AF-C3Y431-F1-model_v4 DDRGK domain-containing protein 1	0.119	239	210	23	261	59	297	6.716E+00	19
LOKIASV2_1058_ESMFold_hypothetical_protein	AF-C5E006-F1-model_v4	LOKIASV2_1058_ESMFold_hypothetical_protein	AF-C5E006-F1-model_v4 Monopolar spindle protein 2	0.100	227	194	62	288	124	340	3.059E+00	19
LOKIASV2_1058_ESMFold_hypothetical_protein	AF-Q7S7G7-F1-model_v4	LOKIASV2_1058_ESMFold_hypothetical_protein	AF-Q7S7G7-F1-model_v4 COP9 signalosome complex subunit 3	0.169	121	86	173	277	373	493	3.668E+00	19
LOKIASV2_1058_ESMFold_hypothetical_protein	AF-Q4A755-F1-model_v4	LOKIASV2_1058_ESMFold_hypothetical_protein	AF-Q4A755-F1-model_v4 Valine--tRNA ligase	0.177	101	81	169	267	720	820	5.273E+00	18
LOKIASV2_1058_ESMFold_hypothetical_protein	AF-Q1LZB0-F1-model_v4	LOKIASV2_1058_ESMFold_hypothetical_protein	AF-Q1LZB0-F1-model_v4 DDRGK domain-containing protein 1	0.113	216	177	23	223	71	286	9.089E+00	17
LOKIASV2_1058_ESMFold_hypothetical_protein	AF-Q5ZZL4-F1-model_v4	LOKIASV2_1058_ESMFold_hypothetical_protein	AF-Q5ZZL4-F1-model_v4 Valine--tRNA ligase	0.177	101	81	169	267	720	820	9.655E+00	17
LOKIASV2_1058_ESMFold_hypothetical_protein	AF-Q9ASW3-F1-model_v4	LOKIASV2_1058_ESMFold_hypothetical_protein	AF-Q9ASW3-F1-model_v4 Protein IQ-DOMAIN 21	0.120	246	207	42	277	57	302	6.322E+00	14
LOKIASV2_1058_ESMFold_hypothetical_protein	AF-C0H537-F1-model_v4	LOKIASV2_1058_ESMFold_hypothetical_protein	AF-C0H537-F1-model_v4 tRNA (guanine(37)-N1)-methyltransferase	0.129	228	172	65	262	2	229	8.555E+00	14
LOKIASV2_1058_ESMFold_hypothetical_protein	AF-P24814-F1-model_v4	LOKIASV2_1058_ESMFold_hypothetical_protein	AF-P24814-F1-model_v4 SCF E3 ubiquitin ligase complex F-box protein GRR1	0.138	267	209	29	272	70	336	7.135E+00	14
LOKIASV2_1058_ESMFold_hypothetical_protein	AF-Q14142-F1-model_v4	LOKIASV2_1058_ESMFold_hypothetical_protein	AF-Q14142-F1-model_v4 Tripartite motif-containing protein 14	0.139	189	155	64	252	67	247	9.655E+00	13
LOKIASV2_1058_ESMFold_hypothetical_protein	AF-Q5AW04-F1-model_v4	LOKIASV2_1058_ESMFold_hypothetical_protein	AF-Q5AW04-F1-model_v4 Protein bfr2	0.128	254	213	27	280	225	469	8.555E+00	13
LOKIASV2_1058_ESMFold_hypothetical_protein	AF-P18171-F1-model_v4	LOKIASV2_1058_ESMFold_hypothetical_protein	AF-P18171-F1-model_v4 Defective chorion-1 protein, FC177 isoform	0.089	296	258	4	287	344	639	9.089E+00	13
LOKIASV2_1058_ESMFold_hypothetical_protein	AF-Q6C9G2-F1-model_v4	LOKIASV2_1058_ESMFold_hypothetical_protein	AF-Q6C9G2-F1-model_v4 Protein BFR2	0.142	280	205	41	280	126	405	9.655E+00	12
LOKIASV2_1058_ESMFold_hypothetical_protein	AF-Q5SF96-F1-model_v4	LOKIASV2_1058_ESMFold_hypothetical_protein	AF-Q5SF96-F1-model_v4 Appendage-associated protein	0.143	267	204	5	271	129	367	9.655E+00	11
