query	target	qheader	theader	fident	alnlen	mismatch	qstart	qend	tstart	tend	evalue	bits
LOKIASV2_1554_ESMFold_hypothetical_protein	AF-Q58124-F1-model_v4	LOKIASV2_1554_ESMFold_hypothetical_protein	AF-Q58124-F1-model_v4 Uncharacterized protein MJ0714	0.161	117	96	8	124	2	117	6.087E-08	273
LOKIASV2_1554_ESMFold_hypothetical_protein	AF-Q57758-F1-model_v4	LOKIASV2_1554_ESMFold_hypothetical_protein	AF-Q57758-F1-model_v4 Uncharacterized protein MJ0310	0.159	113	93	12	124	2	113	3.694E-07	251
LOKIASV2_1554_ESMFold_hypothetical_protein	AF-Q58736-F1-model_v4	LOKIASV2_1554_ESMFold_hypothetical_protein	AF-Q58736-F1-model_v4 Uncharacterized protein MJ1340	0.159	113	93	12	124	2	113	3.931E-07	250
LOKIASV2_1554_ESMFold_hypothetical_protein	AF-Q57759-F1-model_v4	LOKIASV2_1554_ESMFold_hypothetical_protein	AF-Q57759-F1-model_v4 Uncharacterized protein MJ0311	0.128	116	94	3	118	1	109	9.966E-06	178
LOKIASV2_1554_ESMFold_hypothetical_protein	AF-B5G0G8-F1-model_v4	LOKIASV2_1554_ESMFold_hypothetical_protein	AF-B5G0G8-F1-model_v4 Ragulator complex protein LAMTOR3	0.153	123	103	9	131	2	124	2.375E-04	148
LOKIASV2_1554_ESMFold_hypothetical_protein	AF-Q4SSF5-F1-model_v4	LOKIASV2_1554_ESMFold_hypothetical_protein	AF-Q4SSF5-F1-model_v4 Ragulator complex protein LAMTOR3	0.177	132	100	9	140	2	123	2.861E-04	135
LOKIASV2_1554_ESMFold_hypothetical_protein	AF-Q6Y228-F1-model_v4	LOKIASV2_1554_ESMFold_hypothetical_protein	AF-Q6Y228-F1-model_v4 Ragulator complex protein LAMTOR3	0.179	132	99	9	140	2	123	1.537E-04	134
LOKIASV2_1554_ESMFold_hypothetical_protein	AF-Q54E64-F1-model_v4	LOKIASV2_1554_ESMFold_hypothetical_protein	AF-Q54E64-F1-model_v4 TSET complex member tstC	0.122	474	357	25	498	3	410	2.083E-01	33
LOKIASV2_1554_ESMFold_hypothetical_protein	AF-Q9QZS3-F1-model_v4	LOKIASV2_1554_ESMFold_hypothetical_protein	AF-Q9QZS3-F1-model_v4 Protein numb homolog	0.122	440	315	5	364	21	460	7.239E-02	24
LOKIASV2_1554_ESMFold_hypothetical_protein	AF-B9WZ56-F1-model_v4	LOKIASV2_1554_ESMFold_hypothetical_protein	AF-B9WZ56-F1-model_v4 Putative neuropeptide precursor protein	0.152	343	248	156	498	33	326	6.788E-01	22
LOKIASV2_1554_ESMFold_hypothetical_protein	AF-A6QPE1-F1-model_v4	LOKIASV2_1554_ESMFold_hypothetical_protein	AF-A6QPE1-F1-model_v4 RNA-binding protein 48	0.093	391	271	27	417	47	346	8.704E-01	21
LOKIASV2_1554_ESMFold_hypothetical_protein	AF-Q8IZX4-F1-model_v4	LOKIASV2_1554_ESMFold_hypothetical_protein	AF-Q8IZX4-F1-model_v4 Transcription initiation factor TFIID subunit 1-like	0.121	362	274	1	362	1108	1420	5.633E-01	21
LOKIASV2_1554_ESMFold_hypothetical_protein	AF-Q02862-F1-model_v4	LOKIASV2_1554_ESMFold_hypothetical_protein	AF-Q02862-F1-model_v4 Alpha-S2-casein-like A	0.112	220	152	170	389	5	176	7.669E+00	20
LOKIASV2_1554_ESMFold_hypothetical_protein	AF-Q9BGX5-F1-model_v4	LOKIASV2_1554_ESMFold_hypothetical_protein	AF-Q9BGX5-F1-model_v4 Disabled homolog 1	0.116	342	271	2	343	20	327	6.378E-01	20
LOKIASV2_1554_ESMFold_hypothetical_protein	AF-Q967R6-F1-model_v4	LOKIASV2_1554_ESMFold_hypothetical_protein	AF-Q967R6-F1-model_v4 Cytoplasmic polyadenylation element-binding protein	0.127	334	274	107	440	64	378	8.704E-01	20
LOKIASV2_1554_ESMFold_hypothetical_protein	AF-Q68BL8-F1-model_v4	LOKIASV2_1554_ESMFold_hypothetical_protein	AF-Q68BL8-F1-model_v4 Olfactomedin-like protein 2B	0.168	343	254	1	343	37	342	3.025E-01	20
LOKIASV2_1554_ESMFold_hypothetical_protein	AF-Q9H321-F1-model_v4	LOKIASV2_1554_ESMFold_hypothetical_protein	AF-Q9H321-F1-model_v4 Variable charge X-linked protein 3B	0.184	211	135	229	439	67	232	1.725E+00	18
LOKIASV2_1554_ESMFold_hypothetical_protein	AF-O94714-F1-model_v4	LOKIASV2_1554_ESMFold_hypothetical_protein	AF-O94714-F1-model_v4 Protein spt2	0.143	388	320	106	493	32	405	1.725E+00	18
LOKIASV2_1554_ESMFold_hypothetical_protein	AF-Q54YJ7-F1-model_v4	LOKIASV2_1554_ESMFold_hypothetical_protein	AF-Q54YJ7-F1-model_v4 DNA repair protein xrcc4	0.109	260	230	85	343	111	370	1.621E+00	18
LOKIASV2_1554_ESMFold_hypothetical_protein	AF-O94356-F1-model_v4	LOKIASV2_1554_ESMFold_hypothetical_protein	AF-O94356-F1-model_v4 Meiotic expression up-regulated protein 6	0.153	341	230	77	417	220	492	1.049E+00	18
LOKIASV2_1554_ESMFold_hypothetical_protein	AF-Q87M02-F1-model_v4	LOKIASV2_1554_ESMFold_hypothetical_protein	AF-Q87M02-F1-model_v4 Translation initiation factor IF-2	0.163	325	262	9	333	6	319	6.378E-01	18
LOKIASV2_1554_ESMFold_hypothetical_protein	AF-Q5R4U2-F1-model_v4	LOKIASV2_1554_ESMFold_hypothetical_protein	AF-Q5R4U2-F1-model_v4 RNA-binding protein 48	0.096	392	281	26	417	46	357	2.354E+00	17
LOKIASV2_1554_ESMFold_hypothetical_protein	AF-Q561R3-F1-model_v4	LOKIASV2_1554_ESMFold_hypothetical_protein	AF-Q561R3-F1-model_v4 RNA-binding protein 48	0.126	392	271	26	417	46	356	1.523E+00	17
LOKIASV2_1554_ESMFold_hypothetical_protein	AF-Q9HBU1-F1-model_v4	LOKIASV2_1554_ESMFold_hypothetical_protein	AF-Q9HBU1-F1-model_v4 Homeobox protein BarH-like 1	0.098	250	204	191	417	2	251	2.505E+00	16
LOKIASV2_1554_ESMFold_hypothetical_protein	AF-O70523-F1-model_v4	LOKIASV2_1554_ESMFold_hypothetical_protein	AF-O70523-F1-model_v4 Fragile X mental retardation syndrome-related protein 1	0.106	401	281	17	417	273	587	1.345E+00	16
LOKIASV2_1554_ESMFold_hypothetical_protein	AF-F1QPR4-F1-model_v4	LOKIASV2_1554_ESMFold_hypothetical_protein	AF-F1QPR4-F1-model_v4 PAK4-inhibitor inka2	0.125	283	243	131	413	7	285	5.620E+00	15
LOKIASV2_1554_ESMFold_hypothetical_protein	AF-A1L1K8-F1-model_v4	LOKIASV2_1554_ESMFold_hypothetical_protein	AF-A1L1K8-F1-model_v4 Intracellular hyaluronan-binding protein 4	0.148	217	180	185	396	194	410	4.119E+00	15
LOKIASV2_1554_ESMFold_hypothetical_protein	AF-Q04418-F1-model_v4	LOKIASV2_1554_ESMFold_hypothetical_protein	AF-Q04418-F1-model_v4 RNA polymerase II-associated protein RBA50	0.124	251	211	167	417	43	284	4.664E+00	15
LOKIASV2_1554_ESMFold_hypothetical_protein	AF-Q91W39-F1-model_v4	LOKIASV2_1554_ESMFold_hypothetical_protein	AF-Q91W39-F1-model_v4 Nuclear receptor coactivator 5	0.117	414	328	4	417	205	577	1.953E+00	15
LOKIASV2_1554_ESMFold_hypothetical_protein	AF-Q02297-F1-model_v4	LOKIASV2_1554_ESMFold_hypothetical_protein	AF-Q02297-F1-model_v4 Pro-neuregulin-1, membrane-bound isoform	0.107	259	190	72	330	175	388	3.418E+00	15
LOKIASV2_1554_ESMFold_hypothetical_protein	AF-P42166-F1-model_v4	LOKIASV2_1554_ESMFold_hypothetical_protein	AF-P42166-F1-model_v4 Lamina-associated polypeptide 2, isoform alpha	0.135	306	205	189	426	206	511	4.119E+00	15
LOKIASV2_1554_ESMFold_hypothetical_protein	AF-P42566-F1-model_v4	LOKIASV2_1554_ESMFold_hypothetical_protein	AF-P42566-F1-model_v4 Epidermal growth factor receptor substrate 15	0.146	272	195	106	377	439	667	3.637E+00	15
LOKIASV2_1554_ESMFold_hypothetical_protein	AF-B0VE81-F1-model_v4	LOKIASV2_1554_ESMFold_hypothetical_protein	AF-B0VE81-F1-model_v4 Translation initiation factor IF-2	0.098	286	244	58	343	43	313	3.018E+00	15
LOKIASV2_1554_ESMFold_hypothetical_protein	AF-P50104-F1-model_v4	LOKIASV2_1554_ESMFold_hypothetical_protein	AF-P50104-F1-model_v4 Probable transcriptional regulatory protein STB4	0.134	267	208	105	371	1	241	7.207E+00	15
LOKIASV2_1554_ESMFold_hypothetical_protein	AF-Q9Y7Z6-F1-model_v4	LOKIASV2_1554_ESMFold_hypothetical_protein	AF-Q9Y7Z6-F1-model_v4 Meiotic chromosome segregation protein C1539.02	0.098	335	266	105	439	87	382	3.018E+00	14
LOKIASV2_1554_ESMFold_hypothetical_protein	AF-P9WHY4-F1-model_v4	LOKIASV2_1554_ESMFold_hypothetical_protein	AF-P9WHY4-F1-model_v4 Uncharacterized PPE family protein PPE49	0.134	237	195	107	343	139	364	7.207E+00	14
LOKIASV2_1554_ESMFold_hypothetical_protein	AF-A8INQ0-F1-model_v4	LOKIASV2_1554_ESMFold_hypothetical_protein	AF-A8INQ0-F1-model_v4 ADP-ribosylation factor-like protein 13B	0.128	237	165	107	343	184	373	6.364E+00	14
LOKIASV2_1554_ESMFold_hypothetical_protein	AF-Q03717-F1-model_v4	LOKIASV2_1554_ESMFold_hypothetical_protein	AF-Q03717-F1-model_v4 Potassium voltage-gated channel subfamily B member 1	0.151	237	165	107	343	405	599	9.242E+00	14
LOKIASV2_1554_ESMFold_hypothetical_protein	AF-B2I2M7-F1-model_v4	LOKIASV2_1554_ESMFold_hypothetical_protein	AF-B2I2M7-F1-model_v4 Translation initiation factor IF-2	0.108	283	234	58	340	43	305	5.981E+00	14
LOKIASV2_1554_ESMFold_hypothetical_protein	AF-B7I3R9-F1-model_v4	LOKIASV2_1554_ESMFold_hypothetical_protein	AF-B7I3R9-F1-model_v4 Translation initiation factor IF-2	0.099	321	248	10	330	18	293	3.212E+00	14
LOKIASV2_1554_ESMFold_hypothetical_protein	AF-Q4ZHA6-F1-model_v4	LOKIASV2_1554_ESMFold_hypothetical_protein	AF-Q4ZHA6-F1-model_v4 Potassium voltage-gated channel subfamily B member 2	0.158	237	179	107	343	409	622	8.685E+00	14
LOKIASV2_1554_ESMFold_hypothetical_protein	AF-Q60ZS1-F1-model_v4	LOKIASV2_1554_ESMFold_hypothetical_protein	AF-Q60ZS1-F1-model_v4 Shugoshin	0.149	342	242	41	382	19	303	9.835E+00	13
LOKIASV2_1554_ESMFold_hypothetical_protein	AF-Q5F267-F1-model_v4	LOKIASV2_1554_ESMFold_hypothetical_protein	AF-Q5F267-F1-model_v4 Tumor protein p53-inducible protein 13	0.123	355	230	85	439	106	368	4.383E+00	13
LOKIASV2_1554_ESMFold_hypothetical_protein	AF-Q6P4E1-F1-model_v4	LOKIASV2_1554_ESMFold_hypothetical_protein	AF-Q6P4E1-F1-model_v4 Protein GOLM2	0.141	288	229	107	374	131	418	4.664E+00	13
LOKIASV2_1554_ESMFold_hypothetical_protein	AF-P98082-F1-model_v4	LOKIASV2_1554_ESMFold_hypothetical_protein	AF-P98082-F1-model_v4 Disabled homolog 2	0.092	326	265	5	330	31	323	7.669E+00	13
LOKIASV2_1554_ESMFold_hypothetical_protein	AF-A7TSV4-F1-model_v4	LOKIASV2_1554_ESMFold_hypothetical_protein	AF-A7TSV4-F1-model_v4 ATP-dependent DNA helicase MPH1	0.119	308	241	185	459	705	1012	5.981E+00	13
LOKIASV2_1554_ESMFold_hypothetical_protein	AF-Q8TF30-F1-model_v4	LOKIASV2_1554_ESMFold_hypothetical_protein	AF-Q8TF30-F1-model_v4 WASP homolog-associated protein with actin, membranes and microtubules	0.109	461	386	2	462	372	805	4.119E+00	12
LOKIASV2_1554_ESMFold_hypothetical_protein	AF-Q9VNX1-F1-model_v4	LOKIASV2_1554_ESMFold_hypothetical_protein	AF-Q9VNX1-F1-model_v4 DNApol-eta	0.129	490	345	9	498	360	756	6.364E+00	12
LOKIASV2_1554_ESMFold_hypothetical_protein	AF-B8GXA0-F1-model_v4	LOKIASV2_1554_ESMFold_hypothetical_protein	AF-B8GXA0-F1-model_v4 Localization factor PodJL	0.154	334	212	50	383	371	622	8.161E+00	12
LOKIASV2_1554_ESMFold_hypothetical_protein	AF-Q60603-F1-model_v4	LOKIASV2_1554_ESMFold_hypothetical_protein	AF-Q60603-F1-model_v4 Potassium voltage-gated channel subfamily H member 1	0.141	324	267	94	417	666	977	4.383E+00	12
LOKIASV2_1554_ESMFold_hypothetical_protein	AF-O13791-F1-model_v4	LOKIASV2_1554_ESMFold_hypothetical_protein	AF-O13791-F1-model_v4 Protein slt1	0.125	443	284	1	443	5	330	7.207E+00	11
LOKIASV2_1554_ESMFold_hypothetical_protein	AF-Q05199-F1-model_v4	LOKIASV2_1554_ESMFold_hypothetical_protein	AF-Q05199-F1-model_v4 Pro-neuregulin-1, membrane-bound isoform	0.107	267	202	64	330	126	352	9.835E+00	11
LOKIASV2_1554_ESMFold_hypothetical_protein	AF-Q7L0X2-F1-model_v4	LOKIASV2_1554_ESMFold_hypothetical_protein	AF-Q7L0X2-F1-model_v4 Glutamate-rich protein 6	0.138	372	305	127	498	14	368	9.835E+00	11
LOKIASV2_1554_ESMFold_hypothetical_protein	AF-C0RWW9-F1-model_v4	LOKIASV2_1554_ESMFold_hypothetical_protein	AF-C0RWW9-F1-model_v4 Protein AMEIOTIC 1	0.125	348	299	1	343	322	669	8.685E+00	11
LOKIASV2_1554_ESMFold_hypothetical_protein	AF-Q6CLJ6-F1-model_v4	LOKIASV2_1554_ESMFold_hypothetical_protein	AF-Q6CLJ6-F1-model_v4 GLC7-interacting protein 4	0.149	359	260	111	417	369	727	7.669E+00	10
LOKIASV2_1554_ESMFold_hypothetical_protein	AF-B0VLU2-F1-model_v4	LOKIASV2_1554_ESMFold_hypothetical_protein	AF-B0VLU2-F1-model_v4 Translation initiation factor IF-2	0.110	285	236	58	342	43	308	9.835E+00	10
LOKIASV2_1554_ESMFold_hypothetical_protein	AF-Q6FKB1-F1-model_v4	LOKIASV2_1554_ESMFold_hypothetical_protein	AF-Q6FKB1-F1-model_v4 Histone-lysine N-methyltransferase, H3 lysine-4 specific	0.114	498	369	1	498	438	855	8.161E+00	10
