query	target	qheader	theader	fident	alnlen	mismatch	qstart	qend	tstart	tend	evalue	bits
LOKIASV2_3395_ESMFold_hypothetical_protein	AF-Q9USI5-F1-model_v4	LOKIASV2_3395_ESMFold_hypothetical_protein	AF-Q9USI5-F1-model_v4 Heat shock protein sti1 homolog	0.075	278	215	144	376	243	520	4.646E-01	66
LOKIASV2_3395_ESMFold_hypothetical_protein	AF-Q925N3-F1-model_v4	LOKIASV2_3395_ESMFold_hypothetical_protein	AF-Q925N3-F1-model_v4 PEX5-related protein	0.102	383	277	76	384	202	584	1.307E-01	66
LOKIASV2_3395_ESMFold_hypothetical_protein	AF-Q99J38-F1-model_v4	LOKIASV2_3395_ESMFold_hypothetical_protein	AF-Q99J38-F1-model_v4 Tetratricopeptide repeat protein 30A1	0.109	233	193	158	390	4	221	5.781E-01	66
LOKIASV2_3395_ESMFold_hypothetical_protein	AF-Q9H6T3-F1-model_v4	LOKIASV2_3395_ESMFold_hypothetical_protein	AF-Q9H6T3-F1-model_v4 RNA polymerase II-associated protein 3	0.092	402	331	18	382	2	403	7.084E-02	66
LOKIASV2_3395_ESMFold_hypothetical_protein	AF-Q80UM3-F1-model_v4	LOKIASV2_3395_ESMFold_hypothetical_protein	AF-Q80UM3-F1-model_v4 N-alpha-acetyltransferase 15, NatA auxiliary subunit	0.118	245	213	148	389	5	249	4.074E-01	66
LOKIASV2_3395_ESMFold_hypothetical_protein	AF-Q6ZXV5-F1-model_v4	LOKIASV2_3395_ESMFold_hypothetical_protein	AF-Q6ZXV5-F1-model_v4 Protein O-mannosyl-transferase TMTC3	0.094	262	198	163	381	562	823	5.781E-01	66
LOKIASV2_3395_ESMFold_hypothetical_protein	AF-Q6PD62-F1-model_v4	LOKIASV2_3395_ESMFold_hypothetical_protein	AF-Q6PD62-F1-model_v4 RNA polymerase-associated protein CTR9 homolog	0.114	221	189	165	385	525	738	4.853E-01	66
LOKIASV2_3395_ESMFold_hypothetical_protein	AF-P37718-F1-model_v4	LOKIASV2_3395_ESMFold_hypothetical_protein	AF-P37718-F1-model_v4 Cellulose synthase operon protein C	0.093	280	252	109	388	270	548	1.097E-01	66
LOKIASV2_3395_ESMFold_hypothetical_protein	AF-Q7Z4L5-F1-model_v4	LOKIASV2_3395_ESMFold_hypothetical_protein	AF-Q7Z4L5-F1-model_v4 Tetratricopeptide repeat protein 21B	0.120	275	232	96	370	600	864	2.411E-01	66
LOKIASV2_3395_ESMFold_hypothetical_protein	AF-Q8NDW8-F1-model_v4	LOKIASV2_3395_ESMFold_hypothetical_protein	AF-Q8NDW8-F1-model_v4 Tetratricopeptide repeat protein 21A	0.123	304	258	96	390	604	907	8.815E-02	66
LOKIASV2_3395_ESMFold_hypothetical_protein	AF-P0AFB4-F1-model_v4	LOKIASV2_3395_ESMFold_hypothetical_protein	AF-P0AFB4-F1-model_v4 Lipoprotein NlpI	0.118	278	212	145	385	15	292	7.400E-02	65
LOKIASV2_3395_ESMFold_hypothetical_protein	AF-D5D1H3-F1-model_v4	LOKIASV2_3395_ESMFold_hypothetical_protein	AF-D5D1H3-F1-model_v4 Lipoprotein NlpI	0.132	285	209	145	386	9	293	7.731E-02	65
LOKIASV2_3395_ESMFold_hypothetical_protein	AF-P0AFB2-F1-model_v4	LOKIASV2_3395_ESMFold_hypothetical_protein	AF-P0AFB2-F1-model_v4 Lipoprotein NlpI	0.108	279	215	145	386	15	293	8.077E-02	65
LOKIASV2_3395_ESMFold_hypothetical_protein	AF-Q1CM50-F1-model_v4	LOKIASV2_3395_ESMFold_hypothetical_protein	AF-Q1CM50-F1-model_v4 Lipoprotein NlpI	0.126	279	212	144	386	15	293	7.400E-02	65
LOKIASV2_3395_ESMFold_hypothetical_protein	AF-Q0TCU6-F1-model_v4	LOKIASV2_3395_ESMFold_hypothetical_protein	AF-Q0TCU6-F1-model_v4 Lipoprotein NlpI	0.118	279	213	145	386	15	293	7.084E-02	65
LOKIASV2_3395_ESMFold_hypothetical_protein	AF-Q4HXF6-F1-model_v4	LOKIASV2_3395_ESMFold_hypothetical_protein	AF-Q4HXF6-F1-model_v4 Peptidyl-prolyl cis-trans isomerase D	0.080	157	142	235	389	212	368	2.448E+00	65
LOKIASV2_3395_ESMFold_hypothetical_protein	AF-P0ACB8-F1-model_v4	LOKIASV2_3395_ESMFold_hypothetical_protein	AF-P0ACB8-F1-model_v4 Protein HemY	0.107	357	262	95	388	29	385	9.621E-02	65
LOKIASV2_3395_ESMFold_hypothetical_protein	AF-P0ACB7-F1-model_v4	LOKIASV2_3395_ESMFold_hypothetical_protein	AF-P0ACB7-F1-model_v4 Protein HemY	0.096	359	267	95	390	29	387	7.731E-02	65
LOKIASV2_3395_ESMFold_hypothetical_protein	AF-Q28IV6-F1-model_v4	LOKIASV2_3395_ESMFold_hypothetical_protein	AF-Q28IV6-F1-model_v4 COP9 signalosome complex subunit 3	0.104	225	186	165	373	6	230	4.853E-01	65
LOKIASV2_3395_ESMFold_hypothetical_protein	AF-Q9QYI3-F1-model_v4	LOKIASV2_3395_ESMFold_hypothetical_protein	AF-Q9QYI3-F1-model_v4 DnaJ homolog subfamily C member 7	0.097	303	214	145	382	8	310	1.050E-01	65
LOKIASV2_3395_ESMFold_hypothetical_protein	AF-O94826-F1-model_v4	LOKIASV2_3395_ESMFold_hypothetical_protein	AF-O94826-F1-model_v4 Mitochondrial import receptor subunit TOM70	0.128	339	267	84	390	263	601	1.097E-01	65
LOKIASV2_3395_ESMFold_hypothetical_protein	AF-P23231-F1-model_v4	LOKIASV2_3395_ESMFold_hypothetical_protein	AF-P23231-F1-model_v4 Mitochondrial import receptor subunit tom70	0.119	260	182	183	390	359	618	1.097E-01	65
LOKIASV2_3395_ESMFold_hypothetical_protein	AF-O13773-F1-model_v4	LOKIASV2_3395_ESMFold_hypothetical_protein	AF-O13773-F1-model_v4 UBA domain-containing protein 7	0.101	145	127	237	378	407	551	1.216E+00	65
LOKIASV2_3395_ESMFold_hypothetical_protein	AF-Q96N46-F1-model_v4	LOKIASV2_3395_ESMFold_hypothetical_protein	AF-Q96N46-F1-model_v4 Tetratricopeptide repeat protein 14	0.101	159	131	231	389	295	441	9.772E-01	65
LOKIASV2_3395_ESMFold_hypothetical_protein	AF-F4JTI1-F1-model_v4	LOKIASV2_3395_ESMFold_hypothetical_protein	AF-F4JTI1-F1-model_v4 Protein PHOX4	0.095	160	135	230	389	35	184	2.672E+00	65
LOKIASV2_3395_ESMFold_hypothetical_protein	AF-Q68F64-F1-model_v4	LOKIASV2_3395_ESMFold_hypothetical_protein	AF-Q68F64-F1-model_v4 Protein unc-45 homolog B	0.057	135	117	249	383	4	128	5.620E+00	65
LOKIASV2_3395_ESMFold_hypothetical_protein	AF-A2WXU2-F1-model_v4	LOKIASV2_3395_ESMFold_hypothetical_protein	AF-A2WXU2-F1-model_v4 TPR repeat-containing protein ZIP4	0.088	205	174	183	374	350	554	6.592E-01	65
LOKIASV2_3395_ESMFold_hypothetical_protein	AF-Q9Y6J0-F1-model_v4	LOKIASV2_3395_ESMFold_hypothetical_protein	AF-Q9Y6J0-F1-model_v4 Calcineurin-binding protein cabin-1	0.153	177	148	213	388	38	214	7.516E-01	65
LOKIASV2_3395_ESMFold_hypothetical_protein	AF-E4P9W4-F1-model_v4	LOKIASV2_3395_ESMFold_hypothetical_protein	AF-E4P9W4-F1-model_v4 Lipoprotein NlpI	0.115	279	213	145	386	15	293	8.815E-02	64
LOKIASV2_3395_ESMFold_hypothetical_protein	AF-B7NDE9-F1-model_v4	LOKIASV2_3395_ESMFold_hypothetical_protein	AF-B7NDE9-F1-model_v4 Lipoprotein NlpI	0.125	279	211	145	386	15	293	8.077E-02	64
LOKIASV2_3395_ESMFold_hypothetical_protein	AF-C4ZSQ4-F1-model_v4	LOKIASV2_3395_ESMFold_hypothetical_protein	AF-C4ZSQ4-F1-model_v4 Lipoprotein NlpI	0.132	255	191	166	386	39	293	1.146E-01	64
LOKIASV2_3395_ESMFold_hypothetical_protein	AF-C6EH62-F1-model_v4	LOKIASV2_3395_ESMFold_hypothetical_protein	AF-C6EH62-F1-model_v4 Lipoprotein NlpI	0.124	280	210	146	386	14	293	8.077E-02	64
LOKIASV2_3395_ESMFold_hypothetical_protein	AF-P0AFB1-F1-model_v4	LOKIASV2_3395_ESMFold_hypothetical_protein	AF-P0AFB1-F1-model_v4 Lipoprotein NlpI	0.130	279	210	145	386	15	293	8.077E-02	64
LOKIASV2_3395_ESMFold_hypothetical_protein	AF-A6QQ71-F1-model_v4	LOKIASV2_3395_ESMFold_hypothetical_protein	AF-A6QQ71-F1-model_v4 Inactive peptidyl-prolyl cis-trans isomerase FKBP6	0.122	167	139	231	389	143	309	2.147E+00	64
LOKIASV2_3395_ESMFold_hypothetical_protein	AF-P0ACC0-F1-model_v4	LOKIASV2_3395_ESMFold_hypothetical_protein	AF-P0ACC0-F1-model_v4 Protein HemY	0.105	357	262	95	388	29	385	5.947E-02	64
LOKIASV2_3395_ESMFold_hypothetical_protein	AF-Q5ZJF1-F1-model_v4	LOKIASV2_3395_ESMFold_hypothetical_protein	AF-Q5ZJF1-F1-model_v4 COP9 signalosome complex subunit 3	0.100	225	187	165	373	6	230	6.887E-01	64
LOKIASV2_3395_ESMFold_hypothetical_protein	AF-Q9KQ40-F1-model_v4	LOKIASV2_3395_ESMFold_hypothetical_protein	AF-Q9KQ40-F1-model_v4 Putative beta-barrel assembly-enhancing protease	0.053	174	163	202	375	248	420	1.513E+00	64
LOKIASV2_3395_ESMFold_hypothetical_protein	AF-P66951-F1-model_v4	LOKIASV2_3395_ESMFold_hypothetical_protein	AF-P66951-F1-model_v4 Beta-barrel assembly-enhancing protease	0.110	201	174	182	378	224	424	8.570E-01	64
LOKIASV2_3395_ESMFold_hypothetical_protein	AF-P15705-F1-model_v4	LOKIASV2_3395_ESMFold_hypothetical_protein	AF-P15705-F1-model_v4 Heat shock protein STI1	0.120	348	303	29	373	166	513	9.621E-02	64
LOKIASV2_3395_ESMFold_hypothetical_protein	AF-Q6FM42-F1-model_v4	LOKIASV2_3395_ESMFold_hypothetical_protein	AF-Q6FM42-F1-model_v4 Peroxisomal targeting signal receptor	0.124	360	313	1	358	161	520	5.215E-02	64
LOKIASV2_3395_ESMFold_hypothetical_protein	AF-O81629-F1-model_v4	LOKIASV2_3395_ESMFold_hypothetical_protein	AF-O81629-F1-model_v4 Protein KINESIN LIGHT CHAIN-RELATED 1	0.110	258	186	169	378	315	572	6.887E-01	64
LOKIASV2_3395_ESMFold_hypothetical_protein	AF-A2AKQ8-F1-model_v4	LOKIASV2_3395_ESMFold_hypothetical_protein	AF-A2AKQ8-F1-model_v4 Tetratricopeptide repeat protein 30A2	0.105	225	186	166	390	13	221	8.570E-01	64
LOKIASV2_3395_ESMFold_hypothetical_protein	AF-A4IFB6-F1-model_v4	LOKIASV2_3395_ESMFold_hypothetical_protein	AF-A4IFB6-F1-model_v4 CCR4-NOT transcription complex subunit 10	0.090	259	217	145	383	14	272	4.257E-01	64
LOKIASV2_3395_ESMFold_hypothetical_protein	AF-Q4R350-F1-model_v4	LOKIASV2_3395_ESMFold_hypothetical_protein	AF-Q4R350-F1-model_v4 CCR4-NOT transcription complex subunit 10	0.087	252	205	158	383	21	272	4.853E-01	64
LOKIASV2_3395_ESMFold_hypothetical_protein	AF-Q9H9A5-F1-model_v4	LOKIASV2_3395_ESMFold_hypothetical_protein	AF-Q9H9A5-F1-model_v4 CCR4-NOT transcription complex subunit 10	0.093	256	204	158	383	17	272	3.733E-01	64
LOKIASV2_3395_ESMFold_hypothetical_protein	AF-D7REX8-F1-model_v4	LOKIASV2_3395_ESMFold_hypothetical_protein	AF-D7REX8-F1-model_v4 Protein unc-45 homolog B	0.057	135	117	249	383	4	128	5.872E+00	64
LOKIASV2_3395_ESMFold_hypothetical_protein	AF-Q5RCC2-F1-model_v4	LOKIASV2_3395_ESMFold_hypothetical_protein	AF-Q5RCC2-F1-model_v4 Pre-mRNA-processing factor 6	0.114	227	198	167	390	577	803	4.853E-01	64
LOKIASV2_3395_ESMFold_hypothetical_protein	AF-P31600-F1-model_v4	LOKIASV2_3395_ESMFold_hypothetical_protein	AF-P31600-F1-model_v4 Bacteriophage adsorption protein A	0.096	207	183	171	373	483	689	4.853E-01	64
LOKIASV2_3395_ESMFold_hypothetical_protein	AF-A7MB10-F1-model_v4	LOKIASV2_3395_ESMFold_hypothetical_protein	AF-A7MB10-F1-model_v4 Protein RRP5 homolog	0.102	246	215	145	390	1572	1811	6.213E-02	64
LOKIASV2_3395_ESMFold_hypothetical_protein	AF-F1LTE0-F1-model_v4	LOKIASV2_3395_ESMFold_hypothetical_protein	AF-F1LTE0-F1-model_v4 Protein TANC2	0.106	179	156	200	378	1202	1377	1.581E+00	64
LOKIASV2_3395_ESMFold_hypothetical_protein	AF-Q2K4E6-F1-model_v4	LOKIASV2_3395_ESMFold_hypothetical_protein	AF-Q2K4E6-F1-model_v4 TPR repeat-containing protein RHE_CH03534.1	0.081	171	144	211	381	46	203	2.147E+00	63
LOKIASV2_3395_ESMFold_hypothetical_protein	AF-Q2W8Q0-F1-model_v4	LOKIASV2_3395_ESMFold_hypothetical_protein	AF-Q2W8Q0-F1-model_v4 Magnetosome protein MamA	0.097	237	177	121	357	13	209	5.534E-01	63
LOKIASV2_3395_ESMFold_hypothetical_protein	AF-Q3V038-F1-model_v4	LOKIASV2_3395_ESMFold_hypothetical_protein	AF-Q3V038-F1-model_v4 Tetratricopeptide repeat protein 9A	0.098	172	139	231	385	45	216	1.967E+00	63
LOKIASV2_3395_ESMFold_hypothetical_protein	AF-Q92623-F1-model_v4	LOKIASV2_3395_ESMFold_hypothetical_protein	AF-Q92623-F1-model_v4 Tetratricopeptide repeat protein 9A	0.095	179	144	226	385	41	219	1.652E+00	63
LOKIASV2_3395_ESMFold_hypothetical_protein	AF-P57270-F1-model_v4	LOKIASV2_3395_ESMFold_hypothetical_protein	AF-P57270-F1-model_v4 UPF0162 protein BU173	0.163	95	70	283	377	181	265	3.474E+00	63
LOKIASV2_3395_ESMFold_hypothetical_protein	AF-P32602-F1-model_v4	LOKIASV2_3395_ESMFold_hypothetical_protein	AF-P32602-F1-model_v4 Alpha-soluble NSF attachment protein	0.121	220	182	184	391	41	260	2.749E-01	63
LOKIASV2_3395_ESMFold_hypothetical_protein	AF-A1AG68-F1-model_v4	LOKIASV2_3395_ESMFold_hypothetical_protein	AF-A1AG68-F1-model_v4 Lipoprotein NlpI	0.121	278	212	145	386	16	293	8.815E-02	63
LOKIASV2_3395_ESMFold_hypothetical_protein	AF-Q57JI4-F1-model_v4	LOKIASV2_3395_ESMFold_hypothetical_protein	AF-Q57JI4-F1-model_v4 Lipoprotein NlpI	0.119	279	212	145	386	15	293	1.005E-01	63
LOKIASV2_3395_ESMFold_hypothetical_protein	AF-Q8XG77-F1-model_v4	LOKIASV2_3395_ESMFold_hypothetical_protein	AF-Q8XG77-F1-model_v4 Lipoprotein NlpI	0.130	283	213	141	386	11	293	8.815E-02	63
LOKIASV2_3395_ESMFold_hypothetical_protein	AF-P0AB58-F1-model_v4	LOKIASV2_3395_ESMFold_hypothetical_protein	AF-P0AB58-F1-model_v4 Lipopolysaccharide assembly protein B	0.094	273	237	128	390	3	275	1.426E-01	63
LOKIASV2_3395_ESMFold_hypothetical_protein	AF-O94556-F1-model_v4	LOKIASV2_3395_ESMFold_hypothetical_protein	AF-O94556-F1-model_v4 Anaphase-promoting complex subunit 8	0.101	302	242	112	381	263	564	8.438E-02	63
LOKIASV2_3395_ESMFold_hypothetical_protein	AF-Q9FJL3-F1-model_v4	LOKIASV2_3395_ESMFold_hypothetical_protein	AF-Q9FJL3-F1-model_v4 Peptidyl-prolyl cis-trans isomerase FKBP65	0.127	144	122	249	389	410	553	3.047E+00	63
LOKIASV2_3395_ESMFold_hypothetical_protein	AF-Q4QQS2-F1-model_v4	LOKIASV2_3395_ESMFold_hypothetical_protein	AF-Q4QQS2-F1-model_v4 Tetratricopeptide repeat protein 30A2	0.096	233	199	158	390	1	221	8.203E-01	63
LOKIASV2_3395_ESMFold_hypothetical_protein	AF-Q8WVT3-F1-model_v4	LOKIASV2_3395_ESMFold_hypothetical_protein	AF-Q8WVT3-F1-model_v4 Trafficking protein particle complex subunit 12	0.144	181	140	174	354	557	720	7.194E-01	63
LOKIASV2_3395_ESMFold_hypothetical_protein	AF-P19735-F1-model_v4	LOKIASV2_3395_ESMFold_hypothetical_protein	AF-P19735-F1-model_v4 Pre-mRNA-splicing factor 6	0.112	289	253	106	394	584	869	2.411E-01	63
LOKIASV2_3395_ESMFold_hypothetical_protein	AF-Q8IWX7-F1-model_v4	LOKIASV2_3395_ESMFold_hypothetical_protein	AF-Q8IWX7-F1-model_v4 Protein unc-45 homolog B	0.064	135	116	249	383	6	130	5.620E+00	63
LOKIASV2_3395_ESMFold_hypothetical_protein	AF-Q9ZDY1-F1-model_v4	LOKIASV2_3395_ESMFold_hypothetical_protein	AF-Q9ZDY1-F1-model_v4 Outer membrane protein assembly factor BamD	0.100	235	209	145	377	16	250	4.257E-01	62
LOKIASV2_3395_ESMFold_hypothetical_protein	AF-P0AB60-F1-model_v4	LOKIASV2_3395_ESMFold_hypothetical_protein	AF-P0AB60-F1-model_v4 Lipopolysaccharide assembly protein B	0.094	273	237	128	390	3	275	1.426E-01	62
LOKIASV2_3395_ESMFold_hypothetical_protein	AF-P0AB59-F1-model_v4	LOKIASV2_3395_ESMFold_hypothetical_protein	AF-P0AB59-F1-model_v4 Lipopolysaccharide assembly protein B	0.094	273	237	128	390	3	275	1.490E-01	62
LOKIASV2_3395_ESMFold_hypothetical_protein	AF-Q95MP0-F1-model_v4	LOKIASV2_3395_ESMFold_hypothetical_protein	AF-Q95MP0-F1-model_v4 Aryl-hydrocarbon-interacting protein-like 1	0.097	155	138	235	389	171	324	1.387E+00	62
LOKIASV2_3395_ESMFold_hypothetical_protein	AF-Q38931-F1-model_v4	LOKIASV2_3395_ESMFold_hypothetical_protein	AF-Q38931-F1-model_v4 Peptidyl-prolyl cis-trans isomerase FKBP62	0.084	151	127	249	388	400	550	2.243E+00	62
LOKIASV2_3395_ESMFold_hypothetical_protein	AF-P50542-F1-model_v4	LOKIASV2_3395_ESMFold_hypothetical_protein	AF-P50542-F1-model_v4 Peroxisomal targeting signal 1 receptor	0.079	371	259	109	390	265	635	2.307E-01	62
LOKIASV2_3395_ESMFold_hypothetical_protein	AF-Q29L58-F1-model_v4	LOKIASV2_3395_ESMFold_hypothetical_protein	AF-Q29L58-F1-model_v4 Tetratricopeptide repeat protein 30 homolog	0.130	260	175	96	355	1	202	2.871E-01	62
LOKIASV2_3395_ESMFold_hypothetical_protein	AF-P43112-F1-model_v4	LOKIASV2_3395_ESMFold_hypothetical_protein	AF-P43112-F1-model_v4 Vi polysaccharide export protein VexE	0.107	269	212	148	385	71	339	4.853E-01	62
LOKIASV2_3395_ESMFold_hypothetical_protein	AF-Q75A03-F1-model_v4	LOKIASV2_3395_ESMFold_hypothetical_protein	AF-Q75A03-F1-model_v4 Protein DIA2	0.088	186	160	175	360	6	181	5.534E-01	62
LOKIASV2_3395_ESMFold_hypothetical_protein	AF-Q8IWR0-F1-model_v4	LOKIASV2_3395_ESMFold_hypothetical_protein	AF-Q8IWR0-F1-model_v4 Zinc finger CCCH domain-containing protein 7A	0.110	163	139	218	380	15	171	2.147E+00	62
LOKIASV2_3395_ESMFold_hypothetical_protein	AF-Q6B4Z3-F1-model_v4	LOKIASV2_3395_ESMFold_hypothetical_protein	AF-Q6B4Z3-F1-model_v4 Histone demethylase UTY	0.114	252	206	157	390	56	307	5.534E-01	62
LOKIASV2_3395_ESMFold_hypothetical_protein	AF-D3YVL2-F1-model_v4	LOKIASV2_3395_ESMFold_hypothetical_protein	AF-D3YVL2-F1-model_v4 Cilia- and flagella-associated protein 70	0.133	298	218	76	373	882	1134	4.074E-01	62
LOKIASV2_3395_ESMFold_hypothetical_protein	AF-Q9C0D5-F1-model_v4	LOKIASV2_3395_ESMFold_hypothetical_protein	AF-Q9C0D5-F1-model_v4 Protein TANC1	0.091	160	137	229	388	1277	1428	3.047E+00	62
LOKIASV2_3395_ESMFold_hypothetical_protein	AF-Q93DY9-F1-model_v4	LOKIASV2_3395_ESMFold_hypothetical_protein	AF-Q93DY9-F1-model_v4 Magnetosome protein MamA	0.084	249	186	109	357	6	209	8.953E-01	61
LOKIASV2_3395_ESMFold_hypothetical_protein	AF-Q54NP6-F1-model_v4	LOKIASV2_3395_ESMFold_hypothetical_protein	AF-Q54NP6-F1-model_v4 Alpha-soluble NSF attachment protein	0.103	246	205	159	388	19	264	3.420E-01	61
LOKIASV2_3395_ESMFold_hypothetical_protein	AF-Q8CC21-F1-model_v4	LOKIASV2_3395_ESMFold_hypothetical_protein	AF-Q8CC21-F1-model_v4 Tetratricopeptide repeat protein 19, mitochondrial	0.095	272	243	121	389	89	360	3.573E-01	61
LOKIASV2_3395_ESMFold_hypothetical_protein	AF-Q6CL78-F1-model_v4	LOKIASV2_3395_ESMFold_hypothetical_protein	AF-Q6CL78-F1-model_v4 Peptidyl-prolyl cis-trans isomerase D	0.140	178	133	212	389	211	366	1.270E+00	61
LOKIASV2_3395_ESMFold_hypothetical_protein	AF-Q4WIF3-F1-model_v4	LOKIASV2_3395_ESMFold_hypothetical_protein	AF-Q4WIF3-F1-model_v4 Peptidyl-prolyl cis-trans isomerase D	0.086	161	138	238	389	213	373	2.448E+00	61
LOKIASV2_3395_ESMFold_hypothetical_protein	AF-P09914-F1-model_v4	LOKIASV2_3395_ESMFold_hypothetical_protein	AF-P09914-F1-model_v4 Interferon-induced protein with tetratricopeptide repeats 1	0.093	240	186	178	383	155	394	6.040E-01	61
LOKIASV2_3395_ESMFold_hypothetical_protein	AF-Q9H892-F1-model_v4	LOKIASV2_3395_ESMFold_hypothetical_protein	AF-Q9H892-F1-model_v4 Tetratricopeptide repeat protein 12	0.118	153	123	233	385	97	236	3.183E+00	61
LOKIASV2_3395_ESMFold_hypothetical_protein	AF-Q5F3K0-F1-model_v4	LOKIASV2_3395_ESMFold_hypothetical_protein	AF-Q5F3K0-F1-model_v4 Tetratricopeptide repeat protein 27	0.107	264	182	182	386	580	843	3.000E-01	61
LOKIASV2_3395_ESMFold_hypothetical_protein	AF-Q6YZI0-F1-model_v4	LOKIASV2_3395_ESMFold_hypothetical_protein	AF-Q6YZI0-F1-model_v4 Probable UDP-N-acetylglucosamine--peptide N-acetylglucosaminyltransferase SPINDLY	0.137	239	180	145	383	22	230	5.781E-01	61
LOKIASV2_3395_ESMFold_hypothetical_protein	AF-P76585-F1-model_v4	LOKIASV2_3395_ESMFold_hypothetical_protein	AF-P76585-F1-model_v4 Uncharacterized protein YphG	0.097	178	151	212	389	461	628	3.047E+00	61
LOKIASV2_3395_ESMFold_hypothetical_protein	AF-Q6DEU9-F1-model_v4	LOKIASV2_3395_ESMFold_hypothetical_protein	AF-Q6DEU9-F1-model_v4 RNA polymerase-associated protein CTR9 homolog	0.111	231	204	159	389	617	847	1.854E-01	61
LOKIASV2_3395_ESMFold_hypothetical_protein	AF-Q20255-F1-model_v4	LOKIASV2_3395_ESMFold_hypothetical_protein	AF-Q20255-F1-model_v4 Tetratricopeptide repeat protein 21 homolog	0.104	239	191	161	374	801	1039	3.900E-01	61
LOKIASV2_3395_ESMFold_hypothetical_protein	AF-A8BFN4-F1-model_v4	LOKIASV2_3395_ESMFold_hypothetical_protein	AF-A8BFN4-F1-model_v4 UDP-N-acetylglucosamine--peptide N-acetylglucosaminyltransferase	0.127	226	168	148	373	497	690	1.021E+00	61
LOKIASV2_3395_ESMFold_hypothetical_protein	AF-Q14690-F1-model_v4	LOKIASV2_3395_ESMFold_hypothetical_protein	AF-Q14690-F1-model_v4 Protein RRP5 homolog	0.093	249	219	148	389	1572	1820	1.557E-01	61
LOKIASV2_3395_ESMFold_hypothetical_protein	AF-O78458-F1-model_v4	LOKIASV2_3395_ESMFold_hypothetical_protein	AF-O78458-F1-model_v4 Uncharacterized protein ycf37	0.152	184	144	204	387	7	177	1.513E+00	60
LOKIASV2_3395_ESMFold_hypothetical_protein	AF-O14085-F1-model_v4	LOKIASV2_3395_ESMFold_hypothetical_protein	AF-O14085-F1-model_v4 Translocation protein sec72	0.081	169	153	207	375	23	190	1.967E+00	60
LOKIASV2_3395_ESMFold_hypothetical_protein	AF-O51880-F1-model_v4	LOKIASV2_3395_ESMFold_hypothetical_protein	AF-O51880-F1-model_v4 Ancillary SecYEG translocon subunit	0.102	166	138	212	377	39	193	1.652E+00	60
LOKIASV2_3395_ESMFold_hypothetical_protein	AF-Q7CPQ1-F1-model_v4	LOKIASV2_3395_ESMFold_hypothetical_protein	AF-Q7CPQ1-F1-model_v4 Lipoprotein NlpI	0.112	279	214	145	386	15	293	1.097E-01	60
LOKIASV2_3395_ESMFold_hypothetical_protein	AF-B1XGX5-F1-model_v4	LOKIASV2_3395_ESMFold_hypothetical_protein	AF-B1XGX5-F1-model_v4 Lipoprotein NlpI	0.108	279	215	145	386	15	293	1.490E-01	60
LOKIASV2_3395_ESMFold_hypothetical_protein	AF-Q95MN7-F1-model_v4	LOKIASV2_3395_ESMFold_hypothetical_protein	AF-Q95MN7-F1-model_v4 Aryl-hydrocarbon-interacting protein-like 1	0.097	155	138	235	389	171	324	1.725E+00	60
LOKIASV2_3395_ESMFold_hypothetical_protein	AF-Q4R7Z9-F1-model_v4	LOKIASV2_3395_ESMFold_hypothetical_protein	AF-Q4R7Z9-F1-model_v4 Intraflagellar transport protein 56	0.102	226	201	152	377	47	271	8.953E-01	60
LOKIASV2_3395_ESMFold_hypothetical_protein	AF-Q75Q39-F1-model_v4	LOKIASV2_3395_ESMFold_hypothetical_protein	AF-Q75Q39-F1-model_v4 Mitochondrial import receptor subunit TOM70	0.127	341	269	82	390	263	603	1.699E-01	60
LOKIASV2_3395_ESMFold_hypothetical_protein	AF-Q08CL8-F1-model_v4	LOKIASV2_3395_ESMFold_hypothetical_protein	AF-Q08CL8-F1-model_v4 CCR4-NOT transcription complex subunit 10	0.106	267	192	158	373	7	273	1.490E-01	60
LOKIASV2_3395_ESMFold_hypothetical_protein	AF-Q1RMV0-F1-model_v4	LOKIASV2_3395_ESMFold_hypothetical_protein	AF-Q1RMV0-F1-model_v4 Peroxisomal targeting signal 1 receptor	0.103	258	200	165	388	371	628	1.449E+00	60
LOKIASV2_3395_ESMFold_hypothetical_protein	AF-O70525-F1-model_v4	LOKIASV2_3395_ESMFold_hypothetical_protein	AF-O70525-F1-model_v4 Peroxisomal targeting signal 1 receptor	0.088	378	260	105	390	259	636	2.307E-01	60
LOKIASV2_3395_ESMFold_hypothetical_protein	AF-O88480-F1-model_v4	LOKIASV2_3395_ESMFold_hypothetical_protein	AF-O88480-F1-model_v4 Calcineurin-binding protein cabin-1	0.130	192	159	211	394	29	220	1.164E+00	60
LOKIASV2_3395_ESMFold_hypothetical_protein	AF-A7RL75-F1-model_v4	LOKIASV2_3395_ESMFold_hypothetical_protein	AF-A7RL75-F1-model_v4 Tetratricopeptide repeat protein 36 homolog	0.099	163	134	224	386	28	177	1.513E+00	59
LOKIASV2_3395_ESMFold_hypothetical_protein	AF-P55727-F1-model_v4	LOKIASV2_3395_ESMFold_hypothetical_protein	AF-P55727-F1-model_v4 Uncharacterized protein y4yS	0.095	126	101	257	382	63	175	4.323E+00	59
LOKIASV2_3395_ESMFold_hypothetical_protein	AF-Q8N6N2-F1-model_v4	LOKIASV2_3395_ESMFold_hypothetical_protein	AF-Q8N6N2-F1-model_v4 Tetratricopeptide repeat protein 9B	0.093	185	147	232	394	51	235	1.164E+00	59
LOKIASV2_3395_ESMFold_hypothetical_protein	AF-C8V3W6-F1-model_v4	LOKIASV2_3395_ESMFold_hypothetical_protein	AF-C8V3W6-F1-model_v4 Probable assembly chaperone of rpl4	0.113	256	191	158	373	24	279	5.534E-01	59
LOKIASV2_3395_ESMFold_hypothetical_protein	AF-Q01495-F1-model_v4	LOKIASV2_3395_ESMFold_hypothetical_protein	AF-Q01495-F1-model_v4 Peroxisomal targeting signal receptor	0.120	366	249	107	390	202	567	2.411E-01	59
LOKIASV2_3395_ESMFold_hypothetical_protein	AF-Q9JLG9-F1-model_v4	LOKIASV2_3395_ESMFold_hypothetical_protein	AF-Q9JLG9-F1-model_v4 Aryl-hydrocarbon-interacting protein-like 1	0.094	157	138	233	389	172	324	2.055E+00	58
LOKIASV2_3395_ESMFold_hypothetical_protein	AF-P0ABN0-F1-model_v4	LOKIASV2_3395_ESMFold_hypothetical_protein	AF-P0ABN0-F1-model_v4 Cytochrome c-type biogenesis protein CcmH	0.100	276	229	100	375	88	342	2.871E-01	58
LOKIASV2_3395_ESMFold_hypothetical_protein	AF-Q4R898-F1-model_v4	LOKIASV2_3395_ESMFold_hypothetical_protein	AF-Q4R898-F1-model_v4 COP9 signalosome complex subunit 3	0.100	225	187	165	373	6	230	1.066E+00	58
LOKIASV2_3395_ESMFold_hypothetical_protein	AF-A6H7B5-F1-model_v4	LOKIASV2_3395_ESMFold_hypothetical_protein	AF-A6H7B5-F1-model_v4 COP9 signalosome complex subunit 3	0.102	225	187	165	373	6	230	1.164E+00	58
LOKIASV2_3395_ESMFold_hypothetical_protein	AF-Q8BGZ4-F1-model_v4	LOKIASV2_3395_ESMFold_hypothetical_protein	AF-Q8BGZ4-F1-model_v4 Cell division cycle protein 23 homolog	0.108	285	233	133	394	280	564	1.937E-01	58
LOKIASV2_3395_ESMFold_hypothetical_protein	AF-F4K487-F1-model_v4	LOKIASV2_3395_ESMFold_hypothetical_protein	AF-F4K487-F1-model_v4 Protein PHOX3	0.114	261	201	121	381	24	251	8.570E-01	58
LOKIASV2_3395_ESMFold_hypothetical_protein	AF-E9Q6P5-F1-model_v4	LOKIASV2_3395_ESMFold_hypothetical_protein	AF-E9Q6P5-F1-model_v4 Tetratricopeptide repeat protein 7B	0.114	231	186	148	358	347	577	6.887E-01	58
LOKIASV2_3395_ESMFold_hypothetical_protein	AF-Q5R4J9-F1-model_v4	LOKIASV2_3395_ESMFold_hypothetical_protein	AF-Q5R4J9-F1-model_v4 N-alpha-acetyltransferase 15, NatA auxiliary subunit	0.118	245	213	148	389	5	249	9.353E-01	58
LOKIASV2_3395_ESMFold_hypothetical_protein	AF-Q8VZM1-F1-model_v4	LOKIASV2_3395_ESMFold_hypothetical_protein	AF-Q8VZM1-F1-model_v4 N-terminal acetyltransferase A complex auxiliary subunit NAA15	0.101	206	166	183	388	62	247	2.344E+00	58
LOKIASV2_3395_ESMFold_hypothetical_protein	AF-Q9H3U1-F1-model_v4	LOKIASV2_3395_ESMFold_hypothetical_protein	AF-Q9H3U1-F1-model_v4 Protein unc-45 homolog A	0.088	132	110	249	380	21	142	9.093E+00	58
LOKIASV2_3395_ESMFold_hypothetical_protein	AF-Q8ZLB8-F1-model_v4	LOKIASV2_3395_ESMFold_hypothetical_protein	AF-Q8ZLB8-F1-model_v4 Cellulose synthase operon protein C	0.077	249	205	167	389	295	543	2.518E-01	58
LOKIASV2_3395_ESMFold_hypothetical_protein	AF-O94474-F1-model_v4	LOKIASV2_3395_ESMFold_hypothetical_protein	AF-O94474-F1-model_v4 Superkiller protein 3	0.126	253	200	156	385	528	780	8.953E-01	58
LOKIASV2_3395_ESMFold_hypothetical_protein	AF-P58938-F1-model_v4	LOKIASV2_3395_ESMFold_hypothetical_protein	AF-P58938-F1-model_v4 Cellulose synthase operon protein C	0.126	225	183	149	373	23	232	6.592E-01	58
LOKIASV2_3395_ESMFold_hypothetical_protein	AF-Q66H45-F1-model_v4	LOKIASV2_3395_ESMFold_hypothetical_protein	AF-Q66H45-F1-model_v4 Tetratricopeptide repeat protein 36	0.094	161	130	226	386	35	179	1.652E+00	57
LOKIASV2_3395_ESMFold_hypothetical_protein	AF-P0A131-F1-model_v4	LOKIASV2_3395_ESMFold_hypothetical_protein	AF-P0A131-F1-model_v4 Cell division coordinator CpoB	0.071	146	118	226	371	139	266	2.916E+00	57
