query	target	qheader	theader	fident	alnlen	mismatch	qstart	qend	tstart	tend	evalue	bits
LOKIASV2_0664_ESMFold_hypothetical_protein	AF-A0LM45-F1-model_v4	LOKIASV2_0664_ESMFold_hypothetical_protein	AF-A0LM45-F1-model_v4 UPF0251 protein Sfum_2819	0.276	170	97	1	170	1	135	1.190E-09	239
LOKIASV2_0664_ESMFold_hypothetical_protein	AF-A5D4R0-F1-model_v4	LOKIASV2_0664_ESMFold_hypothetical_protein	AF-A5D4R0-F1-model_v4 UPF0251 protein PTH_0588	0.235	170	99	1	170	1	131	3.410E-08	227
LOKIASV2_0664_ESMFold_hypothetical_protein	AF-A4SKL1-F1-model_v4	LOKIASV2_0664_ESMFold_hypothetical_protein	AF-A4SKL1-F1-model_v4 UPF0251 protein ASA_1331	0.320	100	65	1	100	1	97	1.117E-06	223
LOKIASV2_0664_ESMFold_hypothetical_protein	AF-Q8R8Y7-F1-model_v4	LOKIASV2_0664_ESMFold_hypothetical_protein	AF-Q8R8Y7-F1-model_v4 UPF0251 protein TTE1845	0.433	60	33	34	93	31	90	1.170E-05	223
LOKIASV2_0664_ESMFold_hypothetical_protein	AF-Q87JD1-F1-model_v4	LOKIASV2_0664_ESMFold_hypothetical_protein	AF-Q87JD1-F1-model_v4 UPF0251 protein VPA0321	0.323	98	64	1	98	1	95	1.563E-06	222
LOKIASV2_0664_ESMFold_hypothetical_protein	AF-Q0AV72-F1-model_v4	LOKIASV2_0664_ESMFold_hypothetical_protein	AF-Q0AV72-F1-model_v4 UPF0251 protein Swol_2090	0.366	60	37	34	93	31	90	1.531E-05	222
LOKIASV2_0664_ESMFold_hypothetical_protein	AF-A5FSQ2-F1-model_v4	LOKIASV2_0664_ESMFold_hypothetical_protein	AF-A5FSQ2-F1-model_v4 UPF0251 protein DehaBAV1_0135	0.365	93	57	1	93	1	90	3.999E-06	217
LOKIASV2_0664_ESMFold_hypothetical_protein	AF-Q3Z9Y3-F1-model_v4	LOKIASV2_0664_ESMFold_hypothetical_protein	AF-Q3Z9Y3-F1-model_v4 UPF0251 protein DET0218	0.376	93	56	1	93	1	90	3.999E-06	216
LOKIASV2_0664_ESMFold_hypothetical_protein	AF-B2A0V2-F1-model_v4	LOKIASV2_0664_ESMFold_hypothetical_protein	AF-B2A0V2-F1-model_v4 UPF0251 protein Nther_2417	0.354	93	57	1	93	1	90	4.574E-06	215
LOKIASV2_0664_ESMFold_hypothetical_protein	AF-Q8TIB0-F1-model_v4	LOKIASV2_0664_ESMFold_hypothetical_protein	AF-Q8TIB0-F1-model_v4 UPF0251 protein MA_4245	0.390	64	38	30	93	31	94	1.431E-05	214
LOKIASV2_0664_ESMFold_hypothetical_protein	AF-B0K6G7-F1-model_v4	LOKIASV2_0664_ESMFold_hypothetical_protein	AF-B0K6G7-F1-model_v4 UPF0251 protein Teth514_1147	0.365	93	57	1	93	1	90	5.231E-06	214
LOKIASV2_0664_ESMFold_hypothetical_protein	AF-Q3ZWU0-F1-model_v4	LOKIASV2_0664_ESMFold_hypothetical_protein	AF-Q3ZWU0-F1-model_v4 UPF0251 protein cbdbA217	0.365	93	57	1	93	1	90	5.594E-06	213
LOKIASV2_0664_ESMFold_hypothetical_protein	AF-A1RNQ0-F1-model_v4	LOKIASV2_0664_ESMFold_hypothetical_protein	AF-A1RNQ0-F1-model_v4 UPF0251 protein Sputw3181_3483	0.306	100	66	1	100	1	96	1.912E-06	212
LOKIASV2_0664_ESMFold_hypothetical_protein	AF-A4Y384-F1-model_v4	LOKIASV2_0664_ESMFold_hypothetical_protein	AF-A4Y384-F1-model_v4 UPF0251 protein Sputcn32_0687	0.306	100	66	1	100	1	96	2.044E-06	212
LOKIASV2_0664_ESMFold_hypothetical_protein	AF-Q8KCY0-F1-model_v4	LOKIASV2_0664_ESMFold_hypothetical_protein	AF-Q8KCY0-F1-model_v4 UPF0251 protein CT1277	0.274	170	97	1	170	1	135	8.909E-09	210
LOKIASV2_0664_ESMFold_hypothetical_protein	AF-A8H8R3-F1-model_v4	LOKIASV2_0664_ESMFold_hypothetical_protein	AF-A8H8R3-F1-model_v4 UPF0251 protein Spea_3639	0.313	98	65	1	98	1	96	3.270E-06	209
LOKIASV2_0664_ESMFold_hypothetical_protein	AF-Q7MCF1-F1-model_v4	LOKIASV2_0664_ESMFold_hypothetical_protein	AF-Q7MCF1-F1-model_v4 UPF0251 protein VVA1436	0.360	100	61	1	100	1	97	3.497E-06	209
LOKIASV2_0664_ESMFold_hypothetical_protein	AF-A9A6A5-F1-model_v4	LOKIASV2_0664_ESMFold_hypothetical_protein	AF-A9A6A5-F1-model_v4 UPF0251 protein MmarC6_0272	0.383	60	36	33	92	34	93	3.916E-05	208
LOKIASV2_0664_ESMFold_hypothetical_protein	AF-Q8KDU4-F1-model_v4	LOKIASV2_0664_ESMFold_hypothetical_protein	AF-Q8KDU4-F1-model_v4 UPF0251 protein CT0950	0.254	169	104	1	169	6	145	3.410E-08	208
LOKIASV2_0664_ESMFold_hypothetical_protein	AF-B0TUZ6-F1-model_v4	LOKIASV2_0664_ESMFold_hypothetical_protein	AF-B0TUZ6-F1-model_v4 UPF0251 protein Shal_3723	0.292	98	67	1	98	1	95	3.999E-06	207
LOKIASV2_0664_ESMFold_hypothetical_protein	AF-Q8EIV3-F1-model_v4	LOKIASV2_0664_ESMFold_hypothetical_protein	AF-Q8EIV3-F1-model_v4 UPF0251 protein SO_0727	0.320	99	64	1	99	1	95	3.058E-06	207
LOKIASV2_0664_ESMFold_hypothetical_protein	AF-B0K7S0-F1-model_v4	LOKIASV2_0664_ESMFold_hypothetical_protein	AF-B0K7S0-F1-model_v4 UPF0251 protein Teth39_0655	0.365	93	57	1	93	1	90	7.824E-06	207
LOKIASV2_0664_ESMFold_hypothetical_protein	AF-A8G094-F1-model_v4	LOKIASV2_0664_ESMFold_hypothetical_protein	AF-A8G094-F1-model_v4 UPF0251 protein Ssed_3913	0.292	98	67	1	98	1	95	2.674E-06	206
LOKIASV2_0664_ESMFold_hypothetical_protein	AF-B3QUL7-F1-model_v4	LOKIASV2_0664_ESMFold_hypothetical_protein	AF-B3QUL7-F1-model_v4 UPF0251 protein Ctha_0452	0.250	169	98	1	169	1	131	1.425E-08	206
LOKIASV2_0664_ESMFold_hypothetical_protein	AF-Q8U352-F1-model_v4	LOKIASV2_0664_ESMFold_hypothetical_protein	AF-Q8U352-F1-model_v4 UPF0251 protein PF0620	0.423	59	33	34	92	37	95	2.289E-05	205
LOKIASV2_0664_ESMFold_hypothetical_protein	AF-Q6LZK8-F1-model_v4	LOKIASV2_0664_ESMFold_hypothetical_protein	AF-Q6LZK8-F1-model_v4 UPF0251 protein MMP0619	0.355	59	37	34	92	35	93	4.790E-05	205
LOKIASV2_0664_ESMFold_hypothetical_protein	AF-Q8D5H3-F1-model_v4	LOKIASV2_0664_ESMFold_hypothetical_protein	AF-Q8D5H3-F1-model_v4 UPF0251 protein VV2_0946	0.360	100	61	1	100	1	97	5.594E-06	202
LOKIASV2_0664_ESMFold_hypothetical_protein	AF-Q2RHY2-F1-model_v4	LOKIASV2_0664_ESMFold_hypothetical_protein	AF-Q2RHY2-F1-model_v4 UPF0251 protein Moth_1655	0.227	176	110	1	176	1	143	8.725E-08	201
LOKIASV2_0664_ESMFold_hypothetical_protein	AF-O29591-F1-model_v4	LOKIASV2_0664_ESMFold_hypothetical_protein	AF-O29591-F1-model_v4 UPF0251 protein AF_0666	0.409	61	35	33	93	37	97	5.858E-05	198
LOKIASV2_0664_ESMFold_hypothetical_protein	AF-Q8PY75-F1-model_v4	LOKIASV2_0664_ESMFold_hypothetical_protein	AF-Q8PY75-F1-model_v4 UPF0251 protein MM_0989	0.304	92	61	2	93	6	94	1.750E-05	197
LOKIASV2_0664_ESMFold_hypothetical_protein	AF-O27246-F1-model_v4	LOKIASV2_0664_ESMFold_hypothetical_protein	AF-O27246-F1-model_v4 UPF0251 protein MTH_1178	0.276	176	97	1	176	1	135	1.993E-08	197
LOKIASV2_0664_ESMFold_hypothetical_protein	AF-Q9KN74-F1-model_v4	LOKIASV2_0664_ESMFold_hypothetical_protein	AF-Q9KN74-F1-model_v4 UPF0251 protein VC_A0091	0.282	98	67	1	98	1	95	1.023E-05	196
LOKIASV2_0664_ESMFold_hypothetical_protein	AF-A6USB4-F1-model_v4	LOKIASV2_0664_ESMFold_hypothetical_protein	AF-A6USB4-F1-model_v4 UPF0251 protein Mevan_1492	0.336	92	58	2	93	6	94	2.448E-05	196
LOKIASV2_0664_ESMFold_hypothetical_protein	AF-B1I1P6-F1-model_v4	LOKIASV2_0664_ESMFold_hypothetical_protein	AF-B1I1P6-F1-model_v4 UPF0251 protein Daud_0090	0.255	137	76	34	170	31	133	2.607E-08	196
LOKIASV2_0664_ESMFold_hypothetical_protein	AF-O58533-F1-model_v4	LOKIASV2_0664_ESMFold_hypothetical_protein	AF-O58533-F1-model_v4 UPF0251 protein PH0803	0.378	95	57	2	96	10	102	8.947E-06	195
LOKIASV2_0664_ESMFold_hypothetical_protein	AF-Q8TRZ3-F1-model_v4	LOKIASV2_0664_ESMFold_hypothetical_protein	AF-Q8TRZ3-F1-model_v4 UPF0251 protein MA_1017	0.265	140	79	34	173	30	138	1.246E-08	194
LOKIASV2_0664_ESMFold_hypothetical_protein	AF-B1L0J7-F1-model_v4	LOKIASV2_0664_ESMFold_hypothetical_protein	AF-B1L0J7-F1-model_v4 UPF0251 protein CLK_0815	0.263	169	96	1	169	1	131	1.825E-07	193
LOKIASV2_0664_ESMFold_hypothetical_protein	AF-Q0W830-F1-model_v4	LOKIASV2_0664_ESMFold_hypothetical_protein	AF-Q0W830-F1-model_v4 UPF0251 protein UNCMA_27150	0.272	136	76	34	169	30	134	1.743E-08	193
LOKIASV2_0664_ESMFold_hypothetical_protein	AF-A8ZT78-F1-model_v4	LOKIASV2_0664_ESMFold_hypothetical_protein	AF-A8ZT78-F1-model_v4 UPF0251 protein Dole_1957	0.333	93	59	1	93	1	90	2.448E-05	192
LOKIASV2_0664_ESMFold_hypothetical_protein	AF-A7FTP7-F1-model_v4	LOKIASV2_0664_ESMFold_hypothetical_protein	AF-A7FTP7-F1-model_v4 UPF0251 protein CLB_1397	0.257	169	97	1	169	1	131	1.952E-07	192
LOKIASV2_0664_ESMFold_hypothetical_protein	AF-A5F1F9-F1-model_v4	LOKIASV2_0664_ESMFold_hypothetical_protein	AF-A5F1F9-F1-model_v4 UPF0251 protein VC0395_0048/VC395_A0084	0.282	98	67	1	98	1	95	1.637E-05	191
LOKIASV2_0664_ESMFold_hypothetical_protein	AF-B8CIG1-F1-model_v4	LOKIASV2_0664_ESMFold_hypothetical_protein	AF-B8CIG1-F1-model_v4 UPF0251 protein swp_0615	0.297	100	68	1	100	1	98	8.367E-06	191
LOKIASV2_0664_ESMFold_hypothetical_protein	AF-C3LUB5-F1-model_v4	LOKIASV2_0664_ESMFold_hypothetical_protein	AF-C3LUB5-F1-model_v4 UPF0251 protein VCM66_A0089	0.282	98	67	1	98	1	95	2.002E-05	189
LOKIASV2_0664_ESMFold_hypothetical_protein	AF-B8CZ57-F1-model_v4	LOKIASV2_0664_ESMFold_hypothetical_protein	AF-B8CZ57-F1-model_v4 UPF0251 protein Hore_18270	0.265	162	93	1	162	1	128	8.544E-07	189
LOKIASV2_0664_ESMFold_hypothetical_protein	AF-Q9UZ88-F1-model_v4	LOKIASV2_0664_ESMFold_hypothetical_protein	AF-Q9UZ88-F1-model_v4 UPF0251 protein PYRAB12660	0.395	91	53	2	92	10	98	1.872E-05	188
LOKIASV2_0664_ESMFold_hypothetical_protein	AF-Q2RV50-F1-model_v4	LOKIASV2_0664_ESMFold_hypothetical_protein	AF-Q2RV50-F1-model_v4 UPF0251 protein Rru_A1194	0.373	83	47	33	108	30	112	5.231E-06	187
LOKIASV2_0664_ESMFold_hypothetical_protein	AF-Q8PV84-F1-model_v4	LOKIASV2_0664_ESMFold_hypothetical_protein	AF-Q8PV84-F1-model_v4 UPF0251 protein MM_2090	0.270	137	77	34	170	30	135	3.646E-08	187
LOKIASV2_0664_ESMFold_hypothetical_protein	AF-B9MMQ3-F1-model_v4	LOKIASV2_0664_ESMFold_hypothetical_protein	AF-B9MMQ3-F1-model_v4 UPF0251 protein Athe_2281	0.260	136	71	33	168	27	123	8.725E-08	186
LOKIASV2_0664_ESMFold_hypothetical_protein	AF-B3EJP4-F1-model_v4	LOKIASV2_0664_ESMFold_hypothetical_protein	AF-B3EJP4-F1-model_v4 UPF0251 protein Cphamn1_1487	0.248	142	86	29	170	30	145	2.982E-08	185
LOKIASV2_0664_ESMFold_hypothetical_protein	AF-A3D8W0-F1-model_v4	LOKIASV2_0664_ESMFold_hypothetical_protein	AF-A3D8W0-F1-model_v4 UPF0251 protein Sbal_3699	0.310	100	66	1	100	1	96	6.397E-06	184
LOKIASV2_0664_ESMFold_hypothetical_protein	AF-A4XG37-F1-model_v4	LOKIASV2_0664_ESMFold_hypothetical_protein	AF-A4XG37-F1-model_v4 UPF0251 protein Csac_0224	0.251	137	73	33	169	27	124	1.707E-07	181
LOKIASV2_0664_ESMFold_hypothetical_protein	AF-C1FLM3-F1-model_v4	LOKIASV2_0664_ESMFold_hypothetical_protein	AF-C1FLM3-F1-model_v4 UPF0251 protein CLM_1546	0.255	169	97	1	169	1	131	1.396E-07	178
LOKIASV2_0664_ESMFold_hypothetical_protein	AF-A6VJS4-F1-model_v4	LOKIASV2_0664_ESMFold_hypothetical_protein	AF-A6VJS4-F1-model_v4 UPF0251 protein MmarC7_1642	0.329	79	48	34	105	35	113	1.431E-05	177
LOKIASV2_0664_ESMFold_hypothetical_protein	AF-A4FYK8-F1-model_v4	LOKIASV2_0664_ESMFold_hypothetical_protein	AF-A4FYK8-F1-model_v4 UPF0251 protein MmarC5_0986	0.315	76	47	33	101	34	109	3.662E-05	177
LOKIASV2_0664_ESMFold_hypothetical_protein	AF-Q58640-F1-model_v4	LOKIASV2_0664_ESMFold_hypothetical_protein	AF-Q58640-F1-model_v4 UPF0251 protein MJ1243	0.305	107	72	2	108	5	109	2.994E-05	175
LOKIASV2_0664_ESMFold_hypothetical_protein	AF-Q895A7-F1-model_v4	LOKIASV2_0664_ESMFold_hypothetical_protein	AF-Q895A7-F1-model_v4 UPF0251 protein CTC_01373	0.267	169	95	1	169	1	131	3.339E-07	175
LOKIASV2_0664_ESMFold_hypothetical_protein	AF-Q5JF37-F1-model_v4	LOKIASV2_0664_ESMFold_hypothetical_protein	AF-Q5JF37-F1-model_v4 UPF0251 protein TK0562	0.361	91	56	2	92	12	100	2.448E-05	173
LOKIASV2_0664_ESMFold_hypothetical_protein	AF-B8I784-F1-model_v4	LOKIASV2_0664_ESMFold_hypothetical_protein	AF-B8I784-F1-model_v4 UPF0251 protein Ccel_0627	0.272	121	86	1	121	1	119	9.568E-06	171
LOKIASV2_0664_ESMFold_hypothetical_protein	AF-A0PYX0-F1-model_v4	LOKIASV2_0664_ESMFold_hypothetical_protein	AF-A0PYX0-F1-model_v4 UPF0251 protein NT01CX_1491	0.230	145	83	24	168	22	130	4.367E-07	171
LOKIASV2_0664_ESMFold_hypothetical_protein	AF-C3KUP0-F1-model_v4	LOKIASV2_0664_ESMFold_hypothetical_protein	AF-C3KUP0-F1-model_v4 UPF0251 protein CLJ_B1488	0.261	147	81	29	175	26	135	1.067E-07	171
LOKIASV2_0664_ESMFold_hypothetical_protein	AF-Q8TUB6-F1-model_v4	LOKIASV2_0664_ESMFold_hypothetical_protein	AF-Q8TUB6-F1-model_v4 UPF0251 protein MA_0157	0.268	138	99	33	170	29	164	5.833E-08	171
LOKIASV2_0664_ESMFold_hypothetical_protein	AF-A7GD74-F1-model_v4	LOKIASV2_0664_ESMFold_hypothetical_protein	AF-A7GD74-F1-model_v4 UPF0251 protein CLI_1469	0.265	141	77	29	169	26	131	3.122E-07	170
LOKIASV2_0664_ESMFold_hypothetical_protein	AF-Q24RW2-F1-model_v4	LOKIASV2_0664_ESMFold_hypothetical_protein	AF-Q24RW2-F1-model_v4 UPF0251 protein DSY3441	0.272	122	87	1	120	1	122	8.947E-06	169
LOKIASV2_0664_ESMFold_hypothetical_protein	AF-B4S888-F1-model_v4	LOKIASV2_0664_ESMFold_hypothetical_protein	AF-B4S888-F1-model_v4 UPF0251 protein Paes_1249	0.253	139	81	34	172	36	145	1.067E-07	169
LOKIASV2_0664_ESMFold_hypothetical_protein	AF-A5I1K5-F1-model_v4	LOKIASV2_0664_ESMFold_hypothetical_protein	AF-A5I1K5-F1-model_v4 UPF0251 protein CBO1373/CLC_1408	0.252	175	100	1	175	1	135	3.819E-07	167
LOKIASV2_0664_ESMFold_hypothetical_protein	AF-A6LXM3-F1-model_v4	LOKIASV2_0664_ESMFold_hypothetical_protein	AF-A6LXM3-F1-model_v4 UPF0251 protein Cbei_2962	0.275	147	79	29	175	26	135	2.232E-07	166
LOKIASV2_0664_ESMFold_hypothetical_protein	AF-B8FRA6-F1-model_v4	LOKIASV2_0664_ESMFold_hypothetical_protein	AF-B8FRA6-F1-model_v4 UPF0251 protein Dhaf_1981	0.291	122	85	1	121	1	122	1.431E-05	165
LOKIASV2_0664_ESMFold_hypothetical_protein	AF-B1IKA6-F1-model_v4	LOKIASV2_0664_ESMFold_hypothetical_protein	AF-B1IKA6-F1-model_v4 UPF0251 protein CLD_3165	0.261	147	81	29	175	26	135	2.232E-07	165
LOKIASV2_0664_ESMFold_hypothetical_protein	AF-Q97EE7-F1-model_v4	LOKIASV2_0664_ESMFold_hypothetical_protein	AF-Q97EE7-F1-model_v4 UPF0251 protein CA_C3166	0.246	140	78	29	168	26	130	6.986E-07	164
LOKIASV2_0664_ESMFold_hypothetical_protein	AF-Q3AS74-F1-model_v4	LOKIASV2_0664_ESMFold_hypothetical_protein	AF-Q3AS74-F1-model_v4 UPF0251 protein Cag_0886	0.210	154	99	22	175	26	151	3.571E-07	162
LOKIASV2_0664_ESMFold_hypothetical_protein	AF-Q8PWX8-F1-model_v4	LOKIASV2_0664_ESMFold_hypothetical_protein	AF-Q8PWX8-F1-model_v4 UPF0251 protein MM_1448	0.278	146	103	25	170	21	164	1.492E-07	161
LOKIASV2_0664_ESMFold_hypothetical_protein	AF-A6TN94-F1-model_v4	LOKIASV2_0664_ESMFold_hypothetical_protein	AF-A6TN94-F1-model_v4 UPF0251 protein Amet_1463	0.315	117	78	1	117	1	115	1.338E-05	152
LOKIASV2_0664_ESMFold_hypothetical_protein	AF-P38133-F1-model_v4	LOKIASV2_0664_ESMFold_hypothetical_protein	AF-P38133-F1-model_v4 RNA polymerase sigma-E factor	0.274	51	36	37	87	110	160	1.437E-02	129
LOKIASV2_0664_ESMFold_hypothetical_protein	AF-P06574-F1-model_v4	LOKIASV2_0664_ESMFold_hypothetical_protein	AF-P06574-F1-model_v4 RNA polymerase sigma-B factor	0.320	50	33	37	86	206	255	2.812E-02	119
LOKIASV2_0664_ESMFold_hypothetical_protein	AF-P9WGI2-F1-model_v4	LOKIASV2_0664_ESMFold_hypothetical_protein	AF-P9WGI2-F1-model_v4 RNA polymerase sigma factor SigF	0.288	45	31	40	84	216	260	2.629E-02	117
LOKIASV2_0664_ESMFold_hypothetical_protein	AF-P37971-F1-model_v4	LOKIASV2_0664_ESMFold_hypothetical_protein	AF-P37971-F1-model_v4 RNA polymerase sigma-F factor	0.325	43	28	41	83	240	282	2.010E-02	117
LOKIASV2_0664_ESMFold_hypothetical_protein	AF-P37970-F1-model_v4	LOKIASV2_0664_ESMFold_hypothetical_protein	AF-P37970-F1-model_v4 RNA polymerase sigma-F factor	0.325	43	28	41	83	250	292	2.299E-02	116
LOKIASV2_0664_ESMFold_hypothetical_protein	AF-Q9K5J6-F1-model_v4	LOKIASV2_0664_ESMFold_hypothetical_protein	AF-Q9K5J6-F1-model_v4 RNA polymerase sigma-B factor	0.313	51	34	37	86	206	256	2.629E-02	115
LOKIASV2_0664_ESMFold_hypothetical_protein	AF-P19940-F1-model_v4	LOKIASV2_0664_ESMFold_hypothetical_protein	AF-P19940-F1-model_v4 RNA polymerase sigma-G factor	0.326	46	30	37	82	211	256	3.678E-02	114
LOKIASV2_0664_ESMFold_hypothetical_protein	AF-Q82EA9-F1-model_v4	LOKIASV2_0664_ESMFold_hypothetical_protein	AF-Q82EA9-F1-model_v4 RNA polymerase sigma-E factor	0.254	51	37	37	87	112	162	5.144E-02	113
LOKIASV2_0664_ESMFold_hypothetical_protein	AF-P33658-F1-model_v4	LOKIASV2_0664_ESMFold_hypothetical_protein	AF-P33658-F1-model_v4 RNA polymerase sigma-G factor	0.326	46	30	37	82	210	255	4.498E-02	112
LOKIASV2_0664_ESMFold_hypothetical_protein	AF-P26764-F1-model_v4	LOKIASV2_0664_ESMFold_hypothetical_protein	AF-P26764-F1-model_v4 RNA polymerase sigma-F factor	0.276	47	33	40	86	206	252	3.216E-02	111
LOKIASV2_0664_ESMFold_hypothetical_protein	AF-P9WGI3-F1-model_v4	LOKIASV2_0664_ESMFold_hypothetical_protein	AF-P9WGI3-F1-model_v4 RNA polymerase sigma factor SigF	0.295	44	30	41	84	217	260	4.206E-02	111
LOKIASV2_0664_ESMFold_hypothetical_protein	AF-P07860-F1-model_v4	LOKIASV2_0664_ESMFold_hypothetical_protein	AF-P07860-F1-model_v4 RNA polymerase sigma-F factor	0.250	48	35	40	87	206	253	3.439E-02	110
LOKIASV2_0664_ESMFold_hypothetical_protein	AF-O07582-F1-model_v4	LOKIASV2_0664_ESMFold_hypothetical_protein	AF-O07582-F1-model_v4 ECF RNA polymerase sigma factor SigM	0.294	51	35	37	87	109	159	6.728E-02	108
LOKIASV2_0664_ESMFold_hypothetical_protein	AF-P10726-F1-model_v4	LOKIASV2_0664_ESMFold_hypothetical_protein	AF-P10726-F1-model_v4 RNA polymerase sigma-D factor	0.270	48	34	40	87	205	252	5.501E-02	108
LOKIASV2_0664_ESMFold_hypothetical_protein	AF-P35145-F1-model_v4	LOKIASV2_0664_ESMFold_hypothetical_protein	AF-P35145-F1-model_v4 RNA polymerase sigma-F factor	0.255	47	34	40	86	206	252	4.810E-02	106
LOKIASV2_0664_ESMFold_hypothetical_protein	AF-P39140-F1-model_v4	LOKIASV2_0664_ESMFold_hypothetical_protein	AF-P39140-F1-model_v4 Deoxyribonucleoside regulator	0.333	39	25	40	78	8	46	6.728E-02	106
LOKIASV2_0664_ESMFold_hypothetical_protein	AF-O07627-F1-model_v4	LOKIASV2_0664_ESMFold_hypothetical_protein	AF-O07627-F1-model_v4 RNA polymerase sigma factor YlaC	0.235	51	38	37	87	117	167	6.728E-02	105
LOKIASV2_0664_ESMFold_hypothetical_protein	AF-O68887-F1-model_v4	LOKIASV2_0664_ESMFold_hypothetical_protein	AF-O68887-F1-model_v4 RNA polymerase sigma-E factor	0.254	51	37	37	87	112	162	1.076E-01	104
LOKIASV2_0664_ESMFold_hypothetical_protein	AF-Q9UZ54-F1-model_v4	LOKIASV2_0664_ESMFold_hypothetical_protein	AF-Q9UZ54-F1-model_v4 Putative transcriptional regulatory protein PYRAB13000	0.354	48	30	37	84	5	51	8.228E-02	102
LOKIASV2_0664_ESMFold_hypothetical_protein	AF-Q06198-F1-model_v4	LOKIASV2_0664_ESMFold_hypothetical_protein	AF-Q06198-F1-model_v4 RNA polymerase sigma-H factor	0.300	50	34	37	86	139	188	1.076E-01	101
LOKIASV2_0664_ESMFold_hypothetical_protein	AF-P44790-F1-model_v4	LOKIASV2_0664_ESMFold_hypothetical_protein	AF-P44790-F1-model_v4 ECF RNA polymerase sigma-E factor	0.240	50	37	37	86	138	187	1.151E-01	100
LOKIASV2_0664_ESMFold_hypothetical_protein	AF-P0DUB5-F1-model_v4	LOKIASV2_0664_ESMFold_hypothetical_protein	AF-P0DUB5-F1-model_v4 RNA polymerase sigma factor TcsR	0.291	48	33	37	84	125	172	1.151E-01	99
LOKIASV2_0664_ESMFold_hypothetical_protein	AF-Q8U3D3-F1-model_v4	LOKIASV2_0664_ESMFold_hypothetical_protein	AF-Q8U3D3-F1-model_v4 Putative transcriptional regulatory protein PF0535	0.333	45	29	40	84	8	51	1.006E-01	98
LOKIASV2_0664_ESMFold_hypothetical_protein	AF-O58497-F1-model_v4	LOKIASV2_0664_ESMFold_hypothetical_protein	AF-O58497-F1-model_v4 Putative transcriptional regulatory protein PH0763	0.354	48	30	37	84	5	51	1.151E-01	98
LOKIASV2_0664_ESMFold_hypothetical_protein	AF-Q5JHH2-F1-model_v4	LOKIASV2_0664_ESMFold_hypothetical_protein	AF-Q5JHH2-F1-model_v4 Putative transcriptional regulatory protein TK2151	0.375	48	29	37	84	5	51	1.231E-01	98
LOKIASV2_0664_ESMFold_hypothetical_protein	AF-P23484-F1-model_v4	LOKIASV2_0664_ESMFold_hypothetical_protein	AF-P23484-F1-model_v4 Probable RNA polymerase sigma factor FecI	0.260	50	36	40	88	124	173	4.810E-02	97
LOKIASV2_0664_ESMFold_hypothetical_protein	AF-P15935-F1-model_v4	LOKIASV2_0664_ESMFold_hypothetical_protein	AF-P15935-F1-model_v4 Bacteriocin UviA	0.260	46	33	37	82	138	183	1.721E-01	97
LOKIASV2_0664_ESMFold_hypothetical_protein	AF-P17211-F1-model_v4	LOKIASV2_0664_ESMFold_hypothetical_protein	AF-P17211-F1-model_v4 RNA polymerase sigma factor WhiG	0.187	48	38	40	87	231	278	1.408E-01	97
LOKIASV2_0664_ESMFold_hypothetical_protein	AF-A3Q5U0-F1-model_v4	LOKIASV2_0664_ESMFold_hypothetical_protein	AF-A3Q5U0-F1-model_v4 ECF RNA polymerase sigma factor SigK	0.173	46	37	40	85	146	191	1.721E-01	96
LOKIASV2_0664_ESMFold_hypothetical_protein	AF-H8EXN1-F1-model_v4	LOKIASV2_0664_ESMFold_hypothetical_protein	AF-H8EXN1-F1-model_v4 ECF RNA polymerase sigma factor SigL	0.200	50	39	37	86	123	172	1.841E-01	95
LOKIASV2_0664_ESMFold_hypothetical_protein	AF-P66810-F1-model_v4	LOKIASV2_0664_ESMFold_hypothetical_protein	AF-P66810-F1-model_v4 Probable RNA polymerase sigma-C factor	0.304	46	31	37	82	131	176	1.841E-01	95
LOKIASV2_0664_ESMFold_hypothetical_protein	AF-P9WGH0-F1-model_v4	LOKIASV2_0664_ESMFold_hypothetical_protein	AF-P9WGH0-F1-model_v4 ECF RNA polymerase sigma factor SigC	0.304	46	31	37	82	131	176	1.841E-01	95
LOKIASV2_0664_ESMFold_hypothetical_protein	AF-Q45585-F1-model_v4	LOKIASV2_0664_ESMFold_hypothetical_protein	AF-Q45585-F1-model_v4 ECF RNA polymerase sigma factor SigW	0.200	50	39	37	86	137	186	1.408E-01	95
LOKIASV2_0664_ESMFold_hypothetical_protein	AF-P9WGH5-F1-model_v4	LOKIASV2_0664_ESMFold_hypothetical_protein	AF-P9WGH5-F1-model_v4 ECF RNA polymerase sigma factor SigL	0.200	50	39	37	86	123	172	1.841E-01	94
LOKIASV2_0664_ESMFold_hypothetical_protein	AF-P9WGH4-F1-model_v4	LOKIASV2_0664_ESMFold_hypothetical_protein	AF-P9WGH4-F1-model_v4 ECF RNA polymerase sigma factor SigL	0.200	50	39	37	86	123	172	1.841E-01	94
LOKIASV2_0664_ESMFold_hypothetical_protein	AF-P94370-F1-model_v4	LOKIASV2_0664_ESMFold_hypothetical_protein	AF-P94370-F1-model_v4 RNA polymerase sigma factor SigY	0.200	50	39	37	86	128	177	1.721E-01	93
LOKIASV2_0664_ESMFold_hypothetical_protein	AF-B3Q6P8-F1-model_v4	LOKIASV2_0664_ESMFold_hypothetical_protein	AF-B3Q6P8-F1-model_v4 ECF RNA polymerase sigma factor EcfG	0.272	44	31	39	82	114	157	1.841E-01	93
LOKIASV2_0664_ESMFold_hypothetical_protein	AF-V5T8H7-F1-model_v4	LOKIASV2_0664_ESMFold_hypothetical_protein	AF-V5T8H7-F1-model_v4 RNA polymerase sigma factor TcsR	0.312	48	32	37	84	125	172	1.969E-01	92
LOKIASV2_0664_ESMFold_hypothetical_protein	AF-T0CUB8-F1-model_v4	LOKIASV2_0664_ESMFold_hypothetical_protein	AF-T0CUB8-F1-model_v4 RNA polymerase sigma factor TcsR	0.311	45	30	37	81	125	169	2.252E-01	91
LOKIASV2_0664_ESMFold_hypothetical_protein	AF-O05409-F1-model_v4	LOKIASV2_0664_ESMFold_hypothetical_protein	AF-O05409-F1-model_v4 RNA polymerase sigma factor SigZ	0.354	48	30	40	87	110	156	1.006E-01	91
LOKIASV2_0664_ESMFold_hypothetical_protein	AF-P9WGG8-F1-model_v4	LOKIASV2_0664_ESMFold_hypothetical_protein	AF-P9WGG8-F1-model_v4 ECF RNA polymerase sigma factor SigD	0.254	51	37	37	87	158	208	2.754E-01	91
LOKIASV2_0664_ESMFold_hypothetical_protein	AF-P9WGH1-F1-model_v4	LOKIASV2_0664_ESMFold_hypothetical_protein	AF-P9WGH1-F1-model_v4 ECF RNA polymerase sigma factor SigC	0.304	46	31	37	82	131	176	3.149E-01	89
LOKIASV2_0664_ESMFold_hypothetical_protein	AF-A1TEV0-F1-model_v4	LOKIASV2_0664_ESMFold_hypothetical_protein	AF-A1TEV0-F1-model_v4 ECF RNA polymerase sigma factor SigK	0.222	45	34	41	85	150	194	2.945E-01	89
LOKIASV2_0664_ESMFold_hypothetical_protein	AF-P39356-F1-model_v4	LOKIASV2_0664_ESMFold_hypothetical_protein	AF-P39356-F1-model_v4 Uncharacterized transcriptional regulator YjhU	0.285	42	29	40	81	15	56	2.575E-01	89
LOKIASV2_0664_ESMFold_hypothetical_protein	AF-P0AEM8-F1-model_v4	LOKIASV2_0664_ESMFold_hypothetical_protein	AF-P0AEM8-F1-model_v4 RNA polymerase sigma factor FliA	0.212	47	36	40	86	192	238	3.149E-01	88
LOKIASV2_0664_ESMFold_hypothetical_protein	AF-Q7TM95-F1-model_v4	LOKIASV2_0664_ESMFold_hypothetical_protein	AF-Q7TM95-F1-model_v4 Tigger transposable element-derived protein 3	0.312	48	32	40	87	16	62	3.933E-02	88
LOKIASV2_0664_ESMFold_hypothetical_protein	AF-P0A2F0-F1-model_v4	LOKIASV2_0664_ESMFold_hypothetical_protein	AF-P0A2F0-F1-model_v4 ECF RNA polymerase sigma-E factor	0.245	53	37	37	86	138	190	1.408E-01	87
LOKIASV2_0664_ESMFold_hypothetical_protein	AF-P0AGB7-F1-model_v4	LOKIASV2_0664_ESMFold_hypothetical_protein	AF-P0AGB7-F1-model_v4 ECF RNA polymerase sigma-E factor	0.245	53	37	37	86	138	190	1.408E-01	87
LOKIASV2_0664_ESMFold_hypothetical_protein	AF-Q44583-F1-model_v4	LOKIASV2_0664_ESMFold_hypothetical_protein	AF-Q44583-F1-model_v4 RNA polymerase sigma factor NccH	0.235	51	38	37	87	134	184	2.945E-01	86
LOKIASV2_0664_ESMFold_hypothetical_protein	AF-G8QM61-F1-model_v4	LOKIASV2_0664_ESMFold_hypothetical_protein	AF-G8QM61-F1-model_v4 ECF RNA polymerase sigma factor SigF	0.211	52	40	37	88	139	190	1.969E-01	86
LOKIASV2_0664_ESMFold_hypothetical_protein	AF-H8F2P4-F1-model_v4	LOKIASV2_0664_ESMFold_hypothetical_protein	AF-H8F2P4-F1-model_v4 ECF RNA polymerase sigma factor SigM	0.160	50	41	37	86	138	187	3.149E-01	86
LOKIASV2_0664_ESMFold_hypothetical_protein	AF-P9WGG9-F1-model_v4	LOKIASV2_0664_ESMFold_hypothetical_protein	AF-P9WGG9-F1-model_v4 ECF RNA polymerase sigma factor SigD	0.254	51	37	37	87	158	208	4.119E-01	86
LOKIASV2_0664_ESMFold_hypothetical_protein	AF-P0AEM6-F1-model_v4	LOKIASV2_0664_ESMFold_hypothetical_protein	AF-P0AEM6-F1-model_v4 RNA polymerase sigma factor FliA	0.212	47	36	40	86	192	238	3.602E-01	86
LOKIASV2_0664_ESMFold_hypothetical_protein	AF-P0A2E8-F1-model_v4	LOKIASV2_0664_ESMFold_hypothetical_protein	AF-P0A2E8-F1-model_v4 RNA polymerase sigma factor FliA	0.212	47	36	40	86	192	238	3.851E-01	85
LOKIASV2_0664_ESMFold_hypothetical_protein	AF-P0AEM7-F1-model_v4	LOKIASV2_0664_ESMFold_hypothetical_protein	AF-P0AEM7-F1-model_v4 RNA polymerase sigma factor FliA	0.212	47	36	40	86	192	238	3.851E-01	85
LOKIASV2_0664_ESMFold_hypothetical_protein	AF-A6UR76-F1-model_v4	LOKIASV2_0664_ESMFold_hypothetical_protein	AF-A6UR76-F1-model_v4 Putative transcriptional regulatory protein Mevan_1098	0.297	47	32	40	86	8	53	2.754E-01	84
LOKIASV2_0664_ESMFold_hypothetical_protein	AF-P0A2F1-F1-model_v4	LOKIASV2_0664_ESMFold_hypothetical_protein	AF-P0A2F1-F1-model_v4 ECF RNA polymerase sigma-E factor	0.245	53	37	37	86	138	190	1.841E-01	84
LOKIASV2_0664_ESMFold_hypothetical_protein	AF-A1ULE1-F1-model_v4	LOKIASV2_0664_ESMFold_hypothetical_protein	AF-A1ULE1-F1-model_v4 ECF RNA polymerase sigma factor SigK	0.177	45	36	41	85	147	191	4.119E-01	84
