query	target	qheader	theader	fident	alnlen	mismatch	qstart	qend	tstart	tend	evalue	bits
LOKIASV2_3395_ESMFold_hypothetical_protein	AF-Q80W98-F1-model_v4	LOKIASV2_3395_ESMFold_hypothetical_protein	AF-Q80W98-F1-model_v4 Small glutamine-rich tetratricopeptide repeat-containing protein beta	0.104	158	122	224	381	68	204	1.449E+00	75
LOKIASV2_3395_ESMFold_hypothetical_protein	AF-F6PHZ6-F1-model_v4	LOKIASV2_3395_ESMFold_hypothetical_protein	AF-F6PHZ6-F1-model_v4 Inactive peptidyl-prolyl cis-trans isomerase FKBP6	0.118	171	139	231	389	133	303	8.953E-01	75
LOKIASV2_3395_ESMFold_hypothetical_protein	AF-Q5ZLF0-F1-model_v4	LOKIASV2_3395_ESMFold_hypothetical_protein	AF-Q5ZLF0-F1-model_v4 Hsc70-interacting protein	0.093	141	123	249	389	112	248	9.772E-01	75
LOKIASV2_3395_ESMFold_hypothetical_protein	AF-Q6DGG0-F1-model_v4	LOKIASV2_3395_ESMFold_hypothetical_protein	AF-Q6DGG0-F1-model_v4 Peptidyl-prolyl cis-trans isomerase D	0.102	156	137	235	388	213	368	6.040E-01	75
LOKIASV2_3395_ESMFold_hypothetical_protein	AF-Q27968-F1-model_v4	LOKIASV2_3395_ESMFold_hypothetical_protein	AF-Q27968-F1-model_v4 DnaJ homolog subfamily C member 3	0.066	255	216	158	389	27	281	1.490E-01	75
LOKIASV2_3395_ESMFold_hypothetical_protein	AF-Q60864-F1-model_v4	LOKIASV2_3395_ESMFold_hypothetical_protein	AF-Q60864-F1-model_v4 Stress-induced-phosphoprotein 1	0.134	331	235	107	378	146	476	6.780E-02	75
LOKIASV2_3395_ESMFold_hypothetical_protein	AF-Q6CT48-F1-model_v4	LOKIASV2_3395_ESMFold_hypothetical_protein	AF-Q6CT48-F1-model_v4 Peroxisomal targeting signal receptor	0.131	362	256	97	392	204	565	3.518E-02	75
LOKIASV2_3395_ESMFold_hypothetical_protein	AF-Q9VQE9-F1-model_v4	LOKIASV2_3395_ESMFold_hypothetical_protein	AF-Q9VQE9-F1-model_v4 Protein O-mannosyl-transferase TMTC1	0.102	230	186	183	390	537	766	3.420E-01	75
LOKIASV2_3395_ESMFold_hypothetical_protein	AF-Q2KJJ0-F1-model_v4	LOKIASV2_3395_ESMFold_hypothetical_protein	AF-Q2KJJ0-F1-model_v4 Pre-mRNA-processing factor 6	0.119	210	163	182	391	622	807	2.518E-01	75
LOKIASV2_3395_ESMFold_hypothetical_protein	AF-Q8X5M0-F1-model_v4	LOKIASV2_3395_ESMFold_hypothetical_protein	AF-Q8X5M0-F1-model_v4 Putative cellulose synthase operon protein C	0.145	264	210	127	390	117	363	2.307E-01	75
LOKIASV2_3395_ESMFold_hypothetical_protein	AF-Q9LEM8-F1-model_v4	LOKIASV2_3395_ESMFold_hypothetical_protein	AF-Q9LEM8-F1-model_v4 PsbD mRNA maturation factor Nac2, chloroplastic	0.125	232	194	167	389	954	1185	3.900E-01	75
LOKIASV2_3395_ESMFold_hypothetical_protein	AF-Q6INS3-F1-model_v4	LOKIASV2_3395_ESMFold_hypothetical_protein	AF-Q6INS3-F1-model_v4 ER membrane protein complex subunit 2-A	0.108	279	216	133	375	13	291	9.621E-02	74
LOKIASV2_3395_ESMFold_hypothetical_protein	AF-Q5R882-F1-model_v4	LOKIASV2_3395_ESMFold_hypothetical_protein	AF-Q5R882-F1-model_v4 ER membrane protein complex subunit 2	0.108	268	209	112	379	57	291	8.077E-02	74
LOKIASV2_3395_ESMFold_hypothetical_protein	AF-P33746-F1-model_v4	LOKIASV2_3395_ESMFold_hypothetical_protein	AF-P33746-F1-model_v4 Sol locus transcriptional repressor	0.110	287	239	115	384	6	292	6.780E-02	74
LOKIASV2_3395_ESMFold_hypothetical_protein	AF-D3ZQF4-F1-model_v4	LOKIASV2_3395_ESMFold_hypothetical_protein	AF-D3ZQF4-F1-model_v4 Inactive peptidyl-prolyl cis-trans isomerase FKBP6	0.118	167	139	231	389	144	310	7.852E-01	74
LOKIASV2_3395_ESMFold_hypothetical_protein	AF-P42460-F1-model_v4	LOKIASV2_3395_ESMFold_hypothetical_protein	AF-P42460-F1-model_v4 TPR repeat-containing protein Synpcc7942_0270	0.087	215	192	159	369	178	392	2.307E-01	74
LOKIASV2_3395_ESMFold_hypothetical_protein	AF-P30416-F1-model_v4	LOKIASV2_3395_ESMFold_hypothetical_protein	AF-P30416-F1-model_v4 Peptidyl-prolyl cis-trans isomerase FKBP4	0.114	160	140	231	389	262	421	7.516E-01	74
LOKIASV2_3395_ESMFold_hypothetical_protein	AF-Q91YW3-F1-model_v4	LOKIASV2_3395_ESMFold_hypothetical_protein	AF-Q91YW3-F1-model_v4 DnaJ homolog subfamily C member 3	0.072	259	226	145	389	23	281	1.699E-01	74
LOKIASV2_3395_ESMFold_hypothetical_protein	AF-Q9STS3-F1-model_v4	LOKIASV2_3395_ESMFold_hypothetical_protein	AF-Q9STS3-F1-model_v4 Anaphase-promoting complex subunit 8	0.126	212	167	167	378	376	567	3.274E-01	74
LOKIASV2_3395_ESMFold_hypothetical_protein	AF-O09012-F1-model_v4	LOKIASV2_3395_ESMFold_hypothetical_protein	AF-O09012-F1-model_v4 Peroxisomal targeting signal 1 receptor	0.086	377	260	105	390	259	635	5.215E-02	74
LOKIASV2_3395_ESMFold_hypothetical_protein	AF-Q9CY00-F1-model_v4	LOKIASV2_3395_ESMFold_hypothetical_protein	AF-Q9CY00-F1-model_v4 Tetratricopeptide repeat protein 30B	0.104	233	197	158	390	1	221	2.631E-01	74
LOKIASV2_3395_ESMFold_hypothetical_protein	AF-A4IFF3-F1-model_v4	LOKIASV2_3395_ESMFold_hypothetical_protein	AF-A4IFF3-F1-model_v4 Tetratricopeptide repeat protein 9C	0.123	163	134	233	386	2	164	1.114E+00	73
LOKIASV2_3395_ESMFold_hypothetical_protein	AF-O54981-F1-model_v4	LOKIASV2_3395_ESMFold_hypothetical_protein	AF-O54981-F1-model_v4 Stress-induced-phosphoprotein 1	0.128	331	236	107	378	146	476	9.209E-02	73
LOKIASV2_3395_ESMFold_hypothetical_protein	AF-P31948-F1-model_v4	LOKIASV2_3395_ESMFold_hypothetical_protein	AF-P31948-F1-model_v4 Stress-induced-phosphoprotein 1	0.128	331	236	107	378	146	476	9.209E-02	73
LOKIASV2_3395_ESMFold_hypothetical_protein	AF-P16522-F1-model_v4	LOKIASV2_3395_ESMFold_hypothetical_protein	AF-P16522-F1-model_v4 Anaphase-promoting complex subunit CDC23	0.125	209	166	167	375	434	624	4.074E-01	73
LOKIASV2_3395_ESMFold_hypothetical_protein	AF-Q28IV3-F1-model_v4	LOKIASV2_3395_ESMFold_hypothetical_protein	AF-Q28IV3-F1-model_v4 RNA polymerase II-associated protein 3	0.112	409	329	18	388	2	410	3.368E-02	73
LOKIASV2_3395_ESMFold_hypothetical_protein	AF-B2RYD6-F1-model_v4	LOKIASV2_3395_ESMFold_hypothetical_protein	AF-B2RYD6-F1-model_v4 Tetratricopeptide repeat protein 30B	0.104	233	197	158	390	1	221	3.274E-01	73
LOKIASV2_3395_ESMFold_hypothetical_protein	AF-Q8BRH0-F1-model_v4	LOKIASV2_3395_ESMFold_hypothetical_protein	AF-Q8BRH0-F1-model_v4 Protein O-mannosyl-transferase TMTC3	0.117	260	192	163	380	567	826	2.749E-01	73
LOKIASV2_3395_ESMFold_hypothetical_protein	AF-B5X0I6-F1-model_v4	LOKIASV2_3395_ESMFold_hypothetical_protein	AF-B5X0I6-F1-model_v4 Protein CTR9 homolog	0.125	243	184	163	373	550	792	2.518E-01	73
LOKIASV2_3395_ESMFold_hypothetical_protein	AF-Q03560-F1-model_v4	LOKIASV2_3395_ESMFold_hypothetical_protein	AF-Q03560-F1-model_v4 RNA polymerase-associated protein CTR9	0.120	336	240	105	378	463	798	7.400E-02	73
LOKIASV2_3395_ESMFold_hypothetical_protein	AF-O77033-F1-model_v4	LOKIASV2_3395_ESMFold_hypothetical_protein	AF-O77033-F1-model_v4 General transcriptional corepressor trfA	0.110	363	284	27	389	55	374	3.224E-02	73
LOKIASV2_3395_ESMFold_hypothetical_protein	AF-Q8K9W8-F1-model_v4	LOKIASV2_3395_ESMFold_hypothetical_protein	AF-Q8K9W8-F1-model_v4 UPF0162 protein BUsg_167	0.163	95	70	283	377	181	265	1.803E+00	72
LOKIASV2_3395_ESMFold_hypothetical_protein	AF-Q58208-F1-model_v4	LOKIASV2_3395_ESMFold_hypothetical_protein	AF-Q58208-F1-model_v4 TPR repeat-containing protein MJ0798	0.145	284	238	106	389	54	332	1.673E-02	72
LOKIASV2_3395_ESMFold_hypothetical_protein	AF-Q08168-F1-model_v4	LOKIASV2_3395_ESMFold_hypothetical_protein	AF-Q08168-F1-model_v4 58 kDa phosphoprotein	0.103	159	126	231	389	106	246	1.021E+00	72
LOKIASV2_3395_ESMFold_hypothetical_protein	AF-P0DTW8-F1-model_v4	LOKIASV2_3395_ESMFold_hypothetical_protein	AF-P0DTW8-F1-model_v4 Surface lipoprotein assembly modifier	0.083	150	124	226	375	83	218	9.353E-01	72
LOKIASV2_3395_ESMFold_hypothetical_protein	AF-Q43468-F1-model_v4	LOKIASV2_3395_ESMFold_hypothetical_protein	AF-Q43468-F1-model_v4 Hsp70-Hsp90 organizing protein 1	0.075	253	195	164	375	244	496	3.134E-01	72
LOKIASV2_3395_ESMFold_hypothetical_protein	AF-Q9Z3Q0-F1-model_v4	LOKIASV2_3395_ESMFold_hypothetical_protein	AF-Q9Z3Q0-F1-model_v4 Putative adenylate cyclase 3	0.104	230	193	129	358	302	517	2.411E-01	72
LOKIASV2_3395_ESMFold_hypothetical_protein	AF-O14217-F1-model_v4	LOKIASV2_3395_ESMFold_hypothetical_protein	AF-O14217-F1-model_v4 Probable mitochondrial import receptor subunit tom70	0.137	260	180	175	384	360	619	4.574E-02	72
LOKIASV2_3395_ESMFold_hypothetical_protein	AF-Q6NU95-F1-model_v4	LOKIASV2_3395_ESMFold_hypothetical_protein	AF-Q6NU95-F1-model_v4 RNA polymerase II-associated protein 3	0.105	395	329	21	389	15	409	2.827E-02	72
LOKIASV2_3395_ESMFold_hypothetical_protein	AF-Q9CSP9-F1-model_v4	LOKIASV2_3395_ESMFold_hypothetical_protein	AF-Q9CSP9-F1-model_v4 Tetratricopeptide repeat protein 14	0.103	164	135	226	389	290	440	4.853E-01	72
LOKIASV2_3395_ESMFold_hypothetical_protein	AF-Q9DBB4-F1-model_v4	LOKIASV2_3395_ESMFold_hypothetical_protein	AF-Q9DBB4-F1-model_v4 N-alpha-acetyltransferase 16, NatA auxiliary subunit	0.134	255	203	135	389	15	249	3.274E-01	72
LOKIASV2_3395_ESMFold_hypothetical_protein	AF-Q3UV71-F1-model_v4	LOKIASV2_3395_ESMFold_hypothetical_protein	AF-Q3UV71-F1-model_v4 Protein O-mannosyl-transferase TMTC1	0.129	254	193	167	389	679	932	2.307E-01	72
LOKIASV2_3395_ESMFold_hypothetical_protein	AF-Q9BGT1-F1-model_v4	LOKIASV2_3395_ESMFold_hypothetical_protein	AF-Q9BGT1-F1-model_v4 Tetratricopeptide repeat protein 9C	0.129	163	133	233	386	2	164	1.327E+00	71
LOKIASV2_3395_ESMFold_hypothetical_protein	AF-Q1XDU6-F1-model_v4	LOKIASV2_3395_ESMFold_hypothetical_protein	AF-Q1XDU6-F1-model_v4 Uncharacterized protein ycf37	0.139	181	147	198	378	6	177	9.772E-01	71
LOKIASV2_3395_ESMFold_hypothetical_protein	AF-B0BNG0-F1-model_v4	LOKIASV2_3395_ESMFold_hypothetical_protein	AF-B0BNG0-F1-model_v4 ER membrane protein complex subunit 2	0.114	279	218	133	379	13	291	1.146E-01	71
LOKIASV2_3395_ESMFold_hypothetical_protein	AF-C0PEY7-F1-model_v4	LOKIASV2_3395_ESMFold_hypothetical_protein	AF-C0PEY7-F1-model_v4 Tetratricopeptide repeat domain-containing protein PYG7, chloroplastic	0.162	201	149	179	379	132	310	5.534E-01	71
LOKIASV2_3395_ESMFold_hypothetical_protein	AF-Q91XW8-F1-model_v4	LOKIASV2_3395_ESMFold_hypothetical_protein	AF-Q91XW8-F1-model_v4 Inactive peptidyl-prolyl cis-trans isomerase FKBP6	0.133	165	136	235	392	148	312	1.216E+00	71
LOKIASV2_3395_ESMFold_hypothetical_protein	AF-Q5RF31-F1-model_v4	LOKIASV2_3395_ESMFold_hypothetical_protein	AF-Q5RF31-F1-model_v4 Hsc70-interacting protein	0.088	159	130	231	389	107	250	8.570E-01	71
LOKIASV2_3395_ESMFold_hypothetical_protein	AF-Q08752-F1-model_v4	LOKIASV2_3395_ESMFold_hypothetical_protein	AF-Q08752-F1-model_v4 Peptidyl-prolyl cis-trans isomerase D	0.110	156	137	233	388	214	368	7.194E-01	71
LOKIASV2_3395_ESMFold_hypothetical_protein	AF-Q9R0T3-F1-model_v4	LOKIASV2_3395_ESMFold_hypothetical_protein	AF-Q9R0T3-F1-model_v4 DnaJ homolog subfamily C member 3	0.072	260	219	153	389	22	281	2.307E-01	71
LOKIASV2_3395_ESMFold_hypothetical_protein	AF-Q7ZWU1-F1-model_v4	LOKIASV2_3395_ESMFold_hypothetical_protein	AF-Q7ZWU1-F1-model_v4 Stress-induced-phosphoprotein 1	0.113	326	236	107	373	146	471	8.438E-02	71
LOKIASV2_3395_ESMFold_hypothetical_protein	AF-Q9LNB6-F1-model_v4	LOKIASV2_3395_ESMFold_hypothetical_protein	AF-Q9LNB6-F1-model_v4 Hsp70-Hsp90 organizing protein 1	0.063	269	212	149	375	228	496	2.518E-01	71
LOKIASV2_3395_ESMFold_hypothetical_protein	AF-P38825-F1-model_v4	LOKIASV2_3395_ESMFold_hypothetical_protein	AF-P38825-F1-model_v4 Protein TOM71	0.102	230	183	181	385	395	624	4.853E-01	71
LOKIASV2_3395_ESMFold_hypothetical_protein	AF-Q96NG3-F1-model_v4	LOKIASV2_3395_ESMFold_hypothetical_protein	AF-Q96NG3-F1-model_v4 Outer dynein arm-docking complex subunit 4	0.101	293	263	97	389	214	506	1.937E-01	71
LOKIASV2_3395_ESMFold_hypothetical_protein	AF-Q5XIA4-F1-model_v4	LOKIASV2_3395_ESMFold_hypothetical_protein	AF-Q5XIA4-F1-model_v4 CCR4-NOT transcription complex subunit 10	0.087	259	217	145	383	14	272	2.114E-01	71
LOKIASV2_3395_ESMFold_hypothetical_protein	AF-Q8BH15-F1-model_v4	LOKIASV2_3395_ESMFold_hypothetical_protein	AF-Q8BH15-F1-model_v4 CCR4-NOT transcription complex subunit 10	0.090	259	217	145	383	14	272	2.024E-01	71
LOKIASV2_3395_ESMFold_hypothetical_protein	AF-Q6DE97-F1-model_v4	LOKIASV2_3395_ESMFold_hypothetical_protein	AF-Q6DE97-F1-model_v4 CCR4-NOT transcription complex subunit 10-A	0.094	260	213	148	383	16	275	1.426E-01	71
LOKIASV2_3395_ESMFold_hypothetical_protein	AF-O18158-F1-model_v4	LOKIASV2_3395_ESMFold_hypothetical_protein	AF-O18158-F1-model_v4 UDP-N-acetylglucosamine--peptide N-acetylglucosaminyltransferase	0.104	374	308	17	390	45	389	7.084E-02	71
LOKIASV2_3395_ESMFold_hypothetical_protein	AF-Q6NS46-F1-model_v4	LOKIASV2_3395_ESMFold_hypothetical_protein	AF-Q6NS46-F1-model_v4 Protein RRP5 homolog	0.098	255	223	145	392	1560	1814	8.815E-02	71
LOKIASV2_3395_ESMFold_hypothetical_protein	AF-A8E7I5-F1-model_v4	LOKIASV2_3395_ESMFold_hypothetical_protein	AF-A8E7I5-F1-model_v4 Tetratricopeptide repeat protein 36	0.126	161	126	227	387	35	179	6.592E-01	70
LOKIASV2_3395_ESMFold_hypothetical_protein	AF-Q5M990-F1-model_v4	LOKIASV2_3395_ESMFold_hypothetical_protein	AF-Q5M990-F1-model_v4 Tetratricopeptide repeat protein 33	0.106	174	146	226	389	14	187	1.327E+00	70
LOKIASV2_3395_ESMFold_hypothetical_protein	AF-Q6TGY8-F1-model_v4	LOKIASV2_3395_ESMFold_hypothetical_protein	AF-Q6TGY8-F1-model_v4 ER membrane protein complex subunit 2	0.111	279	216	132	375	13	291	1.937E-01	70
LOKIASV2_3395_ESMFold_hypothetical_protein	AF-Q5M7J9-F1-model_v4	LOKIASV2_3395_ESMFold_hypothetical_protein	AF-Q5M7J9-F1-model_v4 ER membrane protein complex subunit 2	0.109	279	216	133	375	13	291	1.937E-01	70
LOKIASV2_3395_ESMFold_hypothetical_protein	AF-Q9CR16-F1-model_v4	LOKIASV2_3395_ESMFold_hypothetical_protein	AF-Q9CR16-F1-model_v4 Peptidyl-prolyl cis-trans isomerase D	0.106	156	137	235	388	213	368	8.570E-01	70
LOKIASV2_3395_ESMFold_hypothetical_protein	AF-P53691-F1-model_v4	LOKIASV2_3395_ESMFold_hypothetical_protein	AF-P53691-F1-model_v4 Peptidyl-prolyl cis-trans isomerase CPR6	0.129	160	136	233	389	210	369	8.953E-01	70
LOKIASV2_3395_ESMFold_hypothetical_protein	AF-Q3ZBZ8-F1-model_v4	LOKIASV2_3395_ESMFold_hypothetical_protein	AF-Q3ZBZ8-F1-model_v4 Stress-induced-phosphoprotein 1	0.126	331	237	107	378	146	476	1.365E-01	70
LOKIASV2_3395_ESMFold_hypothetical_protein	AF-O83389-F1-model_v4	LOKIASV2_3395_ESMFold_hypothetical_protein	AF-O83389-F1-model_v4 Uncharacterized protein TP_0374	0.118	138	112	253	390	63	190	1.967E+00	70
LOKIASV2_3395_ESMFold_hypothetical_protein	AF-Q9UGR2-F1-model_v4	LOKIASV2_3395_ESMFold_hypothetical_protein	AF-Q9UGR2-F1-model_v4 Zinc finger CCCH domain-containing protein 7B	0.096	161	137	220	380	13	164	8.953E-01	70
LOKIASV2_3395_ESMFold_hypothetical_protein	AF-O15550-F1-model_v4	LOKIASV2_3395_ESMFold_hypothetical_protein	AF-O15550-F1-model_v4 Lysine-specific demethylase 6A	0.098	256	214	157	394	59	314	2.411E-01	70
LOKIASV2_3395_ESMFold_hypothetical_protein	AF-Q810A3-F1-model_v4	LOKIASV2_3395_ESMFold_hypothetical_protein	AF-Q810A3-F1-model_v4 Tetratricopeptide repeat protein 9C	0.112	163	136	233	386	2	164	1.581E+00	69
LOKIASV2_3395_ESMFold_hypothetical_protein	AF-P57663-F1-model_v4	LOKIASV2_3395_ESMFold_hypothetical_protein	AF-P57663-F1-model_v4 Ancillary SecYEG translocon subunit	0.113	195	157	184	378	14	191	5.534E-01	69
LOKIASV2_3395_ESMFold_hypothetical_protein	AF-Q1C3L9-F1-model_v4	LOKIASV2_3395_ESMFold_hypothetical_protein	AF-Q1C3L9-F1-model_v4 Lipoprotein NlpI	0.127	285	217	137	386	9	293	4.191E-02	69
LOKIASV2_3395_ESMFold_hypothetical_protein	AF-Q9LDC0-F1-model_v4	LOKIASV2_3395_ESMFold_hypothetical_protein	AF-Q9LDC0-F1-model_v4 Peptidyl-prolyl cis-trans isomerase FKBP42	0.115	149	124	249	389	179	327	1.449E+00	69
LOKIASV2_3395_ESMFold_hypothetical_protein	AF-P44942-F1-model_v4	LOKIASV2_3395_ESMFold_hypothetical_protein	AF-P44942-F1-model_v4 Formate-dependent nitrite reductase complex bifunctional subunit NrfFG	0.118	270	221	114	383	131	382	1.097E-01	69
LOKIASV2_3395_ESMFold_hypothetical_protein	AF-O35465-F1-model_v4	LOKIASV2_3395_ESMFold_hypothetical_protein	AF-O35465-F1-model_v4 Peptidyl-prolyl cis-trans isomerase FKBP8	0.117	155	134	235	389	204	356	1.066E+00	69
LOKIASV2_3395_ESMFold_hypothetical_protein	AF-Q64282-F1-model_v4	LOKIASV2_3395_ESMFold_hypothetical_protein	AF-Q64282-F1-model_v4 Interferon-induced protein with tetratricopeptide repeats 1	0.102	263	184	182	387	156	418	1.197E-01	69
LOKIASV2_3395_ESMFold_hypothetical_protein	AF-Q5R8D8-F1-model_v4	LOKIASV2_3395_ESMFold_hypothetical_protein	AF-Q5R8D8-F1-model_v4 DnaJ homolog subfamily C member 7	0.087	303	216	145	382	8	310	6.490E-02	69
LOKIASV2_3395_ESMFold_hypothetical_protein	AF-B3DNN5-F1-model_v4	LOKIASV2_3395_ESMFold_hypothetical_protein	AF-B3DNN5-F1-model_v4 Anaphase-promoting complex subunit 6	0.090	282	248	105	386	268	540	2.871E-01	69
LOKIASV2_3395_ESMFold_hypothetical_protein	AF-O35814-F1-model_v4	LOKIASV2_3395_ESMFold_hypothetical_protein	AF-O35814-F1-model_v4 Stress-induced-phosphoprotein 1	0.134	331	235	107	378	146	476	1.307E-01	69
LOKIASV2_3395_ESMFold_hypothetical_protein	AF-O94325-F1-model_v4	LOKIASV2_3395_ESMFold_hypothetical_protein	AF-O94325-F1-model_v4 Peroxisomal targeting signal receptor	0.124	346	301	28	373	215	559	5.692E-02	69
LOKIASV2_3395_ESMFold_hypothetical_protein	AF-Q5ZIW2-F1-model_v4	LOKIASV2_3395_ESMFold_hypothetical_protein	AF-Q5ZIW2-F1-model_v4 CCR4-NOT transcription complex subunit 10	0.084	253	206	158	383	20	272	2.749E-01	69
LOKIASV2_3395_ESMFold_hypothetical_protein	AF-Q6NU53-F1-model_v4	LOKIASV2_3395_ESMFold_hypothetical_protein	AF-Q6NU53-F1-model_v4 CCR4-NOT transcription complex subunit 10-B	0.091	255	205	158	383	21	275	1.426E-01	69
LOKIASV2_3395_ESMFold_hypothetical_protein	AF-Q5N829-F1-model_v4	LOKIASV2_3395_ESMFold_hypothetical_protein	AF-Q5N829-F1-model_v4 TPR repeat-containing protein ZIP4	0.089	192	154	183	374	385	554	4.257E-01	69
LOKIASV2_3395_ESMFold_hypothetical_protein	AF-Q61LA1-F1-model_v4	LOKIASV2_3395_ESMFold_hypothetical_protein	AF-Q61LA1-F1-model_v4 Tetratricopeptide repeat protein 21 homolog	0.136	284	232	120	389	743	1026	1.426E-01	69
LOKIASV2_3395_ESMFold_hypothetical_protein	AF-P48277-F1-model_v4	LOKIASV2_3395_ESMFold_hypothetical_protein	AF-P48277-F1-model_v4 Uncharacterized protein ycf37	0.094	223	141	153	375	13	169	3.733E-01	68
LOKIASV2_3395_ESMFold_hypothetical_protein	AF-B9DHG0-F1-model_v4	LOKIASV2_3395_ESMFold_hypothetical_protein	AF-B9DHG0-F1-model_v4 Tetratricopeptide repeat domain-containing protein PYG7, chloroplastic	0.122	323	248	67	389	17	299	1.557E-01	68
LOKIASV2_3395_ESMFold_hypothetical_protein	AF-O06917-F1-model_v4	LOKIASV2_3395_ESMFold_hypothetical_protein	AF-O06917-F1-model_v4 TPR repeat-containing protein MJ0263	0.134	263	194	165	389	13	275	7.731E-02	68
LOKIASV2_3395_ESMFold_hypothetical_protein	AF-P0ACB9-F1-model_v4	LOKIASV2_3395_ESMFold_hypothetical_protein	AF-P0ACB9-F1-model_v4 Protein HemY	0.094	357	265	95	388	29	385	9.209E-02	68
LOKIASV2_3395_ESMFold_hypothetical_protein	AF-Q88MS8-F1-model_v4	LOKIASV2_3395_ESMFold_hypothetical_protein	AF-Q88MS8-F1-model_v4 Probable biofilm formation methyltransferase WspC	0.111	108	84	249	356	321	415	4.138E+00	68
LOKIASV2_3395_ESMFold_hypothetical_protein	AF-Q6INU8-F1-model_v4	LOKIASV2_3395_ESMFold_hypothetical_protein	AF-Q6INU8-F1-model_v4 Tetratricopeptide repeat protein 30A	0.103	233	184	158	390	3	208	4.257E-01	68
LOKIASV2_3395_ESMFold_hypothetical_protein	AF-P81274-F1-model_v4	LOKIASV2_3395_ESMFold_hypothetical_protein	AF-P81274-F1-model_v4 G-protein-signaling modulator 2	0.124	277	201	161	390	72	348	3.573E-01	68
LOKIASV2_3395_ESMFold_hypothetical_protein	AF-O67178-F1-model_v4	LOKIASV2_3395_ESMFold_hypothetical_protein	AF-O67178-F1-model_v4 Uncharacterized protein aq_1088	0.129	250	206	154	390	94	343	3.134E-01	68
LOKIASV2_3395_ESMFold_hypothetical_protein	AF-Q9N593-F1-model_v4	LOKIASV2_3395_ESMFold_hypothetical_protein	AF-Q9N593-F1-model_v4 Cell division cycle protein 27 homolog	0.108	236	202	154	389	551	777	2.871E-01	68
LOKIASV2_3395_ESMFold_hypothetical_protein	AF-P17885-F1-model_v4	LOKIASV2_3395_ESMFold_hypothetical_protein	AF-P17885-F1-model_v4 Protein bimA	0.120	303	243	107	383	503	805	5.215E-02	68
LOKIASV2_3395_ESMFold_hypothetical_protein	AF-Q9V3X5-F1-model_v4	LOKIASV2_3395_ESMFold_hypothetical_protein	AF-Q9V3X5-F1-model_v4 Protein O-mannosyl-transferase TMTC2	0.101	228	186	183	390	621	848	4.074E-01	68
LOKIASV2_3395_ESMFold_hypothetical_protein	AF-O94906-F1-model_v4	LOKIASV2_3395_ESMFold_hypothetical_protein	AF-O94906-F1-model_v4 Pre-mRNA-processing factor 6	0.113	216	185	182	391	592	807	3.900E-01	68
LOKIASV2_3395_ESMFold_hypothetical_protein	AF-Q0HA38-F1-model_v4	LOKIASV2_3395_ESMFold_hypothetical_protein	AF-Q0HA38-F1-model_v4 Tetratricopeptide repeat protein 21B	0.137	243	186	167	383	728	970	1.626E-01	68
LOKIASV2_3395_ESMFold_hypothetical_protein	AF-Q8VBW8-F1-model_v4	LOKIASV2_3395_ESMFold_hypothetical_protein	AF-Q8VBW8-F1-model_v4 Tetratricopeptide repeat protein 36	0.095	203	154	187	389	8	178	9.772E-01	67
LOKIASV2_3395_ESMFold_hypothetical_protein	AF-Q8X5S3-F1-model_v4	LOKIASV2_3395_ESMFold_hypothetical_protein	AF-Q8X5S3-F1-model_v4 Formate-dependent nitrite reductase complex subunit NrfG	0.091	252	171	129	380	9	197	5.297E-01	67
LOKIASV2_3395_ESMFold_hypothetical_protein	AF-P32712-F1-model_v4	LOKIASV2_3395_ESMFold_hypothetical_protein	AF-P32712-F1-model_v4 Formate-dependent nitrite reductase complex subunit NrfG	0.097	269	171	110	378	6	195	3.900E-01	67
LOKIASV2_3395_ESMFold_hypothetical_protein	AF-P0AGM6-F1-model_v4	LOKIASV2_3395_ESMFold_hypothetical_protein	AF-P0AGM6-F1-model_v4 UPF0162 protein YchA	0.138	91	69	283	373	181	261	2.558E+00	67
LOKIASV2_3395_ESMFold_hypothetical_protein	AF-P0A2L9-F1-model_v4	LOKIASV2_3395_ESMFold_hypothetical_protein	AF-P0A2L9-F1-model_v4 Protein SirB1	0.148	91	68	283	373	181	261	2.344E+00	67
LOKIASV2_3395_ESMFold_hypothetical_protein	AF-P0AGM5-F1-model_v4	LOKIASV2_3395_ESMFold_hypothetical_protein	AF-P0AGM5-F1-model_v4 UPF0162 protein YchA	0.138	91	69	283	373	181	261	2.558E+00	67
LOKIASV2_3395_ESMFold_hypothetical_protein	AF-Q31W42-F1-model_v4	LOKIASV2_3395_ESMFold_hypothetical_protein	AF-Q31W42-F1-model_v4 Lipoprotein NlpI	0.139	257	194	161	386	37	293	8.815E-02	67
LOKIASV2_3395_ESMFold_hypothetical_protein	AF-O75344-F1-model_v4	LOKIASV2_3395_ESMFold_hypothetical_protein	AF-O75344-F1-model_v4 Inactive peptidyl-prolyl cis-trans isomerase FKBP6	0.120	163	136	235	389	148	310	1.114E+00	67
LOKIASV2_3395_ESMFold_hypothetical_protein	AF-P0CP80-F1-model_v4	LOKIASV2_3395_ESMFold_hypothetical_protein	AF-P0CP80-F1-model_v4 Peptidyl-prolyl cis-trans isomerase D	0.117	158	124	248	388	216	373	1.513E+00	67
LOKIASV2_3395_ESMFold_hypothetical_protein	AF-Q6P2U9-F1-model_v4	LOKIASV2_3395_ESMFold_hypothetical_protein	AF-Q6P2U9-F1-model_v4 COP9 signalosome complex subunit 3	0.114	229	185	164	373	2	230	4.646E-01	67
LOKIASV2_3395_ESMFold_hypothetical_protein	AF-Q4R5F5-F1-model_v4	LOKIASV2_3395_ESMFold_hypothetical_protein	AF-Q4R5F5-F1-model_v4 Interferon-induced protein with tetratricopeptide repeats 1	0.091	235	182	183	383	160	394	4.257E-01	67
LOKIASV2_3395_ESMFold_hypothetical_protein	AF-Q99615-F1-model_v4	LOKIASV2_3395_ESMFold_hypothetical_protein	AF-Q99615-F1-model_v4 DnaJ homolog subfamily C member 7	0.088	303	216	145	382	8	310	8.438E-02	67
LOKIASV2_3395_ESMFold_hypothetical_protein	AF-Q4R8N7-F1-model_v4	LOKIASV2_3395_ESMFold_hypothetical_protein	AF-Q4R8N7-F1-model_v4 Stress-induced-phosphoprotein 1	0.125	331	237	107	378	146	476	1.775E-01	67
LOKIASV2_3395_ESMFold_hypothetical_protein	AF-A0AVF1-F1-model_v4	LOKIASV2_3395_ESMFold_hypothetical_protein	AF-A0AVF1-F1-model_v4 Intraflagellar transport protein 56	0.106	226	200	152	377	47	271	4.257E-01	67
LOKIASV2_3395_ESMFold_hypothetical_protein	AF-Q9UJX3-F1-model_v4	LOKIASV2_3395_ESMFold_hypothetical_protein	AF-Q9UJX3-F1-model_v4 Anaphase-promoting complex subunit 7	0.085	204	182	183	382	358	561	2.411E-01	67
LOKIASV2_3395_ESMFold_hypothetical_protein	AF-Q9D4B2-F1-model_v4	LOKIASV2_3395_ESMFold_hypothetical_protein	AF-Q9D4B2-F1-model_v4 Outer dynein arm-docking complex subunit 4	0.092	388	307	1	388	161	499	1.775E-01	67
LOKIASV2_3395_ESMFold_hypothetical_protein	AF-A7YE96-F1-model_v4	LOKIASV2_3395_ESMFold_hypothetical_protein	AF-A7YE96-F1-model_v4 Tetratricopeptide repeat protein 30A	0.098	233	186	158	390	2	208	4.646E-01	67
LOKIASV2_3395_ESMFold_hypothetical_protein	AF-A8XBR9-F1-model_v4	LOKIASV2_3395_ESMFold_hypothetical_protein	AF-A8XBR9-F1-model_v4 Tetratricopeptide repeat protein 30 homolog	0.084	224	173	166	389	11	200	8.570E-01	67
LOKIASV2_3395_ESMFold_hypothetical_protein	AF-Q8S8L9-F1-model_v4	LOKIASV2_3395_ESMFold_hypothetical_protein	AF-Q8S8L9-F1-model_v4 Uncharacterized TPR repeat-containing protein At2g32450	0.102	228	198	170	390	240	467	1.937E-01	67
LOKIASV2_3395_ESMFold_hypothetical_protein	AF-P0A2M0-F1-model_v4	LOKIASV2_3395_ESMFold_hypothetical_protein	AF-P0A2M0-F1-model_v4 Protein SirB1	0.148	91	68	283	373	181	261	2.558E+00	66
LOKIASV2_3395_ESMFold_hypothetical_protein	AF-P0AFB3-F1-model_v4	LOKIASV2_3395_ESMFold_hypothetical_protein	AF-P0AFB3-F1-model_v4 Lipoprotein NlpI	0.125	255	193	166	386	39	293	8.815E-02	66
LOKIASV2_3395_ESMFold_hypothetical_protein	AF-Q7CKI5-F1-model_v4	LOKIASV2_3395_ESMFold_hypothetical_protein	AF-Q7CKI5-F1-model_v4 Lipoprotein NlpI	0.123	279	212	144	386	15	293	5.947E-02	66
LOKIASV2_3395_ESMFold_hypothetical_protein	AF-Q7ZTN8-F1-model_v4	LOKIASV2_3395_ESMFold_hypothetical_protein	AF-Q7ZTN8-F1-model_v4 COP9 signalosome complex subunit 3	0.111	229	186	164	373	2	230	4.646E-01	66
LOKIASV2_3395_ESMFold_hypothetical_protein	AF-Q64112-F1-model_v4	LOKIASV2_3395_ESMFold_hypothetical_protein	AF-Q64112-F1-model_v4 Interferon-induced protein with tetratricopeptide repeats 2	0.112	231	179	183	385	157	387	4.646E-01	66
LOKIASV2_3395_ESMFold_hypothetical_protein	AF-Q7ZU45-F1-model_v4	LOKIASV2_3395_ESMFold_hypothetical_protein	AF-Q7ZU45-F1-model_v4 Outer dynein arm-docking complex subunit 4	0.112	385	293	1	385	155	485	1.490E-01	66
LOKIASV2_3395_ESMFold_hypothetical_protein	AF-A4III8-F1-model_v4	LOKIASV2_3395_ESMFold_hypothetical_protein	AF-A4III8-F1-model_v4 Intraflagellar transport protein 56	0.108	226	200	152	377	47	271	4.646E-01	66
