query	target	qheader	theader	fident	alnlen	mismatch	qstart	qend	tstart	tend	evalue	bits
LOKIASV2_0664_ESMFold_hypothetical_protein	AF-Q1B3Q8-F1-model_v4	LOKIASV2_0664_ESMFold_hypothetical_protein	AF-Q1B3Q8-F1-model_v4 RNA polymerase sigma factor SigK	0.173	46	37	40	85	146	191	4.710E-01	84
LOKIASV2_0664_ESMFold_hypothetical_protein	AF-P0A2E9-F1-model_v4	LOKIASV2_0664_ESMFold_hypothetical_protein	AF-P0A2E9-F1-model_v4 RNA polymerase sigma factor FliA	0.212	47	36	40	86	192	238	4.405E-01	84
LOKIASV2_0664_ESMFold_hypothetical_protein	AF-A0PNM4-F1-model_v4	LOKIASV2_0664_ESMFold_hypothetical_protein	AF-A0PNM4-F1-model_v4 ECF RNA polymerase sigma factor SigK	0.173	46	37	41	86	141	186	4.405E-01	83
LOKIASV2_0664_ESMFold_hypothetical_protein	AF-P9WGH7-F1-model_v4	LOKIASV2_0664_ESMFold_hypothetical_protein	AF-P9WGH7-F1-model_v4 ECF RNA polymerase sigma factor SigK	0.173	46	37	41	86	141	186	4.710E-01	83
LOKIASV2_0664_ESMFold_hypothetical_protein	AF-P66812-F1-model_v4	LOKIASV2_0664_ESMFold_hypothetical_protein	AF-P66812-F1-model_v4 ECF RNA polymerase sigma factor SigD	0.254	51	37	37	87	158	208	5.037E-01	83
LOKIASV2_0664_ESMFold_hypothetical_protein	AF-A0A0H3CCX2-F1-model_v4	LOKIASV2_0664_ESMFold_hypothetical_protein	AF-A0A0H3CCX2-F1-model_v4 ECF RNA polymerase sigma factor SigF	0.166	48	39	40	87	130	177	4.119E-01	82
LOKIASV2_0664_ESMFold_hypothetical_protein	AF-A1KFR7-F1-model_v4	LOKIASV2_0664_ESMFold_hypothetical_protein	AF-A1KFR7-F1-model_v4 ECF RNA polymerase sigma factor SigK	0.173	46	37	41	86	141	186	5.037E-01	82
LOKIASV2_0664_ESMFold_hypothetical_protein	AF-Q6M132-F1-model_v4	LOKIASV2_0664_ESMFold_hypothetical_protein	AF-Q6M132-F1-model_v4 Putative transcriptional regulatory protein MMP0086	0.326	46	30	41	86	9	53	2.945E-01	81
LOKIASV2_0664_ESMFold_hypothetical_protein	AF-A5TZH1-F1-model_v4	LOKIASV2_0664_ESMFold_hypothetical_protein	AF-A5TZH1-F1-model_v4 ECF RNA polymerase sigma factor SigK	0.173	46	37	41	86	141	186	5.761E-01	81
LOKIASV2_0664_ESMFold_hypothetical_protein	AF-P0AGB9-F1-model_v4	LOKIASV2_0664_ESMFold_hypothetical_protein	AF-P0AGB9-F1-model_v4 ECF RNA polymerase sigma-E factor	0.235	51	36	39	86	140	190	2.252E-01	81
LOKIASV2_0664_ESMFold_hypothetical_protein	AF-P29248-F1-model_v4	LOKIASV2_0664_ESMFold_hypothetical_protein	AF-P29248-F1-model_v4 RNA polymerase sigma factor FliA	0.212	47	36	40	86	197	243	4.405E-01	81
LOKIASV2_0664_ESMFold_hypothetical_protein	AF-Q52997-F1-model_v4	LOKIASV2_0664_ESMFold_hypothetical_protein	AF-Q52997-F1-model_v4 Uncharacterized protein R00370	0.217	46	35	40	85	125	170	3.602E-01	81
LOKIASV2_0664_ESMFold_hypothetical_protein	AF-B9E1H2-F1-model_v4	LOKIASV2_0664_ESMFold_hypothetical_protein	AF-B9E1H2-F1-model_v4 UPF0122 protein CKR_1296	0.240	50	37	37	86	18	67	5.387E-01	80
LOKIASV2_0664_ESMFold_hypothetical_protein	AF-P0DG80-F1-model_v4	LOKIASV2_0664_ESMFold_hypothetical_protein	AF-P0DG80-F1-model_v4 UPF0122 protein SpyM3_0842	0.180	50	40	37	86	23	72	4.710E-01	80
LOKIASV2_0664_ESMFold_hypothetical_protein	AF-P67255-F1-model_v4	LOKIASV2_0664_ESMFold_hypothetical_protein	AF-P67255-F1-model_v4 UPF0122 protein spyM18_1152	0.180	50	40	37	86	23	72	4.710E-01	80
LOKIASV2_0664_ESMFold_hypothetical_protein	AF-Q1JBN1-F1-model_v4	LOKIASV2_0664_ESMFold_hypothetical_protein	AF-Q1JBN1-F1-model_v4 UPF0122 protein MGAS2096_Spy0975	0.180	50	40	37	86	23	72	4.710E-01	80
LOKIASV2_0664_ESMFold_hypothetical_protein	AF-Q48TF9-F1-model_v4	LOKIASV2_0664_ESMFold_hypothetical_protein	AF-Q48TF9-F1-model_v4 UPF0122 protein M28_Spy0888	0.180	50	40	37	86	23	72	4.710E-01	80
LOKIASV2_0664_ESMFold_hypothetical_protein	AF-Q1JLL4-F1-model_v4	LOKIASV2_0664_ESMFold_hypothetical_protein	AF-Q1JLL4-F1-model_v4 UPF0122 protein MGAS9429_Spy1018	0.180	50	40	37	86	23	72	4.710E-01	80
LOKIASV2_0664_ESMFold_hypothetical_protein	AF-A2RED5-F1-model_v4	LOKIASV2_0664_ESMFold_hypothetical_protein	AF-A2RED5-F1-model_v4 UPF0122 protein SpyM50882	0.180	50	40	37	86	23	72	4.710E-01	80
LOKIASV2_0664_ESMFold_hypothetical_protein	AF-Q1JGP9-F1-model_v4	LOKIASV2_0664_ESMFold_hypothetical_protein	AF-Q1JGP9-F1-model_v4 UPF0122 protein MGAS10270_Spy1030	0.180	50	40	37	86	23	72	4.710E-01	80
LOKIASV2_0664_ESMFold_hypothetical_protein	AF-Q1J6G8-F1-model_v4	LOKIASV2_0664_ESMFold_hypothetical_protein	AF-Q1J6G8-F1-model_v4 UPF0122 protein MGAS10750_Spy1065	0.180	50	40	37	86	23	72	4.710E-01	80
LOKIASV2_0664_ESMFold_hypothetical_protein	AF-Q6GFS7-F1-model_v4	LOKIASV2_0664_ESMFold_hypothetical_protein	AF-Q6GFS7-F1-model_v4 RNA polymerase sigma factor SigS	0.333	48	31	37	84	109	155	4.119E-01	80
LOKIASV2_0664_ESMFold_hypothetical_protein	AF-P23672-F1-model_v4	LOKIASV2_0664_ESMFold_hypothetical_protein	AF-P23672-F1-model_v4 Uncharacterized protein CA_P0167	0.214	42	32	41	82	140	181	5.037E-01	80
LOKIASV2_0664_ESMFold_hypothetical_protein	AF-P9WGH6-F1-model_v4	LOKIASV2_0664_ESMFold_hypothetical_protein	AF-P9WGH6-F1-model_v4 ECF RNA polymerase sigma factor SigK	0.173	46	37	41	86	141	186	5.761E-01	80
LOKIASV2_0664_ESMFold_hypothetical_protein	AF-P37978-F1-model_v4	LOKIASV2_0664_ESMFold_hypothetical_protein	AF-P37978-F1-model_v4 RNA polymerase sigma factor CnrH	0.235	51	38	37	87	138	188	5.761E-01	80
LOKIASV2_0664_ESMFold_hypothetical_protein	AF-P9WGG6-F1-model_v4	LOKIASV2_0664_ESMFold_hypothetical_protein	AF-P9WGG6-F1-model_v4 ECF RNA polymerase sigma factor SigE	0.196	51	40	37	87	193	243	5.387E-01	80
LOKIASV2_0664_ESMFold_hypothetical_protein	AF-L0TCG5-F1-model_v4	LOKIASV2_0664_ESMFold_hypothetical_protein	AF-L0TCG5-F1-model_v4 ECF RNA polymerase sigma factor SigJ	0.177	45	36	39	83	115	159	3.368E-01	80
LOKIASV2_0664_ESMFold_hypothetical_protein	AF-Q97I99-F1-model_v4	LOKIASV2_0664_ESMFold_hypothetical_protein	AF-Q97I99-F1-model_v4 UPF0122 protein CA_C1753	0.180	50	40	37	86	18	67	4.710E-01	79
LOKIASV2_0664_ESMFold_hypothetical_protein	AF-H8EVT0-F1-model_v4	LOKIASV2_0664_ESMFold_hypothetical_protein	AF-H8EVT0-F1-model_v4 ECF RNA polymerase sigma factor SigK	0.173	46	37	41	86	141	186	6.588E-01	79
LOKIASV2_0664_ESMFold_hypothetical_protein	AF-Q7U1Z6-F1-model_v4	LOKIASV2_0664_ESMFold_hypothetical_protein	AF-Q7U1Z6-F1-model_v4 ECF RNA polymerase sigma factor SigK	0.173	46	37	41	86	141	186	6.588E-01	79
LOKIASV2_0664_ESMFold_hypothetical_protein	AF-P0AGB8-F1-model_v4	LOKIASV2_0664_ESMFold_hypothetical_protein	AF-P0AGB8-F1-model_v4 ECF RNA polymerase sigma-E factor	0.235	51	36	39	86	140	190	2.754E-01	79
LOKIASV2_0664_ESMFold_hypothetical_protein	AF-Q57637-F1-model_v4	LOKIASV2_0664_ESMFold_hypothetical_protein	AF-Q57637-F1-model_v4 Putative transcriptional regulatory protein MJ0173	0.326	46	30	41	86	11	55	3.602E-01	78
LOKIASV2_0664_ESMFold_hypothetical_protein	AF-D0ZSY9-F1-model_v4	LOKIASV2_0664_ESMFold_hypothetical_protein	AF-D0ZSY9-F1-model_v4 ECF RNA polymerase sigma-E factor	0.240	50	35	40	86	141	190	2.754E-01	78
LOKIASV2_0664_ESMFold_hypothetical_protein	AF-P0AGB6-F1-model_v4	LOKIASV2_0664_ESMFold_hypothetical_protein	AF-P0AGB6-F1-model_v4 ECF RNA polymerase sigma-E factor	0.240	50	35	40	86	141	190	2.945E-01	78
LOKIASV2_0664_ESMFold_hypothetical_protein	AF-P45215-F1-model_v4	LOKIASV2_0664_ESMFold_hypothetical_protein	AF-P45215-F1-model_v4 Probable RNA polymerase sigma factor HI_1459	0.181	44	35	37	80	143	186	6.161E-01	78
LOKIASV2_0664_ESMFold_hypothetical_protein	AF-P35165-F1-model_v4	LOKIASV2_0664_ESMFold_hypothetical_protein	AF-P35165-F1-model_v4 ECF RNA polymerase sigma factor SigX	0.166	48	39	39	86	120	167	6.588E-01	78
LOKIASV2_0664_ESMFold_hypothetical_protein	AF-O05404-F1-model_v4	LOKIASV2_0664_ESMFold_hypothetical_protein	AF-O05404-F1-model_v4 RNA polymerase sigma factor SigV	0.232	43	32	39	81	115	157	9.215E-01	77
LOKIASV2_0664_ESMFold_hypothetical_protein	AF-Q06909-F1-model_v4	LOKIASV2_0664_ESMFold_hypothetical_protein	AF-Q06909-F1-model_v4 RNA polymerase sigma factor CarQ	0.270	48	34	39	86	120	167	4.405E-01	77
LOKIASV2_0664_ESMFold_hypothetical_protein	AF-O53590-F1-model_v4	LOKIASV2_0664_ESMFold_hypothetical_protein	AF-O53590-F1-model_v4 ECF RNA polymerase sigma factor SigM	0.150	53	43	37	87	138	190	3.851E-01	77
LOKIASV2_0664_ESMFold_hypothetical_protein	AF-P37078-F1-model_v4	LOKIASV2_0664_ESMFold_hypothetical_protein	AF-P37078-F1-model_v4 Sorbitol operon regulator	0.243	41	30	41	81	10	50	5.037E-01	77
LOKIASV2_0664_ESMFold_hypothetical_protein	AF-P45684-F1-model_v4	LOKIASV2_0664_ESMFold_hypothetical_protein	AF-P45684-F1-model_v4 RNA polymerase sigma factor RpoS	0.163	55	42	37	87	271	325	5.761E-01	77
LOKIASV2_0664_ESMFold_hypothetical_protein	AF-Q5M4P2-F1-model_v4	LOKIASV2_0664_ESMFold_hypothetical_protein	AF-Q5M4P2-F1-model_v4 UPF0122 protein stu0888	0.160	50	41	37	86	20	69	6.161E-01	76
LOKIASV2_0664_ESMFold_hypothetical_protein	AF-A5N811-F1-model_v4	LOKIASV2_0664_ESMFold_hypothetical_protein	AF-A5N811-F1-model_v4 UPF0122 protein CKL_1400	0.240	50	37	37	86	18	67	7.046E-01	76
LOKIASV2_0664_ESMFold_hypothetical_protein	AF-Q0TPN9-F1-model_v4	LOKIASV2_0664_ESMFold_hypothetical_protein	AF-Q0TPN9-F1-model_v4 UPF0122 protein CPF_1968	0.220	50	38	37	86	18	67	6.161E-01	76
LOKIASV2_0664_ESMFold_hypothetical_protein	AF-B4U300-F1-model_v4	LOKIASV2_0664_ESMFold_hypothetical_protein	AF-B4U300-F1-model_v4 UPF0122 protein Sez_1013	0.160	50	41	37	86	23	72	6.588E-01	76
LOKIASV2_0664_ESMFold_hypothetical_protein	AF-P39784-F1-model_v4	LOKIASV2_0664_ESMFold_hypothetical_protein	AF-P39784-F1-model_v4 Positive control factor	0.234	47	35	41	87	118	164	6.161E-01	76
LOKIASV2_0664_ESMFold_hypothetical_protein	AF-A0Q0Y5-F1-model_v4	LOKIASV2_0664_ESMFold_hypothetical_protein	AF-A0Q0Y5-F1-model_v4 UPF0122 protein NT01CX_2214	0.200	50	39	37	86	18	67	7.535E-01	75
LOKIASV2_0664_ESMFold_hypothetical_protein	AF-Q9PR02-F1-model_v4	LOKIASV2_0664_ESMFold_hypothetical_protein	AF-Q9PR02-F1-model_v4 UPF0122 protein UU142	0.224	89	60	37	125	21	98	5.144E-02	74
LOKIASV2_0664_ESMFold_hypothetical_protein	AF-B5ZAX5-F1-model_v4	LOKIASV2_0664_ESMFold_hypothetical_protein	AF-B5ZAX5-F1-model_v4 UPF0122 protein UUR10_0158	0.213	89	61	37	125	21	98	5.501E-02	74
LOKIASV2_0664_ESMFold_hypothetical_protein	AF-B1AID1-F1-model_v4	LOKIASV2_0664_ESMFold_hypothetical_protein	AF-B1AID1-F1-model_v4 UPF0122 protein UPA3_0148	0.224	89	60	37	125	21	98	5.144E-02	74
LOKIASV2_0664_ESMFold_hypothetical_protein	AF-B2IQ79-F1-model_v4	LOKIASV2_0664_ESMFold_hypothetical_protein	AF-B2IQ79-F1-model_v4 UPF0122 protein SPCG_1251	0.160	50	41	37	86	20	69	7.535E-01	74
LOKIASV2_0664_ESMFold_hypothetical_protein	AF-A7X3L7-F1-model_v4	LOKIASV2_0664_ESMFold_hypothetical_protein	AF-A7X3L7-F1-model_v4 RNA polymerase sigma factor SigS	0.312	48	32	37	84	109	155	7.046E-01	74
LOKIASV2_0664_ESMFold_hypothetical_protein	AF-P06222-F1-model_v4	LOKIASV2_0664_ESMFold_hypothetical_protein	AF-P06222-F1-model_v4 RNA polymerase sigma-E factor	0.313	51	32	41	87	188	238	3.851E-01	74
LOKIASV2_0664_ESMFold_hypothetical_protein	AF-P9WGG4-F1-model_v4	LOKIASV2_0664_ESMFold_hypothetical_protein	AF-P9WGG4-F1-model_v4 ECF RNA polymerase sigma factor SigG	0.180	97	74	37	133	189	279	2.629E-02	74
LOKIASV2_0664_ESMFold_hypothetical_protein	AF-O05290-F1-model_v4	LOKIASV2_0664_ESMFold_hypothetical_protein	AF-O05290-F1-model_v4 Probable UPF0122 protein	0.260	50	36	37	86	25	74	7.535E-01	73
LOKIASV2_0664_ESMFold_hypothetical_protein	AF-P67253-F1-model_v4	LOKIASV2_0664_ESMFold_hypothetical_protein	AF-P67253-F1-model_v4 UPF0122 protein SPy_1201/M5005_Spy0916	0.180	50	40	37	86	23	72	8.617E-01	73
LOKIASV2_0664_ESMFold_hypothetical_protein	AF-P0DG81-F1-model_v4	LOKIASV2_0664_ESMFold_hypothetical_protein	AF-P0DG81-F1-model_v4 UPF0122 protein SPs1042	0.180	50	40	37	86	23	72	8.617E-01	73
LOKIASV2_0664_ESMFold_hypothetical_protein	AF-A6U2P0-F1-model_v4	LOKIASV2_0664_ESMFold_hypothetical_protein	AF-A6U2P0-F1-model_v4 RNA polymerase sigma factor SigS	0.312	48	32	37	84	109	155	7.046E-01	73
LOKIASV2_0664_ESMFold_hypothetical_protein	AF-Q2YTL0-F1-model_v4	LOKIASV2_0664_ESMFold_hypothetical_protein	AF-Q2YTL0-F1-model_v4 RNA polymerase sigma factor SigS	0.312	48	32	37	84	109	155	7.535E-01	73
LOKIASV2_0664_ESMFold_hypothetical_protein	AF-Q2FXF2-F1-model_v4	LOKIASV2_0664_ESMFold_hypothetical_protein	AF-Q2FXF2-F1-model_v4 RNA polymerase sigma factor SigS	0.311	45	30	40	84	112	155	6.588E-01	73
LOKIASV2_0664_ESMFold_hypothetical_protein	AF-P0ACZ6-F1-model_v4	LOKIASV2_0664_ESMFold_hypothetical_protein	AF-P0ACZ6-F1-model_v4 DNA-binding transcriptional activator EvgA	0.333	42	27	40	81	147	187	8.617E-01	73
LOKIASV2_0664_ESMFold_hypothetical_protein	AF-P33657-F1-model_v4	LOKIASV2_0664_ESMFold_hypothetical_protein	AF-P33657-F1-model_v4 RNA polymerase sigma-E factor	0.288	52	33	41	88	184	235	3.851E-01	73
LOKIASV2_0664_ESMFold_hypothetical_protein	AF-Q04K36-F1-model_v4	LOKIASV2_0664_ESMFold_hypothetical_protein	AF-Q04K36-F1-model_v4 UPF0122 protein SPD_1143	0.160	50	41	37	86	20	69	8.617E-01	72
LOKIASV2_0664_ESMFold_hypothetical_protein	AF-B1ICA2-F1-model_v4	LOKIASV2_0664_ESMFold_hypothetical_protein	AF-B1ICA2-F1-model_v4 UPF0122 protein SPH_1429	0.160	50	41	37	86	20	69	8.617E-01	72
LOKIASV2_0664_ESMFold_hypothetical_protein	AF-Q5XC23-F1-model_v4	LOKIASV2_0664_ESMFold_hypothetical_protein	AF-Q5XC23-F1-model_v4 UPF0122 protein M6_Spy0905	0.180	50	40	37	86	23	72	8.617E-01	72
LOKIASV2_0664_ESMFold_hypothetical_protein	AF-P52621-F1-model_v4	LOKIASV2_0664_ESMFold_hypothetical_protein	AF-P52621-F1-model_v4 RNA polymerase sigma factor FliA	0.208	48	37	40	87	182	229	9.855E-01	72
LOKIASV2_0664_ESMFold_hypothetical_protein	AF-Q9HPU8-F1-model_v4	LOKIASV2_0664_ESMFold_hypothetical_protein	AF-Q9HPU8-F1-model_v4 Bacterioopsin transcriptional activator	0.259	54	34	40	86	620	673	3.368E-01	72
LOKIASV2_0664_ESMFold_hypothetical_protein	AF-P67251-F1-model_v4	LOKIASV2_0664_ESMFold_hypothetical_protein	AF-P67251-F1-model_v4 UPF0122 protein gbs1018	0.160	50	41	37	86	20	69	9.855E-01	71
LOKIASV2_0664_ESMFold_hypothetical_protein	AF-Q97QD1-F1-model_v4	LOKIASV2_0664_ESMFold_hypothetical_protein	AF-Q97QD1-F1-model_v4 UPF0122 protein SP_1288	0.160	50	41	37	86	20	69	9.855E-01	71
LOKIASV2_0664_ESMFold_hypothetical_protein	AF-C1C7R8-F1-model_v4	LOKIASV2_0664_ESMFold_hypothetical_protein	AF-C1C7R8-F1-model_v4 UPF0122 protein SP70585_1353	0.160	50	41	37	86	20	69	9.855E-01	71
LOKIASV2_0664_ESMFold_hypothetical_protein	AF-A8AXA1-F1-model_v4	LOKIASV2_0664_ESMFold_hypothetical_protein	AF-A8AXA1-F1-model_v4 UPF0122 protein SGO_1122	0.160	50	41	37	86	20	69	9.855E-01	71
LOKIASV2_0664_ESMFold_hypothetical_protein	AF-Q5M027-F1-model_v4	LOKIASV2_0664_ESMFold_hypothetical_protein	AF-Q5M027-F1-model_v4 UPF0122 protein str0888	0.160	50	41	37	86	20	69	9.855E-01	71
LOKIASV2_0664_ESMFold_hypothetical_protein	AF-C1CL23-F1-model_v4	LOKIASV2_0664_ESMFold_hypothetical_protein	AF-C1CL23-F1-model_v4 UPF0122 protein SPP_1327	0.160	50	41	37	86	20	69	9.855E-01	71
LOKIASV2_0664_ESMFold_hypothetical_protein	AF-Q834F4-F1-model_v4	LOKIASV2_0664_ESMFold_hypothetical_protein	AF-Q834F4-F1-model_v4 UPF0122 protein EF_1701	0.160	50	41	37	86	20	69	9.855E-01	71
LOKIASV2_0664_ESMFold_hypothetical_protein	AF-Q8XJP2-F1-model_v4	LOKIASV2_0664_ESMFold_hypothetical_protein	AF-Q8XJP2-F1-model_v4 UPF0122 protein CPE1714	0.220	50	38	37	86	18	67	9.215E-01	71
LOKIASV2_0664_ESMFold_hypothetical_protein	AF-Q2NEZ5-F1-model_v4	LOKIASV2_0664_ESMFold_hypothetical_protein	AF-Q2NEZ5-F1-model_v4 Hydrogenase maturation factor HypA	0.250	43	32	132	174	70	112	1.610E-01	71
LOKIASV2_0664_ESMFold_hypothetical_protein	AF-Q2FFW3-F1-model_v4	LOKIASV2_0664_ESMFold_hypothetical_protein	AF-Q2FFW3-F1-model_v4 RNA polymerase sigma factor SigS	0.312	48	32	37	84	109	155	8.617E-01	71
LOKIASV2_0664_ESMFold_hypothetical_protein	AF-Q6G8F3-F1-model_v4	LOKIASV2_0664_ESMFold_hypothetical_protein	AF-Q6G8F3-F1-model_v4 RNA polymerase sigma factor SigS	0.312	48	32	37	84	109	155	8.617E-01	71
LOKIASV2_0664_ESMFold_hypothetical_protein	AF-Q99T92-F1-model_v4	LOKIASV2_0664_ESMFold_hypothetical_protein	AF-Q99T92-F1-model_v4 RNA polymerase sigma factor SigS	0.312	48	32	37	84	109	155	8.617E-01	71
LOKIASV2_0664_ESMFold_hypothetical_protein	AF-Q7A505-F1-model_v4	LOKIASV2_0664_ESMFold_hypothetical_protein	AF-Q7A505-F1-model_v4 RNA polymerase sigma factor SigS	0.312	48	32	37	84	109	155	8.617E-01	71
LOKIASV2_0664_ESMFold_hypothetical_protein	AF-P66808-F1-model_v4	LOKIASV2_0664_ESMFold_hypothetical_protein	AF-P66808-F1-model_v4 ECF RNA polymerase sigma factor SigH	0.187	48	38	40	87	151	198	8.617E-01	71
LOKIASV2_0664_ESMFold_hypothetical_protein	AF-C1CEP3-F1-model_v4	LOKIASV2_0664_ESMFold_hypothetical_protein	AF-C1CEP3-F1-model_v4 UPF0122 protein SPJ_1203	0.160	50	41	37	86	20	69	1.054E+00	70
LOKIASV2_0664_ESMFold_hypothetical_protein	AF-P67252-F1-model_v4	LOKIASV2_0664_ESMFold_hypothetical_protein	AF-P67252-F1-model_v4 UPF0122 protein SAG0983	0.160	50	41	37	86	20	69	1.127E+00	70
LOKIASV2_0664_ESMFold_hypothetical_protein	AF-A7Z4L7-F1-model_v4	LOKIASV2_0664_ESMFold_hypothetical_protein	AF-A7Z4L7-F1-model_v4 UPF0122 protein RBAM_015800	0.160	50	41	37	86	20	69	1.054E+00	70
LOKIASV2_0664_ESMFold_hypothetical_protein	AF-C1CR18-F1-model_v4	LOKIASV2_0664_ESMFold_hypothetical_protein	AF-C1CR18-F1-model_v4 UPF0122 protein SPT_0939	0.160	50	41	37	86	20	69	1.054E+00	70
LOKIASV2_0664_ESMFold_hypothetical_protein	AF-A4VUQ2-F1-model_v4	LOKIASV2_0664_ESMFold_hypothetical_protein	AF-A4VUQ2-F1-model_v4 UPF0122 protein SSU05_0875	0.160	50	41	37	86	23	72	1.054E+00	70
LOKIASV2_0664_ESMFold_hypothetical_protein	AF-B5XLN6-F1-model_v4	LOKIASV2_0664_ESMFold_hypothetical_protein	AF-B5XLN6-F1-model_v4 UPF0122 protein Spy49_0946c	0.180	50	40	37	86	23	72	1.054E+00	70
LOKIASV2_0664_ESMFold_hypothetical_protein	AF-Q5V5E2-F1-model_v4	LOKIASV2_0664_ESMFold_hypothetical_protein	AF-Q5V5E2-F1-model_v4 Putative transcriptional regulatory protein rrnAC0199	0.253	63	42	25	87	16	72	4.119E-01	70
LOKIASV2_0664_ESMFold_hypothetical_protein	AF-P62177-F1-model_v4	LOKIASV2_0664_ESMFold_hypothetical_protein	AF-P62177-F1-model_v4 RNA polymerase sigma-35 factor	0.294	51	32	41	87	188	238	5.387E-01	70
LOKIASV2_0664_ESMFold_hypothetical_protein	AF-Q03474-F1-model_v4	LOKIASV2_0664_ESMFold_hypothetical_protein	AF-Q03474-F1-model_v4 RNA polymerase sigma factor for flagellar operon	0.163	49	40	37	85	193	241	1.205E+00	70
LOKIASV2_0664_ESMFold_hypothetical_protein	AF-A0R2D4-F1-model_v4	LOKIASV2_0664_ESMFold_hypothetical_protein	AF-A0R2D4-F1-model_v4 ECF RNA polymerase sigma factor SigE	0.218	55	39	37	87	199	253	5.037E-01	70
LOKIASV2_0664_ESMFold_hypothetical_protein	AF-P9WGG5-F1-model_v4	LOKIASV2_0664_ESMFold_hypothetical_protein	AF-P9WGG5-F1-model_v4 ECF RNA polymerase sigma factor SigG	0.196	97	72	37	133	189	279	2.629E-02	70
LOKIASV2_0664_ESMFold_hypothetical_protein	AF-Q6B0B8-F1-model_v4	LOKIASV2_0664_ESMFold_hypothetical_protein	AF-Q6B0B8-F1-model_v4 Tigger transposable element-derived protein 3	0.317	62	42	26	87	1	62	6.728E-02	70
LOKIASV2_0664_ESMFold_hypothetical_protein	AF-B2TJ26-F1-model_v4	LOKIASV2_0664_ESMFold_hypothetical_protein	AF-B2TJ26-F1-model_v4 UPF0122 protein CLL_A1244	0.180	50	40	37	86	18	67	1.127E+00	69
LOKIASV2_0664_ESMFold_hypothetical_protein	AF-A8FD61-F1-model_v4	LOKIASV2_0664_ESMFold_hypothetical_protein	AF-A8FD61-F1-model_v4 UPF0122 protein BPUM_1495	0.200	50	39	37	86	20	69	1.127E+00	69
LOKIASV2_0664_ESMFold_hypothetical_protein	AF-A4W0Z7-F1-model_v4	LOKIASV2_0664_ESMFold_hypothetical_protein	AF-A4W0Z7-F1-model_v4 UPF0122 protein SSU98_0878	0.160	50	41	37	86	23	72	1.205E+00	69
LOKIASV2_0664_ESMFold_hypothetical_protein	AF-A4J671-F1-model_v4	LOKIASV2_0664_ESMFold_hypothetical_protein	AF-A4J671-F1-model_v4 UPF0122 protein Dred_2057	0.173	46	37	41	86	22	67	1.127E+00	69
LOKIASV2_0664_ESMFold_hypothetical_protein	AF-B0K9W9-F1-model_v4	LOKIASV2_0664_ESMFold_hypothetical_protein	AF-B0K9W9-F1-model_v4 UPF0122 protein Teth39_1278	0.180	50	40	37	86	19	68	1.378E+00	69
LOKIASV2_0664_ESMFold_hypothetical_protein	AF-A8Z4K2-F1-model_v4	LOKIASV2_0664_ESMFold_hypothetical_protein	AF-A8Z4K2-F1-model_v4 RNA polymerase sigma factor SigS	0.312	48	32	37	84	109	155	9.855E-01	69
LOKIASV2_0664_ESMFold_hypothetical_protein	AF-Q8NW08-F1-model_v4	LOKIASV2_0664_ESMFold_hypothetical_protein	AF-Q8NW08-F1-model_v4 RNA polymerase sigma factor SigS	0.312	48	32	37	84	109	155	9.855E-01	69
LOKIASV2_0664_ESMFold_hypothetical_protein	AF-A0QTP2-F1-model_v4	LOKIASV2_0664_ESMFold_hypothetical_protein	AF-A0QTP2-F1-model_v4 ECF RNA polymerase sigma factor SigH	0.207	53	37	40	87	148	200	4.710E-01	69
LOKIASV2_0664_ESMFold_hypothetical_protein	AF-P52667-F1-model_v4	LOKIASV2_0664_ESMFold_hypothetical_protein	AF-P52667-F1-model_v4 HTH-type transcriptional regulator EstR	0.261	42	30	40	81	8	48	7.535E-01	69
LOKIASV2_0664_ESMFold_hypothetical_protein	AF-C0M9C0-F1-model_v4	LOKIASV2_0664_ESMFold_hypothetical_protein	AF-C0M9C0-F1-model_v4 UPF0122 protein SEQ_1180	0.160	50	41	37	86	20	69	1.205E+00	68
LOKIASV2_0664_ESMFold_hypothetical_protein	AF-B8ZJV2-F1-model_v4	LOKIASV2_0664_ESMFold_hypothetical_protein	AF-B8ZJV2-F1-model_v4 UPF0122 protein SPN23F11830	0.160	50	41	37	86	20	69	1.205E+00	68
LOKIASV2_0664_ESMFold_hypothetical_protein	AF-Q8DPH0-F1-model_v4	LOKIASV2_0664_ESMFold_hypothetical_protein	AF-Q8DPH0-F1-model_v4 UPF0122 protein spr1167	0.160	50	41	37	86	20	69	1.205E+00	68
LOKIASV2_0664_ESMFold_hypothetical_protein	AF-O34843-F1-model_v4	LOKIASV2_0664_ESMFold_hypothetical_protein	AF-O34843-F1-model_v4 RNA polymerase sigma factor SigO	0.215	51	39	37	87	121	171	1.289E+00	68
LOKIASV2_0664_ESMFold_hypothetical_protein	AF-B1LC08-F1-model_v4	LOKIASV2_0664_ESMFold_hypothetical_protein	AF-B1LC08-F1-model_v4 Chromosomal replication initiator protein DnaA	0.181	44	35	39	82	374	417	1.289E+00	68
LOKIASV2_0664_ESMFold_hypothetical_protein	AF-B2V4E0-F1-model_v4	LOKIASV2_0664_ESMFold_hypothetical_protein	AF-B2V4E0-F1-model_v4 UPF0122 protein CLH_1195	0.180	50	40	37	86	18	67	1.289E+00	67
LOKIASV2_0664_ESMFold_hypothetical_protein	AF-O54452-F1-model_v4	LOKIASV2_0664_ESMFold_hypothetical_protein	AF-O54452-F1-model_v4 Transcriptional activator protein RaiR	0.187	48	37	40	87	187	233	1.127E+00	67
LOKIASV2_0664_ESMFold_hypothetical_protein	AF-Q31ME3-F1-model_v4	LOKIASV2_0664_ESMFold_hypothetical_protein	AF-Q31ME3-F1-model_v4 RNA polymerase sigma factor SigA2	0.160	56	42	37	87	260	315	7.046E-01	67
LOKIASV2_0664_ESMFold_hypothetical_protein	AF-P46798-F1-model_v4	LOKIASV2_0664_ESMFold_hypothetical_protein	AF-P46798-F1-model_v4 Chromosomal replication initiator protein DnaA	0.181	44	35	39	82	374	417	1.378E+00	67
LOKIASV2_0664_ESMFold_hypothetical_protein	AF-A2RK52-F1-model_v4	LOKIASV2_0664_ESMFold_hypothetical_protein	AF-A2RK52-F1-model_v4 UPF0122 protein llmg_1069	0.220	50	37	37	86	20	68	8.058E-01	66
LOKIASV2_0664_ESMFold_hypothetical_protein	AF-Q0SSA6-F1-model_v4	LOKIASV2_0664_ESMFold_hypothetical_protein	AF-Q0SSA6-F1-model_v4 UPF0122 protein CPR_1686	0.220	50	38	37	86	18	67	1.378E+00	66
LOKIASV2_0664_ESMFold_hypothetical_protein	AF-P9WGH9-F1-model_v4	LOKIASV2_0664_ESMFold_hypothetical_protein	AF-P9WGH9-F1-model_v4 ECF RNA polymerase sigma factor SigH	0.246	65	44	37	96	148	212	2.945E-01	66
LOKIASV2_0664_ESMFold_hypothetical_protein	AF-P02964-F1-model_v4	LOKIASV2_0664_ESMFold_hypothetical_protein	AF-P02964-F1-model_v4 RNA polymerase sigma-H factor	0.166	48	38	40	87	173	219	1.205E+00	66
LOKIASV2_0664_ESMFold_hypothetical_protein	AF-P62180-F1-model_v4	LOKIASV2_0664_ESMFold_hypothetical_protein	AF-P62180-F1-model_v4 RNA polymerase sigma-28 factor	0.313	51	32	41	87	179	229	9.215E-01	66
LOKIASV2_0664_ESMFold_hypothetical_protein	AF-A5IIK7-F1-model_v4	LOKIASV2_0664_ESMFold_hypothetical_protein	AF-A5IIK7-F1-model_v4 Chromosomal replication initiator protein DnaA	0.181	44	35	39	82	374	417	1.474E+00	66
LOKIASV2_0664_ESMFold_hypothetical_protein	AF-B1II81-F1-model_v4	LOKIASV2_0664_ESMFold_hypothetical_protein	AF-B1II81-F1-model_v4 UPF0122 protein CLD_2190	0.180	50	40	37	86	18	67	1.686E+00	65
LOKIASV2_0664_ESMFold_hypothetical_protein	AF-B7HLH9-F1-model_v4	LOKIASV2_0664_ESMFold_hypothetical_protein	AF-B7HLH9-F1-model_v4 UPF0122 protein BCAH187_A3894	0.180	50	40	37	86	19	68	1.576E+00	65
LOKIASV2_0664_ESMFold_hypothetical_protein	AF-Q03KY3-F1-model_v4	LOKIASV2_0664_ESMFold_hypothetical_protein	AF-Q03KY3-F1-model_v4 UPF0122 protein STER_0914	0.160	50	41	37	86	20	69	1.576E+00	65
LOKIASV2_0664_ESMFold_hypothetical_protein	AF-A7FW14-F1-model_v4	LOKIASV2_0664_ESMFold_hypothetical_protein	AF-A7FW14-F1-model_v4 UPF0122 protein CLB_2314	0.180	50	40	37	86	18	67	1.686E+00	65
LOKIASV2_0664_ESMFold_hypothetical_protein	AF-P0ACZ7-F1-model_v4	LOKIASV2_0664_ESMFold_hypothetical_protein	AF-P0ACZ7-F1-model_v4 DNA-binding transcriptional activator EvgA	0.250	59	38	39	89	146	204	4.119E-01	65
LOKIASV2_0664_ESMFold_hypothetical_protein	AF-H8F0N6-F1-model_v4	LOKIASV2_0664_ESMFold_hypothetical_protein	AF-H8F0N6-F1-model_v4 ECF RNA polymerase sigma factor SigE	0.205	68	47	37	104	193	252	5.761E-01	65
LOKIASV2_0664_ESMFold_hypothetical_protein	AF-P44192-F1-model_v4	LOKIASV2_0664_ESMFold_hypothetical_protein	AF-P44192-F1-model_v4 Uncharacterized protein HI_1421	0.156	51	41	40	89	37	87	9.215E-01	64
LOKIASV2_0664_ESMFold_hypothetical_protein	AF-P69410-F1-model_v4	LOKIASV2_0664_ESMFold_hypothetical_protein	AF-P69410-F1-model_v4 Transcriptional regulatory protein RcsB	0.380	42	25	40	81	154	194	1.576E+00	64
LOKIASV2_0664_ESMFold_hypothetical_protein	AF-Q7AKG9-F1-model_v4	LOKIASV2_0664_ESMFold_hypothetical_protein	AF-Q7AKG9-F1-model_v4 ECF RNA polymerase sigma factor SigR	0.208	65	48	40	101	158	222	2.252E-01	64
LOKIASV2_0664_ESMFold_hypothetical_protein	AF-P9WGG7-F1-model_v4	LOKIASV2_0664_ESMFold_hypothetical_protein	AF-P9WGG7-F1-model_v4 ECF RNA polymerase sigma factor SigE	0.205	68	47	37	104	193	252	6.588E-01	64
LOKIASV2_0664_ESMFold_hypothetical_protein	AF-Q8N1F8-F1-model_v4	LOKIASV2_0664_ESMFold_hypothetical_protein	AF-Q8N1F8-F1-model_v4 Serine/threonine-protein kinase 11-interacting protein	0.232	72	46	116	176	654	725	6.728E-02	64
LOKIASV2_0664_ESMFold_hypothetical_protein	AF-O27001-F1-model_v4	LOKIASV2_0664_ESMFold_hypothetical_protein	AF-O27001-F1-model_v4 DNA-binding protein Tfx	0.195	46	35	41	86	11	55	1.576E+00	63
