query	target	qheader	theader	fident	alnlen	mismatch	qstart	qend	tstart	tend	evalue	bits
LOKIASV2_1509_ESMFold_hypothetical_protein	AF-Q9VP65-F1-model_v4	LOKIASV2_1509_ESMFold_hypothetical_protein	AF-Q9VP65-F1-model_v4 Multifunctional methyltransferase subunit TRM112-like protein	0.141	218	103	1	218	1	121	1.719E-02	77
LOKIASV2_1509_ESMFold_hypothetical_protein	AF-O45241-F1-model_v4	LOKIASV2_1509_ESMFold_hypothetical_protein	AF-O45241-F1-model_v4 Multifunctional methyltransferase subunit TRM112-like protein	0.128	221	108	1	221	1	125	1.197E-02	73
LOKIASV2_1509_ESMFold_hypothetical_protein	AF-Q09723-F1-model_v4	LOKIASV2_1509_ESMFold_hypothetical_protein	AF-Q09723-F1-model_v4 Multifunctional methyltransferase subunit trm112	0.181	218	100	1	218	1	123	8.328E-03	71
LOKIASV2_1509_ESMFold_hypothetical_protein	AF-Q9C9R3-F1-model_v4	LOKIASV2_1509_ESMFold_hypothetical_protein	AF-Q9C9R3-F1-model_v4 Multifunctional methyltransferase subunit TRM112 homolog B	0.144	218	103	1	218	1	121	3.145E-02	64
LOKIASV2_1509_ESMFold_hypothetical_protein	AF-Q8LFJ5-F1-model_v4	LOKIASV2_1509_ESMFold_hypothetical_protein	AF-Q8LFJ5-F1-model_v4 Multifunctional methyltransferase subunit TRM112 homolog A	0.238	60	43	159	218	64	121	5.415E-02	59
LOKIASV2_1509_ESMFold_hypothetical_protein	AF-Q9UI30-F1-model_v4	LOKIASV2_1509_ESMFold_hypothetical_protein	AF-Q9UI30-F1-model_v4 Multifunctional methyltransferase subunit TRM112-like protein	0.380	42	24	180	218	79	120	2.765E-01	58
LOKIASV2_1509_ESMFold_hypothetical_protein	AF-Q2KIA2-F1-model_v4	LOKIASV2_1509_ESMFold_hypothetical_protein	AF-Q2KIA2-F1-model_v4 Multifunctional methyltransferase subunit TRM112-like protein	0.358	53	31	173	221	72	124	1.423E-01	54
LOKIASV2_1509_ESMFold_hypothetical_protein	AF-Q8X0S4-F1-model_v4	LOKIASV2_1509_ESMFold_hypothetical_protein	AF-Q8X0S4-F1-model_v4 Multifunctional methyltransferase subunit trm112	0.186	86	67	138	220	42	127	1.512E-01	43
LOKIASV2_1509_ESMFold_hypothetical_protein	AF-Q54N57-F1-model_v4	LOKIASV2_1509_ESMFold_hypothetical_protein	AF-Q54N57-F1-model_v4 Multifunctional methyltransferase subunit TRM112-like protein	0.211	117	69	113	229	40	127	6.895E-02	40
LOKIASV2_1509_ESMFold_hypothetical_protein	AF-B5EC43-F1-model_v4	LOKIASV2_1509_ESMFold_hypothetical_protein	AF-B5EC43-F1-model_v4 Protein GrpE	0.166	144	93	42	185	15	126	3.289E+00	27
LOKIASV2_1509_ESMFold_hypothetical_protein	AF-C6E644-F1-model_v4	LOKIASV2_1509_ESMFold_hypothetical_protein	AF-C6E644-F1-model_v4 Protein GrpE	0.159	144	93	42	185	15	126	3.943E+00	26
LOKIASV2_1509_ESMFold_hypothetical_protein	AF-O44568-F1-model_v4	LOKIASV2_1509_ESMFold_hypothetical_protein	AF-O44568-F1-model_v4 Probable peptide chain release factor 1, mitochondrial	0.149	126	99	61	186	3	119	9.754E+00	24
LOKIASV2_1509_ESMFold_hypothetical_protein	AF-P9WLK7-F1-model_v4	LOKIASV2_1509_ESMFold_hypothetical_protein	AF-P9WLK7-F1-model_v4 Uncharacterized protein Rv2079	0.086	127	110	61	187	50	170	9.754E+00	24
LOKIASV2_1509_ESMFold_hypothetical_protein	AF-Q6F6N4-F1-model_v4	LOKIASV2_1509_ESMFold_hypothetical_protein	AF-Q6F6N4-F1-model_v4 Protein GrpE	0.155	110	90	76	185	23	130	6.789E+00	23
LOKIASV2_1509_ESMFold_hypothetical_protein	AF-Q8RB69-F1-model_v4	LOKIASV2_1509_ESMFold_hypothetical_protein	AF-Q8RB69-F1-model_v4 Protein GrpE	0.159	162	108	25	186	20	148	2.029E+00	23
LOKIASV2_1509_ESMFold_hypothetical_protein	AF-A4VZB4-F1-model_v4	LOKIASV2_1509_ESMFold_hypothetical_protein	AF-A4VZB4-F1-model_v4 Protein GrpE	0.135	109	85	76	184	15	113	9.754E+00	22
LOKIASV2_1509_ESMFold_hypothetical_protein	AF-Q9UST6-F1-model_v4	LOKIASV2_1509_ESMFold_hypothetical_protein	AF-Q9UST6-F1-model_v4 Kinetochore protein spc24	0.144	186	152	50	235	16	194	2.744E+00	20
LOKIASV2_1509_ESMFold_hypothetical_protein	AF-P63189-F1-model_v4	LOKIASV2_1509_ESMFold_hypothetical_protein	AF-P63189-F1-model_v4 Protein GrpE	0.141	149	123	43	186	1	149	5.020E+00	20
LOKIASV2_1509_ESMFold_hypothetical_protein	AF-B2V8C9-F1-model_v4	LOKIASV2_1509_ESMFold_hypothetical_protein	AF-B2V8C9-F1-model_v4 Protein GrpE	0.140	161	120	25	185	7	147	6.017E+00	20
LOKIASV2_1509_ESMFold_hypothetical_protein	AF-Q9USP9-F1-model_v4	LOKIASV2_1509_ESMFold_hypothetical_protein	AF-Q9USP9-F1-model_v4 Uncharacterized RNA-binding protein C902.04	0.129	161	107	25	185	310	433	6.789E+00	20
LOKIASV2_1509_ESMFold_hypothetical_protein	AF-Q7TN12-F1-model_v4	LOKIASV2_1509_ESMFold_hypothetical_protein	AF-Q7TN12-F1-model_v4 Innate immunity activator protein	0.134	145	124	42	186	93	236	4.726E+00	20
LOKIASV2_1509_ESMFold_hypothetical_protein	AF-O06941-F1-model_v4	LOKIASV2_1509_ESMFold_hypothetical_protein	AF-O06941-F1-model_v4 Protein GrpE	0.124	143	103	42	184	4	122	8.645E+00	19
LOKIASV2_1509_ESMFold_hypothetical_protein	AF-B5XG19-F1-model_v4	LOKIASV2_1509_ESMFold_hypothetical_protein	AF-B5XG19-F1-model_v4 Partner of Y14 and mago B	0.149	165	138	25	189	30	192	6.392E+00	19
LOKIASV2_1509_ESMFold_hypothetical_protein	AF-Q9UTD7-F1-model_v4	LOKIASV2_1509_ESMFold_hypothetical_protein	AF-Q9UTD7-F1-model_v4 Ribosomal RNA-processing protein 15	0.159	161	130	25	185	1	156	2.744E+00	19
LOKIASV2_1509_ESMFold_hypothetical_protein	AF-Q92PF5-F1-model_v4	LOKIASV2_1509_ESMFold_hypothetical_protein	AF-Q92PF5-F1-model_v4 UPF0283 membrane protein R01807	0.112	129	103	25	153	14	130	3.494E+00	19
LOKIASV2_1509_ESMFold_hypothetical_protein	AF-Q0AIY2-F1-model_v4	LOKIASV2_1509_ESMFold_hypothetical_protein	AF-Q0AIY2-F1-model_v4 Protein GrpE	0.129	144	114	42	185	4	135	5.664E+00	18
LOKIASV2_1509_ESMFold_hypothetical_protein	AF-A9N8H5-F1-model_v4	LOKIASV2_1509_ESMFold_hypothetical_protein	AF-A9N8H5-F1-model_v4 Protein GrpE	0.133	142	121	46	185	1	142	7.212E+00	18
LOKIASV2_1509_ESMFold_hypothetical_protein	AF-G2K449-F1-model_v4	LOKIASV2_1509_ESMFold_hypothetical_protein	AF-G2K449-F1-model_v4 Motility gene repressor MogR	0.122	160	135	25	184	141	295	5.020E+00	18
LOKIASV2_1509_ESMFold_hypothetical_protein	AF-P45819-F1-model_v4	LOKIASV2_1509_ESMFold_hypothetical_protein	AF-P45819-F1-model_v4 Sporulation-specific protein 74	0.131	158	125	42	186	82	239	8.645E+00	18
LOKIASV2_1509_ESMFold_hypothetical_protein	AF-Q7ZY11-F1-model_v4	LOKIASV2_1509_ESMFold_hypothetical_protein	AF-Q7ZY11-F1-model_v4 Eukaryotic translation initiation factor 2A	0.107	163	126	27	189	441	582	6.789E+00	18
LOKIASV2_1509_ESMFold_hypothetical_protein	AF-P0DPF3-F1-model_v4	LOKIASV2_1509_ESMFold_hypothetical_protein	AF-P0DPF3-F1-model_v4 Neuroblastoma breakpoint family member 9	0.140	188	142	25	190	249	436	2.583E+00	18
LOKIASV2_1509_ESMFold_hypothetical_protein	AF-Q9CGY9-F1-model_v4	LOKIASV2_1509_ESMFold_hypothetical_protein	AF-Q9CGY9-F1-model_v4 Protein GrpE	0.099	143	108	42	184	2	122	9.754E+00	17
LOKIASV2_1509_ESMFold_hypothetical_protein	AF-A3MNA1-F1-model_v4	LOKIASV2_1509_ESMFold_hypothetical_protein	AF-A3MNA1-F1-model_v4 Protein GrpE	0.138	144	103	42	185	7	126	9.754E+00	17
LOKIASV2_1509_ESMFold_hypothetical_protein	AF-Q5RDL6-F1-model_v4	LOKIASV2_1509_ESMFold_hypothetical_protein	AF-Q5RDL6-F1-model_v4 EP300-interacting inhibitor of differentiation 1	0.215	100	72	24	123	94	186	9.183E+00	17
LOKIASV2_1509_ESMFold_hypothetical_protein	AF-B2UBP7-F1-model_v4	LOKIASV2_1509_ESMFold_hypothetical_protein	AF-B2UBP7-F1-model_v4 Protein GrpE	0.125	148	125	42	185	9	156	8.645E+00	17
LOKIASV2_1509_ESMFold_hypothetical_protein	AF-Q8UFP1-F1-model_v4	LOKIASV2_1509_ESMFold_hypothetical_protein	AF-Q8UFP1-F1-model_v4 UPF0283 membrane protein Atu1356	0.140	135	101	24	158	17	135	8.138E+00	17
LOKIASV2_1509_ESMFold_hypothetical_protein	AF-Q7ZYH1-F1-model_v4	LOKIASV2_1509_ESMFold_hypothetical_protein	AF-Q7ZYH1-F1-model_v4 Target of rapamycin complex 2 subunit MAPKAP1	0.164	94	74	25	114	55	148	6.789E+00	17
LOKIASV2_1509_ESMFold_hypothetical_protein	AF-Q9P6P2-F1-model_v4	LOKIASV2_1509_ESMFold_hypothetical_protein	AF-Q9P6P2-F1-model_v4 rRNA biogenesis protein rrp36	0.121	181	138	28	185	1	181	6.789E+00	16
LOKIASV2_1509_ESMFold_hypothetical_protein	AF-P39723-F1-model_v4	LOKIASV2_1509_ESMFold_hypothetical_protein	AF-P39723-F1-model_v4 Spindle pole component SPC72	0.138	208	169	27	234	28	224	4.726E+00	16
LOKIASV2_1509_ESMFold_hypothetical_protein	AF-C5DV23-F1-model_v4	LOKIASV2_1509_ESMFold_hypothetical_protein	AF-C5DV23-F1-model_v4 Altered inheritance of mitochondria protein 23, mitochondrial	0.095	175	139	60	234	180	334	8.138E+00	14
LOKIASV2_1509_ESMFold_hypothetical_protein	AF-Q6PGT0-F1-model_v4	LOKIASV2_1509_ESMFold_hypothetical_protein	AF-Q6PGT0-F1-model_v4 Transcriptional adapter 3-A	0.146	181	139	3	183	268	431	6.017E+00	14
LOKIASV2_1509_ESMFold_hypothetical_protein	AF-Q6NRW3-F1-model_v4	LOKIASV2_1509_ESMFold_hypothetical_protein	AF-Q6NRW3-F1-model_v4 Kinetochore protein Spc24	0.115	194	156	61	237	4	197	9.183E+00	13
LOKIASV2_1509_ESMFold_hypothetical_protein	AF-Q6P8A1-F1-model_v4	LOKIASV2_1509_ESMFold_hypothetical_protein	AF-Q6P8A1-F1-model_v4 Kinetochore protein spc24	0.125	194	154	61	237	4	197	7.661E+00	13
LOKIASV2_1509_ESMFold_hypothetical_protein	AF-Q8W571-F1-model_v4	LOKIASV2_1509_ESMFold_hypothetical_protein	AF-Q8W571-F1-model_v4 RING-H2 finger protein ATL32	0.141	165	126	46	210	2	149	6.392E+00	13
LOKIASV2_1509_ESMFold_hypothetical_protein	AF-P36682-F1-model_v4	LOKIASV2_1509_ESMFold_hypothetical_protein	AF-P36682-F1-model_v4 Uncharacterized protein YacH	0.099	191	149	44	234	415	580	9.754E+00	13
LOKIASV2_1509_ESMFold_hypothetical_protein	AF-P53894-F1-model_v4	LOKIASV2_1509_ESMFold_hypothetical_protein	AF-P53894-F1-model_v4 Serine/threonine-protein kinase CBK1	0.080	223	167	25	206	157	379	8.645E+00	13
LOKIASV2_1509_ESMFold_hypothetical_protein	AF-Q3SYS7-F1-model_v4	LOKIASV2_1509_ESMFold_hypothetical_protein	AF-Q3SYS7-F1-model_v4 IQ domain-containing protein F1	0.100	197	150	25	221	42	209	8.645E+00	10
