query	target	qheader	theader	fident	alnlen	mismatch	qstart	qend	tstart	tend	evalue	bits
LOKIASV2_1604_ESMFold_hypothetical_protein	AF-Q645T6-F1-model_v4	LOKIASV2_1604_ESMFold_hypothetical_protein	AF-Q645T6-F1-model_v4 Taste receptor type 2 member 50	0.107	283	210	4	239	12	294	7.675E-02	96
LOKIASV2_1604_ESMFold_hypothetical_protein	AF-P41149-F1-model_v4	LOKIASV2_1604_ESMFold_hypothetical_protein	AF-P41149-F1-model_v4 Melanocortin receptor 5	0.122	275	209	1	239	36	310	6.707E-02	96
LOKIASV2_1604_ESMFold_hypothetical_protein	AF-A1CPR8-F1-model_v4	LOKIASV2_1604_ESMFold_hypothetical_protein	AF-A1CPR8-F1-model_v4 Chitin synthase export chaperone	0.100	228	199	8	235	55	276	1.802E-01	96
LOKIASV2_1604_ESMFold_hypothetical_protein	AF-P0CM72-F1-model_v4	LOKIASV2_1604_ESMFold_hypothetical_protein	AF-P0CM72-F1-model_v4 Chitin synthase export chaperone	0.147	231	192	8	238	54	279	9.608E-02	96
LOKIASV2_1604_ESMFold_hypothetical_protein	AF-O54799-F1-model_v4	LOKIASV2_1604_ESMFold_hypothetical_protein	AF-O54799-F1-model_v4 Neuromedin-B receptor	0.112	295	207	5	238	43	337	4.476E-02	96
LOKIASV2_1604_ESMFold_hypothetical_protein	AF-Q9NZH0-F1-model_v4	LOKIASV2_1604_ESMFold_hypothetical_protein	AF-Q9NZH0-F1-model_v4 G-protein coupled receptor family C group 5 member B	0.086	243	213	2	235	53	295	1.203E-01	96
LOKIASV2_1604_ESMFold_hypothetical_protein	AF-Q54DR6-F1-model_v4	LOKIASV2_1604_ESMFold_hypothetical_protein	AF-Q54DR6-F1-model_v4 Frizzled/smoothened-like sans CRD protein G	0.077	292	213	2	233	88	379	6.131E-02	96
LOKIASV2_1604_ESMFold_hypothetical_protein	AF-Q646B3-F1-model_v4	LOKIASV2_1604_ESMFold_hypothetical_protein	AF-Q646B3-F1-model_v4 Taste receptor type 2 member 16	0.082	277	215	4	238	13	289	3.576E-02	95
LOKIASV2_1604_ESMFold_hypothetical_protein	AF-Q948R8-F1-model_v4	LOKIASV2_1604_ESMFold_hypothetical_protein	AF-Q948R8-F1-model_v4 Protein TOM THREE HOMOLOG 1	0.142	239	199	3	235	38	276	5.122E-02	95
LOKIASV2_1604_ESMFold_hypothetical_protein	AF-Q5Y500-F1-model_v4	LOKIASV2_1604_ESMFold_hypothetical_protein	AF-Q5Y500-F1-model_v4 Taste receptor type 2 member 43	0.094	285	215	2	239	10	294	9.186E-02	95
LOKIASV2_1604_ESMFold_hypothetical_protein	AF-Q9JKT8-F1-model_v4	LOKIASV2_1604_ESMFold_hypothetical_protein	AF-Q9JKT8-F1-model_v4 Taste receptor type 2 member 114	0.107	292	213	1	239	2	293	7.015E-02	95
LOKIASV2_1604_ESMFold_hypothetical_protein	AF-Q5Y4Z0-F1-model_v4	LOKIASV2_1604_ESMFold_hypothetical_protein	AF-Q5Y4Z0-F1-model_v4 Taste receptor type 2 member 62	0.107	291	211	1	237	2	292	3.740E-02	95
LOKIASV2_1604_ESMFold_hypothetical_protein	AF-Q6ETK9-F1-model_v4	LOKIASV2_1604_ESMFold_hypothetical_protein	AF-Q6ETK9-F1-model_v4 Heptahelical transmembrane protein ADIPOR2	0.115	195	166	40	234	29	217	5.861E-02	94
LOKIASV2_1604_ESMFold_hypothetical_protein	AF-Q9MZV8-F1-model_v4	LOKIASV2_1604_ESMFold_hypothetical_protein	AF-Q9MZV8-F1-model_v4 Melanocortin receptor 5	0.131	265	205	1	237	28	292	3.268E-02	94
LOKIASV2_1604_ESMFold_hypothetical_protein	AF-Q94AH1-F1-model_v4	LOKIASV2_1604_ESMFold_hypothetical_protein	AF-Q94AH1-F1-model_v4 Protein CANDIDATE G-PROTEIN COUPLED RECEPTOR 2	0.129	242	205	4	239	40	281	5.604E-02	94
LOKIASV2_1604_ESMFold_hypothetical_protein	AF-Q9ZUM2-F1-model_v4	LOKIASV2_1604_ESMFold_hypothetical_protein	AF-Q9ZUM2-F1-model_v4 Tobamovirus multiplication protein 3	0.135	239	201	3	235	48	286	6.131E-02	94
LOKIASV2_1604_ESMFold_hypothetical_protein	AF-Q9EPB8-F1-model_v4	LOKIASV2_1604_ESMFold_hypothetical_protein	AF-Q9EPB8-F1-model_v4 Vomeronasal type-1 receptor 54	0.118	293	209	2	239	11	303	2.062E-01	94
LOKIASV2_1604_ESMFold_hypothetical_protein	AF-Q864I8-F1-model_v4	LOKIASV2_1604_ESMFold_hypothetical_protein	AF-Q864I8-F1-model_v4 Melanocyte-stimulating hormone receptor	0.113	276	211	1	239	38	313	2.282E-02	94
LOKIASV2_1604_ESMFold_hypothetical_protein	AF-Q5FWM8-F1-model_v4	LOKIASV2_1604_ESMFold_hypothetical_protein	AF-Q5FWM8-F1-model_v4 Integral membrane protein GPR180	0.111	254	211	2	239	163	416	1.575E-01	94
LOKIASV2_1604_ESMFold_hypothetical_protein	AF-Q91WW4-F1-model_v4	LOKIASV2_1604_ESMFold_hypothetical_protein	AF-Q91WW4-F1-model_v4 Mas-related G-protein coupled receptor member A2	0.135	252	195	1	226	9	260	6.412E-02	93
LOKIASV2_1604_ESMFold_hypothetical_protein	AF-Q646B4-F1-model_v4	LOKIASV2_1604_ESMFold_hypothetical_protein	AF-Q646B4-F1-model_v4 Taste receptor type 2 member 43	0.090	285	216	2	239	10	294	8.396E-02	93
LOKIASV2_1604_ESMFold_hypothetical_protein	AF-Q864I5-F1-model_v4	LOKIASV2_1604_ESMFold_hypothetical_protein	AF-Q864I5-F1-model_v4 Melanocyte-stimulating hormone receptor	0.120	276	209	1	239	38	313	4.092E-02	93
LOKIASV2_1604_ESMFold_hypothetical_protein	AF-Q2UNJ0-F1-model_v4	LOKIASV2_1604_ESMFold_hypothetical_protein	AF-Q2UNJ0-F1-model_v4 Chitin synthase export chaperone	0.129	228	192	8	235	54	275	2.824E-01	93
LOKIASV2_1604_ESMFold_hypothetical_protein	AF-Q923Z0-F1-model_v4	LOKIASV2_1604_ESMFold_hypothetical_protein	AF-Q923Z0-F1-model_v4 G-protein coupled receptor family C group 5 member B	0.092	243	212	2	235	53	295	5.861E-02	93
LOKIASV2_1604_ESMFold_hypothetical_protein	AF-Q402F3-F1-model_v4	LOKIASV2_1604_ESMFold_hypothetical_protein	AF-Q402F3-F1-model_v4 Tobamovirus multiplication protein 3	0.127	239	203	3	235	39	277	7.338E-02	92
LOKIASV2_1604_ESMFold_hypothetical_protein	AF-Q646B9-F1-model_v4	LOKIASV2_1604_ESMFold_hypothetical_protein	AF-Q646B9-F1-model_v4 Taste receptor type 2 member 31	0.093	281	215	2	239	10	290	1.316E-01	92
LOKIASV2_1604_ESMFold_hypothetical_protein	AF-P41968-F1-model_v4	LOKIASV2_1604_ESMFold_hypothetical_protein	AF-P41968-F1-model_v4 Melanocortin receptor 3	0.093	274	216	1	239	41	314	5.604E-02	92
LOKIASV2_1604_ESMFold_hypothetical_protein	AF-P43657-F1-model_v4	LOKIASV2_1604_ESMFold_hypothetical_protein	AF-P43657-F1-model_v4 Lysophosphatidic acid receptor 6	0.140	290	201	4	238	16	305	3.268E-02	92
LOKIASV2_1604_ESMFold_hypothetical_protein	AF-Q7SB92-F1-model_v4	LOKIASV2_1604_ESMFold_hypothetical_protein	AF-Q7SB92-F1-model_v4 Chitin synthase export chaperone	0.137	236	200	8	240	55	290	2.468E-01	92
LOKIASV2_1604_ESMFold_hypothetical_protein	AF-Q8IZF4-F1-model_v4	LOKIASV2_1604_ESMFold_hypothetical_protein	AF-Q8IZF4-F1-model_v4 Adhesion G-protein coupled receptor G5	0.101	279	215	1	240	239	517	1.005E-01	91
LOKIASV2_1604_ESMFold_hypothetical_protein	AF-Q5T9L3-F1-model_v4	LOKIASV2_1604_ESMFold_hypothetical_protein	AF-Q5T9L3-F1-model_v4 Protein wntless homolog	0.134	258	184	9	222	235	492	7.015E-02	91
LOKIASV2_1604_ESMFold_hypothetical_protein	AF-Q91ZC7-F1-model_v4	LOKIASV2_1604_ESMFold_hypothetical_protein	AF-Q91ZC7-F1-model_v4 Mas-related G-protein coupled receptor member A5	0.109	263	211	2	239	13	275	8.027E-02	90
LOKIASV2_1604_ESMFold_hypothetical_protein	AF-Q0Q460-F1-model_v4	LOKIASV2_1604_ESMFold_hypothetical_protein	AF-Q0Q460-F1-model_v4 Melanocyte-stimulating hormone receptor	0.123	276	209	1	239	38	313	1.203E-01	90
LOKIASV2_1604_ESMFold_hypothetical_protein	AF-Q6MYT0-F1-model_v4	LOKIASV2_1604_ESMFold_hypothetical_protein	AF-Q6MYT0-F1-model_v4 Chitin synthase export chaperone	0.119	228	195	8	235	54	275	2.700E-01	90
LOKIASV2_1604_ESMFold_hypothetical_protein	AF-A6QLE7-F1-model_v4	LOKIASV2_1604_ESMFold_hypothetical_protein	AF-A6QLE7-F1-model_v4 G-protein coupled receptor 52	0.111	289	209	4	239	43	331	1.575E-01	90
LOKIASV2_1604_ESMFold_hypothetical_protein	AF-Q67ES3-F1-model_v4	LOKIASV2_1604_ESMFold_hypothetical_protein	AF-Q67ES3-F1-model_v4 Taste receptor type 2 member 143	0.108	291	211	2	238	3	293	6.707E-02	89
LOKIASV2_1604_ESMFold_hypothetical_protein	AF-P56451-F1-model_v4	LOKIASV2_1604_ESMFold_hypothetical_protein	AF-P56451-F1-model_v4 Melanocortin receptor 5	0.125	274	208	1	239	36	309	3.740E-02	89
LOKIASV2_1604_ESMFold_hypothetical_protein	AF-Q4IJ79-F1-model_v4	LOKIASV2_1604_ESMFold_hypothetical_protein	AF-Q4IJ79-F1-model_v4 Chitin synthase export chaperone	0.125	230	199	8	237	55	282	3.380E-01	89
LOKIASV2_1604_ESMFold_hypothetical_protein	AF-Q99677-F1-model_v4	LOKIASV2_1604_ESMFold_hypothetical_protein	AF-Q99677-F1-model_v4 Lysophosphatidic acid receptor 4	0.122	291	206	4	239	38	328	5.861E-02	89
LOKIASV2_1604_ESMFold_hypothetical_protein	AF-Q5QJU3-F1-model_v4	LOKIASV2_1604_ESMFold_hypothetical_protein	AF-Q5QJU3-F1-model_v4 Alkaline ceramidase 2	0.112	215	173	10	224	33	228	1.005E-01	88
LOKIASV2_1604_ESMFold_hypothetical_protein	AF-Q9EQ47-F1-model_v4	LOKIASV2_1604_ESMFold_hypothetical_protein	AF-Q9EQ47-F1-model_v4 Vomeronasal type-1 receptor 44	0.090	303	216	1	238	1	303	1.723E-01	88
LOKIASV2_1604_ESMFold_hypothetical_protein	AF-Q9EQ46-F1-model_v4	LOKIASV2_1604_ESMFold_hypothetical_protein	AF-Q9EQ46-F1-model_v4 Vomeronasal type-1 receptor 40	0.093	303	215	1	238	1	303	2.824E-01	88
LOKIASV2_1604_ESMFold_hypothetical_protein	AF-P30951-F1-model_v4	LOKIASV2_1604_ESMFold_hypothetical_protein	AF-P30951-F1-model_v4 G-protein coupled receptor 12	0.108	269	209	1	235	44	312	1.575E-01	88
LOKIASV2_1604_ESMFold_hypothetical_protein	AF-Q7TQP3-F1-model_v4	LOKIASV2_1604_ESMFold_hypothetical_protein	AF-Q7TQP3-F1-model_v4 Glucose-dependent insulinotropic receptor	0.096	293	215	1	239	1	293	1.258E-01	88
LOKIASV2_1604_ESMFold_hypothetical_protein	AF-Q8NFJ5-F1-model_v4	LOKIASV2_1604_ESMFold_hypothetical_protein	AF-Q8NFJ5-F1-model_v4 Retinoic acid-induced protein 3	0.101	243	209	2	235	25	267	1.506E-01	88
LOKIASV2_1604_ESMFold_hypothetical_protein	AF-Q9QZN9-F1-model_v4	LOKIASV2_1604_ESMFold_hypothetical_protein	AF-Q9QZN9-F1-model_v4 Cannabinoid receptor 2	0.086	286	218	1	239	29	314	2.062E-01	88
LOKIASV2_1604_ESMFold_hypothetical_protein	AF-Q8BLG2-F1-model_v4	LOKIASV2_1604_ESMFold_hypothetical_protein	AF-Q8BLG2-F1-model_v4 Lysophosphatidic acid receptor 4	0.111	291	209	4	239	38	328	8.782E-02	88
LOKIASV2_1604_ESMFold_hypothetical_protein	AF-Q7TQN8-F1-model_v4	LOKIASV2_1604_ESMFold_hypothetical_protein	AF-Q7TQN8-F1-model_v4 Glucose-dependent insulinotropic receptor	0.093	287	213	4	239	7	293	1.802E-01	88
LOKIASV2_1604_ESMFold_hypothetical_protein	AF-Q86Y34-F1-model_v4	LOKIASV2_1604_ESMFold_hypothetical_protein	AF-Q86Y34-F1-model_v4 Adhesion G protein-coupled receptor G3	0.091	253	200	4	224	268	520	2.062E-01	88
LOKIASV2_1604_ESMFold_hypothetical_protein	AF-Q5UXY6-F1-model_v4	LOKIASV2_1604_ESMFold_hypothetical_protein	AF-Q5UXY6-F1-model_v4 Bacteriorhodopsin-I	0.113	233	203	8	237	7	239	1.376E-01	87
LOKIASV2_1604_ESMFold_hypothetical_protein	AF-P47804-F1-model_v4	LOKIASV2_1604_ESMFold_hypothetical_protein	AF-P47804-F1-model_v4 RPE-retinal G protein-coupled receptor	0.100	263	212	4	240	19	281	1.440E-01	87
LOKIASV2_1604_ESMFold_hypothetical_protein	AF-Q9NYW7-F1-model_v4	LOKIASV2_1604_ESMFold_hypothetical_protein	AF-Q9NYW7-F1-model_v4 Taste receptor type 2 member 1	0.116	284	208	4	239	9	292	6.412E-02	87
LOKIASV2_1604_ESMFold_hypothetical_protein	AF-Q864J0-F1-model_v4	LOKIASV2_1604_ESMFold_hypothetical_protein	AF-Q864J0-F1-model_v4 Melanocyte-stimulating hormone receptor	0.119	270	204	7	239	44	313	4.092E-02	87
LOKIASV2_1604_ESMFold_hypothetical_protein	AF-P83119-F1-model_v4	LOKIASV2_1604_ESMFold_hypothetical_protein	AF-P83119-F1-model_v4 Probable G-protein coupled receptor Mth-like 12	0.122	274	207	1	237	214	487	1.051E-01	87
LOKIASV2_1604_ESMFold_hypothetical_protein	AF-Q4V622-F1-model_v4	LOKIASV2_1604_ESMFold_hypothetical_protein	AF-Q4V622-F1-model_v4 Neuropeptide CCHamide-2 receptor	0.100	300	214	1	239	66	365	9.608E-02	87
LOKIASV2_1604_ESMFold_hypothetical_protein	AF-P35413-F1-model_v4	LOKIASV2_1604_ESMFold_hypothetical_protein	AF-P35413-F1-model_v4 G-protein coupled receptor 3	0.125	271	207	1	237	40	310	8.396E-02	86
LOKIASV2_1604_ESMFold_hypothetical_protein	AF-Q9Z0U9-F1-model_v4	LOKIASV2_1604_ESMFold_hypothetical_protein	AF-Q9Z0U9-F1-model_v4 Sphingosine 1-phosphate receptor 3	0.121	265	202	5	235	44	308	3.090E-01	86
LOKIASV2_1604_ESMFold_hypothetical_protein	AF-Q08417-F1-model_v4	LOKIASV2_1604_ESMFold_hypothetical_protein	AF-Q08417-F1-model_v4 Sphingoid long-chain base transporter RSB1	0.095	280	206	9	237	33	312	1.316E-01	86
LOKIASV2_1604_ESMFold_hypothetical_protein	AF-P55167-F1-model_v4	LOKIASV2_1604_ESMFold_hypothetical_protein	AF-P55167-F1-model_v4 Melanocyte-stimulating hormone receptor	0.104	275	213	1	239	36	310	8.027E-02	85
LOKIASV2_1604_ESMFold_hypothetical_protein	AF-Q67ER9-F1-model_v4	LOKIASV2_1604_ESMFold_hypothetical_protein	AF-Q67ER9-F1-model_v4 Taste receptor type 2 member 39	0.097	292	211	5	239	16	307	1.376E-01	85
LOKIASV2_1604_ESMFold_hypothetical_protein	AF-P34972-F1-model_v4	LOKIASV2_1604_ESMFold_hypothetical_protein	AF-P34972-F1-model_v4 Cannabinoid receptor 2	0.084	280	216	1	237	29	308	1.723E-01	85
LOKIASV2_1604_ESMFold_hypothetical_protein	AF-P24053-F1-model_v4	LOKIASV2_1604_ESMFold_hypothetical_protein	AF-P24053-F1-model_v4 Neuromedin-B receptor	0.122	294	207	2	238	44	337	1.099E-01	85
LOKIASV2_1604_ESMFold_hypothetical_protein	AF-Q5V9L7-F1-model_v4	LOKIASV2_1604_ESMFold_hypothetical_protein	AF-Q5V9L7-F1-model_v4 pH-response regulator protein palH/RIM21	0.113	278	206	1	233	78	355	1.972E-01	85
LOKIASV2_1604_ESMFold_hypothetical_protein	AF-Q7TQB9-F1-model_v4	LOKIASV2_1604_ESMFold_hypothetical_protein	AF-Q7TQB9-F1-model_v4 Taste receptor type 2 member 143	0.110	281	208	4	238	12	292	6.412E-02	84
LOKIASV2_1604_ESMFold_hypothetical_protein	AF-Q01727-F1-model_v4	LOKIASV2_1604_ESMFold_hypothetical_protein	AF-Q01727-F1-model_v4 Melanocyte-stimulating hormone receptor	0.117	276	210	1	239	36	311	8.782E-02	83
LOKIASV2_1604_ESMFold_hypothetical_protein	AF-A6ZNQ4-F1-model_v4	LOKIASV2_1604_ESMFold_hypothetical_protein	AF-A6ZNQ4-F1-model_v4 Sphingoid long-chain base transporter RSB1	0.095	280	206	9	237	33	312	1.802E-01	83
LOKIASV2_1604_ESMFold_hypothetical_protein	AF-Q29627-F1-model_v4	LOKIASV2_1604_ESMFold_hypothetical_protein	AF-Q29627-F1-model_v4 Pituitary adenylate cyclase-activating polypeptide type I receptor	0.099	297	214	2	239	164	460	2.468E-01	83
LOKIASV2_1604_ESMFold_hypothetical_protein	AF-D3ZWZ9-F1-model_v4	LOKIASV2_1604_ESMFold_hypothetical_protein	AF-D3ZWZ9-F1-model_v4 Protein GPR107	0.152	252	198	4	238	261	512	2.157E-01	83
LOKIASV2_1604_ESMFold_hypothetical_protein	AF-Q8IZF3-F1-model_v4	LOKIASV2_1604_ESMFold_hypothetical_protein	AF-Q8IZF3-F1-model_v4 Adhesion G protein-coupled receptor F4	0.113	266	210	2	239	402	667	2.360E-01	83
LOKIASV2_1604_ESMFold_hypothetical_protein	AF-Q54ET0-F1-model_v4	LOKIASV2_1604_ESMFold_hypothetical_protein	AF-Q54ET0-F1-model_v4 Metabotropic glutamate receptor-like protein E	0.097	249	212	4	239	439	687	1.885E-01	83
LOKIASV2_1604_ESMFold_hypothetical_protein	AF-Q9NYV7-F1-model_v4	LOKIASV2_1604_ESMFold_hypothetical_protein	AF-Q9NYV7-F1-model_v4 Taste receptor type 2 member 16	0.087	278	214	4	238	13	290	1.099E-01	82
LOKIASV2_1604_ESMFold_hypothetical_protein	AF-Q91WW3-F1-model_v4	LOKIASV2_1604_ESMFold_hypothetical_protein	AF-Q91WW3-F1-model_v4 Mas-related G-protein coupled receptor member A3	0.108	250	199	1	224	9	258	2.700E-01	82
LOKIASV2_1604_ESMFold_hypothetical_protein	AF-P32244-F1-model_v4	LOKIASV2_1604_ESMFold_hypothetical_protein	AF-P32244-F1-model_v4 Melanocortin receptor 3	0.106	274	213	1	239	41	314	1.316E-01	82
LOKIASV2_1604_ESMFold_hypothetical_protein	AF-Q5AV03-F1-model_v4	LOKIASV2_1604_ESMFold_hypothetical_protein	AF-Q5AV03-F1-model_v4 Probable lipid transporter atnI	0.148	253	193	5	231	42	294	2.700E-01	82
LOKIASV2_1604_ESMFold_hypothetical_protein	AF-Q9W0V7-F1-model_v4	LOKIASV2_1604_ESMFold_hypothetical_protein	AF-Q9W0V7-F1-model_v4 Probable G-protein coupled receptor Mth-like 8	0.109	262	208	2	236	212	473	6.632E-01	82
LOKIASV2_1604_ESMFold_hypothetical_protein	AF-O97148-F1-model_v4	LOKIASV2_1604_ESMFold_hypothetical_protein	AF-O97148-F1-model_v4 G-protein coupled receptor Mth	0.106	270	206	9	239	219	488	2.954E-01	82
LOKIASV2_1604_ESMFold_hypothetical_protein	AF-Q402F4-F1-model_v4	LOKIASV2_1604_ESMFold_hypothetical_protein	AF-Q402F4-F1-model_v4 Tobamovirus multiplication protein 1	0.108	239	206	4	235	34	272	1.203E-01	81
LOKIASV2_1604_ESMFold_hypothetical_protein	AF-Q864F6-F1-model_v4	LOKIASV2_1604_ESMFold_hypothetical_protein	AF-Q864F6-F1-model_v4 Melanocyte-stimulating hormone receptor	0.113	273	211	1	239	41	313	1.203E-01	81
LOKIASV2_1604_ESMFold_hypothetical_protein	AF-P33033-F1-model_v4	LOKIASV2_1604_ESMFold_hypothetical_protein	AF-P33033-F1-model_v4 Melanocortin receptor 3	0.109	274	212	1	239	41	314	1.575E-01	81
LOKIASV2_1604_ESMFold_hypothetical_protein	AF-P28336-F1-model_v4	LOKIASV2_1604_ESMFold_hypothetical_protein	AF-P28336-F1-model_v4 Neuromedin-B receptor	0.113	289	208	4	238	49	337	6.707E-02	81
LOKIASV2_1604_ESMFold_hypothetical_protein	AF-O97967-F1-model_v4	LOKIASV2_1604_ESMFold_hypothetical_protein	AF-O97967-F1-model_v4 Bombesin receptor subtype-3	0.101	302	215	1	240	37	338	1.005E-01	81
LOKIASV2_1604_ESMFold_hypothetical_protein	AF-P32215-F1-model_v4	LOKIASV2_1604_ESMFold_hypothetical_protein	AF-P32215-F1-model_v4 Pituitary adenylate cyclase-activating polypeptide type I receptor	0.094	325	215	2	239	146	470	3.232E-01	81
LOKIASV2_1604_ESMFold_hypothetical_protein	AF-Q8K209-F1-model_v4	LOKIASV2_1604_ESMFold_hypothetical_protein	AF-Q8K209-F1-model_v4 Adhesion G-protein coupled receptor G1	0.088	254	205	2	227	401	654	2.954E-01	81
LOKIASV2_1604_ESMFold_hypothetical_protein	AF-Q864I1-F1-model_v4	LOKIASV2_1604_ESMFold_hypothetical_protein	AF-Q864I1-F1-model_v4 Melanocyte-stimulating hormone receptor	0.120	265	209	1	239	41	305	1.506E-01	80
LOKIASV2_1604_ESMFold_hypothetical_protein	AF-Q67ET7-F1-model_v4	LOKIASV2_1604_ESMFold_hypothetical_protein	AF-Q67ET7-F1-model_v4 Taste receptor type 2 member 3	0.114	284	208	4	239	12	295	1.099E-01	80
LOKIASV2_1604_ESMFold_hypothetical_protein	AF-Q864F5-F1-model_v4	LOKIASV2_1604_ESMFold_hypothetical_protein	AF-Q864F5-F1-model_v4 Melanocyte-stimulating hormone receptor	0.110	276	212	1	239	38	313	2.062E-01	80
LOKIASV2_1604_ESMFold_hypothetical_protein	AF-Q2H7Q1-F1-model_v4	LOKIASV2_1604_ESMFold_hypothetical_protein	AF-Q2H7Q1-F1-model_v4 Chitin synthase export chaperone	0.127	230	198	8	237	54	281	5.065E-01	80
LOKIASV2_1604_ESMFold_hypothetical_protein	AF-Q8NGF0-F1-model_v4	LOKIASV2_1604_ESMFold_hypothetical_protein	AF-Q8NGF0-F1-model_v4 Olfactory receptor 52B6	0.136	280	202	5	239	48	327	1.802E-01	80
LOKIASV2_1604_ESMFold_hypothetical_protein	AF-O14843-F1-model_v4	LOKIASV2_1604_ESMFold_hypothetical_protein	AF-O14843-F1-model_v4 Free fatty acid receptor 3	0.094	271	213	4	239	20	290	2.700E-01	80
LOKIASV2_1604_ESMFold_hypothetical_protein	AF-Q84N34-F1-model_v4	LOKIASV2_1604_ESMFold_hypothetical_protein	AF-Q84N34-F1-model_v4 Heptahelical transmembrane protein 2	0.130	201	169	40	240	161	355	3.536E-01	80
LOKIASV2_1604_ESMFold_hypothetical_protein	AF-Q26495-F1-model_v4	LOKIASV2_1604_ESMFold_hypothetical_protein	AF-Q26495-F1-model_v4 Opsin-2	0.076	302	219	1	238	46	347	3.698E-01	80
LOKIASV2_1604_ESMFold_hypothetical_protein	AF-B3LJA1-F1-model_v4	LOKIASV2_1604_ESMFold_hypothetical_protein	AF-B3LJA1-F1-model_v4 Sphingoid long-chain base transporter RSB1	0.092	280	207	9	237	33	312	2.256E-01	80
LOKIASV2_1604_ESMFold_hypothetical_protein	AF-Q9H228-F1-model_v4	LOKIASV2_1604_ESMFold_hypothetical_protein	AF-Q9H228-F1-model_v4 Sphingosine 1-phosphate receptor 5	0.121	281	206	1	235	36	316	2.157E-01	80
LOKIASV2_1604_ESMFold_hypothetical_protein	AF-Q95KZ0-F1-model_v4	LOKIASV2_1604_ESMFold_hypothetical_protein	AF-Q95KZ0-F1-model_v4 Prostaglandin E2 receptor EP4 subtype	0.065	329	222	2	239	18	346	4.630E-01	80
LOKIASV2_1604_ESMFold_hypothetical_protein	AF-Q864I4-F1-model_v4	LOKIASV2_1604_ESMFold_hypothetical_protein	AF-Q864I4-F1-model_v4 Melanocyte-stimulating hormone receptor	0.118	270	205	7	239	44	313	1.203E-01	79
LOKIASV2_1604_ESMFold_hypothetical_protein	AF-Q91X56-F1-model_v4	LOKIASV2_1604_ESMFold_hypothetical_protein	AF-Q91X56-F1-model_v4 Sphingosine 1-phosphate receptor 5	0.122	281	205	2	235	37	317	2.256E-01	79
LOKIASV2_1604_ESMFold_hypothetical_protein	AF-O95665-F1-model_v4	LOKIASV2_1604_ESMFold_hypothetical_protein	AF-O95665-F1-model_v4 Neurotensin receptor type 2	0.081	333	214	2	235	36	368	1.506E-01	79
LOKIASV2_1604_ESMFold_hypothetical_protein	AF-Q9LZ39-F1-model_v4	LOKIASV2_1604_ESMFold_hypothetical_protein	AF-Q9LZ39-F1-model_v4 Protein CANDIDATE G-PROTEIN COUPLED RECEPTOR 6	0.130	261	207	2	240	168	428	2.954E-01	79
LOKIASV2_1604_ESMFold_hypothetical_protein	AF-Q6BPR6-F1-model_v4	LOKIASV2_1604_ESMFold_hypothetical_protein	AF-Q6BPR6-F1-model_v4 pH-response regulator protein palH/RIM21	0.141	243	204	2	239	88	330	2.954E-01	79
LOKIASV2_1604_ESMFold_hypothetical_protein	AF-Q57101-F1-model_v4	LOKIASV2_1604_ESMFold_hypothetical_protein	AF-Q57101-F1-model_v4 Cruxrhodopsin-1	0.107	233	204	8	237	7	239	2.700E-01	78
LOKIASV2_1604_ESMFold_hypothetical_protein	AF-A7YWP2-F1-model_v4	LOKIASV2_1604_ESMFold_hypothetical_protein	AF-A7YWP2-F1-model_v4 Post-GPI attachment to proteins factor 3	0.086	228	187	11	238	106	311	5.796E-01	78
LOKIASV2_1604_ESMFold_hypothetical_protein	AF-Q50DM5-F1-model_v4	LOKIASV2_1604_ESMFold_hypothetical_protein	AF-Q50DM5-F1-model_v4 Adhesion G-protein coupled receptor G1	0.104	254	202	2	227	401	654	1.723E-01	78
LOKIASV2_1604_ESMFold_hypothetical_protein	AF-Q50DM7-F1-model_v4	LOKIASV2_1604_ESMFold_hypothetical_protein	AF-Q50DM7-F1-model_v4 Adhesion G-protein coupled receptor G1	0.103	254	202	2	227	401	654	3.090E-01	78
LOKIASV2_1604_ESMFold_hypothetical_protein	AF-Q13606-F1-model_v4	LOKIASV2_1604_ESMFold_hypothetical_protein	AF-Q13606-F1-model_v4 Olfactory receptor 5I1	0.115	281	208	4	239	26	306	3.090E-01	77
LOKIASV2_1604_ESMFold_hypothetical_protein	AF-B5VRU8-F1-model_v4	LOKIASV2_1604_ESMFold_hypothetical_protein	AF-B5VRU8-F1-model_v4 Sphingoid long-chain base transporter RSB1	0.089	280	208	9	237	33	312	2.824E-01	77
LOKIASV2_1604_ESMFold_hypothetical_protein	AF-O54798-F1-model_v4	LOKIASV2_1604_ESMFold_hypothetical_protein	AF-O54798-F1-model_v4 Bombesin receptor subtype-3	0.104	302	212	1	238	42	343	1.203E-01	77
LOKIASV2_1604_ESMFold_hypothetical_protein	AF-Q9D1N4-F1-model_v4	LOKIASV2_1604_ESMFold_hypothetical_protein	AF-Q9D1N4-F1-model_v4 Protein myomaker	0.096	218	170	4	221	7	195	2.582E-01	76
LOKIASV2_1604_ESMFold_hypothetical_protein	AF-A6NI61-F1-model_v4	LOKIASV2_1604_ESMFold_hypothetical_protein	AF-A6NI61-F1-model_v4 Protein myomaker	0.091	219	170	4	222	7	194	2.582E-01	76
LOKIASV2_1604_ESMFold_hypothetical_protein	AF-Q924T8-F1-model_v4	LOKIASV2_1604_ESMFold_hypothetical_protein	AF-Q924T8-F1-model_v4 Cysteinyl leukotriene receptor 1	0.126	290	206	4	240	31	320	1.203E-01	76
LOKIASV2_1604_ESMFold_hypothetical_protein	AF-Q64H34-F1-model_v4	LOKIASV2_1604_ESMFold_hypothetical_protein	AF-Q64H34-F1-model_v4 C-C chemokine receptor type 3	0.142	271	200	4	237	44	314	1.802E-01	76
LOKIASV2_1604_ESMFold_hypothetical_protein	AF-Q03566-F1-model_v4	LOKIASV2_1604_ESMFold_hypothetical_protein	AF-Q03566-F1-model_v4 Probable G-protein coupled receptor tkr-1	0.097	277	209	4	235	49	325	1.506E-01	76
LOKIASV2_1604_ESMFold_hypothetical_protein	AF-Q3V3Z3-F1-model_v4	LOKIASV2_1604_ESMFold_hypothetical_protein	AF-Q3V3Z3-F1-model_v4 Adhesion G-protein coupled receptor G5	0.085	280	216	2	238	236	515	2.360E-01	76
LOKIASV2_1604_ESMFold_hypothetical_protein	AF-A6NM76-F1-model_v4	LOKIASV2_1604_ESMFold_hypothetical_protein	AF-A6NM76-F1-model_v4 Olfactory receptor 6C76	0.112	287	211	1	239	16	302	3.868E-01	74
LOKIASV2_1604_ESMFold_hypothetical_protein	AF-C7GLH7-F1-model_v4	LOKIASV2_1604_ESMFold_hypothetical_protein	AF-C7GLH7-F1-model_v4 Sphingoid long-chain base transporter RSB1	0.092	280	207	9	237	33	312	3.868E-01	74
LOKIASV2_1604_ESMFold_hypothetical_protein	AF-Q9FEG2-F1-model_v4	LOKIASV2_1604_ESMFold_hypothetical_protein	AF-Q9FEG2-F1-model_v4 Tobamovirus multiplication protein 1	0.108	238	206	4	235	37	274	4.426E-01	73
LOKIASV2_1604_ESMFold_hypothetical_protein	AF-Q0Z8I9-F1-model_v4	LOKIASV2_1604_ESMFold_hypothetical_protein	AF-Q0Z8I9-F1-model_v4 Melanocortin receptor 4	0.109	271	212	1	239	47	317	2.157E-01	73
LOKIASV2_1604_ESMFold_hypothetical_protein	AF-O97504-F1-model_v4	LOKIASV2_1604_ESMFold_hypothetical_protein	AF-O97504-F1-model_v4 Melanocortin receptor 4	0.116	254	202	1	229	47	300	1.575E-01	73
LOKIASV2_1604_ESMFold_hypothetical_protein	AF-B2RU40-F1-model_v4	LOKIASV2_1604_ESMFold_hypothetical_protein	AF-B2RU40-F1-model_v4 Proline-rich transmembrane protein 4	0.120	262	205	2	235	361	622	2.954E-01	73
LOKIASV2_1604_ESMFold_hypothetical_protein	AF-Q8VD53-F1-model_v4	LOKIASV2_1604_ESMFold_hypothetical_protein	AF-Q8VD53-F1-model_v4 Alkaline ceramidase 2	0.103	215	175	10	224	33	228	2.824E-01	72
LOKIASV2_1604_ESMFold_hypothetical_protein	AF-D4A3T6-F1-model_v4	LOKIASV2_1604_ESMFold_hypothetical_protein	AF-D4A3T6-F1-model_v4 Adhesion G-protein coupled receptor F2	0.105	265	214	1	240	374	638	5.065E-01	72
LOKIASV2_1604_ESMFold_hypothetical_protein	AF-Q5T601-F1-model_v4	LOKIASV2_1604_ESMFold_hypothetical_protein	AF-Q5T601-F1-model_v4 Adhesion G-protein coupled receptor F1	0.120	276	209	1	239	578	853	6.341E-01	72
LOKIASV2_1604_ESMFold_hypothetical_protein	AF-O00421-F1-model_v4	LOKIASV2_1604_ESMFold_hypothetical_protein	AF-O00421-F1-model_v4 C-C chemokine receptor-like 2	0.136	274	206	1	239	37	310	2.582E-01	71
LOKIASV2_1604_ESMFold_hypothetical_protein	AF-Q6CXK7-F1-model_v4	LOKIASV2_1604_ESMFold_hypothetical_protein	AF-Q6CXK7-F1-model_v4 pH-response regulator protein palH/RIM21	0.140	239	197	9	238	98	336	2.824E-01	71
LOKIASV2_1604_ESMFold_hypothetical_protein	AF-Q54LJ7-F1-model_v4	LOKIASV2_1604_ESMFold_hypothetical_protein	AF-Q54LJ7-F1-model_v4 Frizzled and smoothened-like protein P	0.109	300	203	10	238	227	526	6.937E-01	71
LOKIASV2_1604_ESMFold_hypothetical_protein	AF-P40100-F1-model_v4	LOKIASV2_1604_ESMFold_hypothetical_protein	AF-P40100-F1-model_v4 Protoporphyrin uptake protein 1	0.102	281	211	1	236	16	296	2.468E-01	70
LOKIASV2_1604_ESMFold_hypothetical_protein	AF-A2A559-F1-model_v4	LOKIASV2_1604_ESMFold_hypothetical_protein	AF-A2A559-F1-model_v4 Post-GPI attachment to proteins factor 3	0.099	228	186	11	238	106	312	6.632E-01	70
